Binance,"Smart Contract Platform, Gaming (GameFi), NFT, BNB Chain Ecosystem, Binance Launchpool, Avalanche Ecosystem, Ethereum Ecosystem, DWF Labs Portfolio, Gaming Blockchains, Avalanche L1",beam-2,330544247,384551261.0,161221.70678383138,180209.5390185516,0.16,23898128.0
Binance,"Mantle Ecosystem, Bridged USDT, Bridged-Tokens, Bridged Stablecoins",mantle-bridged-usdt-mantle,327428833,327428833.0,,,N/A,656903.0
Binance,"Stablecoins, USD Stablecoin, BNB Chain Ecosystem, Avalanche Ecosystem, Polygon Ecosystem, Optimism Ecosystem, Fiat-backed Stablecoin, Binance-Peg Tokens",binance-peg-busd,323596986,323596986.0,,,N/A,11370650.0
Binance,"Decentralized Exchange (DEX), Smart Contract Platform, Decentralized Finance (DeFi), Prediction Markets, Layer 1 (L1), Gnosis Chain Ecosystem, MEV Protection, Arbitrum Ecosystem, Ethereum Ecosystem, SideChain, Energi Ecosystem",gnosis,322781006,373936952.0,114656.95074205297,103533.5954526148,0.16,24734680.0
Binance,"Meme, Base Ecosystem, Frog-Themed, Base Meme, The Boy’s Club",based-brett,319599746,319599747.0,,,N/A,26080380.0
Binance,"Smart Contract Platform, Zero Knowledge (ZK), FTX Holdings, Paradigm Portfolio, Coinbase Ventures Portfolio, Multicoin Capital Portfolio, Proof of Stake (PoS), Pantera Capital Portfolio, Circle Ventures Portfolio, Privacy Blockchain, Polychain Capital Portfolio, Made in USA, Coinbase 50 Index",mina-protocol,318034185,318036437.0,135446.73222845737,175701.64183594435,0.04,15296871.0
Binance,"Decentralized Finance (DeFi), Arbitrum Ecosystem, Ethereum Ecosystem, Real World Assets (RWA), Base Ecosystem, Coinbase Ventures Portfolio, Energi Ecosystem, Made in USA",reserve-rights-token,311841452,557858499.0,172689.88422799465,254619.31117054858,0.02,22940965.0
Binance,"Smart Contract Platform, Layer 1 (L1), MEV Protection, Proof of Work (PoW), Privacy Blockchain",verus-coin,310031073,310046202.0,,,N/A,8282.1
Binance,"Yield Aggregator, Ethereum Ecosystem, Binance Labs Portfolio, Polychain Capital Portfolio",stakestone-berachain-vault-token,306176444,306176444.0,,,N/A,1319045.0
Binance,"Artificial Intelligence (AI), Ethereum Ecosystem, DePIN, Energi Ecosystem, GMCI DePIN Index, GMCI Index",golem,303847905,303847905.0,76991.76871167721,116936.73516663349,0.07,51326663.0
Binance,"Decentralized Finance (DeFi), Lending/Borrowing Protocols, Ethereum Ecosystem, Base Ecosystem, Coinbase Ventures Portfolio, Pantera Capital Portfolio, Morpho Ecosystem, Binance Alpha Spotlight",morpho,303525522,1285862414.0,,,N/A,13013342.0
Binance,"Artificial Intelligence (AI), Smart Contract Platform, Storage, BNB Chain Ecosystem, Layer 1 (L1), Ethereum Ecosystem, DePIN, DWF Labs Portfolio, Osmosis Ecosystem, GMCI DePIN Index, GMCI Index",aioz-network,302370463,306466229.0,,,N/A,9949761.0
Binance,"Decentralized Finance (DeFi), Tron Ecosystem",just,298310212,298310212.0,208761.24058453128,259234.8200112045,0.03,23336965.0
Binance,"Smart Contract Platform, Layer 1 (L1), Ethereum Ecosystem, Real World Assets (RWA), RWA Protocol, Made in USA",plume,298153686,1490768432.0,,,N/A,49212509.0
Binance,"Solana Ecosystem, Meme, Solana Meme, AI Meme, Pump.fun Ecosystem, Terminal of Truths, Binance Alpha Spotlight",fartcoin,293336433,293336433.0,,,N/A,134119304.0
Binance,"Solana Ecosystem, Arbitrum Ecosystem, Impossible Finance Launchpad, Ethereum Ecosystem, DePIN, Animoca Brands Portfolio",aethir,289358511,1538493611.0,,,N/A,32454545.0
Binance,"Polygon Ecosystem, Bridged WETH, Bridged-Tokens",polygon-pos-bridged-weth-polygon-pos,284697148,284697148.0,,,N/A,13162638.0
Binance,"Decentralized Exchange (DEX), Exchange-based Tokens, Decentralized Finance (DeFi), Yield Farming, Derivatives, Synthetic Issuer, Avalanche Ecosystem, Polygon Ecosystem, Near Protocol Ecosystem, Fantom Ecosystem, Harmony Ecosystem, Ethereum Ecosystem, Optimism Ecosystem, Base Ecosystem, DWF Labs Portfolio, Paradigm Portfolio, Coinbase Ventures Portfolio, Index Coop Defi Index, Energi Ecosystem, Huobi ECO Chain Ecosystem, GMCI DeFi Index, Synthetic, Index Coop Index, GMCI Index, Coinbase 50 Index",havven,282447543,282800021.0,108732.31933361289,131081.250212844,0.12,23249255.0
Binance,"Crypto-Backed Tokens, Wrapped-Tokens, Polygon Ecosystem, Arbitrum Ecosystem, Liquid Staking Tokens, Ethereum Ecosystem, Optimism Ecosystem, Base Ecosystem, Liquid Staked ETH, Liquid Staking",coinbase-wrapped-staked-eth,280948024,781471968.0,,,N/A,4488769.0
Binance,"Infrastructure, Ethereum Ecosystem, Data Availability, Restaking, Polychain Capital Portfolio, Made in USA",eigenlayer,277431583,1944401893.0,357068.2886674765,276499.2435309595,0.09,35949637.0
Binance,"Smart Contract Platform, Privacy, Masternodes, Alleged SEC Securities, Proof of Stake (PoS), Proof of Work (PoW), Made in USA",dash,276735336,276758988.0,47415.07466484803,48571.22341305223,0.04,29861386.0
Binance,"Decentralized Exchange (DEX), Exchange-based Tokens, Decentralized Finance (DeFi), Automated Market Maker (AMM), BNB Chain Ecosystem, Avalanche Ecosystem, Polygon Ecosystem, Near Protocol Ecosystem, Harmony Ecosystem, Ethereum Ecosystem, FTX Holdings, Alameda Research Portfolio, DragonFly Capital Portfolio, Pantera Capital Portfolio, Energi Ecosystem, Binance Labs Portfolio, GMCI DeFi Index, Galaxy Digital Portfolio, Blockchain Capital Portfolio, Dex Aggregator, GMCI Index, Coinbase 50 Index",1inch,275690622,300243626.0,75138.39158383383,105574.5928844908,0.05,20279236.0
Binance,"Liquid Staking Tokens, Ethereum Ecosystem, Liquid Staking",stader-ethx,271439293,271439293.0,,,N/A,107811.0
Binance,"BNB Chain Ecosystem, Wallets, Ethereum Ecosystem, Animoca Brands Portfolio, Binance Launchpad, Energi Ecosystem, Binance Labs Portfolio",safepal,271146388,271146388.0,150910.49654135096,151742.36076865921,0.07,9622049.0
Binance,"Polygon Ecosystem, Bridged WBTC, Bridged-Tokens",polygon-bridged-wbtc-polygon-pos,270170724,270170724.0,,,N/A,7167620.0
Binance,"Smart Contract Platform, Ethereum Ecosystem, Real World Assets (RWA), DWF Labs Portfolio, Proof of Stake (PoS)",creditcoin-2,269634593,372409707.0,,,N/A,21097017.0
Binance,"Smart Contract Platform, Polkadot Ecosystem, Proof of Stake (PoS), Pantera Capital Portfolio, Made in USA, Coinbase 50 Index",kusama,268827485,268841470.0,80073.953317286,127808.83677636214,0.06,11388674.0
Binance,"Exchange-based Tokens, Centralized Exchange (CEX) Token, Ethereum Ecosystem, Morph L2 Ecosystem",mx-token,263428441,1160729628.0,,,N/A,24581696.0
Binance,"Smart Contract Platform, DePIN, Proof of Stake (PoS), Made in USA",theta-fuel,263339614,263383395.0,32080.27852463163,74422.7911091238,0.1,2982666.0
Binance,"Stablecoins, USD Stablecoin, Ethereum Ecosystem, Fiat-backed Stablecoin",elixir-deusd,262942181,262942181.0,,,N/A,5603590.0
Binance,"Decentralized Finance (DeFi), Ethereum Ecosystem, Restaking, Liquid Restaking Tokens, Liquid Staking",ether-fi-staked-btc,260202170,260203015.0,,,N/A,369952.0
Binance,"BRC-20, Bitcoin Ecosystem, Inscriptions",sats-ordinals,258693317,258693317.0,,,N/A,8323687.0
Binance,"Crypto-Backed Tokens, Decentralized Finance (DeFi), cToken, Ethereum Ecosystem",compound-wrapped-btc,258237353,258237353.0,,,N/A,0.0
Binance,"Solana Ecosystem, Arbitrum Ecosystem, Ethereum Ecosystem, Interoperability, Base Ecosystem, Multicoin Capital Portfolio, Cross-chain Communication, Made in USA",wormhole,255806417,881058713.0,10101.056421722853,18019.147565583193,0.03,31344308.0
Binance,"Meme, Cardano Ecosystem",snek,253966161,257207141.0,,,N/A,1501752.0
Binance,"Decentralized Finance (DeFi), Solana Ecosystem, LSDFi, Restaking, Stablecoin Protocol, Binance Labs Portfolio, Binance HODLer Airdrops, Polychain Capital Portfolio",solayer,253942435,1209249689.0,293317.90556413104,212430.67288229824,0.02,142270233.0
Binance,"Arbitrum Ecosystem, Liquid Staking Tokens, Ethereum Ecosystem, Liquid Staking",sweth,252274600,252281634.0,,,N/A,319223.0
Binance,"Smart Contract Platform, Layer 2 (L2), Zero Knowledge (ZK), ZkSync Ecosystem, Consensys Portfolio, Blockchain Capital Portfolio, OKX Ventures Portfolio",zksync,252291693,1441666819.0,237755.97958589531,242141.74746384777,0.15,42857128.0
Binance,"Stablecoins, Tokenized Assets, Tokenized Gold, BNB Chain Ecosystem, Real World Assets (RWA), Tokenized Commodities, Commodity-backed Stablecoin",quorium,250793544,250793544.0,,,N/A,83083.0
Binance,"Decentralized Finance (DeFi), BNB Chain Ecosystem, Polygon Ecosystem, Fantom Ecosystem, Arbitrum Ecosystem, Moonbeam Ecosystem, Liquid Staking Tokens, Ethereum Ecosystem, Optimism Ecosystem, Polygon zkEVM Ecosystem, Liquid Staking, Made in USA",frax-ether,249722143,249722143.0,,,N/A,1285045.0
Binance,"Smart Contract Platform, Gaming (GameFi), NFT, Layer 1 (L1), Play To Earn, Gaming Blockchains, WEMIX Ecosystem",wemix-token,243831235,313534224.0,,,N/A,5888342.0
Binance,"Smart Contract Platform, BNB Chain Ecosystem, GMCI Layer 1 Index, GMCI Index, Made in China",zilliqa,240163076,248517141.0,71988.4481829723,103146.04989145411,0.08,12387742.0
Binance,"Bridged USDC, Sonic Ecosystem, Bridged-Tokens, Bridged Stablecoins",sonic-bridged-usdc-e-sonic,239899336,239899336.0,,,N/A,52858130.0
Binance,"Smart Contract Platform, Polkadot Ecosystem, Layer 1 (L1), Layer 2 (L2), Alameda Research Portfolio, Binance Labs Portfolio, OKX Ventures Portfolio",astar,238003847,261685272.0,164114.41779183902,352861.2565297575,0.03,6250965.0
Binance,"NFT, Ethereum Ecosystem, NFT Marketplace, FTX Holdings, NFTFi, eGirl Capital Portfolio, Paradigm Portfolio, GMCI DeFi Index, GMCI Index, Made in USA, Coinbase 50 Index",blur,236411599,315782576.0,103899.95001656613,123331.31838848561,0.1,19883625.0
Binance,"Stablecoins, USD Stablecoin, BNB Chain Ecosystem, Avalanche Ecosystem, Near Protocol Ecosystem, Arbitrum Ecosystem, Ethereum Ecosystem, Tron Ecosystem, BitTorrent Ecosystem, Algorithmic Stablecoin, Fiat-backed Stablecoin",usdd,233115191,233115191.0,,,N/A,2794473.0
Binance,"Decentralized Finance (DeFi), Liquid Staking Tokens, Base Ecosystem, Liquid Staked ETH, Liquid Staking",super-oeth,231871186,231871186.0,,,N/A,837542.0
Binance,"Infrastructure, Wallets, Gnosis Chain Ecosystem, Ethereum Ecosystem",safe,230399710,416157175.0,,,N/A,14375138.0
Binance,"Infrastructure, Decentralized Finance (DeFi), Sui Ecosystem",deep,229588902,918355609.0,,,N/A,18439029.0
Binance,"Analytics, Avalanche Ecosystem, Meme, Cat-Themed, Made in USA",ket,228717988,228717988.0,,,N/A,8638422.0
Binance,"Smart Contract Platform, Proof of Stake (PoS), Made in China",qtum,228148192,233036130.0,2620.2854558884205,5873.478579069774,0.25,19772466.0
Binance,"Smart Contract Platform, Interoperability, Layer 2 (L2), Rollup, Multicoin Capital Portfolio, Proof of Work (PoW), DragonFly Capital Portfolio, Sequoia Capital Portfolio, Blockchain Capital Portfolio, Polychain Capital Portfolio, Made in China",nervos-network,226275351,229846619.0,209457.22622479752,256149.83446721244,0.02,14263743.0
Binance,"Solana Ecosystem, Avalanche Ecosystem, Polygon Ecosystem, Near Protocol Ecosystem, Harmony Ecosystem, Ethereum Ecosystem, Pantera Capital Portfolio, Energi Ecosystem, Made in USA",basic-attention-token,224059807,224708713.0,43596.238546683635,52601.90182178857,0.07,13593757.0
Binance,"Decentralized Exchange (DEX), Exchange-based Tokens, Decentralized Finance (DeFi), Derivatives, Perpetuals, Ethereum Ecosystem, Paradigm Portfolio",dydx,222726922,222726922.0,,,N/A,13968732.0
Binance,"Gaming (GameFi), Binance Launchpool, Meme, Play To Earn, TON Ecosystem, TON Meme, Tap to Earn",notcoin,221859111,221859111.0,158117.97853026693,196248.47572230495,0.05,110180237.0
Binance,"Artificial Intelligence (AI), Polkadot Ecosystem, Metaverse, Ethereum Ecosystem, Interoperability, Real World Assets (RWA), DePIN, Decentralized Science (DeSci), AI Agents",origintrail,213536319,213837816.0,,,N/A,8234088.0
Binance,"BNB Chain Ecosystem, Polygon Ecosystem, Ethereum Ecosystem, Animoca Brands Portfolio, DWF Labs Portfolio, Alameda Research Portfolio, Energi Ecosystem, Binance Labs Portfolio",mask-network,217585250,217585250.0,201822.2353443324,282635.87822081055,0.05,30112050.0
Binance,"Layer 1 (L1), VeChain Ecosystem",vethor-token,215143874,215177654.0,64917.82579271294,82519.78878290944,0.04,4225610.0
Binance,"Decentralized Exchange (DEX), Decentralized Finance (DeFi), Avalanche Ecosystem, Harmony Ecosystem, Ethereum Ecosystem, Coinbase Ventures Portfolio, Pantera Capital Portfolio, Energi Ecosystem, GMCI DeFi Index, Blockchain Capital Portfolio, GMCI Index, Made in USA",0x,214536237,252872591.0,77728.80231631767,107749.45900438708,0.04,26532903.0
Binance,"Smart Contract Platform, BNB Chain Ecosystem, Layer 1 (L1), Proof of Stake (PoS), Pantera Capital Portfolio, Andreessen Horowitz (a16z) Portfolio, Binance Labs Portfolio, Blockchain Capital Portfolio, Privacy Blockchain, Polychain Capital Portfolio, Coinbase 50 Index",oasis-network,213675213,317506230.0,82828.82704219723,122268.52891559836,0.03,10143403.0
Binance,"Artificial Intelligence (AI), Harmony Ecosystem, Arbitrum Ecosystem, Ethereum Ecosystem, DePIN, Coinbase Ventures Portfolio, Multicoin Capital Portfolio, Pantera Capital Portfolio, GMCI DePIN Index, GMCI Index, Coinbase 50 Index",livepeer,210312826,210312826.0,60906.07043826593,98841.07849216509,0.06,23040739.0
Binance,"Decentralized Finance (DeFi), Aptos Ecosystem",abtc,209732849,209732849.0,,,N/A,84620.0
Binance,"Stablecoins, Ethereum Ecosystem",usda-2,206125902,206125902.0,,,N/A,210437.0
Binance,"Decentralized Exchange (DEX), Decentralized Finance (DeFi), Automated Market Maker (AMM), Cosmos Ecosystem, Osmosis Ecosystem, Paradigm Portfolio, Evmos Ecosystem, Secret Ecosystem, GMCI DeFi Index, GMCI Index",osmosis,206483854,287727820.0,50666.59074145813,145539.8314238762,0.07,9803882.0
Binance,"Artificial Intelligence (AI), Solana Ecosystem, Meme, Solana Meme, AI Meme, AI Agents, Binance Alpha Spotlight, AI Framework, Made in USA",ai16z,205706836,205706836.0,,,N/A,54517630.0
Binance,"Liquid Staking Tokens, Ethereum Ecosystem, Base Ecosystem, Liquid Staked ETH, Liquid Staking",liquid-staked-ethereum,205653945,205653945.0,,,N/A,67949.0
Binance,"Decentralized Finance (DeFi), Solana Ecosystem, Liquid Staking Tokens, Liquid Staked SOL, Liquid Staking",bybit-staked-sol,206146371,206146371.0,,,N/A,4783478.0
Binance,"BNB Chain Ecosystem, Meme, AI Meme",ai-companions,206867182,206867182.0,,,N/A,3589341.0
Binance,"Solana Ecosystem, Meme, Solana Meme, Pump.fun Ecosystem, Zoo-Themed, Memorial Themed",peanut-the-squirrel,205285126,205285126.0,496268.14721759694,634605.9136347283,0.05,408593795.0
Binance,"Stablecoins, USD Stablecoin, Arbitrum Ecosystem, Ethereum Ecosystem, Base Ecosystem, Crypto-backed Stablecoin, Fiat-backed Stablecoin",gho,205259870,205259870.0,,,N/A,7303182.0
Binance,"Gaming (GameFi), BNB Chain Ecosystem, Solana Ecosystem, Meme, Ethereum Ecosystem, Dog-Themed, Solana Meme, Gaming Utility Token",baby-doge-coin,203868366,517481390.0,,,N/A,16396934.0
Binance,"Decentralized Exchange (DEX), BNB Chain Ecosystem, Solana Ecosystem, Ethereum Ecosystem, Real World Assets (RWA), Base Ecosystem, RWA Protocol",chex-token,200962807,200962807.0,,,N/A,1470520.0
Binance,"Gaming (GameFi), NFT, Collectibles, Polygon Ecosystem, Ethereum Ecosystem, Animoca Brands Portfolio, Gaming Blockchains, Made in USA",superfarm,200815621,444581642.0,46235.47319167021,63402.3752125659,0.02,15412966.0
Binance,"Smart Contract Platform, Storage, Harmony Ecosystem, Ethereum Ecosystem, DePIN, Energi Ecosystem, Sora Ecosystem, GMCI DePIN Index, GMCI Index",holotoken,200516549,200516549.0,79729.94798569132,82988.3315083639,0.09,9832131.0
Binance,"Decentralized Finance (DeFi), Polygon Ecosystem, Ethereum Ecosystem, Coinbase Ventures Portfolio, Pantera Capital Portfolio",instadapp,197594233,501040188.0,,,N/A,858346.0
Binance,"Smart Contract Platform, Gaming (GameFi), Ethereum Ecosystem, Base Ecosystem, Card Games, Paradigm Portfolio, Gaming Blockchains, Gaming Utility Token",echelon-prime,197890405,390722048.0,,,N/A,4588371.0
Binance,"Smart Contract Platform, BNB Chain Ecosystem, Avalanche Ecosystem, Polygon Ecosystem, Arbitrum Ecosystem, Ethereum Ecosystem, Optimism Ecosystem, Base Ecosystem, Multicoin Capital Portfolio, Layer 0 (L0), Cross-chain Communication, Circle Ventures Portfolio, Sequoia Capital Portfolio, OKX Ventures Portfolio",layerzero,197667990,1778343808.0,6330.161291850448,9559.69549428209,0.15,27754601.0
Binance,"Decentralized Finance (DeFi), Yield Farming, BNB Chain Ecosystem, Avalanche Ecosystem, Polygon Ecosystem, Fantom Ecosystem, Arbitrum Ecosystem, Ethereum Ecosystem, Optimism Ecosystem, Linea Ecosystem, Bridge Governance Tokens, Base Ecosystem, FTX Holdings",stargate-finance,196419777,202189304.0,157544.83727565833,143539.37177956625,0.05,5850604.0
Binance,"Infrastructure, Smart Contract Platform, Venom Ecosystem",venom,195438427,706666682.0,,,N/A,2493763.0
Binance,"Artificial Intelligence (AI), Exchange-based Tokens, Analytics, Derivatives, Perpetuals, Centralized Exchange (CEX) Token, Ethereum Ecosystem, Binance Launchpad, Coinbase Ventures Portfolio, Binance Labs Portfolio, Made in USA",arkham,194782311,526872538.0,27362.027811244156,65643.21789407467,0.05,61525794.0
Binance,"Solana Ecosystem, BRC-20, Bitcoin Ecosystem, Inscriptions",ordinals,193205725,193205725.0,321005.3013003336,494341.77809799206,0.11,84847561.0
Binance,"Smart Contract Platform, Privacy, Layer 1 (L1), Proof of Stake (PoS), Proof of Work (PoW), Blockchain Capital Portfolio, Made in USA",decred,192200956,192211924.0,28246.49686675192,29928.739773661124,0.17,2777337.0
Binance,"Solana Ecosystem, Meme, Solana Meme, Cat-Themed, Murad Picks",popcat,190976538,190976538.0,,,N/A,94817125.0
Binance,"Smart Contract Platform, Layer 1 (L1), Celo Ecosystem, DWF Labs Portfolio, Coinbase Ventures Portfolio, Proof of Stake (PoS), Andreessen Horowitz (a16z) Portfolio, Optimism Superchain Ecosystem, Outlier Ventures Portfolio, Made in USA",celo,190813448,337562783.0,1372.6657632316019,2687.180408207747,0.32,15376311.0
Binance,"Infrastructure, Smart Contract Platform, BNB Chain Ecosystem, Layer 1 (L1), Ethereum Ecosystem, GMCI Layer 1 Index, Aelf Ecosystem, GMCI Index",aelf,190825874,257232308.0,50089.433051212756,82441.03755257509,0.08,20584744.0
Binance,"BNB Chain Ecosystem, Meme",cheems-token,190601861,190601861.0,,,N/A,5527138.0
Binance,"Infrastructure, Smart Contract Platform, NEO Ecosystem",gas,190060355,190060355.0,50352.2886496822,66466.23603365086,0.03,5402490.0
Binance,"Solana Ecosystem, Meme, Dog-Themed, Solana Meme, Bitcoin Ecosystem, Runes",dog-go-to-the-moon-rune,189174318,189174318.0,,,N/A,8273789.0
Binance,"Smart Contract Platform, Layer 1 (L1), DePIN, Andreessen Horowitz (a16z) Portfolio, Made in USA",chia,187664044,426749474.0,,,N/A,5639489.0
Binance,"Smart Contract Platform, Real World Assets (RWA), Proof of Work (PoW), Made in USA",ravencoin,185286735,185299893.0,51593.71627200182,72785.353314374,0.08,12738536.0
Binance,"Solana Ecosystem, Meme, Solana Meme, AI Meme, Pump.fun Ecosystem",act-i-the-ai-prophecy,184963349,184963349.0,132056.15435162367,294481.6337554202,0.05,54760847.0
Binance,"Crypto-Backed Tokens, Decentralized Finance (DeFi), Wrapped-Tokens, Ethereum Ecosystem",resolv-wstusr,184744046,164817939.0,,,N/A,162.11
Binance,"Smart Contract Platform, Privacy, Proof of Work (PoW)",mimblewimblecoin,184477596,184481450.0,,,N/A,3817.62
Binance,"Gambling (GambleFi), Gaming (GameFi), Ethereum Ecosystem",rollbit-coin,183454915,183454915.0,,,N/A,697558.0
Binance,"Smart Contract Platform, Storage, DePIN, Paradigm Portfolio, Proof of Work (PoW), DragonFly Capital Portfolio, Made in USA",siacoin,181683759,194164615.0,33095.17242363024,46171.82684961774,0.03,17082808.0
Binance,"Meme, Cronos Ecosystem, AI Meme, Cronos zkEVM Ecosystem",agentfun-ai,181900744,181900744.0,,,N/A,5445.13
Binance,"Tourism, BNB Chain Ecosystem",trip,181827212,604036161.0,,,N/A,11428.18
Binance,"Solana Ecosystem, Ethereum Ecosystem, Energi Ecosystem",swissborg,180520027,180520027.0,,,N/A,16004105.0
Binance,"Launchpad, Meme, Base Ecosystem, Cat-Themed, Base Meme",toshi,181140641,181140641.0,,,N/A,32629898.0
Binance,"Gaming (GameFi), Ethereum Ecosystem, Decentralized Identifier (DID), Animoca Brands Portfolio, OKX Ventures Portfolio, Outlier Ventures Portfolio",mocaverse,181046187,842281544.0,,,N/A,25243528.0
Binance,"Decentralized Finance (DeFi), BNB Chain Ecosystem, Polygon Ecosystem, Fantom Ecosystem, Arbitrum Ecosystem, Moonbeam Ecosystem, Liquid Staking Tokens, Ethereum Ecosystem, Optimism Ecosystem, Liquid Staked ETH, Liquid Staking",staked-frax-ether,180720093,180720093.0,,,N/A,153683.0
Binance,"Decentralized Finance (DeFi), Launchpad, Ethereum Ecosystem, DWF Labs Portfolio, Coinbase Ventures Portfolio, Pantera Capital Portfolio, Blockchain Capital Portfolio",auction,180554135,209338834.0,140919.87473859178,257337.79625142514,0.04,93904246.0
Binance,"Exchange-based Tokens, Ethereum Ecosystem",btse-token,179239659,221199555.0,,,N/A,3211932.0
Binance,"BNB Chain Ecosystem, Avalanche Ecosystem, Polygon Ecosystem, Fantom Ecosystem, Arbitrum Ecosystem, Ethereum Ecosystem, Optimism Ecosystem, Liquid Staking Governance Tokens, Linea Ecosystem, DePIN, Scroll Ecosystem, Rollups-as-a-Service (RaaS), Blast Ecosystem, Mode Ecosystem, Pantera Capital Portfolio, Polygon zkEVM Ecosystem, Binance Labs Portfolio, Liquid Staking, Made in USA",ankr,179041026,179041026.0,66127.22693340403,67459.11186960999,0.06,16212274.0
Binance,"Tokenized Real Estate, Tokenized Assets, Ethereum Ecosystem, Real World Assets (RWA), RWA Protocol",apf-coin,177045379,259950003.0,,,N/A,3082787.0
Binance,,nem,176228454,176228454.0,,,N/A,22845903.0
Binance,"Gaming (GameFi), BNB Chain Ecosystem, Ethereum Ecosystem, TON Ecosystem",gmt-token,175643584,175643584.0,,,N/A,20301919.0
Binance,"Meme, Ethereum Ecosystem, Base Ecosystem, Cat-Themed, Murad Picks",mog-coin,175336268,175336268.0,,,N/A,15193589.0
Binance,"Avalanche Ecosystem, Liquid Staking Tokens, Liquid Staking",benqi-liquid-staked-avax,174126973,174126973.0,,,N/A,2459220.0
Binance,"Artificial Intelligence (AI), Smart Contract Platform, Layer 1 (L1), Paradigm Portfolio, Coinbase Ventures Portfolio, DeFiance Capital Portfolio, Polychain Capital Portfolio, Vana Ecosystem",vana,173786571,677090536.0,391894.54223034834,409677.6743536164,0.02,32837586.0
Binance,"Decentralized Finance (DeFi), Solana Ecosystem, Ethereum Ecosystem, Optimism Ecosystem, Base Ecosystem, Cross-chain Communication, BTCfi",threshold-network-token,171545105,188976143.0,48816.99026876643,58320.76481030586,0.06,9341998.0
Binance,"Decentralized Finance (DeFi), Yield Farming, Yield Aggregator, Yearn Ecosystem, Avalanche Ecosystem, Polygon Ecosystem, Near Protocol Ecosystem, Gnosis Chain Ecosystem, Fantom Ecosystem, Harmony Ecosystem, Arbitrum Ecosystem, Ethereum Ecosystem, Optimism Ecosystem, Base Ecosystem, Index Coop Defi Index, Alameda Research Portfolio, Energi Ecosystem, Sora Ecosystem, Huobi ECO Chain Ecosystem, Blockchain Capital Portfolio, Index Coop Index",yearn-finance,171190522,185972426.0,71757.97783473082,77186.27267686285,0.04,26483582.0
Binance,"Internet of Things (IOT), Ethereum Ecosystem, DePIN, Base Ecosystem, Account Abstraction, GMCI DePIN Index, GMCI Index, Made in USA",iotex,170304557,170304557.0,59306.81645988117,79324.81097035139,0.06,14327195.0
Binance,"Starknet Ecosystem, Bridged-Tokens",bridged-wrapped-ether-starkgate,169709928,169709928.0,,,N/A,1004419.0
Binance,"Solana Ecosystem, Meme, Dog-Themed, Solana Meme, Cat-Themed",cat-in-a-dogs-world,169800893,169800893.0,,,N/A,11596515.0
Binance,Arbitrum Ecosystem,rcge,168805259,168805259.0,,,N/A,2.43
Binance,"Entertainment, Smart Contract Platform, Gaming (GameFi), NFT, Metaverse, Layer 1 (L1), Harmony Ecosystem, Ethereum Ecosystem, Gaming Blockchains, Energi Ecosystem",enjincoin,166411873,172170828.0,33432.584009532125,82483.84812482669,0.11,14076699.0
Binance,"Solana Ecosystem, Meme, Cat-Themed",meow,165633714,165633714.0,,,N/A,871083.0
Binance,"Decentralized Finance (DeFi), Yield Farming, Yield Aggregator, Ethereum Ecosystem, Metagovernance, Curve Ecosystem, Yield Optimizer",convex-finance,163631319,199282037.0,47989.50436999622,73076.89388414429,0.1,20622283.0
Binance,"Decentralized Finance (DeFi), Liquid Staking Tokens, Ethereum Ecosystem, Liquid Staked ETH, Liquid Staking",treehouse-eth,163287448,163287448.0,,,N/A,46816.0
Binance,"Decentralized Finance (DeFi), Ethereum Ecosystem, Stablecoin Protocol",tribe-2,162899072,358007718.0,,,N/A,60429.0
Binance,"Decentralized Exchange (DEX), Exchange-based Tokens, Ethereum Ecosystem",coinex-token,160755384,160755450.0,,,N/A,123318.0
Binance,"Decentralized Finance (DeFi), Binance Launchpool, Arbitrum Ecosystem, Ethereum Ecosystem, Restaking, Liquid Restaking Governance Tokens, Ether.fi Ecosystem, Consensys Portfolio, OKX Ventures Portfolio",ether-fi,160164757,691360003.0,552523.0578051,496921.84526797687,0.14,55412704.0
Binance,"Smart Contract Platform, Layer 1 (L1), Layer 0 (L0), Made in USA, Directed Acyclic Graph (DAG)",constellation-labs,160384157,160384273.0,,,N/A,2850041.0
Binance,"Solana Ecosystem, DePIN, Multicoin Capital Portfolio, Made in USA",hivemapper,159335545,247820718.0,,,N/A,564003.0
Binance,"Artificial Intelligence (AI), Meme, Base Ecosystem, AI Agents, Binance Alpha Spotlight, AI Framework",freysa-ai,158997464,158997464.0,,,N/A,698121.0
Binance,"Decentralized Finance (DeFi), Tron Ecosystem",sun-token,158133982,320159334.0,301410.6618641329,305959.144900445,0.06,32404404.0
