Binance,"Decentralized Exchange (DEX), Exchange-based Tokens, Decentralized Finance (DeFi), Yield Farming, Automated Market Maker (AMM), Avalanche Ecosystem, Polygon Ecosystem, Near Protocol Ecosystem, Gnosis Chain Ecosystem, Harmony Ecosystem, Arbitrum Ecosystem, Ethereum Ecosystem, Optimism Ecosystem, Base Ecosystem, Index Coop Defi Index, Alameda Research Portfolio, DeFiance Capital Portfolio, Pantera Capital Portfolio, Energi Ecosystem, Polygon zkEVM Ecosystem, Huobi ECO Chain Ecosystem, Blockchain Capital Portfolio, Index Coop Index",balancer,90415015,97772584.0,112531.79558861881,124338.69725704729,0.07,9958287.0
Binance,"Crypto-Backed Tokens, BNB Chain Ecosystem, Arbitrum Ecosystem, Ethereum Ecosystem, Mantle Ecosystem",ignition-fbtc,90301544,1168336058.0,,,N/A,520087.0
Binance,"Smart Contract Platform, Gaming (GameFi), Solana Ecosystem, Layer 2 (L2), Gaming Blockchains",sonic-svm,90096862,600645749.0,,,N/A,39035852.0
Binance,"Decentralized Finance (DeFi), Yield Farming, BNB Chain Ecosystem, Binance Launchpool, Lending/Borrowing Protocols, Arbitrum Ecosystem, Ethereum Ecosystem, Optimism Ecosystem, ZkSync Ecosystem, opBNB Ecosystem, Unichain Ecosystem",venus,89810320,161118869.0,60244.641363363175,68213.45054030084,0.19,4554554.0
Binance,"Gaming (GameFi), XDC Ecosystem, Gaming Utility Token",gama-coin,89721751,138033538.0,,,N/A,2282948.0
Binance,"Artificial Intelligence (AI), Oracle, Ethereum Ecosystem, DePIN, Energi Ecosystem, Sora Ecosystem, GMCI DePIN Index, GMCI Index",iexec-rlc,89869801,108018487.0,107837.45905773144,83348.92142359441,0.08,13611843.0
Binance,"Artificial Intelligence (AI), Infrastructure, Smart Contract Platform, Decentralized Finance (DeFi), Arbitrum Ecosystem, Ethereum Ecosystem, Zero Knowledge (ZK), DWF Labs Portfolio, Coinbase Ventures Portfolio, Pantera Capital Portfolio, Binance Labs Portfolio",marlin,89463995,109726969.0,38661.077963217474,83184.06624970725,0.09,7526752.0
Binance,"Infrastructure, Smart Contract Platform, Decentralized Finance (DeFi), BNB Chain Ecosystem, Avalanche Ecosystem, Polygon Ecosystem, Fantom Ecosystem, Harmony Ecosystem, Arbitrum Ecosystem, Ethereum Ecosystem, DWF Labs Portfolio, Layer 3 (L3), Outlier Ventures Portfolio",orbs,89100201,195672508.0,,,N/A,6532226.0
Binance,"Cronos Ecosystem, Bridged USDT, Bridged-Tokens, Bridged Stablecoins",cronos-bridged-usdt-cronos,87808388,87808388.0,,,N/A,414047.0
Binance,"NFT, Ethereum Ecosystem",superrare,87276835,109045484.0,219135.14030395666,355929.74310073175,0.09,309048360.0
Binance,"Smart Contract Platform, Ethereum Ecosystem, Layer 2 (L2), Zero Knowledge (ZK), Restaking, Zircuit Ecosystem",zircuit,86695758,394983059.0,,,N/A,27941490.0
Binance,"Smart Contract Platform, Bitcoin Sidechains, Stacks Ecosystem, SideChain",sbtc-2,86311104,86311104.0,,,N/A,52126.0
Binance,"Smart Contract Platform, Layer 1 (L1)",ong,86346220,211662428.0,44086.4190173011,44551.48227501975,0.09,2440785.0
Binance,"Decentralized Exchange (DEX), Decentralized Finance (DeFi), Arbitrum Ecosystem, Ethereum Ecosystem",tokenlon,86283062,103856005.0,,,N/A,36801.0
Binance,"Stablecoins, USD Stablecoin, Ethereum Ecosystem, Sonic Ecosystem, Fiat-backed Stablecoin",frax-usd,86157375,86157375.0,,,N/A,1986183.0
Binance,"SocialFi, Coinbase Ventures Portfolio, Pantera Capital Portfolio, Andreessen Horowitz (a16z) Portfolio, Sequoia Capital Portfolio",deso,86386033,88651757.0,,,N/A,5603972.0
Binance,"Artificial Intelligence (AI), Smart Contract Platform, Gaming (GameFi), NFT, BNB Chain Ecosystem, Layer 1 (L1), Ethereum Ecosystem, Modular Blockchain, Chromia Ecosystem",chromaway,86223689,86223689.0,101205.85603974317,103082.32934258053,0.1,11070890.0
Binance,"Crypto-Backed Tokens, Ethereum Ecosystem",temple,86014370,86183822.0,,,N/A,10488.89
Binance,"Business Services, Polygon Ecosystem, Ethereum Ecosystem",request-network,85541989,111141877.0,35870.83137068046,36457.802606776444,0.18,5639210.0
Binance,"Smart Contract Platform, Polkadot Ecosystem, Layer 1 (L1), Coinbase Ventures Portfolio, Binance Labs Portfolio",moonbeam,84999847,103511113.0,268566.3130129999,105023.13315575143,0.11,5649445.0
Binance,"Polygon Ecosystem, XRP Ledger Ecosystem",crypto-trading-fund,84902982,84902982.0,,,N/A,9132.43
Binance,BNB Chain Ecosystem,metfi-2,84818304,198560295.0,,,N/A,436550.0
Binance,"Smart Contract Platform, Gaming (GameFi), NFT, Layer 1 (L1), Play To Earn, Ethereum Ecosystem, Animoca Brands Portfolio, Gaming Blockchains, Pantera Capital Portfolio, OKX Ventures Portfolio",wax,83842312,90211749.0,29372.981998241972,50214.19695109435,0.04,5410020.0
Binance,"Gaming (GameFi), Play To Earn, Ethereum Ecosystem, RPG, Alameda Research Portfolio, Circle Ventures Portfolio, OKX Ventures Portfolio, MMO",big-time,83575246,235419449.0,,,N/A,28685032.0
Binance,"NFT, Solana Ecosystem, NFT Marketplace",tensor,83502968,249555176.0,10296.042982259514,39200.281322264884,0.11,14344275.0
Binance,"Exchange-based Tokens, Centralized Exchange (CEX) Token, Ethereum Ecosystem",hashkey-ecopoints,83471218,629971454.0,,,N/A,4608439.0
Binance,"Decentralized Finance (DeFi), BNB Chain Ecosystem, Arbitrum Ecosystem, Ethereum Ecosystem, Multicoin Capital Portfolio, Energi Ecosystem",dforce-token,83345000,83345000.0,41691.7224546951,39509.82153521086,0.05,14137801.0
Binance,"Smart Contract Platform, Layer 2 (L2), eGirl Capital Portfolio, Paradigm Portfolio, Blast Ecosystem",blast,83211078,314281973.0,,,N/A,9331210.0
Binance,"Artificial Intelligence (AI), Virtual Reality, Launchpad, Ethereum Ecosystem, Telegram Apps, Discord Bots, PAAL AI Launchpad, AI Agents, AI Applications, AI Agent Launchpad, Binance Alpha Spotlight, AI Framework, DeFAI, Made in USA",paal-ai,83607012,94044797.0,,,N/A,14550968.0
Binance,"Solana Ecosystem, Polygon Ecosystem, DePIN, Pantera Capital Portfolio",geodnet,82833279,258370982.0,,,N/A,276043.0
Binance,Ethereum Ecosystem,dkargo,82818145,88355062.0,,,N/A,1316105.0
Binance,"Artificial Intelligence (AI), Infrastructure, Ethereum Ecosystem, AI Framework, Made in USA",arcblock,82539628,155735147.0,,,N/A,947715.0
Binance,"Gaming (GameFi), NFT, BNB Chain Ecosystem, Metaverse, Collectibles, Polygon Ecosystem, Play To Earn, Harmony Ecosystem, Guild and Scholarship, Ethereum Ecosystem, Animoca Brands Portfolio, Base Ecosystem, DWF Labs Portfolio, Ronin Ecosystem, Gaming Governance Token, Andreessen Horowitz (a16z) Portfolio, Delphi Ventures Portfolio",yield-guild-games,81930639,199580889.0,69833.13722122353,113901.30055520992,0.05,13832823.0
Binance,"Decentralized Exchange (DEX), Decentralized Finance (DeFi), Yield Farming, Automated Market Maker (AMM), Solana Ecosystem, Coinbase Ventures Portfolio, DeFiance Capital Portfolio, Made in USA",orca,81513762,153001171.0,56473.8106061915,47782.076574995044,0.13,21693996.0
Binance,"Artificial Intelligence (AI), BNB Chain Ecosystem, Solana Ecosystem, Ethereum Ecosystem, AI Agents, Alameda Research Portfolio",delysium,81901733,156315232.0,,,N/A,3146359.0
Binance,"Berachain Ecosystem, Bridged USDT, Bridged-Tokens, Ink Ecosystem, Bridged Stablecoins",usdt0,80853394,80853394.0,,,N/A,219953.0
Binance,"Exchange-based Tokens, Centralized Exchange (CEX) Token, Ethereum Ecosystem",bitmart-token,80521061,151692134.0,,,N/A,4516775.0
Binance,"Internet of Things (IOT), BNB Chain Ecosystem, Ethereum Ecosystem, DePIN, DWF Labs Portfolio",mass-vehicle-ledger,80905848,85519730.0,,,N/A,734660.0
Binance,"Gaming (GameFi), Play To Earn, Guild and Scholarship, Ethereum Ecosystem, Animoca Brands Portfolio, Base Ecosystem, DWF Labs Portfolio, Ronin Ecosystem, Coinbase Ventures Portfolio, DeFiance Capital Portfolio, Pantera Capital Portfolio, Binance Labs Portfolio, MMO",zentry,80167265,117689293.0,,,N/A,6179583.0
Binance,"Meme, Ethereum Ecosystem, PolitiFi",constitutiondao,80043571,80043571.0,153897.762387413,154171.033675625,0.06,31537002.0
Binance,"Smart Contract Platform, Privacy, Proof of Work (PoW), Made in USA",verge,80029814,80189898.0,9405.276749808956,8594.241416336346,0.11,5553257.0
Binance,"Stablecoins, Decentralized Finance (DeFi), Lending/Borrowing Protocols, Ethereum Ecosystem",syrupusdc,79616180,79616180.0,,,N/A,16600.06
Binance,"Blast Ecosystem, Bridged WETH, Bridged-Tokens",l2-standard-bridged-weth-blast,79314398,79314398.0,,,N/A,304559.0
Binance,"Stablecoins, USD Stablecoin, Solana Ecosystem, Ethereum Ecosystem, Multicoin Capital Portfolio, Fiat-backed Stablecoin",paxos-standard,79207703,79207703.0,342681.0256938753,1330406.622928029,0.02,3665220.0
Binance,"Exchange-based Tokens, Centralized Exchange (CEX) Token, Near Protocol Ecosystem, Harmony Ecosystem, Ethereum Ecosystem, Multicoin Capital Portfolio, Alameda Research Portfolio, Elastos Smart Contract Chain Ecosystem, Sequoia Capital Portfolio, Made in China",huobi-token,79110683,99777895.0,,,N/A,11392.78
Binance,"Smart Contract Platform, Proof of Stake (PoS)",stratis,78906469,86941218.0,22589.850712828087,16112.534259957447,0.12,783901.0
Binance,"NFT, Polygon Ecosystem",sathosi-airlines-token,78802859,376352730.0,,,N/A,14790.26
Binance,"Smart Contract Platform, Cosmos Ecosystem, Modular Blockchain, Osmosis Ecosystem, Rollups-as-a-Service (RaaS)",dymension,78534487,312295501.0,357564.76677306223,259669.45893359458,0.32,8221174.0
Binance,"Artificial Intelligence (AI), Smart Contract Platform, Decentralized Finance (DeFi), Analytics, NFT, BNB Chain Ecosystem, Launchpad, Ethereum Ecosystem, Telegram Apps, Discord Bots, ChainGPT Launchpad, Poolz Finance Launchpad, AI Agents, AI Applications, Binance Alpha Spotlight, AI Framework, DeFAI",chaingpt,78381660,97314075.0,48610.27581783425,52942.862994592855,0.1,24148236.0
Binance,"Software as a service, Polygon Ecosystem, Ethereum Ecosystem, Decentralized Identifier (DID), Pantera Capital Portfolio, Energi Ecosystem, Blockchain Capital Portfolio",civic,78144039,97436456.0,33732.23210258127,33009.80433907072,0.1,8958342.0
Binance,"Arbitrum Ecosystem, Bridge Governance Tokens, Base Ecosystem, Cross-chain Communication, OKX Ventures Portfolio",orbiter-finance,77766077,250858313.0,,,N/A,93741853.0
Binance,"Decentralized Finance (DeFi), Wallets, Ethereum Ecosystem, Pundi AIFX Omnilayer Ecosystem",pundi-x-2,77779977,77779977.0,71632.04820181704,53169.03792284681,0.03,8159186.0
Binance,"Ethereum Ecosystem, Stablecoin Protocol",level-usd,77567602,77567602.0,,,N/A,911175.0
Binance,"Decentralized Finance (DeFi), Lending/Borrowing Protocols, Moonbeam Ecosystem, Base Ecosystem, Coinbase Ventures Portfolio, Made in USA",moonwell-artemis,77399566,118014087.0,,,N/A,21067387.0
Binance,"Stablecoins, USD Stablecoin, Osmosis Ecosystem, Fiat-backed Stablecoin",usdx,77127612,77127612.0,,,N/A,25329.0
Binance,BNB Chain Ecosystem,bitdca,77026967,82733094.0,,,N/A,85528.0
Binance,"Optimism Ecosystem, Bridged WBTC, Bridged-Tokens",optimism-bridged-wbtc-optimism,76942345,76942345.0,,,N/A,951232.0
Binance,"Smart Contract Platform, Layer 1 (L1), Osmosis Ecosystem, XRP Ledger Ecosystem",coreum,76390499,76390499.0,,,N/A,302824.0
Binance,"Business Services, Decentralized Finance (DeFi), Oracle, Polygon Ecosystem, Gnosis Chain Ecosystem, Arbitrum Ecosystem, Ethereum Ecosystem, Optimism Ecosystem, Manta Network Ecosystem, Binance Labs Portfolio, Lisk Ecosystem, Made in USA",tellor,75801865,78007615.0,165929.7435652854,112042.18030065525,0.04,24371775.0
Binance,"Sports, BNB Chain Ecosystem",pixer-eternity,75548915,351082976.0,,,N/A,375410.0
Binance,"BNB Chain Ecosystem, Solana Ecosystem, Polygon Ecosystem, Meme, Ethereum Ecosystem, Cronos Ecosystem, Dog-Themed, Elon Musk-Inspired, Fuse Ecosystem",dogelon-mars,75383726,137148604.0,,,N/A,6491241.0
Binance,"Decentralized Finance (DeFi), Liquid Staking Tokens, Ethereum Ecosystem, LSDFi, Liquid Staked ETH, Liquid Staking",origin-ether,75310005,75310005.0,,,N/A,52888.0
Binance,"Entertainment, Gaming (GameFi), NFT, Axie Infinity Ecosystem, Play To Earn, Ethereum Ecosystem, Ronin Ecosystem, Gaming Utility Token",smooth-love-potion,75123937,75123937.0,95649.6272659149,51463.81811599522,0.06,9201498.0
Binance,"Smart Contract Platform, Wallets, Layer 2 (L2), Osmosis Ecosystem",islamic-coin,75032469,906347192.0,,,N/A,831257.0
Binance,Retail,milk-alliance,74295638,166455613.0,,,N/A,5279990.0
Binance,"Artificial Intelligence (AI), Decentralized Finance (DeFi), Ethereum Ecosystem, DePIN",pinlink,74236199,92795248.0,,,N/A,1747605.0
Binance,"Artificial Intelligence (AI), BNB Chain Ecosystem, Ethereum Ecosystem, DragonFly Capital Portfolio, Binance Labs Portfolio, Delphi Ventures Portfolio, OKX Ventures Portfolio, Binance HODLer Airdrops, AI Agent Launchpad, Binance Alpha Spotlight, AI Framework",myshell,73890517,273668580.0,132576.37482857014,149446.53608436952,0.04,44208938.0
Binance,"Optimism Ecosystem, Bridged WETH, Bridged-Tokens",l2-standard-bridged-weth-optimism,73888028,73888028.0,,,N/A,6163385.0
Binance,"Smart Contract Platform, Gaming (GameFi), Layer 1 (L1), Proof of Stake (PoS), Gaming Blockchains",oasys,73859172,191412872.0,,,N/A,608725.0
Binance,Smart Contract Platform,songbird,73577590,87421947.0,,,N/A,342501.0
Binance,"Smart Contract Platform, Polkadot Ecosystem, Layer 1 (L1), DePIN, Outlier Ventures Portfolio",peaq-2,73462593,433194940.0,,,N/A,13776978.0
Binance,"Decentralized Finance (DeFi), Solana Ecosystem, Real World Assets (RWA), Payment Solutions, DePIN, Coinbase Ventures Portfolio, Alameda Research Portfolio, Circle Ventures Portfolio, OKX Ventures Portfolio, RWA Protocol, Made in USA",zebec-network,73322691,98952507.0,,,N/A,41490650.0
Binance,"Gaming (GameFi), Play To Earn, TON Ecosystem, Tap to Earn, Arcade Games",watcoin-2,73115220,81171065.0,,,N/A,958305.0
Binance,"Meme, Ethereum Ecosystem, Mantle Ecosystem",puff-the-dragon,73018024,73018024.0,,,N/A,53844.0
Binance,"Decentralized Exchange (DEX), Decentralized Finance (DeFi), Yield Farming, Automated Market Maker (AMM), BNB Chain Ecosystem, Avalanche Ecosystem, Arbitrum Ecosystem, Mantle Ecosystem, DeFiance Capital Portfolio, Delphi Ventures Portfolio, Dex Aggregator",joe,72197468,92457392.0,66058.74193662206,73394.4898580105,0.05,8574679.0
Binance,"Artificial Intelligence (AI), Decentralized Finance (DeFi), Solana Ecosystem, Arbitrum Ecosystem, Metis Ecosystem, AI Agents, Sonic Ecosystem, IOTA EVM Ecosystem, AI Applications, DeFAI",heyanon,71926197,118467430.0,,,N/A,4185200.0
Binance,"Ethereum Ecosystem, DePIN",dent,71841160,75104479.0,46749.42276812644,43898.93141532454,0.13,6135543.0
Binance,"Decentralized Finance (DeFi), Lending/Borrowing Protocols, Ethereum Ecosystem, Real World Assets (RWA), Coinbase Ventures Portfolio, Andreessen Horowitz (a16z) Portfolio, RWA Protocol, Made in USA",goldfinch,71777368,88784607.0,,,N/A,357545.0
Binance,"Decentralized Finance (DeFi), Oracle, Ethereum Ecosystem, DWF Labs Portfolio, Pantera Capital Portfolio",api3,71773927,89570729.0,46984.0659745397,57513.66383546547,0.17,14615869.0
Binance,"Gaming (GameFi), NFT, Collectibles, Play To Earn, Ethereum Ecosystem, Base Ecosystem, Energi Ecosystem",ecomi,71545610,82089474.0,,,N/A,2051922.0
Binance,"Decentralized Exchange (DEX), Exchange-based Tokens, Decentralized Finance (DeFi), BNB Chain Ecosystem, Binance Launchpool, Polygon Ecosystem, Near Protocol Ecosystem, Arbitrum Ecosystem, Ethereum Ecosystem, DWF Labs Portfolio, Coinbase Ventures Portfolio, Alameda Research Portfolio, DeFiance Capital Portfolio, Pantera Capital Portfolio, Aurora Ecosystem, Energi Ecosystem, Binance Labs Portfolio, Galaxy Digital Portfolio",dodo,71076444,71076444.0,39995.078525449026,35752.92916525071,0.14,4602436.0
Binance,"Smart Contract Platform, Gaming (GameFi), NFT, Binance Launchpool, Arbitrum Ecosystem, Layer 3 (L3), XAI Ecosystem, Gaming Blockchains, Outlier Ventures Portfolio",xai-blockchain,70856913,104409774.0,89463.04734688182,85721.80816428536,0.15,28670542.0
Binance,"Stablecoins, Decentralized Finance (DeFi), USD Stablecoin, BNB Chain Ecosystem, Polygon Ecosystem, Gnosis Chain Ecosystem, Arbitrum Ecosystem, Ethereum Ecosystem, Optimism Ecosystem, Base Ecosystem, Crypto-backed Stablecoin, Fiat-backed Stablecoin",crvusd,70421730,70421730.0,,,N/A,6839483.0
Binance,"Stablecoins, USD Stablecoin, Seigniorage, Alleged SEC Securities, Osmosis Ecosystem, Stablecoin Protocol, DeFiance Capital Portfolio, Terra Classic Ecosystem, Binance Labs Portfolio, Delphi Ventures Portfolio, Galaxy Digital Portfolio, Fiat-backed Stablecoin",terrausd,70177424,99424750.0,70524.5890614577,60464.90847337434,0.08,6945217.0
Binance,"Artificial Intelligence (AI), Cardano Ecosystem, Ethereum Ecosystem, AI Agents, Sora Ecosystem",singularitynet,70118638,105963731.0,,,N/A,31286.0
Binance,"Artificial Intelligence (AI), Ethereum Ecosystem",0x0-ai-ai-smart-contract,70066733,70066733.0,,,N/A,175493.0
Binance,"Base Ecosystem, Cybersecurity, Binance Labs Portfolio, OKX Ventures Portfolio, Binance Alpha Spotlight",goplus-security,69791267,384864161.0,71570.6782897886,124600.71783663114,0.26,33759021.0
Binance,"Decentralized Finance (DeFi), Lending/Borrowing Protocols, Solana Ecosystem, Binance Alpha Spotlight",kamino,69678507,516137086.0,,,N/A,7176427.0
Binance,"Meme, Dog-Themed, TON Ecosystem, TON Meme",dogs-2,69778404,74268258.0,74809.96079914534,135723.9990987071,0.07,15189042.0
Binance,"Artificial Intelligence (AI), Business Services, Decentralized Finance (DeFi), Ethereum Ecosystem, Paradigm Portfolio, DragonFly Capital Portfolio, Energi Ecosystem",numeraire,69688017,93316141.0,49225.762503804355,45433.30668123604,0.11,7394199.0
Binance,"Tokenized Assets, Polygon Ecosystem, Arbitrum Ecosystem, Ethereum Ecosystem, Real World Assets (RWA), Starknet Ecosystem, Tokenized Treasury Bills (T-Bills)",spiko-us-t-bills-money-market-fund,69588146,69588146.0,,,N/A,0.0
Binance,"Decentralized Finance (DeFi), Ethereum Ecosystem",elixir-finance,69223603,433571076.0,,,N/A,47998089.0
Binance,"Lending/Borrowing Protocols, Solana Ecosystem, FTX Holdings, Coinbase Ventures Portfolio, Alameda Research Portfolio, DragonFly Capital Portfolio",solend,69360419,137087973.0,,,N/A,2617.89
Binance,"Decentralized Finance (DeFi), Lending/Borrowing Protocols, Arbitrum Ecosystem, Ethereum Ecosystem, Alameda Research Portfolio, Pantera Capital Portfolio",liquity,69287064,71200461.0,58162.36461397682,59656.126159672975,0.14,13271701.0
Binance,"Decentralized Finance (DeFi), Ethereum Ecosystem, Binance Alpha Spotlight",avalon-2,69070950,425706929.0,,,N/A,62363443.0
Binance,"Solana Ecosystem, Restaking, Liquid Restaking Tokens, Liquid Restaked SOL",renzo-restaked-sol,68303814,68303814.0,,,N/A,1084082.0
Binance,"Artificial Intelligence (AI), Smart Contract Platform, Layer 1 (L1), Ethereum Ecosystem, Osmosis Ecosystem, AI Agents, AI Agent Launchpad",humans-ai,68062846,68062846.0,,,N/A,375985.0
Binance,"Stablecoins, Decentralized Finance (DeFi), USD Stablecoin, BNB Chain Ecosystem, Avalanche Ecosystem, Arbitrum Ecosystem, Liquid Staking Tokens, Ethereum Ecosystem, Optimism Ecosystem, Fiat-backed Stablecoin",staked-frax,67848579,67848579.0,,,N/A,59.2
Binance,"Smart Contract Platform, Ethereum Ecosystem, Layer 2 (L2), Zero Knowledge (ZK), Rollup, OKX Ventures Portfolio",taiko,67835969,641502425.0,,,N/A,14798378.0
Binance,"Decentralized Finance (DeFi), Ethereum Ecosystem, Restaking",kelp-gain,67534269,67534269.0,,,N/A,36370.0
Binance,"Solana Ecosystem, Wallets, Base Ecosystem, TON Ecosystem",bitget-wallet-token,67182897,470072637.0,,,N/A,3631.06
Binance,"Smart Contract Platform, Binance Launchpool, Layer 2 (L2), Scroll Ecosystem",scroll,67287993,354147330.0,66786.63887810607,213758.39170520386,0.28,19174122.0
Binance,"Smart Contract Platform, Layer 1 (L1), Proof of Work (PoW), Privacy Blockchain",ergo,66827092,81586565.0,,,N/A,92219.0
Binance,Ethereum Ecosystem,saasgo,66426472,83033089.0,,,N/A,294528.0
Binance,"Artificial Intelligence (AI), Marketing, Analytics, BNB Chain Ecosystem, Ethereum Ecosystem, Animoca Brands Portfolio, Base Ecosystem, AI Agents, Binance Alpha Spotlight",cookie,66302153,147573607.0,43864.62313504386,98202.14123658216,0.14,18066212.0
Binance,SocialFi,steem,66162605,66214018.0,201115.4121100872,212523.1725848536,0.08,12238169.0
Binance,"Artificial Intelligence (AI), Solana Ecosystem, DePIN",nosana,66093669,79249004.0,,,N/A,963020.0
Binance,"NFT, BNB Chain Ecosystem, Solana Ecosystem, Meme, Ethereum Ecosystem, Base Ecosystem, Hybrid Token Standards, Wojak-Themed",non-playable-coin,65843123,65843123.0,,,N/A,6011934.0
Binance,"Decentralized Exchange (DEX), Decentralized Finance (DeFi), Sui Ecosystem, Animoca Brands Portfolio, OKX Ventures Portfolio, Dex Aggregator",cetus-protocol,65821886,96404753.0,93580.75741512232,103691.49407108256,0.1,12085245.0
Binance,"Smart Contract Platform, Layer 1 (L1), DWF Labs Portfolio, Radix Ecosystem",radix,65669478,80411197.0,,,N/A,1397251.0
Binance,E-commerce,pay-coin,65450037,121609559.0,,,N/A,3711136.0
Binance,"Artificial Intelligence (AI), Launchpad, Base Ecosystem, AI Applications, Clanker Ecosystem, Binance Alpha Spotlight",tokenbot-2,65132248,65132248.0,,,N/A,6404707.0
Binance,"Decentralized Finance (DeFi), BNB Chain Ecosystem, Solana Ecosystem, Wallets, Polygon Ecosystem, Ethereum Ecosystem, Binance Launchpad, DWF Labs Portfolio, Multicoin Capital Portfolio, Alameda Research Portfolio, Viction Ecosystem, Binance Labs Portfolio",coin98,65207697,72385984.0,110715.12806690733,115746.76446598687,0.14,23062809.0
Binance,Ethereum Ecosystem,devve,64992578,89244924.0,,,N/A,1249509.0
Binance,"Healthcare, Osmosis Ecosystem",medibloc,64488565,69850049.0,,,N/A,368408.0
Binance,"BNB Chain Ecosystem, Binance Megadrop, BTCfi",solv-protocol,64492067,365394148.0,281826.6114707376,525013.869954863,0.05,63328947.0
Binance,"Stablecoins, USD Stablecoin, Fiat-backed Stablecoin",falcon-finance,64431410,64431410.0,,,N/A,57232.0
Binance,"Artificial Intelligence (AI), BNB Chain Ecosystem, Ethereum Ecosystem, DePIN, AI Agents",netmind-token,64258584,204290705.0,,,N/A,1860519.0
Binance,"Smart Contract Platform, Layer 1 (L1), Ethereum Ecosystem, Proof of Stake (PoS)",pundi-aifx,64260066,64260066.0,,,N/A,391155.0
Binance,"Infrastructure, Smart Contract Platform, BNB Chain Ecosystem, Avalanche Ecosystem, Polygon Ecosystem, Arbitrum Ecosystem, Ethereum Ecosystem, Optimism Ecosystem, Layer 2 (L2), Base Ecosystem, Binance Launchpad, Modular Blockchain, Layer 3 (L3), Rollup, Proof of Stake (PoS), Appchains, Binance Labs Portfolio",cartesi,64033451,74513618.0,42233.96435070837,42097.19209920411,0.13,7838334.0
Binance,"Ethereum Ecosystem, Telegram Apps, Binance HODLer Airdrops",banana-gun,64300979,155885398.0,130099.1868663212,111912.52856786227,0.05,101132150.0
Binance,"Polkadot Ecosystem, Real World Assets (RWA), Coinbase Ventures Portfolio, Circle Ventures Portfolio, Galaxy Digital Portfolio, RWA Protocol",centrifuge,63444126,69529630.0,,,N/A,1160289.0
Binance,"Smart Contract Platform, Layer 1 (L1), Proof of Work (PoW), Made in USA",quai-network,63055851,392545912.0,,,N/A,6698142.0
Binance,,ark,62977461,63523762.0,52647.30341319564,60361.80547744714,0.03,7670073.0
Binance,"Smart Contract Platform, Layer 2 (L2), Made in USA",metal,62602701,62602701.0,39497.281580714494,33007.48471010023,0.13,485201.0
Binance,"SocialFi, Solana Ecosystem",access-protocol,61611355,133761296.0,,,N/A,1058947.0
Binance,"Artificial Intelligence (AI), Solana Ecosystem, Polygon Ecosystem, Gnosis Chain Ecosystem, Arbitrum Ecosystem, Celo Ecosystem, Ethereum Ecosystem, Optimism Ecosystem, Base Ecosystem, AI Agents, Mode Ecosystem, AI Agent Launchpad, Binance Alpha Spotlight, AI Framework, DeFAI",autonolas,60841027,177962333.0,,,N/A,290124.0
Binance,"Infrastructure, Smart Contract Platform",ardor,60538727,60538727.0,32299.218736829258,31709.738675388,0.05,5870361.0
Binance,"Stablecoins, USD Stablecoin, Ethereum Ecosystem, Fiat-backed Stablecoin",binance-usd,60411862,60411862.0,,,N/A,3922.12
Binance,"Artificial Intelligence (AI), Infrastructure, Gaming (GameFi), NFT, Solana Ecosystem, Arbitrum Ecosystem, Impossible Finance Launchpad, Ethereum Ecosystem, Animoca Brands Portfolio, Base Ecosystem",carv,60425052,301989114.0,,,N/A,8208894.0
Binance,"Exchange-based Tokens, BNB Chain Ecosystem, Centralized Exchange (CEX) Token, Polygon Ecosystem, Ethereum Ecosystem",bit2me,60452913,61063548.0,,,N/A,78880.0
Binance,"Gaming (GameFi), Ethereum Ecosystem, Telegram Apps, Gaming Platform",gamebuild,60415183,76054277.0,,,N/A,15385065.0
