Binance,"Decentralized Exchange (DEX), Exchange-based Tokens, Decentralized Finance (DeFi), Automated Market Maker (AMM), BNB Chain Ecosystem, Derivatives, Perpetuals, Centralized Exchange (CEX) Token, Solana Ecosystem, Avalanche Ecosystem, Polygon Ecosystem, Near Protocol Ecosystem, Fantom Ecosystem, Arbitrum Ecosystem, Ethereum Ecosystem, ZkSync Ecosystem, Mantle Ecosystem, Linea Ecosystem, Base Ecosystem, DragonFly Capital Portfolio, Binance Labs Portfolio",woo-network,157995153,188163461.0,62207.09854602492,90880.45034028952,0.12,11925767.0
Binance,"Oracle, Ethereum Ecosystem",redstone-oracles,157509631,562534396.0,134301.12090251484,234540.75750390236,0.07,89680004.0
Binance,"Internet of Things (IOT), Oracle, NFT, Metaverse, Ethereum Ecosystem, DePIN, Alleged SEC Securities, Made in USA",xyo-network,156264660,156264660.0,,,N/A,12292295.0
Binance,"Decentralized Finance (DeFi), Derivatives, Perpetuals, Avalanche Ecosystem, Arbitrum Ecosystem",gmx,155472965,155472965.0,32135.041443749687,80522.46698066955,0.06,23237031.0
Binance,"Smart Contract Platform, EthereumPoW Ecosystem, Proof of Work (PoW)",ethereum-pow-iou,155500643,155500643.0,,,N/A,7522364.0
Binance,"Meme, Ethereum Ecosystem, Frog-Themed, AI Meme",turbo,154713779,154713779.0,16384.352217484837,9096.496408713221,0.12,39437376.0
Binance,"Smart Contract Platform, Gaming (GameFi), Layer 1 (L1), Ethereum Ecosystem, Modular Blockchain, Account Abstraction, Multicoin Capital Portfolio, Gaming Blockchains, Gaming Utility Token, Skale Ecosystem, Consensys Portfolio, Galaxy Digital Portfolio, Made in USA",skale,154734887,162775824.0,55347.096864298444,78227.0609254852,0.04,17236748.0
Binance,"Smart Contract Platform, BNB Chain Ecosystem, Layer 1 (L1), Ethereum Ecosystem, ZetaChain Ecosystem, Cross-chain Communication, Made in USA",zetachain,154446316,443298177.0,,,N/A,10682932.0
Binance,"Stablecoins, Ethereum Ecosystem, Crypto-backed Stablecoin",elixir-staked-deusd,153188175,153188175.0,,,N/A,2083638.0
Binance,"BNB Chain Ecosystem, Binance Alpha Spotlight",bnb48-club-token,152612165,152612165.0,,,N/A,242655.0
Binance,"SocialFi, Arbitrum Ecosystem",uxlink,152019580,449496097.0,,,N/A,22239373.0
Binance,BNB Chain Ecosystem,acet-token,151333614,197435865.0,,,N/A,927651.0
Binance,"Gaming (GameFi), NFT, Solana Ecosystem, Animoca Brands Portfolio, FTX Holdings, Multicoin Capital Portfolio, Alameda Research Portfolio",metaplex,150953527,193434619.0,,,N/A,5375417.0
Binance,Smart Contract Platform,bitkub-coin,150852957,186762243.0,,,N/A,437552.0
Binance,"Smart Contract Platform, Layer 1 (L1), Proof of Stake (PoS), GMCI Layer 1 Index, GMCI Index, Made in USA",casper-network,150887156,156217528.0,,,N/A,4826407.0
Binance,"Smart Contract Platform, Layer 1 (L1), Real World Assets (RWA), RWA Protocol",polymesh,150490503,150490503.0,188036.81795079788,188644.01054499886,0.08,2157089.0
Binance,"Payment Solutions, Made in USA, Directed Acyclic Graph (DAG)",nano,150423324,150423324.0,24066.139238194934,35965.46236318399,0.09,7420778.0
Binance,"Exchange-based Tokens, Decentralized Finance (DeFi), Ethereum Ecosystem, Real World Assets (RWA), Alleged SEC Securities",lcx,149997882,151434192.0,,,N/A,2119564.0
Binance,"Smart Contract Platform, Masternodes, Zero Knowledge (ZK), Proof of Work (PoW), Made in USA",zencash,148324615,148324615.0,150676.79703686992,147542.3830019767,0.11,16474427.0
Binance,"BNB Chain Ecosystem, Binance-Peg Tokens",binance-peg-sol,147460206,147460206.0,,,N/A,4386549.0
Binance,"Decentralized Finance (DeFi), Derivatives, Prediction Markets, Solana Ecosystem",drift-protocol,145633786,504795282.0,,,N/A,44544788.0
Binance,"NFT, Solana Ecosystem, NFT Marketplace, Paradigm Portfolio, Sequoia Capital Portfolio",magic-eden,145619387,1091799601.0,163190.38060375373,163749.15975796586,0.09,16627223.0
Binance,"Smart Contract Platform, Crypto-Backed Tokens, Wrapped-Tokens, Layer 2 (L2), Mantle Ecosystem",wrapped-ether-mantle-bridge,145236256,145236256.0,,,N/A,5743402.0
Binance,"Decentralized Exchange (DEX), Decentralized Finance (DeFi), Yield Farming, Automated Market Maker (AMM), BNB Chain Ecosystem, Seigniorage, Solana Ecosystem, Avalanche Ecosystem, Polygon Ecosystem, Fantom Ecosystem, Harmony Ecosystem, Arbitrum Ecosystem, Moonriver Ecosystem, Ethereum Ecosystem, Liquid Staking Governance Tokens, Curve Ecosystem, Stablecoin Protocol, Polygon zkEVM Ecosystem, Evmos Ecosystem, Fraxtal Ecosystem, GMCI DeFi Index, Liquid Staking, GMCI Index, Made in USA",frax-share,144712507,163491086.0,23732.150815597885,108023.86701799858,0.06,39478586.0
Binance,"Smart Contract Platform, DWF Labs Portfolio, Proof of Stake (PoS)",waves,144450009,144450009.0,,,N/A,13460780.0
Binance,"Crypto-Backed Tokens, BNB Chain Ecosystem, Wrapped-Tokens, Ethereum Ecosystem",wrapped-beacon-eth,144809780,144809780.0,4618454.825700173,14566426.080829324,0.02,13137242.0
Binance,"Internet of Things (IOT), Smart Contract Platform, Layer 1 (L1), Proof of Work (PoW), Made in USA",digibyte,142997616,143016271.0,23674.07455775187,66844.07982653296,0.12,5095981.0
Binance,"Stablecoins, Ethereum Ecosystem, XRP Ledger Ecosystem, Fiat-backed Stablecoin, Made in USA",ripple-usd,141509851,141509851.0,,,N/A,30398623.0
Binance,"Gaming (GameFi), Play To Earn, Telegram Apps, TON Ecosystem, Tap to Earn, Arcade Games",hamster-kombat,141144036,219252872.0,84147.68356299515,102598.01410331854,0.05,26197946.0
Binance,"Stablecoins, EUR Stablecoin, Solana Ecosystem, Avalanche Ecosystem, Ethereum Ecosystem, Base Ecosystem, Stellar Ecosystem",euro-coin,139699417,139699417.0,,,N/A,51277292.0
Binance,"Smart Contract Platform, Layer 1 (L1), Harmony Ecosystem, Animoca Brands Portfolio, Binance Launchpad, Binance Labs Portfolio, Made in USA",harmony,139114497,148730856.0,81862.84849676234,116956.34163812688,0.09,13027554.0
Binance,"Binance Launchpool, Solana Ecosystem, Ethereum Ecosystem, Decentralized Science (DeSci)",bio-protocol,138884485,284478882.0,4133.003462421576,18551.6933756567,0.06,15740514.0
Binance,"Tokenized Assets, Tokenized Gold, Real World Assets (RWA), Tokenized Commodities",kinesis-gold,138334011,138334011.0,,,N/A,147128234.0
Binance,"Alleged SEC Securities, Osmosis Ecosystem, DeFiance Capital Portfolio, Pantera Capital Portfolio, Binance Labs Portfolio, Delphi Ventures Portfolio, Galaxy Digital Portfolio, OKX Ventures Portfolio",terra-luna-2,138094156,216585298.0,131489.0017983947,185751.79178429506,0.05,19283513.0
Binance,"Gaming (GameFi), NFT, BNB Chain Ecosystem, Solana Ecosystem, Polygon Ecosystem, Play To Earn, Move To Earn, Ethereum Ecosystem, Binance Launchpad, Gaming Governance Token, Sports Games, Alameda Research Portfolio, Binance Labs Portfolio, Sequoia Capital Portfolio",stepn,137685266,257549408.0,248519.31825360173,184925.3099999988,0.2,25866695.0
Binance,"Crypto-Backed Tokens, Wrapped-Tokens, Avalanche Ecosystem",wrapped-avax,136927901,136927901.0,,,N/A,18003543.0
Binance,"Smart Contract Platform, Layer 1 (L1), Kadena Ecosystem, Multicoin Capital Portfolio, Proof of Work (PoW), Made in USA",kadena,137014496,137142081.0,61088.29407126572,140497.75134705938,0.05,5902503.0
Binance,"Gaming (GameFi), Polkadot Ecosystem, NFT, Ethereum Ecosystem, Gaming Blockchains, Andreessen Horowitz (a16z) Portfolio, Binance Labs Portfolio, Galaxy Digital Portfolio, Made in USA",mythos,135808280,174842410.0,,,N/A,4271209.0
Binance,"Decentralized Finance (DeFi), Analytics, DeFi Index, Base Ecosystem",mag7-ssi,134837691,134837691.0,,,N/A,1744271.0
Binance,"Stablecoins, EUR Stablecoin, Polygon Ecosystem, Ethereum Ecosystem, Real World Assets (RWA), Fiat-backed Stablecoin",stasis-eurs,134153187,134153187.0,,,N/A,229877.0
Binance,"Smart Contract Platform, Base Ecosystem, Gaming Blockchains",b3,133058660,624903585.0,,,N/A,22151329.0
Binance,"Smart Contract Platform, Masternodes, Proof of Stake (PoS), Made in China",ontology,132975360,145694831.0,62904.57299788089,78787.9846028086,0.07,6305918.0
Binance,"BNB Chain Ecosystem, Arbitrum Ecosystem, Cardano Ecosystem, Ethereum Ecosystem, DePIN, Base Ecosystem, DWF Labs Portfolio",world-mobile-token,131499720,379959991.0,,,N/A,16514725.0
Binance,"Liquid Staking Tokens, Aptos Ecosystem, Liquid Staking",amnis-aptos,131126098,131153877.0,,,N/A,99393.0
Binance,"Decentralized Exchange (DEX), Smart Contract Platform, Exchange-based Tokens, Decentralized Finance (DeFi), Arbitrum Ecosystem, Ethereum Ecosystem, Layer 2 (L2), Zero Knowledge (ZK), Loopring Ecosystem, Rollup, Energi Ecosystem",loopring,131238446,144708061.0,4458.174854787433,10649.813415025224,0.08,13699145.0
Binance,"Solana Ecosystem, Meme, Solana Meme, Murad Picks",gigachad-2,130810548,130810548.0,,,N/A,13311865.0
Binance,"Stablecoins, USD Stablecoin, Solana Ecosystem, Fiat-backed Stablecoin",global-dollar,130276536,130276536.0,,,N/A,1308847.0
Binance,"Smart Contract Platform, SocialFi, NFT, BNB Chain Ecosystem, Binance Launchpool, Ethereum Ecosystem, Decentralized Identifier (DID), Zero Knowledge (ZK), DWF Labs Portfolio, Coinbase Ventures Portfolio, Multicoin Capital Portfolio, Alameda Research Portfolio, DragonFly Capital Portfolio, Binance Labs Portfolio, Quest-to-Earn",project-galaxy,130164897,203781728.0,,,N/A,76240.0
Binance,"Cronos Ecosystem, Bridged USDC, Bridged-Tokens, Bridged Stablecoins",cronos-bridged-usdc-cronos,129296686,129296686.0,,,N/A,1654231.0
Binance,"Tokenized Assets, Real World Assets (RWA), Tokenized Silver, Tokenized Commodities",kinesis-silver,129179738,129179738.0,,,N/A,2524595.0
Binance,"BNB Chain Ecosystem, Harmony Ecosystem, Ethereum Ecosystem, Alameda Research Portfolio, Binance Labs Portfolio",swipe,126867337,126919260.0,81925.24595583056,96791.17493616378,0.1,4975112.0
Binance,"Smart Contract Platform, BNB Chain Ecosystem, Ethereum Ecosystem, Zero Knowledge (ZK), Animoca Brands Portfolio, Binance Labs Portfolio, OKX Ventures Portfolio",polyhedra-network,123028160,2037447087.0,,,N/A,7483031.0
Binance,"Artificial Intelligence (AI), Binance Launchpool, Solana Ecosystem, DePIN, Animoca Brands Portfolio, Multicoin Capital Portfolio, Delphi Ventures Portfolio, OKX Ventures Portfolio, Made in USA",io,122692434,665664933.0,5302.1653792601865,9719.801722487144,0.12,26986228.0
Binance,"Decentralized Finance (DeFi), Insurance, Ethereum Ecosystem",nxm,122672700,122669079.0,,,N/A,0.0
Binance,"BNB Chain Ecosystem, Tron Ecosystem",global-commercial-business,122811691,122811691.0,,,N/A,191024.0
Binance,"Tokenized Assets, Polygon Ecosystem, Arbitrum Ecosystem, Ethereum Ecosystem, Real World Assets (RWA), Starknet Ecosystem, Tokenized Treasury Bills (T-Bills)",eutbl,122515778,122515778.0,,,N/A,0.0
Binance,"Polygon Ecosystem, Bridged DAI, Bridged-Tokens, Bridged Stablecoins",polygon-pos-bridged-dai-polygon-pos,122121724,122121724.0,,,N/A,3508722.0
Binance,"Decentralized Exchange (DEX), Decentralized Finance (DeFi), Gnosis Chain Ecosystem, MEV Protection, Arbitrum Ecosystem, Ethereum Ecosystem, Intent, Delphi Ventures Portfolio, Blockchain Capital Portfolio",cow-protocol,121962867,294147916.0,57243.30269411627,210257.059556349,0.07,27279369.0
Binance,"Smart Contract Platform, Proof of Stake (PoS), Sequoia Capital Portfolio",iostoken,121364826,121364826.0,56213.5228796413,225901.54999711644,0.02,167989300.0
Binance,"Business Services, Decentralized Finance (DeFi), Oracle, Fantom Ecosystem, Ethereum Ecosystem, Binance Launchpad, Osmosis Ecosystem, Energi Ecosystem, Binance Labs Portfolio, Sequoia Capital Portfolio",band-protocol,121069480,122858664.0,58797.53379168241,87444.61526191261,0.13,10786035.0
Binance,"Artificial Intelligence (AI), Smart Contract Platform, BNB Chain Ecosystem, Solana Ecosystem, Layer 1 (L1), Polygon Ecosystem, Ethereum Ecosystem, DWF Labs Portfolio, Injective Ecosystem, OKX Ventures Portfolio",zignaly,119747346,166025529.0,,,N/A,3569349.0
Binance,"Decentralized Exchange (DEX), Exchange-based Tokens, Decentralized Finance (DeFi), Yield Farming, Automated Market Maker (AMM), BNB Chain Ecosystem, Yearn Ecosystem, Solana Ecosystem, Avalanche Ecosystem, Polygon Ecosystem, Near Protocol Ecosystem, Fantom Ecosystem, Harmony Ecosystem, Arbitrum Ecosystem, Celo Ecosystem, Ethereum Ecosystem, Base Ecosystem, Alameda Research Portfolio, Pantera Capital Portfolio, Energi Ecosystem, Sora Ecosystem, Blockchain Capital Portfolio",sushi,119782896,174394925.0,133403.8501980402,209285.8770820718,0.16,44201136.0
Binance,"Arbitrum Ecosystem, Ethereum Ecosystem",reserve-protocol-eth-plus,118743186,118743186.0,,,N/A,1094711.0
Binance,"Smart Contract Platform, Ethereum Ecosystem, Zero Knowledge (ZK), Alleged SEC Securities, Privacy Blockchain",coti,118326800,132038390.0,35495.33762223476,44000.42235721578,0.02,11842906.0
Binance,"Decentralized Finance (DeFi), Derivatives, Synthetic Issuer, Ethereum Ecosystem, Synthetic",stp-network,117869474,117869474.0,72186.55705877497,81909.49950432303,0.05,39002587.0
Binance,"Exchange-based Tokens, BNB Chain Ecosystem, Centralized Exchange (CEX) Token",nkyc-token,117702006,117702006.0,,,N/A,239684.0
Binance,"Arbitrum Ecosystem, Ethereum Ecosystem, Account Abstraction, Coinbase Ventures Portfolio, Binance Labs Portfolio, Consensys Portfolio, Outlier Ventures Portfolio",biconomy,116892381,124894488.0,52557.213870979474,111918.2431395707,0.08,15444755.0
Binance,"Stablecoins, Ethereum Ecosystem, Base Ecosystem, Blast Ecosystem, Fiat-backed Stablecoin",anzen-usdz,116102770,116102770.0,,,N/A,244573.0
Binance,"Smart Contract Platform, SocialFi, Layer 1 (L1), Gaming Blockchains",hive,116071914,,91794.09414823445,85680.7774193072,0.04,5665676.0
Binance,"Decentralized Finance (DeFi), Ethereum Ecosystem, Real World Assets (RWA), Coinbase Ventures Portfolio, Stablecoin Protocol, Binance Labs Portfolio, Galaxy Digital Portfolio",usual,115964680,127424687.0,30993.84187822551,24906.146462346318,0.16,16389561.0
Binance,"Solana Ecosystem, Polygon Ecosystem, Ethereum Ecosystem",m2-global-wealth-limited-mmx,114568600,367562158.0,,,N/A,86371.0
Binance,"BNB Chain Ecosystem, Ethereum Ecosystem, Payment Solutions, DWF Labs Portfolio",alchemy-pay,114619866,231850787.0,116028.78041410766,112665.87918503587,0.09,29657090.0
Binance,"Decentralized Finance (DeFi), Yield Farming, Lending/Borrowing Protocols, Ethereum Ecosystem, Real World Assets (RWA), Base Ecosystem, Binance Alpha Spotlight",syrup,114056586,183025219.0,,,N/A,9498964.0
Binance,"Exchange-based Tokens, NFT, BNB Chain Ecosystem, Ethereum Ecosystem",swftcoin,113404702,113404702.0,,,N/A,3531800.0
Binance,"Meme, Ethereum Ecosystem, Dog-Themed",neiro-3,113315896,113315896.0,247011.38182312503,243138.54486883277,0.01,78999003.0
Binance,"Smart Contract Platform, BNB Chain Ecosystem, Ethereum Ecosystem, Layer 2 (L2)",prometeus,113092759,119289622.0,51519.04967948501,50976.89208695957,0.05,3607643.0
Binance,"Smart Contract Platform, BNB Chain Ecosystem, Layer 1 (L1), Ethereum Ecosystem, Decentralized Identifier (DID), Base Ecosystem, Gravity Alpha Ecosystem",g-token,111589277,185141278.0,152289.9840758406,139078.55771944651,0.06,19198717.0
Binance,"Big Data, Business Services, Infrastructure, Decentralized Finance (DeFi), Solana Ecosystem, FTX Holdings, DWF Labs Portfolio, Name Service",bonfida,111485728,112508228.0,22868.8434335894,97004.23165992556,0.02,13034470.0
Binance,"Business Services, Infrastructure, Smart Contract Platform, Decentralized Finance (DeFi), Polygon Ecosystem, Arbitrum Ecosystem, Ethereum Ecosystem, Liquid Staking Governance Tokens, Coinbase Ventures Portfolio, Proof of Stake (PoS), Index Coop Defi Index, Consensys Portfolio, Liquid Staking, Index Coop Index",rocket-pool,111310584,111310584.0,48205.41423753361,66439.05540073037,0.19,9364388.0
Binance,"Artificial Intelligence (AI), Smart Contract Platform, Layer 1 (L1), Proof of Work (PoW)",qubic-network,111244133,133048644.0,,,N/A,2341790.0
Binance,"Smart Contract Platform, Layer 1 (L1), Zero Knowledge (ZK)",ozone-chain,110296661,152038967.0,,,N/A,218972.0
Binance,"Arbitrum Ecosystem, Bridged USDC, Bridged-Tokens, Bridged Stablecoins",usd-coin-ethereum-bridged,109857068,109857068.0,,,N/A,35673201.0
Binance,"Smart Contract Platform, Cross-chain Communication, Pantera Capital Portfolio",icon,108274830,109513373.0,68142.64819655515,45328.44681844325,0.1,2333477.0
Binance,"BNB Chain Ecosystem, Liquid Staking Tokens",astherus-staked-bnb,108033864,108033864.0,,,N/A,241.21
Binance,"Music, NFT, Ethereum Ecosystem, Coinbase Ventures Portfolio, Multicoin Capital Portfolio, Pantera Capital Portfolio, Energi Ecosystem, Binance Labs Portfolio",audius,107779430,107779430.0,33920.75979749211,71178.29932739596,0.12,19939450.0
Binance,"Tokenized Real Estate, Tokenized Assets, Gnosis Chain Ecosystem, RealT Tokens, Real World Assets (RWA), RWA Protocol",realtoken-ecosystem-governance,107685766,751997426.0,,,N/A,1558.12
Binance,"Decentralized Exchange (DEX), Decentralized Finance (DeFi), BNB Chain Ecosystem, Wallets, XRP Ledger Ecosystem",solo-coin,107233828,107233828.0,,,N/A,5361314.0
Binance,"Smart Contract Platform, BNB Chain Ecosystem, Ethereum Ecosystem, DWF Labs Portfolio, Made in USA",proton,106957462,118554892.0,,,N/A,5136470.0
Binance,"Decentralized Finance (DeFi), Ethereum Ecosystem, Morpho Ecosystem",steakhouse-usdc-morpho-vault,106195654,106195654.0,,,N/A,0.0
Binance,"Smart Contract Platform, Decentralized Finance (DeFi), Binance Launchpool, Derivatives, Perpetuals, Ethereum Ecosystem, Layer 2 (L2), DragonFly Capital Portfolio, Pantera Capital Portfolio",aevo-exchange,105973763,117335858.0,1427.3879602279426,7692.789541640915,0.17,18562834.0
Binance,"Solana Ecosystem, Multicoin Capital Portfolio, Stablecoin Protocol, Alameda Research Portfolio, DeFiance Capital Portfolio",uxd-protocol-token,105862877,105862877.0,,,N/A,34.72
Binance,"Lending/Borrowing Protocols, Ethereum Ecosystem, Paradigm Portfolio, Coinbase Ventures Portfolio",euler,105477740,153443983.0,,,N/A,6317514.0
Binance,"Smart Contract Platform, Ethereum Ecosystem, Metis Ecosystem, Layer 2 (L2), DWF Labs Portfolio, Rollup, GMCI Layer 2 Index, OKX Ventures Portfolio, GMCI Index",metis-token,105319113,168366881.0,85313.73667756509,151603.94056835,0.06,7013903.0
Binance,"Decentralized Finance (DeFi), BNB Chain Ecosystem, Real World Assets (RWA), DWF Labs Portfolio, Stellar Ecosystem",velo,105470164,342505114.0,,,N/A,24120464.0
Binance,"Stablecoins, BNB Chain Ecosystem",astherus-usdf,104884008,104884008.0,,,N/A,694419.0
Binance,"Gaming (GameFi), NFT, Metaverse, Play To Earn, Ethereum Ecosystem, Animoca Brands Portfolio, RPG, Gaming Governance Token, Adventure Games, Energi Ecosystem, Delphi Ventures Portfolio",illuvium,104713538,134955367.0,52805.4875504877,78797.63031022313,0.07,20762829.0
Binance,"Solana Ecosystem, Meme, Solana Meme, PolitiFi, Made in USA",melania-meme,104108335,694054996.0,,,N/A,25895230.0
Binance,"NFT, Meme, Arbitrum Ecosystem, Ethereum Ecosystem, Anime-Themed, Binance HODLer Airdrops, Airdropped Tokens by NFT Projects",anime,103447490,186775364.0,14812.540248709172,25007.15519534265,0.29,17263405.0
Binance,"Polygon Ecosystem, Arbitrum Ecosystem, Ethereum Ecosystem, Optimism Ecosystem, Bridge Governance Tokens, Cross-chain Communication, Intent, Boba Network Ecosystem, Blockchain Capital Portfolio, Made in USA",across-protocol,102697764,254224807.0,139155.2934749634,176805.36030415483,0.04,28963548.0
Binance,"Artificial Intelligence (AI), Base Ecosystem, AI Agents, AI Applications, Made in USA",venice-token,102373794,244034986.0,,,N/A,8654343.0
Binance,"Big Data, Infrastructure, Storage, Cardano Ecosystem, DePIN",iagon,101867737,270910109.0,,,N/A,557780.0
Binance,"NFT, Binance Launchpool, Meme, Ethereum Ecosystem, Binance Labs Portfolio, GMCI Meme Index, GMCI Index",memecoin-2,101668683,171362019.0,78053.21472621552,148793.89775358213,0.04,17744798.0
Binance,"Artificial Intelligence (AI), Smart Contract Platform, Masternodes, DePIN, Proof of Work (PoW), Made in USA",zelcash,101574912,101602957.0,36469.999668266806,54395.62149594993,0.04,8708099.0
Binance,"Business Services, Decentralized Finance (DeFi), Oracle, Derivatives, Synthetic Issuer, Avalanche Ecosystem, Ethereum Ecosystem, Blockchain Capital Portfolio, Synthetic, Made in USA",uma,101181030,146007994.0,15832.164166495982,10895.33026934153,0.05,11294487.0
Binance,"NFT, BNB Chain Ecosystem, Ethereum Ecosystem, Binance Launchpad, DWF Labs Portfolio, Binance Labs Portfolio",space-id,100267171,465022791.0,81913.3181797125,137042.3536063296,0.04,24086220.0
Binance,"Stablecoins, LP Tokens, Ethereum Ecosystem",resolv-rlp,100023582,100023582.0,,,N/A,635910.0
Binance,"Bridged USDT, QL1 Ecosystem, Bridged-Tokens, Bridged Stablecoins",qusdt,100001849,100001849.0,,,N/A,26772.0
Binance,"Infrastructure, Solana Ecosystem, Animoca Brands Portfolio, Cross-chain Communication, OKX Ventures Portfolio",zeus-network,99350066,259549278.0,,,N/A,13070345.0
Binance,"Solana Ecosystem, Liquid Staking Tokens, Liquid Staked SOL, Liquid Staking",drift-staked-sol,98958656,98958656.0,,,N/A,29890.0
Binance,"Decentralized Exchange (DEX), Decentralized Finance (DeFi), Automated Market Maker (AMM), Ethereum Ecosystem, Cronos Ecosystem",vvs-finance,98886900,193331318.0,,,N/A,234887.0
Binance,"Decentralized Finance (DeFi), Yield Farming, Avalanche Ecosystem, Fantom Ecosystem, Arbitrum Ecosystem, Olympus Pro Ecosystem, Ethereum Ecosystem, Stablecoin Protocol",spell-token,100476391,124194457.0,83159.80186589324,89152.9310892014,0.03,16873765.0
Binance,"Solana Ecosystem, Meme, Base Ecosystem, AI Meme, AI Agents, Virtuals Protocol Ecosystem, Binance Alpha Spotlight, DeFAI",aixbt,98502364,115124939.0,139847.0050540641,187178.87664177088,0.09,65483154.0
Binance,"Smart Contract Platform, Polkadot Ecosystem, Binance Launchpool, Layer 2 (L2), Manta Network Ecosystem, Multicoin Capital Portfolio, Alameda Research Portfolio, DeFiance Capital Portfolio, Binance Labs Portfolio",manta-network,97994564,257683752.0,128235.24685086009,155920.89122643898,0.39,32696479.0
Binance,"Solana Ecosystem, Meme, Frog-Themed, Solana Meme, GMCI Meme Index, GMCI Index",book-of-meme,97826389,97826389.0,26782.14897866439,40660.41734146528,0.19,49242481.0
Binance,"Artificial Intelligence (AI), Infrastructure, Smart Contract Platform, Oracle, Polkadot Ecosystem, Ethereum Ecosystem, Interoperability, Layer 2 (L2), Zero Knowledge (ZK), DePIN, DWF Labs Portfolio, Rollup, AI Agents, Sora Ecosystem, AI Framework, Made in USA",pha,97681692,124525373.0,3174.619879027493,5399.388102507641,0.44,26246187.0
Binance,"Crypto-Backed Tokens, Decentralized Finance (DeFi), Compound Tokens, cToken, Ethereum Ecosystem",compound-ether,97290897,97290897.0,,,N/A,68.2
Binance,"Smart Contract Platform, Ethereum Ecosystem, Layer 2 (L2), Optimism Superchain Ecosystem, Outlier Ventures Portfolio, Lisk Ecosystem",lisk,97052254,225257942.0,104599.29542764851,65085.67384195112,0.18,13042498.0
Binance,"Software as a service, Ethereum Ecosystem, Energi Ecosystem",status,96735467,166210071.0,95202.06679958066,100493.67268063509,0.08,7222962.0
Binance,"Meme, PulseChain Ecosystem",the-grays-currency,96890315,96890315.0,,,N/A,796436.0
Binance,"Infrastructure, Smart Contract Platform, Oracle, Layer 1 (L1), Animoca Brands Portfolio, Coinbase Ventures Portfolio, Cross-chain Communication, Made in USA",supra,96527009,858266364.0,,,N/A,15253115.0
Binance,"Gaming (GameFi), NFT, BNB Chain Ecosystem",infinitar-governance-token,96004094,475458441.0,,,N/A,8597896.0
Binance,"Smart Contract Platform, BNB Chain Ecosystem, Binance Launchpool, Ethereum Ecosystem, Layer 2 (L2), Restaking, Rollups-as-a-Service (RaaS), Rollup, Binance Labs Portfolio",altlayer,96317577,344975280.0,86851.71007061795,110900.4745272331,0.03,15985371.0
Binance,"XDC Ecosystem, Telos Ecosystem",ecoin-2,95498064,207099463.0,,,N/A,5.24
Binance,"Infrastructure, Smart Contract Platform, Ethereum Ecosystem, Data Availability, Modular Blockchain",avail,95529553,489263708.0,,,N/A,5539601.0
Binance,"Smart Contract Platform, Layer 1 (L1), Zero Knowledge (ZK), Andreessen Horowitz (a16z) Portfolio, Privacy Blockchain, Made in USA",aleo,95348963,467192984.0,,,N/A,6908810.0
Binance,"Gaming (GameFi), NFT, Kaia Ecosystem, Gaming Blockchains",bora,93795035,98107451.0,,,N/A,212253.0
Binance,"Solana Ecosystem, Payment Solutions, Viction Ecosystem",saros-finance,94642548,360543064.0,,,N/A,730377.0
Binance,"Fraxtal Ecosystem, Bridged-Tokens",l2-standard-bridged-frxusd,94451431,94451431.0,,,N/A,715072.0
Binance,"Solana Ecosystem, Liquid Staking Tokens, Restaking, Liquid Restaking Tokens, Liquid Staked SOL, Liquid Staking, Liquid Restaked SOL",solayer-staked-sol,94204618,94204618.0,,,N/A,570467.0
Binance,"NFT, Polygon Ecosystem, Ethereum Ecosystem, Optimism Ecosystem",blockv,94190952,94190952.0,,,N/A,164522.0
Binance,"Smart Contract Platform, Privacy, Layer 1 (L1), Proof of Stake (PoS), Proof of Work (PoW), Zano Ecosystem, Privacy Blockchain",zano,93467230,93472727.0,,,N/A,634203.0
Binance,Layer 1 (L1),oec-token,93323380,93323380.0,,,N/A,375986.0
Binance,"Artificial Intelligence (AI), Big Data, Media, BNB Chain Ecosystem, Polygon Ecosystem, Ethereum Ecosystem, GMCI DePIN Index, Galaxy Digital Portfolio, GMCI Index",everipedia,92670098,92670098.0,75623.42269673332,38267.21407413656,0.05,5401457.0
Binance,"Energy, Ethereum Ecosystem, Alleged SEC Securities, Energi Ecosystem, GMCI DePIN Index, Blockchain Capital Portfolio, GMCI Index",power-ledger,91790376,173181661.0,55552.18998071092,105189.73132351397,0.06,8769418.0
Binance,"DaoMaker Launchpad, Ethereum Ecosystem, Real World Assets (RWA), Sequoia Capital Portfolio, Made in USA",clearpool,91732500,120709242.0,,,N/A,4676434.0
Binance,"Ethereum Ecosystem, DWF Labs Portfolio",adventure-gold,90688264,90688264.0,69629.07019265484,74812.42147894308,0.1,25144513.0
