Bitget,"Decentralized Finance (DeFi), Ethereum Ecosystem, Restaking, Liquid Restaking Tokens, Liquid Staking",ether-fi-staked-btc,272777661.0,272777661.0,,,N/A,2410076.0
Bitget,"Liquid Staking Tokens, Ethereum Ecosystem, Liquid Staking",stader-ethx,271837334.0,271837334.0,,,N/A,6120.77
Bitget,"Decentralized Exchange (DEX), Exchange-based Tokens, Decentralized Finance (DeFi), Automated Market Maker (AMM), BNB Chain Ecosystem, Avalanche Ecosystem, Polygon Ecosystem, Near Protocol Ecosystem, Harmony Ecosystem, Ethereum Ecosystem, FTX Holdings, Alameda Research Portfolio, DragonFly Capital Portfolio, Pantera Capital Portfolio, Energi Ecosystem, YZi Labs (Prev. Binance Labs) Portfolio, GMCI DeFi Index, Galaxy Digital Portfolio, Blockchain Capital Portfolio, Dex Aggregator, GMCI Index, Coinbase 50 Index",1inch,271209969.0,295194718.0,88806.32640162534,131844.92382276146,0.05,18804227.0
Bitget,"Smart Contract Platform, Oracle, Layer 1 (L1), Ethereum Ecosystem, Mantle Ecosystem, Cross-chain Communication, Consensys Portfolio",entangle,271290346.0,380532950.0,,,N/A,14205.87
Bitget,"Smart Contract Platform, Polkadot Ecosystem, Proof of Stake (PoS), Pantera Capital Portfolio, Made in USA, Coinbase 50 Index",kusama,267455232.0,267455575.0,60558.0854033726,67672.6122998908,0.06,11024320.0
Bitget,"Crypto-Backed Tokens, Wrapped-Tokens, Polygon Ecosystem, Arbitrum Ecosystem, Liquid Staking Tokens, Ethereum Ecosystem, Optimism Ecosystem, Base Ecosystem, Liquid Staked ETH, Liquid Staking",coinbase-wrapped-staked-eth,266267172.0,782984756.0,,,N/A,8839453.0
Bitget,"Artificial Intelligence (AI), Ethereum Ecosystem, DePIN, Energi Ecosystem, GMCI DePIN Index, GMCI Index",golem,263001853.0,263001853.0,51572.16659207193,50942.63740202482,0.04,12828266.0
Bitget,"Stablecoins, Tokenized Assets, Tokenized Gold, BNB Chain Ecosystem, Real World Assets (RWA), Tokenized Commodities, Commodity-backed Stablecoin",quorium,262074995.0,262074995.0,,,N/A,90946.0
Bitget,"BNB Chain Ecosystem, Wallets, Ethereum Ecosystem, Animoca Brands Portfolio, Binance Launchpad, Energi Ecosystem, YZi Labs (Prev. Binance Labs) Portfolio",safepal,262209625.0,262209625.0,71471.9765179473,74733.7829495514,0.08,7465383.0
Bitget,"Decentralized Exchange (DEX), Exchange-based Tokens, Decentralized Finance (DeFi), Yield Farming, Derivatives, Synthetic Issuer, Avalanche Ecosystem, Polygon Ecosystem, Near Protocol Ecosystem, Fantom Ecosystem, Harmony Ecosystem, Ethereum Ecosystem, Optimism Ecosystem, Base Ecosystem, DWF Labs Portfolio, Paradigm Portfolio, Coinbase Ventures Portfolio, Index Coop Defi Index, Energi Ecosystem, Huobi ECO Chain Ecosystem, GMCI DeFi Index, Synthetic, Index Coop Index, GMCI Index, Coinbase 50 Index",havven,260069656.0,260394207.0,139075.43146976715,169175.04293688817,0.26,28190926.0
Bitget,"Artificial Intelligence (AI), Analytics, Base Ecosystem, Binance HODLer Airdrops",kaito,258730820.0,1071842291.0,224394.7437098225,198892.86743142325,0.07,43585806.0
Bitget,"Arbitrum Ecosystem, Liquid Staking Tokens, Ethereum Ecosystem, Liquid Staking",sweth,252325238.0,252332273.0,,,N/A,114858.0
Bitget,"Solana Ecosystem, Meme, Dog-Themed, Solana Meme, Cat-Themed",cat-in-a-dogs-world,250250511.0,250250511.0,73703.06807125054,133328.9561779867,0.07,124640748.0
Bitget,"Gaming (GameFi), NFT, Collectibles, Polygon Ecosystem, Ethereum Ecosystem, Animoca Brands Portfolio, Gaming Blockchains, Made in USA",superfarm,250583852.0,554762522.0,81969.27112699047,65289.266549821645,0.18,23335405.0
Bitget,"Meme, Cardano Ecosystem",snek,249933590.0,253123504.0,13398.435543475893,22060.49733414831,0.03,1065222.0
Bitget,"Smart Contract Platform, Layer 2 (L2), Zero Knowledge (ZK), ZkSync Ecosystem, Consensys Portfolio, Blockchain Capital Portfolio, OKX Ventures Portfolio",zksync,249532363.0,1425899218.0,174716.26394018505,148476.15056587034,0.15,25866724.0
Bitget,"NFT, Ethereum Ecosystem, NFT Marketplace, FTX Holdings, NFTFi, eGirl Capital Portfolio, Paradigm Portfolio, GMCI DeFi Index, GMCI Index, Made in USA, Coinbase 50 Index",blur,246527532.0,325573982.0,135681.61284465814,153351.110555904,0.09,24458491.0
Bitget,"Stablecoins, Ethereum Ecosystem, XRP Ledger Ecosystem, Fiat-backed Stablecoin, Made in USA",ripple-usd,243608087.0,243608087.0,,,N/A,59567405.0
Bitget,"Infrastructure, Smart Contract Platform, Venom Ecosystem",venom,242944981.0,856460338.0,,,N/A,453502.0
Bitget,"Smart Contract Platform, DePIN, Proof of Stake (PoS), Made in USA",theta-fuel,242702896.0,242744638.0,,,N/A,2549821.0
Bitget,"Solana Ecosystem, Arbitrum Ecosystem, Ethereum Ecosystem, Interoperability, Base Ecosystem, Multicoin Capital Portfolio, Cross-chain Communication, Made in USA",wormhole,242521739.0,826909404.0,492916.847266098,762011.2502450376,0.12,36699273.0
Bitget,"Solana Ecosystem, Arbitrum Ecosystem, Impossible Finance Launchpad, Ethereum Ecosystem, DePIN, Animoca Brands Portfolio",aethir,242030212.0,1286853228.0,277436.1295052129,221438.9310716063,0.07,17950019.0
Bitget,"Decentralized Finance (DeFi), BNB Chain Ecosystem, Polygon Ecosystem, Fantom Ecosystem, Arbitrum Ecosystem, Moonbeam Ecosystem, Liquid Staking Tokens, Ethereum Ecosystem, Optimism Ecosystem, Polygon zkEVM Ecosystem, Liquid Staking, Made in USA",frax-ether,239028014.0,239028014.0,,,N/A,1833660.0
Bitget,"Crypto-Backed Tokens, Decentralized Finance (DeFi), cToken, Ethereum Ecosystem",compound-wrapped-btc,237346755.0,237346755.0,,,N/A,0.0
Bitget,"Gaming (GameFi), Binance Launchpool, Meme, Play To Earn, TON Ecosystem, TON Meme, Tap to Earn",notcoin,235926409.0,235926409.0,238104.15927297136,329551.9960770866,0.04,30122161.0
Bitget,"Infrastructure, Ethereum Ecosystem, Data Availability, Restaking, Polychain Capital Portfolio, Made in USA",eigenlayer,232156553.0,1629533060.0,429722.1288797639,441523.00124094257,0.11,28234110.0
Bitget,"Smart Contract Platform, BNB Chain Ecosystem, GMCI Layer 1 Index, GMCI Index, Made in China",zilliqa,231653018.0,239674905.0,127197.45956249257,145452.71223170697,0.09,14159810.0
Bitget,"Smart Contract Platform, BNB Chain Ecosystem, Layer 1 (L1), Ethereum Ecosystem, ZetaChain Ecosystem, Cross-chain Communication, Made in USA, Chain Abstraction",zetachain,229980441.0,618954930.0,52745.971662033946,103162.24835468631,0.1,46817689.0
Bitget,"Smart Contract Platform, Privacy, Proof of Work (PoW)",mimblewimblecoin,229768055.0,229768704.0,,,N/A,163985.0
Bitget,"Smart Contract Platform, Polkadot Ecosystem, Layer 1 (L1), Ethereum Ecosystem, Layer 2 (L2), Alameda Research Portfolio, YZi Labs (Prev. Binance Labs) Portfolio, OKX Ventures Portfolio",astar,228616685.0,251328356.0,99171.02710237936,97140.80167888306,0.33,6640190.0
Bitget,"BNB Chain Ecosystem, Polygon Ecosystem, Ethereum Ecosystem, Animoca Brands Portfolio, DWF Labs Portfolio, Alameda Research Portfolio, Energi Ecosystem, YZi Labs (Prev. Binance Labs) Portfolio",mask-network,230198280.0,230198280.0,58082.972892739795,83026.15205643595,0.09,185228766.0
Bitget,"Artificial Intelligence (AI), Solana Ecosystem, Meme, Solana Meme, AI Meme, AI Agents, Binance Alpha Spotlight, AI Framework, Made in USA",ai16z,227955587.0,227955587.0,201488.12382075933,259586.84822137654,0.05,87213924.0
Bitget,"Decentralized Exchange (DEX), Exchange-based Tokens, Decentralized Finance (DeFi), Derivatives, Perpetuals, Ethereum Ecosystem, Paradigm Portfolio",dydx,226321899.0,226321899.0,133481.39787412286,278800.25611847296,0.1,14089792.0
Bitget,"Solana Ecosystem, Meme, Cat-Themed",meow,223726391.0,223726391.0,,,N/A,40010.0
Bitget,"Smart Contract Platform, Interoperability, Layer 2 (L2), Rollup, Multicoin Capital Portfolio, Proof of Work (PoW), DragonFly Capital Portfolio, Sequoia Capital Portfolio, Blockchain Capital Portfolio, Polychain Capital Portfolio, Made in China",nervos-network,222812116.0,226351997.0,2749.6522509628207,3181.648460826983,0.21,13759283.0
Bitget,"Smart Contract Platform, Gaming (GameFi), NFT, Layer 1 (L1), Play To Earn, Gaming Blockchains, WEMIX Ecosystem",wemix-token,221637655.0,284880964.0,4250.777718282127,3706.082665818073,0.19,1867100.0
Bitget,"Solana Ecosystem, Payment Solutions, Viction Ecosystem",saros-finance,219804733.0,837351421.0,2877.7118154299465,2742.258258401384,0.1,2064481.0
Bitget,"Smart Contract Platform, Gaming (GameFi), Ethereum Ecosystem, Base Ecosystem, Card Games, Paradigm Portfolio, Gaming Blockchains, Gaming Utility Token",echelon-prime,217597475.0,417295174.0,49412.0628405064,57933.081096211565,0.19,13570669.0
Bitget,"Analytics, Avalanche Ecosystem, Meme, Cat-Themed, Made in USA",ket,214535692.0,214535692.0,,,N/A,6837218.0
Bitget,"Decentralized Finance (DeFi), Aptos Ecosystem",abtc,214388796.0,214388796.0,,,N/A,331176.0
Bitget,"Solana Ecosystem, Avalanche Ecosystem, Polygon Ecosystem, Near Protocol Ecosystem, Harmony Ecosystem, Ethereum Ecosystem, Pantera Capital Portfolio, Energi Ecosystem, Made in USA",basic-attention-token,213693414.0,214312297.0,101062.74425002083,110853.84786413546,0.35,15684727.0
Bitget,"Crypto-Backed Tokens, Wrapped-Tokens, Avalanche Ecosystem",wrapped-avax,213494391.0,213494391.0,,,N/A,30036757.0
Bitget,"Stablecoins, USD Stablecoin, Arbitrum Ecosystem, Ethereum Ecosystem, Base Ecosystem, Crypto-backed Stablecoin, Fiat-backed Stablecoin",gho,213065968.0,213066687.0,,,N/A,13387322.0
Bitget,"Stablecoins, Ethereum Ecosystem",usda-2,211811765.0,212291157.0,,,N/A,1595987.0
Bitget,"Decentralized Exchange (DEX), Decentralized Finance (DeFi), Avalanche Ecosystem, Harmony Ecosystem, Ethereum Ecosystem, Coinbase Ventures Portfolio, Pantera Capital Portfolio, Energi Ecosystem, GMCI DeFi Index, Blockchain Capital Portfolio, GMCI Index, Made in USA",0x,211466866.0,249254741.0,128825.92732585176,164083.46338551145,0.04,32665850.0
Bitget,"Meme, Cronos Ecosystem, AI Meme, Cronos zkEVM Ecosystem",agentfun-ai,210237970.0,210237970.0,,,N/A,11176.35
Bitget,"Smart Contract Platform, Proof of Stake (PoS), Made in China",qtum,210855563.0,215324249.0,64320.21463587389,86906.14069557513,0.15,16280588.0
Bitget,"BNB Chain Ecosystem, Binance Alpha Spotlight",bnb48-club-token,211388840.0,211388840.0,,,N/A,349905.0
Bitget,"Liquid Staking Tokens, Ethereum Ecosystem, Base Ecosystem, Liquid Staked ETH, Liquid Staking",liquid-staked-ethereum,209654048.0,209654048.0,,,N/A,216682.0
Bitget,"Decentralized Exchange (DEX), BNB Chain Ecosystem, Solana Ecosystem, Ethereum Ecosystem, Real World Assets (RWA), Base Ecosystem, RWA Protocol",chex-token,205933404.0,205933404.0,,,N/A,1613404.0
Bitget,"Gaming (GameFi), BNB Chain Ecosystem, Solana Ecosystem, Meme, Ethereum Ecosystem, Dog-Themed, Solana Meme, Gaming Utility Token",baby-doge-coin,205937132.0,522732600.0,96660.96670877692,119346.74603652822,0.08,12609794.0
Bitget,"Artificial Intelligence (AI), Exchange-based Tokens, Analytics, Derivatives, Perpetuals, Centralized Exchange (CEX) Token, Ethereum Ecosystem, Binance Launchpad, Coinbase Ventures Portfolio, YZi Labs (Prev. Binance Labs) Portfolio, Made in USA",arkham,204971998.0,528589794.0,427126.0945818292,433161.62140696705,0.19,67131816.0
Bitget,"Layer 1 (L1), VeChain Ecosystem",vethor-token,205416341.0,205570731.0,47877.107037672286,59698.76614044822,0.04,4366465.0
Bitget,"Stablecoins, USD Stablecoin, Ethereum Ecosystem, Fiat-backed Stablecoin",elixir-deusd,201906127.0,201906127.0,973762.0643570609,791240.1706733891,0.02,8388112.0
Bitget,"Smart Contract Platform, BNB Chain Ecosystem, Layer 1 (L1), Proof of Stake (PoS), Pantera Capital Portfolio, Andreessen Horowitz (a16z) Portfolio, YZi Labs (Prev. Binance Labs) Portfolio, Blockchain Capital Portfolio, Privacy Blockchain, Polychain Capital Portfolio, Coinbase 50 Index",oasis-network,201094101.0,298811590.0,76248.32348740922,97921.41772195608,0.1,10342100.0
Bitget,"Solana Ecosystem, Ethereum Ecosystem, Energi Ecosystem",swissborg,202079925.0,202079925.0,,,N/A,293388.0
Bitget,"Exchange-based Tokens, Ethereum Ecosystem",btse-token,199376394.0,246050287.0,,,N/A,1461091.0
Bitget,"Artificial Intelligence (AI), Harmony Ecosystem, Arbitrum Ecosystem, Ethereum Ecosystem, DePIN, Coinbase Ventures Portfolio, Multicoin Capital Portfolio, Pantera Capital Portfolio, GMCI DePIN Index, GMCI Index, Coinbase 50 Index",livepeer,196795939.0,196795939.0,98884.92201627928,82904.66330343617,0.1,20667615.0
Bitget,"Solana Ecosystem, Meme, Solana Meme, Cat-Themed, Murad Picks",popcat,195765177.0,195765177.0,,,N/A,48740334.0
Bitget,"Smart Contract Platform, Privacy, Layer 1 (L1), Proof of Stake (PoS), Proof of Work (PoW), Blockchain Capital Portfolio, Made in USA",decred,194745505.0,194756177.0,,,N/A,2580759.0
Bitget,"Decentralized Finance (DeFi), Yield Farming, BNB Chain Ecosystem, Avalanche Ecosystem, Polygon Ecosystem, Fantom Ecosystem, Arbitrum Ecosystem, Ethereum Ecosystem, Optimism Ecosystem, Linea Ecosystem, Bridge Governance Tokens, Base Ecosystem, FTX Holdings",stargate-finance,195271487.0,201007285.0,85070.8476779337,78896.85257719348,0.3,6460647.0
Bitget,"Smart Contract Platform, Layer 1 (L1), Celo Ecosystem, DWF Labs Portfolio, Coinbase Ventures Portfolio, Proof of Stake (PoS), Andreessen Horowitz (a16z) Portfolio, Optimism Superchain Ecosystem, Outlier Ventures Portfolio, Made in USA",celo,195008025.0,343349139.0,107332.89215929077,218195.36893946616,0.2,25973568.0
Bitget,"Gaming (GameFi), Ethereum Ecosystem, Decentralized Identifier (DID), Animoca Brands Portfolio, OKX Ventures Portfolio, Outlier Ventures Portfolio",mocaverse,193317439.0,791272953.0,52729.46966443168,18222.40034837331,0.07,66634068.0
Bitget,"Tourism, BNB Chain Ecosystem",trip,188566140.0,626423109.0,,,N/A,3193.08
Bitget,"Decentralized Exchange (DEX), Decentralized Finance (DeFi), Automated Market Maker (AMM), Cosmos Ecosystem, Osmosis Ecosystem, Paradigm Portfolio, Proof of Stake (PoS), Evmos Ecosystem, Secret Ecosystem, GMCI DeFi Index, GMCI Index, Made in USA",osmosis,189092420.0,262290196.0,74648.0374290956,78942.96477769216,0.11,6661531.0
Bitget,"Stablecoins, USD Stablecoin, Solana Ecosystem, Fiat-backed Stablecoin",global-dollar,188972630.0,188972630.0,,,N/A,3516262.0
Bitget,Unknown,holotoken,,,,,N/A,
Bitget,Unknown,vana,,,,,N/A,
Bitget,Unknown,origintrail,,,,,N/A,
Bitget,Unknown,staked-frax-ether,,,,,N/A,
Bitget,Unknown,instadapp,,,,,N/A,
Bitget,Unknown,benqi-liquid-staked-avax,,,,,N/A,
Bitget,Unknown,convex-finance,,,,,N/A,
Bitget,Unknown,ankr,,,,,N/A,
Bitget,Unknown,gigachad-2,,,,,N/A,
Bitget,Unknown,ordinals,,,,,N/A,
Bitget,Unknown,iotex,,,,,N/A,
Bitget,Unknown,frax-share,,,,,N/A,
Bitget,Unknown,apf-coin,,,,,N/A,
Bitget,"Infrastructure, Decentralized Finance (DeFi), Sui Ecosystem",deep,,,,,N/A,
Bitget,"Smart Contract Platform, Storage, DePIN, Paradigm Portfolio, Proof of Work (PoW), DragonFly Capital Portfolio, Made in USA",siacoin,173996801.0,186188859.0,,,N/A,18227198.0
Bitget,"Artificial Intelligence (AI), Meme, Base Ecosystem, AI Agents, Binance Alpha Spotlight, AI Framework",freysa-ai,173279780.0,173279780.0,,,N/A,935339.0
Bitget,"BNB Chain Ecosystem, Meme, AI Meme",ai-companions,171691166.0,171691166.0,,,N/A,5345774.0
Bitget,"Solana Ecosystem, Meme, Solana Meme, Pump.fun Ecosystem, Zoo-Themed, Memorial Themed",peanut-the-squirrel,172459251.0,172459251.0,587780.384841963,725961.0561056033,0.06,200928696.0
Bitget,"Smart Contract Platform, Real World Assets (RWA), Proof of Work (PoW), Made in USA",ravencoin,170710591.0,170747186.0,,,N/A,8444407.0
Bitget,"Infrastructure, Smart Contract Platform, BNB Chain Ecosystem, Layer 1 (L1), Ethereum Ecosystem, GMCI Layer 1 Index, Aelf Ecosystem, GMCI Index",aelf,170623736.0,229953560.0,56773.563185785184,63488.4542646037,0.26,13235762.0
Bitget,"Decentralized Finance (DeFi), Derivatives, Prediction Markets, Solana Ecosystem",drift-protocol,170498077.0,581869588.0,285017.3914821675,331660.5707127364,0.07,23228772.0
Bitget,"Decentralized Exchange (DEX), Exchange-based Tokens, Ethereum Ecosystem",coinex-token,170504153.0,170504192.0,,,N/A,111601.0
Bitget,"Starknet Ecosystem, Bridged-Tokens",bridged-wrapped-ether-starkgate,170375004.0,170375398.0,,,N/A,1413880.0
Bitget,"Meme, Ethereum Ecosystem, Base Ecosystem, Cat-Themed, Murad Picks",mog-coin,170926785.0,170926785.0,29551.44430564822,30458.835403637782,0.07,11338306.0
Bitget,Arbitrum Ecosystem,rcge,168805259.0,168805259.0,,,N/A,2.43
Bitget,"Decentralized Finance (DeFi), Yield Farming, Yield Aggregator, Yearn Ecosystem, Avalanche Ecosystem, Polygon Ecosystem, Near Protocol Ecosystem, Gnosis Chain Ecosystem, Fantom Ecosystem, Harmony Ecosystem, Arbitrum Ecosystem, Ethereum Ecosystem, Optimism Ecosystem, Base Ecosystem, Index Coop Defi Index, Alameda Research Portfolio, Energi Ecosystem, Sora Ecosystem, Huobi ECO Chain Ecosystem, Blockchain Capital Portfolio, Index Coop Index",yearn-finance,168056592.0,182366366.0,88699.2923882735,80574.66014746497,0.24,22017235.0
Bitget,"Solana Ecosystem, Meme, Dog-Themed, Solana Meme, Bitcoin Ecosystem, Runes",dog-go-to-the-moon-rune,166516983.0,166516983.0,13222.951179636955,15835.724398413884,0.3,8670278.0
Bitget,"Smart Contract Platform, Layer 1 (L1), Real World Assets (RWA), RWA Protocol",polymesh,164927016.0,164927016.0,93410.28902466822,77010.42768060793,0.21,7177140.0
Bitget,"Decentralized Finance (DeFi), Liquid Staking Tokens, Ethereum Ecosystem, Liquid Staked ETH, Liquid Staking",treehouse-eth,164277300.0,164277300.0,,,N/A,108797.0
Bitget,"Smart Contract Platform, Layer 1 (L1), DePIN, Andreessen Horowitz (a16z) Portfolio, Made in USA",chia,163893015.0,371291823.0,,,N/A,4124964.0
Bitget,"Gaming (GameFi), BNB Chain Ecosystem, Ethereum Ecosystem, TON Ecosystem",gmt-token,162311784.0,162311784.0,8334.895495012604,8319.919512357958,0.43,14272517.0
Bitget,"Infrastructure, Smart Contract Platform, NEO Ecosystem",gas,162458602.0,162458602.0,77958.19823735031,52641.81187817038,0.16,6146488.0
Bitget,"Smart Contract Platform, Layer 1 (L1), Harmony Ecosystem, Animoca Brands Portfolio, Binance Launchpad, YZi Labs (Prev. Binance Labs) Portfolio, Made in USA",harmony,162242020.0,162797086.0,144435.38366124986,131646.04787950934,0.18,10102768.0
Bitget,"Decentralized Finance (DeFi), Tron Ecosystem",sun-token,162397472.0,328671363.0,108482.48117856625,248912.3696467092,0.24,33633255.0
Bitget,"Decentralized Finance (DeFi), Solana Ecosystem, Ethereum Ecosystem, Optimism Ecosystem, Base Ecosystem, Cross-chain Communication, BTCfi",threshold-network-token,158273942.0,174334904.0,46269.14842773321,67994.08653318559,0.19,6868506.0
Bitget,"Smart Contract Platform, Layer 1 (L1), Base Ecosystem, Layer 0 (L0), Made in USA, Directed Acyclic Graph (DAG)",constellation-labs,157099619.0,157099732.0,,,N/A,2855936.0
Bitget,"Gambling (GambleFi), Gaming (GameFi), Ethereum Ecosystem",rollbit-coin,155638866.0,155638866.0,,,N/A,1019448.0
Bitget,"Gaming (GameFi), NFT, Solana Ecosystem, Animoca Brands Portfolio, FTX Holdings, Multicoin Capital Portfolio, Alameda Research Portfolio",metaplex,153777616.0,196848180.0,,,N/A,15463937.0
Bitget,"Decentralized Finance (DeFi), Ethereum Ecosystem, Stablecoin Protocol",tribe-2,153386710.0,337102141.0,,,N/A,59170.0
Bitget,"Stablecoins, EUR Stablecoin, Solana Ecosystem, Avalanche Ecosystem, Ethereum Ecosystem, Base Ecosystem, Stellar Ecosystem",euro-coin,153467670.0,153467670.0,,,N/A,25526689.0
Bitget,"Smart Contract Platform, EthereumPoW Ecosystem, Proof of Work (PoW)",ethereum-pow-iou,151965795.0,151965795.0,22822.532007466096,37631.160586330174,0.14,7555776.0
Bitget,"Internet of Things (IOT), Smart Contract Platform, Layer 1 (L1), Proof of Work (PoW), Made in USA",digibyte,151910034.0,151917878.0,,,N/A,5608916.0
Bitget,"Entertainment, Smart Contract Platform, Gaming (GameFi), NFT, Metaverse, Layer 1 (L1), Harmony Ecosystem, Ethereum Ecosystem, Gaming Blockchains, Energi Ecosystem",enjincoin,151091317.0,156011849.0,68034.85643417896,88251.24409068053,0.24,15181282.0
Bitget,"BRC-20, Bitcoin Ecosystem, Inscriptions",sats-ordinals,150206038.0,150206038.0,85460.90195550732,93201.36140022782,0.14,25979484.0
Bitget,"Decentralized Exchange (DEX), Exchange-based Tokens, Decentralized Finance (DeFi), Automated Market Maker (AMM), BNB Chain Ecosystem, Derivatives, Perpetuals, Centralized Exchange (CEX) Token, Solana Ecosystem, Avalanche Ecosystem, Polygon Ecosystem, Near Protocol Ecosystem, Fantom Ecosystem, Arbitrum Ecosystem, Ethereum Ecosystem, ZkSync Ecosystem, Mantle Ecosystem, Linea Ecosystem, Base Ecosystem, DragonFly Capital Portfolio, YZi Labs (Prev. Binance Labs) Portfolio",woo-network,150491098.0,174019204.0,51561.94395278959,49394.208050217814,0.13,10984746.0
Bitget,"Gaming (GameFi), Play To Earn, Telegram Apps, TON Ecosystem, Tap to Earn, Arcade Games",hamster-kombat,149413130.0,232098066.0,147318.55793060514,171201.47938312462,0.04,43893318.0
Bitget,"Smart Contract Platform, Masternodes, Zero Knowledge (ZK), Proof of Work (PoW), Made in USA",zencash,147107471.0,147109633.0,187216.35263833494,179123.8264704342,0.11,14972348.0
Bitget,"Solana Ecosystem, Liquid Staking Tokens, Liquid Staked SOL, Liquid Staking",drift-staked-sol,146236893.0,146236893.0,,,N/A,148680.0
Bitget,,nem,145966476.0,145966476.0,3083.4419458633397,10110.081583518368,0.31,16554571.0
Bitget,"SocialFi, Arbitrum Ecosystem",uxlink,145843038.0,431233111.0,68990.84616327439,85432.55673755587,0.07,14912353.0
Bitget,"Smart Contract Platform, Crypto-Backed Tokens, Wrapped-Tokens, Layer 2 (L2), Mantle Ecosystem",wrapped-ether-mantle-bridge,145297829.0,145297829.0,,,N/A,2790183.0
Bitget,"Oracle, Ethereum Ecosystem",redstone-oracles,145065527.0,518091167.0,206044.0995263524,219513.72531023237,0.15,30029758.0
Bitget,"Crypto-Backed Tokens, BNB Chain Ecosystem, Wrapped-Tokens, Ethereum Ecosystem",wrapped-beacon-eth,144751110.0,144751110.0,,,N/A,7699525.0
Bitget,"Stablecoins, Tokenized Assets, Tokenized Gold, Real World Assets (RWA), Tokenized Commodities",kinesis-gold,143990782.0,143990782.0,,,N/A,19836134.0
Bitget,"Stablecoins, BNB Chain Ecosystem",astherus-usdf,143710573.0,144237521.0,,,N/A,2155484.0
Bitget,"Solana Ecosystem, DePIN, Multicoin Capital Portfolio, Made in USA",hivemapper,143554722.0,223114151.0,,,N/A,808468.0
Bitget,"Decentralized Finance (DeFi), Solana Ecosystem, Liquid Staking Tokens, Liquid Staked SOL, Liquid Staking",bybit-staked-sol,143182664.0,143182664.0,,,N/A,1213859.0
Bitget,"BNB Chain Ecosystem, Binance-Peg Tokens",binance-peg-sol,142172367.0,142172367.0,,,N/A,3837915.0
Bitget,"Exchange-based Tokens, Decentralized Finance (DeFi), Ethereum Ecosystem, Real World Assets (RWA), Alleged SEC Securities",lcx,140391772.0,141736098.0,,,N/A,833998.0
Bitget,Smart Contract Platform,bitkub-coin,141766169.0,175512420.0,6970.820194982961,10073.419398790857,1.06,408116.0
Bitget,"Tokenized Assets, Polygon Ecosystem, Arbitrum Ecosystem, Ethereum Ecosystem, Real World Assets (RWA), Starknet Ecosystem, Tokenized Treasury Bills (T-Bills)",eutbl,139524007.0,139524007.0,,,N/A,0.0
Bitget,"Meme, Ethereum Ecosystem, Frog-Themed, AI Meme",turbo,138952163.0,138952163.0,70269.45770575372,72363.31189368121,0.05,16338786.0
Bitget,"Decentralized Finance (DeFi), BNB Chain Ecosystem, Liquid Staking Tokens, Sui Ecosystem, Liquid Staking",lorenzo-stbtc,139144033.0,139144033.0,,,N/A,543.49
Bitget,"Internet of Things (IOT), Oracle, NFT, Metaverse, Ethereum Ecosystem, DePIN, Alleged SEC Securities, Made in USA",xyo-network,137940388.0,137940388.0,,,N/A,5933024.0
Bitget,"Polygon Ecosystem, Bridged DAI, Bridged-Tokens, Bridged Stablecoins",polygon-pos-bridged-dai-polygon-pos,138085941.0,138085941.0,,,N/A,9844793.0
Bitget,"Decentralized Finance (DeFi), Binance Launchpool, Arbitrum Ecosystem, Ethereum Ecosystem, Restaking, Liquid Restaking Governance Tokens, Ether.fi Ecosystem, Consensys Portfolio, OKX Ventures Portfolio",ether-fi,137614681.0,600550125.0,77099.25757289279,105108.05917793664,0.07,52448154.0
Bitget,"Smart Contract Platform, BNB Chain Ecosystem, Ethereum Ecosystem, Zero Knowledge (ZK), Animoca Brands Portfolio, YZi Labs (Prev. Binance Labs) Portfolio, OKX Ventures Portfolio",polyhedra-network,137788291.0,2281886956.0,259096.08045185258,254583.41923913045,0.09,4193086.0
Bitget,"NFT, Solana Ecosystem, NFT Marketplace, Paradigm Portfolio, Sequoia Capital Portfolio",magic-eden,137032673.0,1027747332.0,210309.4808638825,222405.34491972416,0.1,15508398.0
Bitget,"Gaming (GameFi), NFT, BNB Chain Ecosystem, Solana Ecosystem, Polygon Ecosystem, Play To Earn, Move To Earn, Ethereum Ecosystem, Binance Launchpad, Gaming Governance Token, Sports Games, Alameda Research Portfolio, YZi Labs (Prev. Binance Labs) Portfolio, Sequoia Capital Portfolio",stepn,136343074.0,254573633.0,191383.22631797346,174810.9266360562,0.2,25441190.0
Bitget,"Liquid Staking Tokens, Aptos Ecosystem, Liquid Staking",amnis-aptos,136147142.0,136175984.0,,,N/A,837782.0
Bitget,BNB Chain Ecosystem,acet-token,135110507.0,176270553.0,,,N/A,1204506.0
Bitget,"Stablecoins, EUR Stablecoin, Polygon Ecosystem, Ethereum Ecosystem, Real World Assets (RWA), Fiat-backed Stablecoin",stasis-eurs,134197947.0,134197947.0,,,N/A,83371.0
Bitget,"Smart Contract Platform, Masternodes, Proof of Stake (PoS), Made in China",ontology,133667582.0,146292980.0,62170.01212980682,59147.39673852201,0.2,7342899.0
Bitget,"Smart Contract Platform, Gaming (GameFi), Layer 1 (L1), Ethereum Ecosystem, Modular Blockchain, Account Abstraction, Multicoin Capital Portfolio, Gaming Blockchains, Gaming Utility Token, Skale Ecosystem, Consensys Portfolio, Galaxy Digital Portfolio, Made in USA",skale,133417252.0,140350399.0,77156.982964096,76612.2310478153,0.09,23191141.0
Bitget,"BNB Chain Ecosystem, Arbitrum Ecosystem, Cardano Ecosystem, Ethereum Ecosystem, DePIN, Base Ecosystem, DWF Labs Portfolio",world-mobile-token,132823922.0,375329323.0,,,N/A,14140589.0
Bitget,"Smart Contract Platform, Ethereum Ecosystem, Zero Knowledge (ZK), Alleged SEC Securities, Privacy Blockchain",coti,131822428.0,147097878.0,99055.59796321344,84461.2950546159,0.16,20730808.0
