Bitget,"Alleged SEC Securities, Osmosis Ecosystem, DeFiance Capital Portfolio, Pantera Capital Portfolio, YZi Labs (Prev. Binance Labs) Portfolio, Delphi Ventures Portfolio, Galaxy Digital Portfolio, OKX Ventures Portfolio",terra-luna-2,131651130.0,206480130.0,74293.11284065983,83388.80545914284,0.16,10090673.0
Bitget,"Arbitrum Ecosystem, Ethereum Ecosystem",reserve-protocol-eth-plus,131139455.0,131139455.0,,,N/A,448220.0
Bitget,"Decentralized Finance (DeFi), Analytics, DeFi Index, Base Ecosystem",mag7-ssi,130950155.0,130950155.0,,,N/A,1485841.0
Bitget,"Smart Contract Platform, Layer 1 (L1), Kadena Ecosystem, Multicoin Capital Portfolio, Proof of Work (PoW), Made in USA",kadena,130453609.0,130456457.0,79189.67946766599,91081.72590991987,0.26,6409420.0
Bitget,"Stablecoins, Tokenized Assets, Real World Assets (RWA), Tokenized Silver, Tokenized Commodities",kinesis-silver,130272076.0,130272076.0,,,N/A,191141.0
Bitget,"Cronos Ecosystem, Bridged USDC, Bridged-Tokens, Bridged Stablecoins",cronos-bridged-usdc-cronos,130299381.0,130299381.0,,,N/A,1163388.0
Bitget,"Decentralized Finance (DeFi), Oracle, Ethereum Ecosystem, DWF Labs Portfolio, Pantera Capital Portfolio",api3,129106424.0,161297550.0,218655.01768917893,209982.45775717648,0.18,85002342.0
Bitget,"Smart Contract Platform, Layer 1 (L1), Proof of Stake (PoS), GMCI Layer 1 Index, GMCI Index, Made in USA",casper-network,127585223.0,132092411.0,8797.19070165217,11116.235008476096,0.2,4942383.0
Bitget,"Decentralized Exchange (DEX), Smart Contract Platform, Exchange-based Tokens, Decentralized Finance (DeFi), Arbitrum Ecosystem, Ethereum Ecosystem, Layer 2 (L2), Zero Knowledge (ZK), Loopring Ecosystem, Rollup, Energi Ecosystem",loopring,127473568.0,140556776.0,86696.3766297666,104871.46626512289,0.1,10195731.0
Bitget,"Decentralized Exchange (DEX), Decentralized Finance (DeFi), Yield Farming, Automated Market Maker (AMM), Solana Ecosystem, Coinbase Ventures Portfolio, DeFiance Capital Portfolio, Made in USA",orca,124164420.0,222610410.0,87117.73309298734,133867.05681679895,0.09,53271916.0
Bitget,"Launchpad, Meme, Base Ecosystem, Cat-Themed, Base Meme",toshi,124632952.0,124632952.0,,,N/A,9705310.0
Bitget,"Decentralized Finance (DeFi), Insurance, Ethereum Ecosystem",nxm,121430846.0,121296211.0,,,N/A,0.0
Bitget,"Binance Launchpool, Solana Ecosystem, Ethereum Ecosystem, Base Ecosystem, Decentralized Science (DeSci)",bio-protocol,124209895.0,253128194.0,102684.85278017508,105502.11025051313,0.13,19808437.0
Bitget,"Decentralized Finance (DeFi), Derivatives, Perpetuals, Avalanche Ecosystem, Arbitrum Ecosystem",gmx,123807855.0,123807855.0,106615.4270912557,106627.97059148828,0.08,10566116.0
Bitget,"Smart Contract Platform, SocialFi, NFT, BNB Chain Ecosystem, Binance Launchpool, Ethereum Ecosystem, Decentralized Identifier (DID), Zero Knowledge (ZK), DWF Labs Portfolio, Coinbase Ventures Portfolio, Multicoin Capital Portfolio, Alameda Research Portfolio, DragonFly Capital Portfolio, YZi Labs (Prev. Binance Labs) Portfolio, Quest-to-Earn",project-galaxy,123552099.0,193428957.0,,,N/A,8455.02
Bitget,"Decentralized Finance (DeFi), Ethereum Ecosystem, Morpho Ecosystem",steakhouse-usdc-morpho-vault,123171677.0,123271673.0,,,N/A,0.0
Bitget,"Decentralized Exchange (DEX), Decentralized Finance (DeFi), Automated Market Maker (AMM), Ethereum Ecosystem, Cronos Ecosystem",vvs-finance,122528421.0,239317019.0,,,N/A,275072.0
Bitget,"Smart Contract Platform, DWF Labs Portfolio, Proof of Stake (PoS)",waves,121479686.0,121479686.0,68216.4069644366,59833.035841650526,0.3,10702229.0
Bitget,"Payment Solutions, Made in USA, Directed Acyclic Graph (DAG)",nano,121070420.0,121070420.0,,,N/A,4087230.0
Bitget,"Infrastructure, Solana Ecosystem, Animoca Brands Portfolio, Cross-chain Communication, OKX Ventures Portfolio",zeus-network,120470232.0,314725091.0,,,N/A,4408700.0
Bitget,"Smart Contract Platform, Base Ecosystem, Gaming Blockchains",b3,120115029.0,564114447.0,,,N/A,9065341.0
Bitget,BNB Chain Ecosystem,bitdca,120011485.0,128871934.0,,,N/A,134325.0
Bitget,"Stablecoins, Decentralized Finance (DeFi), USD Stablecoin, BNB Chain Ecosystem, Polygon Ecosystem, Gnosis Chain Ecosystem, Arbitrum Ecosystem, Ethereum Ecosystem, Optimism Ecosystem, Base Ecosystem, Crypto-backed Stablecoin, Fiat-backed Stablecoin",crvusd,119552529.0,119552529.0,,,N/A,26085680.0
Bitget,"BNB Chain Ecosystem, Harmony Ecosystem, Ethereum Ecosystem, Alameda Research Portfolio, YZi Labs (Prev. Binance Labs) Portfolio",swipe,119572012.0,119783053.0,34226.52959279991,34345.53102048843,0.27,5516929.0
Bitget,"Stablecoins, Ethereum Ecosystem",level-usd,119361365.0,119361365.0,,,N/A,3944131.0
Bitget,"Decentralized Exchange (DEX), Exchange-based Tokens, Decentralized Finance (DeFi), Yield Farming, Automated Market Maker (AMM), BNB Chain Ecosystem, Yearn Ecosystem, Solana Ecosystem, Avalanche Ecosystem, Polygon Ecosystem, Near Protocol Ecosystem, Fantom Ecosystem, Harmony Ecosystem, Arbitrum Ecosystem, Celo Ecosystem, Ethereum Ecosystem, Base Ecosystem, Alameda Research Portfolio, Pantera Capital Portfolio, Energi Ecosystem, Sora Ecosystem, Blockchain Capital Portfolio",sushi,119083073.0,173988408.0,167769.14916541116,216446.745093577,0.16,28482683.0
Bitget,"Artificial Intelligence (AI), Smart Contract Platform, Layer 1 (L1), Proof of Work (PoW)",qubic-network,117492511.0,141375847.0,6990.077310328804,7974.771186352311,0.59,2298239.0
Bitget,"Gaming (GameFi), Polkadot Ecosystem, NFT, Ethereum Ecosystem, Gaming Blockchains, Andreessen Horowitz (a16z) Portfolio, YZi Labs (Prev. Binance Labs) Portfolio, Galaxy Digital Portfolio, Made in USA",mythos,117700548.0,149957110.0,,,N/A,1689917.0
Bitget,"Decentralized Exchange (DEX), Decentralized Finance (DeFi), Gnosis Chain Ecosystem, MEV Protection, Arbitrum Ecosystem, Ethereum Ecosystem, Intent, Delphi Ventures Portfolio, Blockchain Capital Portfolio",cow-protocol,117449943.0,282384149.0,66250.17465321228,77519.3756401984,0.04,13740470.0
Bitget,"Stablecoins, USD Stablecoin, Fiat-backed Stablecoin",falcon-finance,117401530.0,117401530.0,,,N/A,303226.0
Bitget,"Stablecoins, Ethereum Ecosystem, Base Ecosystem, Blast Ecosystem, Fiat-backed Stablecoin",anzen-usdz,116768735.0,116767125.0,,,N/A,296285.0
Bitget,"Business Services, Decentralized Finance (DeFi), Oracle, Fantom Ecosystem, Ethereum Ecosystem, Binance Launchpad, Osmosis Ecosystem, Energi Ecosystem, YZi Labs (Prev. Binance Labs) Portfolio, Sequoia Capital Portfolio",band-protocol,115949557.0,118249745.0,115624.83428711238,89706.86668818166,0.13,9443408.0
Bitget,"Stablecoins, Decentralized Finance (DeFi), Lending/Borrowing Protocols, Ethereum Ecosystem",syrupusdc,115948660.0,115949142.0,,,N/A,811750.0
Bitget,"Exchange-based Tokens, BNB Chain Ecosystem, Centralized Exchange (CEX) Token",nkyc-token,114485768.0,114485768.0,,,N/A,258641.0
Bitget,"Artificial Intelligence (AI), Smart Contract Platform, BNB Chain Ecosystem, Solana Ecosystem, Layer 1 (L1), Polygon Ecosystem, Ethereum Ecosystem, DWF Labs Portfolio, Injective Ecosystem, OKX Ventures Portfolio",zignaly,114312628.0,158507505.0,1397.2211548521868,2944.229750756011,0.8,1826972.0
Bitget,"Arbitrum Ecosystem, Bridged USDC, Bridged-Tokens, Bridged Stablecoins",usd-coin-ethereum-bridged,113694129.0,113694129.0,,,N/A,35299368.0
Bitget,"BNB Chain Ecosystem, Liquid Staking Tokens",astherus-staked-bnb,113557604.0,113557604.0,,,N/A,61435.0
Bitget,"Smart Contract Platform, SocialFi, Layer 1 (L1), Gaming Blockchains",hive,113382704.0,,118713.27447648309,117925.610383431,0.29,5463693.0
Bitget,"Artificial Intelligence (AI), Binance Launchpool, Solana Ecosystem, DePIN, Animoca Brands Portfolio, Multicoin Capital Portfolio, Delphi Ventures Portfolio, OKX Ventures Portfolio, Made in USA",io,112778820.0,599390964.0,379666.60152065445,513258.81180613243,0.13,23599442.0
Bitget,"Lending/Borrowing Protocols, Ethereum Ecosystem, Paradigm Portfolio, Coinbase Ventures Portfolio",euler,113061318.0,164476209.0,,,N/A,2292679.0
Bitget,"Smart Contract Platform, BNB Chain Ecosystem, Layer 1 (L1), Ethereum Ecosystem, Decentralized Identifier (DID), Base Ecosystem, Gravity Alpha Ecosystem",g-token,112763670.0,187089752.0,48585.86445810776,22406.495502438287,0.58,6510654.0
Bitget,"Decentralized Finance (DeFi), Yield Farming, Lending/Borrowing Protocols, Ethereum Ecosystem, Real World Assets (RWA), Base Ecosystem, Binance Alpha Spotlight",syrup,111056722.0,146980258.0,,,N/A,7030361.0
Bitget,"Smart Contract Platform, BNB Chain Ecosystem, Ethereum Ecosystem, Layer 2 (L2)",prometeus,110750408.0,116818924.0,46377.603274479414,53668.775581575304,0.13,2862662.0
Bitget,"Artificial Intelligence (AI), Virtual Reality, BNB Chain Ecosystem, Launchpad, Ethereum Ecosystem, Telegram Apps, Discord Bots, Base Ecosystem, PAAL AI Launchpad, AI Agents, AI Applications, AI Agent Launchpad, Binance Alpha Spotlight, AI Framework, DeFAI, Made in USA",paal-ai,110301322.0,123133943.0,,,N/A,5225235.0
Bitget,"BNB Chain Ecosystem, Ethereum Ecosystem, Payment Solutions, DWF Labs Portfolio",alchemy-pay,110310978.0,223134852.0,102432.4986622058,148804.92442790634,0.09,25284932.0
Bitget,"BNB Chain Ecosystem, Avalanche Ecosystem, Polygon Ecosystem, Arbitrum Ecosystem, Ethereum Ecosystem, Optimism Ecosystem, Base Ecosystem",vicicoin,109410591.0,192074430.0,,,N/A,131491.0
Bitget,"Arbitrum Ecosystem, Ethereum Ecosystem, Account Abstraction, Coinbase Ventures Portfolio, YZi Labs (Prev. Binance Labs) Portfolio, Consensys Portfolio, Outlier Ventures Portfolio",biconomy,109163822.0,116117835.0,100456.07719901095,90351.75678839235,0.26,12027043.0
Bitget,"Ethereum Ecosystem, Crypto-backed Stablecoin, Yield-Bearing Stablecoin",elixir-staked-deusd,108672613.0,109471576.0,,,N/A,3239421.0
Bitget,"Artificial Intelligence (AI), Ethereum Ecosystem",0x0-ai-ai-smart-contract,108417451.0,108417451.0,540.7552055601691,398.2722128487952,1.12,1099653.0
Bitget,"Infrastructure, Binance Launchpool",nillion,106431367.0,545382358.0,89149.93856543017,125377.61958937088,0.19,70814142.0
Bitget,"Solana Ecosystem, Multicoin Capital Portfolio, Stablecoin Protocol, Alameda Research Portfolio, DeFiance Capital Portfolio",uxd-protocol-token,107524060.0,107524060.0,,,N/A,254.95
Bitget,"Artificial Intelligence (AI), BNB Chain Ecosystem, Solana Ecosystem, Ethereum Ecosystem, AI Agents, Alameda Research Portfolio",delysium,106246718.0,200529349.0,,,N/A,13821779.0
Bitget,"Business Services, Decentralized Finance (DeFi), Oracle, Derivatives, Synthetic Issuer, Avalanche Ecosystem, Ethereum Ecosystem, Blockchain Capital Portfolio, Synthetic, Made in USA",uma,104629678.0,150728440.0,35290.08535005648,46102.81200605994,0.08,11144987.0
Bitget,"Smart Contract Platform, Polkadot Ecosystem, Layer 1 (L1), DePIN, Outlier Ventures Portfolio",peaq-2,103236863.0,587788511.0,61480.08025194354,60296.90095835674,0.14,12927818.0
Bitget,"Decentralized Exchange (DEX), Decentralized Finance (DeFi), BNB Chain Ecosystem, Wallets, XRP Ledger Ecosystem",solo-coin,102584811.0,102584811.0,44880.907353674615,47090.39867157895,0.37,1501969.0
Bitget,"NFT, BNB Chain Ecosystem, Solana Ecosystem, Meme, Ethereum Ecosystem, Base Ecosystem, Hybrid Token Standards, Wojak-Themed",non-playable-coin,102669043.0,102669043.0,8419.930954004092,7585.729104622106,0.47,6103976.0
Bitget,"Gaming (GameFi), NFT, Metaverse, Play To Earn, Ethereum Ecosystem, Animoca Brands Portfolio, RPG, Gaming Governance Token, Adventure Games, Energi Ecosystem, Delphi Ventures Portfolio",illuvium,102695620.0,131594557.0,43543.784189105696,35566.37244780205,0.36,19389115.0
Bitget,"Smart Contract Platform, Layer 1 (L1), Zero Knowledge (ZK)",ozone-chain,102661236.0,135823741.0,,,N/A,244300.0
Bitget,"Smart Contract Platform, BNB Chain Ecosystem, Binance Launchpool, Ethereum Ecosystem, Layer 2 (L2), Restaking, Rollups-as-a-Service (RaaS), Rollup, YZi Labs (Prev. Binance Labs) Portfolio",altlayer,101556479.0,334859075.0,62445.91830231051,90434.58224539303,0.06,12301881.0
Bitget,"Decentralized Finance (DeFi), Launchpad, Ethereum Ecosystem, DWF Labs Portfolio, Coinbase Ventures Portfolio, Pantera Capital Portfolio, Blockchain Capital Portfolio",auction,101429320.0,117599585.0,123435.48464149736,186424.71825597444,0.13,64746972.0
Bitget,"Smart Contract Platform, Ethereum Ecosystem, Metis Ecosystem, Layer 2 (L2), DWF Labs Portfolio, Rollup, GMCI Layer 2 Index, OKX Ventures Portfolio, GMCI Index",metis-token,101504463.0,161919199.0,48872.695873543205,80776.43737460668,0.06,9920771.0
Bitget,"Smart Contract Platform, Cross-chain Communication, Pantera Capital Portfolio",icon,101417715.0,102595148.0,54488.09546732342,59628.46166962208,0.21,2445328.0
Bitget,"Music, NFT, Ethereum Ecosystem, Coinbase Ventures Portfolio, Multicoin Capital Portfolio, Pantera Capital Portfolio, Energi Ecosystem, YZi Labs (Prev. Binance Labs) Portfolio",audius,99920933.0,99920933.0,50863.29023588108,76354.61001388817,0.52,9458400.0
Bitget,"Smart Contract Platform, Decentralized Finance (DeFi), Binance Launchpool, Derivatives, Perpetuals, Ethereum Ecosystem, Layer 2 (L2), DragonFly Capital Portfolio, Pantera Capital Portfolio",aevo-exchange,99853138.0,110557751.0,205310.72092414653,254065.61830169652,0.18,24451547.0
Bitget,"Bridged USDT, QL1 Ecosystem, Bridged-Tokens, Bridged Stablecoins",qusdt,100033049.0,100033049.0,,,N/A,8814.12
Bitget,"Polygon Ecosystem, XRP Ledger Ecosystem",crypto-trading-fund,97426143.0,97426143.0,,,N/A,13891.37
Bitget,"BNB Chain Ecosystem, Tron Ecosystem",global-commercial-business,96769483.0,96769483.0,,,N/A,177275.0
Bitget,"Business Services, Infrastructure, Smart Contract Platform, Decentralized Finance (DeFi), Polygon Ecosystem, Arbitrum Ecosystem, Ethereum Ecosystem, Liquid Staking Governance Tokens, Coinbase Ventures Portfolio, Proof of Stake (PoS), Index Coop Defi Index, Consensys Portfolio, Liquid Staking, Index Coop Index",rocket-pool,97579445.0,97579445.0,39788.683340677184,48702.29956529936,0.13,9232398.0
Bitget,"Polygon Ecosystem, Arbitrum Ecosystem, Ethereum Ecosystem, Optimism Ecosystem, Bridge Governance Tokens, Cross-chain Communication, Intent, Boba Network Ecosystem, Blockchain Capital Portfolio, Made in USA",across-protocol,97617541.0,239789554.0,46894.54322177358,36118.5738698845,0.17,14813777.0
Bitget,"Big Data, Business Services, Infrastructure, Decentralized Finance (DeFi), Solana Ecosystem, FTX Holdings, DWF Labs Portfolio, Name Service",bonfida,97220937.0,98112609.0,185503.10303111476,181370.00201614609,0.3,9326464.0
Bitget,"Solana Ecosystem, Meme, Base Ecosystem, AI Meme, AI Agents, Virtuals Protocol Ecosystem, Binance Alpha Spotlight, DeFAI",aixbt,96592096.0,112892308.0,137292.79974936973,149069.4508304776,0.09,49384870.0
Bitget,"NFT, Meme, Arbitrum Ecosystem, Ethereum Ecosystem, Anime-Themed, Binance HODLer Airdrops, Airdropped Tokens by NFT Projects",anime,96299211.0,173869082.0,52983.93754988455,64261.700972885876,0.57,17509010.0
Bitget,"Decentralized Finance (DeFi), Yield Farming, Avalanche Ecosystem, Fantom Ecosystem, Arbitrum Ecosystem, Olympus Pro Ecosystem, Ethereum Ecosystem, Stablecoin Protocol",spell-token,95631935.0,117829803.0,45029.44512184126,51174.92463572199,0.08,13149037.0
Bitget,"XDC Ecosystem, Telos Ecosystem",ecoin-2,95473842.0,207046934.0,,,N/A,20.79
Bitget,"Artificial Intelligence (AI), Smart Contract Platform, Masternodes, DePIN, Proof of Work (PoW), Made in USA",zelcash,95140035.0,95140838.0,48464.54366990098,51449.70217098223,0.16,10994779.0
Bitget,"Fraxtal Ecosystem, Bridged-Tokens",l2-standard-bridged-frxusd,94848150.0,94848150.0,,,N/A,1265858.0
Bitget,"Solana Ecosystem, Meme, Solana Meme, AI Meme, Pump.fun Ecosystem",act-i-the-ai-prophecy,94363424.0,94363424.0,110707.2930441972,131324.4026480465,0.1,541350754.0
Bitget,"Decentralized Finance (DeFi), DaoMaker Launchpad, Ethereum Ecosystem, Real World Assets (RWA), Sequoia Capital Portfolio, Made in USA",clearpool,94280170.0,124061677.0,9973.819133014327,10201.679892157454,0.61,4712634.0
Bitget,"Software as a service, Ethereum Ecosystem, Energi Ecosystem",status,94268721.0,161971730.0,58127.12658086153,43667.24020871905,0.13,10621002.0
Bitget,"Big Data, Analytics, Arbitrum Ecosystem, Base Ecosystem",subsquid,94235888.0,201854155.0,,,N/A,1234182.0
Bitget,"Smart Contract Platform, Polkadot Ecosystem, Binance Launchpool, Layer 2 (L2), Manta Network Ecosystem, Multicoin Capital Portfolio, Alameda Research Portfolio, DeFiance Capital Portfolio, YZi Labs (Prev. Binance Labs) Portfolio",manta-network,93506835.0,228628734.0,,,N/A,20891631.0
Bitget,Unknown,swftcoin,,,,,N/A,
Bitget,Unknown,usual,,,,,N/A,
Bitget,Unknown,oec-token,,,,,N/A,
Bitget,Unknown,lisk,,,,,N/A,
Bitget,Unknown,book-of-meme,,,,,N/A,
Bitget,Unknown,optio,,,,,N/A,
Bitget,Unknown,space-id,,,,,N/A,
Bitget,Unknown,doginme,,,,,N/A,
Bitget,"Gaming (GameFi), Polygon Ecosystem",gamebitcoin-power,,,,,N/A,
Bitget,"Decentralized Finance (DeFi), Yield Farming, BNB Chain Ecosystem, Binance Launchpool, Lending/Borrowing Protocols, Arbitrum Ecosystem, Ethereum Ecosystem, Optimism Ecosystem, ZkSync Ecosystem, opBNB Ecosystem, Unichain Ecosystem",venus,92200260.0,165023522.0,,,N/A,4396894.0
Bitget,"Crypto-Backed Tokens, Ethereum Ecosystem",temple,91355835.0,91535811.0,,,N/A,613492.0
Bitget,"Solana Ecosystem, Meme, Solana Meme, PolitiFi, Made in USA",melania-meme,91331968.0,608879198.0,60874.702251486524,42138.7767660573,0.16,16550437.0
Bitget,"NFT, Binance Launchpool, Meme, Ethereum Ecosystem, YZi Labs (Prev. Binance Labs) Portfolio, GMCI Meme Index, GMCI Index",memecoin-2,91111520.0,147351120.0,172560.40473969476,261066.29824322727,0.05,14422920.0
Bitget,"Decentralized Finance (DeFi), BNB Chain Ecosystem, Real World Assets (RWA), DWF Labs Portfolio, Stellar Ecosystem",velo,91380544.0,296750307.0,33181.60088869311,39891.27616812418,0.08,12352918.0
Bitget,"Smart Contract Platform, Proof of Stake (PoS), Sequoia Capital Portfolio",iostoken,90379586.0,90379586.0,41795.03759521912,61336.52957106159,0.15,9903795.0
Bitget,"Artificial Intelligence (AI), Oracle, Ethereum Ecosystem, DePIN, Energi Ecosystem, Sora Ecosystem, GMCI DePIN Index, GMCI Index",iexec-rlc,90138862.0,108341884.0,96424.53623187312,48024.24923011635,0.24,5909568.0
Bitget,"Business Services, Polygon Ecosystem, Ethereum Ecosystem",request-network,90057701.0,120939207.0,,,N/A,3727628.0
Bitget,"Big Data, Infrastructure, Storage, Cardano Ecosystem, DePIN",iagon,89976767.0,239286909.0,6990.704032122278,4467.970925948557,0.63,455189.0
Bitget,"Gaming (GameFi), Play To Earn, Ethereum Ecosystem, RPG, Alameda Research Portfolio, Circle Ventures Portfolio, OKX Ventures Portfolio, MMO",big-time,89685948.0,247574901.0,174745.0773570428,248822.7391048827,0.1,23664389.0
Bitget,"Smart Contract Platform, Ethereum Ecosystem, Layer 2 (L2), Zero Knowledge (ZK), Restaking, Zircuit Ecosystem",zircuit,89725069.0,408784502.0,136870.46738125887,135952.6434640085,0.07,21183312.0
Bitget,"SocialFi, BNB Chain Ecosystem",h2o-dao,89069676.0,107963244.0,,,N/A,2576.67
Bitget,"Gaming (GameFi), NFT, Kaia Ecosystem, Gaming Blockchains",bora,88928417.0,93017079.0,194.96851054881162,257.875731565673,1.95,365943.0
Bitget,"Solana Ecosystem, Polygon Ecosystem, Ethereum Ecosystem",m2-global-wealth-limited-mmx,88943344.0,282342563.0,,,N/A,35299.0
Bitget,"Smart Contract Platform, BNB Chain Ecosystem, Ethereum Ecosystem, DWF Labs Portfolio, Made in USA",proton,88601251.0,98204990.0,22733.150174631726,25294.060910287582,0.06,2974885.0
Bitget,"Artificial Intelligence (AI), Big Data, Media, BNB Chain Ecosystem, Polygon Ecosystem, Ethereum Ecosystem, GMCI DePIN Index, Galaxy Digital Portfolio, GMCI Index",everipedia,88244619.0,88244619.0,26631.28409583038,40099.7565542346,0.36,5543971.0
Bitget,"Gaming (GameFi), XDC Ecosystem, Gaming Utility Token",gama-coin,88212100.0,135710997.0,,,N/A,14411.59
Bitget,"Smart Contract Platform, Gaming (GameFi), Solana Ecosystem, Layer 2 (L2), Gaming Blockchains",sonic-svm,87732882.0,584885883.0,78333.42008215767,62327.99507691895,0.16,20632501.0
Bitget,"Cronos Ecosystem, Bridged USDT, Bridged-Tokens, Bridged Stablecoins",cronos-bridged-usdt-cronos,87942595.0,87942595.0,,,N/A,104508.0
Bitget,"Infrastructure, Smart Contract Platform, Decentralized Finance (DeFi), BNB Chain Ecosystem, Avalanche Ecosystem, Polygon Ecosystem, Fantom Ecosystem, Harmony Ecosystem, Arbitrum Ecosystem, Ethereum Ecosystem, DWF Labs Portfolio, Layer 3 (L3), Outlier Ventures Portfolio",orbs,87285414.0,191522219.0,23316.76797714756,32314.851256620226,0.21,4397836.0
Bitget,"LP Tokens, Ethereum Ecosystem",resolv-rlp,87150134.0,87150134.0,,,N/A,298568.0
Bitget,"Crypto-Backed Tokens, Decentralized Finance (DeFi), Compound Tokens, cToken, Ethereum Ecosystem",compound-ether,86781197.0,86781197.0,,,N/A,209.54
Bitget,"BNB Chain Ecosystem, Soneium Ecosystem",solv-protocol-solvbtc-jupiter,86796306.0,86796306.0,,,N/A,10538.44
Bitget,"Smart Contract Platform, Privacy, Layer 1 (L1), Proof of Stake (PoS), Proof of Work (PoW), Zano Ecosystem, Privacy Blockchain",zano,86947435.0,86948539.0,,,N/A,321974.0
Bitget,"Solana Ecosystem, Liquid Staking Tokens, Restaking, Liquid Restaking Tokens, Liquid Staked SOL, Liquid Staking, Liquid Restaked SOL",solayer-staked-sol,86391587.0,86391587.0,,,N/A,2358119.0
Bitget,"Stablecoins, USD Stablecoin, Ethereum Ecosystem, Sonic Ecosystem, Fiat-backed Stablecoin",frax-usd,86131376.0,86131376.0,,,N/A,2497666.0
Bitget,"Decentralized Exchange (DEX), Exchange-based Tokens, Decentralized Finance (DeFi), Yield Farming, Automated Market Maker (AMM), Avalanche Ecosystem, Polygon Ecosystem, Near Protocol Ecosystem, Gnosis Chain Ecosystem, Harmony Ecosystem, Arbitrum Ecosystem, Ethereum Ecosystem, Optimism Ecosystem, Base Ecosystem, Index Coop Defi Index, Alameda Research Portfolio, DeFiance Capital Portfolio, Pantera Capital Portfolio, Energi Ecosystem, Polygon zkEVM Ecosystem, Huobi ECO Chain Ecosystem, Blockchain Capital Portfolio, Index Coop Index",balancer,85936440.0,92847698.0,67967.23039850852,58871.055804025855,0.22,7873553.0
Bitget,"Smart Contract Platform, Layer 2 (L2), eGirl Capital Portfolio, Paradigm Portfolio, Blast Ecosystem",blast,85630743.0,315901989.0,66917.4290161834,56319.7512910543,0.32,7296483.0
Bitget,"Decentralized Finance (DeFi), Liquid Staking Tokens, Ethereum Ecosystem, LSDFi, Liquid Staked ETH, Liquid Staking",origin-ether,85327330.0,85327330.0,,,N/A,183900.0
Bitget,"Energy, Ethereum Ecosystem, Alleged SEC Securities, Energi Ecosystem, GMCI DePIN Index, Blockchain Capital Portfolio, GMCI Index",power-ledger,85383215.0,161093217.0,60515.349780026176,71420.22528332799,0.25,5848702.0
Bitget,"Crypto-Backed Tokens, BNB Chain Ecosystem, Arbitrum Ecosystem, Ethereum Ecosystem, Mantle Ecosystem",ignition-fbtc,85202312.0,1277020025.0,,,N/A,419424.0
Bitget,"SocialFi, Coinbase Ventures Portfolio, Pantera Capital Portfolio, Andreessen Horowitz (a16z) Portfolio, Sequoia Capital Portfolio",deso,84653673.0,86873960.0,,,N/A,1404122.0
Bitget,"Smart Contract Platform, Bitcoin Sidechains, Stacks Ecosystem, SideChain",sbtc-2,84310269.0,84310269.0,,,N/A,41032.0
Bitget,"Artificial Intelligence (AI), Infrastructure, Gaming (GameFi), NFT, Solana Ecosystem, Arbitrum Ecosystem, Impossible Finance Launchpad, Ethereum Ecosystem, Animoca Brands Portfolio, Base Ecosystem",carv,83987381.0,379139219.0,44152.03942435328,60967.72896761369,0.42,11359731.0
Bitget,"Smart Contract Platform, Layer 1 (L1), DWF Labs Portfolio, Radix Ecosystem",radix,83522743.0,102247107.0,356.7359515310805,2640.2330305950413,1.14,828821.0
Bitget,"Decentralized Finance (DeFi), Ethereum Ecosystem",relend-usdc,83557755.0,83557755.0,,,N/A,0.0
Bitget,"Artificial Intelligence (AI), Infrastructure, Smart Contract Platform, Oracle, Polkadot Ecosystem, Ethereum Ecosystem, Interoperability, Layer 2 (L2), Zero Knowledge (ZK), DePIN, DWF Labs Portfolio, Rollup, AI Agents, Sora Ecosystem, AI Framework, Made in USA",pha,83091331.0,105538717.0,17922.735803256866,18774.083993403903,0.19,19627700.0
Bitget,"Decentralized Exchange (DEX), Decentralized Finance (DeFi), Arbitrum Ecosystem, Ethereum Ecosystem",tokenlon,82834454.0,99704987.0,,,N/A,100989.0
Bitget,"Meme, Ethereum Ecosystem, Dog-Themed",neiro-3,82878662.0,82878662.0,218120.2427533554,364748.8730418813,0.1,57223154.0
Bitget,"Gaming (GameFi), NFT, BNB Chain Ecosystem, Metaverse, Collectibles, Polygon Ecosystem, Play To Earn, Harmony Ecosystem, Guild and Scholarship, Ethereum Ecosystem, Animoca Brands Portfolio, Base Ecosystem, DWF Labs Portfolio, Ronin Ecosystem, Gaming Governance Token, Andreessen Horowitz (a16z) Portfolio, Delphi Ventures Portfolio",yield-guild-games,82219059.0,190758320.0,98251.76056338598,131362.46942559796,0.05,10738297.0
Bitget,"Solana Ecosystem, Polygon Ecosystem, DePIN, Pantera Capital Portfolio",geodnet,82085004.0,256036986.0,,,N/A,531323.0
Bitget,"Artificial Intelligence (AI), Smart Contract Platform, Gaming (GameFi), NFT, BNB Chain Ecosystem, Layer 1 (L1), Ethereum Ecosystem, Modular Blockchain, Chromia Ecosystem",chromaway,82015801.0,82015801.0,61975.00421103127,57362.66040632639,0.31,9104375.0
Bitget,"Ethereum Ecosystem, DWF Labs Portfolio",adventure-gold,81207234.0,81207234.0,99469.86123079785,99117.3502973169,0.11,16451229.0
Bitget,"Artificial Intelligence (AI), Infrastructure, Smart Contract Platform, Decentralized Finance (DeFi), Arbitrum Ecosystem, Ethereum Ecosystem, Zero Knowledge (ZK), DWF Labs Portfolio, Coinbase Ventures Portfolio, Pantera Capital Portfolio, YZi Labs (Prev. Binance Labs) Portfolio",marlin,81435645.0,99828442.0,41971.49448966307,40229.74799206482,0.3,5164827.0
Bitget,"NFT, Polygon Ecosystem, Ethereum Ecosystem, Optimism Ecosystem",blockv,80734535.0,80734535.0,,,N/A,84815.0
Bitget,BNB Chain Ecosystem,aventis-ai,80744310.0,207988104.0,,,N/A,28094.0
Bitget,"Decentralized Finance (DeFi), Derivatives, Synthetic Issuer, Ethereum Ecosystem, Base Ecosystem, Synthetic",stp-network,81139912.0,81139912.0,41851.17414584527,36696.72568977991,0.31,11957143.0
