Bitget,"Decentralized Finance (DeFi), Arbitrum Ecosystem, Liquid Staking Tokens, Ethereum Ecosystem, Optimism Ecosystem, Base Ecosystem",cgeth-hashkey-cloud,340524334.0,340524334.0,,,N/A,26.24
Bitget,"Artificial Intelligence (AI), Smart Contract Platform, DePIN, Osmosis Ecosystem, Proof of Stake (PoS), Archway Ecosystem, Made in USA",akash-network,339815090.0,340975697.0,,,N/A,56271458.0
Bitget,"Decentralized Finance (DeFi), Liquid Staking Tokens, Ethereum Ecosystem, Liquid Staked ETH, Liquid Staking",stakewise-v3-oseth,336470793.0,336470793.0,,,N/A,1681207.0
Bitget,"Mantle Ecosystem, Bridged USDT, Bridged-Tokens, Bridged Stablecoins",mantle-bridged-usdt-mantle,325324783.0,325324783.0,,,N/A,1202506.0
Bitget,"Smart Contract Platform, Gaming (GameFi), NFT, BNB Chain Ecosystem, Binance Launchpool, Avalanche Ecosystem, Ethereum Ecosystem, DWF Labs Portfolio, Gaming Blockchains, Avalanche L1",beam-2,324199469.0,377169821.0,63433.99056651472,62391.17404074101,0.16,31165762.0
Bitget,"Stablecoins, USD Stablecoin, BNB Chain Ecosystem, Avalanche Ecosystem, Polygon Ecosystem, Optimism Ecosystem, Fiat-backed Stablecoin, Binance-Peg Tokens",binance-peg-busd,323857503.0,323857503.0,,,N/A,8787524.0
Bitget,"Meme, Base Ecosystem, Frog-Themed, Base Meme, The Boy’s Club",based-brett,316157064.0,316157065.0,12080.779464137822,18042.5299864136,0.31,35790571.0
Bitget,"Decentralized Exchange (DEX), Smart Contract Platform, Decentralized Finance (DeFi), Prediction Markets, Layer 1 (L1), Gnosis Chain Ecosystem, MEV Protection, Arbitrum Ecosystem, Ethereum Ecosystem, SideChain, Energi Ecosystem",gnosis,316133602.0,366236034.0,35504.698169235824,42807.11496109514,0.41,36106851.0
Bitget,"Solana Ecosystem, Meme, Ethereum Ecosystem, Base Ecosystem, Murad Picks, Stock market-themed",spx6900,311218214.0,311218214.0,,,N/A,20268201.0
Bitget,"Smart Contract Platform, Zero Knowledge (ZK), FTX Holdings, Paradigm Portfolio, Coinbase Ventures Portfolio, Multicoin Capital Portfolio, Proof of Stake (PoS), Pantera Capital Portfolio, Circle Ventures Portfolio, Privacy Blockchain, Polychain Capital Portfolio, Made in USA, Coinbase 50 Index",mina-protocol,310998793.0,310998793.0,4807.906441786719,13247.792920793518,0.43,16604434.0
Bitget,"Decentralized Finance (DeFi), Arbitrum Ecosystem, Ethereum Ecosystem, Real World Assets (RWA), Base Ecosystem, Coinbase Ventures Portfolio, Energi Ecosystem, Made in USA",reserve-rights-token,307565043.0,550208357.0,127076.55546239254,257456.1249365247,0.07,27318051.0
Bitget,"Decentralized Finance (DeFi), Lending/Borrowing Protocols, Ethereum Ecosystem, Base Ecosystem, Coinbase Ventures Portfolio, Pantera Capital Portfolio, Morpho Ecosystem, Binance Alpha Spotlight",morpho,304320057.0,1289228403.0,28733.11293241412,36931.37592140125,0.13,12924105.0
Bitget,"Smart Contract Platform, Layer 1 (L1), MEV Protection, Proof of Work (PoW), Privacy Blockchain",verus-coin,302655659.0,302657703.0,,,N/A,18370.16
Bitget,"Yield Aggregator, Ethereum Ecosystem, Binance Labs Portfolio, Polychain Capital Portfolio",stakestone-berachain-vault-token,301804574.0,301804574.0,,,N/A,177174.0
Bitget,"Decentralized Finance (DeFi), Tron Ecosystem",just,299066031.0,299066031.0,133756.82828298814,129734.26746585312,0.23,24499752.0
Bitget,"Artificial Intelligence (AI), Ethereum Ecosystem, DePIN, Energi Ecosystem, GMCI DePIN Index, GMCI Index",golem,290476162.0,290476162.0,87661.3170264012,92358.007380858,0.1,73395285.0
Bitget,"Artificial Intelligence (AI), Smart Contract Platform, Storage, BNB Chain Ecosystem, Layer 1 (L1), Ethereum Ecosystem, DePIN, DWF Labs Portfolio, Osmosis Ecosystem, GMCI DePIN Index, GMCI Index",aioz-network,289826423.0,293707031.0,,,N/A,13935471.0
Bitget,"Polygon Ecosystem, Bridged WETH, Bridged-Tokens",polygon-pos-bridged-weth-polygon-pos,277165208.0,277165208.0,,,N/A,14773627.0
Bitget,"Crypto-Backed Tokens, Wrapped-Tokens, Polygon Ecosystem, Arbitrum Ecosystem, Liquid Staking Tokens, Ethereum Ecosystem, Optimism Ecosystem, Base Ecosystem, Liquid Staked ETH, Liquid Staking",coinbase-wrapped-staked-eth,277109719.0,771160715.0,,,N/A,11725624.0
Bitget,"Decentralized Exchange (DEX), Exchange-based Tokens, Decentralized Finance (DeFi), Yield Farming, Derivatives, Synthetic Issuer, Avalanche Ecosystem, Polygon Ecosystem, Near Protocol Ecosystem, Fantom Ecosystem, Harmony Ecosystem, Ethereum Ecosystem, Optimism Ecosystem, Base Ecosystem, DWF Labs Portfolio, Paradigm Portfolio, Coinbase Ventures Portfolio, Index Coop Defi Index, Energi Ecosystem, Huobi ECO Chain Ecosystem, GMCI DeFi Index, Synthetic, Index Coop Index, GMCI Index, Coinbase 50 Index",havven,276419550.0,276764504.0,141025.08639778243,146753.1378143651,0.12,22899128.0
Bitget,"Smart Contract Platform, Layer 1 (L1), Ethereum Ecosystem, Real World Assets (RWA), RWA Protocol, Made in USA",plume,273257358.0,1366286791.0,37062.26212574894,90964.94133865534,0.15,81813729.0
Bitget,"Smart Contract Platform, Privacy, Masternodes, Alleged SEC Securities, Proof of Stake (PoS), Proof of Work (PoW), Made in USA",dash,273133979.0,273142634.0,,,N/A,31977933.0
Bitget,"Decentralized Exchange (DEX), Exchange-based Tokens, Decentralized Finance (DeFi), Automated Market Maker (AMM), BNB Chain Ecosystem, Avalanche Ecosystem, Polygon Ecosystem, Near Protocol Ecosystem, Harmony Ecosystem, Ethereum Ecosystem, FTX Holdings, Alameda Research Portfolio, DragonFly Capital Portfolio, Pantera Capital Portfolio, Energi Ecosystem, Binance Labs Portfolio, GMCI DeFi Index, Galaxy Digital Portfolio, Blockchain Capital Portfolio, Dex Aggregator, GMCI Index, Coinbase 50 Index",1inch,270721218.0,294831646.0,102134.69171020319,172542.85070209243,0.05,27941076.0
Bitget,"BNB Chain Ecosystem, Wallets, Ethereum Ecosystem, Animoca Brands Portfolio, Binance Launchpad, Energi Ecosystem, Binance Labs Portfolio",safepal,270296798.0,270296798.0,70296.87534721449,63523.373944624065,0.13,9449779.0
Bitget,"Liquid Staking Tokens, Ethereum Ecosystem, Liquid Staking",stader-ethx,268096440.0,268096440.0,,,N/A,186609.0
Bitget,"Stablecoins, USD Stablecoin, Ethereum Ecosystem, Fiat-backed Stablecoin",elixir-deusd,267095981.0,267095981.0,1111378.5562667742,1217031.5606685549,0.02,36031928.0
Bitget,"Infrastructure, Ethereum Ecosystem, Data Availability, Restaking, Polychain Capital Portfolio, Made in USA",eigenlayer,266456158.0,1867479729.0,597461.8468194765,702376.3409797344,0.09,50289799.0
Bitget,"Smart Contract Platform, Ethereum Ecosystem, Real World Assets (RWA), DWF Labs Portfolio, Proof of Stake (PoS)",creditcoin-2,264489074.0,369556384.0,93431.7027248783,108426.56423003682,0.13,30312423.0
Bitget,"Polygon Ecosystem, Bridged WBTC, Bridged-Tokens",polygon-bridged-wbtc-polygon-pos,263314926.0,263314926.0,,,N/A,7632575.0
Bitget,"Exchange-based Tokens, Centralized Exchange (CEX) Token, Ethereum Ecosystem, Morph L2 Ecosystem",mx-token,263431565.0,1160743391.0,,,N/A,21115383.0
Bitget,Unknown,kusama,,,,,N/A,
Bitget,Unknown,sats-ordinals,,,,,N/A,
Bitget,"Smart Contract Platform, DePIN, Proof of Stake (PoS), Made in USA",theta-fuel,255922604.0,255932201.0,,,N/A,3419577.0
Bitget,"Crypto-Backed Tokens, Decentralized Finance (DeFi), cToken, Ethereum Ecosystem",compound-wrapped-btc,251533093.0,251533093.0,,,N/A,0.0
Bitget,"Decentralized Finance (DeFi), Ethereum Ecosystem, Restaking, Liquid Restaking Tokens, Liquid Staking",ether-fi-staked-btc,250353116.0,250353116.0,,,N/A,574709.0
Bitget,"Smart Contract Platform, Layer 2 (L2), Zero Knowledge (ZK), ZkSync Ecosystem, Consensys Portfolio, Blockchain Capital Portfolio, OKX Ventures Portfolio",zksync,250056335.0,1428893344.0,174332.6988986796,226777.67902505898,0.15,35964904.0
Bitget,"Decentralized Finance (DeFi), Liquid Staking Tokens, Base Ecosystem, Liquid Staked ETH, Liquid Staking",super-oeth,249806609.0,249806609.0,,,N/A,3556734.0
Bitget,"Stablecoins, Tokenized Assets, Tokenized Gold, BNB Chain Ecosystem, Real World Assets (RWA), Tokenized Commodities, Commodity-backed Stablecoin",quorium,249405764.0,249405764.0,,,N/A,148580.0
Bitget,"Arbitrum Ecosystem, Liquid Staking Tokens, Ethereum Ecosystem, Liquid Staking",sweth,248815337.0,248822274.0,,,N/A,238039.0
Bitget,"Solana Ecosystem, Arbitrum Ecosystem, Ethereum Ecosystem, Interoperability, Base Ecosystem, Multicoin Capital Portfolio, Cross-chain Communication, Made in USA",wormhole,247693563.0,853116095.0,693486.9737158157,688141.3747442256,0.12,30566020.0
Bitget,"Solana Ecosystem, Meme, Solana Meme, AI Meme, Pump.fun Ecosystem, Terminal of Truths, Binance Alpha Spotlight",fartcoin,245299073.0,245299073.0,139270.92118553404,112609.23183066909,0.08,194197400.0
Bitget,"Decentralized Finance (DeFi), BNB Chain Ecosystem, Polygon Ecosystem, Fantom Ecosystem, Arbitrum Ecosystem, Moonbeam Ecosystem, Liquid Staking Tokens, Ethereum Ecosystem, Optimism Ecosystem, Polygon zkEVM Ecosystem, Liquid Staking, Made in USA",frax-ether,247310811.0,247310811.0,,,N/A,3811538.0
Bitget,"Decentralized Finance (DeFi), Solana Ecosystem, LSDFi, Restaking, Stablecoin Protocol, Binance Labs Portfolio, Binance HODLer Airdrops, Polychain Capital Portfolio",solayer,243454692.0,1159308056.0,325017.80108772224,164700.54105613806,0.03,361056766.0
Bitget,"Solana Ecosystem, Arbitrum Ecosystem, Impossible Finance Launchpad, Ethereum Ecosystem, DePIN, Animoca Brands Portfolio",aethir,240624352.0,1508921488.0,172897.67088516994,197477.06139618307,0.03,77012109.0
Bitget,"Smart Contract Platform, BNB Chain Ecosystem, GMCI Layer 1 Index, GMCI Index, Made in China",zilliqa,236557633.0,244781289.0,125411.16773718437,149234.5088047867,0.17,21288911.0
Bitget,"Meme, Cardano Ecosystem",snek,235492778.0,238498011.0,16380.794205517395,15106.15458051385,0.19,1635701.0
Bitget,"Analytics, Avalanche Ecosystem, Meme, Cat-Themed, Made in USA",ket,224342957.0,224342957.0,,,N/A,4046345.0
Bitget,"Smart Contract Platform, Polkadot Ecosystem, Layer 1 (L1), Layer 2 (L2), Alameda Research Portfolio, Binance Labs Portfolio, OKX Ventures Portfolio",astar,234315381.0,257634194.0,115310.00166996138,100119.1420599372,0.32,7631184.0
Bitget,"NFT, Ethereum Ecosystem, NFT Marketplace, FTX Holdings, NFTFi, eGirl Capital Portfolio, Paradigm Portfolio, GMCI DeFi Index, GMCI Index, Made in USA, Coinbase 50 Index",blur,231707914.0,309671254.0,126233.26925203257,193435.80794327304,0.1,22889628.0
Bitget,"Infrastructure, Wallets, Gnosis Chain Ecosystem, Ethereum Ecosystem",safe,224318547.0,405173135.0,71410.57320719701,118901.10699502827,0.12,14902691.0
Bitget,"Decentralized Exchange (DEX), Exchange-based Tokens, Decentralized Finance (DeFi), Derivatives, Perpetuals, Ethereum Ecosystem, Paradigm Portfolio",dydx,223549179.0,223549179.0,83344.01022648737,298481.03328947653,0.1,16284690.0
Bitget,"Smart Contract Platform, Proof of Stake (PoS), Made in China",qtum,222413502.0,227181016.0,97630.60134540722,96829.95579599282,0.14,22587430.0
Bitget,"Bridged USDC, Sonic Ecosystem, Bridged-Tokens, Bridged Stablecoins",sonic-bridged-usdc-e-sonic,222484489.0,222484489.0,,,N/A,71911957.0
Bitget,"Smart Contract Platform, Interoperability, Layer 2 (L2), Rollup, Multicoin Capital Portfolio, Proof of Work (PoW), DragonFly Capital Portfolio, Sequoia Capital Portfolio, Blockchain Capital Portfolio, Polychain Capital Portfolio, Made in China",nervos-network,220653446.0,224135573.0,2773.0022441597584,3467.9517362696974,0.19,13009057.0
Bitget,"Solana Ecosystem, Avalanche Ecosystem, Polygon Ecosystem, Near Protocol Ecosystem, Harmony Ecosystem, Ethereum Ecosystem, Pantera Capital Portfolio, Energi Ecosystem, Made in USA",basic-attention-token,218660223.0,219293491.0,83336.71625635937,102477.81687075236,0.27,18901746.0
Bitget,"BNB Chain Ecosystem, Polygon Ecosystem, Ethereum Ecosystem, Animoca Brands Portfolio, DWF Labs Portfolio, Alameda Research Portfolio, Energi Ecosystem, Binance Labs Portfolio",mask-network,217752251.0,217752251.0,184279.77092853715,234870.20372725124,0.05,56739554.0
Bitget,"Smart Contract Platform, Gaming (GameFi), NFT, Layer 1 (L1), Play To Earn, Gaming Blockchains, WEMIX Ecosystem",wemix-token,213235378.0,274197779.0,182.40619334418687,808.5320450534219,0.92,6520063.0
Bitget,"Gaming (GameFi), Binance Launchpool, Meme, Play To Earn, TON Ecosystem, TON Meme, Tap to Earn",notcoin,210936714.0,210936714.0,169477.53488451455,214750.28866342548,0.05,75759032.0
Bitget,"Stablecoins, USD Stablecoin, BNB Chain Ecosystem, Avalanche Ecosystem, Near Protocol Ecosystem, Arbitrum Ecosystem, Ethereum Ecosystem, Tron Ecosystem, BitTorrent Ecosystem, Algorithmic Stablecoin, Fiat-backed Stablecoin",usdd,209560777.0,209632948.0,,,N/A,3825577.0
Bitget,"Smart Contract Platform, BNB Chain Ecosystem, Layer 1 (L1), Proof of Stake (PoS), Pantera Capital Portfolio, Andreessen Horowitz (a16z) Portfolio, Binance Labs Portfolio, Blockchain Capital Portfolio, Privacy Blockchain, Polychain Capital Portfolio, Coinbase 50 Index",oasis-network,209339118.0,311063101.0,85035.95365152447,117893.895970025,0.03,11490602.0
Bitget,"Layer 1 (L1), VeChain Ecosystem",vethor-token,209152273.0,209287488.0,39773.682408080414,58563.94150934651,0.21,4822811.0
Bitget,"Infrastructure, Decentralized Finance (DeFi), Sui Ecosystem",deep,207914097.0,831656388.0,,,N/A,20208652.0
Bitget,"Decentralized Finance (DeFi), Aptos Ecosystem",abtc,206334766.0,206334766.0,,,N/A,156829.0
Bitget,"Decentralized Exchange (DEX), Decentralized Finance (DeFi), Avalanche Ecosystem, Harmony Ecosystem, Ethereum Ecosystem, Coinbase Ventures Portfolio, Pantera Capital Portfolio, Energi Ecosystem, GMCI DeFi Index, Blockchain Capital Portfolio, GMCI Index, Made in USA",0x,206437654.0,243326839.0,115601.16843744455,174754.31028871346,0.16,28872025.0
Bitget,"Artificial Intelligence (AI), Harmony Ecosystem, Arbitrum Ecosystem, Ethereum Ecosystem, DePIN, Coinbase Ventures Portfolio, Multicoin Capital Portfolio, Pantera Capital Portfolio, GMCI DePIN Index, GMCI Index, Coinbase 50 Index",livepeer,203787096.0,203787096.0,72222.4242196991,110485.66249104717,0.08,34559105.0
Bitget,"Liquid Staking Tokens, Ethereum Ecosystem, Base Ecosystem, Liquid Staked ETH, Liquid Staking",liquid-staked-ethereum,202665908.0,202665908.0,,,N/A,150416.0
Bitget,"Stablecoins, USD Stablecoin, Arbitrum Ecosystem, Ethereum Ecosystem, Base Ecosystem, Crypto-backed Stablecoin, Fiat-backed Stablecoin",gho,202432086.0,202432086.0,,,N/A,18621247.0
Bitget,"Artificial Intelligence (AI), Solana Ecosystem, Meme, Solana Meme, AI Meme, AI Agents, Binance Alpha Spotlight, AI Framework, Made in USA",ai16z,199267747.0,199267747.0,153272.2783319466,215884.91801472893,0.06,68198377.0
Bitget,"Stablecoins, Ethereum Ecosystem",usda-2,197585951.0,197585951.0,,,N/A,14449.75
Bitget,"Gaming (GameFi), BNB Chain Ecosystem, Solana Ecosystem, Meme, Ethereum Ecosystem, Dog-Themed, Solana Meme, Gaming Utility Token",baby-doge-coin,197060754.0,500201551.0,49491.83994789436,109177.44884897454,0.17,15889785.0
Bitget,"Artificial Intelligence (AI), Polkadot Ecosystem, Metaverse, Ethereum Ecosystem, Interoperability, Real World Assets (RWA), DePIN, Decentralized Science (DeSci), AI Agents",origintrail,193473869.0,193475791.0,35337.421346790674,4.5625087245415195,0.15,9767540.0
Bitget,"Smart Contract Platform, Storage, Harmony Ecosystem, Ethereum Ecosystem, DePIN, Energi Ecosystem, Sora Ecosystem, GMCI DePIN Index, GMCI Index",holotoken,195311540.0,195311540.0,32811.79875994242,37382.77478335664,0.27,10042321.0
Bitget,"BNB Chain Ecosystem, Meme, AI Meme",ai-companions,195064780.0,195064780.0,,,N/A,4848436.0
Bitget,"Decentralized Exchange (DEX), Decentralized Finance (DeFi), Automated Market Maker (AMM), Cosmos Ecosystem, Osmosis Ecosystem, Paradigm Portfolio, Evmos Ecosystem, Secret Ecosystem, GMCI DeFi Index, GMCI Index",osmosis,195158427.0,271946245.0,87128.08740194763,111044.77757509495,0.33,13176044.0
Bitget,"Decentralized Finance (DeFi), Yield Farming, BNB Chain Ecosystem, Avalanche Ecosystem, Polygon Ecosystem, Fantom Ecosystem, Arbitrum Ecosystem, Ethereum Ecosystem, Optimism Ecosystem, Linea Ecosystem, Bridge Governance Tokens, Base Ecosystem, FTX Holdings",stargate-finance,193479726.0,199162894.0,105213.93420984705,136678.79280095716,0.15,7624933.0
Bitget,"Decentralized Finance (DeFi), Polygon Ecosystem, Ethereum Ecosystem, Coinbase Ventures Portfolio, Pantera Capital Portfolio",instadapp,192518545.0,488169753.0,,,N/A,1136003.0
Bitget,"BNB Chain Ecosystem, Meme",cheems-token,192230836.0,192230836.0,71401.45948630391,46500.87876569399,0.1,5502689.0
Bitget,"Artificial Intelligence (AI), Exchange-based Tokens, Analytics, Derivatives, Perpetuals, Centralized Exchange (CEX) Token, Ethereum Ecosystem, Binance Launchpad, Coinbase Ventures Portfolio, Binance Labs Portfolio, Made in USA",arkham,191337242.0,517553866.0,375132.6430797128,363422.13097367884,0.19,82401790.0
Bitget,"Smart Contract Platform, BNB Chain Ecosystem, Avalanche Ecosystem, Polygon Ecosystem, Arbitrum Ecosystem, Ethereum Ecosystem, Optimism Ecosystem, Base Ecosystem, Multicoin Capital Portfolio, Layer 0 (L0), Cross-chain Communication, Circle Ventures Portfolio, Sequoia Capital Portfolio, OKX Ventures Portfolio",layerzero,191159154.0,1719786282.0,944325.089364727,1101431.0456441394,0.06,33288943.0
Bitget,"Gaming (GameFi), NFT, Collectibles, Polygon Ecosystem, Ethereum Ecosystem, Animoca Brands Portfolio, Gaming Blockchains, Made in USA",superfarm,190258584.0,421209631.0,59654.32620541784,92570.29061739027,0.24,17181694.0
Bitget,"Smart Contract Platform, Layer 1 (L1), DePIN, Andreessen Horowitz (a16z) Portfolio, Made in USA",chia,189557222.0,431295815.0,,,N/A,15076642.0
Bitget,"Smart Contract Platform, Gaming (GameFi), Ethereum Ecosystem, Base Ecosystem, Card Games, Paradigm Portfolio, Gaming Blockchains, Gaming Utility Token",echelon-prime,189401242.0,373960726.0,64994.69937151953,49490.7319298487,0.06,4211029.0
Bitget,"Decentralized Exchange (DEX), BNB Chain Ecosystem, Solana Ecosystem, Ethereum Ecosystem, Real World Assets (RWA), Base Ecosystem, RWA Protocol",chex-token,188582037.0,188582037.0,,,N/A,1575422.0
Bitget,"Infrastructure, Smart Contract Platform, BNB Chain Ecosystem, Layer 1 (L1), Ethereum Ecosystem, GMCI Layer 1 Index, Aelf Ecosystem, GMCI Index",aelf,190004830.0,256125545.0,73716.62522270945,100850.51418513215,0.16,134740062.0
Bitget,"Smart Contract Platform, Privacy, Layer 1 (L1), Proof of Stake (PoS), Proof of Work (PoW), Blockchain Capital Portfolio, Made in USA",decred,188609101.0,188614281.0,,,N/A,2566567.0
Bitget,"Infrastructure, Smart Contract Platform, NEO Ecosystem",gas,187267623.0,187267623.0,115031.6903532879,137807.1069183503,0.1,9599629.0
Bitget,"Smart Contract Platform, Layer 1 (L1), Celo Ecosystem, DWF Labs Portfolio, Coinbase Ventures Portfolio, Proof of Stake (PoS), Andreessen Horowitz (a16z) Portfolio, Optimism Superchain Ecosystem, Outlier Ventures Portfolio, Made in USA",celo,185976676.0,329006185.0,160602.3962908331,231356.933545228,0.09,24106262.0
Bitget,"Crypto-Backed Tokens, Decentralized Finance (DeFi), Wrapped-Tokens, Ethereum Ecosystem",resolv-wstusr,184744046.0,164471356.0,,,N/A,162.11
Bitget,"Solana Ecosystem, BRC-20, Bitcoin Ecosystem, Inscriptions",ordinals,184286753.0,184286753.0,6594.716596395403,9721.124300647565,0.56,62602923.0
Bitget,"Solana Ecosystem, Meme, Solana Meme, AI Meme, Pump.fun Ecosystem",act-i-the-ai-prophecy,183575953.0,183575953.0,154657.47245454177,210641.11495246273,0.05,80917033.0
Bitget,"Solana Ecosystem, Ethereum Ecosystem, Energi Ecosystem",swissborg,182226220.0,182226220.0,,,N/A,26844067.0
Bitget,"Smart Contract Platform, Privacy, Proof of Work (PoW)",mimblewimblecoin,181895473.0,181898279.0,,,N/A,7379.67
Bitget,"Infrastructure, Smart Contract Platform, Venom Ecosystem",venom,181309578.0,656260014.0,,,N/A,2535405.0
Bitget,"Solana Ecosystem, Meme, Dog-Themed, Solana Meme, Bitcoin Ecosystem, Runes",dog-go-to-the-moon-rune,180629147.0,180629147.0,10832.73661191527,24244.89241129461,0.17,9387551.0
Bitget,"Smart Contract Platform, Real World Assets (RWA), Proof of Work (PoW), Made in USA",ravencoin,179968363.0,180015636.0,,,N/A,17920850.0
Bitget,"Meme, Cronos Ecosystem, AI Meme, Cronos zkEVM Ecosystem",agentfun-ai,179867593.0,179867593.0,,,N/A,9924.64
Bitget,"Tourism, BNB Chain Ecosystem",trip,178982245.0,594585086.0,,,N/A,50890.0
Bitget,"Gaming (GameFi), Ethereum Ecosystem, Decentralized Identifier (DID), Animoca Brands Portfolio, OKX Ventures Portfolio, Outlier Ventures Portfolio",mocaverse,178207683.0,829075969.0,80501.81519709999,173577.19187655672,0.13,32904629.0
Bitget,"Decentralized Finance (DeFi), BNB Chain Ecosystem, Polygon Ecosystem, Fantom Ecosystem, Arbitrum Ecosystem, Moonbeam Ecosystem, Liquid Staking Tokens, Ethereum Ecosystem, Optimism Ecosystem, Liquid Staked ETH, Liquid Staking",staked-frax-ether,178695415.0,178695415.0,,,N/A,819286.0
Bitget,"Tokenized Real Estate, Tokenized Assets, Ethereum Ecosystem, Real World Assets (RWA), RWA Protocol",apf-coin,178571439.0,262190667.0,,,N/A,2955010.0
Bitget,"Solana Ecosystem, Meme, Solana Meme, Cat-Themed, Murad Picks",popcat,178600950.0,178600950.0,,,N/A,88370539.0
Bitget,"Smart Contract Platform, Storage, DePIN, Paradigm Portfolio, Proof of Work (PoW), DragonFly Capital Portfolio, Made in USA",siacoin,177368378.0,189542056.0,,,N/A,21499237.0
Bitget,"Exchange-based Tokens, Ethereum Ecosystem",btse-token,176822737.0,218216832.0,,,N/A,10246364.0
Bitget,"Gaming (GameFi), BNB Chain Ecosystem, Ethereum Ecosystem, TON Ecosystem",gmt-token,176833185.0,176833185.0,7654.838074522763,8289.371700077174,0.14,26361809.0
Bitget,"Solana Ecosystem, Meme, Solana Meme, Pump.fun Ecosystem, Zoo-Themed, Memorial Themed",peanut-the-squirrel,175664795.0,175664795.0,619869.5178118913,788392.7243655876,0.11,350802717.0
Bitget,"BNB Chain Ecosystem, Avalanche Ecosystem, Polygon Ecosystem, Fantom Ecosystem, Arbitrum Ecosystem, Ethereum Ecosystem, Optimism Ecosystem, Liquid Staking Governance Tokens, Linea Ecosystem, DePIN, Scroll Ecosystem, Rollups-as-a-Service (RaaS), Blast Ecosystem, Mode Ecosystem, Pantera Capital Portfolio, Polygon zkEVM Ecosystem, Binance Labs Portfolio, Liquid Staking, Made in USA",ankr,174341768.0,174341768.0,74194.25269198246,115120.0402660223,0.06,16947139.0
Bitget,"Launchpad, Meme, Base Ecosystem, Cat-Themed, Base Meme",toshi,174972485.0,174972485.0,,,N/A,46189625.0
Bitget,"Avalanche Ecosystem, Liquid Staking Tokens, Liquid Staking",benqi-liquid-staked-avax,174343280.0,174343280.0,,,N/A,1535711.0
Bitget,,nem,173659448.0,173659448.0,2588.072654889171,5504.1996955330815,0.21,36196400.0
Bitget,"Gambling (GambleFi), Gaming (GameFi), Ethereum Ecosystem",rollbit-coin,173595670.0,173604830.0,,,N/A,732696.0
Bitget,"Decentralized Finance (DeFi), Solana Ecosystem, Liquid Staking Tokens, Liquid Staked SOL, Liquid Staking",bybit-staked-sol,171592682.0,171592682.0,,,N/A,6541776.0
Bitget,"Artificial Intelligence (AI), Smart Contract Platform, Layer 1 (L1), Paradigm Portfolio, Coinbase Ventures Portfolio, DeFiance Capital Portfolio, Polychain Capital Portfolio, Vana Ecosystem",vana,171797994.0,669342836.0,92136.31264678619,235066.57944598756,0.03,50502279.0
Bitget,"Meme, Ethereum Ecosystem, Base Ecosystem, Cat-Themed, Murad Picks",mog-coin,171192541.0,171192541.0,15691.829851492812,33530.851999851286,0.09,16786287.0
Bitget,"Decentralized Finance (DeFi), Launchpad, Ethereum Ecosystem, DWF Labs Portfolio, Coinbase Ventures Portfolio, Pantera Capital Portfolio, Blockchain Capital Portfolio",auction,170802801.0,198032902.0,248898.48004886706,277371.8405599415,0.04,200275184.0
Bitget,Arbitrum Ecosystem,rcge,168805259.0,168805259.0,,,N/A,2.43
Bitget,"Solana Ecosystem, Meme, Cat-Themed",meow,169410631.0,169410631.0,,,N/A,1492596.0
Bitget,"Decentralized Finance (DeFi), Yield Farming, Yield Aggregator, Yearn Ecosystem, Avalanche Ecosystem, Polygon Ecosystem, Near Protocol Ecosystem, Gnosis Chain Ecosystem, Fantom Ecosystem, Harmony Ecosystem, Arbitrum Ecosystem, Ethereum Ecosystem, Optimism Ecosystem, Base Ecosystem, Index Coop Defi Index, Alameda Research Portfolio, Energi Ecosystem, Sora Ecosystem, Huobi ECO Chain Ecosystem, Blockchain Capital Portfolio, Index Coop Index",yearn-finance,168566287.0,183121595.0,81206.25919396734,96564.16833280813,0.28,34609081.0
Bitget,"Starknet Ecosystem, Bridged-Tokens",bridged-wrapped-ether-starkgate,166773517.0,166773517.0,,,N/A,1697910.0
Bitget,"Decentralized Finance (DeFi), Solana Ecosystem, Ethereum Ecosystem, Optimism Ecosystem, Base Ecosystem, Cross-chain Communication, BTCfi",threshold-network-token,164695462.0,181430494.0,64027.59174719157,69850.14395155158,0.31,10194846.0
Bitget,"Entertainment, Smart Contract Platform, Gaming (GameFi), NFT, Metaverse, Layer 1 (L1), Harmony Ecosystem, Ethereum Ecosystem, Gaming Blockchains, Energi Ecosystem",enjincoin,163936051.0,169609693.0,46930.10982505052,55302.67782422254,0.11,15962847.0
Bitget,"Solana Ecosystem, Meme, Dog-Themed, Solana Meme, Cat-Themed",cat-in-a-dogs-world,162816896.0,162816896.0,73163.96186903221,101895.0524809172,0.05,18274221.0
Bitget,"Decentralized Finance (DeFi), Ethereum Ecosystem, Stablecoin Protocol",tribe-2,162974717.0,358173966.0,,,N/A,55927.0
Bitget,"Decentralized Finance (DeFi), Liquid Staking Tokens, Ethereum Ecosystem, Liquid Staked ETH, Liquid Staking",treehouse-eth,160344706.0,160344706.0,,,N/A,879097.0
Bitget,"Decentralized Exchange (DEX), Exchange-based Tokens, Ethereum Ecosystem",coinex-token,159782809.0,159782809.0,,,N/A,147138.0
Bitget,"Solana Ecosystem, DePIN, Multicoin Capital Portfolio, Made in USA",hivemapper,159799103.0,248541706.0,,,N/A,2208804.0
Bitget,"Stablecoins, Ethereum Ecosystem, Crypto-backed Stablecoin",elixir-staked-deusd,159173957.0,159173957.0,,,N/A,2618775.0
Bitget,"Decentralized Finance (DeFi), Tron Ecosystem",sun-token,159313819.0,322571625.0,235954.93470501024,273816.31412914756,0.25,46540714.0
Bitget,"Internet of Things (IOT), Ethereum Ecosystem, DePIN, Base Ecosystem, Account Abstraction, GMCI DePIN Index, GMCI Index, Made in USA",iotex,157429091.0,157429091.0,72881.69159703453,96152.49388484386,0.06,8544245.0
