Bitget,"Smart Contract Platform, Layer 1 (L1), Layer 0 (L0), Made in USA, Directed Acyclic Graph (DAG)",constellation-labs,161419607.0,161419724.0,,,N/A,2737073.0
Bitget,"Decentralized Finance (DeFi), Binance Launchpool, Arbitrum Ecosystem, Ethereum Ecosystem, Restaking, Liquid Restaking Governance Tokens, Ether.fi Ecosystem, Consensys Portfolio, OKX Ventures Portfolio",ether-fi,156194176.0,674220772.0,74759.67817334142,107283.64654811313,0.03,62674961.0
Bitget,"Decentralized Finance (DeFi), Yield Farming, Yield Aggregator, Ethereum Ecosystem, Metagovernance, Curve Ecosystem, Yield Optimizer",convex-finance,155189807.0,189000782.0,106329.43757060266,164668.2181354762,0.16,19471766.0
Bitget,"Artificial Intelligence (AI), Meme, Base Ecosystem, AI Agents, Binance Alpha Spotlight, AI Framework",freysa-ai,153663892.0,153663892.0,,,N/A,1153121.0
Bitget,BNB Chain Ecosystem,acet-token,153698413.0,200521075.0,,,N/A,1519793.0
Bitget,"Smart Contract Platform, BNB Chain Ecosystem, Layer 1 (L1), Ethereum Ecosystem, ZetaChain Ecosystem, Cross-chain Communication, Made in USA",zetachain,153227896.0,439801016.0,117413.86705390693,139844.2194785812,0.05,13947655.0
Bitget,"Decentralized Exchange (DEX), Exchange-based Tokens, Decentralized Finance (DeFi), Automated Market Maker (AMM), BNB Chain Ecosystem, Derivatives, Perpetuals, Centralized Exchange (CEX) Token, Solana Ecosystem, Avalanche Ecosystem, Polygon Ecosystem, Near Protocol Ecosystem, Fantom Ecosystem, Arbitrum Ecosystem, Ethereum Ecosystem, ZkSync Ecosystem, Mantle Ecosystem, Linea Ecosystem, Base Ecosystem, DragonFly Capital Portfolio, Binance Labs Portfolio",woo-network,153112479.0,182360495.0,34650.30199310681,72162.95541047692,0.36,11586914.0
Bitget,"Smart Contract Platform, EthereumPoW Ecosystem, Proof of Work (PoW)",ethereum-pow-iou,152235103.0,152235103.0,20359.423227227162,22442.850569182076,0.21,13768107.0
Bitget,"Meme, Ethereum Ecosystem, Frog-Themed, AI Meme",turbo,152066102.0,152066102.0,78032.0472471181,57939.67760692426,0.05,86458236.0
Bitget,"Smart Contract Platform, Gaming (GameFi), Layer 1 (L1), Ethereum Ecosystem, Modular Blockchain, Account Abstraction, Multicoin Capital Portfolio, Gaming Blockchains, Gaming Utility Token, Skale Ecosystem, Consensys Portfolio, Galaxy Digital Portfolio, Made in USA",skale,150402786.0,158218601.0,71898.78711218179,87196.47097021338,0.12,23167478.0
Bitget,"SocialFi, Arbitrum Ecosystem",uxlink,148118644.0,437961692.0,65817.89048872475,87964.54945526643,0.05,35978909.0
Bitget,Smart Contract Platform,bitkub-coin,147336376.0,182408569.0,6073.927584181656,10283.916139201207,1.03,346162.0
Bitget,"Decentralized Finance (DeFi), Derivatives, Prediction Markets, Solana Ecosystem",drift-protocol,147454628.0,511106679.0,138770.99562389153,352554.8147227315,0.04,25437173.0
Bitget,"Smart Contract Platform, Layer 1 (L1), Real World Assets (RWA), RWA Protocol",polymesh,146381656.0,146381656.0,89834.720583197,105749.06685010299,0.23,2025888.0
Bitget,"Internet of Things (IOT), Oracle, NFT, Metaverse, Ethereum Ecosystem, DePIN, Alleged SEC Securities, Made in USA",xyo-network,145785458.0,145785458.0,,,N/A,18576610.0
Bitget,"Oracle, Ethereum Ecosystem",redstone-oracles,145160612.0,518430757.0,84782.77676938202,145033.85991189955,0.1,138257227.0
Bitget,"Smart Contract Platform, Masternodes, Zero Knowledge (ZK), Proof of Work (PoW), Made in USA",zencash,143915925.0,143915925.0,242234.17179917797,280287.45613578684,0.01,17575228.0
Bitget,"NFT, Solana Ecosystem, NFT Marketplace, Paradigm Portfolio, Sequoia Capital Portfolio",magic-eden,143630809.0,1076889993.0,276084.5757923861,324861.7266992967,0.1,16172008.0
Bitget,"Internet of Things (IOT), Smart Contract Platform, Layer 1 (L1), Proof of Work (PoW), Made in USA",digibyte,143547625.0,143554175.0,,,N/A,4121916.0
Bitget,"Crypto-Backed Tokens, BNB Chain Ecosystem, Wrapped-Tokens, Ethereum Ecosystem",wrapped-beacon-eth,143118751.0,143118751.0,,,N/A,9614314.0
Bitget,"Smart Contract Platform, Crypto-Backed Tokens, Wrapped-Tokens, Layer 2 (L2), Mantle Ecosystem",wrapped-ether-mantle-bridge,143012676.0,143012686.0,,,N/A,9239973.0
Bitget,"Decentralized Finance (DeFi), Derivatives, Perpetuals, Avalanche Ecosystem, Arbitrum Ecosystem",gmx,142655618.0,142655618.0,80188.55667774766,94192.82914251409,0.07,23738259.0
Bitget,"Payment Solutions, Made in USA, Directed Acyclic Graph (DAG)",nano,142319659.0,142319659.0,,,N/A,12446893.0
Bitget,"BNB Chain Ecosystem, Binance Alpha Spotlight",bnb48-club-token,141680250.0,141680250.0,,,N/A,101680.0
Bitget,"Stablecoins, EUR Stablecoin, Solana Ecosystem, Avalanche Ecosystem, Ethereum Ecosystem, Base Ecosystem, Stellar Ecosystem",euro-coin,140855500.0,140855500.0,,,N/A,55956291.0
Bitget,"Smart Contract Platform, DWF Labs Portfolio, Proof of Stake (PoS)",waves,139708391.0,139708391.0,45140.962534903454,55291.7412742298,0.09,10614531.0
Bitget,"Gaming (GameFi), NFT, Solana Ecosystem, Animoca Brands Portfolio, FTX Holdings, Multicoin Capital Portfolio, Alameda Research Portfolio",metaplex,138825068.0,177892990.0,,,N/A,8225216.0
Bitget,"Gaming (GameFi), Play To Earn, Telegram Apps, TON Ecosystem, Tap to Earn, Arcade Games",hamster-kombat,137825124.0,214097281.0,163618.99447442486,149445.05340471322,0.05,13468947.0
Bitget,"Tokenized Assets, Tokenized Gold, Real World Assets (RWA), Tokenized Commodities",kinesis-gold,138030927.0,138030927.0,,,N/A,62301222.0
Bitget,"BNB Chain Ecosystem, Binance-Peg Tokens",binance-peg-sol,137506982.0,137506982.0,,,N/A,4432697.0
Bitget,"Smart Contract Platform, Layer 1 (L1), Proof of Stake (PoS), GMCI Layer 1 Index, GMCI Index, Made in USA",casper-network,137080415.0,141923038.0,24790.525498566454,30030.774813730928,0.09,4686043.0
Bitget,"Decentralized Exchange (DEX), Decentralized Finance (DeFi), Yield Farming, Automated Market Maker (AMM), BNB Chain Ecosystem, Seigniorage, Solana Ecosystem, Avalanche Ecosystem, Polygon Ecosystem, Fantom Ecosystem, Harmony Ecosystem, Arbitrum Ecosystem, Moonriver Ecosystem, Ethereum Ecosystem, Liquid Staking Governance Tokens, Curve Ecosystem, Stablecoin Protocol, Polygon zkEVM Ecosystem, Evmos Ecosystem, Fraxtal Ecosystem, GMCI DeFi Index, Liquid Staking, GMCI Index, Made in USA",frax-share,137706138.0,155577575.0,943.9739034387916,41218.10003106116,0.06,25793479.0
Bitget,"Exchange-based Tokens, Decentralized Finance (DeFi), Ethereum Ecosystem, Real World Assets (RWA), Alleged SEC Securities",lcx,136425392.0,137731738.0,,,N/A,2060429.0
Bitget,"Smart Contract Platform, Layer 1 (L1), Harmony Ecosystem, Animoca Brands Portfolio, Binance Launchpad, Binance Labs Portfolio, Made in USA",harmony,136318163.0,145741224.0,127941.83060934942,160319.07579604306,0.18,10866980.0
Bitget,"Crypto-Backed Tokens, Wrapped-Tokens, Avalanche Ecosystem",wrapped-avax,136395406.0,136423074.0,,,N/A,83156116.0
Bitget,"Binance Launchpool, Solana Ecosystem, Ethereum Ecosystem, Decentralized Science (DeSci)",bio-protocol,136295766.0,279201423.0,109772.40841410421,126622.25670200012,0.24,17485326.0
Bitget,"Gaming (GameFi), NFT, BNB Chain Ecosystem, Solana Ecosystem, Polygon Ecosystem, Play To Earn, Move To Earn, Ethereum Ecosystem, Binance Launchpad, Gaming Governance Token, Sports Games, Alameda Research Portfolio, Binance Labs Portfolio, Sequoia Capital Portfolio",stepn,135862968.0,254140606.0,176483.43698925112,158803.19836707925,0.2,28851031.0
Bitget,"Stablecoins, Ethereum Ecosystem, XRP Ledger Ecosystem, Fiat-backed Stablecoin, Made in USA",ripple-usd,134930278.0,134930278.0,,,N/A,35466860.0
Bitget,"Stablecoins, EUR Stablecoin, Polygon Ecosystem, Ethereum Ecosystem, Real World Assets (RWA), Fiat-backed Stablecoin",stasis-eurs,134741088.0,134741088.0,,,N/A,164043.0
Bitget,"Smart Contract Platform, Layer 1 (L1), Kadena Ecosystem, Multicoin Capital Portfolio, Proof of Work (PoW), Made in USA",kadena,133869578.0,133974612.0,93654.23315726242,104987.11043737941,0.35,5455516.0
Bitget,"Alleged SEC Securities, Osmosis Ecosystem, DeFiance Capital Portfolio, Pantera Capital Portfolio, Binance Labs Portfolio, Delphi Ventures Portfolio, Galaxy Digital Portfolio, OKX Ventures Portfolio",terra-luna-2,132878353.0,208404892.0,152407.80357282527,280419.4814233625,0.16,20671695.0
Bitget,"Smart Contract Platform, Base Ecosystem, Gaming Blockchains",b3,131621519.0,618154125.0,,,N/A,22816551.0
Bitget,"Tokenized Assets, Real World Assets (RWA), Tokenized Silver, Tokenized Commodities",kinesis-silver,130933565.0,130933565.0,,,N/A,737175.0
Bitget,"Gaming (GameFi), Polkadot Ecosystem, NFT, Ethereum Ecosystem, Gaming Blockchains, Andreessen Horowitz (a16z) Portfolio, Binance Labs Portfolio, Galaxy Digital Portfolio, Made in USA",mythos,130530353.0,168047497.0,,,N/A,6013704.0
Bitget,"Decentralized Finance (DeFi), Analytics, DeFi Index, Base Ecosystem",mag7-ssi,131016386.0,131016386.0,,,N/A,1986661.0
Bitget,"Stablecoins, USD Stablecoin, Solana Ecosystem, Fiat-backed Stablecoin",global-dollar,130274950.0,130274950.0,,,N/A,968232.0
Bitget,"Liquid Staking Tokens, Aptos Ecosystem, Liquid Staking",amnis-aptos,130162629.0,130190203.0,,,N/A,830077.0
Bitget,"Decentralized Exchange (DEX), Smart Contract Platform, Exchange-based Tokens, Decentralized Finance (DeFi), Arbitrum Ecosystem, Ethereum Ecosystem, Layer 2 (L2), Zero Knowledge (ZK), Loopring Ecosystem, Rollup, Energi Ecosystem",loopring,129733541.0,143048700.0,70012.89137840667,135569.2838416524,0.1,13990568.0
Bitget,"Smart Contract Platform, Masternodes, Proof of Stake (PoS), Made in China",ontology,129315336.0,141684716.0,73130.71516809607,95315.44982271153,0.21,8285467.0
Bitget,"Cronos Ecosystem, Bridged USDC, Bridged-Tokens, Bridged Stablecoins",cronos-bridged-usdc-cronos,129489806.0,129489806.0,,,N/A,1827324.0
Bitget,"BNB Chain Ecosystem, Tron Ecosystem",global-commercial-business,124569385.0,124569385.0,,,N/A,178974.0
Bitget,"BNB Chain Ecosystem, Arbitrum Ecosystem, Cardano Ecosystem, Ethereum Ecosystem, DePIN, Base Ecosystem, DWF Labs Portfolio",world-mobile-token,123451581.0,356705411.0,,,N/A,17513157.0
Bitget,"BNB Chain Ecosystem, Harmony Ecosystem, Ethereum Ecosystem, Alameda Research Portfolio, Binance Labs Portfolio",swipe,124092742.0,124125895.0,46760.06995454225,45329.28608993833,0.1,9701527.0
Bitget,"Smart Contract Platform, BNB Chain Ecosystem, Ethereum Ecosystem, Zero Knowledge (ZK), Animoca Brands Portfolio, Binance Labs Portfolio, OKX Ventures Portfolio",polyhedra-network,123075977.0,2038238986.0,258219.32305384762,49944.55826913204,0.1,6297130.0
Bitget,"Smart Contract Platform, SocialFi, NFT, BNB Chain Ecosystem, Binance Launchpool, Ethereum Ecosystem, Decentralized Identifier (DID), Zero Knowledge (ZK), DWF Labs Portfolio, Coinbase Ventures Portfolio, Multicoin Capital Portfolio, Alameda Research Portfolio, DragonFly Capital Portfolio, Binance Labs Portfolio, Quest-to-Earn",project-galaxy,122942051.0,192473885.0,,,N/A,84816.0
Bitget,"Polygon Ecosystem, Bridged DAI, Bridged-Tokens, Bridged Stablecoins",polygon-pos-bridged-dai-polygon-pos,121505335.0,121505335.0,,,N/A,11963110.0
Bitget,"Tokenized Assets, Polygon Ecosystem, Arbitrum Ecosystem, Ethereum Ecosystem, Real World Assets (RWA), Starknet Ecosystem, Tokenized Treasury Bills (T-Bills)",eutbl,120200407.0,120200407.0,,,N/A,0.0
Bitget,"Artificial Intelligence (AI), Binance Launchpool, Solana Ecosystem, DePIN, Animoca Brands Portfolio, Multicoin Capital Portfolio, Delphi Ventures Portfolio, OKX Ventures Portfolio, Made in USA",io,119090019.0,646120114.0,404895.7603374577,557736.5470276292,0.12,31982619.0
Bitget,"Business Services, Decentralized Finance (DeFi), Oracle, Fantom Ecosystem, Ethereum Ecosystem, Binance Launchpad, Osmosis Ecosystem, Energi Ecosystem, Binance Labs Portfolio, Sequoia Capital Portfolio",band-protocol,118539070.0,120263688.0,83349.42866637216,111286.24758165963,0.13,14047187.0
Bitget,"Decentralized Finance (DeFi), Insurance, Ethereum Ecosystem",nxm,117693546.0,117693546.0,,,N/A,0.0
Bitget,"Arbitrum Ecosystem, Ethereum Ecosystem",reserve-protocol-eth-plus,117356585.0,117356585.0,,,N/A,177882.0
Bitget,"Decentralized Exchange (DEX), Exchange-based Tokens, Decentralized Finance (DeFi), Yield Farming, Automated Market Maker (AMM), BNB Chain Ecosystem, Yearn Ecosystem, Solana Ecosystem, Avalanche Ecosystem, Polygon Ecosystem, Near Protocol Ecosystem, Fantom Ecosystem, Harmony Ecosystem, Arbitrum Ecosystem, Celo Ecosystem, Ethereum Ecosystem, Base Ecosystem, Alameda Research Portfolio, Pantera Capital Portfolio, Energi Ecosystem, Sora Ecosystem, Blockchain Capital Portfolio",sushi,117837317.0,171562307.0,169085.72425907763,235871.2909316679,0.16,57372628.0
Bitget,"Exchange-based Tokens, BNB Chain Ecosystem, Centralized Exchange (CEX) Token",nkyc-token,116469902.0,116469902.0,,,N/A,223719.0
Bitget,"Solana Ecosystem, Meme, Solana Meme, Murad Picks",gigachad-2,116012058.0,116012058.0,,,N/A,11218966.0
Bitget,"Solana Ecosystem, Polygon Ecosystem, Ethereum Ecosystem",m2-global-wealth-limited-mmx,114968807.0,368846112.0,,,N/A,114557.0
Bitget,"Smart Contract Platform, Ethereum Ecosystem, Zero Knowledge (ZK), Alleged SEC Securities, Privacy Blockchain",coti,114175985.0,127406583.0,67747.68593180794,73599.98512296502,0.22,13733944.0
Bitget,"Artificial Intelligence (AI), Smart Contract Platform, BNB Chain Ecosystem, Solana Ecosystem, Layer 1 (L1), Polygon Ecosystem, Ethereum Ecosystem, DWF Labs Portfolio, Injective Ecosystem, OKX Ventures Portfolio",zignaly,113288064.0,157069960.0,533.2078188720735,1308.227796851827,1.45,3708969.0
Bitget,"Decentralized Exchange (DEX), Decentralized Finance (DeFi), Gnosis Chain Ecosystem, MEV Protection, Arbitrum Ecosystem, Ethereum Ecosystem, Intent, Delphi Ventures Portfolio, Blockchain Capital Portfolio",cow-protocol,113657375.0,274166539.0,103977.32439316498,116821.71712583091,0.15,21750490.0
Bitget,Unknown,alchemy-pay,,,,,N/A,
Bitget,Unknown,usual,,,,,N/A,
Bitget,Unknown,usd-coin-ethereum-bridged,,,,,N/A,
Bitget,Unknown,hive,,,,,N/A,
Bitget,Unknown,neiro-3,,,,,N/A,
Bitget,Unknown,anzen-usdz,,,,,N/A,
Bitget,Unknown,bonfida,,,,,N/A,
Bitget,Unknown,prometeus,,,,,N/A,
Bitget,Unknown,stp-network,,,,,N/A,
Bitget,Unknown,biconomy,,,,,N/A,
Bitget,Unknown,realtoken-ecosystem-governance,,,,,N/A,
Bitget,"Business Services, Infrastructure, Smart Contract Platform, Decentralized Finance (DeFi), Polygon Ecosystem, Arbitrum Ecosystem, Ethereum Ecosystem, Liquid Staking Governance Tokens, Coinbase Ventures Portfolio, Proof of Stake (PoS), Index Coop Defi Index, Consensys Portfolio, Liquid Staking, Index Coop Index",rocket-pool,108532140.0,108532140.0,40069.327491636315,54612.18252748042,0.18,11468275.0
Bitget,"Smart Contract Platform, BNB Chain Ecosystem, Layer 1 (L1), Ethereum Ecosystem, Decentralized Identifier (DID), Base Ecosystem, Gravity Alpha Ecosystem",g-token,108302649.0,179688330.0,52683.767122415695,22149.10902501196,0.54,29120361.0
Bitget,"Decentralized Finance (DeFi), Ethereum Ecosystem, Morpho Ecosystem",steakhouse-usdc-morpho-vault,106134818.0,106134818.0,,,N/A,0.0
Bitget,"Smart Contract Platform, Cross-chain Communication, Pantera Capital Portfolio",icon,105599235.0,106795411.0,70661.97513582827,47947.935105395816,0.2,3257052.0
Bitget,"Solana Ecosystem, Multicoin Capital Portfolio, Stablecoin Protocol, Alameda Research Portfolio, DeFiance Capital Portfolio",uxd-protocol-token,105821847.0,105821847.0,,,N/A,2.0
Bitget,"Decentralized Exchange (DEX), Decentralized Finance (DeFi), BNB Chain Ecosystem, Wallets, XRP Ledger Ecosystem",solo-coin,105438119.0,105438119.0,29485.777072334906,29705.721101247727,0.35,2107911.0
Bitget,"Artificial Intelligence (AI), Smart Contract Platform, Layer 1 (L1), Proof of Work (PoW)",qubic-network,105466407.0,126138450.0,5552.47564288494,9431.67779592202,0.43,3204074.0
Bitget,"Music, NFT, Ethereum Ecosystem, Coinbase Ventures Portfolio, Multicoin Capital Portfolio, Pantera Capital Portfolio, Energi Ecosystem, Binance Labs Portfolio",audius,104653524.0,104653524.0,72281.56877769486,52296.8559722666,0.37,11700643.0
Bitget,"Smart Contract Platform, Ethereum Ecosystem, Metis Ecosystem, Layer 2 (L2), DWF Labs Portfolio, Rollup, GMCI Layer 2 Index, OKX Ventures Portfolio, GMCI Index",metis-token,104154770.0,166505521.0,79708.3787379552,93502.45570474003,0.06,6194591.0
Bitget,"Exchange-based Tokens, NFT, BNB Chain Ecosystem, Ethereum Ecosystem",swftcoin,103882088.0,103882088.0,,,N/A,3192387.0
Bitget,"Solana Ecosystem, Meme, Solana Meme, PolitiFi, Made in USA",melania-meme,103425527.0,689502946.0,20305.302286892456,42115.826642388056,0.29,30829160.0
Bitget,"Decentralized Finance (DeFi), Yield Farming, Lending/Borrowing Protocols, Ethereum Ecosystem, Real World Assets (RWA), Base Ecosystem, Binance Alpha Spotlight",syrup,103688770.0,166390508.0,,,N/A,17286912.0
Bitget,"Smart Contract Platform, BNB Chain Ecosystem, Ethereum Ecosystem, DWF Labs Portfolio, Made in USA",proton,102797738.0,113948192.0,24003.69498608794,30106.935502291766,0.32,3061013.0
Bitget,"Smart Contract Platform, Decentralized Finance (DeFi), Binance Launchpool, Derivatives, Perpetuals, Ethereum Ecosystem, Layer 2 (L2), DragonFly Capital Portfolio, Pantera Capital Portfolio",aevo-exchange,103227037.0,114294639.0,237542.0462938109,234208.29578437912,0.17,22724218.0
Bitget,"Lending/Borrowing Protocols, Ethereum Ecosystem, Paradigm Portfolio, Coinbase Ventures Portfolio",euler,102739991.0,149461236.0,,,N/A,9282010.0
Bitget,"Stablecoins, BNB Chain Ecosystem",astherus-usdf,102368876.0,102368876.0,,,N/A,172929.0
Bitget,"Artificial Intelligence (AI), Base Ecosystem, AI Agents, AI Applications, Made in USA",venice-token,102373794.0,244034986.0,,,N/A,14572471.0
Bitget,"Smart Contract Platform, Proof of Stake (PoS), Sequoia Capital Portfolio",iostoken,101206966.0,101206966.0,49788.018109821845,92479.3224962619,0.19,21792026.0
Bitget,"Stablecoins, LP Tokens, Ethereum Ecosystem",resolv-rlp,100937718.0,100937718.0,,,N/A,288938.0
Bitget,"NFT, Meme, Arbitrum Ecosystem, Ethereum Ecosystem, Anime-Themed, Binance HODLer Airdrops, Airdropped Tokens by NFT Projects",anime,101042036.0,182432296.0,93253.62907129685,109060.8448384356,0.55,24801095.0
Bitget,"Decentralized Finance (DeFi), BNB Chain Ecosystem, Real World Assets (RWA), DWF Labs Portfolio, Stellar Ecosystem",velo,100521038.0,326433260.0,,,N/A,34476231.0
Bitget,"Artificial Intelligence (AI), Smart Contract Platform, Masternodes, DePIN, Proof of Work (PoW), Made in USA",zelcash,100435593.0,100451524.0,47045.00913186317,87893.86755991269,0.15,9877681.0
Bitget,"NFT, BNB Chain Ecosystem, Ethereum Ecosystem, Binance Launchpad, DWF Labs Portfolio, Binance Labs Portfolio",space-id,99677605.0,462288480.0,97540.45050516927,175178.16110747357,0.13,31508951.0
Bitget,"Bridged USDT, QL1 Ecosystem, Bridged-Tokens, Bridged Stablecoins",qusdt,100030772.0,100030772.0,,,N/A,6348.99
Bitget,"Gaming (GameFi), NFT, Metaverse, Play To Earn, Ethereum Ecosystem, Animoca Brands Portfolio, RPG, Gaming Governance Token, Adventure Games, Energi Ecosystem, Delphi Ventures Portfolio",illuvium,99866024.0,128744804.0,58560.10943577008,81147.37120987906,0.59,25363103.0
Bitget,"NFT, Binance Launchpool, Meme, Ethereum Ecosystem, Binance Labs Portfolio, GMCI Meme Index, GMCI Index",memecoin-2,99226004.0,167332892.0,269365.3931098129,362418.0826261424,0.08,29112638.0
Bitget,"Business Services, Decentralized Finance (DeFi), Oracle, Derivatives, Synthetic Issuer, Avalanche Ecosystem, Ethereum Ecosystem, Blockchain Capital Portfolio, Synthetic, Made in USA",uma,98028782.0,141459938.0,48448.0692127754,62330.164673666426,0.09,17072275.0
Bitget,"Solana Ecosystem, Meme, Base Ecosystem, AI Meme, AI Agents, Virtuals Protocol Ecosystem, Binance Alpha Spotlight, DeFAI",aixbt,96751481.0,113078590.0,135110.0560526925,161711.81473802784,0.09,80478639.0
Bitget,"Decentralized Exchange (DEX), Decentralized Finance (DeFi), Automated Market Maker (AMM), Ethereum Ecosystem, Cronos Ecosystem",vvs-finance,97334287.0,190304887.0,,,N/A,343540.0
Bitget,"Crypto-Backed Tokens, Decentralized Finance (DeFi), Compound Tokens, cToken, Ethereum Ecosystem",compound-ether,96042455.0,96042455.0,,,N/A,170.16
Bitget,"Infrastructure, Smart Contract Platform, Ethereum Ecosystem, Data Availability, Modular Blockchain",avail,95670032.0,490161376.0,75250.40584352543,96875.62079567357,0.21,8463597.0
Bitget,"Smart Contract Platform, Ethereum Ecosystem, Layer 2 (L2), Optimism Superchain Ecosystem, Outlier Ventures Portfolio, Lisk Ecosystem",lisk,95720061.0,222182144.0,28339.817595035995,25835.30855898843,0.18,12670303.0
Bitget,"Stablecoins, USD Stablecoin, Seigniorage, Alleged SEC Securities, Osmosis Ecosystem, Stablecoin Protocol, DeFiance Capital Portfolio, Terra Classic Ecosystem, Binance Labs Portfolio, Delphi Ventures Portfolio, Galaxy Digital Portfolio, Fiat-backed Stablecoin",terrausd,95782364.0,95782400.0,126486.23607617187,107922.63246399669,0.41,6789276.0
Bitget,"Solana Ecosystem, Payment Solutions, Viction Ecosystem",saros-finance,95353260.0,363250538.0,1083.1526105823966,627.1454554070414,0.1,782169.0
Bitget,"Smart Contract Platform, Privacy, Layer 1 (L1), Proof of Stake (PoS), Proof of Work (PoW), Zano Ecosystem, Privacy Blockchain",zano,95343246.0,95345161.0,,,N/A,499224.0
Bitget,"XDC Ecosystem, Telos Ecosystem",ecoin-2,95498064.0,207099463.0,,,N/A,5.24
Bitget,"Polygon Ecosystem, Arbitrum Ecosystem, Ethereum Ecosystem, Optimism Ecosystem, Bridge Governance Tokens, Intent, Boba Network Ecosystem, Blockchain Capital Portfolio, Made in USA",across-protocol,94872310.0,234904367.0,36999.469399886155,12938.062019028073,0.17,17218469.0
Bitget,"Gaming (GameFi), NFT, BNB Chain Ecosystem",infinitar-governance-token,94506497.0,468041620.0,,,N/A,8348216.0
Bitget,"Smart Contract Platform, Polkadot Ecosystem, Binance Launchpool, Layer 2 (L2), Manta Network Ecosystem, Multicoin Capital Portfolio, Alameda Research Portfolio, DeFiance Capital Portfolio, Binance Labs Portfolio",manta-network,94473172.0,248430592.0,19796.539016287796,26742.44802137987,0.04,30990124.0
Bitget,"Solana Ecosystem, Meme, Frog-Themed, Solana Meme, GMCI Meme Index, GMCI Index",book-of-meme,94445214.0,94445214.0,581104.8201384835,700436.5255023554,0.07,52143194.0
Bitget,"Fraxtal Ecosystem, Bridged-Tokens",l2-standard-bridged-frxusd,94510771.0,94510771.0,,,N/A,1044365.0
Bitget,"Software as a service, Ethereum Ecosystem, Energi Ecosystem",status,94479785.0,162334377.0,59555.59101067389,61922.538477659094,0.13,11355864.0
Bitget,"Infrastructure, Smart Contract Platform, Oracle, Layer 1 (L1), Animoca Brands Portfolio, Coinbase Ventures Portfolio, Cross-chain Communication, Made in USA",supra,93541257.0,831718660.0,,,N/A,12279935.0
Bitget,"Gaming (GameFi), NFT, Kaia Ecosystem, Gaming Blockchains",bora,93458605.0,97755552.0,4244.865626578566,12236.4672880914,0.25,2149171.0
Bitget,"Smart Contract Platform, Layer 1 (L1), Zero Knowledge (ZK), Andreessen Horowitz (a16z) Portfolio, Privacy Blockchain, Made in USA",aleo,93973787.0,460454865.0,,,N/A,6418012.0
Bitget,"NFT, Polygon Ecosystem, Ethereum Ecosystem, Optimism Ecosystem",blockv,93176339.0,93176339.0,,,N/A,177206.0
Bitget,"Smart Contract Platform, BNB Chain Ecosystem, Binance Launchpool, Ethereum Ecosystem, Layer 2 (L2), Restaking, Rollups-as-a-Service (RaaS), Rollup, Binance Labs Portfolio",altlayer,92863386.0,332603598.0,71238.78302263674,92363.60679278112,0.03,22208114.0
Bitget,"Decentralized Finance (DeFi), Yield Farming, Avalanche Ecosystem, Fantom Ecosystem, Arbitrum Ecosystem, Olympus Pro Ecosystem, Ethereum Ecosystem, Stablecoin Protocol",spell-token,92875511.0,114799343.0,44674.40917455374,62530.11127371949,0.12,13637565.0
Bitget,"Artificial Intelligence (AI), Infrastructure, Smart Contract Platform, Oracle, Polkadot Ecosystem, Ethereum Ecosystem, Interoperability, Layer 2 (L2), Zero Knowledge (ZK), DePIN, DWF Labs Portfolio, Rollup, AI Agents, Sora Ecosystem, AI Framework, Made in USA",pha,92593962.0,118060383.0,11905.159193959358,20412.597145054315,0.42,24749501.0
Bitget,"Solana Ecosystem, Liquid Staking Tokens, Liquid Staked SOL, Liquid Staking",drift-staked-sol,92250295.0,92250295.0,,,N/A,43782.0
Bitget,"Artificial Intelligence (AI), Big Data, Media, BNB Chain Ecosystem, Polygon Ecosystem, Ethereum Ecosystem, GMCI DePIN Index, Galaxy Digital Portfolio, GMCI Index",everipedia,90545087.0,90545087.0,28260.530129709678,23929.193071796213,0.34,5102943.0
Bitget,"Big Data, Infrastructure, Storage, Cardano Ecosystem, DePIN",iagon,90555987.0,240827304.0,7097.880168483,5290.108376445486,0.62,509574.0
Bitget,"Energy, Ethereum Ecosystem, Alleged SEC Securities, Energi Ecosystem, GMCI DePIN Index, Blockchain Capital Portfolio, GMCI Index",power-ledger,90001518.0,169806607.0,47572.8565412876,95736.22940874587,0.24,11088613.0
Bitget,"Artificial Intelligence (AI), Infrastructure, Smart Contract Platform, Decentralized Finance (DeFi), Arbitrum Ecosystem, Ethereum Ecosystem, Zero Knowledge (ZK), DWF Labs Portfolio, Coinbase Ventures Portfolio, Pantera Capital Portfolio, Binance Labs Portfolio",marlin,89240535.0,109452985.0,42981.63084368512,54252.268886092475,0.36,9981950.0
Bitget,"Ethereum Ecosystem, DWF Labs Portfolio",adventure-gold,89559365.0,89559365.0,98542.21746587814,139919.98690818003,0.21,32902005.0
Bitget,"Decentralized Finance (DeFi), Yield Farming, BNB Chain Ecosystem, Binance Launchpool, Lending/Borrowing Protocols, Arbitrum Ecosystem, Ethereum Ecosystem, Optimism Ecosystem, ZkSync Ecosystem, opBNB Ecosystem, Unichain Ecosystem",venus,89430668.0,160438679.0,,,N/A,6900185.0
Bitget,"Infrastructure, Smart Contract Platform, Decentralized Finance (DeFi), BNB Chain Ecosystem, Avalanche Ecosystem, Polygon Ecosystem, Fantom Ecosystem, Harmony Ecosystem, Arbitrum Ecosystem, Ethereum Ecosystem, DWF Labs Portfolio, Layer 3 (L3), Outlier Ventures Portfolio",orbs,88712753.0,194821636.0,16208.545525372545,21220.569084827755,0.41,10249246.0
Bitget,"Meme, PulseChain Ecosystem",the-grays-currency,89212995.0,89212995.0,,,N/A,568682.0
