Bitget,"Infrastructure, Solana Ecosystem, Animoca Brands Portfolio, Cross-chain Communication, OKX Ventures Portfolio",zeus-network,88432051.0,231026268.0,,,N/A,7284725.0
Bitget,"Solana Ecosystem, Liquid Staking Tokens, Restaking, Liquid Restaking Tokens, Liquid Staked SOL, Liquid Staking, Liquid Restaked SOL",solayer-staked-sol,87929801.0,87929801.0,,,N/A,487084.0
Bitget,"Decentralized Exchange (DEX), Exchange-based Tokens, Decentralized Finance (DeFi), Yield Farming, Automated Market Maker (AMM), Avalanche Ecosystem, Polygon Ecosystem, Near Protocol Ecosystem, Gnosis Chain Ecosystem, Harmony Ecosystem, Arbitrum Ecosystem, Ethereum Ecosystem, Optimism Ecosystem, Base Ecosystem, Index Coop Defi Index, Alameda Research Portfolio, DeFiance Capital Portfolio, Pantera Capital Portfolio, Energi Ecosystem, Polygon zkEVM Ecosystem, Huobi ECO Chain Ecosystem, Blockchain Capital Portfolio, Index Coop Index",balancer,87803685.0,94949499.0,48433.28110038685,76111.29782301997,0.28,11391008.0
Bitget,"Cronos Ecosystem, Bridged USDT, Bridged-Tokens, Bridged Stablecoins",cronos-bridged-usdt-cronos,87837479.0,87837479.0,,,N/A,139442.0
Bitget,"Smart Contract Platform, Gaming (GameFi), Solana Ecosystem, Layer 2 (L2), Gaming Blockchains",sonic-svm,87843465.0,585623102.0,40158.145568937696,62646.4852693815,0.1,60330259.0
Bitget,"Crypto-Backed Tokens, BNB Chain Ecosystem, Arbitrum Ecosystem, Ethereum Ecosystem, Mantle Ecosystem",ignition-fbtc,87310755.0,1135224516.0,,,N/A,782049.0
Bitget,"Gaming (GameFi), XDC Ecosystem",gama-coin,87413887.0,134482977.0,,,N/A,2222477.0
Bitget,Layer 1 (L1),oec-token,87997620.0,87997620.0,,,N/A,336569.0
Bitget,"Decentralized Finance (DeFi), BNB Chain Ecosystem, Arbitrum Ecosystem, Ethereum Ecosystem, Multicoin Capital Portfolio, Energi Ecosystem",dforce-token,87330555.0,87330555.0,,,N/A,15286103.0
Bitget,"SocialFi, Coinbase Ventures Portfolio, Pantera Capital Portfolio, Andreessen Horowitz (a16z) Portfolio, Sequoia Capital Portfolio",deso,87969664.0,90276923.0,,,N/A,9353332.0
Bitget,"Artificial Intelligence (AI), Oracle, Ethereum Ecosystem, DePIN, Energi Ecosystem, Sora Ecosystem, GMCI DePIN Index, GMCI Index",iexec-rlc,86488082.0,103953850.0,106357.07551821785,93686.67884566136,0.33,18151122.0
Bitget,"Smart Contract Platform, Ethereum Ecosystem, Layer 2 (L2), Zero Knowledge (ZK), Restaking, Zircuit Ecosystem",zircuit,85743646.0,390645268.0,173633.60923712622,199501.36957436622,0.03,47730104.0
Bitget,"Stablecoins, USD Stablecoin, Ethereum Ecosystem, Sonic Ecosystem, Fiat-backed Stablecoin",frax-usd,86110886.0,86110886.0,,,N/A,4397940.0
Bitget,"Decentralized Exchange (DEX), Decentralized Finance (DeFi), Arbitrum Ecosystem, Ethereum Ecosystem",tokenlon,85583009.0,103013374.0,,,N/A,101888.0
Bitget,"Business Services, Polygon Ecosystem, Ethereum Ecosystem",request-network,85756553.0,111420652.0,,,N/A,9088708.0
Bitget,"DaoMaker Launchpad, Ethereum Ecosystem, Real World Assets (RWA), Sequoia Capital Portfolio, Made in USA",clearpool,86268852.0,113519719.0,8430.128644378141,11272.344134757574,0.58,4509053.0
Bitget,"Crypto-Backed Tokens, Ethereum Ecosystem",temple,85076715.0,85244320.0,,,N/A,8216.28
Bitget,"Smart Contract Platform, Layer 1 (L1)",ong,84508444.0,207157448.0,38993.17546407195,23948.627632142314,0.29,3057717.0
Bitget,"NFT, Solana Ecosystem, NFT Marketplace",tensor,84228075.0,251722215.0,152045.81627233533,166640.29176591447,0.12,17799840.0
Bitget,"Smart Contract Platform, Polkadot Ecosystem, Layer 1 (L1), Coinbase Ventures Portfolio, Binance Labs Portfolio",moonbeam,83844061.0,102100996.0,76591.55974549138,106588.11387916676,0.57,4769728.0
Bitget,"Smart Contract Platform, Bitcoin Sidechains, Stacks Ecosystem, SideChain",sbtc-2,83356764.0,83356764.0,,,N/A,62530.0
Bitget,"Artificial Intelligence (AI), Smart Contract Platform, Gaming (GameFi), NFT, BNB Chain Ecosystem, Layer 1 (L1), Ethereum Ecosystem, Modular Blockchain, Chromia Ecosystem",chromaway,82927410.0,82927410.0,89539.2175983692,92693.78776699855,0.51,11082843.0
Bitget,"Polygon Ecosystem, XRP Ledger Ecosystem",crypto-trading-fund,82731103.0,82731103.0,,,N/A,16711.96
Bitget,"Solana Ecosystem, Polygon Ecosystem, DePIN, Pantera Capital Portfolio",geodnet,82585092.0,257596846.0,,,N/A,235924.0
Bitget,"Exchange-based Tokens, Centralized Exchange (CEX) Token, Near Protocol Ecosystem, Harmony Ecosystem, Ethereum Ecosystem, Multicoin Capital Portfolio, Alameda Research Portfolio, Elastos Smart Contract Chain Ecosystem, Sequoia Capital Portfolio, Made in China",huobi-token,81970068.0,103384278.0,,,N/A,8401.41
Bitget,"Smart Contract Platform, Gaming (GameFi), NFT, Layer 1 (L1), Play To Earn, Ethereum Ecosystem, Animoca Brands Portfolio, Gaming Blockchains, Pantera Capital Portfolio, OKX Ventures Portfolio",wax,81848944.0,88066946.0,33424.41190388032,44146.47479349415,0.17,5925133.0
Bitget,BNB Chain Ecosystem,metfi-2,81768700.0,191466265.0,,,N/A,372793.0
Bitget,"Smart Contract Platform, Layer 2 (L2), eGirl Capital Portfolio, Paradigm Portfolio, Blast Ecosystem",blast,81545926.0,308348556.0,26038.013294111544,33639.293930220956,0.32,13332122.0
Bitget,Ethereum Ecosystem,dkargo,81450722.0,86896219.0,,,N/A,1361044.0
Bitget,"Gaming (GameFi), Play To Earn, Ethereum Ecosystem, RPG, Alameda Research Portfolio, Circle Ventures Portfolio, OKX Ventures Portfolio, MMO",big-time,81093104.0,228916633.0,155382.26483025722,225051.29953563158,0.09,52753466.0
Bitget,"BNB Chain Ecosystem, Liquid Staking Tokens",astherus-staked-bnb,73767466.0,73767466.0,,,N/A,405.07
Bitget,"Berachain Ecosystem, Bridged USDT, Bridged-Tokens, Ink Ecosystem, Bridged Stablecoins",usdt0,81125149.0,81125149.0,,,N/A,925742.0
Bitget,BNB Chain Ecosystem,bitdca,81002146.0,87003939.0,,,N/A,20454.0
Bitget,"Gaming (GameFi), NFT, BNB Chain Ecosystem, Metaverse, Collectibles, Polygon Ecosystem, Play To Earn, Harmony Ecosystem, Guild and Scholarship, Ethereum Ecosystem, Animoca Brands Portfolio, Base Ecosystem, DWF Labs Portfolio, Ronin Ecosystem, Andreessen Horowitz (a16z) Portfolio, Delphi Ventures Portfolio",yield-guild-games,80366483.0,195770646.0,116098.88749369366,133899.9780510496,0.05,19143064.0
Bitget,"Artificial Intelligence (AI), Virtual Reality, Launchpad, Ethereum Ecosystem, Telegram Apps, Discord Bots, PAAL AI Launchpad, AI Agents, AI Applications, AI Agent Launchpad, Binance Alpha Spotlight, AI Framework, DeFAI, Made in USA",paal-ai,80360858.0,90393382.0,,,N/A,6522294.0
Bitget,"Artificial Intelligence (AI), BNB Chain Ecosystem, Solana Ecosystem, Ethereum Ecosystem, AI Agents, Alameda Research Portfolio",delysium,79760896.0,152312134.0,,,N/A,2918729.0
Bitget,"Gaming (GameFi), Play To Earn, Guild and Scholarship, Ethereum Ecosystem, Animoca Brands Portfolio, Base Ecosystem, DWF Labs Portfolio, Ronin Ecosystem, Coinbase Ventures Portfolio, DeFiance Capital Portfolio, Pantera Capital Portfolio, Binance Labs Portfolio, MMO",zentry,79333809.0,116465741.0,7201.9107174667415,5733.237397511282,0.99,12303339.0
Bitget,"Internet of Things (IOT), BNB Chain Ecosystem, Ethereum Ecosystem, DePIN, DWF Labs Portfolio",mass-vehicle-ledger,79149880.0,83663624.0,726.4090646716363,3569.5347911987024,1.09,411817.0
Bitget,"Stablecoins, Decentralized Finance (DeFi), Lending/Borrowing Protocols, Ethereum Ecosystem",syrupusdc,79251212.0,79251212.0,,,N/A,265491.0
Bitget,"Stablecoins, USD Stablecoin, Solana Ecosystem, Ethereum Ecosystem, Multicoin Capital Portfolio, Fiat-backed Stablecoin",paxos-standard,79186393.0,79186393.0,,,N/A,4216266.0
Bitget,"Decentralized Exchange (DEX), Decentralized Finance (DeFi), Yield Farming, Automated Market Maker (AMM), Solana Ecosystem, Coinbase Ventures Portfolio, DeFiance Capital Portfolio, Made in USA",orca,78440218.0,147232132.0,52201.19034082814,71829.74403224957,0.34,30502986.0
Bitget,"Decentralized Finance (DeFi), Ethereum Ecosystem",avalon-2,77865654.0,479911578.0,,,N/A,156016480.0
Bitget,"Smart Contract Platform, Wallets, Layer 2 (L2), Osmosis Ecosystem",islamic-coin,78609020.0,949619163.0,,,N/A,1115102.0
Bitget,"Meme, Ethereum Ecosystem, PolitiFi",constitutiondao,78272416.0,78272416.0,484544.2933028043,557135.9389604384,0.06,39083499.0
Bitget,Smart Contract Platform,songbird,78512443.0,93290425.0,,,N/A,317865.0
Bitget,"Blast Ecosystem, Bridged WETH, Bridged-Tokens",l2-standard-bridged-weth-blast,77867722.0,77867722.0,,,N/A,649019.0
Bitget,"Software as a service, Polygon Ecosystem, Ethereum Ecosystem, Decentralized Identifier (DID), Pantera Capital Portfolio, Energi Ecosystem, Blockchain Capital Portfolio",civic,77471146.0,96597437.0,73546.10135908825,84216.25268924012,0.1,10337242.0
Bitget,"Smart Contract Platform, Privacy, Proof of Work (PoW), Made in USA",verge,77099065.0,77253286.0,,,N/A,8870943.0
Bitget,"NFT, Polygon Ecosystem",sathosi-airlines-token,72978675.0,348537148.0,,,N/A,2279.07
Bitget,"Smart Contract Platform, Proof of Stake (PoS)",stratis,76383150.0,84162132.0,15555.526905700286,19457.348003110856,0.75,834388.0
Bitget,"Ethereum Ecosystem, Stablecoin Protocol",level-usd,76910918.0,76910918.0,,,N/A,241091.0
Bitget,"Decentralized Finance (DeFi), Lending/Borrowing Protocols, Moonbeam Ecosystem, Base Ecosystem, Coinbase Ventures Portfolio, Made in USA",moonwell-artemis,76374481.0,116466212.0,,,N/A,34936830.0
Bitget,"Artificial Intelligence (AI), Smart Contract Platform, Decentralized Finance (DeFi), Analytics, NFT, BNB Chain Ecosystem, Launchpad, Ethereum Ecosystem, Telegram Apps, Discord Bots, ChainGPT Launchpad, Poolz Finance Launchpad, AI Agents, AI Applications, Binance Alpha Spotlight, AI Framework, DeFAI",chaingpt,76573547.0,95101571.0,36449.98257207683,34398.96828366513,0.11,37287541.0
Bitget,"Sports, BNB Chain Ecosystem",pixer-eternity,75696157.0,351767222.0,,,N/A,161375.0
Bitget,"Stablecoins, USD Stablecoin, BNB Chain Ecosystem, Fantom Ecosystem, Arbitrum Ecosystem, Ethereum Ecosystem, Optimism Ecosystem, Base Ecosystem, Crypto-backed Stablecoin, Fiat-backed Stablecoin",dola-usd,75776366.0,203709677.0,,,N/A,4869240.0
Bitget,"Smart Contract Platform, Cosmos Ecosystem, Modular Blockchain, Osmosis Ecosystem, Rollups-as-a-Service (RaaS)",dymension,75676396.0,301557642.0,85909.4135305456,87967.84802887694,0.13,8901747.0
Bitget,"Decentralized Finance (DeFi), Wallets, Ethereum Ecosystem, Pundi AIFX Omnilayer Ecosystem",pundi-x-2,75857764.0,75857764.0,35610.59731547927,30097.85607836149,0.34,11599343.0
Bitget,"Exchange-based Tokens, Centralized Exchange (CEX) Token, Ethereum Ecosystem",bitmart-token,75191440.0,141651759.0,,,N/A,4041139.0
Bitget,"Optimism Ecosystem, Bridged WBTC, Bridged-Tokens",optimism-bridged-wbtc-optimism,75278228.0,75278228.0,,,N/A,3051757.0
Bitget,"Stablecoins, USD Stablecoin, Osmosis Ecosystem, Fiat-backed Stablecoin",usdx,75563191.0,75563191.0,,,N/A,22990.0
Bitget,"Smart Contract Platform, Layer 1 (L1), Osmosis Ecosystem, XRP Ledger Ecosystem",coreum,74687502.0,74687502.0,806.2557547395683,460.65076897879754,0.87,403452.0
Bitget,"Smart Contract Platform, Gaming (GameFi), Layer 1 (L1), Proof of Stake (PoS), Gaming Blockchains",oasys,74432532.0,193127560.0,5339.265584718071,8749.655505093962,0.41,480109.0
Bitget,"Artificial Intelligence (AI), Infrastructure, Ethereum Ecosystem, AI Framework, Made in USA",arcblock,73939240.0,139508001.0,,,N/A,663313.0
Bitget,"Decentralized Finance (DeFi), Ethereum Ecosystem",elixir-finance,73753585.0,461943900.0,80964.19523519275,64900.599631761106,0.02,46861427.0
Bitget,"Business Services, Decentralized Finance (DeFi), Oracle, Polygon Ecosystem, Gnosis Chain Ecosystem, Arbitrum Ecosystem, Ethereum Ecosystem, Optimism Ecosystem, Manta Network Ecosystem, Binance Labs Portfolio, Lisk Ecosystem, Made in USA",tellor,73189717.0,75319579.0,164341.74984729264,176149.30941127363,0.18,21771581.0
Bitget,"BNB Chain Ecosystem, Solana Ecosystem, Polygon Ecosystem, Meme, Ethereum Ecosystem, Cronos Ecosystem, Dog-Themed, Elon Musk-Inspired, Fuse Ecosystem",dogelon-mars,73320532.0,133394953.0,126757.12191780306,177125.47674667384,0.37,10682594.0
Bitget,"Meme, Ethereum Ecosystem, Mantle Ecosystem",puff-the-dragon,72963396.0,72963396.0,,,N/A,102485.0
Bitget,"Exchange-based Tokens, Centralized Exchange (CEX) Token, Ethereum Ecosystem",hashkey-ecopoints,72611775.0,548013393.0,,,N/A,1423627.0
Bitget,"Entertainment, Gaming (GameFi), NFT, Axie Infinity Ecosystem, Play To Earn, Ethereum Ecosystem, Ronin Ecosystem, Gaming Utility Token",smooth-love-potion,72289424.0,72289424.0,49609.74905684458,54502.02643999015,0.17,8650825.0
Bitget,Retail,milk-alliance,72364910.0,162450787.0,,,N/A,9885543.0
Bitget,"Decentralized Exchange (DEX), Decentralized Finance (DeFi), Yield Farming, Automated Market Maker (AMM), BNB Chain Ecosystem, Avalanche Ecosystem, Arbitrum Ecosystem, Mantle Ecosystem, DeFiance Capital Portfolio, Delphi Ventures Portfolio, Dex Aggregator",joe,72037776.0,92252887.0,103098.55665076013,87669.23453448778,0.22,8534072.0
Bitget,"Artificial Intelligence (AI), BNB Chain Ecosystem, Ethereum Ecosystem, DragonFly Capital Portfolio, Binance Labs Portfolio, Delphi Ventures Portfolio, OKX Ventures Portfolio, Binance HODLer Airdrops, AI Agent Launchpad, Binance Alpha Spotlight, AI Framework",myshell,71671249.0,265449069.0,149797.4584719704,190598.2136264392,0.04,64808115.0
Bitget,"Gaming (GameFi), Play To Earn, TON Ecosystem, Tap to Earn, Arcade Games",watcoin-2,71396339.0,79262798.0,,,N/A,766994.0
Bitget,"Stablecoins, Decentralized Finance (DeFi), USD Stablecoin, BNB Chain Ecosystem, Polygon Ecosystem, Gnosis Chain Ecosystem, Arbitrum Ecosystem, Ethereum Ecosystem, Optimism Ecosystem, Base Ecosystem, Crypto-backed Stablecoin, Fiat-backed Stablecoin",crvusd,71176329.0,71176329.0,,,N/A,8887468.0
Bitget,"Artificial Intelligence (AI), Ethereum Ecosystem",0x0-ai-ai-smart-contract,70643480.0,70643480.0,482.8313149820855,106.28656422934115,1.36,177683.0
Bitget,"Tokenized Assets, Polygon Ecosystem, Arbitrum Ecosystem, Ethereum Ecosystem, Real World Assets (RWA), Starknet Ecosystem, Tokenized Treasury Bills (T-Bills)",spiko-us-t-bills-money-market-fund,69530892.0,69530892.0,,,N/A,0.0
Bitget,"Ethereum Ecosystem, DePIN",dent,69463167.0,72618468.0,63528.31911095971,46587.93043105908,0.14,5653753.0
Bitget,"Smart Contract Platform, Polkadot Ecosystem, Layer 1 (L1), DePIN, Outlier Ventures Portfolio",peaq-2,69877049.0,409972640.0,78857.621613049,47211.90922489384,0.1,12361834.0
Bitget,"Lending/Borrowing Protocols, Solana Ecosystem, FTX Holdings, Coinbase Ventures Portfolio, Alameda Research Portfolio, DragonFly Capital Portfolio",solend,69360419.0,137087973.0,,,N/A,10188.07
Bitget,"Gaming (GameFi), NFT, Collectibles, Play To Earn, Ethereum Ecosystem, Base Ecosystem, Energi Ecosystem",ecomi,69500284.0,79742723.0,,,N/A,2087975.0
Bitget,"Decentralized Finance (DeFi), Lending/Borrowing Protocols, Ethereum Ecosystem, Real World Assets (RWA), Coinbase Ventures Portfolio, Andreessen Horowitz (a16z) Portfolio, RWA Protocol, Made in USA",goldfinch,69327307.0,85754017.0,1159.1298834988127,1154.5104066309498,0.53,483090.0
Bitget,"Smart Contract Platform, Gaming (GameFi), NFT, Binance Launchpool, Arbitrum Ecosystem, Layer 3 (L3), XAI Ecosystem, Gaming Blockchains, Outlier Ventures Portfolio",xai-blockchain,69033402.0,101618245.0,132552.99464574887,165460.17691952205,0.31,32534264.0
Bitget,"Smart Contract Platform, Layer 1 (L1), DWF Labs Portfolio, Radix Ecosystem",radix,69022437.0,84517866.0,1824.724194756601,3331.3967056879656,0.77,1315258.0
Bitget,"Decentralized Exchange (DEX), Exchange-based Tokens, Decentralized Finance (DeFi), BNB Chain Ecosystem, Binance Launchpool, Polygon Ecosystem, Near Protocol Ecosystem, Arbitrum Ecosystem, Ethereum Ecosystem, DWF Labs Portfolio, Coinbase Ventures Portfolio, Alameda Research Portfolio, DeFiance Capital Portfolio, Pantera Capital Portfolio, Aurora Ecosystem, Energi Ecosystem, Binance Labs Portfolio, Galaxy Digital Portfolio",dodo,68706409.0,68706409.0,81331.61730969402,120202.93887665079,0.29,6322242.0
Bitget,"Optimism Ecosystem, Bridged WETH, Bridged-Tokens",l2-standard-bridged-weth-optimism,68298398.0,68298398.0,,,N/A,39297447.0
Bitget,"Artificial Intelligence (AI), Cardano Ecosystem, Ethereum Ecosystem, AI Agents, Sora Ecosystem",singularitynet,68070557.0,102851001.0,,,N/A,87035.0
Bitget,"Stablecoins, Decentralized Finance (DeFi), USD Stablecoin, BNB Chain Ecosystem, Avalanche Ecosystem, Arbitrum Ecosystem, Liquid Staking Tokens, Ethereum Ecosystem, Optimism Ecosystem, Fiat-backed Stablecoin",staked-frax,68340729.0,68340729.0,,,N/A,113.33
Bitget,"Artificial Intelligence (AI), Solana Ecosystem, DePIN",nosana,68226454.0,81806299.0,,,N/A,841940.0
Bitget,"NFT, Ethereum Ecosystem",superrare,67866623.0,84793963.0,171015.73639019963,291624.5526579994,0.12,101981159.0
Bitget,"Artificial Intelligence (AI), Decentralized Finance (DeFi), Solana Ecosystem, Arbitrum Ecosystem, Metis Ecosystem, AI Agents, Sonic Ecosystem, IOTA EVM Ecosystem, AI Applications, DeFAI",heyanon,67955089.0,111983566.0,,,N/A,4966125.0
Bitget,"Meme, Dog-Themed, TON Ecosystem, TON Meme",dogs-2,67594374.0,71943698.0,269912.3774394061,323364.9043840556,0.08,17468651.0
Bitget,"Decentralized Finance (DeFi), Oracle, Ethereum Ecosystem, DWF Labs Portfolio, Pantera Capital Portfolio",api3,67603735.0,84366511.0,60618.94900021006,82506.08549262039,0.35,13349913.0
Bitget,"Artificial Intelligence (AI), Business Services, Decentralized Finance (DeFi), Ethereum Ecosystem, Paradigm Portfolio, DragonFly Capital Portfolio, Energi Ecosystem",numeraire,67380265.0,90233141.0,29992.22658572015,28515.524163123748,0.36,6733710.0
Bitget,"Solana Ecosystem, Wallets, Base Ecosystem, TON Ecosystem",bitget-wallet-token,67182897.0,470072637.0,,,N/A,3631.06
Bitget,"Decentralized Finance (DeFi), Lending/Borrowing Protocols, Arbitrum Ecosystem, Ethereum Ecosystem, Alameda Research Portfolio, Pantera Capital Portfolio",liquity,67148707.0,69032868.0,96524.45084040333,95591.42740238848,0.29,24625298.0
Bitget,"Decentralized Finance (DeFi), Solana Ecosystem, Real World Assets (RWA), Payment Solutions, DePIN, Coinbase Ventures Portfolio, Alameda Research Portfolio, Circle Ventures Portfolio, OKX Ventures Portfolio, RWA Protocol, Made in USA",zebec-network,66927950.0,90322495.0,1982.7986575310676,10728.526320922845,0.22,18019208.0
Bitget,"Smart Contract Platform, Ethereum Ecosystem, Layer 2 (L2), Zero Knowledge (ZK), Rollup, OKX Ventures Portfolio",taiko,66886447.0,632523103.0,122995.96091818399,122638.08624148721,0.05,16993443.0
Bitget,"Decentralized Finance (DeFi), Ethereum Ecosystem, Restaking",kelp-gain,66434303.0,66434303.0,,,N/A,409897.0
Bitget,Ethereum Ecosystem,saasgo,66373674.0,82967093.0,,,N/A,287435.0
Bitget,"Decentralized Finance (DeFi), Lending/Borrowing Protocols, Solana Ecosystem, Binance Alpha Spotlight",kamino,66031583.0,489122839.0,33353.9041660031,38117.206199371096,0.04,9010182.0
Bitget,SocialFi,steem,65192079.0,65213980.0,,,N/A,13539463.0
Bitget,"Artificial Intelligence (AI), Smart Contract Platform, Layer 1 (L1), Ethereum Ecosystem, Osmosis Ecosystem, AI Agents, AI Agent Launchpad",humans-ai,64760172.0,64760172.0,,,N/A,116586.0
Bitget,"BNB Chain Ecosystem, Binance Megadrop, BTCfi",solv-protocol,64816596.0,367232841.0,86768.76386153672,310610.85823420895,0.07,175795681.0
Bitget,"Artificial Intelligence (AI), Launchpad, Base Ecosystem, AI Applications, Clanker Ecosystem, Binance Alpha Spotlight",tokenbot-2,65085238.0,65085238.0,2061.8938766436854,2528.4448847852946,0.52,7511305.0
Bitget,"Smart Contract Platform, Layer 1 (L1), Ethereum Ecosystem, Proof of Stake (PoS)",pundi-aifx,64024073.0,64024073.0,,,N/A,243909.0
Bitget,Unknown,origin-ether,,,,,N/A,
Bitget,Unknown,medibloc,,,,,N/A,
Bitget,"Stablecoins, USD Stablecoin, Fiat-backed Stablecoin",falcon-finance,64177224.0,64177224.0,,,N/A,24826.0
Bitget,"Decentralized Finance (DeFi), BNB Chain Ecosystem, Solana Ecosystem, Wallets, Polygon Ecosystem, Ethereum Ecosystem, Binance Launchpad, DWF Labs Portfolio, Multicoin Capital Portfolio, Alameda Research Portfolio, Viction Ecosystem, Binance Labs Portfolio",coin98,64012831.0,71059583.0,348839.4924454913,262468.4929537313,0.42,31842897.0
Bitget,"Smart Contract Platform, Binance Launchpool, Layer 2 (L2), Scroll Ecosystem",scroll,63842761.0,336014529.0,50813.94487001074,77402.07678944782,0.3,17855984.0
Bitget,"Smart Contract Platform, Layer 1 (L1), Proof of Work (PoW), Privacy Blockchain",ergo,63743264.0,77832211.0,,,N/A,70447.0
Bitget,E-commerce,pay-coin,63723380.0,118401340.0,7899.212958933079,9645.809954052405,0.52,3095323.0
Bitget,"Solana Ecosystem, Restaking, Liquid Restaking Tokens, Liquid Restaked SOL",renzo-restaked-sol,63696323.0,63696323.0,,,N/A,1221234.0
Bitget,"Artificial Intelligence (AI), BNB Chain Ecosystem, Ethereum Ecosystem, DePIN, AI Agents",netmind-token,63569414.0,202204864.0,5391.152132957672,7170.826320545411,0.21,1879093.0
Bitget,"Decentralized Exchange (DEX), Decentralized Finance (DeFi), Sui Ecosystem, Animoca Brands Portfolio, OKX Ventures Portfolio, Dex Aggregator",cetus-protocol,63346304.0,92790082.0,7402.368588298358,17776.08223361254,0.11,15233091.0
Bitget,"Polkadot Ecosystem, Real World Assets (RWA), Coinbase Ventures Portfolio, Circle Ventures Portfolio, Galaxy Digital Portfolio, RWA Protocol",centrifuge,63167153.0,69237876.0,,,N/A,1074421.0
Bitget,"Solana Ecosystem, Meme, Pump.fun Ecosystem",der-daku,62860556.0,62860556.0,,,N/A,206946.0
Bitget,"Base Ecosystem, Cybersecurity, Binance Labs Portfolio, OKX Ventures Portfolio, Binance Alpha Spotlight",goplus-security,61973243.0,341751644.0,74565.95161448777,83740.96860254805,0.03,28811426.0
Bitget,"Meme, Base Ecosystem, Dog-Themed, Base Meme, Farcaster Ecosystem",doginme,68380256.0,68380256.0,,,N/A,11807420.0
Bitget,"Smart Contract Platform, Layer 2 (L2), Made in USA",metal,61221951.0,61221951.0,59319.37560723019,46255.1834927727,0.41,669937.0
Bitget,"Infrastructure, Smart Contract Platform, BNB Chain Ecosystem, Avalanche Ecosystem, Polygon Ecosystem, Arbitrum Ecosystem, Ethereum Ecosystem, Optimism Ecosystem, Layer 2 (L2), Base Ecosystem, Binance Launchpad, Modular Blockchain, Layer 3 (L3), Rollup, Proof of Stake (PoS), Appchains, Binance Labs Portfolio",cartesi,60994556.0,70986699.0,47316.298711273936,52160.11432504078,0.42,9217096.0
Bitget,"Artificial Intelligence (AI), Decentralized Finance (DeFi), Ethereum Ecosystem, DePIN",pinlink,60317843.0,75397303.0,,,N/A,1436981.0
Bitget,,ark,60852984.0,61374953.0,32313.272290644214,53794.0377700169,0.25,7355013.0
Bitget,"Stablecoins, USD Stablecoin, Ethereum Ecosystem, Fiat-backed Stablecoin",binance-usd,60485974.0,60485974.0,,,N/A,270962.0
Bitget,"Smart Contract Platform, Layer 1 (L1), Proof of Work (PoW), Made in USA",quai-network,60442894.0,376388600.0,,,N/A,6909909.0
Bitget,"Exchange-based Tokens, BNB Chain Ecosystem, Centralized Exchange (CEX) Token, Polygon Ecosystem, Ethereum Ecosystem",bit2me,60317230.0,60926495.0,,,N/A,87138.0
Bitget,"Artificial Intelligence (AI), Solana Ecosystem, Polygon Ecosystem, Gnosis Chain Ecosystem, Arbitrum Ecosystem, Celo Ecosystem, Ethereum Ecosystem, Optimism Ecosystem, Base Ecosystem, AI Agents, Mode Ecosystem, AI Agent Launchpad, Binance Alpha Spotlight, AI Framework, DeFAI",autonolas,60319376.0,176436485.0,,,N/A,425663.0
Bitget,"Stablecoins, USD Stablecoin, Arbitrum Ecosystem, Ethereum Ecosystem, Fiat-backed Stablecoin",lift-dollar,60170577.0,60170577.0,,,N/A,658133.0
Bitget,"Decentralized Finance (DeFi), Ethereum Ecosystem, Liquid Staking",usualx,59918453.0,59918453.0,,,N/A,607418.0
Bitget,"Gaming (GameFi), Ethereum Ecosystem, Telegram Apps, Gaming Platform",gamebuild,59257087.0,74596396.0,22225.873205218515,17587.601728182915,0.74,21223180.0
Bitget,"Infrastructure, Smart Contract Platform",ardor,59105191.0,59105191.0,,,N/A,5942945.0
Bitget,"Artificial Intelligence (AI), Infrastructure, Gaming (GameFi), NFT, Solana Ecosystem, Arbitrum Ecosystem, Impossible Finance Launchpad, Ethereum Ecosystem, Animoca Brands Portfolio, Base Ecosystem",carv,58941907.0,294576732.0,16493.093180744694,20180.667369189872,0.17,12187399.0
Bitget,"SocialFi, Solana Ecosystem",access-protocol,58722777.0,127492273.0,,,N/A,854952.0
