Bitget,"Gaming (GameFi), NFT, BNB Chain Ecosystem",infinitar-governance-token,80434609.0,376004974.0,,,N/A,4753613.0
Bitget,"Smart Contract Platform, Cosmos Ecosystem, Modular Blockchain, Osmosis Ecosystem, Rollups-as-a-Service (RaaS)",dymension,79999780.0,304309830.0,80859.37643380836,92290.74966891244,0.03,23641901.0
Bitget,"Stablecoins, USD Stablecoin, Solana Ecosystem, Ethereum Ecosystem, Multicoin Capital Portfolio, Fiat-backed Stablecoin",paxos-standard,79460033.0,79460033.0,,,N/A,7480800.0
Bitget,"Smart Contract Platform, Gaming (GameFi), NFT, Layer 1 (L1), Play To Earn, Ethereum Ecosystem, Animoca Brands Portfolio, Gaming Blockchains, Pantera Capital Portfolio, OKX Ventures Portfolio",wax,79359186.0,85388043.0,39013.43046287009,42816.18276262174,0.13,9170134.0
Bitget,"Exchange-based Tokens, Centralized Exchange (CEX) Token, Ethereum Ecosystem",hashkey-ecopoints,79083717.0,596858244.0,,,N/A,665717.0
Bitget,"Artificial Intelligence (AI), Base Ecosystem, AI Agents, AI Applications, Made in USA",venice-token,78964167.0,191480867.0,,,N/A,12184561.0
Bitget,"Smart Contract Platform, Meme, Ethereum Ecosystem, Layer 2 (L2), Shibarium Ecosystem, Dog-Themed",bone-shibaswap,78989124.0,79022197.0,9803.592272122563,14218.675716786494,0.32,4559654.0
Bitget,"Smart Contract Platform, Layer 1 (L1)",ong,78997722.0,192790685.0,26221.244441783332,33811.48983135085,0.26,3183280.0
Bitget,"Internet of Things (IOT), BNB Chain Ecosystem, Ethereum Ecosystem, DePIN, DWF Labs Portfolio",mass-vehicle-ledger,78761861.0,82781393.0,1953.9840286085946,2350.546481626949,0.87,828450.0
Bitget,"Optimism Ecosystem, Bridged WBTC, Bridged-Tokens",optimism-bridged-wbtc-optimism,77787481.0,77787481.0,,,N/A,2105792.0
Bitget,Ethereum Ecosystem,dkargo,78084311.0,83304741.0,,,N/A,2235629.0
Bitget,"Blast Ecosystem, Bridged WETH, Bridged-Tokens",l2-standard-bridged-weth-blast,77964274.0,77964274.0,,,N/A,1872260.0
Bitget,"Meme, Ethereum Ecosystem, PolitiFi",constitutiondao,77178146.0,77178146.0,612876.1465018704,597643.4486545417,0.07,18910775.0
Bitget,"Smart Contract Platform, Privacy, Proof of Work (PoW), Made in USA",verge,77177586.0,77331964.0,,,N/A,4789504.0
Bitget,"Smart Contract Platform, Proof of Stake (PoS)",stratis,76714081.0,81290061.0,22428.397235124132,26329.53379651757,0.64,1718001.0
Bitget,"Decentralized Finance (DeFi), Solana Ecosystem, Real World Assets (RWA), Payment Solutions, DePIN, Coinbase Ventures Portfolio, Alameda Research Portfolio, Circle Ventures Portfolio, OKX Ventures Portfolio, RWA Protocol, Made in USA",zebec-network,76085993.0,99628254.0,4273.147793474643,8696.7814027271,0.2,11983695.0
Bitget,"Exchange-based Tokens, Centralized Exchange (CEX) Token, Ethereum Ecosystem",bitmart-token,75861162.0,142913437.0,,,N/A,4274921.0
Bitget,"Smart Contract Platform, Layer 1 (L1), Zero Knowledge (ZK), Andreessen Horowitz (a16z) Portfolio, Privacy Blockchain, Made in USA",aleo,75573705.0,358570999.0,,,N/A,6764623.0
Bitget,"Gaming (GameFi), Play To Earn, Guild and Scholarship, Ethereum Ecosystem, Animoca Brands Portfolio, Base Ecosystem, DWF Labs Portfolio, Ronin Ecosystem, Coinbase Ventures Portfolio, DeFiance Capital Portfolio, Pantera Capital Portfolio, YZi Labs (Prev. Binance Labs) Portfolio, MMO",zentry,75007537.0,108322637.0,5272.638196450454,6234.789853223174,0.99,8595016.0
Bitget,"Software as a service, Polygon Ecosystem, Ethereum Ecosystem, Decentralized Identifier (DID), Pantera Capital Portfolio, Energi Ecosystem, Blockchain Capital Portfolio",civic,74771474.0,93231263.0,27203.36804358978,35037.059798590315,0.11,8652759.0
Bitget,"Meme, Dog-Themed, TON Ecosystem, TON Meme",dogs-2,74376535.0,79162253.0,383690.36669729004,414284.3811228435,0.07,26181000.0
Bitget,"Decentralized Exchange (DEX), Decentralized Finance (DeFi), Sui Ecosystem, Animoca Brands Portfolio, OKX Ventures Portfolio, Dex Aggregator",cetus-protocol,73897127.0,106894985.0,17678.42788274403,29711.607484009655,0.09,18948439.0
Bitget,"BNB Chain Ecosystem, Solana Ecosystem, Polygon Ecosystem, Meme, Ethereum Ecosystem, Cronos Ecosystem, Dog-Themed, Elon Musk-Inspired, Fuse Ecosystem",dogelon-mars,73999425.0,134630089.0,100133.97284192915,131178.7344384221,0.29,5115099.0
Bitget,"Sports, BNB Chain Ecosystem",pixer-eternity,73324167.0,340744363.0,,,N/A,644007.0
Bitget,"Smart Contract Platform, Layer 1 (L1), Osmosis Ecosystem, XRP Ledger Ecosystem",coreum,73314228.0,73314228.0,1554.9117686124591,496.17607490127233,1.41,173651.0
Bitget,"Layer 1 (L1), Real World Assets (RWA), Payment Solutions, Base Ecosystem, Stablecoin Protocol",keeta,73205916.0,183014790.0,,,N/A,8724690.0
Bitget,"Infrastructure, Smart Contract Platform, Oracle, Layer 1 (L1), Animoca Brands Portfolio, Coinbase Ventures Portfolio, Cross-chain Communication, Made in USA",supra,72762453.0,500036775.0,,,N/A,3314249.0
Bitget,"Tokenized Assets, Polygon Ecosystem, Arbitrum Ecosystem, Ethereum Ecosystem, Real World Assets (RWA), Starknet Ecosystem, Tokenized Treasury Bills (T-Bills)",spiko-us-t-bills-money-market-fund,72732761.0,72645709.0,,,N/A,0.0
Bitget,"Business Services, Decentralized Finance (DeFi), Oracle, Polygon Ecosystem, Gnosis Chain Ecosystem, Arbitrum Ecosystem, Ethereum Ecosystem, Optimism Ecosystem, Manta Network Ecosystem, YZi Labs (Prev. Binance Labs) Portfolio, Lisk Ecosystem, Made in USA",tellor,72571197.0,74680831.0,113650.67947175245,131436.84111293187,0.11,18801107.0
Bitget,"Smart Contract Platform, Polkadot Ecosystem, Layer 1 (L1), Coinbase Ventures Portfolio, Proof of Stake (PoS), YZi Labs (Prev. Binance Labs) Portfolio",moonbeam,72085916.0,86860561.0,94286.3438461167,78691.08557292745,0.4,4855899.0
Bitget,"Decentralized Finance (DeFi), Lending/Borrowing Protocols, Moonbeam Ecosystem, Base Ecosystem, Coinbase Ventures Portfolio, Made in USA",moonwell-artemis,72149992.0,109199607.0,,,N/A,3028694.0
Bitget,Smart Contract Platform,songbird,71884531.0,85413745.0,,,N/A,238385.0
Bitget,"Stablecoins, USD Stablecoin, Osmosis Ecosystem, Fiat-backed Stablecoin",usdx,71866507.0,71866507.0,,,N/A,15469.7
Bitget,"Gaming (GameFi), Solana Ecosystem, Meme, Ethereum Ecosystem, Frog-Themed, Gaming Platform, The Boy’s Club",pepecoin-2,71654226.0,71654226.0,277.1858190568831,6578.0470532855325,0.45,1427635.0
Bitget,"Decentralized Finance (DeFi), Wallets, Ethereum Ecosystem, Pundi AIFX Omnilayer Ecosystem",pundi-x-2,71296347.0,71296347.0,18575.50286275204,29566.379881433837,0.29,6180828.0
Bitget,"Decentralized Finance (DeFi), Lending/Borrowing Protocols, Solana Ecosystem, Binance Alpha Spotlight",kamino,70917511.0,525314894.0,26085.485156331008,28654.31334252746,0.08,10362019.0
Bitget,"Wrapped-Tokens, Solana Ecosystem",wrapped-fragsol,70858002.0,70867075.0,,,N/A,3297922.0
Bitget,"Ethereum Ecosystem, DePIN",dent,70659991.0,73869657.0,67161.41496052129,62228.50741493058,0.27,6219749.0
Bitget,"Polkadot Ecosystem, Real World Assets (RWA), Coinbase Ventures Portfolio, Circle Ventures Portfolio, Galaxy Digital Portfolio, RWA Protocol",centrifuge,70635707.0,77354671.0,,,N/A,347739.0
Bitget,BNB Chain Ecosystem,metfi-2,70512941.0,234567505.0,,,N/A,331353.0
Bitget,Retail,milk-alliance,70533847.0,156016056.0,,,N/A,2949630.0
Bitget,"Ethereum Ecosystem, Telegram Apps, Binance HODLer Airdrops",banana-gun,69805923.0,169233877.0,91227.99038299813,97026.79562488194,0.1,38420636.0
Bitget,"Smart Contract Platform, Ethereum Ecosystem, Layer 2 (L2), Zero Knowledge (ZK), Rollup, OKX Ventures Portfolio",taiko,69308538.0,673346632.0,70216.63576868181,76132.90536548506,0.13,16074861.0
Bitget,"Lending/Borrowing Protocols, Solana Ecosystem, FTX Holdings, Coinbase Ventures Portfolio, Alameda Research Portfolio, DragonFly Capital Portfolio",solend,69360419.0,137087973.0,,,N/A,23100.0
Bitget,"Decentralized Exchange (DEX), Decentralized Finance (DeFi), Yield Farming, Automated Market Maker (AMM), BNB Chain Ecosystem, Avalanche Ecosystem, Arbitrum Ecosystem, Mantle Ecosystem, DeFiance Capital Portfolio, Delphi Ventures Portfolio, Dex Aggregator",joe,69087548.0,87080861.0,108819.1774738061,92160.6807643598,0.17,23384122.0
Bitget,"Artificial Intelligence (AI), Infrastructure, Ethereum Ecosystem, AI Framework, Made in USA",arcblock,68500677.0,129246560.0,,,N/A,3066143.0
Bitget,"Smart Contract Platform, Gaming (GameFi), Layer 1 (L1), Proof of Stake (PoS), Gaming Blockchains",oasys,68175181.0,172947262.0,44262.08625350505,17419.828375846744,0.06,542440.0
Bitget,"Artificial Intelligence (AI), Decentralized Finance (DeFi), Ethereum Ecosystem, DePIN",pinlink,68311432.0,85389291.0,,,N/A,1367154.0
Bitget,"Exchange-based Tokens, Centralized Exchange (CEX) Token, Near Protocol Ecosystem, Harmony Ecosystem, Ethereum Ecosystem, Multicoin Capital Portfolio, Alameda Research Portfolio, Elastos Smart Contract Chain Ecosystem, Sequoia Capital Portfolio, Made in China",huobi-token,67941075.0,85690291.0,,,N/A,6920.23
Bitget,"Artificial Intelligence (AI), Smart Contract Platform, Decentralized Finance (DeFi), Analytics, NFT, BNB Chain Ecosystem, Launchpad, Ethereum Ecosystem, Telegram Apps, Discord Bots, ChainGPT Launchpad, Poolz Finance Launchpad, AI Agents, AI Applications, Binance Alpha Spotlight, AI Framework, DeFAI",chaingpt,67645409.0,84317076.0,57910.86843462109,64920.74818823794,0.02,25651878.0
Bitget,"Meme, PulseChain Ecosystem",the-grays-currency,67394802.0,67394802.0,,,N/A,148783.0
Bitget,"Entertainment, Gaming (GameFi), NFT, Axie Infinity Ecosystem, Play To Earn, Ethereum Ecosystem, Ronin Ecosystem, Gaming Utility Token",smooth-love-potion,66999487.0,66999487.0,33925.34387262428,42732.32116373867,0.12,7974082.0
Bitget,"Meme, Ethereum Ecosystem, Mantle Ecosystem",puff-the-dragon,66952503.0,66952503.0,,,N/A,67217.0
Bitget,"Smart Contract Platform, Wallets, Layer 2 (L2), Osmosis Ecosystem",islamic-coin,67174889.0,791984619.0,,,N/A,726702.0
Bitget,"Artificial Intelligence (AI), Business Services, Decentralized Finance (DeFi), Ethereum Ecosystem, Paradigm Portfolio, DragonFly Capital Portfolio, Energi Ecosystem",numeraire,67068470.0,89471289.0,19933.093516889505,27894.712454992594,0.24,7779611.0
Bitget,"Decentralized Exchange (DEX), Exchange-based Tokens, Decentralized Finance (DeFi), BNB Chain Ecosystem, Binance Launchpool, Polygon Ecosystem, Near Protocol Ecosystem, Arbitrum Ecosystem, Ethereum Ecosystem, DWF Labs Portfolio, Coinbase Ventures Portfolio, Alameda Research Portfolio, DeFiance Capital Portfolio, Pantera Capital Portfolio, Aurora Ecosystem, Energi Ecosystem, YZi Labs (Prev. Binance Labs) Portfolio, Galaxy Digital Portfolio",dodo,66365949.0,66365949.0,96534.30898072268,94011.72442715686,0.3,14052050.0
Bitget,"Decentralized Finance (DeFi), Lending/Borrowing Protocols, Arbitrum Ecosystem, Ethereum Ecosystem, Alameda Research Portfolio, Pantera Capital Portfolio",liquity,66369958.0,68179513.0,90023.0178570848,74522.88565100367,0.29,12207987.0
Bitget,Ethereum Ecosystem,saasgo,66132019.0,82665024.0,,,N/A,197573.0
Bitget,"Stablecoins, USD Stablecoin, Seigniorage, Alleged SEC Securities, Osmosis Ecosystem, Stablecoin Protocol, DeFiance Capital Portfolio, Terra Classic Ecosystem, YZi Labs (Prev. Binance Labs) Portfolio, Delphi Ventures Portfolio, Galaxy Digital Portfolio, Fiat-backed Stablecoin",terrausd,65708236.0,93096529.0,110797.4386698078,98443.24096864951,0.25,5440635.0
Bitget,"Solana Ecosystem, Avalanche Ecosystem, Polygon Ecosystem, Ethereum Ecosystem, Aptos Ecosystem, Real World Assets (RWA), Ink Ecosystem",apollo-diversified-credit-securitize-fund,65649606.0,65649606.0,,,N/A,0.0
Bitget,Ethereum Ecosystem,devve,65407018.0,89814014.0,,,N/A,800249.0
Bitget,SocialFi,steem,65228496.0,65328594.0,,,N/A,18413754.0
Bitget,"Decentralized Finance (DeFi), USD Stablecoin, BNB Chain Ecosystem, Avalanche Ecosystem, Arbitrum Ecosystem, Liquid Staking Tokens, Ethereum Ecosystem, Optimism Ecosystem, Fiat-backed Stablecoin",staked-frax,65105249.0,65105249.0,,,N/A,6382.77
Bitget,"Artificial Intelligence (AI), Cardano Ecosystem, Ethereum Ecosystem, AI Agents, Sora Ecosystem",singularitynet,64968989.0,97744438.0,,,N/A,12181.29
Bitget,"Solana Ecosystem, Restaking, Liquid Restaking Tokens, Liquid Restaked SOL",renzo-restaked-sol,64486441.0,64486441.0,,,N/A,51738.0
Bitget,BNB Chain Ecosystem,diamond-launch,64481457.0,144836061.0,,,N/A,439240.0
Bitget,"Smart Contract Platform, Gaming (GameFi), NFT, Binance Launchpool, Arbitrum Ecosystem, Layer 3 (L3), XAI Ecosystem, Gaming Blockchains, Outlier Ventures Portfolio",xai-blockchain,64293091.0,95465999.0,166685.4201268585,193429.92940977705,0.17,41404379.0
Bitget,"Artificial Intelligence (AI), Decentralized Finance (DeFi), Solana Ecosystem, Arbitrum Ecosystem, Metis Ecosystem, AI Agents, Sonic Ecosystem, IOTA EVM Ecosystem, AI Applications, DeFAI",heyanon,63809061.0,102359352.0,,,N/A,4428620.0
Bitget,"Optimism Ecosystem, Bridged WETH, Bridged-Tokens",l2-standard-bridged-weth-optimism,63899029.0,63627270.0,,,N/A,7728774.0
Bitget,"Gaming (GameFi), Ethereum Ecosystem, Telegram Apps, Gaming Platform",gamebuild,63233773.0,78857955.0,7743.392396602095,12023.9865637168,0.3,10520882.0
Bitget,"Gaming (GameFi), NFT, Metaverse, Collectibles, Play To Earn, Ethereum Ecosystem, Base Ecosystem, Energi Ecosystem",ecomi,63248221.0,72569277.0,,,N/A,2067466.0
Bitget,"Healthcare, Osmosis Ecosystem",medibloc,62675555.0,67886307.0,,,N/A,191063.0
Bitget,"Smart Contract Platform, Layer 1 (L1), Proof of Work (PoW), Privacy Blockchain",ergo,62543460.0,76140410.0,,,N/A,111365.0
Bitget,"Meme, Base Ecosystem, Cat-Themed, Base Meme",keyboard-cat-base,62569804.0,62569804.0,,,N/A,7448347.0
Bitget,"Stablecoins, USD Stablecoin, BNB Chain Ecosystem, Fantom Ecosystem, Arbitrum Ecosystem, Ethereum Ecosystem, Optimism Ecosystem, Base Ecosystem, Crypto-backed Stablecoin, Fiat-backed Stablecoin",dola-usd,62499380.0,214207038.0,,,N/A,2935233.0
Bitget,"Smart Contract Platform, Cosmos Ecosystem, Osmosis Ecosystem, Alameda Research Portfolio, DragonFly Capital Portfolio, DeFiance Capital Portfolio, Privacy Blockchain, Outlier Ventures Portfolio",secret,62305756.0,65542293.0,,,N/A,3629592.0
Bitget,"Decentralized Finance (DeFi), BNB Chain Ecosystem, Solana Ecosystem, Wallets, Polygon Ecosystem, Ethereum Ecosystem, Binance Launchpad, DWF Labs Portfolio, Multicoin Capital Portfolio, Alameda Research Portfolio, Viction Ecosystem, YZi Labs (Prev. Binance Labs) Portfolio",coin98,61538727.0,65895137.0,342732.5140636083,391055.9927494064,0.45,15984700.0
Bitget,"Decentralized Finance (DeFi), Yield Farming, BNB Chain Ecosystem, Binance Launchpool, Yield Aggregator, Ethereum Ecosystem, Manta Network Ecosystem, YZi Labs (Prev. Binance Labs) Portfolio",bella-protocol,62217407.0,77771759.0,40208.14799936208,81367.26351235178,0.1,30814515.0
Bitget,"BNB Chain Ecosystem, Meme, Binance Alpha Spotlight, Four.meme Ecosystem",test-3,61319666.0,61319666.0,88294.39834704352,96540.91201260342,0.14,59657659.0
Bitget,"Smart Contract Platform, Layer 2 (L2), Made in USA",metal,61241197.0,61241197.0,48427.17000886525,54646.65768683629,0.28,951488.0
Bitget,"Exchange-based Tokens, BNB Chain Ecosystem, Centralized Exchange (CEX) Token, Polygon Ecosystem, Ethereum Ecosystem",bit2me,60994300.0,61610404.0,,,N/A,62062.0
Bitget,"Solana Ecosystem, Meme, Ethereum Ecosystem, Cronos Ecosystem, Dog-Themed, AI Meme",corgiai,60441229.0,65538379.0,,,N/A,79240.0
Bitget,E-commerce,pay-coin,60851926.0,113066031.0,7585.049856482078,9418.432001067811,0.34,326425.0
Bitget,"Meme, Ethereum Ecosystem, Frog-Themed, Murad Picks, Binance Alpha Spotlight",apu-s-club,60646944.0,60646944.0,8047.934476115683,7695.123089261366,0.56,3023875.0
Bitget,"Solana Ecosystem, Meme, Solana Meme, Pump.fun Ecosystem",comedian,60325927.0,60325927.0,15269.72230722339,12026.788552593398,0.33,19940779.0
Bitget,"Artificial Intelligence (AI), Smart Contract Platform, DePIN",ao-computer,59989755.0,59989755.0,,,N/A,1451548.0
Bitget,"Decentralized Finance (DeFi), BNB Chain Ecosystem, Arbitrum Ecosystem, Ethereum Ecosystem, Multicoin Capital Portfolio, Energi Ecosystem",dforce-token,60102024.0,60102024.0,,,N/A,19703192.0
Bitget,"Artificial Intelligence (AI), Smart Contract Platform, Layer 1 (L1), Ethereum Ecosystem, Osmosis Ecosystem, AI Agents, AI Agent Launchpad",humans-ai,59859670.0,59859670.0,,,N/A,52249.0
Bitget,Ethereum Ecosystem,ai-analysis-token,59404380.0,269169277.0,,,N/A,114155.0
Bitget,"Decentralized Exchange (DEX), Decentralized Finance (DeFi), Automated Market Maker (AMM), BNB Chain Ecosystem, Avalanche Ecosystem, Polygon Ecosystem, Fantom Ecosystem, Arbitrum Ecosystem, Ethereum Ecosystem, Optimism Ecosystem, ZkSync Ecosystem, Linea Ecosystem, Pantera Capital Portfolio, Polygon zkEVM Ecosystem, YZi Labs (Prev. Binance Labs) Portfolio",kyber-network-crystal,58943042.0,83127601.0,47946.24535586822,97632.53738126525,0.14,16858580.0
Bitget,"Artificial Intelligence (AI), NFT, Metaverse, Solana Ecosystem, Polygon Ecosystem, Ethereum Ecosystem, Cronos Ecosystem, Base Ecosystem, Multicoin Capital Portfolio, AI Agents, Alameda Research Portfolio, DeFiance Capital Portfolio, YZi Labs (Prev. Binance Labs) Portfolio",alethea-artificial-liquid-intelligence-token,58947448.0,71047180.0,,,N/A,1330400.0
Bitget,"Infrastructure, Smart Contract Platform, Ethereum Ecosystem, Data Availability, Modular Blockchain",avail,58905883.0,298385726.0,77920.22685122312,110888.21293067267,0.35,4402287.0
Bitget,"Artificial Intelligence (AI), Solana Ecosystem, Meme, Pump.fun Ecosystem, AI Applications, Binance Alpha Spotlight",alchemist-ai,58806608.0,69183307.0,72678.85349116215,103478.95396296927,0.01,47469003.0
