Exchange,Category,Token CEX,Market Cap Today,FDV Today,Depth +2%,Depth -2%,Bid Ask Spread Percentage,24H Volume (USD)
Bitget,"Arbitrum Ecosystem, Optimism Ecosystem, Berachain Ecosystem, Bridged USDT, Bridged-Tokens, Ink Ecosystem, Bridged Stablecoins, Unichain Ecosystem",usdt0,982823152.0,983323102.0,,,N/A,87023801.0
Bitget,"Smart Contract Platform, Gaming (GameFi), NFT, Play To Earn, Ethereum Ecosystem, Layer 2 (L2), Zero Knowledge (ZK), Animoca Brands Portfolio, Immutable zkEVM Ecosystem, Coinbase Ventures Portfolio, Rollup, Gaming Blockchains, GMCI 30 Index, GMCI Index, Gaming Marketplace, Coinbase 50 Index",immutable-x,972184508.0,1084522151.0,111589.01569586688,133522.01128927706,0.18,30653766.0
Bitget,"Infrastructure, Smart Contract Platform, Layer 2 (L2), Bitcoin Sidechains, Stacks Ecosystem, SideChain, GMCI Layer 2 Index, GMCI 30 Index, Blockchain Capital Portfolio, GMCI Index, Made in USA, Coinbase 50 Index",blockstack,957735281.0,957735281.0,258952.72850818915,258381.1011456037,0.16,29847737.0
Bitget,"Polygon Ecosystem, Arbitrum Ecosystem, Liquid Staking Tokens, Ethereum Ecosystem, Optimism Ecosystem, Base Ecosystem, Liquid Staked ETH, Liquid Staking",rocket-pool-eth,943074574.0,943074574.0,,,N/A,9130688.0
Bitget,"BNB Chain Ecosystem, Solana Ecosystem, Polygon Ecosystem, Meme, Arbitrum Ecosystem, Ethereum Ecosystem, Aptos Ecosystem, Dog-Themed, Solana Meme, Neon Ecosystem, GMCI Meme Index, GMCI Index, Made in USA, Coinbase 50 Index",bonk,929568150.0,1066779695.0,355718.2994957261,522266.33607595676,0.17,93220917.0
Bitget,"Smart Contract Platform, Decentralized Finance (DeFi), BNB Chain Ecosystem, Cosmos Ecosystem, Layer 1 (L1), Ethereum Ecosystem, Binance Launchpad, Osmosis Ecosystem, Proof of Stake (PoS), Pantera Capital Portfolio, Secret Ecosystem, GMCI Layer 1 Index, GMCI Index, Made in USA, Coinbase 50 Index",injective-protocol,891016513.0,911738317.0,62039.956902333186,62007.02942881482,0.22,67901848.0
Bitget,"Artificial Intelligence (AI), Business Services, Infrastructure, Smart Contract Platform, Analytics, Avalanche Ecosystem, Polygon Ecosystem, Near Protocol Ecosystem, Harmony Ecosystem, Arbitrum Ecosystem, Ethereum Ecosystem, DePIN, Coinbase Ventures Portfolio, Multicoin Capital Portfolio, Proof of Stake (PoS), Energi Ecosystem, Sora Ecosystem, Made in USA, Coinbase 50 Index",the-graph,887032070.0,1002175654.0,213439.7811311401,271999.13830217504,0.11,34803735.0
Bitget,"Stablecoins, USD Stablecoin, BNB Chain Ecosystem, Arbitrum Ecosystem, Ethereum Ecosystem, Base Ecosystem, Fiat-backed Stablecoin",usual-usd,877646026.0,877646026.0,,,N/A,21413485.0
Bitget,"Artificial Intelligence (AI), Smart Contract Platform, Decentralized Finance (DeFi), Layer 1 (L1), Real World Assets (RWA), Parallelized EVM, Coinbase Ventures Portfolio, Multicoin Capital Portfolio, GMCI Layer 1 Index, Delphi Ventures Portfolio, Circle Ventures Portfolio, OKX Ventures Portfolio, GMCI Index, World Liberty Financial Portfolio, Made in USA",sei-network,868947066.0,1779768120.0,487232.1447672574,521800.70873189956,0.06,82569963.0
Bitget,"Smart Contract Platform, Layer 1 (L1), DePIN, Theta Ecosystem, Blockchain Capital Portfolio, Made in USA",theta-token,865215183.0,865215183.0,,,N/A,20502548.0
Bitget,"Smart Contract Platform, Layer 1 (L1), DWF Labs Portfolio",flare-networks,851119389.0,1436845916.0,,,N/A,5539712.0
Bitget,"BNB Chain Ecosystem, Bridged USDC, Bridged-Tokens, Bridged Stablecoins",binance-bridged-usdc-bnb-smart-chain,849406434.0,849406434.0,,,N/A,48583061.0
Bitget,"Decentralized Finance (DeFi), BNB Chain Ecosystem, Ethereum Ecosystem",dexe,831709848.0,1405578288.0,,,N/A,62554844.0
Bitget,"Smart Contract Platform, Decentralized Finance (DeFi), Layer 1 (L1), Berachain Ecosystem, Binance HODLer Airdrops, Outlier Ventures Portfolio, Polychain Capital Portfolio",berachain-bera,819520329.0,3798316624.0,468430.5538375747,345403.4678731609,0.05,174573950.0
Bitget,"Infrastructure, Decentralized Finance (DeFi), Polygon Ecosystem, Arbitrum Ecosystem, Ethereum Ecosystem, Optimism Ecosystem, Liquid Staking Governance Tokens, eGirl Capital Portfolio, Paradigm Portfolio, Coinbase Ventures Portfolio, Multicoin Capital Portfolio, Index Coop Defi Index, Alameda Research Portfolio, DragonFly Capital Portfolio, Andreessen Horowitz (a16z) Portfolio, GMCI DeFi Index, Delphi Ventures Portfolio, Liquid Staking, Index Coop Index, GMCI Index, Coinbase 50 Index",lido-dao,817198569.0,910145094.0,374170.08804677206,422734.7337915728,0.11,68740934.0
Bitget,"Polygon Ecosystem, Bridged USDT, Bridged-Tokens, Bridged Stablecoins",polygon-bridged-usdt-polygon,814507236.0,814507236.0,,,N/A,13599790.0
Bitget,"Stablecoins, Tokenized Assets, Tokenized Gold, Ethereum Ecosystem, Real World Assets (RWA), Tokenized Commodities",tether-gold,775955274.0,775955274.0,61924.91517490691,50849.935428543555,0.01,19543552.0
Bitget,"Crypto-Backed Tokens, BNB Chain Ecosystem, Avalanche Ecosystem, Arbitrum Ecosystem, Ethereum Ecosystem, Mantle Ecosystem, Base Ecosystem, Restaking, Berachain Ecosystem, Merlin Chain Ecosystem, Sonic Ecosystem, Sei Network Ecosystem, Soneium Ecosystem, Corn Ecosystem",solv-protocol-solvbtc-bbn,755451904.0,755452753.0,,,N/A,405887.0
Bitget,"Liquid Staking Tokens, Ethereum Ecosystem, Mantle Ecosystem, Liquid Staked ETH, Liquid Staking",mantle-staked-ether,744256122.0,744256122.0,,,N/A,2026224.0
Bitget,"Crypto-Backed Tokens, BNB Chain Ecosystem, Wrapped-Tokens",wbnb,740670975.0,740670975.0,,,N/A,130250101.0
Bitget,"Stablecoins, USD Stablecoin, Solana Ecosystem, Ethereum Ecosystem, Fiat-backed Stablecoin, Made in USA",paypal-usd,737265649.0,737265649.0,,,N/A,37302632.0
Bitget,Unknown,jito-governance-token,,,,,N/A,
Bitget,Unknown,walrus-2,,,,,N/A,
Bitget,Unknown,curve-dao-token,,,,,N/A,
Bitget,Unknown,gala,,,,,N/A,
Bitget,Unknown,tezos,,,,,N/A,
Bitget,Unknown,the-sandbox,,,,,N/A,
Bitget,Unknown,arbitrum-bridged-wbtc-arbitrum-one,,,,,N/A,
Bitget,Unknown,pax-gold,,,,,N/A,
Bitget,Unknown,zcash,,,,,N/A,
Bitget,Unknown,iota,,,,,N/A,
Bitget,Unknown,stargate-bridged-usdc-berachain,,,,,N/A,
Bitget,Unknown,bittorrent,,,,,N/A,
Bitget,Unknown,bitcoin-cash-sv,,,,,N/A,
Bitget,Unknown,msol,,,,,N/A,
Bitget,Unknown,usdx-money-usdx,,,,,N/A,
Bitget,Unknown,flow,,,,,N/A,
Bitget,Unknown,kaia,,,,,N/A,
Bitget,Unknown,floki,,,,,N/A,
Bitget,Unknown,renzo-restaked-eth,,,,,N/A,
Bitget,Unknown,pancakeswap-token,,,,,N/A,
Bitget,Unknown,infrared-bera,,,,,N/A,
Bitget,Unknown,helium,,,,,N/A,
Bitget,Unknown,jasmycoin,,,,,N/A,
Bitget,Unknown,dydx-chain,,,,,N/A,
Bitget,"NFT, Ethereum Ecosystem, Decentralized Identifier (DID), Name Service",ethereum-name-service,,,,,N/A,
Bitget,"Solana Ecosystem, Liquid Staking Tokens, Liquid Staked SOL, Liquid Staking",jupiter-staked-sol,544814343.0,544814343.0,,,N/A,3708499.0
Bitget,"Business Services, Infrastructure, Decentralized Finance (DeFi), Oracle, Solana Ecosystem, Neon Ecosystem, Manta Network Ecosystem, Multicoin Capital Portfolio, GMCI DeFi Index, Delphi Ventures Portfolio, GMCI Index",pyth-network,538802795.0,1486357136.0,412050.6719579735,367174.09161902254,0.07,51954344.0
Bitget,"Decentralized Exchange (DEX), Decentralized Finance (DeFi), Yield Farming, Automated Market Maker (AMM), Solana Ecosystem, Launchpad, GMCI DeFi Index, GMCI Index",raydium,536135604.0,1023144555.0,176071.02586708052,243630.80705357224,0.05,48494200.0
Bitget,"Solana Ecosystem, Meme, Solana Meme, AI Meme, Pump.fun Ecosystem, Terminal of Truths, Binance Alpha Spotlight",fartcoin,526840817.0,526840817.0,119070.3529472237,163498.0253672278,0.06,186012347.0
Bitget,"Stablecoins, Berachain Ecosystem",honey-3,526867959.0,526867959.0,,,N/A,58488657.0
Bitget,"Artificial Intelligence (AI), Smart Contract Platform, Privacy, Masternodes, DePIN, DWF Labs Portfolio, Proof of Stake (PoS), Proof of Work (PoW)",beldex,518467128.0,744758880.0,,,N/A,2959602.0
Bitget,"Solana Ecosystem, Meme, Ethereum Ecosystem, Base Ecosystem, Bridged-Tokens, Murad Picks, Stock market-themed",spx6900,503832315.0,503832315.0,,,N/A,47864861.0
Bitget,"Stablecoins, USD Stablecoin, BNB Chain Ecosystem, Avalanche Ecosystem, Ethereum Ecosystem, Tron Ecosystem, Andreessen Horowitz (a16z) Portfolio, Fiat-backed Stablecoin",true-usd,493685373.0,493685373.0,266684.8034984655,557540.0446466901,0.04,28245022.0
Bitget,"Smart Contract Platform, Layer 1 (L1), Bitcoin Sidechains, SideChain",coredaoorg,494436704.0,1040263834.0,65533.570033404736,99778.10860056448,0.1,42712265.0
Bitget,"Artificial Intelligence (AI), Solana Ecosystem, DePIN, Polychain Capital Portfolio",grass,492031162.0,1786115375.0,306876.59360995947,279698.2252534069,0.05,61211776.0
Bitget,"BNB Chain Ecosystem, Ethereum Ecosystem, BTCfi",pumpbtc,488846640.0,488846640.0,,,N/A,195468.0
Bitget,"Gaming (GameFi), NFT, BNB Chain Ecosystem, Axie Infinity Ecosystem, Metaverse, Play To Earn, Harmony Ecosystem, Ethereum Ecosystem, Animoca Brands Portfolio, Alleged SEC Securities, Binance Launchpad, Ronin Ecosystem, Card Games, Breeding, Paradigm Portfolio, Gaming Governance Token, Gaming Utility Token, Andreessen Horowitz (a16z) Portfolio, Energi Ecosystem, YZi Labs (Prev. Binance Labs) Portfolio, Consensys Portfolio, Coinbase 50 Index",axie-infinity,486492275.0,820774245.0,109304.63561222031,187373.45886657314,0.07,21865681.0
Bitget,"Entertainment, Gaming (GameFi), NFT, Metaverse, Polygon Ecosystem, Play To Earn, Ethereum Ecosystem, Animoca Brands Portfolio, Alleged SEC Securities, Simulation Games, Coinbase 50 Index",decentraland,483320163.0,567458808.0,120780.14529607918,170661.8547304742,0.04,43012208.0
Bitget,"Decentralized Exchange (DEX), Decentralized Finance (DeFi), Yield Farming, Automated Market Maker (AMM), BNB Chain Ecosystem, Derivatives, Lending/Borrowing Protocols, Arbitrum Ecosystem, Ethereum Ecosystem, Optimism Ecosystem, Fixed Interest, Real World Assets (RWA), LSDFi, Base Ecosystem, Restaking, LRTfi, Liquid Restaking Governance Tokens, Yield Tokenization Protocol, YZi Labs (Prev. Binance Labs) Portfolio, GMCI DeFi Index, Sonic Ecosystem, Liquid Staking, GMCI Index, BTCfi",pendle,478717714.0,834890664.0,658635.8643075718,539683.3964361248,0.03,98336132.0
Bitget,"Stablecoins, Ethereum Ecosystem",resolv-usr,469609013.0,469609013.0,,,N/A,8406395.0
Bitget,"USD Stablecoin, Polygon Ecosystem, Bridged USDC, Fiat-backed Stablecoin, Bridged-Tokens, Bridged Stablecoins",bridged-usdc-polygon-pos-bridge,468044432.0,468044432.0,,,N/A,21785983.0
Bitget,"Smart Contract Platform, Layer 1 (L1), MultiversX Ecosystem, Binance Launchpad, DWF Labs Portfolio, Proof of Stake (PoS), YZi Labs (Prev. Binance Labs) Portfolio, GMCI Layer 1 Index, GMCI Index, Coinbase 50 Index",elrond-erd-2,465855774.0,465855774.0,106112.70901594646,157736.4792988208,0.06,17416994.0
Bitget,"Decentralized Finance (DeFi), Wallets, Polygon Ecosystem, Ethereum Ecosystem, Payment Solutions, Base Ecosystem, Sora Ecosystem, Made in USA",telcoin,458566624.0,498986167.0,9529.941883479672,9233.543688784293,0.58,2948025.0
Bitget,"Ethereum Ecosystem, Mantle Ecosystem, Restaking, Liquid Restaking Tokens, Liquid Restaked ETH",mantle-restaked-eth,456393165.0,456393165.0,,,N/A,4681650.0
Bitget,"Crypto-Backed Tokens, Decentralized Finance (DeFi), Rebase Tokens, Arbitrum Ecosystem, Ethereum Ecosystem, Berachain Ecosystem",olympus,455263090.0,481724517.0,,,N/A,7345300.0
Bitget,"Infrastructure, Smart Contract Platform, Ethereum Ecosystem, Layer 2 (L2), Zero Knowledge (ZK), Starknet Ecosystem, Paradigm Portfolio, Coinbase Ventures Portfolio, Rollup, Multicoin Capital Portfolio, Alameda Research Portfolio, Pantera Capital Portfolio, GMCI Layer 2 Index, Consensys Portfolio, Sequoia Capital Portfolio, GMCI Index, Polychain Capital Portfolio",starknet,450926041.0,1552092666.0,327003.7199770052,253810.457760516,0.06,26168881.0
Bitget,"BNB Chain Ecosystem, Meme, Binance-Peg Tokens",binance-peg-dogecoin,448202355.0,448202355.0,,,N/A,1153714.0
Bitget,"Smart Contract Platform, Gaming (GameFi), NFT, Layer 1 (L1), Play To Earn, Zero Knowledge (ZK), FTX Holdings, Ronin Ecosystem, Gaming Blockchains, SideChain, Andreessen Horowitz (a16z) Portfolio, YZi Labs (Prev. Binance Labs) Portfolio",ronin,445672324.0,719534608.0,196752.94286334456,186998.6796869331,0.14,18553398.0
Bitget,"Tokenized BTC, Avalanche Ecosystem, Bridged-Tokens",bitcoin-avalanche-bridged-btc-b,436907069.0,436907069.0,,,N/A,13993439.0
Bitget,"Solana Ecosystem, Meme, Dog-Themed, Solana Meme, GMCI Meme Index, GMCI Index",dogwifcoin,434521100.0,434521100.0,536506.6104404263,525505.0777338974,0.23,176464425.0
Bitget,"NFT, BNB Chain Ecosystem, Ethereum Ecosystem, Tron Ecosystem",apenft,433178530.0,437502991.0,28360.219301706304,32087.889456520123,0.32,18562337.0
Bitget,"Artificial Intelligence (AI), Smart Contract Platform, Storage, Layer 1 (L1), DePIN, Coinbase Ventures Portfolio, Multicoin Capital Portfolio, Andreessen Horowitz (a16z) Portfolio, Blockchain Capital Portfolio",arweave,429303426.0,429303426.0,39658.476043480296,36785.20598039323,0.15,23298165.0
Bitget,"Base Ecosystem, Bridged WETH, Bridged-Tokens",l2-standard-bridged-weth-base,421250374.0,421250374.0,,,N/A,396868813.0
Bitget,"Arbitrum Ecosystem, Ethereum Ecosystem, Optimism Ecosystem, Base Ecosystem, BTCfi",clbtc,428152158.0,428152158.0,,,N/A,15.11
Bitget,"Smart Contract Platform, Layer 1 (L1), Binance Launchpad, DWF Labs Portfolio, Osmosis Ecosystem, YZi Labs (Prev. Binance Labs) Portfolio, Made in USA",kava,426195891.0,426195891.0,189140.01209600802,205480.66426050267,0.05,36003880.0
Bitget,"Bridged USDC, Sonic Ecosystem, Bridged-Tokens, Bridged Stablecoins",sonic-bridged-usdc-e-sonic,425759510.0,425759510.0,,,N/A,15376450.0
Bitget,"Decentralized Finance (DeFi), Yield Farming, BNB Chain Ecosystem, Lending/Borrowing Protocols, Avalanche Ecosystem, Polygon Ecosystem, Near Protocol Ecosystem, Harmony Ecosystem, Arbitrum Ecosystem, Ethereum Ecosystem, Base Ecosystem, Paradigm Portfolio, Index Coop Defi Index, Energi Ecosystem, Sora Ecosystem, Index Coop Index, Polychain Capital Portfolio, Made in USA",compound-governance-token,422374542.0,472454799.0,99009.40121480353,110345.40340105185,0.19,475984694.0
Bitget,"Smart Contract Platform, Sports, NFT, Layer 1 (L1), Ethereum Ecosystem, Alleged SEC Securities, Chiliz Ecosystem, YZi Labs (Prev. Binance Labs) Portfolio, Coinbase 50 Index",chiliz,424601570.0,424605542.0,132650.15977748536,116578.7235467326,0.22,53258006.0
Bitget,"Decentralized Exchange (DEX), Infrastructure, Smart Contract Platform, Exchange-based Tokens, Decentralized Finance (DeFi), Bridge Governance Tokens, Multicoin Capital Portfolio, Proof of Stake (PoS), Delphi Ventures Portfolio",thorchain,424478774.0,513821395.0,420597.88716059737,463808.00328899594,0.08,130093630.0
Bitget,"Arbitrum Ecosystem, Bridged WETH, Bridged-Tokens",arbitrum-bridged-weth-arbitrum-one,413429841.0,413429841.0,,,N/A,261712882.0
Bitget,"Decentralized Finance (DeFi), Liquid Staking Tokens, Base Ecosystem, Liquid Staked ETH, Liquid Staking",super-oeth,413213657.0,413213657.0,,,N/A,615256.0
Bitget,"Smart Contract Platform, DWF Labs Portfolio, Proof of Work (PoW), GMCI Layer 1 Index, Sequoia Capital Portfolio, GMCI Index, Made in China",conflux-token,412477576.0,460434456.0,161052.2808735513,216675.33775488715,0.12,37842281.0
Bitget,"Stablecoins, USD Stablecoin, Blast Ecosystem, Crypto-backed Stablecoin, Fiat-backed Stablecoin",usdb,408136736.0,408136736.0,,,N/A,1834865.0
Bitget,"Ethereum Ecosystem, Real World Assets (RWA)",hashnote-usyc,405274731.0,405274731.0,,,N/A,37284.0
Bitget,"Tokenized Assets, Solana Ecosystem, Polygon Ecosystem, Ethereum Ecosystem, Real World Assets (RWA), Tokenized Treasury Bonds (T-Bonds)",ousg,405040018.0,405040018.0,,,N/A,0.0
Bitget,"Smart Contract Platform, Layer 1 (L1), Bitcoin Fork, Proof of Work (PoW)",ecash,402035315.0,402035568.0,,,N/A,20008094.0
Bitget,"Smart Contract Platform, Proof of Stake (PoS), Made in China",neo,399384128.0,566261346.0,166252.51658131013,257620.02406628372,0.18,130007843.0
Bitget,"Artificial Intelligence (AI), Solana Ecosystem, Ethereum Ecosystem, Base Ecosystem, AI Agents, Virtuals Protocol Ecosystem, AI Agent Launchpad, Binance Alpha Spotlight",virtual-protocol,397173740.0,609937649.0,185478.63293268273,240573.29672367751,0.05,153354135.0
Bitget,"Gaming (GameFi), NFT, Polygon Ecosystem, Ethereum Ecosystem, Animoca Brands Portfolio, Gaming Blockchains, Gaming Governance Token, Gaming Utility Token, Andreessen Horowitz (a16z) Portfolio, ApeChain Ecosystem, Airdropped Tokens by NFT Projects, Coinbase 50 Index",apecoin,392952836.0,491525594.0,114666.54845784963,139318.21954411754,0.2,37903639.0
Bitget,"Stablecoins, Solana Ecosystem, Arbitrum Ecosystem, Ethereum Ecosystem, Aptos Ecosystem, Sui Ecosystem, Mantle Ecosystem, Osmosis Ecosystem, Fiat-backed Stablecoin, Yield Tokenization Product, Yield-Bearing Stablecoin",ondo-us-dollar-yield,390112889.0,597827628.0,,,N/A,631045.0
Bitget,"Decentralized Finance (DeFi), Liquid Staking Tokens, Ethereum Ecosystem, Liquid Staked ETH, Liquid Staking",stakewise-v3-oseth,388789226.0,388789226.0,,,N/A,463480.0
Bitget,"Smart Contract Platform, Gaming (GameFi), NFT, BNB Chain Ecosystem, Binance Launchpool, Avalanche Ecosystem, Ethereum Ecosystem, DWF Labs Portfolio, Gaming Blockchains, Avalanche L1",beam-2,381054919.0,430391830.0,60131.40256594424,74811.70106600977,0.14,23625344.0
Bitget,"Crypto-Backed Tokens, Decentralized Finance (DeFi), Tokenized BTC, Solana Ecosystem, Polygon Ecosystem, Arbitrum Ecosystem, Ethereum Ecosystem, Optimism Ecosystem, Base Ecosystem",tbtc,380102126.0,380102126.0,,,N/A,16009018.0
Bitget,"Decentralized Finance (DeFi), Arbitrum Ecosystem, Ethereum Ecosystem, Real World Assets (RWA), Base Ecosystem, Coinbase Ventures Portfolio, Energi Ecosystem, Made in USA",reserve-rights-token,375607034.0,669877779.0,147665.39120153134,183052.91621780218,0.06,29032764.0
Bitget,"Decentralized Exchange (DEX), Decentralized Finance (DeFi), Automated Market Maker (AMM), Base Ecosystem, Binance Alpha Spotlight, Made in USA",aerodrome-finance,369692577.0,720417722.0,34837.89503049863,57052.42950141651,0.22,17506568.0
Bitget,"Smart Contract Platform, Layer 1 (L1), Ethereum Ecosystem, Real World Assets (RWA), RWA Protocol, Made in USA",plume,364021634.0,1820108172.0,40284.32808591463,58548.811741836245,0.06,31592583.0
Bitget,"BNB Chain Ecosystem, Wallets, Account Abstraction, Energi Ecosystem",trust-wallet-token,362102871.0,869081863.0,74819.73230098258,75612.87018140354,0.21,13327964.0
Bitget,"Smart Contract Platform, BNB Chain Ecosystem, Polygon Ecosystem, Harmony Ecosystem, Moonriver Ecosystem, Moonbeam Ecosystem, Ethereum Ecosystem, Layer 2 (L2), Zero Knowledge (ZK), Animoca Brands Portfolio, Alleged SEC Securities, Binance Launchpad, FTX Holdings, Coinbase Ventures Portfolio, Rollup, Proof of Stake (PoS), Alameda Research Portfolio, DragonFly Capital Portfolio, Energi Ecosystem, Sora Ecosystem, YZi Labs (Prev. Binance Labs) Portfolio, GMCI Layer 2 Index, GMCI 30 Index, Galaxy Digital Portfolio, GMCI Index, Coinbase 50 Index",matic-network,359011545.0,2054826956.0,,,N/A,1824676.0
Bitget,"Infrastructure, BNB Chain Ecosystem, Avalanche Ecosystem, Polygon Ecosystem, Fantom Ecosystem, Arbitrum Ecosystem, Moonbeam Ecosystem, Ethereum Ecosystem, Optimism Ecosystem, Interoperability, Bridge Governance Tokens, Base Ecosystem, Osmosis Ecosystem, Cross-chain Communication, Secret Ecosystem, Galaxy Digital Portfolio, Polychain Capital Portfolio, Made in USA",axelar,356542958.0,452851061.0,66519.08187341686,54622.57065133751,0.32,9291702.0
Bitget,"Liquid Staking Tokens, Ethereum Ecosystem, Restaking, Liquid Restaking Tokens, Ether.fi Ecosystem, Liquid Staked ETH, Liquid Staking",ether-fi-staked-eth,350405810.0,4729026032.0,,,N/A,97651.0
Bitget,"Stablecoins, Decentralized Finance (DeFi), USD Stablecoin, BNB Chain Ecosystem, Seigniorage, Avalanche Ecosystem, Polygon Ecosystem, Fantom Ecosystem, Harmony Ecosystem, Arbitrum Ecosystem, Moonriver Ecosystem, Moonbeam Ecosystem, Ethereum Ecosystem, Optimism Ecosystem, Aurora Ecosystem, Polygon zkEVM Ecosystem, Evmos Ecosystem, Boba Network Ecosystem, Fiat-backed Stablecoin",frax,348388204.0,348388204.0,,,N/A,6297629.0
Bitget,"Decentralized Finance (DeFi), Arbitrum Ecosystem, Liquid Staking Tokens, Ethereum Ecosystem, Optimism Ecosystem, Base Ecosystem",cgeth-hashkey-cloud,343857414.0,343857414.0,,,N/A,36.2
Bitget,"Mantle Ecosystem, Bridged USDT, Bridged-Tokens, Bridged Stablecoins",mantle-bridged-usdt-mantle,342708394.0,342708394.0,,,N/A,1317994.0
Bitget,"Infrastructure, Wallets, Gnosis Chain Ecosystem, Ethereum Ecosystem",safe,338773533.0,597583069.0,57259.47511062947,139743.38493044,0.12,66524769.0
Bitget,"BNB Chain Ecosystem, Meme",cheems-token,340574640.0,340574640.0,47747.05384956627,39366.47171976937,0.22,9313814.0
Bitget,"Solana Ecosystem, Meme, Solana Meme, Binance HODLer Airdrops, Airdropped Tokens by NFT Projects, Made in USA",pudgy-penguins,340112105.0,415123639.0,39132.81583636336,70778.23278103113,0.07,52828100.0
Bitget,"Smart Contract Platform, Decentralized Finance (DeFi), Coinbase Ventures Portfolio, DeFiance Capital Portfolio, Pantera Capital Portfolio, YZi Labs (Prev. Binance Labs) Portfolio, Galaxy Digital Portfolio",terra-luna,334719290.0,399669506.0,175918.26614068364,176675.17344583748,0.1,11229863.0
Bitget,"Meme, Base Ecosystem, Frog-Themed, Base Meme, The Boy’s Club",based-brett,333657269.0,333657269.0,7736.616267668825,13338.180282296125,0.3,24680904.0
Bitget,"Decentralized Finance (DeFi), Near Protocol Ecosystem, Ethereum Ecosystem, Payment Solutions, Alleged SEC Securities, Pantera Capital Portfolio, Energi Ecosystem, Made in USA",amp-token,329478884.0,389865529.0,18318.82805930621,24110.904935352035,0.13,10181738.0
Bitget,"Stablecoins, USD Stablecoin, BNB Chain Ecosystem, Avalanche Ecosystem, Polygon Ecosystem, Optimism Ecosystem, Fiat-backed Stablecoin, Binance-Peg Tokens",binance-peg-busd,324434216.0,324434216.0,,,N/A,9339441.0
Bitget,"Decentralized Finance (DeFi), Solana Ecosystem, LSDFi, Restaking, Stablecoin Protocol, YZi Labs (Prev. Binance Labs) Portfolio, Binance HODLer Airdrops, Polychain Capital Portfolio",solayer,323553441.0,1540730672.0,143966.3121425771,303255.24177766417,0.2,187528892.0
Bitget,"Decentralized Exchange (DEX), Smart Contract Platform, Decentralized Finance (DeFi), Prediction Markets, Layer 1 (L1), Gnosis Chain Ecosystem, MEV Protection, Arbitrum Ecosystem, Ethereum Ecosystem, SideChain, Energi Ecosystem",gnosis,319298955.0,369903049.0,28539.217528488425,37717.64267793824,0.4,28006720.0
Bitget,"Smart Contract Platform, BNB Chain Ecosystem, Avalanche Ecosystem, Polygon Ecosystem, Arbitrum Ecosystem, Ethereum Ecosystem, Optimism Ecosystem, Base Ecosystem, Multicoin Capital Portfolio, Layer 0 (L0), Cross-chain Communication, Circle Ventures Portfolio, Sequoia Capital Portfolio, OKX Ventures Portfolio",layerzero,312790765.0,2814059673.0,939289.0389642484,1385476.2562229587,0.04,79367169.0
Bitget,"Decentralized Finance (DeFi), Lending/Borrowing Protocols, Ethereum Ecosystem, Base Ecosystem, Coinbase Ventures Portfolio, Pantera Capital Portfolio, Morpho Ecosystem, Binance Alpha Spotlight",morpho,311458128.0,1312205267.0,18349.34606462584,24153.953384558554,0.09,11507007.0
Bitget,"Decentralized Finance (DeFi), Tron Ecosystem",just,306772970.0,306772970.0,123704.44353012033,127674.78118195954,0.16,18181413.0
Bitget,"Yield Aggregator, Ethereum Ecosystem, YZi Labs (Prev. Binance Labs) Portfolio, Polychain Capital Portfolio",stakestone-berachain-vault-token,305632811.0,305632811.0,,,N/A,171333.0
Bitget,"Smart Contract Platform, BNB Chain Ecosystem, Layer 1 (L1), Ethereum Ecosystem, Base Ecosystem, Proof of Stake (PoS), Pantera Capital Portfolio, Made in USA",chain-2,307876479.0,449182742.0,84863.35063603793,107263.89306278146,0.15,25533095.0
Bitget,"Smart Contract Platform, Zero Knowledge (ZK), FTX Holdings, Paradigm Portfolio, Coinbase Ventures Portfolio, Multicoin Capital Portfolio, Proof of Stake (PoS), Pantera Capital Portfolio, Circle Ventures Portfolio, Privacy Blockchain, Polychain Capital Portfolio, Made in USA, Coinbase 50 Index",mina-protocol,303642550.0,303643443.0,4804.835729137746,13666.202437460099,0.64,13221077.0
Bitget,"Polygon Ecosystem, Bridged WETH, Bridged-Tokens",polygon-pos-bridged-weth-polygon-pos,302146244.0,302146244.0,,,N/A,11021238.0
Bitget,"Artificial Intelligence (AI), Smart Contract Platform, DePIN, Osmosis Ecosystem, Proof of Stake (PoS), Archway Ecosystem, Made in USA",akash-network,299433519.0,300456207.0,,,N/A,5133990.0
Bitget,"Artificial Intelligence (AI), Smart Contract Platform, Storage, BNB Chain Ecosystem, Layer 1 (L1), Ethereum Ecosystem, DePIN, DWF Labs Portfolio, Osmosis Ecosystem, GMCI DePIN Index, GMCI Index",aioz-network,293822184.0,293857998.0,,,N/A,5484571.0
Bitget,"Smart Contract Platform, Layer 1 (L1), MEV Protection, Proof of Work (PoW), Privacy Blockchain, Mobile Mining",verus-coin,290948864.0,290949799.0,,,N/A,25470.0
Bitget,"Smart Contract Platform, Ethereum Ecosystem, Real World Assets (RWA), DWF Labs Portfolio, Proof of Stake (PoS)",creditcoin-2,285735330.0,390156882.0,103649.93860361102,125424.59364899457,0.06,8788162.0
Bitget,"Smart Contract Platform, Privacy, Masternodes, Alleged SEC Securities, Proof of Stake (PoS), Proof of Work (PoW), Made in USA",dash,279552100.0,279620126.0,,,N/A,29991690.0
Bitget,"Exchange-based Tokens, Centralized Exchange (CEX) Token, Ethereum Ecosystem, Morph L2 Ecosystem",mx-token,276306518.0,1217473555.0,34432.44656738918,6906.821525047596,0.39,11503579.0
Bitget,"Stablecoins, USD Stablecoin, BNB Chain Ecosystem, Avalanche Ecosystem, Near Protocol Ecosystem, Arbitrum Ecosystem, Ethereum Ecosystem, Tron Ecosystem, BitTorrent Ecosystem, Algorithmic Stablecoin, Fiat-backed Stablecoin",usdd,273776837.0,273834351.0,,,N/A,3903129.0
Bitget,"Polygon Ecosystem, Bridged WBTC, Bridged-Tokens",polygon-bridged-wbtc-polygon-pos,273571390.0,273571390.0,,,N/A,5480753.0
