Gate.io,"Decentralized Finance (DeFi), Arbitrum Ecosystem, Ethereum Ecosystem, Real World Assets (RWA), Base Ecosystem, Coinbase Ventures Portfolio, Energi Ecosystem, Made in USA",reserve-rights-token,328107251,586956665.0,171210.4369907376,167832.88278918283,0.07,21335656.0
Gate.io,"Stablecoins, USD Stablecoin, BNB Chain Ecosystem, Avalanche Ecosystem, Polygon Ecosystem, Optimism Ecosystem, Fiat-backed Stablecoin, Binance-Peg Tokens",binance-peg-busd,324194999,324194999.0,,,N/A,7933692.0
Gate.io,"Decentralized Finance (DeFi), Lending/Borrowing Protocols, Ethereum Ecosystem, Base Ecosystem, Coinbase Ventures Portfolio, Pantera Capital Portfolio, Morpho Ecosystem, Binance Alpha Spotlight",morpho,313806297,1329416101.0,181370.34262260358,180400.9956906158,0.02,9072751.0
Gate.io,"Artificial Intelligence (AI), Smart Contract Platform, Storage, BNB Chain Ecosystem, Layer 1 (L1), Ethereum Ecosystem, DePIN, DWF Labs Portfolio, Osmosis Ecosystem, GMCI DePIN Index, GMCI Index",aioz-network,314255247,318571270.0,23502.010936174396,21586.900708456255,0.15,7412716.0
Gate.io,"Smart Contract Platform, Layer 1 (L1), MEV Protection, Proof of Work (PoW), Privacy Blockchain",verus-coin,311712893,311714730.0,,,N/A,5140.96
Gate.io,"Yield Aggregator, Ethereum Ecosystem, Binance Labs Portfolio, Polychain Capital Portfolio",stakestone-berachain-vault-token,309274975,309274975.0,,,N/A,826824.0
Gate.io,"Smart Contract Platform, Layer 1 (L1), Ethereum Ecosystem, Real World Assets (RWA), RWA Protocol, Made in USA",plume,303448542,1517242712.0,78775.68127995059,54983.13220258378,0.22,16928627.0
Gate.io,"Decentralized Finance (DeFi), Tron Ecosystem",just,297808552,297808552.0,185327.92681012445,125652.99783000963,0.07,17801666.0
Gate.io,"Artificial Intelligence (AI), Ethereum Ecosystem, DePIN, Energi Ecosystem, GMCI DePIN Index, GMCI Index",golem,295032183,295032183.0,62458.58560386756,75100.20837522739,0.3,14708310.0
Gate.io,"Solana Ecosystem, Arbitrum Ecosystem, Impossible Finance Launchpad, Ethereum Ecosystem, DePIN, Animoca Brands Portfolio",aethir,291056824,1547523388.0,334219.74719215615,318246.4055221913,0.03,25133574.0
Gate.io,"Decentralized Exchange (DEX), Exchange-based Tokens, Decentralized Finance (DeFi), Yield Farming, Derivatives, Synthetic Issuer, Avalanche Ecosystem, Polygon Ecosystem, Near Protocol Ecosystem, Fantom Ecosystem, Harmony Ecosystem, Ethereum Ecosystem, Optimism Ecosystem, Base Ecosystem, DWF Labs Portfolio, Paradigm Portfolio, Coinbase Ventures Portfolio, Index Coop Defi Index, Energi Ecosystem, Huobi ECO Chain Ecosystem, GMCI DeFi Index, Synthetic, Index Coop Index, GMCI Index, Coinbase 50 Index",havven,289416309,289777482.0,278334.859655246,234188.8981640332,0.08,20146002.0
Gate.io,"Infrastructure, Ethereum Ecosystem, Data Availability, Restaking, Polychain Capital Portfolio, Made in USA",eigenlayer,290042820,2032788780.0,430904.2133274821,417486.13627178606,0.08,27870142.0
Gate.io,"Crypto-Backed Tokens, Wrapped-Tokens, Polygon Ecosystem, Arbitrum Ecosystem, Liquid Staking Tokens, Ethereum Ecosystem, Optimism Ecosystem, Base Ecosystem, Liquid Staked ETH, Liquid Staking",coinbase-wrapped-staked-eth,285839664,792003894.0,,,N/A,5171157.0
Gate.io,"Polygon Ecosystem, Bridged WETH, Bridged-Tokens",polygon-pos-bridged-weth-polygon-pos,281034748,281034748.0,,,N/A,7305837.0
Gate.io,"Decentralized Exchange (DEX), Exchange-based Tokens, Decentralized Finance (DeFi), Automated Market Maker (AMM), BNB Chain Ecosystem, Avalanche Ecosystem, Polygon Ecosystem, Near Protocol Ecosystem, Harmony Ecosystem, Ethereum Ecosystem, FTX Holdings, Alameda Research Portfolio, DragonFly Capital Portfolio, Pantera Capital Portfolio, Energi Ecosystem, Binance Labs Portfolio, GMCI DeFi Index, Galaxy Digital Portfolio, Blockchain Capital Portfolio, Dex Aggregator, GMCI Index, Coinbase 50 Index",1inch,283256259,308483058.0,108648.22770364326,127877.83840424998,0.05,16738282.0
Gate.io,"Smart Contract Platform, Gaming (GameFi), NFT, Layer 1 (L1), Play To Earn, Gaming Blockchains, WEMIX Ecosystem",wemix-token,278253384,357788714.0,2083.1599250409263,4187.704585973546,0.45,3929460.0
Gate.io,"Smart Contract Platform, Privacy, Masternodes, Alleged SEC Securities, Proof of Stake (PoS), Proof of Work (PoW), Made in USA",dash,281222206,281223819.0,,,N/A,32802827.0
Gate.io,"Smart Contract Platform, Polkadot Ecosystem, Proof of Stake (PoS), Pantera Capital Portfolio, Made in USA, Coinbase 50 Index",kusama,274819892,274820510.0,76153.20081538997,98161.64142433215,0.06,8665882.0
Gate.io,"Liquid Staking Tokens, Ethereum Ecosystem, Liquid Staking",stader-ethx,273751884,273751887.0,,,N/A,112221.0
Gate.io,"BNB Chain Ecosystem, Wallets, Ethereum Ecosystem, Animoca Brands Portfolio, Binance Launchpad, Energi Ecosystem, Binance Labs Portfolio",safepal,273076020,273076020.0,115363.82957203458,72804.74806967929,0.15,7311848.0
Gate.io,"Polygon Ecosystem, Bridged WBTC, Bridged-Tokens",polygon-bridged-wbtc-polygon-pos,270568287,270568287.0,,,N/A,3708311.0
Gate.io,"Smart Contract Platform, Layer 2 (L2), Zero Knowledge (ZK), ZkSync Ecosystem, Consensys Portfolio, Blockchain Capital Portfolio, OKX Ventures Portfolio",zksync,267575992,1529005671.0,346146.8374282146,258750.77183908527,0.04,37870787.0
Gate.io,"Smart Contract Platform, Ethereum Ecosystem, Real World Assets (RWA), DWF Labs Portfolio, Proof of Stake (PoS)",creditcoin-2,268075687,370256601.0,84066.76998538,104908.03719917541,0.11,10407463.0
Gate.io,"Smart Contract Platform, DePIN, Proof of Stake (PoS), Made in USA",theta-fuel,264256982,264261272.0,27236.287499819766,25669.963861312044,0.42,1641783.0
Gate.io,"Solana Ecosystem, Arbitrum Ecosystem, Ethereum Ecosystem, Interoperability, Base Ecosystem, Multicoin Capital Portfolio, Cross-chain Communication, Made in USA",wormhole,265789108,914982413.0,547958.1989210112,479482.241732938,0.11,32562484.0
Gate.io,"Gaming (GameFi), Binance Launchpool, Meme, Play To Earn, TON Ecosystem, TON Meme, Tap to Earn",notcoin,261653801,261653801.0,291136.4875787812,247373.9434485071,0.08,328331628.0
Gate.io,"Exchange-based Tokens, Centralized Exchange (CEX) Token, Ethereum Ecosystem, Morph L2 Ecosystem",mx-token,260750960,1148931994.0,,,N/A,12328844.0
Gate.io,"Stablecoins, USD Stablecoin, Ethereum Ecosystem, Fiat-backed Stablecoin",elixir-deusd,260240120,260190084.0,,,N/A,49950740.0
Gate.io,"Crypto-Backed Tokens, Decentralized Finance (DeFi), cToken, Ethereum Ecosystem",compound-wrapped-btc,258631405,258631405.0,,,N/A,0.0
Gate.io,"Decentralized Finance (DeFi), Ethereum Ecosystem, Restaking, Liquid Restaking Tokens, Liquid Staking",ether-fi-staked-btc,258244786,258245000.0,,,N/A,95491.0
Gate.io,"BRC-20, Bitcoin Ecosystem, Inscriptions",sats-ordinals,256915973,256915973.0,128939.91970890596,219592.77695116843,0.1,4706612.0
Gate.io,"Arbitrum Ecosystem, Liquid Staking Tokens, Ethereum Ecosystem, Liquid Staking",sweth,255361871,255368990.0,,,N/A,119286.0
Gate.io,"Meme, Cardano Ecosystem",snek,255023737,258278214.0,21910.348182759808,17235.334931445454,0.21,1063824.0
Gate.io,"Infrastructure, Decentralized Finance (DeFi), Sui Ecosystem",deep,253171960,1012687840.0,62142.12861266808,268290.253133775,0.02,16962084.0
Gate.io,"Smart Contract Platform, BNB Chain Ecosystem, Avalanche Ecosystem, Polygon Ecosystem, Arbitrum Ecosystem, Ethereum Ecosystem, Optimism Ecosystem, Base Ecosystem, Multicoin Capital Portfolio, Layer 0 (L0), Cross-chain Communication, Circle Ventures Portfolio, Sequoia Capital Portfolio, OKX Ventures Portfolio",layerzero,253655063,2282038231.0,806775.4782579666,946522.1580213967,0.04,319008680.0
Gate.io,"Decentralized Finance (DeFi), BNB Chain Ecosystem, Polygon Ecosystem, Fantom Ecosystem, Arbitrum Ecosystem, Moonbeam Ecosystem, Liquid Staking Tokens, Ethereum Ecosystem, Optimism Ecosystem, Polygon zkEVM Ecosystem, Liquid Staking, Made in USA",frax-ether,251508318,251315049.0,,,N/A,951660.0
Gate.io,"Stablecoins, Tokenized Assets, Tokenized Gold, BNB Chain Ecosystem, Real World Assets (RWA), Tokenized Commodities, Commodity-backed Stablecoin",quorium,250782973,250782973.0,,,N/A,95837.0
Gate.io,"Decentralized Finance (DeFi), Solana Ecosystem, Liquid Staking Tokens, Liquid Staked SOL, Liquid Staking",bybit-staked-sol,245203061,245203061.0,,,N/A,1689049.0
Gate.io,"Stablecoins, USD Stablecoin, BNB Chain Ecosystem, Avalanche Ecosystem, Near Protocol Ecosystem, Arbitrum Ecosystem, Ethereum Ecosystem, Tron Ecosystem, BitTorrent Ecosystem, Algorithmic Stablecoin, Fiat-backed Stablecoin",usdd,244889820,244889820.0,3557.1332094532377,40735.68910495073,0.37,3003271.0
Gate.io,"Bridged USDC, Sonic Ecosystem, Bridged-Tokens, Bridged Stablecoins",sonic-bridged-usdc-e-sonic,244726756,244726756.0,,,N/A,13651599.0
Gate.io,"Smart Contract Platform, Polkadot Ecosystem, Layer 1 (L1), Layer 2 (L2), Alameda Research Portfolio, Binance Labs Portfolio, OKX Ventures Portfolio",astar,243107821,267296249.0,478450.24210064724,390946.6859788883,0.06,3028428.0
Gate.io,"Smart Contract Platform, BNB Chain Ecosystem, GMCI Layer 1 Index, GMCI Index, Made in China",zilliqa,244260067,252754894.0,129674.61889873722,169248.72526431622,0.08,9396729.0
Gate.io,"Decentralized Finance (DeFi), Solana Ecosystem, LSDFi, Restaking, Stablecoin Protocol, Binance Labs Portfolio, Binance HODLer Airdrops, Polychain Capital Portfolio",solayer,244475355,1164168358.0,254387.54878270385,292662.0599534318,0.19,62954216.0
Gate.io,"NFT, Ethereum Ecosystem, NFT Marketplace, FTX Holdings, NFTFi, eGirl Capital Portfolio, Paradigm Portfolio, GMCI DeFi Index, GMCI Index, Made in USA, Coinbase 50 Index",blur,242953399,324319916.0,229330.05246259816,218975.11203473236,0.09,27328294.0
Gate.io,"Infrastructure, Wallets, Gnosis Chain Ecosystem, Ethereum Ecosystem",safe,236938155,427967177.0,129143.40433389683,138461.17439863048,0.07,13051346.0
Gate.io,"Oracle, Ethereum Ecosystem",redstone-oracles,239125261,854018791.0,107016.22544511646,264761.753052373,0.21,303851215.0
Gate.io,"Decentralized Finance (DeFi), Liquid Staking Tokens, Base Ecosystem, Liquid Staked ETH, Liquid Staking",super-oeth,234687852,234694032.0,,,N/A,88887.0
Gate.io,"Smart Contract Platform, Proof of Stake (PoS), Made in China",qtum,233257421,238251848.0,79079.88839541606,79298.82036024175,0.05,17142163.0
Gate.io,"Smart Contract Platform, Interoperability, Layer 2 (L2), Rollup, Multicoin Capital Portfolio, Proof of Work (PoW), DragonFly Capital Portfolio, Sequoia Capital Portfolio, Blockchain Capital Portfolio, Polychain Capital Portfolio, Made in China",nervos-network,231274495,234927444.0,191363.38150909913,148795.71909934017,0.06,10824710.0
Gate.io,"Decentralized Exchange (DEX), Exchange-based Tokens, Decentralized Finance (DeFi), Derivatives, Perpetuals, Ethereum Ecosystem, Paradigm Portfolio",dydx,231579729,231579729.0,,,N/A,10923135.0
Gate.io,"Analytics, Avalanche Ecosystem, Meme, Cat-Themed, Made in USA",ket,231192342,231192342.0,,,N/A,5767249.0
Gate.io,"Solana Ecosystem, Avalanche Ecosystem, Polygon Ecosystem, Near Protocol Ecosystem, Harmony Ecosystem, Ethereum Ecosystem, Pantera Capital Portfolio, Energi Ecosystem, Made in USA",basic-attention-token,225566825,226220094.0,37728.72011573475,41713.66739447536,0.27,15431750.0
Gate.io,"Smart Contract Platform, BNB Chain Ecosystem, Layer 1 (L1), Proof of Stake (PoS), Pantera Capital Portfolio, Andreessen Horowitz (a16z) Portfolio, Binance Labs Portfolio, Blockchain Capital Portfolio, Privacy Blockchain, Polychain Capital Portfolio, Coinbase 50 Index",oasis-network,222515147,330641746.0,88024.75197663001,76781.25612029663,0.03,9293634.0
Gate.io,"Layer 1 (L1), VeChain Ecosystem",vethor-token,219704716,219831444.0,72675.10427492486,49379.58626948853,0.36,3906190.0
Gate.io,"Decentralized Exchange (DEX), Decentralized Finance (DeFi), Automated Market Maker (AMM), Cosmos Ecosystem, Osmosis Ecosystem, Paradigm Portfolio, Evmos Ecosystem, Secret Ecosystem, GMCI DeFi Index, GMCI Index",osmosis,218677025,304648960.0,154122.83679105365,123459.68220675593,0.07,19458819.0
Gate.io,"Gaming (GameFi), NFT, Collectibles, Polygon Ecosystem, Ethereum Ecosystem, Animoca Brands Portfolio, Gaming Blockchains, Made in USA",superfarm,219797148,486604461.0,45601.84116033882,50231.874196588775,0.21,21258033.0
Gate.io,"Artificial Intelligence (AI), Solana Ecosystem, Meme, Solana Meme, AI Meme, AI Agents, Binance Alpha Spotlight, AI Framework, Made in USA",ai16z,219303803,219303803.0,126303.26514471202,131614.53978694527,0.09,38383584.0
Gate.io,"Smart Contract Platform, Gaming (GameFi), Ethereum Ecosystem, Base Ecosystem, Card Games, Paradigm Portfolio, Gaming Blockchains, Gaming Utility Token",echelon-prime,220759835,435876396.0,66660.9697285241,102576.07715526833,0.31,4107132.0
Gate.io,"BNB Chain Ecosystem, Polygon Ecosystem, Ethereum Ecosystem, Animoca Brands Portfolio, DWF Labs Portfolio, Alameda Research Portfolio, Energi Ecosystem, Binance Labs Portfolio",mask-network,218134973,218134973.0,212255.63060416133,321766.63758701883,0.05,19874960.0
Gate.io,"Artificial Intelligence (AI), Harmony Ecosystem, Arbitrum Ecosystem, Ethereum Ecosystem, DePIN, Coinbase Ventures Portfolio, Multicoin Capital Portfolio, Pantera Capital Portfolio, GMCI DePIN Index, GMCI Index, Coinbase 50 Index",livepeer,215815643,215815643.0,106159.51012276848,84826.17439427532,0.07,16695371.0
Gate.io,"Decentralized Exchange (DEX), Decentralized Finance (DeFi), Avalanche Ecosystem, Harmony Ecosystem, Ethereum Ecosystem, Coinbase Ventures Portfolio, Pantera Capital Portfolio, Energi Ecosystem, GMCI DeFi Index, Blockchain Capital Portfolio, GMCI Index, Made in USA",0x,215868173,254442536.0,82193.63216013425,88694.12659605613,0.12,21464057.0
Gate.io,"Decentralized Exchange (DEX), BNB Chain Ecosystem, Solana Ecosystem, Ethereum Ecosystem, Real World Assets (RWA), Base Ecosystem, RWA Protocol",chex-token,210826198,210825670.0,4769.992696393593,3409.057485425549,0.38,1171652.0
Gate.io,"Decentralized Finance (DeFi), Aptos Ecosystem",abtc,211492711,211492711.0,,,N/A,162190.0
Gate.io,"Gaming (GameFi), BNB Chain Ecosystem, Solana Ecosystem, Meme, Ethereum Ecosystem, Dog-Themed, Solana Meme, Gaming Utility Token",baby-doge-coin,210270720,533732558.0,55818.23871107542,62875.97836807465,0.16,10301826.0
Gate.io,"Artificial Intelligence (AI), Polkadot Ecosystem, Metaverse, Ethereum Ecosystem, Interoperability, Real World Assets (RWA), DePIN, Decentralized Science (DeSci), AI Agents",origintrail,209937812,210234229.0,11269.6994378186,12669.088785108468,0.75,3863694.0
Gate.io,"BNB Chain Ecosystem, Meme, AI Meme",ai-companions,211663766,211663766.0,828.7384446378031,2218.7278475218814,0.55,3321107.0
Gate.io,"Liquid Staking Tokens, Ethereum Ecosystem, Base Ecosystem, Liquid Staked ETH, Liquid Staking",liquid-staked-ethereum,208305326,208305326.0,,,N/A,63036.0
Gate.io,"Decentralized Finance (DeFi), Yield Farming, BNB Chain Ecosystem, Avalanche Ecosystem, Polygon Ecosystem, Fantom Ecosystem, Arbitrum Ecosystem, Ethereum Ecosystem, Optimism Ecosystem, Linea Ecosystem, Bridge Governance Tokens, Base Ecosystem, FTX Holdings",stargate-finance,206400729,212463430.0,104239.84457364441,120019.086805953,0.05,7300553.0
Gate.io,"Smart Contract Platform, Storage, Harmony Ecosystem, Ethereum Ecosystem, DePIN, Energi Ecosystem, Sora Ecosystem, GMCI DePIN Index, GMCI Index",holotoken,205226932,205226932.0,56613.540385529166,48867.36659313696,0.35,8837121.0
Gate.io,"Stablecoins, USD Stablecoin, Arbitrum Ecosystem, Ethereum Ecosystem, Base Ecosystem, Crypto-backed Stablecoin, Fiat-backed Stablecoin",gho,205129106,205129106.0,,,N/A,6601344.0
Gate.io,"Solana Ecosystem, Meme, Dog-Themed, Solana Meme, Bitcoin Ecosystem, Runes",dog-go-to-the-moon-rune,203615621,203615621.0,13327.78784923871,12726.258456654867,0.1,5529698.0
Gate.io,"Stablecoins, Ethereum Ecosystem",usda-2,201382376,201382376.0,,,N/A,626179.0
Gate.io,"BNB Chain Ecosystem, Meme",cheems-token,201608057,201608057.0,59902.30694039762,82597.37938413987,0.13,5358455.0
Gate.io,"Decentralized Finance (DeFi), Polygon Ecosystem, Ethereum Ecosystem, Coinbase Ventures Portfolio, Pantera Capital Portfolio",instadapp,200271060,507827826.0,,,N/A,922236.0
Gate.io,"Solana Ecosystem, Meme, Solana Meme, Pump.fun Ecosystem, Zoo-Themed, Memorial Themed",peanut-the-squirrel,200057822,200057822.0,81980.19700577209,99725.04043568471,0.03,185839541.0
Gate.io,"Solana Ecosystem, BRC-20, Bitcoin Ecosystem, Inscriptions",ordinals,197784472,197784472.0,528572.2164428809,593027.4177545973,0.11,69430603.0
Gate.io,"Artificial Intelligence (AI), Exchange-based Tokens, Analytics, Derivatives, Perpetuals, Centralized Exchange (CEX) Token, Ethereum Ecosystem, Binance Launchpad, Coinbase Ventures Portfolio, Binance Labs Portfolio, Made in USA",arkham,197369675,533871176.0,648291.6259898387,515959.1314333809,0.13,42117928.0
Gate.io,"Smart Contract Platform, Layer 1 (L1), Celo Ecosystem, DWF Labs Portfolio, Coinbase Ventures Portfolio, Proof of Stake (PoS), Andreessen Horowitz (a16z) Portfolio, Optimism Superchain Ecosystem, Outlier Ventures Portfolio, Made in USA",celo,197181769,348828804.0,112725.19469113513,141615.4717808583,0.03,11796613.0
Gate.io,"Smart Contract Platform, Privacy, Layer 1 (L1), Proof of Stake (PoS), Proof of Work (PoW), Blockchain Capital Portfolio, Made in USA",decred,197143793,197149901.0,12830.183760565329,14677.476144690294,0.53,1741979.0
Gate.io,"Smart Contract Platform, Layer 1 (L1), DePIN, Andreessen Horowitz (a16z) Portfolio, Made in USA",chia,196624757,446782506.0,34259.246233433616,26105.288547052205,0.21,7377435.0
Gate.io,"Solana Ecosystem, Meme, Solana Meme, Cat-Themed, Murad Picks",popcat,196263603,196263603.0,74691.74559654268,87630.60696850295,0.1,48671627.0
Gate.io,"Gambling (GambleFi), Gaming (GameFi), Ethereum Ecosystem",rollbit-coin,196871678,196871678.0,,,N/A,917601.0
Gate.io,"Infrastructure, Smart Contract Platform, NEO Ecosystem",gas,193794958,193794958.0,74788.46263515069,56860.09569939636,0.1,4282456.0
Gate.io,"Infrastructure, Smart Contract Platform, Venom Ecosystem",venom,191678607,693015706.0,1815.867361741308,5207.34408438256,0.04,428839.0
Gate.io,"Exchange-based Tokens, Ethereum Ecosystem",btse-token,189646648,234042813.0,,,N/A,3266540.0
Gate.io,"Infrastructure, Smart Contract Platform, BNB Chain Ecosystem, Layer 1 (L1), Ethereum Ecosystem, GMCI Layer 1 Index, Aelf Ecosystem, GMCI Index",aelf,187957727,253366061.0,42591.73691928078,57689.39839089943,0.28,11400363.0
Gate.io,"Smart Contract Platform, Storage, DePIN, Paradigm Portfolio, Proof of Work (PoW), DragonFly Capital Portfolio, Made in USA",siacoin,186937036,199794485.0,24917.78095025041,43766.02212801513,0.18,12556628.0
Gate.io,"Smart Contract Platform, Real World Assets (RWA), Proof of Work (PoW), Made in USA",ravencoin,186167821,186207191.0,50501.461524925675,50998.266859890384,0.05,6103234.0
Gate.io,"Gaming (GameFi), Ethereum Ecosystem, Decentralized Identifier (DID), Animoca Brands Portfolio, OKX Ventures Portfolio, Outlier Ventures Portfolio",mocaverse,185698851,863927144.0,39774.193663986676,67672.5813425533,0.22,15461513.0
Gate.io,"Meme, Cronos Ecosystem, AI Meme, Cronos zkEVM Ecosystem",agentfun-ai,184581169,184581169.0,,,N/A,4187.2
Gate.io,"Crypto-Backed Tokens, Decentralized Finance (DeFi), Wrapped-Tokens, Ethereum Ecosystem",resolv-wstusr,184744046,165271580.0,,,N/A,162.11
Gate.io,"Solana Ecosystem, Meme, Solana Meme, AI Meme, Pump.fun Ecosystem",act-i-the-ai-prophecy,183383037,183383037.0,13625.297611987755,15589.524021466224,0.13,25725740.0
Gate.io,"Decentralized Finance (DeFi), BNB Chain Ecosystem, Polygon Ecosystem, Fantom Ecosystem, Arbitrum Ecosystem, Moonbeam Ecosystem, Liquid Staking Tokens, Ethereum Ecosystem, Optimism Ecosystem, Liquid Staked ETH, Liquid Staking",staked-frax-ether,182858535,182847966.0,,,N/A,52988.0
Gate.io,"Meme, Ethereum Ecosystem, Base Ecosystem, Cat-Themed, Murad Picks",mog-coin,181675128,181675128.0,376095.53175879695,296606.2309294957,0.13,10117938.0
Gate.io,"Tourism, BNB Chain Ecosystem",trip,180704784,600307418.0,,,N/A,64797.0
Gate.io,"BNB Chain Ecosystem, Avalanche Ecosystem, Polygon Ecosystem, Fantom Ecosystem, Arbitrum Ecosystem, Ethereum Ecosystem, Optimism Ecosystem, Liquid Staking Governance Tokens, Linea Ecosystem, DePIN, Scroll Ecosystem, Rollups-as-a-Service (RaaS), Blast Ecosystem, Mode Ecosystem, Pantera Capital Portfolio, Polygon zkEVM Ecosystem, Binance Labs Portfolio, Liquid Staking, Made in USA",ankr,180272717,180272717.0,42000.3939432614,26554.49393498041,0.55,11081086.0
Gate.io,"Solana Ecosystem, Ethereum Ecosystem, Energi Ecosystem",swissborg,179833126,179833126.0,,,N/A,5983821.0
Gate.io,"Solana Ecosystem, Meme, Cat-Themed",meow,179139615,179139615.0,,,N/A,291270.0
Gate.io,"Avalanche Ecosystem, Liquid Staking Tokens, Liquid Staking",benqi-liquid-staked-avax,180118206,180118206.0,,,N/A,2060832.0
Gate.io,,nem,177285724,177285724.0,734.4193875276906,2479.2323480343302,0.61,17948539.0
Gate.io,"Artificial Intelligence (AI), Smart Contract Platform, Layer 1 (L1), Paradigm Portfolio, Coinbase Ventures Portfolio, DeFiance Capital Portfolio, Polychain Capital Portfolio, Vana Ecosystem",vana,177170453,690274493.0,313057.58302326774,365272.30895824445,0.03,22958013.0
Gate.io,"Tokenized Real Estate, Tokenized Assets, Ethereum Ecosystem, Real World Assets (RWA), RWA Protocol",apf-coin,176720467,259472945.0,,,N/A,2976044.0
Gate.io,"Decentralized Finance (DeFi), Yield Farming, Yield Aggregator, Yearn Ecosystem, Avalanche Ecosystem, Polygon Ecosystem, Near Protocol Ecosystem, Gnosis Chain Ecosystem, Fantom Ecosystem, Harmony Ecosystem, Arbitrum Ecosystem, Ethereum Ecosystem, Optimism Ecosystem, Base Ecosystem, Index Coop Defi Index, Alameda Research Portfolio, Energi Ecosystem, Sora Ecosystem, Huobi ECO Chain Ecosystem, Blockchain Capital Portfolio, Index Coop Index",yearn-finance,175454019,190615137.0,78819.06835284148,72769.89697908914,0.25,21032578.0
Gate.io,"Launchpad, Meme, Base Ecosystem, Cat-Themed, Base Meme",toshi,172588065,172588065.0,1374522.651845554,1521435.4497909325,0.07,20098767.0
Gate.io,"Gaming (GameFi), BNB Chain Ecosystem, Ethereum Ecosystem, TON Ecosystem",gmt-token,173454269,173454269.0,5942.712541076518,16227.112997522569,0.24,14024827.0
Gate.io,"Solana Ecosystem, Meme, Dog-Themed, Solana Meme, Cat-Themed",cat-in-a-dogs-world,173119472,173119472.0,95845.85405055241,125255.91500681001,0.05,7801651.0
Gate.io,"Decentralized Finance (DeFi), Launchpad, Ethereum Ecosystem, DWF Labs Portfolio, Coinbase Ventures Portfolio, Pantera Capital Portfolio, Blockchain Capital Portfolio",auction,172438505,199929367.0,106054.20803495175,206526.92135957378,0.18,161793153.0
Gate.io,"Starknet Ecosystem, Bridged-Tokens",bridged-wrapped-ether-starkgate,172534618,172534618.0,,,N/A,613395.0
Gate.io,"Smart Contract Platform, Privacy, Proof of Work (PoW)",mimblewimblecoin,169636050,169636436.0,,,N/A,38724.0
Gate.io,"Internet of Things (IOT), Ethereum Ecosystem, DePIN, Base Ecosystem, Account Abstraction, GMCI DePIN Index, GMCI Index, Made in USA",iotex,169375550,169375550.0,36648.56099714812,42174.87001531223,0.11,9477998.0
Gate.io,"Decentralized Finance (DeFi), Derivatives, Perpetuals, Avalanche Ecosystem, Arbitrum Ecosystem",gmx,169567754,169568386.0,70818.58623980776,81209.07562991952,0.24,51446578.0
Gate.io,Arbitrum Ecosystem,rcge,168805259,168805259.0,,,N/A,2.43
Gate.io,"Decentralized Finance (DeFi), Solana Ecosystem, Ethereum Ecosystem, Optimism Ecosystem, Base Ecosystem, Cross-chain Communication, BTCfi",threshold-network-token,168414106,185526997.0,43759.350839685976,29635.598042916532,0.36,13189163.0
Gate.io,"Decentralized Finance (DeFi), Derivatives, Prediction Markets, Solana Ecosystem",drift-protocol,167776789,581547277.0,159501.51899591464,153229.00574000477,0.05,95551489.0
Gate.io,"Entertainment, Smart Contract Platform, Gaming (GameFi), NFT, Metaverse, Layer 1 (L1), Harmony Ecosystem, Ethereum Ecosystem, Gaming Blockchains, Energi Ecosystem",enjincoin,167584452,173383604.0,41593.216785422876,41108.6814110798,0.29,12841164.0
Gate.io,"Smart Contract Platform, Gaming (GameFi), Layer 1 (L1), Ethereum Ecosystem, Modular Blockchain, Account Abstraction, Multicoin Capital Portfolio, Gaming Blockchains, Gaming Utility Token, Skale Ecosystem, Consensys Portfolio, Galaxy Digital Portfolio, Made in USA",skale,166913809,175587634.0,114264.44684255827,111809.4290252174,0.1,20196653.0
Gate.io,"Decentralized Finance (DeFi), Liquid Staking Tokens, Ethereum Ecosystem, Liquid Staked ETH, Liquid Staking",treehouse-eth,165556757,165556757.0,,,N/A,169943.0
Gate.io,"Decentralized Exchange (DEX), Decentralized Finance (DeFi), Yield Farming, Automated Market Maker (AMM), BNB Chain Ecosystem, Seigniorage, Solana Ecosystem, Avalanche Ecosystem, Polygon Ecosystem, Fantom Ecosystem, Harmony Ecosystem, Arbitrum Ecosystem, Moonriver Ecosystem, Ethereum Ecosystem, Liquid Staking Governance Tokens, Curve Ecosystem, Stablecoin Protocol, Polygon zkEVM Ecosystem, Evmos Ecosystem, Fraxtal Ecosystem, GMCI DeFi Index, Liquid Staking, GMCI Index, Made in USA",frax-share,165305922,186755149.0,57449.54746063447,69897.78064538367,0.27,48601865.0
Gate.io,"Decentralized Finance (DeFi), Binance Launchpool, Arbitrum Ecosystem, Ethereum Ecosystem, Restaking, Liquid Restaking Governance Tokens, Ether.fi Ecosystem, Consensys Portfolio, OKX Ventures Portfolio",ether-fi,164322316,709306340.0,821932.2180519628,623099.084045748,0.01,44058833.0
Gate.io,"Decentralized Finance (DeFi), Yield Farming, Yield Aggregator, Ethereum Ecosystem, Metagovernance, Curve Ecosystem, Yield Optimizer",convex-finance,162455166,197850662.0,38372.56728818807,38851.07024028074,0.35,10191894.0
Gate.io,"Decentralized Finance (DeFi), Ethereum Ecosystem, Stablecoin Protocol",tribe-2,163022996,358280070.0,4.381449353783839,3.001565661038172,1.51,58164.0
Gate.io,"Decentralized Exchange (DEX), Exchange-based Tokens, Ethereum Ecosystem",coinex-token,162217213,162217282.0,,,N/A,86515.0
