Gate.io,"Decentralized Finance (DeFi), Ethereum Ecosystem, Stablecoin Protocol",tribe-2,163336589,358969262.0,4.381433724958181,3.0015549543193156,1.51,59061.0
Gate.io,"Decentralized Exchange (DEX), Exchange-based Tokens, Ethereum Ecosystem",coinex-token,162440333,162440333.0,,,N/A,94151.0
Gate.io,"Smart Contract Platform, Gaming (GameFi), Layer 1 (L1), Ethereum Ecosystem, Modular Blockchain, Account Abstraction, Multicoin Capital Portfolio, Gaming Blockchains, Gaming Utility Token, Skale Ecosystem, Consensys Portfolio, Galaxy Digital Portfolio, Made in USA",skale,161626519,170025585.0,98854.80058271706,153785.80368468302,0.07,21187675.0
Gate.io,"Decentralized Finance (DeFi), Yield Farming, Yield Aggregator, Ethereum Ecosystem, Metagovernance, Curve Ecosystem, Yield Optimizer",convex-finance,161903392,197178756.0,26295.167925270907,60790.26829259169,0.35,10157455.0
Gate.io,"Decentralized Finance (DeFi), Binance Launchpool, Arbitrum Ecosystem, Ethereum Ecosystem, Restaking, Liquid Restaking Governance Tokens, Ether.fi Ecosystem, Consensys Portfolio, OKX Ventures Portfolio",ether-fi,160950359,694751100.0,577374.2781676763,800765.615568293,0.01,42719925.0
Gate.io,"BNB Chain Ecosystem, Binance Alpha Spotlight",bnb48-club-token,160101771,160101771.0,,,N/A,146855.0
Gate.io,"Solana Ecosystem, DePIN, Multicoin Capital Portfolio, Made in USA",hivemapper,159077991,247419115.0,15948.852301598685,57217.41299813849,0.26,1842174.0
Gate.io,"Decentralized Exchange (DEX), Exchange-based Tokens, Decentralized Finance (DeFi), Automated Market Maker (AMM), BNB Chain Ecosystem, Derivatives, Perpetuals, Centralized Exchange (CEX) Token, Solana Ecosystem, Avalanche Ecosystem, Polygon Ecosystem, Near Protocol Ecosystem, Fantom Ecosystem, Arbitrum Ecosystem, Ethereum Ecosystem, ZkSync Ecosystem, Mantle Ecosystem, Linea Ecosystem, Base Ecosystem, DragonFly Capital Portfolio, Binance Labs Portfolio",woo-network,158591830,188874071.0,67612.96838261292,101000.58707140898,0.16,5692572.0
Gate.io,"Meme, Ethereum Ecosystem, Frog-Themed, AI Meme",turbo,158550860,158550860.0,130406.28324675965,170460.7012667629,0.09,35773244.0
Gate.io,"Smart Contract Platform, Layer 1 (L1), Proof of Stake (PoS), GMCI Layer 1 Index, GMCI Index, Made in USA",casper-network,157807061,163381892.0,102162.51928038165,112566.84560898271,0.11,10387650.0
Gate.io,"Smart Contract Platform, BNB Chain Ecosystem, Layer 1 (L1), Ethereum Ecosystem, ZetaChain Ecosystem, Cross-chain Communication, Made in USA",zetachain,158885932,456040946.0,135059.11020522928,286303.9645161178,0.05,9429108.0
Gate.io,"Decentralized Finance (DeFi), Tron Ecosystem",sun-token,158026787,319918917.0,220536.24396260997,176441.97809945245,0.06,22677563.0
Gate.io,"SocialFi, Arbitrum Ecosystem",uxlink,157205626,464830354.0,70843.453903121,106841.08245793701,0.09,12868320.0
Gate.io,"Internet of Things (IOT), Oracle, NFT, Metaverse, Ethereum Ecosystem, DePIN, Alleged SEC Securities, Made in USA",xyo-network,154353244,154353244.0,20761.7149154205,25808.485590475637,0.5,4749478.0
Gate.io,"Smart Contract Platform, EthereumPoW Ecosystem, Proof of Work (PoW)",ethereum-pow-iou,152733729,152733729.0,18692.487233352083,27436.521308996416,0.21,3885802.0
Gate.io,"Stablecoins, Ethereum Ecosystem, Crypto-backed Stablecoin",elixir-staked-deusd,152138287,152138287.0,,,N/A,54706.0
Gate.io,Smart Contract Platform,bitkub-coin,151542620,187616074.0,706.0777407232947,904.1490116387155,1.04,275643.0
Gate.io,"Gaming (GameFi), NFT, Solana Ecosystem, Animoca Brands Portfolio, FTX Holdings, Multicoin Capital Portfolio, Alameda Research Portfolio",metaplex,150966423,193451145.0,10849.440432618436,17778.07312233279,0.05,5935988.0
Gate.io,"Smart Contract Platform, Layer 1 (L1), Real World Assets (RWA), RWA Protocol",polymesh,150100234,150100234.0,170893.8985294762,194324.250036624,0.15,1852237.0
Gate.io,"Artificial Intelligence (AI), Meme, Base Ecosystem, AI Agents, Binance Alpha Spotlight, AI Framework",freysa-ai,148462157,148462157.0,0.0,0.0,N/A,613248.0
Gate.io,"Binance Launchpool, Solana Ecosystem, Ethereum Ecosystem, Decentralized Science (DeSci)",bio-protocol,148268163,303680193.0,79362.08506935276,66546.79693008796,0.22,19715660.0
Gate.io,"BNB Chain Ecosystem, Binance-Peg Tokens",binance-peg-sol,148695732,148695732.0,,,N/A,3241408.0
Gate.io,"Artificial Intelligence (AI), Smart Contract Platform, Layer 1 (L1), Proof of Work (PoW)",qubic-network,148212010,177262445.0,8568.592372842873,9431.41681039831,0.22,11370021.0
Gate.io,"Payment Solutions, Made in USA, Directed Acyclic Graph (DAG)",nano,147784272,147784272.0,7543.421923337179,14258.856569692116,0.59,2998535.0
Gate.io,"NFT, Solana Ecosystem, NFT Marketplace, Paradigm Portfolio, Sequoia Capital Portfolio",magic-eden,148387525,1112554065.0,84399.00440738199,236508.40994587247,0.21,14587077.0
Gate.io,"Solana Ecosystem, Meme, Solana Meme, Murad Picks",gigachad-2,147070100,147070100.0,8423.073917017307,10218.00852824042,0.32,11596956.0
Gate.io,"Internet of Things (IOT), Smart Contract Platform, Layer 1 (L1), Proof of Work (PoW), Made in USA",digibyte,146566903,146571548.0,24756.178168018607,73081.3125470553,0.18,3076888.0
Gate.io,"Smart Contract Platform, Crypto-Backed Tokens, Wrapped-Tokens, Layer 2 (L2), Mantle Ecosystem",wrapped-ether-mantle-bridge,145524060,145524060.0,,,N/A,7898429.0
Gate.io,"Smart Contract Platform, Masternodes, Zero Knowledge (ZK), Proof of Work (PoW), Made in USA",zencash,145571046,145571046.0,,,N/A,15312795.0
Gate.io,"Crypto-Backed Tokens, BNB Chain Ecosystem, Wrapped-Tokens, Ethereum Ecosystem",wrapped-beacon-eth,145125465,145125465.0,,,N/A,6181769.0
Gate.io,BNB Chain Ecosystem,acet-token,145700806,190087079.0,,,N/A,759519.0
Gate.io,"Alleged SEC Securities, Osmosis Ecosystem, DeFiance Capital Portfolio, Pantera Capital Portfolio, Binance Labs Portfolio, Delphi Ventures Portfolio, Galaxy Digital Portfolio, OKX Ventures Portfolio",terra-luna-2,144756634,227034652.0,162767.4815034393,199839.02849066825,0.1,28574162.0
Gate.io,"Smart Contract Platform, Layer 1 (L1), Kadena Ecosystem, Multicoin Capital Portfolio, Proof of Work (PoW), Made in USA",kadena,143573993,143737629.0,57884.26535130109,121703.70704521218,0.13,4743402.0
Gate.io,"Exchange-based Tokens, Decentralized Finance (DeFi), Ethereum Ecosystem, Real World Assets (RWA), Alleged SEC Securities",lcx,142179415,143540858.0,,,N/A,2892176.0
Gate.io,"Smart Contract Platform, DWF Labs Portfolio, Proof of Stake (PoS)",waves,141546896,141546896.0,21873.012639027813,23729.413384765616,0.22,12231854.0
Gate.io,"Stablecoins, Ethereum Ecosystem, XRP Ledger Ecosystem, Fiat-backed Stablecoin, Made in USA",ripple-usd,141470852,141470852.0,,,N/A,17211729.0
Gate.io,"Stablecoins, EUR Stablecoin, Solana Ecosystem, Avalanche Ecosystem, Ethereum Ecosystem, Base Ecosystem, Stellar Ecosystem",euro-coin,139608315,139608315.0,,,N/A,21903998.0
Gate.io,"Gaming (GameFi), Play To Earn, Telegram Apps, TON Ecosystem, Tap to Earn, Arcade Games",hamster-kombat,138827608,215654537.0,59936.78854892412,130605.90164017223,0.05,18178002.0
Gate.io,"Gaming (GameFi), Polkadot Ecosystem, NFT, Ethereum Ecosystem, Gaming Blockchains, Andreessen Horowitz (a16z) Portfolio, Binance Labs Portfolio, Galaxy Digital Portfolio, Made in USA",mythos,138771253,178657003.0,7165.446970906775,9345.087859661424,0.34,1764707.0
Gate.io,"Gaming (GameFi), NFT, BNB Chain Ecosystem, Solana Ecosystem, Polygon Ecosystem, Play To Earn, Move To Earn, Ethereum Ecosystem, Binance Launchpad, Gaming Governance Token, Sports Games, Alameda Research Portfolio, Binance Labs Portfolio, Sequoia Capital Portfolio",stepn,138924979,259755337.0,74087.22679151548,80414.62885657106,0.1,19242901.0
Gate.io,"Tokenized Assets, Tokenized Gold, Real World Assets (RWA), Tokenized Commodities",kinesis-gold,138251604,138251604.0,,,N/A,50887.0
Gate.io,"Smart Contract Platform, Layer 1 (L1), Harmony Ecosystem, Animoca Brands Portfolio, Binance Launchpad, Binance Labs Portfolio, Made in USA",harmony,138371512,147936512.0,84211.5195667226,95015.60052563428,0.17,8062420.0
Gate.io,"Crypto-Backed Tokens, Wrapped-Tokens, Avalanche Ecosystem",wrapped-avax,137945257,137945257.0,,,N/A,75826687.0
Gate.io,"Decentralized Finance (DeFi), Analytics, DeFi Index, Base Ecosystem",mag7-ssi,136057622,136057622.0,2378.286476837617,1664.2149487416928,0.34,1072322.0
Gate.io,"BNB Chain Ecosystem, Arbitrum Ecosystem, Cardano Ecosystem, Ethereum Ecosystem, DePIN, Base Ecosystem, DWF Labs Portfolio",world-mobile-token,136213197,393579281.0,3807.553995796135,1855.0991271797498,0.51,13399211.0
Gate.io,"Stablecoins, EUR Stablecoin, Polygon Ecosystem, Ethereum Ecosystem, Real World Assets (RWA), Fiat-backed Stablecoin",stasis-eurs,134621879,134621879.0,,,N/A,56152.0
Gate.io,"Smart Contract Platform, Masternodes, Proof of Stake (PoS), Made in China",ontology,134198531,147035002.0,42860.92223488086,64874.86739825896,0.14,4256734.0
Gate.io,"Liquid Staking Tokens, Aptos Ecosystem, Liquid Staking",amnis-aptos,133356345,133384595.0,,,N/A,130453.0
Gate.io,"Smart Contract Platform, SocialFi, NFT, BNB Chain Ecosystem, Binance Launchpool, Ethereum Ecosystem, Decentralized Identifier (DID), Zero Knowledge (ZK), DWF Labs Portfolio, Coinbase Ventures Portfolio, Multicoin Capital Portfolio, Alameda Research Portfolio, DragonFly Capital Portfolio, Binance Labs Portfolio, Quest-to-Earn",project-galaxy,132151411,206891746.0,,,N/A,354811.0
Gate.io,"Decentralized Exchange (DEX), Smart Contract Platform, Exchange-based Tokens, Decentralized Finance (DeFi), Arbitrum Ecosystem, Ethereum Ecosystem, Layer 2 (L2), Zero Knowledge (ZK), Loopring Ecosystem, Rollup, Energi Ecosystem",loopring,132281772,145858469.0,47204.319636851746,93356.23733815258,0.09,11677400.0
Gate.io,"Tokenized Assets, Real World Assets (RWA), Tokenized Silver, Tokenized Commodities",kinesis-silver,131658825,131658825.0,,,N/A,66635.0
Gate.io,"Stablecoins, USD Stablecoin, Solana Ecosystem, Fiat-backed Stablecoin",global-dollar,130246510,130246510.0,,,N/A,1165033.0
Gate.io,"Cronos Ecosystem, Bridged USDC, Bridged-Tokens, Bridged Stablecoins",cronos-bridged-usdc-cronos,128834848,128834848.0,,,N/A,1779714.0
Gate.io,"Smart Contract Platform, Base Ecosystem, Gaming Blockchains",b3,127650711,599505415.0,55963.59145852362,51144.11025788368,0.17,18639532.0
Gate.io,"Artificial Intelligence (AI), Binance Launchpool, Solana Ecosystem, DePIN, Animoca Brands Portfolio, Multicoin Capital Portfolio, Delphi Ventures Portfolio, OKX Ventures Portfolio, Made in USA",io,127641273,692514743.0,351421.9508633239,327713.39309818664,0.12,37312964.0
Gate.io,"BNB Chain Ecosystem, Harmony Ecosystem, Ethereum Ecosystem, Alameda Research Portfolio, Binance Labs Portfolio",swipe,125815181,125891418.0,56832.57588140253,44781.170517191575,0.15,3565521.0
Gate.io,"Artificial Intelligence (AI), Smart Contract Platform, BNB Chain Ecosystem, Solana Ecosystem, Layer 1 (L1), Polygon Ecosystem, Ethereum Ecosystem, DWF Labs Portfolio, Injective Ecosystem, OKX Ventures Portfolio",zignaly,125577209,174108431.0,5629.94437162131,7595.913450215791,0.59,2163764.0
Gate.io,"Decentralized Exchange (DEX), Decentralized Finance (DeFi), Gnosis Chain Ecosystem, MEV Protection, Arbitrum Ecosystem, Ethereum Ecosystem, Intent, Delphi Ventures Portfolio, Blockchain Capital Portfolio",cow-protocol,123926484,298616435.0,20785.920392465086,25308.81523312431,0.2,29123830.0
Gate.io,"Smart Contract Platform, BNB Chain Ecosystem, Ethereum Ecosystem, Zero Knowledge (ZK), Animoca Brands Portfolio, Binance Labs Portfolio, OKX Ventures Portfolio",polyhedra-network,123700517,2048581877.0,366879.8199739098,414016.78225016425,0.01,8246067.0
Gate.io,"BNB Chain Ecosystem, Tron Ecosystem",global-commercial-business,123583914,123583914.0,,,N/A,201931.0
Gate.io,"Decentralized Exchange (DEX), Exchange-based Tokens, Decentralized Finance (DeFi), Yield Farming, Automated Market Maker (AMM), BNB Chain Ecosystem, Yearn Ecosystem, Solana Ecosystem, Avalanche Ecosystem, Polygon Ecosystem, Near Protocol Ecosystem, Fantom Ecosystem, Harmony Ecosystem, Arbitrum Ecosystem, Celo Ecosystem, Ethereum Ecosystem, Base Ecosystem, Alameda Research Portfolio, Pantera Capital Portfolio, Energi Ecosystem, Sora Ecosystem, Blockchain Capital Portfolio",sushi,123071121,179182333.0,209376.64699129044,209162.29170811048,0.02,25407432.0
Gate.io,"Smart Contract Platform, Ethereum Ecosystem, Zero Knowledge (ZK), Alleged SEC Securities, Privacy Blockchain",coti,123615774,137940246.0,31481.90350111984,59602.1132957795,0.3,21016128.0
Gate.io,"Decentralized Finance (DeFi), Insurance, Ethereum Ecosystem",nxm,123205765,123205765.0,,,N/A,0.0
Gate.io,"Polygon Ecosystem, Bridged DAI, Bridged-Tokens, Bridged Stablecoins",polygon-pos-bridged-dai-polygon-pos,122726348,122726348.0,,,N/A,11310777.0
Gate.io,"Tokenized Assets, Polygon Ecosystem, Arbitrum Ecosystem, Ethereum Ecosystem, Real World Assets (RWA), Starknet Ecosystem, Tokenized Treasury Bills (T-Bills)",eutbl,122449574,122449574.0,,,N/A,0.0
Gate.io,"Exchange-based Tokens, BNB Chain Ecosystem, Centralized Exchange (CEX) Token",nkyc-token,122047429,122047429.0,,,N/A,252497.0
Gate.io,"Business Services, Decentralized Finance (DeFi), Oracle, Fantom Ecosystem, Ethereum Ecosystem, Binance Launchpad, Osmosis Ecosystem, Energi Ecosystem, Binance Labs Portfolio, Sequoia Capital Portfolio",band-protocol,121661289,123498209.0,37927.78209211304,51163.82713755477,0.19,7834212.0
Gate.io,"Arbitrum Ecosystem, Ethereum Ecosystem",reserve-protocol-eth-plus,119186180,119186180.0,,,N/A,263337.0
Gate.io,"Arbitrum Ecosystem, Ethereum Ecosystem, Account Abstraction, Coinbase Ventures Portfolio, Binance Labs Portfolio, Consensys Portfolio, Outlier Ventures Portfolio",biconomy,118812957,126907476.0,55823.62992430926,80691.05715923726,0.24,13168351.0
Gate.io,"Decentralized Finance (DeFi), Ethereum Ecosystem, Real World Assets (RWA), Coinbase Ventures Portfolio, Stablecoin Protocol, Binance Labs Portfolio, Galaxy Digital Portfolio",usual,118429439,130203303.0,276491.7522140347,354237.7642441622,0.06,13511719.0
Gate.io,"Decentralized Finance (DeFi), Yield Farming, Avalanche Ecosystem, Fantom Ecosystem, Arbitrum Ecosystem, Olympus Pro Ecosystem, Ethereum Ecosystem, Stablecoin Protocol",spell-token,116873292,144461947.0,292419.8165619943,407517.22074241226,0.11,132983515.0
Gate.io,"Smart Contract Platform, SocialFi, Layer 1 (L1), Gaming Blockchains",hive,116786124,,55400.077476640756,83885.66265540078,0.12,2303638.0
Gate.io,"Stablecoins, Ethereum Ecosystem, Base Ecosystem, Blast Ecosystem, Fiat-backed Stablecoin",anzen-usdz,114964217,114964217.0,,,N/A,81544.0
Gate.io,"BNB Chain Ecosystem, Ethereum Ecosystem, Payment Solutions, DWF Labs Portfolio",alchemy-pay,114175117,230951157.0,145115.0847697722,206298.31030032012,0.04,26369240.0
Gate.io,"Meme, Ethereum Ecosystem, Dog-Themed",neiro-3,114123123,114123123.0,267144.00957772555,190746.1984276289,0.07,34816504.0
Gate.io,"Solana Ecosystem, Polygon Ecosystem, Ethereum Ecosystem",m2-global-wealth-limited-mmx,114096033,366046055.0,,,N/A,91989.0
Gate.io,"Decentralized Finance (DeFi), Yield Farming, Lending/Borrowing Protocols, Ethereum Ecosystem, Real World Assets (RWA), Base Ecosystem, Binance Alpha Spotlight",syrup,113044759,181393471.0,17459.201136697113,3794.1807971273797,0.26,7854890.0
Gate.io,"Smart Contract Platform, BNB Chain Ecosystem, Ethereum Ecosystem, Layer 2 (L2)",prometeus,111660806,117779207.0,37860.26835035286,62029.40311866222,0.23,1849056.0
Gate.io,"Business Services, Infrastructure, Smart Contract Platform, Decentralized Finance (DeFi), Polygon Ecosystem, Arbitrum Ecosystem, Ethereum Ecosystem, Liquid Staking Governance Tokens, Coinbase Ventures Portfolio, Proof of Stake (PoS), Index Coop Defi Index, Consensys Portfolio, Liquid Staking, Index Coop Index",rocket-pool,111533381,111533381.0,29724.915971005837,44154.23628545865,0.57,10550228.0
Gate.io,"Smart Contract Platform, Ethereum Ecosystem, Metis Ecosystem, Layer 2 (L2), DWF Labs Portfolio, Rollup, GMCI Layer 2 Index, OKX Ventures Portfolio, GMCI Index",metis-token,112301061,179528470.0,94192.27230124755,164659.2860338929,0.11,7144858.0
Gate.io,"Exchange-based Tokens, NFT, BNB Chain Ecosystem, Ethereum Ecosystem",swftcoin,111288591,111288591.0,463847.38549258537,404951.5883981143,0.87,2353078.0
Gate.io,"Smart Contract Platform, BNB Chain Ecosystem, Layer 1 (L1), Ethereum Ecosystem, Decentralized Identifier (DID), Base Ecosystem, Gravity Alpha Ecosystem",g-token,110913802,184020576.0,82635.76677439008,104138.5272795737,0.26,7692016.0
Gate.io,"Big Data, Business Services, Infrastructure, Decentralized Finance (DeFi), Solana Ecosystem, FTX Holdings, DWF Labs Portfolio, Name Service",bonfida,110863002,111879791.0,77384.87452006199,133259.92707796246,0.09,11450700.0
Gate.io,"Arbitrum Ecosystem, Bridged USDC, Bridged-Tokens, Bridged Stablecoins",usd-coin-ethereum-bridged,110361567,110361567.0,,,N/A,15477396.0
Gate.io,"Smart Contract Platform, Cross-chain Communication, Pantera Capital Portfolio",icon,109058529,110289728.0,43193.42227729844,46089.4986935841,0.13,738608.0
Gate.io,"Decentralized Finance (DeFi), Derivatives, Synthetic Issuer, Ethereum Ecosystem, Synthetic",stp-network,108796959,108796959.0,41158.795409835155,60527.66829964868,0.41,22948679.0
Gate.io,"Meme, PulseChain Ecosystem",the-grays-currency,108571297,108571297.0,,,N/A,175968.0
Gate.io,"Music, NFT, Ethereum Ecosystem, Coinbase Ventures Portfolio, Multicoin Capital Portfolio, Pantera Capital Portfolio, Energi Ecosystem, Binance Labs Portfolio",audius,108670666,108670666.0,24478.9532763743,40025.2314499197,0.04,13921713.0
Gate.io,"Smart Contract Platform, Proof of Stake (PoS), Sequoia Capital Portfolio",iostoken,108206241,108206241.0,46726.54491963539,78434.81820797051,0.15,34826803.0
Gate.io,"Smart Contract Platform, Decentralized Finance (DeFi), Binance Launchpool, Derivatives, Perpetuals, Ethereum Ecosystem, Layer 2 (L2), DragonFly Capital Portfolio, Pantera Capital Portfolio",aevo-exchange,108090522,119679568.0,226390.60253121905,379798.1359511237,0.17,13683276.0
Gate.io,"Decentralized Exchange (DEX), Decentralized Finance (DeFi), BNB Chain Ecosystem, Wallets, XRP Ledger Ecosystem",solo-coin,108193093,108193093.0,11914.847848453725,3469.2327867701797,0.32,2334077.0
Gate.io,"Lending/Borrowing Protocols, Ethereum Ecosystem, Paradigm Portfolio, Coinbase Ventures Portfolio",euler,107578394,156499913.0,,,N/A,2430919.0
Gate.io,"Crypto-Backed Tokens, BNB Chain Ecosystem, Arbitrum Ecosystem, Ethereum Ecosystem, Mantle Ecosystem",ignition-fbtc,106930468,1179525482.0,,,N/A,379296.0
Gate.io,"Decentralized Finance (DeFi), Ethereum Ecosystem, Morpho Ecosystem",steakhouse-usdc-morpho-vault,106123273,106123273.0,,,N/A,0.0
Gate.io,"Solana Ecosystem, Multicoin Capital Portfolio, Stablecoin Protocol, Alameda Research Portfolio, DeFiance Capital Portfolio",uxd-protocol-token,105809364,105809364.0,,,N/A,387.65
Gate.io,"Gaming (GameFi), NFT, Metaverse, Play To Earn, Ethereum Ecosystem, Animoca Brands Portfolio, RPG, Gaming Governance Token, Adventure Games, Energi Ecosystem, Delphi Ventures Portfolio",illuvium,105680976,136148514.0,34794.746508606266,47973.92063242704,0.28,13727226.0
Gate.io,"Smart Contract Platform, Privacy, Layer 1 (L1), Proof of Stake (PoS), Proof of Work (PoW), Zano Ecosystem, Privacy Blockchain",zano,105522158,105523645.0,,,N/A,668099.0
Gate.io,"Stablecoins, BNB Chain Ecosystem",astherus-usdf,105086720,105086720.0,,,N/A,363079.0
Gate.io,"Tokenized Real Estate, Tokenized Assets, Gnosis Chain Ecosystem, RealT Tokens, Real World Assets (RWA), RWA Protocol",realtoken-ecosystem-governance,104651587,730808972.0,,,N/A,609.03
Gate.io,"NFT, Meme, Arbitrum Ecosystem, Ethereum Ecosystem, Anime-Themed, Binance HODLer Airdrops, Airdropped Tokens by NFT Projects",anime,103991360,187757326.0,41662.38645022956,48974.61059020144,0.11,12500557.0
Gate.io,"Smart Contract Platform, BNB Chain Ecosystem, Ethereum Ecosystem, DWF Labs Portfolio, Made in USA",proton,103917402,115196456.0,5881.921571027435,8837.689891314436,0.26,4860511.0
Gate.io,"Solana Ecosystem, Meme, Solana Meme, PolitiFi, Made in USA",melania-meme,103659321,691061569.0,16526.191676495695,27132.158401965487,0.14,11880738.0
Gate.io,"Decentralized Finance (DeFi), BNB Chain Ecosystem, Real World Assets (RWA), DWF Labs Portfolio, Stellar Ecosystem",velo,103294050,335438376.0,28505.307509381004,57549.16118013755,0.24,11587725.0
Gate.io,"Artificial Intelligence (AI), Smart Contract Platform, Masternodes, DePIN, Proof of Work (PoW), Made in USA",zelcash,102816682,102822345.0,91696.74260691753,116154.63879180411,0.04,9744277.0
Gate.io,"Artificial Intelligence (AI), Base Ecosystem, AI Agents, AI Applications, Made in USA",venice-token,102373794,244034986.0,34636.53877476151,31507.09829969914,0.22,7721108.0
Gate.io,"Business Services, Decentralized Finance (DeFi), Oracle, Derivatives, Synthetic Issuer, Avalanche Ecosystem, Ethereum Ecosystem, Blockchain Capital Portfolio, Synthetic, Made in USA",uma,102545872,147958456.0,58490.18332866266,98032.51561534162,0.08,9103672.0
Gate.io,"Smart Contract Platform, Polkadot Ecosystem, Binance Launchpool, Layer 2 (L2), Manta Network Ecosystem, Multicoin Capital Portfolio, Alameda Research Portfolio, DeFiance Capital Portfolio, Binance Labs Portfolio",manta-network,102154318,259420295.0,173826.9861906719,246474.5115735202,0.08,28141886.0
Gate.io,"Polygon Ecosystem, Arbitrum Ecosystem, Ethereum Ecosystem, Optimism Ecosystem, Bridge Governance Tokens, Cross-chain Communication, Intent, Boba Network Ecosystem, Blockchain Capital Portfolio, Made in USA",across-protocol,102310335,253191656.0,132844.67718554146,146838.45166759475,0.16,10878198.0
Gate.io,"Infrastructure, Solana Ecosystem, Animoca Brands Portfolio, Cross-chain Communication, OKX Ventures Portfolio",zeus-network,102119237,266783656.0,44782.463424752976,48083.78997704457,0.19,7756545.0
Gate.io,"NFT, Binance Launchpool, Meme, Ethereum Ecosystem, Binance Labs Portfolio, GMCI Meme Index, GMCI Index",memecoin-2,100864141,169931979.0,267685.5852135777,323552.322928965,0.04,17724570.0
Gate.io,"Bridged USDT, QL1 Ecosystem, Bridged-Tokens, Bridged Stablecoins",qusdt,100007597,100007597.0,,,N/A,7729.21
Gate.io,"NFT, BNB Chain Ecosystem, Ethereum Ecosystem, Binance Launchpad, DWF Labs Portfolio, Binance Labs Portfolio",space-id,100017091,463862960.0,168978.7522318636,176510.17293862108,0.09,13657488.0
Gate.io,"Solana Ecosystem, Meme, Frog-Themed, Solana Meme, GMCI Meme Index, GMCI Index",book-of-meme,99498728,99498728.0,277789.0519327635,309644.2714982069,0.06,42768678.0
Gate.io,"Solana Ecosystem, Meme, Base Ecosystem, AI Meme, AI Agents, Virtuals Protocol Ecosystem, Binance Alpha Spotlight, DeFAI",aixbt,99313704,116073196.0,72062.25898961436,72078.92405652006,0.08,41533253.0
Gate.io,"Solana Ecosystem, Liquid Staking Tokens, Liquid Staked SOL, Liquid Staking",drift-staked-sol,99012061,99012061.0,,,N/A,26408.0
Gate.io,"Decentralized Exchange (DEX), Decentralized Finance (DeFi), Automated Market Maker (AMM), Ethereum Ecosystem, Cronos Ecosystem",vvs-finance,98512793,192587305.0,2547.0786952900044,1.3131359859625247,1.19,303726.0
Gate.io,"Smart Contract Platform, BNB Chain Ecosystem, Binance Launchpool, Ethereum Ecosystem, Layer 2 (L2), Restaking, Rollups-as-a-Service (RaaS), Rollup, Binance Labs Portfolio",altlayer,98408211,352463186.0,136444.58592142208,139479.9071325009,0.03,11993749.0
Gate.io,"Smart Contract Platform, Ethereum Ecosystem, Layer 2 (L2), Optimism Superchain Ecosystem, Outlier Ventures Portfolio, Lisk Ecosystem",lisk,97715927,226791734.0,50495.51360305268,58394.51092289025,0.21,8744236.0
Gate.io,"NFT, Polygon Ecosystem, Ethereum Ecosystem, Optimism Ecosystem",blockv,97625183,97625183.0,,,N/A,51758.0
Gate.io,"Crypto-Backed Tokens, Decentralized Finance (DeFi), Compound Tokens, cToken, Ethereum Ecosystem",compound-ether,97567582,97567582.0,,,N/A,281.36
Gate.io,"Big Data, Infrastructure, Storage, Cardano Ecosystem, DePIN",iagon,97068808,258147695.0,3961.0348788598035,2673.1765533856205,0.66,525696.0
Gate.io,"Gaming (GameFi), NFT, BNB Chain Ecosystem",infinitar-governance-token,96092077,468927115.0,688.7606492735466,1079.2424583335232,0.86,7958380.0
Gate.io,"Software as a service, Ethereum Ecosystem, Energi Ecosystem",status,96174080,165245502.0,86018.4899798654,79021.69218451867,0.12,8484135.0
Gate.io,"Stablecoins, LP Tokens, Ethereum Ecosystem",resolv-rlp,96085631,96085631.0,,,N/A,102245.0
Gate.io,"Infrastructure, Smart Contract Platform, Ethereum Ecosystem, Data Availability, Modular Blockchain",avail,95580806,489340743.0,45370.61242786654,42467.37218567041,0.13,2882730.0
Gate.io,"XDC Ecosystem, Telos Ecosystem",ecoin-2,95498064,207099463.0,,,N/A,5.24
Gate.io,"Smart Contract Platform, Layer 1 (L1), Zero Knowledge (ZK), Andreessen Horowitz (a16z) Portfolio, Privacy Blockchain, Made in USA",aleo,95335819,467128579.0,159162.657343339,215970.79478845297,0.11,6440970.0
Gate.io,"DaoMaker Launchpad, Ethereum Ecosystem, Real World Assets (RWA), Sequoia Capital Portfolio, Made in USA",clearpool,95603290,125802748.0,12095.857883778788,11742.127551334412,0.41,2323158.0
Gate.io,"BNB Chain Ecosystem, Liquid Staking Tokens",astherus-staked-bnb,90849062,90849062.0,,,N/A,1036.08
Gate.io,"Solana Ecosystem, Payment Solutions, Viction Ecosystem",saros-finance,94738091,360907038.0,295.2310611625434,7052.106392037165,1.21,688681.0
Gate.io,"Gaming (GameFi), NFT, Kaia Ecosystem, Gaming Blockchains",bora,94431134,98772795.0,1621.49243516526,1098.7032996756272,1.47,512710.0
Gate.io,"Fraxtal Ecosystem, Bridged-Tokens",l2-standard-bridged-frxusd,94501714,94501714.0,,,N/A,1111210.0
Gate.io,"Solana Ecosystem, Liquid Staking Tokens, Restaking, Liquid Restaking Tokens, Liquid Staked SOL, Liquid Staking, Liquid Restaked SOL",solayer-staked-sol,94376066,94376066.0,,,N/A,361619.0
