Gate.io,"Decentralized Exchange (DEX), Decentralized Finance (DeFi), Yield Farming, Automated Market Maker (AMM), BNB Chain Ecosystem, Derivatives, Lending/Borrowing Protocols, Arbitrum Ecosystem, Ethereum Ecosystem, Optimism Ecosystem, Fixed Interest, Real World Assets (RWA), LSDFi, Base Ecosystem, Restaking, LRTfi, Liquid Restaking Governance Tokens, Yield Tokenization Protocol, Binance Labs Portfolio, GMCI DeFi Index, Sonic Ecosystem, Liquid Staking, GMCI Index, BTCfi",pendle,342405946,534502260.0,303792.2567283296,327536.9359119498,0.05,37339446.0
Gate.io,"Decentralized Finance (DeFi), Liquid Staking Tokens, Ethereum Ecosystem, Liquid Staked ETH, Liquid Staking",stakewise-v3-oseth,338376091,338376091.0,,,N/A,1314255.0
Gate.io,"Smart Contract Platform, Decentralized Finance (DeFi), Coinbase Ventures Portfolio, DeFiance Capital Portfolio, Pantera Capital Portfolio, Binance Labs Portfolio, Galaxy Digital Portfolio",terra-luna,336239292,401297807.0,52914.805553142374,55821.80296442019,0.06,11101092.0
Gate.io,"Smart Contract Platform, Gaming (GameFi), NFT, BNB Chain Ecosystem, Binance Launchpool, Avalanche Ecosystem, Ethereum Ecosystem, DWF Labs Portfolio, Gaming Blockchains, Avalanche L1",beam-2,325520202,378706347.0,113431.59086266022,220642.46348570863,0.16,25743131.0
Gate.io,"Mantle Ecosystem, Bridged USDT, Bridged-Tokens, Bridged Stablecoins",mantle-bridged-usdt-mantle,325354418,325354418.0,,,N/A,922019.0
Gate.io,"Solana Ecosystem, Meme, Ethereum Ecosystem, Base Ecosystem, Murad Picks, Stock market-themed",spx6900,323694031,323694031.0,20710.12797407741,23279.062112982683,0.17,17890795.0
Gate.io,"Stablecoins, USD Stablecoin, BNB Chain Ecosystem, Avalanche Ecosystem, Polygon Ecosystem, Optimism Ecosystem, Fiat-backed Stablecoin, Binance-Peg Tokens",binance-peg-busd,323620132,323620132.0,,,N/A,8668374.0
Gate.io,"Decentralized Exchange (DEX), Smart Contract Platform, Decentralized Finance (DeFi), Prediction Markets, Layer 1 (L1), Gnosis Chain Ecosystem, MEV Protection, Arbitrum Ecosystem, Ethereum Ecosystem, SideChain, Energi Ecosystem",gnosis,319872542,370567540.0,86830.55092547058,99798.99330912891,0.08,28790188.0
Gate.io,"Smart Contract Platform, Zero Knowledge (ZK), FTX Holdings, Paradigm Portfolio, Coinbase Ventures Portfolio, Multicoin Capital Portfolio, Proof of Stake (PoS), Pantera Capital Portfolio, Circle Ventures Portfolio, Privacy Blockchain, Polychain Capital Portfolio, Made in USA, Coinbase 50 Index",mina-protocol,314983995,314983995.0,120990.09425482011,184868.72543943426,0.08,14858820.0
Gate.io,"Meme, Base Ecosystem, Frog-Themed, Base Meme, The Boy’s Club",based-brett,313189030,313189030.0,36427.938958377534,48399.153084945385,0.06,32013658.0
Gate.io,"Decentralized Finance (DeFi), Arbitrum Ecosystem, Ethereum Ecosystem, Real World Assets (RWA), Base Ecosystem, Coinbase Ventures Portfolio, Energi Ecosystem, Made in USA",reserve-rights-token,308763021,552351442.0,180021.98369255534,178771.9523853247,0.11,23830235.0
Gate.io,"Smart Contract Platform, Layer 1 (L1), MEV Protection, Proof of Work (PoW), Privacy Blockchain",verus-coin,307156316,307164390.0,,,N/A,17749.75
Gate.io,"Decentralized Finance (DeFi), Lending/Borrowing Protocols, Ethereum Ecosystem, Base Ecosystem, Coinbase Ventures Portfolio, Pantera Capital Portfolio, Morpho Ecosystem, Binance Alpha Spotlight",morpho,305319213,1293461248.0,182364.26956333334,182875.1304772334,0.02,12348649.0
Gate.io,"Yield Aggregator, Ethereum Ecosystem, Binance Labs Portfolio, Polychain Capital Portfolio",stakestone-berachain-vault-token,302871620,302871620.0,,,N/A,286125.0
Gate.io,"Artificial Intelligence (AI), Smart Contract Platform, Storage, BNB Chain Ecosystem, Layer 1 (L1), Ethereum Ecosystem, DePIN, DWF Labs Portfolio, Osmosis Ecosystem, GMCI DePIN Index, GMCI Index",aioz-network,299064361,303089766.0,23527.288060119918,31433.074519647475,0.08,13104831.0
Gate.io,"Decentralized Finance (DeFi), Tron Ecosystem",just,295936380,295936380.0,179390.31044047055,149156.06062801692,0.03,23358679.0
Gate.io,"Artificial Intelligence (AI), Ethereum Ecosystem, DePIN, Energi Ecosystem, GMCI DePIN Index, GMCI Index",golem,293516080,293516080.0,81413.82038912016,88599.41996300395,0.14,33516255.0
Gate.io,"Smart Contract Platform, Layer 1 (L1), Ethereum Ecosystem, Real World Assets (RWA), RWA Protocol, Made in USA",plume,285173740,1425868701.0,74768.78663190805,74484.33393912608,0.05,73203145.0
Gate.io,"Solana Ecosystem, Arbitrum Ecosystem, Impossible Finance Launchpad, Ethereum Ecosystem, DePIN, Animoca Brands Portfolio",aethir,282721339,1503204352.0,364127.704456323,352516.6967025232,0.06,51020410.0
Gate.io,"Polygon Ecosystem, Bridged WETH, Bridged-Tokens",polygon-pos-bridged-weth-polygon-pos,282451964,282451964.0,,,N/A,15468105.0
Gate.io,"Decentralized Exchange (DEX), Exchange-based Tokens, Decentralized Finance (DeFi), Yield Farming, Derivatives, Synthetic Issuer, Avalanche Ecosystem, Polygon Ecosystem, Near Protocol Ecosystem, Fantom Ecosystem, Harmony Ecosystem, Ethereum Ecosystem, Optimism Ecosystem, Base Ecosystem, DWF Labs Portfolio, Paradigm Portfolio, Coinbase Ventures Portfolio, Index Coop Defi Index, Energi Ecosystem, Huobi ECO Chain Ecosystem, GMCI DeFi Index, Synthetic, Index Coop Index, GMCI Index, Coinbase 50 Index",havven,281906911,282258714.0,313148.54305682174,253421.37835149726,0.17,23669580.0
Gate.io,"Crypto-Backed Tokens, Wrapped-Tokens, Polygon Ecosystem, Arbitrum Ecosystem, Liquid Staking Tokens, Ethereum Ecosystem, Optimism Ecosystem, Base Ecosystem, Liquid Staked ETH, Liquid Staking",coinbase-wrapped-staked-eth,278632469,775458465.0,,,N/A,6299439.0
Gate.io,"Smart Contract Platform, Privacy, Masternodes, Alleged SEC Securities, Proof of Stake (PoS), Proof of Work (PoW), Made in USA",dash,276367030,276382847.0,,,N/A,37788959.0
Gate.io,"Infrastructure, Ethereum Ecosystem, Data Availability, Restaking, Polychain Capital Portfolio, Made in USA",eigenlayer,275037368,1927621843.0,432130.90593322145,329163.33302861184,0.09,46901241.0
Gate.io,"Decentralized Exchange (DEX), Exchange-based Tokens, Decentralized Finance (DeFi), Automated Market Maker (AMM), BNB Chain Ecosystem, Avalanche Ecosystem, Polygon Ecosystem, Near Protocol Ecosystem, Harmony Ecosystem, Ethereum Ecosystem, FTX Holdings, Alameda Research Portfolio, DragonFly Capital Portfolio, Pantera Capital Portfolio, Energi Ecosystem, Binance Labs Portfolio, GMCI DeFi Index, Galaxy Digital Portfolio, Blockchain Capital Portfolio, Dex Aggregator, GMCI Index, Coinbase 50 Index",1inch,274602659,299058768.0,131817.7394299876,128112.57893015746,0.05,22824217.0
Gate.io,"BNB Chain Ecosystem, Wallets, Ethereum Ecosystem, Animoca Brands Portfolio, Binance Launchpad, Energi Ecosystem, Binance Labs Portfolio",safepal,271016123,271016123.0,120192.45217496817,91015.51111158072,0.04,9317047.0
Gate.io,"Liquid Staking Tokens, Ethereum Ecosystem, Liquid Staking",stader-ethx,268940002,268940002.0,,,N/A,39197.0
Gate.io,"Polygon Ecosystem, Bridged WBTC, Bridged-Tokens",polygon-bridged-wbtc-polygon-pos,266925686,266925686.0,,,N/A,6636899.0
Gate.io,"Stablecoins, USD Stablecoin, Ethereum Ecosystem, Fiat-backed Stablecoin",elixir-deusd,266888741,266888741.0,,,N/A,22532922.0
Gate.io,"Smart Contract Platform, Ethereum Ecosystem, Real World Assets (RWA), DWF Labs Portfolio, Proof of Stake (PoS)",creditcoin-2,266079446,367499464.0,83672.67417667744,103865.01235087025,0.05,25771677.0
Gate.io,"Exchange-based Tokens, Centralized Exchange (CEX) Token, Ethereum Ecosystem, Morph L2 Ecosystem",mx-token,265347575,1169185795.0,,,N/A,21391464.0
Gate.io,"Smart Contract Platform, Polkadot Ecosystem, Proof of Stake (PoS), Pantera Capital Portfolio, Made in USA, Coinbase 50 Index",kusama,263806776,263806776.0,73770.57550456334,134939.8158387566,0.18,14351056.0
Gate.io,"BRC-20, Bitcoin Ecosystem, Inscriptions",sats-ordinals,258057180,258057180.0,108737.82165917069,261305.52730068946,0.02,6731423.0
Gate.io,"Solana Ecosystem, Arbitrum Ecosystem, Ethereum Ecosystem, Interoperability, Base Ecosystem, Multicoin Capital Portfolio, Cross-chain Communication, Made in USA",wormhole,257650325,887409571.0,503258.8357132294,467691.0622121689,0.11,28830940.0
Gate.io,"Smart Contract Platform, DePIN, Proof of Stake (PoS), Made in USA",theta-fuel,257497024,257521487.0,27446.53294885922,24642.985299908676,0.5,2978361.0
Gate.io,"Decentralized Finance (DeFi), Ethereum Ecosystem, Restaking, Liquid Restaking Tokens, Liquid Staking",ether-fi-staked-btc,255564329,255564329.0,,,N/A,430429.0
Gate.io,"Smart Contract Platform, Layer 2 (L2), Zero Knowledge (ZK), ZkSync Ecosystem, Consensys Portfolio, Blockchain Capital Portfolio, OKX Ventures Portfolio",zksync,255450710,1459718341.0,311362.72437904397,273664.84536005213,0.03,36030955.0
Gate.io,"Crypto-Backed Tokens, Decentralized Finance (DeFi), cToken, Ethereum Ecosystem",compound-wrapped-btc,255219654,255219654.0,,,N/A,0.0
Gate.io,"Solana Ecosystem, Meme, Solana Meme, AI Meme, Pump.fun Ecosystem, Terminal of Truths, Binance Alpha Spotlight",fartcoin,255156006,255156006.0,422558.16011933074,197815.84745340978,0.04,159780971.0
Gate.io,"Stablecoins, Tokenized Assets, Tokenized Gold, BNB Chain Ecosystem, Real World Assets (RWA), Tokenized Commodities, Commodity-backed Stablecoin",quorium,251918416,251918416.0,,,N/A,112878.0
Gate.io,"Decentralized Finance (DeFi), Liquid Staking Tokens, Base Ecosystem, Liquid Staked ETH, Liquid Staking",super-oeth,251515805,251515805.0,,,N/A,767752.0
Gate.io,"Decentralized Finance (DeFi), Solana Ecosystem, LSDFi, Restaking, Stablecoin Protocol, Binance Labs Portfolio, Binance HODLer Airdrops, Polychain Capital Portfolio",solayer,250922116,1194867217.0,239345.54002970248,254243.59737849195,0.15,341253940.0
Gate.io,"Arbitrum Ecosystem, Liquid Staking Tokens, Ethereum Ecosystem, Liquid Staking",sweth,250140913,250147887.0,,,N/A,306447.0
Gate.io,"Decentralized Finance (DeFi), BNB Chain Ecosystem, Polygon Ecosystem, Fantom Ecosystem, Arbitrum Ecosystem, Moonbeam Ecosystem, Liquid Staking Tokens, Ethereum Ecosystem, Optimism Ecosystem, Polygon zkEVM Ecosystem, Liquid Staking, Made in USA",frax-ether,248404699,248404699.0,,,N/A,3264985.0
Gate.io,"Meme, Cardano Ecosystem",snek,243474463,246581554.0,21012.96742489176,18506.900707179142,0.42,1347739.0
Gate.io,"Smart Contract Platform, Gaming (GameFi), NFT, Layer 1 (L1), Play To Earn, Gaming Blockchains, WEMIX Ecosystem",wemix-token,243161560,312676764.0,3014.5022378504855,7674.563118403312,0.2,5089550.0
Gate.io,"Smart Contract Platform, BNB Chain Ecosystem, GMCI Layer 1 Index, GMCI Index, Made in China",zilliqa,239309062,247627608.0,145593.89364174136,245427.3542037506,0.08,16604150.0
Gate.io,"Smart Contract Platform, Polkadot Ecosystem, Layer 1 (L1), Layer 2 (L2), Alameda Research Portfolio, Binance Labs Portfolio, OKX Ventures Portfolio",astar,236028581,259514556.0,466669.67361652636,445018.2255187788,0.06,5867714.0
Gate.io,"Analytics, Avalanche Ecosystem, Meme, Cat-Themed, Made in USA",ket,233815342,233815342.0,,,N/A,9059057.0
Gate.io,"NFT, Ethereum Ecosystem, NFT Marketplace, FTX Holdings, NFTFi, eGirl Capital Portfolio, Paradigm Portfolio, GMCI DeFi Index, GMCI Index, Made in USA, Coinbase 50 Index",blur,233613919,312142923.0,226081.19678280843,236090.90724961305,0.1,17462207.0
Gate.io,"Bridged USDC, Sonic Ecosystem, Bridged-Tokens, Bridged Stablecoins",sonic-bridged-usdc-e-sonic,229982850,229982850.0,,,N/A,30330880.0
Gate.io,"Infrastructure, Wallets, Gnosis Chain Ecosystem, Ethereum Ecosystem",safe,228721739,413126358.0,119604.87286160978,127423.39163881779,0.05,13731414.0
Gate.io,"Smart Contract Platform, Proof of Stake (PoS), Made in China",qtum,225880539,230721267.0,97222.56670072945,93846.30197351474,0.09,22389152.0
Gate.io,"Decentralized Exchange (DEX), Exchange-based Tokens, Decentralized Finance (DeFi), Derivatives, Perpetuals, Ethereum Ecosystem, Paradigm Portfolio",dydx,223044129,223044129.0,,,N/A,14224046.0
Gate.io,"Smart Contract Platform, Interoperability, Layer 2 (L2), Rollup, Multicoin Capital Portfolio, Proof of Work (PoW), DragonFly Capital Portfolio, Sequoia Capital Portfolio, Blockchain Capital Portfolio, Polychain Capital Portfolio, Made in China",nervos-network,222125567,225630132.0,189426.10330891982,169340.4441930182,0.02,13529255.0
Gate.io,"Gaming (GameFi), Binance Launchpool, Meme, Play To Earn, TON Ecosystem, TON Meme, Tap to Earn",notcoin,221568583,221568583.0,268048.23089870106,263945.1666099761,0.05,124976527.0
Gate.io,"Solana Ecosystem, Avalanche Ecosystem, Polygon Ecosystem, Near Protocol Ecosystem, Harmony Ecosystem, Ethereum Ecosystem, Pantera Capital Portfolio, Energi Ecosystem, Made in USA",basic-attention-token,220581311,221220142.0,39222.33962856167,37110.47198833508,0.27,15494556.0
Gate.io,"BNB Chain Ecosystem, Polygon Ecosystem, Ethereum Ecosystem, Animoca Brands Portfolio, DWF Labs Portfolio, Alameda Research Portfolio, Energi Ecosystem, Binance Labs Portfolio",mask-network,217681687,217681687.0,213939.88936493458,318794.5632919182,0.05,42608948.0
Gate.io,"Stablecoins, USD Stablecoin, BNB Chain Ecosystem, Avalanche Ecosystem, Near Protocol Ecosystem, Arbitrum Ecosystem, Ethereum Ecosystem, Tron Ecosystem, BitTorrent Ecosystem, Algorithmic Stablecoin, Fiat-backed Stablecoin",usdd,214828863,215755741.0,57867.59034846289,65729.90140857061,0.02,3026652.0
Gate.io,"Decentralized Exchange (DEX), Decentralized Finance (DeFi), Avalanche Ecosystem, Harmony Ecosystem, Ethereum Ecosystem, Coinbase Ventures Portfolio, Pantera Capital Portfolio, Energi Ecosystem, GMCI DeFi Index, Blockchain Capital Portfolio, GMCI Index, Made in USA",0x,212529878,250507708.0,78200.63470065467,114487.59782867089,0.2,27502470.0
Gate.io,"Layer 1 (L1), VeChain Ecosystem",vethor-token,212240279,212251171.0,64355.577572444825,49018.83593557399,0.25,4077160.0
Gate.io,"Infrastructure, Decentralized Finance (DeFi), Sui Ecosystem",deep,211283050,845132201.0,112442.55846038376,243587.72280626625,0.04,16493174.0
Gate.io,"Smart Contract Platform, BNB Chain Ecosystem, Layer 1 (L1), Proof of Stake (PoS), Pantera Capital Portfolio, Andreessen Horowitz (a16z) Portfolio, Binance Labs Portfolio, Blockchain Capital Portfolio, Privacy Blockchain, Polychain Capital Portfolio, Coinbase 50 Index",oasis-network,211122163,313712580.0,84909.51067819982,99192.03059322969,0.06,10661692.0
Gate.io,"Decentralized Finance (DeFi), Aptos Ecosystem",abtc,208777739,208777739.0,,,N/A,164166.0
Gate.io,"BNB Chain Ecosystem, Meme, AI Meme",ai-companions,206447905,206447905.0,1010.9102684051481,1753.9845352654868,0.58,4102924.0
Gate.io,"Stablecoins, Ethereum Ecosystem",usda-2,206152294,206152294.0,,,N/A,69207.0
Gate.io,"Artificial Intelligence (AI), Solana Ecosystem, Meme, Solana Meme, AI Meme, AI Agents, Binance Alpha Spotlight, AI Framework, Made in USA",ai16z,206119565,206119565.0,112016.9229203479,120151.72683276392,0.1,55283442.0
Gate.io,"Artificial Intelligence (AI), Harmony Ecosystem, Arbitrum Ecosystem, Ethereum Ecosystem, DePIN, Coinbase Ventures Portfolio, Multicoin Capital Portfolio, Pantera Capital Portfolio, GMCI DePIN Index, GMCI Index, Coinbase 50 Index",livepeer,205182012,205182012.0,108892.87269140541,87512.95836832123,0.06,28595949.0
Gate.io,"Stablecoins, USD Stablecoin, Arbitrum Ecosystem, Ethereum Ecosystem, Base Ecosystem, Crypto-backed Stablecoin, Fiat-backed Stablecoin",gho,204817578,204817578.0,,,N/A,16464984.0
Gate.io,"Liquid Staking Tokens, Ethereum Ecosystem, Base Ecosystem, Liquid Staked ETH, Liquid Staking",liquid-staked-ethereum,203707432,203707432.0,,,N/A,63531.0
Gate.io,"Gaming (GameFi), BNB Chain Ecosystem, Solana Ecosystem, Meme, Ethereum Ecosystem, Dog-Themed, Solana Meme, Gaming Utility Token",baby-doge-coin,201993005,512721141.0,49017.86099875858,56585.81499230531,0.08,16553032.0
Gate.io,"Smart Contract Platform, Storage, Harmony Ecosystem, Ethereum Ecosystem, DePIN, Energi Ecosystem, Sora Ecosystem, GMCI DePIN Index, GMCI Index",holotoken,198445040,198445040.0,50580.58054545868,57289.90707470715,0.45,9320948.0
Gate.io,"Artificial Intelligence (AI), Polkadot Ecosystem, Metaverse, Ethereum Ecosystem, Interoperability, Real World Assets (RWA), DePIN, Decentralized Science (DeSci), AI Agents",origintrail,197157042,197159001.0,41227.36079618359,9587.355024379978,0.21,9439830.0
Gate.io,"Decentralized Exchange (DEX), Decentralized Finance (DeFi), Automated Market Maker (AMM), Cosmos Ecosystem, Osmosis Ecosystem, Paradigm Portfolio, Evmos Ecosystem, Secret Ecosystem, GMCI DeFi Index, GMCI Index",osmosis,196749992,274164033.0,97242.67530122816,161732.92645687712,0.11,12091460.0
Gate.io,"Smart Contract Platform, BNB Chain Ecosystem, Avalanche Ecosystem, Polygon Ecosystem, Arbitrum Ecosystem, Ethereum Ecosystem, Optimism Ecosystem, Base Ecosystem, Multicoin Capital Portfolio, Layer 0 (L0), Cross-chain Communication, Circle Ventures Portfolio, Sequoia Capital Portfolio, OKX Ventures Portfolio",layerzero,196256228,1765642718.0,906072.4117985221,770761.0553746484,0.06,27944247.0
Gate.io,"Decentralized Finance (DeFi), Yield Farming, BNB Chain Ecosystem, Avalanche Ecosystem, Polygon Ecosystem, Fantom Ecosystem, Arbitrum Ecosystem, Ethereum Ecosystem, Optimism Ecosystem, Linea Ecosystem, Bridge Governance Tokens, Base Ecosystem, FTX Holdings",stargate-finance,195786773,201537706.0,135088.45881566807,88073.84146186036,0.05,6439974.0
Gate.io,"Artificial Intelligence (AI), Exchange-based Tokens, Analytics, Derivatives, Perpetuals, Centralized Exchange (CEX) Token, Ethereum Ecosystem, Binance Launchpad, Coinbase Ventures Portfolio, Binance Labs Portfolio, Made in USA",arkham,194453918,525984257.0,598355.781839539,574355.3873552498,0.02,63855332.0
Gate.io,"Decentralized Finance (DeFi), Polygon Ecosystem, Ethereum Ecosystem, Coinbase Ventures Portfolio, Pantera Capital Portfolio",instadapp,193836265,491511099.0,,,N/A,947675.0
Gate.io,"Solana Ecosystem, Meme, Solana Meme, Cat-Themed, Murad Picks",popcat,193045742,193045742.0,96817.56095506123,111479.36779312517,0.11,94780712.0
Gate.io,"Smart Contract Platform, Privacy, Layer 1 (L1), Proof of Stake (PoS), Proof of Work (PoW), Blockchain Capital Portfolio, Made in USA",decred,192608815,192609200.0,12715.80704302469,11510.06906463611,0.93,2637095.0
Gate.io,"Solana Ecosystem, BRC-20, Bitcoin Ecosystem, Inscriptions",ordinals,191968576,191968576.0,480546.8701997604,643906.5778064964,0.11,79182355.0
Gate.io,"Infrastructure, Smart Contract Platform, BNB Chain Ecosystem, Layer 1 (L1), Ethereum Ecosystem, GMCI Layer 1 Index, Aelf Ecosystem, GMCI Index",aelf,191440807,258061235.0,47414.54492814601,58096.667717728975,0.2,37321544.0
Gate.io,"Gaming (GameFi), NFT, Collectibles, Polygon Ecosystem, Ethereum Ecosystem, Animoca Brands Portfolio, Gaming Blockchains, Made in USA",superfarm,191421782,423784810.0,45604.88225444974,40435.343299267886,0.14,14684863.0
Gate.io,"Decentralized Exchange (DEX), BNB Chain Ecosystem, Solana Ecosystem, Ethereum Ecosystem, Real World Assets (RWA), Base Ecosystem, RWA Protocol",chex-token,190970029,190970029.0,1651.6201135336248,2829.7955033239327,0.16,1427952.0
Gate.io,"BNB Chain Ecosystem, Meme",cheems-token,190276140,190276140.0,85126.96753626215,63247.73356490712,0.24,5361935.0
Gate.io,"Smart Contract Platform, Gaming (GameFi), Ethereum Ecosystem, Base Ecosystem, Card Games, Paradigm Portfolio, Gaming Blockchains, Gaming Utility Token",echelon-prime,189732302,374614381.0,74233.4590079914,92237.96481543494,0.06,4075029.0
Gate.io,"Infrastructure, Smart Contract Platform, NEO Ecosystem",gas,188771492,188771492.0,94737.30032208623,90456.68990201254,0.17,7070023.0
Gate.io,"Smart Contract Platform, Layer 1 (L1), Celo Ecosystem, DWF Labs Portfolio, Coinbase Ventures Portfolio, Proof of Stake (PoS), Andreessen Horowitz (a16z) Portfolio, Optimism Superchain Ecosystem, Outlier Ventures Portfolio, Made in USA",celo,187945890,332489867.0,152649.16533587762,213806.5957078095,0.03,20155694.0
Gate.io,"Smart Contract Platform, Layer 1 (L1), DePIN, Andreessen Horowitz (a16z) Portfolio, Made in USA",chia,184960872,420837830.0,31500.61822678053,37809.64748376831,0.2,14484288.0
Gate.io,"Crypto-Backed Tokens, Decentralized Finance (DeFi), Wrapped-Tokens, Ethereum Ecosystem",resolv-wstusr,184744046,163775048.0,,,N/A,162.11
Gate.io,"Solana Ecosystem, Ethereum Ecosystem, Energi Ecosystem",swissborg,184683891,184683891.0,,,N/A,24017112.0
Gate.io,"Solana Ecosystem, Meme, Solana Meme, AI Meme, Pump.fun Ecosystem",act-i-the-ai-prophecy,184095076,184095076.0,12514.92265994916,14992.17736996181,0.12,65356049.0
Gate.io,"Smart Contract Platform, Privacy, Proof of Work (PoW)",mimblewimblecoin,183796667,183799964.0,,,N/A,5764.02
Gate.io,"Smart Contract Platform, Real World Assets (RWA), Proof of Work (PoW), Made in USA",ravencoin,183665345,183676752.0,62008.8385821332,49982.018824049104,0.15,14985045.0
Gate.io,"Decentralized Finance (DeFi), Solana Ecosystem, Liquid Staking Tokens, Liquid Staked SOL, Liquid Staking",bybit-staked-sol,182273563,182273563.0,,,N/A,3044094.0
Gate.io,"Infrastructure, Smart Contract Platform, Venom Ecosystem",venom,181829062,658028651.0,1169.9310643027027,402.5966584385135,0.18,2559794.0
Gate.io,"Meme, Cronos Ecosystem, AI Meme, Cronos zkEVM Ecosystem",agentfun-ai,181653767,181653767.0,,,N/A,9151.9
Gate.io,"Solana Ecosystem, Meme, Solana Meme, Pump.fun Ecosystem, Zoo-Themed, Memorial Themed",peanut-the-squirrel,181286339,181286339.0,81333.77771435246,87359.29988909724,0.04,289008768.0
Gate.io,"Gaming (GameFi), Ethereum Ecosystem, Decentralized Identifier (DID), Animoca Brands Portfolio, OKX Ventures Portfolio, Outlier Ventures Portfolio",mocaverse,180527148,839866818.0,49037.24395760419,74986.20910017357,0.39,29850454.0
Gate.io,"Solana Ecosystem, Meme, Dog-Themed, Solana Meme, Bitcoin Ecosystem, Runes",dog-go-to-the-moon-rune,180006527,180006527.0,13992.772872444571,35033.43693354869,0.22,7757109.0
Gate.io,"Smart Contract Platform, Storage, DePIN, Paradigm Portfolio, Proof of Work (PoW), DragonFly Capital Portfolio, Made in USA",siacoin,179508059,191833303.0,30360.135248257182,31649.44671666581,0.06,19708166.0
Gate.io,"Decentralized Finance (DeFi), BNB Chain Ecosystem, Polygon Ecosystem, Fantom Ecosystem, Arbitrum Ecosystem, Moonbeam Ecosystem, Liquid Staking Tokens, Ethereum Ecosystem, Optimism Ecosystem, Liquid Staked ETH, Liquid Staking",staked-frax-ether,179339477,179339477.0,,,N/A,789736.0
Gate.io,"Tokenized Real Estate, Tokenized Assets, Ethereum Ecosystem, Real World Assets (RWA), RWA Protocol",apf-coin,178812350,262544389.0,,,N/A,3135929.0
Gate.io,"Tourism, BNB Chain Ecosystem",trip,177935656,591108280.0,,,N/A,34173.0
Gate.io,"BNB Chain Ecosystem, Avalanche Ecosystem, Polygon Ecosystem, Fantom Ecosystem, Arbitrum Ecosystem, Ethereum Ecosystem, Optimism Ecosystem, Liquid Staking Governance Tokens, Linea Ecosystem, DePIN, Scroll Ecosystem, Rollups-as-a-Service (RaaS), Blast Ecosystem, Mode Ecosystem, Pantera Capital Portfolio, Polygon zkEVM Ecosystem, Binance Labs Portfolio, Liquid Staking, Made in USA",ankr,177898061,177898061.0,37006.090952573744,27795.99007420097,0.17,17981832.0
Gate.io,"Meme, Ethereum Ecosystem, Base Ecosystem, Cat-Themed, Murad Picks",mog-coin,176287022,176287022.0,367540.1017768271,286374.80864921934,0.13,15885342.0
Gate.io,"Gaming (GameFi), BNB Chain Ecosystem, Ethereum Ecosystem, TON Ecosystem",gmt-token,176034900,176034900.0,47357.156449591566,11246.164044258308,0.28,23999606.0
Gate.io,"Solana Ecosystem, Meme, Cat-Themed",meow,175420410,175420410.0,,,N/A,224503.0
Gate.io,"Gambling (GambleFi), Gaming (GameFi), Ethereum Ecosystem",rollbit-coin,175050852,175050852.0,,,N/A,652159.0
Gate.io,,nem,174975447,174975447.0,484.47045844849214,2130.6476468618066,0.21,30912680.0
Gate.io,"Avalanche Ecosystem, Liquid Staking Tokens, Liquid Staking",benqi-liquid-staked-avax,173831407,173831407.0,,,N/A,2429634.0
Gate.io,"Artificial Intelligence (AI), Smart Contract Platform, Layer 1 (L1), Paradigm Portfolio, Coinbase Ventures Portfolio, DeFiance Capital Portfolio, Polychain Capital Portfolio, Vana Ecosystem",vana,173781274,677069897.0,273410.35031546204,416710.83860136726,0.04,39888741.0
Gate.io,"Exchange-based Tokens, Ethereum Ecosystem",btse-token,173059031,213572045.0,,,N/A,3391293.0
Gate.io,"Decentralized Finance (DeFi), Launchpad, Ethereum Ecosystem, DWF Labs Portfolio, Coinbase Ventures Portfolio, Pantera Capital Portfolio, Blockchain Capital Portfolio",auction,172721436,200257414.0,199133.59025786805,192723.00481444102,0.07,193106909.0
Gate.io,"Decentralized Finance (DeFi), Yield Farming, Yield Aggregator, Yearn Ecosystem, Avalanche Ecosystem, Polygon Ecosystem, Near Protocol Ecosystem, Gnosis Chain Ecosystem, Fantom Ecosystem, Harmony Ecosystem, Arbitrum Ecosystem, Ethereum Ecosystem, Optimism Ecosystem, Base Ecosystem, Index Coop Defi Index, Alameda Research Portfolio, Energi Ecosystem, Sora Ecosystem, Huobi ECO Chain Ecosystem, Blockchain Capital Portfolio, Index Coop Index",yearn-finance,171686400,186511123.0,98013.10135599462,86458.25354759119,0.13,30781681.0
Gate.io,Arbitrum Ecosystem,rcge,168805259,168805259.0,,,N/A,2.43
Gate.io,"Decentralized Finance (DeFi), Solana Ecosystem, Ethereum Ecosystem, Optimism Ecosystem, Base Ecosystem, Cross-chain Communication, BTCfi",threshold-network-token,168762392,185910673.0,33194.97773553168,33799.50083377304,0.24,8947304.0
Gate.io,"Starknet Ecosystem, Bridged-Tokens",bridged-wrapped-ether-starkgate,168020108,168020108.0,,,N/A,585508.0
Gate.io,"Solana Ecosystem, Meme, Dog-Themed, Solana Meme, Cat-Themed",cat-in-a-dogs-world,166825325,166825325.0,85307.01169969374,141247.8505534967,0.05,13052487.0
Gate.io,"Entertainment, Smart Contract Platform, Gaming (GameFi), NFT, Metaverse, Layer 1 (L1), Harmony Ecosystem, Ethereum Ecosystem, Gaming Blockchains, Energi Ecosystem",enjincoin,165576291,171306700.0,44691.88375753458,65797.38656611106,0.22,13635241.0
