Gate.io,"Artificial Intelligence (AI), Infrastructure, Smart Contract Platform, Oracle, Polkadot Ecosystem, Ethereum Ecosystem, Interoperability, Layer 2 (L2), Zero Knowledge (ZK), DePIN, DWF Labs Portfolio, Rollup, AI Agents, Sora Ecosystem, AI Framework, Made in USA",pha,94088762,119915719.0,99399.17198442615,126701.99158665833,0.09,21647145.0
Gate.io,"Infrastructure, Smart Contract Platform, Oracle, Layer 1 (L1), Animoca Brands Portfolio, Coinbase Ventures Portfolio, Cross-chain Communication, Made in USA",supra,93754325,833613145.0,17589.155287991132,31595.932008174037,0.04,15296129.0
Gate.io,"Artificial Intelligence (AI), Big Data, Media, BNB Chain Ecosystem, Polygon Ecosystem, Ethereum Ecosystem, GMCI DePIN Index, Galaxy Digital Portfolio, GMCI Index",everipedia,94381708,94381708.0,25315.43751761308,20552.315978006405,0.64,6803485.0
Gate.io,Layer 1 (L1),oec-token,94652014,94652014.0,455.76038530656797,985.3653745527823,0.69,394863.0
Gate.io,"Internet of Things (IOT), BNB Chain Ecosystem, Ethereum Ecosystem, DePIN, DWF Labs Portfolio",mass-vehicle-ledger,93332199,98654730.0,3603.9210152570904,2519.1401757493504,0.34,20251669.0
Gate.io,"Decentralized Finance (DeFi), Yield Farming, BNB Chain Ecosystem, Binance Launchpool, Lending/Borrowing Protocols, Arbitrum Ecosystem, Ethereum Ecosystem, Optimism Ecosystem, ZkSync Ecosystem, opBNB Ecosystem, Unichain Ecosystem",venus,93283379,167348321.0,28440.90182883804,61157.64939890836,0.46,7599114.0
Gate.io,"Smart Contract Platform, Gaming (GameFi), Solana Ecosystem, Layer 2 (L2), Gaming Blockchains",sonic-svm,92026543,613510288.0,120930.54383692335,226918.5706528004,0.04,22091813.0
Gate.io,"Ethereum Ecosystem, DWF Labs Portfolio",adventure-gold,91711442,91711442.0,84825.29685057464,89248.7457488275,0.1,23293918.0
Gate.io,"Artificial Intelligence (AI), Infrastructure, Smart Contract Platform, Decentralized Finance (DeFi), Arbitrum Ecosystem, Ethereum Ecosystem, Zero Knowledge (ZK), DWF Labs Portfolio, Coinbase Ventures Portfolio, Pantera Capital Portfolio, Binance Labs Portfolio",marlin,91456223,112167978.0,35128.018008285995,37820.138143169424,0.42,5747455.0
Gate.io,"Energy, Ethereum Ecosystem, Alleged SEC Securities, Energi Ecosystem, GMCI DePIN Index, Blockchain Capital Portfolio, GMCI Index",power-ledger,90006467,169815944.0,39037.2535441949,42131.707908613214,0.35,7188141.0
Gate.io,"Artificial Intelligence (AI), Oracle, Ethereum Ecosystem, DePIN, Energi Ecosystem, Sora Ecosystem, GMCI DePIN Index, GMCI Index",iexec-rlc,90329779,108571355.0,53220.00562069457,82950.26661532196,0.18,7459645.0
Gate.io,"Decentralized Exchange (DEX), Exchange-based Tokens, Decentralized Finance (DeFi), Yield Farming, Automated Market Maker (AMM), Avalanche Ecosystem, Polygon Ecosystem, Near Protocol Ecosystem, Gnosis Chain Ecosystem, Harmony Ecosystem, Arbitrum Ecosystem, Ethereum Ecosystem, Optimism Ecosystem, Base Ecosystem, Index Coop Defi Index, Alameda Research Portfolio, DeFiance Capital Portfolio, Pantera Capital Portfolio, Energi Ecosystem, Polygon zkEVM Ecosystem, Huobi ECO Chain Ecosystem, Blockchain Capital Portfolio, Index Coop Index",balancer,90405747,97761576.0,95893.20293585575,116848.32684962073,0.21,6826667.0
Gate.io,"Infrastructure, Smart Contract Platform, Decentralized Finance (DeFi), BNB Chain Ecosystem, Avalanche Ecosystem, Polygon Ecosystem, Fantom Ecosystem, Harmony Ecosystem, Arbitrum Ecosystem, Ethereum Ecosystem, DWF Labs Portfolio, Layer 3 (L3), Outlier Ventures Portfolio",orbs,89698122,196985598.0,12789.433801339927,15160.028874431697,0.1,3517138.0
Gate.io,"Gaming (GameFi), XDC Ecosystem, Gaming Utility Token",gama-coin,89454332,137622123.0,,,N/A,2276047.0
Gate.io,"Smart Contract Platform, Gaming (GameFi), Play To Earn, Guild and Scholarship, Ethereum Ecosystem, Layer 2 (L2), Gaming Blockchains, Pantera Capital Portfolio, Ancient8 Ecosystem, Optimism Superchain Ecosystem",ancient8,87411723,332004183.0,3121.1613363783076,40958.85302982041,1.19,77106976.0
Gate.io,"Artificial Intelligence (AI), Virtual Reality, Launchpad, Ethereum Ecosystem, Telegram Apps, Discord Bots, PAAL AI Launchpad, AI Agents, AI Applications, AI Agent Launchpad, Binance Alpha Spotlight, AI Framework, DeFAI, Made in USA",paal-ai,88730033,99807393.0,8659.877438220516,14012.457847022475,0.19,6649303.0
Gate.io,"Cronos Ecosystem, Bridged USDT, Bridged-Tokens, Bridged Stablecoins",cronos-bridged-usdt-cronos,87682469,87682469.0,,,N/A,286566.0
Gate.io,"Smart Contract Platform, Ethereum Ecosystem, Layer 2 (L2), Zero Knowledge (ZK), Restaking, Zircuit Ecosystem",zircuit,87764688,399853069.0,57821.28246861216,106655.70712344853,0.03,13267796.0
Gate.io,"Smart Contract Platform, Layer 1 (L1)",ong,86682142,212485881.0,24360.17436680823,31945.369501025358,0.23,1933526.0
Gate.io,"Smart Contract Platform, Polkadot Ecosystem, Layer 1 (L1), DePIN, Outlier Ventures Portfolio",peaq-2,85812279,505060089.0,25701.56096682124,43017.96055048724,0.02,20450337.0
Gate.io,BNB Chain Ecosystem,metfi-2,86602598,202691617.0,122.97427976711248,193.49230777550707,0.88,516962.0
Gate.io,"Stablecoins, USD Stablecoin, Ethereum Ecosystem, Sonic Ecosystem, Fiat-backed Stablecoin",frax-usd,86176935,86176935.0,,,N/A,1458017.0
Gate.io,"Smart Contract Platform, Bitcoin Sidechains, Stacks Ecosystem, SideChain",sbtc-2,86225817,86225817.0,,,N/A,9798.55
Gate.io,"Artificial Intelligence (AI), Smart Contract Platform, Gaming (GameFi), NFT, BNB Chain Ecosystem, Layer 1 (L1), Ethereum Ecosystem, Modular Blockchain, Chromia Ecosystem",chromaway,86194785,86194785.0,41229.81418907419,42766.5299038831,0.49,9553471.0
Gate.io,"Crypto-Backed Tokens, Ethereum Ecosystem",temple,86009193,86178636.0,,,N/A,4840.87
Gate.io,"Decentralized Exchange (DEX), Decentralized Finance (DeFi), Arbitrum Ecosystem, Ethereum Ecosystem",tokenlon,85509918,102925397.0,,,N/A,40097.0
Gate.io,"Gaming (GameFi), Play To Earn, Ethereum Ecosystem, RPG, Alameda Research Portfolio, Circle Ventures Portfolio, OKX Ventures Portfolio, MMO",big-time,85451518,239507675.0,126504.41390397414,164747.46657664672,0.04,13197613.0
Gate.io,"Smart Contract Platform, Polkadot Ecosystem, Layer 1 (L1), Coinbase Ventures Portfolio, Binance Labs Portfolio",moonbeam,85337041,103920282.0,79344.1777748493,82511.43489728105,0.11,4938297.0
Gate.io,"Business Services, Polygon Ecosystem, Ethereum Ecosystem",request-network,85161365,110647345.0,27844.90507792857,30741.0822077193,0.11,3105692.0
Gate.io,"Smart Contract Platform, Layer 2 (L2), eGirl Capital Portfolio, Paradigm Portfolio, Blast Ecosystem",blast,85132873,321043254.0,54032.01437286684,77644.21723339027,0.09,4221472.0
Gate.io,"SocialFi, Coinbase Ventures Portfolio, Pantera Capital Portfolio, Andreessen Horowitz (a16z) Portfolio, Sequoia Capital Portfolio",deso,84881425,87107685.0,743.8566582859098,247.05540320965014,1.91,2043266.0
Gate.io,"Smart Contract Platform, Layer 1 (L1), Zero Knowledge (ZK)",ozone-chain,84565694,116569990.0,,,N/A,241032.0
Gate.io,"Smart Contract Platform, Gaming (GameFi), NFT, Layer 1 (L1), Play To Earn, Ethereum Ecosystem, Animoca Brands Portfolio, Gaming Blockchains, Pantera Capital Portfolio, OKX Ventures Portfolio",wax,84532209,90954057.0,4656.766372268005,4839.4551955294755,0.21,5073833.0
Gate.io,"Smart Contract Platform, Privacy, Proof of Work (PoW), Made in USA",verge,84117086,84285345.0,,,N/A,9644395.0
Gate.io,"NFT, Solana Ecosystem, NFT Marketplace",tensor,83393741,249228742.0,366732.8590139127,439309.70954883384,0.04,13235023.0
Gate.io,"Solana Ecosystem, Polygon Ecosystem, DePIN, Pantera Capital Portfolio",geodnet,82902642,258587336.0,37226.44127863217,23620.808676453853,0.17,264273.0
Gate.io,"Exchange-based Tokens, Centralized Exchange (CEX) Token, Ethereum Ecosystem",hashkey-ecopoints,82362418,621603152.0,76090.93706551571,75344.12190925938,0.16,2757205.0
Gate.io,"Meme, Ethereum Ecosystem, PolitiFi",constitutiondao,82554225,82554225.0,230025.89955900545,281260.66617711843,0.06,17423529.0
Gate.io,Ethereum Ecosystem,dkargo,82342200,87847298.0,0.0,0.0,4.16,897162.0
Gate.io,"Artificial Intelligence (AI), BNB Chain Ecosystem, Ethereum Ecosystem, DragonFly Capital Portfolio, Binance Labs Portfolio, Delphi Ventures Portfolio, OKX Ventures Portfolio, Binance HODLer Airdrops, AI Agent Launchpad, Binance Alpha Spotlight, AI Framework",myshell,83301177,308522878.0,20727.060194689504,24099.081305768672,0.14,68440577.0
Gate.io,"Gaming (GameFi), NFT, BNB Chain Ecosystem, Metaverse, Collectibles, Polygon Ecosystem, Play To Earn, Harmony Ecosystem, Guild and Scholarship, Ethereum Ecosystem, Animoca Brands Portfolio, Base Ecosystem, DWF Labs Portfolio, Ronin Ecosystem, Gaming Governance Token, Andreessen Horowitz (a16z) Portfolio, Delphi Ventures Portfolio",yield-guild-games,82121593,200046049.0,137148.97678499692,158650.13154793173,0.15,11836584.0
Gate.io,"Decentralized Exchange (DEX), Decentralized Finance (DeFi), Yield Farming, Automated Market Maker (AMM), Solana Ecosystem, Coinbase Ventures Portfolio, DeFiance Capital Portfolio, Made in USA",orca,82043090,153994717.0,62187.25051337714,67031.65423418953,0.13,16120256.0
Gate.io,BNB Chain Ecosystem,bitdca,81559739,87601652.0,,,N/A,18588.75
Gate.io,"Polygon Ecosystem, XRP Ledger Ecosystem",crypto-trading-fund,81474182,81474182.0,,,N/A,9197.8
Gate.io,"Berachain Ecosystem, Bridged USDT, Bridged-Tokens, Ink Ecosystem, Bridged Stablecoins",usdt0,80766703,80766703.0,,,N/A,201451.0
Gate.io,"Decentralized Finance (DeFi), BNB Chain Ecosystem, Arbitrum Ecosystem, Ethereum Ecosystem, Multicoin Capital Portfolio, Energi Ecosystem",dforce-token,80531684,80531684.0,29998.382916569175,76966.2957502127,0.55,9135722.0
Gate.io,"NFT, Polygon Ecosystem",sathosi-airlines-token,80217219,383107539.0,,,N/A,3222.18
Gate.io,"NFT, Ethereum Ecosystem",superrare,79876909,99799863.0,153680.75684065736,206572.7507229259,0.02,118989666.0
Gate.io,"Gaming (GameFi), Play To Earn, Guild and Scholarship, Ethereum Ecosystem, Animoca Brands Portfolio, Base Ecosystem, DWF Labs Portfolio, Ronin Ecosystem, Coinbase Ventures Portfolio, DeFiance Capital Portfolio, Pantera Capital Portfolio, Binance Labs Portfolio, MMO",zentry,79819302,117178467.0,70530.90859565508,79675.5506351698,0.41,7276250.0
Gate.io,"Exchange-based Tokens, Centralized Exchange (CEX) Token, Ethereum Ecosystem",bitmart-token,79804996,150343153.0,,,N/A,4337815.0
Gate.io,"Smart Contract Platform, Cosmos Ecosystem, Modular Blockchain, Osmosis Ecosystem, Rollups-as-a-Service (RaaS)",dymension,79804604,316501932.0,163865.62271620502,186460.60709076363,0.44,8603116.0
Gate.io,"Blast Ecosystem, Bridged WETH, Bridged-Tokens",l2-standard-bridged-weth-blast,79438949,79438949.0,,,N/A,202732.0
Gate.io,"Smart Contract Platform, Proof of Stake (PoS)",stratis,79314198,87388730.0,9569.261918721462,7397.595434486459,0.87,573965.0
Gate.io,"Stablecoins, USD Stablecoin, Solana Ecosystem, Ethereum Ecosystem, Multicoin Capital Portfolio, Fiat-backed Stablecoin",paxos-standard,79279413,79279413.0,1331612.1735589434,1380615.720596825,0.02,1825955.0
Gate.io,"Stablecoins, Decentralized Finance (DeFi), Lending/Borrowing Protocols, Ethereum Ecosystem",syrupusdc,79271395,79271395.0,,,N/A,239667.0
Gate.io,"Artificial Intelligence (AI), Infrastructure, Ethereum Ecosystem, AI Framework, Made in USA",arcblock,78294699,147725847.0,2219.132019892519,2057.4916074189982,0.25,791500.0
Gate.io,"Ethereum Ecosystem, Stablecoin Protocol",level-usd,78670141,78670141.0,,,N/A,1016441.0
Gate.io,"Artificial Intelligence (AI), Smart Contract Platform, Layer 1 (L1), Ethereum Ecosystem, Osmosis Ecosystem, AI Agents, AI Agent Launchpad",humans-ai,78331969,78331969.0,1586.7399725494288,973.417524713117,0.7,667792.0
Gate.io,"Artificial Intelligence (AI), Smart Contract Platform, Decentralized Finance (DeFi), Analytics, NFT, BNB Chain Ecosystem, Launchpad, Ethereum Ecosystem, Telegram Apps, Discord Bots, ChainGPT Launchpad, Poolz Finance Launchpad, AI Agents, AI Applications, Binance Alpha Spotlight, AI Framework, DeFAI",chaingpt,78587635,97569537.0,47669.690320130954,55964.12545432425,0.16,22843012.0
Gate.io,"Software as a service, Polygon Ecosystem, Ethereum Ecosystem, Decentralized Identifier (DID), Pantera Capital Portfolio, Energi Ecosystem, Blockchain Capital Portfolio",civic,78313049,97647192.0,93556.80477118665,105035.13531320474,0.09,7010878.0
Gate.io,"Artificial Intelligence (AI), BNB Chain Ecosystem, Solana Ecosystem, Ethereum Ecosystem, AI Agents, Alameda Research Portfolio",delysium,78525811,149762760.0,26971.39141514572,36942.707714998294,0.14,2519791.0
Gate.io,"Decentralized Finance (DeFi), Wallets, Ethereum Ecosystem, Pundi AIFX Omnilayer Ecosystem",pundi-x-2,77617106,77617106.0,37925.39748332495,29263.201671786654,0.6,5492164.0
Gate.io,"Business Services, Decentralized Finance (DeFi), Oracle, Polygon Ecosystem, Gnosis Chain Ecosystem, Arbitrum Ecosystem, Ethereum Ecosystem, Optimism Ecosystem, Manta Network Ecosystem, Binance Labs Portfolio, Lisk Ecosystem, Made in USA",tellor,77120367,79364354.0,91415.59233712358,171472.72240875135,0.03,22366769.0
Gate.io,"Smart Contract Platform, Layer 1 (L1), Osmosis Ecosystem, XRP Ledger Ecosystem",coreum,76840915,76840915.0,2979.277568648013,1033.3106550092855,0.65,94930.0
Gate.io,"Optimism Ecosystem, Bridged WBTC, Bridged-Tokens",optimism-bridged-wbtc-optimism,76822016,76822016.0,,,N/A,868492.0
Gate.io,"Meme, Dog-Themed, TON Ecosystem, TON Meme",dogs-2,76771671,81711503.0,138579.35619450617,214318.408503052,0.07,42560445.0
Gate.io,"NFT, BNB Chain Ecosystem, Solana Ecosystem, Meme, Ethereum Ecosystem, Base Ecosystem, Hybrid Token Standards, Wojak-Themed",non-playable-coin,75972565,75972565.0,6015.93485221471,12217.969133369186,0.46,5974383.0
Gate.io,"Stablecoins, USD Stablecoin, Osmosis Ecosystem, Fiat-backed Stablecoin",usdx,75813597,75813597.0,,,N/A,13638.82
Gate.io,"BNB Chain Ecosystem, Solana Ecosystem, Polygon Ecosystem, Meme, Ethereum Ecosystem, Cronos Ecosystem, Dog-Themed, Elon Musk-Inspired, Fuse Ecosystem",dogelon-mars,75549779,137450710.0,159887.82383346697,206549.69180723582,0.36,2807637.0
Gate.io,"Decentralized Finance (DeFi), Liquid Staking Tokens, Ethereum Ecosystem, LSDFi, Liquid Staked ETH, Liquid Staking",origin-ether,75477850,75477850.0,,,N/A,38042.0
Gate.io,Smart Contract Platform,songbird,74902359,89000369.0,1287.7930724702337,3430.5588796898073,0.44,368352.0
Gate.io,"Exchange-based Tokens, Centralized Exchange (CEX) Token, Near Protocol Ecosystem, Harmony Ecosystem, Ethereum Ecosystem, Multicoin Capital Portfolio, Alameda Research Portfolio, Elastos Smart Contract Chain Ecosystem, Sequoia Capital Portfolio, Made in China",huobi-token,75136748,94765793.0,299.9914159253579,6.604649767711599,1.67,24933.0
Gate.io,"Sports, BNB Chain Ecosystem",pixer-eternity,75015686,348605009.0,,,N/A,771781.0
Gate.io,"Stablecoins, USD Stablecoin, Seigniorage, Alleged SEC Securities, Osmosis Ecosystem, Stablecoin Protocol, DeFiance Capital Portfolio, Terra Classic Ecosystem, Binance Labs Portfolio, Delphi Ventures Portfolio, Galaxy Digital Portfolio, Fiat-backed Stablecoin",terrausd,75427480,106863185.0,30786.77131535873,38263.86067345462,0.21,21762778.0
Gate.io,"Entertainment, Gaming (GameFi), NFT, Axie Infinity Ecosystem, Play To Earn, Ethereum Ecosystem, Ronin Ecosystem, Gaming Utility Token",smooth-love-potion,74878993,74878993.0,32550.219653543343,43673.43175424056,0.22,9681684.0
Gate.io,"Smart Contract Platform, Gaming (GameFi), Layer 1 (L1), Proof of Stake (PoS), Gaming Blockchains",oasys,75188896,194628328.0,520.2345625749058,1957.6977226862107,2.35,495013.0
Gate.io,"Decentralized Exchange (DEX), Decentralized Finance (DeFi), Yield Farming, Automated Market Maker (AMM), BNB Chain Ecosystem, Avalanche Ecosystem, Arbitrum Ecosystem, Mantle Ecosystem, DeFiance Capital Portfolio, Delphi Ventures Portfolio, Dex Aggregator",joe,75071318,96137697.0,57612.71062442654,50778.01471340165,0.47,6819343.0
Gate.io,"Optimism Ecosystem, Bridged WETH, Bridged-Tokens",l2-standard-bridged-weth-optimism,74283342,74283342.0,,,N/A,17993910.0
Gate.io,Retail,milk-alliance,74024793,165510407.0,327.2583206428384,336.71647281135927,1.78,2128318.0
Gate.io,"Smart Contract Platform, Wallets, Layer 2 (L2), Osmosis Ecosystem",islamic-coin,74232553,894316043.0,132.15617830344155,570.0753899138153,0.59,779517.0
Gate.io,"Gaming (GameFi), NFT, Ethereum Ecosystem",undeads-games,73765277,256615720.0,2247.5921921098484,1622.2220172982486,0.63,353259.0
Gate.io,"Base Ecosystem, Cybersecurity, Binance Labs Portfolio, OKX Ventures Portfolio, Binance Alpha Spotlight",goplus-security,73247920,403925884.0,18160.00596885989,28066.506166010575,0.1,63558495.0
Gate.io,"Decentralized Finance (DeFi), Solana Ecosystem, Real World Assets (RWA), Payment Solutions, DePIN, Coinbase Ventures Portfolio, Alameda Research Portfolio, Circle Ventures Portfolio, OKX Ventures Portfolio, RWA Protocol, Made in USA",zebec-network,73250675,98855318.0,3564.9310973426986,10410.413568858614,0.2,33190645.0
Gate.io,"Meme, Ethereum Ecosystem, Mantle Ecosystem",puff-the-dragon,72957951,72957951.0,1727.655696027279,4.214009106183791,1.3,33817.0
Gate.io,"Artificial Intelligence (AI), Decentralized Finance (DeFi), Ethereum Ecosystem, DePIN",pinlink,72737285,90921606.0,45.8753168610628,278.53122681669686,1.85,1574053.0
Gate.io,"Gaming (GameFi), Play To Earn, TON Ecosystem, Tap to Earn, Arcade Games",watcoin-2,72567293,80562767.0,,,N/A,738696.0
Gate.io,"Ethereum Ecosystem, DePIN",dent,72560566,75856564.0,26426.21820261822,33909.35195775179,0.34,4898684.0
Gate.io,"Decentralized Exchange (DEX), Exchange-based Tokens, Decentralized Finance (DeFi), BNB Chain Ecosystem, Binance Launchpool, Polygon Ecosystem, Near Protocol Ecosystem, Arbitrum Ecosystem, Ethereum Ecosystem, DWF Labs Portfolio, Coinbase Ventures Portfolio, Alameda Research Portfolio, DeFiance Capital Portfolio, Pantera Capital Portfolio, Aurora Ecosystem, Energi Ecosystem, Binance Labs Portfolio, Galaxy Digital Portfolio",dodo,72016139,72016139.0,22211.405302525316,23702.168454088423,0.18,8227655.0
Gate.io,"Decentralized Finance (DeFi), Oracle, Ethereum Ecosystem, DWF Labs Portfolio, Pantera Capital Portfolio",api3,71626458,89386694.0,37496.17758035476,51306.40802246142,0.23,13827415.0
Gate.io,"Smart Contract Platform, Gaming (GameFi), NFT, Binance Launchpool, Arbitrum Ecosystem, Layer 3 (L3), XAI Ecosystem, Gaming Blockchains, Outlier Ventures Portfolio",xai-blockchain,71721912,105742852.0,91948.1374158847,130261.76225349959,0.03,27060392.0
Gate.io,"Decentralized Finance (DeFi), Lending/Borrowing Protocols, Moonbeam Ecosystem, Base Ecosystem, Coinbase Ventures Portfolio, Made in USA",moonwell-artemis,71241921,108613268.0,2638.9616242808133,5770.716226186226,0.09,6105775.0
Gate.io,"Artificial Intelligence (AI), Decentralized Finance (DeFi), Solana Ecosystem, Arbitrum Ecosystem, Metis Ecosystem, AI Agents, Sonic Ecosystem, IOTA EVM Ecosystem, AI Applications, DeFAI",heyanon,71032717,116984428.0,383.6531538944185,1540.6861965279302,0.71,2943197.0
Gate.io,"Smart Contract Platform, Layer 1 (L1), DWF Labs Portfolio, Radix Ecosystem",radix,71004850,86942857.0,4252.220346750277,7665.164613593511,0.13,1528519.0
Gate.io,"Decentralized Finance (DeFi), Lending/Borrowing Protocols, Arbitrum Ecosystem, Ethereum Ecosystem, Alameda Research Portfolio, Pantera Capital Portfolio",liquity,70719548,72671910.0,216162.18588808732,219412.6754080751,0.05,10470599.0
Gate.io,"Decentralized Finance (DeFi), Lending/Borrowing Protocols, Ethereum Ecosystem, Real World Assets (RWA), Coinbase Ventures Portfolio, Andreessen Horowitz (a16z) Portfolio, RWA Protocol, Made in USA",goldfinch,70482410,87182568.0,720.9394768798045,3007.116390483175,0.27,600632.0
Gate.io,"Gaming (GameFi), NFT, Collectibles, Play To Earn, Ethereum Ecosystem, Base Ecosystem, Energi Ecosystem",ecomi,70325463,80689511.0,4822.940160867472,6436.063000875914,0.35,2067123.0
Gate.io,"Smart Contract Platform, Ethereum Ecosystem, Layer 2 (L2), Zero Knowledge (ZK), Rollup, OKX Ventures Portfolio",taiko,70030273,662253228.0,154423.53449119173,177270.35638331462,0.06,11056022.0
Gate.io,"Artificial Intelligence (AI), Cardano Ecosystem, Ethereum Ecosystem, AI Agents, Sora Ecosystem",singularitynet,70078894,105949819.0,,,N/A,34437.0
Gate.io,"Artificial Intelligence (AI), Ethereum Ecosystem",0x0-ai-ai-smart-contract,70053121,70053121.0,,,N/A,91579.0
Gate.io,"Stablecoins, Decentralized Finance (DeFi), USD Stablecoin, BNB Chain Ecosystem, Polygon Ecosystem, Gnosis Chain Ecosystem, Arbitrum Ecosystem, Ethereum Ecosystem, Optimism Ecosystem, Base Ecosystem, Crypto-backed Stablecoin, Fiat-backed Stablecoin",crvusd,69836453,69836453.0,,,N/A,2673349.0
Gate.io,"Decentralized Finance (DeFi), Ethereum Ecosystem, Binance Alpha Spotlight",avalon-2,69997742,431419056.0,34014.672922659825,38092.89837728984,0.05,15682759.0
Gate.io,"Arbitrum Ecosystem, Bridge Governance Tokens, Base Ecosystem, Cross-chain Communication, OKX Ventures Portfolio",orbiter-finance,69428965,223964403.0,11656.984263053637,11487.3842319253,0.22,59084155.0
Gate.io,"Tokenized Assets, Polygon Ecosystem, Arbitrum Ecosystem, Ethereum Ecosystem, Real World Assets (RWA), Starknet Ecosystem, Tokenized Treasury Bills (T-Bills)",spiko-us-t-bills-money-market-fund,69588146,69588146.0,,,N/A,0.0
Gate.io,"Lending/Borrowing Protocols, Solana Ecosystem, FTX Holdings, Coinbase Ventures Portfolio, Alameda Research Portfolio, DragonFly Capital Portfolio",solend,69360419,137087973.0,0.0,0.0,12.67,3011.35
Gate.io,"Artificial Intelligence (AI), Business Services, Decentralized Finance (DeFi), Ethereum Ecosystem, Paradigm Portfolio, DragonFly Capital Portfolio, Energi Ecosystem",numeraire,69417956,92943277.0,38289.41038157104,42323.177160185616,0.03,5667162.0
Gate.io,"Decentralized Finance (DeFi), Lending/Borrowing Protocols, Solana Ecosystem, Binance Alpha Spotlight",kamino,69538204,515097810.0,192935.83276845005,234075.72966758185,0.04,7284546.0
Gate.io,"Artificial Intelligence (AI), Solana Ecosystem, DePIN",nosana,68759654,82445629.0,1500.6425826408774,1910.1967093688302,0.24,346116.0
Gate.io,"Solana Ecosystem, Restaking, Liquid Restaking Tokens, Liquid Restaked SOL",renzo-restaked-sol,68274606,68274606.0,,,N/A,177528.0
Gate.io,"Artificial Intelligence (AI), Marketing, Analytics, BNB Chain Ecosystem, Ethereum Ecosystem, Animoca Brands Portfolio, Base Ecosystem, AI Agents, Binance Alpha Spotlight",cookie,67782509,150867803.0,293135.32540383044,376883.6140277316,0.16,18024112.0
Gate.io,"Smart Contract Platform, Binance Launchpool, Layer 2 (L2), Scroll Ecosystem",scroll,68081803,358325280.0,142505.42745876173,203047.93660520122,0.08,10950093.0
Gate.io,"Stablecoins, Decentralized Finance (DeFi), USD Stablecoin, BNB Chain Ecosystem, Avalanche Ecosystem, Arbitrum Ecosystem, Liquid Staking Tokens, Ethereum Ecosystem, Optimism Ecosystem, Fiat-backed Stablecoin",staked-frax,67498630,67498630.0,,,N/A,42.77
Gate.io,"Decentralized Finance (DeFi), Ethereum Ecosystem",elixir-finance,67602793,423419390.0,53488.20742253833,50974.19210553723,0.14,47885283.0
Gate.io,"Decentralized Exchange (DEX), Decentralized Finance (DeFi), Sui Ecosystem, Animoca Brands Portfolio, OKX Ventures Portfolio, Dex Aggregator",cetus-protocol,67449875,98774085.0,62800.9774671638,76983.06451446917,0.14,9646542.0
Gate.io,"Solana Ecosystem, Wallets, Base Ecosystem, TON Ecosystem",bitget-wallet-token,67182897,470072637.0,,,N/A,3631.06
Gate.io,"Meme, Base Ecosystem, Dog-Themed, Base Meme, Farcaster Ecosystem",doginme,66328064,66328064.0,0.0,0.0,N/A,5955763.0
Gate.io,"Smart Contract Platform, Layer 1 (L1), Proof of Work (PoW), Privacy Blockchain",ergo,66381989,81027781.0,478.0229190851496,3835.502258562225,0.89,74467.0
Gate.io,SocialFi,steem,66301693,66453337.0,117107.49451916329,127125.33302804602,0.23,8741065.0
Gate.io,E-commerce,pay-coin,65964413,122565296.0,,,N/A,4796212.0
Gate.io,Ethereum Ecosystem,saasgo,66099606,82624508.0,2210.6743009394077,3833.548207738299,1.05,200821.0
Gate.io,"Decentralized Finance (DeFi), BNB Chain Ecosystem, Solana Ecosystem, Wallets, Polygon Ecosystem, Ethereum Ecosystem, Binance Launchpad, DWF Labs Portfolio, Multicoin Capital Portfolio, Alameda Research Portfolio, Viction Ecosystem, Binance Labs Portfolio",coin98,65903041,73157875.0,86433.28871316089,91633.46222127009,0.34,15831780.0
Gate.io,"Healthcare, Osmosis Ecosystem",medibloc,65592992,71046295.0,1479.0614772326685,3575.413909975076,2.45,375852.0
Gate.io,Ethereum Ecosystem,devve,65161691,89477142.0,1986.2472504571801,2040.143951989385,0.43,898845.0
Gate.io,"Polkadot Ecosystem, Real World Assets (RWA), Coinbase Ventures Portfolio, Circle Ventures Portfolio, Galaxy Digital Portfolio, RWA Protocol",centrifuge,65200367,71435579.0,9251.20977149741,8589.908443778777,0.13,733735.0
Gate.io,"Stablecoins, USD Stablecoin, Fiat-backed Stablecoin",falcon-finance,64680845,64680845.0,,,N/A,58288.0
Gate.io,"Artificial Intelligence (AI), BNB Chain Ecosystem, Ethereum Ecosystem, DePIN, AI Agents",netmind-token,64271339,204093095.0,4736.510199369043,2698.9205509657386,0.49,1679734.0
Gate.io,"Infrastructure, Smart Contract Platform, BNB Chain Ecosystem, Avalanche Ecosystem, Polygon Ecosystem, Arbitrum Ecosystem, Ethereum Ecosystem, Optimism Ecosystem, Layer 2 (L2), Base Ecosystem, Binance Launchpad, Modular Blockchain, Layer 3 (L3), Rollup, Proof of Stake (PoS), Appchains, Binance Labs Portfolio",cartesi,64248665,74753208.0,56324.16534408799,60307.17798220843,0.21,8277177.0
Gate.io,"Ethereum Ecosystem, Telegram Apps, Binance HODLer Airdrops",banana-gun,64097199,155391372.0,88185.87789777284,190940.6360577801,0.11,72854947.0
Gate.io,"Artificial Intelligence (AI), Launchpad, Base Ecosystem, AI Applications, Clanker Ecosystem, Binance Alpha Spotlight",tokenbot-2,63719270,63719270.0,451.8603810021066,6172.291492050871,0.91,4760963.0
Gate.io,"SocialFi, Solana Ecosystem",access-protocol,63192715,137191638.0,12225.88828616945,11888.848938737869,0.45,1085250.0
Gate.io,,ark,63372619,63930897.0,34880.837194914384,37446.98741432903,0.23,4653683.0
