Gate.io,"Smart Contract Platform, Gaming (GameFi), NFT, BNB Chain Ecosystem, Binance Launchpool, Avalanche Ecosystem, Ethereum Ecosystem, DWF Labs Portfolio, Gaming Blockchains, Avalanche L1",beam-2,332680874,387036987.0,89593.72250904846,197318.57329208418,0.32,14802126.0
Gate.io,"Meme, Base Ecosystem, Frog-Themed, Base Meme, The Boy’s Club",based-brett,331524782,331524782.0,38276.92769785421,52197.458237520616,0.06,13999749.0
Gate.io,"Artificial Intelligence (AI), Smart Contract Platform, DePIN, Osmosis Ecosystem, Proof of Stake (PoS), Archway Ecosystem, Made in USA",akash-network,329451704,330576916.0,155097.0648481632,178817.49774693768,0.08,10721775.0
Gate.io,"Decentralized Exchange (DEX), Smart Contract Platform, Decentralized Finance (DeFi), Prediction Markets, Layer 1 (L1), Gnosis Chain Ecosystem, MEV Protection, Arbitrum Ecosystem, Ethereum Ecosystem, SideChain, Energi Ecosystem",gnosis,326796299,378588608.0,79105.3572540284,75051.08208921563,0.16,15453738.0
Gate.io,"Stablecoins, USD Stablecoin, BNB Chain Ecosystem, Avalanche Ecosystem, Polygon Ecosystem, Optimism Ecosystem, Fiat-backed Stablecoin, Binance-Peg Tokens",binance-peg-busd,324629268,324629268.0,,,N/A,8864879.0
Gate.io,"Smart Contract Platform, Zero Knowledge (ZK), FTX Holdings, Paradigm Portfolio, Coinbase Ventures Portfolio, Multicoin Capital Portfolio, Proof of Stake (PoS), Pantera Capital Portfolio, Circle Ventures Portfolio, Privacy Blockchain, Polychain Capital Portfolio, Made in USA, Coinbase 50 Index",mina-protocol,323339626,323339626.0,163414.5372729188,210701.6157482511,0.04,14030122.0
Gate.io,"Decentralized Finance (DeFi), Arbitrum Ecosystem, Ethereum Ecosystem, Real World Assets (RWA), Base Ecosystem, Coinbase Ventures Portfolio, Energi Ecosystem, Made in USA",reserve-rights-token,319676348,571874478.0,136784.8653491936,216751.4187742996,0.09,21419170.0
Gate.io,"Smart Contract Platform, Layer 1 (L1), MEV Protection, Proof of Work (PoW), Privacy Blockchain",verus-coin,309966667,309969796.0,,,N/A,4768.98
Gate.io,"Decentralized Finance (DeFi), Lending/Borrowing Protocols, Ethereum Ecosystem, Base Ecosystem, Coinbase Ventures Portfolio, Pantera Capital Portfolio, Morpho Ecosystem, Binance Alpha Spotlight",morpho,309953078,1313092234.0,177416.80369310974,156928.53779129195,0.05,8775015.0
Gate.io,"Yield Aggregator, Ethereum Ecosystem, Binance Labs Portfolio, Polychain Capital Portfolio",stakestone-berachain-vault-token,306215426,306215426.0,,,N/A,779193.0
Gate.io,"Smart Contract Platform, Layer 1 (L1), Ethereum Ecosystem, Real World Assets (RWA), RWA Protocol, Made in USA",plume,303120706,1515603530.0,73011.24565577143,74057.97041643252,0.19,15167709.0
Gate.io,"Decentralized Finance (DeFi), Tron Ecosystem",just,297250164,297250164.0,116736.68516316853,181521.90261292225,0.2,18150062.0
Gate.io,"Artificial Intelligence (AI), Ethereum Ecosystem, DePIN, Energi Ecosystem, GMCI DePIN Index, GMCI Index",golem,287070566,287070566.0,81072.46518517316,68197.57991986175,0.28,15837226.0
Gate.io,"Decentralized Exchange (DEX), Exchange-based Tokens, Decentralized Finance (DeFi), Yield Farming, Derivatives, Synthetic Issuer, Avalanche Ecosystem, Polygon Ecosystem, Near Protocol Ecosystem, Fantom Ecosystem, Harmony Ecosystem, Ethereum Ecosystem, Optimism Ecosystem, Base Ecosystem, DWF Labs Portfolio, Paradigm Portfolio, Coinbase Ventures Portfolio, Index Coop Defi Index, Energi Ecosystem, Huobi ECO Chain Ecosystem, GMCI DeFi Index, Synthetic, Index Coop Index, GMCI Index, Coinbase 50 Index",havven,286907228,287265271.0,220461.37346464136,276046.371621657,0.14,20537237.0
Gate.io,"Polygon Ecosystem, Bridged WETH, Bridged-Tokens",polygon-pos-bridged-weth-polygon-pos,285789607,285789607.0,,,N/A,7462288.0
Gate.io,"Solana Ecosystem, Arbitrum Ecosystem, Impossible Finance Launchpad, Ethereum Ecosystem, DePIN, Animoca Brands Portfolio",aethir,285588355,1518448026.0,294106.5354389134,326818.67044404335,0.08,20158119.0
Gate.io,"Crypto-Backed Tokens, Wrapped-Tokens, Polygon Ecosystem, Arbitrum Ecosystem, Liquid Staking Tokens, Ethereum Ecosystem, Optimism Ecosystem, Base Ecosystem, Liquid Staked ETH, Liquid Staking",coinbase-wrapped-staked-eth,283109017,784375223.0,,,N/A,4515908.0
Gate.io,"Infrastructure, Ethereum Ecosystem, Data Availability, Restaking, Polychain Capital Portfolio, Made in USA",eigenlayer,281347086,1971844016.0,304380.9610146747,439543.50085774495,0.09,27408725.0
Gate.io,"Smart Contract Platform, Privacy, Masternodes, Alleged SEC Securities, Proof of Stake (PoS), Proof of Work (PoW), Made in USA",dash,280051610,280058525.0,,,N/A,32643270.0
Gate.io,"Smart Contract Platform, BNB Chain Ecosystem, Avalanche Ecosystem, Polygon Ecosystem, Arbitrum Ecosystem, Ethereum Ecosystem, Optimism Ecosystem, Base Ecosystem, Multicoin Capital Portfolio, Layer 0 (L0), Cross-chain Communication, Circle Ventures Portfolio, Sequoia Capital Portfolio, OKX Ventures Portfolio",layerzero,278859014,2508788601.0,173306.02775577738,807008.9569409487,0.16,413639596.0
Gate.io,"Decentralized Exchange (DEX), Exchange-based Tokens, Decentralized Finance (DeFi), Automated Market Maker (AMM), BNB Chain Ecosystem, Avalanche Ecosystem, Polygon Ecosystem, Near Protocol Ecosystem, Harmony Ecosystem, Ethereum Ecosystem, FTX Holdings, Alameda Research Portfolio, DragonFly Capital Portfolio, Pantera Capital Portfolio, Energi Ecosystem, Binance Labs Portfolio, GMCI DeFi Index, Galaxy Digital Portfolio, Blockchain Capital Portfolio, Dex Aggregator, GMCI Index, Coinbase 50 Index",1inch,277726910,302461265.0,98308.99711671093,141442.03813039607,0.05,17693959.0
Gate.io,"Smart Contract Platform, Polkadot Ecosystem, Proof of Stake (PoS), Pantera Capital Portfolio, Made in USA, Coinbase 50 Index",kusama,272329478,272329478.0,55791.5676403532,123650.60000271907,0.06,7249432.0
Gate.io,"BNB Chain Ecosystem, Wallets, Ethereum Ecosystem, Animoca Brands Portfolio, Binance Launchpad, Energi Ecosystem, Binance Labs Portfolio",safepal,272579461,272579461.0,97367.76665134811,71192.07646035979,0.11,8167277.0
Gate.io,"Liquid Staking Tokens, Ethereum Ecosystem, Liquid Staking",stader-ethx,271135350,271135350.0,,,N/A,75797.0
Gate.io,"Smart Contract Platform, Ethereum Ecosystem, Real World Assets (RWA), DWF Labs Portfolio, Proof of Stake (PoS)",creditcoin-2,270949226,374225431.0,73433.50031400779,114037.24660407552,0.08,9712916.0
Gate.io,"Polygon Ecosystem, Bridged WBTC, Bridged-Tokens",polygon-bridged-wbtc-polygon-pos,269573495,269573495.0,,,N/A,3519629.0
Gate.io,"Smart Contract Platform, Layer 2 (L2), Zero Knowledge (ZK), ZkSync Ecosystem, Consensys Portfolio, Blockchain Capital Portfolio, OKX Ventures Portfolio",zksync,266428247,1522447125.0,195312.33166654233,368674.64684460056,0.04,37602850.0
Gate.io,"Smart Contract Platform, DePIN, Proof of Stake (PoS), Made in USA",theta-fuel,262332271,262343390.0,25084.62846917075,19942.20272441624,0.42,1649150.0
Gate.io,"Solana Ecosystem, Arbitrum Ecosystem, Ethereum Ecosystem, Interoperability, Base Ecosystem, Multicoin Capital Portfolio, Cross-chain Communication, Made in USA",wormhole,261051128,898221411.0,420519.46849680564,646485.8214492087,0.11,32595389.0
Gate.io,"Stablecoins, USD Stablecoin, Ethereum Ecosystem, Fiat-backed Stablecoin",elixir-deusd,260202783,260202783.0,,,N/A,46823190.0
Gate.io,"Smart Contract Platform, Gaming (GameFi), NFT, Layer 1 (L1), Play To Earn, Gaming Blockchains, WEMIX Ecosystem",wemix-token,259586405,333784105.0,5955.528597584386,4103.455922403006,0.23,4105359.0
Gate.io,"Crypto-Backed Tokens, Decentralized Finance (DeFi), cToken, Ethereum Ecosystem",compound-wrapped-btc,257669399,257669399.0,,,N/A,0.0
Gate.io,"Decentralized Finance (DeFi), Ethereum Ecosystem, Restaking, Liquid Restaking Tokens, Liquid Staking",ether-fi-staked-btc,257478700,257478700.0,,,N/A,62519.0
Gate.io,"BRC-20, Bitcoin Ecosystem, Inscriptions",sats-ordinals,256947776,256947776.0,119671.2389629981,204411.99638660587,0.05,4495375.0
Gate.io,"Exchange-based Tokens, Centralized Exchange (CEX) Token, Ethereum Ecosystem, Morph L2 Ecosystem",mx-token,256935138,1132118559.0,,,N/A,14115378.0
Gate.io,"Stablecoins, USD Stablecoin, BNB Chain Ecosystem, Avalanche Ecosystem, Near Protocol Ecosystem, Arbitrum Ecosystem, Ethereum Ecosystem, Tron Ecosystem, BitTorrent Ecosystem, Algorithmic Stablecoin, Fiat-backed Stablecoin",usdd,254699555,254699555.0,4582.823352689023,40629.7346256191,0.33,4889291.0
Gate.io,"Arbitrum Ecosystem, Liquid Staking Tokens, Ethereum Ecosystem, Liquid Staking",sweth,252931572,252938624.0,,,N/A,113448.0
Gate.io,"Gaming (GameFi), Binance Launchpool, Meme, Play To Earn, TON Ecosystem, TON Meme, Tap to Earn",notcoin,252749771,252749771.0,317507.31753040495,301588.0666543158,0.08,334189487.0
Gate.io,"Stablecoins, Tokenized Assets, Tokenized Gold, BNB Chain Ecosystem, Real World Assets (RWA), Tokenized Commodities, Commodity-backed Stablecoin",quorium,250703849,250703849.0,,,N/A,95708.0
Gate.io,"Decentralized Finance (DeFi), BNB Chain Ecosystem, Polygon Ecosystem, Fantom Ecosystem, Arbitrum Ecosystem, Moonbeam Ecosystem, Liquid Staking Tokens, Ethereum Ecosystem, Optimism Ecosystem, Polygon zkEVM Ecosystem, Liquid Staking, Made in USA",frax-ether,249295057,249295057.0,,,N/A,1087089.0
Gate.io,"Meme, Cardano Ecosystem",snek,245169968,248298696.0,21616.561275891243,20890.013856028563,0.19,1106809.0
Gate.io,"Bridged USDC, Sonic Ecosystem, Bridged-Tokens, Bridged Stablecoins",sonic-bridged-usdc-e-sonic,245344148,245344148.0,,,N/A,33882300.0
Gate.io,"Decentralized Finance (DeFi), Solana Ecosystem, Liquid Staking Tokens, Liquid Staked SOL, Liquid Staking",bybit-staked-sol,244183965,244183965.0,,,N/A,1580986.0
Gate.io,"Decentralized Finance (DeFi), Solana Ecosystem, LSDFi, Restaking, Stablecoin Protocol, Binance Labs Portfolio, Binance HODLer Airdrops, Polychain Capital Portfolio",solayer,244745592,1165455202.0,252790.91383932953,273350.19193771156,0.21,120165550.0
Gate.io,"Infrastructure, Decentralized Finance (DeFi), Sui Ecosystem",deep,241363122,965452487.0,87638.47245803877,245666.66069140946,0.02,18371035.0
Gate.io,"Smart Contract Platform, BNB Chain Ecosystem, GMCI Layer 1 Index, GMCI Index, Made in China",zilliqa,241139925,249519336.0,105849.93030511712,156338.5855534262,0.08,9548479.0
Gate.io,"Smart Contract Platform, Polkadot Ecosystem, Layer 1 (L1), Layer 2 (L2), Alameda Research Portfolio, Binance Labs Portfolio, OKX Ventures Portfolio",astar,240261585,264166350.0,340548.28329419036,567933.20688484,0.03,3387628.0
Gate.io,"NFT, Ethereum Ecosystem, NFT Marketplace, FTX Holdings, NFTFi, eGirl Capital Portfolio, Paradigm Portfolio, GMCI DeFi Index, GMCI Index, Made in USA, Coinbase 50 Index",blur,240101003,320472325.0,189271.00819358803,270441.4240222349,0.09,18214913.0
Gate.io,"Infrastructure, Wallets, Gnosis Chain Ecosystem, Ethereum Ecosystem",safe,234006227,422671411.0,124138.60261262947,145598.2098977943,0.05,13596048.0
Gate.io,"Smart Contract Platform, Proof of Stake (PoS), Made in China",qtum,233309906,238304872.0,65151.50046434645,104589.07795501438,0.05,18579606.0
Gate.io,"Oracle, Ethereum Ecosystem",redstone-oracles,232903418,831797920.0,261358.45733199065,174830.20590860985,0.06,331287483.0
Gate.io,"Decentralized Finance (DeFi), Liquid Staking Tokens, Base Ecosystem, Liquid Staked ETH, Liquid Staking",super-oeth,232600555,232600555.0,,,N/A,87296.0
Gate.io,"Decentralized Exchange (DEX), Exchange-based Tokens, Decentralized Finance (DeFi), Derivatives, Perpetuals, Ethereum Ecosystem, Paradigm Portfolio",dydx,228676394,228676394.0,,,N/A,10791541.0
Gate.io,"Smart Contract Platform, Interoperability, Layer 2 (L2), Rollup, Multicoin Capital Portfolio, Proof of Work (PoW), DragonFly Capital Portfolio, Sequoia Capital Portfolio, Blockchain Capital Portfolio, Polychain Capital Portfolio, Made in China",nervos-network,228569332,232179313.0,132855.50375655136,250341.8763178135,0.1,11530790.0
Gate.io,"Solana Ecosystem, Avalanche Ecosystem, Polygon Ecosystem, Near Protocol Ecosystem, Harmony Ecosystem, Ethereum Ecosystem, Pantera Capital Portfolio, Energi Ecosystem, Made in USA",basic-attention-token,224424349,225074310.0,36922.43513815209,46072.33160146337,0.33,15135218.0
Gate.io,"Smart Contract Platform, Gaming (GameFi), Ethereum Ecosystem, Base Ecosystem, Card Games, Paradigm Portfolio, Gaming Blockchains, Gaming Utility Token",echelon-prime,223239317,440771977.0,94704.23646226633,102612.7478127438,0.28,6564796.0
Gate.io,"Artificial Intelligence (AI), Solana Ecosystem, Meme, Solana Meme, AI Meme, AI Agents, Binance Alpha Spotlight, AI Framework, Made in USA",ai16z,221439600,221439600.0,135030.4078540033,132235.88328526696,0.08,38061137.0
Gate.io,"BNB Chain Ecosystem, Polygon Ecosystem, Ethereum Ecosystem, Animoca Brands Portfolio, DWF Labs Portfolio, Alameda Research Portfolio, Energi Ecosystem, Binance Labs Portfolio",mask-network,218530809,218530809.0,195555.17536252536,360236.4733660889,0.05,21729089.0
Gate.io,"Smart Contract Platform, BNB Chain Ecosystem, Layer 1 (L1), Proof of Stake (PoS), Pantera Capital Portfolio, Andreessen Horowitz (a16z) Portfolio, Binance Labs Portfolio, Blockchain Capital Portfolio, Privacy Blockchain, Polychain Capital Portfolio, Coinbase 50 Index",oasis-network,217474426,323151592.0,53282.178740857475,110542.8156014376,0.03,9189327.0
Gate.io,"Layer 1 (L1), VeChain Ecosystem",vethor-token,217106970,217247845.0,63152.89524566481,62439.44059667243,0.24,4011641.0
Gate.io,"BNB Chain Ecosystem, Meme, AI Meme",ai-companions,215381120,215381120.0,592.0933105462635,2301.9569953164205,1.15,4630367.0
Gate.io,"Decentralized Exchange (DEX), Decentralized Finance (DeFi), Automated Market Maker (AMM), Cosmos Ecosystem, Osmosis Ecosystem, Paradigm Portfolio, Evmos Ecosystem, Secret Ecosystem, GMCI DeFi Index, GMCI Index",osmosis,214848853,299238949.0,91524.86845348972,159425.5937633587,0.1,16999397.0
Gate.io,"Analytics, Avalanche Ecosystem, Meme, Cat-Themed, Made in USA",ket,216201761,216201761.0,,,N/A,5612999.0
Gate.io,"Gaming (GameFi), NFT, Collectibles, Polygon Ecosystem, Ethereum Ecosystem, Animoca Brands Portfolio, Gaming Blockchains, Made in USA",superfarm,214496898,474870344.0,37973.16778804416,41046.96318929428,0.17,23335071.0
Gate.io,"Decentralized Exchange (DEX), Decentralized Finance (DeFi), Avalanche Ecosystem, Harmony Ecosystem, Ethereum Ecosystem, Coinbase Ventures Portfolio, Pantera Capital Portfolio, Energi Ecosystem, GMCI DeFi Index, Blockchain Capital Portfolio, GMCI Index, Made in USA",0x,213361716,251488190.0,62913.08514645582,126898.37073604375,0.12,21325458.0
Gate.io,"Artificial Intelligence (AI), Harmony Ecosystem, Arbitrum Ecosystem, Ethereum Ecosystem, DePIN, Coinbase Ventures Portfolio, Multicoin Capital Portfolio, Pantera Capital Portfolio, GMCI DePIN Index, GMCI Index, Coinbase 50 Index",livepeer,211433416,211433416.0,86583.09865473444,85657.3623662561,0.11,18045069.0
Gate.io,"Decentralized Finance (DeFi), Aptos Ecosystem",abtc,211129515,211129515.0,,,N/A,197232.0
Gate.io,"Decentralized Exchange (DEX), BNB Chain Ecosystem, Solana Ecosystem, Ethereum Ecosystem, Real World Assets (RWA), Base Ecosystem, RWA Protocol",chex-token,209861044,209861044.0,6049.52328744067,3034.72944042914,0.28,1188224.0
Gate.io,"Gaming (GameFi), BNB Chain Ecosystem, Solana Ecosystem, Meme, Ethereum Ecosystem, Dog-Themed, Solana Meme, Gaming Utility Token",baby-doge-coin,206757398,524814653.0,52428.341722341465,47515.5860286126,0.08,9811110.0
Gate.io,"Liquid Staking Tokens, Ethereum Ecosystem, Base Ecosystem, Liquid Staked ETH, Liquid Staking",liquid-staked-ethereum,206114284,206114284.0,,,N/A,72727.0
Gate.io,"Stablecoins, USD Stablecoin, Arbitrum Ecosystem, Ethereum Ecosystem, Base Ecosystem, Crypto-backed Stablecoin, Fiat-backed Stablecoin",gho,205267161,205267161.0,,,N/A,4912256.0
Gate.io,"Decentralized Finance (DeFi), Yield Farming, BNB Chain Ecosystem, Avalanche Ecosystem, Polygon Ecosystem, Fantom Ecosystem, Arbitrum Ecosystem, Ethereum Ecosystem, Optimism Ecosystem, Linea Ecosystem, Bridge Governance Tokens, Base Ecosystem, FTX Holdings",stargate-finance,203944855,209935420.0,116156.486847028,84297.10894655822,0.05,7059178.0
Gate.io,"Artificial Intelligence (AI), Polkadot Ecosystem, Metaverse, Ethereum Ecosystem, Interoperability, Real World Assets (RWA), DePIN, Decentralized Science (DeSci), AI Agents",origintrail,203182728,203469607.0,15540.294280220232,44337.49421293508,0.2,3446375.0
Gate.io,"BNB Chain Ecosystem, Meme",cheems-token,202193031,202193031.0,72418.29516827551,70254.32823797224,0.18,5159290.0
Gate.io,"Smart Contract Platform, Storage, Harmony Ecosystem, Ethereum Ecosystem, DePIN, Energi Ecosystem, Sora Ecosystem, GMCI DePIN Index, GMCI Index",holotoken,201323934,201323934.0,45048.05627260479,47876.42326357744,0.44,8340767.0
Gate.io,"Stablecoins, Ethereum Ecosystem",usda-2,201381593,201381593.0,,,N/A,621970.0
Gate.io,"Gambling (GambleFi), Gaming (GameFi), Ethereum Ecosystem",rollbit-coin,198475948,198479531.0,,,N/A,1088991.0
Gate.io,"Smart Contract Platform, Layer 1 (L1), DePIN, Andreessen Horowitz (a16z) Portfolio, Made in USA",chia,197529463,448804924.0,33794.56335248797,28737.979695187285,0.18,7076170.0
Gate.io,"Solana Ecosystem, Meme, Dog-Themed, Solana Meme, Bitcoin Ecosystem, Runes",dog-go-to-the-moon-rune,198333356,198333356.0,14494.594614646052,19504.633708994632,0.2,5852851.0
Gate.io,"Decentralized Finance (DeFi), Polygon Ecosystem, Ethereum Ecosystem, Coinbase Ventures Portfolio, Pantera Capital Portfolio",instadapp,197259785,500192128.0,,,N/A,846587.0
Gate.io,"Solana Ecosystem, Meme, Solana Meme, Cat-Themed, Murad Picks",popcat,197920241,197920241.0,72794.57883938722,101878.17011319492,0.05,45096070.0
Gate.io,"Solana Ecosystem, Meme, Solana Meme, Pump.fun Ecosystem, Zoo-Themed, Memorial Themed",peanut-the-squirrel,199551837,199551837.0,77189.83807720643,97242.14306266855,0.1,161909442.0
Gate.io,"Solana Ecosystem, BRC-20, Bitcoin Ecosystem, Inscriptions",ordinals,195196923,195196923.0,603374.7677625071,602134.4575656372,0.11,70959473.0
Gate.io,"Smart Contract Platform, Privacy, Layer 1 (L1), Proof of Stake (PoS), Proof of Work (PoW), Blockchain Capital Portfolio, Made in USA",decred,195613784,195623651.0,15017.10787473722,11387.948187173395,0.95,1672501.0
Gate.io,"Smart Contract Platform, Layer 1 (L1), Celo Ecosystem, DWF Labs Portfolio, Coinbase Ventures Portfolio, Proof of Stake (PoS), Andreessen Horowitz (a16z) Portfolio, Optimism Superchain Ecosystem, Outlier Ventures Portfolio, Made in USA",celo,194988192,344948208.0,113391.98450770503,175639.16970674542,0.03,11669947.0
Gate.io,"Artificial Intelligence (AI), Exchange-based Tokens, Analytics, Derivatives, Perpetuals, Centralized Exchange (CEX) Token, Ethereum Ecosystem, Binance Launchpad, Coinbase Ventures Portfolio, Binance Labs Portfolio, Made in USA",arkham,194528694,526186522.0,550139.6561543336,672175.846011495,0.02,43250457.0
Gate.io,"Infrastructure, Smart Contract Platform, Venom Ecosystem",venom,191634244,692845562.0,5598.5850339952,4375.740110535689,0.01,373910.0
Gate.io,"Smart Contract Platform, Storage, DePIN, Paradigm Portfolio, Proof of Work (PoW), DragonFly Capital Portfolio, Made in USA",siacoin,190673899,203790409.0,18986.488850773578,36394.291226386835,0.15,16898401.0
Gate.io,"Infrastructure, Smart Contract Platform, NEO Ecosystem",gas,191403361,191403361.0,63539.37815560985,76261.69012550071,0.1,4094079.0
Gate.io,"Exchange-based Tokens, Ethereum Ecosystem",btse-token,187712482,231655860.0,,,N/A,3318950.0
Gate.io,"Infrastructure, Smart Contract Platform, BNB Chain Ecosystem, Layer 1 (L1), Ethereum Ecosystem, GMCI Layer 1 Index, Aelf Ecosystem, GMCI Index",aelf,185147883,249578407.0,47644.130357387025,57809.75596226937,0.28,8339214.0
Gate.io,"Crypto-Backed Tokens, Decentralized Finance (DeFi), Wrapped-Tokens, Ethereum Ecosystem",resolv-wstusr,184744046,165304383.0,,,N/A,162.11
Gate.io,"Smart Contract Platform, Real World Assets (RWA), Proof of Work (PoW), Made in USA",ravencoin,184217574,184263381.0,42595.298258259696,85287.1403343881,0.05,5639407.0
Gate.io,"Solana Ecosystem, Meme, Solana Meme, AI Meme, Pump.fun Ecosystem",act-i-the-ai-prophecy,183082074,183082074.0,14077.844251837569,12979.099050844768,0.12,24207061.0
Gate.io,"Gaming (GameFi), Ethereum Ecosystem, Decentralized Identifier (DID), Animoca Brands Portfolio, OKX Ventures Portfolio, Outlier Ventures Portfolio",mocaverse,182269088,847970852.0,33652.02379190497,91375.24724243874,0.23,16069137.0
Gate.io,"Decentralized Finance (DeFi), Launchpad, Ethereum Ecosystem, DWF Labs Portfolio, Coinbase Ventures Portfolio, Pantera Capital Portfolio, Blockchain Capital Portfolio",auction,182874523,212029139.0,165936.69900196395,152308.18476483648,0.11,176123985.0
Gate.io,"Meme, Cronos Ecosystem, AI Meme, Cronos zkEVM Ecosystem",agentfun-ai,180575322,180575322.0,,,N/A,4293.66
Gate.io,"Decentralized Finance (DeFi), BNB Chain Ecosystem, Polygon Ecosystem, Fantom Ecosystem, Arbitrum Ecosystem, Moonbeam Ecosystem, Liquid Staking Tokens, Ethereum Ecosystem, Optimism Ecosystem, Liquid Staked ETH, Liquid Staking",staked-frax-ether,180913593,180913593.0,,,N/A,37112.0
Gate.io,"Solana Ecosystem, Ethereum Ecosystem, Energi Ecosystem",swissborg,180266972,180266972.0,,,N/A,5580077.0
Gate.io,"Tourism, BNB Chain Ecosystem",trip,180041190,598102937.0,,,N/A,31740.0
Gate.io,"Meme, Ethereum Ecosystem, Base Ecosystem, Cat-Themed, Murad Picks",mog-coin,179317383,179317383.0,383039.7766256671,394157.54537351686,0.11,9493433.0
Gate.io,"BNB Chain Ecosystem, Avalanche Ecosystem, Polygon Ecosystem, Fantom Ecosystem, Arbitrum Ecosystem, Ethereum Ecosystem, Optimism Ecosystem, Liquid Staking Governance Tokens, Linea Ecosystem, DePIN, Scroll Ecosystem, Rollups-as-a-Service (RaaS), Blast Ecosystem, Mode Ecosystem, Pantera Capital Portfolio, Polygon zkEVM Ecosystem, Binance Labs Portfolio, Liquid Staking, Made in USA",ankr,179347509,179347509.0,31574.942576812646,29438.978674746228,0.39,10888218.0
Gate.io,"Avalanche Ecosystem, Liquid Staking Tokens, Liquid Staking",benqi-liquid-staked-avax,179104764,179104764.0,,,N/A,2189597.0
Gate.io,"Solana Ecosystem, Meme, Cat-Themed",meow,177733741,177733741.0,,,N/A,339510.0
Gate.io,"Tokenized Real Estate, Tokenized Assets, Ethereum Ecosystem, Real World Assets (RWA), RWA Protocol",apf-coin,176936483,259790115.0,,,N/A,2955637.0
Gate.io,,nem,175767935,175767935.0,594.292486801597,3854.015042130432,0.57,16224872.0
Gate.io,"Artificial Intelligence (AI), Smart Contract Platform, Layer 1 (L1), Paradigm Portfolio, Coinbase Ventures Portfolio, DeFiance Capital Portfolio, Polychain Capital Portfolio, Vana Ecosystem",vana,173464663,675836350.0,273558.9780762328,330834.10251219344,0.04,17376708.0
Gate.io,"Gaming (GameFi), BNB Chain Ecosystem, Ethereum Ecosystem, TON Ecosystem",gmt-token,172570974,172570974.0,6520.266179389861,19831.474311196576,0.17,13329863.0
Gate.io,"Solana Ecosystem, Meme, Dog-Themed, Solana Meme, Cat-Themed",cat-in-a-dogs-world,172392044,172392044.0,87292.26365755175,132386.23678813977,0.05,7170692.0
Gate.io,"Decentralized Finance (DeFi), Yield Farming, Yield Aggregator, Yearn Ecosystem, Avalanche Ecosystem, Polygon Ecosystem, Near Protocol Ecosystem, Gnosis Chain Ecosystem, Fantom Ecosystem, Harmony Ecosystem, Arbitrum Ecosystem, Ethereum Ecosystem, Optimism Ecosystem, Base Ecosystem, Index Coop Defi Index, Alameda Research Portfolio, Energi Ecosystem, Sora Ecosystem, Huobi ECO Chain Ecosystem, Blockchain Capital Portfolio, Index Coop Index",yearn-finance,172515686,187422901.0,67957.36233732697,82239.2785751454,0.23,22411222.0
Gate.io,"Decentralized Exchange (DEX), Decentralized Finance (DeFi), Yield Farming, Automated Market Maker (AMM), BNB Chain Ecosystem, Seigniorage, Solana Ecosystem, Avalanche Ecosystem, Polygon Ecosystem, Fantom Ecosystem, Harmony Ecosystem, Arbitrum Ecosystem, Moonriver Ecosystem, Ethereum Ecosystem, Liquid Staking Governance Tokens, Curve Ecosystem, Stablecoin Protocol, Polygon zkEVM Ecosystem, Evmos Ecosystem, Fraxtal Ecosystem, GMCI DeFi Index, Liquid Staking, GMCI Index, Made in USA",frax-share,170477733,192597920.0,45656.24984113363,108410.01101859988,0.26,43881036.0
Gate.io,"Starknet Ecosystem, Bridged-Tokens",bridged-wrapped-ether-starkgate,170029816,170029816.0,,,N/A,835455.0
Gate.io,"Smart Contract Platform, Privacy, Proof of Work (PoW)",mimblewimblecoin,169253463,169254037.0,,,N/A,40407.0
Gate.io,Arbitrum Ecosystem,rcge,168805259,168805259.0,,,N/A,2.43
Gate.io,"Internet of Things (IOT), Ethereum Ecosystem, DePIN, Base Ecosystem, Account Abstraction, GMCI DePIN Index, GMCI Index, Made in USA",iotex,168210251,168210251.0,36644.039669229336,47953.99630071552,0.11,8905937.0
Gate.io,"Decentralized Finance (DeFi), Derivatives, Prediction Markets, Solana Ecosystem",drift-protocol,168584820,584348070.0,121485.61482503799,226528.42163461357,0.09,111725767.0
Gate.io,"Launchpad, Meme, Base Ecosystem, Cat-Themed, Base Meme",toshi,167552510,167552510.0,1306121.8651558517,1124676.116684785,0.18,19285180.0
Gate.io,"Decentralized Finance (DeFi), Solana Ecosystem, Ethereum Ecosystem, Optimism Ecosystem, Base Ecosystem, Cross-chain Communication, BTCfi",threshold-network-token,166127350,183007879.0,39762.907704822916,53047.71462262051,0.24,13526233.0
Gate.io,"Entertainment, Smart Contract Platform, Gaming (GameFi), NFT, Metaverse, Layer 1 (L1), Harmony Ecosystem, Ethereum Ecosystem, Gaming Blockchains, Energi Ecosystem",enjincoin,166084205,171831443.0,33093.47928850236,51956.044991172435,0.04,13427685.0
Gate.io,"Smart Contract Platform, Layer 1 (L1), Layer 0 (L0), Made in USA, Directed Acyclic Graph (DAG)",constellation-labs,165954808,165954928.0,3241.0400250439593,5432.4697496484805,0.75,2090769.0
Gate.io,"Decentralized Finance (DeFi), Derivatives, Perpetuals, Avalanche Ecosystem, Arbitrum Ecosystem",gmx,164739498,164739498.0,59781.45069542726,60618.709451411494,0.18,52425415.0
Gate.io,"Decentralized Finance (DeFi), Liquid Staking Tokens, Ethereum Ecosystem, Liquid Staked ETH, Liquid Staking",treehouse-eth,163371942,163371942.0,,,N/A,167784.0
