Gate.io,"Smart Contract Platform, Gaming (GameFi), Layer 1 (L1), Ethereum Ecosystem, Modular Blockchain, Account Abstraction, Multicoin Capital Portfolio, Gaming Blockchains, Gaming Utility Token, Skale Ecosystem, Consensys Portfolio, Galaxy Digital Portfolio, Made in USA",skale,163302696,171788866.0,108405.1601038115,143652.66770197736,0.07,21159781.0
Gate.io,"Decentralized Finance (DeFi), Liquid Staking Tokens, Ethereum Ecosystem, Liquid Staked ETH, Liquid Staking",treehouse-eth,163014315,163014315.0,,,N/A,386.32
Gate.io,"Decentralized Exchange (DEX), Exchange-based Tokens, Ethereum Ecosystem",coinex-token,162363168,162363240.0,,,N/A,79844.0
Gate.io,"Decentralized Finance (DeFi), Binance Launchpool, Arbitrum Ecosystem, Ethereum Ecosystem, Restaking, Liquid Restaking Governance Tokens, Ether.fi Ecosystem, Consensys Portfolio, OKX Ventures Portfolio",ether-fi,162613518,701930219.0,789126.0329638947,646939.0617589878,0.03,42621685.0
Gate.io,"Smart Contract Platform, Layer 1 (L1), Proof of Stake (PoS), GMCI Layer 1 Index, GMCI Index, Made in USA",casper-network,160949450,166635292.0,97487.33845656498,125714.91366043611,0.12,9202053.0
Gate.io,"Decentralized Exchange (DEX), Exchange-based Tokens, Decentralized Finance (DeFi), Automated Market Maker (AMM), BNB Chain Ecosystem, Derivatives, Perpetuals, Centralized Exchange (CEX) Token, Solana Ecosystem, Avalanche Ecosystem, Polygon Ecosystem, Near Protocol Ecosystem, Fantom Ecosystem, Arbitrum Ecosystem, Ethereum Ecosystem, ZkSync Ecosystem, Mantle Ecosystem, Linea Ecosystem, Base Ecosystem, DragonFly Capital Portfolio, Binance Labs Portfolio",woo-network,160222173,190815719.0,72765.04117723525,103910.8999764131,0.16,5677385.0
Gate.io,"Smart Contract Platform, BNB Chain Ecosystem, Layer 1 (L1), Ethereum Ecosystem, ZetaChain Ecosystem, Cross-chain Communication, Made in USA",zetachain,159727875,458457524.0,129888.07009409646,291941.9152504554,0.09,9149394.0
Gate.io,"Meme, Ethereum Ecosystem, Frog-Themed, AI Meme",turbo,159690421,159690421.0,140147.66493345087,145511.66145401867,0.04,32939848.0
Gate.io,"Solana Ecosystem, DePIN, Multicoin Capital Portfolio, Made in USA",hivemapper,158729632,246877301.0,15588.105813191045,66977.4148591371,0.03,1738807.0
Gate.io,"BNB Chain Ecosystem, Binance Alpha Spotlight",bnb48-club-token,159009618,159009618.0,,,N/A,147262.0
Gate.io,"Decentralized Finance (DeFi), Tron Ecosystem",sun-token,158636909,321154085.0,255028.71351893822,170674.30290731063,0.06,23282438.0
Gate.io,"SocialFi, Arbitrum Ecosystem",uxlink,159117361,470483031.0,71258.88108028201,108577.18418694084,0.13,12829583.0
Gate.io,"Internet of Things (IOT), Oracle, NFT, Metaverse, Ethereum Ecosystem, DePIN, Alleged SEC Securities, Made in USA",xyo-network,155465241,155465241.0,27216.2519713008,20452.90734174236,0.47,4586065.0
Gate.io,"Smart Contract Platform, EthereumPoW Ecosystem, Proof of Work (PoW)",ethereum-pow-iou,154791217,154791217.0,18040.02563142198,35703.85695695128,0.28,3794981.0
Gate.io,"Smart Contract Platform, Layer 1 (L1), Real World Assets (RWA), RWA Protocol",polymesh,152413065,152413065.0,194425.64480676953,191198.83404457002,0.07,1871974.0
Gate.io,"Stablecoins, Ethereum Ecosystem, Crypto-backed Stablecoin",elixir-staked-deusd,152042104,152026617.0,,,N/A,52273.0
Gate.io,Smart Contract Platform,bitkub-coin,152008816,188193244.0,255.45681736698697,2875.412991015727,0.47,264202.0
Gate.io,"Gaming (GameFi), NFT, Solana Ecosystem, Animoca Brands Portfolio, FTX Holdings, Multicoin Capital Portfolio, Alameda Research Portfolio",metaplex,151204145,193755767.0,19488.18723287782,13352.961900792274,0.05,5798927.0
Gate.io,BNB Chain Ecosystem,acet-token,148992040,194380953.0,,,N/A,889658.0
Gate.io,"Artificial Intelligence (AI), Smart Contract Platform, Layer 1 (L1), Proof of Work (PoW)",qubic-network,146638164,175380116.0,9068.3006832074,9640.692744703345,0.3,12101638.0
Gate.io,"Payment Solutions, Made in USA, Directed Acyclic Graph (DAG)",nano,148988460,148988460.0,6802.013743638585,15014.631073173787,0.93,2948062.0
Gate.io,"Artificial Intelligence (AI), Meme, Base Ecosystem, AI Agents, Binance Alpha Spotlight, AI Framework",freysa-ai,148036857,148036857.0,0.0,0.0,N/A,620545.0
Gate.io,"Binance Launchpool, Solana Ecosystem, Ethereum Ecosystem, Decentralized Science (DeSci)",bio-protocol,148702642,304570059.0,60479.381140550824,78287.90314125805,0.22,19656874.0
Gate.io,"BNB Chain Ecosystem, Binance-Peg Tokens",binance-peg-sol,148624960,148624960.0,,,N/A,3251782.0
Gate.io,"NFT, Solana Ecosystem, NFT Marketplace, Paradigm Portfolio, Sequoia Capital Portfolio",magic-eden,148712392,1114989797.0,85599.02189008669,235986.02561756223,0.1,14133923.0
Gate.io,"Smart Contract Platform, Masternodes, Zero Knowledge (ZK), Proof of Work (PoW), Made in USA",zencash,151793048,151793852.0,,,N/A,16672452.0
Gate.io,"Internet of Things (IOT), Smart Contract Platform, Layer 1 (L1), Proof of Work (PoW), Made in USA",digibyte,147826782,147833356.0,35367.02560416161,62102.32168493387,0.32,3060419.0
Gate.io,"Smart Contract Platform, Layer 1 (L1), Kadena Ecosystem, Multicoin Capital Portfolio, Proof of Work (PoW), Made in USA",kadena,147667524,147839112.0,63975.60686971166,112899.22805549839,0.19,4809110.0
Gate.io,"Solana Ecosystem, Meme, Solana Meme, Murad Picks",gigachad-2,146807322,146807322.0,6047.317520006953,11044.575584401362,0.26,12126974.0
Gate.io,"Smart Contract Platform, Crypto-Backed Tokens, Wrapped-Tokens, Layer 2 (L2), Mantle Ecosystem",wrapped-ether-mantle-bridge,145999639,145999639.0,,,N/A,2618384.0
Gate.io,"Crypto-Backed Tokens, BNB Chain Ecosystem, Wrapped-Tokens, Ethereum Ecosystem",wrapped-beacon-eth,145817663,145817663.0,,,N/A,6283339.0
Gate.io,"Alleged SEC Securities, Osmosis Ecosystem, DeFiance Capital Portfolio, Pantera Capital Portfolio, Binance Labs Portfolio, Delphi Ventures Portfolio, Galaxy Digital Portfolio, OKX Ventures Portfolio",terra-luna-2,145332866,227938409.0,178120.84958912505,167102.2876297216,0.09,28886045.0
Gate.io,"Exchange-based Tokens, Decentralized Finance (DeFi), Ethereum Ecosystem, Real World Assets (RWA), Alleged SEC Securities",lcx,142254056,143616214.0,,,N/A,2894205.0
Gate.io,"Smart Contract Platform, DWF Labs Portfolio, Proof of Stake (PoS)",waves,142019778,142019778.0,22608.17010244017,20284.63342036388,0.11,7871036.0
Gate.io,"Stablecoins, Ethereum Ecosystem, XRP Ledger Ecosystem, Fiat-backed Stablecoin, Made in USA",ripple-usd,141474567,141474567.0,,,N/A,14495330.0
Gate.io,"Crypto-Backed Tokens, Wrapped-Tokens, Avalanche Ecosystem",wrapped-avax,139880888,139880888.0,,,N/A,77379301.0
Gate.io,"Gaming (GameFi), NFT, BNB Chain Ecosystem, Solana Ecosystem, Polygon Ecosystem, Play To Earn, Move To Earn, Ethereum Ecosystem, Binance Launchpad, Gaming Governance Token, Sports Games, Alameda Research Portfolio, Binance Labs Portfolio, Sequoia Capital Portfolio",stepn,140666412,263011385.0,92402.46580106471,68432.17007668116,0.08,17710198.0
Gate.io,"Gaming (GameFi), Play To Earn, Telegram Apps, TON Ecosystem, Tap to Earn, Arcade Games",hamster-kombat,140841111,218782309.0,67690.49127542376,120486.4943621451,0.05,18481924.0
Gate.io,"Smart Contract Platform, Layer 1 (L1), Harmony Ecosystem, Animoca Brands Portfolio, Binance Launchpad, Binance Labs Portfolio, Made in USA",harmony,140162530,149851335.0,86000.81529712277,103449.80720241793,0.11,8246706.0
Gate.io,"Stablecoins, EUR Stablecoin, Solana Ecosystem, Avalanche Ecosystem, Ethereum Ecosystem, Base Ecosystem, Stellar Ecosystem",euro-coin,139569588,139569588.0,,,N/A,21627199.0
Gate.io,"Gaming (GameFi), Polkadot Ecosystem, NFT, Ethereum Ecosystem, Gaming Blockchains, Andreessen Horowitz (a16z) Portfolio, Binance Labs Portfolio, Galaxy Digital Portfolio, Made in USA",mythos,138964567,178905879.0,6695.450322888494,9802.151317339674,0.22,1688192.0
Gate.io,"Tokenized Assets, Tokenized Gold, Real World Assets (RWA), Tokenized Commodities",kinesis-gold,138099974,138099974.0,,,N/A,37699.0
Gate.io,"BNB Chain Ecosystem, Arbitrum Ecosystem, Cardano Ecosystem, Ethereum Ecosystem, DePIN, Base Ecosystem, DWF Labs Portfolio",world-mobile-token,137006805,395872360.0,3840.5739432359555,3005.2139877111385,0.1,13592459.0
Gate.io,"Decentralized Finance (DeFi), Analytics, DeFi Index, Base Ecosystem",mag7-ssi,136103711,136103711.0,2379.7356030597675,1812.1133581175247,0.3,836648.0
Gate.io,"Smart Contract Platform, Masternodes, Proof of Stake (PoS), Made in China",ontology,135637261,148611351.0,39176.09723782144,72472.73289849625,0.13,4180576.0
Gate.io,"Stablecoins, EUR Stablecoin, Polygon Ecosystem, Ethereum Ecosystem, Real World Assets (RWA), Fiat-backed Stablecoin",stasis-eurs,134613400,134613400.0,,,N/A,56161.0
Gate.io,"Smart Contract Platform, SocialFi, NFT, BNB Chain Ecosystem, Binance Launchpool, Ethereum Ecosystem, Decentralized Identifier (DID), Zero Knowledge (ZK), DWF Labs Portfolio, Coinbase Ventures Portfolio, Multicoin Capital Portfolio, Alameda Research Portfolio, DragonFly Capital Portfolio, Binance Labs Portfolio, Quest-to-Earn",project-galaxy,133223636,208570386.0,,,N/A,363083.0
Gate.io,"Liquid Staking Tokens, Aptos Ecosystem, Liquid Staking",amnis-aptos,135012299,135040901.0,,,N/A,120107.0
Gate.io,"Decentralized Exchange (DEX), Smart Contract Platform, Exchange-based Tokens, Decentralized Finance (DeFi), Arbitrum Ecosystem, Ethereum Ecosystem, Layer 2 (L2), Zero Knowledge (ZK), Loopring Ecosystem, Rollup, Energi Ecosystem",loopring,133948474,147696232.0,45704.22903838366,86786.56860740247,0.05,11927443.0
Gate.io,"Tokenized Assets, Real World Assets (RWA), Tokenized Silver, Tokenized Commodities",kinesis-silver,131683522,131683522.0,,,N/A,64344.0
Gate.io,"Stablecoins, USD Stablecoin, Solana Ecosystem, Fiat-backed Stablecoin",global-dollar,130233468,130233468.0,,,N/A,1168428.0
Gate.io,"Cronos Ecosystem, Bridged USDC, Bridged-Tokens, Bridged Stablecoins",cronos-bridged-usdc-cronos,129499781,129499781.0,,,N/A,1711234.0
Gate.io,"Artificial Intelligence (AI), Binance Launchpool, Solana Ecosystem, DePIN, Animoca Brands Portfolio, Multicoin Capital Portfolio, Delphi Ventures Portfolio, OKX Ventures Portfolio, Made in USA",io,128581028,697613362.0,281440.92097150645,403476.3906124303,0.11,35885013.0
Gate.io,"Smart Contract Platform, Ethereum Ecosystem, Zero Knowledge (ZK), Alleged SEC Securities, Privacy Blockchain",coti,128601315,143503506.0,27438.271564555405,38336.75383327551,0.22,23722064.0
Gate.io,"Smart Contract Platform, Base Ecosystem, Gaming Blockchains",b3,127332015,598008677.0,62420.01623762211,51770.090995776205,0.3,18939610.0
Gate.io,"BNB Chain Ecosystem, Harmony Ecosystem, Ethereum Ecosystem, Alameda Research Portfolio, Binance Labs Portfolio",swipe,127466649,127546591.0,47409.14399055443,43005.75271038814,0.2,3577038.0
Gate.io,"Artificial Intelligence (AI), Smart Contract Platform, BNB Chain Ecosystem, Solana Ecosystem, Layer 1 (L1), Polygon Ecosystem, Ethereum Ecosystem, DWF Labs Portfolio, Injective Ecosystem, OKX Ventures Portfolio",zignaly,127221573,176388285.0,3534.8116960389966,4698.070719361158,0.79,2038245.0
Gate.io,"Decentralized Exchange (DEX), Exchange-based Tokens, Decentralized Finance (DeFi), Yield Farming, Automated Market Maker (AMM), BNB Chain Ecosystem, Yearn Ecosystem, Solana Ecosystem, Avalanche Ecosystem, Polygon Ecosystem, Near Protocol Ecosystem, Fantom Ecosystem, Harmony Ecosystem, Arbitrum Ecosystem, Celo Ecosystem, Ethereum Ecosystem, Base Ecosystem, Alameda Research Portfolio, Pantera Capital Portfolio, Energi Ecosystem, Sora Ecosystem, Blockchain Capital Portfolio",sushi,125381519,182546099.0,197703.4798892836,238113.7168813813,0.06,25021731.0
Gate.io,"Decentralized Exchange (DEX), Decentralized Finance (DeFi), Gnosis Chain Ecosystem, MEV Protection, Arbitrum Ecosystem, Ethereum Ecosystem, Intent, Delphi Ventures Portfolio, Blockchain Capital Portfolio",cow-protocol,124519144,300044524.0,23697.394834280647,25480.00404189601,0.17,27911307.0
Gate.io,"Decentralized Finance (DeFi), Yield Farming, Avalanche Ecosystem, Fantom Ecosystem, Arbitrum Ecosystem, Olympus Pro Ecosystem, Ethereum Ecosystem, Stablecoin Protocol",spell-token,124783959,154239975.0,331541.3943947936,110344.08575789304,0.18,148516686.0
Gate.io,"BNB Chain Ecosystem, Tron Ecosystem",global-commercial-business,123912712,123912712.0,,,N/A,204871.0
Gate.io,"Smart Contract Platform, BNB Chain Ecosystem, Ethereum Ecosystem, Zero Knowledge (ZK), Animoca Brands Portfolio, Binance Labs Portfolio, OKX Ventures Portfolio",polyhedra-network,123825965,2050659391.0,343321.4469914646,403071.0204964127,0.02,8001416.0
Gate.io,"Business Services, Decentralized Finance (DeFi), Oracle, Fantom Ecosystem, Ethereum Ecosystem, Binance Launchpad, Osmosis Ecosystem, Energi Ecosystem, Binance Labs Portfolio, Sequoia Capital Portfolio",band-protocol,123737089,125609586.0,35415.85365304586,45422.94888284747,0.16,7844040.0
Gate.io,"Decentralized Finance (DeFi), Insurance, Ethereum Ecosystem",nxm,123577187,123577187.0,,,N/A,0.0
Gate.io,"Polygon Ecosystem, Bridged DAI, Bridged-Tokens, Bridged Stablecoins",polygon-pos-bridged-dai-polygon-pos,122730641,122730641.0,,,N/A,2388250.0
Gate.io,"Tokenized Assets, Polygon Ecosystem, Arbitrum Ecosystem, Ethereum Ecosystem, Real World Assets (RWA), Starknet Ecosystem, Tokenized Treasury Bills (T-Bills)",eutbl,122449574,122449574.0,,,N/A,0.0
Gate.io,"Exchange-based Tokens, BNB Chain Ecosystem, Centralized Exchange (CEX) Token",nkyc-token,121538237,121538237.0,,,N/A,253247.0
Gate.io,"Arbitrum Ecosystem, Ethereum Ecosystem, Account Abstraction, Coinbase Ventures Portfolio, Binance Labs Portfolio, Consensys Portfolio, Outlier Ventures Portfolio",biconomy,119898218,128063289.0,41606.2497696886,83287.4341201789,0.39,12108936.0
Gate.io,"Arbitrum Ecosystem, Ethereum Ecosystem",reserve-protocol-eth-plus,119547260,119547260.0,,,N/A,244012.0
Gate.io,"Decentralized Finance (DeFi), Ethereum Ecosystem, Real World Assets (RWA), Coinbase Ventures Portfolio, Stablecoin Protocol, Binance Labs Portfolio, Galaxy Digital Portfolio",usual,118745416,130545880.0,223708.24367631882,315015.44605180307,0.06,13051871.0
Gate.io,"Stablecoins, Ethereum Ecosystem, Base Ecosystem, Blast Ecosystem, Fiat-backed Stablecoin",anzen-usdz,117875426,117875426.0,,,N/A,74929.0
Gate.io,"Smart Contract Platform, SocialFi, Layer 1 (L1), Gaming Blockchains",hive,118010788,,52254.27758788761,87809.5169686255,0.16,2239598.0
Gate.io,"Smart Contract Platform, Ethereum Ecosystem, Metis Ecosystem, Layer 2 (L2), DWF Labs Portfolio, Rollup, GMCI Layer 2 Index, OKX Ventures Portfolio, GMCI Index",metis-token,116894520,186871737.0,81592.69924452012,117842.5438363816,0.11,10297717.0
Gate.io,"BNB Chain Ecosystem, Ethereum Ecosystem, Payment Solutions, DWF Labs Portfolio",alchemy-pay,115839857,234318560.0,152116.24119577932,175768.81931306742,0.04,26312633.0
Gate.io,"Decentralized Finance (DeFi), Yield Farming, Lending/Borrowing Protocols, Ethereum Ecosystem, Real World Assets (RWA), Base Ecosystem, Binance Alpha Spotlight",syrup,112950498,181244123.0,11736.57539384745,6524.950048594031,0.23,6791951.0
Gate.io,"Meme, Ethereum Ecosystem, Dog-Themed",neiro-3,113018440,113018440.0,270063.33184129506,188713.19943012565,0.07,33634234.0
Gate.io,"Business Services, Infrastructure, Smart Contract Platform, Decentralized Finance (DeFi), Polygon Ecosystem, Arbitrum Ecosystem, Ethereum Ecosystem, Liquid Staking Governance Tokens, Coinbase Ventures Portfolio, Proof of Stake (PoS), Index Coop Defi Index, Consensys Portfolio, Liquid Staking, Index Coop Index",rocket-pool,112072514,112072514.0,32802.91772322293,42876.84469073942,0.47,10329224.0
Gate.io,"Big Data, Business Services, Infrastructure, Decentralized Finance (DeFi), Solana Ecosystem, FTX Holdings, DWF Labs Portfolio, Name Service",bonfida,111889474,112915677.0,97215.1423443769,108469.45891373929,0.09,11493098.0
Gate.io,"Smart Contract Platform, BNB Chain Ecosystem, Ethereum Ecosystem, Layer 2 (L2)",prometeus,111582917,117697049.0,34665.860580253306,58471.39850106686,0.25,1868071.0
Gate.io,"Smart Contract Platform, BNB Chain Ecosystem, Layer 1 (L1), Ethereum Ecosystem, Decentralized Identifier (DID), Base Ecosystem, Gravity Alpha Ecosystem",g-token,111590442,185143211.0,84032.37524230726,125290.46577486981,0.32,6387091.0
Gate.io,"Exchange-based Tokens, NFT, BNB Chain Ecosystem, Ethereum Ecosystem",swftcoin,111693556,111693556.0,322752.3952102711,401866.6185201945,0.86,2221472.0
Gate.io,"Arbitrum Ecosystem, Bridged USDC, Bridged-Tokens, Bridged Stablecoins",usd-coin-ethereum-bridged,110376881,110376881.0,,,N/A,13314606.0
Gate.io,"Meme, PulseChain Ecosystem",the-grays-currency,109790893,109790893.0,,,N/A,165077.0
Gate.io,"Music, NFT, Ethereum Ecosystem, Coinbase Ventures Portfolio, Multicoin Capital Portfolio, Pantera Capital Portfolio, Energi Ecosystem, Binance Labs Portfolio",audius,109612490,109612490.0,30487.988309270077,30257.01294712984,0.21,13411432.0
Gate.io,"Decentralized Finance (DeFi), Derivatives, Synthetic Issuer, Ethereum Ecosystem, Synthetic",stp-network,109661606,109661606.0,49307.76348140766,61065.26731571785,0.34,21320085.0
Gate.io,"Solana Ecosystem, Polygon Ecosystem, Ethereum Ecosystem",m2-global-wealth-limited-mmx,108706941,348756620.0,,,N/A,88780.0
Gate.io,"Smart Contract Platform, Decentralized Finance (DeFi), Binance Launchpool, Derivatives, Perpetuals, Ethereum Ecosystem, Layer 2 (L2), DragonFly Capital Portfolio, Pantera Capital Portfolio",aevo-exchange,109316592,121037092.0,278525.6519432682,327173.4151914225,0.08,13992238.0
Gate.io,"Smart Contract Platform, Cross-chain Communication, Pantera Capital Portfolio",icon,109017349,110250432.0,55147.95295902573,44875.80781246378,0.02,1056888.0
Gate.io,"Smart Contract Platform, Proof of Stake (PoS), Sequoia Capital Portfolio",iostoken,108866994,108866994.0,49092.57899722287,97900.1145130474,0.11,20634216.0
Gate.io,"Lending/Borrowing Protocols, Ethereum Ecosystem, Paradigm Portfolio, Coinbase Ventures Portfolio",euler,107602385,156534815.0,,,N/A,2454839.0
Gate.io,"Decentralized Exchange (DEX), Decentralized Finance (DeFi), BNB Chain Ecosystem, Wallets, XRP Ledger Ecosystem",solo-coin,108384957,108384957.0,9809.1982095668,3544.9693800186405,0.38,2234966.0
Gate.io,"Crypto-Backed Tokens, BNB Chain Ecosystem, Arbitrum Ecosystem, Ethereum Ecosystem, Mantle Ecosystem",ignition-fbtc,108136730,1192831722.0,,,N/A,347603.0
Gate.io,"Decentralized Finance (DeFi), Ethereum Ecosystem, Morpho Ecosystem",steakhouse-usdc-morpho-vault,108093930,108093930.0,,,N/A,0.0
Gate.io,"Gaming (GameFi), NFT, Metaverse, Play To Earn, Ethereum Ecosystem, Animoca Brands Portfolio, RPG, Gaming Governance Token, Adventure Games, Energi Ecosystem, Delphi Ventures Portfolio",illuvium,106185556,136792964.0,42622.733774056906,34265.63401461214,0.42,13454265.0
Gate.io,"Solana Ecosystem, Multicoin Capital Portfolio, Stablecoin Protocol, Alameda Research Portfolio, DeFiance Capital Portfolio",uxd-protocol-token,105783114,105783114.0,,,N/A,387.63
Gate.io,"Smart Contract Platform, Privacy, Layer 1 (L1), Proof of Stake (PoS), Proof of Work (PoW), Zano Ecosystem, Privacy Blockchain",zano,105113624,105116290.0,,,N/A,736301.0
Gate.io,"Stablecoins, BNB Chain Ecosystem",astherus-usdf,105054174,105054174.0,,,N/A,393336.0
Gate.io,"NFT, Meme, Arbitrum Ecosystem, Ethereum Ecosystem, Anime-Themed, Binance HODLer Airdrops, Airdropped Tokens by NFT Projects",anime,104845819,189300059.0,47025.443942914855,50172.40007609898,0.11,12400321.0
Gate.io,"Smart Contract Platform, BNB Chain Ecosystem, Ethereum Ecosystem, DWF Labs Portfolio, Made in USA",proton,104645203,116011327.0,6860.08729254231,9301.36570132512,0.06,4116114.0
Gate.io,"Tokenized Real Estate, Tokenized Assets, Gnosis Chain Ecosystem, RealT Tokens, Real World Assets (RWA), RWA Protocol",realtoken-ecosystem-governance,103977593,726102298.0,,,N/A,234.73
Gate.io,"Artificial Intelligence (AI), Smart Contract Platform, Masternodes, DePIN, Proof of Work (PoW), Made in USA",zelcash,103720622,103728131.0,86837.52605272144,107178.35124882964,0.04,9762133.0
Gate.io,"Solana Ecosystem, Meme, Solana Meme, PolitiFi, Made in USA",melania-meme,103512195,690080728.0,16398.218727520973,22394.978243895854,0.14,12234428.0
Gate.io,"Infrastructure, Solana Ecosystem, Animoca Brands Portfolio, Cross-chain Communication, OKX Ventures Portfolio",zeus-network,103664957,270821808.0,32336.258948805596,45152.103717178616,0.29,7636648.0
Gate.io,"Business Services, Decentralized Finance (DeFi), Oracle, Derivatives, Synthetic Issuer, Avalanche Ecosystem, Ethereum Ecosystem, Blockchain Capital Portfolio, Synthetic, Made in USA",uma,103525797,149372335.0,55781.341959696874,93405.43852343402,0.08,8980142.0
Gate.io,"DaoMaker Launchpad, Ethereum Ecosystem, Real World Assets (RWA), Sequoia Capital Portfolio, Made in USA",clearpool,103614275,136344268.0,10978.467006711382,11646.404209383469,0.48,2742135.0
Gate.io,"Smart Contract Platform, Polkadot Ecosystem, Binance Launchpool, Layer 2 (L2), Manta Network Ecosystem, Multicoin Capital Portfolio, Alameda Research Portfolio, DeFiance Capital Portfolio, Binance Labs Portfolio",manta-network,103215791,262115901.0,199481.99469673657,263658.7025524991,0.04,28098919.0
Gate.io,"Decentralized Finance (DeFi), BNB Chain Ecosystem, Real World Assets (RWA), DWF Labs Portfolio, Stellar Ecosystem",velo,102292018,332184365.0,33262.55619869908,58275.01745686831,0.12,11648502.0
Gate.io,"Artificial Intelligence (AI), Base Ecosystem, AI Agents, AI Applications, Made in USA",venice-token,102373794,244034986.0,32436.405749179412,32902.70317664119,0.21,10825693.0
Gate.io,"NFT, BNB Chain Ecosystem, Ethereum Ecosystem, Binance Launchpad, DWF Labs Portfolio, Binance Labs Portfolio",space-id,101635418,471368496.0,211474.34185949425,185497.2291604958,0.04,14142219.0
Gate.io,"Polygon Ecosystem, Arbitrum Ecosystem, Ethereum Ecosystem, Optimism Ecosystem, Bridge Governance Tokens, Cross-chain Communication, Intent, Boba Network Ecosystem, Blockchain Capital Portfolio, Made in USA",across-protocol,101906214,252185233.0,151203.10505240876,165055.18337332495,0.12,10984687.0
Gate.io,"NFT, Binance Launchpool, Meme, Ethereum Ecosystem, Binance Labs Portfolio, GMCI Meme Index, GMCI Index",memecoin-2,101679039,171288456.0,276404.5771352522,364166.39857157465,0.04,16613078.0
Gate.io,"Smart Contract Platform, BNB Chain Ecosystem, Binance Launchpool, Ethereum Ecosystem, Layer 2 (L2), Restaking, Rollups-as-a-Service (RaaS), Rollup, Binance Labs Portfolio",altlayer,100434515,359720685.0,171925.03923330354,126275.98732096223,0.03,13265691.0
Gate.io,"Solana Ecosystem, Meme, Base Ecosystem, AI Meme, AI Agents, Virtuals Protocol Ecosystem, Binance Alpha Spotlight, DeFAI",aixbt,100789259,117797755.0,66508.85795873548,71754.62692858516,0.06,39308375.0
Gate.io,"Solana Ecosystem, Meme, Frog-Themed, Solana Meme, GMCI Meme Index, GMCI Index",book-of-meme,100053705,100053705.0,297388.6354636634,283266.93378380366,0.07,43945691.0
Gate.io,"Bridged USDT, QL1 Ecosystem, Bridged-Tokens, Bridged Stablecoins",qusdt,99990458,99990458.0,,,N/A,6859.66
Gate.io,"Solana Ecosystem, Liquid Staking Tokens, Liquid Staked SOL, Liquid Staking",drift-staked-sol,99397004,99397004.0,,,N/A,36536.0
Gate.io,"Decentralized Exchange (DEX), Decentralized Finance (DeFi), Automated Market Maker (AMM), Ethereum Ecosystem, Cronos Ecosystem",vvs-finance,99875153,195249845.0,2560.343221127898,1.3131285062259637,1.7,291852.0
Gate.io,"Smart Contract Platform, Ethereum Ecosystem, Layer 2 (L2), Optimism Superchain Ecosystem, Outlier Ventures Portfolio, Lisk Ecosystem",lisk,98830753,229379055.0,53773.520318323324,62578.71183690457,0.26,8583249.0
Gate.io,"Big Data, Infrastructure, Storage, Cardano Ecosystem, DePIN",iagon,97932472,260444547.0,3456.2126370990713,2719.7798813740396,0.72,524730.0
Gate.io,"NFT, Polygon Ecosystem, Ethereum Ecosystem, Optimism Ecosystem",blockv,95992338,95992338.0,,,N/A,56223.0
Gate.io,"Crypto-Backed Tokens, Decentralized Finance (DeFi), Compound Tokens, cToken, Ethereum Ecosystem",compound-ether,97865012,97865012.0,,,N/A,129.8
Gate.io,"Software as a service, Ethereum Ecosystem, Energi Ecosystem",status,97063973,166774508.0,73071.06089886786,103122.49476707296,0.12,8215640.0
Gate.io,"Infrastructure, Smart Contract Platform, Ethereum Ecosystem, Data Availability, Modular Blockchain",avail,97989518,501672515.0,47088.17108393933,50809.09322089633,0.06,3648785.0
Gate.io,"Solana Ecosystem, Payment Solutions, Viction Ecosystem",saros-finance,96099096,366091820.0,921.7059017740152,3809.6811137472523,1.43,710604.0
Gate.io,"Internet of Things (IOT), BNB Chain Ecosystem, Ethereum Ecosystem, DePIN, DWF Labs Portfolio",mass-vehicle-ledger,96493862,101996695.0,1304.0701659077865,3986.1418723826546,0.64,26690537.0
Gate.io,Layer 1 (L1),oec-token,95216320,95216320.0,502.3969671691515,501.83566247403087,1.34,354101.0
Gate.io,"Stablecoins, LP Tokens, Ethereum Ecosystem",resolv-rlp,95667808,95667808.0,,,N/A,192941.0
Gate.io,"XDC Ecosystem, Telos Ecosystem",ecoin-2,95498064,207099463.0,,,N/A,5.24
Gate.io,"Smart Contract Platform, Layer 1 (L1), Zero Knowledge (ZK), Andreessen Horowitz (a16z) Portfolio, Privacy Blockchain, Made in USA",aleo,95253631,466725875.0,158605.00892530018,213628.0892828741,0.11,6222704.0
Gate.io,"Gaming (GameFi), NFT, Kaia Ecosystem, Gaming Blockchains",bora,95056015,99426407.0,2049.3896344384457,1855.8945583071263,1.26,510874.0
Gate.io,"Infrastructure, Smart Contract Platform, Oracle, Layer 1 (L1), Animoca Brands Portfolio, Coinbase Ventures Portfolio, Cross-chain Communication, Made in USA",supra,95261883,847017549.0,21826.563311209185,32924.38534825192,0.2,15396022.0
Gate.io,"Artificial Intelligence (AI), Infrastructure, Smart Contract Platform, Oracle, Polkadot Ecosystem, Ethereum Ecosystem, Interoperability, Layer 2 (L2), Zero Knowledge (ZK), DePIN, DWF Labs Portfolio, Rollup, AI Agents, Sora Ecosystem, AI Framework, Made in USA",pha,94632095,120605761.0,107179.9366131929,118465.14858311624,0.07,20413890.0
