Gate.io,"Solana Ecosystem, Payment Solutions, Viction Ecosystem",saros-finance,94680936,360689305.0,912.3983389221388,8706.42641034904,1.03,999127.0
Gate.io,"Gaming (GameFi), NFT, Kaia Ecosystem, Gaming Blockchains",bora,94584822,98933549.0,1338.1012939479683,1704.667918514773,1.54,959033.0
Gate.io,"Fraxtal Ecosystem, Bridged-Tokens",l2-standard-bridged-frxusd,94334414,94334414.0,,,N/A,700233.0
Gate.io,"Infrastructure, Smart Contract Platform, Oracle, Layer 1 (L1), Animoca Brands Portfolio, Coinbase Ventures Portfolio, Cross-chain Communication, Made in USA",supra,93678554,832939436.0,21314.838667114473,18948.098436502492,0.14,4281062.0
Gate.io,"Artificial Intelligence (AI), Infrastructure, Smart Contract Platform, Oracle, Polkadot Ecosystem, Ethereum Ecosystem, Interoperability, Layer 2 (L2), Zero Knowledge (ZK), DePIN, DWF Labs Portfolio, Rollup, AI Agents, Sora Ecosystem, AI Framework, Made in USA",pha,93663955,119415179.0,121711.70565499057,122160.1469387809,0.1,24853150.0
Gate.io,"Gaming (GameFi), NFT, BNB Chain Ecosystem",infinitar-governance-token,93050934,460832968.0,1021.578077289921,2819.887599885785,0.8,7906169.0
Gate.io,"Smart Contract Platform, Layer 1 (L1), Zero Knowledge (ZK), Andreessen Horowitz (a16z) Portfolio, Privacy Blockchain, Made in USA",aleo,92999841,455682701.0,152534.72900754155,197391.25830999855,0.04,6213589.0
Gate.io,"Solana Ecosystem, Liquid Staking Tokens, Liquid Staked SOL, Liquid Staking",drift-staked-sol,92927492,92927492.0,,,N/A,37524.0
Gate.io,"NFT, Polygon Ecosystem, Ethereum Ecosystem, Optimism Ecosystem",blockv,92926857,92926857.0,,,N/A,155797.0
Gate.io,"Smart Contract Platform, Privacy, Layer 1 (L1), Proof of Stake (PoS), Proof of Work (PoW), Zano Ecosystem, Privacy Blockchain",zano,92264512,92266038.0,,,N/A,559579.0
Gate.io,"Artificial Intelligence (AI), Big Data, Media, BNB Chain Ecosystem, Polygon Ecosystem, Ethereum Ecosystem, GMCI DePIN Index, Galaxy Digital Portfolio, GMCI Index",everipedia,91423429,91423429.0,20204.386380061067,16748.2763222901,0.86,5088551.0
Gate.io,"Energy, Ethereum Ecosystem, Alleged SEC Securities, Energi Ecosystem, GMCI DePIN Index, Blockchain Capital Portfolio, GMCI Index",power-ledger,90682474,171091373.0,42401.96308836585,61065.860451032124,0.29,9398037.0
Gate.io,Layer 1 (L1),oec-token,90545234,90545234.0,25.191806715395753,1272.4176149284986,1.16,314656.0
Gate.io,"Decentralized Finance (DeFi), Yield Farming, BNB Chain Ecosystem, Binance Launchpool, Lending/Borrowing Protocols, Arbitrum Ecosystem, Ethereum Ecosystem, Optimism Ecosystem, ZkSync Ecosystem, opBNB Ecosystem, Unichain Ecosystem",venus,90175401,161774390.0,47912.020164152476,35247.30124272178,0.52,4578033.0
Gate.io,"Artificial Intelligence (AI), Oracle, Ethereum Ecosystem, DePIN, Energi Ecosystem, Sora Ecosystem, GMCI DePIN Index, GMCI Index",iexec-rlc,90112129,108309752.0,54979.07600954724,80328.36813618509,0.29,15586071.0
Gate.io,"Ethereum Ecosystem, DWF Labs Portfolio",adventure-gold,89832340,89832340.0,58330.11495928599,117697.87705858772,0.1,25145810.0
Gate.io,"Decentralized Exchange (DEX), Exchange-based Tokens, Decentralized Finance (DeFi), Yield Farming, Automated Market Maker (AMM), Avalanche Ecosystem, Polygon Ecosystem, Near Protocol Ecosystem, Gnosis Chain Ecosystem, Harmony Ecosystem, Arbitrum Ecosystem, Ethereum Ecosystem, Optimism Ecosystem, Base Ecosystem, Index Coop Defi Index, Alameda Research Portfolio, DeFiance Capital Portfolio, Pantera Capital Portfolio, Energi Ecosystem, Polygon zkEVM Ecosystem, Huobi ECO Chain Ecosystem, Blockchain Capital Portfolio, Index Coop Index",balancer,89391058,96665773.0,104856.65487627746,125251.4426603204,0.21,10440258.0
Gate.io,"Smart Contract Platform, Gaming (GameFi), Solana Ecosystem, Layer 2 (L2), Gaming Blockchains",sonic-svm,89245262,594968412.0,204350.22161069425,251361.52404976854,0.06,40942399.0
Gate.io,"SocialFi, Coinbase Ventures Portfolio, Pantera Capital Portfolio, Andreessen Horowitz (a16z) Portfolio, Sequoia Capital Portfolio",deso,89007143,91341613.0,255.96937332285472,604.7949691922217,2.27,8399870.0
Gate.io,"Crypto-Backed Tokens, BNB Chain Ecosystem, Arbitrum Ecosystem, Ethereum Ecosystem, Mantle Ecosystem",ignition-fbtc,88952460,1150834041.0,,,N/A,598642.0
Gate.io,"Decentralized Finance (DeFi), BNB Chain Ecosystem, Arbitrum Ecosystem, Ethereum Ecosystem, Multicoin Capital Portfolio, Energi Ecosystem",dforce-token,88952457,88952457.0,25736.816725407592,23911.071546157353,0.49,11158499.0
Gate.io,"Artificial Intelligence (AI), Infrastructure, Smart Contract Platform, Decentralized Finance (DeFi), Arbitrum Ecosystem, Ethereum Ecosystem, Zero Knowledge (ZK), DWF Labs Portfolio, Coinbase Ventures Portfolio, Pantera Capital Portfolio, Binance Labs Portfolio",marlin,88858754,108984700.0,34655.88733304875,49650.51421873276,0.41,9220937.0
Gate.io,"Solana Ecosystem, Liquid Staking Tokens, Restaking, Liquid Restaking Tokens, Liquid Staked SOL, Liquid Staking, Liquid Restaked SOL",solayer-staked-sol,88784207,88784207.0,,,N/A,468649.0
Gate.io,"DaoMaker Launchpad, Ethereum Ecosystem, Real World Assets (RWA), Sequoia Capital Portfolio, Made in USA",clearpool,88701166,116720361.0,8918.72038513384,15029.055139647533,0.58,3863318.0
Gate.io,"Gaming (GameFi), XDC Ecosystem",gama-coin,88680402,136431462.0,,,N/A,2259436.0
Gate.io,"Infrastructure, Smart Contract Platform, Decentralized Finance (DeFi), BNB Chain Ecosystem, Avalanche Ecosystem, Polygon Ecosystem, Fantom Ecosystem, Harmony Ecosystem, Arbitrum Ecosystem, Ethereum Ecosystem, DWF Labs Portfolio, Layer 3 (L3), Outlier Ventures Portfolio",orbs,88668004,194723361.0,12910.933557792385,14592.98123286799,0.1,9236174.0
Gate.io,"Infrastructure, Solana Ecosystem, Animoca Brands Portfolio, Cross-chain Communication, OKX Ventures Portfolio",zeus-network,87776917,229314751.0,47539.6399290081,50735.39254816043,0.3,8695694.0
Gate.io,"Cronos Ecosystem, Bridged USDT, Bridged-Tokens, Bridged Stablecoins",cronos-bridged-usdt-cronos,87617793,87617793.0,,,N/A,322149.0
Gate.io,"Smart Contract Platform, Ethereum Ecosystem, Layer 2 (L2), Zero Knowledge (ZK), Restaking, Zircuit Ecosystem",zircuit,86589898,394500762.0,68509.1783715882,129738.5412366545,0.05,42193214.0
Gate.io,"Smart Contract Platform, Layer 1 (L1)",ong,86111505,211087066.0,37210.34045017719,30095.67148360522,0.24,2649965.0
Gate.io,"Business Services, Polygon Ecosystem, Ethereum Ecosystem",request-network,86108885,111878425.0,32573.034044932032,26824.091675700314,0.09,7991562.0
Gate.io,"Stablecoins, USD Stablecoin, Ethereum Ecosystem, Sonic Ecosystem, Fiat-backed Stablecoin",frax-usd,86107722,86107722.0,,,N/A,3817560.0
Gate.io,"Decentralized Exchange (DEX), Decentralized Finance (DeFi), Arbitrum Ecosystem, Ethereum Ecosystem",tokenlon,85638956,103080716.0,,,N/A,80966.0
Gate.io,"Crypto-Backed Tokens, Ethereum Ecosystem",temple,85186336,85354157.0,,,N/A,3855.04
Gate.io,"Polygon Ecosystem, XRP Ledger Ecosystem",crypto-trading-fund,84926421,84926421.0,,,N/A,16549.96
Gate.io,"Smart Contract Platform, Bitcoin Sidechains, Stacks Ecosystem, SideChain",sbtc-2,84728478,84728478.0,,,N/A,45315.0
Gate.io,"Artificial Intelligence (AI), Smart Contract Platform, Gaming (GameFi), NFT, BNB Chain Ecosystem, Layer 1 (L1), Ethereum Ecosystem, Modular Blockchain, Chromia Ecosystem",chromaway,84561454,84561454.0,73128.85757446974,39264.2035941324,0.2,11152551.0
Gate.io,"NFT, Solana Ecosystem, NFT Marketplace",tensor,84443072,252364749.0,417453.756942612,439026.0506991055,0.08,14043462.0
Gate.io,"Smart Contract Platform, Polkadot Ecosystem, Layer 1 (L1), Coinbase Ventures Portfolio, Binance Labs Portfolio",moonbeam,83763569,102004229.0,59510.298960635235,123929.8285587477,0.11,4895806.0
Gate.io,"Smart Contract Platform, Gaming (GameFi), NFT, Layer 1 (L1), Play To Earn, Ethereum Ecosystem, Animoca Brands Portfolio, Gaming Blockchains, Pantera Capital Portfolio, OKX Ventures Portfolio",wax,83295259,89623137.0,3077.4416310264614,5136.471218586142,0.17,5542228.0
Gate.io,BNB Chain Ecosystem,bitdca,83151808,89311661.0,,,N/A,45436.0
Gate.io,"BNB Chain Ecosystem, Liquid Staking Tokens",astherus-staked-bnb,83020851,83020851.0,,,N/A,372.87
Gate.io,"Solana Ecosystem, Polygon Ecosystem, DePIN, Pantera Capital Portfolio",geodnet,82907673,258603029.0,37799.79891622806,33748.18067433996,0.03,225572.0
Gate.io,"Gaming (GameFi), Play To Earn, Ethereum Ecosystem, RPG, Alameda Research Portfolio, Circle Ventures Portfolio, OKX Ventures Portfolio, MMO",big-time,82828256,233559914.0,123611.38515653837,166290.29662164004,0.04,45514560.0
Gate.io,BNB Chain Ecosystem,metfi-2,82654316,193517877.0,152.44527577658423,145.47759887694906,1.38,401507.0
Gate.io,"Smart Contract Platform, Layer 2 (L2), eGirl Capital Portfolio, Paradigm Portfolio, Blast Ecosystem",blast,82522642,311884272.0,63468.75463850967,79316.19523841306,0.1,11634562.0
Gate.io,"Gaming (GameFi), NFT, BNB Chain Ecosystem, Metaverse, Collectibles, Polygon Ecosystem, Play To Earn, Harmony Ecosystem, Guild and Scholarship, Ethereum Ecosystem, Animoca Brands Portfolio, Base Ecosystem, DWF Labs Portfolio, Ronin Ecosystem, Andreessen Horowitz (a16z) Portfolio, Delphi Ventures Portfolio",yield-guild-games,82414550,200759684.0,150370.71027753426,162712.66930408916,0.05,15675399.0
Gate.io,Ethereum Ecosystem,dkargo,82100601,87589546.0,10.377918163809658,280.3161835388398,3.45,1202392.0
Gate.io,"Arbitrum Ecosystem, Bridge Governance Tokens, Base Ecosystem, Cross-chain Communication, OKX Ventures Portfolio",orbiter-finance,81677358,263475350.0,8453.337074041372,12070.516967050185,0.2,106633366.0
Gate.io,"Berachain Ecosystem, Bridged USDT, Bridged-Tokens, Ink Ecosystem, Bridged Stablecoins",usdt0,81427974,81427974.0,,,N/A,909195.0
Gate.io,"Artificial Intelligence (AI), Virtual Reality, Launchpad, Ethereum Ecosystem, Telegram Apps, Discord Bots, PAAL AI Launchpad, AI Agents, AI Applications, AI Agent Launchpad, Binance Alpha Spotlight, AI Framework, DeFAI, Made in USA",paal-ai,81332965,91486850.0,8937.695763016054,7029.437629304155,0.31,10951155.0
Gate.io,"Internet of Things (IOT), BNB Chain Ecosystem, Ethereum Ecosystem, DePIN, DWF Labs Portfolio",mass-vehicle-ledger,80546314,85139694.0,4551.644803019255,4325.077414408116,0.52,403652.0
Gate.io,"Exchange-based Tokens, Centralized Exchange (CEX) Token, Ethereum Ecosystem",hashkey-ecopoints,80494217,607503523.0,64581.12009745438,89666.06666326291,0.33,3559826.0
Gate.io,"Decentralized Exchange (DEX), Decentralized Finance (DeFi), Yield Farming, Automated Market Maker (AMM), Solana Ecosystem, Coinbase Ventures Portfolio, DeFiance Capital Portfolio, Made in USA",orca,80200255,150535717.0,47963.36710147025,52175.535965230025,0.07,27008360.0
Gate.io,"Gaming (GameFi), Play To Earn, Guild and Scholarship, Ethereum Ecosystem, Animoca Brands Portfolio, Base Ecosystem, DWF Labs Portfolio, Ronin Ecosystem, Coinbase Ventures Portfolio, DeFiance Capital Portfolio, Pantera Capital Portfolio, Binance Labs Portfolio, MMO",zentry,80148765,117662134.0,71607.6089691629,53313.17909617995,0.41,9710464.0
Gate.io,"Meme, Ethereum Ecosystem, PolitiFi",constitutiondao,80007542,80007542.0,277526.1119048899,254073.61986853782,0.06,35473646.0
Gate.io,"Stablecoins, Decentralized Finance (DeFi), Lending/Borrowing Protocols, Ethereum Ecosystem",syrupusdc,79288548,79288548.0,,,N/A,251210.0
Gate.io,"Stablecoins, USD Stablecoin, Solana Ecosystem, Ethereum Ecosystem, Multicoin Capital Portfolio, Fiat-backed Stablecoin",paxos-standard,79274305,79274305.0,1355276.174540871,1701770.9936707057,0.04,3912376.0
Gate.io,"Artificial Intelligence (AI), BNB Chain Ecosystem, Solana Ecosystem, Ethereum Ecosystem, AI Agents, Alameda Research Portfolio",delysium,78876511,150587474.0,30370.695026183294,35598.71789561756,0.02,3006803.0
Gate.io,"Smart Contract Platform, Privacy, Proof of Work (PoW), Made in USA",verge,78750073,78907597.0,,,N/A,7502551.0
Gate.io,"Smart Contract Platform, Proof of Stake (PoS)",stratis,78440081,86428006.0,10985.350527978668,6676.56006686921,1.07,1836664.0
Gate.io,"Blast Ecosystem, Bridged WETH, Bridged-Tokens",l2-standard-bridged-weth-blast,78419249,78419249.0,,,N/A,234403.0
Gate.io,"Exchange-based Tokens, Centralized Exchange (CEX) Token, Near Protocol Ecosystem, Harmony Ecosystem, Ethereum Ecosystem, Multicoin Capital Portfolio, Alameda Research Portfolio, Elastos Smart Contract Chain Ecosystem, Sequoia Capital Portfolio, Made in China",huobi-token,78261489,98706854.0,473.638474763449,11.023275396993101,1.71,11206.2
Gate.io,"Software as a service, Polygon Ecosystem, Ethereum Ecosystem, Decentralized Identifier (DID), Pantera Capital Portfolio, Energi Ecosystem, Blockchain Capital Portfolio",civic,78190988,97494997.0,95989.82451539484,104151.14150558485,0.09,9022207.0
Gate.io,"Smart Contract Platform, Cosmos Ecosystem, Modular Blockchain, Osmosis Ecosystem, Rollups-as-a-Service (RaaS)",dymension,77992191,310504564.0,189168.12373447348,164670.46656165321,0.26,8622519.0
Gate.io,"Artificial Intelligence (AI), Smart Contract Platform, Decentralized Finance (DeFi), Analytics, NFT, BNB Chain Ecosystem, Launchpad, Ethereum Ecosystem, Telegram Apps, Discord Bots, ChainGPT Launchpad, Poolz Finance Launchpad, AI Agents, AI Applications, Binance Alpha Spotlight, AI Framework, DeFAI",chaingpt,77824499,96625897.0,60101.93015173929,43859.515180111106,0.15,28816995.0
Gate.io,"Ethereum Ecosystem, Stablecoin Protocol",level-usd,77378847,77378847.0,,,N/A,617489.0
Gate.io,"Stablecoins, USD Stablecoin, Osmosis Ecosystem, Fiat-backed Stablecoin",usdx,77187691,77187691.0,,,N/A,29930.0
Gate.io,"Stablecoins, USD Stablecoin, BNB Chain Ecosystem, Fantom Ecosystem, Arbitrum Ecosystem, Ethereum Ecosystem, Optimism Ecosystem, Base Ecosystem, Crypto-backed Stablecoin, Fiat-backed Stablecoin",dola-usd,76857855,203691992.0,,,N/A,4565196.0
Gate.io,"Decentralized Finance (DeFi), Wallets, Ethereum Ecosystem, Pundi AIFX Omnilayer Ecosystem",pundi-x-2,76842752,76842752.0,42382.04476860788,27571.479852035598,0.61,9919520.0
Gate.io,"Optimism Ecosystem, Bridged WBTC, Bridged-Tokens",optimism-bridged-wbtc-optimism,76357097,76357097.0,,,N/A,1202801.0
Gate.io,"Artificial Intelligence (AI), Infrastructure, Ethereum Ecosystem, AI Framework, Made in USA",arcblock,75828635,143072896.0,1009.5328575247422,2100.9171693035473,0.26,552212.0
Gate.io,"Business Services, Decentralized Finance (DeFi), Oracle, Polygon Ecosystem, Gnosis Chain Ecosystem, Arbitrum Ecosystem, Ethereum Ecosystem, Optimism Ecosystem, Manta Network Ecosystem, Binance Labs Portfolio, Lisk Ecosystem, Made in USA",tellor,75810175,78016166.0,147368.21119666708,166648.23631049998,0.03,23464597.0
Gate.io,"Sports, BNB Chain Ecosystem",pixer-eternity,75564857,351157061.0,,,N/A,316643.0
Gate.io,"Smart Contract Platform, Wallets, Layer 2 (L2), Osmosis Ecosystem",islamic-coin,75471958,911693873.0,272.9253228467532,239.0132996183845,0.88,1181627.0
Gate.io,"Smart Contract Platform, Layer 1 (L1), Osmosis Ecosystem, XRP Ledger Ecosystem",coreum,74985007,74985007.0,6762.662436363122,1526.8896078180937,0.54,416169.0
Gate.io,"BNB Chain Ecosystem, Solana Ecosystem, Polygon Ecosystem, Meme, Ethereum Ecosystem, Cronos Ecosystem, Dog-Themed, Elon Musk-Inspired, Fuse Ecosystem",dogelon-mars,74917072,136299602.0,200263.6173319995,203653.62559116617,0.26,9417644.0
Gate.io,Smart Contract Platform,songbird,74317314,88305666.0,1002.5888256258216,1370.0155658266324,0.55,393780.0
Gate.io,"Exchange-based Tokens, Centralized Exchange (CEX) Token, Ethereum Ecosystem",bitmart-token,74065739,139531072.0,,,N/A,4123644.0
Gate.io,Retail,milk-alliance,73735027,165526541.0,171.40180700737469,352.68717972052,1.02,8060528.0
Gate.io,"Meme, Ethereum Ecosystem, Mantle Ecosystem",puff-the-dragon,73559325,73559325.0,3252.0169817855253,1618.6065398706219,1.61,87651.0
Gate.io,"Smart Contract Platform, Gaming (GameFi), Layer 1 (L1), Proof of Stake (PoS), Gaming Blockchains",oasys,73462067,190423952.0,1300.0313167358647,1327.314377272405,1.57,559989.0
Gate.io,"Optimism Ecosystem, Bridged WETH, Bridged-Tokens",l2-standard-bridged-weth-optimism,73355682,73355682.0,,,N/A,34016879.0
Gate.io,"Entertainment, Gaming (GameFi), NFT, Axie Infinity Ecosystem, Play To Earn, Ethereum Ecosystem, Ronin Ecosystem, Gaming Utility Token",smooth-love-potion,72829170,72829170.0,41574.30022778917,26539.900319636294,0.11,8256434.0
Gate.io,"Artificial Intelligence (AI), BNB Chain Ecosystem, Ethereum Ecosystem, DragonFly Capital Portfolio, Binance Labs Portfolio, Delphi Ventures Portfolio, OKX Ventures Portfolio, Binance HODLer Airdrops, AI Agent Launchpad, Binance Alpha Spotlight, AI Framework",myshell,72444830,268314184.0,18461.078217601054,22765.921640432236,0.06,46752970.0
Gate.io,"Decentralized Exchange (DEX), Decentralized Finance (DeFi), Yield Farming, Automated Market Maker (AMM), BNB Chain Ecosystem, Avalanche Ecosystem, Arbitrum Ecosystem, Mantle Ecosystem, DeFiance Capital Portfolio, Delphi Ventures Portfolio, Dex Aggregator",joe,72301848,92591063.0,64265.188160853584,42010.968972805655,0.11,8707601.0
Gate.io,"Gaming (GameFi), Play To Earn, TON Ecosystem, Tap to Earn, Arcade Games",watcoin-2,72269386,80232037.0,,,N/A,837467.0
Gate.io,"Decentralized Finance (DeFi), Lending/Borrowing Protocols, Moonbeam Ecosystem, Base Ecosystem, Coinbase Ventures Portfolio, Made in USA",moonwell-artemis,72114377,109965652.0,3304.715215835551,7725.57741730359,0.23,33012630.0
Gate.io,"Decentralized Finance (DeFi), Ethereum Ecosystem, Binance Alpha Spotlight",avalon-2,71231605,439023760.0,42308.80637719119,28659.004640014726,0.05,128777492.0
Gate.io,"Smart Contract Platform, Polkadot Ecosystem, Layer 1 (L1), DePIN, Outlier Ventures Portfolio",peaq-2,71208200,419085793.0,58691.96354244463,49370.032220517416,0.08,11597043.0
Gate.io,"Stablecoins, Decentralized Finance (DeFi), USD Stablecoin, BNB Chain Ecosystem, Polygon Ecosystem, Gnosis Chain Ecosystem, Arbitrum Ecosystem, Ethereum Ecosystem, Optimism Ecosystem, Base Ecosystem, Crypto-backed Stablecoin, Fiat-backed Stablecoin",crvusd,71164187,71164187.0,,,N/A,7608936.0
Gate.io,"Decentralized Finance (DeFi), Solana Ecosystem, Real World Assets (RWA), Payment Solutions, DePIN, Coinbase Ventures Portfolio, Alameda Research Portfolio, Circle Ventures Portfolio, OKX Ventures Portfolio, RWA Protocol, Made in USA",zebec-network,70927798,95720483.0,3691.0671651617813,9064.273716987169,0.13,32785561.0
Gate.io,"Ethereum Ecosystem, DePIN",dent,70816302,74033068.0,26019.320871037457,33051.93072904311,0.58,5746857.0
Gate.io,"Decentralized Finance (DeFi), Ethereum Ecosystem",elixir-finance,70745391,443102553.0,79414.54062177149,71253.0711388348,0.14,46682741.0
Gate.io,"Decentralized Finance (DeFi), Oracle, Ethereum Ecosystem, DWF Labs Portfolio, Pantera Capital Portfolio",api3,70265053,87687720.0,38189.13817924505,38579.22420287718,0.24,13686259.0
Gate.io,"Smart Contract Platform, Gaming (GameFi), NFT, Binance Launchpool, Arbitrum Ecosystem, Layer 3 (L3), XAI Ecosystem, Gaming Blockchains, Outlier Ventures Portfolio",xai-blockchain,70058858,103138150.0,119954.89046427122,99453.96893646389,0.02,28803277.0
Gate.io,"Artificial Intelligence (AI), Decentralized Finance (DeFi), Solana Ecosystem, Arbitrum Ecosystem, Metis Ecosystem, AI Agents, Sonic Ecosystem, IOTA EVM Ecosystem, AI Applications, DeFAI",heyanon,70046078,115370744.0,365.78716305322274,345.06054176401136,0.73,4584495.0
Gate.io,"Decentralized Finance (DeFi), Lending/Borrowing Protocols, Ethereum Ecosystem, Real World Assets (RWA), Coinbase Ventures Portfolio, Andreessen Horowitz (a16z) Portfolio, RWA Protocol, Made in USA",goldfinch,69921271,86488717.0,280.70138332291583,1731.3370816837876,0.33,366010.0
Gate.io,"Decentralized Exchange (DEX), Exchange-based Tokens, Decentralized Finance (DeFi), BNB Chain Ecosystem, Binance Launchpool, Polygon Ecosystem, Near Protocol Ecosystem, Arbitrum Ecosystem, Ethereum Ecosystem, DWF Labs Portfolio, Coinbase Ventures Portfolio, Alameda Research Portfolio, DeFiance Capital Portfolio, Pantera Capital Portfolio, Aurora Ecosystem, Energi Ecosystem, Binance Labs Portfolio, Galaxy Digital Portfolio",dodo,69878760,69878760.0,20802.173432230662,16622.321052523017,0.21,5451784.0
Gate.io,"Gaming (GameFi), NFT, Collectibles, Play To Earn, Ethereum Ecosystem, Base Ecosystem, Energi Ecosystem",ecomi,69870161,80167109.0,5956.215578920491,6508.290540813192,0.46,2249427.0
Gate.io,"Artificial Intelligence (AI), Cardano Ecosystem, Ethereum Ecosystem, AI Agents, Sora Ecosystem",singularitynet,69670196,105269574.0,,,N/A,91720.0
Gate.io,"Tokenized Assets, Polygon Ecosystem, Arbitrum Ecosystem, Ethereum Ecosystem, Real World Assets (RWA), Starknet Ecosystem, Tokenized Treasury Bills (T-Bills)",spiko-us-t-bills-money-market-fund,69530892,69530892.0,,,N/A,0.0
Gate.io,"Lending/Borrowing Protocols, Solana Ecosystem, FTX Holdings, Coinbase Ventures Portfolio, Alameda Research Portfolio, DragonFly Capital Portfolio",solend,69360419,137087973.0,0.0,0.0,14.08,4555.72
Gate.io,"Meme, Dog-Themed, TON Ecosystem, TON Meme",dogs-2,69346888,73808976.0,141842.2064282524,190049.8562358366,0.07,15050661.0
Gate.io,"Artificial Intelligence (AI), Ethereum Ecosystem",0x0-ai-ai-smart-contract,69220346,69220346.0,,,N/A,206822.0
Gate.io,"Stablecoins, USD Stablecoin, Seigniorage, Alleged SEC Securities, Osmosis Ecosystem, Stablecoin Protocol, DeFiance Capital Portfolio, Terra Classic Ecosystem, Binance Labs Portfolio, Delphi Ventures Portfolio, Galaxy Digital Portfolio, Fiat-backed Stablecoin",terrausd,68754913,97409129.0,26817.892516165335,33909.50810856188,0.15,7513699.0
Gate.io,"Decentralized Finance (DeFi), Lending/Borrowing Protocols, Arbitrum Ecosystem, Ethereum Ecosystem, Alameda Research Portfolio, Pantera Capital Portfolio",liquity,68679320,70606169.0,331388.12454206,396243.24190787046,0.08,15867741.0
Gate.io,"Artificial Intelligence (AI), Solana Ecosystem, DePIN",nosana,68678121,82347867.0,1076.010578191006,1812.1548279562721,0.49,542833.0
Gate.io,"Artificial Intelligence (AI), Business Services, Decentralized Finance (DeFi), Ethereum Ecosystem, Paradigm Portfolio, DragonFly Capital Portfolio, Energi Ecosystem",numeraire,68579643,91839304.0,32217.21429300572,39378.631651742675,0.06,6490955.0
Gate.io,"Smart Contract Platform, Layer 1 (L1), DWF Labs Portfolio, Radix Ecosystem",radix,68539803,83926445.0,7464.671057297484,7983.3189278037225,0.11,1243886.0
Gate.io,"Stablecoins, Decentralized Finance (DeFi), USD Stablecoin, BNB Chain Ecosystem, Avalanche Ecosystem, Arbitrum Ecosystem, Liquid Staking Tokens, Ethereum Ecosystem, Optimism Ecosystem, Fiat-backed Stablecoin",staked-frax,68151382,68151382.0,,,N/A,91.2
Gate.io,"Smart Contract Platform, Ethereum Ecosystem, Layer 2 (L2), Zero Knowledge (ZK), Rollup, OKX Ventures Portfolio",taiko,67493290,638261822.0,169767.5704544892,180065.19509024927,0.02,16294063.0
Gate.io,"Solana Ecosystem, Wallets, Base Ecosystem, TON Ecosystem",bitget-wallet-token,67182897,470072637.0,,,N/A,3631.06
Gate.io,"Decentralized Finance (DeFi), Ethereum Ecosystem, Restaking",kelp-gain,67028188,67028188.0,,,N/A,439681.0
Gate.io,"Decentralized Finance (DeFi), Lending/Borrowing Protocols, Solana Ecosystem, Binance Alpha Spotlight",kamino,66883605,495434113.0,185036.18429044072,201867.5818587938,0.02,7708965.0
Gate.io,Ethereum Ecosystem,saasgo,66475137,83093922.0,2369.3237068751528,4311.183447524854,0.22,280008.0
Gate.io,"Artificial Intelligence (AI), Smart Contract Platform, Layer 1 (L1), Ethereum Ecosystem, Osmosis Ecosystem, AI Agents, AI Agent Launchpad",humans-ai,66058443,66058443.0,2556.259557271614,543.4305172515764,0.59,275067.0
Gate.io,SocialFi,steem,65766439,65795772.0,139882.94602626024,140009.03006428017,0.23,12755664.0
Gate.io,"Artificial Intelligence (AI), Launchpad, Base Ecosystem, AI Applications, Clanker Ecosystem, Binance Alpha Spotlight",tokenbot-2,65355757,65355757.0,721.1868477133937,2221.428439438886,1.01,7218141.0
Gate.io,"Smart Contract Platform, Binance Launchpool, Layer 2 (L2), Scroll Ecosystem",scroll,65351515,343955341.0,141377.31486500127,323165.60908185627,0.03,15583656.0
Gate.io,"BNB Chain Ecosystem, Binance Megadrop, BTCfi",solv-protocol,65293210,369933199.0,40123.55991355702,59782.254539486246,0.09,115256050.0
Gate.io,"Smart Contract Platform, Layer 1 (L1), Ethereum Ecosystem, Proof of Stake (PoS)",pundi-aifx,65259868,65259868.0,,,N/A,321039.0
Gate.io,E-commerce,pay-coin,64797837,120397738.0,,,N/A,2766248.0
Gate.io,"Decentralized Finance (DeFi), Liquid Staking Tokens, Ethereum Ecosystem, LSDFi, Liquid Staked ETH, Liquid Staking",origin-ether,64755357,64755357.0,,,N/A,67430.0
Gate.io,"Smart Contract Platform, Layer 1 (L1), Proof of Work (PoW), Privacy Blockchain",ergo,64658543,78944998.0,651.4396545822299,1342.210463764037,0.46,84258.0
Gate.io,"Decentralized Exchange (DEX), Decentralized Finance (DeFi), Sui Ecosystem, Animoca Brands Portfolio, OKX Ventures Portfolio, Dex Aggregator",cetus-protocol,64539022,94531694.0,131969.4791066665,107731.62927801447,0.12,12938368.0
Gate.io,"Healthcare, Osmosis Ecosystem",medibloc,64354867,69705235.0,1907.8748176820936,2107.735015544347,1.36,296970.0
Gate.io,"Solana Ecosystem, Restaking, Liquid Restaking Tokens, Liquid Restaked SOL",renzo-restaked-sol,64189729,64189729.0,,,N/A,1500313.0
Gate.io,"Stablecoins, USD Stablecoin, Fiat-backed Stablecoin",falcon-finance,64174757,64174757.0,,,N/A,23942.0
Gate.io,"Decentralized Finance (DeFi), BNB Chain Ecosystem, Solana Ecosystem, Wallets, Polygon Ecosystem, Ethereum Ecosystem, Binance Launchpad, DWF Labs Portfolio, Multicoin Capital Portfolio, Alameda Research Portfolio, Viction Ecosystem, Binance Labs Portfolio",coin98,64132448,71192368.0,99115.66225729899,103614.60203694795,0.28,27691087.0
Gate.io,,ark,63654479,64203257.0,41351.07413004649,43600.96584512597,0.35,6436360.0
Gate.io,"Artificial Intelligence (AI), BNB Chain Ecosystem, Ethereum Ecosystem, DePIN, AI Agents",netmind-token,63564834,202211090.0,1608.8537213151255,2913.3923593150175,0.5,1970825.0
