Gate.io,"Artificial Intelligence (AI), Smart Contract Platform, DePIN, Osmosis Ecosystem, Proof of Stake (PoS), Archway Ecosystem, Made in USA",akash-network,327633624,328752626.0,47078.68747980633,62445.28941532982,0.08,6759498.0
Gate.io,"Smart Contract Platform, Zero Knowledge (ZK), FTX Holdings, Paradigm Portfolio, Coinbase Ventures Portfolio, Multicoin Capital Portfolio, Proof of Stake (PoS), Pantera Capital Portfolio, Circle Ventures Portfolio, Privacy Blockchain, Polychain Capital Portfolio, Made in USA, Coinbase 50 Index",mina-protocol,328692896,328693866.0,161036.81096866907,186454.09613311195,0.04,14483231.0
Gate.io,"Decentralized Exchange (DEX), Smart Contract Platform, Decentralized Finance (DeFi), Prediction Markets, Layer 1 (L1), Gnosis Chain Ecosystem, MEV Protection, Arbitrum Ecosystem, Ethereum Ecosystem, SideChain, Energi Ecosystem",gnosis,325357494,376921775.0,63313.70647165479,76328.88938280546,0.16,15134841.0
Gate.io,"Stablecoins, USD Stablecoin, BNB Chain Ecosystem, Avalanche Ecosystem, Polygon Ecosystem, Optimism Ecosystem, Fiat-backed Stablecoin, Binance-Peg Tokens",binance-peg-busd,324503710,324503710.0,,,N/A,4085419.0
Gate.io,"Decentralized Finance (DeFi), Arbitrum Ecosystem, Ethereum Ecosystem, Real World Assets (RWA), Base Ecosystem, Coinbase Ventures Portfolio, Energi Ecosystem, Made in USA",reserve-rights-token,323072666,577950209.0,103970.70228030931,233905.08776916203,0.07,20527086.0
Gate.io,"Smart Contract Platform, Layer 1 (L1), MEV Protection, Proof of Work (PoW), Privacy Blockchain",verus-coin,311020241,311020946.0,,,N/A,4732.47
Gate.io,"Decentralized Finance (DeFi), Lending/Borrowing Protocols, Ethereum Ecosystem, Base Ecosystem, Coinbase Ventures Portfolio, Pantera Capital Portfolio, Morpho Ecosystem, Binance Alpha Spotlight",morpho,311371947,1319103078.0,178339.06930440626,180043.06424058566,0.02,8764238.0
Gate.io,"Smart Contract Platform, Layer 1 (L1), Ethereum Ecosystem, Real World Assets (RWA), RWA Protocol, Made in USA",plume,309950020,1549750099.0,69415.91157399885,71613.36845520532,0.2,16554826.0
Gate.io,"Yield Aggregator, Ethereum Ecosystem, Binance Labs Portfolio, Polychain Capital Portfolio",stakestone-berachain-vault-token,307376817,307376817.0,,,N/A,678464.0
Gate.io,"Decentralized Finance (DeFi), Tron Ecosystem",just,296882104,296882104.0,144871.60874218118,169707.1734185017,0.13,9652145.0
Gate.io,"Artificial Intelligence (AI), Ethereum Ecosystem, DePIN, Energi Ecosystem, GMCI DePIN Index, GMCI Index",golem,291260999,291260999.0,70846.91337938841,75114.94254322739,0.21,13191034.0
Gate.io,"Decentralized Exchange (DEX), Exchange-based Tokens, Decentralized Finance (DeFi), Yield Farming, Derivatives, Synthetic Issuer, Avalanche Ecosystem, Polygon Ecosystem, Near Protocol Ecosystem, Fantom Ecosystem, Harmony Ecosystem, Ethereum Ecosystem, Optimism Ecosystem, Base Ecosystem, DWF Labs Portfolio, Paradigm Portfolio, Coinbase Ventures Portfolio, Index Coop Defi Index, Energi Ecosystem, Huobi ECO Chain Ecosystem, GMCI DeFi Index, Synthetic, Index Coop Index, GMCI Index, Coinbase 50 Index",havven,288367933,288727798.0,213886.13978366728,310925.7925226044,0.14,20603912.0
Gate.io,"Solana Ecosystem, Arbitrum Ecosystem, Impossible Finance Launchpad, Ethereum Ecosystem, DePIN, Animoca Brands Portfolio",aethir,287307912,1527590754.0,341914.6275766676,294056.82028283377,0.06,20115560.0
Gate.io,"Polygon Ecosystem, Bridged WETH, Bridged-Tokens",polygon-pos-bridged-weth-polygon-pos,279328444,279328444.0,,,N/A,7164879.0
Gate.io,"Crypto-Backed Tokens, Wrapped-Tokens, Polygon Ecosystem, Arbitrum Ecosystem, Liquid Staking Tokens, Ethereum Ecosystem, Optimism Ecosystem, Base Ecosystem, Liquid Staked ETH, Liquid Staking",coinbase-wrapped-staked-eth,284118242,787157806.0,,,N/A,4526718.0
Gate.io,"Smart Contract Platform, Privacy, Masternodes, Alleged SEC Securities, Proof of Stake (PoS), Proof of Work (PoW), Made in USA",dash,283275779,283284781.0,,,N/A,32594495.0
Gate.io,"Infrastructure, Ethereum Ecosystem, Data Availability, Restaking, Polychain Capital Portfolio, Made in USA",eigenlayer,282315047,1978628051.0,371274.9778322601,439192.8844596014,0.17,26998599.0
Gate.io,"Decentralized Exchange (DEX), Exchange-based Tokens, Decentralized Finance (DeFi), Automated Market Maker (AMM), BNB Chain Ecosystem, Avalanche Ecosystem, Polygon Ecosystem, Near Protocol Ecosystem, Harmony Ecosystem, Ethereum Ecosystem, FTX Holdings, Alameda Research Portfolio, DragonFly Capital Portfolio, Pantera Capital Portfolio, Energi Ecosystem, Binance Labs Portfolio, GMCI DeFi Index, Galaxy Digital Portfolio, Blockchain Capital Portfolio, Dex Aggregator, GMCI Index, Coinbase 50 Index",1inch,279259211,304130032.0,88955.66390655881,149476.05863115453,0.05,16347495.0
Gate.io,"BNB Chain Ecosystem, Wallets, Ethereum Ecosystem, Animoca Brands Portfolio, Binance Launchpad, Energi Ecosystem, Binance Labs Portfolio",safepal,275701756,275701756.0,70568.07057578777,98383.55686658573,0.04,8193559.0
Gate.io,"Smart Contract Platform, Polkadot Ecosystem, Proof of Stake (PoS), Pantera Capital Portfolio, Made in USA, Coinbase 50 Index",kusama,275905486,275906550.0,55310.25533209566,142892.22091207877,0.06,7834726.0
Gate.io,"Smart Contract Platform, BNB Chain Ecosystem, Avalanche Ecosystem, Polygon Ecosystem, Arbitrum Ecosystem, Ethereum Ecosystem, Optimism Ecosystem, Base Ecosystem, Multicoin Capital Portfolio, Layer 0 (L0), Cross-chain Communication, Circle Ventures Portfolio, Sequoia Capital Portfolio, OKX Ventures Portfolio",layerzero,271925031,2446406195.0,613282.1492411814,982293.2893273116,0.04,373960286.0
Gate.io,"Liquid Staking Tokens, Ethereum Ecosystem, Liquid Staking",stader-ethx,271578240,271578240.0,,,N/A,75945.0
Gate.io,"Smart Contract Platform, Ethereum Ecosystem, Real World Assets (RWA), DWF Labs Portfolio, Proof of Stake (PoS)",creditcoin-2,271480815,374959643.0,76680.4052957948,104753.46644649179,0.08,9558558.0
Gate.io,"Polygon Ecosystem, Bridged WBTC, Bridged-Tokens",polygon-bridged-wbtc-polygon-pos,270662479,270662479.0,,,N/A,3443919.0
Gate.io,"Smart Contract Platform, Layer 2 (L2), Zero Knowledge (ZK), ZkSync Ecosystem, Consensys Portfolio, Blockchain Capital Portfolio, OKX Ventures Portfolio",zksync,266655972,1523748414.0,208932.76373019835,309782.28546976286,0.04,33323521.0
Gate.io,"Smart Contract Platform, DePIN, Proof of Stake (PoS), Made in USA",theta-fuel,262826409,262840834.0,23640.317123695928,24851.949199527924,0.57,1626188.0
Gate.io,"Solana Ecosystem, Arbitrum Ecosystem, Ethereum Ecosystem, Interoperability, Base Ecosystem, Multicoin Capital Portfolio, Cross-chain Communication, Made in USA",wormhole,262380356,902795000.0,468242.7647262748,584030.8576773349,0.11,32347515.0
Gate.io,"Stablecoins, USD Stablecoin, Ethereum Ecosystem, Fiat-backed Stablecoin",elixir-deusd,259983673,259983673.0,,,N/A,28941486.0
Gate.io,"Decentralized Finance (DeFi), Ethereum Ecosystem, Restaking, Liquid Restaking Tokens, Liquid Staking",ether-fi-staked-btc,259262483,259262483.0,,,N/A,62985.0
Gate.io,"Crypto-Backed Tokens, Decentralized Finance (DeFi), cToken, Ethereum Ecosystem",compound-wrapped-btc,258703305,258703305.0,,,N/A,0.0
Gate.io,"Smart Contract Platform, Gaming (GameFi), NFT, Layer 1 (L1), Play To Earn, Gaming Blockchains, WEMIX Ecosystem",wemix-token,257789451,331473170.0,2893.9155117484574,8370.913453995672,0.19,3894008.0
Gate.io,"Exchange-based Tokens, Centralized Exchange (CEX) Token, Ethereum Ecosystem, Morph L2 Ecosystem",mx-token,258850736,1140559145.0,,,N/A,11826540.0
Gate.io,"BRC-20, Bitcoin Ecosystem, Inscriptions",sats-ordinals,256919718,256919718.0,120175.45316174415,222204.4381783893,0.03,4449341.0
Gate.io,"Stablecoins, USD Stablecoin, BNB Chain Ecosystem, Avalanche Ecosystem, Near Protocol Ecosystem, Arbitrum Ecosystem, Ethereum Ecosystem, Tron Ecosystem, BitTorrent Ecosystem, Algorithmic Stablecoin, Fiat-backed Stablecoin",usdd,254593307,254593307.0,1737.8279241891246,39352.73025984831,0.3,4986583.0
Gate.io,"Arbitrum Ecosystem, Liquid Staking Tokens, Ethereum Ecosystem, Liquid Staking",sweth,254038468,254045551.0,,,N/A,114755.0
Gate.io,"Gaming (GameFi), Binance Launchpool, Meme, Play To Earn, TON Ecosystem, TON Meme, Tap to Earn",notcoin,253122312,253122312.0,280146.56450528203,349511.26597322803,0.08,318456792.0
Gate.io,"Stablecoins, Tokenized Assets, Tokenized Gold, BNB Chain Ecosystem, Real World Assets (RWA), Tokenized Commodities, Commodity-backed Stablecoin",quorium,250786069,250786069.0,,,N/A,95615.0
Gate.io,"Decentralized Finance (DeFi), BNB Chain Ecosystem, Polygon Ecosystem, Fantom Ecosystem, Arbitrum Ecosystem, Moonbeam Ecosystem, Liquid Staking Tokens, Ethereum Ecosystem, Optimism Ecosystem, Polygon zkEVM Ecosystem, Liquid Staking, Made in USA",frax-ether,249529401,249529401.0,,,N/A,877643.0
Gate.io,"Decentralized Finance (DeFi), Solana Ecosystem, LSDFi, Restaking, Stablecoin Protocol, Binance Labs Portfolio, Binance HODLer Airdrops, Polychain Capital Portfolio",solayer,245386828,1168508702.0,307589.25067726045,349746.58578649245,0.19,113194565.0
Gate.io,"Meme, Cardano Ecosystem",snek,246055091,249195114.0,14111.22455937225,21172.293159465677,0.2,1104717.0
Gate.io,"Bridged USDC, Sonic Ecosystem, Bridged-Tokens, Bridged Stablecoins",sonic-bridged-usdc-e-sonic,245330843,245330843.0,,,N/A,41229459.0
Gate.io,"Decentralized Finance (DeFi), Solana Ecosystem, Liquid Staking Tokens, Liquid Staked SOL, Liquid Staking",bybit-staked-sol,244713676,244713676.0,,,N/A,1511851.0
Gate.io,"Infrastructure, Decentralized Finance (DeFi), Sui Ecosystem",deep,244364773,977459094.0,61918.95845655357,221773.96570987417,0.01,15547324.0
Gate.io,"Smart Contract Platform, BNB Chain Ecosystem, GMCI Layer 1 Index, GMCI Index, Made in China",zilliqa,243539939,252002491.0,88637.71220385592,194153.56928547495,0.08,9817575.0
Gate.io,"NFT, Ethereum Ecosystem, NFT Marketplace, FTX Holdings, NFTFi, eGirl Capital Portfolio, Paradigm Portfolio, GMCI DeFi Index, GMCI Index, Made in USA, Coinbase 50 Index",blur,242922530,324217658.0,200135.2247677204,290130.8139295219,0.09,18243409.0
Gate.io,"Smart Contract Platform, Polkadot Ecosystem, Layer 1 (L1), Layer 2 (L2), Alameda Research Portfolio, Binance Labs Portfolio, OKX Ventures Portfolio",astar,242769284,266923666.0,476398.81093636417,460058.04773777066,0.06,3435800.0
Gate.io,"Smart Contract Platform, Proof of Stake (PoS), Made in China",qtum,237161129,242238240.0,63333.17063857187,104412.30012193858,0.09,19166323.0
Gate.io,"Infrastructure, Wallets, Gnosis Chain Ecosystem, Ethereum Ecosystem",safe,235135683,424711479.0,124169.08532423203,147307.07914574043,0.07,13555196.0
Gate.io,"Smart Contract Platform, Gaming (GameFi), Ethereum Ecosystem, Base Ecosystem, Card Games, Paradigm Portfolio, Gaming Blockchains, Gaming Utility Token",echelon-prime,234881303,463758346.0,72929.32875932558,96704.70314861144,0.05,7360751.0
Gate.io,"Decentralized Finance (DeFi), Liquid Staking Tokens, Base Ecosystem, Liquid Staked ETH, Liquid Staking",super-oeth,233446955,233446955.0,,,N/A,74826.0
Gate.io,"Oracle, Ethereum Ecosystem",redstone-oracles,231476573,826702045.0,213068.98800689456,369355.4348008578,0.11,333638817.0
Gate.io,"Smart Contract Platform, Interoperability, Layer 2 (L2), Rollup, Multicoin Capital Portfolio, Proof of Work (PoW), DragonFly Capital Portfolio, Sequoia Capital Portfolio, Blockchain Capital Portfolio, Polychain Capital Portfolio, Made in China",nervos-network,230970924,234619851.0,162217.08614076985,164693.9727854952,0.1,11479697.0
Gate.io,"Decentralized Exchange (DEX), Exchange-based Tokens, Decentralized Finance (DeFi), Derivatives, Perpetuals, Ethereum Ecosystem, Paradigm Portfolio",dydx,230560413,230560413.0,,,N/A,10106543.0
Gate.io,"Solana Ecosystem, Avalanche Ecosystem, Polygon Ecosystem, Near Protocol Ecosystem, Harmony Ecosystem, Ethereum Ecosystem, Pantera Capital Portfolio, Energi Ecosystem, Made in USA",basic-attention-token,226936356,227593592.0,29686.251063002117,45879.869277843056,0.26,15334799.0
Gate.io,"Artificial Intelligence (AI), Solana Ecosystem, Meme, Solana Meme, AI Meme, AI Agents, Binance Alpha Spotlight, AI Framework, Made in USA",ai16z,222078430,222078430.0,124289.62660551257,108120.53940752368,0.11,37190322.0
Gate.io,"Layer 1 (L1), VeChain Ecosystem",vethor-token,220568693,220723408.0,50944.75505640963,66227.32585407194,0.28,4833522.0
Gate.io,"Smart Contract Platform, BNB Chain Ecosystem, Layer 1 (L1), Proof of Stake (PoS), Pantera Capital Portfolio, Andreessen Horowitz (a16z) Portfolio, Binance Labs Portfolio, Blockchain Capital Portfolio, Privacy Blockchain, Polychain Capital Portfolio, Coinbase 50 Index",oasis-network,220097215,327048871.0,56985.86574646432,104351.24893990421,0.06,8806650.0
Gate.io,"BNB Chain Ecosystem, Polygon Ecosystem, Ethereum Ecosystem, Animoca Brands Portfolio, DWF Labs Portfolio, Alameda Research Portfolio, Energi Ecosystem, Binance Labs Portfolio",mask-network,218809931,218809931.0,203844.01389635383,334168.7046621072,0.05,21591071.0
Gate.io,"Gaming (GameFi), NFT, Collectibles, Polygon Ecosystem, Ethereum Ecosystem, Animoca Brands Portfolio, Gaming Blockchains, Made in USA",superfarm,218740748,484265717.0,37312.40970138187,64206.89355967997,0.16,23832587.0
Gate.io,"Decentralized Exchange (DEX), Decentralized Finance (DeFi), Automated Market Maker (AMM), Cosmos Ecosystem, Osmosis Ecosystem, Paradigm Portfolio, Evmos Ecosystem, Secret Ecosystem, GMCI DeFi Index, GMCI Index",osmosis,216971541,302195404.0,90737.9935012218,136852.25518979586,0.1,16366978.0
Gate.io,"Artificial Intelligence (AI), Harmony Ecosystem, Arbitrum Ecosystem, Ethereum Ecosystem, DePIN, Coinbase Ventures Portfolio, Multicoin Capital Portfolio, Pantera Capital Portfolio, GMCI DePIN Index, GMCI Index, Coinbase 50 Index",livepeer,217284142,217284142.0,79875.9363190517,95795.83455033624,0.11,18995500.0
Gate.io,"Analytics, Avalanche Ecosystem, Meme, Cat-Themed, Made in USA",ket,214854912,214854912.0,,,N/A,5899893.0
Gate.io,"Decentralized Exchange (DEX), Decentralized Finance (DeFi), Avalanche Ecosystem, Harmony Ecosystem, Ethereum Ecosystem, Coinbase Ventures Portfolio, Pantera Capital Portfolio, Energi Ecosystem, GMCI DeFi Index, Blockchain Capital Portfolio, GMCI Index, Made in USA",0x,216688542,255409500.0,64746.813921082445,117525.20778215729,0.16,21873246.0
Gate.io,"Decentralized Finance (DeFi), Aptos Ecosystem",abtc,212235128,212235128.0,,,N/A,199139.0
Gate.io,"Decentralized Exchange (DEX), BNB Chain Ecosystem, Solana Ecosystem, Ethereum Ecosystem, Real World Assets (RWA), Base Ecosystem, RWA Protocol",chex-token,211382360,211382360.0,6837.437502605775,5736.490027172588,0.24,1143415.0
Gate.io,"BNB Chain Ecosystem, Meme, AI Meme",ai-companions,210942703,210942703.0,1060.471012106405,889.0850761589746,0.56,4866695.0
Gate.io,"Artificial Intelligence (AI), Polkadot Ecosystem, Metaverse, Ethereum Ecosystem, Interoperability, Real World Assets (RWA), DePIN, Decentralized Science (DeSci), AI Agents",origintrail,208086779,208380582.0,16384.93782240216,17496.449712918507,0.19,3539955.0
Gate.io,"Liquid Staking Tokens, Ethereum Ecosystem, Base Ecosystem, Liquid Staked ETH, Liquid Staking",liquid-staked-ethereum,206382475,206382475.0,,,N/A,73347.0
Gate.io,"Gaming (GameFi), BNB Chain Ecosystem, Solana Ecosystem, Meme, Ethereum Ecosystem, Dog-Themed, Solana Meme, Gaming Utility Token",baby-doge-coin,206971878,525359070.0,46994.13841161788,63792.087619966944,0.08,9985332.0
Gate.io,"Smart Contract Platform, Storage, Harmony Ecosystem, Ethereum Ecosystem, DePIN, Energi Ecosystem, Sora Ecosystem, GMCI DePIN Index, GMCI Index",holotoken,205504970,205504970.0,41882.73544189028,52514.069552474415,0.17,8471421.0
Gate.io,"Stablecoins, USD Stablecoin, Arbitrum Ecosystem, Ethereum Ecosystem, Base Ecosystem, Crypto-backed Stablecoin, Fiat-backed Stablecoin",gho,205213797,205218298.0,,,N/A,4683903.0
Gate.io,"Decentralized Finance (DeFi), Yield Farming, BNB Chain Ecosystem, Avalanche Ecosystem, Polygon Ecosystem, Fantom Ecosystem, Arbitrum Ecosystem, Ethereum Ecosystem, Optimism Ecosystem, Linea Ecosystem, Bridge Governance Tokens, Base Ecosystem, FTX Holdings",stargate-finance,204737225,210751064.0,116437.86413887364,92456.79595584916,0.05,6910324.0
Gate.io,"BNB Chain Ecosystem, Meme",cheems-token,201279234,201279234.0,73699.0110763533,72799.3722890624,0.07,4624049.0
Gate.io,"Stablecoins, Ethereum Ecosystem",usda-2,201383037,201383037.0,,,N/A,21971.0
Gate.io,"Solana Ecosystem, Meme, Dog-Themed, Solana Meme, Bitcoin Ecosystem, Runes",dog-go-to-the-moon-rune,199968456,199968456.0,8510.605201931054,14846.949464860883,0.2,6018090.0
Gate.io,"Smart Contract Platform, Layer 1 (L1), Celo Ecosystem, DWF Labs Portfolio, Coinbase Ventures Portfolio, Proof of Stake (PoS), Andreessen Horowitz (a16z) Portfolio, Optimism Superchain Ecosystem, Outlier Ventures Portfolio, Made in USA",celo,198014743,350302396.0,92858.7295390583,177633.22657643614,0.03,10579317.0
Gate.io,"Gambling (GambleFi), Gaming (GameFi), Ethereum Ecosystem",rollbit-coin,197760517,197760517.0,,,N/A,1130073.0
Gate.io,"Decentralized Finance (DeFi), Polygon Ecosystem, Ethereum Ecosystem, Coinbase Ventures Portfolio, Pantera Capital Portfolio",instadapp,197232097,500121919.0,,,N/A,674949.0
Gate.io,"Smart Contract Platform, Privacy, Layer 1 (L1), Proof of Stake (PoS), Proof of Work (PoW), Blockchain Capital Portfolio, Made in USA",decred,196959759,196960232.0,9260.993568344511,13150.22996877711,0.52,1625420.0
Gate.io,"Solana Ecosystem, Meme, Solana Meme, Pump.fun Ecosystem, Zoo-Themed, Memorial Themed",peanut-the-squirrel,196896007,196896007.0,73749.30902977283,99155.43832998103,0.02,144205270.0
Gate.io,"Smart Contract Platform, Layer 1 (L1), DePIN, Andreessen Horowitz (a16z) Portfolio, Made in USA",chia,196458003,446354670.0,32064.256027966592,31639.490437607765,0.21,7108362.0
Gate.io,"Artificial Intelligence (AI), Exchange-based Tokens, Analytics, Derivatives, Perpetuals, Centralized Exchange (CEX) Token, Ethereum Ecosystem, Binance Launchpad, Coinbase Ventures Portfolio, Binance Labs Portfolio, Made in USA",arkham,195924363,529961708.0,491026.0747124984,719602.3350716288,0.02,42039840.0
Gate.io,"Solana Ecosystem, Meme, Solana Meme, Cat-Themed, Murad Picks",popcat,194962654,194962654.0,82277.2463936241,88803.87909832361,0.1,42756708.0
Gate.io,"Solana Ecosystem, BRC-20, Bitcoin Ecosystem, Inscriptions",ordinals,194850543,194850543.0,528111.6902226695,702628.3947604855,0.11,52545825.0
Gate.io,"Infrastructure, Smart Contract Platform, NEO Ecosystem",gas,193253853,193253853.0,57103.28998377678,87276.90021822602,0.13,4011043.0
Gate.io,"Smart Contract Platform, Storage, DePIN, Paradigm Portfolio, Proof of Work (PoW), DragonFly Capital Portfolio, Made in USA",siacoin,192573610,205823381.0,20996.194995798633,40823.098520765474,0.41,17275295.0
Gate.io,"Infrastructure, Smart Contract Platform, Venom Ecosystem",venom,191363763,691861460.0,5951.435125864469,6071.364224486827,0.05,372301.0
Gate.io,"Smart Contract Platform, Real World Assets (RWA), Proof of Work (PoW), Made in USA",ravencoin,186140162,186192401.0,40517.02735058095,50101.068158819595,0.02,5616654.0
Gate.io,"Decentralized Finance (DeFi), Launchpad, Ethereum Ecosystem, DWF Labs Portfolio, Coinbase Ventures Portfolio, Pantera Capital Portfolio, Blockchain Capital Portfolio",auction,185118551,214630919.0,236576.65854552801,233643.7586104621,0.01,77797643.0
Gate.io,"Exchange-based Tokens, Ethereum Ecosystem",btse-token,185304904,228684670.0,,,N/A,3211635.0
Gate.io,"Infrastructure, Smart Contract Platform, BNB Chain Ecosystem, Layer 1 (L1), Ethereum Ecosystem, GMCI Layer 1 Index, Aelf Ecosystem, GMCI Index",aelf,185040779,249434031.0,41702.79726889597,61978.90099189666,0.28,7954377.0
Gate.io,"Crypto-Backed Tokens, Decentralized Finance (DeFi), Wrapped-Tokens, Ethereum Ecosystem",resolv-wstusr,184744046,165300994.0,,,N/A,162.11
Gate.io,"Gaming (GameFi), Ethereum Ecosystem, Decentralized Identifier (DID), Animoca Brands Portfolio, OKX Ventures Portfolio, Outlier Ventures Portfolio",mocaverse,184769158,859601931.0,35082.232805369094,90286.95510939165,0.04,17976960.0
Gate.io,"Avalanche Ecosystem, Liquid Staking Tokens, Liquid Staking",benqi-liquid-staked-avax,182151149,182151149.0,,,N/A,1893117.0
Gate.io,"Meme, Ethereum Ecosystem, Base Ecosystem, Cat-Themed, Murad Picks",mog-coin,182644166,182644166.0,326841.9868227356,390841.5660714102,0.11,9069317.0
Gate.io,"Meme, Cronos Ecosystem, AI Meme, Cronos zkEVM Ecosystem",agentfun-ai,182814485,182814485.0,,,N/A,5882.2
Gate.io,"Solana Ecosystem, Meme, Solana Meme, AI Meme, Pump.fun Ecosystem",act-i-the-ai-prophecy,182322787,182322787.0,13957.883171993959,15529.106125224767,0.14,24280742.0
Gate.io,"Decentralized Finance (DeFi), BNB Chain Ecosystem, Polygon Ecosystem, Fantom Ecosystem, Arbitrum Ecosystem, Moonbeam Ecosystem, Liquid Staking Tokens, Ethereum Ecosystem, Optimism Ecosystem, Liquid Staked ETH, Liquid Staking",staked-frax-ether,181565852,181565852.0,,,N/A,36438.0
Gate.io,"BNB Chain Ecosystem, Avalanche Ecosystem, Polygon Ecosystem, Fantom Ecosystem, Arbitrum Ecosystem, Ethereum Ecosystem, Optimism Ecosystem, Liquid Staking Governance Tokens, Linea Ecosystem, DePIN, Scroll Ecosystem, Rollups-as-a-Service (RaaS), Blast Ecosystem, Mode Ecosystem, Pantera Capital Portfolio, Polygon zkEVM Ecosystem, Binance Labs Portfolio, Liquid Staking, Made in USA",ankr,181084458,181084458.0,34891.594368677506,30473.744235895818,0.39,10906537.0
Gate.io,"Solana Ecosystem, Ethereum Ecosystem, Energi Ecosystem",swissborg,180083514,180083514.0,,,N/A,5456146.0
Gate.io,"Tourism, BNB Chain Ecosystem",trip,178828111,594073047.0,,,N/A,31811.0
Gate.io,"Solana Ecosystem, Meme, Cat-Themed",meow,174893346,174893346.0,,,N/A,342766.0
Gate.io,"Tokenized Real Estate, Tokenized Assets, Ethereum Ecosystem, Real World Assets (RWA), RWA Protocol",apf-coin,176455457,259083838.0,,,N/A,2959529.0
Gate.io,,nem,175716254,175716254.0,539.8778453866893,3428.391541232566,0.62,15600848.0
Gate.io,"Launchpad, Meme, Base Ecosystem, Cat-Themed, Base Meme",toshi,174632732,174632732.0,1350107.451146409,878475.9657671208,0.07,20762626.0
Gate.io,"Decentralized Finance (DeFi), Yield Farming, Yield Aggregator, Yearn Ecosystem, Avalanche Ecosystem, Polygon Ecosystem, Near Protocol Ecosystem, Gnosis Chain Ecosystem, Fantom Ecosystem, Harmony Ecosystem, Arbitrum Ecosystem, Ethereum Ecosystem, Optimism Ecosystem, Base Ecosystem, Index Coop Defi Index, Alameda Research Portfolio, Energi Ecosystem, Sora Ecosystem, Huobi ECO Chain Ecosystem, Blockchain Capital Portfolio, Index Coop Index",yearn-finance,173706138,188716221.0,73066.1144153421,76603.65521624549,0.22,22259094.0
Gate.io,"Solana Ecosystem, Meme, Dog-Themed, Solana Meme, Cat-Themed",cat-in-a-dogs-world,173904963,173904963.0,87322.35330197535,132821.63184280152,0.05,6960823.0
Gate.io,"Gaming (GameFi), BNB Chain Ecosystem, Ethereum Ecosystem, TON Ecosystem",gmt-token,173251536,173251536.0,6121.100478592818,14460.802204781881,0.14,13236756.0
Gate.io,"Artificial Intelligence (AI), Smart Contract Platform, Layer 1 (L1), Paradigm Portfolio, Coinbase Ventures Portfolio, DeFiance Capital Portfolio, Polychain Capital Portfolio, Vana Ecosystem",vana,173320003,675272739.0,284026.6741428074,333303.5029579563,0.04,15865410.0
Gate.io,"Decentralized Exchange (DEX), Decentralized Finance (DeFi), Yield Farming, Automated Market Maker (AMM), BNB Chain Ecosystem, Seigniorage, Solana Ecosystem, Avalanche Ecosystem, Polygon Ecosystem, Fantom Ecosystem, Harmony Ecosystem, Arbitrum Ecosystem, Moonriver Ecosystem, Ethereum Ecosystem, Liquid Staking Governance Tokens, Curve Ecosystem, Stablecoin Protocol, Polygon zkEVM Ecosystem, Evmos Ecosystem, Fraxtal Ecosystem, GMCI DeFi Index, Liquid Staking, GMCI Index, Made in USA",frax-share,173157204,195625064.0,46543.449919477614,91620.55187302774,0.31,44761076.0
Gate.io,"Starknet Ecosystem, Bridged-Tokens",bridged-wrapped-ether-starkgate,170845480,170845480.0,,,N/A,789742.0
Gate.io,"Smart Contract Platform, Privacy, Proof of Work (PoW)",mimblewimblecoin,169884608,169885267.0,,,N/A,40548.0
Gate.io,"Decentralized Finance (DeFi), Derivatives, Prediction Markets, Solana Ecosystem",drift-protocol,170559520,591192770.0,153171.48644132804,159359.56896376092,0.05,110247469.0
Gate.io,"Internet of Things (IOT), Ethereum Ecosystem, DePIN, Base Ecosystem, Account Abstraction, GMCI DePIN Index, GMCI Index, Made in USA",iotex,169830802,169830802.0,24053.568142526365,71426.85024957138,0.11,7766840.0
Gate.io,"Smart Contract Platform, Layer 1 (L1), Layer 0 (L0), Made in USA, Directed Acyclic Graph (DAG)",constellation-labs,169033548,169033670.0,3207.717887554162,6099.385216999852,0.36,2218772.0
Gate.io,Arbitrum Ecosystem,rcge,168805259,168805259.0,,,N/A,2.43
Gate.io,"Decentralized Finance (DeFi), Solana Ecosystem, Ethereum Ecosystem, Optimism Ecosystem, Base Ecosystem, Cross-chain Communication, BTCfi",threshold-network-token,167781961,184830619.0,36751.55180355458,48579.22736477691,0.24,13612003.0
Gate.io,"Entertainment, Smart Contract Platform, Gaming (GameFi), NFT, Metaverse, Layer 1 (L1), Harmony Ecosystem, Ethereum Ecosystem, Gaming Blockchains, Energi Ecosystem",enjincoin,167250581,173038180.0,30752.318691017208,49959.941947766434,0.24,13726244.0
Gate.io,"Decentralized Finance (DeFi), Derivatives, Perpetuals, Avalanche Ecosystem, Arbitrum Ecosystem",gmx,165299213,165299584.0,70273.9904398583,47484.79528689256,0.24,45551030.0
Gate.io,"Decentralized Finance (DeFi), Yield Farming, Yield Aggregator, Ethereum Ecosystem, Metagovernance, Curve Ecosystem, Yield Optimizer",convex-finance,163656302,199313637.0,24668.986330109376,51294.80714356548,0.3,9954505.0
Gate.io,"Decentralized Finance (DeFi), Ethereum Ecosystem, Stablecoin Protocol",tribe-2,163165575,358593419.0,4.381395425926613,3.0015287170976284,1.51,58116.0
