Gate.io,"Fraxtal Ecosystem, Bridged-Tokens",l2-standard-bridged-frxusd,94743247,94743247.0,,,N/A,1171201.0
Gate.io,"Solana Ecosystem, Liquid Staking Tokens, Restaking, Liquid Restaking Tokens, Liquid Staked SOL, Liquid Staking, Liquid Restaked SOL",solayer-staked-sol,94523670,94523670.0,,,N/A,338674.0
Gate.io,"Gaming (GameFi), NFT, BNB Chain Ecosystem",infinitar-governance-token,94791929,462582421.0,3669.2111570171946,3958.894983766864,1.03,7429201.0
Gate.io,"Artificial Intelligence (AI), Big Data, Media, BNB Chain Ecosystem, Polygon Ecosystem, Ethereum Ecosystem, GMCI DePIN Index, Galaxy Digital Portfolio, GMCI Index",everipedia,94190854,94190854.0,158.62780230643745,57.148783257727224,1.8,5467751.0
Gate.io,"Decentralized Finance (DeFi), Yield Farming, BNB Chain Ecosystem, Binance Launchpool, Lending/Borrowing Protocols, Arbitrum Ecosystem, Ethereum Ecosystem, Optimism Ecosystem, ZkSync Ecosystem, opBNB Ecosystem, Unichain Ecosystem",venus,93426137,167604344.0,33518.918959879105,61638.764653537844,0.46,7951424.0
Gate.io,"Smart Contract Platform, Gaming (GameFi), Solana Ecosystem, Layer 2 (L2), Gaming Blockchains",sonic-svm,92639515,617596768.0,134487.12976949004,220783.422603945,0.1,22400534.0
Gate.io,"Artificial Intelligence (AI), Oracle, Ethereum Ecosystem, DePIN, Energi Ecosystem, Sora Ecosystem, GMCI DePIN Index, GMCI Index",iexec-rlc,92578242,111273883.0,66318.38655343134,99078.89813606816,0.16,7642190.0
Gate.io,"Ethereum Ecosystem, DWF Labs Portfolio",adventure-gold,91952575,91952575.0,72722.96029296724,93890.77596014741,0.02,22428230.0
Gate.io,"BNB Chain Ecosystem, Liquid Staking Tokens",astherus-staked-bnb,91632354,91632354.0,,,N/A,811.41
Gate.io,"Artificial Intelligence (AI), Infrastructure, Smart Contract Platform, Decentralized Finance (DeFi), Arbitrum Ecosystem, Ethereum Ecosystem, Zero Knowledge (ZK), DWF Labs Portfolio, Coinbase Ventures Portfolio, Pantera Capital Portfolio, Binance Labs Portfolio",marlin,91514058,112238867.0,27470.45353935053,41691.84546504345,0.54,5453978.0
Gate.io,"Decentralized Exchange (DEX), Exchange-based Tokens, Decentralized Finance (DeFi), Yield Farming, Automated Market Maker (AMM), Avalanche Ecosystem, Polygon Ecosystem, Near Protocol Ecosystem, Gnosis Chain Ecosystem, Harmony Ecosystem, Arbitrum Ecosystem, Ethereum Ecosystem, Optimism Ecosystem, Base Ecosystem, Index Coop Defi Index, Alameda Research Portfolio, DeFiance Capital Portfolio, Pantera Capital Portfolio, Energi Ecosystem, Polygon zkEVM Ecosystem, Huobi ECO Chain Ecosystem, Blockchain Capital Portfolio, Index Coop Index",balancer,90804676,98192888.0,91027.6861373529,114749.68707221089,0.21,7126070.0
Gate.io,"Smart Contract Platform, Layer 1 (L1), Zero Knowledge (ZK)",ozone-chain,90409894,124625957.0,,,N/A,233183.0
Gate.io,"Energy, Ethereum Ecosystem, Alleged SEC Securities, Energi Ecosystem, GMCI DePIN Index, Blockchain Capital Portfolio, GMCI Index",power-ledger,90403608,170565234.0,32208.585999874453,56652.71896442355,0.23,7140662.0
Gate.io,"Infrastructure, Smart Contract Platform, Decentralized Finance (DeFi), BNB Chain Ecosystem, Avalanche Ecosystem, Polygon Ecosystem, Fantom Ecosystem, Harmony Ecosystem, Arbitrum Ecosystem, Ethereum Ecosystem, DWF Labs Portfolio, Layer 3 (L3), Outlier Ventures Portfolio",orbs,90210598,198111045.0,12300.806207436708,14457.510083401994,0.1,3476383.0
Gate.io,"Smart Contract Platform, Polkadot Ecosystem, Layer 1 (L1), DePIN, Outlier Ventures Portfolio",peaq-2,90407252,532089077.0,79188.65196215309,67400.21181633648,0.1,17482799.0
Gate.io,"Gaming (GameFi), XDC Ecosystem, Gaming Utility Token",gama-coin,89820023,138184726.0,,,N/A,2285353.0
Gate.io,"Artificial Intelligence (AI), Virtual Reality, Launchpad, Ethereum Ecosystem, Telegram Apps, Discord Bots, PAAL AI Launchpad, AI Agents, AI Applications, AI Agent Launchpad, Binance Alpha Spotlight, AI Framework, DeFAI, Made in USA",paal-ai,89487125,100659003.0,14004.130365722916,12899.859017253231,0.14,6437545.0
Gate.io,"Smart Contract Platform, Ethereum Ecosystem, Layer 2 (L2), Zero Knowledge (ZK), Restaking, Zircuit Ecosystem",zircuit,88496050,403185130.0,54490.66712782377,108913.85171657594,0.05,12885257.0
Gate.io,"Cronos Ecosystem, Bridged USDT, Bridged-Tokens, Bridged Stablecoins",cronos-bridged-usdt-cronos,87709305,87709305.0,,,N/A,270193.0
Gate.io,"Smart Contract Platform, Layer 1 (L1)",ong,87737379,215072607.0,25895.511948726707,26812.536434341568,0.23,1929290.0
Gate.io,"SocialFi, Coinbase Ventures Portfolio, Pantera Capital Portfolio, Andreessen Horowitz (a16z) Portfolio, Sequoia Capital Portfolio",deso,87281859,89571078.0,703.691131476617,279.1904457595731,2.67,2001741.0
Gate.io,"Artificial Intelligence (AI), Smart Contract Platform, Gaming (GameFi), NFT, BNB Chain Ecosystem, Layer 1 (L1), Ethereum Ecosystem, Modular Blockchain, Chromia Ecosystem",chromaway,87004710,87004710.0,49047.380432793696,46902.623394470305,0.39,9201969.0
Gate.io,BNB Chain Ecosystem,metfi-2,86170183,201657909.0,123.90436044765346,193.26457734586148,0.74,503033.0
Gate.io,"Smart Contract Platform, Bitcoin Sidechains, Stacks Ecosystem, SideChain",sbtc-2,86222966,86222966.0,,,N/A,3965.19
Gate.io,"Stablecoins, USD Stablecoin, Ethereum Ecosystem, Sonic Ecosystem, Fiat-backed Stablecoin",frax-usd,86254634,86254634.0,,,N/A,1464375.0
Gate.io,"Crypto-Backed Tokens, Ethereum Ecosystem",temple,86009193,86178636.0,,,N/A,4840.87
Gate.io,"Smart Contract Platform, Layer 2 (L2), eGirl Capital Portfolio, Paradigm Portfolio, Blast Ecosystem",blast,85860870,323745636.0,42862.47723474395,73120.12752140312,0.06,4136071.0
Gate.io,"Gaming (GameFi), Play To Earn, Ethereum Ecosystem, RPG, Alameda Research Portfolio, Circle Ventures Portfolio, OKX Ventures Portfolio, MMO",big-time,86122219,241239230.0,113142.33593497195,181533.43800849302,0.04,12999302.0
Gate.io,"Smart Contract Platform, Gaming (GameFi), NFT, Layer 1 (L1), Play To Earn, Ethereum Ecosystem, Animoca Brands Portfolio, Gaming Blockchains, Pantera Capital Portfolio, OKX Ventures Portfolio",wax,85865436,92388567.0,3746.3135920487134,7964.696891864439,0.16,5120852.0
Gate.io,"Smart Contract Platform, Polkadot Ecosystem, Layer 1 (L1), Coinbase Ventures Portfolio, Binance Labs Portfolio",moonbeam,85858801,104555660.0,69335.0738070699,82414.77165544202,0.11,4746498.0
Gate.io,"Decentralized Exchange (DEX), Decentralized Finance (DeFi), Arbitrum Ecosystem, Ethereum Ecosystem",tokenlon,85532780,102952916.0,,,N/A,38161.0
Gate.io,"Business Services, Polygon Ecosystem, Ethereum Ecosystem",request-network,85447857,111019574.0,33227.132864990075,38395.914796277386,0.05,3023131.0
Gate.io,"Smart Contract Platform, Privacy, Proof of Work (PoW), Made in USA",verge,84870238,85040003.0,,,N/A,10068586.0
Gate.io,"NFT, Solana Ecosystem, NFT Marketplace",tensor,84490833,252507486.0,404171.7559785835,402691.14822197205,0.04,12911701.0
Gate.io,"Meme, Ethereum Ecosystem, PolitiFi",constitutiondao,84128150,84128150.0,208150.15699870308,302508.74198279664,0.06,17662361.0
Gate.io,"Exchange-based Tokens, Centralized Exchange (CEX) Token, Ethereum Ecosystem",hashkey-ecopoints,83406788,629485191.0,76350.11451535719,73978.53250334732,0.22,3305857.0
Gate.io,Ethereum Ecosystem,dkargo,83194668,88756759.0,0.0,0.0,6.04,879754.0
Gate.io,"Solana Ecosystem, Polygon Ecosystem, DePIN, Pantera Capital Portfolio",geodnet,83182548,259460412.0,37247.88116744703,34354.31561960332,0.05,252903.0
Gate.io,"Decentralized Exchange (DEX), Decentralized Finance (DeFi), Yield Farming, Automated Market Maker (AMM), Solana Ecosystem, Coinbase Ventures Portfolio, DeFiance Capital Portfolio, Made in USA",orca,82546729,154940047.0,52481.060301739155,71701.70132124219,0.06,15107597.0
Gate.io,"Gaming (GameFi), NFT, BNB Chain Ecosystem, Metaverse, Collectibles, Polygon Ecosystem, Play To Earn, Harmony Ecosystem, Guild and Scholarship, Ethereum Ecosystem, Animoca Brands Portfolio, Base Ecosystem, DWF Labs Portfolio, Ronin Ecosystem, Gaming Governance Token, Andreessen Horowitz (a16z) Portfolio, Delphi Ventures Portfolio",yield-guild-games,82670183,201382400.0,131740.0516154993,168108.88792822612,0.05,11757496.0
Gate.io,"Smart Contract Platform, Gaming (GameFi), Play To Earn, Guild and Scholarship, Ethereum Ecosystem, Layer 2 (L2), Gaming Blockchains, Pantera Capital Portfolio, Ancient8 Ecosystem, Optimism Superchain Ecosystem",ancient8,80708721,306545073.0,567.5122047173376,31565.493537075814,0.71,29473014.0
Gate.io,BNB Chain Ecosystem,bitdca,81519106,87558009.0,,,N/A,18624.46
Gate.io,"Smart Contract Platform, Cosmos Ecosystem, Modular Blockchain, Osmosis Ecosystem, Rollups-as-a-Service (RaaS)",dymension,81453450,322977001.0,156731.9237574984,209307.21144764134,0.22,8928188.0
Gate.io,"Decentralized Finance (DeFi), BNB Chain Ecosystem, Arbitrum Ecosystem, Ethereum Ecosystem, Multicoin Capital Portfolio, Energi Ecosystem",dforce-token,80659163,80659163.0,27019.572337276906,52766.39340479372,0.37,7978606.0
Gate.io,"Berachain Ecosystem, Bridged USDT, Bridged-Tokens, Ink Ecosystem, Bridged Stablecoins",usdt0,80741784,80741784.0,,,N/A,186329.0
Gate.io,"Artificial Intelligence (AI), BNB Chain Ecosystem, Ethereum Ecosystem, DragonFly Capital Portfolio, Binance Labs Portfolio, Delphi Ventures Portfolio, OKX Ventures Portfolio, Binance HODLer Airdrops, AI Agent Launchpad, Binance Alpha Spotlight, AI Framework",myshell,80473638,298050510.0,20969.485056167967,24015.59613276577,0.04,58142379.0
Gate.io,"Polygon Ecosystem, XRP Ledger Ecosystem",crypto-trading-fund,80171269,80171269.0,,,N/A,8388.58
Gate.io,"NFT, Polygon Ecosystem",sathosi-airlines-token,80181394,382936447.0,,,N/A,3234.19
Gate.io,"Artificial Intelligence (AI), Smart Contract Platform, Decentralized Finance (DeFi), Analytics, NFT, BNB Chain Ecosystem, Launchpad, Ethereum Ecosystem, Telegram Apps, Discord Bots, ChainGPT Launchpad, Poolz Finance Launchpad, AI Agents, AI Applications, Binance Alpha Spotlight, AI Framework, DeFAI",chaingpt,80182266,99549332.0,47355.79326823177,62574.93218886535,0.17,23103194.0
Gate.io,"Smart Contract Platform, Proof of Stake (PoS)",stratis,79901471,88035604.0,8898.824159821557,8583.104570232721,0.89,527283.0
Gate.io,"Blast Ecosystem, Bridged WETH, Bridged-Tokens",l2-standard-bridged-weth-blast,79803883,79803883.0,,,N/A,758687.0
Gate.io,"NFT, Ethereum Ecosystem",superrare,79577010,99425163.0,129705.19358603176,329472.28818956,0.01,114453347.0
Gate.io,"Gaming (GameFi), Play To Earn, Guild and Scholarship, Ethereum Ecosystem, Animoca Brands Portfolio, Base Ecosystem, DWF Labs Portfolio, Ronin Ecosystem, Coinbase Ventures Portfolio, DeFiance Capital Portfolio, Pantera Capital Portfolio, Binance Labs Portfolio, MMO",zentry,79484287,116686886.0,85886.75924840983,106778.46573627551,0.41,7119231.0
Gate.io,"Stablecoins, USD Stablecoin, Solana Ecosystem, Ethereum Ecosystem, Multicoin Capital Portfolio, Fiat-backed Stablecoin",paxos-standard,79257911,79257911.0,1260813.216530812,1400209.209065864,0.02,1971407.0
Gate.io,"Software as a service, Polygon Ecosystem, Ethereum Ecosystem, Decentralized Identifier (DID), Pantera Capital Portfolio, Energi Ecosystem, Blockchain Capital Portfolio",civic,79240390,98803477.0,89431.7687282986,113942.67545259262,0.08,6860292.0
Gate.io,"Stablecoins, Decentralized Finance (DeFi), Lending/Borrowing Protocols, Ethereum Ecosystem",syrupusdc,79137599,79137599.0,,,N/A,180986.0
Gate.io,"Artificial Intelligence (AI), BNB Chain Ecosystem, Solana Ecosystem, Ethereum Ecosystem, AI Agents, Alameda Research Portfolio",delysium,79081423,150814447.0,20244.836701039952,30022.310997518718,0.04,2490112.0
Gate.io,"Artificial Intelligence (AI), Infrastructure, Ethereum Ecosystem, AI Framework, Made in USA",arcblock,78787500,148655660.0,1973.7064898727035,2462.779424458902,0.63,736292.0
Gate.io,"Ethereum Ecosystem, Stablecoin Protocol",level-usd,78672905,78672905.0,,,N/A,818821.0
Gate.io,"Artificial Intelligence (AI), Smart Contract Platform, Layer 1 (L1), Ethereum Ecosystem, Osmosis Ecosystem, AI Agents, AI Agent Launchpad",humans-ai,78436469,78436469.0,1885.2627470701411,971.678683420372,0.6,660542.0
Gate.io,"Decentralized Finance (DeFi), Wallets, Ethereum Ecosystem, Pundi AIFX Omnilayer Ecosystem",pundi-x-2,78144128,78144128.0,26878.6628810863,34580.898322498986,0.69,5453972.0
Gate.io,"Exchange-based Tokens, Centralized Exchange (CEX) Token, Ethereum Ecosystem",bitmart-token,78072103,147078586.0,,,N/A,4233947.0
Gate.io,"Business Services, Decentralized Finance (DeFi), Oracle, Polygon Ecosystem, Gnosis Chain Ecosystem, Arbitrum Ecosystem, Ethereum Ecosystem, Optimism Ecosystem, Manta Network Ecosystem, Binance Labs Portfolio, Lisk Ecosystem, Made in USA",tellor,77985282,80254435.0,115838.10984170632,149257.77977970848,0.07,20612353.0
Gate.io,"Stablecoins, USD Stablecoin, Osmosis Ecosystem, Fiat-backed Stablecoin",usdx,77658257,77658257.0,,,N/A,15663.28
Gate.io,"NFT, BNB Chain Ecosystem, Solana Ecosystem, Meme, Ethereum Ecosystem, Base Ecosystem, Hybrid Token Standards, Wojak-Themed",non-playable-coin,77598268,77598268.0,7519.073428255983,9866.294913827353,0.62,6029215.0
Gate.io,"Decentralized Exchange (DEX), Decentralized Finance (DeFi), Yield Farming, Automated Market Maker (AMM), BNB Chain Ecosystem, Avalanche Ecosystem, Arbitrum Ecosystem, Mantle Ecosystem, DeFiance Capital Portfolio, Delphi Ventures Portfolio, Dex Aggregator",joe,77381430,99096069.0,48419.49386760347,57877.74046967697,0.35,8174960.0
Gate.io,"Optimism Ecosystem, Bridged WBTC, Bridged-Tokens",optimism-bridged-wbtc-optimism,77144602,77144602.0,,,N/A,806973.0
Gate.io,"Smart Contract Platform, Layer 1 (L1), Osmosis Ecosystem, XRP Ledger Ecosystem",coreum,77113181,77113181.0,2067.2129988848174,1099.2046434648992,0.95,95589.0
Gate.io,"Meme, Dog-Themed, TON Ecosystem, TON Meme",dogs-2,77012582,81967915.0,150855.3752449042,252886.80809962866,0.07,51466700.0
Gate.io,Smart Contract Platform,songbird,76234610,90583376.0,1278.707574348879,5717.130408282758,0.24,370304.0
Gate.io,"Stablecoins, USD Stablecoin, Seigniorage, Alleged SEC Securities, Osmosis Ecosystem, Stablecoin Protocol, DeFiance Capital Portfolio, Terra Classic Ecosystem, Binance Labs Portfolio, Delphi Ventures Portfolio, Galaxy Digital Portfolio, Fiat-backed Stablecoin",terrausd,75850705,107462747.0,41844.91398017107,33585.13342653625,0.16,22165916.0
Gate.io,"Decentralized Finance (DeFi), Liquid Staking Tokens, Ethereum Ecosystem, LSDFi, Liquid Staked ETH, Liquid Staking",origin-ether,75732845,75732845.0,,,N/A,54894.0
Gate.io,"BNB Chain Ecosystem, Solana Ecosystem, Polygon Ecosystem, Meme, Ethereum Ecosystem, Cronos Ecosystem, Dog-Themed, Elon Musk-Inspired, Fuse Ecosystem",dogelon-mars,75153103,136729021.0,165302.2680690926,235671.78120574373,0.27,2630980.0
Gate.io,"Smart Contract Platform, Gaming (GameFi), Layer 1 (L1), Proof of Stake (PoS), Gaming Blockchains",oasys,74952477,193827906.0,678.8573154796718,1010.459430052679,2.05,461623.0
Gate.io,"Sports, BNB Chain Ecosystem",pixer-eternity,74897560,348056066.0,,,N/A,795903.0
Gate.io,"Exchange-based Tokens, Centralized Exchange (CEX) Token, Near Protocol Ecosystem, Harmony Ecosystem, Ethereum Ecosystem, Multicoin Capital Portfolio, Alameda Research Portfolio, Elastos Smart Contract Chain Ecosystem, Sequoia Capital Portfolio, Made in China",huobi-token,74857800,94413971.0,233.342554455316,11.340578019088905,0.02,25194.0
Gate.io,"Entertainment, Gaming (GameFi), NFT, Axie Infinity Ecosystem, Play To Earn, Ethereum Ecosystem, Ronin Ecosystem, Gaming Utility Token",smooth-love-potion,74779991,74779991.0,40148.92167812384,40867.08061850346,0.06,9814461.0
Gate.io,"Optimism Ecosystem, Bridged WETH, Bridged-Tokens",l2-standard-bridged-weth-optimism,74729883,74729883.0,,,N/A,17802801.0
Gate.io,"Smart Contract Platform, Layer 1 (L1), DWF Labs Portfolio, Radix Ecosystem",radix,74451051,91162639.0,5490.794017295735,8397.046702666896,0.19,1806506.0
Gate.io,Retail,milk-alliance,74308279,166144248.0,440.2108577193459,72.29435029320157,1.83,2126382.0
Gate.io,"Smart Contract Platform, Wallets, Layer 2 (L2), Osmosis Ecosystem",islamic-coin,74271804,894781917.0,349.2922884227403,350.07246688636525,0.22,755406.0
Gate.io,"Decentralized Finance (DeFi), Solana Ecosystem, Real World Assets (RWA), Payment Solutions, DePIN, Coinbase Ventures Portfolio, Alameda Research Portfolio, Circle Ventures Portfolio, OKX Ventures Portfolio, RWA Protocol, Made in USA",zebec-network,73964192,99818243.0,3963.2661748943383,12092.666860062569,0.28,23507708.0
Gate.io,"Artificial Intelligence (AI), Decentralized Finance (DeFi), Ethereum Ecosystem, DePIN",pinlink,73980504,92475630.0,110.3071466041477,1369.7691053192952,1.05,1623440.0
Gate.io,"Gaming (GameFi), NFT, Ethereum Ecosystem",undeads-games,74617839,259581622.0,2288.7724469836844,1049.4155928130847,0.19,352884.0
Gate.io,"Ethereum Ecosystem, DePIN",dent,73224515,76550672.0,22851.21511240284,34374.54777691088,0.46,4817909.0
Gate.io,"Meme, Ethereum Ecosystem, Mantle Ecosystem",puff-the-dragon,72962431,72962431.0,0.0,0.0,7.26,32060.0
Gate.io,"Meme, Base Ecosystem, Dog-Themed, Base Meme, Farcaster Ecosystem",doginme,75320279,75320279.0,0.0,0.0,N/A,6179115.0
Gate.io,"Gaming (GameFi), Play To Earn, TON Ecosystem, Tap to Earn, Arcade Games",watcoin-2,72825910,80849880.0,,,N/A,725589.0
Gate.io,"Decentralized Finance (DeFi), Lending/Borrowing Protocols, Moonbeam Ecosystem, Base Ecosystem, Coinbase Ventures Portfolio, Made in USA",moonwell-artemis,72712187,110854592.0,4031.548156501728,5330.924649405659,0.09,5600631.0
Gate.io,"Decentralized Finance (DeFi), Oracle, Ethereum Ecosystem, DWF Labs Portfolio, Pantera Capital Portfolio",api3,72727083,90760226.0,38473.28737522447,51343.52606526185,0.24,13856406.0
Gate.io,"Decentralized Exchange (DEX), Exchange-based Tokens, Decentralized Finance (DeFi), BNB Chain Ecosystem, Binance Launchpool, Polygon Ecosystem, Near Protocol Ecosystem, Arbitrum Ecosystem, Ethereum Ecosystem, DWF Labs Portfolio, Coinbase Ventures Portfolio, Alameda Research Portfolio, DeFiance Capital Portfolio, Pantera Capital Portfolio, Aurora Ecosystem, Energi Ecosystem, Binance Labs Portfolio, Galaxy Digital Portfolio",dodo,72349388,72349388.0,23995.797987622693,23037.88688266428,0.33,8809601.0
Gate.io,"Base Ecosystem, Cybersecurity, Binance Labs Portfolio, OKX Ventures Portfolio, Binance Alpha Spotlight",goplus-security,72304464,398723196.0,42529.16939383753,70931.66838003494,0.05,63053702.0
Gate.io,"Smart Contract Platform, Gaming (GameFi), NFT, Binance Launchpool, Arbitrum Ecosystem, Layer 3 (L3), XAI Ecosystem, Gaming Blockchains, Outlier Ventures Portfolio",xai-blockchain,72256156,106533799.0,126727.65935122593,100731.35023490372,0.03,27398255.0
Gate.io,"Decentralized Finance (DeFi), Lending/Borrowing Protocols, Ethereum Ecosystem, Real World Assets (RWA), Coinbase Ventures Portfolio, Andreessen Horowitz (a16z) Portfolio, RWA Protocol, Made in USA",goldfinch,71257314,88141078.0,791.6261747643108,2916.1946978908795,0.35,586193.0
Gate.io,"Artificial Intelligence (AI), Cardano Ecosystem, Ethereum Ecosystem, AI Agents, Sora Ecosystem",singularitynet,71288039,107778313.0,,,N/A,29735.0
Gate.io,"Decentralized Finance (DeFi), Lending/Borrowing Protocols, Arbitrum Ecosystem, Ethereum Ecosystem, Alameda Research Portfolio, Pantera Capital Portfolio",liquity,71305291,73270750.0,230345.27143424944,210035.40586484634,0.1,10623273.0
Gate.io,"Artificial Intelligence (AI), Decentralized Finance (DeFi), Solana Ecosystem, Arbitrum Ecosystem, Metis Ecosystem, AI Agents, Sonic Ecosystem, IOTA EVM Ecosystem, AI Applications, DeFAI",heyanon,70639430,116336721.0,255.5062334184037,438.96928661867844,0.36,3000627.0
Gate.io,"Gaming (GameFi), NFT, Collectibles, Play To Earn, Ethereum Ecosystem, Base Ecosystem, Energi Ecosystem",ecomi,70240330,80591832.0,4608.11547849805,10381.016072589733,0.42,1980584.0
Gate.io,"Artificial Intelligence (AI), Ethereum Ecosystem",0x0-ai-ai-smart-contract,69888759,69888759.0,,,N/A,91809.0
Gate.io,"Stablecoins, Decentralized Finance (DeFi), USD Stablecoin, BNB Chain Ecosystem, Polygon Ecosystem, Gnosis Chain Ecosystem, Arbitrum Ecosystem, Ethereum Ecosystem, Optimism Ecosystem, Base Ecosystem, Crypto-backed Stablecoin, Fiat-backed Stablecoin",crvusd,69946575,69946575.0,,,N/A,2790018.0
Gate.io,"Artificial Intelligence (AI), Business Services, Decentralized Finance (DeFi), Ethereum Ecosystem, Paradigm Portfolio, DragonFly Capital Portfolio, Energi Ecosystem",numeraire,70035316,93769856.0,37684.32103491357,44307.84596283705,0.05,5533064.0
Gate.io,"Decentralized Finance (DeFi), Lending/Borrowing Protocols, Solana Ecosystem, Binance Alpha Spotlight",kamino,69761437,516751384.0,220102.52735325327,180759.30405803004,0.04,6854602.0
Gate.io,"Smart Contract Platform, Ethereum Ecosystem, Layer 2 (L2), Zero Knowledge (ZK), Rollup, OKX Ventures Portfolio",taiko,69570676,657906975.0,156522.24790773098,167888.4412088182,0.06,10849084.0
Gate.io,"Tokenized Assets, Polygon Ecosystem, Arbitrum Ecosystem, Ethereum Ecosystem, Real World Assets (RWA), Starknet Ecosystem, Tokenized Treasury Bills (T-Bills)",spiko-us-t-bills-money-market-fund,69588146,69588146.0,,,N/A,0.0
Gate.io,"Lending/Borrowing Protocols, Solana Ecosystem, FTX Holdings, Coinbase Ventures Portfolio, Alameda Research Portfolio, DragonFly Capital Portfolio",solend,69360419,137087973.0,0.0,0.0,11.91,2989.43
Gate.io,"Decentralized Finance (DeFi), Ethereum Ecosystem, Binance Alpha Spotlight",avalon-2,69989233,431366608.0,40695.90535272704,40342.66606727624,0.07,15218867.0
Gate.io,"Solana Ecosystem, Restaking, Liquid Restaking Tokens, Liquid Restaked SOL",renzo-restaked-sol,68563682,68563682.0,,,N/A,174259.0
Gate.io,"Arbitrum Ecosystem, Bridge Governance Tokens, Base Ecosystem, Cross-chain Communication, OKX Ventures Portfolio",orbiter-finance,68818444,221994981.0,11323.761693261746,12366.456307629192,0.09,58577520.0
Gate.io,"Smart Contract Platform, Binance Launchpool, Layer 2 (L2), Scroll Ecosystem",scroll,68324443,359602332.0,153259.50436002077,177160.69557131553,0.06,10681789.0
Gate.io,"Artificial Intelligence (AI), Marketing, Analytics, BNB Chain Ecosystem, Ethereum Ecosystem, Animoca Brands Portfolio, Base Ecosystem, AI Agents, Binance Alpha Spotlight",cookie,68128391,151637654.0,311439.6017885763,408181.7248743756,0.02,18216296.0
Gate.io,"Artificial Intelligence (AI), Solana Ecosystem, DePIN",nosana,68109477,81666039.0,1595.3212204352928,1689.776467100169,0.37,401051.0
Gate.io,"Stablecoins, Decentralized Finance (DeFi), USD Stablecoin, BNB Chain Ecosystem, Avalanche Ecosystem, Arbitrum Ecosystem, Liquid Staking Tokens, Ethereum Ecosystem, Optimism Ecosystem, Fiat-backed Stablecoin",staked-frax,68108454,68108454.0,,,N/A,38.23
Gate.io,"Decentralized Exchange (DEX), Decentralized Finance (DeFi), Sui Ecosystem, Animoca Brands Portfolio, OKX Ventures Portfolio, Dex Aggregator",cetus-protocol,67846758,99353717.0,75705.61417816917,76669.16964568921,0.16,9153005.0
Gate.io,"Decentralized Finance (DeFi), Ethereum Ecosystem",elixir-finance,67323282,421668715.0,46126.776134306456,69951.59345691216,0.17,47285666.0
Gate.io,"Solana Ecosystem, Wallets, Base Ecosystem, TON Ecosystem",bitget-wallet-token,67182897,470072637.0,,,N/A,3631.06
Gate.io,SocialFi,steem,66911328,67068351.0,121442.23637846146,174903.30195840073,0.15,8469143.0
Gate.io,"Decentralized Finance (DeFi), BNB Chain Ecosystem, Solana Ecosystem, Wallets, Polygon Ecosystem, Ethereum Ecosystem, Binance Launchpad, DWF Labs Portfolio, Multicoin Capital Portfolio, Alameda Research Portfolio, Viction Ecosystem, Binance Labs Portfolio",coin98,66500141,73820706.0,79619.90198418456,92759.99508311275,0.24,15470854.0
Gate.io,"Smart Contract Platform, Layer 1 (L1), Proof of Work (PoW), Privacy Blockchain",ergo,66302440,80929681.0,85.503043697855,3796.1601007683807,0.04,72785.0
Gate.io,Ethereum Ecosystem,saasgo,66269734,82837168.0,3046.1131179003364,4187.972351676506,1.0,198377.0
Gate.io,"Smart Contract Platform, Layer 1 (L1), Proof of Work (PoW), Made in USA",quai-network,65754929,409169902.0,3630.648078887254,2179.166918275913,0.27,4805844.0
Gate.io,E-commerce,pay-coin,65648373,121978078.0,,,N/A,5480883.0
Gate.io,"Healthcare, Osmosis Ecosystem",medibloc,65620231,71075799.0,1478.346820514918,3921.8173909044417,2.14,362815.0
Gate.io,Ethereum Ecosystem,devve,65739212,90270169.0,2438.765004201289,1982.3155084250504,0.57,656245.0
Gate.io,"Meme, Ethereum Ecosystem, Frog-Themed, Murad Picks, Binance Alpha Spotlight",apu-s-club,66077892,66077892.0,2438.7711385088646,3558.8147872127256,0.25,7858937.0
Gate.io,"Polkadot Ecosystem, Real World Assets (RWA), Coinbase Ventures Portfolio, Circle Ventures Portfolio, Galaxy Digital Portfolio, RWA Protocol",centrifuge,65157684,71387379.0,11527.33125602376,8371.566278330783,0.2,598301.0
Gate.io,"Stablecoins, USD Stablecoin, Fiat-backed Stablecoin",falcon-finance,64664146,64664146.0,,,N/A,64979.0
Gate.io,"Infrastructure, Smart Contract Platform, BNB Chain Ecosystem, Avalanche Ecosystem, Polygon Ecosystem, Arbitrum Ecosystem, Ethereum Ecosystem, Optimism Ecosystem, Layer 2 (L2), Base Ecosystem, Binance Launchpad, Modular Blockchain, Layer 3 (L3), Rollup, Proof of Stake (PoS), Appchains, Binance Labs Portfolio",cartesi,64502747,75046047.0,57630.41965284562,64241.00322267112,0.15,8234149.0
Gate.io,"Artificial Intelligence (AI), BNB Chain Ecosystem, Ethereum Ecosystem, DePIN, AI Agents",netmind-token,64379221,204435672.0,3724.158785023704,2848.4555445442243,0.49,1677822.0
Gate.io,"Smart Contract Platform, Layer 2 (L2), Made in USA",metal,64163358,64163358.0,19600.803607282432,21239.90692452264,0.24,646779.0
Gate.io,,ark,64108021,64673709.0,26271.626811976428,41787.44224108578,0.35,4442158.0
Gate.io,"Ethereum Ecosystem, Telegram Apps, Binance HODLer Airdrops",banana-gun,63928772,154983053.0,109962.66024955394,189506.23666876327,0.05,69274626.0
Gate.io,"Smart Contract Platform, Layer 1 (L1), Ethereum Ecosystem, Proof of Stake (PoS)",pundi-aifx,63209305,63209305.0,,,N/A,98590.0
