Gate.io,"Smart Contract Platform, Layer 1 (L1), Layer 0 (L0), Made in USA, Directed Acyclic Graph (DAG)",constellation-labs,165278215,165278334.0,3203.3027510440966,6757.267265255167,0.11,2674615.0
Gate.io,"Internet of Things (IOT), Ethereum Ecosystem, DePIN, Base Ecosystem, Account Abstraction, GMCI DePIN Index, GMCI Index, Made in USA",iotex,165150319,165150319.0,32361.225199149874,54674.57637470255,0.11,11288045.0
Gate.io,"Launchpad, Meme, Base Ecosystem, Cat-Themed, Base Meme",toshi,165052432,165052432.0,1510601.4630248284,705548.5397005059,0.08,37736767.0
Gate.io,"Decentralized Finance (DeFi), Yield Farming, Yield Aggregator, Ethereum Ecosystem, Metagovernance, Curve Ecosystem, Yield Optimizer",convex-finance,164767758,200665661.0,31790.11358391398,48435.002987183434,0.4,21214714.0
Gate.io,"Decentralized Finance (DeFi), Ethereum Ecosystem, Stablecoin Protocol",tribe-2,163692466,359751383.0,5.0241645363469045,3.149215153368012,1.5,60791.0
Gate.io,"Decentralized Finance (DeFi), Liquid Staking Tokens, Ethereum Ecosystem, Liquid Staked ETH, Liquid Staking",treehouse-eth,161344844,161344844.0,,,N/A,195062.0
Gate.io,"Solana Ecosystem, DePIN, Multicoin Capital Portfolio, Made in USA",hivemapper,160510774,249648596.0,56261.87253665081,57483.043248863294,0.23,1401976.0
Gate.io,"Decentralized Exchange (DEX), Exchange-based Tokens, Ethereum Ecosystem",coinex-token,159185347,159185347.0,,,N/A,114210.0
Gate.io,"Decentralized Finance (DeFi), Binance Launchpool, Arbitrum Ecosystem, Ethereum Ecosystem, Restaking, Liquid Restaking Governance Tokens, Ether.fi Ecosystem, Consensys Portfolio, OKX Ventures Portfolio",ether-fi,158743199,685223772.0,873114.3543149978,703622.7447080635,0.01,52560207.0
Gate.io,"Stablecoins, Ethereum Ecosystem, Crypto-backed Stablecoin",elixir-staked-deusd,157905585,157905585.0,,,N/A,3376800.0
Gate.io,"Artificial Intelligence (AI), Meme, Base Ecosystem, AI Agents, Binance Alpha Spotlight, AI Framework",freysa-ai,157878160,157878160.0,0.0,0.0,N/A,1078176.0
Gate.io,"Decentralized Finance (DeFi), Tron Ecosystem",sun-token,157325294,318545348.0,223010.6906528144,173291.74216525,0.06,41272901.0
Gate.io,"Decentralized Exchange (DEX), Exchange-based Tokens, Decentralized Finance (DeFi), Automated Market Maker (AMM), BNB Chain Ecosystem, Derivatives, Perpetuals, Centralized Exchange (CEX) Token, Solana Ecosystem, Avalanche Ecosystem, Polygon Ecosystem, Near Protocol Ecosystem, Fantom Ecosystem, Arbitrum Ecosystem, Ethereum Ecosystem, ZkSync Ecosystem, Mantle Ecosystem, Linea Ecosystem, Base Ecosystem, DragonFly Capital Portfolio, Binance Labs Portfolio",woo-network,156387185,186258790.0,88582.1192861168,108663.85801734142,0.17,12001583.0
Gate.io,"Smart Contract Platform, BNB Chain Ecosystem, Layer 1 (L1), Ethereum Ecosystem, ZetaChain Ecosystem, Cross-chain Communication, Made in USA",zetachain,154808499,444337728.0,196236.27912227064,287226.7595956908,0.05,12036135.0
Gate.io,"Meme, Ethereum Ecosystem, Frog-Themed, AI Meme",turbo,154633311,154633311.0,127397.59073787049,179428.84704712973,0.04,53967824.0
Gate.io,"Smart Contract Platform, EthereumPoW Ecosystem, Proof of Work (PoW)",ethereum-pow-iou,153008340,153008340.0,18739.563798127092,31224.721457149735,0.14,13026669.0
Gate.io,"Smart Contract Platform, Gaming (GameFi), Layer 1 (L1), Ethereum Ecosystem, Modular Blockchain, Account Abstraction, Multicoin Capital Portfolio, Gaming Blockchains, Gaming Utility Token, Skale Ecosystem, Consensys Portfolio, Galaxy Digital Portfolio, Made in USA",skale,152632297,160563971.0,117027.31501817743,130199.48578585501,0.08,20407813.0
Gate.io,BNB Chain Ecosystem,acet-token,152352185,198764733.0,,,N/A,1157531.0
Gate.io,"SocialFi, Arbitrum Ecosystem",uxlink,151252142,447226914.0,101420.88701535303,90382.2702603513,0.11,31268014.0
Gate.io,"Decentralized Finance (DeFi), Derivatives, Prediction Markets, Solana Ecosystem",drift-protocol,150454898,521506203.0,125962.59040383404,118799.26556204537,0.06,33296187.0
Gate.io,"Smart Contract Platform, Layer 1 (L1), Real World Assets (RWA), RWA Protocol",polymesh,150364964,150364964.0,192977.30745600682,159799.17498824248,0.15,1789012.0
Gate.io,"Internet of Things (IOT), Oracle, NFT, Metaverse, Ethereum Ecosystem, DePIN, Alleged SEC Securities, Made in USA",xyo-network,149543674,149543674.0,26405.722679133483,16967.7937669633,0.51,16638180.0
Gate.io,"Payment Solutions, Made in USA, Directed Acyclic Graph (DAG)",nano,147640780,147640780.0,7798.992374436677,18925.52200489737,0.87,11153770.0
Gate.io,Smart Contract Platform,bitkub-coin,147504858,182617157.0,867.1196087694677,466.3370588953144,1.0,363983.0
Gate.io,"Smart Contract Platform, Masternodes, Zero Knowledge (ZK), Proof of Work (PoW), Made in USA",zencash,147020704,147022725.0,,,N/A,16963343.0
Gate.io,"NFT, Solana Ecosystem, NFT Marketplace, Paradigm Portfolio, Sequoia Capital Portfolio",magic-eden,145436665,1090429625.0,82460.47455399286,228699.2187945948,0.04,16094044.0
Gate.io,"Internet of Things (IOT), Smart Contract Platform, Layer 1 (L1), Proof of Work (PoW), Made in USA",digibyte,145225247,145237405.0,54889.72571824616,71773.34860723054,0.02,5201027.0
Gate.io,"Smart Contract Platform, Crypto-Backed Tokens, Wrapped-Tokens, Layer 2 (L2), Mantle Ecosystem",wrapped-ether-mantle-bridge,143878934,143878991.0,,,N/A,7864582.0
Gate.io,"Crypto-Backed Tokens, BNB Chain Ecosystem, Wrapped-Tokens, Ethereum Ecosystem",wrapped-beacon-eth,143681174,143681174.0,,,N/A,12144275.0
Gate.io,"Gaming (GameFi), Play To Earn, Telegram Apps, TON Ecosystem, Tap to Earn, Arcade Games",hamster-kombat,143452005,222838066.0,87678.305869476,122703.47038050726,0.04,16145447.0
Gate.io,"Decentralized Finance (DeFi), Derivatives, Perpetuals, Avalanche Ecosystem, Arbitrum Ecosystem",gmx,143352051,143352051.0,43079.09937960711,54330.671571604405,0.35,15328864.0
Gate.io,"Oracle, Ethereum Ecosystem",redstone-oracles,143271543,511684081.0,121236.11679148217,274495.81289163383,0.14,85859795.0
Gate.io,"Exchange-based Tokens, Decentralized Finance (DeFi), Ethereum Ecosystem, Real World Assets (RWA), Alleged SEC Securities",lcx,142744334,144111186.0,,,N/A,2453397.0
Gate.io,"Stablecoins, EUR Stablecoin, Solana Ecosystem, Avalanche Ecosystem, Ethereum Ecosystem, Base Ecosystem, Stellar Ecosystem",euro-coin,142624553,142624553.0,,,N/A,47218633.0
Gate.io,"Smart Contract Platform, DWF Labs Portfolio, Proof of Stake (PoS)",waves,142197969,142197969.0,33753.72086204013,30474.47374309409,0.26,13874617.0
Gate.io,"Gaming (GameFi), NFT, Solana Ecosystem, Animoca Brands Portfolio, FTX Holdings, Multicoin Capital Portfolio, Alameda Research Portfolio",metaplex,141482118,181297783.0,14471.165287708513,19702.614831294355,0.06,7391093.0
Gate.io,"BNB Chain Ecosystem, Binance Alpha Spotlight",bnb48-club-token,141170918,141170918.0,,,N/A,65453.0
Gate.io,"Binance Launchpool, Solana Ecosystem, Ethereum Ecosystem, Decentralized Science (DeSci)",bio-protocol,140601528,288018582.0,59291.36671708833,82382.44668514185,0.12,16938531.0
Gate.io,"Smart Contract Platform, Layer 1 (L1), Proof of Stake (PoS), GMCI Layer 1 Index, GMCI Index, Made in USA",casper-network,140247528,145202035.0,90344.99258318309,108136.0547016287,0.08,4230678.0
Gate.io,"Gaming (GameFi), NFT, BNB Chain Ecosystem, Solana Ecosystem, Polygon Ecosystem, Play To Earn, Move To Earn, Ethereum Ecosystem, Binance Launchpad, Gaming Governance Token, Sports Games, Alameda Research Portfolio, Binance Labs Portfolio, Sequoia Capital Portfolio",stepn,139307539,260583919.0,84724.01583538354,67073.19401497375,0.16,27289507.0
Gate.io,"BNB Chain Ecosystem, Binance-Peg Tokens",binance-peg-sol,138660892,138660892.0,,,N/A,3312084.0
Gate.io,"Tokenized Assets, Tokenized Gold, Real World Assets (RWA), Tokenized Commodities",kinesis-gold,138139536,138139536.0,,,N/A,46395409.0
Gate.io,"Smart Contract Platform, Layer 1 (L1), Harmony Ecosystem, Animoca Brands Portfolio, Binance Launchpad, Binance Labs Portfolio, Made in USA",harmony,138047498,147590100.0,86614.81078693358,86045.94012064642,0.1,11777691.0
Gate.io,"Crypto-Backed Tokens, Wrapped-Tokens, Avalanche Ecosystem",wrapped-avax,136206274,136206274.0,,,N/A,39835254.0
Gate.io,"Decentralized Exchange (DEX), Decentralized Finance (DeFi), Yield Farming, Automated Market Maker (AMM), BNB Chain Ecosystem, Seigniorage, Solana Ecosystem, Avalanche Ecosystem, Polygon Ecosystem, Fantom Ecosystem, Harmony Ecosystem, Arbitrum Ecosystem, Moonriver Ecosystem, Ethereum Ecosystem, Liquid Staking Governance Tokens, Curve Ecosystem, Stablecoin Protocol, Polygon zkEVM Ecosystem, Evmos Ecosystem, Fraxtal Ecosystem, GMCI DeFi Index, Liquid Staking, GMCI Index, Made in USA",frax-share,135449040,153027269.0,41238.79426734886,54267.055002281224,0.13,29285706.0
Gate.io,"Smart Contract Platform, Layer 1 (L1), Kadena Ecosystem, Multicoin Capital Portfolio, Proof of Work (PoW), Made in USA",kadena,135414746,135529930.0,90996.27135327432,84965.19170749266,0.23,4931135.0
Gate.io,"Gaming (GameFi), Polkadot Ecosystem, NFT, Ethereum Ecosystem, Gaming Blockchains, Andreessen Horowitz (a16z) Portfolio, Binance Labs Portfolio, Galaxy Digital Portfolio, Made in USA",mythos,135274565,174155294.0,5989.590811809382,6730.176185375741,0.4,5758127.0
Gate.io,"Stablecoins, Ethereum Ecosystem, XRP Ledger Ecosystem, Fiat-backed Stablecoin, Made in USA",ripple-usd,135058364,135058364.0,,,N/A,26626510.0
Gate.io,"Alleged SEC Securities, Osmosis Ecosystem, DeFiance Capital Portfolio, Pantera Capital Portfolio, Binance Labs Portfolio, Delphi Ventures Portfolio, Galaxy Digital Portfolio, OKX Ventures Portfolio",terra-luna-2,134386885,210770856.0,208691.7302647381,225817.53204507276,0.15,19162129.0
Gate.io,"Stablecoins, EUR Stablecoin, Polygon Ecosystem, Ethereum Ecosystem, Real World Assets (RWA), Fiat-backed Stablecoin",stasis-eurs,134245444,134245444.0,,,N/A,337265.0
Gate.io,"Decentralized Finance (DeFi), Analytics, DeFi Index, Base Ecosystem",mag7-ssi,131805479,131805479.0,2266.107062904438,1851.0815383091076,0.36,1440850.0
Gate.io,"Smart Contract Platform, SocialFi, NFT, BNB Chain Ecosystem, Binance Launchpool, Ethereum Ecosystem, Decentralized Identifier (DID), Zero Knowledge (ZK), DWF Labs Portfolio, Coinbase Ventures Portfolio, Multicoin Capital Portfolio, Alameda Research Portfolio, DragonFly Capital Portfolio, Binance Labs Portfolio, Quest-to-Earn",project-galaxy,131567958,205978311.0,,,N/A,58420.0
Gate.io,"Smart Contract Platform, Masternodes, Proof of Stake (PoS), Made in China",ontology,131506612,144085593.0,49098.670204508046,67693.77340409334,0.14,7108751.0
Gate.io,"Decentralized Exchange (DEX), Smart Contract Platform, Exchange-based Tokens, Decentralized Finance (DeFi), Arbitrum Ecosystem, Ethereum Ecosystem, Layer 2 (L2), Zero Knowledge (ZK), Loopring Ecosystem, Rollup, Energi Ecosystem",loopring,131374728,144858330.0,43322.11027867205,81481.92671443461,0.05,13106168.0
Gate.io,"Liquid Staking Tokens, Aptos Ecosystem, Liquid Staking",amnis-aptos,130783496,130811202.0,,,N/A,763684.0
Gate.io,"Tokenized Assets, Real World Assets (RWA), Tokenized Silver, Tokenized Commodities",kinesis-silver,130641239,130641239.0,,,N/A,1124069.0
Gate.io,"Stablecoins, USD Stablecoin, Solana Ecosystem, Fiat-backed Stablecoin",global-dollar,130302408,130302408.0,,,N/A,1057914.0
Gate.io,"Cronos Ecosystem, Bridged USDC, Bridged-Tokens, Bridged Stablecoins",cronos-bridged-usdc-cronos,129479265,129479265.0,,,N/A,1683568.0
Gate.io,"BNB Chain Ecosystem, Arbitrum Ecosystem, Cardano Ecosystem, Ethereum Ecosystem, DePIN, Base Ecosystem, DWF Labs Portfolio",world-mobile-token,126763695,366275553.0,3164.4156917907403,3008.883136336172,0.05,16975518.0
Gate.io,"Smart Contract Platform, Base Ecosystem, Gaming Blockchains",b3,125593470,589843681.0,57688.85256597305,60693.03619909331,0.32,22588777.0
Gate.io,"Smart Contract Platform, Layer 1 (L1), Zero Knowledge (ZK)",ozone-chain,124818551,172056736.0,,,N/A,246612.0
Gate.io,"Smart Contract Platform, Proof of Stake (PoS), Sequoia Capital Portfolio",iostoken,124194417,124194417.0,51481.87368112252,145070.7762105823,0.27,116464850.0
Gate.io,"BNB Chain Ecosystem, Harmony Ecosystem, Ethereum Ecosystem, Alameda Research Portfolio, Binance Labs Portfolio",swipe,123706509,123747530.0,81684.47769772066,34796.000256234845,0.21,7430218.0
Gate.io,"BNB Chain Ecosystem, Tron Ecosystem",global-commercial-business,123633708,123633708.0,,,N/A,198489.0
Gate.io,"Smart Contract Platform, BNB Chain Ecosystem, Ethereum Ecosystem, Zero Knowledge (ZK), Animoca Brands Portfolio, Binance Labs Portfolio, OKX Ventures Portfolio",polyhedra-network,122482011,2028402410.0,360168.8068732988,413048.3746658619,0.02,5107635.0
Gate.io,"Tokenized Assets, Polygon Ecosystem, Arbitrum Ecosystem, Ethereum Ecosystem, Real World Assets (RWA), Starknet Ecosystem, Tokenized Treasury Bills (T-Bills)",eutbl,122206105,122206105.0,,,N/A,0.0
Gate.io,"Polygon Ecosystem, Bridged DAI, Bridged-Tokens, Bridged Stablecoins",polygon-pos-bridged-dai-polygon-pos,121552028,121552028.0,,,N/A,12030868.0
Gate.io,"Artificial Intelligence (AI), Binance Launchpool, Solana Ecosystem, DePIN, Animoca Brands Portfolio, Multicoin Capital Portfolio, Delphi Ventures Portfolio, OKX Ventures Portfolio, Made in USA",io,121358931,658430044.0,327262.6627487682,329699.7135285677,0.12,26579796.0
Gate.io,"Decentralized Finance (DeFi), Insurance, Ethereum Ecosystem",nxm,119717066,119717066.0,,,N/A,0.0
Gate.io,"Business Services, Decentralized Finance (DeFi), Oracle, Fantom Ecosystem, Ethereum Ecosystem, Binance Launchpad, Osmosis Ecosystem, Energi Ecosystem, Binance Labs Portfolio, Sequoia Capital Portfolio",band-protocol,119449406,121199545.0,45675.48241383119,53731.72090086332,0.25,11916303.0
Gate.io,"Arbitrum Ecosystem, Ethereum Ecosystem",reserve-protocol-eth-plus,118384704,118384704.0,,,N/A,251934.0
Gate.io,"Decentralized Exchange (DEX), Exchange-based Tokens, Decentralized Finance (DeFi), Yield Farming, Automated Market Maker (AMM), BNB Chain Ecosystem, Yearn Ecosystem, Solana Ecosystem, Avalanche Ecosystem, Polygon Ecosystem, Near Protocol Ecosystem, Fantom Ecosystem, Harmony Ecosystem, Arbitrum Ecosystem, Celo Ecosystem, Ethereum Ecosystem, Base Ecosystem, Alameda Research Portfolio, Pantera Capital Portfolio, Energi Ecosystem, Sora Ecosystem, Blockchain Capital Portfolio",sushi,118264099,172183670.0,167061.89951145797,228271.5513421778,0.07,49994283.0
Gate.io,"Solana Ecosystem, Meme, Solana Meme, Murad Picks",gigachad-2,117837643,117837643.0,6880.155481418544,12873.764019929928,0.39,8898086.0
Gate.io,"Decentralized Exchange (DEX), Decentralized Finance (DeFi), Gnosis Chain Ecosystem, MEV Protection, Arbitrum Ecosystem, Ethereum Ecosystem, Intent, Delphi Ventures Portfolio, Blockchain Capital Portfolio",cow-protocol,117643980,283735831.0,23111.54125527807,29752.892841609908,0.14,26478027.0
Gate.io,"Stablecoins, Ethereum Ecosystem, Base Ecosystem, Blast Ecosystem, Fiat-backed Stablecoin",anzen-usdz,116128298,116128298.0,,,N/A,240622.0
Gate.io,"Exchange-based Tokens, BNB Chain Ecosystem, Centralized Exchange (CEX) Token",nkyc-token,115719966,115719966.0,,,N/A,245262.0
Gate.io,"Smart Contract Platform, Ethereum Ecosystem, Zero Knowledge (ZK), Alleged SEC Securities, Privacy Blockchain",coti,115268007,128625148.0,38114.02640766055,38864.06569282708,0.25,13129751.0
Gate.io,"Decentralized Finance (DeFi), Derivatives, Synthetic Issuer, Ethereum Ecosystem, Synthetic",stp-network,114051431,114051431.0,55222.615887977605,54232.124635973705,0.27,36149124.0
Gate.io,"BNB Chain Ecosystem, Ethereum Ecosystem, Payment Solutions, DWF Labs Portfolio",alchemy-pay,113959710,230515436.0,175778.6816481428,167381.59361817944,0.09,31443442.0
Gate.io,"Smart Contract Platform, BNB Chain Ecosystem, Ethereum Ecosystem, Layer 2 (L2)",prometeus,113946661,120190314.0,25202.11798218724,37865.998064855135,0.35,2675259.0
Gate.io,"Meme, Ethereum Ecosystem, Dog-Themed",neiro-3,113834246,113834246.0,232856.0029875446,259392.15170407586,0.04,109706442.0
Gate.io,"Decentralized Finance (DeFi), Ethereum Ecosystem, Real World Assets (RWA), Coinbase Ventures Portfolio, Stablecoin Protocol, Binance Labs Portfolio, Galaxy Digital Portfolio",usual,113827552,124984376.0,263843.77302028757,270830.48446810263,0.06,14813367.0
Gate.io,"Artificial Intelligence (AI), Smart Contract Platform, BNB Chain Ecosystem, Solana Ecosystem, Layer 1 (L1), Polygon Ecosystem, Ethereum Ecosystem, DWF Labs Portfolio, Injective Ecosystem, OKX Ventures Portfolio",zignaly,113426750,157262242.0,3914.9482432738696,4226.062452323082,0.27,2705214.0
Gate.io,"Smart Contract Platform, SocialFi, Layer 1 (L1), Gaming Blockchains",hive,113088403,,77942.7979054518,61799.687472024394,0.25,5452606.0
Gate.io,"Arbitrum Ecosystem, Ethereum Ecosystem, Account Abstraction, Coinbase Ventures Portfolio, Binance Labs Portfolio, Consensys Portfolio, Outlier Ventures Portfolio",biconomy,112701102,120431824.0,51898.06238026796,58901.8066800847,0.33,12908312.0
Gate.io,"Big Data, Business Services, Infrastructure, Decentralized Finance (DeFi), Solana Ecosystem, FTX Holdings, DWF Labs Portfolio, Name Service",bonfida,110708777,111724152.0,99009.42425564585,104991.65220180419,0.09,11948171.0
Gate.io,"Smart Contract Platform, BNB Chain Ecosystem, Layer 1 (L1), Ethereum Ecosystem, Decentralized Identifier (DID), Base Ecosystem, Gravity Alpha Ecosystem",g-token,110467188,183279586.0,123017.60304852267,98416.90618883338,0.39,21395701.0
Gate.io,"Solana Ecosystem, Polygon Ecosystem, Ethereum Ecosystem",m2-global-wealth-limited-mmx,110275354,353788447.0,,,N/A,110855.0
Gate.io,"Arbitrum Ecosystem, Bridged USDC, Bridged-Tokens, Bridged Stablecoins",usd-coin-ethereum-bridged,109878563,109878563.0,,,N/A,35760633.0
Gate.io,"Decentralized Finance (DeFi), Yield Farming, Lending/Borrowing Protocols, Ethereum Ecosystem, Real World Assets (RWA), Base Ecosystem, Binance Alpha Spotlight",syrup,109833632,176248881.0,53040.75070729727,57348.19705608163,0.2,14211849.0
Gate.io,"Music, NFT, Ethereum Ecosystem, Coinbase Ventures Portfolio, Multicoin Capital Portfolio, Pantera Capital Portfolio, Energi Ecosystem, Binance Labs Portfolio",audius,109832107,109832107.0,47895.251410941506,44167.059577267355,0.46,19482711.0
Gate.io,"Business Services, Infrastructure, Smart Contract Platform, Decentralized Finance (DeFi), Polygon Ecosystem, Arbitrum Ecosystem, Ethereum Ecosystem, Liquid Staking Governance Tokens, Coinbase Ventures Portfolio, Proof of Stake (PoS), Index Coop Defi Index, Consensys Portfolio, Liquid Staking, Index Coop Index",rocket-pool,109759537,109759537.0,33923.90800864182,54859.41756739718,0.48,10325196.0
Gate.io,"Meme, PulseChain Ecosystem",the-grays-currency,108258999,108258999.0,,,N/A,947742.0
Gate.io,"Decentralized Finance (DeFi), Ethereum Ecosystem, Morpho Ecosystem",steakhouse-usdc-morpho-vault,107768856,107768856.0,,,N/A,0.0
Gate.io,"Smart Contract Platform, Cross-chain Communication, Pantera Capital Portfolio",icon,107399604,108619630.0,58550.13761751017,48656.09632135662,0.12,3097890.0
Gate.io,"Exchange-based Tokens, NFT, BNB Chain Ecosystem, Ethereum Ecosystem",swftcoin,107271816,107271816.0,544840.4637665292,395422.01619449526,0.4,2472902.0
Gate.io,"Artificial Intelligence (AI), Smart Contract Platform, Layer 1 (L1), Proof of Work (PoW)",qubic-network,106132076,126934594.0,8671.998404381782,14524.716225825447,0.4,2718577.0
Gate.io,"Smart Contract Platform, BNB Chain Ecosystem, Ethereum Ecosystem, DWF Labs Portfolio, Made in USA",proton,106018472,117514303.0,5772.507260979668,13776.209156816642,0.22,4580186.0
Gate.io,"Solana Ecosystem, Multicoin Capital Portfolio, Stablecoin Protocol, Alameda Research Portfolio, DeFiance Capital Portfolio",uxd-protocol-token,105833290,105833290.0,,,N/A,34.7
Gate.io,"Solana Ecosystem, Meme, Solana Meme, PolitiFi, Made in USA",melania-meme,105204003,701359442.0,22605.46122328573,24516.178906552646,0.14,27195323.0
Gate.io,"Smart Contract Platform, Decentralized Finance (DeFi), Binance Launchpool, Derivatives, Perpetuals, Ethereum Ecosystem, Layer 2 (L2), DragonFly Capital Portfolio, Pantera Capital Portfolio",aevo-exchange,104971383,116226007.0,269897.3628313681,254116.8400866685,0.09,18908182.0
Gate.io,"Decentralized Exchange (DEX), Decentralized Finance (DeFi), BNB Chain Ecosystem, Wallets, XRP Ledger Ecosystem",solo-coin,104283874,104283874.0,6389.464867870903,8213.85100827828,0.37,3760541.0
Gate.io,"Tokenized Real Estate, Tokenized Assets, Gnosis Chain Ecosystem, RealT Tokens, Real World Assets (RWA), RWA Protocol",realtoken-ecosystem-governance,103980309,726121268.0,,,N/A,1755.34
Gate.io,"NFT, Meme, Arbitrum Ecosystem, Ethereum Ecosystem, Anime-Themed, Binance HODLer Airdrops, Airdropped Tokens by NFT Projects",anime,103323425,186551363.0,38876.4732808192,44957.24883312211,0.05,18256280.0
Gate.io,"Lending/Borrowing Protocols, Ethereum Ecosystem, Paradigm Portfolio, Coinbase Ventures Portfolio",euler,103292585,150265124.0,,,N/A,8416166.0
Gate.io,"Smart Contract Platform, Ethereum Ecosystem, Metis Ecosystem, Layer 2 (L2), DWF Labs Portfolio, Rollup, GMCI Layer 2 Index, OKX Ventures Portfolio, GMCI Index",metis-token,103159025,164913687.0,119297.47858424991,114983.73347420049,0.06,6491380.0
Gate.io,"Gaming (GameFi), NFT, Metaverse, Play To Earn, Ethereum Ecosystem, Animoca Brands Portfolio, RPG, Gaming Governance Token, Adventure Games, Energi Ecosystem, Delphi Ventures Portfolio",illuvium,102668559,132341530.0,32254.324467080045,46404.96318479885,0.29,24152798.0
Gate.io,"Artificial Intelligence (AI), Base Ecosystem, AI Agents, AI Applications, Made in USA",venice-token,102373794,244034986.0,37438.13485895219,24859.168485132595,0.17,11053827.0
Gate.io,"Stablecoins, BNB Chain Ecosystem",astherus-usdf,102372967,102372967.0,,,N/A,120002.0
Gate.io,"NFT, BNB Chain Ecosystem, Ethereum Ecosystem, Binance Launchpad, DWF Labs Portfolio, Binance Labs Portfolio",space-id,102227952,474116571.0,179223.34193902442,190191.18197493796,0.04,36138330.0
Gate.io,"NFT, Binance Launchpool, Meme, Ethereum Ecosystem, Binance Labs Portfolio, GMCI Meme Index, GMCI Index",memecoin-2,101711948,171475364.0,251819.93053563434,243267.7512458615,0.04,22230280.0
Gate.io,"Solana Ecosystem, Meme, Base Ecosystem, AI Meme, AI Agents, Virtuals Protocol Ecosystem, Binance Alpha Spotlight, DeFAI",aixbt,101150351,118219783.0,72409.76143256163,66608.56730902728,0.12,73106828.0
Gate.io,"Artificial Intelligence (AI), Smart Contract Platform, Masternodes, DePIN, Proof of Work (PoW), Made in USA",zelcash,101116189,101137342.0,115542.19168182775,103774.77629931645,0.08,9462630.0
Gate.io,"Decentralized Finance (DeFi), BNB Chain Ecosystem, Real World Assets (RWA), DWF Labs Portfolio, Stellar Ecosystem",velo,100614302,326736128.0,31710.49644944425,58282.68319833477,0.28,32988850.0
Gate.io,"Bridged USDT, QL1 Ecosystem, Bridged-Tokens, Bridged Stablecoins",qusdt,99956956,99956956.0,,,N/A,6143.69
Gate.io,"Business Services, Decentralized Finance (DeFi), Oracle, Derivatives, Synthetic Issuer, Avalanche Ecosystem, Ethereum Ecosystem, Blockchain Capital Portfolio, Synthetic, Made in USA",uma,99886127,144139601.0,73963.88949184974,80371.51684182479,0.09,14753722.0
Gate.io,"Stablecoins, LP Tokens, Ethereum Ecosystem",resolv-rlp,99650190,99650190.0,,,N/A,630865.0
Gate.io,"Decentralized Exchange (DEX), Decentralized Finance (DeFi), Automated Market Maker (AMM), Ethereum Ecosystem, Cronos Ecosystem",vvs-finance,98915101,193391140.0,90.09579389247273,29.906562864847125,3.76,255778.0
Gate.io,"Smart Contract Platform, Polkadot Ecosystem, Binance Launchpool, Layer 2 (L2), Manta Network Ecosystem, Multicoin Capital Portfolio, Alameda Research Portfolio, DeFiance Capital Portfolio, Binance Labs Portfolio",manta-network,98212416,258256604.0,166103.27880067442,221761.30277839935,0.08,33080266.0
Gate.io,"NFT, Polygon Ecosystem",sathosi-airlines-token,98102684,468526313.0,,,N/A,24873.0
Gate.io,"Polygon Ecosystem, Arbitrum Ecosystem, Ethereum Ecosystem, Optimism Ecosystem, Bridge Governance Tokens, Cross-chain Communication, Intent, Boba Network Ecosystem, Blockchain Capital Portfolio, Made in USA",across-protocol,97916180,242417896.0,128671.43519289877,180265.86387537315,0.08,15249517.0
Gate.io,"Smart Contract Platform, Ethereum Ecosystem, Layer 2 (L2), Optimism Superchain Ecosystem, Outlier Ventures Portfolio, Lisk Ecosystem",lisk,97641089,226640615.0,61323.24304465517,60237.89339704683,0.18,12662011.0
Gate.io,"Big Data, Infrastructure, Storage, Cardano Ecosystem, DePIN",iagon,97466428,259205135.0,3790.7492546,2413.0404590872276,0.36,523631.0
Gate.io,"NFT, Ethereum Ecosystem",superrare,97043021,121247559.0,158935.58585016037,124410.94343920577,0.03,266174115.0
Gate.io,"Solana Ecosystem, Meme, Frog-Themed, Solana Meme, GMCI Meme Index, GMCI Index",book-of-meme,96957165,96957165.0,282582.41284403537,287678.57466858666,0.06,45946830.0
Gate.io,"Crypto-Backed Tokens, Decentralized Finance (DeFi), Compound Tokens, cToken, Ethereum Ecosystem",compound-ether,96466878,96466878.0,,,N/A,104.16
Gate.io,"XDC Ecosystem, Telos Ecosystem",ecoin-2,95498064,207099463.0,,,N/A,5.24
Gate.io,"Software as a service, Ethereum Ecosystem, Energi Ecosystem",status,95336955,163807160.0,112349.24070955894,100144.59922053102,0.04,9925425.0
Gate.io,"Infrastructure, Smart Contract Platform, Ethereum Ecosystem, Data Availability, Modular Blockchain",avail,94925555,486188576.0,45502.13233143304,65344.9513669113,0.13,7329378.0
Gate.io,"Decentralized Finance (DeFi), Yield Farming, Avalanche Ecosystem, Fantom Ecosystem, Arbitrum Ecosystem, Olympus Pro Ecosystem, Ethereum Ecosystem, Stablecoin Protocol",spell-token,94896472,117297364.0,272316.75225976045,348345.1188492012,0.03,12914625.0
Gate.io,"Smart Contract Platform, BNB Chain Ecosystem, Binance Launchpool, Ethereum Ecosystem, Layer 2 (L2), Restaking, Rollups-as-a-Service (RaaS), Rollup, Binance Labs Portfolio",altlayer,94706204,339203914.0,140689.32680284133,135246.35785644644,0.03,17072538.0
