Exchange,Category,Token CEX,Market Cap Today,FDV Today,Depth +2%,Depth -2%,Bid Ask Spread Percentage,24H Volume (USD)
Gate.io,"Decentralized Finance (DeFi), Lending/Borrowing Protocols, Avalanche Ecosystem, Polygon Ecosystem, Ethereum Ecosystem, Real World Assets (RWA), Paradigm Portfolio, Index Coop Defi Index, Stablecoin Protocol, DragonFly Capital Portfolio, Andreessen Horowitz (a16z) Portfolio, Energi Ecosystem, Sora Ecosystem, GMCI DeFi Index, RWA Protocol, Index Coop Index, GMCI Index, Polychain Capital Portfolio, Made in USA, Coinbase 50 Index",maker,990954698,1021621891.0,285893.32181112777,197760.3765488986,0.09,130264771.0
Gate.io,"Decentralized Finance (DeFi), BNB Chain Ecosystem, Ethereum Ecosystem",dexe,987135169,1668244957.0,63173.58526727637,40183.87674963432,0.26,31696339.0
Gate.io,"Stablecoins, USD Stablecoin, Arbitrum Ecosystem, Ethereum Ecosystem, Fiat-backed Stablecoin",usual-usd,978414886,978414886.0,,,N/A,101712197.0
Gate.io,"Infrastructure, Smart Contract Platform, Layer 2 (L2), Bitcoin Sidechains, Stacks Ecosystem, SideChain, GMCI Layer 2 Index, GMCI 30 Index, Blockchain Capital Portfolio, GMCI Index, Made in USA, Coinbase 50 Index",blockstack,967420300,967420300.0,300160.35632822965,359387.3481337876,0.03,26887510.0
Gate.io,"Smart Contract Platform, Decentralized Finance (DeFi), BNB Chain Ecosystem, Cosmos Ecosystem, Layer 1 (L1), Ethereum Ecosystem, Binance Launchpad, Osmosis Ecosystem, Proof of Stake (PoS), Pantera Capital Portfolio, Secret Ecosystem, GMCI Layer 1 Index, GMCI Index, Made in USA, Coinbase 50 Index",injective-protocol,950513985,972619483.0,418257.13324609725,521566.7585480514,0.1,107960776.0
Gate.io,"Polygon Ecosystem, Arbitrum Ecosystem, Liquid Staking Tokens, Ethereum Ecosystem, Optimism Ecosystem, Base Ecosystem, Liquid Staked ETH, Liquid Staking",rocket-pool-eth,946203381,946203232.0,,,N/A,11386797.0
Gate.io,"Smart Contract Platform, Ethereum Ecosystem, Decentralized Identifier (DID), Optimism Ecosystem, Coinbase Ventures Portfolio, Multicoin Capital Portfolio, Andreessen Horowitz (a16z) Portfolio, Blockchain Capital Portfolio, Optimism Superchain Ecosystem, World Chain Ecosystem, Made in USA",worldcoin-wld,940724193,8510044603.0,784018.3750802006,654699.5675618211,0.04,108404976.0
Gate.io,"Smart Contract Platform, Gaming (GameFi), NFT, Play To Earn, Ethereum Ecosystem, Layer 2 (L2), Zero Knowledge (ZK), Animoca Brands Portfolio, Immutable Ecosystem, Coinbase Ventures Portfolio, Rollup, Gaming Blockchains, GMCI 30 Index, GMCI Index, Gaming Marketplace, Coinbase 50 Index",immutable-x,932976668,1055213948.0,157509.33065486688,131745.81921884633,0.09,32939406.0
Gate.io,"Artificial Intelligence (AI), Smart Contract Platform, Decentralized Finance (DeFi), Layer 1 (L1), Real World Assets (RWA), Parallelized EVM, Coinbase Ventures Portfolio, Multicoin Capital Portfolio, GMCI Layer 1 Index, Delphi Ventures Portfolio, Circle Ventures Portfolio, OKX Ventures Portfolio, GMCI Index, World Liberty Financial Portfolio, Made in USA",sei-network,928069597,1992634668.0,365775.0717706194,498746.4728269968,0.05,101134363.0
Gate.io,"Decentralized Finance (DeFi), Solana Ecosystem, Liquid Staking Tokens, Liquid Staked SOL, Liquid Staking",binance-staked-sol,912114408,912114408.0,,,N/A,2627669.0
Gate.io,"Smart Contract Platform, Layer 1 (L1), DWF Labs Portfolio",flare-networks,900134480,1522073288.0,194719.38314623476,225844.302948923,0.02,7187176.0
Gate.io,"Smart Contract Platform, Layer 1 (L1), DePIN, Theta Ecosystem, Blockchain Capital Portfolio, Made in USA",theta-token,885226057,885226057.0,227561.66102419214,146104.6267878889,0.1,28058752.0
Gate.io,"Artificial Intelligence (AI), Business Services, Infrastructure, Smart Contract Platform, Analytics, Avalanche Ecosystem, Polygon Ecosystem, Near Protocol Ecosystem, Harmony Ecosystem, Arbitrum Ecosystem, Ethereum Ecosystem, DePIN, Coinbase Ventures Portfolio, Multicoin Capital Portfolio, Proof of Stake (PoS), Energi Ecosystem, Sora Ecosystem, Made in USA, Coinbase 50 Index",the-graph,881415557,995830073.0,202894.7665132391,233380.46281219725,0.06,36578814.0
Gate.io,"Polygon Ecosystem, Bridged USDT, Bridged-Tokens, Bridged Stablecoins",polygon-bridged-usdt-polygon,846989371,846989371.0,,,N/A,13921133.0
Gate.io,"BNB Chain Ecosystem, Solana Ecosystem, Polygon Ecosystem, Meme, Arbitrum Ecosystem, Ethereum Ecosystem, Aptos Ecosystem, Dog-Themed, Solana Meme, Neon Ecosystem, GMCI Meme Index, GMCI Index, Made in USA, Coinbase 50 Index",bonk,839486039,963495235.0,615491.7765905445,574372.9151276345,0.19,66295872.0
Gate.io,"Infrastructure, Decentralized Finance (DeFi), Polygon Ecosystem, Arbitrum Ecosystem, Ethereum Ecosystem, Optimism Ecosystem, Liquid Staking Governance Tokens, eGirl Capital Portfolio, Paradigm Portfolio, Coinbase Ventures Portfolio, Multicoin Capital Portfolio, Index Coop Defi Index, Alameda Research Portfolio, DragonFly Capital Portfolio, Andreessen Horowitz (a16z) Portfolio, GMCI DeFi Index, Delphi Ventures Portfolio, Liquid Staking, Index Coop Index, GMCI Index, Coinbase 50 Index",lido-dao,828971628,924009671.0,541324.5991631034,395440.0644666826,0.1,90091792.0
Gate.io,"Crypto-Backed Tokens, BNB Chain Ecosystem, Avalanche Ecosystem, Arbitrum Ecosystem, Ethereum Ecosystem, Mantle Ecosystem, Base Ecosystem, Restaking, Berachain Ecosystem, Merlin Chain Ecosystem, Sonic Ecosystem, Sei v2 Ecosystem, Soneium Ecosystem, Corn Ecosystem",solv-protocol-solvbtc-bbn,822656267,822656267.0,,,N/A,186580.0
Gate.io,"Stablecoins, USD Stablecoin, Solana Ecosystem, Ethereum Ecosystem, Fiat-backed Stablecoin, Made in USA",paypal-usd,760813643,760813643.0,605243.8262451525,244809.76518478105,0.01,253489880.0
Gate.io,"Smart Contract Platform, DWF Labs Portfolio, GMCI Layer 1 Index, GMCI Index, Made in USA, Coinbase 50 Index",eos,760080886,1052267661.0,644204.4451298711,500523.2482323407,0.02,69704758.0
Gate.io,"Liquid Staking Tokens, Ethereum Ecosystem, Mantle Ecosystem, Liquid Staked ETH, Liquid Staking",mantle-staked-ether,756919272,756919272.0,,,N/A,6442980.0
Gate.io,"Stablecoins, Tokenized Assets, Tokenized Gold, Ethereum Ecosystem, Real World Assets (RWA), Tokenized Commodities",tether-gold,741861633,741861633.0,75083.1785076616,73447.80726024733,0.1,25708773.0
Gate.io,"Smart Contract Platform, Gaming (GameFi), NFT, Layer 1 (L1), Play To Earn, Ethereum Ecosystem, DWF Labs Portfolio, Gaming Platform, Binance Labs Portfolio, GalaChain Ecosystem, Made in USA",gala,722363397,722363416.0,380573.5065444235,304296.593055486,0.06,71344746.0
Gate.io,"Smart Contract Platform, Layer 1 (L1), Tezos Ecosystem, Proof of Stake (PoS), GMCI Layer 1 Index, GMCI Index, Polychain Capital Portfolio, Made in USA, Coinbase 50 Index",tezos,719127526,733206160.0,194199.05899534724,253684.97342722802,0.06,22793943.0
Gate.io,"BNB Chain Ecosystem, Bridged USDC, Bridged-Tokens, Bridged Stablecoins",binance-bridged-usdc-bnb-smart-chain,698237543,698237543.0,,,N/A,97385451.0
Gate.io,"Crypto-Backed Tokens, BNB Chain Ecosystem, Wrapped-Tokens",wbnb,693939480,695499137.0,,,N/A,264301321.0
Gate.io,"Storage, BNB Chain Ecosystem, Ethereum Ecosystem, DePIN, Alleged SEC Securities, Binance Launchpad, Tron Ecosystem, Energi Ecosystem, Binance Labs Portfolio, BitTorrent Ecosystem, GMCI DePIN Index, GMCI Index",bittorrent,683061981,685790497.0,31049.73354877925,66315.24695762452,0.13,21264839.0
Gate.io,"Berachain Ecosystem, Bridged USDC, Bridged-Tokens, Bridged Stablecoins",stargate-bridged-usdc-berachain,681617662,681617662.0,,,N/A,4271073.0
Gate.io,"Gaming (GameFi), NFT, Metaverse, Polygon Ecosystem, Play To Earn, Harmony Ecosystem, Ethereum Ecosystem, Animoca Brands Portfolio, Alleged SEC Securities, Binance Launchpad, Gaming Utility Token, Simulation Games, Energi Ecosystem, Binance Labs Portfolio, Coinbase 50 Index",the-sandbox,681204153,835540407.0,432218.98002476426,295416.43887222017,0.04,59276532.0
Gate.io,"Decentralized Finance (DeFi), Solana Ecosystem, Liquid Staking Governance Tokens, Multicoin Capital Portfolio, Alameda Research Portfolio, Delphi Ventures Portfolio, Liquid Staking, Made in USA",jito-governance-token,676248784,2221056413.0,517437.80121521914,628585.1691008797,0.04,29087411.0
Gate.io,"Smart Contract Platform, Bitcoin Fork, Proof of Work (PoW)",bitcoin-cash-sv,674516852,674517596.0,50192.99791760371,63483.48998846212,0.03,46410895.0
Gate.io,"Arbitrum Ecosystem, Bridged WBTC, Bridged-Tokens",arbitrum-bridged-wbtc-arbitrum-one,674261794,674261794.0,,,N/A,92266966.0
Gate.io,"Internet of Things (IOT), Smart Contract Platform, Layer 1 (L1), DePIN, DWF Labs Portfolio, IOTA EVM Ecosystem, Outlier Ventures Portfolio, Directed Acyclic Graph (DAG)",iota,665195147,833833915.0,284265.4666735015,273720.2317442745,0.06,21092195.0
Gate.io,"Smart Contract Platform, Decentralized Finance (DeFi), Layer 1 (L1), Berachain Ecosystem, Binance HODLer Airdrops, Outlier Ventures Portfolio, Polychain Capital Portfolio",berachain-bera,658213627,3050691572.0,869530.2577179859,1035369.7512937093,0.02,96881946.0
Gate.io,"Internet of Things (IOT), Ethereum Ecosystem, DePIN, DWF Labs Portfolio, Coinbase 50 Index",jasmycoin,652833884,674136601.0,274825.88481653656,239256.6472279237,0.04,52701815.0
Gate.io,"Smart Contract Platform, Layer 1 (L1)",kaia,644073194,644073215.0,89852.84313929312,212213.07011616044,0.04,19746737.0
Gate.io,"Stablecoins, Tokenized Assets, Tokenized Gold, Ethereum Ecosystem, Real World Assets (RWA), Tokenized Commodities",pax-gold,635815876,635815876.0,,,N/A,43165913.0
Gate.io,"Smart Contract Platform, Sports, NFT, Layer 1 (L1), Animoca Brands Portfolio, Alleged SEC Securities, Multicoin Capital Portfolio, Proof of Stake (PoS), Flow Ecosystem, Andreessen Horowitz (a16z) Portfolio",flow,627371859,627371859.0,419857.7974004272,374696.5372391653,0.1,26665649.0
Gate.io,"Stablecoins, USD Stablecoin, BNB Chain Ecosystem, Arbitrum Ecosystem, Ethereum Ecosystem, Fiat-backed Stablecoin",usdx-money-usdx,625468749,625468749.0,,,N/A,245888.0
Gate.io,"Decentralized Finance (DeFi), Solana Ecosystem, Liquid Staking Tokens, Liquid Staked SOL, Liquid Staking",msol,607451023,607451023.0,8902.304222561086,9180.84959254993,0.4,9954738.0
Gate.io,"BNB Chain Ecosystem, Arbitrum Ecosystem, Liquid Staking Tokens, Base Ecosystem, Restaking, Liquid Restaking Tokens, Blast Ecosystem, Mode Ecosystem, Liquid Staking",renzo-restaked-eth,600935508,600977778.0,,,N/A,2431336.0
Gate.io,"Gaming (GameFi), NFT, BNB Chain Ecosystem, Metaverse, Meme, Play To Earn, Ethereum Ecosystem, Telegram Apps, Dog-Themed, DWF Labs Portfolio, RPG, On-chain Gaming, TokenFi Launchpad, GMCI Meme Index, GMCI Index",floki,588760333,609160759.0,446146.7916786238,357175.9863956771,0.03,105413963.0
Gate.io,"Smart Contract Platform, Proof of Stake (PoS), Made in China",neo,561676497,796365372.0,232003.12684636185,172237.70134418353,0.06,21267297.0
Gate.io,"NFT, Ethereum Ecosystem, Decentralized Identifier (DID), Name Service",ethereum-name-service,552482893,1665831891.0,353378.883019717,285394.5088652126,0.06,38469694.0
Gate.io,"Business Services, Infrastructure, Decentralized Finance (DeFi), Oracle, Solana Ecosystem, Neon Ecosystem, Manta Network Ecosystem, Multicoin Capital Portfolio, GMCI DeFi Index, Delphi Ventures Portfolio, GMCI Index",pyth-network,529827776,1461598385.0,451963.68306630227,419498.7245260339,0.07,23808588.0
Gate.io,"Stablecoins, Ethereum Ecosystem",resolv-usr,528092429,528092429.0,,,N/A,7797568.0
Gate.io,"Stablecoins, Berachain Ecosystem",honey-3,527042529,527042529.0,,,N/A,14855776.0
Gate.io,"Artificial Intelligence (AI), Smart Contract Platform, Privacy, Masternodes, DePIN, DWF Labs Portfolio, Proof of Stake (PoS), Proof of Work (PoW)",beldex,523981687,752694105.0,2168.099584507641,3524.5949541854607,0.37,3081515.0
Gate.io,"Decentralized Exchange (DEX), Exchange-based Tokens, Decentralized Finance (DeFi), Yield Farming, Automated Market Maker (AMM), Polygon Ecosystem, Fantom Ecosystem, Arbitrum Ecosystem, Ethereum Ecosystem, Optimism Ecosystem, Curve Ecosystem, DWF Labs Portfolio, Stablecoin Protocol, Energi Ecosystem, Sora Ecosystem, Binance Labs Portfolio, GMCI DeFi Index, GMCI Index, Coinbase 50 Index",curve-dao-token,522031792,899238112.0,552160.5804119065,542769.5603500658,0.05,105247508.0
Gate.io,"Communication, Internet of Things (IOT), Smart Contract Platform, Solana Ecosystem, DePIN, Multicoin Capital Portfolio, Proof of Stake (PoS), Alameda Research Portfolio, Pantera Capital Portfolio, Andreessen Horowitz (a16z) Portfolio, Made in USA, Coinbase 50 Index",helium,520697186,647087947.0,110566.24238926944,131475.64979466764,0.07,6320522.0
Gate.io,"Smart Contract Platform, Gaming (GameFi), NFT, Layer 1 (L1), Play To Earn, Zero Knowledge (ZK), FTX Holdings, Ronin Ecosystem, Gaming Blockchains, SideChain, Andreessen Horowitz (a16z) Portfolio, Binance Labs Portfolio",ronin,520180311,839827190.0,44715.23561956406,61951.0654379854,0.37,11692838.0
Gate.io,"Gaming (GameFi), NFT, BNB Chain Ecosystem, Axie Infinity Ecosystem, Metaverse, Play To Earn, Harmony Ecosystem, Ethereum Ecosystem, Animoca Brands Portfolio, Alleged SEC Securities, Binance Launchpad, Ronin Ecosystem, Card Games, Breeding, Paradigm Portfolio, Gaming Governance Token, Gaming Utility Token, Andreessen Horowitz (a16z) Portfolio, Energi Ecosystem, Binance Labs Portfolio, Consensys Portfolio, Coinbase 50 Index",axie-infinity,513837127,870205358.0,138186.31500556457,115894.9030191343,0.09,26181980.0
Gate.io,"Solana Ecosystem, Liquid Staking Tokens, Liquid Staked SOL, Liquid Staking",jupiter-staked-sol,513267201,513267201.0,,,N/A,6019501.0
Gate.io,"Entertainment, Gaming (GameFi), NFT, Metaverse, Polygon Ecosystem, Play To Earn, Ethereum Ecosystem, Animoca Brands Portfolio, Alleged SEC Securities, Simulation Games, Coinbase 50 Index",decentraland,512412885,601614314.0,192921.87038103433,175116.9885462266,0.07,51549558.0
Gate.io,"Smart Contract Platform, Layer 1 (L1), Binance Launchpad, DWF Labs Portfolio, Osmosis Ecosystem, Binance Labs Portfolio, Made in USA",kava,507168932,507168932.0,280527.70999061776,244806.58649034228,0.17,22758566.0
Gate.io,"Smart Contract Platform, Layer 1 (L1), MultiversX Ecosystem, Binance Launchpad, DWF Labs Portfolio, Proof of Stake (PoS), Binance Labs Portfolio, GMCI Layer 1 Index, GMCI Index, Coinbase 50 Index",elrond-erd-2,499063525,499063525.0,163904.66338110314,138216.12024516833,0.17,23676874.0
Gate.io,"Smart Contract Platform, Privacy, Layer 1 (L1), Zero Knowledge (ZK), Proof of Work (PoW), Pantera Capital Portfolio, Made in USA, Coinbase 50 Index",zcash,498061149,498089257.0,,,N/A,61313160.0
Gate.io,"Stablecoins, USD Stablecoin, BNB Chain Ecosystem, Avalanche Ecosystem, Ethereum Ecosystem, Tron Ecosystem, Andreessen Horowitz (a16z) Portfolio, Fiat-backed Stablecoin",true-usd,494887905,494887905.0,1683398.4587635447,1333394.361547825,0.01,40629173.0
Gate.io,"Solana Ecosystem, Meme, Dog-Themed, Solana Meme, GMCI Meme Index, GMCI Index",dogwifcoin,493016351,493016351.0,765887.236862393,583195.1713088079,0.04,296105719.0
Gate.io,"Decentralized Finance (DeFi), Wallets, Polygon Ecosystem, Ethereum Ecosystem, Payment Solutions, Base Ecosystem, Sora Ecosystem, Made in USA",telcoin,488380511,531427946.0,,,N/A,4943088.0
Gate.io,"Infrastructure, Smart Contract Platform, Ethereum Ecosystem, Layer 2 (L2), Zero Knowledge (ZK), Starknet Ecosystem, Paradigm Portfolio, Coinbase Ventures Portfolio, Rollup, Multicoin Capital Portfolio, Alameda Research Portfolio, Pantera Capital Portfolio, GMCI Layer 2 Index, Consensys Portfolio, Sequoia Capital Portfolio, GMCI Index, Polychain Capital Portfolio",starknet,481305714,1754345487.0,318086.5483732504,356605.43904417596,0.06,28241146.0
Gate.io,"BNB Chain Ecosystem, Ethereum Ecosystem, BTCfi",pumpbtc,473819605,473819605.0,,,N/A,306.25
Gate.io,"Decentralized Exchange (DEX), Smart Contract Platform, Decentralized Finance (DeFi), Cosmos Ecosystem, Perpetuals, Layer 1 (L1), Osmosis Ecosystem, Appchains, DragonFly Capital Portfolio, DeFiance Capital Portfolio, Andreessen Horowitz (a16z) Portfolio, GMCI DeFi Index, Delphi Ventures Portfolio, GMCI Index, Polychain Capital Portfolio, Made in USA",dydx-chain,469746655,469746655.0,434373.5008961092,489568.59169160714,0.03,21478682.0
Gate.io,"Decentralized Exchange (DEX), Exchange-based Tokens, Decentralized Finance (DeFi), Yield Farming, Automated Market Maker (AMM), BNB Chain Ecosystem, Arbitrum Ecosystem, Ethereum Ecosystem, Aptos Ecosystem, ZkSync Ecosystem, Linea Ecosystem, Base Ecosystem, Polygon zkEVM Ecosystem, Binance Labs Portfolio, opBNB Ecosystem, GMCI DeFi Index, GMCI Index",pancakeswap-token,465281496,604056954.0,235334.65210483782,162521.0943908918,0.06,95258309.0
Gate.io,"Decentralized Exchange (DEX), Decentralized Finance (DeFi), Yield Farming, Automated Market Maker (AMM), Solana Ecosystem, Launchpad, GMCI DeFi Index, GMCI Index",raydium,445998949,851061177.0,147242.54174459167,146899.81287771638,0.12,57635434.0
Gate.io,"USD Stablecoin, Polygon Ecosystem, Bridged USDC, Fiat-backed Stablecoin, Bridged-Tokens, Bridged Stablecoins",bridged-usdc-polygon-pos-bridge,443915082,443915082.0,,,N/A,16910606.0
Gate.io,"Ethereum Ecosystem, Mantle Ecosystem, Restaking, Liquid Restaking Tokens, Liquid Restaked ETH",mantle-restaked-eth,440238395,440238395.0,,,N/A,7764282.0
Gate.io,"Base Ecosystem, Bridged WETH, Bridged-Tokens",l2-standard-bridged-weth-base,438809817,438809817.0,,,N/A,387073628.0
Gate.io,"Artificial Intelligence (AI), Smart Contract Platform, Storage, Layer 1 (L1), DePIN, Coinbase Ventures Portfolio, Multicoin Capital Portfolio, Andreessen Horowitz (a16z) Portfolio, Blockchain Capital Portfolio",arweave,435645292,435645292.0,230065.812205143,234452.7847855773,0.15,52418325.0
Gate.io,"BNB Chain Ecosystem, Meme, Binance-Peg Tokens",binance-peg-dogecoin,434488368,434488368.0,,,N/A,1157472.0
Gate.io,"Smart Contract Platform, BNB Chain Ecosystem, Layer 1 (L1), Ethereum Ecosystem, Base Ecosystem, Proof of Stake (PoS), Pantera Capital Portfolio, Made in USA",chain-2,430920742,633483922.0,407256.7798690891,457199.5096770141,0.08,83220736.0
Gate.io,"NFT, BNB Chain Ecosystem, Ethereum Ecosystem, Tron Ecosystem",apenft,428686847,432966468.0,15027.92957497513,18267.092340349052,0.6,50184418.0
Gate.io,"Tokenized BTC, Avalanche Ecosystem, Bridged-Tokens",bitcoin-avalanche-bridged-btc-b,427024595,427024595.0,,,N/A,19297039.0
Gate.io,"Decentralized Exchange (DEX), Infrastructure, Smart Contract Platform, Exchange-based Tokens, Decentralized Finance (DeFi), Bridge Governance Tokens, Multicoin Capital Portfolio, Proof of Stake (PoS), Delphi Ventures Portfolio",thorchain,426429601,516098727.0,407671.89234214457,323700.93203790847,0.08,136728869.0
Gate.io,"Arbitrum Ecosystem, Bridged WETH, Bridged-Tokens",arbitrum-bridged-weth-arbitrum-one,423168014,423168014.0,,,N/A,166134359.0
Gate.io,"Smart Contract Platform, DWF Labs Portfolio, Proof of Work (PoW), GMCI Layer 1 Index, Sequoia Capital Portfolio, GMCI Index, Made in China",conflux-token,420711355,469691464.0,479397.7549279366,252753.89243497528,0.01,68635292.0
Gate.io,"Artificial Intelligence (AI), Solana Ecosystem, Ethereum Ecosystem, Base Ecosystem, AI Agents, Virtuals Protocol Ecosystem, AI Agent Launchpad, Binance Alpha Spotlight",virtual-protocol,419559085,645971228.0,150789.24399708034,163374.68638092242,0.02,161302047.0
Gate.io,"Smart Contract Platform, Layer 1 (L1), Bitcoin Fork, Proof of Work (PoW)",ecash,417193354,417193354.0,47007.33097332349,43145.501996222476,0.19,20197064.0
Gate.io,"Arbitrum Ecosystem, Ethereum Ecosystem, Optimism Ecosystem, Base Ecosystem, BTCfi",clbtc,413998298,413998298.0,,,N/A,17.26
Gate.io,"Gaming (GameFi), NFT, Polygon Ecosystem, Ethereum Ecosystem, Animoca Brands Portfolio, Gaming Blockchains, Gaming Governance Token, Gaming Utility Token, Andreessen Horowitz (a16z) Portfolio, ApeChain Ecosystem, Airdropped Tokens by NFT Projects, Coinbase 50 Index",apecoin,412038471,515398887.0,322044.91279256635,242241.6418856458,0.04,52530047.0
Gate.io,"Decentralized Exchange (DEX), Decentralized Finance (DeFi), Automated Market Maker (AMM), Base Ecosystem, Binance Alpha Spotlight, Made in USA",aerodrome-finance,411264009,795962896.0,17093.30617332904,42584.832415473626,0.04,23932109.0
Gate.io,"Tokenized Assets, Solana Ecosystem, Polygon Ecosystem, Ethereum Ecosystem, Real World Assets (RWA), Tokenized Treasury Bonds (T-Bonds)",ousg,409121828,409121828.0,,,N/A,0.0
Gate.io,"Smart Contract Platform, Sports, NFT, Layer 1 (L1), Ethereum Ecosystem, Alleged SEC Securities, Chiliz Ecosystem, Binance Labs Portfolio, Coinbase 50 Index",chiliz,408678722,408678722.0,299949.74523744115,234200.99569163355,0.02,48071999.0
Gate.io,"Stablecoins, USD Stablecoin, Blast Ecosystem, Crypto-backed Stablecoin, Fiat-backed Stablecoin",usdb,407306699,407306699.0,,,N/A,1446818.0
Gate.io,"Ethereum Ecosystem, Real World Assets (RWA)",hashnote-usyc,400450325,400450325.0,,,N/A,10.66
Gate.io,"Solana Ecosystem, Meme, Solana Meme, Binance HODLer Airdrops, Airdropped Tokens by NFT Projects, Made in USA",pudgy-penguins,396958707,484507728.0,84400.95102109815,101102.38162232761,0.03,143458989.0
Gate.io,"Smart Contract Platform, Layer 1 (L1), Bitcoin Sidechains, SideChain",coredaoorg,394060747,830165182.0,65440.313475291245,59767.77385127438,0.05,13753427.0
Gate.io,"Decentralized Finance (DeFi), BNB Chain Ecosystem, Liquid Staking Tokens, Sui Ecosystem, Liquid Staking",lorenzo-stbtc,385839607,385839607.0,,,N/A,14191.38
Gate.io,"Stablecoins, Solana Ecosystem, Arbitrum Ecosystem, Ethereum Ecosystem, Aptos Ecosystem, Sui Ecosystem, Mantle Ecosystem, Osmosis Ecosystem, Fiat-backed Stablecoin, Yield Tokenization Product",ondo-us-dollar-yield,385482468,593831653.0,,,N/A,557498.0
Gate.io,"Smart Contract Platform, BNB Chain Ecosystem, Polygon Ecosystem, Harmony Ecosystem, Moonriver Ecosystem, Moonbeam Ecosystem, Ethereum Ecosystem, Layer 2 (L2), Zero Knowledge (ZK), Animoca Brands Portfolio, Alleged SEC Securities, Binance Launchpad, FTX Holdings, Coinbase Ventures Portfolio, Rollup, Proof of Stake (PoS), Alameda Research Portfolio, DragonFly Capital Portfolio, Energi Ecosystem, Sora Ecosystem, Binance Labs Portfolio, GMCI Layer 2 Index, GMCI 30 Index, Galaxy Digital Portfolio, GMCI Index, Coinbase 50 Index",matic-network,384123341,2146495207.0,,,N/A,3654198.0
Gate.io,"Decentralized Finance (DeFi), Liquid Staking Tokens, Berachain Ecosystem, Liquid Staking",infrared-bera,375814873,375814873.0,,,N/A,65802.0
Gate.io,"Artificial Intelligence (AI), Solana Ecosystem, DePIN, Polychain Capital Portfolio",grass,369816852,1516232609.0,86297.46867263304,265021.9807043011,0.12,130137477.0
Gate.io,"Liquid Staking Tokens, Ethereum Ecosystem, Restaking, Liquid Restaking Tokens, Ether.fi Ecosystem, Liquid Staked ETH, Liquid Staking",ether-fi-staked-eth,363725671,4261786159.0,,,N/A,25369.0
Gate.io,"Decentralized Finance (DeFi), Yield Farming, BNB Chain Ecosystem, Lending/Borrowing Protocols, Avalanche Ecosystem, Polygon Ecosystem, Near Protocol Ecosystem, Harmony Ecosystem, Arbitrum Ecosystem, Ethereum Ecosystem, Base Ecosystem, Paradigm Portfolio, Index Coop Defi Index, Energi Ecosystem, Sora Ecosystem, Index Coop Index, Polychain Capital Portfolio, Made in USA",compound-governance-token,360369970,405039008.0,75437.17531620206,69335.30345358516,0.17,37549647.0
Gate.io,"BNB Chain Ecosystem, Wallets, Account Abstraction, Energi Ecosystem",trust-wallet-token,360137187,864364030.0,80519.34047171909,102421.83277838987,0.13,12614394.0
Gate.io,"Crypto-Backed Tokens, Decentralized Finance (DeFi), Rebase Tokens, Arbitrum Ecosystem, Ethereum Ecosystem, Berachain Ecosystem",olympus,358504829,459198949.0,,,N/A,712763.0
Gate.io,"Stablecoins, Decentralized Finance (DeFi), USD Stablecoin, BNB Chain Ecosystem, Seigniorage, Avalanche Ecosystem, Polygon Ecosystem, Fantom Ecosystem, Harmony Ecosystem, Arbitrum Ecosystem, Moonriver Ecosystem, Moonbeam Ecosystem, Ethereum Ecosystem, Optimism Ecosystem, Stablecoin Protocol, Aurora Ecosystem, Polygon zkEVM Ecosystem, Evmos Ecosystem, Boba Network Ecosystem, Fiat-backed Stablecoin",frax,352751295,352751295.0,162.60153988022506,651.0205049867577,0.01,8507037.0
Gate.io,"Crypto-Backed Tokens, Decentralized Finance (DeFi), Tokenized BTC, Solana Ecosystem, Polygon Ecosystem, Arbitrum Ecosystem, Ethereum Ecosystem, Optimism Ecosystem, Base Ecosystem",tbtc,351736942,351736942.0,,,N/A,9589799.0
Gate.io,"Artificial Intelligence (AI), Analytics, Base Ecosystem, Binance HODLer Airdrops",kaito,345724448,1432230162.0,407344.4416902522,338209.37698164425,0.11,146580441.0
Gate.io,"Decentralized Finance (DeFi), Near Protocol Ecosystem, Ethereum Ecosystem, Payment Solutions, Alleged SEC Securities, Pantera Capital Portfolio, Energi Ecosystem, Made in USA",amp-token,344355180,407468341.0,35589.178716397364,49884.73728771987,0.15,44378938.0
Gate.io,"Decentralized Finance (DeFi), Arbitrum Ecosystem, Liquid Staking Tokens, Ethereum Ecosystem, Optimism Ecosystem, Base Ecosystem",cgeth-hashkey-cloud,343752644,343752644.0,,,N/A,34.13
Gate.io,"Infrastructure, BNB Chain Ecosystem, Avalanche Ecosystem, Polygon Ecosystem, Fantom Ecosystem, Arbitrum Ecosystem, Moonbeam Ecosystem, Ethereum Ecosystem, Optimism Ecosystem, Interoperability, Bridge Governance Tokens, Base Ecosystem, Osmosis Ecosystem, Cross-chain Communication, Secret Ecosystem, Galaxy Digital Portfolio, Polychain Capital Portfolio, Made in USA",axelar,343540980,440353998.0,195898.53078182504,105215.54582912382,0.14,13477936.0
Gate.io,"Artificial Intelligence (AI), Smart Contract Platform, DePIN, Osmosis Ecosystem, Proof of Stake (PoS), Archway Ecosystem, Made in USA",akash-network,343207685,344379880.0,158806.63695592005,174286.11054484537,0.15,29533344.0
