Gate.io,"Decentralized Exchange (DEX), Exchange-based Tokens, Decentralized Finance (DeFi), Automated Market Maker (AMM), BNB Chain Ecosystem, Derivatives, Perpetuals, Centralized Exchange (CEX) Token, Solana Ecosystem, Avalanche Ecosystem, Polygon Ecosystem, Near Protocol Ecosystem, Fantom Ecosystem, Arbitrum Ecosystem, Ethereum Ecosystem, ZkSync Ecosystem, Mantle Ecosystem, Linea Ecosystem, Base Ecosystem, DragonFly Capital Portfolio, Binance Labs Portfolio",woo-network,162107122,193060588.0,63017.4858111887,97883.17302284294,0.16,9391497.0
Gate.io,"Smart Contract Platform, Layer 1 (L1), Layer 0 (L0), Made in USA, Directed Acyclic Graph (DAG)",constellation-labs,163174221,163174338.0,4074.732705399123,5159.165194376935,0.48,2054904.0
Gate.io,"BNB Chain Ecosystem, Binance Alpha Spotlight",bnb48-club-token,162821300,162821300.0,,,N/A,128935.0
Gate.io,"Meme, Ethereum Ecosystem, Frog-Themed, AI Meme",turbo,161721308,161721308.0,152217.15424361525,180689.00298803198,0.04,33894567.0
Gate.io,"Smart Contract Platform, BNB Chain Ecosystem, Layer 1 (L1), Ethereum Ecosystem, ZetaChain Ecosystem, Cross-chain Communication, Made in USA",zetachain,160100863,459528089.0,150315.3460538842,238249.65861573617,0.09,9230768.0
Gate.io,"Smart Contract Platform, Layer 1 (L1), Proof of Stake (PoS), GMCI Layer 1 Index, GMCI Index, Made in USA",casper-network,159848450,165495396.0,108230.45734585152,116128.02033185402,0.06,16226391.0
Gate.io,"Decentralized Finance (DeFi), Tron Ecosystem",sun-token,159149913,322192640.0,218096.6323241551,165616.05391840884,0.06,23011258.0
Gate.io,"SocialFi, Arbitrum Ecosystem",uxlink,159400431,471320020.0,75875.75351844533,104461.2645688836,0.08,12289210.0
Gate.io,"Solana Ecosystem, DePIN, Multicoin Capital Portfolio, Made in USA",hivemapper,159257345,247698070.0,51706.232139591666,66686.43767500462,0.26,1783058.0
Gate.io,"Internet of Things (IOT), Oracle, NFT, Metaverse, Ethereum Ecosystem, DePIN, Alleged SEC Securities, Made in USA",xyo-network,157269272,157269272.0,21720.36746533823,26281.48841586304,0.5,5022071.0
Gate.io,"Smart Contract Platform, EthereumPoW Ecosystem, Proof of Work (PoW)",ethereum-pow-iou,154114262,154114262.0,18694.55944307926,24206.070980502787,0.28,3777364.0
Gate.io,Smart Contract Platform,bitkub-coin,152506083,188808882.0,344.71027343531927,995.7734910831053,1.15,321541.0
Gate.io,"Smart Contract Platform, Layer 1 (L1), Real World Assets (RWA), RWA Protocol",polymesh,152157684,152157684.0,204194.86545153253,162508.2078620015,0.15,1901949.0
Gate.io,"Artificial Intelligence (AI), Meme, Base Ecosystem, AI Agents, Binance Alpha Spotlight, AI Framework",freysa-ai,152530225,152530225.0,0.0,0.0,N/A,618293.0
Gate.io,"Stablecoins, Ethereum Ecosystem, Crypto-backed Stablecoin",elixir-staked-deusd,152403597,152402816.0,,,N/A,66173.0
Gate.io,"Binance Launchpool, Solana Ecosystem, Ethereum Ecosystem, Decentralized Science (DeSci)",bio-protocol,151828491,310980245.0,65935.34825382997,62437.089117715586,0.21,18560216.0
Gate.io,"Gaming (GameFi), NFT, Solana Ecosystem, Animoca Brands Portfolio, FTX Holdings, Multicoin Capital Portfolio, Alameda Research Portfolio",metaplex,151320540,193904917.0,19514.508834675013,9973.803634244887,0.05,6372157.0
Gate.io,BNB Chain Ecosystem,acet-token,150985564,196981784.0,,,N/A,723044.0
Gate.io,"Payment Solutions, Made in USA, Directed Acyclic Graph (DAG)",nano,150267020,150267020.0,8242.021826207845,14089.671642072319,0.4,3234308.0
Gate.io,"Solana Ecosystem, Meme, Solana Meme, Murad Picks",gigachad-2,149230168,149230168.0,7365.576323074148,8697.63497867059,0.26,11462751.0
Gate.io,"Alleged SEC Securities, Osmosis Ecosystem, DeFiance Capital Portfolio, Pantera Capital Portfolio, Binance Labs Portfolio, Delphi Ventures Portfolio, Galaxy Digital Portfolio, OKX Ventures Portfolio",terra-luna-2,149666700,234735544.0,157713.32434777173,191274.8227191682,0.05,27609181.0
Gate.io,"NFT, Solana Ecosystem, NFT Marketplace, Paradigm Portfolio, Sequoia Capital Portfolio",magic-eden,148948685,1116761430.0,87553.4843892991,226783.32785930685,0.13,11437314.0
Gate.io,"BNB Chain Ecosystem, Binance-Peg Tokens",binance-peg-sol,149247306,149247306.0,,,N/A,3381398.0
Gate.io,"Smart Contract Platform, Masternodes, Zero Knowledge (ZK), Proof of Work (PoW), Made in USA",zencash,147522005,147522005.0,,,N/A,15279052.0
Gate.io,"Crypto-Backed Tokens, BNB Chain Ecosystem, Wrapped-Tokens, Ethereum Ecosystem",wrapped-beacon-eth,146543503,146543503.0,,,N/A,3432030.0
Gate.io,"Smart Contract Platform, Crypto-Backed Tokens, Wrapped-Tokens, Layer 2 (L2), Mantle Ecosystem",wrapped-ether-mantle-bridge,147032196,147032196.0,,,N/A,4901420.0
Gate.io,"Internet of Things (IOT), Smart Contract Platform, Layer 1 (L1), Proof of Work (PoW), Made in USA",digibyte,147338672,147340882.0,35614.04193057157,58103.34833203938,0.33,3234553.0
Gate.io,"Exchange-based Tokens, Decentralized Finance (DeFi), Ethereum Ecosystem, Real World Assets (RWA), Alleged SEC Securities",lcx,145828081,147224462.0,,,N/A,2917932.0
Gate.io,"Artificial Intelligence (AI), Smart Contract Platform, Layer 1 (L1), Proof of Work (PoW)",qubic-network,147409966,176303195.0,11257.753884063493,6460.846096901976,0.43,9972801.0
Gate.io,"Smart Contract Platform, DWF Labs Portfolio, Proof of Stake (PoS)",waves,144491587,144491587.0,19791.30906578105,21570.054942294097,0.17,6947632.0
Gate.io,"Smart Contract Platform, Layer 1 (L1), Kadena Ecosystem, Multicoin Capital Portfolio, Proof of Work (PoW), Made in USA",kadena,144551064,144711513.0,69348.89634062802,115141.17718034892,0.06,4493922.0
Gate.io,"Stablecoins, Ethereum Ecosystem, XRP Ledger Ecosystem, Fiat-backed Stablecoin, Made in USA",ripple-usd,141423333,141423333.0,,,N/A,18237464.0
Gate.io,"Smart Contract Platform, Layer 1 (L1), Harmony Ecosystem, Animoca Brands Portfolio, Binance Launchpad, Binance Labs Portfolio, Made in USA",harmony,140630662,150351827.0,116523.34720815178,92161.17160631364,0.12,8028452.0
Gate.io,"Stablecoins, EUR Stablecoin, Solana Ecosystem, Avalanche Ecosystem, Ethereum Ecosystem, Base Ecosystem, Stellar Ecosystem",euro-coin,139619321,139619321.0,,,N/A,22587922.0
Gate.io,"Gaming (GameFi), NFT, BNB Chain Ecosystem, Solana Ecosystem, Polygon Ecosystem, Play To Earn, Move To Earn, Ethereum Ecosystem, Binance Launchpad, Gaming Governance Token, Sports Games, Alameda Research Portfolio, Binance Labs Portfolio, Sequoia Capital Portfolio",stepn,139561588,261002428.0,100253.45887553511,59012.05742045668,0.08,20115982.0
Gate.io,"Crypto-Backed Tokens, Wrapped-Tokens, Avalanche Ecosystem",wrapped-avax,138576995,138576995.0,,,N/A,45167695.0
Gate.io,"Gaming (GameFi), Polkadot Ecosystem, NFT, Ethereum Ecosystem, Gaming Blockchains, Andreessen Horowitz (a16z) Portfolio, Binance Labs Portfolio, Galaxy Digital Portfolio, Made in USA",mythos,139002000,178954072.0,8006.6203869682095,12490.500053816175,0.22,1919048.0
Gate.io,"BNB Chain Ecosystem, Arbitrum Ecosystem, Cardano Ecosystem, Ethereum Ecosystem, DePIN, Base Ecosystem, DWF Labs Portfolio",world-mobile-token,138073373,398954140.0,3873.6616242031982,3297.925442735499,0.05,13174969.0
Gate.io,"Gaming (GameFi), Play To Earn, Telegram Apps, TON Ecosystem, Tap to Earn, Arcade Games",hamster-kombat,138273201,214793322.0,62584.86602643544,112886.54316165083,0.05,19359204.0
Gate.io,"Tokenized Assets, Tokenized Gold, Real World Assets (RWA), Tokenized Commodities",kinesis-gold,137144949,137144949.0,,,N/A,692267.0
Gate.io,"Decentralized Finance (DeFi), Analytics, DeFi Index, Base Ecosystem",mag7-ssi,136356499,136356499.0,2347.9245323667674,1688.276634270823,0.37,1157903.0
Gate.io,"Liquid Staking Tokens, Aptos Ecosystem, Liquid Staking",amnis-aptos,134688625,134717158.0,,,N/A,136766.0
Gate.io,"Smart Contract Platform, Masternodes, Proof of Stake (PoS), Made in China",ontology,134834741,147732067.0,52899.689313312054,53205.16207879267,0.14,4205695.0
Gate.io,"Stablecoins, EUR Stablecoin, Polygon Ecosystem, Ethereum Ecosystem, Real World Assets (RWA), Fiat-backed Stablecoin",stasis-eurs,134815981,134815981.0,,,N/A,48075.0
Gate.io,"Decentralized Exchange (DEX), Smart Contract Platform, Exchange-based Tokens, Decentralized Finance (DeFi), Arbitrum Ecosystem, Ethereum Ecosystem, Layer 2 (L2), Zero Knowledge (ZK), Loopring Ecosystem, Rollup, Energi Ecosystem",loopring,134128513,147894750.0,58479.80721767941,67781.01717943924,0.09,12315952.0
Gate.io,"Smart Contract Platform, Base Ecosystem, Gaming Blockchains",b3,134478267,631570704.0,65687.47467028073,56599.42239989736,0.25,19446798.0
Gate.io,"Smart Contract Platform, SocialFi, NFT, BNB Chain Ecosystem, Binance Launchpool, Ethereum Ecosystem, Decentralized Identifier (DID), Zero Knowledge (ZK), DWF Labs Portfolio, Coinbase Ventures Portfolio, Multicoin Capital Portfolio, Alameda Research Portfolio, DragonFly Capital Portfolio, Binance Labs Portfolio, Quest-to-Earn",project-galaxy,132580849,207564059.0,,,N/A,344595.0
Gate.io,"Artificial Intelligence (AI), Smart Contract Platform, BNB Chain Ecosystem, Solana Ecosystem, Layer 1 (L1), Polygon Ecosystem, Ethereum Ecosystem, DWF Labs Portfolio, Injective Ecosystem, OKX Ventures Portfolio",zignaly,130251247,180588822.0,2062.917408906868,3479.5886819793764,0.57,2342854.0
Gate.io,"Stablecoins, USD Stablecoin, Solana Ecosystem, Fiat-backed Stablecoin",global-dollar,130252654,130252654.0,,,N/A,635477.0
Gate.io,"Artificial Intelligence (AI), Binance Launchpool, Solana Ecosystem, DePIN, Animoca Brands Portfolio, Multicoin Capital Portfolio, Delphi Ventures Portfolio, OKX Ventures Portfolio, Made in USA",io,129665093,703494932.0,389956.1186659846,269083.6093525231,0.11,37057378.0
Gate.io,"Cronos Ecosystem, Bridged USDC, Bridged-Tokens, Bridged Stablecoins",cronos-bridged-usdc-cronos,129335434,129335434.0,,,N/A,2041267.0
Gate.io,"Tokenized Assets, Real World Assets (RWA), Tokenized Silver, Tokenized Commodities",kinesis-silver,127828273,127828273.0,,,N/A,64860.0
Gate.io,"BNB Chain Ecosystem, Harmony Ecosystem, Ethereum Ecosystem, Alameda Research Portfolio, Binance Labs Portfolio",swipe,127255138,127328705.0,56232.40692321577,39032.12278628325,0.1,3672597.0
Gate.io,"Decentralized Exchange (DEX), Exchange-based Tokens, Decentralized Finance (DeFi), Yield Farming, Automated Market Maker (AMM), BNB Chain Ecosystem, Yearn Ecosystem, Solana Ecosystem, Avalanche Ecosystem, Polygon Ecosystem, Near Protocol Ecosystem, Fantom Ecosystem, Harmony Ecosystem, Arbitrum Ecosystem, Celo Ecosystem, Ethereum Ecosystem, Base Ecosystem, Alameda Research Portfolio, Pantera Capital Portfolio, Energi Ecosystem, Sora Ecosystem, Blockchain Capital Portfolio",sushi,126751287,184540379.0,211908.130086864,179224.52310789173,0.02,24695433.0
Gate.io,"Smart Contract Platform, Ethereum Ecosystem, Zero Knowledge (ZK), Alleged SEC Securities, Privacy Blockchain",coti,125088323,139583432.0,25845.167587589967,48384.22336783568,0.36,19677967.0
Gate.io,"Decentralized Exchange (DEX), Decentralized Finance (DeFi), Gnosis Chain Ecosystem, MEV Protection, Arbitrum Ecosystem, Ethereum Ecosystem, Intent, Delphi Ventures Portfolio, Blockchain Capital Portfolio",cow-protocol,125034893,301287285.0,24994.51965844648,29860.38246452481,0.17,30549503.0
Gate.io,"Decentralized Finance (DeFi), Insurance, Ethereum Ecosystem",nxm,124231798,124231798.0,,,N/A,0.0
Gate.io,"Business Services, Decentralized Finance (DeFi), Oracle, Fantom Ecosystem, Ethereum Ecosystem, Binance Launchpad, Osmosis Ecosystem, Energi Ecosystem, Binance Labs Portfolio, Sequoia Capital Portfolio",band-protocol,124236789,126106873.0,46078.45895187561,45352.37783281174,0.25,8151226.0
Gate.io,"Smart Contract Platform, BNB Chain Ecosystem, Ethereum Ecosystem, Zero Knowledge (ZK), Animoca Brands Portfolio, Binance Labs Portfolio, OKX Ventures Portfolio",polyhedra-network,123655771,2047840841.0,364974.1195576821,394782.0840143444,0.01,8028718.0
Gate.io,"BNB Chain Ecosystem, Tron Ecosystem",global-commercial-business,123590607,123590607.0,,,N/A,204036.0
Gate.io,"Exchange-based Tokens, BNB Chain Ecosystem, Centralized Exchange (CEX) Token",nkyc-token,123349296,123349296.0,,,N/A,245092.0
Gate.io,"Decentralized Finance (DeFi), Yield Farming, Avalanche Ecosystem, Fantom Ecosystem, Arbitrum Ecosystem, Olympus Pro Ecosystem, Ethereum Ecosystem, Stablecoin Protocol",spell-token,123499131,152651855.0,338658.32485341147,419509.30411506264,0.12,152993397.0
Gate.io,"Tokenized Assets, Polygon Ecosystem, Arbitrum Ecosystem, Ethereum Ecosystem, Real World Assets (RWA), Starknet Ecosystem, Tokenized Treasury Bills (T-Bills)",eutbl,122449574,122449574.0,,,N/A,0.0
Gate.io,"Polygon Ecosystem, Bridged DAI, Bridged-Tokens, Bridged Stablecoins",polygon-pos-bridged-dai-polygon-pos,121725534,116287634.0,,,N/A,2698576.0
Gate.io,"Arbitrum Ecosystem, Ethereum Ecosystem, Account Abstraction, Coinbase Ventures Portfolio, Binance Labs Portfolio, Consensys Portfolio, Outlier Ventures Portfolio",biconomy,121298157,129568669.0,57976.84387396044,50805.03302140279,0.23,13314205.0
Gate.io,"Arbitrum Ecosystem, Ethereum Ecosystem",reserve-protocol-eth-plus,120369934,120369934.0,,,N/A,448140.0
Gate.io,"Decentralized Finance (DeFi), Ethereum Ecosystem, Real World Assets (RWA), Coinbase Ventures Portfolio, Stablecoin Protocol, Binance Labs Portfolio, Galaxy Digital Portfolio",usual,119954720,131889567.0,260960.16988524573,272078.6192502075,0.06,14152596.0
Gate.io,"Decentralized Finance (DeFi), Yield Farming, Lending/Borrowing Protocols, Ethereum Ecosystem, Real World Assets (RWA), Base Ecosystem, Binance Alpha Spotlight",syrup,118076946,189468200.0,17697.727402871886,13055.642507536959,0.17,9815610.0
Gate.io,"Smart Contract Platform, SocialFi, Layer 1 (L1), Gaming Blockchains",hive,117197273,,62251.6894524218,55650.422832403565,0.16,3306260.0
Gate.io,"Meme, Ethereum Ecosystem, Dog-Themed",neiro-3,115828299,115828299.0,248157.55221617653,237446.10020189735,0.04,35271146.0
Gate.io,"BNB Chain Ecosystem, Ethereum Ecosystem, Payment Solutions, DWF Labs Portfolio",alchemy-pay,115813969,234266193.0,171096.3390768379,162464.1475085423,0.04,26004412.0
Gate.io,"Stablecoins, Ethereum Ecosystem, Base Ecosystem, Blast Ecosystem, Fiat-backed Stablecoin",anzen-usdz,115325587,115325587.0,,,N/A,99215.0
Gate.io,"Exchange-based Tokens, NFT, BNB Chain Ecosystem, Ethereum Ecosystem",swftcoin,113183537,113183537.0,318964.878959105,387550.1351767385,0.72,2731872.0
Gate.io,"Solana Ecosystem, Polygon Ecosystem, Ethereum Ecosystem",m2-global-wealth-limited-mmx,112875739,362131073.0,,,N/A,91595.0
Gate.io,"Smart Contract Platform, BNB Chain Ecosystem, Ethereum Ecosystem, Layer 2 (L2)",prometeus,113387867,119600901.0,27062.08702952771,80319.56143774131,0.43,1883238.0
Gate.io,"Decentralized Finance (DeFi), Derivatives, Synthetic Issuer, Ethereum Ecosystem, Synthetic",stp-network,113051308,113051308.0,44360.88498479278,58954.02865434845,0.29,22575905.0
Gate.io,"Business Services, Infrastructure, Smart Contract Platform, Decentralized Finance (DeFi), Polygon Ecosystem, Arbitrum Ecosystem, Ethereum Ecosystem, Liquid Staking Governance Tokens, Coinbase Ventures Portfolio, Proof of Stake (PoS), Index Coop Defi Index, Consensys Portfolio, Liquid Staking, Index Coop Index",rocket-pool,112611057,112611057.0,32010.739364423094,29912.93274796966,0.41,10188535.0
Gate.io,"Big Data, Business Services, Infrastructure, Decentralized Finance (DeFi), Solana Ecosystem, FTX Holdings, DWF Labs Portfolio, Name Service",bonfida,112772878,113807184.0,75248.23438645365,100163.48740765917,0.18,11550294.0
Gate.io,"Smart Contract Platform, Proof of Stake (PoS), Sequoia Capital Portfolio",iostoken,112536831,112536831.0,70441.0458032467,90079.67140114057,0.08,42948086.0
Gate.io,"Smart Contract Platform, BNB Chain Ecosystem, Layer 1 (L1), Ethereum Ecosystem, Decentralized Identifier (DID), Base Ecosystem, Gravity Alpha Ecosystem",g-token,111885522,185632787.0,103065.9371560057,82173.68733697572,0.32,7059315.0
Gate.io,"Meme, PulseChain Ecosystem",the-grays-currency,111411467,111411452.0,,,N/A,201761.0
Gate.io,"Smart Contract Platform, Cross-chain Communication, Pantera Capital Portfolio",icon,110556834,111815895.0,45842.969793211516,52313.0019978891,0.09,978679.0
Gate.io,"Smart Contract Platform, Decentralized Finance (DeFi), Binance Launchpool, Derivatives, Perpetuals, Ethereum Ecosystem, Layer 2 (L2), DragonFly Capital Portfolio, Pantera Capital Portfolio",aevo-exchange,110459529,122302570.0,276557.091133577,271542.0123716009,0.08,13301953.0
Gate.io,"Arbitrum Ecosystem, Bridged USDC, Bridged-Tokens, Bridged Stablecoins",usd-coin-ethereum-bridged,110223375,110223375.0,,,N/A,21448665.0
Gate.io,"Music, NFT, Ethereum Ecosystem, Coinbase Ventures Portfolio, Multicoin Capital Portfolio, Pantera Capital Portfolio, Energi Ecosystem, Binance Labs Portfolio",audius,110345885,110345886.0,29323.552099412114,43017.30214119775,0.31,13687018.0
Gate.io,"Decentralized Exchange (DEX), Decentralized Finance (DeFi), BNB Chain Ecosystem, Wallets, XRP Ledger Ecosystem",solo-coin,109623759,109623759.0,13409.767036578993,3752.7140743635814,0.49,2391956.0
Gate.io,"Smart Contract Platform, Ethereum Ecosystem, Metis Ecosystem, Layer 2 (L2), DWF Labs Portfolio, Rollup, GMCI Layer 2 Index, OKX Ventures Portfolio, GMCI Index",metis-token,109594011,175200885.0,113465.66407505322,111645.2280143166,0.06,5025864.0
Gate.io,"Lending/Borrowing Protocols, Ethereum Ecosystem, Paradigm Portfolio, Coinbase Ventures Portfolio",euler,108775610,158241566.0,,,N/A,2555189.0
Gate.io,"Gaming (GameFi), NFT, Metaverse, Play To Earn, Ethereum Ecosystem, Animoca Brands Portfolio, RPG, Gaming Governance Token, Adventure Games, Energi Ecosystem, Delphi Ventures Portfolio",illuvium,108982838,140413466.0,44524.42461499752,29160.313163377978,0.2,13616827.0
Gate.io,"Crypto-Backed Tokens, BNB Chain Ecosystem, Arbitrum Ecosystem, Ethereum Ecosystem, Mantle Ecosystem",ignition-fbtc,107300785,1183610368.0,,,N/A,406640.0
Gate.io,"Decentralized Finance (DeFi), BNB Chain Ecosystem, Real World Assets (RWA), DWF Labs Portfolio, Stellar Ecosystem",velo,107312018,348486374.0,36981.73077916886,54504.04315049367,0.12,11835433.0
Gate.io,"NFT, Meme, Arbitrum Ecosystem, Ethereum Ecosystem, Anime-Themed, Binance HODLer Airdrops, Airdropped Tokens by NFT Projects",anime,106179565,191708149.0,50992.53586530368,49144.09547758879,0.1,12595812.0
Gate.io,"Artificial Intelligence (AI), Smart Contract Platform, Masternodes, DePIN, Proof of Work (PoW), Made in USA",zelcash,105902367,105905638.0,98006.15670314235,83861.58708117987,0.04,9145401.0
Gate.io,"Solana Ecosystem, Multicoin Capital Portfolio, Stablecoin Protocol, Alameda Research Portfolio, DeFiance Capital Portfolio",uxd-protocol-token,107394058,107394058.0,,,N/A,91.14
Gate.io,"Decentralized Finance (DeFi), Ethereum Ecosystem, Morpho Ecosystem",steakhouse-usdc-morpho-vault,106124506,108147269.0,,,N/A,0.0
Gate.io,"Stablecoins, BNB Chain Ecosystem",astherus-usdf,105056806,105056806.0,,,N/A,365163.0
Gate.io,"Tokenized Real Estate, Tokenized Assets, Gnosis Chain Ecosystem, RealT Tokens, Real World Assets (RWA), RWA Protocol",realtoken-ecosystem-governance,105092029,733884691.0,,,N/A,567.64
Gate.io,"Solana Ecosystem, Meme, Solana Meme, PolitiFi, Made in USA",melania-meme,104934848,699565073.0,15180.818391909073,22259.490307207427,0.14,13277064.0
Gate.io,"Smart Contract Platform, Privacy, Layer 1 (L1), Proof of Stake (PoS), Proof of Work (PoW), Zano Ecosystem, Privacy Blockchain",zano,105187373,105187373.0,,,N/A,686816.0
Gate.io,"Smart Contract Platform, BNB Chain Ecosystem, Ethereum Ecosystem, DWF Labs Portfolio, Made in USA",proton,105335840,116770678.0,8034.1599476635,12102.665822226716,0.18,2655078.0
Gate.io,"Smart Contract Platform, Polkadot Ecosystem, Binance Launchpool, Layer 2 (L2), Manta Network Ecosystem, Multicoin Capital Portfolio, Alameda Research Portfolio, DeFiance Capital Portfolio, Binance Labs Portfolio",manta-network,103906474,263869886.0,231873.92751198815,212510.47221164827,0.08,27817141.0
Gate.io,"NFT, Binance Launchpool, Meme, Ethereum Ecosystem, Binance Labs Portfolio, GMCI Meme Index, GMCI Index",memecoin-2,103111643,173724174.0,304359.4192350891,267604.88165817765,0.04,18587378.0
Gate.io,"Solana Ecosystem, Meme, Base Ecosystem, AI Meme, AI Agents, Virtuals Protocol Ecosystem, Binance Alpha Spotlight, DeFAI",aixbt,103023768,120409345.0,76511.33451907014,67730.70909368865,0.1,42073046.0
Gate.io,"Business Services, Decentralized Finance (DeFi), Oracle, Derivatives, Synthetic Issuer, Avalanche Ecosystem, Ethereum Ecosystem, Blockchain Capital Portfolio, Synthetic, Made in USA",uma,102914112,148489909.0,73259.82627461443,76283.67896176406,0.17,9402938.0
Gate.io,"Artificial Intelligence (AI), Base Ecosystem, AI Agents, AI Applications, Made in USA",venice-token,102373794,244034986.0,31473.07923403409,29878.000337672547,0.2,7019699.0
Gate.io,"Infrastructure, Solana Ecosystem, Animoca Brands Portfolio, Cross-chain Communication, OKX Ventures Portfolio",zeus-network,101515401,265206154.0,51553.51999501672,41608.2480748823,0.15,7898193.0
Gate.io,"Solana Ecosystem, Meme, Frog-Themed, Solana Meme, GMCI Meme Index, GMCI Index",book-of-meme,101312407,101312407.0,351418.8299962741,251909.49387823473,0.04,44980483.0
Gate.io,"Polygon Ecosystem, Arbitrum Ecosystem, Ethereum Ecosystem, Optimism Ecosystem, Bridge Governance Tokens, Cross-chain Communication, Intent, Boba Network Ecosystem, Blockchain Capital Portfolio, Made in USA",across-protocol,101029438,250034023.0,148013.92123093107,160837.29454683626,0.04,11288476.0
Gate.io,"Big Data, Infrastructure, Storage, Cardano Ecosystem, DePIN",iagon,100597195,267531193.0,2984.6224590440747,4370.456478492226,0.62,501800.0
Gate.io,"Decentralized Exchange (DEX), Decentralized Finance (DeFi), Automated Market Maker (AMM), Ethereum Ecosystem, Cronos Ecosystem",vvs-finance,100815222,197090723.0,2591.4859126707224,8.45848916948097,3.44,314005.0
Gate.io,"Bridged USDT, QL1 Ecosystem, Bridged-Tokens, Bridged Stablecoins",qusdt,99987695,99987695.0,,,N/A,8143.32
Gate.io,"Smart Contract Platform, BNB Chain Ecosystem, Binance Launchpool, Ethereum Ecosystem, Layer 2 (L2), Restaking, Rollups-as-a-Service (RaaS), Rollup, Binance Labs Portfolio",altlayer,99667719,356974297.0,139760.23760434653,125400.53473654599,0.03,12141502.0
Gate.io,"NFT, BNB Chain Ecosystem, Ethereum Ecosystem, Binance Launchpad, DWF Labs Portfolio, Binance Labs Portfolio",space-id,99396784,460986079.0,179473.2613361602,168419.81406579007,0.04,14427162.0
Gate.io,"Solana Ecosystem, Liquid Staking Tokens, Liquid Staked SOL, Liquid Staking",drift-staked-sol,99705294,99705294.0,,,N/A,24236.0
Gate.io,"Crypto-Backed Tokens, Decentralized Finance (DeFi), Compound Tokens, cToken, Ethereum Ecosystem",compound-ether,98387520,98387497.0,,,N/A,269.71
Gate.io,"Smart Contract Platform, Ethereum Ecosystem, Layer 2 (L2), Optimism Superchain Ecosystem, Outlier Ventures Portfolio, Lisk Ecosystem",lisk,97826309,227048481.0,60421.93534263285,35429.96259381637,0.18,9251294.0
Gate.io,"NFT, Polygon Ecosystem, Ethereum Ecosystem, Optimism Ecosystem",blockv,97972544,97972544.0,,,N/A,70138.0
Gate.io,"DaoMaker Launchpad, Ethereum Ecosystem, Real World Assets (RWA), Sequoia Capital Portfolio, Made in USA",clearpool,97490781,128286466.0,6160.757330372039,10166.906687429457,0.2,2517159.0
Gate.io,"Software as a service, Ethereum Ecosystem, Energi Ecosystem",status,96911369,166512305.0,89963.050582484,80159.56148942823,0.04,7483061.0
Gate.io,"Smart Contract Platform, Layer 1 (L1), Zero Knowledge (ZK), Andreessen Horowitz (a16z) Portfolio, Privacy Blockchain, Made in USA",aleo,96721288,473917133.0,166881.37636712813,203342.4052005678,0.11,6224189.0
Gate.io,"Artificial Intelligence (AI), Infrastructure, Smart Contract Platform, Oracle, Polkadot Ecosystem, Ethereum Ecosystem, Interoperability, Layer 2 (L2), Zero Knowledge (ZK), DePIN, DWF Labs Portfolio, Rollup, AI Agents, Sora Ecosystem, AI Framework, Made in USA",pha,95991420,122345491.0,102554.0021265918,138574.54949719334,0.24,21765460.0
Gate.io,"Stablecoins, LP Tokens, Ethereum Ecosystem",resolv-rlp,95895980,95895980.0,,,N/A,196070.0
Gate.io,"XDC Ecosystem, Telos Ecosystem",ecoin-2,95498064,207099463.0,,,N/A,5.24
Gate.io,"Gaming (GameFi), NFT, Kaia Ecosystem, Gaming Blockchains",bora,95057676,99428144.0,2118.2029957280993,2455.4719380413226,1.3,258354.0
Gate.io,"Infrastructure, Smart Contract Platform, Oracle, Layer 1 (L1), Animoca Brands Portfolio, Coinbase Ventures Portfolio, Cross-chain Communication, Made in USA",supra,94918904,843967959.0,18877.38039352327,24154.963540832927,0.16,14979459.0
Gate.io,"Solana Ecosystem, Liquid Staking Tokens, Restaking, Liquid Restaking Tokens, Liquid Staked SOL, Liquid Staking, Liquid Restaked SOL",solayer-staked-sol,94808762,94808762.0,,,N/A,227845.0
Gate.io,Layer 1 (L1),oec-token,94640205,94640205.0,603.3506774265122,481.80692184995445,1.85,341629.0
Gate.io,"Fraxtal Ecosystem, Bridged-Tokens",l2-standard-bridged-frxusd,94557119,94557119.0,,,N/A,1262617.0
Gate.io,"Decentralized Finance (DeFi), Yield Farming, BNB Chain Ecosystem, Binance Launchpool, Lending/Borrowing Protocols, Arbitrum Ecosystem, Ethereum Ecosystem, Optimism Ecosystem, ZkSync Ecosystem, opBNB Ecosystem, Unichain Ecosystem",venus,94540888,169604473.0,35250.75921640129,41696.6830764807,0.51,6649068.0
Gate.io,"Solana Ecosystem, Payment Solutions, Viction Ecosystem",saros-finance,94848299,361326879.0,822.7310448151875,5686.540947673843,1.01,725352.0
Gate.io,"Smart Contract Platform, Gaming (GameFi), Solana Ecosystem, Layer 2 (L2), Gaming Blockchains",sonic-svm,94257181,628381209.0,161572.2510999214,168013.06868875257,0.05,24499472.0
Gate.io,"Infrastructure, Smart Contract Platform, Ethereum Ecosystem, Data Availability, Modular Blockchain",avail,94645927,484556203.0,44464.38807020224,46643.30678265058,0.19,3088568.0
Gate.io,"Gaming (GameFi), NFT, BNB Chain Ecosystem",infinitar-governance-token,94350127,460426440.0,4012.7301940688963,687.1902191692354,1.94,8282802.0
