Gate.io,"Artificial Intelligence (AI), Big Data, Media, BNB Chain Ecosystem, Polygon Ecosystem, Ethereum Ecosystem, GMCI DePIN Index, Galaxy Digital Portfolio, GMCI Index",everipedia,93011181,93011181.0,22282.116821721578,20287.40894568916,0.63,4642286.0
Gate.io,"Artificial Intelligence (AI), Oracle, Ethereum Ecosystem, DePIN, Energi Ecosystem, Sora Ecosystem, GMCI DePIN Index, GMCI Index",iexec-rlc,92865566,111619230.0,80976.07646594351,60279.93590628858,0.14,7112832.0
Gate.io,"Ethereum Ecosystem, DWF Labs Portfolio",adventure-gold,92824642,92824642.0,74026.60868476571,91846.04740502732,0.05,26913192.0
Gate.io,"Artificial Intelligence (AI), Infrastructure, Smart Contract Platform, Decentralized Finance (DeFi), Arbitrum Ecosystem, Ethereum Ecosystem, Zero Knowledge (ZK), DWF Labs Portfolio, Coinbase Ventures Portfolio, Pantera Capital Portfolio, Binance Labs Portfolio",marlin,92333720,113244198.0,36925.08984874247,38148.8255371466,0.44,5714457.0
Gate.io,"Decentralized Exchange (DEX), Exchange-based Tokens, Decentralized Finance (DeFi), Yield Farming, Automated Market Maker (AMM), Avalanche Ecosystem, Polygon Ecosystem, Near Protocol Ecosystem, Gnosis Chain Ecosystem, Harmony Ecosystem, Arbitrum Ecosystem, Ethereum Ecosystem, Optimism Ecosystem, Base Ecosystem, Index Coop Defi Index, Alameda Research Portfolio, DeFiance Capital Portfolio, Pantera Capital Portfolio, Energi Ecosystem, Polygon zkEVM Ecosystem, Huobi ECO Chain Ecosystem, Blockchain Capital Portfolio, Index Coop Index",balancer,90972743,98375042.0,105592.02021702727,88650.0563379065,0.21,6685621.0
Gate.io,"Energy, Ethereum Ecosystem, Alleged SEC Securities, Energi Ecosystem, GMCI DePIN Index, Blockchain Capital Portfolio, GMCI Index",power-ledger,90840455,171389437.0,36842.5804767946,56037.19087220292,0.18,7645594.0
Gate.io,"Gaming (GameFi), XDC Ecosystem, Gaming Utility Token",gama-coin,89815945,138178453.0,,,N/A,2285090.0
Gate.io,"Artificial Intelligence (AI), Virtual Reality, Launchpad, Ethereum Ecosystem, Telegram Apps, Discord Bots, PAAL AI Launchpad, AI Agents, AI Applications, AI Agent Launchpad, Binance Alpha Spotlight, AI Framework, DeFAI, Made in USA",paal-ai,88772138,99854754.0,11798.069075049643,12607.755188426314,0.28,6931992.0
Gate.io,"Infrastructure, Smart Contract Platform, Decentralized Finance (DeFi), BNB Chain Ecosystem, Avalanche Ecosystem, Polygon Ecosystem, Fantom Ecosystem, Harmony Ecosystem, Arbitrum Ecosystem, Ethereum Ecosystem, DWF Labs Portfolio, Layer 3 (L3), Outlier Ventures Portfolio",orbs,89380154,196287311.0,13622.836616830127,14842.529054400047,0.1,3329703.0
Gate.io,"Smart Contract Platform, Ethereum Ecosystem, Layer 2 (L2), Zero Knowledge (ZK), Restaking, Zircuit Ecosystem",zircuit,87957786,400732819.0,56343.34555482398,98266.38806970813,0.12,13467227.0
Gate.io,"Cronos Ecosystem, Bridged USDT, Bridged-Tokens, Bridged Stablecoins",cronos-bridged-usdt-cronos,87714810,87714810.0,,,N/A,411949.0
Gate.io,"Smart Contract Platform, Layer 1 (L1)",ong,87586758,214703388.0,30028.465685751245,27158.13568797815,0.14,1851286.0
Gate.io,"Artificial Intelligence (AI), Smart Contract Platform, Gaming (GameFi), NFT, BNB Chain Ecosystem, Layer 1 (L1), Ethereum Ecosystem, Modular Blockchain, Chromia Ecosystem",chromaway,87260988,87260988.0,96930.14739581736,48639.25319188624,0.29,9959237.0
Gate.io,"Smart Contract Platform, Bitcoin Sidechains, Stacks Ecosystem, SideChain",sbtc-2,87075977,87075977.0,,,N/A,9840.65
Gate.io,"Smart Contract Platform, Polkadot Ecosystem, Layer 1 (L1), Coinbase Ventures Portfolio, Binance Labs Portfolio",moonbeam,86965350,105902530.0,92016.51621695468,66974.04436124978,0.11,4906446.0
Gate.io,BNB Chain Ecosystem,metfi-2,86705626,202933617.0,111.74599164662503,97.3920581697135,0.52,479228.0
Gate.io,"Gaming (GameFi), Play To Earn, Ethereum Ecosystem, RPG, Alameda Research Portfolio, Circle Ventures Portfolio, OKX Ventures Portfolio, MMO",big-time,86561981,242865863.0,149051.50052510426,156275.85490311528,0.04,14175160.0
Gate.io,"Smart Contract Platform, Privacy, Proof of Work (PoW), Made in USA",verge,86162448,86334798.0,,,N/A,5791779.0
Gate.io,"SocialFi, Coinbase Ventures Portfolio, Pantera Capital Portfolio, Andreessen Horowitz (a16z) Portfolio, Sequoia Capital Portfolio",deso,86389849,88655672.0,624.6567719770892,4776.940332018609,2.3,73691.0
Gate.io,"Decentralized Exchange (DEX), Decentralized Finance (DeFi), Arbitrum Ecosystem, Ethereum Ecosystem",tokenlon,86667995,104319335.0,,,N/A,27562.0
Gate.io,"Stablecoins, USD Stablecoin, Ethereum Ecosystem, Sonic Ecosystem, Fiat-backed Stablecoin",frax-usd,86149522,86149522.0,,,N/A,1864924.0
Gate.io,"Smart Contract Platform, Layer 1 (L1), Zero Knowledge (ZK)",ozone-chain,86010676,118561832.0,,,N/A,244215.0
Gate.io,"Crypto-Backed Tokens, Ethereum Ecosystem",temple,85861057,86030207.0,,,N/A,4834.35
Gate.io,"Smart Contract Platform, Layer 2 (L2), eGirl Capital Portfolio, Paradigm Portfolio, Blast Ecosystem",blast,85296377,321743217.0,46354.13253640504,74017.23029370213,0.06,4661317.0
Gate.io,"Smart Contract Platform, Gaming (GameFi), NFT, Layer 1 (L1), Play To Earn, Ethereum Ecosystem, Animoca Brands Portfolio, Gaming Blockchains, Pantera Capital Portfolio, OKX Ventures Portfolio",wax,85239883,91715492.0,2601.4364759566747,5630.0161331514455,0.21,5157523.0
Gate.io,"Business Services, Polygon Ecosystem, Ethereum Ecosystem",request-network,85248374,110760392.0,25733.163745314614,34652.611033324734,0.11,3360283.0
Gate.io,"Exchange-based Tokens, Centralized Exchange (CEX) Token, Ethereum Ecosystem",hashkey-ecopoints,84818814,640141991.0,88941.55050438286,74454.92715146265,0.2,2166513.0
Gate.io,"NFT, Solana Ecosystem, NFT Marketplace",tensor,84693426,253112951.0,451651.0816793678,392145.15924662136,0.04,14274612.0
Gate.io,"Gaming (GameFi), NFT, BNB Chain Ecosystem, Metaverse, Collectibles, Polygon Ecosystem, Play To Earn, Harmony Ecosystem, Guild and Scholarship, Ethereum Ecosystem, Animoca Brands Portfolio, Base Ecosystem, DWF Labs Portfolio, Ronin Ecosystem, Gaming Governance Token, Andreessen Horowitz (a16z) Portfolio, Delphi Ventures Portfolio",yield-guild-games,83512450,203434140.0,144118.88955541994,153116.7682521479,0.15,13279903.0
Gate.io,"Meme, Ethereum Ecosystem, PolitiFi",constitutiondao,83659557,83659557.0,230751.52610086143,221836.694851938,0.06,17961842.0
Gate.io,"Polygon Ecosystem, XRP Ledger Ecosystem",crypto-trading-fund,83415332,83415332.0,,,N/A,8276.58
Gate.io,Ethereum Ecosystem,dkargo,83223617,88787642.0,7.932228791151746,364.66654712488764,2.51,975508.0
Gate.io,"Decentralized Exchange (DEX), Decentralized Finance (DeFi), Yield Farming, Automated Market Maker (AMM), Solana Ecosystem, Coinbase Ventures Portfolio, DeFiance Capital Portfolio, Made in USA",orca,82920347,155641328.0,67826.08891655476,58028.941914548705,0.13,16394239.0
Gate.io,"Artificial Intelligence (AI), Infrastructure, Ethereum Ecosystem, AI Framework, Made in USA",arcblock,81807823,154354382.0,3064.123074837647,2478.439633627776,0.24,856209.0
Gate.io,"NFT, Ethereum Ecosystem",superrare,82312550,102843004.0,139515.11246963037,322094.47695872374,0.03,128297105.0
Gate.io,"Solana Ecosystem, Polygon Ecosystem, DePIN, Pantera Capital Portfolio",geodnet,82722116,258024247.0,17030.264842722263,13713.279466054264,0.08,273030.0
Gate.io,"Artificial Intelligence (AI), BNB Chain Ecosystem, Ethereum Ecosystem, DragonFly Capital Portfolio, Binance Labs Portfolio, Delphi Ventures Portfolio, OKX Ventures Portfolio, Binance HODLer Airdrops, AI Agent Launchpad, Binance Alpha Spotlight, AI Framework",myshell,82622213,306008196.0,23461.16823798275,21254.07119285311,0.15,68057899.0
Gate.io,"Internet of Things (IOT), BNB Chain Ecosystem, Ethereum Ecosystem, DePIN, DWF Labs Portfolio",mass-vehicle-ledger,81917387,86588955.0,3841.2949872324334,4583.250647345998,0.26,621172.0
Gate.io,"Decentralized Finance (DeFi), BNB Chain Ecosystem, Arbitrum Ecosystem, Ethereum Ecosystem, Multicoin Capital Portfolio, Energi Ecosystem",dforce-token,81545501,81545501.0,32601.900577656757,25627.94844040552,0.53,9938475.0
Gate.io,"Smart Contract Platform, Cosmos Ecosystem, Modular Blockchain, Osmosis Ecosystem, Rollups-as-a-Service (RaaS)",dymension,81328100,322672028.0,150451.06189065977,213570.54637063603,0.34,8221463.0
Gate.io,"Gaming (GameFi), Play To Earn, Guild and Scholarship, Ethereum Ecosystem, Animoca Brands Portfolio, Base Ecosystem, DWF Labs Portfolio, Ronin Ecosystem, Coinbase Ventures Portfolio, DeFiance Capital Portfolio, Pantera Capital Portfolio, Binance Labs Portfolio, MMO",zentry,81152455,119135598.0,78580.7247291054,70653.63590263623,0.41,6376900.0
Gate.io,BNB Chain Ecosystem,bitdca,81212391,87228572.0,,,N/A,31316.0
Gate.io,"Berachain Ecosystem, Bridged USDT, Bridged-Tokens, Ink Ecosystem, Bridged Stablecoins",usdt0,80841254,80841254.0,,,N/A,219143.0
Gate.io,"Blast Ecosystem, Bridged WETH, Bridged-Tokens",l2-standard-bridged-weth-blast,80111748,80078169.0,,,N/A,153260.0
Gate.io,"Smart Contract Platform, Proof of Stake (PoS)",stratis,79446236,87534456.0,8334.16331409077,6045.504338088266,0.89,1148203.0
Gate.io,"Artificial Intelligence (AI), BNB Chain Ecosystem, Solana Ecosystem, Ethereum Ecosystem, AI Agents, Alameda Research Portfolio",delysium,79523934,151684917.0,30938.785133822134,21880.78689084962,0.06,2127332.0
Gate.io,"Software as a service, Polygon Ecosystem, Ethereum Ecosystem, Decentralized Identifier (DID), Pantera Capital Portfolio, Energi Ecosystem, Blockchain Capital Portfolio",civic,79636188,99296991.0,29804.76378224658,110876.11002985555,0.04,7108706.0
Gate.io,"NFT, Polygon Ecosystem",sathosi-airlines-token,79657210,380433005.0,,,N/A,2521.14
Gate.io,"Artificial Intelligence (AI), Smart Contract Platform, Decentralized Finance (DeFi), Analytics, NFT, BNB Chain Ecosystem, Launchpad, Ethereum Ecosystem, Telegram Apps, Discord Bots, ChainGPT Launchpad, Poolz Finance Launchpad, AI Agents, AI Applications, Binance Alpha Spotlight, AI Framework, DeFAI",chaingpt,79329525,98490892.0,54314.578478077085,47157.7997947435,0.19,21947416.0
Gate.io,"Stablecoins, USD Stablecoin, Solana Ecosystem, Ethereum Ecosystem, Multicoin Capital Portfolio, Fiat-backed Stablecoin",paxos-standard,79270490,79270490.0,1332395.2028707508,1382218.8775213803,0.02,1779991.0
Gate.io,"Stablecoins, Decentralized Finance (DeFi), Lending/Borrowing Protocols, Ethereum Ecosystem",syrupusdc,79177054,79177804.0,,,N/A,115603.0
Gate.io,"BNB Chain Ecosystem, Liquid Staking Tokens",astherus-staked-bnb,80994725,80994748.0,,,N/A,1014.85
Gate.io,"Ethereum Ecosystem, Stablecoin Protocol",level-usd,78252852,78603188.0,,,N/A,981805.0
Gate.io,"Business Services, Decentralized Finance (DeFi), Oracle, Polygon Ecosystem, Gnosis Chain Ecosystem, Arbitrum Ecosystem, Ethereum Ecosystem, Optimism Ecosystem, Manta Network Ecosystem, Binance Labs Portfolio, Lisk Ecosystem, Made in USA",tellor,77943212,80211141.0,132779.49229024287,136093.36216933298,0.07,19197369.0
Gate.io,"Decentralized Finance (DeFi), Wallets, Ethereum Ecosystem, Pundi AIFX Omnilayer Ecosystem",pundi-x-2,78032993,78032993.0,37866.393363371164,26664.450875402465,0.63,5658116.0
Gate.io,"Decentralized Finance (DeFi), Solana Ecosystem, Real World Assets (RWA), Payment Solutions, DePIN, Coinbase Ventures Portfolio, Alameda Research Portfolio, Circle Ventures Portfolio, OKX Ventures Portfolio, RWA Protocol, Made in USA",zebec-network,77325067,104353906.0,4003.2978479704657,10029.546549450415,0.14,27032476.0
Gate.io,"Smart Contract Platform, Layer 1 (L1), Osmosis Ecosystem, XRP Ledger Ecosystem",coreum,77731393,77731393.0,1594.439918859806,4839.830891197296,0.11,100299.0
Gate.io,"Smart Contract Platform, Polkadot Ecosystem, Layer 1 (L1), DePIN, Outlier Ventures Portfolio",peaq-2,77976160,458258034.0,32422.137961369554,43055.5888402098,0.19,9082545.0
Gate.io,"Exchange-based Tokens, Centralized Exchange (CEX) Token, Ethereum Ecosystem",bitmart-token,77648264,146280125.0,,,N/A,4215279.0
Gate.io,Smart Contract Platform,songbird,77313257,91865046.0,777.6960754497715,2479.8653522831282,0.57,382506.0
Gate.io,"Stablecoins, USD Stablecoin, Seigniorage, Alleged SEC Securities, Osmosis Ecosystem, Stablecoin Protocol, DeFiance Capital Portfolio, Terra Classic Ecosystem, Binance Labs Portfolio, Delphi Ventures Portfolio, Galaxy Digital Portfolio, Fiat-backed Stablecoin",terrausd,77865481,110317088.0,32873.48550840068,41090.865068370425,0.1,19912259.0
Gate.io,"Arbitrum Ecosystem, Bridge Governance Tokens, Base Ecosystem, Cross-chain Communication, OKX Ventures Portfolio",orbiter-finance,76984824,248338142.0,10723.422951275339,13543.468799958122,0.2,59052843.0
Gate.io,"Optimism Ecosystem, Bridged WBTC, Bridged-Tokens",optimism-bridged-wbtc-optimism,77118239,77118239.0,,,N/A,788840.0
Gate.io,"Stablecoins, USD Stablecoin, Osmosis Ecosystem, Fiat-backed Stablecoin",usdx,76470428,76470428.0,,,N/A,12381.16
Gate.io,"Artificial Intelligence (AI), Smart Contract Platform, Layer 1 (L1), Ethereum Ecosystem, Osmosis Ecosystem, AI Agents, AI Agent Launchpad",humans-ai,76144858,76144858.0,2069.124796754263,2290.648987875415,0.2,649394.0
Gate.io,"Decentralized Finance (DeFi), Liquid Staking Tokens, Ethereum Ecosystem, LSDFi, Liquid Staked ETH, Liquid Staking",origin-ether,76226950,76226950.0,,,N/A,39883.0
Gate.io,"Meme, Dog-Themed, TON Ecosystem, TON Meme",dogs-2,76370381,81284392.0,120446.20491446099,228772.46536562516,0.07,37553400.0
Gate.io,"Base Ecosystem, Cybersecurity, Binance Labs Portfolio, OKX Ventures Portfolio, Binance Alpha Spotlight",goplus-security,75783922,417910676.0,46888.17875275538,66496.65046594817,0.02,63685410.0
Gate.io,"Decentralized Exchange (DEX), Decentralized Finance (DeFi), Yield Farming, Automated Market Maker (AMM), BNB Chain Ecosystem, Avalanche Ecosystem, Arbitrum Ecosystem, Mantle Ecosystem, DeFiance Capital Portfolio, Delphi Ventures Portfolio, Dex Aggregator",joe,75841358,97123824.0,63698.4196590585,51887.30309840488,0.26,6066054.0
Gate.io,"BNB Chain Ecosystem, Solana Ecosystem, Polygon Ecosystem, Meme, Ethereum Ecosystem, Cronos Ecosystem, Dog-Themed, Elon Musk-Inspired, Fuse Ecosystem",dogelon-mars,75880154,138051775.0,160864.05788371182,239311.9365355373,0.4,3081372.0
Gate.io,"Decentralized Finance (DeFi), Lending/Borrowing Protocols, Moonbeam Ecosystem, Base Ecosystem, Coinbase Ventures Portfolio, Made in USA",moonwell-artemis,75493898,115096886.0,2650.396980539767,5322.708054019812,0.04,6612829.0
Gate.io,"Entertainment, Gaming (GameFi), NFT, Axie Infinity Ecosystem, Play To Earn, Ethereum Ecosystem, Ronin Ecosystem, Gaming Utility Token",smooth-love-potion,75507980,75507980.0,31241.277274827957,42268.31034276667,0.16,8488865.0
Gate.io,"Smart Contract Platform, Gaming (GameFi), Layer 1 (L1), Proof of Stake (PoS), Gaming Blockchains",oasys,74958894,194032964.0,706.9692495477302,1000.9281831579125,1.85,484753.0
Gate.io,"Sports, BNB Chain Ecosystem",pixer-eternity,74898729,348061502.0,,,N/A,712446.0
Gate.io,"Smart Contract Platform, Wallets, Layer 2 (L2), Osmosis Ecosystem",islamic-coin,74416928,897694348.0,198.93015883407037,606.6639994438884,0.58,755201.0
Gate.io,"Artificial Intelligence (AI), Decentralized Finance (DeFi), Ethereum Ecosystem, DePIN",pinlink,73632179,92040224.0,524.2522747163086,2135.379075508556,1.41,1655673.0
Gate.io,"Optimism Ecosystem, Bridged WETH, Bridged-Tokens",l2-standard-bridged-weth-optimism,74072045,73404543.0,,,N/A,5055712.0
Gate.io,"Exchange-based Tokens, Centralized Exchange (CEX) Token, Near Protocol Ecosystem, Harmony Ecosystem, Ethereum Ecosystem, Multicoin Capital Portfolio, Alameda Research Portfolio, Elastos Smart Contract Chain Ecosystem, Sequoia Capital Portfolio, Made in China",huobi-token,74005472,93338977.0,42.47373335106799,280.8510023360882,3.67,21224.0
Gate.io,"Gaming (GameFi), NFT, Ethereum Ecosystem",undeads-games,74054789,257622876.0,2405.931558862506,1637.558989330771,0.83,438939.0
Gate.io,Retail,milk-alliance,73492260,164319729.0,326.08189483569134,128.71529722297657,1.51,2128573.0
Gate.io,"Decentralized Finance (DeFi), Oracle, Ethereum Ecosystem, DWF Labs Portfolio, Pantera Capital Portfolio",api3,73133465,91267373.0,46407.44223922899,42993.11700689144,0.26,13370725.0
Gate.io,"Ethereum Ecosystem, DePIN",dent,73390049,76723726.0,33666.24127532363,27108.693534460017,0.55,4980225.0
Gate.io,"Meme, Ethereum Ecosystem, Mantle Ecosystem",puff-the-dragon,73336816,73336816.0,15.031089069994707,4.214043660248913,3.19,28383.0
Gate.io,"NFT, BNB Chain Ecosystem, Solana Ecosystem, Meme, Ethereum Ecosystem, Base Ecosystem, Hybrid Token Standards, Wojak-Themed",non-playable-coin,75734290,75734290.0,6743.149859075309,2542.97979048513,0.7,5005612.0
Gate.io,"Gaming (GameFi), Play To Earn, TON Ecosystem, Tap to Earn, Arcade Games",watcoin-2,73260907,81332805.0,,,N/A,794520.0
Gate.io,"Smart Contract Platform, Gaming (GameFi), NFT, Binance Launchpool, Arbitrum Ecosystem, Layer 3 (L3), XAI Ecosystem, Gaming Blockchains, Outlier Ventures Portfolio",xai-blockchain,73134017,107821190.0,139193.61158235217,94755.58217155887,0.03,26482198.0
Gate.io,"Decentralized Exchange (DEX), Exchange-based Tokens, Decentralized Finance (DeFi), BNB Chain Ecosystem, Binance Launchpool, Polygon Ecosystem, Near Protocol Ecosystem, Arbitrum Ecosystem, Ethereum Ecosystem, DWF Labs Portfolio, Coinbase Ventures Portfolio, Alameda Research Portfolio, DeFiance Capital Portfolio, Pantera Capital Portfolio, Aurora Ecosystem, Energi Ecosystem, Binance Labs Portfolio, Galaxy Digital Portfolio",dodo,72921756,72921756.0,34409.095389635,17122.173131708198,0.37,8153752.0
Gate.io,"Artificial Intelligence (AI), Decentralized Finance (DeFi), Solana Ecosystem, Arbitrum Ecosystem, Metis Ecosystem, AI Agents, Sonic Ecosystem, IOTA EVM Ecosystem, AI Applications, DeFAI",heyanon,71947071,118490287.0,488.62889256493725,1587.6627373279273,0.53,2921044.0
Gate.io,"Decentralized Finance (DeFi), Lending/Borrowing Protocols, Arbitrum Ecosystem, Ethereum Ecosystem, Alameda Research Portfolio, Pantera Capital Portfolio",liquity,71315064,73283867.0,228318.5089450695,189286.59996860803,0.11,10863050.0
Gate.io,"Decentralized Finance (DeFi), Ethereum Ecosystem, Binance Alpha Spotlight",avalon-2,71544432,440951813.0,31123.545711739716,35594.61849684779,0.16,17197703.0
Gate.io,"Artificial Intelligence (AI), Cardano Ecosystem, Ethereum Ecosystem, AI Agents, Sora Ecosystem",singularitynet,70762538,106944626.0,,,N/A,35149.0
Gate.io,"Artificial Intelligence (AI), Business Services, Decentralized Finance (DeFi), Ethereum Ecosystem, Paradigm Portfolio, DragonFly Capital Portfolio, Energi Ecosystem",numeraire,70668232,94617264.0,44482.655971858374,36554.40560037957,0.06,5758683.0
Gate.io,"Artificial Intelligence (AI), Ethereum Ecosystem",0x0-ai-ai-smart-contract,70558117,70558117.0,,,N/A,95038.0
Gate.io,"Decentralized Finance (DeFi), Lending/Borrowing Protocols, Ethereum Ecosystem, Real World Assets (RWA), Coinbase Ventures Portfolio, Andreessen Horowitz (a16z) Portfolio, RWA Protocol, Made in USA",goldfinch,70350530,87019440.0,353.7755720469107,2624.4454085953316,0.33,547971.0
Gate.io,"Gaming (GameFi), NFT, Collectibles, Play To Earn, Ethereum Ecosystem, Base Ecosystem, Energi Ecosystem",ecomi,70437000,80817485.0,3962.963161947577,6693.487885232431,0.31,2127870.0
Gate.io,"Decentralized Finance (DeFi), Lending/Borrowing Protocols, Solana Ecosystem, Binance Alpha Spotlight",kamino,70417823,521613507.0,191695.36759139324,205887.0315486758,0.02,7734202.0
Gate.io,"Stablecoins, Decentralized Finance (DeFi), USD Stablecoin, BNB Chain Ecosystem, Polygon Ecosystem, Gnosis Chain Ecosystem, Arbitrum Ecosystem, Ethereum Ecosystem, Optimism Ecosystem, Base Ecosystem, Crypto-backed Stablecoin, Fiat-backed Stablecoin",crvusd,69904219,69904219.0,,,N/A,2843707.0
Gate.io,"Artificial Intelligence (AI), Solana Ecosystem, DePIN",nosana,69305445,83100053.0,1620.5345165984334,1903.0205737906583,0.36,432973.0
Gate.io,"Smart Contract Platform, Ethereum Ecosystem, Layer 2 (L2), Zero Knowledge (ZK), Rollup, OKX Ventures Portfolio",taiko,69551547,657726079.0,159031.1148750477,159914.02439415493,0.05,11452536.0
Gate.io,"Tokenized Assets, Polygon Ecosystem, Arbitrum Ecosystem, Ethereum Ecosystem, Real World Assets (RWA), Starknet Ecosystem, Tokenized Treasury Bills (T-Bills)",spiko-us-t-bills-money-market-fund,69588146,69588146.0,,,N/A,0.0
Gate.io,"Smart Contract Platform, Layer 1 (L1), DWF Labs Portfolio, Radix Ecosystem",radix,69494525,85093897.0,8013.311623539903,6966.160013993891,0.09,1702891.0
Gate.io,"Smart Contract Platform, Binance Launchpool, Layer 2 (L2), Scroll Ecosystem",scroll,69662789,366646259.0,192545.86087452556,239616.84328523895,0.03,11568689.0
Gate.io,"Lending/Borrowing Protocols, Solana Ecosystem, FTX Holdings, Coinbase Ventures Portfolio, Alameda Research Portfolio, DragonFly Capital Portfolio",solend,69360419,137087973.0,0.0,0.0,8.25,537.25
Gate.io,"Artificial Intelligence (AI), Marketing, Analytics, BNB Chain Ecosystem, Ethereum Ecosystem, Animoca Brands Portfolio, Base Ecosystem, AI Agents, Binance Alpha Spotlight",cookie,68955842,153479462.0,407065.3974145182,321177.1575068916,0.18,18960658.0
Gate.io,"Solana Ecosystem, Restaking, Liquid Restaking Tokens, Liquid Restaked SOL",renzo-restaked-sol,69010111,69010111.0,,,N/A,147163.0
Gate.io,"Meme, Ethereum Ecosystem, Frog-Themed, Murad Picks, Binance Alpha Spotlight",apu-s-club,68120754,68120754.0,2030.765896314584,1876.2199079658674,0.2,7001571.0
Gate.io,"Decentralized Finance (DeFi), Ethereum Ecosystem",elixir-finance,68480168,428914688.0,52375.32096170874,49921.40500116236,0.02,50682056.0
Gate.io,"Decentralized Exchange (DEX), Decentralized Finance (DeFi), Sui Ecosystem, Animoca Brands Portfolio, OKX Ventures Portfolio, Dex Aggregator",cetus-protocol,68300659,100022108.0,71687.60868002866,70711.4480086116,0.17,10203940.0
Gate.io,"Stablecoins, Decentralized Finance (DeFi), USD Stablecoin, BNB Chain Ecosystem, Avalanche Ecosystem, Arbitrum Ecosystem, Liquid Staking Tokens, Ethereum Ecosystem, Optimism Ecosystem, Fiat-backed Stablecoin",staked-frax,67795903,67795903.0,,,N/A,35.81
Gate.io,"Solana Ecosystem, Wallets, Base Ecosystem, TON Ecosystem",bitget-wallet-token,67182897,470072637.0,,,N/A,3631.06
Gate.io,"Smart Contract Platform, Layer 1 (L1), Proof of Work (PoW), Privacy Blockchain",ergo,67434655,82315508.0,875.7824069935564,288.24440698223106,0.2,75790.0
Gate.io,SocialFi,steem,66880144,66961695.0,131793.09002189556,112052.12169866802,0.23,9185973.0
Gate.io,"Arbitrum Ecosystem, Ethereum Ecosystem, Base Ecosystem, Decentralized Science (DeSci)",axondao-governance-token,65621249,151726327.0,,,N/A,491259.0
Gate.io,"Decentralized Finance (DeFi), BNB Chain Ecosystem, Solana Ecosystem, Wallets, Polygon Ecosystem, Ethereum Ecosystem, Binance Launchpad, DWF Labs Portfolio, Multicoin Capital Portfolio, Alameda Research Portfolio, Viction Ecosystem, Binance Labs Portfolio",coin98,66188836,73475131.0,86207.19842228487,110300.75606357036,0.01,16815875.0
Gate.io,Ethereum Ecosystem,saasgo,66193523,82741904.0,2061.382873270908,2723.985281499719,0.97,193288.0
Gate.io,E-commerce,pay-coin,65555355,121805246.0,,,N/A,3920938.0
Gate.io,"Polkadot Ecosystem, Real World Assets (RWA), Coinbase Ventures Portfolio, Circle Ventures Portfolio, Galaxy Digital Portfolio, RWA Protocol",centrifuge,65149854,71382813.0,9683.101457637962,7678.479171576435,0.17,827422.0
Gate.io,Ethereum Ecosystem,devve,65846140,90416998.0,2018.5698680254077,2824.692606417158,0.31,997250.0
Gate.io,"Healthcare, Osmosis Ecosystem",medibloc,65033700,70440504.0,1417.2705630488601,3558.8583528906556,2.3,252520.0
Gate.io,"Stablecoins, USD Stablecoin, Fiat-backed Stablecoin",falcon-finance,64663923,64663923.0,,,N/A,51675.0
Gate.io,"Infrastructure, Smart Contract Platform, BNB Chain Ecosystem, Avalanche Ecosystem, Polygon Ecosystem, Arbitrum Ecosystem, Ethereum Ecosystem, Optimism Ecosystem, Layer 2 (L2), Base Ecosystem, Binance Launchpad, Modular Blockchain, Layer 3 (L3), Rollup, Proof of Stake (PoS), Appchains, Binance Labs Portfolio",cartesi,64496831,75043468.0,60591.580549208324,63359.683042990044,0.08,7409296.0
Gate.io,"Artificial Intelligence (AI), Launchpad, Base Ecosystem, AI Applications, Clanker Ecosystem, Binance Alpha Spotlight",tokenbot-2,63695035,63695035.0,567.6655355469582,3669.5724650916504,0.79,4949696.0
Gate.io,"Smart Contract Platform, Layer 2 (L2), Made in USA",metal,64235464,64235464.0,28954.852667687766,17355.299179631547,0.29,1281537.0
Gate.io,,ark,64031954,64594792.0,22485.017862154906,34766.47311479012,0.46,5597347.0
Gate.io,"Smart Contract Platform, Layer 1 (L1), Ethereum Ecosystem, Proof of Stake (PoS)",pundi-aifx,63796400,63796400.0,,,N/A,67207.0
Gate.io,"Artificial Intelligence (AI), BNB Chain Ecosystem, Ethereum Ecosystem, DePIN, AI Agents",netmind-token,63895336,203091787.0,3794.280729020667,2126.4279432865806,0.57,1698372.0
Gate.io,"Decentralized Finance (DeFi), Lending/Borrowing Protocols, Ethereum Ecosystem, Real World Assets (RWA), Alameda Research Portfolio, Circle Ventures Portfolio, RWA Protocol",maple,63080542,160103753.0,,,N/A,2591723.0
Gate.io,"Decentralized Finance (DeFi), Ethereum Ecosystem, Liquid Staking",usualx,62931914,62931914.0,,,N/A,178385.0
Gate.io,"Meme, Base Ecosystem, Dog-Themed, Base Meme, Farcaster Ecosystem",doginme,62569347,62569347.0,0.0,0.0,N/A,5601104.0
Gate.io,"Artificial Intelligence (AI), Infrastructure, Gaming (GameFi), NFT, Solana Ecosystem, Arbitrum Ecosystem, Impossible Finance Launchpad, Ethereum Ecosystem, Animoca Brands Portfolio, Base Ecosystem",carv,62221384,310966727.0,13958.778655934286,15226.216514724418,0.1,5521587.0
Gate.io,"BNB Chain Ecosystem, Binance Megadrop, BTCfi",solv-protocol,62090300,351786401.0,43585.27647993647,50961.65671542196,0.17,41079054.0
Gate.io,"Infrastructure, Smart Contract Platform",ardor,61792600,61792600.0,,,N/A,4581117.0
