KuCoin,"Artificial Intelligence (AI), Analytics, Base Ecosystem, Binance HODLer Airdrops",kaito,337188715,1396869245.0,82572.78404921225,116385.31657268711,0.12,133593208.0
KuCoin,"Artificial Intelligence (AI), Smart Contract Platform, DePIN, Osmosis Ecosystem, Proof of Stake (PoS), Archway Ecosystem, Made in USA",akash-network,332932898,334069999.0,75815.85943665792,90275.20550922684,0.05,18255183.0
KuCoin,"Mantle Ecosystem, Bridged USDT, Bridged-Tokens, Bridged Stablecoins",mantle-bridged-usdt-mantle,328045166,328045166.0,,,N/A,584716.0
KuCoin,"Decentralized Exchange (DEX), Smart Contract Platform, Decentralized Finance (DeFi), Prediction Markets, Layer 1 (L1), Gnosis Chain Ecosystem, MEV Protection, Arbitrum Ecosystem, Ethereum Ecosystem, SideChain, Energi Ecosystem",gnosis,324937365,376435062.0,,,N/A,23291698.0
KuCoin,"Solana Ecosystem, Meme, Ethereum Ecosystem, Base Ecosystem, Murad Picks, Stock market-themed",spx6900,324620517,324620517.0,25959.921054341365,69052.11561357514,0.06,18388059.0
KuCoin,"Stablecoins, USD Stablecoin, BNB Chain Ecosystem, Avalanche Ecosystem, Polygon Ecosystem, Optimism Ecosystem, Fiat-backed Stablecoin, Binance-Peg Tokens",binance-peg-busd,323565621,323565621.0,,,N/A,8655721.0
KuCoin,"Meme, Base Ecosystem, Frog-Themed, Base Meme, The Boy’s Club",based-brett,322740924,322740928.0,29418.699574608036,31640.789502677762,0.03,20829968.0
KuCoin,"Smart Contract Platform, Zero Knowledge (ZK), FTX Holdings, Paradigm Portfolio, Coinbase Ventures Portfolio, Multicoin Capital Portfolio, Proof of Stake (PoS), Pantera Capital Portfolio, Circle Ventures Portfolio, Privacy Blockchain, Polychain Capital Portfolio, Made in USA, Coinbase 50 Index",mina-protocol,318378648,318378648.0,46495.64371485127,40207.95255747551,0.08,14829522.0
KuCoin,"Decentralized Finance (DeFi), Arbitrum Ecosystem, Ethereum Ecosystem, Real World Assets (RWA), Base Ecosystem, Coinbase Ventures Portfolio, Energi Ecosystem, Made in USA",reserve-rights-token,314723366,563014003.0,23873.649171830628,51109.978364776376,0.02,22626754.0
KuCoin,"Artificial Intelligence (AI), Smart Contract Platform, Storage, BNB Chain Ecosystem, Layer 1 (L1), Ethereum Ecosystem, DePIN, DWF Labs Portfolio, Osmosis Ecosystem, GMCI DePIN Index, GMCI Index",aioz-network,312251213,316493627.0,12306.562691800384,33522.184525702476,0.17,8537799.0
KuCoin,"Decentralized Finance (DeFi), Lending/Borrowing Protocols, Ethereum Ecosystem, Base Ecosystem, Coinbase Ventures Portfolio, Pantera Capital Portfolio, Morpho Ecosystem, Binance Alpha Spotlight",morpho,310656611,1316072722.0,55166.57143160054,45581.17415722461,0.09,12722314.0
KuCoin,"Smart Contract Platform, Layer 1 (L1), MEV Protection, Proof of Work (PoW), Privacy Blockchain",verus-coin,310181095,310199728.0,,,N/A,8801.85
KuCoin,"Yield Aggregator, Ethereum Ecosystem, Binance Labs Portfolio, Polychain Capital Portfolio",stakestone-berachain-vault-token,307290112,307290112.0,,,N/A,1408936.0
KuCoin,"Solana Ecosystem, Meme, Solana Meme, AI Meme, Pump.fun Ecosystem, Terminal of Truths, Binance Alpha Spotlight",fartcoin,305795817,305795817.0,267385.39719176217,149688.55673696572,0.03,103696953.0
KuCoin,"Smart Contract Platform, Layer 1 (L1), Ethereum Ecosystem, Real World Assets (RWA), RWA Protocol, Made in USA",plume,301452187,1507260937.0,37968.71377423758,49006.2950440507,0.12,30226006.0
KuCoin,"Decentralized Finance (DeFi), Tron Ecosystem",just,298267964,298267964.0,25387.0321551625,21089.323754965684,0.17,21953597.0
KuCoin,"Artificial Intelligence (AI), Ethereum Ecosystem, DePIN, Energi Ecosystem, GMCI DePIN Index, GMCI Index",golem,293120126,293120126.0,829.2507858231237,2975.002889246836,0.45,18263570.0
KuCoin,"Solana Ecosystem, Arbitrum Ecosystem, Impossible Finance Launchpad, Ethereum Ecosystem, DePIN, Animoca Brands Portfolio",aethir,284779204,1514145840.0,70867.82333162546,82419.53666826924,0.06,30980514.0
KuCoin,"Decentralized Exchange (DEX), Exchange-based Tokens, Decentralized Finance (DeFi), Yield Farming, Derivatives, Synthetic Issuer, Avalanche Ecosystem, Polygon Ecosystem, Near Protocol Ecosystem, Fantom Ecosystem, Harmony Ecosystem, Ethereum Ecosystem, Optimism Ecosystem, Base Ecosystem, DWF Labs Portfolio, Paradigm Portfolio, Coinbase Ventures Portfolio, Index Coop Defi Index, Energi Ecosystem, Huobi ECO Chain Ecosystem, GMCI DeFi Index, Synthetic, Index Coop Index, GMCI Index, Coinbase 50 Index",havven,284140225,284494815.0,15499.559020031653,13008.82920944797,0.12,19228436.0
KuCoin,"Crypto-Backed Tokens, Wrapped-Tokens, Polygon Ecosystem, Arbitrum Ecosystem, Liquid Staking Tokens, Ethereum Ecosystem, Optimism Ecosystem, Base Ecosystem, Liquid Staked ETH, Liquid Staking",coinbase-wrapped-staked-eth,282284398,785240277.0,,,N/A,4154828.0
KuCoin,"Polygon Ecosystem, Bridged WETH, Bridged-Tokens",polygon-pos-bridged-weth-polygon-pos,278806485,278806485.0,,,N/A,14632244.0
KuCoin,"Infrastructure, Ethereum Ecosystem, Data Availability, Restaking, Polychain Capital Portfolio, Made in USA",eigenlayer,278176173,1949620412.0,50391.78524988205,61103.27039634282,0.04,32343159.0
KuCoin,"Decentralized Exchange (DEX), Exchange-based Tokens, Decentralized Finance (DeFi), Automated Market Maker (AMM), BNB Chain Ecosystem, Avalanche Ecosystem, Polygon Ecosystem, Near Protocol Ecosystem, Harmony Ecosystem, Ethereum Ecosystem, FTX Holdings, Alameda Research Portfolio, DragonFly Capital Portfolio, Pantera Capital Portfolio, Energi Ecosystem, Binance Labs Portfolio, GMCI DeFi Index, Galaxy Digital Portfolio, Blockchain Capital Portfolio, Dex Aggregator, GMCI Index, Coinbase 50 Index",1inch,277477689,302189848.0,35844.35286612729,46630.745361380534,0.06,20329846.0
KuCoin,"Smart Contract Platform, Privacy, Masternodes, Alleged SEC Securities, Proof of Stake (PoS), Proof of Work (PoW), Made in USA",dash,276990568,276990568.0,13818.142189199358,26122.20583874581,0.04,27546239.0
KuCoin,"Liquid Staking Tokens, Ethereum Ecosystem, Liquid Staking",stader-ethx,271900715,271900715.0,,,N/A,171482.0
KuCoin,"BNB Chain Ecosystem, Wallets, Ethereum Ecosystem, Animoca Brands Portfolio, Binance Launchpad, Energi Ecosystem, Binance Labs Portfolio",safepal,271644631,271644631.0,3.4447755637951647,185.63396494242647,0.46,9813761.0
KuCoin,"Smart Contract Platform, Polkadot Ecosystem, Proof of Stake (PoS), Pantera Capital Portfolio, Made in USA, Coinbase 50 Index",kusama,270885280,270885280.0,18734.707823854358,24321.995672883455,0.06,11406869.0
KuCoin,"Polygon Ecosystem, Bridged WBTC, Bridged-Tokens",polygon-bridged-wbtc-polygon-pos,270435134,270435134.0,,,N/A,6983517.0
KuCoin,"Smart Contract Platform, Ethereum Ecosystem, Real World Assets (RWA), DWF Labs Portfolio, Proof of Stake (PoS)",creditcoin-2,268139364,370344550.0,32093.22883000293,32752.091205775185,0.08,17124971.0
KuCoin,"Smart Contract Platform, DePIN, Proof of Stake (PoS), Made in USA",theta-fuel,263908286,263963705.0,7770.60925676775,17759.285644312044,0.29,2367353.0
KuCoin,"Exchange-based Tokens, Centralized Exchange (CEX) Token, Ethereum Ecosystem, Morph L2 Ecosystem",mx-token,263422491,1160703410.0,,,N/A,18346261.0
KuCoin,"Smart Contract Platform, Layer 2 (L2), Zero Knowledge (ZK), ZkSync Ecosystem, Consensys Portfolio, Blockchain Capital Portfolio, OKX Ventures Portfolio",zksync,262940647,1502517982.0,16389.25528989794,29949.438872191182,0.14,49695483.0
KuCoin,"Stablecoins, USD Stablecoin, Ethereum Ecosystem, Fiat-backed Stablecoin",elixir-deusd,262376865,262376865.0,,,N/A,127935899.0
KuCoin,"Decentralized Finance (DeFi), Ethereum Ecosystem, Restaking, Liquid Restaking Tokens, Liquid Staking",ether-fi-staked-btc,261682535,261682535.0,,,N/A,258362.0
KuCoin,"Solana Ecosystem, Arbitrum Ecosystem, Ethereum Ecosystem, Interoperability, Base Ecosystem, Multicoin Capital Portfolio, Cross-chain Communication, Made in USA",wormhole,260620666,897189986.0,76104.15174319941,129753.45977439002,0.11,33329938.0
KuCoin,"Smart Contract Platform, Gaming (GameFi), NFT, Layer 1 (L1), Play To Earn, Gaming Blockchains, WEMIX Ecosystem",wemix-token,259608660,333817884.0,2290.816876586052,739.7442667485111,0.81,4155346.0
KuCoin,"Crypto-Backed Tokens, Decentralized Finance (DeFi), cToken, Ethereum Ecosystem",compound-wrapped-btc,258367909,258367909.0,,,N/A,0.0
KuCoin,"Meme, Cardano Ecosystem",snek,257028748,260308811.0,,,N/A,1432966.0
KuCoin,"BRC-20, Bitcoin Ecosystem, Inscriptions",sats-ordinals,256927218,256927218.0,10504.54038299463,12484.576659828157,0.16,7843015.0
KuCoin,"Arbitrum Ecosystem, Liquid Staking Tokens, Ethereum Ecosystem, Liquid Staking",sweth,253774957,253782033.0,,,N/A,378994.0
KuCoin,"Stablecoins, Tokenized Assets, Tokenized Gold, BNB Chain Ecosystem, Real World Assets (RWA), Tokenized Commodities, Commodity-backed Stablecoin",quorium,250739412,250739412.0,,,N/A,83105.0
KuCoin,"Decentralized Finance (DeFi), BNB Chain Ecosystem, Polygon Ecosystem, Fantom Ecosystem, Arbitrum Ecosystem, Moonbeam Ecosystem, Liquid Staking Tokens, Ethereum Ecosystem, Optimism Ecosystem, Polygon zkEVM Ecosystem, Liquid Staking, Made in USA",frax-ether,249422323,249422323.0,,,N/A,1642311.0
KuCoin,"Smart Contract Platform, BNB Chain Ecosystem, Avalanche Ecosystem, Polygon Ecosystem, Arbitrum Ecosystem, Ethereum Ecosystem, Optimism Ecosystem, Base Ecosystem, Multicoin Capital Portfolio, Layer 0 (L0), Cross-chain Communication, Circle Ventures Portfolio, Sequoia Capital Portfolio, OKX Ventures Portfolio",layerzero,244773730,2202136254.0,25111.871648091033,28322.443693693473,0.15,201253751.0
KuCoin,"Decentralized Finance (DeFi), Solana Ecosystem, LSDFi, Restaking, Stablecoin Protocol, Binance Labs Portfolio, Binance HODLer Airdrops, Polychain Capital Portfolio",solayer,243162648,1157917372.0,39454.73582432432,89556.06990858188,0.17,94136254.0
KuCoin,"Bridged USDC, Sonic Ecosystem, Bridged-Tokens, Bridged Stablecoins",sonic-bridged-usdc-e-sonic,240301792,240301792.0,,,N/A,59172208.0
KuCoin,"Smart Contract Platform, BNB Chain Ecosystem, GMCI Layer 1 Index, GMCI Index, Made in China",zilliqa,240200634,248546520.0,79038.58079467501,86248.2635065498,0.08,11812666.0
KuCoin,"Smart Contract Platform, Polkadot Ecosystem, Layer 1 (L1), Layer 2 (L2), Alameda Research Portfolio, Binance Labs Portfolio, OKX Ventures Portfolio",astar,239961517,263837703.0,817.6517665626374,4112.880510830544,0.27,5841351.0
KuCoin,"NFT, Ethereum Ecosystem, NFT Marketplace, FTX Holdings, NFTFi, eGirl Capital Portfolio, Paradigm Portfolio, GMCI DeFi Index, GMCI Index, Made in USA, Coinbase 50 Index",blur,237685099,317428807.0,19789.715248644145,35089.61072811828,0.19,30299522.0
KuCoin,"Infrastructure, Decentralized Finance (DeFi), Sui Ecosystem",deep,233613509,934454038.0,132226.17275345486,80249.34934618264,0.12,16722739.0
KuCoin,"Decentralized Finance (DeFi), Liquid Staking Tokens, Base Ecosystem, Liquid Staked ETH, Liquid Staking",super-oeth,233280593,233280593.0,,,N/A,851281.0
KuCoin,"Stablecoins, USD Stablecoin, BNB Chain Ecosystem, Avalanche Ecosystem, Near Protocol Ecosystem, Arbitrum Ecosystem, Ethereum Ecosystem, Tron Ecosystem, BitTorrent Ecosystem, Algorithmic Stablecoin, Fiat-backed Stablecoin",usdd,233185548,233185548.0,8871.752005761346,7849.332081145333,0.6,3041236.0
KuCoin,"Infrastructure, Wallets, Gnosis Chain Ecosystem, Ethereum Ecosystem",safe,232762214,420424424.0,31122.233017755712,46739.45120872944,0.07,14384050.0
KuCoin,"Decentralized Exchange (DEX), Exchange-based Tokens, Decentralized Finance (DeFi), Derivatives, Perpetuals, Ethereum Ecosystem, Paradigm Portfolio",dydx,228940330,228940330.0,,,N/A,14174600.0
KuCoin,"Smart Contract Platform, Interoperability, Layer 2 (L2), Rollup, Multicoin Capital Portfolio, Proof of Work (PoW), DragonFly Capital Portfolio, Sequoia Capital Portfolio, Blockchain Capital Portfolio, Polychain Capital Portfolio, Made in China",nervos-network,227523641,231113124.0,52207.04749707587,55905.85817670311,0.04,14155768.0
KuCoin,"Smart Contract Platform, Proof of Stake (PoS), Made in China",qtum,227187924,232054446.0,21062.09202992577,12188.095131300917,0.23,18701323.0
KuCoin,"Analytics, Avalanche Ecosystem, Meme, Cat-Themed, Made in USA",ket,224208994,224208994.0,,,N/A,7326079.0
KuCoin,"Solana Ecosystem, Avalanche Ecosystem, Polygon Ecosystem, Near Protocol Ecosystem, Harmony Ecosystem, Ethereum Ecosystem, Pantera Capital Portfolio, Energi Ecosystem, Made in USA",basic-attention-token,223794912,224443050.0,188.4828018170297,1903.3498382915668,0.27,13112349.0
KuCoin,"Gaming (GameFi), Binance Launchpool, Meme, Play To Earn, TON Ecosystem, TON Meme, Tap to Earn",notcoin,218833221,218833221.0,74031.60254110051,83016.9876581849,0.05,142550376.0
KuCoin,"BNB Chain Ecosystem, Polygon Ecosystem, Ethereum Ecosystem, Animoca Brands Portfolio, DWF Labs Portfolio, Alameda Research Portfolio, Energi Ecosystem, Binance Labs Portfolio",mask-network,217464218,217464218.0,73293.9072794446,58163.58050163695,0.04,26184303.0
KuCoin,"Layer 1 (L1), VeChain Ecosystem",vethor-token,217004821,217059369.0,6889.798695052716,43709.61480565804,0.48,3958149.0
KuCoin,"Smart Contract Platform, BNB Chain Ecosystem, Layer 1 (L1), Proof of Stake (PoS), Pantera Capital Portfolio, Andreessen Horowitz (a16z) Portfolio, Binance Labs Portfolio, Blockchain Capital Portfolio, Privacy Blockchain, Polychain Capital Portfolio, Coinbase 50 Index",oasis-network,214403609,318588576.0,27462.541729230823,64556.95909303992,0.06,10194770.0
KuCoin,"Decentralized Exchange (DEX), Decentralized Finance (DeFi), Avalanche Ecosystem, Harmony Ecosystem, Ethereum Ecosystem, Coinbase Ventures Portfolio, Pantera Capital Portfolio, Energi Ecosystem, GMCI DeFi Index, Blockchain Capital Portfolio, GMCI Index, Made in USA",0x,214388794,252698800.0,17151.178275501243,17916.42202242662,0.16,25098931.0
KuCoin,"Decentralized Finance (DeFi), Aptos Ecosystem",abtc,212318509,212318509.0,,,N/A,51394.0
KuCoin,"Artificial Intelligence (AI), Harmony Ecosystem, Arbitrum Ecosystem, Ethereum Ecosystem, DePIN, Coinbase Ventures Portfolio, Multicoin Capital Portfolio, Pantera Capital Portfolio, GMCI DePIN Index, GMCI Index, Coinbase 50 Index",livepeer,211580764,211580764.0,31531.460630843314,37555.62158800826,0.08,18100375.0
KuCoin,"Decentralized Exchange (DEX), Decentralized Finance (DeFi), Automated Market Maker (AMM), Cosmos Ecosystem, Osmosis Ecosystem, Paradigm Portfolio, Evmos Ecosystem, Secret Ecosystem, GMCI DeFi Index, GMCI Index",osmosis,209768500,292238087.0,27839.389084244533,35325.33774101185,0.07,11790484.0
KuCoin,"Artificial Intelligence (AI), Polkadot Ecosystem, Metaverse, Ethereum Ecosystem, Interoperability, Real World Assets (RWA), DePIN, Decentralized Science (DeSci), AI Agents",origintrail,209357731,209653329.0,25023.815269838728,24395.74381796534,0.29,6311728.0
KuCoin,"Decentralized Finance (DeFi), Solana Ecosystem, Liquid Staking Tokens, Liquid Staked SOL, Liquid Staking",bybit-staked-sol,209151266,209151266.0,,,N/A,5015990.0
KuCoin,"Artificial Intelligence (AI), Solana Ecosystem, Meme, Solana Meme, AI Meme, AI Agents, Binance Alpha Spotlight, AI Framework, Made in USA",ai16z,207307831,207307831.0,125770.87584538969,76430.50958258564,0.1,51768315.0
KuCoin,"Liquid Staking Tokens, Ethereum Ecosystem, Base Ecosystem, Liquid Staked ETH, Liquid Staking",liquid-staked-ethereum,206715746,206715746.0,,,N/A,35748.0
KuCoin,"Stablecoins, Ethereum Ecosystem",usda-2,206279218,206279218.0,,,N/A,788622.0
KuCoin,"Stablecoins, USD Stablecoin, Arbitrum Ecosystem, Ethereum Ecosystem, Base Ecosystem, Crypto-backed Stablecoin, Fiat-backed Stablecoin",gho,205219785,205219785.0,,,N/A,7740865.0
KuCoin,"Smart Contract Platform, Gaming (GameFi), Ethereum Ecosystem, Base Ecosystem, Card Games, Paradigm Portfolio, Gaming Blockchains, Gaming Utility Token",echelon-prime,204291202,403360016.0,,,N/A,4239321.0
KuCoin,"Gaming (GameFi), BNB Chain Ecosystem, Solana Ecosystem, Meme, Ethereum Ecosystem, Dog-Themed, Solana Meme, Gaming Utility Token",baby-doge-coin,204244328,518435698.0,19038.318696488393,19658.0929990943,0.16,14647163.0
KuCoin,"Gaming (GameFi), NFT, Collectibles, Polygon Ecosystem, Ethereum Ecosystem, Animoca Brands Portfolio, Gaming Blockchains, Made in USA",superfarm,204233990,452149499.0,27312.593027091923,35396.69716961145,0.22,19025108.0
KuCoin,"BNB Chain Ecosystem, Meme, AI Meme",ai-companions,203802267,203802267.0,,,N/A,2957176.0
KuCoin,"Decentralized Exchange (DEX), BNB Chain Ecosystem, Solana Ecosystem, Ethereum Ecosystem, Real World Assets (RWA), Base Ecosystem, RWA Protocol",chex-token,201119078,201119078.0,,,N/A,1489109.0
KuCoin,"Smart Contract Platform, Storage, Harmony Ecosystem, Ethereum Ecosystem, DePIN, Energi Ecosystem, Sora Ecosystem, GMCI DePIN Index, GMCI Index",holotoken,200843234,200843234.0,,,N/A,10931543.0
KuCoin,"BNB Chain Ecosystem, Meme",cheems-token,198815417,198815417.0,4663.881269883125,4559.641330030954,0.72,5518929.0
KuCoin,"Decentralized Finance (DeFi), Polygon Ecosystem, Ethereum Ecosystem, Coinbase Ventures Portfolio, Pantera Capital Portfolio",instadapp,198286049,502794428.0,,,N/A,1018831.0
KuCoin,"Decentralized Finance (DeFi), Yield Farming, BNB Chain Ecosystem, Avalanche Ecosystem, Polygon Ecosystem, Fantom Ecosystem, Arbitrum Ecosystem, Ethereum Ecosystem, Optimism Ecosystem, Linea Ecosystem, Bridge Governance Tokens, Base Ecosystem, FTX Holdings",stargate-finance,198002610,203818630.0,4441.052551915241,12770.774357651097,0.1,7249402.0
KuCoin,"Solana Ecosystem, Meme, Solana Meme, Pump.fun Ecosystem, Zoo-Themed, Memorial Themed",peanut-the-squirrel,197793451,197793451.0,97914.06856993798,112783.69031803725,0.1,409739761.0
KuCoin,"Infrastructure, Smart Contract Platform, Venom Ecosystem",venom,194198590,702168409.0,1878.589068192735,2468.9799401353316,0.31,2211914.0
KuCoin,"Smart Contract Platform, Privacy, Layer 1 (L1), Proof of Stake (PoS), Proof of Work (PoW), Blockchain Capital Portfolio, Made in USA",decred,194196421,194196421.0,2411.8886200706684,1567.9881641079803,0.61,2437611.0
KuCoin,"Artificial Intelligence (AI), Exchange-based Tokens, Analytics, Derivatives, Perpetuals, Centralized Exchange (CEX) Token, Ethereum Ecosystem, Binance Launchpad, Coinbase Ventures Portfolio, Binance Labs Portfolio, Made in USA",arkham,193823611,524279322.0,37506.380133993654,52550.13113392569,0.08,57998261.0
KuCoin,"Smart Contract Platform, Layer 1 (L1), Celo Ecosystem, DWF Labs Portfolio, Coinbase Ventures Portfolio, Proof of Stake (PoS), Andreessen Horowitz (a16z) Portfolio, Optimism Superchain Ecosystem, Outlier Ventures Portfolio, Made in USA",celo,193219087,341818533.0,26044.682834669286,35175.71813730829,0.03,15446112.0
KuCoin,"Smart Contract Platform, Layer 1 (L1), DePIN, Andreessen Horowitz (a16z) Portfolio, Made in USA",chia,191410393,435050741.0,6313.214648366284,15205.687130694178,0.06,10633741.0
KuCoin,"Solana Ecosystem, Meme, Solana Meme, Cat-Themed, Murad Picks",popcat,191229525,191229525.0,26832.606466305166,40165.43141920485,0.1,96140427.0
KuCoin,"Infrastructure, Smart Contract Platform, NEO Ecosystem",gas,190980590,190980590.0,11651.564256165851,13844.354590611418,0.15,4604151.0
KuCoin,"Solana Ecosystem, Meme, Dog-Themed, Solana Meme, Bitcoin Ecosystem, Runes",dog-go-to-the-moon-rune,190284334,190284334.0,,,N/A,7687195.0
KuCoin,"Solana Ecosystem, BRC-20, Bitcoin Ecosystem, Inscriptions",ordinals,189120330,189120330.0,63557.42755784482,86259.1375053407,0.11,106882149.0
KuCoin,"Infrastructure, Smart Contract Platform, BNB Chain Ecosystem, Layer 1 (L1), Ethereum Ecosystem, GMCI Layer 1 Index, Aelf Ecosystem, GMCI Index",aelf,185259406,249728739.0,11570.844528111329,14342.961465129187,0.2,15726573.0
KuCoin,"Gambling (GambleFi), Gaming (GameFi), Ethereum Ecosystem",rollbit-coin,184959317,184966403.0,,,N/A,598428.0
KuCoin,"Smart Contract Platform, Real World Assets (RWA), Proof of Work (PoW), Made in USA",ravencoin,184820208,184826244.0,8991.65867511104,16544.58456224368,0.24,9760819.0
KuCoin,"Crypto-Backed Tokens, Decentralized Finance (DeFi), Wrapped-Tokens, Ethereum Ecosystem",resolv-wstusr,184744046,165975365.0,,,N/A,162.11
KuCoin,"Smart Contract Platform, Privacy, Proof of Work (PoW)",mimblewimblecoin,184316629,184320833.0,,,N/A,4065.27
KuCoin,"Meme, Cronos Ecosystem, AI Meme, Cronos zkEVM Ecosystem",agentfun-ai,184091425,184091425.0,,,N/A,6555.41
KuCoin,"Solana Ecosystem, Meme, Solana Meme, AI Meme, Pump.fun Ecosystem",act-i-the-ai-prophecy,183458310,183458310.0,30448.632569922633,44259.39555109357,0.16,44385638.0
KuCoin,"Gaming (GameFi), Ethereum Ecosystem, Decentralized Identifier (DID), Animoca Brands Portfolio, OKX Ventures Portfolio, Outlier Ventures Portfolio",mocaverse,183019063,851459962.0,37860.39817391855,29455.989620450975,0.14,23725102.0
KuCoin,"Smart Contract Platform, Storage, DePIN, Paradigm Portfolio, Proof of Work (PoW), DragonFly Capital Portfolio, Made in USA",siacoin,181602680,194081662.0,,,N/A,14840426.0
KuCoin,"Artificial Intelligence (AI), Smart Contract Platform, Layer 1 (L1), Paradigm Portfolio, Coinbase Ventures Portfolio, DeFiance Capital Portfolio, Polychain Capital Portfolio, Vana Ecosystem",vana,181552658,707348020.0,127461.54021286414,9651.456140504532,0.35,32496040.0
KuCoin,"Exchange-based Tokens, Ethereum Ecosystem",btse-token,181549318,224049903.0,,,N/A,3275466.0
KuCoin,"Decentralized Finance (DeFi), BNB Chain Ecosystem, Polygon Ecosystem, Fantom Ecosystem, Arbitrum Ecosystem, Moonbeam Ecosystem, Liquid Staking Tokens, Ethereum Ecosystem, Optimism Ecosystem, Liquid Staked ETH, Liquid Staking",staked-frax-ether,181282151,181282151.0,,,N/A,135573.0
KuCoin,"Solana Ecosystem, Ethereum Ecosystem, Energi Ecosystem",swissborg,181150760,181150760.0,,,N/A,10561644.0
KuCoin,"Tourism, BNB Chain Ecosystem",trip,180348841,599124963.0,,,N/A,40277.0
KuCoin,"BNB Chain Ecosystem, Avalanche Ecosystem, Polygon Ecosystem, Fantom Ecosystem, Arbitrum Ecosystem, Ethereum Ecosystem, Optimism Ecosystem, Liquid Staking Governance Tokens, Linea Ecosystem, DePIN, Scroll Ecosystem, Rollups-as-a-Service (RaaS), Blast Ecosystem, Mode Ecosystem, Pantera Capital Portfolio, Polygon zkEVM Ecosystem, Binance Labs Portfolio, Liquid Staking, Made in USA",ankr,178585812,178585812.0,9605.749265785904,8216.692755494134,0.11,15186887.0
KuCoin,"Launchpad, Meme, Base Ecosystem, Cat-Themed, Base Meme",toshi,177697617,177697617.0,22706.279720346025,23437.916294385766,0.05,28171974.0
KuCoin,,nem,177283415,177283415.0,374.08180276279427,1384.2161693343735,1.48,19559014.0
KuCoin,"Tokenized Real Estate, Tokenized Assets, Ethereum Ecosystem, Real World Assets (RWA), RWA Protocol",apf-coin,177042019,259945069.0,,,N/A,3191815.0
KuCoin,"Gaming (GameFi), BNB Chain Ecosystem, Ethereum Ecosystem, TON Ecosystem",gmt-token,175804407,175804407.0,,,N/A,17338857.0
KuCoin,"Meme, Ethereum Ecosystem, Base Ecosystem, Cat-Themed, Murad Picks",mog-coin,175491957,175491957.0,19214.778613560797,27556.127643699103,0.45,13984218.0
KuCoin,"Avalanche Ecosystem, Liquid Staking Tokens, Liquid Staking",benqi-liquid-staked-avax,174730237,174730237.0,,,N/A,2287606.0
KuCoin,"Oracle, Ethereum Ecosystem",redstone-oracles,173475471,619555252.0,31812.958501222573,31353.91572779673,0.32,103182208.0
KuCoin,"Decentralized Finance (DeFi), Yield Farming, Yield Aggregator, Yearn Ecosystem, Avalanche Ecosystem, Polygon Ecosystem, Near Protocol Ecosystem, Gnosis Chain Ecosystem, Fantom Ecosystem, Harmony Ecosystem, Arbitrum Ecosystem, Ethereum Ecosystem, Optimism Ecosystem, Base Ecosystem, Index Coop Defi Index, Alameda Research Portfolio, Energi Ecosystem, Sora Ecosystem, Huobi ECO Chain Ecosystem, Blockchain Capital Portfolio, Index Coop Index",yearn-finance,171769317,186601199.0,24127.11785208999,37280.13528078234,0.03,24129150.0
KuCoin,"Decentralized Finance (DeFi), Solana Ecosystem, Ethereum Ecosystem, Optimism Ecosystem, Base Ecosystem, Cross-chain Communication, BTCfi",threshold-network-token,170032524,187309866.0,13250.777714051499,12188.588570344726,0.18,9761707.0
KuCoin,"Starknet Ecosystem, Bridged-Tokens",bridged-wrapped-ether-starkgate,169929237,169929237.0,,,N/A,1061653.0
KuCoin,"Internet of Things (IOT), Ethereum Ecosystem, DePIN, Base Ecosystem, Account Abstraction, GMCI DePIN Index, GMCI Index, Made in USA",iotex,169668784,169668784.0,6073.481599134964,13674.769955759064,0.06,15683572.0
KuCoin,"Solana Ecosystem, Meme, Dog-Themed, Solana Meme, Cat-Themed",cat-in-a-dogs-world,169660281,169660281.0,46216.236008393804,59183.31367429091,0.05,12780120.0
KuCoin,Arbitrum Ecosystem,rcge,168805259,168805259.0,,,N/A,2.43
KuCoin,"Entertainment, Smart Contract Platform, Gaming (GameFi), NFT, Metaverse, Layer 1 (L1), Harmony Ecosystem, Ethereum Ecosystem, Gaming Blockchains, Energi Ecosystem",enjincoin,167018408,172798352.0,12851.0930471497,23916.00739453416,0.11,14787410.0
KuCoin,"Decentralized Finance (DeFi), Launchpad, Ethereum Ecosystem, DWF Labs Portfolio, Coinbase Ventures Portfolio, Pantera Capital Portfolio, Blockchain Capital Portfolio",auction,166185448,192679422.0,20237.662750298623,119912.9711225986,0.2,136997157.0
KuCoin,"Decentralized Finance (DeFi), Derivatives, Perpetuals, Avalanche Ecosystem, Arbitrum Ecosystem",gmx,164520207,164520207.0,1979.8114343067002,7297.519226255023,0.06,36178791.0
KuCoin,"Decentralized Finance (DeFi), Liquid Staking Tokens, Ethereum Ecosystem, Liquid Staked ETH, Liquid Staking",treehouse-eth,163803667,163803667.0,,,N/A,52280.0
KuCoin,"Decentralized Finance (DeFi), Ethereum Ecosystem, Stablecoin Protocol",tribe-2,162792081,357772582.0,,,N/A,59717.0
KuCoin,"Decentralized Finance (DeFi), Yield Farming, Yield Aggregator, Ethereum Ecosystem, Metagovernance, Curve Ecosystem, Yield Optimizer",convex-finance,162344168,197714792.0,3545.2265767156136,8527.400069162391,0.11,16870736.0
KuCoin,"Solana Ecosystem, Meme, Cat-Themed",meow,161797598,161797598.0,,,N/A,807891.0
KuCoin,"Decentralized Exchange (DEX), Exchange-based Tokens, Ethereum Ecosystem",coinex-token,161382454,161382454.0,,,N/A,133096.0
