Exchange,Category,Token CEX,Market Cap Today,FDV Today,Depth +2%,Depth -2%,Bid Ask Spread Percentage,24H Volume (USD)
KuCoin,"Smart Contract Platform, Decentralized Finance (DeFi), BNB Chain Ecosystem, Cosmos Ecosystem, Layer 1 (L1), Ethereum Ecosystem, Binance Launchpad, Osmosis Ecosystem, Proof of Stake (PoS), Pantera Capital Portfolio, Secret Ecosystem, GMCI Layer 1 Index, GMCI Index, Made in USA, Coinbase 50 Index",injective-protocol,982815030,1005671733.0,100571.7414484141,173362.31207629963,0.02,110213387.0
KuCoin,"Decentralized Finance (DeFi), BNB Chain Ecosystem, Ethereum Ecosystem",dexe,988143196,1669948510.0,522.1451834519038,1958.211374744679,0.5,20966456.0
KuCoin,"Infrastructure, Smart Contract Platform, Layer 2 (L2), Bitcoin Sidechains, Stacks Ecosystem, SideChain, GMCI Layer 2 Index, GMCI 30 Index, Blockchain Capital Portfolio, GMCI Index, Made in USA, Coinbase 50 Index",blockstack,977431749,977431749.0,39801.57987731787,59834.324358130245,0.05,29146833.0
KuCoin,"Stablecoins, USD Stablecoin, Arbitrum Ecosystem, Ethereum Ecosystem, Fiat-backed Stablecoin",usual-usd,976026627,976026627.0,,,N/A,60130227.0
KuCoin,"Smart Contract Platform, Gaming (GameFi), NFT, Play To Earn, Ethereum Ecosystem, Layer 2 (L2), Zero Knowledge (ZK), Animoca Brands Portfolio, Immutable Ecosystem, Coinbase Ventures Portfolio, Rollup, Gaming Blockchains, GMCI 30 Index, GMCI Index, Gaming Marketplace, Coinbase 50 Index",immutable-x,966915593,1093599503.0,13803.236358343951,28408.920403123753,0.11,30442824.0
KuCoin,"Decentralized Finance (DeFi), Solana Ecosystem, Liquid Staking Tokens, Liquid Staked SOL, Liquid Staking",binance-staked-sol,965992936,965992936.0,,,N/A,3187231.0
KuCoin,"Smart Contract Platform, Ethereum Ecosystem, Decentralized Identifier (DID), Optimism Ecosystem, Coinbase Ventures Portfolio, Multicoin Capital Portfolio, Andreessen Horowitz (a16z) Portfolio, Blockchain Capital Portfolio, Optimism Superchain Ecosystem, World Chain Ecosystem, Made in USA",worldcoin-wld,964031427,8716351703.0,89687.20006036777,112477.42806472596,0.05,115484358.0
KuCoin,"Polygon Ecosystem, Arbitrum Ecosystem, Liquid Staking Tokens, Ethereum Ecosystem, Optimism Ecosystem, Base Ecosystem, Liquid Staked ETH, Liquid Staking",rocket-pool-eth,954570839,954572913.0,,,N/A,3029837.0
KuCoin,"Artificial Intelligence (AI), Smart Contract Platform, Decentralized Finance (DeFi), Layer 1 (L1), Real World Assets (RWA), Parallelized EVM, Coinbase Ventures Portfolio, Multicoin Capital Portfolio, GMCI Layer 1 Index, Delphi Ventures Portfolio, Circle Ventures Portfolio, OKX Ventures Portfolio, GMCI Index, World Liberty Financial Portfolio, Made in USA",sei-network,946215334,2031594921.0,80023.88365899149,135372.64544013655,0.05,107606746.0
KuCoin,"Smart Contract Platform, Layer 1 (L1), DWF Labs Portfolio",flare-networks,923354664,1561070677.0,21913.49360534633,59920.991540583156,0.13,11575482.0
KuCoin,"Artificial Intelligence (AI), Business Services, Infrastructure, Smart Contract Platform, Analytics, Avalanche Ecosystem, Polygon Ecosystem, Near Protocol Ecosystem, Harmony Ecosystem, Arbitrum Ecosystem, Ethereum Ecosystem, DePIN, Coinbase Ventures Portfolio, Multicoin Capital Portfolio, Proof of Stake (PoS), Energi Ecosystem, Sora Ecosystem, Made in USA, Coinbase 50 Index",the-graph,899148449,1015864831.0,9883.424197474811,28866.182574567694,0.12,37801659.0
KuCoin,"Smart Contract Platform, Layer 1 (L1), DePIN, Theta Ecosystem, Blockchain Capital Portfolio, Made in USA",theta-token,896531727,896531727.0,50921.50838189717,122230.98945566203,0.16,22747653.0
KuCoin,"Infrastructure, Decentralized Finance (DeFi), Polygon Ecosystem, Arbitrum Ecosystem, Ethereum Ecosystem, Optimism Ecosystem, Liquid Staking Governance Tokens, eGirl Capital Portfolio, Paradigm Portfolio, Coinbase Ventures Portfolio, Multicoin Capital Portfolio, Index Coop Defi Index, Alameda Research Portfolio, DragonFly Capital Portfolio, Andreessen Horowitz (a16z) Portfolio, GMCI DeFi Index, Delphi Ventures Portfolio, Liquid Staking, Index Coop Index, GMCI Index, Coinbase 50 Index",lido-dao,848045125,945269862.0,64631.5566765951,85919.18629582795,0.13,101272857.0
KuCoin,"Polygon Ecosystem, Bridged USDT, Bridged-Tokens, Bridged Stablecoins",polygon-bridged-usdt-polygon,847850842,847850842.0,,,N/A,14158651.0
KuCoin,"Crypto-Backed Tokens, BNB Chain Ecosystem, Avalanche Ecosystem, Arbitrum Ecosystem, Ethereum Ecosystem, Mantle Ecosystem, Base Ecosystem, Restaking, Berachain Ecosystem, Merlin Chain Ecosystem, Sonic Ecosystem, Sei v2 Ecosystem, Soneium Ecosystem, Corn Ecosystem",solv-protocol-solvbtc-bbn,840300013,840300013.0,,,N/A,308724.0
KuCoin,"BNB Chain Ecosystem, Solana Ecosystem, Polygon Ecosystem, Meme, Arbitrum Ecosystem, Ethereum Ecosystem, Aptos Ecosystem, Dog-Themed, Solana Meme, Neon Ecosystem, GMCI Meme Index, GMCI Index, Made in USA, Coinbase 50 Index",bonk,837081623,960733328.0,121385.02666910383,147436.64733470813,0.1,71033767.0
KuCoin,"Liquid Staking Tokens, Ethereum Ecosystem, Mantle Ecosystem, Liquid Staked ETH, Liquid Staking",mantle-staked-ether,764685097,764685417.0,,,N/A,6394381.0
KuCoin,"Smart Contract Platform, DWF Labs Portfolio, GMCI Layer 1 Index, GMCI Index, Made in USA, Coinbase 50 Index",eos,763968715,1057650031.0,70203.70248099281,95148.66866230727,0.08,67117824.0
KuCoin,"Stablecoins, USD Stablecoin, Solana Ecosystem, Ethereum Ecosystem, Fiat-backed Stablecoin, Made in USA",paypal-usd,760906497,760906497.0,83013.47405091648,55477.7670913069,0.12,257499787.0
KuCoin,"Stablecoins, Tokenized Assets, Tokenized Gold, Ethereum Ecosystem, Real World Assets (RWA), Tokenized Commodities",tether-gold,735642236,735642236.0,,,N/A,19484437.0
KuCoin,"Smart Contract Platform, Layer 1 (L1), Tezos Ecosystem, Proof of Stake (PoS), GMCI Layer 1 Index, GMCI Index, Polychain Capital Portfolio, Made in USA, Coinbase 50 Index",tezos,730207084,744502135.0,18864.10278504687,57351.197785230455,0.28,20962271.0
KuCoin,"Smart Contract Platform, Gaming (GameFi), NFT, Layer 1 (L1), Play To Earn, Ethereum Ecosystem, DWF Labs Portfolio, Gaming Platform, Binance Labs Portfolio, GalaChain Ecosystem, Made in USA",gala,721419105,721419141.0,36574.151566951696,87219.69250948653,0.12,63208895.0
KuCoin,"Crypto-Backed Tokens, BNB Chain Ecosystem, Wrapped-Tokens",wbnb,704231032,704231032.0,,,N/A,139414537.0
KuCoin,"BNB Chain Ecosystem, Bridged USDC, Bridged-Tokens, Bridged Stablecoins",binance-bridged-usdc-bnb-smart-chain,698433648,698433648.0,,,N/A,75488014.0
KuCoin,"Gaming (GameFi), NFT, Metaverse, Polygon Ecosystem, Play To Earn, Harmony Ecosystem, Ethereum Ecosystem, Animoca Brands Portfolio, Alleged SEC Securities, Binance Launchpad, Gaming Utility Token, Simulation Games, Energi Ecosystem, Binance Labs Portfolio, Coinbase 50 Index",the-sandbox,699508561,857991933.0,54244.10836673347,93284.24502105657,0.11,61000872.0
KuCoin,"Storage, BNB Chain Ecosystem, Ethereum Ecosystem, DePIN, Alleged SEC Securities, Binance Launchpad, Tron Ecosystem, Energi Ecosystem, Binance Labs Portfolio, BitTorrent Ecosystem, GMCI DePIN Index, GMCI Index",bittorrent,686394557,689136385.0,19559.21534979809,32882.05915171792,0.17,25306438.0
KuCoin,"Berachain Ecosystem, Bridged USDC, Bridged-Tokens, Bridged Stablecoins",stargate-bridged-usdc-berachain,684297076,684297076.0,,,N/A,4321294.0
KuCoin,"Arbitrum Ecosystem, Bridged WBTC, Bridged-Tokens",arbitrum-bridged-wbtc-arbitrum-one,681330919,681330919.0,,,N/A,90390739.0
KuCoin,"Decentralized Finance (DeFi), Solana Ecosystem, Liquid Staking Governance Tokens, Multicoin Capital Portfolio, Alameda Research Portfolio, Delphi Ventures Portfolio, Liquid Staking, Made in USA",jito-governance-token,682079923,2240208075.0,28539.228561883512,27348.40329648049,0.09,33072364.0
KuCoin,"Smart Contract Platform, Bitcoin Fork, Proof of Work (PoW)",bitcoin-cash-sv,675502099,675503163.0,8019.334798669585,19649.147878113195,0.23,34824095.0
KuCoin,"Internet of Things (IOT), Smart Contract Platform, Layer 1 (L1), DePIN, DWF Labs Portfolio, IOTA EVM Ecosystem, Outlier Ventures Portfolio, Directed Acyclic Graph (DAG)",iota,666408636,835355045.0,52454.110280890774,93446.02486840959,0.11,17862240.0
KuCoin,"Internet of Things (IOT), Ethereum Ecosystem, DePIN, DWF Labs Portfolio, Coinbase 50 Index",jasmycoin,664920022,686617123.0,64577.922490596204,84028.95994587576,0.06,59905312.0
KuCoin,"Smart Contract Platform, Decentralized Finance (DeFi), Layer 1 (L1), Berachain Ecosystem, Binance HODLer Airdrops, Outlier Ventures Portfolio, Polychain Capital Portfolio",berachain-bera,659686122,3057516299.0,69285.53293789935,70529.66123447022,0.06,85996180.0
KuCoin,"Smart Contract Platform, Layer 1 (L1)",kaia,647417934,647417955.0,45660.90963732953,47441.6891737832,0.09,14075995.0
KuCoin,"Decentralized Finance (DeFi), Solana Ecosystem, Liquid Staking Tokens, Liquid Staked SOL, Liquid Staking",msol,643512491,643516072.0,,,N/A,12216104.0
KuCoin,"Smart Contract Platform, Sports, NFT, Layer 1 (L1), Animoca Brands Portfolio, Alleged SEC Securities, Multicoin Capital Portfolio, Proof of Stake (PoS), Flow Ecosystem, Andreessen Horowitz (a16z) Portfolio",flow,633117295,633117295.0,17734.037095658347,20344.66281016785,0.32,24190339.0
KuCoin,"Stablecoins, Tokenized Assets, Tokenized Gold, Ethereum Ecosystem, Real World Assets (RWA), Tokenized Commodities",pax-gold,631855444,631855444.0,24808.144790526923,42932.442016938076,0.01,43239120.0
KuCoin,"Stablecoins, USD Stablecoin, BNB Chain Ecosystem, Arbitrum Ecosystem, Ethereum Ecosystem, Fiat-backed Stablecoin",usdx-money-usdx,625414125,625414125.0,,,N/A,205721.0
KuCoin,"BNB Chain Ecosystem, Arbitrum Ecosystem, Liquid Staking Tokens, Base Ecosystem, Restaking, Liquid Restaking Tokens, Blast Ecosystem, Mode Ecosystem, Liquid Staking",renzo-restaked-eth,606665839,606729700.0,,,N/A,2068468.0
KuCoin,"Gaming (GameFi), NFT, BNB Chain Ecosystem, Metaverse, Meme, Play To Earn, Ethereum Ecosystem, Telegram Apps, Dog-Themed, DWF Labs Portfolio, RPG, On-chain Gaming, TokenFi Launchpad, GMCI Meme Index, GMCI Index",floki,593965109,614545995.0,81737.68688062584,97541.92835751968,0.16,94888871.0
KuCoin,"Smart Contract Platform, Proof of Stake (PoS), Made in China",neo,566812364,803647191.0,24942.56136062559,34367.22540947488,0.15,20218116.0
KuCoin,"NFT, Ethereum Ecosystem, Decentralized Identifier (DID), Name Service",ethereum-name-service,558376888,1683603309.0,59126.20446028452,83091.08261746579,0.04,39214059.0
KuCoin,"Solana Ecosystem, Liquid Staking Tokens, Liquid Staked SOL, Liquid Staking",jupiter-staked-sol,550185586,550185586.0,,,N/A,5722923.0
KuCoin,"Business Services, Infrastructure, Decentralized Finance (DeFi), Oracle, Solana Ecosystem, Neon Ecosystem, Manta Network Ecosystem, Multicoin Capital Portfolio, GMCI DeFi Index, Delphi Ventures Portfolio, GMCI Index",pyth-network,542273656,1495931954.0,92779.12231680828,135343.0479650819,0.06,26098495.0
KuCoin,"Stablecoins, Ethereum Ecosystem",resolv-usr,532968491,532968491.0,,,N/A,4447101.0
KuCoin,"Decentralized Exchange (DEX), Exchange-based Tokens, Decentralized Finance (DeFi), Yield Farming, Automated Market Maker (AMM), Polygon Ecosystem, Fantom Ecosystem, Arbitrum Ecosystem, Ethereum Ecosystem, Optimism Ecosystem, Curve Ecosystem, DWF Labs Portfolio, Stablecoin Protocol, Energi Ecosystem, Sora Ecosystem, Binance Labs Portfolio, GMCI DeFi Index, GMCI Index, Coinbase 50 Index",curve-dao-token,530813786,914308290.0,58040.03072222246,100982.9666362461,0.1,97381860.0
KuCoin,"Stablecoins, Berachain Ecosystem",honey-3,526898070,526898070.0,,,N/A,12210894.0
KuCoin,"Artificial Intelligence (AI), Smart Contract Platform, Privacy, Masternodes, DePIN, DWF Labs Portfolio, Proof of Stake (PoS), Proof of Work (PoW)",beldex,526575599,756420073.0,590.0299939368181,220.42219697486354,0.66,3162597.0
KuCoin,"Communication, Internet of Things (IOT), Smart Contract Platform, Solana Ecosystem, DePIN, Multicoin Capital Portfolio, Proof of Stake (PoS), Alameda Research Portfolio, Pantera Capital Portfolio, Andreessen Horowitz (a16z) Portfolio, Made in USA, Coinbase 50 Index",helium,522775634,649671379.0,4828.386558290876,15087.314838178232,0.03,5623914.0
KuCoin,"Smart Contract Platform, Gaming (GameFi), NFT, Layer 1 (L1), Play To Earn, Zero Knowledge (ZK), FTX Holdings, Ronin Ecosystem, Gaming Blockchains, SideChain, Andreessen Horowitz (a16z) Portfolio, Binance Labs Portfolio",ronin,522166478,843033842.0,3698.320922042808,2563.6578232913266,0.12,10724123.0
KuCoin,"Entertainment, Gaming (GameFi), NFT, Metaverse, Polygon Ecosystem, Play To Earn, Ethereum Ecosystem, Animoca Brands Portfolio, Alleged SEC Securities, Simulation Games, Coinbase 50 Index",decentraland,515859073,605660451.0,42040.14352461053,79077.0524175682,0.13,47818951.0
KuCoin,"Smart Contract Platform, Privacy, Layer 1 (L1), Zero Knowledge (ZK), Proof of Work (PoW), Pantera Capital Portfolio, Made in USA, Coinbase 50 Index",zcash,514756770,514766099.0,13456.012826674518,182015.97689312484,0.13,24813225.0
KuCoin,"Gaming (GameFi), NFT, BNB Chain Ecosystem, Axie Infinity Ecosystem, Metaverse, Play To Earn, Harmony Ecosystem, Ethereum Ecosystem, Animoca Brands Portfolio, Alleged SEC Securities, Binance Launchpad, Ronin Ecosystem, Card Games, Breeding, Paradigm Portfolio, Gaming Governance Token, Gaming Utility Token, Andreessen Horowitz (a16z) Portfolio, Energi Ecosystem, Binance Labs Portfolio, Consensys Portfolio, Coinbase 50 Index",axie-infinity,513739003,869980774.0,17931.839333186846,48044.75763793284,0.09,24640716.0
KuCoin,"Decentralized Finance (DeFi), Wallets, Polygon Ecosystem, Ethereum Ecosystem, Payment Solutions, Base Ecosystem, Sora Ecosystem, Made in USA",telcoin,506353263,550984874.0,10779.731971486724,21667.338145571317,0.62,6178610.0
KuCoin,"Smart Contract Platform, Layer 1 (L1), Binance Launchpad, DWF Labs Portfolio, Osmosis Ecosystem, Binance Labs Portfolio, Made in USA",kava,504855976,504855976.0,60465.62990330061,78928.10719084846,0.21,27065130.0
KuCoin,"Solana Ecosystem, Meme, Dog-Themed, Solana Meme, GMCI Meme Index, GMCI Index",dogwifcoin,503159230,503159230.0,211155.33952938864,234835.79919027258,0.02,338728752.0
KuCoin,"Smart Contract Platform, Layer 1 (L1), MultiversX Ecosystem, Binance Launchpad, DWF Labs Portfolio, Proof of Stake (PoS), Binance Labs Portfolio, GMCI Layer 1 Index, GMCI Index, Coinbase 50 Index",elrond-erd-2,503822149,503822149.0,21403.13308848146,47742.65075836039,0.11,19545407.0
KuCoin,"Stablecoins, USD Stablecoin, BNB Chain Ecosystem, Avalanche Ecosystem, Ethereum Ecosystem, Tron Ecosystem, Andreessen Horowitz (a16z) Portfolio, Fiat-backed Stablecoin",true-usd,495025929,495025929.0,58244.25463366594,38088.96537779551,0.13,38920821.0
KuCoin,"Infrastructure, Smart Contract Platform, Ethereum Ecosystem, Layer 2 (L2), Zero Knowledge (ZK), Starknet Ecosystem, Paradigm Portfolio, Coinbase Ventures Portfolio, Rollup, Multicoin Capital Portfolio, Alameda Research Portfolio, Pantera Capital Portfolio, GMCI Layer 2 Index, Consensys Portfolio, Sequoia Capital Portfolio, GMCI Index, Polychain Capital Portfolio",starknet,488627374,1781032727.0,19018.988628643434,64613.43400476264,0.1,25522476.0
KuCoin,"Decentralized Exchange (DEX), Exchange-based Tokens, Decentralized Finance (DeFi), Yield Farming, Automated Market Maker (AMM), BNB Chain Ecosystem, Arbitrum Ecosystem, Ethereum Ecosystem, Aptos Ecosystem, ZkSync Ecosystem, Linea Ecosystem, Base Ecosystem, Polygon zkEVM Ecosystem, Binance Labs Portfolio, opBNB Ecosystem, GMCI DeFi Index, GMCI Index",pancakeswap-token,480244711,620900931.0,26858.24024577526,47558.11536419852,0.12,50542756.0
KuCoin,"BNB Chain Ecosystem, Ethereum Ecosystem, BTCfi",pumpbtc,478744084,478744075.0,,,N/A,8.26
KuCoin,"Decentralized Exchange (DEX), Smart Contract Platform, Decentralized Finance (DeFi), Cosmos Ecosystem, Perpetuals, Layer 1 (L1), Osmosis Ecosystem, Appchains, DragonFly Capital Portfolio, DeFiance Capital Portfolio, Andreessen Horowitz (a16z) Portfolio, GMCI DeFi Index, Delphi Ventures Portfolio, GMCI Index, Polychain Capital Portfolio, Made in USA",dydx-chain,469848295,469849514.0,41239.05064096312,64393.301065166976,0.13,19342817.0
KuCoin,"Decentralized Exchange (DEX), Decentralized Finance (DeFi), Yield Farming, Automated Market Maker (AMM), Solana Ecosystem, Launchpad, GMCI DeFi Index, GMCI Index",raydium,468439216,893881997.0,32747.2799370192,58153.09415797214,0.04,62648847.0
KuCoin,"Ethereum Ecosystem, Mantle Ecosystem, Restaking, Liquid Restaking Tokens, Liquid Restaked ETH",mantle-restaked-eth,443942363,443942363.0,,,N/A,6795518.0
KuCoin,"USD Stablecoin, Polygon Ecosystem, Bridged USDC, Fiat-backed Stablecoin, Bridged-Tokens, Bridged Stablecoins",bridged-usdc-polygon-pos-bridge,444095236,444060764.0,,,N/A,1081355.0
KuCoin,"Smart Contract Platform, BNB Chain Ecosystem, Layer 1 (L1), Ethereum Ecosystem, Base Ecosystem, Proof of Stake (PoS), Pantera Capital Portfolio, Made in USA",chain-2,437261162,642782601.0,34929.445583048866,68412.41010487887,0.07,64198237.0
KuCoin,"BNB Chain Ecosystem, Meme, Binance-Peg Tokens",binance-peg-dogecoin,436531262,436531262.0,,,N/A,916221.0
KuCoin,"Base Ecosystem, Bridged WETH, Bridged-Tokens",l2-standard-bridged-weth-base,437081242,437081242.0,,,N/A,377090573.0
KuCoin,"Artificial Intelligence (AI), Solana Ecosystem, Ethereum Ecosystem, Base Ecosystem, AI Agents, Virtuals Protocol Ecosystem, AI Agent Launchpad, Binance Alpha Spotlight",virtual-protocol,433423460,667317416.0,48346.24639729239,48785.32110005987,0.15,193759068.0
KuCoin,"Tokenized BTC, Avalanche Ecosystem, Bridged-Tokens",bitcoin-avalanche-bridged-btc-b,432204803,432236827.0,,,N/A,23780948.0
KuCoin,"Artificial Intelligence (AI), Smart Contract Platform, Storage, Layer 1 (L1), DePIN, Coinbase Ventures Portfolio, Multicoin Capital Portfolio, Andreessen Horowitz (a16z) Portfolio, Blockchain Capital Portfolio",arweave,427251324,427251324.0,22121.36106639438,78570.20117403228,0.11,51604007.0
KuCoin,"NFT, BNB Chain Ecosystem, Ethereum Ecosystem, Tron Ecosystem",apenft,426146714,430400976.0,18865.83949227868,7569.24598751173,0.69,37799946.0
KuCoin,"Arbitrum Ecosystem, Bridged WETH, Bridged-Tokens",arbitrum-bridged-weth-arbitrum-one,423780352,423639595.0,,,N/A,271331436.0
KuCoin,"Decentralized Exchange (DEX), Decentralized Finance (DeFi), Automated Market Maker (AMM), Base Ecosystem, Binance Alpha Spotlight, Made in USA",aerodrome-finance,422002561,816802595.0,17760.538601521614,34075.763340264704,0.19,23431013.0
KuCoin,"Arbitrum Ecosystem, Ethereum Ecosystem, Optimism Ecosystem, Base Ecosystem, BTCfi",clbtc,417383211,417383211.0,,,N/A,9.31
KuCoin,"Smart Contract Platform, Layer 1 (L1), Bitcoin Fork, Proof of Work (PoW)",ecash,417751430,417753733.0,7704.1614166038435,9182.029511300974,0.24,19512641.0
KuCoin,"Smart Contract Platform, DWF Labs Portfolio, Proof of Work (PoW), GMCI Layer 1 Index, Sequoia Capital Portfolio, GMCI Index, Made in China",conflux-token,418273505,466968696.0,32200.237796335787,53018.0399634311,0.12,57271078.0
KuCoin,"Gaming (GameFi), NFT, Polygon Ecosystem, Ethereum Ecosystem, Animoca Brands Portfolio, Gaming Blockchains, Gaming Governance Token, Gaming Utility Token, Andreessen Horowitz (a16z) Portfolio, ApeChain Ecosystem, Airdropped Tokens by NFT Projects, Coinbase 50 Index",apecoin,416919689,521504565.0,87634.75324749318,99195.94115941948,0.08,51133975.0
KuCoin,"Decentralized Exchange (DEX), Infrastructure, Smart Contract Platform, Exchange-based Tokens, Decentralized Finance (DeFi), Bridge Governance Tokens, Multicoin Capital Portfolio, Proof of Stake (PoS), Delphi Ventures Portfolio",thorchain,415405430,502757986.0,89777.41226220306,155256.40122656443,0.09,153980914.0
KuCoin,"Smart Contract Platform, Sports, NFT, Layer 1 (L1), Ethereum Ecosystem, Alleged SEC Securities, Chiliz Ecosystem, Binance Labs Portfolio, Coinbase 50 Index",chiliz,414884812,414888712.0,38206.61499366636,82248.68244956338,0.07,68407936.0
KuCoin,"Tokenized Assets, Solana Ecosystem, Polygon Ecosystem, Ethereum Ecosystem, Real World Assets (RWA), Tokenized Treasury Bonds (T-Bonds)",ousg,409212061,409212061.0,,,N/A,0.0
KuCoin,"Solana Ecosystem, Meme, Solana Meme, Binance HODLer Airdrops, Airdropped Tokens by NFT Projects, Made in USA",pudgy-penguins,407260648,497081756.0,71832.13271752324,85159.86670469862,0.31,126025126.0
KuCoin,"Artificial Intelligence (AI), Solana Ecosystem, DePIN, Polychain Capital Portfolio",grass,404990190,1470149174.0,62129.94176171591,73687.20166493928,0.2,104046302.0
KuCoin,"Stablecoins, USD Stablecoin, Blast Ecosystem, Crypto-backed Stablecoin, Fiat-backed Stablecoin",usdb,404401156,404401156.0,,,N/A,133082.0
KuCoin,"Smart Contract Platform, Layer 1 (L1), Bitcoin Sidechains, SideChain",coredaoorg,404683976,852545342.0,,,N/A,13619851.0
KuCoin,"Ethereum Ecosystem, Real World Assets (RWA)",hashnote-usyc,400450325,400450325.0,,,N/A,10.66
KuCoin,"Decentralized Finance (DeFi), BNB Chain Ecosystem, Liquid Staking Tokens, Sui Ecosystem, Liquid Staking",lorenzo-stbtc,389686261,389686261.0,,,N/A,14148.35
KuCoin,"Smart Contract Platform, BNB Chain Ecosystem, Polygon Ecosystem, Harmony Ecosystem, Moonriver Ecosystem, Moonbeam Ecosystem, Ethereum Ecosystem, Layer 2 (L2), Zero Knowledge (ZK), Animoca Brands Portfolio, Alleged SEC Securities, Binance Launchpad, FTX Holdings, Coinbase Ventures Portfolio, Rollup, Proof of Stake (PoS), Alameda Research Portfolio, DragonFly Capital Portfolio, Energi Ecosystem, Sora Ecosystem, Binance Labs Portfolio, GMCI Layer 2 Index, GMCI 30 Index, Galaxy Digital Portfolio, GMCI Index, Coinbase 50 Index",matic-network,384366347,2148591197.0,,,N/A,14170476.0
KuCoin,"Stablecoins, Solana Ecosystem, Arbitrum Ecosystem, Ethereum Ecosystem, Aptos Ecosystem, Sui Ecosystem, Mantle Ecosystem, Osmosis Ecosystem, Fiat-backed Stablecoin, Yield Tokenization Product",ondo-us-dollar-yield,385035263,593144245.0,,,N/A,728343.0
KuCoin,"Decentralized Finance (DeFi), Liquid Staking Tokens, Berachain Ecosystem, Liquid Staking",infrared-bera,371362982,371362982.0,,,N/A,55943.0
KuCoin,"Liquid Staking Tokens, Ethereum Ecosystem, Restaking, Liquid Restaking Tokens, Ether.fi Ecosystem, Liquid Staked ETH, Liquid Staking",ether-fi-staked-eth,368715916,4294761895.0,,,N/A,25082.0
KuCoin,"Decentralized Finance (DeFi), Yield Farming, BNB Chain Ecosystem, Lending/Borrowing Protocols, Avalanche Ecosystem, Polygon Ecosystem, Near Protocol Ecosystem, Harmony Ecosystem, Arbitrum Ecosystem, Ethereum Ecosystem, Base Ecosystem, Paradigm Portfolio, Index Coop Defi Index, Energi Ecosystem, Sora Ecosystem, Index Coop Index, Polychain Capital Portfolio, Made in USA",compound-governance-token,366984790,412473283.0,11908.776045216488,21914.5535391451,0.15,37516086.0
KuCoin,"BNB Chain Ecosystem, Wallets, Account Abstraction, Energi Ecosystem",trust-wallet-token,361049035,866552554.0,4503.550532618369,8054.136956678417,0.14,11872974.0
KuCoin,"Crypto-Backed Tokens, Decentralized Finance (DeFi), Rebase Tokens, Arbitrum Ecosystem, Ethereum Ecosystem, Berachain Ecosystem",olympus,358580684,459274380.0,,,N/A,327887.0
KuCoin,"Decentralized Finance (DeFi), Near Protocol Ecosystem, Ethereum Ecosystem, Payment Solutions, Alleged SEC Securities, Pantera Capital Portfolio, Energi Ecosystem, Made in USA",amp-token,354405010,419360096.0,1149.1360544932763,3196.9328178884475,0.14,31274786.0
KuCoin,"Stablecoins, Decentralized Finance (DeFi), USD Stablecoin, BNB Chain Ecosystem, Seigniorage, Avalanche Ecosystem, Polygon Ecosystem, Fantom Ecosystem, Harmony Ecosystem, Arbitrum Ecosystem, Moonriver Ecosystem, Moonbeam Ecosystem, Ethereum Ecosystem, Optimism Ecosystem, Stablecoin Protocol, Aurora Ecosystem, Polygon zkEVM Ecosystem, Evmos Ecosystem, Boba Network Ecosystem, Fiat-backed Stablecoin",frax,352800613,352800613.0,,,N/A,11003415.0
KuCoin,"Crypto-Backed Tokens, Decentralized Finance (DeFi), Tokenized BTC, Solana Ecosystem, Polygon Ecosystem, Arbitrum Ecosystem, Ethereum Ecosystem, Optimism Ecosystem, Base Ecosystem",tbtc,352450857,352450857.0,,,N/A,9777500.0
KuCoin,"Decentralized Finance (DeFi), Arbitrum Ecosystem, Liquid Staking Tokens, Ethereum Ecosystem, Optimism Ecosystem, Base Ecosystem",cgeth-hashkey-cloud,349431169,349431169.0,,,N/A,33.68
KuCoin,"Decentralized Exchange (DEX), Decentralized Finance (DeFi), Yield Farming, Automated Market Maker (AMM), BNB Chain Ecosystem, Derivatives, Lending/Borrowing Protocols, Arbitrum Ecosystem, Ethereum Ecosystem, Optimism Ecosystem, Fixed Interest, Real World Assets (RWA), LSDFi, Base Ecosystem, Restaking, LRTfi, Liquid Restaking Governance Tokens, Yield Tokenization Protocol, Binance Labs Portfolio, GMCI DeFi Index, Sonic Ecosystem, Liquid Staking, GMCI Index, BTCfi",pendle,347842729,555495592.0,33224.525061426415,45245.55354932098,0.1,44210053.0
KuCoin,"Infrastructure, BNB Chain Ecosystem, Avalanche Ecosystem, Polygon Ecosystem, Fantom Ecosystem, Arbitrum Ecosystem, Moonbeam Ecosystem, Ethereum Ecosystem, Optimism Ecosystem, Interoperability, Bridge Governance Tokens, Base Ecosystem, Osmosis Ecosystem, Cross-chain Communication, Secret Ecosystem, Galaxy Digital Portfolio, Polychain Capital Portfolio, Made in USA",axelar,344825284,441994579.0,7704.111644642305,8829.081199400314,0.19,12034454.0
KuCoin,"Artificial Intelligence (AI), Analytics, Base Ecosystem, Binance HODLer Airdrops",kaito,342520501,1418957196.0,110969.3381117974,106408.47824241528,0.09,147699333.0
KuCoin,"Artificial Intelligence (AI), Smart Contract Platform, DePIN, Osmosis Ecosystem, Proof of Stake (PoS), Archway Ecosystem, Made in USA",akash-network,340387738,341550301.0,68774.2655887932,80421.16893997794,0.02,26184676.0
KuCoin,"Decentralized Finance (DeFi), Liquid Staking Tokens, Ethereum Ecosystem, Liquid Staked ETH, Liquid Staking",stakewise-v3-oseth,341312695,341312695.0,,,N/A,295397.0
