KuCoin,"Decentralized Finance (DeFi), Binance Launchpool, Arbitrum Ecosystem, Ethereum Ecosystem, Restaking, Liquid Restaking Governance Tokens, Ether.fi Ecosystem, Consensys Portfolio, OKX Ventures Portfolio",ether-fi,160687406,693616047.0,98432.15983342663,127247.61200003298,0.14,57854871.0
KuCoin,"Decentralized Exchange (DEX), Exchange-based Tokens, Ethereum Ecosystem",coinex-token,160279158,160279231.0,,,N/A,122544.0
KuCoin,"Solana Ecosystem, DePIN, Multicoin Capital Portfolio, Made in USA",hivemapper,160248917,249241320.0,27444.641087512904,27050.26877416566,0.26,565079.0
KuCoin,"Decentralized Finance (DeFi), Tron Ecosystem",sun-token,157917332,319720703.0,42706.566059803925,50385.18810521245,0.06,33884504.0
KuCoin,"Decentralized Exchange (DEX), Exchange-based Tokens, Decentralized Finance (DeFi), Automated Market Maker (AMM), BNB Chain Ecosystem, Derivatives, Perpetuals, Centralized Exchange (CEX) Token, Solana Ecosystem, Avalanche Ecosystem, Polygon Ecosystem, Near Protocol Ecosystem, Fantom Ecosystem, Arbitrum Ecosystem, Ethereum Ecosystem, ZkSync Ecosystem, Mantle Ecosystem, Linea Ecosystem, Base Ecosystem, DragonFly Capital Portfolio, Binance Labs Portfolio",woo-network,157407891,187474462.0,43969.50188546599,67123.3882056988,0.11,12457549.0
KuCoin,"Oracle, Ethereum Ecosystem",redstone-oracles,156909333,560390474.0,30855.76200876971,40867.56993341245,0.23,91168720.0
KuCoin,"BNB Chain Ecosystem, Binance Alpha Spotlight",bnb48-club-token,154421418,154421418.0,,,N/A,222598.0
KuCoin,"Meme, Ethereum Ecosystem, Frog-Themed, AI Meme",turbo,154567011,154567011.0,32324.66835059763,62396.877524922194,0.09,40910106.0
KuCoin,"Smart Contract Platform, EthereumPoW Ecosystem, Proof of Work (PoW)",ethereum-pow-iou,154655235,154655235.0,633.1754042994627,2256.486809727279,0.4,10156815.0
KuCoin,"Decentralized Finance (DeFi), Derivatives, Perpetuals, Avalanche Ecosystem, Arbitrum Ecosystem",gmx,154195399,154197551.0,2361.36173191291,4752.608145166218,0.13,21784691.0
KuCoin,"Internet of Things (IOT), Oracle, NFT, Metaverse, Ethereum Ecosystem, DePIN, Alleged SEC Securities, Made in USA",xyo-network,154328949,154328949.0,29451.157280828716,23965.928740763105,0.02,12754020.0
KuCoin,"Stablecoins, Ethereum Ecosystem, Crypto-backed Stablecoin",elixir-staked-deusd,153162769,153156222.0,,,N/A,2068607.0
KuCoin,"Smart Contract Platform, Gaming (GameFi), Layer 1 (L1), Ethereum Ecosystem, Modular Blockchain, Account Abstraction, Multicoin Capital Portfolio, Gaming Blockchains, Gaming Utility Token, Skale Ecosystem, Consensys Portfolio, Galaxy Digital Portfolio, Made in USA",skale,153170269,161129898.0,16598.426987635135,26676.29046945588,0.08,16793323.0
KuCoin,"Smart Contract Platform, BNB Chain Ecosystem, Layer 1 (L1), Ethereum Ecosystem, ZetaChain Ecosystem, Cross-chain Communication, Made in USA",zetachain,152949680,439002471.0,91447.31017085272,100153.60950121764,0.05,10782680.0
KuCoin,"SocialFi, Arbitrum Ecosystem",uxlink,151507114,447980822.0,15392.047938640715,15522.369718598351,0.16,23583506.0
KuCoin,"Smart Contract Platform, Layer 1 (L1), Real World Assets (RWA), RWA Protocol",polymesh,150080326,150080326.0,17073.806398966153,17773.224798912524,0.15,2167180.0
KuCoin,"Payment Solutions, Made in USA, Directed Acyclic Graph (DAG)",nano,150006453,150006453.0,886.7289048135634,1062.9974064383246,0.42,7819600.0
KuCoin,"Gaming (GameFi), NFT, Solana Ecosystem, Animoca Brands Portfolio, FTX Holdings, Multicoin Capital Portfolio, Alameda Research Portfolio",metaplex,149937560,192132741.0,8667.400769517864,13138.751996313167,0.01,5679586.0
KuCoin,Smart Contract Platform,bitkub-coin,149239446,184764649.0,,,N/A,437438.0
KuCoin,BNB Chain Ecosystem,acet-token,149608613,195185359.0,,,N/A,935726.0
KuCoin,"Smart Contract Platform, Masternodes, Zero Knowledge (ZK), Proof of Work (PoW), Made in USA",zencash,148171626,148171626.0,28259.846110469534,33510.43518023134,0.11,16595393.0
KuCoin,"BNB Chain Ecosystem, Binance-Peg Tokens",binance-peg-sol,147408924,147408924.0,,,N/A,4252932.0
KuCoin,"NFT, Solana Ecosystem, NFT Marketplace, Paradigm Portfolio, Sequoia Capital Portfolio",magic-eden,145809810,1093227322.0,31859.933226392994,27909.1271345392,0.18,16760728.0
KuCoin,"Exchange-based Tokens, Decentralized Finance (DeFi), Ethereum Ecosystem, Real World Assets (RWA), Alleged SEC Securities",lcx,145996089,147394079.0,,,N/A,2023511.0
KuCoin,"Smart Contract Platform, Crypto-Backed Tokens, Wrapped-Tokens, Layer 2 (L2), Mantle Ecosystem",wrapped-ether-mantle-bridge,145046510,145046510.0,,,N/A,6164576.0
KuCoin,"Crypto-Backed Tokens, BNB Chain Ecosystem, Wrapped-Tokens, Ethereum Ecosystem",wrapped-beacon-eth,144879809,144879809.0,,,N/A,13289443.0
KuCoin,"Decentralized Exchange (DEX), Decentralized Finance (DeFi), Yield Farming, Automated Market Maker (AMM), BNB Chain Ecosystem, Seigniorage, Solana Ecosystem, Avalanche Ecosystem, Polygon Ecosystem, Fantom Ecosystem, Harmony Ecosystem, Arbitrum Ecosystem, Moonriver Ecosystem, Ethereum Ecosystem, Liquid Staking Governance Tokens, Curve Ecosystem, Stablecoin Protocol, Polygon zkEVM Ecosystem, Evmos Ecosystem, Fraxtal Ecosystem, GMCI DeFi Index, Liquid Staking, GMCI Index, Made in USA",frax-share,145315816,164172719.0,7659.719081959708,875.6358507075009,0.3,38425474.0
KuCoin,"Smart Contract Platform, DWF Labs Portfolio, Proof of Stake (PoS)",waves,143801814,143801814.0,7012.777928467438,11655.42636730661,0.17,13247972.0
KuCoin,"Smart Contract Platform, Layer 1 (L1), Proof of Stake (PoS), GMCI Layer 1 Index, GMCI Index, Made in USA",casper-network,143777168,148856366.0,5788.859832144025,17266.192303112646,0.09,4235477.0
KuCoin,"Gaming (GameFi), Play To Earn, Telegram Apps, TON Ecosystem, Tap to Earn, Arcade Games",hamster-kombat,141993282,220572089.0,16660.630893262714,40321.75024553663,0.09,26504933.0
KuCoin,"Internet of Things (IOT), Smart Contract Platform, Layer 1 (L1), Proof of Work (PoW), Made in USA",digibyte,142241307,142259255.0,11722.978249062955,13347.74314088856,0.11,5063249.0
KuCoin,"Decentralized Finance (DeFi), Derivatives, Prediction Markets, Solana Ecosystem",drift-protocol,142308967,493270807.0,59581.375837003194,59972.22321237082,0.08,43788785.0
KuCoin,"Stablecoins, Ethereum Ecosystem, XRP Ledger Ecosystem, Fiat-backed Stablecoin, Made in USA",ripple-usd,141558349,141558349.0,,,N/A,30700694.0
KuCoin,"Stablecoins, EUR Stablecoin, Solana Ecosystem, Avalanche Ecosystem, Ethereum Ecosystem, Base Ecosystem, Stellar Ecosystem",euro-coin,139685756,139685756.0,,,N/A,50910318.0
KuCoin,"Gaming (GameFi), NFT, BNB Chain Ecosystem, Solana Ecosystem, Polygon Ecosystem, Play To Earn, Move To Earn, Ethereum Ecosystem, Binance Launchpad, Gaming Governance Token, Sports Games, Alameda Research Portfolio, Binance Labs Portfolio, Sequoia Capital Portfolio",stepn,138317912,258732815.0,11998.614971584686,16281.752147001598,0.4,26586192.0
KuCoin,"Smart Contract Platform, Layer 1 (L1), Harmony Ecosystem, Animoca Brands Portfolio, Binance Launchpad, Binance Labs Portfolio, Made in USA",harmony,138618180,148200231.0,25202.312824520493,37806.263922006656,0.12,13352908.0
KuCoin,"Binance Launchpool, Solana Ecosystem, Ethereum Ecosystem, Decentralized Science (DeSci)",bio-protocol,138161758,282998786.0,109785.3712309101,120823.36785012786,0.16,15959501.0
KuCoin,"Alleged SEC Securities, Osmosis Ecosystem, DeFiance Capital Portfolio, Pantera Capital Portfolio, Binance Labs Portfolio, Delphi Ventures Portfolio, Galaxy Digital Portfolio, OKX Ventures Portfolio",terra-luna-2,137351378,215420333.0,24474.008448108623,39647.11822250208,0.15,19425155.0
KuCoin,"Tokenized Assets, Tokenized Gold, Real World Assets (RWA), Tokenized Commodities",kinesis-gold,137081560,137081560.0,,,N/A,151081320.0
KuCoin,"Smart Contract Platform, Layer 1 (L1), Kadena Ecosystem, Multicoin Capital Portfolio, Proof of Work (PoW), Made in USA",kadena,136780301,136906642.0,17881.341650661787,38519.3186179069,0.02,6144673.0
KuCoin,"Crypto-Backed Tokens, Wrapped-Tokens, Avalanche Ecosystem",wrapped-avax,136768625,136768625.0,,,N/A,14029098.0
KuCoin,"Solana Ecosystem, Meme, Solana Meme, Murad Picks",gigachad-2,133314187,133314187.0,8021.570460422791,10752.703066758819,0.29,13595479.0
KuCoin,"Gaming (GameFi), Polkadot Ecosystem, NFT, Ethereum Ecosystem, Gaming Blockchains, Andreessen Horowitz (a16z) Portfolio, Binance Labs Portfolio, Galaxy Digital Portfolio, Made in USA",mythos,135229624,174097436.0,,,N/A,4476329.0
KuCoin,"Decentralized Finance (DeFi), Analytics, DeFi Index, Base Ecosystem",mag7-ssi,134303836,134303836.0,,,N/A,1776796.0
KuCoin,"Stablecoins, EUR Stablecoin, Polygon Ecosystem, Ethereum Ecosystem, Real World Assets (RWA), Fiat-backed Stablecoin",stasis-eurs,134155323,134155323.0,,,N/A,237784.0
KuCoin,"Stablecoins, USD Stablecoin, Solana Ecosystem, Fiat-backed Stablecoin",global-dollar,133278972,133278972.0,,,N/A,1314220.0
KuCoin,"Smart Contract Platform, Masternodes, Proof of Stake (PoS), Made in China",ontology,132899491,145611705.0,2880.919040857988,9433.897027455185,0.16,5965861.0
KuCoin,"Smart Contract Platform, Base Ecosystem, Gaming Blockchains",b3,133058808,624904283.0,9858.642834195403,15384.785424968159,0.51,22680565.0
KuCoin,"BNB Chain Ecosystem, Arbitrum Ecosystem, Cardano Ecosystem, Ethereum Ecosystem, DePIN, Base Ecosystem, DWF Labs Portfolio",world-mobile-token,130746737,377784296.0,4368.157845427804,6728.626491944593,0.26,17277174.0
KuCoin,"Liquid Staking Tokens, Aptos Ecosystem, Liquid Staking",amnis-aptos,130457152,130484788.0,,,N/A,100387.0
KuCoin,"Tokenized Assets, Real World Assets (RWA), Tokenized Silver, Tokenized Commodities",kinesis-silver,130222289,130222289.0,,,N/A,2563653.0
KuCoin,"Decentralized Exchange (DEX), Smart Contract Platform, Exchange-based Tokens, Decentralized Finance (DeFi), Arbitrum Ecosystem, Ethereum Ecosystem, Layer 2 (L2), Zero Knowledge (ZK), Loopring Ecosystem, Rollup, Energi Ecosystem",loopring,130177589,143538324.0,16081.925019521275,28713.66670723763,0.29,13831344.0
KuCoin,"Cronos Ecosystem, Bridged USDC, Bridged-Tokens, Bridged Stablecoins",cronos-bridged-usdc-cronos,129113237,129113237.0,,,N/A,1781787.0
KuCoin,"Smart Contract Platform, SocialFi, NFT, BNB Chain Ecosystem, Binance Launchpool, Ethereum Ecosystem, Decentralized Identifier (DID), Zero Knowledge (ZK), DWF Labs Portfolio, Coinbase Ventures Portfolio, Multicoin Capital Portfolio, Alameda Research Portfolio, DragonFly Capital Portfolio, Binance Labs Portfolio, Quest-to-Earn",project-galaxy,127687899,199903824.0,,,N/A,55680.0
KuCoin,"BNB Chain Ecosystem, Harmony Ecosystem, Ethereum Ecosystem, Alameda Research Portfolio, Binance Labs Portfolio",swipe,126257417,126308196.0,7901.525991582742,16595.56287580791,0.15,5459518.0
KuCoin,"Smart Contract Platform, Proof of Stake (PoS), Sequoia Capital Portfolio",iostoken,125136341,125136341.0,10803.623823415624,9084.27145614083,0.25,89481540.0
KuCoin,"Smart Contract Platform, BNB Chain Ecosystem, Ethereum Ecosystem, Zero Knowledge (ZK), Animoca Brands Portfolio, Binance Labs Portfolio, OKX Ventures Portfolio",polyhedra-network,123124289,2039039061.0,31614.462363087358,41934.44934021713,0.29,7360347.0
KuCoin,"BNB Chain Ecosystem, Tron Ecosystem",global-commercial-business,122680397,122680397.0,,,N/A,193543.0
KuCoin,"Decentralized Finance (DeFi), Insurance, Ethereum Ecosystem",nxm,122677409,122677409.0,,,N/A,0.0
KuCoin,"Tokenized Assets, Polygon Ecosystem, Arbitrum Ecosystem, Ethereum Ecosystem, Real World Assets (RWA), Starknet Ecosystem, Tokenized Treasury Bills (T-Bills)",eutbl,122202114,122202114.0,,,N/A,0.0
KuCoin,"Polygon Ecosystem, Bridged DAI, Bridged-Tokens, Bridged Stablecoins",polygon-pos-bridged-dai-polygon-pos,122083244,122083244.0,,,N/A,3555905.0
KuCoin,"Artificial Intelligence (AI), Binance Launchpool, Solana Ecosystem, DePIN, Animoca Brands Portfolio, Multicoin Capital Portfolio, Delphi Ventures Portfolio, OKX Ventures Portfolio, Made in USA",io,122256398,663299227.0,70095.39767209475,82409.80205378222,0.17,27205835.0
KuCoin,"Decentralized Exchange (DEX), Decentralized Finance (DeFi), Gnosis Chain Ecosystem, MEV Protection, Arbitrum Ecosystem, Ethereum Ecosystem, Intent, Delphi Ventures Portfolio, Blockchain Capital Portfolio",cow-protocol,121484327,292993782.0,15960.982809475472,65602.08775567687,0.2,27472206.0
KuCoin,"Business Services, Decentralized Finance (DeFi), Oracle, Fantom Ecosystem, Ethereum Ecosystem, Binance Launchpad, Osmosis Ecosystem, Energi Ecosystem, Binance Labs Portfolio, Sequoia Capital Portfolio",band-protocol,120361210,122138543.0,1842.642343351986,4063.9495638963017,0.91,11017470.0
KuCoin,"Artificial Intelligence (AI), Smart Contract Platform, BNB Chain Ecosystem, Solana Ecosystem, Layer 1 (L1), Polygon Ecosystem, Ethereum Ecosystem, DWF Labs Portfolio, Injective Ecosystem, OKX Ventures Portfolio",zignaly,120004785,166382460.0,,,N/A,3335257.0
KuCoin,"Decentralized Exchange (DEX), Exchange-based Tokens, Decentralized Finance (DeFi), Yield Farming, Automated Market Maker (AMM), BNB Chain Ecosystem, Yearn Ecosystem, Solana Ecosystem, Avalanche Ecosystem, Polygon Ecosystem, Near Protocol Ecosystem, Fantom Ecosystem, Harmony Ecosystem, Arbitrum Ecosystem, Celo Ecosystem, Ethereum Ecosystem, Base Ecosystem, Alameda Research Portfolio, Pantera Capital Portfolio, Energi Ecosystem, Sora Ecosystem, Blockchain Capital Portfolio",sushi,119217661,173571984.0,14623.498752002828,22600.196931484905,0.11,44494592.0
KuCoin,"Arbitrum Ecosystem, Ethereum Ecosystem",reserve-protocol-eth-plus,118663557,118663557.0,,,N/A,1116541.0
KuCoin,"Exchange-based Tokens, BNB Chain Ecosystem, Centralized Exchange (CEX) Token",nkyc-token,117224064,117224064.0,,,N/A,242581.0
KuCoin,"Smart Contract Platform, Ethereum Ecosystem, Zero Knowledge (ZK), Alleged SEC Securities, Privacy Blockchain",coti,117071233,130637330.0,2780.0216477786826,2840.65936519882,0.15,14650299.0
KuCoin,"Decentralized Finance (DeFi), Ethereum Ecosystem, Real World Assets (RWA), Coinbase Ventures Portfolio, Stablecoin Protocol, Binance Labs Portfolio, Galaxy Digital Portfolio",usual,116362955,127854739.0,93191.55600924189,103356.95968382734,0.11,16270045.0
KuCoin,"Arbitrum Ecosystem, Ethereum Ecosystem, Account Abstraction, Coinbase Ventures Portfolio, Binance Labs Portfolio, Consensys Portfolio, Outlier Ventures Portfolio",biconomy,116466907,124442656.0,3479.6977902461344,26304.168700518054,0.24,15867440.0
KuCoin,"Smart Contract Platform, SocialFi, Layer 1 (L1), Gaming Blockchains",hive,116075115,,,,N/A,5727570.0
KuCoin,"Decentralized Finance (DeFi), Derivatives, Synthetic Issuer, Ethereum Ecosystem, Synthetic",stp-network,115591719,115591719.0,,,N/A,38024563.0
KuCoin,"Stablecoins, Ethereum Ecosystem, Base Ecosystem, Blast Ecosystem, Fiat-backed Stablecoin",anzen-usdz,115805957,115805957.0,,,N/A,238974.0
KuCoin,"Meme, PulseChain Ecosystem",the-grays-currency,104393575,104393503.0,,,N/A,834883.0
KuCoin,"Exchange-based Tokens, NFT, BNB Chain Ecosystem, Ethereum Ecosystem",swftcoin,114217156,114217156.0,4732.374000789319,4680.838778198416,0.81,3431898.0
KuCoin,"Solana Ecosystem, Polygon Ecosystem, Ethereum Ecosystem",m2-global-wealth-limited-mmx,114466766,367235449.0,,,N/A,115085.0
KuCoin,"BNB Chain Ecosystem, Ethereum Ecosystem, Payment Solutions, DWF Labs Portfolio",alchemy-pay,113664721,229918738.0,22520.87693340859,36944.62399264084,0.05,29876580.0
KuCoin,"Meme, Ethereum Ecosystem, Dog-Themed",neiro-3,113385825,113385825.0,,,N/A,83333336.0
KuCoin,"Smart Contract Platform, BNB Chain Ecosystem, Ethereum Ecosystem, Layer 2 (L2)",prometeus,112967235,119157221.0,4186.447559781976,22663.1951035433,0.16,3353047.0
KuCoin,"Smart Contract Platform, Layer 1 (L1), Zero Knowledge (ZK)",ozone-chain,111011040,153023705.0,,,N/A,218999.0
KuCoin,"Decentralized Finance (DeFi), Yield Farming, Lending/Borrowing Protocols, Ethereum Ecosystem, Real World Assets (RWA), Base Ecosystem, Binance Alpha Spotlight",syrup,113172646,181607769.0,34765.67322297132,41767.42679020043,0.2,9978290.0
KuCoin,"Business Services, Infrastructure, Smart Contract Platform, Decentralized Finance (DeFi), Polygon Ecosystem, Arbitrum Ecosystem, Ethereum Ecosystem, Liquid Staking Governance Tokens, Coinbase Ventures Portfolio, Proof of Stake (PoS), Index Coop Defi Index, Consensys Portfolio, Liquid Staking, Index Coop Index",rocket-pool,111226570,111226570.0,7595.111313074524,26786.08324852552,0.38,9622267.0
KuCoin,"Smart Contract Platform, BNB Chain Ecosystem, Layer 1 (L1), Ethereum Ecosystem, Decentralized Identifier (DID), Base Ecosystem, Gravity Alpha Ecosystem",g-token,111047825,184242939.0,10215.653104937233,13080.790428016864,0.26,20012044.0
KuCoin,"Big Data, Business Services, Infrastructure, Decentralized Finance (DeFi), Solana Ecosystem, FTX Holdings, DWF Labs Portfolio, Name Service",bonfida,110737509,111753147.0,3057.411851268737,16646.478492562263,0.18,12880126.0
KuCoin,"Arbitrum Ecosystem, Bridged USDC, Bridged-Tokens, Bridged Stablecoins",usd-coin-ethereum-bridged,110068637,110068637.0,,,N/A,36540551.0
KuCoin,"Artificial Intelligence (AI), Smart Contract Platform, Layer 1 (L1), Proof of Work (PoW)",qubic-network,109671294,131167519.0,,,N/A,2305923.0
KuCoin,"Smart Contract Platform, Cross-chain Communication, Pantera Capital Portfolio",icon,107928420,109162198.0,1277.2413318985466,2873.006882940454,0.1,2503584.0
KuCoin,"Tokenized Real Estate, Tokenized Assets, Gnosis Chain Ecosystem, RealT Tokens, Real World Assets (RWA), RWA Protocol",realtoken-ecosystem-governance,107491045,750637638.0,,,N/A,1555.08
KuCoin,"Music, NFT, Ethereum Ecosystem, Coinbase Ventures Portfolio, Multicoin Capital Portfolio, Pantera Capital Portfolio, Energi Ecosystem, Binance Labs Portfolio",audius,107625445,107625445.0,6338.823302630479,8021.342749627598,0.24,19570365.0
KuCoin,"Smart Contract Platform, BNB Chain Ecosystem, Ethereum Ecosystem, DWF Labs Portfolio, Made in USA",proton,107942733,119647405.0,9206.380410451082,5273.8224614744995,0.18,4113102.0
KuCoin,"Decentralized Finance (DeFi), Ethereum Ecosystem, Morpho Ecosystem",steakhouse-usdc-morpho-vault,106180769,106180769.0,,,N/A,0.0
KuCoin,"Solana Ecosystem, Multicoin Capital Portfolio, Stablecoin Protocol, Alameda Research Portfolio, DeFiance Capital Portfolio",uxd-protocol-token,105746763,105746763.0,,,N/A,34.69
KuCoin,"Lending/Borrowing Protocols, Ethereum Ecosystem, Paradigm Portfolio, Coinbase Ventures Portfolio",euler,105330604,153229935.0,7295.559087767552,7686.657569548384,0.2,7279349.0
KuCoin,"Smart Contract Platform, Decentralized Finance (DeFi), Binance Launchpool, Derivatives, Perpetuals, Ethereum Ecosystem, Layer 2 (L2), DragonFly Capital Portfolio, Pantera Capital Portfolio",aevo-exchange,105149022,116422692.0,9543.530319809954,16676.446312929587,0.85,19333787.0
KuCoin,"Decentralized Exchange (DEX), Decentralized Finance (DeFi), BNB Chain Ecosystem, Wallets, XRP Ledger Ecosystem",solo-coin,104912773,104912773.0,,,N/A,5307068.0
KuCoin,"Stablecoins, BNB Chain Ecosystem",astherus-usdf,104862368,104862836.0,,,N/A,699233.0
KuCoin,"Smart Contract Platform, Ethereum Ecosystem, Metis Ecosystem, Layer 2 (L2), DWF Labs Portfolio, Rollup, GMCI Layer 2 Index, OKX Ventures Portfolio, GMCI Index",metis-token,104840270,167601385.0,8579.914851970078,33237.258546675264,0.18,6878562.0
KuCoin,"Solana Ecosystem, Meme, Solana Meme, PolitiFi, Made in USA",melania-meme,104822338,698815011.0,32508.370885509063,27016.870165315413,0.14,24541962.0
KuCoin,"Gaming (GameFi), NFT, Metaverse, Play To Earn, Ethereum Ecosystem, Animoca Brands Portfolio, RPG, Gaming Governance Token, Adventure Games, Energi Ecosystem, Delphi Ventures Portfolio",illuvium,104340225,134477903.0,5576.396845200303,24526.55159110654,0.18,21483332.0
KuCoin,"Decentralized Finance (DeFi), BNB Chain Ecosystem, Real World Assets (RWA), DWF Labs Portfolio, Stellar Ecosystem",velo,103418590,335842807.0,49599.852705027275,43010.52741469998,0.35,24960951.0
KuCoin,"NFT, Meme, Arbitrum Ecosystem, Ethereum Ecosystem, Anime-Themed, Binance HODLer Airdrops, Airdropped Tokens by NFT Projects",anime,102835586,185670566.0,48240.22252069344,57166.039755139085,0.11,17622248.0
KuCoin,"Polygon Ecosystem, Arbitrum Ecosystem, Ethereum Ecosystem, Optimism Ecosystem, Bridge Governance Tokens, Cross-chain Communication, Intent, Boba Network Ecosystem, Blockchain Capital Portfolio, Made in USA",across-protocol,103307041,255738467.0,59882.32811164558,60445.414308301544,0.23,29257084.0
KuCoin,"Artificial Intelligence (AI), Base Ecosystem, AI Agents, AI Applications, Made in USA",venice-token,102373794,244034986.0,29000.768295460366,30136.500658976038,0.14,9305336.0
KuCoin,"NFT, Binance Launchpool, Meme, Ethereum Ecosystem, Binance Labs Portfolio, GMCI Meme Index, GMCI Index",memecoin-2,101039286,170308738.0,32685.690208472603,36451.89740790569,0.12,19236511.0
KuCoin,"NFT, BNB Chain Ecosystem, Ethereum Ecosystem, Binance Launchpad, DWF Labs Portfolio, Binance Labs Portfolio",space-id,100621361,466665466.0,23728.584571549487,36997.026647432904,0.09,25474436.0
KuCoin,"Artificial Intelligence (AI), Smart Contract Platform, Masternodes, DePIN, Proof of Work (PoW), Made in USA",zelcash,100752776,100779979.0,11875.91698022237,31782.73642429905,0.11,9191691.0
KuCoin,"Big Data, Infrastructure, Storage, Cardano Ecosystem, DePIN",iagon,100549816,267405191.0,,,N/A,550028.0
KuCoin,"Business Services, Decentralized Finance (DeFi), Oracle, Derivatives, Synthetic Issuer, Avalanche Ecosystem, Ethereum Ecosystem, Blockchain Capital Portfolio, Synthetic, Made in USA",uma,100339540,144793692.0,10922.40029679694,21918.634060735327,0.26,9657611.0
KuCoin,"Stablecoins, LP Tokens, Ethereum Ecosystem",resolv-rlp,100038118,100038118.0,,,N/A,670756.0
KuCoin,"Bridged USDT, QL1 Ecosystem, Bridged-Tokens, Bridged Stablecoins",qusdt,99945954,99945954.0,,,N/A,27075.0
KuCoin,"Decentralized Exchange (DEX), Decentralized Finance (DeFi), Automated Market Maker (AMM), Ethereum Ecosystem, Cronos Ecosystem",vvs-finance,98913757,193384278.0,,,N/A,245680.0
KuCoin,"Infrastructure, Solana Ecosystem, Animoca Brands Portfolio, Cross-chain Communication, OKX Ventures Portfolio",zeus-network,99521526,259997212.0,30786.831872817864,32524.77687471844,0.23,12938368.0
KuCoin,"Solana Ecosystem, Meme, Base Ecosystem, AI Meme, AI Agents, Virtuals Protocol Ecosystem, Binance Alpha Spotlight, DeFAI",aixbt,98939479,115635819.0,62653.732036869515,83867.9564551087,0.09,66970254.0
KuCoin,"Solana Ecosystem, Liquid Staking Tokens, Liquid Staked SOL, Liquid Staking",drift-staked-sol,98687402,98687402.0,,,N/A,28493.0
KuCoin,"Solana Ecosystem, Meme, Frog-Themed, Solana Meme, GMCI Meme Index, GMCI Index",book-of-meme,97281297,97281297.0,68266.22494800357,92502.90500402595,0.07,49354231.0
KuCoin,"Crypto-Backed Tokens, Decentralized Finance (DeFi), Compound Tokens, cToken, Ethereum Ecosystem",compound-ether,97200546,97200546.0,,,N/A,54.03
KuCoin,"Smart Contract Platform, Polkadot Ecosystem, Binance Launchpool, Layer 2 (L2), Manta Network Ecosystem, Multicoin Capital Portfolio, Alameda Research Portfolio, DeFiance Capital Portfolio, Binance Labs Portfolio",manta-network,97538920,256485603.0,5182.325433969152,10709.914462116338,0.16,33063455.0
KuCoin,"Infrastructure, Smart Contract Platform, Oracle, Layer 1 (L1), Animoca Brands Portfolio, Coinbase Ventures Portfolio, Cross-chain Communication, Made in USA",supra,96860708,861233440.0,22080.838062227194,29212.424763710216,0.55,15441028.0
KuCoin,"Decentralized Finance (DeFi), Yield Farming, Avalanche Ecosystem, Fantom Ecosystem, Arbitrum Ecosystem, Olympus Pro Ecosystem, Ethereum Ecosystem, Stablecoin Protocol",spell-token,96899747,119773524.0,,,N/A,14878529.0
KuCoin,"Smart Contract Platform, Ethereum Ecosystem, Layer 2 (L2), Optimism Superchain Ecosystem, Outlier Ventures Portfolio, Lisk Ecosystem",lisk,96957674,225038421.0,2465.8681648963234,17759.459282856373,0.14,12487883.0
KuCoin,"Software as a service, Ethereum Ecosystem, Energi Ecosystem",status,96045687,165024897.0,,,N/A,8066083.0
KuCoin,"Infrastructure, Smart Contract Platform, Ethereum Ecosystem, Data Availability, Modular Blockchain",avail,95775903,490529976.0,73025.11129034817,62110.708826980444,0.17,5811760.0
KuCoin,"Artificial Intelligence (AI), Infrastructure, Smart Contract Platform, Oracle, Polkadot Ecosystem, Ethereum Ecosystem, Interoperability, Layer 2 (L2), Zero Knowledge (ZK), DePIN, DWF Labs Portfolio, Rollup, AI Agents, Sora Ecosystem, AI Framework, Made in USA",pha,96207094,122647370.0,13270.820691622019,13307.516825882174,0.16,24494281.0
KuCoin,"XDC Ecosystem, Telos Ecosystem",ecoin-2,95498064,207099463.0,,,N/A,5.24
KuCoin,"Smart Contract Platform, BNB Chain Ecosystem, Binance Launchpool, Ethereum Ecosystem, Layer 2 (L2), Restaking, Rollups-as-a-Service (RaaS), Rollup, Binance Labs Portfolio",altlayer,95531945,342161425.0,14662.18269999913,16005.460525849961,0.23,16003743.0
KuCoin,"Smart Contract Platform, Layer 1 (L1), Zero Knowledge (ZK), Andreessen Horowitz (a16z) Portfolio, Privacy Blockchain, Made in USA",aleo,95674932,468790175.0,,,N/A,7082221.0
KuCoin,"NFT, Polygon Ecosystem, Ethereum Ecosystem, Optimism Ecosystem",blockv,94530677,94530677.0,,,N/A,155553.0
KuCoin,"Fraxtal Ecosystem, Bridged-Tokens",l2-standard-bridged-frxusd,94629969,94629969.0,,,N/A,937374.0
KuCoin,"Solana Ecosystem, Payment Solutions, Viction Ecosystem",saros-finance,94102529,358485850.0,1445.6269396502078,1329.9490027114125,0.33,724921.0
KuCoin,"Gaming (GameFi), NFT, BNB Chain Ecosystem",infinitar-governance-token,93887047,464973805.0,,,N/A,8433512.0
KuCoin,"Solana Ecosystem, Liquid Staking Tokens, Restaking, Liquid Restaking Tokens, Liquid Staked SOL, Liquid Staking, Liquid Restaked SOL",solayer-staked-sol,94070478,94070478.0,,,N/A,561592.0
KuCoin,"Gaming (GameFi), NFT, Kaia Ecosystem, Gaming Blockchains",bora,93643358,97948800.0,,,N/A,226340.0
KuCoin,"Smart Contract Platform, Privacy, Layer 1 (L1), Proof of Stake (PoS), Proof of Work (PoW), Zano Ecosystem, Privacy Blockchain",zano,94625287,94630540.0,,,N/A,618415.0
