KuCoin,"Artificial Intelligence (AI), Infrastructure, Smart Contract Platform, Decentralized Finance (DeFi), Arbitrum Ecosystem, Ethereum Ecosystem, Zero Knowledge (ZK), DWF Labs Portfolio, Coinbase Ventures Portfolio, Pantera Capital Portfolio, Binance Labs Portfolio",marlin,92138361,113004597.0,6267.837289656966,11382.415114098803,0.34,5723647.0
KuCoin,"Energy, Ethereum Ecosystem, Alleged SEC Securities, Energi Ecosystem, GMCI DePIN Index, Blockchain Capital Portfolio, GMCI Index",power-ledger,90792222,171298435.0,,,N/A,7597863.0
KuCoin,"Decentralized Exchange (DEX), Exchange-based Tokens, Decentralized Finance (DeFi), Yield Farming, Automated Market Maker (AMM), Avalanche Ecosystem, Polygon Ecosystem, Near Protocol Ecosystem, Gnosis Chain Ecosystem, Harmony Ecosystem, Arbitrum Ecosystem, Ethereum Ecosystem, Optimism Ecosystem, Base Ecosystem, Index Coop Defi Index, Alameda Research Portfolio, DeFiance Capital Portfolio, Pantera Capital Portfolio, Energi Ecosystem, Polygon zkEVM Ecosystem, Huobi ECO Chain Ecosystem, Blockchain Capital Portfolio, Index Coop Index",balancer,90825539,98215685.0,10030.202467822457,9886.92531396301,0.28,6696752.0
KuCoin,"Gaming (GameFi), XDC Ecosystem, Gaming Utility Token",gama-coin,89797225,138149652.0,,,N/A,2284744.0
KuCoin,"Infrastructure, Smart Contract Platform, Decentralized Finance (DeFi), BNB Chain Ecosystem, Avalanche Ecosystem, Polygon Ecosystem, Fantom Ecosystem, Harmony Ecosystem, Arbitrum Ecosystem, Ethereum Ecosystem, DWF Labs Portfolio, Layer 3 (L3), Outlier Ventures Portfolio",orbs,89614047,196800962.0,11680.975969868152,10865.128849788258,0.1,3078480.0
KuCoin,"SocialFi, Coinbase Ventures Portfolio, Pantera Capital Portfolio, Andreessen Horowitz (a16z) Portfolio, Sequoia Capital Portfolio",deso,87454025,89747759.0,,,N/A,2139705.0
KuCoin,"Artificial Intelligence (AI), Virtual Reality, Launchpad, Ethereum Ecosystem, Telegram Apps, Discord Bots, PAAL AI Launchpad, AI Agents, AI Applications, AI Agent Launchpad, Binance Alpha Spotlight, AI Framework, DeFAI, Made in USA",paal-ai,88446992,99489017.0,3364.6155176176844,9605.941249101468,0.3,6916953.0
KuCoin,"Smart Contract Platform, Ethereum Ecosystem, Layer 2 (L2), Zero Knowledge (ZK), Restaking, Zircuit Ecosystem",zircuit,88212354,401892620.0,41202.400938485276,42463.244726329955,0.02,13154271.0
KuCoin,"Cronos Ecosystem, Bridged USDT, Bridged-Tokens, Bridged Stablecoins",cronos-bridged-usdt-cronos,87675445,87675445.0,,,N/A,297815.0
KuCoin,"Smart Contract Platform, Layer 1 (L1)",ong,87574803,214674081.0,,,N/A,1838247.0
KuCoin,"Artificial Intelligence (AI), Smart Contract Platform, Gaming (GameFi), NFT, BNB Chain Ecosystem, Layer 1 (L1), Ethereum Ecosystem, Modular Blockchain, Chromia Ecosystem",chromaway,86939264,86939264.0,11221.748017374666,12264.855837196397,0.19,10035479.0
KuCoin,"Smart Contract Platform, Bitcoin Sidechains, Stacks Ecosystem, SideChain",sbtc-2,86992927,86992927.0,,,N/A,9762.96
KuCoin,"Smart Contract Platform, Polkadot Ecosystem, Layer 1 (L1), Coinbase Ventures Portfolio, Binance Labs Portfolio",moonbeam,86815155,105719631.0,6532.0458186795495,23501.234320916607,0.11,4804853.0
KuCoin,BNB Chain Ecosystem,metfi-2,86920996,203437648.0,,,N/A,474870.0
KuCoin,"Gaming (GameFi), Play To Earn, Ethereum Ecosystem, RPG, Alameda Research Portfolio, Circle Ventures Portfolio, OKX Ventures Portfolio, MMO",big-time,86481625,242640411.0,31583.24949042172,32195.74056605452,0.04,14150024.0
KuCoin,"Stablecoins, USD Stablecoin, Ethereum Ecosystem, Sonic Ecosystem, Fiat-backed Stablecoin",frax-usd,86145963,86145963.0,,,N/A,1643033.0
KuCoin,"Decentralized Exchange (DEX), Decentralized Finance (DeFi), Arbitrum Ecosystem, Ethereum Ecosystem",tokenlon,86010860,103528364.0,,,N/A,27520.0
KuCoin,"Crypto-Backed Tokens, Ethereum Ecosystem",temple,85880106,86049294.0,,,N/A,4833.61
KuCoin,"Business Services, Polygon Ecosystem, Ethereum Ecosystem",request-network,85799747,111476774.0,12288.571050560102,14364.50681087012,0.13,3364320.0
KuCoin,"Smart Contract Platform, Layer 1 (L1), Zero Knowledge (ZK)",ozone-chain,85770722,118231067.0,,,N/A,242906.0
KuCoin,"Smart Contract Platform, Layer 2 (L2), eGirl Capital Portfolio, Paradigm Portfolio, Blast Ecosystem",blast,85571497,322762895.0,11417.502481510997,15642.98669908285,0.25,5274565.0
KuCoin,"Smart Contract Platform, Gaming (GameFi), NFT, Layer 1 (L1), Play To Earn, Ethereum Ecosystem, Animoca Brands Portfolio, Gaming Blockchains, Pantera Capital Portfolio, OKX Ventures Portfolio",wax,85259023,91736086.0,4373.756288891712,6605.174415705522,0.16,4892279.0
KuCoin,"Smart Contract Platform, Privacy, Proof of Work (PoW), Made in USA",verge,85172520,85342890.0,,,N/A,9220540.0
KuCoin,"Exchange-based Tokens, Centralized Exchange (CEX) Token, Ethereum Ecosystem",hashkey-ecopoints,84752792,639643713.0,58328.563839213864,55774.79719392686,0.34,2111545.0
KuCoin,"NFT, Solana Ecosystem, NFT Marketplace",tensor,84365054,252131586.0,32606.171503166865,65296.67474208932,0.2,14017145.0
KuCoin,"Polygon Ecosystem, XRP Ledger Ecosystem",crypto-trading-fund,83940543,83940543.0,,,N/A,8275.45
KuCoin,"Meme, Ethereum Ecosystem, PolitiFi",constitutiondao,83287879,83287879.0,41246.672029541245,53166.25362450422,0.06,18192654.0
KuCoin,Ethereum Ecosystem,dkargo,83925214,89536146.0,,,N/A,956012.0
KuCoin,"Gaming (GameFi), NFT, BNB Chain Ecosystem, Metaverse, Collectibles, Polygon Ecosystem, Play To Earn, Harmony Ecosystem, Guild and Scholarship, Ethereum Ecosystem, Animoca Brands Portfolio, Base Ecosystem, DWF Labs Portfolio, Ronin Ecosystem, Gaming Governance Token, Andreessen Horowitz (a16z) Portfolio, Delphi Ventures Portfolio",yield-guild-games,83011699,202214324.0,18144.682489117396,22980.40226179381,0.05,12000051.0
KuCoin,"NFT, Polygon Ecosystem",sathosi-airlines-token,82776700,395331303.0,,,N/A,4109.9
KuCoin,"Decentralized Exchange (DEX), Decentralized Finance (DeFi), Yield Farming, Automated Market Maker (AMM), Solana Ecosystem, Coinbase Ventures Portfolio, DeFiance Capital Portfolio, Made in USA",orca,82951427,155699666.0,37028.04361015855,41764.095759540236,0.06,16818188.0
KuCoin,"Solana Ecosystem, Polygon Ecosystem, DePIN, Pantera Capital Portfolio",geodnet,82971262,258801373.0,,,N/A,268951.0
KuCoin,"Artificial Intelligence (AI), Infrastructure, Ethereum Ecosystem, AI Framework, Made in USA",arcblock,82187040,155069887.0,,,N/A,830923.0
KuCoin,"Internet of Things (IOT), BNB Chain Ecosystem, Ethereum Ecosystem, DePIN, DWF Labs Portfolio",mass-vehicle-ledger,81981861,86657107.0,,,N/A,611623.0
KuCoin,"Artificial Intelligence (AI), BNB Chain Ecosystem, Ethereum Ecosystem, DragonFly Capital Portfolio, Binance Labs Portfolio, Delphi Ventures Portfolio, OKX Ventures Portfolio, Binance HODLer Airdrops, AI Agent Launchpad, Binance Alpha Spotlight, AI Framework",myshell,82090214,304037829.0,14661.512548857067,39799.64576688607,0.09,74576768.0
KuCoin,"Smart Contract Platform, Cosmos Ecosystem, Modular Blockchain, Osmosis Ecosystem, Rollups-as-a-Service (RaaS)",dymension,81520185,323402124.0,15190.267031451462,16561.463281428893,0.31,8265556.0
KuCoin,"Decentralized Finance (DeFi), BNB Chain Ecosystem, Arbitrum Ecosystem, Ethereum Ecosystem, Multicoin Capital Portfolio, Energi Ecosystem",dforce-token,81339808,81339808.0,,,N/A,9259649.0
KuCoin,BNB Chain Ecosystem,bitdca,81470739,87506059.0,,,N/A,22481.0
KuCoin,"NFT, Ethereum Ecosystem",superrare,81362264,101655697.0,,,N/A,125233694.0
KuCoin,"Gaming (GameFi), Play To Earn, Guild and Scholarship, Ethereum Ecosystem, Animoca Brands Portfolio, Base Ecosystem, DWF Labs Portfolio, Ronin Ecosystem, Coinbase Ventures Portfolio, DeFiance Capital Portfolio, Pantera Capital Portfolio, Binance Labs Portfolio, MMO",zentry,81009776,118926138.0,,,N/A,6238840.0
KuCoin,"Berachain Ecosystem, Bridged USDT, Bridged-Tokens, Ink Ecosystem, Bridged Stablecoins",usdt0,80842811,80842811.0,,,N/A,215157.0
KuCoin,"Blast Ecosystem, Bridged WETH, Bridged-Tokens",l2-standard-bridged-weth-blast,80081836,80081836.0,,,N/A,594904.0
KuCoin,"Smart Contract Platform, Proof of Stake (PoS)",stratis,79597151,87700670.0,2908.862551414787,2747.729138265701,1.08,1133298.0
KuCoin,"Artificial Intelligence (AI), BNB Chain Ecosystem, Solana Ecosystem, Ethereum Ecosystem, AI Agents, Alameda Research Portfolio",delysium,79765761,152142097.0,8051.383015360615,2592.9759529812272,0.16,2130112.0
KuCoin,"Software as a service, Polygon Ecosystem, Ethereum Ecosystem, Decentralized Identifier (DID), Pantera Capital Portfolio, Energi Ecosystem, Blockchain Capital Portfolio",civic,79564185,99207212.0,6591.790002567761,6884.4874544961085,0.4,7375850.0
KuCoin,"Stablecoins, USD Stablecoin, Solana Ecosystem, Ethereum Ecosystem, Multicoin Capital Portfolio, Fiat-backed Stablecoin",paxos-standard,79271161,79271161.0,4805.292477227993,173.91449355810082,0.63,1783162.0
KuCoin,"Artificial Intelligence (AI), Smart Contract Platform, Layer 1 (L1), Ethereum Ecosystem, Osmosis Ecosystem, AI Agents, AI Agent Launchpad",humans-ai,78874870,78874870.0,1618.7884796242943,1631.673941257342,0.56,678083.0
KuCoin,"Stablecoins, Decentralized Finance (DeFi), Lending/Borrowing Protocols, Ethereum Ecosystem",syrupusdc,79174367,79174367.0,,,N/A,158986.0
KuCoin,"Artificial Intelligence (AI), Smart Contract Platform, Decentralized Finance (DeFi), Analytics, NFT, BNB Chain Ecosystem, Launchpad, Ethereum Ecosystem, Telegram Apps, Discord Bots, ChainGPT Launchpad, Poolz Finance Launchpad, AI Agents, AI Applications, Binance Alpha Spotlight, AI Framework, DeFAI",chaingpt,79001410,98083523.0,9739.967296652663,15538.044674860676,0.15,22342593.0
KuCoin,"NFT, BNB Chain Ecosystem, Solana Ecosystem, Meme, Ethereum Ecosystem, Base Ecosystem, Hybrid Token Standards, Wojak-Themed",non-playable-coin,78887634,78887634.0,4116.270732486912,32791.2579674645,0.81,5595172.0
KuCoin,"Ethereum Ecosystem, Stablecoin Protocol",level-usd,78691889,78691889.0,,,N/A,1039250.0
KuCoin,"Business Services, Decentralized Finance (DeFi), Oracle, Polygon Ecosystem, Gnosis Chain Ecosystem, Arbitrum Ecosystem, Ethereum Ecosystem, Optimism Ecosystem, Manta Network Ecosystem, Binance Labs Portfolio, Lisk Ecosystem, Made in USA",tellor,78330801,80610007.0,11316.358171956621,33718.29491219445,0.1,23052404.0
KuCoin,"BNB Chain Ecosystem, Liquid Staking Tokens",astherus-staked-bnb,80374023,80374023.0,,,N/A,985.88
KuCoin,"Decentralized Finance (DeFi), Wallets, Ethereum Ecosystem, Pundi AIFX Omnilayer Ecosystem",pundi-x-2,77999038,77999038.0,3858.5511930491425,4830.910784017907,0.23,5640810.0
KuCoin,"Exchange-based Tokens, Centralized Exchange (CEX) Token, Ethereum Ecosystem",bitmart-token,77779746,146527821.0,1400.6879009891504,2643.536832582766,0.13,4223531.0
KuCoin,"Smart Contract Platform, Layer 1 (L1), Osmosis Ecosystem, XRP Ledger Ecosystem",coreum,77072636,77072636.0,,,N/A,107495.0
KuCoin,"Decentralized Finance (DeFi), Solana Ecosystem, Real World Assets (RWA), Payment Solutions, DePIN, Coinbase Ventures Portfolio, Alameda Research Portfolio, Circle Ventures Portfolio, OKX Ventures Portfolio, RWA Protocol, Made in USA",zebec-network,77300586,104320867.0,6813.742025066363,16713.42066046056,0.26,36244529.0
KuCoin,"Smart Contract Platform, Polkadot Ecosystem, Layer 1 (L1), DePIN, Outlier Ventures Portfolio",peaq-2,81071727,476400801.0,30693.493444341497,58827.4451263983,0.09,9167461.0
KuCoin,"Optimism Ecosystem, Bridged WBTC, Bridged-Tokens",optimism-bridged-wbtc-optimism,77117851,77117851.0,,,N/A,1033237.0
KuCoin,"Meme, Dog-Themed, TON Ecosystem, TON Meme",dogs-2,76261383,81168380.0,30187.485476513793,38382.61971810018,0.07,38223655.0
KuCoin,"Stablecoins, USD Stablecoin, Osmosis Ecosystem, Fiat-backed Stablecoin",usdx,76381469,76381469.0,,,N/A,12218.15
KuCoin,"Stablecoins, USD Stablecoin, Seigniorage, Alleged SEC Securities, Osmosis Ecosystem, Stablecoin Protocol, DeFiance Capital Portfolio, Terra Classic Ecosystem, Binance Labs Portfolio, Delphi Ventures Portfolio, Galaxy Digital Portfolio, Fiat-backed Stablecoin",terrausd,76206997,107967416.0,10115.984439626438,17089.761360673296,0.14,20555626.0
KuCoin,"Decentralized Finance (DeFi), Liquid Staking Tokens, Ethereum Ecosystem, LSDFi, Liquid Staked ETH, Liquid Staking",origin-ether,76101663,76101663.0,,,N/A,34167.0
KuCoin,Smart Contract Platform,songbird,76226356,90573570.0,,,N/A,392712.0
KuCoin,"Entertainment, Gaming (GameFi), NFT, Axie Infinity Ecosystem, Play To Earn, Ethereum Ecosystem, Ronin Ecosystem, Gaming Utility Token",smooth-love-potion,75992496,75992296.0,2825.639302958672,6503.825510572012,0.05,8850152.0
KuCoin,"Decentralized Exchange (DEX), Decentralized Finance (DeFi), Yield Farming, Automated Market Maker (AMM), BNB Chain Ecosystem, Avalanche Ecosystem, Arbitrum Ecosystem, Mantle Ecosystem, DeFiance Capital Portfolio, Delphi Ventures Portfolio, Dex Aggregator",joe,75566426,96771741.0,,,N/A,6169144.0
KuCoin,"Exchange-based Tokens, Centralized Exchange (CEX) Token, Near Protocol Ecosystem, Harmony Ecosystem, Ethereum Ecosystem, Multicoin Capital Portfolio, Alameda Research Portfolio, Elastos Smart Contract Chain Ecosystem, Sequoia Capital Portfolio, Made in China",huobi-token,75643799,95405307.0,,,N/A,22078.0
KuCoin,"BNB Chain Ecosystem, Solana Ecosystem, Polygon Ecosystem, Meme, Ethereum Ecosystem, Cronos Ecosystem, Dog-Themed, Elon Musk-Inspired, Fuse Ecosystem",dogelon-mars,75864688,138023636.0,13487.902808198007,8969.365561218936,0.51,2642019.0
KuCoin,"Decentralized Finance (DeFi), Lending/Borrowing Protocols, Moonbeam Ecosystem, Base Ecosystem, Coinbase Ventures Portfolio, Made in USA",moonwell-artemis,74938256,114249558.0,4439.753508383877,6713.782329713463,0.04,6464216.0
KuCoin,"Sports, BNB Chain Ecosystem",pixer-eternity,74997549,348520727.0,,,N/A,725991.0
KuCoin,"Smart Contract Platform, Gaming (GameFi), Layer 1 (L1), Proof of Stake (PoS), Gaming Blockchains",oasys,75049303,194266988.0,990.1769453457122,696.0584352346523,1.34,487421.0
KuCoin,"Arbitrum Ecosystem, Bridge Governance Tokens, Base Ecosystem, Cross-chain Communication, OKX Ventures Portfolio",orbiter-finance,74096485,239020920.0,9645.74941602673,10411.384199653605,0.16,58824496.0
KuCoin,"Smart Contract Platform, Wallets, Layer 2 (L2), Osmosis Ecosystem",islamic-coin,74963989,904290417.0,308.2511092212397,226.32655952122815,0.53,501548.0
KuCoin,"Gaming (GameFi), NFT, Ethereum Ecosystem",undeads-games,73943950,257237288.0,,,N/A,436912.0
KuCoin,"Artificial Intelligence (AI), Decentralized Finance (DeFi), Ethereum Ecosystem, DePIN",pinlink,72836082,91045103.0,,,N/A,1628999.0
KuCoin,"Base Ecosystem, Cybersecurity, Binance Labs Portfolio, OKX Ventures Portfolio, Binance Alpha Spotlight",goplus-security,73942564,407756501.0,20528.495144370692,30347.18985680554,0.12,67277558.0
KuCoin,"Decentralized Finance (DeFi), Oracle, Ethereum Ecosystem, DWF Labs Portfolio, Pantera Capital Portfolio",api3,73345871,91532446.0,10752.050997255175,16815.612927451068,0.15,13461959.0
KuCoin,"Meme, Ethereum Ecosystem, Mantle Ecosystem",puff-the-dragon,73017878,73017878.0,,,N/A,31429.0
KuCoin,Retail,milk-alliance,73458644,164244568.0,133.7856271399922,750.6464216128727,0.52,2086427.0
KuCoin,"Optimism Ecosystem, Bridged WETH, Bridged-Tokens",l2-standard-bridged-weth-optimism,73296739,73296739.0,,,N/A,5267031.0
KuCoin,"Ethereum Ecosystem, DePIN",dent,73434896,76770609.0,5935.567337767651,9229.219189257132,0.35,4951716.0
KuCoin,"Gaming (GameFi), Play To Earn, TON Ecosystem, Tap to Earn, Arcade Games",watcoin-2,72864901,80893166.0,,,N/A,793031.0
KuCoin,"Smart Contract Platform, Gaming (GameFi), NFT, Binance Launchpool, Arbitrum Ecosystem, Layer 3 (L3), XAI Ecosystem, Gaming Blockchains, Outlier Ventures Portfolio",xai-blockchain,72899089,107475380.0,17491.575771499953,30460.334876141427,1.45,26515722.0
KuCoin,"Decentralized Exchange (DEX), Exchange-based Tokens, Decentralized Finance (DeFi), BNB Chain Ecosystem, Binance Launchpool, Polygon Ecosystem, Near Protocol Ecosystem, Arbitrum Ecosystem, Ethereum Ecosystem, DWF Labs Portfolio, Coinbase Ventures Portfolio, Alameda Research Portfolio, DeFiance Capital Portfolio, Pantera Capital Portfolio, Aurora Ecosystem, Energi Ecosystem, Binance Labs Portfolio, Galaxy Digital Portfolio",dodo,72729124,72729124.0,6425.3017967374735,8083.805546922463,0.14,8136904.0
KuCoin,"Decentralized Finance (DeFi), Ethereum Ecosystem, Binance Alpha Spotlight",avalon-2,72930906,449497109.0,,,N/A,19869081.0
KuCoin,"Artificial Intelligence (AI), Decentralized Finance (DeFi), Solana Ecosystem, Arbitrum Ecosystem, Metis Ecosystem, AI Agents, Sonic Ecosystem, IOTA EVM Ecosystem, AI Applications, DeFAI",heyanon,71750537,118166614.0,,,N/A,2910019.0
KuCoin,"Decentralized Finance (DeFi), Lending/Borrowing Protocols, Arbitrum Ecosystem, Ethereum Ecosystem, Alameda Research Portfolio, Pantera Capital Portfolio",liquity,71295096,73263348.0,1735.6863177805462,1382.6487997080947,0.18,10695041.0
KuCoin,"Artificial Intelligence (AI), Cardano Ecosystem, Ethereum Ecosystem, AI Agents, Sora Ecosystem",singularitynet,70586279,106716770.0,,,N/A,34507.0
KuCoin,"Artificial Intelligence (AI), Business Services, Decentralized Finance (DeFi), Ethereum Ecosystem, Paradigm Portfolio, DragonFly Capital Portfolio, Energi Ecosystem",numeraire,70674404,94625527.0,5358.756024390251,12634.277912703228,0.21,5657489.0
KuCoin,"Gaming (GameFi), NFT, Collectibles, Play To Earn, Ethereum Ecosystem, Base Ecosystem, Energi Ecosystem",ecomi,70559203,80957698.0,,,N/A,2118031.0
KuCoin,"Artificial Intelligence (AI), Ethereum Ecosystem",0x0-ai-ai-smart-contract,70225172,70225172.0,,,N/A,100002.0
KuCoin,"Decentralized Finance (DeFi), Lending/Borrowing Protocols, Solana Ecosystem, Binance Alpha Spotlight",kamino,70915606,525300785.0,209019.22541600603,203117.6733979324,0.1,7552209.0
KuCoin,"Decentralized Finance (DeFi), Lending/Borrowing Protocols, Ethereum Ecosystem, Real World Assets (RWA), Coinbase Ventures Portfolio, Andreessen Horowitz (a16z) Portfolio, RWA Protocol, Made in USA",goldfinch,70150175,86771612.0,,,N/A,574563.0
KuCoin,"Stablecoins, Decentralized Finance (DeFi), USD Stablecoin, BNB Chain Ecosystem, Polygon Ecosystem, Gnosis Chain Ecosystem, Arbitrum Ecosystem, Ethereum Ecosystem, Optimism Ecosystem, Base Ecosystem, Crypto-backed Stablecoin, Fiat-backed Stablecoin",crvusd,69911531,69911531.0,,,N/A,2949355.0
KuCoin,"Smart Contract Platform, Layer 1 (L1), DWF Labs Portfolio, Radix Ecosystem",radix,69593577,85214913.0,8627.243700962954,14473.195896207244,0.15,1594723.0
KuCoin,"Tokenized Assets, Polygon Ecosystem, Arbitrum Ecosystem, Ethereum Ecosystem, Real World Assets (RWA), Starknet Ecosystem, Tokenized Treasury Bills (T-Bills)",spiko-us-t-bills-money-market-fund,69588146,69588146.0,,,N/A,0.0
KuCoin,"Smart Contract Platform, Binance Launchpool, Layer 2 (L2), Scroll Ecosystem",scroll,69426071,365400372.0,34667.89967360966,19286.016922406543,0.05,10992102.0
KuCoin,"Smart Contract Platform, Ethereum Ecosystem, Layer 2 (L2), Zero Knowledge (ZK), Rollup, OKX Ventures Portfolio",taiko,69612751,658304864.0,23330.701821814986,47341.74491852792,0.15,11177548.0
KuCoin,"Lending/Borrowing Protocols, Solana Ecosystem, FTX Holdings, Coinbase Ventures Portfolio, Alameda Research Portfolio, DragonFly Capital Portfolio",solend,69360419,137087973.0,,,N/A,384.32
KuCoin,"Artificial Intelligence (AI), Solana Ecosystem, DePIN",nosana,69322274,83120232.0,,,N/A,428798.0
KuCoin,"Solana Ecosystem, Restaking, Liquid Restaking Tokens, Liquid Restaked SOL",renzo-restaked-sol,69190671,69190671.0,,,N/A,148325.0
KuCoin,"Decentralized Finance (DeFi), Ethereum Ecosystem",elixir-finance,68516938,429144994.0,,,N/A,50249794.0
KuCoin,"Artificial Intelligence (AI), Marketing, Analytics, BNB Chain Ecosystem, Ethereum Ecosystem, Animoca Brands Portfolio, Base Ecosystem, AI Agents, Binance Alpha Spotlight",cookie,68286080,151988731.0,8477.5655250936,13754.190294034557,0.18,18841992.0
KuCoin,"Decentralized Exchange (DEX), Decentralized Finance (DeFi), Sui Ecosystem, Animoca Brands Portfolio, OKX Ventures Portfolio, Dex Aggregator",cetus-protocol,68230189,99918500.0,11979.840139393555,20377.744526989136,0.06,10074425.0
KuCoin,"Stablecoins, Decentralized Finance (DeFi), USD Stablecoin, BNB Chain Ecosystem, Avalanche Ecosystem, Arbitrum Ecosystem, Liquid Staking Tokens, Ethereum Ecosystem, Optimism Ecosystem, Fiat-backed Stablecoin",staked-frax,67665336,67665336.0,,,N/A,35.74
KuCoin,"Smart Contract Platform, Layer 1 (L1), Proof of Work (PoW), Privacy Blockchain",ergo,67141081,81956469.0,2393.177083958394,6220.369557720664,0.52,76091.0
KuCoin,"Solana Ecosystem, Wallets, Base Ecosystem, TON Ecosystem",bitget-wallet-token,67182897,470072637.0,,,N/A,3631.06
KuCoin,SocialFi,steem,66570180,66651353.0,,,N/A,9007758.0
KuCoin,Ethereum Ecosystem,saasgo,66249409,82811762.0,,,N/A,197276.0
KuCoin,"Decentralized Finance (DeFi), BNB Chain Ecosystem, Solana Ecosystem, Wallets, Polygon Ecosystem, Ethereum Ecosystem, Binance Launchpad, DWF Labs Portfolio, Multicoin Capital Portfolio, Alameda Research Portfolio, Viction Ecosystem, Binance Labs Portfolio",coin98,66204255,73492247.0,11241.689026715636,10102.140300696063,0.41,16999373.0
KuCoin,"Meme, Ethereum Ecosystem, Frog-Themed, Murad Picks, Binance Alpha Spotlight",apu-s-club,64868369,64868369.0,,,N/A,7062038.0
KuCoin,E-commerce,pay-coin,65581447,121853725.0,,,N/A,3919947.0
KuCoin,"Polkadot Ecosystem, Real World Assets (RWA), Coinbase Ventures Portfolio, Circle Ventures Portfolio, Galaxy Digital Portfolio, RWA Protocol",centrifuge,64960002,71174797.0,5910.30421239527,693.4382163351405,0.16,756504.0
KuCoin,"Healthcare, Osmosis Ecosystem",medibloc,64767324,70151982.0,,,N/A,238344.0
KuCoin,"Stablecoins, USD Stablecoin, Fiat-backed Stablecoin",falcon-finance,64658014,64658014.0,,,N/A,50989.0
KuCoin,Ethereum Ecosystem,devve,64128685,88058665.0,,,N/A,514675.0
KuCoin,"Infrastructure, Smart Contract Platform, BNB Chain Ecosystem, Avalanche Ecosystem, Polygon Ecosystem, Arbitrum Ecosystem, Ethereum Ecosystem, Optimism Ecosystem, Layer 2 (L2), Base Ecosystem, Binance Launchpad, Modular Blockchain, Layer 3 (L3), Rollup, Proof of Stake (PoS), Appchains, Binance Labs Portfolio",cartesi,64376024,74902401.0,8930.899237195552,14848.413506759412,0.13,7476318.0
KuCoin,"Smart Contract Platform, Layer 1 (L1), Ethereum Ecosystem, Proof of Stake (PoS)",pundi-aifx,64054134,64054134.0,,,N/A,73034.0
KuCoin,"Artificial Intelligence (AI), BNB Chain Ecosystem, Ethereum Ecosystem, DePIN, AI Agents",netmind-token,63890284,202948372.0,,,N/A,1679292.0
KuCoin,,ark,63773090,64333992.0,,,N/A,4622470.0
KuCoin,"Smart Contract Platform, Layer 2 (L2), Made in USA",metal,63701405,63701405.0,10652.913249668203,12100.56910724599,0.2,692978.0
KuCoin,"Arbitrum Ecosystem, Ethereum Ecosystem, Base Ecosystem, Decentralized Science (DeSci)",axondao-governance-token,62515594,144545579.0,,,N/A,493730.0
KuCoin,"Artificial Intelligence (AI), Launchpad, Base Ecosystem, AI Applications, Clanker Ecosystem, Binance Alpha Spotlight",tokenbot-2,63347269,63347269.0,,,N/A,4882890.0
KuCoin,"Smart Contract Platform, Layer 1 (L1), Proof of Work (PoW), Made in USA",quai-network,62538739,389190318.0,,,N/A,4579089.0
KuCoin,"Decentralized Finance (DeFi), Lending/Borrowing Protocols, Ethereum Ecosystem, Real World Assets (RWA), Alameda Research Portfolio, Circle Ventures Portfolio, RWA Protocol",maple,63296580,160652075.0,,,N/A,2382305.0
KuCoin,"Meme, Base Ecosystem, Dog-Themed, Base Meme, Farcaster Ecosystem",doginme,64628601,64628601.0,,,N/A,5623459.0
KuCoin,"Decentralized Finance (DeFi), Ethereum Ecosystem, Liquid Staking",usualx,62782323,62782323.0,,,N/A,175475.0
KuCoin,"Infrastructure, Smart Contract Platform",ardor,61894258,61894258.0,,,N/A,4577963.0
KuCoin,"BNB Chain Ecosystem, Binance Megadrop, BTCfi",solv-protocol,61931250,350885267.0,45847.77970858606,73484.0640483313,0.24,40365775.0
KuCoin,"Artificial Intelligence (AI), Infrastructure, Gaming (GameFi), NFT, Solana Ecosystem, Arbitrum Ecosystem, Impossible Finance Launchpad, Ethereum Ecosystem, Animoca Brands Portfolio, Base Ecosystem",carv,61849174,309106511.0,6022.860459876196,6015.786734038093,0.36,4316190.0
KuCoin,"Smart Contract Platform, Osmosis Ecosystem, Alameda Research Portfolio, DragonFly Capital Portfolio, DeFiance Capital Portfolio, Privacy Blockchain, Outlier Ventures Portfolio",secret,61541337,64743862.0,4593.627604570713,8573.154371256596,0.05,4038514.0
KuCoin,"Ethereum Ecosystem, Telegram Apps, Binance HODLer Airdrops",banana-gun,62015132,150343801.0,17524.998474596825,56209.24125572668,0.22,86808497.0
KuCoin,"Exchange-based Tokens, BNB Chain Ecosystem, Centralized Exchange (CEX) Token, Polygon Ecosystem, Ethereum Ecosystem",bit2me,61139440,61757011.0,,,N/A,29805.0
KuCoin,"Artificial Intelligence (AI), Solana Ecosystem, Polygon Ecosystem, Gnosis Chain Ecosystem, Arbitrum Ecosystem, Celo Ecosystem, Ethereum Ecosystem, Optimism Ecosystem, Base Ecosystem, AI Agents, Mode Ecosystem, AI Agent Launchpad, Binance Alpha Spotlight, AI Framework, DeFAI",autonolas,61126722,178798003.0,,,N/A,261557.0
KuCoin,"BNB Chain Ecosystem, Meme, Binance Alpha Spotlight, Four.meme Ecosystem",test-3,60804990,60804990.0,17162.06860105671,12564.053348223268,0.16,60218100.0
