KuCoin,"Decentralized Exchange (DEX), Exchange-based Tokens, Decentralized Finance (DeFi), Automated Market Maker (AMM), BNB Chain Ecosystem, Derivatives, Perpetuals, Centralized Exchange (CEX) Token, Solana Ecosystem, Avalanche Ecosystem, Polygon Ecosystem, Near Protocol Ecosystem, Fantom Ecosystem, Arbitrum Ecosystem, Ethereum Ecosystem, ZkSync Ecosystem, Mantle Ecosystem, Linea Ecosystem, Base Ecosystem, DragonFly Capital Portfolio, Binance Labs Portfolio",woo-network,161908404,192823926.0,44243.91099292115,100375.45218716087,0.06,9433598.0
KuCoin,"Decentralized Exchange (DEX), Exchange-based Tokens, Ethereum Ecosystem",coinex-token,162335888,162335956.0,,,N/A,84792.0
KuCoin,"Smart Contract Platform, Layer 1 (L1), Layer 0 (L0), Made in USA, Directed Acyclic Graph (DAG)",constellation-labs,161961531,161961648.0,18193.630704929637,7459.020162848095,0.57,2282609.0
KuCoin,"Meme, Ethereum Ecosystem, Frog-Themed, AI Meme",turbo,159944668,159944668.0,52906.55344322246,65513.7111672653,0.09,34533733.0
KuCoin,"Smart Contract Platform, BNB Chain Ecosystem, Layer 1 (L1), Ethereum Ecosystem, ZetaChain Ecosystem, Cross-chain Communication, Made in USA",zetachain,160276952,460033507.0,92783.32388506866,105965.34870743772,0.05,9249396.0
KuCoin,"SocialFi, Arbitrum Ecosystem",uxlink,159882633,472745811.0,19681.42260279312,23953.868406596626,0.08,12214116.0
KuCoin,"Solana Ecosystem, DePIN, Multicoin Capital Portfolio, Made in USA",hivemapper,159012562,247317351.0,7907.084693048195,27921.471416459615,0.57,1769516.0
KuCoin,"Decentralized Finance (DeFi), Tron Ecosystem",sun-token,158886181,321658727.0,44985.93637415692,40163.63962171476,0.12,23062590.0
KuCoin,"Smart Contract Platform, Layer 1 (L1), Proof of Stake (PoS), GMCI Layer 1 Index, GMCI Index, Made in USA",casper-network,158708486,164315161.0,30048.488611327703,44616.892243110735,0.16,15520020.0
KuCoin,"Internet of Things (IOT), Oracle, NFT, Metaverse, Ethereum Ecosystem, DePIN, Alleged SEC Securities, Made in USA",xyo-network,156575736,156575736.0,29063.367208377967,28738.420319071225,0.28,4954554.0
KuCoin,"Smart Contract Platform, EthereumPoW Ecosystem, Proof of Work (PoW)",ethereum-pow-iou,154265876,154265876.0,839.3212396578045,2394.9065135217506,0.31,3724555.0
KuCoin,"Artificial Intelligence (AI), Meme, Base Ecosystem, AI Agents, Binance Alpha Spotlight, AI Framework",freysa-ai,152008401,152008401.0,,,N/A,623322.0
KuCoin,"Stablecoins, Ethereum Ecosystem, Crypto-backed Stablecoin",elixir-staked-deusd,152444345,152444284.0,,,N/A,64913.0
KuCoin,"Smart Contract Platform, Layer 1 (L1), Real World Assets (RWA), RWA Protocol",polymesh,151742558,151742558.0,16684.65872434291,17522.075188644434,0.08,1854421.0
KuCoin,Smart Contract Platform,bitkub-coin,152943312,189350189.0,,,N/A,308284.0
KuCoin,"Gaming (GameFi), NFT, Solana Ecosystem, Animoca Brands Portfolio, FTX Holdings, Multicoin Capital Portfolio, Alameda Research Portfolio",metaplex,151228061,193786413.0,8035.8801483361085,15356.416837608687,0.07,6312058.0
KuCoin,BNB Chain Ecosystem,acet-token,152374887,198794350.0,,,N/A,719473.0
KuCoin,"Payment Solutions, Made in USA, Directed Acyclic Graph (DAG)",nano,150090639,150090639.0,2127.108000959439,1448.9634080325104,0.42,3141607.0
KuCoin,"Binance Launchpool, Solana Ecosystem, Ethereum Ecosystem, Decentralized Science (DeSci)",bio-protocol,151805218,310932578.0,114330.93337565802,108331.79852404115,0.1,18793804.0
KuCoin,"Solana Ecosystem, Meme, Solana Meme, Murad Picks",gigachad-2,150996512,150996512.0,8047.49944457044,8724.557274081317,0.25,11488121.0
KuCoin,"NFT, Solana Ecosystem, NFT Marketplace, Paradigm Portfolio, Sequoia Capital Portfolio",magic-eden,149372255,1119937202.0,32873.720999108096,23574.392140703952,0.18,11707732.0
KuCoin,"BNB Chain Ecosystem, Binance-Peg Tokens",binance-peg-sol,148896763,148896763.0,,,N/A,3122065.0
KuCoin,"Alleged SEC Securities, Osmosis Ecosystem, DeFiance Capital Portfolio, Pantera Capital Portfolio, Binance Labs Portfolio, Delphi Ventures Portfolio, Galaxy Digital Portfolio, OKX Ventures Portfolio",terra-luna-2,148045119,232192275.0,30609.319893158703,31954.593990670728,0.09,27766798.0
KuCoin,"Smart Contract Platform, Masternodes, Zero Knowledge (ZK), Proof of Work (PoW), Made in USA",zencash,146932305,146933113.0,40525.6184153258,48005.667712688904,0.12,15368444.0
KuCoin,"Crypto-Backed Tokens, BNB Chain Ecosystem, Wrapped-Tokens, Ethereum Ecosystem",wrapped-beacon-eth,146376235,146376235.0,,,N/A,2853092.0
KuCoin,"Internet of Things (IOT), Smart Contract Platform, Layer 1 (L1), Proof of Work (PoW), Made in USA",digibyte,146069636,146071827.0,11372.13501825889,13100.531289193093,0.11,3249240.0
KuCoin,"Exchange-based Tokens, Decentralized Finance (DeFi), Ethereum Ecosystem, Real World Assets (RWA), Alleged SEC Securities",lcx,145326308,146717884.0,,,N/A,3058267.0
KuCoin,"Smart Contract Platform, Crypto-Backed Tokens, Wrapped-Tokens, Layer 2 (L2), Mantle Ecosystem",wrapped-ether-mantle-bridge,146732383,146732383.0,,,N/A,6307375.0
KuCoin,"Smart Contract Platform, Layer 1 (L1), Kadena Ecosystem, Multicoin Capital Portfolio, Proof of Work (PoW), Made in USA",kadena,144810914,144972720.0,14724.16229379041,36236.15602402873,0.06,4697862.0
KuCoin,"Smart Contract Platform, DWF Labs Portfolio, Proof of Stake (PoS)",waves,145015055,145015055.0,12901.617662113369,18143.87526457023,0.1,6873113.0
KuCoin,"Stablecoins, Ethereum Ecosystem, XRP Ledger Ecosystem, Fiat-backed Stablecoin, Made in USA",ripple-usd,141411097,141411097.0,,,N/A,8312111.0
KuCoin,"Artificial Intelligence (AI), Smart Contract Platform, Layer 1 (L1), Proof of Work (PoW)",qubic-network,140829141,168432489.0,,,N/A,10174766.0
KuCoin,"Smart Contract Platform, Layer 1 (L1), Harmony Ecosystem, Animoca Brands Portfolio, Binance Launchpad, Binance Labs Portfolio, Made in USA",harmony,140520695,150234259.0,31728.343403275972,34494.43391972609,0.04,8040126.0
KuCoin,"Stablecoins, EUR Stablecoin, Solana Ecosystem, Avalanche Ecosystem, Ethereum Ecosystem, Base Ecosystem, Stellar Ecosystem",euro-coin,139597136,139597136.0,,,N/A,22169311.0
KuCoin,"Gaming (GameFi), NFT, BNB Chain Ecosystem, Solana Ecosystem, Polygon Ecosystem, Play To Earn, Move To Earn, Ethereum Ecosystem, Binance Launchpad, Gaming Governance Token, Sports Games, Alameda Research Portfolio, Binance Labs Portfolio, Sequoia Capital Portfolio",stepn,139022577,259994393.0,10595.992869653413,17811.74899401051,0.2,18245108.0
KuCoin,"Crypto-Backed Tokens, Wrapped-Tokens, Avalanche Ecosystem",wrapped-avax,138949177,138684773.0,,,N/A,71312591.0
KuCoin,"Gaming (GameFi), Polkadot Ecosystem, NFT, Ethereum Ecosystem, Gaming Blockchains, Andreessen Horowitz (a16z) Portfolio, Binance Labs Portfolio, Galaxy Digital Portfolio, Made in USA",mythos,139094655,179073357.0,,,N/A,1886087.0
KuCoin,"Gaming (GameFi), Play To Earn, Telegram Apps, TON Ecosystem, Tap to Earn, Arcade Games",hamster-kombat,138593490,215290858.0,20445.935393624244,41013.11090537931,0.05,19129744.0
KuCoin,"BNB Chain Ecosystem, Arbitrum Ecosystem, Cardano Ecosystem, Ethereum Ecosystem, DePIN, Base Ecosystem, DWF Labs Portfolio",world-mobile-token,138019578,398798702.0,4122.856913411581,6730.7681758880835,0.15,13219080.0
KuCoin,"Tokenized Assets, Tokenized Gold, Real World Assets (RWA), Tokenized Commodities",kinesis-gold,137166682,137166682.0,,,N/A,693411.0
KuCoin,"Decentralized Finance (DeFi), Analytics, DeFi Index, Base Ecosystem",mag7-ssi,136397313,136397313.0,,,N/A,1088549.0
KuCoin,"Liquid Staking Tokens, Aptos Ecosystem, Liquid Staking",amnis-aptos,134219095,134247528.0,,,N/A,136383.0
KuCoin,"Stablecoins, EUR Stablecoin, Polygon Ecosystem, Ethereum Ecosystem, Real World Assets (RWA), Fiat-backed Stablecoin",stasis-eurs,135064612,135064612.0,,,N/A,55837.0
KuCoin,"Smart Contract Platform, Masternodes, Proof of Stake (PoS), Made in China",ontology,135250246,148187316.0,11924.225490271749,2282.4895391723403,0.28,4252134.0
KuCoin,"Decentralized Exchange (DEX), Smart Contract Platform, Exchange-based Tokens, Decentralized Finance (DeFi), Arbitrum Ecosystem, Ethereum Ecosystem, Layer 2 (L2), Zero Knowledge (ZK), Loopring Ecosystem, Rollup, Energi Ecosystem",loopring,133950703,147698690.0,20112.051643593164,27351.02585703846,0.19,12008800.0
KuCoin,"Smart Contract Platform, Base Ecosystem, Gaming Blockchains",b3,133722650,628021982.0,8162.14764686644,20264.120544841382,0.32,19306627.0
KuCoin,"Smart Contract Platform, SocialFi, NFT, BNB Chain Ecosystem, Binance Launchpool, Ethereum Ecosystem, Decentralized Identifier (DID), Zero Knowledge (ZK), DWF Labs Portfolio, Coinbase Ventures Portfolio, Multicoin Capital Portfolio, Alameda Research Portfolio, DragonFly Capital Portfolio, Binance Labs Portfolio, Quest-to-Earn",project-galaxy,132552282,207519337.0,,,N/A,340268.0
KuCoin,"Stablecoins, USD Stablecoin, Solana Ecosystem, Fiat-backed Stablecoin",global-dollar,130243136,130243136.0,,,N/A,1050163.0
KuCoin,"Cronos Ecosystem, Bridged USDC, Bridged-Tokens, Bridged Stablecoins",cronos-bridged-usdc-cronos,128883298,128883298.0,,,N/A,1802486.0
KuCoin,"Artificial Intelligence (AI), Binance Launchpool, Solana Ecosystem, DePIN, Animoca Brands Portfolio, Multicoin Capital Portfolio, Delphi Ventures Portfolio, OKX Ventures Portfolio, Made in USA",io,128609484,697767748.0,77938.48101397807,85595.51951230167,0.1,36278611.0
KuCoin,"Tokenized Assets, Real World Assets (RWA), Tokenized Silver, Tokenized Commodities",kinesis-silver,131889136,131889136.0,,,N/A,66487.0
KuCoin,"BNB Chain Ecosystem, Harmony Ecosystem, Ethereum Ecosystem, Alameda Research Portfolio, Binance Labs Portfolio",swipe,127115693,127190033.0,8825.824132447191,18157.900146715616,0.1,3874075.0
KuCoin,"Artificial Intelligence (AI), Smart Contract Platform, BNB Chain Ecosystem, Solana Ecosystem, Layer 1 (L1), Polygon Ecosystem, Ethereum Ecosystem, DWF Labs Portfolio, Injective Ecosystem, OKX Ventures Portfolio",zignaly,126616295,175549088.0,,,N/A,2214466.0
KuCoin,"Decentralized Exchange (DEX), Exchange-based Tokens, Decentralized Finance (DeFi), Yield Farming, Automated Market Maker (AMM), BNB Chain Ecosystem, Yearn Ecosystem, Solana Ecosystem, Avalanche Ecosystem, Polygon Ecosystem, Near Protocol Ecosystem, Fantom Ecosystem, Harmony Ecosystem, Arbitrum Ecosystem, Celo Ecosystem, Ethereum Ecosystem, Base Ecosystem, Alameda Research Portfolio, Pantera Capital Portfolio, Energi Ecosystem, Sora Ecosystem, Blockchain Capital Portfolio",sushi,125555809,182799852.0,21972.59321769961,22368.469718997174,0.06,24551982.0
KuCoin,"Decentralized Exchange (DEX), Decentralized Finance (DeFi), Gnosis Chain Ecosystem, MEV Protection, Arbitrum Ecosystem, Ethereum Ecosystem, Intent, Delphi Ventures Portfolio, Blockchain Capital Portfolio",cow-protocol,125311821,301954577.0,22077.059939700575,60429.447349374874,0.2,37065256.0
KuCoin,"Smart Contract Platform, Ethereum Ecosystem, Zero Knowledge (ZK), Alleged SEC Securities, Privacy Blockchain",coti,124256056,138654723.0,8764.693404072957,11288.498266144394,0.29,20043051.0
KuCoin,"Decentralized Finance (DeFi), Insurance, Ethereum Ecosystem",nxm,123994841,123994841.0,,,N/A,0.0
KuCoin,"Business Services, Decentralized Finance (DeFi), Oracle, Fantom Ecosystem, Ethereum Ecosystem, Binance Launchpad, Osmosis Ecosystem, Energi Ecosystem, Binance Labs Portfolio, Sequoia Capital Portfolio",band-protocol,123836811,125702215.0,4632.857216985051,6365.6772055489355,0.11,8190429.0
KuCoin,"Smart Contract Platform, BNB Chain Ecosystem, Ethereum Ecosystem, Zero Knowledge (ZK), Animoca Brands Portfolio, Binance Labs Portfolio, OKX Ventures Portfolio",polyhedra-network,123531293,2045779379.0,183628.38596775933,181574.19388337494,0.1,8090580.0
KuCoin,"Exchange-based Tokens, BNB Chain Ecosystem, Centralized Exchange (CEX) Token",nkyc-token,123709599,123709599.0,,,N/A,247790.0
KuCoin,"BNB Chain Ecosystem, Tron Ecosystem",global-commercial-business,123182134,123182134.0,,,N/A,206164.0
KuCoin,"Tokenized Assets, Polygon Ecosystem, Arbitrum Ecosystem, Ethereum Ecosystem, Real World Assets (RWA), Starknet Ecosystem, Tokenized Treasury Bills (T-Bills)",eutbl,122449574,122449574.0,,,N/A,0.0
KuCoin,"Arbitrum Ecosystem, Ethereum Ecosystem, Account Abstraction, Coinbase Ventures Portfolio, Binance Labs Portfolio, Consensys Portfolio, Outlier Ventures Portfolio",biconomy,121269976,129537120.0,6998.6408640934205,31463.936027384618,0.31,13133847.0
KuCoin,"Arbitrum Ecosystem, Ethereum Ecosystem",reserve-protocol-eth-plus,120177193,120177193.0,,,N/A,443622.0
KuCoin,"Decentralized Finance (DeFi), Ethereum Ecosystem, Real World Assets (RWA), Coinbase Ventures Portfolio, Stablecoin Protocol, Binance Labs Portfolio, Galaxy Digital Portfolio",usual,119802721,131722445.0,103608.79496696948,110838.43027261646,0.06,13922720.0
KuCoin,"Decentralized Finance (DeFi), Yield Farming, Avalanche Ecosystem, Fantom Ecosystem, Arbitrum Ecosystem, Olympus Pro Ecosystem, Ethereum Ecosystem, Stablecoin Protocol",spell-token,120501270,148946331.0,,,N/A,149403854.0
KuCoin,"Smart Contract Platform, SocialFi, Layer 1 (L1), Gaming Blockchains",hive,117140058,,,,N/A,2363069.0
KuCoin,"Decentralized Finance (DeFi), Yield Farming, Lending/Borrowing Protocols, Ethereum Ecosystem, Real World Assets (RWA), Base Ecosystem, Binance Alpha Spotlight",syrup,117245118,188133435.0,22625.213849646,13905.912147470635,0.25,10389372.0
KuCoin,"Polygon Ecosystem, Bridged DAI, Bridged-Tokens, Bridged Stablecoins",polygon-pos-bridged-dai-polygon-pos,116230491,116230491.0,,,N/A,11694796.0
KuCoin,"Stablecoins, Ethereum Ecosystem, Base Ecosystem, Blast Ecosystem, Fiat-backed Stablecoin",anzen-usdz,115261291,115261291.0,,,N/A,97013.0
KuCoin,"BNB Chain Ecosystem, Ethereum Ecosystem, Payment Solutions, DWF Labs Portfolio",alchemy-pay,115289528,233205365.0,35506.32937348937,52353.69452388859,0.01,25604580.0
KuCoin,"Meme, Ethereum Ecosystem, Dog-Themed",neiro-3,115218061,115218061.0,,,N/A,35077834.0
KuCoin,"Exchange-based Tokens, NFT, BNB Chain Ecosystem, Ethereum Ecosystem",swftcoin,112680753,112680753.0,5177.4385567266645,8180.900140701565,0.88,2714598.0
KuCoin,"Solana Ecosystem, Polygon Ecosystem, Ethereum Ecosystem",m2-global-wealth-limited-mmx,113858619,365284375.0,,,N/A,92228.0
KuCoin,"Decentralized Finance (DeFi), Derivatives, Synthetic Issuer, Ethereum Ecosystem, Synthetic",stp-network,113325560,113325560.0,,,N/A,21626051.0
KuCoin,"Big Data, Business Services, Infrastructure, Decentralized Finance (DeFi), Solana Ecosystem, FTX Holdings, DWF Labs Portfolio, Name Service",bonfida,112683620,113717107.0,2531.5962971658732,16848.228985526148,0.18,11561995.0
KuCoin,"Smart Contract Platform, BNB Chain Ecosystem, Ethereum Ecosystem, Layer 2 (L2)",prometeus,112776134,118955648.0,6726.523563859377,23506.181490989005,0.18,1604962.0
KuCoin,"Smart Contract Platform, Proof of Stake (PoS), Sequoia Capital Portfolio",iostoken,112629171,112629171.0,12004.621226189949,15536.79796989763,0.12,43674231.0
KuCoin,"Business Services, Infrastructure, Smart Contract Platform, Decentralized Finance (DeFi), Polygon Ecosystem, Arbitrum Ecosystem, Ethereum Ecosystem, Liquid Staking Governance Tokens, Coinbase Ventures Portfolio, Proof of Stake (PoS), Index Coop Defi Index, Consensys Portfolio, Liquid Staking, Index Coop Index",rocket-pool,112477262,112477262.0,9607.513663164824,27735.917426408796,0.38,10440511.0
KuCoin,"Meme, PulseChain Ecosystem",the-grays-currency,111139850,111139850.0,,,N/A,197697.0
KuCoin,"Smart Contract Platform, BNB Chain Ecosystem, Layer 1 (L1), Ethereum Ecosystem, Decentralized Identifier (DID), Base Ecosystem, Gravity Alpha Ecosystem",g-token,111713795,185347870.0,11379.164500386922,5556.961965617066,0.39,6728283.0
KuCoin,"Smart Contract Platform, Cross-chain Communication, Pantera Capital Portfolio",icon,110559693,111819698.0,1794.2321509141266,1558.25844608087,0.1,964076.0
KuCoin,"Smart Contract Platform, Decentralized Finance (DeFi), Binance Launchpool, Derivatives, Perpetuals, Ethereum Ecosystem, Layer 2 (L2), DragonFly Capital Portfolio, Pantera Capital Portfolio",aevo-exchange,110217980,122035123.0,5658.287716368823,3886.3082422115012,0.81,13170234.0
KuCoin,"Arbitrum Ecosystem, Bridged USDC, Bridged-Tokens, Bridged Stablecoins",usd-coin-ethereum-bridged,110277863,110277863.0,,,N/A,21896477.0
KuCoin,"Smart Contract Platform, Ethereum Ecosystem, Metis Ecosystem, Layer 2 (L2), DWF Labs Portfolio, Rollup, GMCI Layer 2 Index, OKX Ventures Portfolio, GMCI Index",metis-token,109633243,175263603.0,12398.150956388949,35162.588602608426,0.06,5337484.0
KuCoin,"Decentralized Exchange (DEX), Decentralized Finance (DeFi), BNB Chain Ecosystem, Wallets, XRP Ledger Ecosystem",solo-coin,108993678,108993678.0,,,N/A,2429732.0
KuCoin,"Music, NFT, Ethereum Ecosystem, Coinbase Ventures Portfolio, Multicoin Capital Portfolio, Pantera Capital Portfolio, Energi Ecosystem, Binance Labs Portfolio",audius,109413580,109413580.0,7793.627586950984,9857.489656525302,0.36,13854505.0
KuCoin,"Gaming (GameFi), NFT, Metaverse, Play To Earn, Ethereum Ecosystem, Animoca Brands Portfolio, RPG, Gaming Governance Token, Adventure Games, Energi Ecosystem, Delphi Ventures Portfolio",illuvium,108617394,139937209.0,11107.003588364923,21191.111665978602,0.03,13786529.0
KuCoin,"Lending/Borrowing Protocols, Ethereum Ecosystem, Paradigm Portfolio, Coinbase Ventures Portfolio",euler,109293499,158994967.0,6853.107600762917,8152.501882626233,0.17,2514833.0
KuCoin,"Decentralized Finance (DeFi), Ethereum Ecosystem, Morpho Ecosystem",steakhouse-usdc-morpho-vault,106088336,106088336.0,,,N/A,0.0
KuCoin,"Decentralized Finance (DeFi), BNB Chain Ecosystem, Real World Assets (RWA), DWF Labs Portfolio, Stellar Ecosystem",velo,108106316,351065786.0,21492.33905130208,69398.49881021318,0.16,11738680.0
KuCoin,"Solana Ecosystem, Multicoin Capital Portfolio, Stablecoin Protocol, Alameda Research Portfolio, DeFiance Capital Portfolio",uxd-protocol-token,107462019,107462019.0,,,N/A,91.56
KuCoin,"Crypto-Backed Tokens, BNB Chain Ecosystem, Arbitrum Ecosystem, Ethereum Ecosystem, Mantle Ecosystem",ignition-fbtc,107089956,1181284765.0,,,N/A,400253.0
KuCoin,"NFT, Meme, Arbitrum Ecosystem, Ethereum Ecosystem, Anime-Themed, Binance HODLer Airdrops, Airdropped Tokens by NFT Projects",anime,106268818,191869297.0,49967.23047241416,59490.75549766815,0.15,12498189.0
KuCoin,"Smart Contract Platform, BNB Chain Ecosystem, Ethereum Ecosystem, DWF Labs Portfolio, Made in USA",proton,104469332,115810049.0,20849.220673426404,10340.592445006994,0.09,3835873.0
KuCoin,"Artificial Intelligence (AI), Smart Contract Platform, Masternodes, DePIN, Proof of Work (PoW), Made in USA",zelcash,105160115,105163963.0,12813.465526229586,33545.484728447955,0.04,9248943.0
KuCoin,"Stablecoins, BNB Chain Ecosystem",astherus-usdf,105099209,105099209.0,,,N/A,362684.0
KuCoin,"Smart Contract Platform, Privacy, Layer 1 (L1), Proof of Stake (PoS), Proof of Work (PoW), Zano Ecosystem, Privacy Blockchain",zano,105102238,105102685.0,,,N/A,667833.0
KuCoin,"Solana Ecosystem, Meme, Solana Meme, PolitiFi, Made in USA",melania-meme,104698770,697991223.0,12375.394755244557,29731.478569495102,0.14,12424671.0
KuCoin,"Tokenized Real Estate, Tokenized Assets, Gnosis Chain Ecosystem, RealT Tokens, Real World Assets (RWA), RWA Protocol",realtoken-ecosystem-governance,104509302,729815360.0,,,N/A,608.08
KuCoin,"Smart Contract Platform, Polkadot Ecosystem, Binance Launchpool, Layer 2 (L2), Manta Network Ecosystem, Multicoin Capital Portfolio, Alameda Research Portfolio, DeFiance Capital Portfolio, Binance Labs Portfolio",manta-network,103682086,263300052.0,7205.423987389505,17978.94563451318,0.08,28212477.0
KuCoin,"Business Services, Decentralized Finance (DeFi), Oracle, Derivatives, Synthetic Issuer, Avalanche Ecosystem, Ethereum Ecosystem, Blockchain Capital Portfolio, Synthetic, Made in USA",uma,103211711,148919295.0,12469.87463189111,20800.682878963256,0.08,9215742.0
KuCoin,"NFT, Binance Launchpool, Meme, Ethereum Ecosystem, Binance Labs Portfolio, GMCI Meme Index, GMCI Index",memecoin-2,102730882,173082134.0,40193.616786507206,42336.58397998712,0.04,18766372.0
KuCoin,"Artificial Intelligence (AI), Base Ecosystem, AI Agents, AI Applications, Made in USA",venice-token,102373794,244034986.0,28809.894147685434,26363.225177304004,0.14,6870356.0
KuCoin,"Infrastructure, Solana Ecosystem, Animoca Brands Portfolio, Cross-chain Communication, OKX Ventures Portfolio",zeus-network,101608292,265448829.0,32477.03672039541,32643.715165221405,0.19,7886423.0
KuCoin,"Solana Ecosystem, Meme, Base Ecosystem, AI Meme, AI Agents, Virtuals Protocol Ecosystem, Binance Alpha Spotlight, DeFAI",aixbt,101262324,118350651.0,77950.46668110388,73283.2047579238,0.08,42221814.0
KuCoin,"Polygon Ecosystem, Arbitrum Ecosystem, Ethereum Ecosystem, Optimism Ecosystem, Bridge Governance Tokens, Cross-chain Communication, Intent, Boba Network Ecosystem, Blockchain Capital Portfolio, Made in USA",across-protocol,101170996,250381708.0,43734.03177980568,43385.49980180383,0.2,11327356.0
KuCoin,"Decentralized Exchange (DEX), Decentralized Finance (DeFi), Automated Market Maker (AMM), Ethereum Ecosystem, Cronos Ecosystem",vvs-finance,100671464,196810143.0,,,N/A,312946.0
KuCoin,"Solana Ecosystem, Meme, Frog-Themed, Solana Meme, GMCI Meme Index, GMCI Index",book-of-meme,100749511,100749511.0,78074.25597218389,98362.057363189,0.07,45161900.0
KuCoin,"Big Data, Infrastructure, Storage, Cardano Ecosystem, DePIN",iagon,100548277,267401099.0,,,N/A,491036.0
KuCoin,"Bridged USDT, QL1 Ecosystem, Bridged-Tokens, Bridged Stablecoins",qusdt,100009154,100009154.0,,,N/A,8034.2
KuCoin,"Solana Ecosystem, Liquid Staking Tokens, Liquid Staked SOL, Liquid Staking",drift-staked-sol,99725697,99725697.0,,,N/A,26514.0
KuCoin,"Smart Contract Platform, BNB Chain Ecosystem, Binance Launchpool, Ethereum Ecosystem, Layer 2 (L2), Restaking, Rollups-as-a-Service (RaaS), Rollup, Binance Labs Portfolio",altlayer,99285854,355606589.0,15535.506253907713,16745.063612352813,0.17,12062108.0
KuCoin,"NFT, BNB Chain Ecosystem, Ethereum Ecosystem, Binance Launchpad, DWF Labs Portfolio, Binance Labs Portfolio",space-id,99419662,461092182.0,21222.227878050373,34903.301429677056,0.13,14123791.0
KuCoin,"Crypto-Backed Tokens, Decentralized Finance (DeFi), Compound Tokens, cToken, Ethereum Ecosystem",compound-ether,98347548,98347548.0,,,N/A,281.59
KuCoin,"NFT, Polygon Ecosystem, Ethereum Ecosystem, Optimism Ecosystem",blockv,97924178,97924178.0,,,N/A,60520.0
KuCoin,"Smart Contract Platform, Ethereum Ecosystem, Layer 2 (L2), Optimism Superchain Ecosystem, Outlier Ventures Portfolio, Lisk Ecosystem",lisk,97812979,227017543.0,4092.165012696699,20412.130133735856,0.18,9119946.0
KuCoin,"Gaming (GameFi), NFT, BNB Chain Ecosystem",infinitar-governance-token,95731676,467168368.0,,,N/A,8176892.0
KuCoin,"Software as a service, Ethereum Ecosystem, Energi Ecosystem",status,97056662,166761947.0,,,N/A,6475570.0
KuCoin,"DaoMaker Launchpad, Ethereum Ecosystem, Real World Assets (RWA), Sequoia Capital Portfolio, Made in USA",clearpool,96805810,127385124.0,3936.095203147772,4401.633131335733,0.34,2453021.0
KuCoin,"Stablecoins, LP Tokens, Ethereum Ecosystem",resolv-rlp,95896650,95896650.0,,,N/A,196072.0
KuCoin,"Smart Contract Platform, Layer 1 (L1), Zero Knowledge (ZK), Andreessen Horowitz (a16z) Portfolio, Privacy Blockchain, Made in USA",aleo,95890294,469845409.0,,,N/A,6348772.0
KuCoin,"Artificial Intelligence (AI), Infrastructure, Smart Contract Platform, Oracle, Polkadot Ecosystem, Ethereum Ecosystem, Interoperability, Layer 2 (L2), Zero Knowledge (ZK), DePIN, DWF Labs Portfolio, Rollup, AI Agents, Sora Ecosystem, AI Framework, Made in USA",pha,95562564,121797855.0,14379.14188587658,10724.492751659733,0.33,21661120.0
KuCoin,"XDC Ecosystem, Telos Ecosystem",ecoin-2,95498064,207099463.0,,,N/A,5.24
KuCoin,"Gaming (GameFi), NFT, Kaia Ecosystem, Gaming Blockchains",bora,94993206,99360710.0,,,N/A,419505.0
KuCoin,"Infrastructure, Smart Contract Platform, Ethereum Ecosystem, Data Availability, Modular Blockchain",avail,94704748,484857346.0,141075.94099111343,2696.1389813092414,0.17,3047205.0
KuCoin,"Infrastructure, Smart Contract Platform, Oracle, Layer 1 (L1), Animoca Brands Portfolio, Coinbase Ventures Portfolio, Cross-chain Communication, Made in USA",supra,94907991,843870924.0,29072.11910837603,20361.733086624216,0.11,15024661.0
KuCoin,"Solana Ecosystem, Liquid Staking Tokens, Restaking, Liquid Restaking Tokens, Liquid Staked SOL, Liquid Staking, Liquid Restaked SOL",solayer-staked-sol,95052667,95048285.0,,,N/A,223389.0
KuCoin,Layer 1 (L1),oec-token,94900983,94900983.0,,,N/A,345428.0
KuCoin,"Solana Ecosystem, Payment Solutions, Viction Ecosystem",saros-finance,94593031,360354428.0,1404.1434711042655,1978.6901952076362,0.66,707616.0
KuCoin,"Decentralized Finance (DeFi), Yield Farming, BNB Chain Ecosystem, Binance Launchpool, Lending/Borrowing Protocols, Arbitrum Ecosystem, Ethereum Ecosystem, Optimism Ecosystem, ZkSync Ecosystem, opBNB Ecosystem, Unichain Ecosystem",venus,94875194,170204169.0,,,N/A,6940486.0
KuCoin,"Fraxtal Ecosystem, Bridged-Tokens",l2-standard-bridged-frxusd,94413497,94413497.0,,,N/A,1226955.0
KuCoin,"Smart Contract Platform, Gaming (GameFi), Solana Ecosystem, Layer 2 (L2), Gaming Blockchains",sonic-svm,93952486,626349909.0,99400.88732418205,92291.23977057029,0.06,23555969.0
KuCoin,"Artificial Intelligence (AI), Big Data, Media, BNB Chain Ecosystem, Polygon Ecosystem, Ethereum Ecosystem, GMCI DePIN Index, Galaxy Digital Portfolio, GMCI Index",everipedia,93016031,93016031.0,,,N/A,4762884.0
KuCoin,"Ethereum Ecosystem, DWF Labs Portfolio",adventure-gold,92971145,92971145.0,22281.804389163455,27942.834240572596,0.2,25834373.0
KuCoin,"Artificial Intelligence (AI), Oracle, Ethereum Ecosystem, DePIN, Energi Ecosystem, Sora Ecosystem, GMCI DePIN Index, GMCI Index",iexec-rlc,91929654,110494315.0,8116.062620376795,21701.367821657543,0.09,7220310.0
