KuCoin,"DaoMaker Launchpad, Ethereum Ecosystem, Real World Assets (RWA), Sequoia Capital Portfolio, Made in USA",clearpool,92878612,122217391.0,4436.685898311764,12125.686534814826,0.41,4633032.0
KuCoin,Layer 1 (L1),oec-token,92946131,92946131.0,,,N/A,274831.0
KuCoin,"Artificial Intelligence (AI), Big Data, Media, BNB Chain Ecosystem, Polygon Ecosystem, Ethereum Ecosystem, GMCI DePIN Index, Galaxy Digital Portfolio, GMCI Index",everipedia,92563309,92563309.0,,,N/A,5400045.0
KuCoin,"Energy, Ethereum Ecosystem, Alleged SEC Securities, Energi Ecosystem, GMCI DePIN Index, Blockchain Capital Portfolio, GMCI Index",power-ledger,91778480,173159215.0,,,N/A,8823447.0
KuCoin,"Crypto-Backed Tokens, BNB Chain Ecosystem, Arbitrum Ecosystem, Ethereum Ecosystem, Mantle Ecosystem",ignition-fbtc,90797225,1174749097.0,,,N/A,566385.0
KuCoin,"Decentralized Exchange (DEX), Exchange-based Tokens, Decentralized Finance (DeFi), Yield Farming, Automated Market Maker (AMM), Avalanche Ecosystem, Polygon Ecosystem, Near Protocol Ecosystem, Gnosis Chain Ecosystem, Harmony Ecosystem, Arbitrum Ecosystem, Ethereum Ecosystem, Optimism Ecosystem, Base Ecosystem, Index Coop Defi Index, Alameda Research Portfolio, DeFiance Capital Portfolio, Pantera Capital Portfolio, Energi Ecosystem, Polygon zkEVM Ecosystem, Huobi ECO Chain Ecosystem, Blockchain Capital Portfolio, Index Coop Index",balancer,90202405,97543323.0,11438.879365786683,12719.713110472376,0.14,10066131.0
KuCoin,"Artificial Intelligence (AI), Infrastructure, Smart Contract Platform, Decentralized Finance (DeFi), Arbitrum Ecosystem, Ethereum Ecosystem, Zero Knowledge (ZK), DWF Labs Portfolio, Coinbase Ventures Portfolio, Pantera Capital Portfolio, Binance Labs Portfolio",marlin,89685755,109998956.0,7998.6880738918935,14107.422661643588,0.39,7563665.0
KuCoin,"Smart Contract Platform, Gaming (GameFi), Solana Ecosystem, Layer 2 (L2), Gaming Blockchains",sonic-svm,89527315,596848768.0,47984.66596057757,93133.35066984214,0.06,39440311.0
KuCoin,"Gaming (GameFi), XDC Ecosystem, Gaming Utility Token",gama-coin,89650943,137924603.0,,,N/A,2280064.0
KuCoin,"Ethereum Ecosystem, DWF Labs Portfolio",adventure-gold,89503679,89503679.0,21729.48687197136,22248.01906276632,0.27,24193082.0
KuCoin,"Decentralized Finance (DeFi), Yield Farming, BNB Chain Ecosystem, Binance Launchpool, Lending/Borrowing Protocols, Arbitrum Ecosystem, Ethereum Ecosystem, Optimism Ecosystem, ZkSync Ecosystem, opBNB Ecosystem, Unichain Ecosystem",venus,89182965,159993481.0,,,N/A,4749781.0
KuCoin,"Smart Contract Platform, Ethereum Ecosystem, Layer 2 (L2), Zero Knowledge (ZK), Restaking, Zircuit Ecosystem",zircuit,88663466,403947871.0,35454.722468406726,32482.980947741667,0.02,29587850.0
KuCoin,"Artificial Intelligence (AI), Oracle, Ethereum Ecosystem, DePIN, Energi Ecosystem, Sora Ecosystem, GMCI DePIN Index, GMCI Index",iexec-rlc,88693385,106604501.0,9056.990124901155,19746.853818536736,0.23,14062469.0
KuCoin,"NFT, Ethereum Ecosystem",superrare,88470027,110536282.0,,,N/A,305907900.0
KuCoin,"Infrastructure, Smart Contract Platform, Decentralized Finance (DeFi), BNB Chain Ecosystem, Avalanche Ecosystem, Polygon Ecosystem, Fantom Ecosystem, Harmony Ecosystem, Arbitrum Ecosystem, Ethereum Ecosystem, DWF Labs Portfolio, Layer 3 (L3), Outlier Ventures Portfolio",orbs,88335682,193993551.0,10556.317014257926,9036.055436347886,0.1,6782308.0
KuCoin,"Cronos Ecosystem, Bridged USDT, Bridged-Tokens, Bridged Stablecoins",cronos-bridged-usdt-cronos,87699096,87699096.0,,,N/A,423295.0
KuCoin,"SocialFi, Coinbase Ventures Portfolio, Pantera Capital Portfolio, Andreessen Horowitz (a16z) Portfolio, Sequoia Capital Portfolio",deso,86060226,88317404.0,,,N/A,5935498.0
KuCoin,"Smart Contract Platform, Bitcoin Sidechains, Stacks Ecosystem, SideChain",sbtc-2,86212746,86212746.0,,,N/A,57014.0
KuCoin,"Decentralized Exchange (DEX), Decentralized Finance (DeFi), Arbitrum Ecosystem, Ethereum Ecosystem",tokenlon,86339239,103923623.0,,,N/A,48568.0
KuCoin,"Artificial Intelligence (AI), Smart Contract Platform, Gaming (GameFi), NFT, BNB Chain Ecosystem, Layer 1 (L1), Ethereum Ecosystem, Modular Blockchain, Chromia Ecosystem",chromaway,86148929,86158124.0,13571.767985738434,21225.824659414808,0.39,11335030.0
KuCoin,"Smart Contract Platform, Layer 1 (L1)",ong,86182325,211260668.0,,,N/A,2468621.0
KuCoin,"Stablecoins, USD Stablecoin, Ethereum Ecosystem, Sonic Ecosystem, Fiat-backed Stablecoin",frax-usd,86162461,86162461.0,,,N/A,1877885.0
KuCoin,"Crypto-Backed Tokens, Ethereum Ecosystem",temple,85954545,86123880.0,,,N/A,10481.54
KuCoin,"Polygon Ecosystem, XRP Ledger Ecosystem",crypto-trading-fund,85451241,85451241.0,,,N/A,9117.76
KuCoin,"Business Services, Polygon Ecosystem, Ethereum Ecosystem",request-network,85353801,110897371.0,11815.511071262597,13921.517511514834,0.16,5709281.0
KuCoin,BNB Chain Ecosystem,metfi-2,84577654,197996930.0,,,N/A,412199.0
KuCoin,"Smart Contract Platform, Polkadot Ecosystem, Layer 1 (L1), Coinbase Ventures Portfolio, Binance Labs Portfolio",moonbeam,84364599,102736795.0,8047.746584998028,18536.00483383552,0.23,5616630.0
KuCoin,"NFT, Solana Ecosystem, NFT Marketplace",tensor,84219529,251696673.0,80869.60732878388,74339.80354526675,0.12,14251869.0
KuCoin,"Decentralized Finance (DeFi), BNB Chain Ecosystem, Arbitrum Ecosystem, Ethereum Ecosystem, Multicoin Capital Portfolio, Energi Ecosystem",dforce-token,82652691,82652691.0,,,N/A,13260972.0
KuCoin,"Smart Contract Platform, Gaming (GameFi), NFT, Layer 1 (L1), Play To Earn, Ethereum Ecosystem, Animoca Brands Portfolio, Gaming Blockchains, Pantera Capital Portfolio, OKX Ventures Portfolio",wax,83651445,90006382.0,5334.762329480675,8514.735999080876,0.17,5640763.0
KuCoin,"Smart Contract Platform, Layer 2 (L2), eGirl Capital Portfolio, Paradigm Portfolio, Blast Ecosystem",blast,83417609,315097330.0,11807.515153762242,14183.915888779742,0.19,9779507.0
KuCoin,"Gaming (GameFi), Play To Earn, Ethereum Ecosystem, RPG, Alameda Research Portfolio, Circle Ventures Portfolio, OKX Ventures Portfolio, MMO",big-time,83490655,235181639.0,24438.504252692335,25612.379872183843,0.06,30554867.0
KuCoin,"Solana Ecosystem, Polygon Ecosystem, DePIN, Pantera Capital Portfolio",geodnet,83089812,259171152.0,,,N/A,266250.0
KuCoin,"Exchange-based Tokens, Centralized Exchange (CEX) Token, Ethereum Ecosystem",hashkey-ecopoints,83111304,627255124.0,71566.99763466886,68571.47797463549,0.24,4551341.0
KuCoin,"Artificial Intelligence (AI), BNB Chain Ecosystem, Solana Ecosystem, Ethereum Ecosystem, AI Agents, Alameda Research Portfolio",delysium,82802193,158042176.0,819.4545263158035,2912.284160599891,0.36,3150300.0
KuCoin,"BNB Chain Ecosystem, Liquid Staking Tokens",astherus-staked-bnb,82120482,82120221.0,,,N/A,226.18
KuCoin,Ethereum Ecosystem,dkargo,82430974,87942006.0,,,N/A,1233805.0
KuCoin,"Gaming (GameFi), NFT, BNB Chain Ecosystem, Metaverse, Collectibles, Polygon Ecosystem, Play To Earn, Harmony Ecosystem, Guild and Scholarship, Ethereum Ecosystem, Animoca Brands Portfolio, Base Ecosystem, DWF Labs Portfolio, Ronin Ecosystem, Gaming Governance Token, Andreessen Horowitz (a16z) Portfolio, Delphi Ventures Portfolio",yield-guild-games,82122848,200049106.0,12997.306880455237,25634.21597584843,0.1,15132486.0
KuCoin,"Decentralized Exchange (DEX), Decentralized Finance (DeFi), Yield Farming, Automated Market Maker (AMM), Solana Ecosystem, Coinbase Ventures Portfolio, DeFiance Capital Portfolio, Made in USA",orca,81129651,152280196.0,33076.45990415647,32251.22790810584,0.06,22662129.0
KuCoin,"Artificial Intelligence (AI), Infrastructure, Ethereum Ecosystem, AI Framework, Made in USA",arcblock,85271290,160889226.0,,,N/A,834508.0
KuCoin,"Artificial Intelligence (AI), Virtual Reality, Launchpad, Ethereum Ecosystem, Telegram Apps, Discord Bots, PAAL AI Launchpad, AI Agents, AI Applications, AI Agent Launchpad, Binance Alpha Spotlight, AI Framework, DeFAI, Made in USA",paal-ai,80731387,90810170.0,3505.0290659213315,6419.942135739878,0.55,14309063.0
KuCoin,"Berachain Ecosystem, Bridged USDT, Bridged-Tokens, Ink Ecosystem, Bridged Stablecoins",usdt0,80763332,80763332.0,,,N/A,232686.0
KuCoin,"Internet of Things (IOT), BNB Chain Ecosystem, Ethereum Ecosystem, DePIN, DWF Labs Portfolio",mass-vehicle-ledger,80307968,84887756.0,,,N/A,397649.0
KuCoin,"Exchange-based Tokens, Centralized Exchange (CEX) Token, Ethereum Ecosystem",bitmart-token,80172378,151035256.0,1437.991779601652,1433.3882090098264,0.13,4486346.0
KuCoin,"Gaming (GameFi), Play To Earn, Guild and Scholarship, Ethereum Ecosystem, Animoca Brands Portfolio, Base Ecosystem, DWF Labs Portfolio, Ronin Ecosystem, Coinbase Ventures Portfolio, DeFiance Capital Portfolio, Pantera Capital Portfolio, Binance Labs Portfolio, MMO",zentry,79716917,117028162.0,,,N/A,6389700.0
KuCoin,"Stablecoins, Decentralized Finance (DeFi), Lending/Borrowing Protocols, Ethereum Ecosystem",syrupusdc,79625684,79625848.0,,,N/A,5003.49
KuCoin,"Meme, Ethereum Ecosystem, PolitiFi",constitutiondao,79811850,79811850.0,24459.341721925593,54297.07248999221,0.13,32626479.0
KuCoin,"Stablecoins, USD Stablecoin, Solana Ecosystem, Ethereum Ecosystem, Multicoin Capital Portfolio, Fiat-backed Stablecoin",paxos-standard,79295563,79295563.0,4603.587583043898,173.91494356866815,0.63,2429266.0
KuCoin,"Blast Ecosystem, Bridged WETH, Bridged-Tokens",l2-standard-bridged-weth-blast,79288475,79288475.0,,,N/A,311252.0
KuCoin,"Exchange-based Tokens, Centralized Exchange (CEX) Token, Near Protocol Ecosystem, Harmony Ecosystem, Ethereum Ecosystem, Multicoin Capital Portfolio, Alameda Research Portfolio, Elastos Smart Contract Chain Ecosystem, Sequoia Capital Portfolio, Made in China",huobi-token,79113065,99780900.0,,,N/A,11398.11
KuCoin,"Smart Contract Platform, Privacy, Proof of Work (PoW), Made in USA",verge,79249261,79407783.0,,,N/A,5821173.0
KuCoin,BNB Chain Ecosystem,bitdca,78907281,84752701.0,,,N/A,79276.0
KuCoin,"Arbitrum Ecosystem, Bridge Governance Tokens, Base Ecosystem, Cross-chain Communication, OKX Ventures Portfolio",orbiter-finance,78288209,252542609.0,11531.090980518815,7340.399163200533,0.26,95814790.0
KuCoin,"Decentralized Finance (DeFi), Lending/Borrowing Protocols, Moonbeam Ecosystem, Base Ecosystem, Coinbase Ventures Portfolio, Made in USA",moonwell-artemis,78890571,120288396.0,9800.780998594993,3712.166503633779,0.01,23378056.0
KuCoin,"Artificial Intelligence (AI), Smart Contract Platform, Decentralized Finance (DeFi), Analytics, NFT, BNB Chain Ecosystem, Launchpad, Ethereum Ecosystem, Telegram Apps, Discord Bots, ChainGPT Launchpad, Poolz Finance Launchpad, AI Agents, AI Applications, Binance Alpha Spotlight, AI Framework, DeFAI",chaingpt,78342649,97266274.0,7098.659246841793,17709.218628344945,0.07,24239481.0
KuCoin,"Smart Contract Platform, Proof of Stake (PoS)",stratis,78215640,86180106.0,2567.543596830711,1851.1066564212251,0.83,762632.0
KuCoin,"Decentralized Finance (DeFi), Wallets, Ethereum Ecosystem, Pundi AIFX Omnilayer Ecosystem",pundi-x-2,77863474,77863474.0,1681.4679286848855,2011.962129796785,0.36,8505593.0
KuCoin,"Smart Contract Platform, Cosmos Ecosystem, Modular Blockchain, Osmosis Ecosystem, Rollups-as-a-Service (RaaS)",dymension,77827611,309545165.0,15576.89849262504,16514.6248144204,0.32,8458376.0
KuCoin,"Ethereum Ecosystem, Stablecoin Protocol",level-usd,77551653,77553284.0,,,N/A,910463.0
KuCoin,"Software as a service, Polygon Ecosystem, Ethereum Ecosystem, Decentralized Identifier (DID), Pantera Capital Portfolio, Energi Ecosystem, Blockchain Capital Portfolio",civic,77410455,96521763.0,14253.505171417948,17475.18997827517,0.31,8737219.0
KuCoin,"Stablecoins, USD Stablecoin, Osmosis Ecosystem, Fiat-backed Stablecoin",usdx,77456015,77456015.0,,,N/A,25272.0
KuCoin,"Optimism Ecosystem, Bridged WBTC, Bridged-Tokens",optimism-bridged-wbtc-optimism,76877424,76877424.0,,,N/A,1555479.0
KuCoin,"Smart Contract Platform, Layer 1 (L1), Osmosis Ecosystem, XRP Ledger Ecosystem",coreum,76669652,76669652.0,,,N/A,365618.0
KuCoin,"Business Services, Decentralized Finance (DeFi), Oracle, Polygon Ecosystem, Gnosis Chain Ecosystem, Arbitrum Ecosystem, Ethereum Ecosystem, Optimism Ecosystem, Manta Network Ecosystem, Binance Labs Portfolio, Lisk Ecosystem, Made in USA",tellor,76070835,78284411.0,9690.66555173843,37867.49318172948,0.05,25433226.0
KuCoin,"NFT, Polygon Ecosystem",sathosi-airlines-token,72439797,345963532.0,,,N/A,14010.04
KuCoin,"Sports, BNB Chain Ecosystem",pixer-eternity,75539772,351040487.0,,,N/A,370346.0
KuCoin,"Decentralized Finance (DeFi), Liquid Staking Tokens, Ethereum Ecosystem, LSDFi, Liquid Staked ETH, Liquid Staking",origin-ether,75279162,75279162.0,,,N/A,57082.0
KuCoin,"BNB Chain Ecosystem, Solana Ecosystem, Polygon Ecosystem, Meme, Ethereum Ecosystem, Cronos Ecosystem, Dog-Themed, Elon Musk-Inspired, Fuse Ecosystem",dogelon-mars,74967838,136391961.0,5655.115289110175,17573.308596961193,0.44,6686529.0
KuCoin,"Artificial Intelligence (AI), BNB Chain Ecosystem, Ethereum Ecosystem, DragonFly Capital Portfolio, Binance Labs Portfolio, Delphi Ventures Portfolio, OKX Ventures Portfolio, Binance HODLer Airdrops, AI Agent Launchpad, Binance Alpha Spotlight, AI Framework",myshell,74761354,276893903.0,15056.286140533633,28097.446320543153,0.11,48564337.0
KuCoin,"Entertainment, Gaming (GameFi), NFT, Axie Infinity Ecosystem, Play To Earn, Ethereum Ecosystem, Ronin Ecosystem, Gaming Utility Token",smooth-love-potion,74267438,74267438.0,5176.268233857109,9133.42504727318,0.28,9161538.0
KuCoin,"Smart Contract Platform, Wallets, Layer 2 (L2), Osmosis Ecosystem",islamic-coin,74353152,898148108.0,455.26931249861826,910.8193608631392,0.36,842151.0
KuCoin,"Smart Contract Platform, Gaming (GameFi), Layer 1 (L1), Proof of Stake (PoS), Gaming Blockchains",oasys,74035228,191869137.0,512.1623376849393,1818.1536346215341,1.87,610734.0
KuCoin,"Optimism Ecosystem, Bridged WETH, Bridged-Tokens",l2-standard-bridged-weth-optimism,74023033,74071510.0,,,N/A,25641716.0
KuCoin,Retail,milk-alliance,73970273,165726648.0,182.79121254450803,755.3399806451323,0.58,5571097.0
KuCoin,Smart Contract Platform,songbird,73868887,87768055.0,,,N/A,396978.0
KuCoin,"Meme, Ethereum Ecosystem, Mantle Ecosystem",puff-the-dragon,73457379,73457379.0,,,N/A,65050.0
KuCoin,"Gaming (GameFi), Play To Earn, TON Ecosystem, Tap to Earn, Arcade Games",watcoin-2,73064130,81114347.0,,,N/A,947453.0
KuCoin,"Artificial Intelligence (AI), Decentralized Finance (DeFi), Ethereum Ecosystem, DePIN",pinlink,75198009,93997511.0,,,N/A,1745072.0
KuCoin,"Decentralized Exchange (DEX), Decentralized Finance (DeFi), Yield Farming, Automated Market Maker (AMM), BNB Chain Ecosystem, Avalanche Ecosystem, Arbitrum Ecosystem, Mantle Ecosystem, DeFiance Capital Portfolio, Delphi Ventures Portfolio, Dex Aggregator",joe,72239850,92511667.0,,,N/A,8618384.0
KuCoin,"Decentralized Finance (DeFi), Solana Ecosystem, Real World Assets (RWA), Payment Solutions, DePIN, Coinbase Ventures Portfolio, Alameda Research Portfolio, Circle Ventures Portfolio, OKX Ventures Portfolio, RWA Protocol, Made in USA",zebec-network,73455982,99132389.0,6409.048064228068,4791.515293200841,0.32,35542991.0
KuCoin,"Decentralized Finance (DeFi), Ethereum Ecosystem",elixir-finance,71634967,448674273.0,,,N/A,45626440.0
KuCoin,"Artificial Intelligence (AI), Decentralized Finance (DeFi), Solana Ecosystem, Arbitrum Ecosystem, Metis Ecosystem, AI Agents, Sonic Ecosystem, IOTA EVM Ecosystem, AI Applications, DeFAI",heyanon,71561020,117865958.0,,,N/A,4336898.0
KuCoin,"Smart Contract Platform, Polkadot Ecosystem, Layer 1 (L1), DePIN, Outlier Ventures Portfolio",peaq-2,71684248,422612367.0,27067.31941690535,32681.65866249069,0.2,12964837.0
KuCoin,"Ethereum Ecosystem, DePIN",dent,71491809,74739260.0,3798.1574014324055,7504.943192565348,0.25,6002944.0
KuCoin,"Decentralized Exchange (DEX), Exchange-based Tokens, Decentralized Finance (DeFi), BNB Chain Ecosystem, Binance Launchpool, Polygon Ecosystem, Near Protocol Ecosystem, Arbitrum Ecosystem, Ethereum Ecosystem, DWF Labs Portfolio, Coinbase Ventures Portfolio, Alameda Research Portfolio, DeFiance Capital Portfolio, Pantera Capital Portfolio, Aurora Ecosystem, Energi Ecosystem, Binance Labs Portfolio, Galaxy Digital Portfolio",dodo,71071103,71071103.0,2477.4296256660805,5604.0553813553,0.56,4577320.0
KuCoin,"Decentralized Finance (DeFi), Lending/Borrowing Protocols, Ethereum Ecosystem, Real World Assets (RWA), Coinbase Ventures Portfolio, Andreessen Horowitz (a16z) Portfolio, RWA Protocol, Made in USA",goldfinch,71072974,87913310.0,,,N/A,614169.0
KuCoin,"Smart Contract Platform, Gaming (GameFi), NFT, Binance Launchpool, Arbitrum Ecosystem, Layer 3 (L3), XAI Ecosystem, Gaming Blockchains, Outlier Ventures Portfolio",xai-blockchain,70813436,104344902.0,12621.962579273746,24968.92292303013,1.49,28975828.0
KuCoin,"Decentralized Finance (DeFi), Oracle, Ethereum Ecosystem, DWF Labs Portfolio, Pantera Capital Portfolio",api3,70711494,88244858.0,8522.349282262649,14875.134385545813,0.22,14578398.0
KuCoin,"Gaming (GameFi), NFT, Collectibles, Play To Earn, Ethereum Ecosystem, Base Ecosystem, Energi Ecosystem",ecomi,70792330,81225181.0,,,N/A,2049012.0
KuCoin,"Artificial Intelligence (AI), Ethereum Ecosystem",0x0-ai-ai-smart-contract,70452154,70452154.0,,,N/A,180764.0
KuCoin,"Stablecoins, Decentralized Finance (DeFi), USD Stablecoin, BNB Chain Ecosystem, Polygon Ecosystem, Gnosis Chain Ecosystem, Arbitrum Ecosystem, Ethereum Ecosystem, Optimism Ecosystem, Base Ecosystem, Crypto-backed Stablecoin, Fiat-backed Stablecoin",crvusd,70437427,70437447.0,,,N/A,7362712.0
KuCoin,"Artificial Intelligence (AI), Cardano Ecosystem, Ethereum Ecosystem, AI Agents, Sora Ecosystem",singularitynet,70067785,105886444.0,,,N/A,41450.0
KuCoin,"Decentralized Finance (DeFi), Ethereum Ecosystem, Binance Alpha Spotlight",avalon-2,69652230,429289553.0,,,N/A,68414038.0
KuCoin,"Stablecoins, USD Stablecoin, Seigniorage, Alleged SEC Securities, Osmosis Ecosystem, Stablecoin Protocol, DeFiance Capital Portfolio, Terra Classic Ecosystem, Binance Labs Portfolio, Delphi Ventures Portfolio, Galaxy Digital Portfolio, Fiat-backed Stablecoin",terrausd,70211946,99473658.0,13852.595368684897,16595.079515296224,0.24,7115554.0
KuCoin,"Artificial Intelligence (AI), Business Services, Decentralized Finance (DeFi), Ethereum Ecosystem, Paradigm Portfolio, DragonFly Capital Portfolio, Energi Ecosystem",numeraire,69589375,93184053.0,4084.211072631624,8796.828444387618,0.21,7551267.0
KuCoin,"Tokenized Assets, Polygon Ecosystem, Arbitrum Ecosystem, Ethereum Ecosystem, Real World Assets (RWA), Starknet Ecosystem, Tokenized Treasury Bills (T-Bills)",spiko-us-t-bills-money-market-fund,69588146,69588146.0,,,N/A,0.0
KuCoin,"Artificial Intelligence (AI), Smart Contract Platform, Layer 1 (L1), Ethereum Ecosystem, Osmosis Ecosystem, AI Agents, AI Agent Launchpad",humans-ai,69502330,69502330.0,637.7964387854508,2977.90812604185,0.56,390076.0
KuCoin,"Meme, Dog-Themed, TON Ecosystem, TON Meme",dogs-2,69651363,74133042.0,34863.12134918911,36594.03389329499,0.15,15223089.0
KuCoin,"Lending/Borrowing Protocols, Solana Ecosystem, FTX Holdings, Coinbase Ventures Portfolio, Alameda Research Portfolio, DragonFly Capital Portfolio",solend,69360419,137087973.0,,,N/A,2634.55
KuCoin,"Decentralized Finance (DeFi), Lending/Borrowing Protocols, Arbitrum Ecosystem, Ethereum Ecosystem, Alameda Research Portfolio, Pantera Capital Portfolio",liquity,69241399,71153535.0,1399.2958619368535,868.1501379908035,0.22,13794592.0
KuCoin,"Decentralized Finance (DeFi), Lending/Borrowing Protocols, Solana Ecosystem, Binance Alpha Spotlight",kamino,69015079,511222805.0,203193.8338192211,190954.7578849987,0.06,7101383.0
KuCoin,"NFT, BNB Chain Ecosystem, Solana Ecosystem, Meme, Ethereum Ecosystem, Base Ecosystem, Hybrid Token Standards, Wojak-Themed",non-playable-coin,67428265,67428265.0,10069.285003863897,16218.47264316202,0.6,5972650.0
KuCoin,"Solana Ecosystem, Restaking, Liquid Restaking Tokens, Liquid Restaked SOL",renzo-restaked-sol,68056618,68056618.0,,,N/A,2105629.0
KuCoin,"Stablecoins, Decentralized Finance (DeFi), USD Stablecoin, BNB Chain Ecosystem, Avalanche Ecosystem, Arbitrum Ecosystem, Liquid Staking Tokens, Ethereum Ecosystem, Optimism Ecosystem, Fiat-backed Stablecoin",staked-frax,67882305,67882305.0,,,N/A,69.75
KuCoin,"Decentralized Finance (DeFi), Ethereum Ecosystem, Restaking",kelp-gain,67425396,67427390.0,,,N/A,36349.0
KuCoin,"Solana Ecosystem, Wallets, Base Ecosystem, TON Ecosystem",bitget-wallet-token,67182897,470072637.0,,,N/A,3631.06
KuCoin,"Smart Contract Platform, Ethereum Ecosystem, Layer 2 (L2), Zero Knowledge (ZK), Rollup, OKX Ventures Portfolio",taiko,67215663,635636395.0,24676.726416449954,41726.3758616685,0.16,14966421.0
KuCoin,"Smart Contract Platform, Layer 1 (L1), DWF Labs Portfolio, Radix Ecosystem",radix,67196172,82280829.0,5783.697636434392,4182.956009752898,0.32,1214289.0
KuCoin,"Smart Contract Platform, Binance Launchpool, Layer 2 (L2), Scroll Ecosystem",scroll,66723450,351176054.0,60248.91259069186,37768.067713389464,0.11,18762428.0
KuCoin,"Smart Contract Platform, Layer 1 (L1), Proof of Work (PoW), Privacy Blockchain",ergo,66553524,81253436.0,1590.1232188861939,5267.839853301318,0.48,97386.0
KuCoin,Ethereum Ecosystem,saasgo,66443726,83054658.0,,,N/A,294282.0
KuCoin,"Artificial Intelligence (AI), Marketing, Analytics, BNB Chain Ecosystem, Ethereum Ecosystem, Animoca Brands Portfolio, Base Ecosystem, AI Agents, Binance Alpha Spotlight",cookie,66388443,147765670.0,12159.351346912897,14562.124812745871,0.26,19607086.0
KuCoin,"Artificial Intelligence (AI), Launchpad, Base Ecosystem, AI Applications, Clanker Ecosystem, Binance Alpha Spotlight",tokenbot-2,66430453,66430453.0,,,N/A,5876329.0
KuCoin,E-commerce,pay-coin,66255406,123105977.0,,,N/A,2932713.0
KuCoin,SocialFi,steem,65908159,65956526.0,,,N/A,12455393.0
KuCoin,"Decentralized Exchange (DEX), Decentralized Finance (DeFi), Sui Ecosystem, Animoca Brands Portfolio, OKX Ventures Portfolio, Dex Aggregator",cetus-protocol,65572718,96040489.0,18896.426275796373,23621.764133377532,0.16,12276520.0
KuCoin,"Artificial Intelligence (AI), Solana Ecosystem, DePIN",nosana,65235614,78220161.0,,,N/A,952052.0
KuCoin,"Polkadot Ecosystem, Real World Assets (RWA), Coinbase Ventures Portfolio, Circle Ventures Portfolio, Galaxy Digital Portfolio, RWA Protocol",centrifuge,65102591,71341895.0,733.6528930970288,600.0806152041355,0.47,1015544.0
KuCoin,"Decentralized Finance (DeFi), BNB Chain Ecosystem, Solana Ecosystem, Wallets, Polygon Ecosystem, Ethereum Ecosystem, Binance Launchpad, DWF Labs Portfolio, Multicoin Capital Portfolio, Alameda Research Portfolio, Viction Ecosystem, Binance Labs Portfolio",coin98,64939342,72088088.0,6644.636075519431,8867.273414064262,0.28,17886596.0
KuCoin,"Healthcare, Osmosis Ecosystem",medibloc,64876584,70270326.0,,,N/A,343517.0
KuCoin,"BNB Chain Ecosystem, Binance Megadrop, BTCfi",solv-protocol,64502149,365451271.0,40148.17389176836,98650.9473510985,0.21,67777152.0
KuCoin,"Stablecoins, USD Stablecoin, Fiat-backed Stablecoin",falcon-finance,64443158,64443158.0,,,N/A,51838.0
KuCoin,"Artificial Intelligence (AI), BNB Chain Ecosystem, Ethereum Ecosystem, DePIN, AI Agents",netmind-token,64287356,204509669.0,,,N/A,1880986.0
KuCoin,"Smart Contract Platform, Layer 1 (L1), Ethereum Ecosystem, Proof of Stake (PoS)",pundi-aifx,63785589,63786595.0,,,N/A,400536.0
KuCoin,"Base Ecosystem, Cybersecurity, Binance Labs Portfolio, OKX Ventures Portfolio, Binance Alpha Spotlight",goplus-security,64162092,353822057.0,15623.289590180357,29940.15002758777,0.06,24064437.0
KuCoin,"Infrastructure, Smart Contract Platform, BNB Chain Ecosystem, Avalanche Ecosystem, Polygon Ecosystem, Arbitrum Ecosystem, Ethereum Ecosystem, Optimism Ecosystem, Layer 2 (L2), Base Ecosystem, Binance Launchpad, Modular Blockchain, Layer 3 (L3), Rollup, Proof of Stake (PoS), Appchains, Binance Labs Portfolio",cartesi,64053710,74538199.0,6899.375249778541,11358.63331671143,0.27,8103476.0
KuCoin,,ark,62657187,63200399.0,,,N/A,7651565.0
KuCoin,"Smart Contract Platform, Layer 2 (L2), Made in USA",metal,62387270,62387270.0,6702.508832629344,8422.792087765634,0.15,442195.0
KuCoin,Ethereum Ecosystem,devve,62438966,85738418.0,,,N/A,1148454.0
KuCoin,"SocialFi, Solana Ecosystem",access-protocol,61391638,133284518.0,3942.8107505189623,4188.122739361006,0.48,889405.0
KuCoin,"Artificial Intelligence (AI), Solana Ecosystem, Polygon Ecosystem, Gnosis Chain Ecosystem, Arbitrum Ecosystem, Celo Ecosystem, Ethereum Ecosystem, Optimism Ecosystem, Base Ecosystem, AI Agents, Mode Ecosystem, AI Agent Launchpad, Binance Alpha Spotlight, AI Framework, DeFAI",autonolas,61181002,178956773.0,,,N/A,293208.0
KuCoin,"Decentralized Finance (DeFi), Ethereum Ecosystem, Liquid Staking",usualx,60548738,60548738.0,,,N/A,294652.0
KuCoin,"Stablecoins, USD Stablecoin, Ethereum Ecosystem, Fiat-backed Stablecoin",binance-usd,60425473,60425473.0,,,N/A,4172.21
KuCoin,"Exchange-based Tokens, BNB Chain Ecosystem, Centralized Exchange (CEX) Token, Polygon Ecosystem, Ethereum Ecosystem",bit2me,60323473,60932801.0,,,N/A,76128.0
KuCoin,"Infrastructure, Smart Contract Platform",ardor,60398984,60398984.0,,,N/A,5915621.0
KuCoin,"Artificial Intelligence (AI), Infrastructure, Gaming (GameFi), NFT, Solana Ecosystem, Arbitrum Ecosystem, Impossible Finance Launchpad, Ethereum Ecosystem, Animoca Brands Portfolio, Base Ecosystem",carv,60369960,301713775.0,10781.788873131927,10634.791802240465,0.37,8494889.0
KuCoin,"Smart Contract Platform, Layer 1 (L1), Proof of Work (PoW), Made in USA",quai-network,59967650,373329476.0,,,N/A,6294226.0
KuCoin,"Stablecoins, USD Stablecoin, Arbitrum Ecosystem, Ethereum Ecosystem, Fiat-backed Stablecoin",lift-dollar,60173248,60173248.0,,,N/A,626915.0
