KuCoin,"Smart Contract Platform, Decentralized Finance (DeFi), Coinbase Ventures Portfolio, DeFiance Capital Portfolio, Pantera Capital Portfolio, Binance Labs Portfolio, Galaxy Digital Portfolio",terra-luna,339838419,405623118.0,9672.037811779046,51930.95522828505,0.13,11424117.0
KuCoin,"Solana Ecosystem, Meme, Ethereum Ecosystem, Base Ecosystem, Murad Picks, Stock market-themed",spx6900,332822767,332822767.0,11683.587342211638,45958.83924802961,0.03,20831782.0
KuCoin,"Smart Contract Platform, Gaming (GameFi), NFT, BNB Chain Ecosystem, Binance Launchpool, Avalanche Ecosystem, Ethereum Ecosystem, DWF Labs Portfolio, Gaming Blockchains, Avalanche L1",beam-2,328840088,382568662.0,,,N/A,24352060.0
KuCoin,"Mantle Ecosystem, Bridged USDT, Bridged-Tokens, Bridged Stablecoins",mantle-bridged-usdt-mantle,327496796,327496796.0,,,N/A,678822.0
KuCoin,"Stablecoins, USD Stablecoin, BNB Chain Ecosystem, Avalanche Ecosystem, Polygon Ecosystem, Optimism Ecosystem, Fiat-backed Stablecoin, Binance-Peg Tokens",binance-peg-busd,323737646,323737646.0,,,N/A,7491011.0
KuCoin,"Decentralized Exchange (DEX), Smart Contract Platform, Decentralized Finance (DeFi), Prediction Markets, Layer 1 (L1), Gnosis Chain Ecosystem, MEV Protection, Arbitrum Ecosystem, Ethereum Ecosystem, SideChain, Energi Ecosystem",gnosis,321229006,372138984.0,,,N/A,25199691.0
KuCoin,"Meme, Base Ecosystem, Frog-Themed, Base Meme, The Boy’s Club",based-brett,321124531,321124531.0,24992.096610071974,29643.58286388271,0.06,28444241.0
KuCoin,"Smart Contract Platform, Zero Knowledge (ZK), FTX Holdings, Paradigm Portfolio, Coinbase Ventures Portfolio, Multicoin Capital Portfolio, Proof of Stake (PoS), Pantera Capital Portfolio, Circle Ventures Portfolio, Privacy Blockchain, Polychain Capital Portfolio, Made in USA, Coinbase 50 Index",mina-protocol,316500889,316502196.0,25831.82589747096,23262.58071613273,0.23,15562523.0
KuCoin,"Yield Aggregator, Ethereum Ecosystem, Binance Labs Portfolio, Polychain Capital Portfolio",stakestone-berachain-vault-token,306290894,306290894.0,,,N/A,1322452.0
KuCoin,"Decentralized Finance (DeFi), Arbitrum Ecosystem, Ethereum Ecosystem, Real World Assets (RWA), Base Ecosystem, Coinbase Ventures Portfolio, Energi Ecosystem, Made in USA",reserve-rights-token,307211787,549576412.0,16414.190546009682,87228.19017887254,0.07,23219676.0
KuCoin,"Smart Contract Platform, Layer 1 (L1), MEV Protection, Proof of Work (PoW), Privacy Blockchain",verus-coin,305187972,305202865.0,,,N/A,8725.75
KuCoin,"Smart Contract Platform, Layer 1 (L1), Ethereum Ecosystem, Real World Assets (RWA), RWA Protocol, Made in USA",plume,304833460,1524167299.0,32592.301409701697,67238.29028227048,0.14,50817893.0
KuCoin,"Solana Ecosystem, Meme, Solana Meme, AI Meme, Pump.fun Ecosystem, Terminal of Truths, Binance Alpha Spotlight",fartcoin,299712034,299712034.0,80448.78137838005,105452.68198507576,0.07,141112691.0
KuCoin,"Decentralized Finance (DeFi), Lending/Borrowing Protocols, Ethereum Ecosystem, Base Ecosystem, Coinbase Ventures Portfolio, Pantera Capital Portfolio, Morpho Ecosystem, Binance Alpha Spotlight",morpho,302131653,1279957396.0,42240.94931127841,37817.83794262184,0.08,13025577.0
KuCoin,"Artificial Intelligence (AI), Ethereum Ecosystem, DePIN, Energi Ecosystem, GMCI DePIN Index, GMCI Index",golem,298188358,298188358.0,899.2753408687722,1917.8257667562034,0.83,33284772.0
KuCoin,"Artificial Intelligence (AI), Smart Contract Platform, Storage, BNB Chain Ecosystem, Layer 1 (L1), Ethereum Ecosystem, DePIN, DWF Labs Portfolio, Osmosis Ecosystem, GMCI DePIN Index, GMCI Index",aioz-network,300946905,305021170.0,12682.056790945937,31871.09723164586,0.19,10544776.0
KuCoin,"Decentralized Finance (DeFi), Tron Ecosystem",just,297078965,297078965.0,29997.07740713553,29405.507347322127,0.2,12659125.0
KuCoin,"Solana Ecosystem, Arbitrum Ecosystem, Impossible Finance Launchpad, Ethereum Ecosystem, DePIN, Animoca Brands Portfolio",aethir,286911404,1525482557.0,141333.38165204434,157768.04756790423,0.14,32212709.0
KuCoin,"Polygon Ecosystem, Bridged WETH, Bridged-Tokens",polygon-pos-bridged-weth-polygon-pos,285569625,285569818.0,,,N/A,15312856.0
KuCoin,"Decentralized Exchange (DEX), Exchange-based Tokens, Decentralized Finance (DeFi), Yield Farming, Derivatives, Synthetic Issuer, Avalanche Ecosystem, Polygon Ecosystem, Near Protocol Ecosystem, Fantom Ecosystem, Harmony Ecosystem, Ethereum Ecosystem, Optimism Ecosystem, Base Ecosystem, DWF Labs Portfolio, Paradigm Portfolio, Coinbase Ventures Portfolio, Index Coop Defi Index, Energi Ecosystem, Huobi ECO Chain Ecosystem, GMCI DeFi Index, Synthetic, Index Coop Index, GMCI Index, Coinbase 50 Index",havven,282173914,282526050.0,10024.916733359947,15366.774891918978,0.24,23384040.0
KuCoin,"Crypto-Backed Tokens, Wrapped-Tokens, Polygon Ecosystem, Arbitrum Ecosystem, Liquid Staking Tokens, Ethereum Ecosystem, Optimism Ecosystem, Base Ecosystem, Liquid Staked ETH, Liquid Staking",coinbase-wrapped-staked-eth,280970934,781577350.0,,,N/A,5361538.0
KuCoin,"Smart Contract Platform, Privacy, Masternodes, Alleged SEC Securities, Proof of Stake (PoS), Proof of Work (PoW), Made in USA",dash,274824200,274847132.0,17266.80926440418,22112.58743723414,0.18,28939490.0
KuCoin,"Infrastructure, Ethereum Ecosystem, Data Availability, Restaking, Polychain Capital Portfolio, Made in USA",eigenlayer,275446694,1930490636.0,34703.48641726031,48819.657512206126,0.13,38358583.0
KuCoin,"Decentralized Exchange (DEX), Exchange-based Tokens, Decentralized Finance (DeFi), Automated Market Maker (AMM), BNB Chain Ecosystem, Avalanche Ecosystem, Polygon Ecosystem, Near Protocol Ecosystem, Harmony Ecosystem, Ethereum Ecosystem, FTX Holdings, Alameda Research Portfolio, DragonFly Capital Portfolio, Pantera Capital Portfolio, Energi Ecosystem, Binance Labs Portfolio, GMCI DeFi Index, Galaxy Digital Portfolio, Blockchain Capital Portfolio, Dex Aggregator, GMCI Index, Coinbase 50 Index",1inch,274158551,298575108.0,36835.012680894695,50293.065580846975,0.14,21026509.0
KuCoin,"Liquid Staking Tokens, Ethereum Ecosystem, Liquid Staking",stader-ethx,271438256,271438292.0,,,N/A,107859.0
KuCoin,"Polygon Ecosystem, Bridged WBTC, Bridged-Tokens",polygon-bridged-wbtc-polygon-pos,270121777,270121777.0,,,N/A,7360800.0
KuCoin,"BNB Chain Ecosystem, Wallets, Ethereum Ecosystem, Animoca Brands Portfolio, Binance Launchpad, Energi Ecosystem, Binance Labs Portfolio",safepal,268999086,268999086.0,14254.238504790435,17813.301890522027,0.06,9562725.0
KuCoin,"Smart Contract Platform, Ethereum Ecosystem, Real World Assets (RWA), DWF Labs Portfolio, Proof of Stake (PoS)",creditcoin-2,268659478,371062913.0,32635.344623099427,30160.856278608127,0.15,23327909.0
KuCoin,"Smart Contract Platform, Polkadot Ecosystem, Proof of Stake (PoS), Pantera Capital Portfolio, Made in USA, Coinbase 50 Index",kusama,267506847,267520629.0,12518.29496249279,22456.979388848635,0.18,12611929.0
KuCoin,"Smart Contract Platform, Gaming (GameFi), NFT, Layer 1 (L1), Play To Earn, Gaming Blockchains, WEMIX Ecosystem",wemix-token,247566231,318337624.0,902.1337982453175,208.13622704086515,0.61,5796702.0
KuCoin,"Stablecoins, USD Stablecoin, Ethereum Ecosystem, Fiat-backed Stablecoin",elixir-deusd,264141136,262890657.0,,,N/A,5601022.0
KuCoin,"Smart Contract Platform, DePIN, Proof of Stake (PoS), Made in USA",theta-fuel,263955847,263998081.0,9485.75385639116,13526.277504770082,0.31,3016024.0
KuCoin,"Exchange-based Tokens, Centralized Exchange (CEX) Token, Ethereum Ecosystem, Morph L2 Ecosystem",mx-token,262069017,1154739673.0,,,N/A,25097640.0
KuCoin,"Decentralized Finance (DeFi), Ethereum Ecosystem, Restaking, Liquid Restaking Tokens, Liquid Staking",ether-fi-staked-btc,259916655,259916737.0,,,N/A,536118.0
KuCoin,"BRC-20, Bitcoin Ecosystem, Inscriptions",sats-ordinals,258857366,258857366.0,6535.3720446092775,18629.1370956964,0.08,8382405.0
KuCoin,"Crypto-Backed Tokens, Decentralized Finance (DeFi), cToken, Ethereum Ecosystem",compound-wrapped-btc,258132990,258132990.0,,,N/A,0.0
KuCoin,"Decentralized Finance (DeFi), Solana Ecosystem, LSDFi, Restaking, Stablecoin Protocol, Binance Labs Portfolio, Binance HODLer Airdrops, Polychain Capital Portfolio",solayer,256745201,1222596195.0,37497.33644389551,67862.84983489827,0.16,147779853.0
KuCoin,"Solana Ecosystem, Arbitrum Ecosystem, Ethereum Ecosystem, Interoperability, Base Ecosystem, Multicoin Capital Portfolio, Cross-chain Communication, Made in USA",wormhole,258228833,889402094.0,125870.63856619547,127092.14716779003,0.11,31697087.0
KuCoin,"Smart Contract Platform, Layer 2 (L2), Zero Knowledge (ZK), ZkSync Ecosystem, Consensys Portfolio, Blockchain Capital Portfolio, OKX Ventures Portfolio",zksync,254170915,1452405231.0,10390.159355557174,25616.09241850614,0.14,43139130.0
KuCoin,"Meme, Cardano Ecosystem",snek,251379447,254587418.0,,,N/A,1556772.0
KuCoin,"Arbitrum Ecosystem, Liquid Staking Tokens, Ethereum Ecosystem, Liquid Staking",sweth,252433598,252440637.0,,,N/A,359895.0
KuCoin,"Stablecoins, Tokenized Assets, Tokenized Gold, BNB Chain Ecosystem, Real World Assets (RWA), Tokenized Commodities, Commodity-backed Stablecoin",quorium,250744116,250744116.0,,,N/A,83044.0
KuCoin,"Decentralized Finance (DeFi), BNB Chain Ecosystem, Polygon Ecosystem, Fantom Ecosystem, Arbitrum Ecosystem, Moonbeam Ecosystem, Liquid Staking Tokens, Ethereum Ecosystem, Optimism Ecosystem, Polygon zkEVM Ecosystem, Liquid Staking, Made in USA",frax-ether,250132938,250036778.0,,,N/A,420249.0
KuCoin,"Smart Contract Platform, BNB Chain Ecosystem, GMCI Layer 1 Index, GMCI Index, Made in China",zilliqa,239243155,247558566.0,75963.17873228558,93471.87691672285,0.16,13484441.0
KuCoin,"Analytics, Avalanche Ecosystem, Meme, Cat-Themed, Made in USA",ket,238814735,238814735.0,,,N/A,8685456.0
KuCoin,"Smart Contract Platform, Polkadot Ecosystem, Layer 1 (L1), Layer 2 (L2), Alameda Research Portfolio, Binance Labs Portfolio, OKX Ventures Portfolio",astar,237782504,261442400.0,41734.35530203729,48553.890769627586,0.1,6321534.0
KuCoin,"Bridged USDC, Sonic Ecosystem, Bridged-Tokens, Bridged Stablecoins",sonic-bridged-usdc-e-sonic,237376947,239784046.0,,,N/A,46128514.0
KuCoin,"NFT, Ethereum Ecosystem, NFT Marketplace, FTX Holdings, NFTFi, eGirl Capital Portfolio, Paradigm Portfolio, GMCI DeFi Index, GMCI Index, Made in USA, Coinbase 50 Index",blur,235441063,314503119.0,19095.775092189186,35634.60172445118,0.29,18208528.0
KuCoin,"Stablecoins, USD Stablecoin, BNB Chain Ecosystem, Avalanche Ecosystem, Near Protocol Ecosystem, Arbitrum Ecosystem, Ethereum Ecosystem, Tron Ecosystem, BitTorrent Ecosystem, Algorithmic Stablecoin, Fiat-backed Stablecoin",usdd,233130018,233083729.0,50790.21327359064,49478.44582945462,0.39,2920608.0
KuCoin,"Decentralized Finance (DeFi), Liquid Staking Tokens, Base Ecosystem, Liquid Staked ETH, Liquid Staking",super-oeth,231923082,231923082.0,,,N/A,839730.0
KuCoin,"Infrastructure, Wallets, Gnosis Chain Ecosystem, Ethereum Ecosystem",safe,228599535,412905628.0,4601.439677196567,12136.433676710598,0.1,14153688.0
KuCoin,"Smart Contract Platform, Proof of Stake (PoS), Made in China",qtum,227802451,232683173.0,21611.332959185973,12109.269539085417,0.23,19869459.0
KuCoin,"Smart Contract Platform, Interoperability, Layer 2 (L2), Rollup, Multicoin Capital Portfolio, Proof of Work (PoW), DragonFly Capital Portfolio, Sequoia Capital Portfolio, Blockchain Capital Portfolio, Polychain Capital Portfolio, Made in China",nervos-network,224381618,227923882.0,29912.582287874153,35990.58907739045,0.14,14341574.0
KuCoin,"Infrastructure, Decentralized Finance (DeFi), Sui Ecosystem",deep,225296027,901184107.0,177573.42159633746,123506.01651578958,0.18,15596674.0
KuCoin,"Decentralized Exchange (DEX), Exchange-based Tokens, Decentralized Finance (DeFi), Derivatives, Perpetuals, Ethereum Ecosystem, Paradigm Portfolio",dydx,223249269,223249269.0,,,N/A,14014335.0
KuCoin,"Solana Ecosystem, Avalanche Ecosystem, Polygon Ecosystem, Near Protocol Ecosystem, Harmony Ecosystem, Ethereum Ecosystem, Pantera Capital Portfolio, Energi Ecosystem, Made in USA",basic-attention-token,223233821,223880334.0,6138.455688018488,10455.529543378063,0.13,13566345.0
KuCoin,"Gaming (GameFi), Binance Launchpool, Meme, Play To Earn, TON Ecosystem, TON Meme, Tap to Earn",notcoin,222001840,222001840.0,46611.72920246456,75235.25115666518,0.05,110627995.0
KuCoin,"BNB Chain Ecosystem, Polygon Ecosystem, Ethereum Ecosystem, Animoca Brands Portfolio, DWF Labs Portfolio, Alameda Research Portfolio, Energi Ecosystem, Binance Labs Portfolio",mask-network,217244296,217244296.0,47186.701834935004,67263.018187209,0.09,30884069.0
KuCoin,"Layer 1 (L1), VeChain Ecosystem",vethor-token,213662168,213691823.0,7087.515669512937,47399.43873765087,0.49,4378800.0
KuCoin,"Decentralized Exchange (DEX), Decentralized Finance (DeFi), Avalanche Ecosystem, Harmony Ecosystem, Ethereum Ecosystem, Coinbase Ventures Portfolio, Pantera Capital Portfolio, Energi Ecosystem, GMCI DeFi Index, Blockchain Capital Portfolio, GMCI Index, Made in USA",0x,213301740,251417496.0,15465.956718976087,18281.48101071351,0.2,27081921.0
KuCoin,"Smart Contract Platform, BNB Chain Ecosystem, Layer 1 (L1), Proof of Stake (PoS), Pantera Capital Portfolio, Andreessen Horowitz (a16z) Portfolio, Binance Labs Portfolio, Blockchain Capital Portfolio, Privacy Blockchain, Polychain Capital Portfolio, Coinbase 50 Index",oasis-network,213162227,316743969.0,21869.795564365602,55407.94876428216,0.16,10199458.0
KuCoin,"Artificial Intelligence (AI), Polkadot Ecosystem, Metaverse, Ethereum Ecosystem, Interoperability, Real World Assets (RWA), DePIN, Decentralized Science (DeSci), AI Agents",origintrail,205302805,205592678.0,23683.81126253168,25142.26458520493,0.02,8236737.0
KuCoin,"Artificial Intelligence (AI), Harmony Ecosystem, Arbitrum Ecosystem, Ethereum Ecosystem, DePIN, Coinbase Ventures Portfolio, Multicoin Capital Portfolio, Pantera Capital Portfolio, GMCI DePIN Index, GMCI Index, Coinbase 50 Index",livepeer,208536418,208536418.0,35293.08115431972,36701.73129239317,0.1,23485431.0
KuCoin,"Decentralized Finance (DeFi), Aptos Ecosystem",abtc,208305741,208305741.0,,,N/A,121754.0
KuCoin,"Solana Ecosystem, Meme, Solana Meme, Pump.fun Ecosystem, Zoo-Themed, Memorial Themed",peanut-the-squirrel,207754743,207754743.0,90809.6169597543,107819.33760354077,0.1,404256675.0
KuCoin,"Stablecoins, Ethereum Ecosystem",usda-2,206127145,206127145.0,,,N/A,210455.0
KuCoin,"Artificial Intelligence (AI), Solana Ecosystem, Meme, Solana Meme, AI Meme, AI Agents, Binance Alpha Spotlight, AI Framework, Made in USA",ai16z,206403877,206403877.0,122154.97927301815,120768.69708650724,0.11,54586041.0
KuCoin,"Liquid Staking Tokens, Ethereum Ecosystem, Base Ecosystem, Liquid Staked ETH, Liquid Staking",liquid-staked-ethereum,205566319,205566319.0,,,N/A,67601.0
KuCoin,"Stablecoins, USD Stablecoin, Arbitrum Ecosystem, Ethereum Ecosystem, Base Ecosystem, Crypto-backed Stablecoin, Fiat-backed Stablecoin",gho,205302136,205298202.0,,,N/A,8089963.0
KuCoin,"Decentralized Finance (DeFi), Solana Ecosystem, Liquid Staking Tokens, Liquid Staked SOL, Liquid Staking",bybit-staked-sol,205318091,205318091.0,,,N/A,4744896.0
KuCoin,"BNB Chain Ecosystem, Meme, AI Meme",ai-companions,203276276,203276276.0,,,N/A,3727617.0
KuCoin,"Gaming (GameFi), BNB Chain Ecosystem, Solana Ecosystem, Meme, Ethereum Ecosystem, Dog-Themed, Solana Meme, Gaming Utility Token",baby-doge-coin,203468234,516465731.0,17424.34197035734,30471.22512102209,0.08,16259744.0
KuCoin,"Decentralized Exchange (DEX), Decentralized Finance (DeFi), Automated Market Maker (AMM), Cosmos Ecosystem, Osmosis Ecosystem, Paradigm Portfolio, Evmos Ecosystem, Secret Ecosystem, GMCI DeFi Index, GMCI Index",osmosis,201607283,280932493.0,11715.754757210618,37089.789764458124,0.07,9682606.0
KuCoin,"Decentralized Exchange (DEX), BNB Chain Ecosystem, Solana Ecosystem, Ethereum Ecosystem, Real World Assets (RWA), Base Ecosystem, RWA Protocol",chex-token,200784807,200784807.0,,,N/A,1478036.0
KuCoin,"Smart Contract Platform, Storage, Harmony Ecosystem, Ethereum Ecosystem, DePIN, Energi Ecosystem, Sora Ecosystem, GMCI DePIN Index, GMCI Index",holotoken,200209636,200209636.0,,,N/A,9788895.0
KuCoin,"Smart Contract Platform, Gaming (GameFi), Ethereum Ecosystem, Base Ecosystem, Card Games, Paradigm Portfolio, Gaming Blockchains, Gaming Utility Token",echelon-prime,199518201,393936029.0,,,N/A,4568944.0
KuCoin,"Gaming (GameFi), NFT, Collectibles, Polygon Ecosystem, Ethereum Ecosystem, Animoca Brands Portfolio, Gaming Blockchains, Made in USA",superfarm,199006594,440576674.0,21571.43181590304,35619.67211393854,0.23,15428412.0
KuCoin,"Decentralized Finance (DeFi), Polygon Ecosystem, Ethereum Ecosystem, Coinbase Ventures Portfolio, Pantera Capital Portfolio",instadapp,197610682,501081899.0,,,N/A,859653.0
KuCoin,"Decentralized Finance (DeFi), Yield Farming, BNB Chain Ecosystem, Avalanche Ecosystem, Polygon Ecosystem, Fantom Ecosystem, Arbitrum Ecosystem, Ethereum Ecosystem, Optimism Ecosystem, Linea Ecosystem, Bridge Governance Tokens, Base Ecosystem, FTX Holdings",stargate-finance,196137596,201898834.0,12657.00866423405,8915.85323490593,0.2,5968510.0
KuCoin,"Infrastructure, Smart Contract Platform, Venom Ecosystem",venom,195638701,707394725.0,5714.259177215058,2381.4306239999382,0.31,2750841.0
KuCoin,"Artificial Intelligence (AI), Exchange-based Tokens, Analytics, Derivatives, Perpetuals, Centralized Exchange (CEX) Token, Ethereum Ecosystem, Binance Launchpad, Coinbase Ventures Portfolio, Binance Labs Portfolio, Made in USA",arkham,195306722,528291034.0,30052.24233563977,53463.84209553463,0.13,62998369.0
KuCoin,"Smart Contract Platform, BNB Chain Ecosystem, Avalanche Ecosystem, Polygon Ecosystem, Arbitrum Ecosystem, Ethereum Ecosystem, Optimism Ecosystem, Base Ecosystem, Multicoin Capital Portfolio, Layer 0 (L0), Cross-chain Communication, Circle Ventures Portfolio, Sequoia Capital Portfolio, OKX Ventures Portfolio",layerzero,194594582,1750693526.0,39837.50168333276,44454.12315825508,0.04,23554508.0
KuCoin,"Solana Ecosystem, BRC-20, Bitcoin Ecosystem, Inscriptions",ordinals,192869772,192869772.0,54434.71690859257,78297.5031072155,0.22,84612707.0
KuCoin,"Solana Ecosystem, Meme, Solana Meme, Cat-Themed, Murad Picks",popcat,190172212,190172212.0,23980.655001675615,51245.64465276488,0.05,95776844.0
KuCoin,"BNB Chain Ecosystem, Meme",cheems-token,190688229,190688229.0,5253.251527335876,5868.289304347714,0.31,5494275.0
KuCoin,"Smart Contract Platform, Layer 1 (L1), Celo Ecosystem, DWF Labs Portfolio, Coinbase Ventures Portfolio, Proof of Stake (PoS), Andreessen Horowitz (a16z) Portfolio, Optimism Superchain Ecosystem, Outlier Ventures Portfolio, Made in USA",celo,191011048,337912352.0,28611.622829377153,24820.483157871116,0.06,15852599.0
KuCoin,"Smart Contract Platform, Privacy, Layer 1 (L1), Proof of Stake (PoS), Proof of Work (PoW), Blockchain Capital Portfolio, Made in USA",decred,191924177,191934145.0,2142.4975921196205,1401.0659521576251,0.61,2765892.0
KuCoin,"Infrastructure, Smart Contract Platform, NEO Ecosystem",gas,189933034,189933034.0,1015.6991559237815,7656.354170173312,0.28,5659727.0
KuCoin,"Decentralized Finance (DeFi), Launchpad, Ethereum Ecosystem, DWF Labs Portfolio, Coinbase Ventures Portfolio, Pantera Capital Portfolio, Blockchain Capital Portfolio",auction,186433884,216155958.0,14579.8527067072,137515.9329398836,0.14,92860142.0
KuCoin,"Smart Contract Platform, Layer 1 (L1), DePIN, Andreessen Horowitz (a16z) Portfolio, Made in USA",chia,190037975,431886615.0,8903.518578513425,18029.282817865118,0.12,13083077.0
KuCoin,"Infrastructure, Smart Contract Platform, BNB Chain Ecosystem, Layer 1 (L1), Ethereum Ecosystem, GMCI Layer 1 Index, Aelf Ecosystem, GMCI Index",aelf,188511093,254111994.0,12380.629207622493,9167.959252078768,0.27,22206609.0
KuCoin,"Solana Ecosystem, Meme, Dog-Themed, Solana Meme, Bitcoin Ecosystem, Runes",dog-go-to-the-moon-rune,186754610,186754610.0,,,N/A,8260509.0
KuCoin,"Solana Ecosystem, Meme, Solana Meme, AI Meme, Pump.fun Ecosystem",act-i-the-ai-prophecy,186582417,186582417.0,22063.199504182434,42213.13472735329,0.14,56851433.0
KuCoin,"Crypto-Backed Tokens, Decentralized Finance (DeFi), Wrapped-Tokens, Ethereum Ecosystem",resolv-wstusr,184744046,165128664.0,,,N/A,162.11
KuCoin,"Smart Contract Platform, Privacy, Proof of Work (PoW)",mimblewimblecoin,184486774,184490577.0,,,N/A,6582.41
KuCoin,"Smart Contract Platform, Real World Assets (RWA), Proof of Work (PoW), Made in USA",ravencoin,183973603,183984017.0,8845.35147167545,16387.379418128436,0.16,12902049.0
KuCoin,"Solana Ecosystem, Ethereum Ecosystem, Energi Ecosystem",swissborg,182244935,182244935.0,,,N/A,16879584.0
KuCoin,"Gambling (GambleFi), Gaming (GameFi), Ethereum Ecosystem",rollbit-coin,182344071,182337962.0,,,N/A,768002.0
KuCoin,"Meme, Cronos Ecosystem, AI Meme, Cronos zkEVM Ecosystem",agentfun-ai,182209586,182209586.0,,,N/A,5590.12
KuCoin,"Gaming (GameFi), Ethereum Ecosystem, Decentralized Identifier (DID), Animoca Brands Portfolio, OKX Ventures Portfolio, Outlier Ventures Portfolio",mocaverse,181007611,842102080.0,39403.4256193499,46851.36929706727,0.21,25396244.0
KuCoin,"Tourism, BNB Chain Ecosystem",trip,181009849,601320853.0,,,N/A,11144.15
KuCoin,"Decentralized Finance (DeFi), BNB Chain Ecosystem, Polygon Ecosystem, Fantom Ecosystem, Arbitrum Ecosystem, Moonbeam Ecosystem, Liquid Staking Tokens, Ethereum Ecosystem, Optimism Ecosystem, Liquid Staked ETH, Liquid Staking",staked-frax-ether,180488228,180488228.0,,,N/A,157888.0
KuCoin,"Smart Contract Platform, Storage, DePIN, Paradigm Portfolio, Proof of Work (PoW), DragonFly Capital Portfolio, Made in USA",siacoin,180870192,193294676.0,,,N/A,18197597.0
KuCoin,"BNB Chain Ecosystem, Avalanche Ecosystem, Polygon Ecosystem, Fantom Ecosystem, Arbitrum Ecosystem, Ethereum Ecosystem, Optimism Ecosystem, Liquid Staking Governance Tokens, Linea Ecosystem, DePIN, Scroll Ecosystem, Rollups-as-a-Service (RaaS), Blast Ecosystem, Mode Ecosystem, Pantera Capital Portfolio, Polygon zkEVM Ecosystem, Binance Labs Portfolio, Liquid Staking, Made in USA",ankr,178348272,178348272.0,11589.043916269853,11776.13526188177,0.17,15473890.0
KuCoin,"Tokenized Real Estate, Tokenized Assets, Ethereum Ecosystem, Real World Assets (RWA), RWA Protocol",apf-coin,177512032,260635175.0,,,N/A,3140976.0
KuCoin,"Gaming (GameFi), BNB Chain Ecosystem, Ethereum Ecosystem, TON Ecosystem",gmt-token,175801447,175801447.0,,,N/A,20958600.0
KuCoin,"Meme, Ethereum Ecosystem, Base Ecosystem, Cat-Themed, Murad Picks",mog-coin,175184311,175184311.0,27085.70422539308,23501.15416018956,0.22,15428584.0
KuCoin,,nem,175000184,175000184.0,891.7006182945216,300.6383154277925,0.61,22994156.0
KuCoin,"Exchange-based Tokens, Ethereum Ecosystem",btse-token,175068698,216052174.0,,,N/A,3240104.0
KuCoin,"Avalanche Ecosystem, Liquid Staking Tokens, Liquid Staking",benqi-liquid-staked-avax,173791269,173791269.0,,,N/A,2399205.0
KuCoin,"Launchpad, Meme, Base Ecosystem, Cat-Themed, Base Meme",toshi,173173392,173173392.0,17988.750571896926,20352.196902410145,0.15,33527415.0
KuCoin,"Artificial Intelligence (AI), Smart Contract Platform, Layer 1 (L1), Paradigm Portfolio, Coinbase Ventures Portfolio, DeFiance Capital Portfolio, Polychain Capital Portfolio, Vana Ecosystem",vana,172073083,670414610.0,159491.63494656325,10006.363845174137,0.38,33312526.0
KuCoin,"Internet of Things (IOT), Ethereum Ecosystem, DePIN, Base Ecosystem, Account Abstraction, GMCI DePIN Index, GMCI Index, Made in USA",iotex,171417772,171417772.0,3498.400719294755,13674.926284076053,0.11,14222552.0
KuCoin,"Decentralized Finance (DeFi), Solana Ecosystem, Ethereum Ecosystem, Optimism Ecosystem, Base Ecosystem, Cross-chain Communication, BTCfi",threshold-network-token,170747976,188098016.0,10557.874408352542,19105.16114376126,0.18,9489124.0
KuCoin,"Decentralized Finance (DeFi), Yield Farming, Yield Aggregator, Yearn Ecosystem, Avalanche Ecosystem, Polygon Ecosystem, Near Protocol Ecosystem, Gnosis Chain Ecosystem, Fantom Ecosystem, Harmony Ecosystem, Arbitrum Ecosystem, Ethereum Ecosystem, Optimism Ecosystem, Base Ecosystem, Index Coop Defi Index, Alameda Research Portfolio, Energi Ecosystem, Sora Ecosystem, Huobi ECO Chain Ecosystem, Blockchain Capital Portfolio, Index Coop Index",yearn-finance,171358515,186154926.0,16377.598527224463,40221.95555439636,0.04,27815067.0
KuCoin,"Starknet Ecosystem, Bridged-Tokens",bridged-wrapped-ether-starkgate,169158728,169158728.0,,,N/A,786719.0
KuCoin,"Solana Ecosystem, Meme, Dog-Themed, Solana Meme, Cat-Themed",cat-in-a-dogs-world,169752765,169752765.0,33080.674371534515,51608.84037228641,0.05,12250262.0
KuCoin,Arbitrum Ecosystem,rcge,168805259,168805259.0,,,N/A,2.43
KuCoin,"Smart Contract Platform, Layer 1 (L1), Layer 0 (L0), Made in USA, Directed Acyclic Graph (DAG)",constellation-labs,166133055,166133175.0,4164.4555810691,14367.033878334172,0.21,2828058.0
KuCoin,"Solana Ecosystem, Meme, Cat-Themed",meow,166352746,166352746.0,,,N/A,930397.0
KuCoin,"Entertainment, Smart Contract Platform, Gaming (GameFi), NFT, Metaverse, Layer 1 (L1), Harmony Ecosystem, Ethereum Ecosystem, Gaming Blockchains, Energi Ecosystem",enjincoin,165452845,171178610.0,4478.811482078191,19412.016552879744,0.11,14185781.0
KuCoin,"Decentralized Finance (DeFi), Yield Farming, Yield Aggregator, Ethereum Ecosystem, Metagovernance, Curve Ecosystem, Yield Optimizer",convex-finance,163251836,198819865.0,7250.306014252874,6240.035918006181,0.12,20790291.0
KuCoin,"Decentralized Finance (DeFi), Liquid Staking Tokens, Ethereum Ecosystem, Liquid Staked ETH, Liquid Staking",treehouse-eth,163004807,163013445.0,,,N/A,46731.0
KuCoin,"Decentralized Finance (DeFi), Ethereum Ecosystem, Stablecoin Protocol",tribe-2,162745993,357671293.0,,,N/A,59600.0
KuCoin,"Artificial Intelligence (AI), Meme, Base Ecosystem, AI Agents, Binance Alpha Spotlight, AI Framework",freysa-ai,160579578,160579578.0,,,N/A,702713.0
