Exchange,Category,Token CEX,Market Cap Today,FDV Today,Depth +2%,Depth -2%,Bid Ask Spread Percentage,24H Volume (USD)
KuCoin,"Smart Contract Platform, Decentralized Finance (DeFi), BNB Chain Ecosystem, Cosmos Ecosystem, Layer 1 (L1), Ethereum Ecosystem, Binance Launchpad, Osmosis Ecosystem, Proof of Stake (PoS), Pantera Capital Portfolio, Secret Ecosystem, GMCI Layer 1 Index, GMCI Index, Made in USA, Coinbase 50 Index",injective-protocol,996378072,1019550201.0,109840.69667491944,152206.61994677535,0.02,68370669.0
KuCoin,"Decentralized Finance (DeFi), BNB Chain Ecosystem, Ethereum Ecosystem",dexe,993412814,1678854091.0,822.6738250324023,3293.1298102259007,0.31,5458826.0
KuCoin,"Stablecoins, USD Stablecoin, Arbitrum Ecosystem, Ethereum Ecosystem, Fiat-backed Stablecoin",usual-usd,975978087,975978087.0,,,N/A,1328354.0
KuCoin,"Decentralized Finance (DeFi), Solana Ecosystem, Liquid Staking Tokens, Liquid Staked SOL, Liquid Staking",binance-staked-sol,973912053,973912078.0,,,N/A,2147864.0
KuCoin,"Smart Contract Platform, Layer 1 (L1), DWF Labs Portfolio",flare-networks,963169951,1628341721.0,59823.571801854385,34710.424508840704,0.06,10223568.0
KuCoin,"Polygon Ecosystem, Arbitrum Ecosystem, Liquid Staking Tokens, Ethereum Ecosystem, Optimism Ecosystem, Base Ecosystem, Liquid Staked ETH, Liquid Staking",rocket-pool-eth,963651014,963651014.0,,,N/A,3111393.0
KuCoin,"Artificial Intelligence (AI), Business Services, Infrastructure, Smart Contract Platform, Analytics, Avalanche Ecosystem, Polygon Ecosystem, Near Protocol Ecosystem, Harmony Ecosystem, Arbitrum Ecosystem, Ethereum Ecosystem, DePIN, Coinbase Ventures Portfolio, Multicoin Capital Portfolio, Proof of Stake (PoS), Energi Ecosystem, Sora Ecosystem, Made in USA, Coinbase 50 Index",the-graph,912964548,1031474366.0,17711.5312544191,56625.83346641725,0.04,31309544.0
KuCoin,"Smart Contract Platform, Layer 1 (L1), DePIN, Theta Ecosystem, Blockchain Capital Portfolio, Made in USA",theta-token,908887188,908887188.0,53439.288607227136,101722.90590247132,0.07,12083069.0
KuCoin,"Infrastructure, Decentralized Finance (DeFi), Polygon Ecosystem, Arbitrum Ecosystem, Ethereum Ecosystem, Optimism Ecosystem, Liquid Staking Governance Tokens, eGirl Capital Portfolio, Paradigm Portfolio, Coinbase Ventures Portfolio, Multicoin Capital Portfolio, Index Coop Defi Index, Alameda Research Portfolio, DragonFly Capital Portfolio, Andreessen Horowitz (a16z) Portfolio, GMCI DeFi Index, Delphi Ventures Portfolio, Liquid Staking, Index Coop Index, GMCI Index, Coinbase 50 Index",lido-dao,862240651,961092845.0,77357.8906372778,93979.20491213733,0.03,57075502.0
KuCoin,"BNB Chain Ecosystem, Solana Ecosystem, Polygon Ecosystem, Meme, Arbitrum Ecosystem, Ethereum Ecosystem, Aptos Ecosystem, Dog-Themed, Solana Meme, Neon Ecosystem, GMCI Meme Index, GMCI Index, Made in USA, Coinbase 50 Index",bonk,852130769,977999773.0,132655.34848178478,134156.7432809564,0.07,37664726.0
KuCoin,"Polygon Ecosystem, Bridged USDT, Bridged-Tokens, Bridged Stablecoins",polygon-bridged-usdt-polygon,847887785,847887785.0,,,N/A,8449250.0
KuCoin,"Crypto-Backed Tokens, BNB Chain Ecosystem, Avalanche Ecosystem, Arbitrum Ecosystem, Ethereum Ecosystem, Mantle Ecosystem, Base Ecosystem, Restaking, Berachain Ecosystem, Merlin Chain Ecosystem, Sonic Ecosystem, Sei v2 Ecosystem, Soneium Ecosystem, Corn Ecosystem",solv-protocol-solvbtc-bbn,839418452,839418452.0,,,N/A,8348152.0
KuCoin,"Liquid Staking Tokens, Ethereum Ecosystem, Mantle Ecosystem, Liquid Staked ETH, Liquid Staking",mantle-staked-ether,764443509,764443509.0,,,N/A,6361844.0
KuCoin,"Smart Contract Platform, DWF Labs Portfolio, GMCI Layer 1 Index, GMCI Index, Made in USA, Coinbase 50 Index",eos,764336271,1058158881.0,68738.57659675414,86116.91027710166,0.04,47059824.0
KuCoin,"Stablecoins, USD Stablecoin, Solana Ecosystem, Ethereum Ecosystem, Fiat-backed Stablecoin, Made in USA",paypal-usd,760731325,760731325.0,34842.04552838554,6446.884549950389,0.68,98119642.0
KuCoin,"Smart Contract Platform, Gaming (GameFi), NFT, Layer 1 (L1), Play To Earn, Ethereum Ecosystem, DWF Labs Portfolio, Gaming Platform, Binance Labs Portfolio, GalaChain Ecosystem, Made in USA",gala,743960081,743959992.0,58524.232265574254,84501.15631073421,0.06,39714570.0
KuCoin,"Stablecoins, Tokenized Assets, Tokenized Gold, Ethereum Ecosystem, Real World Assets (RWA), Tokenized Commodities",tether-gold,736620868,736620868.0,,,N/A,7533672.0
KuCoin,"Smart Contract Platform, Layer 1 (L1), Tezos Ecosystem, Proof of Stake (PoS), GMCI Layer 1 Index, GMCI Index, Polychain Capital Portfolio, Made in USA, Coinbase 50 Index",tezos,735939022,750344136.0,37124.90476668713,49079.34790720129,0.28,14511724.0
KuCoin,"Crypto-Backed Tokens, BNB Chain Ecosystem, Wrapped-Tokens",wbnb,736201073,736201073.0,,,N/A,195973442.0
KuCoin,"Internet of Things (IOT), Ethereum Ecosystem, DePIN, DWF Labs Portfolio, Coinbase 50 Index",jasmycoin,710310541,733488787.0,65709.93088998958,85722.98200875761,0.03,60911116.0
KuCoin,"Gaming (GameFi), NFT, Metaverse, Polygon Ecosystem, Play To Earn, Harmony Ecosystem, Ethereum Ecosystem, Animoca Brands Portfolio, Alleged SEC Securities, Binance Launchpad, Gaming Utility Token, Simulation Games, Energi Ecosystem, Binance Labs Portfolio, Coinbase 50 Index",the-sandbox,702756298,861975490.0,67986.67943141538,103326.6392204621,0.02,40683201.0
KuCoin,"BNB Chain Ecosystem, Bridged USDC, Bridged-Tokens, Bridged Stablecoins",binance-bridged-usdc-bnb-smart-chain,697857519,697857519.0,,,N/A,64711962.0
KuCoin,"Smart Contract Platform, Decentralized Finance (DeFi), Layer 1 (L1), Berachain Ecosystem, Binance HODLer Airdrops, Outlier Ventures Portfolio, Polychain Capital Portfolio",berachain-bera,696655166,3228860596.0,77359.86076310009,83689.32956833429,0.09,69008768.0
KuCoin,"Storage, BNB Chain Ecosystem, Ethereum Ecosystem, DePIN, Alleged SEC Securities, Binance Launchpad, Tron Ecosystem, Energi Ecosystem, Binance Labs Portfolio, BitTorrent Ecosystem, GMCI DePIN Index, GMCI Index",bittorrent,688830357,691581914.0,31483.966889807187,37172.30458140459,0.03,15260992.0
KuCoin,"Berachain Ecosystem, Bridged USDC, Bridged-Tokens, Bridged Stablecoins",stargate-bridged-usdc-berachain,686557682,686557682.0,,,N/A,2224201.0
KuCoin,"Smart Contract Platform, Bitcoin Fork, Proof of Work (PoW)",bitcoin-cash-sv,682370206,682370206.0,10638.762846052316,19663.551081333935,0.17,14994342.0
KuCoin,"Arbitrum Ecosystem, Bridged WBTC, Bridged-Tokens",arbitrum-bridged-wbtc-arbitrum-one,682523802,682523802.0,,,N/A,34781239.0
KuCoin,"Decentralized Finance (DeFi), Solana Ecosystem, Liquid Staking Governance Tokens, Multicoin Capital Portfolio, Alameda Research Portfolio, Delphi Ventures Portfolio, Liquid Staking, Made in USA",jito-governance-token,679651227,2229508651.0,34478.23866296341,45607.213128721836,0.04,25020578.0
KuCoin,"Internet of Things (IOT), Smart Contract Platform, Layer 1 (L1), DePIN, DWF Labs Portfolio, IOTA EVM Ecosystem, Outlier Ventures Portfolio, Directed Acyclic Graph (DAG)",iota,677485068,849239548.0,77962.21872820228,100258.64863256707,0.05,14576354.0
KuCoin,"Smart Contract Platform, Layer 1 (L1)",kaia,650617209,650617230.0,45406.24668122759,47194.29620352661,0.09,5861322.0
KuCoin,"Decentralized Finance (DeFi), Solana Ecosystem, Liquid Staking Tokens, Liquid Staked SOL, Liquid Staking",msol,652989333,652992622.0,,,N/A,8911838.0
KuCoin,"Smart Contract Platform, Sports, NFT, Layer 1 (L1), Animoca Brands Portfolio, Alleged SEC Securities, Multicoin Capital Portfolio, Proof of Stake (PoS), Flow Ecosystem, Andreessen Horowitz (a16z) Portfolio",flow,649410943,649410943.0,18826.95814827861,17668.647785600835,0.17,18299321.0
KuCoin,"Stablecoins, Tokenized Assets, Tokenized Gold, Ethereum Ecosystem, Real World Assets (RWA), Tokenized Commodities",pax-gold,632743968,632743968.0,45040.35336832382,51645.95990443326,0.02,19582803.0
KuCoin,"Stablecoins, USD Stablecoin, BNB Chain Ecosystem, Arbitrum Ecosystem, Ethereum Ecosystem, Fiat-backed Stablecoin",usdx-money-usdx,626304720,626304720.0,,,N/A,160233.0
KuCoin,"BNB Chain Ecosystem, Arbitrum Ecosystem, Liquid Staking Tokens, Base Ecosystem, Restaking, Liquid Restaking Tokens, Blast Ecosystem, Mode Ecosystem, Liquid Staking",renzo-restaked-eth,611677340,611677340.0,,,N/A,1938050.0
KuCoin,"Gaming (GameFi), NFT, BNB Chain Ecosystem, Metaverse, Meme, Play To Earn, Ethereum Ecosystem, Telegram Apps, Dog-Themed, DWF Labs Portfolio, RPG, On-chain Gaming, TokenFi Launchpad, GMCI Meme Index, GMCI Index",floki,607401148,628447659.0,95404.44516322066,99302.06425151309,0.16,60464470.0
KuCoin,"Smart Contract Platform, Proof of Stake (PoS), Made in China",neo,576018249,816699629.0,52183.397968502504,60856.818709982086,0.02,14303397.0
KuCoin,"NFT, Ethereum Ecosystem, Decentralized Identifier (DID), Name Service",ethereum-name-service,570019226,1718706982.0,68314.35211014168,83949.64773681207,0.02,34292246.0
KuCoin,"Solana Ecosystem, Liquid Staking Tokens, Liquid Staked SOL, Liquid Staking",jupiter-staked-sol,558429248,558429248.0,,,N/A,2155507.0
KuCoin,"Communication, Internet of Things (IOT), Smart Contract Platform, Solana Ecosystem, DePIN, Multicoin Capital Portfolio, Proof of Stake (PoS), Alameda Research Portfolio, Pantera Capital Portfolio, Andreessen Horowitz (a16z) Portfolio, Made in USA, Coinbase 50 Index",helium,556197304,691002362.0,35589.02546111809,48144.71688334417,0.03,3844202.0
KuCoin,"Business Services, Infrastructure, Decentralized Finance (DeFi), Oracle, Solana Ecosystem, Neon Ecosystem, Manta Network Ecosystem, Multicoin Capital Portfolio, GMCI DeFi Index, Delphi Ventures Portfolio, GMCI Index",pyth-network,548197000,1512272265.0,118903.63349847028,152327.30149405994,0.04,22987701.0
KuCoin,"Decentralized Exchange (DEX), Exchange-based Tokens, Decentralized Finance (DeFi), Yield Farming, Automated Market Maker (AMM), BNB Chain Ecosystem, Arbitrum Ecosystem, Ethereum Ecosystem, Aptos Ecosystem, ZkSync Ecosystem, Linea Ecosystem, Base Ecosystem, Polygon zkEVM Ecosystem, Binance Labs Portfolio, opBNB Ecosystem, GMCI DeFi Index, GMCI Index",pancakeswap-token,545887572,706052653.0,33454.581080993725,49187.73335519956,0.05,154125666.0
KuCoin,"Decentralized Exchange (DEX), Exchange-based Tokens, Decentralized Finance (DeFi), Yield Farming, Automated Market Maker (AMM), Polygon Ecosystem, Fantom Ecosystem, Arbitrum Ecosystem, Ethereum Ecosystem, Optimism Ecosystem, Curve Ecosystem, DWF Labs Portfolio, Stablecoin Protocol, Energi Ecosystem, Sora Ecosystem, Binance Labs Portfolio, GMCI DeFi Index, GMCI Index, Coinbase 50 Index",curve-dao-token,542594575,934466908.0,65576.33222807485,148828.26987086498,0.02,63352406.0
KuCoin,"Stablecoins, Ethereum Ecosystem",resolv-usr,541595715,541595715.0,,,N/A,2369262.0
KuCoin,"Stablecoins, Berachain Ecosystem",honey-3,526799411,526799411.0,,,N/A,3685187.0
KuCoin,"Gaming (GameFi), NFT, BNB Chain Ecosystem, Axie Infinity Ecosystem, Metaverse, Play To Earn, Harmony Ecosystem, Ethereum Ecosystem, Animoca Brands Portfolio, Alleged SEC Securities, Binance Launchpad, Ronin Ecosystem, Card Games, Breeding, Paradigm Portfolio, Gaming Governance Token, Gaming Utility Token, Andreessen Horowitz (a16z) Portfolio, Energi Ecosystem, Binance Labs Portfolio, Consensys Portfolio, Coinbase 50 Index",axie-infinity,524890484,888718271.0,21574.55429825027,53708.007242426254,0.06,19273443.0
KuCoin,"Decentralized Finance (DeFi), Wallets, Polygon Ecosystem, Ethereum Ecosystem, Payment Solutions, Base Ecosystem, Sora Ecosystem, Made in USA",telcoin,524063920,570256606.0,33647.93507335372,13083.530023295094,0.46,2330167.0
KuCoin,"Artificial Intelligence (AI), Smart Contract Platform, Privacy, Masternodes, DePIN, DWF Labs Portfolio, Proof of Stake (PoS), Proof of Work (PoW)",beldex,519944568,746894080.0,457.2671218422952,13077.923620960888,0.56,3231434.0
KuCoin,"Smart Contract Platform, Privacy, Layer 1 (L1), Zero Knowledge (ZK), Proof of Work (PoW), Pantera Capital Portfolio, Made in USA, Coinbase 50 Index",zcash,519036065,519038505.0,27945.044090794774,138064.74395938843,0.05,55106425.0
KuCoin,"Entertainment, Gaming (GameFi), NFT, Metaverse, Polygon Ecosystem, Play To Earn, Ethereum Ecosystem, Animoca Brands Portfolio, Alleged SEC Securities, Simulation Games, Coinbase 50 Index",decentraland,515886567,605692843.0,44599.22252845502,65129.54437632369,0.03,33230552.0
KuCoin,"Smart Contract Platform, Layer 1 (L1), MultiversX Ecosystem, Binance Launchpad, DWF Labs Portfolio, Proof of Stake (PoS), Binance Labs Portfolio, GMCI Layer 1 Index, GMCI Index, Coinbase 50 Index",elrond-erd-2,515282508,515282508.0,27148.744303699703,29070.483717689523,0.05,11393925.0
KuCoin,"Infrastructure, Smart Contract Platform, Ethereum Ecosystem, Layer 2 (L2), Zero Knowledge (ZK), Starknet Ecosystem, Paradigm Portfolio, Coinbase Ventures Portfolio, Rollup, Multicoin Capital Portfolio, Alameda Research Portfolio, Pantera Capital Portfolio, GMCI Layer 2 Index, Consensys Portfolio, Sequoia Capital Portfolio, GMCI Index, Polychain Capital Portfolio",starknet,515009198,1877193718.0,25775.124537206295,60739.65040749997,0.06,23190007.0
KuCoin,"Smart Contract Platform, Layer 1 (L1), Binance Launchpad, DWF Labs Portfolio, Osmosis Ecosystem, Binance Labs Portfolio, Made in USA",kava,505046752,505046752.0,60205.46641600877,76253.08258379983,0.02,8176763.0
KuCoin,"Smart Contract Platform, Gaming (GameFi), NFT, Layer 1 (L1), Play To Earn, Zero Knowledge (ZK), FTX Holdings, Ronin Ecosystem, Gaming Blockchains, SideChain, Andreessen Horowitz (a16z) Portfolio, Binance Labs Portfolio",ronin,502050866,810557338.0,2482.4497642798815,3329.994753307362,0.12,16504570.0
KuCoin,"Solana Ecosystem, Meme, Dog-Themed, Solana Meme, GMCI Meme Index, GMCI Index",dogwifcoin,498457652,498457652.0,250116.9223073356,244511.1346546199,0.02,195133213.0
KuCoin,"Decentralized Exchange (DEX), Decentralized Finance (DeFi), Yield Farming, Automated Market Maker (AMM), Solana Ecosystem, Launchpad, GMCI DeFi Index, GMCI Index",raydium,494720978,944033206.0,51143.06090051041,58290.89811214942,0.04,59832598.0
KuCoin,"Stablecoins, USD Stablecoin, BNB Chain Ecosystem, Avalanche Ecosystem, Ethereum Ecosystem, Tron Ecosystem, Andreessen Horowitz (a16z) Portfolio, Fiat-backed Stablecoin",true-usd,495602501,495602501.0,52025.37286249371,48553.58987589134,0.14,23470405.0
KuCoin,"Decentralized Exchange (DEX), Smart Contract Platform, Decentralized Finance (DeFi), Cosmos Ecosystem, Perpetuals, Layer 1 (L1), Osmosis Ecosystem, Appchains, DragonFly Capital Portfolio, DeFiance Capital Portfolio, Andreessen Horowitz (a16z) Portfolio, GMCI DeFi Index, Delphi Ventures Portfolio, GMCI Index, Polychain Capital Portfolio, Made in USA",dydx-chain,483558252,483559676.0,47736.758449162066,36926.70639445034,0.03,14536692.0
KuCoin,"BNB Chain Ecosystem, Ethereum Ecosystem, BTCfi",pumpbtc,476850616,476850616.0,,,N/A,311.55
KuCoin,"Artificial Intelligence (AI), Solana Ecosystem, Ethereum Ecosystem, Base Ecosystem, AI Agents, Virtuals Protocol Ecosystem, AI Agent Launchpad, Binance Alpha Spotlight",virtual-protocol,471375775,725750434.0,55497.61632218425,68902.79269224056,0.14,171340005.0
KuCoin,"BNB Chain Ecosystem, Meme, Binance-Peg Tokens",binance-peg-dogecoin,450293368,450293368.0,,,N/A,1278619.0
KuCoin,"Ethereum Ecosystem, Mantle Ecosystem, Restaking, Liquid Restaking Tokens, Liquid Restaked ETH",mantle-restaked-eth,447809375,447809375.0,,,N/A,3779072.0
KuCoin,"Base Ecosystem, Bridged WETH, Bridged-Tokens",l2-standard-bridged-weth-base,443231391,443436168.0,,,N/A,256532091.0
KuCoin,"Smart Contract Platform, Sports, NFT, Layer 1 (L1), Ethereum Ecosystem, Alleged SEC Securities, Chiliz Ecosystem, Binance Labs Portfolio, Coinbase 50 Index",chiliz,442159195,442163349.0,49840.9286209255,68798.13902243949,0.04,73482681.0
KuCoin,"USD Stablecoin, Polygon Ecosystem, Bridged USDC, Fiat-backed Stablecoin, Bridged-Tokens, Bridged Stablecoins",bridged-usdc-polygon-pos-bridge,441409547,441409547.0,,,N/A,11495493.0
KuCoin,"Smart Contract Platform, BNB Chain Ecosystem, Layer 1 (L1), Ethereum Ecosystem, Base Ecosystem, Proof of Stake (PoS), Pantera Capital Portfolio, Made in USA",chain-2,438577012,644638161.0,32077.79274910694,83555.6925055224,0.07,29529905.0
KuCoin,"Smart Contract Platform, DWF Labs Portfolio, Proof of Work (PoW), GMCI Layer 1 Index, Sequoia Capital Portfolio, GMCI Index, Made in China",conflux-token,434180328,484722698.0,84522.0444635168,104278.48841352368,0.12,41030420.0
KuCoin,"Artificial Intelligence (AI), Smart Contract Platform, Storage, Layer 1 (L1), DePIN, Coinbase Ventures Portfolio, Multicoin Capital Portfolio, Andreessen Horowitz (a16z) Portfolio, Blockchain Capital Portfolio",arweave,432730183,432730183.0,31191.912690153637,71951.36542655222,0.02,24666544.0
KuCoin,"Tokenized BTC, Avalanche Ecosystem, Bridged-Tokens",bitcoin-avalanche-bridged-btc-b,431139524,431139524.0,,,N/A,22349548.0
KuCoin,"Decentralized Exchange (DEX), Decentralized Finance (DeFi), Automated Market Maker (AMM), Base Ecosystem, Binance Alpha Spotlight, Made in USA",aerodrome-finance,430532753,833419096.0,19625.64241931788,45985.37038583962,0.18,15858637.0
KuCoin,"NFT, BNB Chain Ecosystem, Ethereum Ecosystem, Tron Ecosystem",apenft,426258367,430513744.0,10920.948408877213,7456.015143214353,0.74,16734968.0
KuCoin,"Smart Contract Platform, Layer 1 (L1), Bitcoin Fork, Proof of Work (PoW)",ecash,425422896,425422896.0,7752.117607469915,11219.827085278925,0.14,16534693.0
KuCoin,"Gaming (GameFi), NFT, Polygon Ecosystem, Ethereum Ecosystem, Animoca Brands Portfolio, Gaming Blockchains, Gaming Governance Token, Gaming Utility Token, Andreessen Horowitz (a16z) Portfolio, ApeChain Ecosystem, Airdropped Tokens by NFT Projects, Coinbase 50 Index",apecoin,423947731,530295602.0,80972.40677873949,110447.56300146585,0.04,32856770.0
KuCoin,"Arbitrum Ecosystem, Ethereum Ecosystem, Optimism Ecosystem, Base Ecosystem, BTCfi",clbtc,422208389,422208389.0,,,N/A,12.38
KuCoin,"Arbitrum Ecosystem, Bridged WETH, Bridged-Tokens",arbitrum-bridged-weth-arbitrum-one,420804617,420804617.0,,,N/A,102408592.0
KuCoin,"Solana Ecosystem, Meme, Solana Meme, Binance HODLer Airdrops, Airdropped Tokens by NFT Projects, Made in USA",pudgy-penguins,421351658,514280530.0,76669.9165969144,93730.01579996067,0.15,76642800.0
KuCoin,"Smart Contract Platform, Layer 1 (L1), Bitcoin Sidechains, SideChain",coredaoorg,412697248,869364123.0,,,N/A,10591571.0
KuCoin,"Decentralized Exchange (DEX), Infrastructure, Smart Contract Platform, Exchange-based Tokens, Decentralized Finance (DeFi), Bridge Governance Tokens, Multicoin Capital Portfolio, Proof of Stake (PoS), Delphi Ventures Portfolio",thorchain,413968680,501023387.0,100717.88945488425,182476.93846818316,0.04,95346245.0
KuCoin,"Tokenized Assets, Solana Ecosystem, Polygon Ecosystem, Ethereum Ecosystem, Real World Assets (RWA), Tokenized Treasury Bonds (T-Bonds)",ousg,409212061,409212061.0,,,N/A,0.0
KuCoin,"Artificial Intelligence (AI), Solana Ecosystem, DePIN, Polychain Capital Portfolio",grass,404347142,1467814854.0,74590.9487252688,71520.64322700506,0.02,33827450.0
KuCoin,"Stablecoins, USD Stablecoin, Blast Ecosystem, Crypto-backed Stablecoin, Fiat-backed Stablecoin",usdb,406289636,406289636.0,,,N/A,508736.0
KuCoin,"Ethereum Ecosystem, Real World Assets (RWA)",hashnote-usyc,400450325,400450325.0,,,N/A,10.66
KuCoin,"Decentralized Finance (DeFi), BNB Chain Ecosystem, Liquid Staking Tokens, Sui Ecosystem, Liquid Staking",lorenzo-stbtc,391664264,391664264.0,,,N/A,12363.79
KuCoin,"Decentralized Finance (DeFi), Liquid Staking Tokens, Berachain Ecosystem, Liquid Staking",infrared-bera,390991940,390991940.0,,,N/A,41669.0
KuCoin,"Stablecoins, Solana Ecosystem, Arbitrum Ecosystem, Ethereum Ecosystem, Aptos Ecosystem, Sui Ecosystem, Mantle Ecosystem, Osmosis Ecosystem, Fiat-backed Stablecoin, Yield Tokenization Product",ondo-us-dollar-yield,382728307,589590395.0,,,N/A,143260.0
KuCoin,"Smart Contract Platform, BNB Chain Ecosystem, Polygon Ecosystem, Harmony Ecosystem, Moonriver Ecosystem, Moonbeam Ecosystem, Ethereum Ecosystem, Layer 2 (L2), Zero Knowledge (ZK), Animoca Brands Portfolio, Alleged SEC Securities, Binance Launchpad, FTX Holdings, Coinbase Ventures Portfolio, Rollup, Proof of Stake (PoS), Alameda Research Portfolio, DragonFly Capital Portfolio, Energi Ecosystem, Sora Ecosystem, Binance Labs Portfolio, GMCI Layer 2 Index, GMCI 30 Index, Galaxy Digital Portfolio, GMCI Index, Coinbase 50 Index",matic-network,385641577,2191166415.0,,,N/A,17315390.0
KuCoin,"Infrastructure, BNB Chain Ecosystem, Avalanche Ecosystem, Polygon Ecosystem, Fantom Ecosystem, Arbitrum Ecosystem, Moonbeam Ecosystem, Ethereum Ecosystem, Optimism Ecosystem, Interoperability, Bridge Governance Tokens, Base Ecosystem, Osmosis Ecosystem, Cross-chain Communication, Secret Ecosystem, Galaxy Digital Portfolio, Polychain Capital Portfolio, Made in USA",axelar,381867325,489222920.0,7236.150866816625,8505.817321343107,0.34,23696949.0
KuCoin,"Decentralized Finance (DeFi), Yield Farming, BNB Chain Ecosystem, Lending/Borrowing Protocols, Avalanche Ecosystem, Polygon Ecosystem, Near Protocol Ecosystem, Harmony Ecosystem, Arbitrum Ecosystem, Ethereum Ecosystem, Base Ecosystem, Paradigm Portfolio, Index Coop Defi Index, Energi Ecosystem, Sora Ecosystem, Index Coop Index, Polychain Capital Portfolio, Made in USA",compound-governance-token,375839894,422425907.0,13091.648273858706,21256.394970488986,0.07,42099330.0
KuCoin,"Liquid Staking Tokens, Ethereum Ecosystem, Restaking, Liquid Restaking Tokens, Ether.fi Ecosystem, Liquid Staked ETH, Liquid Staking",ether-fi-staked-eth,372313174,4430626111.0,,,N/A,10966.44
KuCoin,"Solana Ecosystem, Meme, Ethereum Ecosystem, Base Ecosystem, Murad Picks, Stock market-themed",spx6900,373052290,373052290.0,24493.083138407095,50828.405890107235,0.07,17817932.0
KuCoin,"BNB Chain Ecosystem, Wallets, Account Abstraction, Energi Ecosystem",trust-wallet-token,365856818,878091697.0,7396.9783588046585,13494.070908309715,0.14,11200825.0
KuCoin,"Crypto-Backed Tokens, Decentralized Finance (DeFi), Rebase Tokens, Arbitrum Ecosystem, Ethereum Ecosystem, Berachain Ecosystem",olympus,361721443,463240225.0,,,N/A,156050.0
KuCoin,"Decentralized Finance (DeFi), Near Protocol Ecosystem, Ethereum Ecosystem, Payment Solutions, Alleged SEC Securities, Pantera Capital Portfolio, Energi Ecosystem, Made in USA",amp-token,359811999,425758074.0,12141.80162243716,8180.404618649348,0.02,26448412.0
KuCoin,"Crypto-Backed Tokens, Decentralized Finance (DeFi), Tokenized BTC, Solana Ecosystem, Polygon Ecosystem, Arbitrum Ecosystem, Ethereum Ecosystem, Optimism Ecosystem, Base Ecosystem",tbtc,354335746,354335746.0,,,N/A,5924607.0
KuCoin,"Decentralized Exchange (DEX), Decentralized Finance (DeFi), Yield Farming, Automated Market Maker (AMM), BNB Chain Ecosystem, Derivatives, Lending/Borrowing Protocols, Arbitrum Ecosystem, Ethereum Ecosystem, Optimism Ecosystem, Fixed Interest, Real World Assets (RWA), LSDFi, Base Ecosystem, Restaking, LRTfi, Liquid Restaking Governance Tokens, Yield Tokenization Protocol, Binance Labs Portfolio, GMCI DeFi Index, Sonic Ecosystem, Liquid Staking, GMCI Index, BTCfi",pendle,353265637,564336149.0,40381.53567963182,48537.50940352549,0.14,29406712.0
KuCoin,"Decentralized Finance (DeFi), Arbitrum Ecosystem, Liquid Staking Tokens, Ethereum Ecosystem, Optimism Ecosystem, Base Ecosystem",cgeth-hashkey-cloud,352789752,352789752.0,,,N/A,7.12
KuCoin,"Stablecoins, Decentralized Finance (DeFi), USD Stablecoin, BNB Chain Ecosystem, Seigniorage, Avalanche Ecosystem, Polygon Ecosystem, Fantom Ecosystem, Harmony Ecosystem, Arbitrum Ecosystem, Moonriver Ecosystem, Moonbeam Ecosystem, Ethereum Ecosystem, Optimism Ecosystem, Stablecoin Protocol, Aurora Ecosystem, Polygon zkEVM Ecosystem, Evmos Ecosystem, Boba Network Ecosystem, Fiat-backed Stablecoin",frax,352833780,352833780.0,,,N/A,8166335.0
KuCoin,"Smart Contract Platform, Decentralized Finance (DeFi), Coinbase Ventures Portfolio, DeFiance Capital Portfolio, Pantera Capital Portfolio, Binance Labs Portfolio, Galaxy Digital Portfolio",terra-luna,348241007,415666022.0,34621.320201553935,417022.8191099674,0.09,17509836.0
KuCoin,"Artificial Intelligence (AI), Analytics, Base Ecosystem, Binance HODLer Airdrops",kaito,347801412,1440834387.0,72553.75736046885,121098.57984968713,0.11,233687983.0
KuCoin,"Decentralized Finance (DeFi), Liquid Staking Tokens, Ethereum Ecosystem, Liquid Staked ETH, Liquid Staking",stakewise-v3-oseth,344899707,344899707.0,,,N/A,127165.0
KuCoin,"Artificial Intelligence (AI), Smart Contract Platform, DePIN, Osmosis Ecosystem, Proof of Stake (PoS), Archway Ecosystem, Made in USA",akash-network,336266506,337414994.0,63401.65991736911,89979.90223162808,0.07,12063283.0
KuCoin,"Solana Ecosystem, Meme, Solana Meme, AI Meme, Pump.fun Ecosystem, Terminal of Truths, Binance Alpha Spotlight",fartcoin,334593013,334593013.0,99072.62194475261,129360.06219326447,0.06,80282935.0
KuCoin,"Meme, Base Ecosystem, Frog-Themed, Base Meme, The Boy’s Club",based-brett,336113649,336113649.0,33967.269205389486,32681.280457205048,0.03,14585336.0
KuCoin,"Smart Contract Platform, Gaming (GameFi), NFT, BNB Chain Ecosystem, Binance Launchpool, Avalanche Ecosystem, Ethereum Ecosystem, DWF Labs Portfolio, Gaming Blockchains, Avalanche L1",beam-2,333386730,387858172.0,,,N/A,15082267.0
KuCoin,"Decentralized Exchange (DEX), Smart Contract Platform, Decentralized Finance (DeFi), Prediction Markets, Layer 1 (L1), Gnosis Chain Ecosystem, MEV Protection, Arbitrum Ecosystem, Ethereum Ecosystem, SideChain, Energi Ecosystem",gnosis,329176669,381346231.0,,,N/A,16136084.0
KuCoin,"Smart Contract Platform, Zero Knowledge (ZK), FTX Holdings, Paradigm Portfolio, Coinbase Ventures Portfolio, Multicoin Capital Portfolio, Proof of Stake (PoS), Pantera Capital Portfolio, Circle Ventures Portfolio, Privacy Blockchain, Polychain Capital Portfolio, Made in USA, Coinbase 50 Index",mina-protocol,328563456,328563456.0,43100.57005177191,42405.79194178143,0.11,14057092.0
