KuCoin,"Smart Contract Platform, Layer 1 (L1), Zero Knowledge (ZK), Andreessen Horowitz (a16z) Portfolio, Privacy Blockchain, Made in USA",aleo,93226181,456791728.0,,,N/A,6777954.0
KuCoin,"Artificial Intelligence (AI), Big Data, Media, BNB Chain Ecosystem, Polygon Ecosystem, Ethereum Ecosystem, GMCI DePIN Index, Galaxy Digital Portfolio, GMCI Index",everipedia,92860072,92860072.0,,,N/A,6023232.0
KuCoin,"Energy, Ethereum Ecosystem, Alleged SEC Securities, Energi Ecosystem, GMCI DePIN Index, Blockchain Capital Portfolio, GMCI Index",power-ledger,91153142,171979387.0,,,N/A,7160974.0
KuCoin,"Decentralized Finance (DeFi), Yield Farming, BNB Chain Ecosystem, Binance Launchpool, Lending/Borrowing Protocols, Arbitrum Ecosystem, Ethereum Ecosystem, Optimism Ecosystem, ZkSync Ecosystem, opBNB Ecosystem, Unichain Ecosystem",venus,90868637,163017362.0,,,N/A,5102661.0
KuCoin,"Smart Contract Platform, Gaming (GameFi), Solana Ecosystem, Layer 2 (L2), Gaming Blockchains",sonic-svm,90833785,605558564.0,85215.90765716408,102564.8071066403,0.06,44061053.0
KuCoin,"Artificial Intelligence (AI), Infrastructure, Smart Contract Platform, Decentralized Finance (DeFi), Arbitrum Ecosystem, Ethereum Ecosystem, Zero Knowledge (ZK), DWF Labs Portfolio, Coinbase Ventures Portfolio, Pantera Capital Portfolio, Binance Labs Portfolio",marlin,90171326,110592228.0,12081.862825318785,7634.055171188581,0.35,7739912.0
KuCoin,"Crypto-Backed Tokens, BNB Chain Ecosystem, Arbitrum Ecosystem, Ethereum Ecosystem, Mantle Ecosystem",ignition-fbtc,90092092,1165591128.0,,,N/A,562121.0
KuCoin,"Decentralized Exchange (DEX), Exchange-based Tokens, Decentralized Finance (DeFi), Yield Farming, Automated Market Maker (AMM), Avalanche Ecosystem, Polygon Ecosystem, Near Protocol Ecosystem, Gnosis Chain Ecosystem, Harmony Ecosystem, Arbitrum Ecosystem, Ethereum Ecosystem, Optimism Ecosystem, Base Ecosystem, Index Coop Defi Index, Alameda Research Portfolio, DeFiance Capital Portfolio, Pantera Capital Portfolio, Energi Ecosystem, Polygon zkEVM Ecosystem, Huobi ECO Chain Ecosystem, Blockchain Capital Portfolio, Index Coop Index",balancer,90089507,97420351.0,8588.418780849466,9038.579164448498,0.14,9015599.0
KuCoin,"SocialFi, Coinbase Ventures Portfolio, Pantera Capital Portfolio, Andreessen Horowitz (a16z) Portfolio, Sequoia Capital Portfolio",deso,89918426,92276796.0,,,N/A,3718035.0
KuCoin,"Gaming (GameFi), XDC Ecosystem, Gaming Utility Token",gama-coin,89751544,138079374.0,,,N/A,2275082.0
KuCoin,"Artificial Intelligence (AI), Oracle, Ethereum Ecosystem, DePIN, Energi Ecosystem, Sora Ecosystem, GMCI DePIN Index, GMCI Index",iexec-rlc,88872229,106819461.0,6272.156534719347,21666.01422347283,0.07,10685926.0
KuCoin,"Infrastructure, Smart Contract Platform, Decentralized Finance (DeFi), BNB Chain Ecosystem, Avalanche Ecosystem, Polygon Ecosystem, Fantom Ecosystem, Harmony Ecosystem, Arbitrum Ecosystem, Ethereum Ecosystem, DWF Labs Portfolio, Layer 3 (L3), Outlier Ventures Portfolio",orbs,88816401,195049256.0,11245.053293341993,11066.773866614349,0.1,4741143.0
KuCoin,"Cronos Ecosystem, Bridged USDT, Bridged-Tokens, Bridged Stablecoins",cronos-bridged-usdt-cronos,87757980,87757980.0,,,N/A,304765.0
KuCoin,"Smart Contract Platform, Ethereum Ecosystem, Layer 2 (L2), Zero Knowledge (ZK), Restaking, Zircuit Ecosystem",zircuit,87464164,398483889.0,41558.607841679375,42107.07889809664,0.03,18633864.0
KuCoin,"Artificial Intelligence (AI), Virtual Reality, Launchpad, Ethereum Ecosystem, Telegram Apps, Discord Bots, PAAL AI Launchpad, AI Agents, AI Applications, AI Agent Launchpad, Binance Alpha Spotlight, AI Framework, DeFAI, Made in USA",paal-ai,86925358,97777417.0,1357.2333615246503,3270.977597468964,0.42,11399307.0
KuCoin,"Smart Contract Platform, Layer 1 (L1)",ong,86453088,211924397.0,,,N/A,2640278.0
KuCoin,"Stablecoins, USD Stablecoin, Ethereum Ecosystem, Sonic Ecosystem, Fiat-backed Stablecoin",frax-usd,86183642,86183642.0,,,N/A,1850573.0
KuCoin,"Smart Contract Platform, Bitcoin Sidechains, Stacks Ecosystem, SideChain",sbtc-2,86179203,86179203.0,,,N/A,45129.0
KuCoin,"Exchange-based Tokens, Centralized Exchange (CEX) Token, Ethereum Ecosystem",hashkey-ecopoints,86122011,649977443.0,56463.035234660325,58517.18072294817,0.36,4040005.0
KuCoin,"Decentralized Exchange (DEX), Decentralized Finance (DeFi), Arbitrum Ecosystem, Ethereum Ecosystem",tokenlon,86047324,103572255.0,,,N/A,34782.0
KuCoin,"Crypto-Backed Tokens, Ethereum Ecosystem",temple,85841353,86010465.0,,,N/A,14318.91
KuCoin,"NFT, Solana Ecosystem, NFT Marketplace",tensor,85780788,256362618.0,74813.41011651602,83467.74945303035,0.12,15784105.0
KuCoin,"Artificial Intelligence (AI), Smart Contract Platform, Gaming (GameFi), NFT, BNB Chain Ecosystem, Layer 1 (L1), Ethereum Ecosystem, Modular Blockchain, Chromia Ecosystem",chromaway,85777688,85777688.0,11811.100689404728,11334.63542569148,0.2,11254364.0
KuCoin,"Gaming (GameFi), Play To Earn, Ethereum Ecosystem, RPG, Alameda Research Portfolio, Circle Ventures Portfolio, OKX Ventures Portfolio, MMO",big-time,85347879,239913098.0,26698.7528714627,31750.962550830256,0.04,21530957.0
KuCoin,"Smart Contract Platform, Polkadot Ecosystem, Layer 1 (L1), Coinbase Ventures Portfolio, Binance Labs Portfolio",moonbeam,85129845,103662544.0,9473.635162945075,30956.52795808792,0.23,5799207.0
KuCoin,BNB Chain Ecosystem,metfi-2,85003124,198992834.0,,,N/A,388288.0
KuCoin,"Business Services, Polygon Ecosystem, Ethereum Ecosystem",request-network,84968223,110396402.0,6209.859324467294,12294.123330397339,0.23,4875545.0
KuCoin,"Smart Contract Platform, Layer 2 (L2), eGirl Capital Portfolio, Paradigm Portfolio, Blast Ecosystem",blast,84130949,317641998.0,11576.480894309096,14927.220732301015,0.31,7474325.0
KuCoin,"Smart Contract Platform, Gaming (GameFi), NFT, Layer 1 (L1), Play To Earn, Ethereum Ecosystem, Animoca Brands Portfolio, Gaming Blockchains, Pantera Capital Portfolio, OKX Ventures Portfolio",wax,83981940,90361984.0,3816.269399660568,4091.465987403541,0.25,5676997.0
KuCoin,"Polygon Ecosystem, XRP Ledger Ecosystem",crypto-trading-fund,83789870,83789870.0,,,N/A,6155.6
KuCoin,Ethereum Ecosystem,dkargo,82979291,88526982.0,,,N/A,1248732.0
KuCoin,"NFT, Polygon Ecosystem",sathosi-airlines-token,82922796,396029043.0,,,N/A,13269.56
KuCoin,"Solana Ecosystem, Polygon Ecosystem, DePIN, Pantera Capital Portfolio",geodnet,82702456,257962922.0,,,N/A,278547.0
KuCoin,"Exchange-based Tokens, Centralized Exchange (CEX) Token, Ethereum Ecosystem",bitmart-token,82627321,155660079.0,1535.5326284767827,1415.5531610592593,0.33,4473036.0
KuCoin,"Gaming (GameFi), NFT, BNB Chain Ecosystem, Metaverse, Collectibles, Polygon Ecosystem, Play To Earn, Harmony Ecosystem, Guild and Scholarship, Ethereum Ecosystem, Animoca Brands Portfolio, Base Ecosystem, DWF Labs Portfolio, Ronin Ecosystem, Gaming Governance Token, Andreessen Horowitz (a16z) Portfolio, Delphi Ventures Portfolio",yield-guild-games,82180268,200188981.0,12403.280584814058,15967.496932278156,0.05,13831187.0
KuCoin,"Decentralized Exchange (DEX), Decentralized Finance (DeFi), Yield Farming, Automated Market Maker (AMM), Solana Ecosystem, Coinbase Ventures Portfolio, DeFiance Capital Portfolio, Made in USA",orca,81613896,153189121.0,36110.82471071491,33625.633269303355,0.05,20171212.0
KuCoin,"Internet of Things (IOT), BNB Chain Ecosystem, Ethereum Ecosystem, DePIN, DWF Labs Portfolio",mass-vehicle-ledger,81471457,86117595.0,,,N/A,782325.0
KuCoin,"Exchange-based Tokens, Centralized Exchange (CEX) Token, Near Protocol Ecosystem, Harmony Ecosystem, Ethereum Ecosystem, Multicoin Capital Portfolio, Alameda Research Portfolio, Elastos Smart Contract Chain Ecosystem, Sequoia Capital Portfolio, Made in China",huobi-token,81449260,102727412.0,,,N/A,8385.95
KuCoin,"NFT, Ethereum Ecosystem",superrare,81166447,101411039.0,,,N/A,319254406.0
KuCoin,"Decentralized Finance (DeFi), BNB Chain Ecosystem, Arbitrum Ecosystem, Ethereum Ecosystem, Multicoin Capital Portfolio, Energi Ecosystem",dforce-token,81076285,81076285.0,,,N/A,14549932.0
KuCoin,"Berachain Ecosystem, Bridged USDT, Bridged-Tokens, Ink Ecosystem, Bridged Stablecoins",usdt0,80759263,80759263.0,,,N/A,159013.0
KuCoin,"Smart Contract Platform, Privacy, Proof of Work (PoW), Made in USA",verge,80476716,80637693.0,,,N/A,5227290.0
KuCoin,"Gaming (GameFi), Play To Earn, Guild and Scholarship, Ethereum Ecosystem, Animoca Brands Portfolio, Base Ecosystem, DWF Labs Portfolio, Ronin Ecosystem, Coinbase Ventures Portfolio, DeFiance Capital Portfolio, Pantera Capital Portfolio, Binance Labs Portfolio, MMO",zentry,80087602,117572343.0,,,N/A,5284552.0
KuCoin,"Artificial Intelligence (AI), BNB Chain Ecosystem, Solana Ecosystem, Ethereum Ecosystem, AI Agents, Alameda Research Portfolio",delysium,79860856,152395915.0,8517.051487706955,7622.658272170156,0.37,2472654.0
KuCoin,"Artificial Intelligence (AI), Infrastructure, Ethereum Ecosystem, AI Framework, Made in USA",arcblock,79791514,150550026.0,,,N/A,1178901.0
KuCoin,"Meme, Ethereum Ecosystem, PolitiFi",constitutiondao,79703170,79703170.0,27487.961408796768,51704.324077598154,0.13,22075686.0
KuCoin,"Blast Ecosystem, Bridged WETH, Bridged-Tokens",l2-standard-bridged-weth-blast,79677362,79677362.0,,,N/A,1117026.0
KuCoin,"Stablecoins, Decentralized Finance (DeFi), Lending/Borrowing Protocols, Ethereum Ecosystem",syrupusdc,79541672,79541672.0,,,N/A,114974.0
KuCoin,"Stablecoins, USD Stablecoin, Solana Ecosystem, Ethereum Ecosystem, Multicoin Capital Portfolio, Fiat-backed Stablecoin",paxos-standard,79283950,79283950.0,4805.208259738911,173.91144553510705,0.63,3587373.0
KuCoin,"BNB Chain Ecosystem, Liquid Staking Tokens",astherus-staked-bnb,79021050,79021050.0,,,N/A,521.53
KuCoin,"Smart Contract Platform, Proof of Stake (PoS)",stratis,79004308,87047967.0,3482.5871673444653,1113.6930295482302,1.36,813663.0
KuCoin,"Smart Contract Platform, Cosmos Ecosystem, Modular Blockchain, Osmosis Ecosystem, Rollups-as-a-Service (RaaS)",dymension,78576433,312276481.0,14775.51562959907,15993.338114959193,0.29,7288173.0
KuCoin,"Software as a service, Polygon Ecosystem, Ethereum Ecosystem, Decentralized Identifier (DID), Pantera Capital Portfolio, Energi Ecosystem, Blockchain Capital Portfolio",civic,78520469,97905820.0,15723.009795241098,18150.149559365727,0.41,8339706.0
KuCoin,"Decentralized Finance (DeFi), Solana Ecosystem, Real World Assets (RWA), Payment Solutions, DePIN, Coinbase Ventures Portfolio, Alameda Research Portfolio, Circle Ventures Portfolio, OKX Ventures Portfolio, RWA Protocol, Made in USA",zebec-network,78421573,105833694.0,6399.822916040693,8005.932402577047,0.36,34890317.0
KuCoin,BNB Chain Ecosystem,bitdca,78116652,83903502.0,,,N/A,86367.0
KuCoin,"Artificial Intelligence (AI), Smart Contract Platform, Decentralized Finance (DeFi), Analytics, NFT, BNB Chain Ecosystem, Launchpad, Ethereum Ecosystem, Telegram Apps, Discord Bots, ChainGPT Launchpad, Poolz Finance Launchpad, AI Agents, AI Applications, Binance Alpha Spotlight, AI Framework, DeFAI",chaingpt,78011262,96854202.0,7841.545610392065,16929.344310558194,0.22,21766758.0
KuCoin,"Decentralized Finance (DeFi), Wallets, Ethereum Ecosystem, Pundi AIFX Omnilayer Ecosystem",pundi-x-2,77824295,77824295.0,4258.785381576892,3357.1102664313917,0.17,6860938.0
KuCoin,"Smart Contract Platform, Layer 1 (L1), Osmosis Ecosystem, XRP Ledger Ecosystem",coreum,77628575,77628575.0,,,N/A,242283.0
KuCoin,"Ethereum Ecosystem, Stablecoin Protocol",level-usd,77627586,77627586.0,,,N/A,772833.0
KuCoin,"Artificial Intelligence (AI), BNB Chain Ecosystem, Ethereum Ecosystem, DragonFly Capital Portfolio, Binance Labs Portfolio, Delphi Ventures Portfolio, OKX Ventures Portfolio, Binance HODLer Airdrops, AI Agent Launchpad, Binance Alpha Spotlight, AI Framework",myshell,77355330,286501223.0,19740.399911799806,39487.88052744723,0.17,55642083.0
KuCoin,"Optimism Ecosystem, Bridged WBTC, Bridged-Tokens",optimism-bridged-wbtc-optimism,76922114,76922114.0,,,N/A,1686307.0
KuCoin,"Stablecoins, USD Stablecoin, Osmosis Ecosystem, Fiat-backed Stablecoin",usdx,76766823,76766823.0,,,N/A,23471.0
KuCoin,"Business Services, Decentralized Finance (DeFi), Oracle, Polygon Ecosystem, Gnosis Chain Ecosystem, Arbitrum Ecosystem, Ethereum Ecosystem, Optimism Ecosystem, Manta Network Ecosystem, Binance Labs Portfolio, Lisk Ecosystem, Made in USA",tellor,76567415,78795441.0,8617.573266299929,40336.576090173025,0.16,25041930.0
KuCoin,"Artificial Intelligence (AI), Decentralized Finance (DeFi), Ethereum Ecosystem, DePIN",pinlink,76433009,95541262.0,,,N/A,1860577.0
KuCoin,"Decentralized Finance (DeFi), Liquid Staking Tokens, Ethereum Ecosystem, LSDFi, Liquid Staked ETH, Liquid Staking",origin-ether,75714811,75714811.0,,,N/A,44624.0
KuCoin,"BNB Chain Ecosystem, Solana Ecosystem, Polygon Ecosystem, Meme, Ethereum Ecosystem, Cronos Ecosystem, Dog-Themed, Elon Musk-Inspired, Fuse Ecosystem",dogelon-mars,75326268,137044068.0,11017.420307101504,13752.607931233018,0.29,5103734.0
KuCoin,"Arbitrum Ecosystem, Bridge Governance Tokens, Base Ecosystem, Cross-chain Communication, OKX Ventures Portfolio",orbiter-finance,75320115,242968112.0,8912.414390494629,11778.119279843359,0.28,80150919.0
KuCoin,"Sports, BNB Chain Ecosystem",pixer-eternity,75261757,349748525.0,,,N/A,216147.0
KuCoin,Smart Contract Platform,songbird,75062580,89186350.0,,,N/A,336174.0
KuCoin,"Smart Contract Platform, Wallets, Layer 2 (L2), Osmosis Ecosystem",islamic-coin,75013446,904942775.0,325.2000635547306,958.878173552255,0.29,527988.0
KuCoin,"Smart Contract Platform, Polkadot Ecosystem, Layer 1 (L1), DePIN, Outlier Ventures Portfolio",peaq-2,74856064,440701230.0,40425.244313810275,36786.80847376591,0.1,10642086.0
KuCoin,"Decentralized Finance (DeFi), Lending/Borrowing Protocols, Moonbeam Ecosystem, Base Ecosystem, Coinbase Ventures Portfolio, Made in USA",moonwell-artemis,74631953,113791877.0,6198.671354641828,5732.604582044342,0.07,14051671.0
KuCoin,"Smart Contract Platform, Layer 1 (L1), Zero Knowledge (ZK)",ozone-chain,74397769,102553965.0,,,N/A,195180.0
KuCoin,"Optimism Ecosystem, Bridged WETH, Bridged-Tokens",l2-standard-bridged-weth-optimism,74099822,74099822.0,,,N/A,7139839.0
KuCoin,"Smart Contract Platform, Gaming (GameFi), Layer 1 (L1), Proof of Stake (PoS), Gaming Blockchains",oasys,74031190,191672102.0,825.9039750570308,775.2380835370698,1.81,626333.0
KuCoin,"Entertainment, Gaming (GameFi), NFT, Axie Infinity Ecosystem, Play To Earn, Ethereum Ecosystem, Ronin Ecosystem, Gaming Utility Token",smooth-love-potion,73603808,73603808.0,7094.801451734448,9829.346542529349,0.06,8964545.0
KuCoin,Retail,milk-alliance,73503654,164681212.0,84.84945722950745,811.9605795407934,1.95,3685632.0
KuCoin,"Meme, Ethereum Ecosystem, Mantle Ecosystem",puff-the-dragon,73380418,73380418.0,,,N/A,37947.0
KuCoin,"Gaming (GameFi), Play To Earn, TON Ecosystem, Tap to Earn, Arcade Games",watcoin-2,73151389,81211219.0,,,N/A,1010368.0
KuCoin,"Decentralized Exchange (DEX), Decentralized Finance (DeFi), Yield Farming, Automated Market Maker (AMM), BNB Chain Ecosystem, Avalanche Ecosystem, Arbitrum Ecosystem, Mantle Ecosystem, DeFiance Capital Portfolio, Delphi Ventures Portfolio, Dex Aggregator",joe,72291169,92577387.0,,,N/A,7705329.0
KuCoin,"Ethereum Ecosystem, DePIN",dent,72138902,75415746.0,7439.793983068853,6952.393384446044,0.24,6111005.0
KuCoin,"Decentralized Finance (DeFi), Oracle, Ethereum Ecosystem, DWF Labs Portfolio, Pantera Capital Portfolio",api3,71700700,89479345.0,13943.94732630695,13328.346808678509,0.15,14652617.0
KuCoin,"Smart Contract Platform, Gaming (GameFi), NFT, Binance Launchpool, Arbitrum Ecosystem, Layer 3 (L3), XAI Ecosystem, Gaming Blockchains, Outlier Ventures Portfolio",xai-blockchain,71123853,104805737.0,15980.02907334979,26663.343843004815,1.49,28555275.0
KuCoin,"Artificial Intelligence (AI), Cardano Ecosystem, Ethereum Ecosystem, AI Agents, Sora Ecosystem",singularitynet,71104576,107459444.0,,,N/A,29205.0
KuCoin,"Decentralized Exchange (DEX), Exchange-based Tokens, Decentralized Finance (DeFi), BNB Chain Ecosystem, Binance Launchpool, Polygon Ecosystem, Near Protocol Ecosystem, Arbitrum Ecosystem, Ethereum Ecosystem, DWF Labs Portfolio, Coinbase Ventures Portfolio, Alameda Research Portfolio, DeFiance Capital Portfolio, Pantera Capital Portfolio, Aurora Ecosystem, Energi Ecosystem, Binance Labs Portfolio, Galaxy Digital Portfolio",dodo,71078701,71078701.0,11362.886493276821,9693.894755507667,0.14,4593033.0
KuCoin,"Decentralized Finance (DeFi), Lending/Borrowing Protocols, Ethereum Ecosystem, Real World Assets (RWA), Coinbase Ventures Portfolio, Andreessen Horowitz (a16z) Portfolio, RWA Protocol, Made in USA",goldfinch,70913888,87716529.0,,,N/A,617848.0
KuCoin,"Artificial Intelligence (AI), Ethereum Ecosystem",0x0-ai-ai-smart-contract,70729480,70729480.0,,,N/A,168280.0
KuCoin,"Artificial Intelligence (AI), Decentralized Finance (DeFi), Solana Ecosystem, Arbitrum Ecosystem, Metis Ecosystem, AI Agents, Sonic Ecosystem, IOTA EVM Ecosystem, AI Applications, DeFAI",heyanon,70680709,116416025.0,,,N/A,3618513.0
KuCoin,"Stablecoins, Decentralized Finance (DeFi), USD Stablecoin, BNB Chain Ecosystem, Polygon Ecosystem, Gnosis Chain Ecosystem, Arbitrum Ecosystem, Ethereum Ecosystem, Optimism Ecosystem, Base Ecosystem, Crypto-backed Stablecoin, Fiat-backed Stablecoin",crvusd,70416634,70416634.0,,,N/A,6619835.0
KuCoin,"Decentralized Finance (DeFi), Ethereum Ecosystem, Binance Alpha Spotlight",avalon-2,70410606,433963672.0,,,N/A,30230906.0
KuCoin,"Decentralized Finance (DeFi), Lending/Borrowing Protocols, Arbitrum Ecosystem, Ethereum Ecosystem, Alameda Research Portfolio, Pantera Capital Portfolio",liquity,70279068,72219860.0,1229.7561431206302,1847.918015100626,0.07,10977890.0
KuCoin,"Gaming (GameFi), NFT, Collectibles, Play To Earn, Ethereum Ecosystem, Base Ecosystem, Energi Ecosystem",ecomi,70252627,80605941.0,,,N/A,2186400.0
KuCoin,"Stablecoins, USD Stablecoin, Seigniorage, Alleged SEC Securities, Osmosis Ecosystem, Stablecoin Protocol, DeFiance Capital Portfolio, Terra Classic Ecosystem, Binance Labs Portfolio, Delphi Ventures Portfolio, Galaxy Digital Portfolio, Fiat-backed Stablecoin",terrausd,69913226,99050469.0,13744.268235355265,16918.85890549655,0.08,7008369.0
KuCoin,"Tokenized Assets, Polygon Ecosystem, Arbitrum Ecosystem, Ethereum Ecosystem, Real World Assets (RWA), Starknet Ecosystem, Tokenized Treasury Bills (T-Bills)",spiko-us-t-bills-money-market-fund,69588146,69588146.0,,,N/A,0.0
KuCoin,"Lending/Borrowing Protocols, Solana Ecosystem, FTX Holdings, Coinbase Ventures Portfolio, Alameda Research Portfolio, DragonFly Capital Portfolio",solend,69360419,137087973.0,,,N/A,4718.89
KuCoin,"Smart Contract Platform, Ethereum Ecosystem, Layer 2 (L2), Zero Knowledge (ZK), Rollup, OKX Ventures Portfolio",taiko,69296851,655317503.0,22015.132332414898,45211.4127570545,0.15,19234448.0
KuCoin,"Artificial Intelligence (AI), Smart Contract Platform, Layer 1 (L1), Ethereum Ecosystem, Osmosis Ecosystem, AI Agents, AI Agent Launchpad",humans-ai,68817074,68817074.0,885.8650160998357,2967.5570291046292,0.55,228858.0
KuCoin,"Meme, Dog-Themed, TON Ecosystem, TON Meme",dogs-2,68776547,73201937.0,29852.082127424437,48317.63356705558,0.08,14314954.0
KuCoin,"Decentralized Finance (DeFi), Ethereum Ecosystem",elixir-finance,68683741,430189737.0,,,N/A,50343170.0
KuCoin,"Artificial Intelligence (AI), Business Services, Decentralized Finance (DeFi), Ethereum Ecosystem, Paradigm Portfolio, DragonFly Capital Portfolio, Energi Ecosystem",numeraire,68658977,91938199.0,7066.804629631792,14077.215727191142,0.15,7548774.0
KuCoin,"Decentralized Finance (DeFi), Lending/Borrowing Protocols, Solana Ecosystem, Binance Alpha Spotlight",kamino,68628959,508362658.0,197472.25831083982,202231.25167221605,0.13,7709317.0
KuCoin,"Artificial Intelligence (AI), Solana Ecosystem, DePIN",nosana,68391623,82004344.0,,,N/A,1034195.0
KuCoin,"Stablecoins, Decentralized Finance (DeFi), USD Stablecoin, BNB Chain Ecosystem, Avalanche Ecosystem, Arbitrum Ecosystem, Liquid Staking Tokens, Ethereum Ecosystem, Optimism Ecosystem, Fiat-backed Stablecoin",staked-frax,68275224,68275224.0,,,N/A,41.07
KuCoin,"Solana Ecosystem, Restaking, Liquid Restaking Tokens, Liquid Restaked SOL",renzo-restaked-sol,68088177,68088177.0,,,N/A,619785.0
KuCoin,"Decentralized Finance (DeFi), Ethereum Ecosystem, Restaking",kelp-gain,67668101,67668101.0,,,N/A,35583.0
KuCoin,"Artificial Intelligence (AI), Marketing, Analytics, BNB Chain Ecosystem, Ethereum Ecosystem, Animoca Brands Portfolio, Base Ecosystem, AI Agents, Binance Alpha Spotlight",cookie,67663634,150603950.0,12662.031778091758,10688.211662315623,0.28,20084955.0
KuCoin,"Decentralized Exchange (DEX), Decentralized Finance (DeFi), Sui Ecosystem, Animoca Brands Portfolio, OKX Ventures Portfolio, Dex Aggregator",cetus-protocol,67310140,98580647.0,3441.971407279554,17208.14720021591,0.06,11359526.0
KuCoin,"Solana Ecosystem, Wallets, Base Ecosystem, TON Ecosystem",bitget-wallet-token,67182897,470072637.0,,,N/A,3631.06
KuCoin,"Smart Contract Platform, Layer 1 (L1), Proof of Work (PoW), Privacy Blockchain",ergo,67131376,81954406.0,3190.2694372869596,4879.9515290418,0.29,86356.0
KuCoin,"Smart Contract Platform, Binance Launchpool, Layer 2 (L2), Scroll Ecosystem",scroll,66923393,352228383.0,241513.95392457844,138729.40201740494,0.06,17060018.0
KuCoin,"Base Ecosystem, Cybersecurity, Binance Labs Portfolio, OKX Ventures Portfolio, Binance Alpha Spotlight",goplus-security,66475954,366581856.0,8811.581878273228,33298.51877580654,0.03,41377305.0
KuCoin,Ethereum Ecosystem,saasgo,66190220,82737775.0,,,N/A,251919.0
KuCoin,"NFT, BNB Chain Ecosystem, Solana Ecosystem, Meme, Ethereum Ecosystem, Base Ecosystem, Hybrid Token Standards, Wojak-Themed",non-playable-coin,66130224,66130224.0,9254.90450550053,13236.889572084314,0.49,5691353.0
KuCoin,"Artificial Intelligence (AI), Launchpad, Base Ecosystem, AI Applications, Clanker Ecosystem, Binance Alpha Spotlight",tokenbot-2,66099539,66099539.0,,,N/A,5422641.0
KuCoin,SocialFi,steem,66090342,66144900.0,,,N/A,11519440.0
KuCoin,E-commerce,pay-coin,65855540,122363005.0,,,N/A,4297454.0
KuCoin,"Healthcare, Osmosis Ecosystem",medibloc,64968889,70370306.0,,,N/A,358789.0
KuCoin,"Smart Contract Platform, Layer 1 (L1), DWF Labs Portfolio, Radix Ecosystem",radix,64794347,79338857.0,4356.064691953096,11541.559804439064,0.16,1408549.0
KuCoin,"Stablecoins, USD Stablecoin, Fiat-backed Stablecoin",falcon-finance,64415695,64415695.0,,,N/A,39560.0
KuCoin,"Decentralized Finance (DeFi), BNB Chain Ecosystem, Solana Ecosystem, Wallets, Polygon Ecosystem, Ethereum Ecosystem, Binance Launchpad, DWF Labs Portfolio, Multicoin Capital Portfolio, Alameda Research Portfolio, Viction Ecosystem, Binance Labs Portfolio",coin98,64348416,71432111.0,7532.06043224861,9406.740952556624,0.28,14823959.0
KuCoin,"Artificial Intelligence (AI), BNB Chain Ecosystem, Ethereum Ecosystem, DePIN, AI Agents",netmind-token,64304101,204369563.0,,,N/A,1788065.0
KuCoin,Ethereum Ecosystem,devve,64275539,88260318.0,,,N/A,1432066.0
KuCoin,"Smart Contract Platform, Layer 1 (L1), Ethereum Ecosystem, Proof of Stake (PoS)",pundi-aifx,63709939,63709939.0,,,N/A,306446.0
KuCoin,"Infrastructure, Smart Contract Platform, BNB Chain Ecosystem, Avalanche Ecosystem, Polygon Ecosystem, Arbitrum Ecosystem, Ethereum Ecosystem, Optimism Ecosystem, Layer 2 (L2), Base Ecosystem, Binance Launchpad, Modular Blockchain, Layer 3 (L3), Rollup, Proof of Stake (PoS), Appchains, Binance Labs Portfolio",cartesi,63695504,74119360.0,8217.982770119059,12313.054577395946,0.27,7689277.0
KuCoin,"Decentralized Finance (DeFi), Lending/Borrowing Protocols, Ethereum Ecosystem, Real World Assets (RWA), Alameda Research Portfolio, Circle Ventures Portfolio, RWA Protocol",maple,63632677,161505118.0,,,N/A,2520733.0
KuCoin,BNB Chain Ecosystem,aventis-ai,63563913,163733368.0,,,N/A,60654.0
KuCoin,"BNB Chain Ecosystem, Binance Megadrop, BTCfi",solv-protocol,63540781,360004423.0,43978.20680551889,101844.95354960488,0.28,51408360.0
KuCoin,,ark,63427790,63979788.0,,,N/A,7911095.0
KuCoin,"Polkadot Ecosystem, Real World Assets (RWA), Coinbase Ventures Portfolio, Circle Ventures Portfolio, Galaxy Digital Portfolio, RWA Protocol",centrifuge,63384193,69452590.0,981.6029300044747,7728.4503315091515,0.4,1447505.0
KuCoin,"Gaming (GameFi), NFT, Ethereum Ecosystem",undeads-games,62792857,218444706.0,,,N/A,413285.0
KuCoin,"Smart Contract Platform, Layer 2 (L2), Made in USA",metal,62542858,62542858.0,7702.317961273771,13162.231598602593,0.12,474694.0
KuCoin,"BNB Chain Ecosystem, Meme, Binance Alpha Spotlight, Four.meme Ecosystem",test-3,61739680,61739680.0,13337.092664351401,13666.887593620524,0.31,53492193.0
KuCoin,"Artificial Intelligence (AI), Solana Ecosystem, Polygon Ecosystem, Gnosis Chain Ecosystem, Arbitrum Ecosystem, Celo Ecosystem, Ethereum Ecosystem, Optimism Ecosystem, Base Ecosystem, AI Agents, Mode Ecosystem, AI Agent Launchpad, Binance Alpha Spotlight, AI Framework, DeFAI",autonolas,61616806,180231515.0,,,N/A,250542.0
KuCoin,"Decentralized Finance (DeFi), Ethereum Ecosystem, Liquid Staking",usualx,61373393,61373393.0,,,N/A,270936.0
KuCoin,"Exchange-based Tokens, BNB Chain Ecosystem, Centralized Exchange (CEX) Token, Polygon Ecosystem, Ethereum Ecosystem",bit2me,61286201,61905254.0,,,N/A,67683.0
KuCoin,"Artificial Intelligence (AI), Infrastructure, Gaming (GameFi), NFT, Solana Ecosystem, Arbitrum Ecosystem, Impossible Finance Launchpad, Ethereum Ecosystem, Animoca Brands Portfolio, Base Ecosystem",carv,61254356,306133765.0,5988.641612910529,4875.941632318747,0.29,7569967.0
KuCoin,"Infrastructure, Smart Contract Platform",ardor,60758279,60758279.0,,,N/A,5621609.0
