KuCoin,"Mantle Ecosystem, Bridged USDT, Bridged-Tokens, Bridged Stablecoins",mantle-bridged-usdt-mantle,328470380,328827499.0,,,N/A,1238759.0
KuCoin,"Decentralized Finance (DeFi), Arbitrum Ecosystem, Ethereum Ecosystem, Real World Assets (RWA), Base Ecosystem, Coinbase Ventures Portfolio, Energi Ecosystem, Made in USA",reserve-rights-token,326147114,583450141.0,27798.751940150683,69106.20214825777,0.05,21365635.0
KuCoin,"Stablecoins, USD Stablecoin, BNB Chain Ecosystem, Avalanche Ecosystem, Polygon Ecosystem, Optimism Ecosystem, Fiat-backed Stablecoin, Binance-Peg Tokens",binance-peg-busd,322925540,322925540.0,,,N/A,7953431.0
KuCoin,"Artificial Intelligence (AI), Smart Contract Platform, Storage, BNB Chain Ecosystem, Layer 1 (L1), Ethereum Ecosystem, DePIN, DWF Labs Portfolio, Osmosis Ecosystem, GMCI DePIN Index, GMCI Index",aioz-network,312981881,317282530.0,34152.76209537281,20234.267875582704,0.22,7441086.0
KuCoin,"Decentralized Finance (DeFi), Lending/Borrowing Protocols, Ethereum Ecosystem, Base Ecosystem, Coinbase Ventures Portfolio, Pantera Capital Portfolio, Morpho Ecosystem, Binance Alpha Spotlight",morpho,311195754,1318356739.0,46458.572461828655,53703.30548571242,0.08,9006280.0
KuCoin,"Smart Contract Platform, Layer 1 (L1), MEV Protection, Proof of Work (PoW), Privacy Blockchain",verus-coin,310578384,310580892.0,,,N/A,5014.69
KuCoin,"Yield Aggregator, Ethereum Ecosystem, Binance Labs Portfolio, Polychain Capital Portfolio",stakestone-berachain-vault-token,308610144,308610144.0,,,N/A,823214.0
KuCoin,"Smart Contract Platform, Layer 1 (L1), Ethereum Ecosystem, Real World Assets (RWA), RWA Protocol, Made in USA",plume,303265777,1516328884.0,45916.72921205046,53032.60574132442,0.07,17152592.0
KuCoin,"Decentralized Finance (DeFi), Tron Ecosystem",just,297585059,297585059.0,18126.89594569389,28771.50695038787,0.13,17811366.0
KuCoin,"Artificial Intelligence (AI), Ethereum Ecosystem, DePIN, Energi Ecosystem, GMCI DePIN Index, GMCI Index",golem,293376626,293376626.0,979.9332382916767,2546.006986555483,0.17,14127456.0
KuCoin,"Solana Ecosystem, Arbitrum Ecosystem, Impossible Finance Launchpad, Ethereum Ecosystem, DePIN, Animoca Brands Portfolio",aethir,292020400,1552646639.0,157357.41835489083,157377.47458504746,0.05,23834741.0
KuCoin,"Decentralized Exchange (DEX), Exchange-based Tokens, Decentralized Finance (DeFi), Yield Farming, Derivatives, Synthetic Issuer, Avalanche Ecosystem, Polygon Ecosystem, Near Protocol Ecosystem, Fantom Ecosystem, Harmony Ecosystem, Ethereum Ecosystem, Optimism Ecosystem, Base Ecosystem, DWF Labs Portfolio, Paradigm Portfolio, Coinbase Ventures Portfolio, Index Coop Defi Index, Energi Ecosystem, Huobi ECO Chain Ecosystem, GMCI DeFi Index, Synthetic, Index Coop Index, GMCI Index, Coinbase 50 Index",havven,289938270,290300095.0,16020.605657087437,15956.767189898019,0.12,20166007.0
KuCoin,"Infrastructure, Ethereum Ecosystem, Data Availability, Restaking, Polychain Capital Portfolio, Made in USA",eigenlayer,286447236,2007588830.0,44480.29525121818,65734.91228672779,0.03,27741762.0
KuCoin,"Crypto-Backed Tokens, Wrapped-Tokens, Polygon Ecosystem, Arbitrum Ecosystem, Liquid Staking Tokens, Ethereum Ecosystem, Optimism Ecosystem, Base Ecosystem, Liquid Staked ETH, Liquid Staking",coinbase-wrapped-staked-eth,285355139,790647729.0,,,N/A,5201056.0
KuCoin,"Decentralized Exchange (DEX), Exchange-based Tokens, Decentralized Finance (DeFi), Automated Market Maker (AMM), BNB Chain Ecosystem, Avalanche Ecosystem, Polygon Ecosystem, Near Protocol Ecosystem, Harmony Ecosystem, Ethereum Ecosystem, FTX Holdings, Alameda Research Portfolio, DragonFly Capital Portfolio, Pantera Capital Portfolio, Energi Ecosystem, Binance Labs Portfolio, GMCI DeFi Index, Galaxy Digital Portfolio, Blockchain Capital Portfolio, Dex Aggregator, GMCI Index, Coinbase 50 Index",1inch,282524488,307686116.0,34496.81040326748,49813.3775529126,0.03,17300012.0
KuCoin,"Smart Contract Platform, Privacy, Masternodes, Alleged SEC Securities, Proof of Stake (PoS), Proof of Work (PoW), Made in USA",dash,281106831,281109330.0,11776.275435699315,25204.507420171343,0.04,32991239.0
KuCoin,"Polygon Ecosystem, Bridged WETH, Bridged-Tokens",polygon-pos-bridged-weth-polygon-pos,286181143,286181143.0,,,N/A,6379216.0
KuCoin,"Smart Contract Platform, Polkadot Ecosystem, Proof of Stake (PoS), Pantera Capital Portfolio, Made in USA, Coinbase 50 Index",kusama,274307248,274308041.0,14449.022038892268,25441.02387310595,0.06,8408227.0
KuCoin,"Liquid Staking Tokens, Ethereum Ecosystem, Liquid Staking",stader-ethx,273204676,273204676.0,,,N/A,95895.0
KuCoin,"BNB Chain Ecosystem, Wallets, Ethereum Ecosystem, Animoca Brands Portfolio, Binance Launchpad, Energi Ecosystem, Binance Labs Portfolio",safepal,272605784,272605784.0,3.7706882991469675,66.95028155541715,0.62,7298661.0
KuCoin,"Smart Contract Platform, Gaming (GameFi), NFT, Layer 1 (L1), Play To Earn, Gaming Blockchains, WEMIX Ecosystem",wemix-token,271814283,349509617.0,31.810044954755476,493.72621033888174,0.61,3972994.0
KuCoin,"Polygon Ecosystem, Bridged WBTC, Bridged-Tokens",polygon-bridged-wbtc-polygon-pos,270571350,270571350.0,,,N/A,3687402.0
KuCoin,"Smart Contract Platform, Ethereum Ecosystem, Real World Assets (RWA), DWF Labs Portfolio, Proof of Stake (PoS)",creditcoin-2,268500739,370843668.0,34573.69757521705,36480.639623947216,0.1,11248739.0
KuCoin,"Smart Contract Platform, Layer 2 (L2), Zero Knowledge (ZK), ZkSync Ecosystem, Consensys Portfolio, Blockchain Capital Portfolio, OKX Ventures Portfolio",zksync,266431762,1522467214.0,17494.28003179022,31172.885798790427,0.14,37255387.0
KuCoin,"Smart Contract Platform, DePIN, Proof of Stake (PoS), Made in USA",theta-fuel,265258584,265262890.0,8112.824540567211,16436.16647791242,0.28,1687782.0
KuCoin,"Solana Ecosystem, Arbitrum Ecosystem, Ethereum Ecosystem, Interoperability, Base Ecosystem, Multicoin Capital Portfolio, Cross-chain Communication, Made in USA",wormhole,264638749,911022288.0,128980.38991257938,132131.23963537038,0.11,34510445.0
KuCoin,"Exchange-based Tokens, Centralized Exchange (CEX) Token, Ethereum Ecosystem, Morph L2 Ecosystem",mx-token,260584660,1148199234.0,,,N/A,12255778.0
KuCoin,"Stablecoins, USD Stablecoin, Ethereum Ecosystem, Fiat-backed Stablecoin",elixir-deusd,260248330,260248330.0,,,N/A,49940022.0
KuCoin,"Gaming (GameFi), Binance Launchpool, Meme, Play To Earn, TON Ecosystem, TON Meme, Tap to Earn",notcoin,258025022,258025022.0,70597.37114578769,79090.24019797907,0.09,328161511.0
KuCoin,"Crypto-Backed Tokens, Decentralized Finance (DeFi), cToken, Ethereum Ecosystem",compound-wrapped-btc,258356855,258356855.0,,,N/A,0.0
KuCoin,"Decentralized Finance (DeFi), Ethereum Ecosystem, Restaking, Liquid Restaking Tokens, Liquid Staking",ether-fi-staked-btc,257240467,257240467.0,,,N/A,95853.0
KuCoin,"BRC-20, Bitcoin Ecosystem, Inscriptions",sats-ordinals,257051940,257051940.0,11879.075192008042,15358.82155210555,0.08,4760750.0
KuCoin,"Arbitrum Ecosystem, Liquid Staking Tokens, Ethereum Ecosystem, Liquid Staking",sweth,254815511,254822616.0,,,N/A,110375.0
KuCoin,"Meme, Cardano Ecosystem",snek,252889709,256116953.0,,,N/A,1065894.0
KuCoin,"Infrastructure, Decentralized Finance (DeFi), Sui Ecosystem",deep,251667908,1006671632.0,153823.15554634217,191283.12501774635,0.16,16639429.0
KuCoin,"Smart Contract Platform, BNB Chain Ecosystem, Avalanche Ecosystem, Polygon Ecosystem, Arbitrum Ecosystem, Ethereum Ecosystem, Optimism Ecosystem, Base Ecosystem, Multicoin Capital Portfolio, Layer 0 (L0), Cross-chain Communication, Circle Ventures Portfolio, Sequoia Capital Portfolio, OKX Ventures Portfolio",layerzero,253918040,2284404142.0,41058.79229791306,71129.0678053002,0.04,330980288.0
KuCoin,"Decentralized Finance (DeFi), BNB Chain Ecosystem, Polygon Ecosystem, Fantom Ecosystem, Arbitrum Ecosystem, Moonbeam Ecosystem, Liquid Staking Tokens, Ethereum Ecosystem, Optimism Ecosystem, Polygon zkEVM Ecosystem, Liquid Staking, Made in USA",frax-ether,251291984,251291984.0,,,N/A,1246162.0
KuCoin,"Stablecoins, Tokenized Assets, Tokenized Gold, BNB Chain Ecosystem, Real World Assets (RWA), Tokenized Commodities, Commodity-backed Stablecoin",quorium,250797836,250797836.0,,,N/A,95820.0
KuCoin,"Decentralized Finance (DeFi), Solana Ecosystem, LSDFi, Restaking, Stablecoin Protocol, Binance Labs Portfolio, Binance HODLer Airdrops, Polychain Capital Portfolio",solayer,244702031,1165247769.0,51458.435974953805,77066.3655618269,0.05,62405581.0
KuCoin,"Stablecoins, USD Stablecoin, BNB Chain Ecosystem, Avalanche Ecosystem, Near Protocol Ecosystem, Arbitrum Ecosystem, Ethereum Ecosystem, Tron Ecosystem, BitTorrent Ecosystem, Algorithmic Stablecoin, Fiat-backed Stablecoin",usdd,244867888,244868228.0,90271.63412803257,106553.84027529639,0.33,2850702.0
KuCoin,"Bridged USDC, Sonic Ecosystem, Bridged-Tokens, Bridged Stablecoins",sonic-bridged-usdc-e-sonic,244807013,244807013.0,,,N/A,12638458.0
KuCoin,"Decentralized Finance (DeFi), Solana Ecosystem, Liquid Staking Tokens, Liquid Staked SOL, Liquid Staking",bybit-staked-sol,245751949,245751949.0,,,N/A,1620020.0
KuCoin,"Smart Contract Platform, BNB Chain Ecosystem, GMCI Layer 1 Index, GMCI Index, Made in China",zilliqa,243191318,251642356.0,78887.69026899146,85942.38468597914,0.08,9392624.0
KuCoin,"Smart Contract Platform, Polkadot Ecosystem, Layer 1 (L1), Layer 2 (L2), Alameda Research Portfolio, Binance Labs Portfolio, OKX Ventures Portfolio",astar,242876691,267042145.0,44069.545666585094,52790.6012770144,0.06,2983030.0
KuCoin,"NFT, Ethereum Ecosystem, NFT Marketplace, FTX Holdings, NFTFi, eGirl Capital Portfolio, Paradigm Portfolio, GMCI DeFi Index, GMCI Index, Made in USA, Coinbase 50 Index",blur,242364182,323524655.0,24616.93808280484,34914.369728798316,0.19,27604680.0
KuCoin,"Infrastructure, Wallets, Gnosis Chain Ecosystem, Ethereum Ecosystem",safe,235659274,425657210.0,42767.68572026894,47245.776464506394,0.05,13411092.0
KuCoin,"Decentralized Finance (DeFi), Liquid Staking Tokens, Base Ecosystem, Liquid Staked ETH, Liquid Staking",super-oeth,234433488,234433488.0,,,N/A,88750.0
KuCoin,"Oracle, Ethereum Ecosystem",redstone-oracles,230497240,823204430.0,36351.749411467645,42375.55508723059,0.19,313702054.0
KuCoin,"Smart Contract Platform, Proof of Stake (PoS), Made in China",qtum,232400270,237376220.0,15867.122541164688,7164.237727808923,0.23,17382690.0
KuCoin,"Analytics, Avalanche Ecosystem, Meme, Cat-Themed, Made in USA",ket,230756293,230756293.0,,,N/A,5566304.0
KuCoin,"Smart Contract Platform, Interoperability, Layer 2 (L2), Rollup, Multicoin Capital Portfolio, Proof of Work (PoW), DragonFly Capital Portfolio, Sequoia Capital Portfolio, Blockchain Capital Portfolio, Polychain Capital Portfolio, Made in China",nervos-network,230921175,234568530.0,57483.39577098525,36187.9233802644,0.04,11215221.0
KuCoin,"Decentralized Exchange (DEX), Exchange-based Tokens, Decentralized Finance (DeFi), Derivatives, Perpetuals, Ethereum Ecosystem, Paradigm Portfolio",dydx,229995379,229995379.0,,,N/A,10834975.0
KuCoin,"Smart Contract Platform, Gaming (GameFi), Ethereum Ecosystem, Base Ecosystem, Card Games, Paradigm Portfolio, Gaming Blockchains, Gaming Utility Token",echelon-prime,228515273,451189020.0,,,N/A,4685436.0
KuCoin,"Solana Ecosystem, Avalanche Ecosystem, Polygon Ecosystem, Near Protocol Ecosystem, Harmony Ecosystem, Ethereum Ecosystem, Pantera Capital Portfolio, Energi Ecosystem, Made in USA",basic-attention-token,224640108,225290694.0,6502.583276884133,13921.801512145797,0.33,15476043.0
KuCoin,"Smart Contract Platform, BNB Chain Ecosystem, Layer 1 (L1), Proof of Stake (PoS), Pantera Capital Portfolio, Andreessen Horowitz (a16z) Portfolio, Binance Labs Portfolio, Blockchain Capital Portfolio, Privacy Blockchain, Polychain Capital Portfolio, Coinbase 50 Index",oasis-network,221578285,329249636.0,22228.714946259097,58326.32048399717,0.09,9433564.0
KuCoin,"Layer 1 (L1), VeChain Ecosystem",vethor-token,219204992,219331432.0,10850.77426085212,44437.69846184282,0.24,3901106.0
KuCoin,"BNB Chain Ecosystem, Polygon Ecosystem, Ethereum Ecosystem, Animoca Brands Portfolio, DWF Labs Portfolio, Alameda Research Portfolio, Energi Ecosystem, Binance Labs Portfolio",mask-network,218335072,218335072.0,54476.09812355078,72607.4091247664,0.03,19871504.0
KuCoin,"Decentralized Exchange (DEX), Decentralized Finance (DeFi), Automated Market Maker (AMM), Cosmos Ecosystem, Osmosis Ecosystem, Paradigm Portfolio, Evmos Ecosystem, Secret Ecosystem, GMCI DeFi Index, GMCI Index",osmosis,217587136,303130586.0,27690.346151806167,35217.49625937318,0.07,19440139.0
KuCoin,"Artificial Intelligence (AI), Solana Ecosystem, Meme, Solana Meme, AI Meme, AI Agents, Binance Alpha Spotlight, AI Framework, Made in USA",ai16z,216305156,216305156.0,89877.60806041778,139598.8916457096,0.15,37490303.0
KuCoin,"Artificial Intelligence (AI), Harmony Ecosystem, Arbitrum Ecosystem, Ethereum Ecosystem, DePIN, Coinbase Ventures Portfolio, Multicoin Capital Portfolio, Pantera Capital Portfolio, GMCI DePIN Index, GMCI Index, Coinbase 50 Index",livepeer,215607638,215607638.0,32650.873522031565,32163.50556175139,0.06,16950490.0
KuCoin,"Decentralized Exchange (DEX), Decentralized Finance (DeFi), Avalanche Ecosystem, Harmony Ecosystem, Ethereum Ecosystem, Coinbase Ventures Portfolio, Pantera Capital Portfolio, Energi Ecosystem, GMCI DeFi Index, Blockchain Capital Portfolio, GMCI Index, Made in USA",0x,215795894,254357341.0,16693.68553223542,21990.495575275076,0.12,21465526.0
KuCoin,"Gaming (GameFi), NFT, Collectibles, Polygon Ecosystem, Ethereum Ecosystem, Animoca Brands Portfolio, Gaming Blockchains, Made in USA",superfarm,214087170,473963256.0,28816.47550270251,27002.209770018864,0.21,21644489.0
KuCoin,"Decentralized Finance (DeFi), Aptos Ecosystem",abtc,211301258,211301258.0,,,N/A,168978.0
KuCoin,"Decentralized Exchange (DEX), BNB Chain Ecosystem, Solana Ecosystem, Ethereum Ecosystem, Real World Assets (RWA), Base Ecosystem, RWA Protocol",chex-token,211435520,211434990.0,,,N/A,1172793.0
KuCoin,"BNB Chain Ecosystem, Meme, AI Meme",ai-companions,212701694,212701694.0,,,N/A,3606588.0
KuCoin,"Gaming (GameFi), BNB Chain Ecosystem, Solana Ecosystem, Meme, Ethereum Ecosystem, Dog-Themed, Solana Meme, Gaming Utility Token",baby-doge-coin,208842541,530107396.0,24064.037974055158,9413.588425521828,0.08,10259219.0
KuCoin,"Liquid Staking Tokens, Ethereum Ecosystem, Base Ecosystem, Liquid Staked ETH, Liquid Staking",liquid-staked-ethereum,207928404,207928404.0,,,N/A,63097.0
KuCoin,"Artificial Intelligence (AI), Polkadot Ecosystem, Metaverse, Ethereum Ecosystem, Interoperability, Real World Assets (RWA), DePIN, Decentralized Science (DeSci), AI Agents",origintrail,207784309,208077685.0,10904.264584085779,9683.673936520727,0.29,3926435.0
KuCoin,"Decentralized Finance (DeFi), Yield Farming, BNB Chain Ecosystem, Avalanche Ecosystem, Polygon Ecosystem, Fantom Ecosystem, Arbitrum Ecosystem, Ethereum Ecosystem, Optimism Ecosystem, Linea Ecosystem, Bridge Governance Tokens, Base Ecosystem, FTX Holdings",stargate-finance,206722920,212795086.0,10511.235476393807,9678.114304616838,0.09,7256213.0
KuCoin,"Solana Ecosystem, Meme, Dog-Themed, Solana Meme, Bitcoin Ecosystem, Runes",dog-go-to-the-moon-rune,208069684,208069684.0,,,N/A,5756841.0
KuCoin,"Stablecoins, USD Stablecoin, Arbitrum Ecosystem, Ethereum Ecosystem, Base Ecosystem, Crypto-backed Stablecoin, Fiat-backed Stablecoin",gho,205195642,205195642.0,,,N/A,6677053.0
KuCoin,"Smart Contract Platform, Storage, Harmony Ecosystem, Ethereum Ecosystem, DePIN, Energi Ecosystem, Sora Ecosystem, GMCI DePIN Index, GMCI Index",holotoken,204624809,204624809.0,,,N/A,8591147.0
KuCoin,"BNB Chain Ecosystem, Meme",cheems-token,201834809,201834809.0,4193.993944340648,8862.454540553681,0.38,5303331.0
KuCoin,"Stablecoins, Ethereum Ecosystem",usda-2,201382541,201382541.0,,,N/A,626163.0
KuCoin,"Decentralized Finance (DeFi), Polygon Ecosystem, Ethereum Ecosystem, Coinbase Ventures Portfolio, Pantera Capital Portfolio",instadapp,198805494,504111586.0,,,N/A,635189.0
KuCoin,"Solana Ecosystem, Meme, Solana Meme, Pump.fun Ecosystem, Zoo-Themed, Memorial Themed",peanut-the-squirrel,199766676,199766676.0,97455.25744895746,109366.48502619004,0.1,177381247.0
KuCoin,"Solana Ecosystem, BRC-20, Bitcoin Ecosystem, Inscriptions",ordinals,197239833,197239833.0,59544.45674882709,84120.51329812055,0.11,69745219.0
KuCoin,"Smart Contract Platform, Layer 1 (L1), Celo Ecosystem, DWF Labs Portfolio, Coinbase Ventures Portfolio, Proof of Stake (PoS), Andreessen Horowitz (a16z) Portfolio, Optimism Superchain Ecosystem, Outlier Ventures Portfolio, Made in USA",celo,196773709,348106917.0,23321.699829956968,37436.543175548824,0.06,12073329.0
KuCoin,"Gambling (GambleFi), Gaming (GameFi), Ethereum Ecosystem",rollbit-coin,198340806,198340806.0,,,N/A,1059842.0
KuCoin,"Artificial Intelligence (AI), Exchange-based Tokens, Analytics, Derivatives, Perpetuals, Centralized Exchange (CEX) Token, Ethereum Ecosystem, Binance Launchpad, Coinbase Ventures Portfolio, Binance Labs Portfolio, Made in USA",arkham,196648097,531919359.0,43548.36644633631,54426.74161092027,0.06,41997345.0
KuCoin,"Smart Contract Platform, Layer 1 (L1), DePIN, Andreessen Horowitz (a16z) Portfolio, Made in USA",chia,196892257,447390336.0,9329.571169195822,17585.82342398998,0.05,7318427.0
KuCoin,"Smart Contract Platform, Privacy, Layer 1 (L1), Proof of Stake (PoS), Proof of Work (PoW), Blockchain Capital Portfolio, Made in USA",decred,196279269,196286685.0,1598.0140022040841,1954.409339526155,0.34,1712097.0
KuCoin,"Solana Ecosystem, Meme, Solana Meme, Cat-Themed, Murad Picks",popcat,193903324,193903324.0,41616.25845651125,47144.82568663756,0.1,47231245.0
KuCoin,"Infrastructure, Smart Contract Platform, NEO Ecosystem",gas,193636534,193636534.0,11896.033122800583,16595.078775948587,0.3,4945605.0
KuCoin,"Exchange-based Tokens, Ethereum Ecosystem",btse-token,191520204,236354968.0,,,N/A,3262495.0
KuCoin,"Infrastructure, Smart Contract Platform, Venom Ecosystem",venom,191964909,694048218.0,2330.7780500216113,1304.1567599337804,0.52,437742.0
KuCoin,"Infrastructure, Smart Contract Platform, BNB Chain Ecosystem, Layer 1 (L1), Ethereum Ecosystem, GMCI Layer 1 Index, Aelf Ecosystem, GMCI Index",aelf,187933048,253332794.0,9458.37982798151,8214.900141874039,0.2,11030812.0
KuCoin,"Smart Contract Platform, Storage, DePIN, Paradigm Portfolio, Proof of Work (PoW), DragonFly Capital Portfolio, Made in USA",siacoin,188052877,200987677.0,,,N/A,12682276.0
KuCoin,"Smart Contract Platform, Real World Assets (RWA), Proof of Work (PoW), Made in USA",ravencoin,185836137,185877243.0,16250.16663082199,13757.470510574802,0.24,5596379.0
KuCoin,"Gaming (GameFi), Ethereum Ecosystem, Decentralized Identifier (DID), Animoca Brands Portfolio, OKX Ventures Portfolio, Outlier Ventures Portfolio",mocaverse,185046161,860890632.0,46221.323347980244,37924.151953226596,0.12,15634602.0
KuCoin,"Crypto-Backed Tokens, Decentralized Finance (DeFi), Wrapped-Tokens, Ethereum Ecosystem",resolv-wstusr,184744046,165271259.0,,,N/A,162.11
KuCoin,"Meme, Cronos Ecosystem, AI Meme, Cronos zkEVM Ecosystem",agentfun-ai,185007149,185007149.0,,,N/A,4612.06
KuCoin,"Solana Ecosystem, Meme, Solana Meme, AI Meme, Pump.fun Ecosystem",act-i-the-ai-prophecy,183542881,183542881.0,36354.45665202173,42581.480724874185,0.17,25327350.0
KuCoin,"Decentralized Finance (DeFi), BNB Chain Ecosystem, Polygon Ecosystem, Fantom Ecosystem, Arbitrum Ecosystem, Moonbeam Ecosystem, Liquid Staking Tokens, Ethereum Ecosystem, Optimism Ecosystem, Liquid Staked ETH, Liquid Staking",staked-frax-ether,182604989,182604989.0,,,N/A,37240.0
KuCoin,"Avalanche Ecosystem, Liquid Staking Tokens, Liquid Staking",benqi-liquid-staked-avax,180674365,180674365.0,,,N/A,2308988.0
KuCoin,"Solana Ecosystem, Ethereum Ecosystem, Energi Ecosystem",swissborg,180284674,180284674.0,,,N/A,5858547.0
KuCoin,"Meme, Ethereum Ecosystem, Base Ecosystem, Cat-Themed, Murad Picks",mog-coin,180398874,180398874.0,25669.41555821668,35098.74911714932,0.43,10161570.0
KuCoin,"Tourism, BNB Chain Ecosystem",trip,180460817,599496950.0,,,N/A,64626.0
KuCoin,"BNB Chain Ecosystem, Avalanche Ecosystem, Polygon Ecosystem, Fantom Ecosystem, Arbitrum Ecosystem, Ethereum Ecosystem, Optimism Ecosystem, Liquid Staking Governance Tokens, Linea Ecosystem, DePIN, Scroll Ecosystem, Rollups-as-a-Service (RaaS), Blast Ecosystem, Mode Ecosystem, Pantera Capital Portfolio, Polygon zkEVM Ecosystem, Binance Labs Portfolio, Liquid Staking, Made in USA",ankr,180103190,180103190.0,7472.716181344827,13068.183541400005,0.11,11182585.0
KuCoin,"Solana Ecosystem, Meme, Cat-Themed",meow,173145561,173145561.0,,,N/A,323034.0
KuCoin,,nem,177851685,177851685.0,2380.7557306430926,1468.8579660705655,0.3,15024929.0
KuCoin,"Tokenized Real Estate, Tokenized Assets, Ethereum Ecosystem, Real World Assets (RWA), RWA Protocol",apf-coin,176648188,259366819.0,,,N/A,2944163.0
KuCoin,"Artificial Intelligence (AI), Smart Contract Platform, Layer 1 (L1), Paradigm Portfolio, Coinbase Ventures Portfolio, DeFiance Capital Portfolio, Polychain Capital Portfolio, Vana Ecosystem",vana,176504242,687678866.0,162107.88052428587,81873.42550573355,0.3,45318835.0
KuCoin,"Decentralized Finance (DeFi), Yield Farming, Yield Aggregator, Yearn Ecosystem, Avalanche Ecosystem, Polygon Ecosystem, Near Protocol Ecosystem, Gnosis Chain Ecosystem, Fantom Ecosystem, Harmony Ecosystem, Arbitrum Ecosystem, Ethereum Ecosystem, Optimism Ecosystem, Base Ecosystem, Index Coop Defi Index, Alameda Research Portfolio, Energi Ecosystem, Sora Ecosystem, Huobi ECO Chain Ecosystem, Blockchain Capital Portfolio, Index Coop Index",yearn-finance,175503378,190668762.0,16569.240363802837,19221.129073303375,0.02,21070341.0
KuCoin,"Decentralized Finance (DeFi), Launchpad, Ethereum Ecosystem, DWF Labs Portfolio, Coinbase Ventures Portfolio, Pantera Capital Portfolio, Blockchain Capital Portfolio",auction,174305509,202094016.0,13332.197262172009,123774.31238959689,0.3,103434592.0
KuCoin,"Launchpad, Meme, Base Ecosystem, Cat-Themed, Base Meme",toshi,173620310,173620310.0,22412.326785921505,21262.291233953718,0.05,19604184.0
KuCoin,"Gaming (GameFi), BNB Chain Ecosystem, Ethereum Ecosystem, TON Ecosystem",gmt-token,173242658,173242658.0,,,N/A,13755390.0
KuCoin,"Solana Ecosystem, Meme, Dog-Themed, Solana Meme, Cat-Themed",cat-in-a-dogs-world,172739604,172739604.0,47942.058050885615,67473.51233181372,0.05,7366478.0
KuCoin,"Starknet Ecosystem, Bridged-Tokens",bridged-wrapped-ether-starkgate,172143203,172143203.0,,,N/A,885789.0
KuCoin,"Internet of Things (IOT), Ethereum Ecosystem, DePIN, Base Ecosystem, Account Abstraction, GMCI DePIN Index, GMCI Index, Made in USA",iotex,169236670,169236670.0,7122.070259949054,18121.67813381996,0.06,9379719.0
KuCoin,"Smart Contract Platform, Privacy, Proof of Work (PoW)",mimblewimblecoin,169074972,169075356.0,,,N/A,40164.0
KuCoin,"Decentralized Finance (DeFi), Solana Ecosystem, Ethereum Ecosystem, Optimism Ecosystem, Base Ecosystem, Cross-chain Communication, BTCfi",threshold-network-token,168590838,185721687.0,16510.89933058763,17936.69989909623,0.18,13400097.0
KuCoin,Arbitrum Ecosystem,rcge,168805259,168805259.0,,,N/A,2.43
KuCoin,"Decentralized Finance (DeFi), Derivatives, Prediction Markets, Solana Ecosystem",drift-protocol,167473677,580496632.0,21534.139261210927,23228.976978182523,0.12,95789093.0
KuCoin,"Entertainment, Smart Contract Platform, Gaming (GameFi), NFT, Metaverse, Layer 1 (L1), Harmony Ecosystem, Ethereum Ecosystem, Gaming Blockchains, Energi Ecosystem",enjincoin,167285297,173074098.0,12978.833157882058,38653.92215688597,0.11,12630813.0
KuCoin,"Decentralized Finance (DeFi), Derivatives, Perpetuals, Avalanche Ecosystem, Arbitrum Ecosystem",gmx,167161405,167161457.0,10182.206713058762,12586.770798462885,0.06,53561096.0
KuCoin,"Decentralized Exchange (DEX), Decentralized Finance (DeFi), Yield Farming, Automated Market Maker (AMM), BNB Chain Ecosystem, Seigniorage, Solana Ecosystem, Avalanche Ecosystem, Polygon Ecosystem, Fantom Ecosystem, Harmony Ecosystem, Arbitrum Ecosystem, Moonriver Ecosystem, Ethereum Ecosystem, Liquid Staking Governance Tokens, Curve Ecosystem, Stablecoin Protocol, Polygon zkEVM Ecosystem, Evmos Ecosystem, Fraxtal Ecosystem, GMCI DeFi Index, Liquid Staking, GMCI Index, Made in USA",frax-share,165392531,186852996.0,6661.177273252207,6924.577252624626,0.21,48771956.0
KuCoin,"Smart Contract Platform, Gaming (GameFi), Layer 1 (L1), Ethereum Ecosystem, Modular Blockchain, Account Abstraction, Multicoin Capital Portfolio, Gaming Blockchains, Gaming Utility Token, Skale Ecosystem, Consensys Portfolio, Galaxy Digital Portfolio, Made in USA",skale,165035504,173611721.0,16383.922761778033,29505.366658896008,0.07,20473310.0
KuCoin,"Decentralized Finance (DeFi), Liquid Staking Tokens, Ethereum Ecosystem, Liquid Staked ETH, Liquid Staking",treehouse-eth,164800297,164800297.0,,,N/A,169154.0
KuCoin,"Decentralized Finance (DeFi), Ethereum Ecosystem, Stablecoin Protocol",tribe-2,163224147,358722144.0,,,N/A,57729.0
KuCoin,"Decentralized Finance (DeFi), Binance Launchpool, Arbitrum Ecosystem, Ethereum Ecosystem, Restaking, Liquid Restaking Governance Tokens, Ether.fi Ecosystem, Consensys Portfolio, OKX Ventures Portfolio",ether-fi,162605755,701896707.0,119708.86655732576,138839.7082344053,0.28,42965552.0
KuCoin,"Decentralized Finance (DeFi), Yield Farming, Yield Aggregator, Ethereum Ecosystem, Metagovernance, Curve Ecosystem, Yield Optimizer",convex-finance,162261133,197614368.0,5039.647554089417,10917.33142601435,0.18,10251760.0
KuCoin,"BNB Chain Ecosystem, Binance Alpha Spotlight",bnb48-club-token,163099950,163099950.0,,,N/A,129506.0
