KuCoin,"Decentralized Finance (DeFi), Binance Launchpool, Arbitrum Ecosystem, Ethereum Ecosystem, Restaking, Liquid Restaking Governance Tokens, Ether.fi Ecosystem, Consensys Portfolio, OKX Ventures Portfolio",ether-fi,160161958,691347921.0,111807.17742626311,136155.95561592415,0.14,57809417.0
KuCoin,"Solana Ecosystem, DePIN, Multicoin Capital Portfolio, Made in USA",hivemapper,159950006,248775388.0,27671.50669274108,27943.25367461581,0.64,1234756.0
KuCoin,"Smart Contract Platform, Layer 1 (L1), Proof of Stake (PoS), GMCI Layer 1 Index, GMCI Index, Made in USA",casper-network,159493703,165125367.0,13850.970525869498,12167.852859656712,0.16,12727890.0
KuCoin,"Meme, Ethereum Ecosystem, Frog-Themed, AI Meme",turbo,159416527,159416527.0,52304.26380173095,62460.13867912364,0.09,34700495.0
KuCoin,"Decentralized Finance (DeFi), Tron Ecosystem",sun-token,159314731,322549888.0,39526.27359346586,50943.30948188315,0.12,26043023.0
KuCoin,"Artificial Intelligence (AI), Meme, Base Ecosystem, AI Agents, Binance Alpha Spotlight, AI Framework",freysa-ai,159013037,159013037.0,,,N/A,604206.0
KuCoin,"Decentralized Exchange (DEX), Exchange-based Tokens, Decentralized Finance (DeFi), Automated Market Maker (AMM), BNB Chain Ecosystem, Derivatives, Perpetuals, Centralized Exchange (CEX) Token, Solana Ecosystem, Avalanche Ecosystem, Polygon Ecosystem, Near Protocol Ecosystem, Fantom Ecosystem, Arbitrum Ecosystem, Ethereum Ecosystem, ZkSync Ecosystem, Mantle Ecosystem, Linea Ecosystem, Base Ecosystem, DragonFly Capital Portfolio, Binance Labs Portfolio",woo-network,158809226,189132977.0,50761.06895111645,73019.35464521855,0.06,11905871.0
KuCoin,"Smart Contract Platform, BNB Chain Ecosystem, Layer 1 (L1), Ethereum Ecosystem, ZetaChain Ecosystem, Cross-chain Communication, Made in USA",zetachain,158142091,453905942.0,91052.41728998466,104433.23544608624,0.05,13187659.0
KuCoin,"SocialFi, Arbitrum Ecosystem",uxlink,156955723,464091433.0,15961.169856806777,22563.433052205753,0.11,23567651.0
KuCoin,"Decentralized Finance (DeFi), Derivatives, Prediction Markets, Solana Ecosystem",drift-protocol,155978857,540653331.0,19838.568230526253,20294.329150952897,0.11,71963387.0
KuCoin,"Gaming (GameFi), NFT, Solana Ecosystem, Animoca Brands Portfolio, FTX Holdings, Multicoin Capital Portfolio, Alameda Research Portfolio",metaplex,155666682,199474144.0,9035.682897689367,13591.650906237883,0.01,4394250.0
KuCoin,"Decentralized Exchange (DEX), Decentralized Finance (DeFi), Yield Farming, Automated Market Maker (AMM), BNB Chain Ecosystem, Seigniorage, Solana Ecosystem, Avalanche Ecosystem, Polygon Ecosystem, Fantom Ecosystem, Harmony Ecosystem, Arbitrum Ecosystem, Moonriver Ecosystem, Ethereum Ecosystem, Liquid Staking Governance Tokens, Curve Ecosystem, Stablecoin Protocol, Polygon zkEVM Ecosystem, Evmos Ecosystem, Fraxtal Ecosystem, GMCI DeFi Index, Liquid Staking, GMCI Index, Made in USA",frax-share,154710577,174786465.0,6798.193465928406,7099.25014847913,0.23,44199750.0
KuCoin,"Smart Contract Platform, Gaming (GameFi), Layer 1 (L1), Ethereum Ecosystem, Modular Blockchain, Account Abstraction, Multicoin Capital Portfolio, Gaming Blockchains, Gaming Utility Token, Skale Ecosystem, Consensys Portfolio, Galaxy Digital Portfolio, Made in USA",skale,154690090,162728699.0,15564.684799283394,25647.870602994815,0.08,14865270.0
KuCoin,"Smart Contract Platform, EthereumPoW Ecosystem, Proof of Work (PoW)",ethereum-pow-iou,153927457,153927457.0,1509.2517226292869,1842.7236854194643,0.3,5872002.0
KuCoin,"BNB Chain Ecosystem, Binance Alpha Spotlight",bnb48-club-token,153557322,153557322.0,,,N/A,242286.0
KuCoin,"Stablecoins, Ethereum Ecosystem, Crypto-backed Stablecoin",elixir-staked-deusd,152972190,152972190.0,,,N/A,1953171.0
KuCoin,"Internet of Things (IOT), Oracle, NFT, Metaverse, Ethereum Ecosystem, DePIN, Alleged SEC Securities, Made in USA",xyo-network,152514305,152514305.0,29849.56326819425,24825.061620540993,0.02,8904644.0
KuCoin,"Payment Solutions, Made in USA, Directed Acyclic Graph (DAG)",nano,152203408,152203408.0,275.80974594476714,1105.935725944138,0.52,5063298.0
KuCoin,BNB Chain Ecosystem,acet-token,151838228,198094203.0,,,N/A,766364.0
KuCoin,Smart Contract Platform,bitkub-coin,151319570,187339929.0,,,N/A,462525.0
KuCoin,"Smart Contract Platform, Layer 1 (L1), Layer 0 (L0), Made in USA, Directed Acyclic Graph (DAG)",constellation-labs,150618772,150618881.0,15639.260558917797,6504.969327778201,0.42,2879100.0
KuCoin,"Smart Contract Platform, Layer 1 (L1), Real World Assets (RWA), RWA Protocol",polymesh,149981998,149981998.0,14759.867438012063,22966.41600875056,0.23,2877240.0
KuCoin,"NFT, Solana Ecosystem, NFT Marketplace, Paradigm Portfolio, Sequoia Capital Portfolio",magic-eden,148419840,1112796350.0,46991.420096139096,24709.12573757158,0.25,20213074.0
KuCoin,"Smart Contract Platform, Masternodes, Zero Knowledge (ZK), Proof of Work (PoW), Made in USA",zencash,148000600,148004930.0,33294.91063336553,45189.42969732611,0.1,13907318.0
KuCoin,"BNB Chain Ecosystem, Binance-Peg Tokens",binance-peg-sol,146921697,146921697.0,,,N/A,4567726.0
KuCoin,"Smart Contract Platform, Crypto-Backed Tokens, Wrapped-Tokens, Layer 2 (L2), Mantle Ecosystem",wrapped-ether-mantle-bridge,145937330,145860075.0,,,N/A,5074510.0
KuCoin,"Exchange-based Tokens, Decentralized Finance (DeFi), Ethereum Ecosystem, Real World Assets (RWA), Alleged SEC Securities",lcx,145607169,147001434.0,,,N/A,2164290.0
KuCoin,"Crypto-Backed Tokens, BNB Chain Ecosystem, Wrapped-Tokens, Ethereum Ecosystem",wrapped-beacon-eth,145443673,145443673.0,,,N/A,6053492.0
KuCoin,"Internet of Things (IOT), Smart Contract Platform, Layer 1 (L1), Proof of Work (PoW), Made in USA",digibyte,144827997,144850549.0,13397.120015913113,15538.46769437269,0.24,5142353.0
KuCoin,"Smart Contract Platform, DWF Labs Portfolio, Proof of Stake (PoS)",waves,143557995,143557995.0,11685.365022021655,14992.862144527302,0.15,10627775.0
KuCoin,"Stablecoins, Ethereum Ecosystem, XRP Ledger Ecosystem, Fiat-backed Stablecoin, Made in USA",ripple-usd,141471102,141471102.0,,,N/A,30211400.0
KuCoin,"Binance Launchpool, Solana Ecosystem, Ethereum Ecosystem, Decentralized Science (DeSci)",bio-protocol,141137114,289092890.0,110095.23167148526,80756.09793987182,0.13,14776775.0
KuCoin,"Smart Contract Platform, Layer 1 (L1), Harmony Ecosystem, Animoca Brands Portfolio, Binance Launchpad, Binance Labs Portfolio, Made in USA",harmony,140130406,149816991.0,23708.046478168075,30442.981534530212,0.04,11339236.0
KuCoin,"Stablecoins, EUR Stablecoin, Solana Ecosystem, Avalanche Ecosystem, Ethereum Ecosystem, Base Ecosystem, Stellar Ecosystem",euro-coin,139713421,139713421.0,,,N/A,46831668.0
KuCoin,"Smart Contract Platform, Layer 1 (L1), Kadena Ecosystem, Multicoin Capital Portfolio, Proof of Work (PoW), Made in USA",kadena,139224982,139361088.0,17528.01836583023,37422.99061094987,0.02,5931221.0
KuCoin,"Tokenized Assets, Tokenized Gold, Real World Assets (RWA), Tokenized Commodities",kinesis-gold,138641361,138641361.0,,,N/A,141272928.0
KuCoin,"Alleged SEC Securities, Osmosis Ecosystem, DeFiance Capital Portfolio, Pantera Capital Portfolio, Binance Labs Portfolio, Delphi Ventures Portfolio, Galaxy Digital Portfolio, OKX Ventures Portfolio",terra-luna-2,138622014,217413185.0,28534.15002335786,34980.6362841283,0.05,18598541.0
KuCoin,"Gaming (GameFi), Play To Earn, Telegram Apps, TON Ecosystem, Tap to Earn, Arcade Games",hamster-kombat,138088253,214506024.0,19445.048723777712,37903.5101381785,0.05,26861604.0
KuCoin,"Crypto-Backed Tokens, Wrapped-Tokens, Avalanche Ecosystem",wrapped-avax,137652658,137652658.0,,,N/A,75153358.0
KuCoin,"Gaming (GameFi), NFT, BNB Chain Ecosystem, Solana Ecosystem, Polygon Ecosystem, Play To Earn, Move To Earn, Ethereum Ecosystem, Binance Launchpad, Gaming Governance Token, Sports Games, Alameda Research Portfolio, Binance Labs Portfolio, Sequoia Capital Portfolio",stepn,137318054,256806610.0,10129.290647666689,19539.916454859147,0.2,27568315.0
KuCoin,"Decentralized Finance (DeFi), Analytics, DeFi Index, Base Ecosystem",mag7-ssi,135794285,135794285.0,,,N/A,1857294.0
KuCoin,"Gaming (GameFi), Polkadot Ecosystem, NFT, Ethereum Ecosystem, Gaming Blockchains, Andreessen Horowitz (a16z) Portfolio, Binance Labs Portfolio, Galaxy Digital Portfolio, Made in USA",mythos,135035007,173846882.0,,,N/A,3088946.0
KuCoin,"BNB Chain Ecosystem, Arbitrum Ecosystem, Cardano Ecosystem, Ethereum Ecosystem, DePIN, Base Ecosystem, DWF Labs Portfolio",world-mobile-token,134958017,389952518.0,5326.053683085418,6618.522355309717,0.21,14406814.0
KuCoin,"Stablecoins, EUR Stablecoin, Polygon Ecosystem, Ethereum Ecosystem, Real World Assets (RWA), Fiat-backed Stablecoin",stasis-eurs,134758385,134758385.0,,,N/A,65430.0
KuCoin,"Liquid Staking Tokens, Aptos Ecosystem, Liquid Staking",amnis-aptos,133405768,133434029.0,,,N/A,86832.0
KuCoin,"Smart Contract Platform, Masternodes, Proof of Stake (PoS), Made in China",ontology,133173423,145911839.0,1924.646464459156,5862.212194473806,0.28,5969907.0
KuCoin,"Decentralized Exchange (DEX), Smart Contract Platform, Exchange-based Tokens, Decentralized Finance (DeFi), Arbitrum Ecosystem, Ethereum Ecosystem, Layer 2 (L2), Zero Knowledge (ZK), Loopring Ecosystem, Rollup, Energi Ecosystem",loopring,132448872,146042718.0,17160.791088477257,37498.63555971192,0.19,13306079.0
KuCoin,"Tokenized Assets, Real World Assets (RWA), Tokenized Silver, Tokenized Commodities",kinesis-silver,132072606,132072606.0,,,N/A,2384823.0
KuCoin,"Solana Ecosystem, Meme, Solana Meme, Murad Picks",gigachad-2,131399118,131399118.0,8746.628017857276,9030.325105903703,0.22,13467916.0
KuCoin,"Stablecoins, USD Stablecoin, Solana Ecosystem, Fiat-backed Stablecoin",global-dollar,130293603,130293603.0,,,N/A,545653.0
KuCoin,"Cronos Ecosystem, Bridged USDC, Bridged-Tokens, Bridged Stablecoins",cronos-bridged-usdc-cronos,129088271,129088271.0,,,N/A,1277714.0
KuCoin,"Smart Contract Platform, Base Ecosystem, Gaming Blockchains",b3,128200943,602089551.0,4009.2918469125225,15746.012700053,0.35,20959032.0
KuCoin,"BNB Chain Ecosystem, Harmony Ecosystem, Ethereum Ecosystem, Alameda Research Portfolio, Binance Labs Portfolio",swipe,127290371,127347808.0,7885.660480007037,19175.988329251682,0.1,4385812.0
KuCoin,"Decentralized Exchange (DEX), Decentralized Finance (DeFi), Gnosis Chain Ecosystem, MEV Protection, Arbitrum Ecosystem, Ethereum Ecosystem, Intent, Delphi Ventures Portfolio, Blockchain Capital Portfolio",cow-protocol,126560182,305235633.0,20300.69900513268,72302.61628547368,0.16,37213692.0
KuCoin,"Artificial Intelligence (AI), Binance Launchpool, Solana Ecosystem, DePIN, Animoca Brands Portfolio, Multicoin Capital Portfolio, Delphi Ventures Portfolio, OKX Ventures Portfolio, Made in USA",io,124167135,673665888.0,69269.83798233126,79379.78826960515,0.11,28741351.0
KuCoin,"BNB Chain Ecosystem, Tron Ecosystem",global-commercial-business,123711950,123711950.0,,,N/A,189841.0
KuCoin,"Artificial Intelligence (AI), Smart Contract Platform, BNB Chain Ecosystem, Solana Ecosystem, Layer 1 (L1), Polygon Ecosystem, Ethereum Ecosystem, DWF Labs Portfolio, Injective Ecosystem, OKX Ventures Portfolio",zignaly,123520150,171256391.0,,,N/A,3573483.0
KuCoin,"Smart Contract Platform, BNB Chain Ecosystem, Ethereum Ecosystem, Zero Knowledge (ZK), Animoca Brands Portfolio, Binance Labs Portfolio, OKX Ventures Portfolio",polyhedra-network,123457383,2044555384.0,155888.45600886652,179728.87532665196,0.24,7954306.0
KuCoin,"Decentralized Finance (DeFi), Insurance, Ethereum Ecosystem",nxm,123272663,123272663.0,,,N/A,0.0
KuCoin,"Tokenized Assets, Polygon Ecosystem, Arbitrum Ecosystem, Ethereum Ecosystem, Real World Assets (RWA), Starknet Ecosystem, Tokenized Treasury Bills (T-Bills)",eutbl,122515778,122515778.0,,,N/A,0.0
KuCoin,"Polygon Ecosystem, Bridged DAI, Bridged-Tokens, Bridged Stablecoins",polygon-pos-bridged-dai-polygon-pos,122265504,122265504.0,,,N/A,13007790.0
KuCoin,"Decentralized Exchange (DEX), Exchange-based Tokens, Decentralized Finance (DeFi), Yield Farming, Automated Market Maker (AMM), BNB Chain Ecosystem, Yearn Ecosystem, Solana Ecosystem, Avalanche Ecosystem, Polygon Ecosystem, Near Protocol Ecosystem, Fantom Ecosystem, Harmony Ecosystem, Arbitrum Ecosystem, Celo Ecosystem, Ethereum Ecosystem, Base Ecosystem, Alameda Research Portfolio, Pantera Capital Portfolio, Energi Ecosystem, Sora Ecosystem, Blockchain Capital Portfolio",sushi,121762474,177277041.0,21838.67397618031,33126.877235130894,0.06,27927315.0
KuCoin,"Business Services, Decentralized Finance (DeFi), Oracle, Fantom Ecosystem, Ethereum Ecosystem, Binance Launchpad, Osmosis Ecosystem, Energi Ecosystem, Binance Labs Portfolio, Sequoia Capital Portfolio",band-protocol,121387020,123188567.0,3027.9271430012177,7451.769305723435,0.14,10133413.0
KuCoin,"Smart Contract Platform, SocialFi, NFT, BNB Chain Ecosystem, Binance Launchpool, Ethereum Ecosystem, Decentralized Identifier (DID), Zero Knowledge (ZK), DWF Labs Portfolio, Coinbase Ventures Portfolio, Multicoin Capital Portfolio, Alameda Research Portfolio, DragonFly Capital Portfolio, Binance Labs Portfolio, Quest-to-Earn",project-galaxy,121222862,189782382.0,,,N/A,67318.0
KuCoin,"Arbitrum Ecosystem, Ethereum Ecosystem",reserve-protocol-eth-plus,119150181,119150181.0,,,N/A,1335407.0
KuCoin,"Arbitrum Ecosystem, Ethereum Ecosystem, Account Abstraction, Coinbase Ventures Portfolio, Binance Labs Portfolio, Consensys Portfolio, Outlier Ventures Portfolio",biconomy,118911486,127042729.0,4237.450352041339,27477.832684491157,0.32,16172027.0
KuCoin,"Exchange-based Tokens, BNB Chain Ecosystem, Centralized Exchange (CEX) Token",nkyc-token,118673193,118673193.0,,,N/A,233951.0
KuCoin,"Decentralized Finance (DeFi), Yield Farming, Lending/Borrowing Protocols, Ethereum Ecosystem, Real World Assets (RWA), Base Ecosystem, Binance Alpha Spotlight",syrup,117755936,188951269.0,12057.19792503626,21559.75879396291,0.38,13431304.0
KuCoin,"Smart Contract Platform, Ethereum Ecosystem, Zero Knowledge (ZK), Alleged SEC Securities, Privacy Blockchain",coti,116471741,129968369.0,5409.644155950179,16456.098915637685,0.31,15885902.0
KuCoin,"Smart Contract Platform, SocialFi, Layer 1 (L1), Gaming Blockchains",hive,116063977,,,,N/A,3208843.0
KuCoin,"Stablecoins, Ethereum Ecosystem, Base Ecosystem, Blast Ecosystem, Fiat-backed Stablecoin",anzen-usdz,115885575,115885575.0,,,N/A,224474.0
KuCoin,"Decentralized Finance (DeFi), Ethereum Ecosystem, Real World Assets (RWA), Coinbase Ventures Portfolio, Stablecoin Protocol, Binance Labs Portfolio, Galaxy Digital Portfolio",usual,115100460,126465247.0,94399.67047096239,112567.94387887476,0.12,17000971.0
KuCoin,"Solana Ecosystem, Polygon Ecosystem, Ethereum Ecosystem",m2-global-wealth-limited-mmx,114594967,367646748.0,,,N/A,86302.0
KuCoin,"BNB Chain Ecosystem, Ethereum Ecosystem, Payment Solutions, DWF Labs Portfolio",alchemy-pay,114531298,231671633.0,34468.44711990125,46964.242716167566,0.03,26672773.0
KuCoin,"Exchange-based Tokens, NFT, BNB Chain Ecosystem, Ethereum Ecosystem",swftcoin,114349332,114349332.0,4048.1724687775663,4693.476292262709,0.51,4058299.0
KuCoin,"Meme, Ethereum Ecosystem, Dog-Themed",neiro-3,113946670,113946670.0,,,N/A,56714927.0
KuCoin,"Smart Contract Platform, Proof of Stake (PoS), Sequoia Capital Portfolio",iostoken,113347288,113347288.0,7265.042308980395,16850.277103596447,0.21,186941184.0
KuCoin,"Decentralized Finance (DeFi), Derivatives, Synthetic Issuer, Ethereum Ecosystem, Synthetic",stp-network,113311341,113311341.0,,,N/A,71258145.0
KuCoin,"Smart Contract Platform, BNB Chain Ecosystem, Ethereum Ecosystem, Layer 2 (L2)",prometeus,113112624,119310576.0,3146.3278175102087,20968.703549395905,0.18,3145016.0
KuCoin,"Business Services, Infrastructure, Smart Contract Platform, Decentralized Finance (DeFi), Polygon Ecosystem, Arbitrum Ecosystem, Ethereum Ecosystem, Liquid Staking Governance Tokens, Coinbase Ventures Portfolio, Proof of Stake (PoS), Index Coop Defi Index, Consensys Portfolio, Liquid Staking, Index Coop Index",rocket-pool,111469846,111469846.0,7153.045445868767,26002.354516840183,0.19,9355904.0
KuCoin,"Big Data, Business Services, Infrastructure, Decentralized Finance (DeFi), Solana Ecosystem, FTX Holdings, DWF Labs Portfolio, Name Service",bonfida,111198050,112217912.0,2742.4798855067047,16001.619077917927,0.27,13378236.0
KuCoin,"Artificial Intelligence (AI), Smart Contract Platform, Layer 1 (L1), Proof of Work (PoW)",qubic-network,110897187,132633694.0,,,N/A,2676697.0
KuCoin,"Meme, PulseChain Ecosystem",the-grays-currency,110534030,110533971.0,,,N/A,290997.0
KuCoin,"Smart Contract Platform, BNB Chain Ecosystem, Layer 1 (L1), Ethereum Ecosystem, Decentralized Identifier (DID), Base Ecosystem, Gravity Alpha Ecosystem",g-token,110262523,182940019.0,7752.263030880345,8646.702554839512,0.33,11980892.0
KuCoin,"Arbitrum Ecosystem, Bridged USDC, Bridged-Tokens, Bridged Stablecoins",usd-coin-ethereum-bridged,110052560,110052560.0,,,N/A,38872902.0
KuCoin,"Decentralized Exchange (DEX), Decentralized Finance (DeFi), BNB Chain Ecosystem, Wallets, XRP Ledger Ecosystem",solo-coin,110041884,110041884.0,,,N/A,4344616.0
KuCoin,"Smart Contract Platform, Cross-chain Communication, Pantera Capital Portfolio",icon,108651688,109885556.0,1088.6089096019932,2253.929156612204,0.2,1140683.0
KuCoin,"Music, NFT, Ethereum Ecosystem, Coinbase Ventures Portfolio, Multicoin Capital Portfolio, Pantera Capital Portfolio, Energi Ecosystem, Binance Labs Portfolio",audius,108182490,108182490.0,6419.91060611341,7032.427879419596,0.24,19864061.0
KuCoin,"Tokenized Real Estate, Tokenized Assets, Gnosis Chain Ecosystem, RealT Tokens, Real World Assets (RWA), RWA Protocol",realtoken-ecosystem-governance,107258519,749013849.0,,,N/A,1669.86
KuCoin,"Smart Contract Platform, BNB Chain Ecosystem, Ethereum Ecosystem, DWF Labs Portfolio, Made in USA",proton,106427064,117966382.0,10492.50994060894,9601.786485499671,0.11,5127605.0
KuCoin,"Decentralized Finance (DeFi), Ethereum Ecosystem, Morpho Ecosystem",steakhouse-usdc-morpho-vault,106195148,106195148.0,,,N/A,0.0
KuCoin,"Smart Contract Platform, Decentralized Finance (DeFi), Binance Launchpool, Derivatives, Perpetuals, Ethereum Ecosystem, Layer 2 (L2), DragonFly Capital Portfolio, Pantera Capital Portfolio",aevo-exchange,106094667,117469725.0,2412.1232613732323,13293.574643653754,0.85,17814952.0
KuCoin,"Smart Contract Platform, Ethereum Ecosystem, Metis Ecosystem, Layer 2 (L2), DWF Labs Portfolio, Rollup, GMCI Layer 2 Index, OKX Ventures Portfolio, GMCI Index",metis-token,106093376,169604645.0,8963.735128165701,39529.56927577364,0.06,6289008.0
KuCoin,"Solana Ecosystem, Multicoin Capital Portfolio, Stablecoin Protocol, Alameda Research Portfolio, DeFiance Capital Portfolio",uxd-protocol-token,105752318,105752318.0,,,N/A,64.77
KuCoin,"Lending/Borrowing Protocols, Ethereum Ecosystem, Paradigm Portfolio, Coinbase Ventures Portfolio",euler,105729378,153810053.0,3326.582604381144,3424.7708524566574,0.02,4663766.0
KuCoin,"Gaming (GameFi), NFT, Metaverse, Play To Earn, Ethereum Ecosystem, Animoca Brands Portfolio, RPG, Gaming Governance Token, Adventure Games, Energi Ecosystem, Delphi Ventures Portfolio",illuvium,105382927,135806979.0,6443.98944698509,26980.651917474046,0.05,17575269.0
KuCoin,"Decentralized Finance (DeFi), BNB Chain Ecosystem, Real World Assets (RWA), DWF Labs Portfolio, Stellar Ecosystem",velo,105008678,341006479.0,49311.24481764747,41719.5787188293,0.11,17351584.0
KuCoin,"Stablecoins, BNB Chain Ecosystem",astherus-usdf,104898937,104898937.0,,,N/A,722187.0
KuCoin,"Solana Ecosystem, Meme, Solana Meme, PolitiFi, Made in USA",melania-meme,104661931,697745628.0,20947.123070588554,31678.692738487123,0.14,18600342.0
KuCoin,"NFT, Meme, Arbitrum Ecosystem, Ethereum Ecosystem, Anime-Themed, Binance HODLer Airdrops, Airdropped Tokens by NFT Projects",anime,104266782,188254602.0,46585.7787812653,53712.38186014568,0.12,17264660.0
KuCoin,"Artificial Intelligence (AI), Base Ecosystem, AI Agents, AI Applications, Made in USA",venice-token,102373794,244034986.0,26486.13891380486,28057.258078831368,0.2,8292164.0
KuCoin,"Polygon Ecosystem, Arbitrum Ecosystem, Ethereum Ecosystem, Optimism Ecosystem, Bridge Governance Tokens, Cross-chain Communication, Intent, Boba Network Ecosystem, Blockchain Capital Portfolio, Made in USA",across-protocol,102359119,253369286.0,57994.87496707004,57918.471876698335,0.2,31245367.0
KuCoin,"Decentralized Finance (DeFi), Yield Farming, Avalanche Ecosystem, Fantom Ecosystem, Arbitrum Ecosystem, Olympus Pro Ecosystem, Ethereum Ecosystem, Stablecoin Protocol",spell-token,102039952,126127105.0,,,N/A,46021614.0
KuCoin,"Big Data, Infrastructure, Storage, Cardano Ecosystem, DePIN",iagon,101696518,270454764.0,,,N/A,485845.0
KuCoin,"Business Services, Decentralized Finance (DeFi), Oracle, Derivatives, Synthetic Issuer, Avalanche Ecosystem, Ethereum Ecosystem, Blockchain Capital Portfolio, Synthetic, Made in USA",uma,101624020,146647146.0,13935.841922036303,26810.17549085272,0.08,11391820.0
KuCoin,"Artificial Intelligence (AI), Smart Contract Platform, Masternodes, DePIN, Proof of Work (PoW), Made in USA",zelcash,100708641,100739341.0,15674.828076492462,41323.82442220789,0.08,8669749.0
KuCoin,"NFT, Binance Launchpool, Meme, Ethereum Ecosystem, Binance Labs Portfolio, GMCI Meme Index, GMCI Index",memecoin-2,100565236,169484241.0,32099.534342148534,43715.76172712565,0.04,18685099.0
KuCoin,"Decentralized Exchange (DEX), Decentralized Finance (DeFi), Automated Market Maker (AMM), Ethereum Ecosystem, Cronos Ecosystem",vvs-finance,100275310,196042265.0,,,N/A,240843.0
KuCoin,"Bridged USDT, QL1 Ecosystem, Bridged-Tokens, Bridged Stablecoins",qusdt,99967509,99967509.0,,,N/A,27568.0
KuCoin,"Smart Contract Platform, Privacy, Layer 1 (L1), Proof of Stake (PoS), Proof of Work (PoW), Zano Ecosystem, Privacy Blockchain",zano,99613153,99620838.0,,,N/A,615356.0
KuCoin,"Stablecoins, LP Tokens, Ethereum Ecosystem",resolv-rlp,99509780,99509780.0,,,N/A,304354.0
KuCoin,"NFT, BNB Chain Ecosystem, Ethereum Ecosystem, Binance Launchpad, DWF Labs Portfolio, Binance Labs Portfolio",space-id,99009371,459189318.0,2914.8022062253767,14485.271755872673,0.13,19834248.0
KuCoin,"Solana Ecosystem, Liquid Staking Tokens, Liquid Staked SOL, Liquid Staking",drift-staked-sol,98590173,98590173.0,,,N/A,17188.71
KuCoin,"Infrastructure, Solana Ecosystem, Animoca Brands Portfolio, Cross-chain Communication, OKX Ventures Portfolio",zeus-network,98565923,257500728.0,30000.578586075586,32915.46282280109,0.08,11356247.0
KuCoin,"Crypto-Backed Tokens, Decentralized Finance (DeFi), Compound Tokens, cToken, Ethereum Ecosystem",compound-ether,97754680,97754680.0,,,N/A,166.01
KuCoin,"Solana Ecosystem, Meme, Frog-Themed, Solana Meme, GMCI Meme Index, GMCI Index",book-of-meme,97747135,97747135.0,91978.43761690415,95908.66957545943,0.07,51120333.0
KuCoin,"Smart Contract Platform, Polkadot Ecosystem, Binance Launchpool, Layer 2 (L2), Manta Network Ecosystem, Multicoin Capital Portfolio, Alameda Research Portfolio, DeFiance Capital Portfolio, Binance Labs Portfolio",manta-network,97361586,256019290.0,8064.0906283613685,15263.723541702575,0.04,29419999.0
KuCoin,"Solana Ecosystem, Meme, Base Ecosystem, AI Meme, AI Agents, Virtuals Protocol Ecosystem, Binance Alpha Spotlight, DeFAI",aixbt,97297344,113716569.0,74268.12679493541,76348.63267257344,0.09,55116303.0
KuCoin,"Smart Contract Platform, Ethereum Ecosystem, Layer 2 (L2), Optimism Superchain Ecosystem, Outlier Ventures Portfolio, Lisk Ecosystem",lisk,97193722,225585007.0,2783.148848384417,22054.098588936595,0.2,11671746.0
KuCoin,"Software as a service, Ethereum Ecosystem, Energi Ecosystem",status,97147121,166917373.0,,,N/A,6545413.0
KuCoin,"Solana Ecosystem, Payment Solutions, Viction Ecosystem",saros-finance,96715611,368440447.0,1797.8396936262207,1092.553850316919,0.83,740441.0
KuCoin,"Smart Contract Platform, BNB Chain Ecosystem, Binance Launchpool, Ethereum Ecosystem, Layer 2 (L2), Restaking, Rollups-as-a-Service (RaaS), Rollup, Binance Labs Portfolio",altlayer,96358391,345121461.0,14036.46833108414,10714.732407756037,0.23,14030191.0
KuCoin,"NFT, Polygon Ecosystem, Ethereum Ecosystem, Optimism Ecosystem",blockv,96277762,96277762.0,,,N/A,108566.0
KuCoin,"Artificial Intelligence (AI), Infrastructure, Smart Contract Platform, Oracle, Polkadot Ecosystem, Ethereum Ecosystem, Interoperability, Layer 2 (L2), Zero Knowledge (ZK), DePIN, DWF Labs Portfolio, Rollup, AI Agents, Sora Ecosystem, AI Framework, Made in USA",pha,96119590,122526676.0,14184.7795258434,13772.83665308032,0.17,26285130.0
KuCoin,"Gaming (GameFi), NFT, BNB Chain Ecosystem",infinitar-governance-token,95653478,473722019.0,,,N/A,9288440.0
KuCoin,"XDC Ecosystem, Telos Ecosystem",ecoin-2,95498064,207099463.0,,,N/A,5.24
KuCoin,"Infrastructure, Smart Contract Platform, Oracle, Layer 1 (L1), Animoca Brands Portfolio, Coinbase Ventures Portfolio, Cross-chain Communication, Made in USA",supra,95061333,845234359.0,26370.526804387246,26657.604171833016,0.04,14550769.0
KuCoin,"Gaming (GameFi), NFT, Kaia Ecosystem, Gaming Blockchains",bora,94962936,99329049.0,,,N/A,201899.0
KuCoin,"Fraxtal Ecosystem, Bridged-Tokens",l2-standard-bridged-frxusd,94459182,94459182.0,,,N/A,1040939.0
KuCoin,"Infrastructure, Smart Contract Platform, Ethereum Ecosystem, Data Availability, Modular Blockchain",avail,94332382,483129855.0,73098.80063164601,65837.88474079958,0.04,4654124.0
KuCoin,"Ethereum Ecosystem, DWF Labs Portfolio",adventure-gold,94031949,94031949.0,22469.874786030152,27788.03071830339,0.24,29144251.0
KuCoin,"Solana Ecosystem, Liquid Staking Tokens, Restaking, Liquid Restaking Tokens, Liquid Staked SOL, Liquid Staking, Liquid Restaked SOL",solayer-staked-sol,93851902,93851902.0,,,N/A,399688.0
KuCoin,Layer 1 (L1),oec-token,93672759,93672759.0,,,N/A,353254.0
KuCoin,"DaoMaker Launchpad, Ethereum Ecosystem, Real World Assets (RWA), Sequoia Capital Portfolio, Made in USA",clearpool,93335016,122817965.0,3570.3598027706566,36426.593848241966,0.24,3995375.0
