MEXC,"Artificial Intelligence (AI), Analytics, Base Ecosystem, Binance HODLer Airdrops",kaito,336950858,1395883877.0,41144.32909578371,60282.31490068868,0.04,133759048.0
MEXC,"Artificial Intelligence (AI), Smart Contract Platform, DePIN, Osmosis Ecosystem, Proof of Stake (PoS), Archway Ecosystem, Made in USA",akash-network,333079734,334217338.0,,,N/A,10967330.0
MEXC,"Smart Contract Platform, Gaming (GameFi), NFT, BNB Chain Ecosystem, Binance Launchpool, Avalanche Ecosystem, Ethereum Ecosystem, DWF Labs Portfolio, Gaming Blockchains, Avalanche L1",beam-2,331891411,386118535.0,238941.58557173618,282569.1207564406,0.24,21022324.0
MEXC,"Mantle Ecosystem, Bridged USDT, Bridged-Tokens, Bridged Stablecoins",mantle-bridged-usdt-mantle,327630453,327630453.0,,,N/A,628705.0
MEXC,"Solana Ecosystem, Meme, Ethereum Ecosystem, Base Ecosystem, Murad Picks, Stock market-themed",spx6900,325325013,325325013.0,19952.498373370025,88074.91951906988,0.31,19812330.0
MEXC,"Stablecoins, USD Stablecoin, BNB Chain Ecosystem, Avalanche Ecosystem, Polygon Ecosystem, Optimism Ecosystem, Fiat-backed Stablecoin, Binance-Peg Tokens",binance-peg-busd,323347135,323347135.0,,,N/A,4307815.0
MEXC,"Decentralized Exchange (DEX), Smart Contract Platform, Decentralized Finance (DeFi), Prediction Markets, Layer 1 (L1), Gnosis Chain Ecosystem, MEV Protection, Arbitrum Ecosystem, Ethereum Ecosystem, SideChain, Energi Ecosystem",gnosis,321386079,372320950.0,20532.09746622429,9919.084229197026,0.08,23561606.0
MEXC,"Meme, Base Ecosystem, Frog-Themed, Base Meme, The Boy’s Club",based-brett,321080086,321080088.0,,,N/A,23858854.0
MEXC,"Smart Contract Platform, Zero Knowledge (ZK), FTX Holdings, Paradigm Portfolio, Coinbase Ventures Portfolio, Multicoin Capital Portfolio, Proof of Stake (PoS), Pantera Capital Portfolio, Circle Ventures Portfolio, Privacy Blockchain, Polychain Capital Portfolio, Made in USA, Coinbase 50 Index",mina-protocol,317688730,317688730.0,6529.484463292676,9859.211403950289,0.73,14750806.0
MEXC,"Smart Contract Platform, Layer 1 (L1), MEV Protection, Proof of Work (PoW), Privacy Blockchain",verus-coin,313087663,313106471.0,,,N/A,9019.92
MEXC,"Decentralized Finance (DeFi), Arbitrum Ecosystem, Ethereum Ecosystem, Real World Assets (RWA), Base Ecosystem, Coinbase Ventures Portfolio, Energi Ecosystem, Made in USA",reserve-rights-token,314910478,563348732.0,46573.443515216975,40967.78931272235,0.21,22331296.0
MEXC,"Decentralized Finance (DeFi), Lending/Borrowing Protocols, Ethereum Ecosystem, Base Ecosystem, Coinbase Ventures Portfolio, Pantera Capital Portfolio, Morpho Ecosystem, Binance Alpha Spotlight",morpho,309230233,1310029981.0,9748.8617677471,15270.836117195271,0.11,12921947.0
MEXC,"Yield Aggregator, Ethereum Ecosystem, Binance Labs Portfolio, Polychain Capital Portfolio",stakestone-berachain-vault-token,306654005,306654005.0,,,N/A,1367366.0
MEXC,"Artificial Intelligence (AI), Smart Contract Platform, Storage, BNB Chain Ecosystem, Layer 1 (L1), Ethereum Ecosystem, DePIN, DWF Labs Portfolio, Osmosis Ecosystem, GMCI DePIN Index, GMCI Index",aioz-network,306345372,310507546.0,,,N/A,9105043.0
MEXC,"Smart Contract Platform, Layer 1 (L1), Ethereum Ecosystem, Real World Assets (RWA), RWA Protocol, Made in USA",plume,308561544,1542807721.0,74385.17073047448,57364.39276460984,0.01,40329612.0
MEXC,"Solana Ecosystem, Meme, Solana Meme, AI Meme, Pump.fun Ecosystem, Terminal of Truths, Binance Alpha Spotlight",fartcoin,300721985,300721985.0,38357.785949145196,41474.41609211252,0.06,119083666.0
MEXC,"Decentralized Finance (DeFi), Tron Ecosystem",just,298567837,298567837.0,52902.89752140178,50656.131719156154,0.03,22111109.0
MEXC,"Artificial Intelligence (AI), Ethereum Ecosystem, DePIN, Energi Ecosystem, GMCI DePIN Index, GMCI Index",golem,294664658,294664658.0,,,N/A,20159771.0
MEXC,"Solana Ecosystem, Arbitrum Ecosystem, Impossible Finance Launchpad, Ethereum Ecosystem, DePIN, Animoca Brands Portfolio",aethir,284770709,1514100673.0,38770.042872647486,76315.91077506467,0.17,27778477.0
MEXC,"Decentralized Exchange (DEX), Exchange-based Tokens, Decentralized Finance (DeFi), Yield Farming, Derivatives, Synthetic Issuer, Avalanche Ecosystem, Polygon Ecosystem, Near Protocol Ecosystem, Fantom Ecosystem, Harmony Ecosystem, Ethereum Ecosystem, Optimism Ecosystem, Base Ecosystem, DWF Labs Portfolio, Paradigm Portfolio, Coinbase Ventures Portfolio, Index Coop Defi Index, Energi Ecosystem, Huobi ECO Chain Ecosystem, GMCI DeFi Index, Synthetic, Index Coop Index, GMCI Index, Coinbase 50 Index",havven,282515854,282868416.0,194828.44217120882,266590.57373110764,0.22,18445544.0
MEXC,"Crypto-Backed Tokens, Wrapped-Tokens, Polygon Ecosystem, Arbitrum Ecosystem, Liquid Staking Tokens, Ethereum Ecosystem, Optimism Ecosystem, Base Ecosystem, Liquid Staked ETH, Liquid Staking",coinbase-wrapped-staked-eth,281172756,782164313.0,,,N/A,4526963.0
MEXC,"Polygon Ecosystem, Bridged WETH, Bridged-Tokens",polygon-pos-bridged-weth-polygon-pos,277596416,277596416.0,,,N/A,14472981.0
MEXC,"Decentralized Exchange (DEX), Exchange-based Tokens, Decentralized Finance (DeFi), Automated Market Maker (AMM), BNB Chain Ecosystem, Avalanche Ecosystem, Polygon Ecosystem, Near Protocol Ecosystem, Harmony Ecosystem, Ethereum Ecosystem, FTX Holdings, Alameda Research Portfolio, DragonFly Capital Portfolio, Pantera Capital Portfolio, Energi Ecosystem, Binance Labs Portfolio, GMCI DeFi Index, Galaxy Digital Portfolio, Blockchain Capital Portfolio, Dex Aggregator, GMCI Index, Coinbase 50 Index",1inch,278439294,303237094.0,126960.51174724464,134072.4783475381,0.05,19544834.0
MEXC,"Infrastructure, Ethereum Ecosystem, Data Availability, Restaking, Polychain Capital Portfolio, Made in USA",eigenlayer,277554763,1945265207.0,426294.78677301056,395222.69281996327,0.09,34043689.0
MEXC,"Smart Contract Platform, Privacy, Masternodes, Alleged SEC Securities, Proof of Stake (PoS), Proof of Work (PoW), Made in USA",dash,275649217,275649217.0,35001.88810902998,86760.56243210346,0.04,28956820.0
MEXC,"BNB Chain Ecosystem, Wallets, Ethereum Ecosystem, Animoca Brands Portfolio, Binance Launchpad, Energi Ecosystem, Binance Labs Portfolio",safepal,271547667,271547667.0,12497.756462940984,59060.35729263164,0.02,9306773.0
MEXC,"Liquid Staking Tokens, Ethereum Ecosystem, Liquid Staking",stader-ethx,271267535,271267535.0,,,N/A,149610.0
MEXC,"Polygon Ecosystem, Bridged WBTC, Bridged-Tokens",polygon-bridged-wbtc-polygon-pos,270762559,270762559.0,,,N/A,6750355.0
MEXC,"Smart Contract Platform, Polkadot Ecosystem, Proof of Stake (PoS), Pantera Capital Portfolio, Made in USA, Coinbase 50 Index",kusama,268616760,268616760.0,121851.84069754762,156047.1939072225,0.06,11250751.0
MEXC,"Smart Contract Platform, Ethereum Ecosystem, Real World Assets (RWA), DWF Labs Portfolio, Proof of Stake (PoS)",creditcoin-2,269323158,371979564.0,11549.458369534468,15660.027353906848,0.05,19011672.0
MEXC,"Stablecoins, USD Stablecoin, Ethereum Ecosystem, Fiat-backed Stablecoin",elixir-deusd,262626524,262626524.0,,,N/A,4573389.0
MEXC,"Exchange-based Tokens, Centralized Exchange (CEX) Token, Ethereum Ecosystem, Morph L2 Ecosystem",mx-token,262358932,1156017111.0,11717.154460125339,24635.605761553772,0.22,14514902.0
MEXC,"Smart Contract Platform, DePIN, Proof of Stake (PoS), Made in USA",theta-fuel,263065357,263114022.0,7066.906813656941,5217.074524111501,0.23,2443537.0
MEXC,"Decentralized Finance (DeFi), Ethereum Ecosystem, Restaking, Liquid Restaking Tokens, Liquid Staking",ether-fi-staked-btc,260172154,260172154.0,,,N/A,308617.0
MEXC,"Meme, Cardano Ecosystem",snek,258384345,261681708.0,11278.036894145522,19632.241172515674,0.09,1486295.0
MEXC,"Crypto-Backed Tokens, Decentralized Finance (DeFi), cToken, Ethereum Ecosystem",compound-wrapped-btc,258872189,258872189.0,,,N/A,0.0
MEXC,"Smart Contract Platform, Layer 2 (L2), Zero Knowledge (ZK), ZkSync Ecosystem, Consensys Portfolio, Blockchain Capital Portfolio, OKX Ventures Portfolio",zksync,260284173,1487338130.0,326346.286524598,386710.4469411997,0.29,44360465.0
MEXC,"BRC-20, Bitcoin Ecosystem, Inscriptions",sats-ordinals,256893489,256893489.0,349459.4309662262,358534.6165949552,0.08,8312830.0
MEXC,"Solana Ecosystem, Arbitrum Ecosystem, Ethereum Ecosystem, Interoperability, Base Ecosystem, Multicoin Capital Portfolio, Cross-chain Communication, Made in USA",wormhole,258100432,888514047.0,324236.03459256125,394663.6236856565,0.11,30789175.0
MEXC,"Arbitrum Ecosystem, Liquid Staking Tokens, Ethereum Ecosystem, Liquid Staking",sweth,252478383,252485423.0,,,N/A,327814.0
MEXC,"Stablecoins, Tokenized Assets, Tokenized Gold, BNB Chain Ecosystem, Real World Assets (RWA), Tokenized Commodities, Commodity-backed Stablecoin",quorium,250768037,250768037.0,,,N/A,83073.0
MEXC,"Smart Contract Platform, Gaming (GameFi), NFT, Layer 1 (L1), Play To Earn, Gaming Blockchains, WEMIX Ecosystem",wemix-token,251641847,323575959.0,573.1856215703014,2747.68394630537,1.81,5959352.0
MEXC,"Decentralized Finance (DeFi), Solana Ecosystem, LSDFi, Restaking, Stablecoin Protocol, Binance Labs Portfolio, Binance HODLer Airdrops, Polychain Capital Portfolio",solayer,246795367,1175216033.0,30801.424353061546,69684.41859064825,0.26,105318112.0
MEXC,"Decentralized Finance (DeFi), BNB Chain Ecosystem, Polygon Ecosystem, Fantom Ecosystem, Arbitrum Ecosystem, Moonbeam Ecosystem, Liquid Staking Tokens, Ethereum Ecosystem, Optimism Ecosystem, Polygon zkEVM Ecosystem, Liquid Staking, Made in USA",frax-ether,248828760,248828760.0,,,N/A,1385501.0
MEXC,"Smart Contract Platform, BNB Chain Ecosystem, GMCI Layer 1 Index, GMCI Index, Made in China",zilliqa,239699720,248030719.0,92600.39601771899,110467.7018751714,0.25,12141963.0
MEXC,"Bridged USDC, Sonic Ecosystem, Bridged-Tokens, Bridged Stablecoins",sonic-bridged-usdc-e-sonic,238626534,238626534.0,,,N/A,41201720.0
MEXC,"Smart Contract Platform, Polkadot Ecosystem, Layer 1 (L1), Layer 2 (L2), Alameda Research Portfolio, Binance Labs Portfolio, OKX Ventures Portfolio",astar,238594546,262333667.0,130860.22577565454,54034.729305793655,0.03,6071119.0
MEXC,"NFT, Ethereum Ecosystem, NFT Marketplace, FTX Holdings, NFTFi, eGirl Capital Portfolio, Paradigm Portfolio, GMCI DeFi Index, GMCI Index, Made in USA, Coinbase 50 Index",blur,236844203,316320878.0,161549.18180596028,205013.4635132226,0.25,27161340.0
MEXC,"Stablecoins, USD Stablecoin, BNB Chain Ecosystem, Avalanche Ecosystem, Near Protocol Ecosystem, Arbitrum Ecosystem, Ethereum Ecosystem, Tron Ecosystem, BitTorrent Ecosystem, Algorithmic Stablecoin, Fiat-backed Stablecoin",usdd,233313864,233313864.0,,,N/A,2930068.0
MEXC,"Decentralized Finance (DeFi), Liquid Staking Tokens, Base Ecosystem, Liquid Staked ETH, Liquid Staking",super-oeth,232236290,232236290.0,,,N/A,839054.0
MEXC,"Infrastructure, Wallets, Gnosis Chain Ecosystem, Ethereum Ecosystem",safe,230752884,416795093.0,28621.99886427252,28825.31478944575,0.07,14223628.0
MEXC,"Infrastructure, Decentralized Finance (DeFi), Sui Ecosystem",deep,231332322,925329287.0,403340.46676294116,455319.47133803245,0.2,16679711.0
MEXC,"Smart Contract Platform, BNB Chain Ecosystem, Avalanche Ecosystem, Polygon Ecosystem, Arbitrum Ecosystem, Ethereum Ecosystem, Optimism Ecosystem, Base Ecosystem, Multicoin Capital Portfolio, Layer 0 (L0), Cross-chain Communication, Circle Ventures Portfolio, Sequoia Capital Portfolio, OKX Ventures Portfolio",layerzero,230383996,2072677281.0,225539.94281017565,408400.4143027001,0.05,107780007.0
MEXC,"Smart Contract Platform, Proof of Stake (PoS), Made in China",qtum,226421811,231272160.0,80654.98632239258,150768.76628727018,0.14,18578644.0
MEXC,"Smart Contract Platform, Interoperability, Layer 2 (L2), Rollup, Multicoin Capital Portfolio, Proof of Work (PoW), DragonFly Capital Portfolio, Sequoia Capital Portfolio, Blockchain Capital Portfolio, Polychain Capital Portfolio, Made in China",nervos-network,226288566,229861119.0,21024.105438935505,46379.352314890195,0.02,13966966.0
MEXC,"Decentralized Exchange (DEX), Exchange-based Tokens, Decentralized Finance (DeFi), Derivatives, Perpetuals, Ethereum Ecosystem, Paradigm Portfolio",dydx,225612793,225612793.0,74197.51988424071,322952.4048070143,0.02,13559220.0
MEXC,"Solana Ecosystem, Avalanche Ecosystem, Polygon Ecosystem, Near Protocol Ecosystem, Harmony Ecosystem, Ethereum Ecosystem, Pantera Capital Portfolio, Energi Ecosystem, Made in USA",basic-attention-token,222898195,223543736.0,37894.15607941011,81214.5504490948,0.13,13103235.0
MEXC,"Analytics, Avalanche Ecosystem, Meme, Cat-Themed, Made in USA",ket,220490057,220490057.0,,,N/A,7530758.0
MEXC,"BNB Chain Ecosystem, Polygon Ecosystem, Ethereum Ecosystem, Animoca Brands Portfolio, DWF Labs Portfolio, Alameda Research Portfolio, Energi Ecosystem, Binance Labs Portfolio",mask-network,217925430,217925430.0,178557.41398849242,331127.1225349187,0.05,26893194.0
MEXC,"Layer 1 (L1), VeChain Ecosystem",vethor-token,216335116,216389496.0,368.95260245652685,9432.895219582633,0.32,3942743.0
MEXC,"Gaming (GameFi), Binance Launchpool, Meme, Play To Earn, TON Ecosystem, TON Meme, Tap to Earn",notcoin,220559599,220559599.0,152761.22431004688,223187.3610840804,0.14,136386041.0
MEXC,"Decentralized Exchange (DEX), Decentralized Finance (DeFi), Avalanche Ecosystem, Harmony Ecosystem, Ethereum Ecosystem, Coinbase Ventures Portfolio, Pantera Capital Portfolio, Energi Ecosystem, GMCI DeFi Index, Blockchain Capital Portfolio, GMCI Index, Made in USA",0x,213252069,251358950.0,62093.46724746923,68480.58494000384,0.12,25737591.0
MEXC,"Smart Contract Platform, BNB Chain Ecosystem, Layer 1 (L1), Proof of Stake (PoS), Pantera Capital Portfolio, Andreessen Horowitz (a16z) Portfolio, Binance Labs Portfolio, Blockchain Capital Portfolio, Privacy Blockchain, Polychain Capital Portfolio, Coinbase 50 Index",oasis-network,213767502,317643366.0,67100.75734330839,9426.82238731084,0.09,9681784.0
MEXC,"Decentralized Finance (DeFi), Aptos Ecosystem",abtc,210910588,210910588.0,,,N/A,30157.0
MEXC,"Artificial Intelligence (AI), Harmony Ecosystem, Arbitrum Ecosystem, Ethereum Ecosystem, DePIN, Coinbase Ventures Portfolio, Multicoin Capital Portfolio, Pantera Capital Portfolio, GMCI DePIN Index, GMCI Index, Coinbase 50 Index",livepeer,210056304,210056304.0,36914.5383764092,69431.03352278146,0.04,19116362.0
MEXC,"Decentralized Finance (DeFi), Solana Ecosystem, Liquid Staking Tokens, Liquid Staked SOL, Liquid Staking",bybit-staked-sol,207124328,207124328.0,,,N/A,4875529.0
MEXC,"BNB Chain Ecosystem, Meme, AI Meme",ai-companions,206454910,206454910.0,85.6462938357486,3058.5791256144903,0.19,3278644.0
MEXC,"Decentralized Exchange (DEX), Decentralized Finance (DeFi), Automated Market Maker (AMM), Cosmos Ecosystem, Osmosis Ecosystem, Paradigm Portfolio, Evmos Ecosystem, Secret Ecosystem, GMCI DeFi Index, GMCI Index",osmosis,207346406,288864074.0,59496.64428743562,98536.44150584875,0.07,11547338.0
MEXC,"Artificial Intelligence (AI), Solana Ecosystem, Meme, Solana Meme, AI Meme, AI Agents, Binance Alpha Spotlight, AI Framework, Made in USA",ai16z,207072350,207072350.0,68339.37723986484,53718.908182887266,0.05,51470033.0
MEXC,"Stablecoins, Ethereum Ecosystem",usda-2,206165228,206165228.0,,,N/A,214523.0
MEXC,"Artificial Intelligence (AI), Polkadot Ecosystem, Metaverse, Ethereum Ecosystem, Interoperability, Real World Assets (RWA), DePIN, Decentralized Science (DeSci), AI Agents",origintrail,206289950,206581217.0,,,N/A,7145170.0
MEXC,"Stablecoins, USD Stablecoin, Arbitrum Ecosystem, Ethereum Ecosystem, Base Ecosystem, Crypto-backed Stablecoin, Fiat-backed Stablecoin",gho,205341846,205341846.0,,,N/A,8657472.0
MEXC,"Smart Contract Platform, Gaming (GameFi), Ethereum Ecosystem, Base Ecosystem, Card Games, Paradigm Portfolio, Gaming Blockchains, Gaming Utility Token",echelon-prime,203547229,401891089.0,,,N/A,4687108.0
MEXC,"Liquid Staking Tokens, Ethereum Ecosystem, Base Ecosystem, Liquid Staked ETH, Liquid Staking",liquid-staked-ethereum,206098448,206098448.0,,,N/A,66896.0
MEXC,"Gaming (GameFi), BNB Chain Ecosystem, Solana Ecosystem, Meme, Ethereum Ecosystem, Dog-Themed, Solana Meme, Gaming Utility Token",baby-doge-coin,203782456,517263325.0,1642.2243449688142,5600.3563083784,0.15,15577003.0
MEXC,"Gaming (GameFi), NFT, Collectibles, Polygon Ecosystem, Ethereum Ecosystem, Animoca Brands Portfolio, Gaming Blockchains, Made in USA",superfarm,201631308,446387475.0,,,N/A,15493736.0
MEXC,"Smart Contract Platform, Storage, Harmony Ecosystem, Ethereum Ecosystem, DePIN, Energi Ecosystem, Sora Ecosystem, GMCI DePIN Index, GMCI Index",holotoken,202539386,202539386.0,55817.5202370572,36886.357252541566,0.26,10479500.0
MEXC,"Solana Ecosystem, Meme, Solana Meme, Pump.fun Ecosystem, Zoo-Themed, Memorial Themed",peanut-the-squirrel,199842727,199842727.0,446476.79921590333,661236.4974747945,0.1,403871758.0
MEXC,"Decentralized Exchange (DEX), BNB Chain Ecosystem, Solana Ecosystem, Ethereum Ecosystem, Real World Assets (RWA), Base Ecosystem, RWA Protocol",chex-token,197604388,197604388.0,5331.156798602847,6697.305642696543,0.15,1407978.0
MEXC,"Decentralized Finance (DeFi), Polygon Ecosystem, Ethereum Ecosystem, Coinbase Ventures Portfolio, Pantera Capital Portfolio",instadapp,197519847,500851567.0,186.45865697178257,268.74410281776034,0.3,957157.0
MEXC,"BNB Chain Ecosystem, Meme",cheems-token,202922998,202922998.0,105783.23179853841,6461.183116680188,0.25,5368875.0
MEXC,"Decentralized Finance (DeFi), Yield Farming, BNB Chain Ecosystem, Avalanche Ecosystem, Polygon Ecosystem, Fantom Ecosystem, Arbitrum Ecosystem, Ethereum Ecosystem, Optimism Ecosystem, Linea Ecosystem, Bridge Governance Tokens, Base Ecosystem, FTX Holdings",stargate-finance,195176456,200909462.0,88297.31666641399,120290.78740509022,0.05,5897038.0
MEXC,"Infrastructure, Smart Contract Platform, Venom Ecosystem",venom,194156632,702019814.0,5969.097096261392,17106.2230379124,0.32,2443155.0
MEXC,"Artificial Intelligence (AI), Exchange-based Tokens, Analytics, Derivatives, Perpetuals, Centralized Exchange (CEX) Token, Ethereum Ecosystem, Binance Launchpad, Coinbase Ventures Portfolio, Binance Labs Portfolio, Made in USA",arkham,193475591,523337952.0,234083.79494866,411216.50815113203,0.15,57073901.0
MEXC,"Solana Ecosystem, Meme, Solana Meme, Cat-Themed, Murad Picks",popcat,193845662,193845662.0,129885.49950846744,145643.49471597758,0.1,95510926.0
MEXC,"Solana Ecosystem, BRC-20, Bitcoin Ecosystem, Inscriptions",ordinals,194547062,194547062.0,755198.3599359049,1024188.549380107,0.22,91010757.0
MEXC,"Smart Contract Platform, Privacy, Layer 1 (L1), Proof of Stake (PoS), Proof of Work (PoW), Blockchain Capital Portfolio, Made in USA",decred,192835887,192835887.0,52050.44862380409,6986.265346557313,0.28,2633138.0
MEXC,"Infrastructure, Smart Contract Platform, NEO Ecosystem",gas,191424487,191424487.0,,,N/A,4778499.0
MEXC,"Smart Contract Platform, Layer 1 (L1), Celo Ecosystem, DWF Labs Portfolio, Coinbase Ventures Portfolio, Proof of Stake (PoS), Andreessen Horowitz (a16z) Portfolio, Optimism Superchain Ecosystem, Outlier Ventures Portfolio, Made in USA",celo,191625489,338999344.0,,,N/A,15109203.0
MEXC,"Solana Ecosystem, Meme, Dog-Themed, Solana Meme, Bitcoin Ecosystem, Runes",dog-go-to-the-moon-rune,188801366,188801366.0,59.87433981198602,5674.224898069164,0.63,7699967.0
MEXC,"Smart Contract Platform, Layer 1 (L1), DePIN, Andreessen Horowitz (a16z) Portfolio, Made in USA",chia,189362753,430396723.0,1888.1324223289103,3233.6191106708316,0.23,5809379.0
MEXC,"Infrastructure, Smart Contract Platform, BNB Chain Ecosystem, Layer 1 (L1), Ethereum Ecosystem, GMCI Layer 1 Index, Aelf Ecosystem, GMCI Index",aelf,185738563,250374639.0,10659.756013048018,35426.431651254796,0.04,16717316.0
MEXC,"Crypto-Backed Tokens, Decentralized Finance (DeFi), Wrapped-Tokens, Ethereum Ecosystem",resolv-wstusr,184744046,165975365.0,,,N/A,162.11
MEXC,"Smart Contract Platform, Privacy, Proof of Work (PoW)",mimblewimblecoin,184652632,184656651.0,,,N/A,3869.96
MEXC,"Meme, Cronos Ecosystem, AI Meme, Cronos zkEVM Ecosystem",agentfun-ai,183305669,183305669.0,,,N/A,6708.61
MEXC,"Smart Contract Platform, Real World Assets (RWA), Proof of Work (PoW), Made in USA",ravencoin,184260248,184260248.0,72471.43030666541,60328.97554135388,0.08,10772283.0
MEXC,"Solana Ecosystem, Meme, Solana Meme, AI Meme, Pump.fun Ecosystem",act-i-the-ai-prophecy,184231520,184231520.0,181609.82588976817,471445.12914429425,0.05,49411524.0
MEXC,"Solana Ecosystem, Ethereum Ecosystem, Energi Ecosystem",swissborg,181819644,181819644.0,,,N/A,13120479.0
MEXC,"Gambling (GambleFi), Gaming (GameFi), Ethereum Ecosystem",rollbit-coin,184105290,184117464.0,,,N/A,602776.0
MEXC,"Smart Contract Platform, Storage, DePIN, Paradigm Portfolio, Proof of Work (PoW), DragonFly Capital Portfolio, Made in USA",siacoin,181473489,193943594.0,13833.600808922105,12641.688398974231,0.52,15415590.0
MEXC,"Tourism, BNB Chain Ecosystem",trip,180792637,600599269.0,,,N/A,41459.0
MEXC,"Decentralized Finance (DeFi), BNB Chain Ecosystem, Polygon Ecosystem, Fantom Ecosystem, Arbitrum Ecosystem, Moonbeam Ecosystem, Liquid Staking Tokens, Ethereum Ecosystem, Optimism Ecosystem, Liquid Staked ETH, Liquid Staking",staked-frax-ether,180631440,180631440.0,,,N/A,85235.0
MEXC,"Gaming (GameFi), Ethereum Ecosystem, Decentralized Identifier (DID), Animoca Brands Portfolio, OKX Ventures Portfolio, Outlier Ventures Portfolio",mocaverse,180342929,839009778.0,18236.265500288977,19464.22054362607,0.12,22821227.0
MEXC,"Artificial Intelligence (AI), Smart Contract Platform, Layer 1 (L1), Paradigm Portfolio, Coinbase Ventures Portfolio, DeFiance Capital Portfolio, Polychain Capital Portfolio, Vana Ecosystem",vana,178230539,694404697.0,29093.239900864897,107581.56718063579,0.07,30816350.0
MEXC,"BNB Chain Ecosystem, Avalanche Ecosystem, Polygon Ecosystem, Fantom Ecosystem, Arbitrum Ecosystem, Ethereum Ecosystem, Optimism Ecosystem, Liquid Staking Governance Tokens, Linea Ecosystem, DePIN, Scroll Ecosystem, Rollups-as-a-Service (RaaS), Blast Ecosystem, Mode Ecosystem, Pantera Capital Portfolio, Polygon zkEVM Ecosystem, Binance Labs Portfolio, Liquid Staking, Made in USA",ankr,178032089,178032089.0,70973.18669270277,93165.94585736518,0.06,15893451.0
MEXC,"Tokenized Real Estate, Tokenized Assets, Ethereum Ecosystem, Real World Assets (RWA), RWA Protocol",apf-coin,177308282,260336015.0,269.2462854701631,387.2529241610257,0.61,3212991.0
MEXC,"Exchange-based Tokens, Ethereum Ecosystem",btse-token,175815349,216973616.0,,,N/A,3212777.0
MEXC,,nem,176824001,176824001.0,,,N/A,20476991.0
MEXC,"Meme, Ethereum Ecosystem, Base Ecosystem, Cat-Themed, Murad Picks",mog-coin,175481782,175481782.0,1347.3069977934606,7756.9991675893925,0.16,14917140.0
MEXC,"Gaming (GameFi), BNB Chain Ecosystem, Ethereum Ecosystem, TON Ecosystem",gmt-token,175128437,175128437.0,3968.1874303774907,10476.1535332374,0.16,18852339.0
MEXC,"Launchpad, Meme, Base Ecosystem, Cat-Themed, Base Meme",toshi,173077599,173077599.0,12869.271317155946,11999.376650234797,0.24,28748951.0
MEXC,"Avalanche Ecosystem, Liquid Staking Tokens, Liquid Staking",benqi-liquid-staked-avax,172928431,172928431.0,,,N/A,2746461.0
MEXC,"Decentralized Finance (DeFi), Yield Farming, Yield Aggregator, Yearn Ecosystem, Avalanche Ecosystem, Polygon Ecosystem, Near Protocol Ecosystem, Gnosis Chain Ecosystem, Fantom Ecosystem, Harmony Ecosystem, Arbitrum Ecosystem, Ethereum Ecosystem, Optimism Ecosystem, Base Ecosystem, Index Coop Defi Index, Alameda Research Portfolio, Energi Ecosystem, Sora Ecosystem, Huobi ECO Chain Ecosystem, Blockchain Capital Portfolio, Index Coop Index",yearn-finance,171744133,186573840.0,24134.40938100864,29429.734702566548,0.05,25138580.0
MEXC,"Internet of Things (IOT), Ethereum Ecosystem, DePIN, Base Ecosystem, Account Abstraction, GMCI DePIN Index, GMCI Index, Made in USA",iotex,171131185,171131185.0,18786.57871594001,33482.320159647104,0.06,15212518.0
MEXC,"Decentralized Finance (DeFi), Launchpad, Ethereum Ecosystem, DWF Labs Portfolio, Coinbase Ventures Portfolio, Pantera Capital Portfolio, Blockchain Capital Portfolio",auction,167713876,194451527.0,145412.94592328154,208830.80979675637,0.1,130537125.0
MEXC,"Decentralized Finance (DeFi), Solana Ecosystem, Ethereum Ecosystem, Optimism Ecosystem, Base Ecosystem, Cross-chain Communication, BTCfi",threshold-network-token,169453998,186672555.0,30708.670823563385,65879.08730357737,0.18,9185265.0
MEXC,"Starknet Ecosystem, Bridged-Tokens",bridged-wrapped-ether-starkgate,169474913,169474913.0,,,N/A,911518.0
MEXC,"Solana Ecosystem, Meme, Dog-Themed, Solana Meme, Cat-Themed",cat-in-a-dogs-world,169478513,169478513.0,33776.73766460302,50427.19179380763,0.26,11397130.0
MEXC,Arbitrum Ecosystem,rcge,168805259,168805259.0,,,N/A,2.43
MEXC,"Entertainment, Smart Contract Platform, Gaming (GameFi), NFT, Metaverse, Layer 1 (L1), Harmony Ecosystem, Ethereum Ecosystem, Gaming Blockchains, Energi Ecosystem",enjincoin,166792372,172564494.0,58503.31348957606,83242.66183491358,0.09,13966512.0
MEXC,"Solana Ecosystem, Meme, Cat-Themed",meow,164592640,164592640.0,,,N/A,820100.0
MEXC,"Decentralized Finance (DeFi), Ethereum Ecosystem, Stablecoin Protocol",tribe-2,162913813,358040114.0,170.26208894981858,25.78804141189414,0.17,59403.0
MEXC,"Decentralized Finance (DeFi), Liquid Staking Tokens, Ethereum Ecosystem, Liquid Staked ETH, Liquid Staking",treehouse-eth,162990680,162990680.0,,,N/A,19920.22
MEXC,"Oracle, Ethereum Ecosystem",redstone-oracles,162999903,582142511.0,27186.640082445912,91179.90155874826,0.24,88665649.0
MEXC,"Decentralized Finance (DeFi), Yield Farming, Yield Aggregator, Ethereum Ecosystem, Metagovernance, Curve Ecosystem, Yield Optimizer",convex-finance,161784845,197033438.0,32364.657911462502,42815.44318239917,0.05,19139268.0
MEXC,"Decentralized Exchange (DEX), Exchange-based Tokens, Ethereum Ecosystem",coinex-token,161341513,161341513.0,,,N/A,119977.0
