MEXC,"Decentralized Exchange (DEX), Decentralized Finance (DeFi), Automated Market Maker (AMM), Base Ecosystem, Binance Alpha Spotlight, Made in USA",aerodrome-finance,342444275,667971225.0,7415.039579371842,16408.87581479968,0.28,39862453.0
MEXC,"Infrastructure, Wallets, Gnosis Chain Ecosystem, Ethereum Ecosystem",safe,341985138,603248213.0,11705.508731475364,17173.257185539314,0.08,46666447.0
MEXC,"Smart Contract Platform, Decentralized Finance (DeFi), Coinbase Ventures Portfolio, DeFiance Capital Portfolio, Pantera Capital Portfolio, YZi Labs (Prev. Binance Labs) Portfolio, Galaxy Digital Portfolio",terra-luna,334955736,399983751.0,47217.10525716958,67517.2832036402,0.05,14565255.0
MEXC,"Solana Ecosystem, Meme, Solana Meme, Binance HODLer Airdrops, Airdropped Tokens by NFT Projects, Made in USA",pudgy-penguins,324567045,396150125.0,64587.850518716295,72556.6129965845,0.02,57550797.0
MEXC,"BNB Chain Ecosystem, Meme",cheems-token,328742219,328742219.0,2971.4613625366687,2529.7819789386945,0.56,8061292.0
MEXC,"Stablecoins, USD Stablecoin, BNB Chain Ecosystem, Avalanche Ecosystem, Polygon Ecosystem, Optimism Ecosystem, Fiat-backed Stablecoin, Binance-Peg Tokens",binance-peg-busd,324059155,324059155.0,,,N/A,3460245.0
MEXC,"Meme, Base Ecosystem, Frog-Themed, Base Meme, The Boy’s Club",based-brett,325919170,325919170.0,,,N/A,26958186.0
MEXC,"Smart Contract Platform, BNB Chain Ecosystem, Avalanche Ecosystem, Polygon Ecosystem, Arbitrum Ecosystem, Ethereum Ecosystem, Optimism Ecosystem, Base Ecosystem, Multicoin Capital Portfolio, Layer 0 (L0), Cross-chain Communication, Circle Ventures Portfolio, Sequoia Capital Portfolio, OKX Ventures Portfolio",layerzero,328567148,2955993803.0,418805.47476982296,567848.0299872158,0.03,126631271.0
MEXC,"Decentralized Finance (DeFi), Tron Ecosystem",just,318158855,318158855.0,74710.3059077354,42872.96950968095,0.09,47821859.0
MEXC,"Decentralized Finance (DeFi), Near Protocol Ecosystem, Ethereum Ecosystem, Payment Solutions, Alleged SEC Securities, Pantera Capital Portfolio, Energi Ecosystem, Made in USA",amp-token,317799386,376045421.0,3962.12551868519,5048.960382733915,0.21,10850073.0
MEXC,"Artificial Intelligence (AI), Smart Contract Platform, DePIN, Osmosis Ecosystem, Proof of Stake (PoS), Archway Ecosystem, Made in USA",akash-network,319386070,320476904.0,,,N/A,15477456.0
MEXC,"Decentralized Exchange (DEX), Smart Contract Platform, Decentralized Finance (DeFi), Prediction Markets, Layer 1 (L1), Gnosis Chain Ecosystem, MEV Protection, Arbitrum Ecosystem, Ethereum Ecosystem, SideChain, Energi Ecosystem",gnosis,315775445,365821115.0,14546.843109466974,19942.200027503313,0.41,26054168.0
MEXC,"Smart Contract Platform, Oracle, Layer 1 (L1), Ethereum Ecosystem, Mantle Ecosystem, Cross-chain Communication, Consensys Portfolio",entangle,304806206,427464105.0,19.796402257055618,5.466358388656433,0.33,10337.85
MEXC,"Yield Aggregator, Ethereum Ecosystem, YZi Labs (Prev. Binance Labs) Portfolio, Polychain Capital Portfolio",stakestone-berachain-vault-token,304834402,304834402.0,,,N/A,745966.0
MEXC,"Smart Contract Platform, BNB Chain Ecosystem, Layer 1 (L1), Ethereum Ecosystem, Base Ecosystem, Proof of Stake (PoS), Pantera Capital Portfolio, Made in USA",chain-2,304615961,444377532.0,8108.111641436545,17890.758807522863,0.49,33692579.0
MEXC,"Solana Ecosystem, Meme, Dog-Themed, Solana Meme, Cat-Themed",cat-in-a-dogs-world,297940507,297940507.0,40734.005379094575,50247.87528561646,0.21,206442647.0
MEXC,"Decentralized Finance (DeFi), Solana Ecosystem, LSDFi, Restaking, Stablecoin Protocol, YZi Labs (Prev. Binance Labs) Portfolio, Binance HODLer Airdrops, Polychain Capital Portfolio",solayer,298194736,1419974934.0,48136.63639997911,62628.897964987635,0.26,126269703.0
MEXC,"Smart Contract Platform, Zero Knowledge (ZK), FTX Holdings, Paradigm Portfolio, Coinbase Ventures Portfolio, Multicoin Capital Portfolio, Proof of Stake (PoS), Pantera Capital Portfolio, Circle Ventures Portfolio, Privacy Blockchain, Polychain Capital Portfolio, Made in USA, Coinbase 50 Index",mina-protocol,297980967,297980967.0,145625.75786465252,156076.5130712053,0.04,16382860.0
MEXC,"Polygon Ecosystem, Bridged WETH, Bridged-Tokens",polygon-pos-bridged-weth-polygon-pos,295831715,295831715.0,,,N/A,12548073.0
MEXC,"Artificial Intelligence (AI), Smart Contract Platform, Storage, BNB Chain Ecosystem, Layer 1 (L1), Ethereum Ecosystem, DePIN, DWF Labs Portfolio, Osmosis Ecosystem, GMCI DePIN Index, GMCI Index",aioz-network,291858173,291946467.0,,,N/A,9683492.0
MEXC,"Decentralized Finance (DeFi), Lending/Borrowing Protocols, Ethereum Ecosystem, Base Ecosystem, Coinbase Ventures Portfolio, Pantera Capital Portfolio, Morpho Ecosystem, Binance Alpha Spotlight",morpho,291372432,1226373894.0,11670.96652336364,13311.456150423362,0.09,27607376.0
MEXC,"Smart Contract Platform, Ethereum Ecosystem, Real World Assets (RWA), DWF Labs Portfolio, Proof of Stake (PoS)",creditcoin-2,282629234,385915668.0,17725.780415240075,24857.23780612749,0.11,10047187.0
MEXC,"Exchange-based Tokens, Centralized Exchange (CEX) Token, Ethereum Ecosystem, Morph L2 Ecosystem",mx-token,279419021,1231188000.0,83695.12457168245,105608.57273155145,0.07,11804067.0
MEXC,"Polygon Ecosystem, Bridged WBTC, Bridged-Tokens",polygon-bridged-wbtc-polygon-pos,279134008,279134008.0,,,N/A,5500952.0
MEXC,"Smart Contract Platform, Layer 1 (L1), MEV Protection, Proof of Work (PoW), Privacy Blockchain, Mobile Mining",verus-coin,278521093,278522376.0,,,N/A,10470.39
MEXC,"Decentralized Finance (DeFi), Ethereum Ecosystem, Restaking, Liquid Restaking Tokens, Liquid Staking",ether-fi-staked-btc,277306838,277306907.0,,,N/A,2188921.0
MEXC,"Stablecoins, USD Stablecoin, BNB Chain Ecosystem, Avalanche Ecosystem, Near Protocol Ecosystem, Arbitrum Ecosystem, Ethereum Ecosystem, Tron Ecosystem, BitTorrent Ecosystem, Algorithmic Stablecoin, Fiat-backed Stablecoin",usdd,276360571,276363622.0,,,N/A,5734671.0
MEXC,"Smart Contract Platform, Privacy, Masternodes, Alleged SEC Securities, Proof of Stake (PoS), Proof of Work (PoW), Made in USA",dash,275249498,275264695.0,31855.944716223134,99118.85620272248,0.13,34564955.0
MEXC,"Solana Ecosystem, Payment Solutions, Viction Ecosystem",saros-finance,282004934,1074304583.0,644.4796436258424,344.95266039414423,2.7,3027693.0
MEXC,"Decentralized Exchange (DEX), Exchange-based Tokens, Decentralized Finance (DeFi), Automated Market Maker (AMM), BNB Chain Ecosystem, Avalanche Ecosystem, Polygon Ecosystem, Near Protocol Ecosystem, Harmony Ecosystem, Ethereum Ecosystem, FTX Holdings, Alameda Research Portfolio, DragonFly Capital Portfolio, Pantera Capital Portfolio, Energi Ecosystem, YZi Labs (Prev. Binance Labs) Portfolio, GMCI DeFi Index, Galaxy Digital Portfolio, Blockchain Capital Portfolio, Dex Aggregator, GMCI Index, Coinbase 50 Index",1inch,272627041,296737112.0,81411.15980745025,138900.2413216474,0.1,23607051.0
MEXC,"Liquid Staking Tokens, Ethereum Ecosystem, Liquid Staking",stader-ethx,270905469,270905469.0,,,N/A,51598.0
MEXC,"Crypto-Backed Tokens, Wrapped-Tokens, Polygon Ecosystem, Arbitrum Ecosystem, Liquid Staking Tokens, Ethereum Ecosystem, Optimism Ecosystem, Base Ecosystem, Liquid Staked ETH, Liquid Staking",coinbase-wrapped-staked-eth,265274271,778851708.0,,,N/A,1927958.0
MEXC,"Stablecoins, Tokenized Assets, Tokenized Gold, BNB Chain Ecosystem, Real World Assets (RWA), Tokenized Commodities, Commodity-backed Stablecoin",quorium,262752942,262752942.0,,,N/A,86663.0
MEXC,"BNB Chain Ecosystem, Wallets, Ethereum Ecosystem, Animoca Brands Portfolio, Binance Launchpad, Energi Ecosystem, YZi Labs (Prev. Binance Labs) Portfolio",safepal,261759460,261759460.0,20116.8679183342,14340.907296938643,0.1,8672045.0
MEXC,"Artificial Intelligence (AI), Ethereum Ecosystem, DePIN, Energi Ecosystem, GMCI DePIN Index, GMCI Index",golem,258208465,258208465.0,,,N/A,17878836.0
MEXC,"Smart Contract Platform, Polkadot Ecosystem, Proof of Stake (PoS), Pantera Capital Portfolio, Made in USA, Coinbase 50 Index",kusama,257779410,257793735.0,72975.74378191591,151328.47468413966,0.06,14236033.0
MEXC,"Meme, Cardano Ecosystem",snek,250758979,253796143.0,8812.013526043638,25949.26425556844,0.02,1097373.0
MEXC,"Arbitrum Ecosystem, Liquid Staking Tokens, Ethereum Ecosystem, Liquid Staking",sweth,251286593,251293600.0,,,N/A,86401.0
MEXC,"Solana Ecosystem, Arbitrum Ecosystem, Impossible Finance Launchpad, Ethereum Ecosystem, DePIN, Animoca Brands Portfolio",aethir,248134406,1319308691.0,22789.7727936486,34423.33091662882,0.32,54930012.0
MEXC,"Gaming (GameFi), NFT, Collectibles, Polygon Ecosystem, Ethereum Ecosystem, Animoca Brands Portfolio, Gaming Blockchains, Made in USA",superfarm,247701704,548381793.0,,,N/A,22913446.0
MEXC,"NFT, Ethereum Ecosystem, NFT Marketplace, FTX Holdings, NFTFi, eGirl Capital Portfolio, Paradigm Portfolio, GMCI DeFi Index, GMCI Index, Made in USA, Coinbase 50 Index",blur,244952960,323284988.0,196255.35158530684,187519.4550466538,0.08,19960163.0
MEXC,"Stablecoins, Ethereum Ecosystem, XRP Ledger Ecosystem, Fiat-backed Stablecoin, Made in USA",ripple-usd,243854874,243854874.0,,,N/A,63916536.0
MEXC,"Infrastructure, Smart Contract Platform, Venom Ecosystem",venom,243262656,857455743.0,13199.649922064815,15374.553966661608,0.32,399940.0
MEXC,"Smart Contract Platform, Layer 2 (L2), Zero Knowledge (ZK), ZkSync Ecosystem, Consensys Portfolio, Blockchain Capital Portfolio, OKX Ventures Portfolio",zksync,240736982,1375639897.0,175349.56197229703,238976.72999644422,0.18,30038660.0
MEXC,"Crypto-Backed Tokens, Decentralized Finance (DeFi), cToken, Ethereum Ecosystem",compound-wrapped-btc,241197671,241197671.0,,,N/A,0.0
MEXC,"Smart Contract Platform, DePIN, Proof of Stake (PoS), Made in USA",theta-fuel,239170393,239248705.0,3759.4976274908327,5697.412029639006,0.29,2100476.0
MEXC,"Decentralized Finance (DeFi), BNB Chain Ecosystem, Polygon Ecosystem, Fantom Ecosystem, Arbitrum Ecosystem, Moonbeam Ecosystem, Liquid Staking Tokens, Ethereum Ecosystem, Optimism Ecosystem, Polygon zkEVM Ecosystem, Liquid Staking, Made in USA",frax-ether,238728992,238728992.0,,,N/A,438647.0
MEXC,"Decentralized Exchange (DEX), Exchange-based Tokens, Decentralized Finance (DeFi), Yield Farming, Derivatives, Synthetic Issuer, Avalanche Ecosystem, Polygon Ecosystem, Near Protocol Ecosystem, Fantom Ecosystem, Harmony Ecosystem, Ethereum Ecosystem, Optimism Ecosystem, Base Ecosystem, DWF Labs Portfolio, Paradigm Portfolio, Coinbase Ventures Portfolio, Index Coop Defi Index, Energi Ecosystem, Huobi ECO Chain Ecosystem, GMCI DeFi Index, Synthetic, Index Coop Index, GMCI Index, Coinbase 50 Index",havven,239655274,239954349.0,245285.91750933306,323734.9045182877,0.1,34940546.0
MEXC,"Smart Contract Platform, Privacy, Proof of Work (PoW)",mimblewimblecoin,239546935,239549180.0,,,N/A,215176.0
MEXC,"Solana Ecosystem, Arbitrum Ecosystem, Ethereum Ecosystem, Interoperability, Base Ecosystem, Multicoin Capital Portfolio, Cross-chain Communication, Made in USA",wormhole,232765934,793251715.0,355106.64736576134,320222.0192089394,0.13,48576591.0
MEXC,"Gaming (GameFi), Binance Launchpool, Meme, Play To Earn, TON Ecosystem, TON Meme, Tap to Earn",notcoin,231628715,231628715.0,130993.26863520799,265653.6284633705,0.13,33718802.0
MEXC,"Analytics, Avalanche Ecosystem, Meme, Cat-Themed, Made in USA",ket,235337882,235337882.0,,,N/A,10742441.0
MEXC,"Artificial Intelligence (AI), Analytics, Base Ecosystem, Binance HODLer Airdrops",kaito,230707594,955750676.0,61280.836560776166,48577.981808333214,0.01,60896942.0
MEXC,"Smart Contract Platform, BNB Chain Ecosystem, GMCI Layer 1 Index, GMCI Index, Made in China",zilliqa,229886982,237846079.0,124562.19411765468,99345.02623959731,0.26,16710836.0
MEXC,"Solana Ecosystem, Meme, Cat-Themed",meow,224135163,224135163.0,,,N/A,39663.0
MEXC,"Infrastructure, Ethereum Ecosystem, Data Availability, Restaking, Polychain Capital Portfolio, Made in USA",eigenlayer,221344374,1553641156.0,234329.12130854087,315800.77444172616,0.17,40357312.0
MEXC,"Smart Contract Platform, Gaming (GameFi), NFT, Layer 1 (L1), Play To Earn, Gaming Blockchains, WEMIX Ecosystem",wemix-token,220132676,282917300.0,850.1110952711252,1106.1216093750827,1.15,1807101.0
MEXC,"Smart Contract Platform, Polkadot Ecosystem, Layer 1 (L1), Ethereum Ecosystem, Layer 2 (L2), Alameda Research Portfolio, YZi Labs (Prev. Binance Labs) Portfolio, OKX Ventures Portfolio",astar,220201808,242075719.0,28132.046307961093,37427.051729729654,0.07,9125738.0
MEXC,"Decentralized Finance (DeFi), Aptos Ecosystem",abtc,218996528,218996528.0,,,N/A,374360.0
MEXC,"Decentralized Exchange (DEX), Exchange-based Tokens, Decentralized Finance (DeFi), Derivatives, Perpetuals, Ethereum Ecosystem, Paradigm Portfolio",dydx,217155569,217155569.0,157537.16297831372,276608.78631073417,0.02,16237336.0
MEXC,"Smart Contract Platform, Interoperability, Layer 2 (L2), Rollup, Multicoin Capital Portfolio, Proof of Work (PoW), DragonFly Capital Portfolio, Sequoia Capital Portfolio, Blockchain Capital Portfolio, Polychain Capital Portfolio, Made in China",nervos-network,217398816,220848379.0,10398.725633418748,13419.378275832569,0.09,14041409.0
MEXC,"Meme, Cronos Ecosystem, AI Meme, Cronos zkEVM Ecosystem",agentfun-ai,215247218,215247218.0,,,N/A,17363.66
MEXC,"Stablecoins, USD Stablecoin, Arbitrum Ecosystem, Ethereum Ecosystem, Base Ecosystem, Crypto-backed Stablecoin, Fiat-backed Stablecoin",gho,213198097,213198097.0,,,N/A,12563162.0
MEXC,"Smart Contract Platform, Gaming (GameFi), Ethereum Ecosystem, Base Ecosystem, Card Games, Paradigm Portfolio, Gaming Blockchains, Gaming Utility Token",echelon-prime,214320901,411011544.0,,,N/A,9325825.0
MEXC,"Stablecoins, Ethereum Ecosystem",usda-2,212370574,212370574.0,,,N/A,165377.0
MEXC,"Crypto-Backed Tokens, Wrapped-Tokens, Avalanche Ecosystem",wrapped-avax,212728506,211241222.0,,,N/A,19249147.0
MEXC,"Decentralized Exchange (DEX), Decentralized Finance (DeFi), Avalanche Ecosystem, Harmony Ecosystem, Ethereum Ecosystem, Coinbase Ventures Portfolio, Pantera Capital Portfolio, Energi Ecosystem, GMCI DeFi Index, Blockchain Capital Portfolio, GMCI Index, Made in USA",0x,211618248,249433175.0,104640.69361593922,39701.840880665644,0.08,34863208.0
MEXC,"Artificial Intelligence (AI), Solana Ecosystem, Meme, Solana Meme, AI Meme, AI Agents, Binance Alpha Spotlight, AI Framework, Made in USA",ai16z,209866635,209866635.0,33149.50733512252,34787.87766523092,0.05,86309845.0
MEXC,"Smart Contract Platform, BNB Chain Ecosystem, Layer 1 (L1), Ethereum Ecosystem, ZetaChain Ecosystem, Cross-chain Communication, Made in USA, Chain Abstraction",zetachain,208683327,561637213.0,64207.5582293194,189213.79902866416,0.04,58243484.0
MEXC,"Solana Ecosystem, Avalanche Ecosystem, Polygon Ecosystem, Near Protocol Ecosystem, Harmony Ecosystem, Ethereum Ecosystem, Pantera Capital Portfolio, Energi Ecosystem, Made in USA",basic-attention-token,208201533,208804511.0,76439.70318998027,111381.34214973456,0.07,18550162.0
MEXC,"Liquid Staking Tokens, Ethereum Ecosystem, Base Ecosystem, Liquid Staked ETH, Liquid Staking",liquid-staked-ethereum,208407493,208407493.0,,,N/A,65073.0
MEXC,"Smart Contract Platform, Proof of Stake (PoS), Made in China",qtum,206560926,210935895.0,79432.57356816586,59693.65678542731,0.2,16334606.0
MEXC,"Stablecoins, USD Stablecoin, Ethereum Ecosystem, Fiat-backed Stablecoin",elixir-deusd,203399685,203399685.0,,,N/A,6508721.0
MEXC,"Decentralized Exchange (DEX), BNB Chain Ecosystem, Solana Ecosystem, Ethereum Ecosystem, Real World Assets (RWA), Base Ecosystem, RWA Protocol",chex-token,202092432,202092432.0,9672.50906701352,2670.6722374703463,0.1,1312112.0
MEXC,"Artificial Intelligence (AI), Exchange-based Tokens, Analytics, Derivatives, Perpetuals, Centralized Exchange (CEX) Token, Ethereum Ecosystem, Binance Launchpad, Coinbase Ventures Portfolio, YZi Labs (Prev. Binance Labs) Portfolio, Made in USA",arkham,200631213,517395608.0,496509.2530726925,472636.4240097014,0.19,80266236.0
MEXC,"Layer 1 (L1), VeChain Ecosystem",vethor-token,198888706,198891831.0,506.8888496284905,8025.5039324142845,0.18,5607827.0
MEXC,"Gaming (GameFi), BNB Chain Ecosystem, Solana Ecosystem, Meme, Ethereum Ecosystem, Dog-Themed, Solana Meme, Gaming Utility Token",baby-doge-coin,198259787,503245109.0,3977.8345166377026,15758.176977525824,0.07,20954429.0
MEXC,"Exchange-based Tokens, Ethereum Ecosystem",btse-token,197674844,243950405.0,,,N/A,1422954.0
MEXC,"Solana Ecosystem, Ethereum Ecosystem, Energi Ecosystem",swissborg,199702166,199702166.0,,,N/A,297747.0
MEXC,"Smart Contract Platform, Layer 1 (L1), Celo Ecosystem, DWF Labs Portfolio, Coinbase Ventures Portfolio, Proof of Stake (PoS), Andreessen Horowitz (a16z) Portfolio, Optimism Superchain Ecosystem, Outlier Ventures Portfolio, Made in USA",celo,193535156,340755869.0,,,N/A,23142415.0
MEXC,"Artificial Intelligence (AI), Harmony Ecosystem, Arbitrum Ecosystem, Ethereum Ecosystem, DePIN, Coinbase Ventures Portfolio, Multicoin Capital Portfolio, Pantera Capital Portfolio, GMCI DePIN Index, GMCI Index, Coinbase 50 Index",livepeer,192277861,192277861.0,45178.173138347636,50595.7622520355,0.02,23038418.0
MEXC,"Smart Contract Platform, Privacy, Layer 1 (L1), Proof of Stake (PoS), Proof of Work (PoW), Blockchain Capital Portfolio, Made in USA",decred,191305239,191322515.0,5919.194449994474,11430.12079175018,0.1,2168282.0
MEXC,"Decentralized Finance (DeFi), Yield Farming, BNB Chain Ecosystem, Avalanche Ecosystem, Polygon Ecosystem, Fantom Ecosystem, Arbitrum Ecosystem, Ethereum Ecosystem, Optimism Ecosystem, Linea Ecosystem, Bridge Governance Tokens, Base Ecosystem, FTX Holdings",stargate-finance,190016988,195598443.0,82498.2222542316,81733.52176545413,0.05,6048712.0
MEXC,"Smart Contract Platform, BNB Chain Ecosystem, Layer 1 (L1), Proof of Stake (PoS), Pantera Capital Portfolio, Andreessen Horowitz (a16z) Portfolio, YZi Labs (Prev. Binance Labs) Portfolio, Blockchain Capital Portfolio, Privacy Blockchain, Polychain Capital Portfolio, Coinbase 50 Index",oasis-network,189032198,280888456.0,70773.10130155421,57002.896525952194,0.07,14298326.0
MEXC,"Tourism, BNB Chain Ecosystem",trip,188423380,625948855.0,,,N/A,2087.78
MEXC,"Decentralized Exchange (DEX), Decentralized Finance (DeFi), Automated Market Maker (AMM), Cosmos Ecosystem, Osmosis Ecosystem, Paradigm Portfolio, Proof of Stake (PoS), Evmos Ecosystem, Secret Ecosystem, GMCI DeFi Index, GMCI Index, Made in USA",osmosis,188627654,261578831.0,30912.526734107007,32692.937160535694,0.08,9186186.0
MEXC,"BNB Chain Ecosystem, Binance Alpha Spotlight",bnb48-club-token,188370904,188370904.0,,,N/A,187321.0
MEXC,"Solana Ecosystem, Meme, Solana Meme, Cat-Themed, Murad Picks",popcat,187705939,187705939.0,108116.66510759946,168248.72850678308,0.11,44426682.0
MEXC,"Decentralized Finance (DeFi), Yield Farming, Yield Aggregator, Ethereum Ecosystem, Metagovernance, Curve Ecosystem, Yield Optimizer",convex-finance,184459737,224669913.0,25238.499434138037,22577.818318139623,0.22,20773392.0
MEXC,"Gaming (GameFi), Ethereum Ecosystem, Decentralized Identifier (DID), Animoca Brands Portfolio, OKX Ventures Portfolio, Outlier Ventures Portfolio",mocaverse,183780652,752237667.0,7007.947412907744,5797.641082109021,0.19,24495426.0
MEXC,"Infrastructure, Smart Contract Platform, BNB Chain Ecosystem, Layer 1 (L1), Ethereum Ecosystem, GMCI Layer 1 Index, Aelf Ecosystem, GMCI Index",aelf,184151537,248185291.0,48076.646261310256,46028.183189724994,0.04,38280696.0
MEXC,"Decentralized Finance (DeFi), BNB Chain Ecosystem, Polygon Ecosystem, Fantom Ecosystem, Arbitrum Ecosystem, Moonbeam Ecosystem, Liquid Staking Tokens, Ethereum Ecosystem, Optimism Ecosystem, Liquid Staked ETH, Liquid Staking",staked-frax-ether,183164868,183164868.0,,,N/A,292297.0
MEXC,"Avalanche Ecosystem, Liquid Staking Tokens, Liquid Staking",benqi-liquid-staked-avax,182923052,182923052.0,,,N/A,1179048.0
MEXC,"Artificial Intelligence (AI), Polkadot Ecosystem, Metaverse, Ethereum Ecosystem, Interoperability, Real World Assets (RWA), DePIN, Decentralized Science (DeSci), AI Agents",origintrail,182367284,182624334.0,,,N/A,2255766.0
MEXC,"Stablecoins, USD Stablecoin, Solana Ecosystem, Fiat-backed Stablecoin",global-dollar,180177124,180177124.0,,,N/A,1933941.0
MEXC,"Smart Contract Platform, Storage, Harmony Ecosystem, Ethereum Ecosystem, DePIN, Energi Ecosystem, Sora Ecosystem, GMCI DePIN Index, GMCI Index",holotoken,179604023,179604023.0,87630.97088045803,96430.53162674943,0.3,11843456.0
MEXC,"BNB Chain Ecosystem, Avalanche Ecosystem, Polygon Ecosystem, Fantom Ecosystem, Arbitrum Ecosystem, Ethereum Ecosystem, Optimism Ecosystem, Liquid Staking Governance Tokens, Linea Ecosystem, DePIN, Scroll Ecosystem, Rollups-as-a-Service (RaaS), Blast Ecosystem, Mode Ecosystem, Pantera Capital Portfolio, Polygon zkEVM Ecosystem, YZi Labs (Prev. Binance Labs) Portfolio, Liquid Staking, Made in USA",ankr,178617224,178617224.0,77610.86818124891,97273.16458099941,0.17,29982886.0
MEXC,"Artificial Intelligence (AI), Smart Contract Platform, Layer 1 (L1), Paradigm Portfolio, Coinbase Ventures Portfolio, DeFiance Capital Portfolio, Polychain Capital Portfolio, Vana Ecosystem",vana,178097645,693886930.0,55094.59037996114,89921.01241309538,0.03,28891329.0
MEXC,"Internet of Things (IOT), Ethereum Ecosystem, DePIN, Base Ecosystem, Account Abstraction, GMCI DePIN Index, GMCI Index, Made in USA",iotex,177519105,177519105.0,53052.788159368036,31477.075627541893,0.05,15264357.0
MEXC,"Decentralized Finance (DeFi), Polygon Ecosystem, Ethereum Ecosystem, Coinbase Ventures Portfolio, Pantera Capital Portfolio",instadapp,174998051,443742993.0,6315.497782465621,21299.350668080293,0.09,14266110.0
MEXC,"Decentralized Exchange (DEX), Decentralized Finance (DeFi), Yield Farming, Automated Market Maker (AMM), BNB Chain Ecosystem, Seigniorage, Solana Ecosystem, Avalanche Ecosystem, Polygon Ecosystem, Fantom Ecosystem, Harmony Ecosystem, Arbitrum Ecosystem, Moonriver Ecosystem, Ethereum Ecosystem, Liquid Staking Governance Tokens, Curve Ecosystem, Stablecoin Protocol, Polygon zkEVM Ecosystem, Evmos Ecosystem, Fraxtal Ecosystem, GMCI DeFi Index, Liquid Staking, GMCI Index, Made in USA",frax-share,171866973,192655367.0,56267.91283184067,54983.22042407007,0.1,16776690.0
MEXC,"Infrastructure, Decentralized Finance (DeFi), Sui Ecosystem",deep,171997267,687989068.0,341898.35638172046,357917.0089848182,0.13,17605434.0
MEXC,"Smart Contract Platform, Real World Assets (RWA), Proof of Work (PoW), Made in USA",ravencoin,170511221,170511221.0,76558.6923799483,127734.23724243569,0.44,8179028.0
MEXC,"Smart Contract Platform, Storage, DePIN, Paradigm Portfolio, Proof of Work (PoW), DragonFly Capital Portfolio, Made in USA",siacoin,169954292,181877376.0,12087.611575716766,10590.790551255242,0.1,20306078.0
MEXC,Arbitrum Ecosystem,rcge,168805259,168805259.0,,,N/A,2.43
MEXC,"Starknet Ecosystem, Bridged-Tokens",bridged-wrapped-ether-starkgate,168374400,168375141.0,,,N/A,1167803.0
MEXC,"Solana Ecosystem, Meme, Solana Meme, Murad Picks",gigachad-2,170361744,170361744.0,9448.833169830259,9492.94590184775,0.45,8073485.0
MEXC,"Decentralized Finance (DeFi), Yield Farming, Yield Aggregator, Yearn Ecosystem, Avalanche Ecosystem, Polygon Ecosystem, Near Protocol Ecosystem, Gnosis Chain Ecosystem, Fantom Ecosystem, Harmony Ecosystem, Arbitrum Ecosystem, Ethereum Ecosystem, Optimism Ecosystem, Base Ecosystem, Index Coop Defi Index, Alameda Research Portfolio, Energi Ecosystem, Sora Ecosystem, Huobi ECO Chain Ecosystem, Blockchain Capital Portfolio, Index Coop Index",yearn-finance,167316780,181563560.0,19378.417848138037,24442.401722037983,0.05,25254932.0
MEXC,"Smart Contract Platform, Layer 1 (L1), DePIN, Andreessen Horowitz (a16z) Portfolio, Made in USA",chia,166296915,376708952.0,1100.7871430986204,1410.7831477895672,0.17,8711062.0
MEXC,"Decentralized Exchange (DEX), Exchange-based Tokens, Ethereum Ecosystem",coinex-token,165209045,165209112.0,,,N/A,128298.0
MEXC,"Meme, Ethereum Ecosystem, Base Ecosystem, Cat-Themed, Murad Picks",mog-coin,165033959,165033959.0,1031.9182486431778,7422.96408306415,0.24,13486845.0
MEXC,"Decentralized Finance (DeFi), Liquid Staking Tokens, Ethereum Ecosystem, Liquid Staked ETH, Liquid Staking",treehouse-eth,163745293,163745293.0,,,N/A,993615.0
MEXC,"Decentralized Finance (DeFi), Derivatives, Prediction Markets, Solana Ecosystem",drift-protocol,162736237,555190792.0,1717.9747717799755,624.0242050002843,0.22,22892687.0
MEXC,"Decentralized Finance (DeFi), Tron Ecosystem",sun-token,163160407,330191313.0,16067.76411884498,20081.084582969528,0.08,35940816.0
MEXC,"Solana Ecosystem, Meme, Dog-Themed, Solana Meme, Bitcoin Ecosystem, Runes",dog-go-to-the-moon-rune,163625598,163625598.0,561.1115532423333,855.0596290651916,0.73,9455661.0
MEXC,"Smart Contract Platform, Layer 1 (L1), Harmony Ecosystem, Animoca Brands Portfolio, Binance Launchpad, YZi Labs (Prev. Binance Labs) Portfolio, Made in USA",harmony,161331443,161882978.0,27751.27295568031,9889.129719607437,1.07,10447615.0
MEXC,"Artificial Intelligence (AI), Meme, Base Ecosystem, AI Agents, Binance Alpha Spotlight, AI Framework",freysa-ai,161750366,161750366.0,3008.3850731420603,329.7784311181785,0.25,1671149.0
MEXC,"Gambling (GambleFi), Gaming (GameFi), Ethereum Ecosystem",rollbit-coin,158381389,158381389.0,,,N/A,634584.0
MEXC,"Internet of Things (IOT), Smart Contract Platform, Layer 1 (L1), Proof of Work (PoW), Made in USA",digibyte,157033729,157057242.0,,,N/A,5871964.0
MEXC,"Smart Contract Platform, Layer 1 (L1), Real World Assets (RWA), RWA Protocol",polymesh,156969687,156969687.0,,,N/A,4980907.0
MEXC,"Decentralized Finance (DeFi), Solana Ecosystem, Ethereum Ecosystem, Optimism Ecosystem, Base Ecosystem, Cross-chain Communication, BTCfi",threshold-network-token,156765118,172672970.0,37727.87078349345,58297.543023949824,0.19,6454722.0
MEXC,"Solana Ecosystem, BRC-20, Bitcoin Ecosystem, Inscriptions",ordinals,157246323,157246323.0,727873.7717890122,830919.9241163882,0.27,75494045.0
