MEXC,"Solana Ecosystem, Meme, Solana Meme, Pump.fun Ecosystem, Zoo-Themed, Memorial Themed",peanut-the-squirrel,156526494,156526494.0,268060.3950446209,494712.68846569874,0.13,189038358.0
MEXC,"Stablecoins, EUR Stablecoin, Solana Ecosystem, Avalanche Ecosystem, Ethereum Ecosystem, Base Ecosystem, Stellar Ecosystem",euro-coin,156422206,156422206.0,,,N/A,44427144.0
MEXC,"Gaming (GameFi), Polkadot Ecosystem, NFT, Ethereum Ecosystem, Gaming Blockchains, Andreessen Horowitz (a16z) Portfolio, YZi Labs (Prev. Binance Labs) Portfolio, Galaxy Digital Portfolio, Made in USA",mythos,158054178,200306559.0,568.8360518657903,631.241271558695,0.4,1485101.0
MEXC,"Gaming (GameFi), NFT, Solana Ecosystem, Animoca Brands Portfolio, FTX Holdings, Multicoin Capital Portfolio, Alameda Research Portfolio",metaplex,155893368,199359094.0,2324.865425658842,5565.9524577135235,0.2,28586450.0
MEXC,"Gaming (GameFi), BNB Chain Ecosystem, Ethereum Ecosystem, TON Ecosystem",gmt-token,154870408,154870408.0,4795.906009543377,3561.5820206072976,0.42,14652075.0
MEXC,"Decentralized Finance (DeFi), Ethereum Ecosystem, Stablecoin Protocol",tribe-2,153923922,338282787.0,63.50904437143548,29.73979887653263,0.85,57730.0
MEXC,"Smart Contract Platform, Layer 1 (L1), Base Ecosystem, Layer 0 (L0), Made in USA, Directed Acyclic Graph (DAG)",constellation-labs,149894924,149895032.0,1947.1468167357975,4519.106088910416,0.02,2539042.0
MEXC,"Solana Ecosystem, Liquid Staking Tokens, Liquid Staked SOL, Liquid Staking",drift-staked-sol,148901334,148901334.0,,,N/A,161236.0
MEXC,"Solana Ecosystem, DePIN, Multicoin Capital Portfolio, Made in USA",hivemapper,149792004,232808196.0,27121.55065671241,26487.437776644376,0.52,610156.0
MEXC,"BNB Chain Ecosystem, Meme, AI Meme",ai-companions,148596714,148596714.0,985.06541406657,2273.8736724396067,0.25,5766113.0
MEXC,"SocialFi, Arbitrum Ecosystem",uxlink,147874552,437239952.0,38107.59918423719,54712.32816212915,0.05,33643948.0
MEXC,"Gaming (GameFi), Play To Earn, Telegram Apps, TON Ecosystem, Tap to Earn, Arcade Games",hamster-kombat,146471373,227528347.0,88493.5141133295,83063.55545779273,0.04,32174953.0
MEXC,"Tokenized Real Estate, Tokenized Assets, Ethereum Ecosystem, Real World Assets (RWA), RWA Protocol",apf-coin,142536672,209281984.0,485.9056813586358,41.668462813025336,0.02,2622374.0
MEXC,"Decentralized Finance (DeFi), Solana Ecosystem, Liquid Staking Tokens, Liquid Staked SOL, Liquid Staking",bybit-staked-sol,145680685,145680685.0,,,N/A,322372.0
MEXC,"Entertainment, Smart Contract Platform, Gaming (GameFi), NFT, Metaverse, Layer 1 (L1), Harmony Ecosystem, Ethereum Ecosystem, Gaming Blockchains, Energi Ecosystem",enjincoin,146661547,151437444.0,114941.8787409184,107603.701876536,0.24,16276709.0
MEXC,"Stablecoins, BNB Chain Ecosystem",astherus-usdf,145679839,146179117.0,,,N/A,1046486.0
MEXC,"Smart Contract Platform, EthereumPoW Ecosystem, Proof of Work (PoW)",ethereum-pow-iou,144388671,144388671.0,20256.39576398861,27505.9578227932,0.15,8299564.0
MEXC,"Decentralized Exchange (DEX), Exchange-based Tokens, Decentralized Finance (DeFi), Automated Market Maker (AMM), BNB Chain Ecosystem, Derivatives, Perpetuals, Centralized Exchange (CEX) Token, Solana Ecosystem, Avalanche Ecosystem, Polygon Ecosystem, Near Protocol Ecosystem, Fantom Ecosystem, Arbitrum Ecosystem, Ethereum Ecosystem, ZkSync Ecosystem, Mantle Ecosystem, Linea Ecosystem, Base Ecosystem, DragonFly Capital Portfolio, YZi Labs (Prev. Binance Labs) Portfolio",woo-network,144636536,167249326.0,122109.32023818913,202075.41680850752,0.2,20329015.0
MEXC,"Stablecoins, Tokenized Assets, Tokenized Gold, Real World Assets (RWA), Tokenized Commodities",kinesis-gold,144570282,144570282.0,,,N/A,28935195.0
MEXC,"Smart Contract Platform, Crypto-Backed Tokens, Wrapped-Tokens, Layer 2 (L2), Mantle Ecosystem",wrapped-ether-mantle-bridge,144398226,144398226.0,,,N/A,2481025.0
MEXC,"BNB Chain Ecosystem, Binance-Peg Tokens",binance-peg-sol,144138610,144138610.0,,,N/A,3542330.0
MEXC,"Crypto-Backed Tokens, BNB Chain Ecosystem, Wrapped-Tokens, Ethereum Ecosystem",wrapped-beacon-eth,144252400,144252400.0,,,N/A,2843650.0
MEXC,"Smart Contract Platform, Masternodes, Zero Knowledge (ZK), Proof of Work (PoW), Made in USA",zencash,143279066,143282407.0,19360.267505711017,36388.886322617465,0.32,20792288.0
MEXC,,nem,141881456,141881456.0,,,N/A,7213160.0
MEXC,"Polygon Ecosystem, Bridged DAI, Bridged-Tokens, Bridged Stablecoins",polygon-pos-bridged-dai-polygon-pos,139459313,139459313.0,,,N/A,4512571.0
MEXC,Smart Contract Platform,bitkub-coin,139940262,173251872.0,,,N/A,397629.0
MEXC,"Infrastructure, Smart Contract Platform, NEO Ecosystem",gas,137600731,137600731.0,,,N/A,21847564.0
MEXC,"Exchange-based Tokens, Decentralized Finance (DeFi), Ethereum Ecosystem, Real World Assets (RWA), Alleged SEC Securities",lcx,138874552,140204349.0,,,N/A,592481.0
MEXC,"Tokenized Assets, Polygon Ecosystem, Arbitrum Ecosystem, Ethereum Ecosystem, Real World Assets (RWA), Starknet Ecosystem, Tokenized Treasury Bills (T-Bills)",eutbl,137150750,137150750.0,,,N/A,0.0
MEXC,"Decentralized Exchange (DEX), Decentralized Finance (DeFi), Yield Farming, Automated Market Maker (AMM), Solana Ecosystem, Coinbase Ventures Portfolio, DeFiance Capital Portfolio, Made in USA",orca,137039746,245694170.0,54175.07140963067,85272.14545337239,0.04,101052160.0
MEXC,"Smart Contract Platform, BNB Chain Ecosystem, Ethereum Ecosystem, Zero Knowledge (ZK), Animoca Brands Portfolio, YZi Labs (Prev. Binance Labs) Portfolio, OKX Ventures Portfolio",polyhedra-network,135896795,2250562233.0,35167.23121403287,23650.017027661364,0.12,13476943.0
MEXC,"Liquid Staking Tokens, Aptos Ecosystem, Liquid Staking",amnis-aptos,136709438,136738399.0,,,N/A,1188221.0
MEXC,"BNB Chain Ecosystem, Polygon Ecosystem, Ethereum Ecosystem, Animoca Brands Portfolio, DWF Labs Portfolio, Alameda Research Portfolio, Energi Ecosystem, YZi Labs (Prev. Binance Labs) Portfolio",mask-network,136818311,136818311.0,110183.75050111675,159355.76929820864,0.07,641184095.0
MEXC,BNB Chain Ecosystem,acet-token,135607788,176919325.0,,,N/A,265528.0
MEXC,"Stablecoins, EUR Stablecoin, Polygon Ecosystem, Ethereum Ecosystem, Real World Assets (RWA), Fiat-backed Stablecoin",stasis-eurs,134264842,134264842.0,,,N/A,46969.0
MEXC,"BRC-20, Bitcoin Ecosystem, Inscriptions",sats-ordinals,134548161,134548161.0,143804.04707723475,109725.81514341694,0.31,36678239.0
MEXC,"NFT, Solana Ecosystem, NFT Marketplace, Paradigm Portfolio, Sequoia Capital Portfolio",magic-eden,133366463,1000250696.0,168049.9368293924,157659.20592204423,0.21,16895706.0
MEXC,"Decentralized Finance (DeFi), Analytics, DeFi Index, Base Ecosystem",mag7-ssi,132865609,132865609.0,14.367503731716862,138.5191019975043,0.11,1207409.0
MEXC,"Gaming (GameFi), NFT, BNB Chain Ecosystem, Solana Ecosystem, Polygon Ecosystem, Play To Earn, Move To Earn, Ethereum Ecosystem, Binance Launchpad, Gaming Governance Token, Sports Games, Alameda Research Portfolio, YZi Labs (Prev. Binance Labs) Portfolio, Sequoia Capital Portfolio",stepn,132455820,247261724.0,155917.1754426851,274049.293999061,0.42,32525089.0
MEXC,"Meme, Ethereum Ecosystem, Frog-Themed, AI Meme",turbo,132958323,132958323.0,99448.67191013932,156379.23212976605,0.1,20487639.0
MEXC,"BNB Chain Ecosystem, Arbitrum Ecosystem, Cardano Ecosystem, Ethereum Ecosystem, DePIN, Base Ecosystem, DWF Labs Portfolio",world-mobile-token,131035327,370275172.0,6537.467147533071,6775.666155618795,0.16,14241833.0
MEXC,"Arbitrum Ecosystem, Ethereum Ecosystem",reserve-protocol-eth-plus,131112823,131112823.0,,,N/A,720046.0
MEXC,"Decentralized Finance (DeFi), Binance Launchpool, Arbitrum Ecosystem, Ethereum Ecosystem, Restaking, Liquid Restaking Governance Tokens, Ether.fi Ecosystem, Consensys Portfolio, OKX Ventures Portfolio",ether-fi,130712855,570430574.0,142229.52256103168,457825.7014707558,0.23,65933354.0
MEXC,"Smart Contract Platform, Gaming (GameFi), Layer 1 (L1), Ethereum Ecosystem, Modular Blockchain, Account Abstraction, Multicoin Capital Portfolio, Gaming Blockchains, Gaming Utility Token, Skale Ecosystem, Consensys Portfolio, Galaxy Digital Portfolio, Made in USA",skale,129749629,136492185.0,46593.702604216654,43101.71729210113,0.13,30725180.0
MEXC,"Stablecoins, Tokenized Assets, Real World Assets (RWA), Tokenized Silver, Tokenized Commodities",kinesis-silver,129669167,129669167.0,,,N/A,278962.0
MEXC,"Alleged SEC Securities, Osmosis Ecosystem, DeFiance Capital Portfolio, Pantera Capital Portfolio, YZi Labs (Prev. Binance Labs) Portfolio, Delphi Ventures Portfolio, Galaxy Digital Portfolio, OKX Ventures Portfolio",terra-luna-2,128172599,201024441.0,34212.85881301903,45172.59400314096,0.11,14601359.0
MEXC,"Cronos Ecosystem, Bridged USDC, Bridged-Tokens, Bridged Stablecoins",cronos-bridged-usdc-cronos,129745461,129745461.0,,,N/A,2785802.0
MEXC,"Smart Contract Platform, Masternodes, Proof of Stake (PoS), Made in China",ontology,128760127,140921998.0,117616.1293304857,65310.284137927476,0.21,11634290.0
MEXC,"Internet of Things (IOT), Oracle, NFT, Metaverse, Ethereum Ecosystem, DePIN, Alleged SEC Securities, Made in USA",xyo-network,128321498,128321498.0,,,N/A,7056819.0
MEXC,"Smart Contract Platform, Layer 1 (L1), Kadena Ecosystem, Multicoin Capital Portfolio, Proof of Work (PoW), Made in USA",kadena,127786642,127812290.0,54441.63784568711,24297.954825509594,0.15,8377041.0
MEXC,"Smart Contract Platform, Ethereum Ecosystem, Zero Knowledge (ZK), Alleged SEC Securities, Privacy Blockchain",coti,126978319,141692439.0,11677.994287870511,14802.94954900937,0.07,18479935.0
MEXC,"Decentralized Exchange (DEX), Decentralized Finance (DeFi), Automated Market Maker (AMM), Ethereum Ecosystem, Cronos Ecosystem",vvs-finance,126030695,246144124.0,,,N/A,704337.0
MEXC,"Oracle, Ethereum Ecosystem",redstone-oracles,125161704,447006085.0,121263.99903141249,149433.84013370544,0.25,37435588.0
MEXC,"Smart Contract Platform, Layer 1 (L1), Proof of Stake (PoS), GMCI Layer 1 Index, GMCI Index, Made in USA",casper-network,125987778,130438532.0,1440.1115871035342,5831.466785527754,0.05,8224998.0
MEXC,"Decentralized Exchange (DEX), Smart Contract Platform, Exchange-based Tokens, Decentralized Finance (DeFi), Arbitrum Ecosystem, Ethereum Ecosystem, Layer 2 (L2), Zero Knowledge (ZK), Loopring Ecosystem, Rollup, Energi Ecosystem",loopring,124014077,136742222.0,12381.249854626956,20212.767627755336,0.07,14499168.0
MEXC,"Stablecoins, Decentralized Finance (DeFi), USD Stablecoin, BNB Chain Ecosystem, Polygon Ecosystem, Gnosis Chain Ecosystem, Arbitrum Ecosystem, Ethereum Ecosystem, Optimism Ecosystem, Base Ecosystem, Crypto-backed Stablecoin, Fiat-backed Stablecoin",crvusd,123541048,123541048.0,,,N/A,13931459.0
MEXC,"Decentralized Finance (DeFi), Ethereum Ecosystem, Morpho Ecosystem",steakhouse-usdc-morpho-vault,123040302,123040302.0,,,N/A,0.0
MEXC,"Smart Contract Platform, SocialFi, NFT, BNB Chain Ecosystem, Binance Launchpool, Ethereum Ecosystem, Decentralized Identifier (DID), Zero Knowledge (ZK), DWF Labs Portfolio, Coinbase Ventures Portfolio, Multicoin Capital Portfolio, Alameda Research Portfolio, DragonFly Capital Portfolio, YZi Labs (Prev. Binance Labs) Portfolio, Quest-to-Earn",project-galaxy,122647236,192012334.0,,,N/A,11314.43
MEXC,"Infrastructure, Solana Ecosystem, Animoca Brands Portfolio, Cross-chain Communication, OKX Ventures Portfolio",zeus-network,121031739,316192010.0,6020.888994102236,6956.259558268783,0.28,4695275.0
MEXC,"Stablecoins, Ethereum Ecosystem, Base Ecosystem, Blast Ecosystem, Fiat-backed Stablecoin",anzen-usdz,122012862,122012862.0,,,N/A,266984.0
MEXC,"Decentralized Finance (DeFi), Derivatives, Perpetuals, Avalanche Ecosystem, Arbitrum Ecosystem",gmx,120218632,120218636.0,44421.28938401485,51865.43408980562,0.17,13818485.0
MEXC,"Stablecoins, Ethereum Ecosystem",level-usd,120065727,120065727.0,,,N/A,2736395.0
MEXC,BNB Chain Ecosystem,bitdca,120321375,129197631.0,11587.984012207107,10019.694687844754,0.39,136024.0
MEXC,"Payment Solutions, Made in USA, Directed Acyclic Graph (DAG)",nano,119283977,119283977.0,,,N/A,4560088.0
MEXC,"Launchpad, Meme, Base Ecosystem, Cat-Themed, Base Meme",toshi,119603340,119603340.0,3126.237467614472,5010.7186467946285,0.32,12380822.0
MEXC,"Binance Launchpool, Solana Ecosystem, Ethereum Ecosystem, Base Ecosystem, Decentralized Science (DeSci)",bio-protocol,117696280,239799621.0,240778.38480620034,312273.7503883042,0.29,23797799.0
MEXC,"Stablecoins, USD Stablecoin, Fiat-backed Stablecoin",falcon-finance,117906229,117906229.0,,,N/A,334872.0
MEXC,"Decentralized Finance (DeFi), Insurance, Ethereum Ecosystem",nxm,117974178,117974178.0,,,N/A,0.0
MEXC,"Decentralized Exchange (DEX), Exchange-based Tokens, Decentralized Finance (DeFi), Yield Farming, Automated Market Maker (AMM), BNB Chain Ecosystem, Yearn Ecosystem, Solana Ecosystem, Avalanche Ecosystem, Polygon Ecosystem, Near Protocol Ecosystem, Fantom Ecosystem, Harmony Ecosystem, Arbitrum Ecosystem, Celo Ecosystem, Ethereum Ecosystem, Base Ecosystem, Alameda Research Portfolio, Pantera Capital Portfolio, Energi Ecosystem, Sora Ecosystem, Blockchain Capital Portfolio",sushi,116082763,169604753.0,271885.40532642056,540469.498268845,0.08,32956771.0
MEXC,"Ethereum Ecosystem, Crypto-backed Stablecoin, Yield-Bearing Stablecoin",elixir-staked-deusd,115453858,115453858.0,,,N/A,954188.0
MEXC,"Smart Contract Platform, DWF Labs Portfolio, Proof of Stake (PoS)",waves,115639826,115639826.0,26131.725951715725,33767.39874050089,0.3,8921150.0
MEXC,"BNB Chain Ecosystem, Harmony Ecosystem, Ethereum Ecosystem, Alameda Research Portfolio, YZi Labs (Prev. Binance Labs) Portfolio",swipe,114714868,114937057.0,89076.57999923307,146171.86019272904,0.17,8630927.0
MEXC,"Artificial Intelligence (AI), Smart Contract Platform, Layer 1 (L1), Proof of Work (PoW)",qubic-network,115436144,139485406.0,6130.449110279076,11143.936211105623,0.13,1873779.0
MEXC,"Stablecoins, Decentralized Finance (DeFi), Lending/Borrowing Protocols, Ethereum Ecosystem",syrupusdc,114628975,114628975.0,,,N/A,2883355.0
MEXC,"Lending/Borrowing Protocols, Ethereum Ecosystem, Paradigm Portfolio, Coinbase Ventures Portfolio",euler,112289073,163352784.0,3561.7264038983485,12264.851424407489,0.13,2410411.0
MEXC,"Arbitrum Ecosystem, Bridged USDC, Bridged-Tokens, Bridged Stablecoins",usd-coin-ethereum-bridged,113885078,113885078.0,,,N/A,45853032.0
MEXC,"Business Services, Decentralized Finance (DeFi), Oracle, Fantom Ecosystem, Ethereum Ecosystem, Binance Launchpad, Osmosis Ecosystem, Energi Ecosystem, YZi Labs (Prev. Binance Labs) Portfolio, Sequoia Capital Portfolio",band-protocol,112317372,114577418.0,,,N/A,9911706.0
MEXC,"Artificial Intelligence (AI), Smart Contract Platform, BNB Chain Ecosystem, Solana Ecosystem, Layer 1 (L1), Polygon Ecosystem, Ethereum Ecosystem, DWF Labs Portfolio, Injective Ecosystem, OKX Ventures Portfolio",zignaly,113541301,157437973.0,4334.034512523453,12862.337388535896,0.32,2109857.0
MEXC,"Decentralized Finance (DeFi), Oracle, Ethereum Ecosystem, DWF Labs Portfolio, Pantera Capital Portfolio",api3,110568893,137686641.0,297302.63103907445,287979.3356945328,0.08,39184356.0
MEXC,"BNB Chain Ecosystem, Liquid Staking Tokens",astherus-staked-bnb,111928753,111862286.0,,,N/A,26125.0
MEXC,"Decentralized Exchange (DEX), Decentralized Finance (DeFi), Gnosis Chain Ecosystem, MEV Protection, Arbitrum Ecosystem, Ethereum Ecosystem, Intent, Delphi Ventures Portfolio, Blockchain Capital Portfolio",cow-protocol,111655934,268294908.0,67895.8208234076,69195.44501575967,0.07,19110426.0
MEXC,"Smart Contract Platform, Base Ecosystem, Gaming Blockchains",b3,110432238,518639689.0,21991.501771329982,26607.004000481247,0.25,11820101.0
MEXC,"Exchange-based Tokens, BNB Chain Ecosystem, Centralized Exchange (CEX) Token",nkyc-token,111563006,111563006.0,,,N/A,260714.0
MEXC,"Decentralized Finance (DeFi), Yield Farming, Lending/Borrowing Protocols, Ethereum Ecosystem, Real World Assets (RWA), Base Ecosystem, Binance Alpha Spotlight",syrup,111854135,148035610.0,55827.26225049368,45546.882031593195,0.05,8182502.0
MEXC,"BNB Chain Ecosystem, Avalanche Ecosystem, Polygon Ecosystem, Arbitrum Ecosystem, Ethereum Ecosystem, Optimism Ecosystem, Base Ecosystem",vicicoin,109995823,193101827.0,,,N/A,176166.0
MEXC,"Smart Contract Platform, SocialFi, Layer 1 (L1), Gaming Blockchains",hive,110006180,,58647.22295795289,20590.07681750951,0.13,3278961.0
MEXC,"BNB Chain Ecosystem, Ethereum Ecosystem, Payment Solutions, DWF Labs Portfolio",alchemy-pay,109065931,220616396.0,114492.56726701847,125196.83911467005,0.05,25838344.0
MEXC,"Smart Contract Platform, BNB Chain Ecosystem, Layer 1 (L1), Ethereum Ecosystem, Decentralized Identifier (DID), Base Ecosystem, Gravity Alpha Ecosystem",g-token,108546080,180092215.0,52623.233093400224,43317.92596496367,0.27,9503895.0
MEXC,"Artificial Intelligence (AI), Binance Launchpool, Solana Ecosystem, DePIN, Animoca Brands Portfolio, Multicoin Capital Portfolio, Delphi Ventures Portfolio, OKX Ventures Portfolio, Made in USA",io,108445506,576360495.0,241947.5846349744,263530.01133513503,0.14,27713076.0
MEXC,"Smart Contract Platform, BNB Chain Ecosystem, Ethereum Ecosystem, Layer 2 (L2)",prometeus,107968565,113884651.0,22421.505678302878,57.03961311414004,0.3,5017605.0
MEXC,"Solana Ecosystem, Multicoin Capital Portfolio, Stablecoin Protocol, Alameda Research Portfolio, DeFiance Capital Portfolio",uxd-protocol-token,105968500,105968500.0,,,N/A,24.78
MEXC,"Artificial Intelligence (AI), Virtual Reality, BNB Chain Ecosystem, Launchpad, Ethereum Ecosystem, Telegram Apps, Discord Bots, Base Ecosystem, PAAL AI Launchpad, AI Agents, AI Applications, AI Agent Launchpad, Binance Alpha Spotlight, AI Framework, DeFAI, Made in USA",paal-ai,106928309,119367694.0,5415.239252042064,15171.897143450202,0.46,8925933.0
MEXC,"Arbitrum Ecosystem, Ethereum Ecosystem, Account Abstraction, Coinbase Ventures Portfolio, YZi Labs (Prev. Binance Labs) Portfolio, Consensys Portfolio, Outlier Ventures Portfolio",biconomy,105682091,112382897.0,73354.85227255324,84759.77354921596,0.09,10032887.0
MEXC,"Decentralized Exchange (DEX), Decentralized Finance (DeFi), BNB Chain Ecosystem, Wallets, XRP Ledger Ecosystem",solo-coin,106238377,106238377.0,23329.290240515347,23208.23200099352,0.15,1715540.0
MEXC,"Artificial Intelligence (AI), BNB Chain Ecosystem, Solana Ecosystem, Ethereum Ecosystem, AI Agents, Alameda Research Portfolio",delysium,104354700,196833042.0,9819.740401380783,14561.576327829509,0.29,13341594.0
MEXC,"Artificial Intelligence (AI), Ethereum Ecosystem",0x0-ai-ai-smart-contract,103998453,103998453.0,,,N/A,613542.0
MEXC,"Smart Contract Platform, Layer 1 (L1), Zero Knowledge (ZK)",ozone-chain,103319242,136694301.0,88.33516678640991,15.862780600821305,0.8,248029.0
MEXC,"Business Services, Decentralized Finance (DeFi), Oracle, Derivatives, Synthetic Issuer, Avalanche Ecosystem, Ethereum Ecosystem, Blockchain Capital Portfolio, Synthetic, Made in USA",uma,102194673,147232007.0,98621.50795981208,73737.41188091329,0.17,13875174.0
MEXC,"NFT, BNB Chain Ecosystem, Solana Ecosystem, Meme, Ethereum Ecosystem, Base Ecosystem, Hybrid Token Standards, Wojak-Themed",non-playable-coin,103278575,103278575.0,7491.467149299474,26025.125907940648,0.33,4278847.0
MEXC,"Polygon Ecosystem, XRP Ledger Ecosystem",crypto-trading-fund,102463751,102463751.0,,,N/A,10476.1
MEXC,"Decentralized Finance (DeFi), DaoMaker Launchpad, Ethereum Ecosystem, Real World Assets (RWA), Sequoia Capital Portfolio, Made in USA",clearpool,103484096,136172967.0,14750.311350047696,15527.191216966437,0.15,8989967.0
MEXC,"Bridged USDT, QL1 Ecosystem, Bridged-Tokens, Bridged Stablecoins",qusdt,100013167,100013167.0,,,N/A,20281.0
MEXC,"Smart Contract Platform, Cross-chain Communication, Pantera Capital Portfolio",icon,99447593,100605915.0,,,N/A,2791453.0
MEXC,"Gaming (GameFi), NFT, Metaverse, Play To Earn, Ethereum Ecosystem, Animoca Brands Portfolio, RPG, Gaming Governance Token, Adventure Games, Energi Ecosystem, Delphi Ventures Portfolio",illuvium,98470711,126142670.0,53819.573985940086,69790.63167502942,0.08,19882687.0
MEXC,"Gaming (GameFi), Play To Earn, Ethereum Ecosystem, RPG, Alameda Research Portfolio, Circle Ventures Portfolio, OKX Ventures Portfolio, MMO",big-time,98266137,284132718.0,20153.636640505883,42546.52964615567,0.1,78680067.0
MEXC,"Smart Contract Platform, Ethereum Ecosystem, Metis Ecosystem, Layer 2 (L2), DWF Labs Portfolio, Rollup, GMCI Layer 2 Index, OKX Ventures Portfolio, GMCI Index",metis-token,98488663,157108416.0,9827.503695964193,30422.338463521744,0.25,9802856.0
MEXC,"Smart Contract Platform, Decentralized Finance (DeFi), Binance Launchpool, Derivatives, Perpetuals, Ethereum Ecosystem, Layer 2 (L2), DragonFly Capital Portfolio, Pantera Capital Portfolio",aevo-exchange,97156165,107571653.0,130377.2759207951,245415.78097816103,0.17,28472745.0
MEXC,"Music, NFT, Ethereum Ecosystem, Coinbase Ventures Portfolio, Multicoin Capital Portfolio, Pantera Capital Portfolio, Energi Ecosystem, YZi Labs (Prev. Binance Labs) Portfolio",audius,95841514,95841514.0,,,N/A,9601543.0
MEXC,"XDC Ecosystem, Telos Ecosystem",ecoin-2,95560776,207235463.0,,,N/A,2.0
MEXC,"Polygon Ecosystem, Arbitrum Ecosystem, Ethereum Ecosystem, Optimism Ecosystem, Bridge Governance Tokens, Cross-chain Communication, Intent, Boba Network Ecosystem, Blockchain Capital Portfolio, Made in USA",across-protocol,95695814,235008827.0,126756.25136672817,110449.02601038743,0.03,15368981.0
MEXC,"Decentralized Finance (DeFi), Launchpad, Ethereum Ecosystem, DWF Labs Portfolio, Coinbase Ventures Portfolio, Pantera Capital Portfolio, Blockchain Capital Portfolio",auction,94186974,109202636.0,442633.39170077187,393610.506896396,0.18,67980814.0
MEXC,"Fraxtal Ecosystem, Bridged-Tokens",l2-standard-bridged-frxusd,94973849,94973849.0,,,N/A,609390.0
MEXC,"Big Data, Business Services, Infrastructure, Decentralized Finance (DeFi), Solana Ecosystem, FTX Holdings, DWF Labs Portfolio, Name Service",bonfida,94511146,95377969.0,105894.42593426153,99450.30657226818,0.22,12214192.0
MEXC,"NFT, Meme, Arbitrum Ecosystem, Ethereum Ecosystem, Anime-Themed, Binance HODLer Airdrops, Airdropped Tokens by NFT Projects",anime,94753141,171077640.0,202587.85275543464,160830.21797348032,0.06,25689894.0
MEXC,"Smart Contract Platform, Polkadot Ecosystem, Layer 1 (L1), DePIN, Outlier Ventures Portfolio",peaq-2,93383286,530795366.0,7814.924400993968,19148.71573381059,0.1,7879572.0
MEXC,"Decentralized Finance (DeFi), BNB Chain Ecosystem, Liquid Staking Tokens, Sui Ecosystem, Liquid Staking",lorenzo-stbtc,94120327,94120327.0,,,N/A,264268.0
MEXC,"Software as a service, Ethereum Ecosystem, Energi Ecosystem",status,93225968,160180080.0,10752.813494194179,16752.979736914393,0.13,24306659.0
MEXC,Layer 1 (L1),oec-token,93629813,93629813.0,2422.0332888458365,2979.928575890535,1.52,398789.0
MEXC,"BNB Chain Ecosystem, Tron Ecosystem",global-commercial-business,97916043,97916043.0,121.30340405334444,284.0961312822418,0.74,147228.0
MEXC,"Smart Contract Platform, BNB Chain Ecosystem, Binance Launchpool, Ethereum Ecosystem, Layer 2 (L2), Restaking, Rollups-as-a-Service (RaaS), Rollup, YZi Labs (Prev. Binance Labs) Portfolio",altlayer,93226776,307393802.0,56556.05075517526,69392.47520159364,0.1,27923510.0
MEXC,"Infrastructure, Binance Launchpool",nillion,91928943,471068117.0,296994.8192239963,327273.82174420136,0.21,78941927.0
MEXC,"Gaming (GameFi), Polygon Ecosystem",gamebitcoin-power,92810091,544286411.0,,,N/A,5864.95
MEXC,"Gaming (GameFi), XDC Ecosystem, Gaming Utility Token",gama-coin,92576870,142426032.0,,,N/A,2355439.0
MEXC,"Artificial Intelligence (AI), Smart Contract Platform, Masternodes, DePIN, Proof of Work (PoW), Made in USA",zelcash,92215091,92217606.0,29850.464935207514,29631.167763464935,0.12,9467807.0
MEXC,"Exchange-based Tokens, NFT, BNB Chain Ecosystem, Ethereum Ecosystem",swftcoin,92233584,92233584.0,1472.493289903971,1104.8023794462147,0.15,1265466.0
MEXC,"Business Services, Infrastructure, Smart Contract Platform, Decentralized Finance (DeFi), Polygon Ecosystem, Arbitrum Ecosystem, Ethereum Ecosystem, Liquid Staking Governance Tokens, Coinbase Ventures Portfolio, Proof of Stake (PoS), Index Coop Defi Index, Consensys Portfolio, Liquid Staking, Index Coop Index",rocket-pool,91630965,91630965.0,7849.278613773497,11077.128430679148,0.14,10505862.0
MEXC,"Crypto-Backed Tokens, Ethereum Ecosystem",temple,91068616,91248025.0,,,N/A,62486.0
MEXC,"Smart Contract Platform, Ethereum Ecosystem, Layer 2 (L2), Optimism Superchain Ecosystem, Outlier Ventures Portfolio, Lisk Ecosystem",lisk,90980378,204166274.0,,,N/A,13192702.0
MEXC,"Decentralized Finance (DeFi), Yield Farming, BNB Chain Ecosystem, Binance Launchpool, Lending/Borrowing Protocols, Arbitrum Ecosystem, Ethereum Ecosystem, Optimism Ecosystem, ZkSync Ecosystem, opBNB Ecosystem, Unichain Ecosystem",venus,90780452,162480880.0,9800.515648606244,9941.148932316857,0.17,5430251.0
MEXC,"Decentralized Finance (DeFi), BNB Chain Ecosystem, Real World Assets (RWA), DWF Labs Portfolio, Stellar Ecosystem",velo,90589216,294180541.0,3311.6034145507865,17910.732644612697,0.07,15721896.0
MEXC,"Decentralized Finance (DeFi), Yield Farming, Avalanche Ecosystem, Fantom Ecosystem, Arbitrum Ecosystem, Olympus Pro Ecosystem, Ethereum Ecosystem, Stablecoin Protocol",spell-token,91045620,112178650.0,6963.618982823815,12850.548386937538,0.18,16540304.0
MEXC,"Gaming (GameFi), NFT, Kaia Ecosystem, Gaming Blockchains",bora,90355560,94509838.0,,,N/A,722473.0
MEXC,"NFT, BNB Chain Ecosystem, Ethereum Ecosystem, Binance Launchpad, DWF Labs Portfolio, YZi Labs (Prev. Binance Labs) Portfolio",space-id,89563121,415379153.0,76172.55593084084,139970.70709587962,0.05,12285832.0
MEXC,"Decentralized Finance (DeFi), E-commerce",optio,78427427,103507568.0,,,N/A,92554.0
