Exchange,Category,Token CEX,Market Cap Today,FDV Today,Depth +2%,Depth -2%,Bid Ask Spread Percentage,24H Volume (USD)
MEXC,"BNB Chain Ecosystem, Solana Ecosystem, Polygon Ecosystem, Meme, Arbitrum Ecosystem, Ethereum Ecosystem, Aptos Ecosystem, Dog-Themed, Solana Meme, Neon Ecosystem, GMCI Meme Index, GMCI Index, Made in USA, Coinbase 50 Index",bonk,973406709,1117082495.0,638788.0121439524,926876.1031399672,0.08,222277237.0
MEXC,"Smart Contract Platform, Ethereum Ecosystem, Decentralized Identifier (DID), Optimism Ecosystem, Coinbase Ventures Portfolio, Multicoin Capital Portfolio, Andreessen Horowitz (a16z) Portfolio, Blockchain Capital Portfolio, Optimism Superchain Ecosystem, World Chain Ecosystem, Made in USA",worldcoin-wld,975944116,7976887809.0,1056199.5755808973,1590733.4944307986,0.13,128946883.0
MEXC,"Arbitrum Ecosystem, Optimism Ecosystem, Berachain Ecosystem, Bridged USDT, Bridged-Tokens, Ink Ecosystem, Bridged Stablecoins, Unichain Ecosystem",usdt0,964541236,964538102.0,,,N/A,73887043.0
MEXC,"Infrastructure, Smart Contract Platform, Layer 2 (L2), Bitcoin Sidechains, Stacks Ecosystem, SideChain, GMCI Layer 2 Index, GMCI 30 Index, Blockchain Capital Portfolio, GMCI Index, Made in USA, Coinbase 50 Index",blockstack,955359290,955359290.0,623082.70875279,736195.0455417414,0.16,38651378.0
MEXC,"Smart Contract Platform, Gaming (GameFi), NFT, Play To Earn, Ethereum Ecosystem, Layer 2 (L2), Zero Knowledge (ZK), Animoca Brands Portfolio, Immutable zkEVM Ecosystem, Coinbase Ventures Portfolio, Rollup, Gaming Blockchains, GMCI 30 Index, GMCI Index, Gaming Marketplace, Coinbase 50 Index",immutable-x,948829684,1058468636.0,224580.86354677184,256587.31622058107,0.23,25624972.0
MEXC,"Polygon Ecosystem, Arbitrum Ecosystem, Liquid Staking Tokens, Ethereum Ecosystem, Optimism Ecosystem, Base Ecosystem, Liquid Staked ETH, Liquid Staking",rocket-pool-eth,938192330,938192330.0,,,N/A,3087974.0
MEXC,"Smart Contract Platform, Decentralized Finance (DeFi), BNB Chain Ecosystem, Cosmos Ecosystem, Layer 1 (L1), Ethereum Ecosystem, Binance Launchpad, Osmosis Ecosystem, Proof of Stake (PoS), Pantera Capital Portfolio, Secret Ecosystem, GMCI Layer 1 Index, GMCI Index, Made in USA, Coinbase 50 Index",injective-protocol,881183036,901676149.0,760592.0218842005,858238.0090711615,0.22,71401389.0
MEXC,"Stablecoins, USD Stablecoin, BNB Chain Ecosystem, Arbitrum Ecosystem, Ethereum Ecosystem, Base Ecosystem, Fiat-backed Stablecoin",usual-usd,871677833,871677833.0,,,N/A,14113339.0
MEXC,"Artificial Intelligence (AI), Smart Contract Platform, Decentralized Finance (DeFi), Layer 1 (L1), Real World Assets (RWA), Parallelized EVM, Coinbase Ventures Portfolio, Multicoin Capital Portfolio, GMCI Layer 1 Index, Delphi Ventures Portfolio, Circle Ventures Portfolio, OKX Ventures Portfolio, GMCI Index, World Liberty Financial Portfolio, Made in USA",sei-network,860855540,1763195144.0,568456.3213693362,661595.4382025126,0.06,64275068.0
MEXC,"Artificial Intelligence (AI), Business Services, Infrastructure, Smart Contract Platform, Analytics, Avalanche Ecosystem, Polygon Ecosystem, Near Protocol Ecosystem, Harmony Ecosystem, Arbitrum Ecosystem, Ethereum Ecosystem, DePIN, Coinbase Ventures Portfolio, Multicoin Capital Portfolio, Proof of Stake (PoS), Energi Ecosystem, Sora Ecosystem, Made in USA, Coinbase 50 Index",the-graph,853591080,964393766.0,321871.58568604005,359501.51382477075,0.12,42121863.0
MEXC,"Decentralized Finance (DeFi), BNB Chain Ecosystem, Ethereum Ecosystem",dexe,845932400,1429614205.0,10054.387467756384,10417.141701034545,0.05,51879435.0
MEXC,"BNB Chain Ecosystem, Bridged USDC, Bridged-Tokens, Bridged Stablecoins",binance-bridged-usdc-bnb-smart-chain,848926862,848926862.0,,,N/A,48921674.0
MEXC,"Smart Contract Platform, Layer 1 (L1), DePIN, Theta Ecosystem, Blockchain Capital Portfolio, Made in USA",theta-token,847661620,847661620.0,,,N/A,20246890.0
MEXC,"Smart Contract Platform, Layer 1 (L1), DWF Labs Portfolio",flare-networks,823327505,1389871606.0,55566.93236649552,49607.56365164453,0.3,8593786.0
MEXC,"Polygon Ecosystem, Bridged USDT, Bridged-Tokens, Bridged Stablecoins",polygon-bridged-usdt-polygon,814671007,814671005.0,,,N/A,15854245.0
MEXC,"Infrastructure, Decentralized Finance (DeFi), Polygon Ecosystem, Arbitrum Ecosystem, Ethereum Ecosystem, Optimism Ecosystem, Liquid Staking Governance Tokens, eGirl Capital Portfolio, Paradigm Portfolio, Coinbase Ventures Portfolio, Multicoin Capital Portfolio, Index Coop Defi Index, Alameda Research Portfolio, DragonFly Capital Portfolio, Andreessen Horowitz (a16z) Portfolio, GMCI DeFi Index, Delphi Ventures Portfolio, Liquid Staking, Index Coop Index, GMCI Index, Coinbase 50 Index",lido-dao,799808172,890776749.0,278654.910912321,443367.31840163557,0.2,66752617.0
MEXC,"Smart Contract Platform, Decentralized Finance (DeFi), Layer 1 (L1), Berachain Ecosystem, Binance HODLer Airdrops, Outlier Ventures Portfolio, Polychain Capital Portfolio",berachain-bera,791824292,3669950903.0,180403.70312232655,170240.76880741896,0.03,140220332.0
MEXC,"Stablecoins, Tokenized Assets, Tokenized Gold, Ethereum Ecosystem, Real World Assets (RWA), Tokenized Commodities",tether-gold,775548059,775548059.0,35818.85043335996,35348.33597264273,0.25,21104469.0
MEXC,"Crypto-Backed Tokens, BNB Chain Ecosystem, Avalanche Ecosystem, Arbitrum Ecosystem, Ethereum Ecosystem, Mantle Ecosystem, Base Ecosystem, Restaking, Berachain Ecosystem, Merlin Chain Ecosystem, Sonic Ecosystem, Sei Network Ecosystem, Soneium Ecosystem, Corn Ecosystem",solv-protocol-solvbtc-bbn,772213284,772213284.0,,,N/A,160808.0
MEXC,"Crypto-Backed Tokens, BNB Chain Ecosystem, Wrapped-Tokens",wbnb,743248886,745894250.0,,,N/A,187629376.0
MEXC,"Liquid Staking Tokens, Ethereum Ecosystem, Mantle Ecosystem, Liquid Staked ETH, Liquid Staking",mantle-staked-ether,739278046,739278046.0,,,N/A,1508531.0
MEXC,"Infrastructure, Storage, Sui Ecosystem",walrus-2,735475641,2941902565.0,92336.62480157631,91999.57563003848,0.09,234823236.0
MEXC,"Decentralized Finance (DeFi), Solana Ecosystem, Liquid Staking Governance Tokens, Multicoin Capital Portfolio, Alameda Research Portfolio, Delphi Ventures Portfolio, Liquid Staking, Made in USA",jito-governance-token,724728225,2323693964.0,267986.6588660826,252535.28525351826,0.04,45736597.0
MEXC,"Decentralized Exchange (DEX), Exchange-based Tokens, Decentralized Finance (DeFi), Yield Farming, Automated Market Maker (AMM), Polygon Ecosystem, Fantom Ecosystem, Arbitrum Ecosystem, Ethereum Ecosystem, Optimism Ecosystem, Curve Ecosystem, DWF Labs Portfolio, Stablecoin Protocol, Energi Ecosystem, Sora Ecosystem, YZi Labs (Prev. Binance Labs) Portfolio, GMCI DeFi Index, GMCI Index, Coinbase 50 Index",curve-dao-token,715209645,1226506652.0,174878.6117283751,271110.3033247724,0.02,175802543.0
MEXC,"Arbitrum Ecosystem, Bridged WBTC, Bridged-Tokens",arbitrum-bridged-wbtc-arbitrum-one,700986934,700591534.0,,,N/A,105208300.0
MEXC,"Smart Contract Platform, Gaming (GameFi), NFT, Layer 1 (L1), Play To Earn, Ethereum Ecosystem, DWF Labs Portfolio, Gaming Platform, YZi Labs (Prev. Binance Labs) Portfolio, GalaChain Ecosystem, Made in USA",gala,700361406,700361425.0,431509.52613070223,453146.69035335485,0.06,61641834.0
MEXC,"Smart Contract Platform, Layer 1 (L1), Tezos Ecosystem, Proof of Stake (PoS), GMCI Layer 1 Index, GMCI Index, Polychain Capital Portfolio, Made in USA, Coinbase 50 Index",tezos,696146094,709734534.0,19230.11911608714,79685.0401967164,0.06,20698359.0
MEXC,"Stablecoins, USD Stablecoin, Solana Ecosystem, Ethereum Ecosystem, Fiat-backed Stablecoin, Made in USA",paypal-usd,692376665,720742266.0,,,N/A,33149302.0
MEXC,"Stablecoins, Tokenized Assets, Tokenized Gold, Ethereum Ecosystem, Real World Assets (RWA), Tokenized Commodities",pax-gold,687702529,687702529.0,630761.1849607506,345719.83871292474,0.05,53915877.0
MEXC,"Gaming (GameFi), NFT, Metaverse, Polygon Ecosystem, Play To Earn, Harmony Ecosystem, Ethereum Ecosystem, Animoca Brands Portfolio, Alleged SEC Securities, Binance Launchpad, Gaming Utility Token, Simulation Games, Energi Ecosystem, YZi Labs (Prev. Binance Labs) Portfolio, Coinbase 50 Index",the-sandbox,680487776,834661725.0,138324.76480650558,261599.29710875032,0.04,64343637.0
MEXC,"Internet of Things (IOT), Smart Contract Platform, Layer 1 (L1), DePIN, DWF Labs Portfolio, IOTA EVM Ecosystem, Outlier Ventures Portfolio, Directed Acyclic Graph (DAG)",iota,658110345,816437381.0,226231.9237551972,132895.9130048215,0.17,25149513.0
MEXC,"Storage, BNB Chain Ecosystem, Ethereum Ecosystem, DePIN, Alleged SEC Securities, Binance Launchpad, Tron Ecosystem, Energi Ecosystem, YZi Labs (Prev. Binance Labs) Portfolio, BitTorrent Ecosystem, GMCI DePIN Index, GMCI Index",bittorrent,656355018,658976852.0,4251.024144319492,1687.1407471547232,0.03,20868789.0
MEXC,"Smart Contract Platform, Privacy, Layer 1 (L1), Zero Knowledge (ZK), Proof of Work (PoW), Pantera Capital Portfolio, Made in USA, Coinbase 50 Index",zcash,656581639,656611809.0,9707.663974050223,29148.21280634052,0.2,80062833.0
MEXC,"Smart Contract Platform, Bitcoin Fork, Proof of Work (PoW)",bitcoin-cash-sv,645117339,645117339.0,75691.72806541533,96941.96889462575,0.12,28965573.0
MEXC,"Berachain Ecosystem, Bridged USDC, Bridged-Tokens, Bridged Stablecoins",stargate-bridged-usdc-berachain,639781300,639781300.0,,,N/A,19135678.0
MEXC,"Decentralized Finance (DeFi), Solana Ecosystem, Liquid Staking Tokens, Liquid Staked SOL, Liquid Staking",msol,634837273,634837273.0,,,N/A,7636540.0
MEXC,"Smart Contract Platform, Layer 1 (L1)",kaia,640953301,640953322.0,75291.80287723099,80852.0926548068,0.27,11624174.0
MEXC,"Stablecoins, USD Stablecoin, BNB Chain Ecosystem, Arbitrum Ecosystem, Ethereum Ecosystem, Fiat-backed Stablecoin",usdx-money-usdx,626549000,626549000.0,,,N/A,425883.0
MEXC,"Smart Contract Platform, Sports, NFT, Layer 1 (L1), Animoca Brands Portfolio, Alleged SEC Securities, Multicoin Capital Portfolio, Proof of Stake (PoS), Flow Ecosystem, Andreessen Horowitz (a16z) Portfolio",flow,614465051,614465051.0,272048.1769758566,216935.36002827625,0.23,26094644.0
MEXC,"Decentralized Exchange (DEX), Decentralized Finance (DeFi), Yield Farming, Automated Market Maker (AMM), Solana Ecosystem, Launchpad, GMCI DeFi Index, GMCI Index",raydium,587780274,1121738669.0,1647.9143472705337,9819.838873304054,0.47,97194312.0
MEXC,"BNB Chain Ecosystem, Arbitrum Ecosystem, Liquid Staking Tokens, Base Ecosystem, Restaking, Liquid Restaking Tokens, Blast Ecosystem, Mode Ecosystem, Liquid Staking",renzo-restaked-eth,583405452,583407358.0,,,N/A,1275172.0
MEXC,"Gaming (GameFi), NFT, BNB Chain Ecosystem, Metaverse, Meme, Play To Earn, Ethereum Ecosystem, Telegram Apps, Dog-Themed, DWF Labs Portfolio, RPG, On-chain Gaming, TokenFi Launchpad, GMCI Meme Index, GMCI Index",floki,576208048,596228673.0,109802.23518758007,157105.8488661328,0.02,91738397.0
MEXC,"Decentralized Exchange (DEX), Exchange-based Tokens, Decentralized Finance (DeFi), Yield Farming, Automated Market Maker (AMM), BNB Chain Ecosystem, Arbitrum Ecosystem, Ethereum Ecosystem, Aptos Ecosystem, ZkSync Ecosystem, Linea Ecosystem, Base Ecosystem, Polygon zkEVM Ecosystem, YZi Labs (Prev. Binance Labs) Portfolio, opBNB Ecosystem, GMCI DeFi Index, GMCI Index",pancakeswap-token,565735876,716464354.0,264718.10885875253,258322.65998089148,0.05,86628200.0
MEXC,"Decentralized Finance (DeFi), Liquid Staking Tokens, Berachain Ecosystem, Liquid Staking",infrared-bera,562488293,564302440.0,,,N/A,972812.0
MEXC,"Communication, Internet of Things (IOT), Smart Contract Platform, Solana Ecosystem, DePIN, Multicoin Capital Portfolio, Proof of Stake (PoS), Alameda Research Portfolio, Pantera Capital Portfolio, Andreessen Horowitz (a16z) Portfolio, Made in USA, Coinbase 50 Index",helium,557268826,691312366.0,147.66174297494138,73.67660322660075,0.19,5915398.0
MEXC,"Solana Ecosystem, Liquid Staking Tokens, Liquid Staked SOL, Liquid Staking",jupiter-staked-sol,554088820,554088820.0,,,N/A,3768837.0
MEXC,"NFT, Ethereum Ecosystem, Decentralized Identifier (DID), Name Service",ethereum-name-service,546485561,1647748894.0,219129.02491973012,316385.73838036676,0.18,85307324.0
MEXC,"Solana Ecosystem, Meme, Solana Meme, AI Meme, Pump.fun Ecosystem, Terminal of Truths, Binance Alpha Spotlight",fartcoin,543706031,543706031.0,54168.99204926827,68227.27019452007,0.32,173759348.0
MEXC,"Business Services, Infrastructure, Decentralized Finance (DeFi), Oracle, Solana Ecosystem, Neon Ecosystem, Manta Network Ecosystem, Multicoin Capital Portfolio, GMCI DeFi Index, Delphi Ventures Portfolio, GMCI Index",pyth-network,529719257,1461299023.0,357525.6028928425,374231.6365114498,0.07,43061610.0
MEXC,"Internet of Things (IOT), Ethereum Ecosystem, DePIN, DWF Labs Portfolio, Coinbase 50 Index",jasmycoin,531931510,549289044.0,197328.09274710828,170306.48480125476,0.09,67425703.0
MEXC,"Artificial Intelligence (AI), Solana Ecosystem, DePIN, Polychain Capital Portfolio",grass,536406961,1947203338.0,22641.669669253202,23568.643191988856,0.17,72417666.0
MEXC,"Stablecoins, Berachain Ecosystem",honey-3,526826293,526826293.0,,,N/A,35295238.0
MEXC,"Decentralized Exchange (DEX), Decentralized Finance (DeFi), Yield Farming, Automated Market Maker (AMM), BNB Chain Ecosystem, Derivatives, Lending/Borrowing Protocols, Arbitrum Ecosystem, Ethereum Ecosystem, Optimism Ecosystem, Fixed Interest, Real World Assets (RWA), LSDFi, Base Ecosystem, Restaking, LRTfi, Liquid Restaking Governance Tokens, Yield Tokenization Protocol, YZi Labs (Prev. Binance Labs) Portfolio, GMCI DeFi Index, Sonic Ecosystem, Liquid Staking, GMCI Index, BTCfi",pendle,524648237,915303947.0,302782.4697092728,250717.17710459058,0.03,153317577.0
MEXC,"Solana Ecosystem, Meme, Ethereum Ecosystem, Base Ecosystem, Bridged-Tokens, Murad Picks, Stock market-themed",spx6900,518740805,518740805.0,19610.545923845562,30428.522152329162,0.23,39725006.0
MEXC,"Artificial Intelligence (AI), Smart Contract Platform, Privacy, Masternodes, DePIN, DWF Labs Portfolio, Proof of Stake (PoS), Proof of Work (PoW)",beldex,507917557,729603611.0,1768.4172335675873,3650.0481268070753,0.05,4437338.0
MEXC,"BNB Chain Ecosystem, Ethereum Ecosystem, BTCfi",pumpbtc,497733129,497733129.0,,,N/A,303559.0
MEXC,"Smart Contract Platform, Layer 1 (L1), Bitcoin Sidechains, SideChain",coredaoorg,496546932,1044627988.0,23684.58620960199,45805.67420153695,0.02,29353617.0
MEXC,"Decentralized Exchange (DEX), Smart Contract Platform, Decentralized Finance (DeFi), Cosmos Ecosystem, Perpetuals, Layer 1 (L1), Osmosis Ecosystem, Appchains, DragonFly Capital Portfolio, DeFiance Capital Portfolio, Andreessen Horowitz (a16z) Portfolio, GMCI DeFi Index, Delphi Ventures Portfolio, GMCI Index, Polychain Capital Portfolio, Made in USA",dydx-chain,496899678,496899678.0,,,N/A,18037352.0
MEXC,"Stablecoins, USD Stablecoin, BNB Chain Ecosystem, Avalanche Ecosystem, Ethereum Ecosystem, Tron Ecosystem, Andreessen Horowitz (a16z) Portfolio, Fiat-backed Stablecoin",true-usd,494471592,494471592.0,802537.1718004482,8168447.021426275,0.01,34942489.0
MEXC,"Entertainment, Gaming (GameFi), NFT, Metaverse, Polygon Ecosystem, Play To Earn, Ethereum Ecosystem, Animoca Brands Portfolio, Alleged SEC Securities, Simulation Games, Coinbase 50 Index",decentraland,473823916,556309510.0,73449.6168335493,123080.18915604286,0.12,51906623.0
MEXC,"Gaming (GameFi), NFT, BNB Chain Ecosystem, Axie Infinity Ecosystem, Metaverse, Play To Earn, Harmony Ecosystem, Ethereum Ecosystem, Animoca Brands Portfolio, Alleged SEC Securities, Binance Launchpad, Ronin Ecosystem, Card Games, Breeding, Paradigm Portfolio, Gaming Governance Token, Gaming Utility Token, Andreessen Horowitz (a16z) Portfolio, Energi Ecosystem, YZi Labs (Prev. Binance Labs) Portfolio, Consensys Portfolio, Coinbase 50 Index",axie-infinity,469101074,791306344.0,85710.18163313791,125155.69673962338,0.03,25051521.0
MEXC,"Decentralized Finance (DeFi), Wallets, Polygon Ecosystem, Ethereum Ecosystem, Payment Solutions, Base Ecosystem, Sora Ecosystem, Made in USA",telcoin,474606765,516440138.0,4976.679709072157,5257.890723334177,0.41,2697427.0
MEXC,"USD Stablecoin, Polygon Ecosystem, Bridged USDC, Fiat-backed Stablecoin, Bridged-Tokens, Bridged Stablecoins",bridged-usdc-polygon-pos-bridge,468395594,468395594.0,,,N/A,21439299.0
MEXC,"Stablecoins, Ethereum Ecosystem",resolv-usr,467620250,467620250.0,,,N/A,4352281.0
MEXC,"Smart Contract Platform, Layer 1 (L1), MultiversX Ecosystem, Binance Launchpad, DWF Labs Portfolio, Proof of Stake (PoS), YZi Labs (Prev. Binance Labs) Portfolio, GMCI Layer 1 Index, GMCI Index, Coinbase 50 Index",elrond-erd-2,465495506,465495506.0,127844.30835823221,168677.21432333096,0.06,18088308.0
MEXC,"Ethereum Ecosystem, Mantle Ecosystem, Restaking, Liquid Restaking Tokens, Liquid Restaked ETH",mantle-restaked-eth,453501992,453501992.0,,,N/A,3112370.0
MEXC,"BNB Chain Ecosystem, Meme, Binance-Peg Tokens",binance-peg-dogecoin,450207405,450207405.0,,,N/A,2414025.0
MEXC,"Crypto-Backed Tokens, Decentralized Finance (DeFi), Rebase Tokens, Arbitrum Ecosystem, Ethereum Ecosystem, Berachain Ecosystem",olympus,447767051,450170442.0,,,N/A,4375680.0
MEXC,"Smart Contract Platform, Gaming (GameFi), NFT, Layer 1 (L1), Play To Earn, Zero Knowledge (ZK), FTX Holdings, Ronin Ecosystem, Gaming Blockchains, SideChain, Andreessen Horowitz (a16z) Portfolio, YZi Labs (Prev. Binance Labs) Portfolio",ronin,448177177,723578673.0,2176.896200266471,2841.7288700655486,0.37,11541161.0
MEXC,"Tokenized BTC, Avalanche Ecosystem, Bridged-Tokens",bitcoin-avalanche-bridged-btc-b,444732103,444732103.0,,,N/A,20078169.0
MEXC,"Smart Contract Platform, DWF Labs Portfolio, Proof of Work (PoW), GMCI Layer 1 Index, Sequoia Capital Portfolio, GMCI Index, Made in China",conflux-token,438181500,489121577.0,328982.13688887755,297428.4870740022,0.09,72880423.0
MEXC,"NFT, BNB Chain Ecosystem, Ethereum Ecosystem, Tron Ecosystem",apenft,433367297,437693643.0,12907.906411879569,5508.028016313987,1.22,23508972.0
MEXC,"Arbitrum Ecosystem, Ethereum Ecosystem, Optimism Ecosystem, Base Ecosystem, BTCfi",clbtc,433374102,433374102.0,,,N/A,3.7
MEXC,"Bridged USDC, Sonic Ecosystem, Bridged-Tokens, Bridged Stablecoins",sonic-bridged-usdc-e-sonic,430666618,430905783.0,,,N/A,17522870.0
MEXC,"Smart Contract Platform, Layer 1 (L1), Binance Launchpad, DWF Labs Portfolio, Osmosis Ecosystem, YZi Labs (Prev. Binance Labs) Portfolio, Made in USA",kava,431383532,431383532.0,74437.31114228218,72626.79207150603,0.03,59319046.0
MEXC,"Base Ecosystem, Bridged WETH, Bridged-Tokens",l2-standard-bridged-weth-base,426894141,426894141.0,,,N/A,427647208.0
MEXC,"Infrastructure, Smart Contract Platform, Ethereum Ecosystem, Layer 2 (L2), Zero Knowledge (ZK), Starknet Ecosystem, Paradigm Portfolio, Coinbase Ventures Portfolio, Rollup, Multicoin Capital Portfolio, Alameda Research Portfolio, Pantera Capital Portfolio, GMCI Layer 2 Index, Consensys Portfolio, Sequoia Capital Portfolio, GMCI Index, Polychain Capital Portfolio",starknet,426386311,1467626630.0,279591.9614862222,367239.92761615384,0.07,31853186.0
MEXC,"Decentralized Exchange (DEX), Infrastructure, Smart Contract Platform, Exchange-based Tokens, Decentralized Finance (DeFi), Bridge Governance Tokens, Multicoin Capital Portfolio, Proof of Stake (PoS), Delphi Ventures Portfolio",thorchain,427540784,517601901.0,560657.6490615985,521929.8865437404,0.17,91360029.0
MEXC,"Solana Ecosystem, Meme, Dog-Themed, Solana Meme, GMCI Meme Index, GMCI Index",dogwifcoin,421778962,421778962.0,1166099.5527075075,1325581.3345928483,0.47,220511103.0
MEXC,"Arbitrum Ecosystem, Bridged WETH, Bridged-Tokens",arbitrum-bridged-weth-arbitrum-one,413659770,413659770.0,,,N/A,254186608.0
MEXC,"Smart Contract Platform, Sports, NFT, Layer 1 (L1), Ethereum Ecosystem, Alleged SEC Securities, Chiliz Ecosystem, YZi Labs (Prev. Binance Labs) Portfolio, Coinbase 50 Index",chiliz,413349363,413349363.0,35876.19530698946,63733.96501193984,0.07,53698388.0
MEXC,"Decentralized Finance (DeFi), Liquid Staking Tokens, Base Ecosystem, Liquid Staked ETH, Liquid Staking",super-oeth,411735743,411735743.0,,,N/A,1238139.0
MEXC,"Ethereum Ecosystem, Real World Assets (RWA)",hashnote-usyc,411142414,411142414.0,,,N/A,117.16
MEXC,"Stablecoins, USD Stablecoin, Blast Ecosystem, Crypto-backed Stablecoin, Fiat-backed Stablecoin",usdb,406286194,406286194.0,,,N/A,1780860.0
MEXC,"Tokenized Assets, Solana Ecosystem, Polygon Ecosystem, Ethereum Ecosystem, Real World Assets (RWA), Tokenized Treasury Bonds (T-Bonds)",ousg,405085386,405085386.0,,,N/A,0.0
MEXC,"Smart Contract Platform, Layer 1 (L1), Bitcoin Fork, Proof of Work (PoW)",ecash,399894615,399897071.0,51735.89232612822,72072.32995904102,0.1,21471551.0
MEXC,"Artificial Intelligence (AI), Solana Ecosystem, Ethereum Ecosystem, Base Ecosystem, AI Agents, Virtuals Protocol Ecosystem, AI Agent Launchpad, Binance Alpha Spotlight",virtual-protocol,397546433,610509991.0,56474.40115791123,58147.04958851981,0.15,121058965.0
MEXC,"Decentralized Finance (DeFi), Yield Farming, BNB Chain Ecosystem, Lending/Borrowing Protocols, Avalanche Ecosystem, Polygon Ecosystem, Near Protocol Ecosystem, Harmony Ecosystem, Arbitrum Ecosystem, Ethereum Ecosystem, Base Ecosystem, Paradigm Portfolio, Index Coop Defi Index, Energi Ecosystem, Sora Ecosystem, Index Coop Index, Polychain Capital Portfolio, Made in USA",compound-governance-token,394259517,441006221.0,18244.001447893774,30531.588264370515,0.27,251683874.0
MEXC,"Artificial Intelligence (AI), Smart Contract Platform, Storage, Layer 1 (L1), DePIN, Coinbase Ventures Portfolio, Multicoin Capital Portfolio, Andreessen Horowitz (a16z) Portfolio, Blockchain Capital Portfolio",arweave,395129777,395129777.0,67250.27102910235,113522.89907197717,0.05,49568534.0
MEXC,"Decentralized Finance (DeFi), Liquid Staking Tokens, Ethereum Ecosystem, Liquid Staked ETH, Liquid Staking",stakewise-v3-oseth,386014226,386014226.0,,,N/A,3877.6
MEXC,"Crypto-Backed Tokens, Decentralized Finance (DeFi), Tokenized BTC, Solana Ecosystem, Polygon Ecosystem, Arbitrum Ecosystem, Ethereum Ecosystem, Optimism Ecosystem, Base Ecosystem",tbtc,385723249,385723249.0,,,N/A,16924994.0
MEXC,"Stablecoins, Solana Ecosystem, Arbitrum Ecosystem, Ethereum Ecosystem, Aptos Ecosystem, Sui Ecosystem, Mantle Ecosystem, Osmosis Ecosystem, Fiat-backed Stablecoin, Yield Tokenization Product, Yield-Bearing Stablecoin",ondo-us-dollar-yield,382826592,591241361.0,,,N/A,6975456.0
MEXC,"Gaming (GameFi), NFT, Polygon Ecosystem, Ethereum Ecosystem, Animoca Brands Portfolio, Gaming Blockchains, Gaming Governance Token, Gaming Utility Token, Andreessen Horowitz (a16z) Portfolio, ApeChain Ecosystem, Airdropped Tokens by NFT Projects, Coinbase 50 Index",apecoin,377084024,471676070.0,97109.6728484803,125744.94309862686,0.02,41927468.0
MEXC,"Decentralized Finance (DeFi), Arbitrum Ecosystem, Ethereum Ecosystem, Real World Assets (RWA), Base Ecosystem, Coinbase Ventures Portfolio, Energi Ecosystem, Made in USA",reserve-rights-token,363905512,647040203.0,41915.78207995941,21301.21804693811,0.06,26984865.0
MEXC,"Smart Contract Platform, Gaming (GameFi), NFT, BNB Chain Ecosystem, Binance Launchpool, Avalanche Ecosystem, Ethereum Ecosystem, DWF Labs Portfolio, Gaming Blockchains, Avalanche L1",beam-2,364128567,411273947.0,159560.3375582305,179072.48223229073,0.25,24530002.0
MEXC,"Smart Contract Platform, Layer 1 (L1), Ethereum Ecosystem, Real World Assets (RWA), RWA Protocol, Made in USA",plume,364903823,1824519115.0,42350.83669775284,43739.50348348186,0.16,41284667.0
MEXC,"BNB Chain Ecosystem, Wallets, Account Abstraction, Energi Ecosystem",trust-wallet-token,352203535,845322499.0,29576.091504834014,39456.0619961255,0.05,14946153.0
MEXC,"Infrastructure, BNB Chain Ecosystem, Avalanche Ecosystem, Polygon Ecosystem, Fantom Ecosystem, Arbitrum Ecosystem, Moonbeam Ecosystem, Ethereum Ecosystem, Optimism Ecosystem, Interoperability, Bridge Governance Tokens, Base Ecosystem, Osmosis Ecosystem, Cross-chain Communication, Secret Ecosystem, Galaxy Digital Portfolio, Polychain Capital Portfolio, Made in USA",axelar,351812444,446619016.0,5574.323438018553,5211.618282944442,0.35,9246975.0
MEXC,"Stablecoins, Decentralized Finance (DeFi), USD Stablecoin, BNB Chain Ecosystem, Seigniorage, Avalanche Ecosystem, Polygon Ecosystem, Fantom Ecosystem, Harmony Ecosystem, Arbitrum Ecosystem, Moonriver Ecosystem, Moonbeam Ecosystem, Ethereum Ecosystem, Optimism Ecosystem, Aurora Ecosystem, Polygon zkEVM Ecosystem, Evmos Ecosystem, Boba Network Ecosystem, Fiat-backed Stablecoin",frax,348467974,348467974.0,,,N/A,4842221.0
MEXC,"Liquid Staking Tokens, Ethereum Ecosystem, Restaking, Liquid Restaking Tokens, Ether.fi Ecosystem, Liquid Staked ETH, Liquid Staking",ether-fi-staked-eth,348716196,4688314986.0,,,N/A,47281.0
MEXC,"Smart Contract Platform, BNB Chain Ecosystem, Polygon Ecosystem, Harmony Ecosystem, Moonriver Ecosystem, Moonbeam Ecosystem, Ethereum Ecosystem, Layer 2 (L2), Zero Knowledge (ZK), Animoca Brands Portfolio, Alleged SEC Securities, Binance Launchpad, FTX Holdings, Coinbase Ventures Portfolio, Rollup, Proof of Stake (PoS), Alameda Research Portfolio, DragonFly Capital Portfolio, Energi Ecosystem, Sora Ecosystem, YZi Labs (Prev. Binance Labs) Portfolio, GMCI Layer 2 Index, GMCI 30 Index, Galaxy Digital Portfolio, GMCI Index, Coinbase 50 Index",matic-network,347492538,1989359474.0,,,N/A,1546061.0
MEXC,"Mantle Ecosystem, Bridged USDT, Bridged-Tokens, Bridged Stablecoins",mantle-bridged-usdt-mantle,342411660,342411660.0,,,N/A,1582111.0
MEXC,"Decentralized Finance (DeFi), Arbitrum Ecosystem, Liquid Staking Tokens, Ethereum Ecosystem, Optimism Ecosystem, Base Ecosystem",cgeth-hashkey-cloud,342103779,342103779.0,,,N/A,12.57
MEXC,"Smart Contract Platform, Proof of Stake (PoS), Made in China",neo,340290451,482476182.0,287996.02393978887,368517.00611809874,0.23,165491778.0
