MEXC,"Infrastructure, Smart Contract Platform, Decentralized Finance (DeFi), BNB Chain Ecosystem, Avalanche Ecosystem, Polygon Ecosystem, Fantom Ecosystem, Harmony Ecosystem, Arbitrum Ecosystem, Ethereum Ecosystem, DWF Labs Portfolio, Layer 3 (L3), Outlier Ventures Portfolio",orbs,89492726,196365516.0,,,N/A,5711563.0
MEXC,"LP Tokens, Ethereum Ecosystem",resolv-rlp,89274093,89274093.0,,,N/A,37553.0
MEXC,"Artificial Intelligence (AI), Infrastructure, Gaming (GameFi), NFT, Solana Ecosystem, Arbitrum Ecosystem, Impossible Finance Launchpad, Ethereum Ecosystem, Animoca Brands Portfolio, Base Ecosystem",carv,88921670,401413785.0,18244.83866036395,24080.001667105676,0.25,44412064.0
MEXC,"Smart Contract Platform, Proof of Stake (PoS), Sequoia Capital Portfolio",iostoken,88908071,88908071.0,27966.02183150682,26277.549301357114,0.08,10490501.0
MEXC,"Solana Ecosystem, Meme, Solana Meme, PolitiFi, Made in USA",melania-meme,88983283,593221311.0,13219.634744252475,5754.963552556815,0.3,16988951.0
MEXC,"BNB Chain Ecosystem, Soneium Ecosystem",solv-protocol-solvbtc-jupiter,88218605,88218605.0,,,N/A,2551.88
MEXC,"Smart Contract Platform, Polkadot Ecosystem, Binance Launchpool, Layer 2 (L2), Manta Network Ecosystem, Multicoin Capital Portfolio, Alameda Research Portfolio, DeFiance Capital Portfolio, YZi Labs (Prev. Binance Labs) Portfolio",manta-network,88526705,216452076.0,240346.80998587274,261208.3823515707,0.14,26772384.0
MEXC,"Big Data, Infrastructure, Storage, Cardano Ecosystem, DePIN",iagon,88450201,235227113.0,,,N/A,290833.0
MEXC,"Cronos Ecosystem, Bridged USDT, Bridged-Tokens, Bridged Stablecoins",cronos-bridged-usdt-cronos,87786335,87786335.0,,,N/A,258849.0
MEXC,"Solana Ecosystem, Polygon Ecosystem, Ethereum Ecosystem",m2-global-wealth-limited-mmx,87938789,279153694.0,,,N/A,36786.0
MEXC,"Solana Ecosystem, Liquid Staking Tokens, Restaking, Liquid Restaking Tokens, Liquid Staked SOL, Liquid Staking, Liquid Restaked SOL",solayer-staked-sol,87521410,87521410.0,,,N/A,493090.0
MEXC,"Solana Ecosystem, Meme, Frog-Themed, Solana Meme, GMCI Meme Index, GMCI Index",book-of-meme,87653233,87653233.0,242743.32125743886,372658.1497602256,0.16,47655104.0
MEXC,"Smart Contract Platform, Bitcoin Sidechains, Stacks Ecosystem, SideChain",sbtc-2,86577068,86577068.0,,,N/A,107697.0
MEXC,"Artificial Intelligence (AI), Oracle, Ethereum Ecosystem, DePIN, Energi Ecosystem, Sora Ecosystem, GMCI DePIN Index, GMCI Index",iexec-rlc,86530348,104004651.0,20616.479721782347,12098.892845242559,0.96,8219875.0
MEXC,"Big Data, Analytics, Arbitrum Ecosystem, Base Ecosystem",subsquid,87159615,186365440.0,3486.583665750541,3343.347497216476,0.56,2030147.0
MEXC,"Decentralized Finance (DeFi), BNB Chain Ecosystem, Ethereum Ecosystem, Real World Assets (RWA), Base Ecosystem, Coinbase Ventures Portfolio, Stablecoin Protocol, YZi Labs (Prev. Binance Labs) Portfolio, Galaxy Digital Portfolio",usual,86081865,94901420.0,224641.35598162567,263251.41100750765,0.09,23053411.0
MEXC,"NFT, Binance Launchpool, Meme, Ethereum Ecosystem, YZi Labs (Prev. Binance Labs) Portfolio, GMCI Meme Index, GMCI Index",memecoin-2,86525910,139845308.0,75672.09707296672,95613.90640622158,0.05,20099087.0
MEXC,"Smart Contract Platform, Ethereum Ecosystem, Layer 2 (L2), Zero Knowledge (ZK), Restaking, Zircuit Ecosystem",zircuit,87023066,396474265.0,45034.73044737752,47897.02020191041,0.05,29961706.0
MEXC,"Stablecoins, USD Stablecoin, Ethereum Ecosystem, Sonic Ecosystem, Fiat-backed Stablecoin",frax-usd,86246938,86246990.0,,,N/A,2683541.0
MEXC,"Crypto-Backed Tokens, Decentralized Finance (DeFi), Compound Tokens, cToken, Ethereum Ecosystem",compound-ether,86328774,86328774.0,,,N/A,129.68
MEXC,"Artificial Intelligence (AI), Big Data, Media, BNB Chain Ecosystem, Polygon Ecosystem, Ethereum Ecosystem, GMCI DePIN Index, Galaxy Digital Portfolio, GMCI Index",everipedia,86025327,86025327.0,20736.922654884784,15832.241690912682,0.07,6749207.0
MEXC,"Decentralized Finance (DeFi), Liquid Staking Tokens, Ethereum Ecosystem, LSDFi, Liquid Staked ETH, Liquid Staking",origin-ether,86276878,86276293.0,,,N/A,93365.0
MEXC,"Stablecoins, USD Stablecoin, Ethereum Ecosystem, Fiat-backed Stablecoin",lift-dollar,84609830,84609830.0,,,N/A,49236687.0
MEXC,"Decentralized Exchange (DEX), Exchange-based Tokens, Decentralized Finance (DeFi), Yield Farming, Automated Market Maker (AMM), Avalanche Ecosystem, Polygon Ecosystem, Near Protocol Ecosystem, Gnosis Chain Ecosystem, Harmony Ecosystem, Arbitrum Ecosystem, Ethereum Ecosystem, Optimism Ecosystem, Base Ecosystem, Index Coop Defi Index, Alameda Research Portfolio, DeFiance Capital Portfolio, Pantera Capital Portfolio, Energi Ecosystem, Polygon zkEVM Ecosystem, Huobi ECO Chain Ecosystem, Blockchain Capital Portfolio, Index Coop Index",balancer,84705851,91517417.0,108574.13149423343,91168.70264104265,0.3,11118160.0
MEXC,"Smart Contract Platform, Gaming (GameFi), Solana Ecosystem, Layer 2 (L2), Gaming Blockchains",sonic-svm,84511755,563411702.0,6267.02363421402,11663.48020656508,0.17,37112225.0
MEXC,"Crypto-Backed Tokens, BNB Chain Ecosystem, Arbitrum Ecosystem, Ethereum Ecosystem, Mantle Ecosystem",ignition-fbtc,84665193,1302638970.0,,,N/A,218425.0
MEXC,"NFT, Polygon Ecosystem, Ethereum Ecosystem, Optimism Ecosystem",blockv,84789445,84789445.0,,,N/A,72661.0
MEXC,"Decentralized Finance (DeFi), Ethereum Ecosystem",relend-usdc,84440810,84440810.0,,,N/A,0.0
MEXC,"Business Services, Polygon Ecosystem, Ethereum Ecosystem",request-network,83032301,111504742.0,,,N/A,4714862.0
MEXC,"Energy, Ethereum Ecosystem, Alleged SEC Securities, Energi Ecosystem, GMCI DePIN Index, Blockchain Capital Portfolio, GMCI Index",power-ledger,83715636,157946981.0,,,N/A,7835660.0
MEXC,"Smart Contract Platform, Privacy, Layer 1 (L1), Proof of Stake (PoS), Proof of Work (PoW), Zano Ecosystem, Privacy Blockchain",zano,84730765,84732793.0,426.97517135917036,2066.254165266489,0.31,523306.0
MEXC,"SocialFi, Coinbase Ventures Portfolio, Pantera Capital Portfolio, Andreessen Horowitz (a16z) Portfolio, Sequoia Capital Portfolio",deso,82351689,84511600.0,,,N/A,1528451.0
MEXC,"Solana Ecosystem, Polygon Ecosystem, DePIN, Pantera Capital Portfolio",geodnet,82456746,257196510.0,18114.729937122218,9970.509423946565,1.04,327458.0
MEXC,"Smart Contract Platform, BNB Chain Ecosystem, Ethereum Ecosystem, DWF Labs Portfolio, Made in USA",proton,83589466,92654924.0,3685.948071118467,8101.738110950294,0.27,6687764.0
MEXC,"Artificial Intelligence (AI), Smart Contract Platform, Gaming (GameFi), NFT, BNB Chain Ecosystem, Layer 1 (L1), Ethereum Ecosystem, Modular Blockchain, Chromia Ecosystem",chromaway,81570888,81570888.0,90199.40020884201,96464.89206941369,0.24,10042542.0
MEXC,"Gaming (GameFi), NFT, BNB Chain Ecosystem",infinitar-governance-token,81672285,376510511.0,1278.806835533046,1697.8163925890315,2.67,5018111.0
MEXC,"Smart Contract Platform, Layer 2 (L2), eGirl Capital Portfolio, Paradigm Portfolio, Blast Ecosystem",blast,82145550,302641078.0,25500.692806019997,37793.99087852963,0.13,14722643.0
MEXC,"Decentralized Exchange (DEX), Decentralized Finance (DeFi), Arbitrum Ecosystem, Ethereum Ecosystem",tokenlon,81887056,98992917.0,,,N/A,110975.0
MEXC,"SocialFi, BNB Chain Ecosystem",h2o-dao,80905347,98067087.0,,,N/A,1268.62
MEXC,"Smart Contract Platform, Layer 1 (L1), DWF Labs Portfolio, Radix Ecosystem",radix,80443311,98475712.0,1878.7573968056286,5979.541691386563,0.23,835361.0
MEXC,"Gaming (GameFi), NFT, BNB Chain Ecosystem, Metaverse, Collectibles, Polygon Ecosystem, Play To Earn, Harmony Ecosystem, Guild and Scholarship, Ethereum Ecosystem, Animoca Brands Portfolio, Base Ecosystem, DWF Labs Portfolio, Ronin Ecosystem, Gaming Governance Token, Andreessen Horowitz (a16z) Portfolio, Delphi Ventures Portfolio",yield-guild-games,80041123,185705241.0,52138.29053480201,95337.4305095645,0.16,15842622.0
MEXC,"Ethereum Ecosystem, DWF Labs Portfolio",adventure-gold,79762541,79762541.0,97630.03004198702,183270.9758363466,0.19,20267630.0
MEXC,"Stablecoins, USD Stablecoin, Solana Ecosystem, Ethereum Ecosystem, Multicoin Capital Portfolio, Fiat-backed Stablecoin",paxos-standard,79442881,79442881.0,1023670.219170676,127903.7092363394,0.02,7347143.0
MEXC,"Optimism Ecosystem, Bridged WBTC, Bridged-Tokens",optimism-bridged-wbtc-optimism,79563228,79563228.0,,,N/A,2692293.0
MEXC,"Artificial Intelligence (AI), Infrastructure, Smart Contract Platform, Decentralized Finance (DeFi), Arbitrum Ecosystem, Ethereum Ecosystem, Zero Knowledge (ZK), DWF Labs Portfolio, Coinbase Ventures Portfolio, Pantera Capital Portfolio, YZi Labs (Prev. Binance Labs) Portfolio",marlin,78743924,96208952.0,1126.6664687219936,1243.342232428392,0.08,5584513.0
MEXC,"Internet of Things (IOT), BNB Chain Ecosystem, Ethereum Ecosystem, DePIN, DWF Labs Portfolio",mass-vehicle-ledger,78440680,82443821.0,1137.5615778373315,688.5806845988991,0.03,685849.0
MEXC,"Artificial Intelligence (AI), Solana Ecosystem, Meme, Pump.fun Ecosystem, AI Applications, Binance Alpha Spotlight",alchemist-ai,77529877,91210384.0,10291.078059193478,10725.268719136757,0.45,65788012.0
MEXC,"Artificial Intelligence (AI), Infrastructure, Smart Contract Platform, Oracle, Polkadot Ecosystem, Ethereum Ecosystem, Interoperability, Layer 2 (L2), Zero Knowledge (ZK), DePIN, DWF Labs Portfolio, Rollup, AI Agents, Sora Ecosystem, AI Framework, Made in USA",pha,77708134,98680603.0,192416.87607369013,199565.7415171855,0.1,22295701.0
MEXC,"Smart Contract Platform, Gaming (GameFi), NFT, Layer 1 (L1), Play To Earn, Ethereum Ecosystem, Animoca Brands Portfolio, Gaming Blockchains, Pantera Capital Portfolio, OKX Ventures Portfolio",wax,77832831,83745732.0,31820.141560312037,63287.792765315506,0.23,7463073.0
MEXC,"Decentralized Finance (DeFi), Derivatives, Synthetic Issuer, Ethereum Ecosystem, Base Ecosystem, Synthetic",stp-network,77549775,77549775.0,10690.331758138222,8004.216139212991,0.08,6348355.0
MEXC,"Exchange-based Tokens, Centralized Exchange (CEX) Token, Ethereum Ecosystem",bitmart-token,77425672,145860787.0,,,N/A,4278857.0
MEXC,"Blast Ecosystem, Bridged WETH, Bridged-Tokens",l2-standard-bridged-weth-blast,77270402,77270402.0,,,N/A,1924210.0
MEXC,"Meme, Ethereum Ecosystem, Dog-Themed",neiro-3,76352694,76352694.0,39691.09592088423,59592.945556035316,0.03,61260267.0
MEXC,"Smart Contract Platform, Layer 1 (L1)",ong,76794662,187414207.0,29778.367099523646,46518.84079991614,0.21,2730106.0
MEXC,"Smart Contract Platform, Layer 1 (L1), Zero Knowledge (ZK), Andreessen Horowitz (a16z) Portfolio, Privacy Blockchain, Made in USA",aleo,76246450,361173893.0,117654.15036374904,122785.41486169807,0.05,5666171.0
MEXC,"Smart Contract Platform, Meme, Ethereum Ecosystem, Layer 2 (L2), Shibarium Ecosystem, Dog-Themed",bone-shibaswap,76442337,76474343.0,4452.134766496676,5618.146299111675,0.23,6081377.0
MEXC,"Smart Contract Platform, Cosmos Ecosystem, Modular Blockchain, Osmosis Ecosystem, Rollups-as-a-Service (RaaS)",dymension,75408418,286023943.0,275917.14850886,270879.91405915836,0.07,24149653.0
MEXC,"Gaming (GameFi), Play To Earn, Guild and Scholarship, Ethereum Ecosystem, Animoca Brands Portfolio, Base Ecosystem, DWF Labs Portfolio, Ronin Ecosystem, Coinbase Ventures Portfolio, DeFiance Capital Portfolio, Pantera Capital Portfolio, YZi Labs (Prev. Binance Labs) Portfolio, MMO",zentry,75638467,109233799.0,18044.808974722364,33889.958386649894,0.8,9183703.0
MEXC,"Artificial Intelligence (AI), Base Ecosystem, AI Agents, AI Applications, Made in USA",venice-token,75574508,183115986.0,32820.44834940887,32909.49110350684,0.19,13828852.0
MEXC,"Exchange-based Tokens, Centralized Exchange (CEX) Token, Near Protocol Ecosystem, Harmony Ecosystem, Ethereum Ecosystem, Multicoin Capital Portfolio, Alameda Research Portfolio, Elastos Smart Contract Chain Ecosystem, Sequoia Capital Portfolio, Made in China",huobi-token,74845217,94398100.0,,,N/A,14647.8
MEXC,Ethereum Ecosystem,dkargo,75647570,80705089.0,431.464397456791,131.27005798313454,1.05,1376988.0
MEXC,BNB Chain Ecosystem,aventis-ai,74950078,193062826.0,25.194959253837222,5.486429212396735,0.42,26421.0
MEXC,"Smart Contract Platform, Privacy, Proof of Work (PoW), Made in USA",verge,74853469,75003198.0,35392.25089526502,545.5356206041675,0.2,4353632.0
MEXC,"Decentralized Finance (DeFi), Solana Ecosystem, Real World Assets (RWA), Payment Solutions, DePIN, Coinbase Ventures Portfolio, Alameda Research Portfolio, Circle Ventures Portfolio, OKX Ventures Portfolio, RWA Protocol, Made in USA",zebec-network,74886839,98058062.0,3279.5447504006256,4002.7324245411696,0.27,8606059.0
MEXC,"Exchange-based Tokens, Centralized Exchange (CEX) Token, Ethereum Ecosystem",hashkey-ecopoints,74883260,565156680.0,55803.975567974936,58253.6107391417,0.09,1446495.0
MEXC,"Smart Contract Platform, Proof of Stake (PoS)",stratis,74299991,78730668.0,,,N/A,2153144.0
MEXC,"Meme, PulseChain Ecosystem",the-grays-currency,72808054,72808054.0,,,N/A,177370.0
MEXC,"Meme, Ethereum Ecosystem, PolitiFi",constitutiondao,73573349,73573349.0,222446.94242447763,259189.45494222172,0.07,31223174.0
MEXC,"Decentralized Exchange (DEX), Decentralized Finance (DeFi), Sui Ecosystem, Animoca Brands Portfolio, OKX Ventures Portfolio, Dex Aggregator",cetus-protocol,74020220,107054719.0,5303.822999356603,13138.92607769424,0.02,21779503.0
MEXC,"Tokenized Assets, Polygon Ecosystem, Arbitrum Ecosystem, Ethereum Ecosystem, Real World Assets (RWA), Starknet Ecosystem, Tokenized Treasury Bills (T-Bills)",spiko-us-t-bills-money-market-fund,73452023,73452023.0,,,N/A,0.0
MEXC,"Smart Contract Platform, Layer 1 (L1), Osmosis Ecosystem, XRP Ledger Ecosystem",coreum,73245691,73245691.0,2928.5276988753944,1561.0950557562667,1.06,82401.0
MEXC,"Stablecoins, USD Stablecoin, Osmosis Ecosystem, Fiat-backed Stablecoin",usdx,73769408,73769408.0,,,N/A,39772.0
MEXC,"Software as a service, Polygon Ecosystem, Ethereum Ecosystem, Decentralized Identifier (DID), Pantera Capital Portfolio, Energi Ecosystem, Blockchain Capital Portfolio",civic,72698336,90646303.0,,,N/A,11048416.0
MEXC,"Solana Ecosystem, Meme, Base Ecosystem, AI Meme, AI Agents, Virtuals Protocol Ecosystem, Binance Alpha Spotlight, DeFAI",aixbt,73910990,86383696.0,227944.26787839516,292695.6552576633,0.17,83789146.0
MEXC,"Sports, BNB Chain Ecosystem",pixer-eternity,72510069,336961169.0,154.9703759552212,56.20930552104161,0.8,247822.0
MEXC,"Stablecoins, USD Stablecoin, Seigniorage, Alleged SEC Securities, Osmosis Ecosystem, Stablecoin Protocol, DeFiance Capital Portfolio, Terra Classic Ecosystem, YZi Labs (Prev. Binance Labs) Portfolio, Delphi Ventures Portfolio, Galaxy Digital Portfolio, Fiat-backed Stablecoin",terrausd,73906807,80518470.0,34112.58697648674,52501.83586707734,0.15,20116377.0
MEXC,"Wrapped-Tokens, Solana Ecosystem",wrapped-fragsol,72377176,72458260.0,,,N/A,2155549.0
MEXC,"Meme, Dog-Themed, TON Ecosystem, TON Meme",dogs-2,71835517,76457734.0,117309.99306948585,235394.90499723222,0.07,30519888.0
MEXC,"BNB Chain Ecosystem, Solana Ecosystem, Polygon Ecosystem, Meme, Ethereum Ecosystem, Cronos Ecosystem, Dog-Themed, Elon Musk-Inspired, Fuse Ecosystem",dogelon-mars,72381209,131686005.0,14847.441377557214,17560.536686001247,0.15,3791454.0
MEXC,"Decentralized Finance (DeFi), Lending/Borrowing Protocols, Moonbeam Ecosystem, Base Ecosystem, Coinbase Ventures Portfolio, Made in USA",moonwell-artemis,71824900,108569747.0,,,N/A,3776643.0
MEXC,Smart Contract Platform,songbird,71578826,85054153.0,263.4475079856441,377.0068199782816,0.24,210618.0
MEXC,"Meme, Ethereum Ecosystem, Mantle Ecosystem",puff-the-dragon,70448619,70448619.0,,,N/A,182910.0
MEXC,BNB Chain Ecosystem,metfi-2,70305507,233803244.0,,,N/A,533968.0
MEXC,Retail,milk-alliance,69787176,154226111.0,,,N/A,3134812.0
MEXC,"Decentralized Finance (DeFi), Lending/Borrowing Protocols, Solana Ecosystem, Binance Alpha Spotlight",kamino,70064164,518993808.0,52554.33694833466,61481.45507401446,0.06,18412819.0
MEXC,"Decentralized Finance (DeFi), Wallets, Ethereum Ecosystem, Pundi AIFX Omnilayer Ecosystem",pundi-x-2,69976229,69976229.0,,,N/A,6870793.0
MEXC,"Smart Contract Platform, Polkadot Ecosystem, Layer 1 (L1), Coinbase Ventures Portfolio, Proof of Stake (PoS), YZi Labs (Prev. Binance Labs) Portfolio",moonbeam,69953662,84285682.0,14535.375297436329,15080.2441219192,0.1,13284105.0
MEXC,"Lending/Borrowing Protocols, Solana Ecosystem, FTX Holdings, Coinbase Ventures Portfolio, Alameda Research Portfolio, DragonFly Capital Portfolio",solend,69360419,137087973.0,,,N/A,36999.0
MEXC,"Decentralized Exchange (DEX), Decentralized Finance (DeFi), Yield Farming, Automated Market Maker (AMM), BNB Chain Ecosystem, Avalanche Ecosystem, Arbitrum Ecosystem, Mantle Ecosystem, DeFiance Capital Portfolio, Delphi Ventures Portfolio, Dex Aggregator",joe,68007656,85719720.0,47412.53550266711,157927.7225293412,0.18,7896263.0
MEXC,"Ethereum Ecosystem, DePIN",dent,68171480,71268108.0,,,N/A,5571682.0
MEXC,"Exchange-based Tokens, Layer 1 (L1), Ethereum Ecosystem",devve,68296761,93782081.0,1465.8258678145228,3513.9872200917034,0.25,925119.0
MEXC,"Smart Contract Platform, Wallets, Layer 2 (L2), Osmosis Ecosystem",islamic-coin,68221831,803260712.0,2082.2357477125147,229.83076703218345,0.25,773360.0
MEXC,"Infrastructure, Smart Contract Platform, Oracle, Layer 1 (L1), Animoca Brands Portfolio, Coinbase Ventures Portfolio, Cross-chain Communication, Made in USA",supra,67490498,463713817.0,28788.92040573256,28737.66752827109,0.17,4823933.0
MEXC,"Business Services, Decentralized Finance (DeFi), Oracle, Polygon Ecosystem, Gnosis Chain Ecosystem, Arbitrum Ecosystem, Ethereum Ecosystem, Optimism Ecosystem, Manta Network Ecosystem, YZi Labs (Prev. Binance Labs) Portfolio, Lisk Ecosystem, Made in USA",tellor,67594066,69652068.0,,,N/A,29696517.0
MEXC,"Polkadot Ecosystem, Real World Assets (RWA), Coinbase Ventures Portfolio, Circle Ventures Portfolio, Galaxy Digital Portfolio, RWA Protocol",centrifuge,67312585,73715112.0,,,N/A,442931.0
MEXC,"Entertainment, Gaming (GameFi), NFT, Axie Infinity Ecosystem, Play To Earn, Ethereum Ecosystem, Ronin Ecosystem, Gaming Utility Token",smooth-love-potion,66747773,66747527.0,15847.081558061374,14807.90599148868,0.06,8716817.0
MEXC,"Ethereum Ecosystem, Telegram Apps, Binance HODLer Airdrops",banana-gun,66445954,161088142.0,130864.84281931014,156631.63495023522,0.05,28800997.0
MEXC,"Smart Contract Platform, Gaming (GameFi), Layer 1 (L1), Proof of Stake (PoS), Gaming Blockchains",oasys,66387100,168216004.0,4969.883919828125,705.0308150439625,0.82,558891.0
MEXC,"Smart Contract Platform, Ethereum Ecosystem, Layer 2 (L2), Zero Knowledge (ZK), Rollup, OKX Ventures Portfolio",taiko,66226601,643404989.0,6836.460045866076,15002.300124994066,0.16,15685985.0
MEXC,Ethereum Ecosystem,saasgo,65218510,81523138.0,,,N/A,215072.0
MEXC,"Solana Ecosystem, Restaking, Liquid Restaking Tokens, Liquid Restaked SOL",renzo-restaked-sol,65623162,65623162.0,,,N/A,419674.0
MEXC,"BNB Chain Ecosystem, Meme, Binance Alpha Spotlight, Four.meme Ecosystem",test-3,65874746,65874746.0,216751.10783300924,226884.05188536216,0.19,64584882.0
MEXC,"Solana Ecosystem, Avalanche Ecosystem, Polygon Ecosystem, Ethereum Ecosystem, Aptos Ecosystem, Real World Assets (RWA), Ink Ecosystem",apollo-diversified-credit-securitize-fund,65662341,65662341.0,,,N/A,0.0
MEXC,BNB Chain Ecosystem,diamond-launch,65803862,147806403.0,,,N/A,629295.0
MEXC,"Stablecoins, USD Stablecoin, BNB Chain Ecosystem, Fantom Ecosystem, Arbitrum Ecosystem, Ethereum Ecosystem, Optimism Ecosystem, Base Ecosystem, Crypto-backed Stablecoin, Fiat-backed Stablecoin",dola-usd,64959844,214412793.0,,,N/A,3819440.0
MEXC,"Artificial Intelligence (AI), Infrastructure, Ethereum Ecosystem, AI Framework, Made in USA",arcblock,65161861,122946907.0,,,N/A,875094.0
MEXC,SocialFi,steem,64568858,64678485.0,75157.74098195569,40485.61721032979,0.16,18513633.0
MEXC,"Artificial Intelligence (AI), Decentralized Finance (DeFi), Ethereum Ecosystem, DePIN",pinlink,63881369,79851711.0,4482.366781846792,3494.7648570914616,0.27,918595.0
MEXC,"Smart Contract Platform, Meme, Base Ecosystem, Layer 3 (L3), Base Meme, Farcaster Ecosystem",degen-base,64297637,106713316.0,23507.914394012572,2823.1736624678924,0.07,15912990.0
MEXC,"Artificial Intelligence (AI), Business Services, Decentralized Finance (DeFi), Ethereum Ecosystem, Paradigm Portfolio, DragonFly Capital Portfolio, Energi Ecosystem",numeraire,63977188,85337372.0,6217.6990963826875,7281.491102123948,0.15,9674536.0
MEXC,"Decentralized Finance (DeFi), Lending/Borrowing Protocols, Arbitrum Ecosystem, Ethereum Ecosystem, Alameda Research Portfolio, Pantera Capital Portfolio",liquity,63687924,65420602.0,222676.55670996604,193803.51939931203,0.14,16747226.0
MEXC,"Meme, Base Ecosystem, Dog-Themed, Base Meme, Farcaster Ecosystem",doginme,65866738,65866738.0,514.9459690849806,2562.790294362005,0.3,22370746.0
MEXC,"Exchange-based Tokens, BNB Chain Ecosystem, Centralized Exchange (CEX) Token, Polygon Ecosystem, Ethereum Ecosystem",bit2me,63509609,64151120.0,,,N/A,72757.0
MEXC,"Decentralized Exchange (DEX), Exchange-based Tokens, Decentralized Finance (DeFi), BNB Chain Ecosystem, Binance Launchpool, Polygon Ecosystem, Near Protocol Ecosystem, Arbitrum Ecosystem, Ethereum Ecosystem, DWF Labs Portfolio, Coinbase Ventures Portfolio, Alameda Research Portfolio, DeFiance Capital Portfolio, Pantera Capital Portfolio, Aurora Ecosystem, Energi Ecosystem, YZi Labs (Prev. Binance Labs) Portfolio, Galaxy Digital Portfolio",dodo,63338359,63338359.0,55338.8477497799,44553.78530476807,0.31,11103925.0
MEXC,"Decentralized Finance (DeFi), USD Stablecoin, BNB Chain Ecosystem, Avalanche Ecosystem, Arbitrum Ecosystem, Liquid Staking Tokens, Ethereum Ecosystem, Optimism Ecosystem, Fiat-backed Stablecoin",staked-frax,63423314,63423314.0,,,N/A,392.09
MEXC,"Solana Ecosystem, Meme, Ethereum Ecosystem, Cronos Ecosystem, Dog-Themed, AI Meme",corgiai,61138213,66294142.0,,,N/A,127144.0
MEXC,"Optimism Ecosystem, Bridged WETH, Bridged-Tokens",l2-standard-bridged-weth-optimism,63007987,63007987.0,,,N/A,26323320.0
MEXC,"Smart Contract Platform, Layer 1 (L1), Proof of Work (PoW), Privacy Blockchain",ergo,63021854,76710717.0,1945.8763756666203,4880.355841098924,0.63,82496.0
MEXC,"Healthcare, Osmosis Ecosystem",medibloc,62416718,67605951.0,,,N/A,394130.0
MEXC,"Gaming (GameFi), NFT, Metaverse, Collectibles, Play To Earn, Ethereum Ecosystem, Base Ecosystem, Energi Ecosystem",ecomi,62315094,71498633.0,3368.738078960405,3229.0800085472283,0.22,3367091.0
MEXC,"Crypto-Backed Tokens, Decentralized Finance (DeFi), Wrapped-Tokens, Ethereum Ecosystem",resolv-wstusr,62157791,62157791.0,,,N/A,5141.72
MEXC,E-commerce,pay-coin,61532807,114331142.0,,,N/A,37761.0
MEXC,"Meme, Ethereum Ecosystem, Frog-Themed, Murad Picks, Binance Alpha Spotlight",apu-s-club,62167072,62167072.0,7966.713436304098,5490.3651652572435,0.38,2396297.0
MEXC,"Artificial Intelligence (AI), Cardano Ecosystem, Ethereum Ecosystem, AI Agents, Sora Ecosystem",singularitynet,61422859,92846104.0,,,N/A,27616.0
MEXC,"Artificial Intelligence (AI), Smart Contract Platform, Decentralized Finance (DeFi), Analytics, NFT, BNB Chain Ecosystem, Launchpad, Ethereum Ecosystem, Telegram Apps, Discord Bots, ChainGPT Launchpad, Poolz Finance Launchpad, AI Agents, AI Applications, Binance Alpha Spotlight, AI Framework, DeFAI",chaingpt,61173448,75638752.0,121791.61724357236,128300.63625353803,0.25,28108078.0
MEXC,"Artificial Intelligence (AI), Decentralized Finance (DeFi), Solana Ecosystem, Arbitrum Ecosystem, Metis Ecosystem, AI Agents, Sonic Ecosystem, IOTA EVM Ecosystem, AI Applications, DeFAI",heyanon,60435536,96947711.0,454.8346953949486,2378.717656281928,1.2,3196413.0
MEXC,"Smart Contract Platform, Cosmos Ecosystem, Osmosis Ecosystem, Alameda Research Portfolio, DragonFly Capital Portfolio, DeFiance Capital Portfolio, Privacy Blockchain, Outlier Ventures Portfolio",secret,60488867,63630690.0,21490.105956707506,27275.042371435156,0.15,3657824.0
MEXC,"Smart Contract Platform, Gaming (GameFi), NFT, Binance Launchpool, Arbitrum Ecosystem, Layer 3 (L3), XAI Ecosystem, Gaming Blockchains, Outlier Ventures Portfolio",xai-blockchain,60222624,89454512.0,,,N/A,61795916.0
MEXC,Ethereum Ecosystem,ai-analysis-token,60352055,273463320.0,251.74492582580518,357.89708226161156,0.87,116326.0
MEXC,"Decentralized Finance (DeFi), Yield Farming, BNB Chain Ecosystem, Binance Launchpool, Yield Aggregator, Ethereum Ecosystem, Manta Network Ecosystem, YZi Labs (Prev. Binance Labs) Portfolio",bella-protocol,59187966,73984957.0,8590.653658400794,9249.032240491853,0.07,16823106.0
MEXC,"Smart Contract Platform, Layer 2 (L2), Made in USA",metal,60110324,60110324.0,,,N/A,1518783.0
MEXC,"Gaming (GameFi), Solana Ecosystem, Meme, Ethereum Ecosystem, Frog-Themed, Gaming Platform, The Boy’s Club",pepecoin-2,60098051,60098051.0,2479.635869258393,1361.862342989573,0.02,4458322.0
MEXC,"Meme, Cat-Themed, Hyperliquid Ecosystem, HyperEVM Ecosystem",purr-2,58438680,58438684.0,,,N/A,1734049.0
MEXC,"Decentralized Finance (DeFi), BNB Chain Ecosystem, Solana Ecosystem, Wallets, Polygon Ecosystem, Ethereum Ecosystem, Binance Launchpad, DWF Labs Portfolio, Multicoin Capital Portfolio, Alameda Research Portfolio, Viction Ecosystem, YZi Labs (Prev. Binance Labs) Portfolio",coin98,58856998,63023565.0,177863.2540141435,208444.48330227853,0.19,20272566.0
MEXC,"Crypto-Backed Tokens, Wrapped-Tokens, Gnosis Chain Ecosystem, Bridged-Tokens",bridged-wrapped-steth-gnosis,59479976,59479976.0,,,N/A,1583064.0
MEXC,"Meme, Tron Ecosystem, Sun Pump Ecosystem, TRON Meme",sundog,58738077,58738077.0,2230.0888639578266,8098.915892278827,0.31,20345140.0
MEXC,"Layer 1 (L1), Real World Assets (RWA), Payment Solutions, Base Ecosystem, Stablecoin Protocol",keeta,60906640,152266600.0,,,N/A,6321608.0
MEXC,"Decentralized Finance (DeFi), Liquid Staking Tokens, Berachain Ecosystem, Liquid Staked ETH",berachain-staked-eth,58269085,58269085.0,,,N/A,2777.94
