MEXC,"Decentralized Finance (DeFi), Binance Launchpool, Arbitrum Ecosystem, Ethereum Ecosystem, Restaking, Liquid Restaking Governance Tokens, Ether.fi Ecosystem, Consensys Portfolio, OKX Ventures Portfolio",ether-fi,160549810,693022107.0,204407.31375237796,914743.7691939517,0.13,55881454.0
MEXC,"Solana Ecosystem, DePIN, Multicoin Capital Portfolio, Made in USA",hivemapper,160105016,249017505.0,7145.4062752967675,26499.634769006865,0.28,687596.0
MEXC,"Artificial Intelligence (AI), Meme, Base Ecosystem, AI Agents, Binance Alpha Spotlight, AI Framework",freysa-ai,158752426,158752426.0,196.19957637758677,257.4581979984692,0.21,630423.0
MEXC,"Smart Contract Platform, Layer 1 (L1), Proof of Stake (PoS), GMCI Layer 1 Index, GMCI Index, Made in USA",casper-network,160582281,166255152.0,7762.800638746225,6815.228060581063,0.08,11088562.0
MEXC,"Decentralized Finance (DeFi), Tron Ecosystem",sun-token,159085379,322085540.0,147582.76026311834,122586.07593046612,0.17,29935431.0
MEXC,"Decentralized Exchange (DEX), Exchange-based Tokens, Decentralized Finance (DeFi), Automated Market Maker (AMM), BNB Chain Ecosystem, Derivatives, Perpetuals, Centralized Exchange (CEX) Token, Solana Ecosystem, Avalanche Ecosystem, Polygon Ecosystem, Near Protocol Ecosystem, Fantom Ecosystem, Arbitrum Ecosystem, Ethereum Ecosystem, ZkSync Ecosystem, Mantle Ecosystem, Linea Ecosystem, Base Ecosystem, DragonFly Capital Portfolio, Binance Labs Portfolio",woo-network,157761763,187885507.0,94829.36763946363,106724.55560653802,0.2,11459683.0
MEXC,"Smart Contract Platform, BNB Chain Ecosystem, Layer 1 (L1), Ethereum Ecosystem, ZetaChain Ecosystem, Cross-chain Communication, Made in USA",zetachain,156173525,448255684.0,132685.47223275126,230028.1945760081,0.05,10353981.0
MEXC,"Decentralized Finance (DeFi), Derivatives, Perpetuals, Avalanche Ecosystem, Arbitrum Ecosystem",gmx,161346404,161346404.0,13959.123189021886,34461.35290882843,0.12,23461143.0
MEXC,"Gaming (GameFi), NFT, Solana Ecosystem, Animoca Brands Portfolio, FTX Holdings, Multicoin Capital Portfolio, Alameda Research Portfolio",metaplex,155312372,199020124.0,119.00345253406218,2251.841205995507,0.25,4910379.0
MEXC,"Meme, Ethereum Ecosystem, Frog-Themed, AI Meme",turbo,156087173,156087173.0,127390.7159921729,232907.33324995296,0.04,33271679.0
MEXC,BNB Chain Ecosystem,acet-token,151311983,197407644.0,,,N/A,762629.0
MEXC,"Internet of Things (IOT), Oracle, NFT, Metaverse, Ethereum Ecosystem, DePIN, Alleged SEC Securities, Made in USA",xyo-network,153025354,153025354.0,,,N/A,10555719.0
MEXC,"Smart Contract Platform, EthereumPoW Ecosystem, Proof of Work (PoW)",ethereum-pow-iou,154283655,154283655.0,21471.098050125707,40480.066152094005,0.14,6631419.0
MEXC,"BNB Chain Ecosystem, Binance Alpha Spotlight",bnb48-club-token,153578367,153578367.0,,,N/A,246050.0
MEXC,"Smart Contract Platform, Gaming (GameFi), Layer 1 (L1), Ethereum Ecosystem, Modular Blockchain, Account Abstraction, Multicoin Capital Portfolio, Gaming Blockchains, Gaming Utility Token, Skale Ecosystem, Consensys Portfolio, Galaxy Digital Portfolio, Made in USA",skale,154713982,162753832.0,29279.934489396168,24108.61513660302,0.04,15197762.0
MEXC,"Stablecoins, Ethereum Ecosystem, Crypto-backed Stablecoin",elixir-staked-deusd,152966299,152966299.0,,,N/A,1998146.0
MEXC,Smart Contract Platform,bitkub-coin,152399463,188676882.0,,,N/A,459690.0
MEXC,"SocialFi, Arbitrum Ecosystem",uxlink,153039374,452511456.0,51764.17942841168,40082.86798597237,0.04,18634095.0
MEXC,"Payment Solutions, Made in USA, Directed Acyclic Graph (DAG)",nano,151151504,151151504.0,,,N/A,6184438.0
MEXC,"Decentralized Exchange (DEX), Decentralized Finance (DeFi), Yield Farming, Automated Market Maker (AMM), BNB Chain Ecosystem, Seigniorage, Solana Ecosystem, Avalanche Ecosystem, Polygon Ecosystem, Fantom Ecosystem, Harmony Ecosystem, Arbitrum Ecosystem, Moonriver Ecosystem, Ethereum Ecosystem, Liquid Staking Governance Tokens, Curve Ecosystem, Stablecoin Protocol, Polygon zkEVM Ecosystem, Evmos Ecosystem, Fraxtal Ecosystem, GMCI DeFi Index, Liquid Staking, GMCI Index, Made in USA",frax-share,152194742,171944166.0,36468.324916088335,51998.34529300974,0.23,45216662.0
MEXC,"Smart Contract Platform, Layer 1 (L1), Real World Assets (RWA), RWA Protocol",polymesh,150356144,150356144.0,,,N/A,2227272.0
MEXC,"Smart Contract Platform, Layer 1 (L1), Layer 0 (L0), Made in USA, Directed Acyclic Graph (DAG)",constellation-labs,150012735,150012843.0,1879.3908096784348,692.995625433333,0.07,2909570.0
MEXC,"BNB Chain Ecosystem, Binance-Peg Tokens",binance-peg-sol,148085597,148085597.0,,,N/A,4515983.0
MEXC,"Smart Contract Platform, Masternodes, Zero Knowledge (ZK), Proof of Work (PoW), Made in USA",zencash,148536116,148538303.0,526552.3797423819,524198.0543373609,0.21,15315000.0
MEXC,"NFT, Solana Ecosystem, NFT Marketplace, Paradigm Portfolio, Sequoia Capital Portfolio",magic-eden,146949166,1101769785.0,144817.71065416894,138201.17922119948,0.14,15971252.0
MEXC,"Exchange-based Tokens, Decentralized Finance (DeFi), Ethereum Ecosystem, Real World Assets (RWA), Alleged SEC Securities",lcx,145670183,147065053.0,,,N/A,2097998.0
MEXC,"Decentralized Finance (DeFi), Derivatives, Prediction Markets, Solana Ecosystem",drift-protocol,148655404,515268805.0,2170.118546768026,2018.7464920258508,0.23,44858825.0
MEXC,"Smart Contract Platform, Crypto-Backed Tokens, Wrapped-Tokens, Layer 2 (L2), Mantle Ecosystem",wrapped-ether-mantle-bridge,145141768,145141768.0,,,N/A,5903288.0
MEXC,"Crypto-Backed Tokens, BNB Chain Ecosystem, Wrapped-Tokens, Ethereum Ecosystem",wrapped-beacon-eth,144931029,144931029.0,,,N/A,13745732.0
MEXC,"Internet of Things (IOT), Smart Contract Platform, Layer 1 (L1), Proof of Work (PoW), Made in USA",digibyte,144602300,144623005.0,,,N/A,5167564.0
MEXC,"Smart Contract Platform, DWF Labs Portfolio, Proof of Stake (PoS)",waves,143278245,143278245.0,37244.322297999475,25389.209722188218,0.29,12457863.0
MEXC,"Stablecoins, Ethereum Ecosystem, XRP Ledger Ecosystem, Fiat-backed Stablecoin, Made in USA",ripple-usd,141514980,141514980.0,,,N/A,29984330.0
MEXC,"Stablecoins, EUR Stablecoin, Solana Ecosystem, Avalanche Ecosystem, Ethereum Ecosystem, Base Ecosystem, Stellar Ecosystem",euro-coin,139705028,139705028.0,,,N/A,47642527.0
MEXC,"Binance Launchpool, Solana Ecosystem, Ethereum Ecosystem, Decentralized Science (DeSci)",bio-protocol,139514007,285768259.0,259026.10100705264,314338.60689718183,0.13,15404198.0
MEXC,"Tokenized Assets, Tokenized Gold, Real World Assets (RWA), Tokenized Commodities",kinesis-gold,138622607,138622607.0,,,N/A,145907423.0
MEXC,"Smart Contract Platform, Layer 1 (L1), Harmony Ecosystem, Animoca Brands Portfolio, Binance Launchpad, Binance Labs Portfolio, Made in USA",harmony,138230079,147785302.0,104757.73974523581,142172.39300231313,0.09,12746788.0
MEXC,"Alleged SEC Securities, Osmosis Ecosystem, DeFiance Capital Portfolio, Pantera Capital Portfolio, Binance Labs Portfolio, Delphi Ventures Portfolio, Galaxy Digital Portfolio, OKX Ventures Portfolio",terra-luna-2,138203242,216756387.0,73971.77185829867,95719.45967874394,0.05,19153197.0
MEXC,"Gaming (GameFi), Play To Earn, Telegram Apps, TON Ecosystem, Tap to Earn, Arcade Games",hamster-kombat,138366215,214937810.0,60311.50123273197,120092.80698664136,0.05,27511924.0
MEXC,"Smart Contract Platform, Layer 1 (L1), Kadena Ecosystem, Multicoin Capital Portfolio, Proof of Work (PoW), Made in USA",kadena,138577799,138710060.0,20688.064150529917,25886.317571142168,0.2,5788060.0
MEXC,"Gaming (GameFi), Polkadot Ecosystem, NFT, Ethereum Ecosystem, Gaming Blockchains, Andreessen Horowitz (a16z) Portfolio, Binance Labs Portfolio, Galaxy Digital Portfolio, Made in USA",mythos,136577790,175833094.0,6691.77500105862,11452.218966333865,0.23,3681077.0
MEXC,"Gaming (GameFi), NFT, BNB Chain Ecosystem, Solana Ecosystem, Polygon Ecosystem, Play To Earn, Move To Earn, Ethereum Ecosystem, Binance Launchpad, Gaming Governance Token, Sports Games, Alameda Research Portfolio, Binance Labs Portfolio, Sequoia Capital Portfolio",stepn,137180949,256550203.0,418144.389887762,363578.9477569344,0.18,25146490.0
MEXC,"Crypto-Backed Tokens, Wrapped-Tokens, Avalanche Ecosystem",wrapped-avax,136112762,136112762.0,,,N/A,40197114.0
MEXC,"Decentralized Finance (DeFi), Analytics, DeFi Index, Base Ecosystem",mag7-ssi,135520907,135520907.0,162.4045320978377,10.5003270113223,0.66,1682931.0
MEXC,"BNB Chain Ecosystem, Arbitrum Ecosystem, Cardano Ecosystem, Ethereum Ecosystem, DePIN, Base Ecosystem, DWF Labs Portfolio",world-mobile-token,134977835,390009782.0,10856.68129207994,7729.302289346985,0.15,16103793.0
MEXC,"Stablecoins, EUR Stablecoin, Polygon Ecosystem, Ethereum Ecosystem, Real World Assets (RWA), Fiat-backed Stablecoin",stasis-eurs,134343590,134343590.0,,,N/A,135640.0
MEXC,"Smart Contract Platform, Masternodes, Proof of Stake (PoS), Made in China",ontology,133028817,145753402.0,116931.75226091937,38878.61674183316,0.07,5751059.0
MEXC,"Liquid Staking Tokens, Aptos Ecosystem, Liquid Staking",amnis-aptos,132053555,132081530.0,,,N/A,70987.0
MEXC,"Decentralized Exchange (DEX), Smart Contract Platform, Exchange-based Tokens, Decentralized Finance (DeFi), Arbitrum Ecosystem, Ethereum Ecosystem, Layer 2 (L2), Zero Knowledge (ZK), Loopring Ecosystem, Rollup, Energi Ecosystem",loopring,131877713,145412939.0,102592.89172161903,124422.13739041208,0.09,13441510.0
MEXC,"Smart Contract Platform, Base Ecosystem, Gaming Blockchains",b3,130557832,613158567.0,40063.8344796542,40231.915691745766,0.2,21590799.0
MEXC,"Tokenized Assets, Real World Assets (RWA), Tokenized Silver, Tokenized Commodities",kinesis-silver,132126763,132126763.0,,,N/A,2425772.0
MEXC,"Stablecoins, USD Stablecoin, Solana Ecosystem, Fiat-backed Stablecoin",global-dollar,130298636,130298636.0,,,N/A,442188.0
MEXC,"Solana Ecosystem, Meme, Solana Meme, Murad Picks",gigachad-2,131325874,131325874.0,8055.861991849663,13231.573469534085,0.22,13888747.0
MEXC,"Cronos Ecosystem, Bridged USDC, Bridged-Tokens, Bridged Stablecoins",cronos-bridged-usdc-cronos,129153215,129153215.0,,,N/A,1608720.0
MEXC,"Smart Contract Platform, SocialFi, NFT, BNB Chain Ecosystem, Binance Launchpool, Ethereum Ecosystem, Decentralized Identifier (DID), Zero Knowledge (ZK), DWF Labs Portfolio, Coinbase Ventures Portfolio, Multicoin Capital Portfolio, Alameda Research Portfolio, DragonFly Capital Portfolio, Binance Labs Portfolio, Quest-to-Earn",project-galaxy,125546414,196551187.0,,,N/A,66928.0
MEXC,"BNB Chain Ecosystem, Harmony Ecosystem, Ethereum Ecosystem, Alameda Research Portfolio, Binance Labs Portfolio",swipe,126978417,127033007.0,67904.03528332499,113926.4459662833,0.15,4668455.0
MEXC,"Artificial Intelligence (AI), Binance Launchpool, Solana Ecosystem, DePIN, Animoca Brands Portfolio, Multicoin Capital Portfolio, Delphi Ventures Portfolio, OKX Ventures Portfolio, Made in USA",io,123861238,672006249.0,311378.1510740049,431730.2755073851,0.12,26415562.0
MEXC,"Smart Contract Platform, BNB Chain Ecosystem, Ethereum Ecosystem, Zero Knowledge (ZK), Animoca Brands Portfolio, Binance Labs Portfolio, OKX Ventures Portfolio",polyhedra-network,123192326,2040165819.0,9050.196322052101,6214.6271018113575,0.09,7901670.0
MEXC,"BNB Chain Ecosystem, Tron Ecosystem",global-commercial-business,122919916,122919916.0,331.59580372700935,147.2021855950139,0.39,188325.0
MEXC,"Decentralized Finance (DeFi), Insurance, Ethereum Ecosystem",nxm,122794585,122794585.0,,,N/A,0.0
MEXC,"Tokenized Assets, Polygon Ecosystem, Arbitrum Ecosystem, Ethereum Ecosystem, Real World Assets (RWA), Starknet Ecosystem, Tokenized Treasury Bills (T-Bills)",eutbl,122515778,122515778.0,,,N/A,0.0
MEXC,"Polygon Ecosystem, Bridged DAI, Bridged-Tokens, Bridged Stablecoins",polygon-pos-bridged-dai-polygon-pos,122301517,122301517.0,,,N/A,3705932.0
MEXC,"Decentralized Exchange (DEX), Decentralized Finance (DeFi), Gnosis Chain Ecosystem, MEV Protection, Arbitrum Ecosystem, Ethereum Ecosystem, Intent, Delphi Ventures Portfolio, Blockchain Capital Portfolio",cow-protocol,121852333,293881332.0,33976.764707950046,96151.73043721882,0.1,27436824.0
MEXC,"Decentralized Exchange (DEX), Exchange-based Tokens, Decentralized Finance (DeFi), Yield Farming, Automated Market Maker (AMM), BNB Chain Ecosystem, Yearn Ecosystem, Solana Ecosystem, Avalanche Ecosystem, Polygon Ecosystem, Near Protocol Ecosystem, Fantom Ecosystem, Harmony Ecosystem, Arbitrum Ecosystem, Celo Ecosystem, Ethereum Ecosystem, Base Ecosystem, Alameda Research Portfolio, Pantera Capital Portfolio, Energi Ecosystem, Sora Ecosystem, Blockchain Capital Portfolio",sushi,120824458,175911360.0,489437.37106056244,536180.1723080879,0.27,26795896.0
MEXC,"Business Services, Decentralized Finance (DeFi), Oracle, Fantom Ecosystem, Ethereum Ecosystem, Binance Launchpad, Osmosis Ecosystem, Energi Ecosystem, Binance Labs Portfolio, Sequoia Capital Portfolio",band-protocol,120666965,122457825.0,,,N/A,10059310.0
MEXC,"Artificial Intelligence (AI), Smart Contract Platform, BNB Chain Ecosystem, Solana Ecosystem, Layer 1 (L1), Polygon Ecosystem, Ethereum Ecosystem, DWF Labs Portfolio, Injective Ecosystem, OKX Ventures Portfolio",zignaly,120424894,166964926.0,4203.1265376591255,2993.518170975916,0.29,3529094.0
MEXC,"Decentralized Finance (DeFi), Yield Farming, Lending/Borrowing Protocols, Ethereum Ecosystem, Real World Assets (RWA), Base Ecosystem, Binance Alpha Spotlight",syrup,119060464,191044515.0,18134.41742084497,9854.110074800166,0.12,13310262.0
MEXC,"Arbitrum Ecosystem, Ethereum Ecosystem",reserve-protocol-eth-plus,118770160,118770160.0,,,N/A,1313893.0
MEXC,"Exchange-based Tokens, BNB Chain Ecosystem, Centralized Exchange (CEX) Token",nkyc-token,118493689,118493689.0,,,N/A,239486.0
MEXC,"Arbitrum Ecosystem, Ethereum Ecosystem, Account Abstraction, Coinbase Ventures Portfolio, Binance Labs Portfolio, Consensys Portfolio, Outlier Ventures Portfolio",biconomy,118590439,126702232.0,45980.15377563269,117984.03403970678,0.16,15399457.0
MEXC,"Smart Contract Platform, SocialFi, Layer 1 (L1), Gaming Blockchains",hive,116528742,,82836.11287009367,82010.12930221132,0.04,3196539.0
MEXC,"Stablecoins, Ethereum Ecosystem, Base Ecosystem, Blast Ecosystem, Fiat-backed Stablecoin",anzen-usdz,115947490,115947490.0,,,N/A,227363.0
MEXC,"Smart Contract Platform, Ethereum Ecosystem, Zero Knowledge (ZK), Alleged SEC Securities, Privacy Blockchain",coti,116337224,129818265.0,15020.993507927427,17632.79325186839,0.02,15933649.0
MEXC,"Artificial Intelligence (AI), Smart Contract Platform, Layer 1 (L1), Proof of Work (PoW)",qubic-network,114499661,136942275.0,6757.699138132966,12177.16223059179,0.09,2589705.0
MEXC,"Solana Ecosystem, Polygon Ecosystem, Ethereum Ecosystem",m2-global-wealth-limited-mmx,115440660,370359923.0,,,N/A,85073.0
MEXC,"Decentralized Finance (DeFi), Ethereum Ecosystem, Real World Assets (RWA), Coinbase Ventures Portfolio, Stablecoin Protocol, Binance Labs Portfolio, Galaxy Digital Portfolio",usual,115252190,126631958.0,207955.79859090518,292518.6246843838,0.06,17371435.0
MEXC,"BNB Chain Ecosystem, Ethereum Ecosystem, Payment Solutions, DWF Labs Portfolio",alchemy-pay,115009086,232638093.0,110995.63378271452,124991.16366022249,0.09,28111314.0
MEXC,"Meme, Ethereum Ecosystem, Dog-Themed",neiro-3,114417232,114417232.0,21718.834279184422,27762.03784319186,0.03,65718211.0
MEXC,"Decentralized Finance (DeFi), Derivatives, Synthetic Issuer, Ethereum Ecosystem, Synthetic",stp-network,113100538,113100538.0,8877.571009487387,22902.393248036453,0.09,36902954.0
MEXC,"Smart Contract Platform, BNB Chain Ecosystem, Ethereum Ecosystem, Layer 2 (L2)",prometeus,113389801,119602941.0,31198.846133867635,59.829197374590166,0.24,2961905.0
MEXC,"Smart Contract Platform, Proof of Stake (PoS), Sequoia Capital Portfolio",iostoken,113224453,113224453.0,21975.148996963893,20236.16071197912,0.63,192714987.0
MEXC,"Exchange-based Tokens, NFT, BNB Chain Ecosystem, Ethereum Ecosystem",swftcoin,112620150,112620150.0,5835.543761700394,1777.2513005089238,0.26,4009917.0
MEXC,"Business Services, Infrastructure, Smart Contract Platform, Decentralized Finance (DeFi), Polygon Ecosystem, Arbitrum Ecosystem, Ethereum Ecosystem, Liquid Staking Governance Tokens, Coinbase Ventures Portfolio, Proof of Stake (PoS), Index Coop Defi Index, Consensys Portfolio, Liquid Staking, Index Coop Index",rocket-pool,111093883,111093883.0,2328.668915267312,229609.6318750536,0.32,9302747.0
MEXC,"Big Data, Business Services, Infrastructure, Decentralized Finance (DeFi), Solana Ecosystem, FTX Holdings, DWF Labs Portfolio, Name Service",bonfida,111075143,112093878.0,79574.20942896721,227564.58352255414,0.09,12983167.0
MEXC,"Arbitrum Ecosystem, Bridged USDC, Bridged-Tokens, Bridged Stablecoins",usd-coin-ethereum-bridged,110085053,110085053.0,,,N/A,38585775.0
MEXC,"Smart Contract Platform, Layer 1 (L1), Zero Knowledge (ZK)",ozone-chain,110262255,151991540.0,133.0145946808132,5.987481378506008,0.98,222343.0
MEXC,"Smart Contract Platform, BNB Chain Ecosystem, Layer 1 (L1), Ethereum Ecosystem, Decentralized Identifier (DID), Base Ecosystem, Gravity Alpha Ecosystem",g-token,109331505,181395338.0,69283.62580031509,39907.8268286994,0.2,9849230.0
MEXC,"Decentralized Exchange (DEX), Decentralized Finance (DeFi), BNB Chain Ecosystem, Wallets, XRP Ledger Ecosystem",solo-coin,110452946,110452946.0,3233.4632032959053,5131.518476986342,0.23,4977445.0
MEXC,"Smart Contract Platform, Cross-chain Communication, Pantera Capital Portfolio",icon,108551494,109781763.0,,,N/A,1718156.0
MEXC,"Music, NFT, Ethereum Ecosystem, Coinbase Ventures Portfolio, Multicoin Capital Portfolio, Pantera Capital Portfolio, Energi Ecosystem, Binance Labs Portfolio",audius,107672484,107672484.0,,,N/A,19837963.0
MEXC,"Tokenized Real Estate, Tokenized Assets, Gnosis Chain Ecosystem, RealT Tokens, Real World Assets (RWA), RWA Protocol",realtoken-ecosystem-governance,107576195,751232267.0,,,N/A,1555.99
MEXC,"Smart Contract Platform, BNB Chain Ecosystem, Ethereum Ecosystem, DWF Labs Portfolio, Made in USA",proton,107145947,118764263.0,3607.3469633858263,10211.027131125873,0.17,4336984.0
MEXC,"Decentralized Finance (DeFi), Ethereum Ecosystem, Morpho Ecosystem",steakhouse-usdc-morpho-vault,106197804,106197804.0,,,N/A,0.0
MEXC,"Meme, PulseChain Ecosystem",the-grays-currency,109254981,109254981.0,,,N/A,368067.0
MEXC,"Solana Ecosystem, Multicoin Capital Portfolio, Stablecoin Protocol, Alameda Research Portfolio, DeFiance Capital Portfolio",uxd-protocol-token,105921143,105921143.0,,,N/A,34.74
MEXC,"Smart Contract Platform, Ethereum Ecosystem, Metis Ecosystem, Layer 2 (L2), DWF Labs Portfolio, Rollup, GMCI Layer 2 Index, OKX Ventures Portfolio, GMCI Index",metis-token,105605106,168824079.0,6199.956033406087,21847.784427837032,0.18,6718858.0
MEXC,"Smart Contract Platform, Decentralized Finance (DeFi), Binance Launchpool, Derivatives, Perpetuals, Ethereum Ecosystem, Layer 2 (L2), DragonFly Capital Portfolio, Pantera Capital Portfolio",aevo-exchange,105831972,117178864.0,213077.59888995002,280872.3404625358,0.14,18277328.0
MEXC,"Gaming (GameFi), NFT, Metaverse, Play To Earn, Ethereum Ecosystem, Animoca Brands Portfolio, RPG, Gaming Governance Token, Adventure Games, Energi Ecosystem, Delphi Ventures Portfolio",illuvium,105303379,135708164.0,71799.44989456503,103976.8843786954,0.07,18159478.0
MEXC,"Stablecoins, BNB Chain Ecosystem",astherus-usdf,104934391,104934391.0,,,N/A,743872.0
MEXC,"Solana Ecosystem, Meme, Solana Meme, PolitiFi, Made in USA",melania-meme,105018929,700125617.0,12956.897539266252,6890.884944756647,0.19,22198976.0
MEXC,"Lending/Borrowing Protocols, Ethereum Ecosystem, Paradigm Portfolio, Coinbase Ventures Portfolio",euler,104909867,152617867.0,3016.654997278408,3844.4845932036224,0.25,6162315.0
MEXC,"Decentralized Finance (DeFi), BNB Chain Ecosystem, Real World Assets (RWA), DWF Labs Portfolio, Stellar Ecosystem",velo,104315164,338754353.0,16150.669019193096,21198.1112157173,0.06,19870647.0
MEXC,"Decentralized Finance (DeFi), Yield Farming, Avalanche Ecosystem, Fantom Ecosystem, Arbitrum Ecosystem, Olympus Pro Ecosystem, Ethereum Ecosystem, Stablecoin Protocol",spell-token,103301208,127686089.0,13803.075853651915,27469.329642400648,0.32,44150909.0
MEXC,"NFT, Meme, Arbitrum Ecosystem, Ethereum Ecosystem, Anime-Themed, Binance HODLer Airdrops, Airdropped Tokens by NFT Projects",anime,102635782,185309817.0,199880.27006200107,189357.78398387053,0.05,16156909.0
MEXC,"Artificial Intelligence (AI), Base Ecosystem, AI Agents, AI Applications, Made in USA",venice-token,102373794,244034986.0,24508.90244336429,28233.082358528885,0.32,8173651.0
MEXC,"Big Data, Infrastructure, Storage, Cardano Ecosystem, DePIN",iagon,101466606,269843331.0,,,N/A,579753.0
MEXC,"Business Services, Decentralized Finance (DeFi), Oracle, Derivatives, Synthetic Issuer, Avalanche Ecosystem, Ethereum Ecosystem, Blockchain Capital Portfolio, Synthetic, Made in USA",uma,101709770,146770887.0,79819.94530373086,167796.37621671043,0.17,11470065.0
MEXC,"Polygon Ecosystem, Arbitrum Ecosystem, Ethereum Ecosystem, Optimism Ecosystem, Bridge Governance Tokens, Cross-chain Communication, Intent, Boba Network Ecosystem, Blockchain Capital Portfolio, Made in USA",across-protocol,100806634,249531109.0,94784.86445328094,147498.4586305201,0.04,31715930.0
MEXC,"Artificial Intelligence (AI), Smart Contract Platform, Masternodes, DePIN, Proof of Work (PoW), Made in USA",zelcash,100942483,100973255.0,,,N/A,9051332.0
MEXC,"NFT, Binance Launchpool, Meme, Ethereum Ecosystem, Binance Labs Portfolio, GMCI Meme Index, GMCI Index",memecoin-2,100842926,169958359.0,171850.82380862904,174536.73030894576,0.04,18392883.0
MEXC,"NFT, BNB Chain Ecosystem, Ethereum Ecosystem, Binance Launchpad, DWF Labs Portfolio, Binance Labs Portfolio",space-id,99666928,462238959.0,90393.80524804273,157022.4963735558,0.04,25051350.0
MEXC,"Decentralized Exchange (DEX), Decentralized Finance (DeFi), Automated Market Maker (AMM), Ethereum Ecosystem, Cronos Ecosystem",vvs-finance,99771804,195058570.0,,,N/A,248337.0
MEXC,"Bridged USDT, QL1 Ecosystem, Bridged-Tokens, Bridged Stablecoins",qusdt,99982050,99982050.0,,,N/A,27373.0
MEXC,"Stablecoins, LP Tokens, Ethereum Ecosystem",resolv-rlp,99532018,99532018.0,,,N/A,541943.0
MEXC,"Solana Ecosystem, Liquid Staking Tokens, Liquid Staked SOL, Liquid Staking",drift-staked-sol,99465119,99465119.0,,,N/A,14266.91
MEXC,"Infrastructure, Solana Ecosystem, Animoca Brands Portfolio, Cross-chain Communication, OKX Ventures Portfolio",zeus-network,99442508,259790780.0,13738.304018886136,21578.69056468933,0.27,11886168.0
MEXC,"Smart Contract Platform, Privacy, Layer 1 (L1), Proof of Stake (PoS), Proof of Work (PoW), Zano Ecosystem, Privacy Blockchain",zano,97729308,97736847.0,740.40288889837,1559.6276567110563,0.43,622939.0
MEXC,"Solana Ecosystem, Meme, Frog-Themed, Solana Meme, GMCI Meme Index, GMCI Index",book-of-meme,97961074,97961074.0,213541.51484023497,298867.617138362,0.07,51429165.0
MEXC,"Smart Contract Platform, Polkadot Ecosystem, Binance Launchpool, Layer 2 (L2), Manta Network Ecosystem, Multicoin Capital Portfolio, Alameda Research Portfolio, DeFiance Capital Portfolio, Binance Labs Portfolio",manta-network,97731320,256991533.0,287823.94521510287,377089.4096610851,0.16,31531777.0
MEXC,"Crypto-Backed Tokens, Decentralized Finance (DeFi), Compound Tokens, cToken, Ethereum Ecosystem",compound-ether,97299807,97299807.0,,,N/A,14.17
MEXC,"Solana Ecosystem, Meme, Base Ecosystem, AI Meme, AI Agents, Virtuals Protocol Ecosystem, Binance Alpha Spotlight, DeFAI",aixbt,97175092,113573686.0,209884.64283368297,216093.9489383118,0.22,57192075.0
MEXC,"Software as a service, Ethereum Ecosystem, Energi Ecosystem",status,97215511,167034879.0,24157.403268979135,16100.887555085987,0.12,6899004.0
MEXC,"Smart Contract Platform, Ethereum Ecosystem, Layer 2 (L2), Optimism Superchain Ecosystem, Outlier Ventures Portfolio, Lisk Ecosystem",lisk,97069896,225297873.0,,,N/A,11892965.0
MEXC,"Artificial Intelligence (AI), Infrastructure, Smart Contract Platform, Oracle, Polkadot Ecosystem, Ethereum Ecosystem, Interoperability, Layer 2 (L2), Zero Knowledge (ZK), DePIN, DWF Labs Portfolio, Rollup, AI Agents, Sora Ecosystem, AI Framework, Made in USA",pha,96623751,123171538.0,139131.54685803,140502.0244757846,0.08,26510221.0
MEXC,"Gaming (GameFi), NFT, BNB Chain Ecosystem",infinitar-governance-token,96673954,478775907.0,1077.9691468395147,121.10970904135489,0.29,8880397.0
MEXC,"Smart Contract Platform, BNB Chain Ecosystem, Binance Launchpool, Ethereum Ecosystem, Layer 2 (L2), Restaking, Rollups-as-a-Service (RaaS), Rollup, Binance Labs Portfolio",altlayer,96342101,345063115.0,52383.60884190483,82033.82445746037,0.03,14524926.0
MEXC,"XDC Ecosystem, Telos Ecosystem",ecoin-2,95498064,207099463.0,,,N/A,5.24
MEXC,"Solana Ecosystem, Payment Solutions, Viction Ecosystem",saros-finance,95761274,364804879.0,1140.3640348463814,786.2393591006343,1.69,722083.0
MEXC,"Smart Contract Platform, Layer 1 (L1), Zero Knowledge (ZK), Andreessen Horowitz (a16z) Portfolio, Privacy Blockchain, Made in USA",aleo,95308388,466994176.0,92561.54660954919,93436.08878815557,0.04,6854003.0
MEXC,"NFT, Polygon Ecosystem, Ethereum Ecosystem, Optimism Ecosystem",blockv,95165098,95165098.0,,,N/A,112172.0
MEXC,"Gaming (GameFi), NFT, Kaia Ecosystem, Gaming Blockchains",bora,94032150,98355467.0,7677.272348800394,4187.493337512455,0.18,201265.0
MEXC,"Solana Ecosystem, Liquid Staking Tokens, Restaking, Liquid Restaking Tokens, Liquid Staked SOL, Liquid Staking, Liquid Restaked SOL",solayer-staked-sol,94541644,94541644.0,,,N/A,473441.0
MEXC,"Infrastructure, Smart Contract Platform, Oracle, Layer 1 (L1), Animoca Brands Portfolio, Coinbase Ventures Portfolio, Cross-chain Communication, Made in USA",supra,94719269,842192913.0,34604.1005287265,61026.57191115498,0.03,14280881.0
MEXC,"Fraxtal Ecosystem, Bridged-Tokens",l2-standard-bridged-frxusd,94451549,94451549.0,,,N/A,710930.0
