MEXC,"Infrastructure, Smart Contract Platform, Ethereum Ecosystem, Data Availability, Modular Blockchain",avail,94727730,485154660.0,5597.133616640014,8668.076232080035,0.17,5057888.0
MEXC,"DaoMaker Launchpad, Ethereum Ecosystem, Real World Assets (RWA), Sequoia Capital Portfolio, Made in USA",clearpool,94234648,124001775.0,12079.76911105882,10354.775287066814,0.24,4180010.0
MEXC,Layer 1 (L1),oec-token,92579588,92579588.0,1204.4644565232925,1680.4066312065127,0.27,349692.0
MEXC,"Artificial Intelligence (AI), Big Data, Media, BNB Chain Ecosystem, Polygon Ecosystem, Ethereum Ecosystem, GMCI DePIN Index, Galaxy Digital Portfolio, GMCI Index",everipedia,92768817,92768817.0,9498.596113005024,20735.092486148544,0.02,5456239.0
MEXC,"Energy, Ethereum Ecosystem, Alleged SEC Securities, Energi Ecosystem, GMCI DePIN Index, Blockchain Capital Portfolio, GMCI Index",power-ledger,90582638,170903012.0,,,N/A,7460644.0
MEXC,"Artificial Intelligence (AI), Infrastructure, Smart Contract Platform, Decentralized Finance (DeFi), Arbitrum Ecosystem, Ethereum Ecosystem, Zero Knowledge (ZK), DWF Labs Portfolio, Coinbase Ventures Portfolio, Pantera Capital Portfolio, Binance Labs Portfolio",marlin,90817250,111386491.0,20618.424740641734,125435.08441964287,0.68,7471402.0
MEXC,"Crypto-Backed Tokens, BNB Chain Ecosystem, Arbitrum Ecosystem, Ethereum Ecosystem, Mantle Ecosystem",ignition-fbtc,90199813,1166972001.0,,,N/A,567022.0
MEXC,"Ethereum Ecosystem, DWF Labs Portfolio",adventure-gold,91030098,91030098.0,51445.3140523899,112998.05408150825,0.21,26715418.0
MEXC,"Gaming (GameFi), XDC Ecosystem, Gaming Utility Token",gama-coin,89856931,138241508.0,,,N/A,2286341.0
MEXC,"Decentralized Exchange (DEX), Exchange-based Tokens, Decentralized Finance (DeFi), Yield Farming, Automated Market Maker (AMM), Avalanche Ecosystem, Polygon Ecosystem, Near Protocol Ecosystem, Gnosis Chain Ecosystem, Harmony Ecosystem, Arbitrum Ecosystem, Ethereum Ecosystem, Optimism Ecosystem, Base Ecosystem, Index Coop Defi Index, Alameda Research Portfolio, DeFiance Capital Portfolio, Pantera Capital Portfolio, Energi Ecosystem, Polygon zkEVM Ecosystem, Huobi ECO Chain Ecosystem, Blockchain Capital Portfolio, Index Coop Index",balancer,89823821,97133186.0,40156.24694741804,74497.30555225663,0.07,9248983.0
MEXC,"Decentralized Finance (DeFi), Yield Farming, BNB Chain Ecosystem, Binance Launchpool, Lending/Borrowing Protocols, Arbitrum Ecosystem, Ethereum Ecosystem, Optimism Ecosystem, ZkSync Ecosystem, opBNB Ecosystem, Unichain Ecosystem",venus,90106976,161650951.0,131765.05639575224,130312.00773105661,0.15,4805856.0
MEXC,"Smart Contract Platform, Gaming (GameFi), Solana Ecosystem, Layer 2 (L2), Gaming Blockchains",sonic-svm,89755087,598367244.0,7009.945319902401,10319.536181629066,0.16,35208796.0
MEXC,"Artificial Intelligence (AI), Oracle, Ethereum Ecosystem, DePIN, Energi Ecosystem, Sora Ecosystem, GMCI DePIN Index, GMCI Index",iexec-rlc,88636830,106536525.0,40497.868773248425,35180.3225261619,0.2,11612504.0
MEXC,"Infrastructure, Smart Contract Platform, Decentralized Finance (DeFi), BNB Chain Ecosystem, Avalanche Ecosystem, Polygon Ecosystem, Fantom Ecosystem, Harmony Ecosystem, Arbitrum Ecosystem, Ethereum Ecosystem, DWF Labs Portfolio, Layer 3 (L3), Outlier Ventures Portfolio",orbs,89074318,195615666.0,,,N/A,5714735.0
MEXC,"SocialFi, Coinbase Ventures Portfolio, Pantera Capital Portfolio, Andreessen Horowitz (a16z) Portfolio, Sequoia Capital Portfolio",deso,87789771,90092312.0,,,N/A,4644718.0
MEXC,"Cronos Ecosystem, Bridged USDT, Bridged-Tokens, Bridged Stablecoins",cronos-bridged-usdt-cronos,87761401,87761401.0,,,N/A,406832.0
MEXC,"Smart Contract Platform, Ethereum Ecosystem, Layer 2 (L2), Zero Knowledge (ZK), Restaking, Zircuit Ecosystem",zircuit,87619910,399193463.0,47075.92387510381,49235.37441642123,0.03,22847753.0
MEXC,"Polygon Ecosystem, XRP Ledger Ecosystem",crypto-trading-fund,85618936,85618936.0,,,N/A,3611.42
MEXC,"Stablecoins, USD Stablecoin, Ethereum Ecosystem, Sonic Ecosystem, Fiat-backed Stablecoin",frax-usd,86196249,86196249.0,,,N/A,1807009.0
MEXC,"Smart Contract Platform, Layer 1 (L1)",ong,86426588,211859437.0,39767.15404941795,49837.97952633659,0.14,2393803.0
MEXC,"Smart Contract Platform, Bitcoin Sidechains, Stacks Ecosystem, SideChain",sbtc-2,86072411,86072411.0,,,N/A,39210.0
MEXC,"Crypto-Backed Tokens, Ethereum Ecosystem",temple,85869751,86038919.0,,,N/A,15316.66
MEXC,"Decentralized Exchange (DEX), Decentralized Finance (DeFi), Arbitrum Ecosystem, Ethereum Ecosystem",tokenlon,85913817,103411556.0,,,N/A,35854.0
MEXC,"Artificial Intelligence (AI), Virtual Reality, Launchpad, Ethereum Ecosystem, Telegram Apps, Discord Bots, PAAL AI Launchpad, AI Agents, AI Applications, AI Agent Launchpad, Binance Alpha Spotlight, AI Framework, DeFAI, Made in USA",paal-ai,85754294,96460153.0,8094.798730032018,8115.469586377292,0.01,13628234.0
MEXC,"Exchange-based Tokens, Centralized Exchange (CEX) Token, Ethereum Ecosystem",hashkey-ecopoints,85694917,646754093.0,71532.63165887834,60933.57540898486,0.08,4373899.0
MEXC,BNB Chain Ecosystem,metfi-2,85431118,199994772.0,,,N/A,436204.0
MEXC,"BNB Chain Ecosystem, Liquid Staking Tokens",astherus-staked-bnb,85446213,85446213.0,,,N/A,483.93
MEXC,"Artificial Intelligence (AI), Smart Contract Platform, Gaming (GameFi), NFT, BNB Chain Ecosystem, Layer 1 (L1), Ethereum Ecosystem, Modular Blockchain, Chromia Ecosystem",chromaway,85373636,85373636.0,194117.54464275076,232381.61553399125,0.27,10824732.0
MEXC,"Business Services, Polygon Ecosystem, Ethereum Ecosystem",request-network,85073718,110533468.0,,,N/A,5347607.0
MEXC,"NFT, Solana Ecosystem, NFT Marketplace",tensor,84431062,252328857.0,64834.58234706602,85495.56645888991,0.04,15369125.0
MEXC,"Smart Contract Platform, Polkadot Ecosystem, Layer 1 (L1), Coinbase Ventures Portfolio, Binance Labs Portfolio",moonbeam,84499815,102898208.0,67441.67543266191,45621.499112544814,0.09,5382091.0
MEXC,"Gaming (GameFi), Play To Earn, Ethereum Ecosystem, RPG, Alameda Research Portfolio, Circle Ventures Portfolio, OKX Ventures Portfolio, MMO",big-time,84317778,237017483.0,48150.95616450792,59188.941192891565,0.02,23951723.0
MEXC,"Smart Contract Platform, Gaming (GameFi), NFT, Layer 1 (L1), Play To Earn, Ethereum Ecosystem, Animoca Brands Portfolio, Gaming Blockchains, Pantera Capital Portfolio, OKX Ventures Portfolio",wax,83919263,90294545.0,24795.080228964795,23353.94170686956,0.17,5341190.0
MEXC,"Solana Ecosystem, Polygon Ecosystem, DePIN, Pantera Capital Portfolio",geodnet,82878917,258513335.0,17997.635733002477,19865.963539554527,0.88,272077.0
MEXC,Ethereum Ecosystem,dkargo,82657896,88184099.0,26.619450990036636,1075.9834196300399,0.8,1270420.0
MEXC,"Smart Contract Platform, Layer 2 (L2), eGirl Capital Portfolio, Paradigm Portfolio, Blast Ecosystem",blast,82976287,313313621.0,11139.409261380899,26886.452515362864,0.1,8251752.0
MEXC,"NFT, Ethereum Ecosystem",superrare,82482354,103055160.0,236362.62393714357,391759.4021249771,0.18,318218132.0
MEXC,"Gaming (GameFi), NFT, BNB Chain Ecosystem, Metaverse, Collectibles, Polygon Ecosystem, Play To Earn, Harmony Ecosystem, Guild and Scholarship, Ethereum Ecosystem, Animoca Brands Portfolio, Base Ecosystem, DWF Labs Portfolio, Ronin Ecosystem, Gaming Governance Token, Andreessen Horowitz (a16z) Portfolio, Delphi Ventures Portfolio",yield-guild-games,82333619,200562539.0,101153.79819374645,121455.73983258569,0.2,14373232.0
MEXC,"Decentralized Finance (DeFi), BNB Chain Ecosystem, Arbitrum Ecosystem, Ethereum Ecosystem, Multicoin Capital Portfolio, Energi Ecosystem",dforce-token,82078781,82078781.0,11516.600287700807,18068.939435469056,0.02,13904092.0
MEXC,"Internet of Things (IOT), BNB Chain Ecosystem, Ethereum Ecosystem, DePIN, DWF Labs Portfolio",mass-vehicle-ledger,80939754,85555570.0,663.1476296257168,1491.5564590767158,1.0,301856.0
MEXC,"Artificial Intelligence (AI), Infrastructure, Ethereum Ecosystem, AI Framework, Made in USA",arcblock,80676797,152220371.0,,,N/A,1105428.0
MEXC,"Berachain Ecosystem, Bridged USDT, Bridged-Tokens, Ink Ecosystem, Bridged Stablecoins",usdt0,80760052,80762815.0,,,N/A,70234.0
MEXC,"Decentralized Exchange (DEX), Decentralized Finance (DeFi), Yield Farming, Automated Market Maker (AMM), Solana Ecosystem, Coinbase Ventures Portfolio, DeFiance Capital Portfolio, Made in USA",orca,81044244,152119887.0,1683.471946072093,1750.7715308668376,0.2,20223356.0
MEXC,"Smart Contract Platform, Privacy, Proof of Work (PoW), Made in USA",verge,80515079,80676133.0,46378.9300056366,61412.01266966862,0.04,4639690.0
MEXC,"Exchange-based Tokens, Centralized Exchange (CEX) Token, Ethereum Ecosystem",bitmart-token,81526031,153585379.0,,,N/A,4470152.0
MEXC,"Exchange-based Tokens, Centralized Exchange (CEX) Token, Near Protocol Ecosystem, Harmony Ecosystem, Ethereum Ecosystem, Multicoin Capital Portfolio, Alameda Research Portfolio, Elastos Smart Contract Chain Ecosystem, Sequoia Capital Portfolio, Made in China",huobi-token,80188172,101136872.0,,,N/A,10627.63
MEXC,"Smart Contract Platform, Proof of Stake (PoS)",stratis,79441483,87529161.0,,,N/A,786369.0
MEXC,"Artificial Intelligence (AI), BNB Chain Ecosystem, Solana Ecosystem, Ethereum Ecosystem, AI Agents, Alameda Research Portfolio",delysium,80078428,152816618.0,14766.482576886507,9097.611398214432,0.24,2611593.0
MEXC,"NFT, Polygon Ecosystem",sathosi-airlines-token,80004315,382090736.0,6.804663464583285,234.93693239285662,0.05,13443.43
MEXC,"Stablecoins, Decentralized Finance (DeFi), Lending/Borrowing Protocols, Ethereum Ecosystem",syrupusdc,79565070,79565070.0,,,N/A,95399.0
MEXC,"Stablecoins, USD Stablecoin, Solana Ecosystem, Ethereum Ecosystem, Multicoin Capital Portfolio, Fiat-backed Stablecoin",paxos-standard,79286714,79286714.0,340510.327240126,994186.7912108386,0.02,2317994.0
MEXC,"Blast Ecosystem, Bridged WETH, Bridged-Tokens",l2-standard-bridged-weth-blast,79221468,79221468.0,,,N/A,947923.0
MEXC,"Meme, Ethereum Ecosystem, PolitiFi",constitutiondao,79425443,79425443.0,210271.81379631718,298979.0266326906,0.06,29332967.0
MEXC,"Gaming (GameFi), Play To Earn, Guild and Scholarship, Ethereum Ecosystem, Animoca Brands Portfolio, Base Ecosystem, DWF Labs Portfolio, Ronin Ecosystem, Coinbase Ventures Portfolio, DeFiance Capital Portfolio, Pantera Capital Portfolio, Binance Labs Portfolio, MMO",zentry,80645527,118391404.0,6637.637758450671,13501.2085983994,0.9,5543709.0
MEXC,"Smart Contract Platform, Cosmos Ecosystem, Modular Blockchain, Osmosis Ecosystem, Rollups-as-a-Service (RaaS)",dymension,78368575,311513967.0,571453.7860378388,553456.6921962133,0.03,7856014.0
MEXC,BNB Chain Ecosystem,bitdca,78123719,83911092.0,3429.925377728364,13041.520367689527,0.59,90849.0
MEXC,"Software as a service, Polygon Ecosystem, Ethereum Ecosystem, Decentralized Identifier (DID), Pantera Capital Portfolio, Energi Ecosystem, Blockchain Capital Portfolio",civic,78301694,97633033.0,,,N/A,8591068.0
MEXC,"Artificial Intelligence (AI), Smart Contract Platform, Decentralized Finance (DeFi), Analytics, NFT, BNB Chain Ecosystem, Launchpad, Ethereum Ecosystem, Telegram Apps, Discord Bots, ChainGPT Launchpad, Poolz Finance Launchpad, AI Agents, AI Applications, Binance Alpha Spotlight, AI Framework, DeFAI",chaingpt,78009035,96851449.0,73118.88100510689,90173.84357577557,0.13,21124168.0
MEXC,"Decentralized Finance (DeFi), Wallets, Ethereum Ecosystem, Pundi AIFX Omnilayer Ecosystem",pundi-x-2,77851806,77851806.0,,,N/A,7254477.0
MEXC,"Ethereum Ecosystem, Stablecoin Protocol",level-usd,77580350,77580350.0,,,N/A,540977.0
MEXC,"Stablecoins, USD Stablecoin, Osmosis Ecosystem, Fiat-backed Stablecoin",usdx,77514857,77514857.0,,,N/A,23320.0
MEXC,"Business Services, Decentralized Finance (DeFi), Oracle, Polygon Ecosystem, Gnosis Chain Ecosystem, Arbitrum Ecosystem, Ethereum Ecosystem, Optimism Ecosystem, Manta Network Ecosystem, Binance Labs Portfolio, Lisk Ecosystem, Made in USA",tellor,77160925,79406222.0,,,N/A,26605363.0
MEXC,"Smart Contract Platform, Layer 1 (L1), Osmosis Ecosystem, XRP Ledger Ecosystem",coreum,77204355,77204355.0,740.576036814246,1283.3080286582385,0.94,253901.0
MEXC,"Optimism Ecosystem, Bridged WBTC, Bridged-Tokens",optimism-bridged-wbtc-optimism,77138106,77138106.0,,,N/A,1093375.0
MEXC,"Artificial Intelligence (AI), BNB Chain Ecosystem, Ethereum Ecosystem, DragonFly Capital Portfolio, Binance Labs Portfolio, Delphi Ventures Portfolio, OKX Ventures Portfolio, Binance HODLer Airdrops, AI Agent Launchpad, Binance Alpha Spotlight, AI Framework",myshell,77074305,285460388.0,109693.10256728154,123699.44459829254,0.1,49936636.0
MEXC,"Arbitrum Ecosystem, Bridge Governance Tokens, Base Ecosystem, Cross-chain Communication, OKX Ventures Portfolio",orbiter-finance,75451952,243393393.0,11521.891505961183,14712.453806250367,0.34,88236715.0
MEXC,"Decentralized Finance (DeFi), Solana Ecosystem, Real World Assets (RWA), Payment Solutions, DePIN, Coinbase Ventures Portfolio, Alameda Research Portfolio, Circle Ventures Portfolio, OKX Ventures Portfolio, RWA Protocol, Made in USA",zebec-network,75603609,102030716.0,1828.4151007877392,4036.1520132001788,0.56,44515962.0
MEXC,"Smart Contract Platform, Wallets, Layer 2 (L2), Osmosis Ecosystem",islamic-coin,75963235,916405570.0,1161.9750859726062,91.09737067750486,0.15,848666.0
MEXC,"BNB Chain Ecosystem, Solana Ecosystem, Polygon Ecosystem, Meme, Ethereum Ecosystem, Cronos Ecosystem, Dog-Themed, Elon Musk-Inspired, Fuse Ecosystem",dogelon-mars,75291459,136980738.0,9881.803294319705,18337.49557802989,0.07,6043669.0
MEXC,"Artificial Intelligence (AI), Decentralized Finance (DeFi), Ethereum Ecosystem, DePIN",pinlink,75705222,94631528.0,536.7202702152575,620.0904316562137,0.23,1865855.0
MEXC,"Decentralized Finance (DeFi), Liquid Staking Tokens, Ethereum Ecosystem, LSDFi, Liquid Staked ETH, Liquid Staking",origin-ether,75293611,75293611.0,,,N/A,38507.0
MEXC,"Sports, BNB Chain Ecosystem",pixer-eternity,75240274,349648690.0,1921.8851219938883,1292.4105268502144,0.14,303341.0
MEXC,Smart Contract Platform,songbird,74793734,88866921.0,60.700290399558796,1191.68137759019,0.07,360341.0
MEXC,"Decentralized Finance (DeFi), Lending/Borrowing Protocols, Moonbeam Ecosystem, Base Ecosystem, Coinbase Ventures Portfolio, Made in USA",moonwell-artemis,74171764,113090883.0,,,N/A,16549209.0
MEXC,"Optimism Ecosystem, Bridged WETH, Bridged-Tokens",l2-standard-bridged-weth-optimism,73927022,73927022.0,,,N/A,24180777.0
MEXC,"Entertainment, Gaming (GameFi), NFT, Axie Infinity Ecosystem, Play To Earn, Ethereum Ecosystem, Ronin Ecosystem, Gaming Utility Token",smooth-love-potion,73731200,73731200.0,22018.233419821277,31353.9663432489,0.06,8990673.0
MEXC,"Smart Contract Platform, Polkadot Ecosystem, Layer 1 (L1), DePIN, Outlier Ventures Portfolio",peaq-2,73601686,434314628.0,17971.87520082002,22554.487122364553,0.24,11455537.0
MEXC,"Gaming (GameFi), Play To Earn, TON Ecosystem, Tap to Earn, Arcade Games",watcoin-2,73267980,81340656.0,,,N/A,1011692.0
MEXC,"Meme, Ethereum Ecosystem, Mantle Ecosystem",puff-the-dragon,73088883,73088883.0,,,N/A,51659.0
MEXC,Retail,milk-alliance,73037631,163637112.0,,,N/A,4470507.0
MEXC,"Smart Contract Platform, Gaming (GameFi), Layer 1 (L1), Proof of Stake (PoS), Gaming Blockchains",oasys,73098234,189440831.0,883.0030984000575,1539.457493005274,1.21,641934.0
MEXC,"Ethereum Ecosystem, DePIN",dent,71985754,75255641.0,,,N/A,6220582.0
MEXC,"Decentralized Exchange (DEX), Decentralized Finance (DeFi), Yield Farming, Automated Market Maker (AMM), BNB Chain Ecosystem, Avalanche Ecosystem, Arbitrum Ecosystem, Mantle Ecosystem, DeFiance Capital Portfolio, Delphi Ventures Portfolio, Dex Aggregator",joe,71495828,91558859.0,18953.133148002104,26654.566690684023,0.6,7574864.0
MEXC,"Decentralized Finance (DeFi), Oracle, Ethereum Ecosystem, DWF Labs Portfolio, Pantera Capital Portfolio",api3,71449036,89165279.0,66522.49644984027,91818.45400116195,0.13,14228085.0
MEXC,"Gaming (GameFi), NFT, Collectibles, Play To Earn, Ethereum Ecosystem, Base Ecosystem, Energi Ecosystem",ecomi,71032781,81501068.0,2918.126278308032,2788.535133278977,0.15,2125529.0
MEXC,"Decentralized Finance (DeFi), Lending/Borrowing Protocols, Ethereum Ecosystem, Real World Assets (RWA), Coinbase Ventures Portfolio, Andreessen Horowitz (a16z) Portfolio, RWA Protocol, Made in USA",goldfinch,71016178,87843056.0,382.4800275967357,660.123225545195,0.22,626623.0
MEXC,"Smart Contract Platform, Gaming (GameFi), NFT, Binance Launchpool, Arbitrum Ecosystem, Layer 3 (L3), XAI Ecosystem, Gaming Blockchains, Outlier Ventures Portfolio",xai-blockchain,70912678,104494557.0,,,N/A,28476023.0
MEXC,"Artificial Intelligence (AI), Decentralized Finance (DeFi), Solana Ecosystem, Arbitrum Ecosystem, Metis Ecosystem, AI Agents, Sonic Ecosystem, IOTA EVM Ecosystem, AI Applications, DeFAI",heyanon,70535751,116177268.0,604.3321083535949,1379.8351305492536,0.11,3925839.0
MEXC,"Stablecoins, Decentralized Finance (DeFi), USD Stablecoin, BNB Chain Ecosystem, Polygon Ecosystem, Gnosis Chain Ecosystem, Arbitrum Ecosystem, Ethereum Ecosystem, Optimism Ecosystem, Base Ecosystem, Crypto-backed Stablecoin, Fiat-backed Stablecoin",crvusd,70429218,70429218.0,,,N/A,6304508.0
MEXC,"Decentralized Exchange (DEX), Exchange-based Tokens, Decentralized Finance (DeFi), BNB Chain Ecosystem, Binance Launchpool, Polygon Ecosystem, Near Protocol Ecosystem, Arbitrum Ecosystem, Ethereum Ecosystem, DWF Labs Portfolio, Coinbase Ventures Portfolio, Alameda Research Portfolio, DeFiance Capital Portfolio, Pantera Capital Portfolio, Aurora Ecosystem, Energi Ecosystem, Binance Labs Portfolio, Galaxy Digital Portfolio",dodo,70486189,70486189.0,56143.963376228625,72097.46333080651,0.01,4566529.0
MEXC,"Artificial Intelligence (AI), Ethereum Ecosystem",0x0-ai-ai-smart-contract,70747369,70747369.0,,,N/A,169483.0
MEXC,"Artificial Intelligence (AI), Cardano Ecosystem, Ethereum Ecosystem, AI Agents, Sora Ecosystem",singularitynet,70342221,106303019.0,,,N/A,26279.0
MEXC,"Decentralized Finance (DeFi), Lending/Borrowing Protocols, Solana Ecosystem, Binance Alpha Spotlight",kamino,69830785,517265074.0,47106.3551657186,65346.33690565391,0.06,7422590.0
MEXC,"Artificial Intelligence (AI), Smart Contract Platform, Layer 1 (L1), Ethereum Ecosystem, Osmosis Ecosystem, AI Agents, AI Agent Launchpad",humans-ai,68845469,68845469.0,1471.5989560714283,3600.4593053811673,0.75,370327.0
MEXC,"Stablecoins, USD Stablecoin, Seigniorage, Alleged SEC Securities, Osmosis Ecosystem, Stablecoin Protocol, DeFiance Capital Portfolio, Terra Classic Ecosystem, Binance Labs Portfolio, Delphi Ventures Portfolio, Galaxy Digital Portfolio, Fiat-backed Stablecoin",terrausd,69684367,98726218.0,51939.42730155758,85840.08539938554,0.32,7130084.0
MEXC,"Tokenized Assets, Polygon Ecosystem, Arbitrum Ecosystem, Ethereum Ecosystem, Real World Assets (RWA), Starknet Ecosystem, Tokenized Treasury Bills (T-Bills)",spiko-us-t-bills-money-market-fund,69588146,69588146.0,,,N/A,0.0
MEXC,"Decentralized Finance (DeFi), Ethereum Ecosystem",elixir-finance,69588705,435857834.0,14696.482421495655,16010.632240529061,0.16,44193431.0
MEXC,"Lending/Borrowing Protocols, Solana Ecosystem, FTX Holdings, Coinbase Ventures Portfolio, Alameda Research Portfolio, DragonFly Capital Portfolio",solend,69360419,137087973.0,,,N/A,4796.63
MEXC,"Decentralized Finance (DeFi), Lending/Borrowing Protocols, Arbitrum Ecosystem, Ethereum Ecosystem, Alameda Research Portfolio, Pantera Capital Portfolio",liquity,69204052,71115157.0,79753.96791055528,112411.37758197391,0.07,11522212.0
MEXC,"Decentralized Finance (DeFi), Ethereum Ecosystem, Binance Alpha Spotlight",avalon-2,68805466,424070663.0,6901.4138992350745,13171.400830026654,0.17,23182296.0
MEXC,"Artificial Intelligence (AI), Business Services, Decentralized Finance (DeFi), Ethereum Ecosystem, Paradigm Portfolio, DragonFly Capital Portfolio, Energi Ecosystem",numeraire,68700323,91993563.0,84557.27653694266,82348.87601166578,0.1,7371820.0
MEXC,"Meme, Dog-Themed, TON Ecosystem, TON Meme",dogs-2,68550213,72961040.0,158888.9655833815,225831.8372877659,0.15,14630662.0
MEXC,"Solana Ecosystem, Restaking, Liquid Restaking Tokens, Liquid Restaked SOL",renzo-restaked-sol,68737413,68737413.0,,,N/A,914962.0
MEXC,"Artificial Intelligence (AI), Solana Ecosystem, DePIN",nosana,67822087,81321447.0,352.4839352364605,1670.654634493603,0.14,994018.0
MEXC,"Stablecoins, Decentralized Finance (DeFi), USD Stablecoin, BNB Chain Ecosystem, Avalanche Ecosystem, Arbitrum Ecosystem, Liquid Staking Tokens, Ethereum Ecosystem, Optimism Ecosystem, Fiat-backed Stablecoin",staked-frax,68128940,68128940.0,,,N/A,50.48
MEXC,"Smart Contract Platform, Layer 1 (L1), Proof of Work (PoW), Privacy Blockchain",ergo,67173477,82006706.0,3221.1903948278773,3077.2084285619044,0.47,85285.0
MEXC,"Solana Ecosystem, Wallets, Base Ecosystem, TON Ecosystem",bitget-wallet-token,67182897,470072637.0,,,N/A,3631.06
MEXC,"Smart Contract Platform, Ethereum Ecosystem, Layer 2 (L2), Zero Knowledge (ZK), Rollup, OKX Ventures Portfolio",taiko,67669530,639928464.0,10138.062290878677,15748.26535686924,0.2,13358663.0
MEXC,"Decentralized Exchange (DEX), Decentralized Finance (DeFi), Sui Ecosystem, Animoca Brands Portfolio, OKX Ventures Portfolio, Dex Aggregator",cetus-protocol,66909079,97994297.0,11058.321215849794,11986.258403185375,0.29,11351296.0
MEXC,"Artificial Intelligence (AI), Marketing, Analytics, BNB Chain Ecosystem, Ethereum Ecosystem, Animoca Brands Portfolio, Base Ecosystem, AI Agents, Binance Alpha Spotlight",cookie,66712431,148486787.0,42516.01571533751,89610.79206635963,0.11,18729850.0
MEXC,"Smart Contract Platform, Binance Launchpool, Layer 2 (L2), Scroll Ecosystem",scroll,66977596,352513661.0,208005.1102614951,238945.73498738257,0.37,17879911.0
MEXC,Ethereum Ecosystem,saasgo,66334712,82918389.0,,,N/A,275700.0
MEXC,"NFT, BNB Chain Ecosystem, Solana Ecosystem, Meme, Ethereum Ecosystem, Base Ecosystem, Hybrid Token Standards, Wojak-Themed",non-playable-coin,66115042,66115042.0,6852.676675171457,18081.935088514918,0.52,6051450.0
MEXC,"Base Ecosystem, Cybersecurity, Binance Labs Portfolio, OKX Ventures Portfolio, Binance Alpha Spotlight",goplus-security,66143647,364749347.0,123756.59495407114,141821.44791977477,0.13,38032798.0
MEXC,SocialFi,steem,65955271,66007879.0,42516.21188417275,55530.5093535985,0.15,11714624.0
MEXC,"Decentralized Finance (DeFi), Ethereum Ecosystem, Restaking",kelp-gain,65606430,65606430.0,,,N/A,1417.42
MEXC,E-commerce,pay-coin,65588825,121867435.0,,,N/A,3629266.0
MEXC,"Smart Contract Platform, Layer 1 (L1), DWF Labs Portfolio, Radix Ecosystem",radix,65231293,79874351.0,3090.95466785673,3595.5272775663875,0.11,1541498.0
MEXC,"Healthcare, Osmosis Ecosystem",medibloc,64846151,70237363.0,,,N/A,350236.0
MEXC,"Stablecoins, USD Stablecoin, Fiat-backed Stablecoin",falcon-finance,64420934,64420934.0,,,N/A,57808.0
MEXC,"Decentralized Finance (DeFi), BNB Chain Ecosystem, Solana Ecosystem, Wallets, Polygon Ecosystem, Ethereum Ecosystem, Binance Launchpad, DWF Labs Portfolio, Multicoin Capital Portfolio, Alameda Research Portfolio, Viction Ecosystem, Binance Labs Portfolio",coin98,64540546,71645391.0,196296.80351186512,191700.22017827025,0.28,15813298.0
MEXC,"Decentralized Finance (DeFi), Lending/Borrowing Protocols, Ethereum Ecosystem, Real World Assets (RWA), Alameda Research Portfolio, Circle Ventures Portfolio, RWA Protocol",maple,64282264,163153824.0,,,N/A,2549355.0
MEXC,"Artificial Intelligence (AI), BNB Chain Ecosystem, Ethereum Ecosystem, DePIN, AI Agents",netmind-token,64375485,204596434.0,6938.8348637085255,16817.31181092095,0.14,1822170.0
MEXC,"BNB Chain Ecosystem, Binance Megadrop, BTCfi",solv-protocol,63894313,362007441.0,75242.48465850696,275431.4657174183,0.07,54143047.0
MEXC,"Smart Contract Platform, Layer 1 (L1), Ethereum Ecosystem, Proof of Stake (PoS)",pundi-aifx,63730935,63730935.0,,,N/A,338087.0
MEXC,"Polkadot Ecosystem, Real World Assets (RWA), Coinbase Ventures Portfolio, Circle Ventures Portfolio, Galaxy Digital Portfolio, RWA Protocol",centrifuge,63486559,69563414.0,,,N/A,1212580.0
MEXC,"Infrastructure, Smart Contract Platform, BNB Chain Ecosystem, Avalanche Ecosystem, Polygon Ecosystem, Arbitrum Ecosystem, Ethereum Ecosystem, Optimism Ecosystem, Layer 2 (L2), Base Ecosystem, Binance Launchpad, Modular Blockchain, Layer 3 (L3), Rollup, Proof of Stake (PoS), Appchains, Binance Labs Portfolio",cartesi,63804808,74246552.0,,,N/A,7880861.0
MEXC,"Artificial Intelligence (AI), Launchpad, Base Ecosystem, AI Applications, Clanker Ecosystem, Binance Alpha Spotlight",tokenbot-2,64969848,64969848.0,3583.6690692288967,3337.686223930222,0.32,5794372.0
MEXC,,ark,62674882,63219435.0,35563.19557295606,25467.75371228968,0.09,7662810.0
MEXC,"Smart Contract Platform, Layer 2 (L2), Made in USA",metal,62551247,62551247.0,,,N/A,476963.0
MEXC,Ethereum Ecosystem,devve,62735126,86145091.0,1398.3716076866444,1845.1764073824697,0.08,1372181.0
MEXC,"Artificial Intelligence (AI), Solana Ecosystem, Polygon Ecosystem, Gnosis Chain Ecosystem, Arbitrum Ecosystem, Celo Ecosystem, Ethereum Ecosystem, Optimism Ecosystem, Base Ecosystem, AI Agents, Mode Ecosystem, AI Agent Launchpad, Binance Alpha Spotlight, AI Framework, DeFAI",autonolas,60976020,178357192.0,1751.5252749166525,1531.030542923906,0.52,280290.0
MEXC,"Smart Contract Platform, Layer 1 (L1), Proof of Work (PoW), Made in USA",quai-network,59921697,373008963.0,4703.797317213868,6955.957035441908,0.24,6330577.0
MEXC,"Infrastructure, Smart Contract Platform",ardor,60723239,60723239.0,,,N/A,5634043.0
MEXC,"Artificial Intelligence (AI), Infrastructure, Gaming (GameFi), NFT, Solana Ecosystem, Arbitrum Ecosystem, Impossible Finance Launchpad, Ethereum Ecosystem, Animoca Brands Portfolio, Base Ecosystem",carv,60430913,302018403.0,6448.674175425035,11952.039795954253,0.26,7260298.0
MEXC,"Exchange-based Tokens, BNB Chain Ecosystem, Centralized Exchange (CEX) Token, Polygon Ecosystem, Ethereum Ecosystem",bit2me,60954138,61569837.0,,,N/A,81714.0
