OKX,"Decentralized Exchange (DEX), Smart Contract Platform, Decentralized Finance (DeFi), Prediction Markets, Layer 1 (L1), Gnosis Chain Ecosystem, MEV Protection, Arbitrum Ecosystem, Ethereum Ecosystem, SideChain, Energi Ecosystem",gnosis,323883127,375213743.0,,,N/A,22722987.0
OKX,"Solana Ecosystem, Meme, Solana Meme, AI Meme, Pump.fun Ecosystem, Terminal of Truths, Binance Alpha Spotlight",fartcoin,321950204,321950204.0,,,N/A,107985608.0
OKX,"Artificial Intelligence (AI), Smart Contract Platform, Storage, BNB Chain Ecosystem, Layer 1 (L1), Ethereum Ecosystem, DePIN, DWF Labs Portfolio, Osmosis Ecosystem, GMCI DePIN Index, GMCI Index",aioz-network,324930908,329360385.0,,,N/A,8999898.0
OKX,"Smart Contract Platform, Zero Knowledge (ZK), FTX Holdings, Paradigm Portfolio, Coinbase Ventures Portfolio, Multicoin Capital Portfolio, Proof of Stake (PoS), Pantera Capital Portfolio, Circle Ventures Portfolio, Privacy Blockchain, Polychain Capital Portfolio, Made in USA, Coinbase 50 Index",mina-protocol,319005298,319005298.0,44381.91803469971,62081.83326899206,0.08,13951296.0
OKX,"Decentralized Finance (DeFi), Arbitrum Ecosystem, Ethereum Ecosystem, Real World Assets (RWA), Base Ecosystem, Coinbase Ventures Portfolio, Energi Ecosystem, Made in USA",reserve-rights-token,319550416,571649197.0,46817.73266352428,72972.62401744758,0.03,21885586.0
OKX,"Decentralized Finance (DeFi), Lending/Borrowing Protocols, Ethereum Ecosystem, Base Ecosystem, Coinbase Ventures Portfolio, Pantera Capital Portfolio, Morpho Ecosystem, Binance Alpha Spotlight",morpho,310941221,1317278451.0,307495.7256079762,372524.1631694745,0.04,12059809.0
OKX,"Smart Contract Platform, Layer 1 (L1), MEV Protection, Proof of Work (PoW), Privacy Blockchain",verus-coin,310933906,310958182.0,,,N/A,10781.96
OKX,"Yield Aggregator, Ethereum Ecosystem, Binance Labs Portfolio, Polychain Capital Portfolio",stakestone-berachain-vault-token,307486283,307486283.0,,,N/A,1420012.0
OKX,"Smart Contract Platform, Layer 1 (L1), Ethereum Ecosystem, Real World Assets (RWA), RWA Protocol, Made in USA",plume,301584902,1507924510.0,,,N/A,28714766.0
OKX,"Decentralized Finance (DeFi), Tron Ecosystem",just,297842576,297842576.0,16700.349972816843,20956.31786142844,0.1,21069348.0
OKX,"Solana Ecosystem, Arbitrum Ecosystem, Impossible Finance Launchpad, Ethereum Ecosystem, DePIN, Animoca Brands Portfolio",aethir,291043297,1547451468.0,200644.501929503,228642.94319826513,0.08,28283359.0
OKX,"Artificial Intelligence (AI), Ethereum Ecosystem, DePIN, Energi Ecosystem, GMCI DePIN Index, GMCI Index",golem,290425502,290425502.0,21334.808530753304,23846.780549863404,0.07,17117146.0
OKX,"Decentralized Exchange (DEX), Exchange-based Tokens, Decentralized Finance (DeFi), Yield Farming, Derivatives, Synthetic Issuer, Avalanche Ecosystem, Polygon Ecosystem, Near Protocol Ecosystem, Fantom Ecosystem, Harmony Ecosystem, Ethereum Ecosystem, Optimism Ecosystem, Base Ecosystem, DWF Labs Portfolio, Paradigm Portfolio, Coinbase Ventures Portfolio, Index Coop Defi Index, Energi Ecosystem, Huobi ECO Chain Ecosystem, GMCI DeFi Index, Synthetic, Index Coop Index, GMCI Index, Coinbase 50 Index",havven,287169475,287527845.0,37247.86538275275,42621.37044248118,0.05,20060182.0
OKX,"Polygon Ecosystem, Bridged WETH, Bridged-Tokens",polygon-pos-bridged-weth-polygon-pos,283642890,283642890.0,,,N/A,11287264.0
OKX,"Crypto-Backed Tokens, Wrapped-Tokens, Polygon Ecosystem, Arbitrum Ecosystem, Liquid Staking Tokens, Ethereum Ecosystem, Optimism Ecosystem, Base Ecosystem, Liquid Staked ETH, Liquid Staking",coinbase-wrapped-staked-eth,282178812,784930284.0,,,N/A,3997545.0
OKX,"Infrastructure, Ethereum Ecosystem, Data Availability, Restaking, Polychain Capital Portfolio, Made in USA",eigenlayer,280670509,1967102167.0,189610.471467145,244308.20112034038,0.09,30531851.0
OKX,"Smart Contract Platform, Privacy, Masternodes, Alleged SEC Securities, Proof of Stake (PoS), Proof of Work (PoW), Made in USA",dash,276150158,276154569.0,,,N/A,28382461.0
OKX,"Decentralized Exchange (DEX), Exchange-based Tokens, Decentralized Finance (DeFi), Automated Market Maker (AMM), BNB Chain Ecosystem, Avalanche Ecosystem, Polygon Ecosystem, Near Protocol Ecosystem, Harmony Ecosystem, Ethereum Ecosystem, FTX Holdings, Alameda Research Portfolio, DragonFly Capital Portfolio, Pantera Capital Portfolio, Energi Ecosystem, Binance Labs Portfolio, GMCI DeFi Index, Galaxy Digital Portfolio, Blockchain Capital Portfolio, Dex Aggregator, GMCI Index, Coinbase 50 Index",1inch,274581526,299035753.0,45598.7081889893,69387.46425316861,0.05,19541462.0
OKX,"BNB Chain Ecosystem, Wallets, Ethereum Ecosystem, Animoca Brands Portfolio, Binance Launchpad, Energi Ecosystem, Binance Labs Portfolio",safepal,271112362,271112362.0,,,N/A,9931283.0
OKX,"Liquid Staking Tokens, Ethereum Ecosystem, Liquid Staking",stader-ethx,271325163,271325163.0,,,N/A,175873.0
OKX,"Smart Contract Platform, Polkadot Ecosystem, Proof of Stake (PoS), Pantera Capital Portfolio, Made in USA, Coinbase 50 Index",kusama,271536381,271536381.0,11854.137875155931,34779.93237968899,0.06,10723409.0
OKX,"Polygon Ecosystem, Bridged WBTC, Bridged-Tokens",polygon-bridged-wbtc-polygon-pos,268950935,268950935.0,,,N/A,6653282.0
OKX,"Smart Contract Platform, Ethereum Ecosystem, Real World Assets (RWA), DWF Labs Portfolio, Proof of Stake (PoS)",creditcoin-2,268211009,370443504.0,52826.58263473687,61341.9353988144,0.05,16441696.0
OKX,"Smart Contract Platform, Layer 2 (L2), Zero Knowledge (ZK), ZkSync Ecosystem, Consensys Portfolio, Blockchain Capital Portfolio, OKX Ventures Portfolio",zksync,265440243,1516801389.0,52282.43222000061,79612.40872481758,0.03,51195532.0
OKX,"Exchange-based Tokens, Centralized Exchange (CEX) Token, Ethereum Ecosystem, Morph L2 Ecosystem",mx-token,262846497,1158165441.0,,,N/A,17256562.0
OKX,"Stablecoins, USD Stablecoin, Ethereum Ecosystem, Fiat-backed Stablecoin",elixir-deusd,262441612,262441612.0,,,N/A,121630051.0
OKX,"Smart Contract Platform, DePIN, Proof of Stake (PoS), Made in USA",theta-fuel,261219736,261274590.0,,,N/A,2304114.0
OKX,"Decentralized Finance (DeFi), Ethereum Ecosystem, Restaking, Liquid Restaking Tokens, Liquid Staking",ether-fi-staked-btc,257525216,257525216.0,,,N/A,183950.0
OKX,"Solana Ecosystem, Arbitrum Ecosystem, Ethereum Ecosystem, Interoperability, Base Ecosystem, Multicoin Capital Portfolio, Cross-chain Communication, Made in USA",wormhole,259718388,894083881.0,161507.16166218396,196893.49804150267,0.11,32750398.0
OKX,"Crypto-Backed Tokens, Decentralized Finance (DeFi), cToken, Ethereum Ecosystem",compound-wrapped-btc,257074215,257074215.0,,,N/A,0.0
OKX,"BRC-20, Bitcoin Ecosystem, Inscriptions",sats-ordinals,256639494,256639494.0,215844.00039503028,291988.39386488916,0.08,7545386.0
OKX,"Smart Contract Platform, Gaming (GameFi), NFT, Layer 1 (L1), Play To Earn, Gaming Blockchains, WEMIX Ecosystem",wemix-token,258966741,332992644.0,,,N/A,3963587.0
OKX,"Meme, Cardano Ecosystem",snek,257210794,260493181.0,,,N/A,1430844.0
OKX,"Smart Contract Platform, BNB Chain Ecosystem, Avalanche Ecosystem, Polygon Ecosystem, Arbitrum Ecosystem, Ethereum Ecosystem, Optimism Ecosystem, Base Ecosystem, Multicoin Capital Portfolio, Layer 0 (L0), Cross-chain Communication, Circle Ventures Portfolio, Sequoia Capital Portfolio, OKX Ventures Portfolio",layerzero,253785931,2283215599.0,599074.7087837611,998922.1133777808,0.09,187818068.0
OKX,"Decentralized Finance (DeFi), Solana Ecosystem, LSDFi, Restaking, Stablecoin Protocol, Binance Labs Portfolio, Binance HODLer Airdrops, Polychain Capital Portfolio",solayer,243514078,1159590848.0,,,N/A,180847118.0
OKX,"Arbitrum Ecosystem, Liquid Staking Tokens, Ethereum Ecosystem, Liquid Staking",sweth,253385900,253392964.0,,,N/A,177084.0
OKX,"Stablecoins, Tokenized Assets, Tokenized Gold, BNB Chain Ecosystem, Real World Assets (RWA), Tokenized Commodities, Commodity-backed Stablecoin",quorium,250775561,250775561.0,,,N/A,82073.0
OKX,"Decentralized Finance (DeFi), BNB Chain Ecosystem, Polygon Ecosystem, Fantom Ecosystem, Arbitrum Ecosystem, Moonbeam Ecosystem, Liquid Staking Tokens, Ethereum Ecosystem, Optimism Ecosystem, Polygon zkEVM Ecosystem, Liquid Staking, Made in USA",frax-ether,249674090,249674090.0,,,N/A,1471076.0
OKX,"Bridged USDC, Sonic Ecosystem, Bridged-Tokens, Bridged Stablecoins",sonic-bridged-usdc-e-sonic,240342710,240342710.0,,,N/A,18361887.0
OKX,"Smart Contract Platform, Polkadot Ecosystem, Layer 1 (L1), Layer 2 (L2), Alameda Research Portfolio, Binance Labs Portfolio, OKX Ventures Portfolio",astar,239443475,263263993.0,124323.14172900819,227771.3604760278,0.06,5196346.0
OKX,"Smart Contract Platform, BNB Chain Ecosystem, GMCI Layer 1 Index, GMCI Index, Made in China",zilliqa,239802264,248136319.0,72250.86801734078,130462.00700182961,0.08,11102881.0
OKX,"NFT, Ethereum Ecosystem, NFT Marketplace, FTX Holdings, NFTFi, eGirl Capital Portfolio, Paradigm Portfolio, GMCI DeFi Index, GMCI Index, Made in USA, Coinbase 50 Index",blur,237132867,316648700.0,59097.07919911777,82612.10649428582,0.09,30477803.0
OKX,"Stablecoins, USD Stablecoin, BNB Chain Ecosystem, Avalanche Ecosystem, Near Protocol Ecosystem, Arbitrum Ecosystem, Ethereum Ecosystem, Tron Ecosystem, BitTorrent Ecosystem, Algorithmic Stablecoin, Fiat-backed Stablecoin",usdd,234349321,234349321.0,,,N/A,3359452.0
OKX,"Infrastructure, Wallets, Gnosis Chain Ecosystem, Ethereum Ecosystem",safe,233090609,421017585.0,102661.80919605042,108390.22748915716,0.05,14440008.0
OKX,"Decentralized Finance (DeFi), Liquid Staking Tokens, Base Ecosystem, Liquid Staked ETH, Liquid Staking",super-oeth,232871795,232871795.0,,,N/A,846423.0
OKX,"Infrastructure, Decentralized Finance (DeFi), Sui Ecosystem",deep,230270302,921081209.0,,,N/A,17121582.0
OKX,"Smart Contract Platform, Proof of Stake (PoS), Made in China",qtum,227466875,232338751.0,63978.79828740819,82844.79571139063,0.09,17144187.0
OKX,"Decentralized Exchange (DEX), Exchange-based Tokens, Decentralized Finance (DeFi), Derivatives, Perpetuals, Ethereum Ecosystem, Paradigm Portfolio",dydx,226910675,226910675.0,,,N/A,13533595.0
OKX,"Smart Contract Platform, Interoperability, Layer 2 (L2), Rollup, Multicoin Capital Portfolio, Proof of Work (PoW), DragonFly Capital Portfolio, Sequoia Capital Portfolio, Blockchain Capital Portfolio, Polychain Capital Portfolio, Made in China",nervos-network,226708206,230287152.0,,,N/A,12613512.0
OKX,"Solana Ecosystem, Avalanche Ecosystem, Polygon Ecosystem, Near Protocol Ecosystem, Harmony Ecosystem, Ethereum Ecosystem, Pantera Capital Portfolio, Energi Ecosystem, Made in USA",basic-attention-token,225197322,225849522.0,12754.609240536583,20510.26006049394,0.07,17207713.0
OKX,"Gaming (GameFi), Binance Launchpool, Meme, Play To Earn, TON Ecosystem, TON Meme, Tap to Earn",notcoin,210859990,210859990.0,91665.51740415448,101663.50475742799,0.05,98630576.0
OKX,"BNB Chain Ecosystem, Polygon Ecosystem, Ethereum Ecosystem, Animoca Brands Portfolio, DWF Labs Portfolio, Alameda Research Portfolio, Energi Ecosystem, Binance Labs Portfolio",mask-network,217758759,217758759.0,105595.14572940163,140070.00677740504,0.05,23379683.0
OKX,"Analytics, Avalanche Ecosystem, Meme, Cat-Themed, Made in USA",ket,218220966,218220966.0,,,N/A,6698790.0
OKX,"Layer 1 (L1), VeChain Ecosystem",vethor-token,216949429,217028865.0,,,N/A,3674026.0
OKX,"Artificial Intelligence (AI), Solana Ecosystem, Meme, Solana Meme, AI Meme, AI Agents, Binance Alpha Spotlight, AI Framework, Made in USA",ai16z,217677667,217677667.0,,,N/A,49970711.0
OKX,"Decentralized Exchange (DEX), Decentralized Finance (DeFi), Avalanche Ecosystem, Harmony Ecosystem, Ethereum Ecosystem, Coinbase Ventures Portfolio, Pantera Capital Portfolio, Energi Ecosystem, GMCI DeFi Index, Blockchain Capital Portfolio, GMCI Index, Made in USA",0x,214919292,253324096.0,20069.95646034785,38162.97489292165,0.12,24706577.0
OKX,"Artificial Intelligence (AI), Polkadot Ecosystem, Metaverse, Ethereum Ecosystem, Interoperability, Real World Assets (RWA), DePIN, Decentralized Science (DeSci), AI Agents",origintrail,213367728,213668988.0,,,N/A,6003260.0
OKX,"Smart Contract Platform, BNB Chain Ecosystem, Layer 1 (L1), Proof of Stake (PoS), Pantera Capital Portfolio, Andreessen Horowitz (a16z) Portfolio, Binance Labs Portfolio, Blockchain Capital Portfolio, Privacy Blockchain, Polychain Capital Portfolio, Coinbase 50 Index",oasis-network,211754598,314652333.0,,,N/A,10089296.0
OKX,"Decentralized Finance (DeFi), Aptos Ecosystem",abtc,211104511,211104511.0,,,N/A,100664.0
OKX,"Decentralized Exchange (DEX), Decentralized Finance (DeFi), Automated Market Maker (AMM), Cosmos Ecosystem, Osmosis Ecosystem, Paradigm Portfolio, Evmos Ecosystem, Secret Ecosystem, GMCI DeFi Index, GMCI Index",osmosis,210624805,293431045.0,,,N/A,12261267.0
OKX,"Decentralized Finance (DeFi), Solana Ecosystem, Liquid Staking Tokens, Liquid Staked SOL, Liquid Staking",bybit-staked-sol,208634297,208634297.0,,,N/A,4849805.0
OKX,"Artificial Intelligence (AI), Harmony Ecosystem, Arbitrum Ecosystem, Ethereum Ecosystem, DePIN, Coinbase Ventures Portfolio, Multicoin Capital Portfolio, Pantera Capital Portfolio, GMCI DePIN Index, GMCI Index, Coinbase 50 Index",livepeer,208530648,208530648.0,42022.534933205396,84003.59672715761,0.06,17888116.0
OKX,"Liquid Staking Tokens, Ethereum Ecosystem, Base Ecosystem, Liquid Staked ETH, Liquid Staking",liquid-staked-ethereum,206046514,206046514.0,,,N/A,70113.0
OKX,"BNB Chain Ecosystem, Meme",cheems-token,207294957,207294957.0,,,N/A,6152915.0
OKX,"Stablecoins, USD Stablecoin, Arbitrum Ecosystem, Ethereum Ecosystem, Base Ecosystem, Crypto-backed Stablecoin, Fiat-backed Stablecoin",gho,205415106,205415106.0,,,N/A,6994305.0
OKX,"BNB Chain Ecosystem, Meme, AI Meme",ai-companions,203873792,203873792.0,,,N/A,2621487.0
OKX,"Gaming (GameFi), BNB Chain Ecosystem, Solana Ecosystem, Meme, Ethereum Ecosystem, Dog-Themed, Solana Meme, Gaming Utility Token",baby-doge-coin,203619803,516850459.0,54880.03511770501,64629.5693979102,0.08,13583438.0
OKX,"Smart Contract Platform, Storage, Harmony Ecosystem, Ethereum Ecosystem, DePIN, Energi Ecosystem, Sora Ecosystem, GMCI DePIN Index, GMCI Index",holotoken,202157863,202157863.0,,,N/A,10714678.0
OKX,"Gaming (GameFi), NFT, Collectibles, Polygon Ecosystem, Ethereum Ecosystem, Animoca Brands Portfolio, Gaming Blockchains, Made in USA",superfarm,202357051,447994183.0,,,N/A,18915183.0
OKX,"Stablecoins, Ethereum Ecosystem",usda-2,201398279,201398279.0,,,N/A,803613.0
OKX,"Decentralized Finance (DeFi), Yield Farming, BNB Chain Ecosystem, Avalanche Ecosystem, Polygon Ecosystem, Fantom Ecosystem, Arbitrum Ecosystem, Ethereum Ecosystem, Optimism Ecosystem, Linea Ecosystem, Bridge Governance Tokens, Base Ecosystem, FTX Holdings",stargate-finance,201472613,207390559.0,,,N/A,7279577.0
OKX,"Decentralized Exchange (DEX), BNB Chain Ecosystem, Solana Ecosystem, Ethereum Ecosystem, Real World Assets (RWA), Base Ecosystem, RWA Protocol",chex-token,201144414,201144414.0,,,N/A,1431314.0
OKX,"Smart Contract Platform, Gaming (GameFi), Ethereum Ecosystem, Base Ecosystem, Card Games, Paradigm Portfolio, Gaming Blockchains, Gaming Utility Token",echelon-prime,200489275,395853352.0,,,N/A,4429140.0
OKX,"Solana Ecosystem, Meme, Solana Meme, Pump.fun Ecosystem, Zoo-Themed, Memorial Themed",peanut-the-squirrel,197999300,197999300.0,178188.56250250884,285957.7786710123,0.1,408447291.0
OKX,"Decentralized Finance (DeFi), Polygon Ecosystem, Ethereum Ecosystem, Coinbase Ventures Portfolio, Pantera Capital Portfolio",instadapp,194196732,492425135.0,,,N/A,447996.0
OKX,"Smart Contract Platform, Privacy, Layer 1 (L1), Proof of Stake (PoS), Proof of Work (PoW), Blockchain Capital Portfolio, Made in USA",decred,194789661,194789661.0,,,N/A,2357118.0
OKX,"Solana Ecosystem, Meme, Solana Meme, Cat-Themed, Murad Picks",popcat,193107378,193107378.0,,,N/A,84741370.0
OKX,"Infrastructure, Smart Contract Platform, Venom Ecosystem",venom,193384811,699212351.0,608.0597839254449,6777.985947383426,0.01,1804852.0
OKX,"Smart Contract Platform, Layer 1 (L1), Celo Ecosystem, DWF Labs Portfolio, Coinbase Ventures Portfolio, Proof of Stake (PoS), Andreessen Horowitz (a16z) Portfolio, Optimism Superchain Ecosystem, Outlier Ventures Portfolio, Made in USA",celo,193027654,341479873.0,46241.768916702975,75145.5746776019,0.03,14608945.0
OKX,"Smart Contract Platform, Layer 1 (L1), DePIN, Andreessen Horowitz (a16z) Portfolio, Made in USA",chia,191477115,435014754.0,39822.273199031944,53884.71393071205,0.15,5740250.0
OKX,"Artificial Intelligence (AI), Exchange-based Tokens, Analytics, Derivatives, Perpetuals, Centralized Exchange (CEX) Token, Ethereum Ecosystem, Binance Launchpad, Coinbase Ventures Portfolio, Binance Labs Portfolio, Made in USA",arkham,192331630,520243617.0,136978.93977424686,183407.46292941648,0.02,52848319.0
OKX,"Solana Ecosystem, Meme, Dog-Themed, Solana Meme, Bitcoin Ecosystem, Runes",dog-go-to-the-moon-rune,193226723,193226723.0,,,N/A,6927755.0
OKX,"Infrastructure, Smart Contract Platform, NEO Ecosystem",gas,190030994,190030994.0,25616.561152878665,28527.83327954436,0.03,4500726.0
OKX,"Oracle, Ethereum Ecosystem",redstone-oracles,204129791,729034968.0,,,N/A,146904235.0
OKX,"Solana Ecosystem, BRC-20, Bitcoin Ecosystem, Inscriptions",ordinals,188336620,188336620.0,212590.3328824984,292100.9127664234,0.03,85521988.0
OKX,"Gambling (GambleFi), Gaming (GameFi), Ethereum Ecosystem",rollbit-coin,184853876,184880779.0,,,N/A,667936.0
OKX,"Infrastructure, Smart Contract Platform, BNB Chain Ecosystem, Layer 1 (L1), Ethereum Ecosystem, GMCI Layer 1 Index, Aelf Ecosystem, GMCI Index",aelf,185028625,249417647.0,15101.749176062029,31838.92241176064,0.08,13870665.0
OKX,"Smart Contract Platform, Privacy, Proof of Work (PoW)",mimblewimblecoin,184934750,184938968.0,,,N/A,5364.49
OKX,"Crypto-Backed Tokens, Decentralized Finance (DeFi), Wrapped-Tokens, Ethereum Ecosystem",resolv-wstusr,184744046,165501422.0,,,N/A,162.11
OKX,"Smart Contract Platform, Real World Assets (RWA), Proof of Work (PoW), Made in USA",ravencoin,184446728,184452752.0,15312.792135215326,30976.658576725662,0.08,8887088.0
OKX,"Exchange-based Tokens, Ethereum Ecosystem",btse-token,185550294,228987505.0,,,N/A,3300924.0
OKX,"Solana Ecosystem, Meme, Solana Meme, AI Meme, Pump.fun Ecosystem",act-i-the-ai-prophecy,183435001,183435001.0,90402.17147934604,119803.15688816807,0.1,43527158.0
OKX,"Meme, Cronos Ecosystem, AI Meme, Cronos zkEVM Ecosystem",agentfun-ai,183670850,183670850.0,,,N/A,6843.67
OKX,"Gaming (GameFi), Ethereum Ecosystem, Decentralized Identifier (DID), Animoca Brands Portfolio, OKX Ventures Portfolio, Outlier Ventures Portfolio",mocaverse,182306110,848143088.0,,,N/A,20611398.0
OKX,"Solana Ecosystem, Ethereum Ecosystem, Energi Ecosystem",swissborg,182775526,182775526.0,,,N/A,10168255.0
OKX,"Tourism, BNB Chain Ecosystem",trip,181384670,602566022.0,,,N/A,40348.0
OKX,"Decentralized Finance (DeFi), BNB Chain Ecosystem, Polygon Ecosystem, Fantom Ecosystem, Arbitrum Ecosystem, Moonbeam Ecosystem, Liquid Staking Tokens, Ethereum Ecosystem, Optimism Ecosystem, Liquid Staked ETH, Liquid Staking",staked-frax-ether,181274075,181274075.0,,,N/A,129844.0
OKX,"Smart Contract Platform, Storage, DePIN, Paradigm Portfolio, Proof of Work (PoW), DragonFly Capital Portfolio, Made in USA",siacoin,179500410,191838873.0,5518.715472100871,7814.733927210506,0.09,14355291.0
OKX,"Artificial Intelligence (AI), Smart Contract Platform, Layer 1 (L1), Paradigm Portfolio, Coinbase Ventures Portfolio, DeFiance Capital Portfolio, Polychain Capital Portfolio, Vana Ecosystem",vana,176714619,688498516.0,,,N/A,28569938.0
OKX,"BNB Chain Ecosystem, Avalanche Ecosystem, Polygon Ecosystem, Fantom Ecosystem, Arbitrum Ecosystem, Ethereum Ecosystem, Optimism Ecosystem, Liquid Staking Governance Tokens, Linea Ecosystem, DePIN, Scroll Ecosystem, Rollups-as-a-Service (RaaS), Blast Ecosystem, Mode Ecosystem, Pantera Capital Portfolio, Polygon zkEVM Ecosystem, Binance Labs Portfolio, Liquid Staking, Made in USA",ankr,178951348,178951348.0,,,N/A,13394396.0
OKX,"Tokenized Real Estate, Tokenized Assets, Ethereum Ecosystem, Real World Assets (RWA), RWA Protocol",apf-coin,177457843,260555609.0,,,N/A,3186286.0
OKX,,nem,175734850,175734850.0,,,N/A,19648603.0
OKX,"Meme, Ethereum Ecosystem, Base Ecosystem, Cat-Themed, Murad Picks",mog-coin,176723966,176723966.0,,,N/A,13334273.0
OKX,"Gaming (GameFi), BNB Chain Ecosystem, Ethereum Ecosystem, TON Ecosystem",gmt-token,175251086,175251086.0,,,N/A,17086971.0
OKX,"Decentralized Finance (DeFi), Yield Farming, Yield Aggregator, Yearn Ecosystem, Avalanche Ecosystem, Polygon Ecosystem, Near Protocol Ecosystem, Gnosis Chain Ecosystem, Fantom Ecosystem, Harmony Ecosystem, Arbitrum Ecosystem, Ethereum Ecosystem, Optimism Ecosystem, Base Ecosystem, Index Coop Defi Index, Alameda Research Portfolio, Energi Ecosystem, Sora Ecosystem, Huobi ECO Chain Ecosystem, Blockchain Capital Portfolio, Index Coop Index",yearn-finance,171657629,186490698.0,24445.829647600345,35329.14018039336,0.08,23778406.0
OKX,"Avalanche Ecosystem, Liquid Staking Tokens, Liquid Staking",benqi-liquid-staked-avax,171864228,171864228.0,,,N/A,2110991.0
OKX,"Launchpad, Meme, Base Ecosystem, Cat-Themed, Base Meme",toshi,170671970,170671970.0,,,N/A,26800973.0
OKX,"Solana Ecosystem, Meme, Cat-Themed",meow,169554390,169554390.0,,,N/A,854218.0
OKX,"Starknet Ecosystem, Bridged-Tokens",bridged-wrapped-ether-starkgate,170181833,170181833.0,,,N/A,619567.0
OKX,"Decentralized Finance (DeFi), Solana Ecosystem, Ethereum Ecosystem, Optimism Ecosystem, Base Ecosystem, Cross-chain Communication, BTCfi",threshold-network-token,169769352,187019952.0,18332.433569354653,16453.93909582736,0.12,9193345.0
OKX,"Solana Ecosystem, Meme, Dog-Themed, Solana Meme, Cat-Themed",cat-in-a-dogs-world,168475480,168475480.0,63140.81947408526,83597.74947058775,0.05,10593373.0
OKX,Arbitrum Ecosystem,rcge,168805259,168805259.0,,,N/A,2.43
OKX,"Decentralized Finance (DeFi), Launchpad, Ethereum Ecosystem, DWF Labs Portfolio, Coinbase Ventures Portfolio, Pantera Capital Portfolio, Blockchain Capital Portfolio",auction,167649583,194376975.0,47907.54519667603,150871.66673745014,0.05,138093854.0
OKX,"Internet of Things (IOT), Ethereum Ecosystem, DePIN, Base Ecosystem, Account Abstraction, GMCI DePIN Index, GMCI Index, Made in USA",iotex,167674039,167674040.0,,,N/A,14181266.0
OKX,"Gaming (GameFi), NFT, Solana Ecosystem, Animoca Brands Portfolio, FTX Holdings, Multicoin Capital Portfolio, Alameda Research Portfolio",metaplex,166155878,212915191.0,,,N/A,5884639.0
OKX,"Entertainment, Smart Contract Platform, Gaming (GameFi), NFT, Metaverse, Layer 1 (L1), Harmony Ecosystem, Ethereum Ecosystem, Gaming Blockchains, Energi Ecosystem",enjincoin,164112862,169792255.0,14168.342635552652,24733.926852125776,0.11,11885573.0
OKX,"Decentralized Finance (DeFi), Liquid Staking Tokens, Ethereum Ecosystem, Liquid Staked ETH, Liquid Staking",treehouse-eth,163475275,163475275.0,,,N/A,52474.0
OKX,"Decentralized Finance (DeFi), Ethereum Ecosystem, Stablecoin Protocol",tribe-2,162956888,358134782.0,,,N/A,60011.0
OKX,"Decentralized Finance (DeFi), Derivatives, Perpetuals, Avalanche Ecosystem, Arbitrum Ecosystem",gmx,162685670,162685670.0,24745.236788250193,28323.137395869093,0.12,39908308.0
OKX,"Decentralized Exchange (DEX), Exchange-based Tokens, Ethereum Ecosystem",coinex-token,162171092,162171092.0,,,N/A,105878.0
OKX,"Smart Contract Platform, Layer 1 (L1), Proof of Stake (PoS), GMCI Layer 1 Index, GMCI Index, Made in USA",casper-network,160502192,166169466.0,78865.39001809455,95544.98727817414,0.06,14516615.0
OKX,"Decentralized Finance (DeFi), Derivatives, Prediction Markets, Solana Ecosystem",drift-protocol,162287824,562521447.0,,,N/A,56083036.0
OKX,"Decentralized Finance (DeFi), Binance Launchpool, Arbitrum Ecosystem, Ethereum Ecosystem, Restaking, Liquid Restaking Governance Tokens, Ether.fi Ecosystem, Consensys Portfolio, OKX Ventures Portfolio",ether-fi,161365232,696541922.0,375719.43174692633,327170.3198277536,0.01,56368485.0
OKX,"Decentralized Finance (DeFi), Yield Farming, Yield Aggregator, Ethereum Ecosystem, Metagovernance, Curve Ecosystem, Yield Optimizer",convex-finance,159771683,194581829.0,9433.734632195488,28381.691840228068,0.15,14220141.0
OKX,"Smart Contract Platform, BNB Chain Ecosystem, Layer 1 (L1), Ethereum Ecosystem, ZetaChain Ecosystem, Cross-chain Communication, Made in USA",zetachain,160070860,459441975.0,163040.01570297804,223146.61886440107,0.09,12219961.0
OKX,"Solana Ecosystem, DePIN, Multicoin Capital Portfolio, Made in USA",hivemapper,158627170,246717938.0,,,N/A,1427932.0
OKX,"Decentralized Finance (DeFi), Tron Ecosystem",sun-token,158620498,321144339.0,,,N/A,24664957.0
OKX,"Decentralized Exchange (DEX), Decentralized Finance (DeFi), Yield Farming, Automated Market Maker (AMM), BNB Chain Ecosystem, Seigniorage, Solana Ecosystem, Avalanche Ecosystem, Polygon Ecosystem, Fantom Ecosystem, Harmony Ecosystem, Arbitrum Ecosystem, Moonriver Ecosystem, Ethereum Ecosystem, Liquid Staking Governance Tokens, Curve Ecosystem, Stablecoin Protocol, Polygon zkEVM Ecosystem, Evmos Ecosystem, Fraxtal Ecosystem, GMCI DeFi Index, Liquid Staking, GMCI Index, Made in USA",frax-share,160597332,181436908.0,7369.995381598137,22092.964615297275,0.16,47223796.0
OKX,"Decentralized Exchange (DEX), Exchange-based Tokens, Decentralized Finance (DeFi), Automated Market Maker (AMM), BNB Chain Ecosystem, Derivatives, Perpetuals, Centralized Exchange (CEX) Token, Solana Ecosystem, Avalanche Ecosystem, Polygon Ecosystem, Near Protocol Ecosystem, Fantom Ecosystem, Arbitrum Ecosystem, Ethereum Ecosystem, ZkSync Ecosystem, Mantle Ecosystem, Linea Ecosystem, Base Ecosystem, DragonFly Capital Portfolio, Binance Labs Portfolio",woo-network,158190728,188396380.0,18736.883895983494,31079.490820262185,0.12,11578298.0
OKX,"Meme, Ethereum Ecosystem, Frog-Themed, AI Meme",turbo,156280802,156280802.0,60299.55145873497,141545.14725741712,0.04,36452918.0
