OKX,"Decentralized Finance (DeFi), Lending/Borrowing Protocols, Ethereum Ecosystem, Base Ecosystem, Coinbase Ventures Portfolio, Pantera Capital Portfolio, Morpho Ecosystem, Binance Alpha Spotlight",morpho,314527984,1332473477.0,268176.16053165816,392851.4398970828,0.04,8638113.0
OKX,"Smart Contract Platform, Layer 1 (L1), MEV Protection, Proof of Work (PoW), Privacy Blockchain",verus-coin,310503270,310506632.0,,,N/A,5929.9
OKX,"Artificial Intelligence (AI), Smart Contract Platform, Storage, BNB Chain Ecosystem, Layer 1 (L1), Ethereum Ecosystem, DePIN, DWF Labs Portfolio, Osmosis Ecosystem, GMCI DePIN Index, GMCI Index",aioz-network,309705327,313946783.0,,,N/A,7420147.0
OKX,"Yield Aggregator, Ethereum Ecosystem, Binance Labs Portfolio, Polychain Capital Portfolio",stakestone-berachain-vault-token,309174858,309174858.0,,,N/A,823494.0
OKX,"Decentralized Finance (DeFi), Tron Ecosystem",just,298819894,298819894.0,19095.712315306293,18394.48823996633,0.07,9604177.0
OKX,"Smart Contract Platform, Layer 1 (L1), Ethereum Ecosystem, Real World Assets (RWA), RWA Protocol, Made in USA",plume,295999185,1479995923.0,,,N/A,19040457.0
OKX,"Artificial Intelligence (AI), Ethereum Ecosystem, DePIN, Energi Ecosystem, GMCI DePIN Index, GMCI Index",golem,293943302,293943302.0,19812.035617078196,23428.466506078315,0.07,15336400.0
OKX,"Solana Ecosystem, Arbitrum Ecosystem, Impossible Finance Launchpad, Ethereum Ecosystem, DePIN, Animoca Brands Portfolio",aethir,292318905,1554233760.0,191717.06488111283,261336.29282190834,0.05,27263957.0
OKX,"Infrastructure, Ethereum Ecosystem, Data Availability, Restaking, Polychain Capital Portfolio, Made in USA",eigenlayer,289056825,2025878351.0,196260.24261344253,240028.11633693188,0.09,26383310.0
OKX,"Decentralized Exchange (DEX), Exchange-based Tokens, Decentralized Finance (DeFi), Yield Farming, Derivatives, Synthetic Issuer, Avalanche Ecosystem, Polygon Ecosystem, Near Protocol Ecosystem, Fantom Ecosystem, Harmony Ecosystem, Ethereum Ecosystem, Optimism Ecosystem, Base Ecosystem, DWF Labs Portfolio, Paradigm Portfolio, Coinbase Ventures Portfolio, Index Coop Defi Index, Energi Ecosystem, Huobi ECO Chain Ecosystem, GMCI DeFi Index, Synthetic, Index Coop Index, GMCI Index, Coinbase 50 Index",havven,287425874,287784564.0,36160.60968248055,46774.17767223739,0.02,20651694.0
OKX,"Polygon Ecosystem, Bridged WETH, Bridged-Tokens",polygon-pos-bridged-weth-polygon-pos,285566217,285566217.0,,,N/A,8013075.0
OKX,"Crypto-Backed Tokens, Wrapped-Tokens, Polygon Ecosystem, Arbitrum Ecosystem, Liquid Staking Tokens, Ethereum Ecosystem, Optimism Ecosystem, Base Ecosystem, Liquid Staked ETH, Liquid Staking",coinbase-wrapped-staked-eth,285290888,790750530.0,,,N/A,4434871.0
OKX,"Smart Contract Platform, Privacy, Masternodes, Alleged SEC Securities, Proof of Stake (PoS), Proof of Work (PoW), Made in USA",dash,282138057,282138564.0,,,N/A,32863458.0
OKX,"Smart Contract Platform, Gaming (GameFi), NFT, Layer 1 (L1), Play To Earn, Gaming Blockchains, WEMIX Ecosystem",wemix-token,282062403,362688402.0,,,N/A,3767781.0
OKX,"Decentralized Exchange (DEX), Exchange-based Tokens, Decentralized Finance (DeFi), Automated Market Maker (AMM), BNB Chain Ecosystem, Avalanche Ecosystem, Polygon Ecosystem, Near Protocol Ecosystem, Harmony Ecosystem, Ethereum Ecosystem, FTX Holdings, Alameda Research Portfolio, DragonFly Capital Portfolio, Pantera Capital Portfolio, Energi Ecosystem, Binance Labs Portfolio, GMCI DeFi Index, Galaxy Digital Portfolio, Blockchain Capital Portfolio, Dex Aggregator, GMCI Index, Coinbase 50 Index",1inch,279114371,303972294.0,36188.46031973757,72972.1996868569,0.1,16732774.0
OKX,"BNB Chain Ecosystem, Wallets, Ethereum Ecosystem, Animoca Brands Portfolio, Binance Launchpad, Energi Ecosystem, Binance Labs Portfolio",safepal,274987933,274987933.0,,,N/A,7399645.0
OKX,"Liquid Staking Tokens, Ethereum Ecosystem, Liquid Staking",stader-ethx,273733541,273733541.0,,,N/A,111664.0
OKX,"Smart Contract Platform, Polkadot Ecosystem, Proof of Stake (PoS), Pantera Capital Portfolio, Made in USA, Coinbase 50 Index",kusama,273246140,273247765.0,12669.953046751785,29119.473694130327,0.06,8185583.0
OKX,"Polygon Ecosystem, Bridged WBTC, Bridged-Tokens",polygon-bridged-wbtc-polygon-pos,270707378,270707378.0,,,N/A,2565196.0
OKX,"Smart Contract Platform, Layer 2 (L2), Zero Knowledge (ZK), ZkSync Ecosystem, Consensys Portfolio, Blockchain Capital Portfolio, OKX Ventures Portfolio",zksync,269214065,1538366088.0,51451.91468353424,76830.25126135573,0.03,42352028.0
OKX,"Smart Contract Platform, Ethereum Ecosystem, Real World Assets (RWA), DWF Labs Portfolio, Proof of Stake (PoS)",creditcoin-2,268482545,370818539.0,59628.61436636085,63555.451876074854,0.03,11951752.0
OKX,"Solana Ecosystem, Arbitrum Ecosystem, Ethereum Ecosystem, Interoperability, Base Ecosystem, Multicoin Capital Portfolio, Cross-chain Communication, Made in USA",wormhole,265742462,914821833.0,154482.67662951685,187414.63905816912,0.11,34229555.0
OKX,"Smart Contract Platform, DePIN, Proof of Stake (PoS), Made in USA",theta-fuel,265140780,265144066.0,,,N/A,2353080.0
OKX,"Exchange-based Tokens, Centralized Exchange (CEX) Token, Ethereum Ecosystem, Morph L2 Ecosystem",mx-token,260776031,1149042464.0,,,N/A,11632431.0
OKX,"Stablecoins, USD Stablecoin, Ethereum Ecosystem, Fiat-backed Stablecoin",elixir-deusd,260456613,260456613.0,,,N/A,89723582.0
OKX,"Meme, Cardano Ecosystem",snek,259597605,262910451.0,,,N/A,1108137.0
OKX,"Crypto-Backed Tokens, Decentralized Finance (DeFi), cToken, Ethereum Ecosystem",compound-wrapped-btc,258773274,258773274.0,,,N/A,0.0
OKX,"Decentralized Finance (DeFi), Ethereum Ecosystem, Restaking, Liquid Restaking Tokens, Liquid Staking",ether-fi-staked-btc,258486373,258486373.0,,,N/A,58173.0
OKX,"BRC-20, Bitcoin Ecosystem, Inscriptions",sats-ordinals,256861119,256861119.0,213219.41492693278,350390.79560639965,0.08,4934780.0
OKX,"Smart Contract Platform, BNB Chain Ecosystem, Avalanche Ecosystem, Polygon Ecosystem, Arbitrum Ecosystem, Ethereum Ecosystem, Optimism Ecosystem, Base Ecosystem, Multicoin Capital Portfolio, Layer 0 (L0), Cross-chain Communication, Circle Ventures Portfolio, Sequoia Capital Portfolio, OKX Ventures Portfolio",layerzero,256748724,2309870728.0,582995.9249358387,1021989.1842934715,0.04,225140154.0
OKX,"Gaming (GameFi), Binance Launchpool, Meme, Play To Earn, TON Ecosystem, TON Meme, Tap to Earn",notcoin,254977077,254977077.0,4508.277126946182,6907.058194808977,0.61,288560476.0
OKX,"Arbitrum Ecosystem, Liquid Staking Tokens, Ethereum Ecosystem, Liquid Staking",sweth,254833149,254840253.0,,,N/A,120834.0
OKX,"Decentralized Finance (DeFi), BNB Chain Ecosystem, Polygon Ecosystem, Fantom Ecosystem, Arbitrum Ecosystem, Moonbeam Ecosystem, Liquid Staking Tokens, Ethereum Ecosystem, Optimism Ecosystem, Polygon zkEVM Ecosystem, Liquid Staking, Made in USA",frax-ether,251859533,251859533.0,,,N/A,578717.0
OKX,"Stablecoins, Tokenized Assets, Tokenized Gold, BNB Chain Ecosystem, Real World Assets (RWA), Tokenized Commodities, Commodity-backed Stablecoin",quorium,250806230,250806230.0,,,N/A,81971.0
OKX,"Infrastructure, Decentralized Finance (DeFi), Sui Ecosystem",deep,250264050,1001056198.0,,,N/A,16922713.0
OKX,"BNB Chain Ecosystem, Meme, AI Meme",ai-companions,244900998,244900998.0,,,N/A,2600711.0
OKX,"Decentralized Finance (DeFi), Solana Ecosystem, Liquid Staking Tokens, Liquid Staked SOL, Liquid Staking",bybit-staked-sol,243673192,243673192.0,,,N/A,1802350.0
OKX,"Decentralized Finance (DeFi), Solana Ecosystem, LSDFi, Restaking, Stablecoin Protocol, Binance Labs Portfolio, Binance HODLer Airdrops, Polychain Capital Portfolio",solayer,243567116,1159843411.0,,,N/A,70331767.0
OKX,"Stablecoins, USD Stablecoin, BNB Chain Ecosystem, Avalanche Ecosystem, Near Protocol Ecosystem, Arbitrum Ecosystem, Ethereum Ecosystem, Tron Ecosystem, BitTorrent Ecosystem, Algorithmic Stablecoin, Fiat-backed Stablecoin",usdd,243415581,243415581.0,,,N/A,3309371.0
OKX,"Smart Contract Platform, Polkadot Ecosystem, Layer 1 (L1), Layer 2 (L2), Alameda Research Portfolio, Binance Labs Portfolio, OKX Ventures Portfolio",astar,242589660,266726755.0,124485.50026326241,226798.68286952376,0.09,3206884.0
OKX,"Smart Contract Platform, BNB Chain Ecosystem, GMCI Layer 1 Index, GMCI Index, Made in China",zilliqa,242501704,250931437.0,70753.27505739857,112704.1232054242,0.08,9355292.0
OKX,"Bridged USDC, Sonic Ecosystem, Bridged-Tokens, Bridged Stablecoins",sonic-bridged-usdc-e-sonic,242271681,242271681.0,,,N/A,15980564.0
OKX,"NFT, Ethereum Ecosystem, NFT Marketplace, FTX Holdings, NFTFi, eGirl Capital Portfolio, Paradigm Portfolio, GMCI DeFi Index, GMCI Index, Made in USA, Coinbase 50 Index",blur,241831255,322861750.0,64369.24425711525,76777.84268980494,0.09,27698511.0
OKX,"Oracle, Ethereum Ecosystem",redstone-oracles,238174327,850622595.0,,,N/A,270431127.0
OKX,"Infrastructure, Wallets, Gnosis Chain Ecosystem, Ethereum Ecosystem",safe,235125739,424693518.0,104374.7966743973,108506.83282809271,0.02,13120443.0
OKX,"Decentralized Finance (DeFi), Liquid Staking Tokens, Base Ecosystem, Liquid Staked ETH, Liquid Staking",super-oeth,234293178,234293178.0,,,N/A,59461.0
OKX,"Smart Contract Platform, Proof of Stake (PoS), Made in China",qtum,231613384,236573192.0,62917.3053637017,87329.54114280472,0.09,16762198.0
OKX,"Decentralized Exchange (DEX), Exchange-based Tokens, Decentralized Finance (DeFi), Derivatives, Perpetuals, Ethereum Ecosystem, Paradigm Portfolio",dydx,231220463,231220463.0,,,N/A,11242375.0
OKX,"Smart Contract Platform, Interoperability, Layer 2 (L2), Rollup, Multicoin Capital Portfolio, Proof of Work (PoW), DragonFly Capital Portfolio, Sequoia Capital Portfolio, Blockchain Capital Portfolio, Polychain Capital Portfolio, Made in China",nervos-network,228830688,232444602.0,,,N/A,10615943.0
OKX,"Solana Ecosystem, Avalanche Ecosystem, Polygon Ecosystem, Near Protocol Ecosystem, Harmony Ecosystem, Ethereum Ecosystem, Pantera Capital Portfolio, Energi Ecosystem, Made in USA",basic-attention-token,224877774,225529048.0,12650.129673460782,21926.670784234673,0.07,15175009.0
OKX,"Analytics, Avalanche Ecosystem, Meme, Cat-Themed, Made in USA",ket,222415707,222415707.0,,,N/A,5128872.0
OKX,"Layer 1 (L1), VeChain Ecosystem",vethor-token,218706339,218813901.0,,,N/A,3517709.0
OKX,"Artificial Intelligence (AI), Solana Ecosystem, Meme, Solana Meme, AI Meme, AI Agents, Binance Alpha Spotlight, AI Framework, Made in USA",ai16z,218442040,218442040.0,,,N/A,39670474.0
OKX,"BNB Chain Ecosystem, Polygon Ecosystem, Ethereum Ecosystem, Animoca Brands Portfolio, DWF Labs Portfolio, Alameda Research Portfolio, Energi Ecosystem, Binance Labs Portfolio",mask-network,217600590,217600590.0,94476.22887670844,131173.6710257024,0.05,20775437.0
OKX,"Smart Contract Platform, BNB Chain Ecosystem, Layer 1 (L1), Proof of Stake (PoS), Pantera Capital Portfolio, Andreessen Horowitz (a16z) Portfolio, Binance Labs Portfolio, Blockchain Capital Portfolio, Privacy Blockchain, Polychain Capital Portfolio, Coinbase 50 Index",oasis-network,217534357,323240645.0,,,N/A,8780379.0
OKX,"Decentralized Exchange (DEX), Decentralized Finance (DeFi), Automated Market Maker (AMM), Cosmos Ecosystem, Osmosis Ecosystem, Paradigm Portfolio, Evmos Ecosystem, Secret Ecosystem, GMCI DeFi Index, GMCI Index",osmosis,217072244,302413267.0,,,N/A,16155305.0
OKX,"Decentralized Exchange (DEX), Decentralized Finance (DeFi), Avalanche Ecosystem, Harmony Ecosystem, Ethereum Ecosystem, Coinbase Ventures Portfolio, Pantera Capital Portfolio, Energi Ecosystem, GMCI DeFi Index, Blockchain Capital Portfolio, GMCI Index, Made in USA",0x,216955182,255723787.0,23715.48151137088,39285.28776211527,0.12,22522739.0
OKX,"Artificial Intelligence (AI), Harmony Ecosystem, Arbitrum Ecosystem, Ethereum Ecosystem, DePIN, Coinbase Ventures Portfolio, Multicoin Capital Portfolio, Pantera Capital Portfolio, GMCI DePIN Index, GMCI Index, Coinbase 50 Index",livepeer,216140476,216140476.0,44756.04203044419,77481.29317938424,0.05,15547456.0
OKX,"Gaming (GameFi), NFT, Collectibles, Polygon Ecosystem, Ethereum Ecosystem, Animoca Brands Portfolio, Gaming Blockchains, Made in USA",superfarm,213316747,472257631.0,,,N/A,18964136.0
OKX,"Smart Contract Platform, Gaming (GameFi), Ethereum Ecosystem, Base Ecosystem, Card Games, Paradigm Portfolio, Gaming Blockchains, Gaming Utility Token",echelon-prime,213095996,420744629.0,,,N/A,4074802.0
OKX,"Decentralized Finance (DeFi), Aptos Ecosystem",abtc,211947685,211947685.0,,,N/A,125415.0
OKX,"Gaming (GameFi), BNB Chain Ecosystem, Solana Ecosystem, Meme, Ethereum Ecosystem, Dog-Themed, Solana Meme, Gaming Utility Token",baby-doge-coin,209692164,532264004.0,61833.109183082925,57956.482856072944,0.16,10628846.0
OKX,"Decentralized Exchange (DEX), BNB Chain Ecosystem, Solana Ecosystem, Ethereum Ecosystem, Real World Assets (RWA), Base Ecosystem, RWA Protocol",chex-token,209164298,209164298.0,,,N/A,1205995.0
OKX,"Liquid Staking Tokens, Ethereum Ecosystem, Base Ecosystem, Liquid Staked ETH, Liquid Staking",liquid-staked-ethereum,207687113,207687113.0,,,N/A,35842.0
OKX,"Stablecoins, USD Stablecoin, Arbitrum Ecosystem, Ethereum Ecosystem, Base Ecosystem, Crypto-backed Stablecoin, Fiat-backed Stablecoin",gho,205341218,205341218.0,,,N/A,5559395.0
OKX,"Decentralized Finance (DeFi), Yield Farming, BNB Chain Ecosystem, Avalanche Ecosystem, Polygon Ecosystem, Fantom Ecosystem, Arbitrum Ecosystem, Ethereum Ecosystem, Optimism Ecosystem, Linea Ecosystem, Bridge Governance Tokens, Base Ecosystem, FTX Holdings",stargate-finance,204633206,210643989.0,,,N/A,9189513.0
OKX,"Smart Contract Platform, Storage, Harmony Ecosystem, Ethereum Ecosystem, DePIN, Energi Ecosystem, Sora Ecosystem, GMCI DePIN Index, GMCI Index",holotoken,204302891,204302891.0,,,N/A,8955802.0
OKX,"Artificial Intelligence (AI), Polkadot Ecosystem, Metaverse, Ethereum Ecosystem, Interoperability, Real World Assets (RWA), DePIN, Decentralized Science (DeSci), AI Agents",origintrail,204111374,204399564.0,,,N/A,4721859.0
OKX,"BNB Chain Ecosystem, Meme",cheems-token,202001674,202001674.0,,,N/A,5376952.0
OKX,"Smart Contract Platform, Layer 1 (L1), DePIN, Andreessen Horowitz (a16z) Portfolio, Made in USA",chia,201408669,457535675.0,35708.48064262277,53267.50750284336,0.15,4157505.0
OKX,"Stablecoins, Ethereum Ecosystem",usda-2,201383967,201383967.0,,,N/A,661241.0
OKX,"Solana Ecosystem, Meme, Solana Meme, Pump.fun Ecosystem, Zoo-Themed, Memorial Themed",peanut-the-squirrel,200689407,200689407.0,173157.98187574532,272228.8619080269,0.05,229055567.0
OKX,"Solana Ecosystem, Meme, Dog-Themed, Solana Meme, Bitcoin Ecosystem, Runes",dog-go-to-the-moon-rune,200399368,200399368.0,,,N/A,5493531.0
OKX,"Artificial Intelligence (AI), Exchange-based Tokens, Analytics, Derivatives, Perpetuals, Centralized Exchange (CEX) Token, Ethereum Ecosystem, Binance Launchpad, Coinbase Ventures Portfolio, Binance Labs Portfolio, Made in USA",arkham,197310942,533712309.0,145179.8315515725,179472.67083247,0.02,44174548.0
OKX,"Decentralized Finance (DeFi), Polygon Ecosystem, Ethereum Ecosystem, Coinbase Ventures Portfolio, Pantera Capital Portfolio",instadapp,197181015,499992389.0,,,N/A,915239.0
OKX,"Smart Contract Platform, Layer 1 (L1), Celo Ecosystem, DWF Labs Portfolio, Coinbase Ventures Portfolio, Proof of Stake (PoS), Andreessen Horowitz (a16z) Portfolio, Optimism Superchain Ecosystem, Outlier Ventures Portfolio, Made in USA",celo,195475170,345809707.0,44651.72277824656,77259.29283238578,0.03,11222803.0
OKX,"Smart Contract Platform, Privacy, Layer 1 (L1), Proof of Stake (PoS), Proof of Work (PoW), Blockchain Capital Portfolio, Made in USA",decred,195461809,195463763.0,,,N/A,1814912.0
OKX,"Solana Ecosystem, Meme, Solana Meme, Cat-Themed, Murad Picks",popcat,194449218,194449218.0,,,N/A,56018255.0
OKX,"Solana Ecosystem, BRC-20, Bitcoin Ecosystem, Inscriptions",ordinals,194227382,194227382.0,204051.4661292618,244850.27546509868,0.02,67855381.0
OKX,"Infrastructure, Smart Contract Platform, NEO Ecosystem",gas,192525448,192525448.0,23724.37214024898,27187.36060454612,0.07,4110193.0
OKX,"Infrastructure, Smart Contract Platform, Venom Ecosystem",venom,192225712,695004369.0,1034.9841195952833,9269.235999824905,0.03,700553.0
OKX,"Gambling (GambleFi), Gaming (GameFi), Ethereum Ecosystem",rollbit-coin,187871280,187871280.0,,,N/A,616103.0
OKX,"Exchange-based Tokens, Ethereum Ecosystem",btse-token,187249050,231083939.0,,,N/A,3244857.0
OKX,"Meme, Cronos Ecosystem, AI Meme, Cronos zkEVM Ecosystem",agentfun-ai,186875000,186875000.0,,,N/A,4266.34
OKX,"Gaming (GameFi), Ethereum Ecosystem, Decentralized Identifier (DID), Animoca Brands Portfolio, OKX Ventures Portfolio, Outlier Ventures Portfolio",mocaverse,186549587,867885026.0,,,N/A,16207377.0
OKX,"Infrastructure, Smart Contract Platform, BNB Chain Ecosystem, Layer 1 (L1), Ethereum Ecosystem, GMCI Layer 1 Index, Aelf Ecosystem, GMCI Index",aelf,185817144,250480567.0,18127.931185224963,28470.73008801466,0.08,11552220.0
OKX,"Smart Contract Platform, Real World Assets (RWA), Proof of Work (PoW), Made in USA",ravencoin,185775629,185806305.0,20575.059132661503,37128.731416813855,0.08,6620459.0
OKX,"Smart Contract Platform, Privacy, Proof of Work (PoW)",mimblewimblecoin,185611494,185611661.0,,,N/A,3228.99
OKX,"Crypto-Backed Tokens, Decentralized Finance (DeFi), Wrapped-Tokens, Ethereum Ecosystem",resolv-wstusr,184744046,165242307.0,,,N/A,162.11
OKX,"Smart Contract Platform, Storage, DePIN, Paradigm Portfolio, Proof of Work (PoW), DragonFly Capital Portfolio, Made in USA",siacoin,183790214,196427388.0,4684.508704689986,11330.209859877697,0.09,12925092.0
OKX,"Solana Ecosystem, Meme, Solana Meme, AI Meme, Pump.fun Ecosystem",act-i-the-ai-prophecy,183116739,183116739.0,109320.73446197822,110955.85500781346,0.05,27926386.0
OKX,"Decentralized Finance (DeFi), BNB Chain Ecosystem, Polygon Ecosystem, Fantom Ecosystem, Arbitrum Ecosystem, Moonbeam Ecosystem, Liquid Staking Tokens, Ethereum Ecosystem, Optimism Ecosystem, Liquid Staked ETH, Liquid Staking",staked-frax-ether,182269416,182269416.0,,,N/A,28930.0
OKX,"BNB Chain Ecosystem, Avalanche Ecosystem, Polygon Ecosystem, Fantom Ecosystem, Arbitrum Ecosystem, Ethereum Ecosystem, Optimism Ecosystem, Liquid Staking Governance Tokens, Linea Ecosystem, DePIN, Scroll Ecosystem, Rollups-as-a-Service (RaaS), Blast Ecosystem, Mode Ecosystem, Pantera Capital Portfolio, Polygon zkEVM Ecosystem, Binance Labs Portfolio, Liquid Staking, Made in USA",ankr,180856866,180856866.0,,,N/A,11648551.0
OKX,"Tourism, BNB Chain Ecosystem",trip,180301628,598968119.0,,,N/A,41702.0
OKX,"Solana Ecosystem, Ethereum Ecosystem, Energi Ecosystem",swissborg,180186276,180186276.0,,,N/A,6975117.0
OKX,"Meme, Ethereum Ecosystem, Base Ecosystem, Cat-Themed, Murad Picks",mog-coin,178277958,178277958.0,,,N/A,10607558.0
OKX,"Solana Ecosystem, Meme, Cat-Themed",meow,177693666,177693666.0,,,N/A,288512.0
OKX,"Tokenized Real Estate, Tokenized Assets, Ethereum Ecosystem, Real World Assets (RWA), RWA Protocol",apf-coin,177084241,260007062.0,,,N/A,2988621.0
OKX,,nem,176876132,176876132.0,,,N/A,18844365.0
OKX,"Artificial Intelligence (AI), Smart Contract Platform, Layer 1 (L1), Paradigm Portfolio, Coinbase Ventures Portfolio, DeFiance Capital Portfolio, Polychain Capital Portfolio, Vana Ecosystem",vana,176861756,689071776.0,,,N/A,23730464.0
OKX,"Avalanche Ecosystem, Liquid Staking Tokens, Liquid Staking",benqi-liquid-staked-avax,173146208,173146208.0,,,N/A,2698941.0
OKX,"Decentralized Finance (DeFi), Launchpad, Ethereum Ecosystem, DWF Labs Portfolio, Coinbase Ventures Portfolio, Pantera Capital Portfolio, Blockchain Capital Portfolio",auction,172781427,200326959.0,55162.76491404473,224635.27117381897,0.05,187526193.0
OKX,"Decentralized Finance (DeFi), Yield Farming, Yield Aggregator, Yearn Ecosystem, Avalanche Ecosystem, Polygon Ecosystem, Near Protocol Ecosystem, Gnosis Chain Ecosystem, Fantom Ecosystem, Harmony Ecosystem, Arbitrum Ecosystem, Ethereum Ecosystem, Optimism Ecosystem, Base Ecosystem, Index Coop Defi Index, Alameda Research Portfolio, Energi Ecosystem, Sora Ecosystem, Huobi ECO Chain Ecosystem, Blockchain Capital Portfolio, Index Coop Index",yearn-finance,172778498,187708422.0,74159.05143270356,34528.98442804624,0.06,20849360.0
OKX,"Gaming (GameFi), BNB Chain Ecosystem, Ethereum Ecosystem, TON Ecosystem",gmt-token,172702631,172702631.0,,,N/A,14982841.0
OKX,"Solana Ecosystem, Meme, Dog-Themed, Solana Meme, Cat-Themed",cat-in-a-dogs-world,172081024,172081024.0,61901.436314996536,86578.61324102765,0.1,7822585.0
OKX,"Starknet Ecosystem, Bridged-Tokens",bridged-wrapped-ether-starkgate,171780551,171780551.0,,,N/A,893773.0
OKX,"Internet of Things (IOT), Ethereum Ecosystem, DePIN, Base Ecosystem, Account Abstraction, GMCI DePIN Index, GMCI Index, Made in USA",iotex,170245557,170245557.0,,,N/A,10090382.0
OKX,"Decentralized Exchange (DEX), Decentralized Finance (DeFi), Yield Farming, Automated Market Maker (AMM), BNB Chain Ecosystem, Seigniorage, Solana Ecosystem, Avalanche Ecosystem, Polygon Ecosystem, Fantom Ecosystem, Harmony Ecosystem, Arbitrum Ecosystem, Moonriver Ecosystem, Ethereum Ecosystem, Liquid Staking Governance Tokens, Curve Ecosystem, Stablecoin Protocol, Polygon zkEVM Ecosystem, Evmos Ecosystem, Fraxtal Ecosystem, GMCI DeFi Index, Liquid Staking, GMCI Index, Made in USA",frax-share,170122676,192198127.0,11377.46357131653,30558.52065799901,0.11,51146451.0
OKX,"Decentralized Finance (DeFi), Derivatives, Perpetuals, Avalanche Ecosystem, Arbitrum Ecosystem",gmx,170067619,170067619.0,17397.75421977539,33759.02059340573,0.06,54264936.0
OKX,"Launchpad, Meme, Base Ecosystem, Cat-Themed, Base Meme",toshi,168876198,168876198.0,,,N/A,21552864.0
OKX,Arbitrum Ecosystem,rcge,168805259,168805259.0,,,N/A,2.43
OKX,"Entertainment, Smart Contract Platform, Gaming (GameFi), NFT, Metaverse, Layer 1 (L1), Harmony Ecosystem, Ethereum Ecosystem, Gaming Blockchains, Energi Ecosystem",enjincoin,167170029,172955220.0,8489.719140836121,28919.86606280591,0.11,12813889.0
OKX,"Decentralized Finance (DeFi), Solana Ecosystem, Ethereum Ecosystem, Optimism Ecosystem, Base Ecosystem, Cross-chain Communication, BTCfi",threshold-network-token,166468774,183383996.0,19032.91698648582,15627.41910857416,0.12,12699097.0
OKX,"Decentralized Finance (DeFi), Derivatives, Prediction Markets, Solana Ecosystem",drift-protocol,165513939,573703795.0,,,N/A,94606053.0
OKX,"Decentralized Finance (DeFi), Liquid Staking Tokens, Ethereum Ecosystem, Liquid Staked ETH, Liquid Staking",treehouse-eth,164849810,164849810.0,,,N/A,126336.0
OKX,"Decentralized Finance (DeFi), Binance Launchpool, Arbitrum Ecosystem, Ethereum Ecosystem, Restaking, Liquid Restaking Governance Tokens, Ether.fi Ecosystem, Consensys Portfolio, OKX Ventures Portfolio",ether-fi,164734878,711087183.0,371495.5575964881,225320.3800311995,0.01,44955592.0
OKX,"Decentralized Finance (DeFi), Ethereum Ecosystem, Stablecoin Protocol",tribe-2,163170229,358603648.0,,,N/A,57426.0
OKX,"Decentralized Finance (DeFi), Yield Farming, Yield Aggregator, Ethereum Ecosystem, Metagovernance, Curve Ecosystem, Yield Optimizer",convex-finance,162195314,197533853.0,6650.527269350436,30226.557450631703,0.1,10442109.0
OKX,"Decentralized Exchange (DEX), Exchange-based Tokens, Ethereum Ecosystem",coinex-token,162145992,162145992.0,,,N/A,90141.0
OKX,"BNB Chain Ecosystem, Binance Alpha Spotlight",bnb48-club-token,161966844,161966844.0,,,N/A,150438.0
OKX,"Decentralized Exchange (DEX), Exchange-based Tokens, Decentralized Finance (DeFi), Automated Market Maker (AMM), BNB Chain Ecosystem, Derivatives, Perpetuals, Centralized Exchange (CEX) Token, Solana Ecosystem, Avalanche Ecosystem, Polygon Ecosystem, Near Protocol Ecosystem, Fantom Ecosystem, Arbitrum Ecosystem, Ethereum Ecosystem, ZkSync Ecosystem, Mantle Ecosystem, Linea Ecosystem, Base Ecosystem, DragonFly Capital Portfolio, Binance Labs Portfolio",woo-network,160996129,191737458.0,20686.02546854691,33272.82654360236,0.12,9574156.0
OKX,"Smart Contract Platform, BNB Chain Ecosystem, Layer 1 (L1), Ethereum Ecosystem, ZetaChain Ecosystem, Cross-chain Communication, Made in USA",zetachain,160987120,462071861.0,145859.29012780785,223862.41960797046,0.05,9635404.0
OKX,"Meme, Ethereum Ecosystem, Frog-Themed, AI Meme",turbo,160960790,160960790.0,60533.54144531359,139798.42684167903,0.04,32241492.0
OKX,"Smart Contract Platform, Layer 1 (L1), Proof of Stake (PoS), GMCI Layer 1 Index, GMCI Index, Made in USA",casper-network,160200844,165860239.0,78546.11403470165,100403.75863189678,0.06,14921620.0
OKX,"Solana Ecosystem, DePIN, Multicoin Capital Portfolio, Made in USA",hivemapper,159645822,248302280.0,,,N/A,1750959.0
OKX,"Decentralized Finance (DeFi), Tron Ecosystem",sun-token,159423769,322747051.0,,,N/A,23398788.0
OKX,"Smart Contract Platform, Gaming (GameFi), Layer 1 (L1), Ethereum Ecosystem, Modular Blockchain, Account Abstraction, Multicoin Capital Portfolio, Gaming Blockchains, Gaming Utility Token, Skale Ecosystem, Consensys Portfolio, Galaxy Digital Portfolio, Made in USA",skale,158415767,166647983.0,28844.979545214796,38565.91530248995,0.14,12898869.0
OKX,"Internet of Things (IOT), Oracle, NFT, Metaverse, Ethereum Ecosystem, DePIN, Alleged SEC Securities, Made in USA",xyo-network,157897254,157897254.0,,,N/A,5922391.0
OKX,"SocialFi, Arbitrum Ecosystem",uxlink,157812696,466625358.0,63032.91339242728,90533.37396755736,0.04,12990125.0
OKX,"Smart Contract Platform, EthereumPoW Ecosystem, Proof of Work (PoW)",ethereum-pow-iou,153983737,153983737.0,25761.75806121066,31016.797145804718,0.07,5703095.0
OKX,"Gaming (GameFi), NFT, Solana Ecosystem, Animoca Brands Portfolio, FTX Holdings, Multicoin Capital Portfolio, Alameda Research Portfolio",metaplex,153221402,196340716.0,,,N/A,6380524.0
OKX,"Stablecoins, Ethereum Ecosystem, Crypto-backed Stablecoin",elixir-staked-deusd,152506850,152506850.0,,,N/A,193398.0
OKX,Smart Contract Platform,bitkub-coin,152168802,188391314.0,,,N/A,323032.0
