OKX,"Polygon Ecosystem, XRP Ledger Ecosystem",crypto-trading-fund,84866871,84866871.0,,,N/A,6595.3
OKX,"SocialFi, Coinbase Ventures Portfolio, Pantera Capital Portfolio, Andreessen Horowitz (a16z) Portfolio, Sequoia Capital Portfolio",deso,84854854,87080418.0,,,N/A,2467692.0
OKX,"Smart Contract Platform, Layer 2 (L2), eGirl Capital Portfolio, Paradigm Portfolio, Blast Ecosystem",blast,84770823,319842832.0,,,N/A,5186117.0
OKX,"Exchange-based Tokens, Centralized Exchange (CEX) Token, Ethereum Ecosystem",hashkey-ecopoints,84745879,639591538.0,,,N/A,2201862.0
OKX,"NFT, Solana Ecosystem, NFT Marketplace",tensor,84722977,253201268.0,143464.96724926188,171376.5139123411,0.08,14122163.0
OKX,"Smart Contract Platform, Gaming (GameFi), NFT, Layer 1 (L1), Play To Earn, Ethereum Ecosystem, Animoca Brands Portfolio, Gaming Blockchains, Pantera Capital Portfolio, OKX Ventures Portfolio",wax,84451384,90867091.0,9710.446161683993,17292.483130163186,0.08,5208830.0
OKX,"Meme, Ethereum Ecosystem, PolitiFi",constitutiondao,83602955,83602955.0,156987.4416658996,206493.41053433996,0.06,17533061.0
OKX,"Gaming (GameFi), NFT, BNB Chain Ecosystem, Metaverse, Collectibles, Polygon Ecosystem, Play To Earn, Harmony Ecosystem, Guild and Scholarship, Ethereum Ecosystem, Animoca Brands Portfolio, Base Ecosystem, DWF Labs Portfolio, Ronin Ecosystem, Gaming Governance Token, Andreessen Horowitz (a16z) Portfolio, Delphi Ventures Portfolio",yield-guild-games,83244309,202780956.0,35431.242769640805,74609.98237036783,0.1,12161672.0
OKX,"Solana Ecosystem, Polygon Ecosystem, DePIN, Pantera Capital Portfolio",geodnet,82917411,258633404.0,,,N/A,325825.0
OKX,Ethereum Ecosystem,dkargo,82666323,88193090.0,,,N/A,1026904.0
OKX,"Artificial Intelligence (AI), BNB Chain Ecosystem, Ethereum Ecosystem, DragonFly Capital Portfolio, Binance Labs Portfolio, Delphi Ventures Portfolio, OKX Ventures Portfolio, Binance HODLer Airdrops, AI Agent Launchpad, Binance Alpha Spotlight, AI Framework",myshell,82479441,305479410.0,,,N/A,71329256.0
OKX,"Decentralized Exchange (DEX), Decentralized Finance (DeFi), Yield Farming, Automated Market Maker (AMM), Solana Ecosystem, Coinbase Ventures Portfolio, DeFiance Capital Portfolio, Made in USA",orca,82410766,154684846.0,,,N/A,15175483.0
OKX,"Smart Contract Platform, Privacy, Proof of Work (PoW), Made in USA",verge,82179330,82343713.0,,,N/A,5271252.0
OKX,"Smart Contract Platform, Cosmos Ecosystem, Modular Blockchain, Osmosis Ecosystem, Rollups-as-a-Service (RaaS)",dymension,82114652,325954857.0,,,N/A,8013758.0
OKX,"Internet of Things (IOT), BNB Chain Ecosystem, Ethereum Ecosystem, DePIN, DWF Labs Portfolio",mass-vehicle-ledger,81945798,86618987.0,,,N/A,617272.0
OKX,"NFT, Ethereum Ecosystem",superrare,81489431,101814581.0,,,N/A,146891962.0
OKX,"Decentralized Finance (DeFi), BNB Chain Ecosystem, Arbitrum Ecosystem, Ethereum Ecosystem, Multicoin Capital Portfolio, Energi Ecosystem",dforce-token,81389301,81389301.0,,,N/A,9792885.0
OKX,"Gaming (GameFi), Play To Earn, Guild and Scholarship, Ethereum Ecosystem, Animoca Brands Portfolio, Base Ecosystem, DWF Labs Portfolio, Ronin Ecosystem, Coinbase Ventures Portfolio, DeFiance Capital Portfolio, Pantera Capital Portfolio, Binance Labs Portfolio, MMO",zentry,81118149,119085235.0,50953.75567919501,74641.03468462547,0.16,5888645.0
OKX,"Berachain Ecosystem, Bridged USDT, Bridged-Tokens, Ink Ecosystem, Bridged Stablecoins",usdt0,80813842,80813842.0,,,N/A,245572.0
OKX,"Artificial Intelligence (AI), BNB Chain Ecosystem, Solana Ecosystem, Ethereum Ecosystem, AI Agents, Alameda Research Portfolio",delysium,80210846,153013593.0,,,N/A,1969814.0
OKX,"Blast Ecosystem, Bridged WETH, Bridged-Tokens",l2-standard-bridged-weth-blast,80099360,80099360.0,,,N/A,150753.0
OKX,"NFT, Polygon Ecosystem",sathosi-airlines-token,79857918,381391562.0,,,N/A,3460.88
OKX,"Exchange-based Tokens, Centralized Exchange (CEX) Token, Ethereum Ecosystem",bitmart-token,79375515,149534061.0,,,N/A,4262869.0
OKX,"Stablecoins, USD Stablecoin, Solana Ecosystem, Ethereum Ecosystem, Multicoin Capital Portfolio, Fiat-backed Stablecoin",paxos-standard,79272161,79272161.0,,,N/A,1763305.0
OKX,"Stablecoins, Decentralized Finance (DeFi), Lending/Borrowing Protocols, Ethereum Ecosystem",syrupusdc,79259117,79259117.0,,,N/A,115597.0
OKX,"Artificial Intelligence (AI), Smart Contract Platform, Decentralized Finance (DeFi), Analytics, NFT, BNB Chain Ecosystem, Launchpad, Ethereum Ecosystem, Telegram Apps, Discord Bots, ChainGPT Launchpad, Poolz Finance Launchpad, AI Agents, AI Applications, Binance Alpha Spotlight, AI Framework, DeFAI",chaingpt,79256405,98400106.0,,,N/A,21578768.0
OKX,"Software as a service, Polygon Ecosystem, Ethereum Ecosystem, Decentralized Identifier (DID), Pantera Capital Portfolio, Energi Ecosystem, Blockchain Capital Portfolio",civic,78863666,98333746.0,12904.649114382342,37041.14607793559,0.05,7193389.0
OKX,"Smart Contract Platform, Proof of Stake (PoS)",stratis,78719359,86733884.0,,,N/A,1126785.0
OKX,BNB Chain Ecosystem,bitdca,78636401,84461754.0,,,N/A,35346.0
OKX,"Smart Contract Platform, Layer 1 (L1), Osmosis Ecosystem, XRP Ledger Ecosystem",coreum,78560804,78560804.0,,,N/A,129320.0
OKX,"Ethereum Ecosystem, Stablecoin Protocol",level-usd,78181931,78181931.0,,,N/A,844575.0
OKX,"Decentralized Finance (DeFi), Wallets, Ethereum Ecosystem, Pundi AIFX Omnilayer Ecosystem",pundi-x-2,78157160,78157160.0,,,N/A,5789149.0
OKX,"Smart Contract Platform, Polkadot Ecosystem, Layer 1 (L1), DePIN, Outlier Ventures Portfolio",peaq-2,77842297,458118023.0,,,N/A,7956053.0
OKX,"Artificial Intelligence (AI), Infrastructure, Ethereum Ecosystem, AI Framework, Made in USA",arcblock,77590056,146396332.0,,,N/A,1099246.0
OKX,Smart Contract Platform,songbird,77569069,92164456.0,,,N/A,254645.0
OKX,"Business Services, Decentralized Finance (DeFi), Oracle, Polygon Ecosystem, Gnosis Chain Ecosystem, Arbitrum Ecosystem, Ethereum Ecosystem, Optimism Ecosystem, Manta Network Ecosystem, Binance Labs Portfolio, Lisk Ecosystem, Made in USA",tellor,77558239,79814966.0,54759.24612087617,57147.80590384257,0.03,21577586.0
OKX,"Optimism Ecosystem, Bridged WBTC, Bridged-Tokens",optimism-bridged-wbtc-optimism,77157414,77157414.0,,,N/A,1071265.0
OKX,"Exchange-based Tokens, Centralized Exchange (CEX) Token, Near Protocol Ecosystem, Harmony Ecosystem, Ethereum Ecosystem, Multicoin Capital Portfolio, Alameda Research Portfolio, Elastos Smart Contract Chain Ecosystem, Sequoia Capital Portfolio, Made in China",huobi-token,76372980,96324983.0,,,N/A,18956.18
OKX,"Decentralized Finance (DeFi), Liquid Staking Tokens, Ethereum Ecosystem, LSDFi, Liquid Staked ETH, Liquid Staking",origin-ether,76121109,76121109.0,,,N/A,18973.94
OKX,"Meme, Dog-Themed, TON Ecosystem, TON Meme",dogs-2,76058936,80952907.0,49878.6851561259,96454.90462563964,0.07,33348042.0
OKX,"Arbitrum Ecosystem, Bridge Governance Tokens, Base Ecosystem, Cross-chain Communication, OKX Ventures Portfolio",orbiter-finance,75836235,244633018.0,,,N/A,59836812.0
OKX,"Stablecoins, USD Stablecoin, Seigniorage, Alleged SEC Securities, Osmosis Ecosystem, Stablecoin Protocol, DeFiance Capital Portfolio, Terra Classic Ecosystem, Binance Labs Portfolio, Delphi Ventures Portfolio, Galaxy Digital Portfolio, Fiat-backed Stablecoin",terrausd,75818630,107417098.0,39498.58200016089,62891.1307975727,0.15,10901803.0
OKX,"Base Ecosystem, Cybersecurity, Binance Labs Portfolio, OKX Ventures Portfolio, Binance Alpha Spotlight",goplus-security,75692946,417408989.0,,,N/A,73288763.0
OKX,"BNB Chain Ecosystem, Solana Ecosystem, Polygon Ecosystem, Meme, Ethereum Ecosystem, Cronos Ecosystem, Dog-Themed, Elon Musk-Inspired, Fuse Ecosystem",dogelon-mars,75512106,137382170.0,7607.5700796724595,9724.435664800521,0.15,3464429.0
OKX,"Stablecoins, USD Stablecoin, Osmosis Ecosystem, Fiat-backed Stablecoin",usdx,75147716,75147716.0,,,N/A,11535.38
OKX,"Smart Contract Platform, Gaming (GameFi), Layer 1 (L1), Proof of Stake (PoS), Gaming Blockchains",oasys,74966604,194052919.0,1152.9932623464792,3467.6633163903784,0.26,539732.0
OKX,"Sports, BNB Chain Ecosystem",pixer-eternity,74916434,348143777.0,,,N/A,683982.0
OKX,"Smart Contract Platform, Wallets, Layer 2 (L2), Osmosis Ecosystem",islamic-coin,74825709,902640474.0,,,N/A,737924.0
OKX,"Artificial Intelligence (AI), Decentralized Finance (DeFi), Ethereum Ecosystem, DePIN",pinlink,74554877,93193596.0,,,N/A,1929615.0
OKX,"Optimism Ecosystem, Bridged WETH, Bridged-Tokens",l2-standard-bridged-weth-optimism,74320119,74320119.0,,,N/A,19613639.0
OKX,"Artificial Intelligence (AI), Smart Contract Platform, Layer 1 (L1), Ethereum Ecosystem, Osmosis Ecosystem, AI Agents, AI Agent Launchpad",humans-ai,74044374,74044374.0,,,N/A,511566.0
OKX,"Decentralized Finance (DeFi), Lending/Borrowing Protocols, Moonbeam Ecosystem, Base Ecosystem, Coinbase Ventures Portfolio, Made in USA",moonwell-artemis,73941267,112731680.0,,,N/A,7913531.0
OKX,"Smart Contract Platform, Gaming (GameFi), NFT, Binance Launchpool, Arbitrum Ecosystem, Layer 3 (L3), XAI Ecosystem, Gaming Blockchains, Outlier Ventures Portfolio",xai-blockchain,73709749,108627610.0,,,N/A,25882449.0
OKX,Retail,milk-alliance,73531519,164407507.0,,,N/A,2407562.0
OKX,"Decentralized Finance (DeFi), Solana Ecosystem, Real World Assets (RWA), Payment Solutions, DePIN, Coinbase Ventures Portfolio, Alameda Research Portfolio, Circle Ventures Portfolio, OKX Ventures Portfolio, RWA Protocol, Made in USA",zebec-network,73365119,99009766.0,14370.374025303152,14544.488212303266,0.06,28573356.0
OKX,"Gaming (GameFi), Play To Earn, TON Ecosystem, Tap to Earn, Arcade Games",watcoin-2,73261346,81333291.0,,,N/A,844608.0
OKX,"Meme, Ethereum Ecosystem, Mantle Ecosystem",puff-the-dragon,72949151,72949151.0,,,N/A,19802.37
OKX,"Decentralized Finance (DeFi), Oracle, Ethereum Ecosystem, DWF Labs Portfolio, Pantera Capital Portfolio",api3,72931489,91015316.0,25924.09775599852,20253.481089660407,0.05,14005414.0
OKX,"Ethereum Ecosystem, DePIN",dent,72773990,76079683.0,,,N/A,5122382.0
OKX,"Gaming (GameFi), NFT, Ethereum Ecosystem",undeads-games,72730227,253014971.0,,,N/A,429259.0
OKX,"Decentralized Exchange (DEX), Decentralized Finance (DeFi), Yield Farming, Automated Market Maker (AMM), BNB Chain Ecosystem, Avalanche Ecosystem, Arbitrum Ecosystem, Mantle Ecosystem, DeFiance Capital Portfolio, Delphi Ventures Portfolio, Dex Aggregator",joe,72708436,93111747.0,27545.106127604104,20428.819582135813,0.16,4945046.0
OKX,"Entertainment, Gaming (GameFi), NFT, Axie Infinity Ecosystem, Play To Earn, Ethereum Ecosystem, Ronin Ecosystem, Gaming Utility Token",smooth-love-potion,72699199,72699199.0,12966.13656850167,21361.142008348335,0.11,8008626.0
OKX,"Decentralized Exchange (DEX), Exchange-based Tokens, Decentralized Finance (DeFi), BNB Chain Ecosystem, Binance Launchpool, Polygon Ecosystem, Near Protocol Ecosystem, Arbitrum Ecosystem, Ethereum Ecosystem, DWF Labs Portfolio, Coinbase Ventures Portfolio, Alameda Research Portfolio, DeFiance Capital Portfolio, Pantera Capital Portfolio, Aurora Ecosystem, Energi Ecosystem, Binance Labs Portfolio, Galaxy Digital Portfolio",dodo,72652076,72652076.0,,,N/A,7802269.0
OKX,"Decentralized Finance (DeFi), Lending/Borrowing Protocols, Arbitrum Ecosystem, Ethereum Ecosystem, Alameda Research Portfolio, Pantera Capital Portfolio",liquity,71870620,73854814.0,8213.396292724741,31119.578288545672,0.03,10939569.0
OKX,"Artificial Intelligence (AI), Decentralized Finance (DeFi), Solana Ecosystem, Arbitrum Ecosystem, Metis Ecosystem, AI Agents, Sonic Ecosystem, IOTA EVM Ecosystem, AI Applications, DeFAI",heyanon,71680586,118051409.0,,,N/A,3005309.0
OKX,"Decentralized Finance (DeFi), Lending/Borrowing Protocols, Ethereum Ecosystem, Real World Assets (RWA), Coinbase Ventures Portfolio, Andreessen Horowitz (a16z) Portfolio, RWA Protocol, Made in USA",goldfinch,71511250,88455434.0,,,N/A,520824.0
OKX,"Artificial Intelligence (AI), Cardano Ecosystem, Ethereum Ecosystem, AI Agents, Sora Ecosystem",singularitynet,71511012,108075575.0,,,N/A,33857.0
OKX,"Artificial Intelligence (AI), Marketing, Analytics, BNB Chain Ecosystem, Ethereum Ecosystem, Animoca Brands Portfolio, Base Ecosystem, AI Agents, Binance Alpha Spotlight",cookie,70937162,157890084.0,,,N/A,18540193.0
OKX,"Decentralized Finance (DeFi), Ethereum Ecosystem, Binance Alpha Spotlight",avalon-2,70728787,435924723.0,,,N/A,18568470.0
OKX,"Stablecoins, Decentralized Finance (DeFi), USD Stablecoin, BNB Chain Ecosystem, Polygon Ecosystem, Gnosis Chain Ecosystem, Arbitrum Ecosystem, Ethereum Ecosystem, Optimism Ecosystem, Base Ecosystem, Crypto-backed Stablecoin, Fiat-backed Stablecoin",crvusd,70242512,70242512.0,,,N/A,3168502.0
OKX,"Artificial Intelligence (AI), Business Services, Decentralized Finance (DeFi), Ethereum Ecosystem, Paradigm Portfolio, DragonFly Capital Portfolio, Energi Ecosystem",numeraire,70063389,93807443.0,6860.240020732911,24074.098232532295,0.11,5975763.0
OKX,"Gaming (GameFi), NFT, Collectibles, Play To Earn, Ethereum Ecosystem, Base Ecosystem, Energi Ecosystem",ecomi,70039350,80361233.0,1859.7326537259048,3457.9841890691323,0.15,2052285.0
OKX,"Decentralized Finance (DeFi), Lending/Borrowing Protocols, Solana Ecosystem, Binance Alpha Spotlight",kamino,69780706,516894119.0,,,N/A,7596917.0
OKX,"Artificial Intelligence (AI), Ethereum Ecosystem",0x0-ai-ai-smart-contract,69720794,69720794.0,,,N/A,110487.0
OKX,"Tokenized Assets, Polygon Ecosystem, Arbitrum Ecosystem, Ethereum Ecosystem, Real World Assets (RWA), Starknet Ecosystem, Tokenized Treasury Bills (T-Bills)",spiko-us-t-bills-money-market-fund,69588146,69588146.0,,,N/A,0.0
OKX,"Lending/Borrowing Protocols, Solana Ecosystem, FTX Holdings, Coinbase Ventures Portfolio, Alameda Research Portfolio, DragonFly Capital Portfolio",solend,69360419,137087973.0,,,N/A,441.82
OKX,"Solana Ecosystem, Restaking, Liquid Restaking Tokens, Liquid Restaked SOL",renzo-restaked-sol,69098257,69098257.0,,,N/A,141972.0
OKX,"Smart Contract Platform, Ethereum Ecosystem, Layer 2 (L2), Zero Knowledge (ZK), Rollup, OKX Ventures Portfolio",taiko,69081086,653277084.0,,,N/A,12260725.0
OKX,"Artificial Intelligence (AI), Solana Ecosystem, DePIN",nosana,68524311,82163442.0,,,N/A,432489.0
OKX,"Decentralized Finance (DeFi), Ethereum Ecosystem",elixir-finance,68341480,428046038.0,,,N/A,47559013.0
OKX,"Stablecoins, Decentralized Finance (DeFi), USD Stablecoin, BNB Chain Ecosystem, Avalanche Ecosystem, Arbitrum Ecosystem, Liquid Staking Tokens, Ethereum Ecosystem, Optimism Ecosystem, Fiat-backed Stablecoin",staked-frax,68061117,68061117.0,,,N/A,36.12
OKX,"Decentralized Exchange (DEX), Decentralized Finance (DeFi), Sui Ecosystem, Animoca Brands Portfolio, OKX Ventures Portfolio, Dex Aggregator",cetus-protocol,68009923,99598838.0,50930.80876184216,48130.88684775485,0.05,10437923.0
OKX,"Smart Contract Platform, Layer 1 (L1), Proof of Work (PoW), Privacy Blockchain",ergo,67395923,82270541.0,,,N/A,63798.0
OKX,"Smart Contract Platform, Binance Launchpool, Layer 2 (L2), Scroll Ecosystem",scroll,67270409,354054787.0,67058.56878127625,87951.52699479087,0.06,12826963.0
OKX,"Solana Ecosystem, Wallets, Base Ecosystem, TON Ecosystem",bitget-wallet-token,67182897,470072637.0,,,N/A,3631.06
OKX,SocialFi,steem,66537645,66605169.0,,,N/A,9643030.0
OKX,"NFT, BNB Chain Ecosystem, Solana Ecosystem, Meme, Ethereum Ecosystem, Base Ecosystem, Hybrid Token Standards, Wojak-Themed",non-playable-coin,66204750,66204750.0,,,N/A,4519866.0
OKX,"Decentralized Finance (DeFi), BNB Chain Ecosystem, Solana Ecosystem, Wallets, Polygon Ecosystem, Ethereum Ecosystem, Binance Launchpad, DWF Labs Portfolio, Multicoin Capital Portfolio, Alameda Research Portfolio, Viction Ecosystem, Binance Labs Portfolio",coin98,66110591,73388273.0,,,N/A,16624558.0
OKX,E-commerce,pay-coin,66075736,122772140.0,,,N/A,4772171.0
OKX,Ethereum Ecosystem,saasgo,65976586,82470732.0,,,N/A,200530.0
OKX,"Smart Contract Platform, Layer 1 (L1), DWF Labs Portfolio, Radix Ecosystem",radix,65809172,80581480.0,,,N/A,1793561.0
OKX,"Decentralized Finance (DeFi), Lending/Borrowing Protocols, Ethereum Ecosystem, Real World Assets (RWA), Alameda Research Portfolio, Circle Ventures Portfolio, RWA Protocol",maple,65384704,165951909.0,,,N/A,2649706.0
OKX,"Polkadot Ecosystem, Real World Assets (RWA), Coinbase Ventures Portfolio, Circle Ventures Portfolio, Galaxy Digital Portfolio, RWA Protocol",centrifuge,65179521,71415456.0,2103.6931601219467,6016.259655730242,0.08,997792.0
OKX,"Healthcare, Osmosis Ecosystem",medibloc,64962590,70363483.0,,,N/A,303151.0
OKX,"Stablecoins, USD Stablecoin, Fiat-backed Stablecoin",falcon-finance,64662594,64662594.0,,,N/A,52139.0
OKX,"Smart Contract Platform, Layer 1 (L1), Ethereum Ecosystem, Proof of Stake (PoS)",pundi-aifx,64650857,64650857.0,,,N/A,58668.0
OKX,"Infrastructure, Smart Contract Platform, BNB Chain Ecosystem, Avalanche Ecosystem, Polygon Ecosystem, Arbitrum Ecosystem, Ethereum Ecosystem, Optimism Ecosystem, Layer 2 (L2), Base Ecosystem, Binance Launchpad, Modular Blockchain, Layer 3 (L3), Rollup, Proof of Stake (PoS), Appchains, Binance Labs Portfolio",cartesi,64240237,74746681.0,,,N/A,7154706.0
OKX,"Artificial Intelligence (AI), Launchpad, Base Ecosystem, AI Applications, Clanker Ecosystem, Binance Alpha Spotlight",tokenbot-2,64198294,64198294.0,,,N/A,5098606.0
OKX,Ethereum Ecosystem,devve,64135267,88067702.0,,,N/A,738925.0
OKX,"Artificial Intelligence (AI), BNB Chain Ecosystem, Ethereum Ecosystem, DePIN, AI Agents",netmind-token,64075338,203663896.0,,,N/A,1686809.0
OKX,,ark,63499681,64056375.0,,,N/A,4445179.0
OKX,"Smart Contract Platform, Layer 2 (L2), Made in USA",metal,63349613,63349613.0,,,N/A,672965.0
OKX,"BNB Chain Ecosystem, Meme, Binance Alpha Spotlight, Four.meme Ecosystem",test-3,62529095,62529095.0,,,N/A,60613408.0
OKX,"Decentralized Finance (DeFi), Ethereum Ecosystem, Liquid Staking",usualx,62409111,62409111.0,,,N/A,244508.0
OKX,"Artificial Intelligence (AI), Infrastructure, Gaming (GameFi), NFT, Solana Ecosystem, Arbitrum Ecosystem, Impossible Finance Launchpad, Ethereum Ecosystem, Animoca Brands Portfolio, Base Ecosystem",carv,61902179,309371421.0,,,N/A,4784369.0
OKX,"Infrastructure, Smart Contract Platform",ardor,61826612,61826612.0,,,N/A,5324358.0
OKX,"Smart Contract Platform, Osmosis Ecosystem, Alameda Research Portfolio, DragonFly Capital Portfolio, DeFiance Capital Portfolio, Privacy Blockchain, Outlier Ventures Portfolio",secret,61493048,64693059.0,,,N/A,3894935.0
OKX,"Exchange-based Tokens, BNB Chain Ecosystem, Centralized Exchange (CEX) Token, Polygon Ecosystem, Ethereum Ecosystem",bit2me,61483511,62104557.0,,,N/A,46409.0
OKX,"BNB Chain Ecosystem, Binance Megadrop, BTCfi",solv-protocol,61470765,348276291.0,,,N/A,41745845.0
OKX,"Artificial Intelligence (AI), Solana Ecosystem, Polygon Ecosystem, Gnosis Chain Ecosystem, Arbitrum Ecosystem, Celo Ecosystem, Ethereum Ecosystem, Optimism Ecosystem, Base Ecosystem, AI Agents, Mode Ecosystem, AI Agent Launchpad, Binance Alpha Spotlight, AI Framework, DeFAI",autonolas,60886534,178095442.0,,,N/A,253220.0
OKX,"SocialFi, Solana Ecosystem",access-protocol,60863563,132137069.0,,,N/A,786114.0
OKX,"Ethereum Ecosystem, Telegram Apps, Binance HODLer Airdrops",banana-gun,60398913,146425588.0,32760.90957750038,36422.77782229102,0.17,106097498.0
OKX,"Stablecoins, USD Stablecoin, Ethereum Ecosystem, Fiat-backed Stablecoin",binance-usd,60372541,60372541.0,,,N/A,5456.29
OKX,"Gaming (GameFi), Ethereum Ecosystem, Telegram Apps, Gaming Platform",gamebuild,60359030,75983588.0,,,N/A,9689417.0
