OKX,"Artificial Intelligence (AI), Meme, Base Ecosystem, AI Agents, Binance Alpha Spotlight, AI Framework",freysa-ai,156108167,156108167.0,,,N/A,622082.0
OKX,"SocialFi, Arbitrum Ecosystem",uxlink,156256977,462025362.0,68021.41369275971,81283.7274017408,0.04,17083831.0
OKX,"BNB Chain Ecosystem, Binance Alpha Spotlight",bnb48-club-token,154292812,154292812.0,,,N/A,245850.0
OKX,"Smart Contract Platform, Gaming (GameFi), Layer 1 (L1), Ethereum Ecosystem, Modular Blockchain, Account Abstraction, Multicoin Capital Portfolio, Gaming Blockchains, Gaming Utility Token, Skale Ecosystem, Consensys Portfolio, Galaxy Digital Portfolio, Made in USA",skale,153360437,161329949.0,30606.629924927947,40166.62427508247,0.15,14692820.0
OKX,"Stablecoins, Ethereum Ecosystem, Crypto-backed Stablecoin",elixir-staked-deusd,152791221,152791221.0,,,N/A,1145589.0
OKX,"Smart Contract Platform, Layer 1 (L1), Layer 0 (L0), Made in USA, Directed Acyclic Graph (DAG)",constellation-labs,152840692,152840802.0,,,N/A,2779739.0
OKX,BNB Chain Ecosystem,acet-token,152957929,199555011.0,,,N/A,715888.0
OKX,"Smart Contract Platform, EthereumPoW Ecosystem, Proof of Work (PoW)",ethereum-pow-iou,151147529,151147529.0,28122.331692628457,26677.965553581256,0.14,5626355.0
OKX,Smart Contract Platform,bitkub-coin,152321602,188580486.0,,,N/A,455457.0
OKX,"Internet of Things (IOT), Oracle, NFT, Metaverse, Ethereum Ecosystem, DePIN, Alleged SEC Securities, Made in USA",xyo-network,150813720,150813720.0,,,N/A,8559260.0
OKX,"Payment Solutions, Made in USA, Directed Acyclic Graph (DAG)",nano,150321957,150321957.0,574.6239536990028,4070.4137883070603,0.4,4909920.0
OKX,"Smart Contract Platform, Layer 1 (L1), Real World Assets (RWA), RWA Protocol",polymesh,148438896,148438896.0,,,N/A,2336038.0
OKX,"BNB Chain Ecosystem, Binance-Peg Tokens",binance-peg-sol,146084190,146084190.0,,,N/A,4605769.0
OKX,"NFT, Solana Ecosystem, NFT Marketplace, Paradigm Portfolio, Sequoia Capital Portfolio",magic-eden,145738503,1092692694.0,579536.5256784065,557111.4066787955,0.09,14906003.0
OKX,"Internet of Things (IOT), Smart Contract Platform, Layer 1 (L1), Proof of Work (PoW), Made in USA",digibyte,145794586,145820613.0,15261.051442781056,21622.719960449114,0.14,4287688.0
OKX,"Smart Contract Platform, Crypto-Backed Tokens, Wrapped-Tokens, Layer 2 (L2), Mantle Ecosystem",wrapped-ether-mantle-bridge,145886789,145886789.0,,,N/A,5016371.0
OKX,"Crypto-Backed Tokens, BNB Chain Ecosystem, Wrapped-Tokens, Ethereum Ecosystem",wrapped-beacon-eth,145487058,145487058.0,,,N/A,6224580.0
OKX,"Smart Contract Platform, Masternodes, Zero Knowledge (ZK), Proof of Work (PoW), Made in USA",zencash,144084785,144089000.0,,,N/A,15416831.0
OKX,"Smart Contract Platform, DWF Labs Portfolio, Proof of Stake (PoS)",waves,143575028,143575028.0,,,N/A,10030922.0
OKX,"Exchange-based Tokens, Decentralized Finance (DeFi), Ethereum Ecosystem, Real World Assets (RWA), Alleged SEC Securities",lcx,143231563,144603081.0,,,N/A,2120387.0
OKX,"Stablecoins, Ethereum Ecosystem, XRP Ledger Ecosystem, Fiat-backed Stablecoin, Made in USA",ripple-usd,141834255,141834255.0,,,N/A,32600788.0
OKX,"Binance Launchpool, Solana Ecosystem, Ethereum Ecosystem, Decentralized Science (DeSci)",bio-protocol,140901949,288608176.0,141575.21668453747,184807.19083862024,0.23,14561947.0
OKX,"Stablecoins, EUR Stablecoin, Solana Ecosystem, Avalanche Ecosystem, Ethereum Ecosystem, Base Ecosystem, Stellar Ecosystem",euro-coin,139585317,139585317.0,262331.9175336528,261270.8689589662,0.06,38851874.0
OKX,"Smart Contract Platform, Layer 1 (L1), Harmony Ecosystem, Animoca Brands Portfolio, Binance Launchpad, Binance Labs Portfolio, Made in USA",harmony,139530622,149175746.0,15251.392667363334,35121.08217047912,0.09,10520700.0
OKX,"Smart Contract Platform, Layer 1 (L1), Kadena Ecosystem, Multicoin Capital Portfolio, Proof of Work (PoW), Made in USA",kadena,139043829,139179758.0,6922.0578031494815,17459.08672582561,0.07,5656842.0
OKX,"Solana Ecosystem, Meme, Solana Meme, Murad Picks",gigachad-2,136271586,136271586.0,,,N/A,14152835.0
OKX,"Tokenized Assets, Tokenized Gold, Real World Assets (RWA), Tokenized Commodities",kinesis-gold,138516853,138516853.0,,,N/A,135627192.0
OKX,"Gaming (GameFi), Play To Earn, Telegram Apps, TON Ecosystem, Tap to Earn, Arcade Games",hamster-kombat,137741402,213967227.0,24889.39824220286,60320.34244885324,0.05,25805898.0
OKX,"Alleged SEC Securities, Osmosis Ecosystem, DeFiance Capital Portfolio, Pantera Capital Portfolio, Binance Labs Portfolio, Delphi Ventures Portfolio, Galaxy Digital Portfolio, OKX Ventures Portfolio",terra-luna-2,137709133,215981433.0,61217.881610721925,96830.17045463169,0.1,17909503.0
OKX,"Gaming (GameFi), NFT, BNB Chain Ecosystem, Solana Ecosystem, Polygon Ecosystem, Play To Earn, Move To Earn, Ethereum Ecosystem, Binance Launchpad, Gaming Governance Token, Sports Games, Alameda Research Portfolio, Binance Labs Portfolio, Sequoia Capital Portfolio",stepn,136890678,256007361.0,55130.836662773596,81786.89453127087,0.04,22698365.0
OKX,"Decentralized Finance (DeFi), Analytics, DeFi Index, Base Ecosystem",mag7-ssi,135212945,135212945.0,,,N/A,1703765.0
OKX,"Crypto-Backed Tokens, Wrapped-Tokens, Avalanche Ecosystem",wrapped-avax,135379726,135558794.0,,,N/A,44843640.0
OKX,"Stablecoins, EUR Stablecoin, Polygon Ecosystem, Ethereum Ecosystem, Real World Assets (RWA), Fiat-backed Stablecoin",stasis-eurs,135029929,135029929.0,,,N/A,53866.0
OKX,"Gaming (GameFi), Polkadot Ecosystem, NFT, Ethereum Ecosystem, Gaming Blockchains, Andreessen Horowitz (a16z) Portfolio, Binance Labs Portfolio, Galaxy Digital Portfolio, Made in USA",mythos,134818530,173568185.0,,,N/A,3056106.0
OKX,"BNB Chain Ecosystem, Arbitrum Ecosystem, Cardano Ecosystem, Ethereum Ecosystem, DePIN, Base Ecosystem, DWF Labs Portfolio",world-mobile-token,134090919,387447096.0,,,N/A,15000905.0
OKX,"Liquid Staking Tokens, Aptos Ecosystem, Liquid Staking",amnis-aptos,133832029,133860380.0,,,N/A,109073.0
OKX,"Smart Contract Platform, Masternodes, Proof of Stake (PoS), Made in China",ontology,132721268,145416435.0,16778.25329221843,19536.740382961998,0.07,5446549.0
OKX,"Tokenized Assets, Real World Assets (RWA), Tokenized Silver, Tokenized Commodities",kinesis-silver,131640580,131640580.0,,,N/A,2359713.0
OKX,"Decentralized Exchange (DEX), Smart Contract Platform, Exchange-based Tokens, Decentralized Finance (DeFi), Arbitrum Ecosystem, Ethereum Ecosystem, Layer 2 (L2), Zero Knowledge (ZK), Loopring Ecosystem, Rollup, Energi Ecosystem",loopring,131254373,144725623.0,29492.204898059026,50928.85756551686,0.09,14404432.0
OKX,"Stablecoins, USD Stablecoin, Solana Ecosystem, Fiat-backed Stablecoin",global-dollar,130290946,130290946.0,,,N/A,544995.0
OKX,"Cronos Ecosystem, Bridged USDC, Bridged-Tokens, Bridged Stablecoins",cronos-bridged-usdc-cronos,129339587,129339587.0,,,N/A,1513031.0
OKX,"Artificial Intelligence (AI), Binance Launchpool, Solana Ecosystem, DePIN, Animoca Brands Portfolio, Multicoin Capital Portfolio, Delphi Ventures Portfolio, OKX Ventures Portfolio, Made in USA",io,127934318,694104653.0,,,N/A,31120990.0
OKX,"Smart Contract Platform, SocialFi, NFT, BNB Chain Ecosystem, Binance Launchpool, Ethereum Ecosystem, Decentralized Identifier (DID), Zero Knowledge (ZK), DWF Labs Portfolio, Coinbase Ventures Portfolio, Multicoin Capital Portfolio, Alameda Research Portfolio, DragonFly Capital Portfolio, Binance Labs Portfolio, Quest-to-Earn",project-galaxy,126758831,198449306.0,,,N/A,54041.0
OKX,"Smart Contract Platform, Base Ecosystem, Gaming Blockchains",b3,126874178,595858465.0,,,N/A,19302994.0
OKX,"BNB Chain Ecosystem, Harmony Ecosystem, Ethereum Ecosystem, Alameda Research Portfolio, Binance Labs Portfolio",swipe,126050596,126107474.0,,,N/A,4175530.0
OKX,"BNB Chain Ecosystem, Tron Ecosystem",global-commercial-business,123561537,123561537.0,,,N/A,177313.0
OKX,"Artificial Intelligence (AI), Smart Contract Platform, BNB Chain Ecosystem, Solana Ecosystem, Layer 1 (L1), Polygon Ecosystem, Ethereum Ecosystem, DWF Labs Portfolio, Injective Ecosystem, OKX Ventures Portfolio",zignaly,122309181,169577425.0,,,N/A,3266653.0
OKX,"Smart Contract Platform, BNB Chain Ecosystem, Ethereum Ecosystem, Zero Knowledge (ZK), Animoca Brands Portfolio, Binance Labs Portfolio, OKX Ventures Portfolio",polyhedra-network,123419166,2043922467.0,352156.2798737398,343310.2315784298,0.01,8530134.0
OKX,"Decentralized Finance (DeFi), Insurance, Ethereum Ecosystem",nxm,123314282,123314282.0,,,N/A,0.0
OKX,"Polygon Ecosystem, Bridged DAI, Bridged-Tokens, Bridged Stablecoins",polygon-pos-bridged-dai-polygon-pos,122353207,122353207.0,,,N/A,3549666.0
OKX,"Tokenized Assets, Polygon Ecosystem, Arbitrum Ecosystem, Ethereum Ecosystem, Real World Assets (RWA), Starknet Ecosystem, Tokenized Treasury Bills (T-Bills)",eutbl,122494505,122494505.0,,,N/A,0.0
OKX,"Decentralized Exchange (DEX), Exchange-based Tokens, Decentralized Finance (DeFi), Yield Farming, Automated Market Maker (AMM), BNB Chain Ecosystem, Yearn Ecosystem, Solana Ecosystem, Avalanche Ecosystem, Polygon Ecosystem, Near Protocol Ecosystem, Fantom Ecosystem, Harmony Ecosystem, Arbitrum Ecosystem, Celo Ecosystem, Ethereum Ecosystem, Base Ecosystem, Alameda Research Portfolio, Pantera Capital Portfolio, Energi Ecosystem, Sora Ecosystem, Blockchain Capital Portfolio",sushi,121800584,177332526.0,57311.73662319741,134386.11909125556,0.05,26716794.0
OKX,"Decentralized Exchange (DEX), Decentralized Finance (DeFi), Gnosis Chain Ecosystem, MEV Protection, Arbitrum Ecosystem, Ethereum Ecosystem, Intent, Delphi Ventures Portfolio, Blockchain Capital Portfolio",cow-protocol,121127084,292131350.0,,,N/A,35051056.0
OKX,"Business Services, Decentralized Finance (DeFi), Oracle, Fantom Ecosystem, Ethereum Ecosystem, Binance Launchpad, Osmosis Ecosystem, Energi Ecosystem, Binance Labs Portfolio, Sequoia Capital Portfolio",band-protocol,120567684,122366160.0,12789.040936419096,30957.77249626497,0.04,10033557.0
OKX,"Exchange-based Tokens, BNB Chain Ecosystem, Centralized Exchange (CEX) Token",nkyc-token,119386298,119386298.0,,,N/A,234086.0
OKX,"Arbitrum Ecosystem, Ethereum Ecosystem",reserve-protocol-eth-plus,118946454,118946454.0,,,N/A,1352586.0
OKX,"Arbitrum Ecosystem, Ethereum Ecosystem, Account Abstraction, Coinbase Ventures Portfolio, Binance Labs Portfolio, Consensys Portfolio, Outlier Ventures Portfolio",biconomy,118177313,126251321.0,25806.804397827374,34830.62658636006,0.16,15893648.0
OKX,"Smart Contract Platform, Ethereum Ecosystem, Zero Knowledge (ZK), Alleged SEC Securities, Privacy Blockchain",coti,116351592,129834298.0,,,N/A,12544138.0
OKX,"Smart Contract Platform, SocialFi, Layer 1 (L1), Gaming Blockchains",hive,115693177,,,,N/A,2918130.0
OKX,"Decentralized Finance (DeFi), Ethereum Ecosystem, Real World Assets (RWA), Coinbase Ventures Portfolio, Stablecoin Protocol, Binance Labs Portfolio, Galaxy Digital Portfolio",usual,115919126,127363481.0,,,N/A,16032431.0
OKX,"Stablecoins, Ethereum Ecosystem, Base Ecosystem, Blast Ecosystem, Fiat-backed Stablecoin",anzen-usdz,115213548,115213548.0,,,N/A,222491.0
OKX,"Meme, Ethereum Ecosystem, Dog-Themed",neiro-3,114000335,114000335.0,65160.8542966349,170406.7749424149,0.07,55701093.0
OKX,"BNB Chain Ecosystem, Ethereum Ecosystem, Payment Solutions, DWF Labs Portfolio",alchemy-pay,114562238,231734216.0,21324.221502938748,62218.46346620672,0.09,26922373.0
OKX,"Decentralized Finance (DeFi), Derivatives, Synthetic Issuer, Ethereum Ecosystem, Synthetic",stp-network,112945475,112945475.0,,,N/A,32130745.0
OKX,"Decentralized Finance (DeFi), Yield Farming, Lending/Borrowing Protocols, Ethereum Ecosystem, Real World Assets (RWA), Base Ecosystem, Binance Alpha Spotlight",syrup,112777606,180966027.0,,,N/A,12486164.0
OKX,"Exchange-based Tokens, NFT, BNB Chain Ecosystem, Ethereum Ecosystem",swftcoin,112486285,112486285.0,9480.473738650528,17745.317702838045,0.15,4083193.0
OKX,"Smart Contract Platform, BNB Chain Ecosystem, Ethereum Ecosystem, Layer 2 (L2)",prometeus,112285976,118438632.0,,,N/A,3056770.0
OKX,"Business Services, Infrastructure, Smart Contract Platform, Decentralized Finance (DeFi), Polygon Ecosystem, Arbitrum Ecosystem, Ethereum Ecosystem, Liquid Staking Governance Tokens, Coinbase Ventures Portfolio, Proof of Stake (PoS), Index Coop Defi Index, Consensys Portfolio, Liquid Staking, Index Coop Index",rocket-pool,111519833,111519833.0,1905.3454450600077,6561.876251664254,0.17,10357221.0
OKX,"Smart Contract Platform, Proof of Stake (PoS), Sequoia Capital Portfolio",iostoken,112205610,112205610.0,16493.562095867437,68535.72865016708,0.02,83435180.0
OKX,"Artificial Intelligence (AI), Smart Contract Platform, Layer 1 (L1), Proof of Work (PoW)",qubic-network,112721127,134815138.0,,,N/A,2673312.0
OKX,"Big Data, Business Services, Infrastructure, Decentralized Finance (DeFi), Solana Ecosystem, FTX Holdings, DWF Labs Portfolio, Name Service",bonfida,110414669,111427346.0,,,N/A,12827541.0
OKX,"Decentralized Exchange (DEX), Decentralized Finance (DeFi), BNB Chain Ecosystem, Wallets, XRP Ledger Ecosystem",solo-coin,110575354,110575354.0,,,N/A,4251335.0
OKX,"Arbitrum Ecosystem, Bridged USDC, Bridged-Tokens, Bridged Stablecoins",usd-coin-ethereum-bridged,110310009,110310009.0,,,N/A,34354379.0
OKX,"Smart Contract Platform, BNB Chain Ecosystem, Layer 1 (L1), Ethereum Ecosystem, Decentralized Identifier (DID), Base Ecosystem, Gravity Alpha Ecosystem",g-token,110103009,182675365.0,16268.333531134762,18734.347165517323,0.07,8956748.0
OKX,"Music, NFT, Ethereum Ecosystem, Coinbase Ventures Portfolio, Multicoin Capital Portfolio, Pantera Capital Portfolio, Energi Ecosystem, Binance Labs Portfolio",audius,109078961,109078961.0,,,N/A,15410109.0
OKX,"Solana Ecosystem, Polygon Ecosystem, Ethereum Ecosystem",m2-global-wealth-limited-mmx,108693754,348714313.0,,,N/A,82136.0
OKX,"Tokenized Real Estate, Tokenized Assets, Gnosis Chain Ecosystem, RealT Tokens, Real World Assets (RWA), RWA Protocol",realtoken-ecosystem-governance,107185690,748505266.0,,,N/A,599.28
OKX,"Smart Contract Platform, Cross-chain Communication, Pantera Capital Portfolio",icon,107791551,109015266.0,16506.009918782165,32113.352522987272,0.1,998178.0
OKX,"Smart Contract Platform, Ethereum Ecosystem, Metis Ecosystem, Layer 2 (L2), DWF Labs Portfolio, Rollup, GMCI Layer 2 Index, OKX Ventures Portfolio, GMCI Index",metis-token,106866406,170840439.0,26901.305007870647,51877.49366070932,0.12,6082996.0
OKX,"Decentralized Finance (DeFi), Ethereum Ecosystem, Morpho Ecosystem",steakhouse-usdc-morpho-vault,108250056,108250056.0,,,N/A,0.0
OKX,"Solana Ecosystem, Multicoin Capital Portfolio, Stablecoin Protocol, Alameda Research Portfolio, DeFiance Capital Portfolio",uxd-protocol-token,105918858,105918858.0,,,N/A,47.96
OKX,"Smart Contract Platform, Decentralized Finance (DeFi), Binance Launchpool, Derivatives, Perpetuals, Ethereum Ecosystem, Layer 2 (L2), DragonFly Capital Portfolio, Pantera Capital Portfolio",aevo-exchange,105394388,116694365.0,74263.179332812,170008.17306317243,0.09,16554099.0
OKX,"Lending/Borrowing Protocols, Ethereum Ecosystem, Paradigm Portfolio, Coinbase Ventures Portfolio",euler,105537585,153531041.0,,,N/A,3489313.0
OKX,"Stablecoins, BNB Chain Ecosystem",astherus-usdf,104984081,104984081.0,,,N/A,770607.0
OKX,"Decentralized Finance (DeFi), BNB Chain Ecosystem, Real World Assets (RWA), DWF Labs Portfolio, Stellar Ecosystem",velo,105136061,341420144.0,20700.720767594925,66426.05419852342,0.08,16737982.0
OKX,"Gaming (GameFi), NFT, Metaverse, Play To Earn, Ethereum Ecosystem, Animoca Brands Portfolio, RPG, Gaming Governance Token, Adventure Games, Energi Ecosystem, Delphi Ventures Portfolio",illuvium,104981622,135280606.0,4729.009262089523,5862.319595935796,0.07,16906474.0
OKX,"Solana Ecosystem, Meme, Solana Meme, PolitiFi, Made in USA",melania-meme,104115793,694104712.0,,,N/A,17818224.0
OKX,"Smart Contract Platform, BNB Chain Ecosystem, Ethereum Ecosystem, DWF Labs Portfolio, Made in USA",proton,103770560,115021401.0,,,N/A,4264154.0
OKX,"NFT, Meme, Arbitrum Ecosystem, Ethereum Ecosystem, Anime-Themed, Binance HODLer Airdrops, Airdropped Tokens by NFT Projects",anime,103382958,186658851.0,136427.95939200997,155856.27269907616,0.11,12899262.0
OKX,"Artificial Intelligence (AI), Base Ecosystem, AI Agents, AI Applications, Made in USA",venice-token,102373794,244034986.0,,,N/A,7805916.0
OKX,"Decentralized Finance (DeFi), Yield Farming, Avalanche Ecosystem, Fantom Ecosystem, Arbitrum Ecosystem, Olympus Pro Ecosystem, Ethereum Ecosystem, Stablecoin Protocol",spell-token,101384324,125316713.0,,,N/A,48723422.0
OKX,"Meme, PulseChain Ecosystem",the-grays-currency,101548385,101548385.0,,,N/A,272820.0
OKX,"Business Services, Decentralized Finance (DeFi), Oracle, Derivatives, Synthetic Issuer, Avalanche Ecosystem, Ethereum Ecosystem, Blockchain Capital Portfolio, Synthetic, Made in USA",uma,100628448,145200338.0,13749.377532492641,19789.596072640452,0.17,9106442.0
OKX,"Polygon Ecosystem, Arbitrum Ecosystem, Ethereum Ecosystem, Optimism Ecosystem, Bridge Governance Tokens, Cross-chain Communication, Intent, Boba Network Ecosystem, Blockchain Capital Portfolio, Made in USA",across-protocol,100576845,248944447.0,,,N/A,30727378.0
OKX,"Bridged USDT, QL1 Ecosystem, Bridged-Tokens, Bridged Stablecoins",qusdt,100026611,100026611.0,,,N/A,27833.0
OKX,"Big Data, Infrastructure, Storage, Cardano Ecosystem, DePIN",iagon,100765822,267979644.0,,,N/A,485620.0
OKX,"Artificial Intelligence (AI), Smart Contract Platform, Masternodes, DePIN, Proof of Work (PoW), Made in USA",zelcash,100299013,100333457.0,,,N/A,7191355.0
OKX,"Decentralized Exchange (DEX), Decentralized Finance (DeFi), Automated Market Maker (AMM), Ethereum Ecosystem, Cronos Ecosystem",vvs-finance,100571961,196616424.0,,,N/A,236485.0
OKX,"Solana Ecosystem, Meme, Base Ecosystem, AI Meme, AI Agents, Virtuals Protocol Ecosystem, Binance Alpha Spotlight, DeFAI",aixbt,100109926,117003782.0,103755.54629756241,124614.63006621574,0.17,49048491.0
OKX,"Smart Contract Platform, Privacy, Layer 1 (L1), Proof of Stake (PoS), Proof of Work (PoW), Zano Ecosystem, Privacy Blockchain",zano,100048904,100059748.0,,,N/A,651966.0
OKX,"Stablecoins, LP Tokens, Ethereum Ecosystem",resolv-rlp,99519873,99519873.0,,,N/A,302724.0
OKX,"NFT, Binance Launchpool, Meme, Ethereum Ecosystem, Binance Labs Portfolio, GMCI Meme Index, GMCI Index",memecoin-2,99362281,167424318.0,81303.85913367156,108905.04270306151,0.04,19203648.0
OKX,"Solana Ecosystem, Payment Solutions, Viction Ecosystem",saros-finance,98714816,376056466.0,,,N/A,735922.0
OKX,"NFT, BNB Chain Ecosystem, Ethereum Ecosystem, Binance Launchpad, DWF Labs Portfolio, Binance Labs Portfolio",space-id,98335562,456064305.0,51210.197303784764,58186.952727180054,0.09,18452805.0
OKX,"Solana Ecosystem, Liquid Staking Tokens, Liquid Staked SOL, Liquid Staking",drift-staked-sol,98288287,98288287.0,,,N/A,17481.67
OKX,"Infrastructure, Solana Ecosystem, Animoca Brands Portfolio, Cross-chain Communication, OKX Ventures Portfolio",zeus-network,97581132,254927988.0,39199.680001981855,57820.85723548881,0.16,10959326.0
OKX,"Crypto-Backed Tokens, Decentralized Finance (DeFi), Compound Tokens, cToken, Ethereum Ecosystem",compound-ether,97734706,97734706.0,,,N/A,166.61
OKX,"Solana Ecosystem, Meme, Frog-Themed, Solana Meme, GMCI Meme Index, GMCI Index",book-of-meme,96965133,96965133.0,72405.0155717397,97934.22993485826,0.14,49762289.0
OKX,"Smart Contract Platform, Polkadot Ecosystem, Binance Launchpool, Layer 2 (L2), Manta Network Ecosystem, Multicoin Capital Portfolio, Alameda Research Portfolio, DeFiance Capital Portfolio, Binance Labs Portfolio",manta-network,96943938,254921056.0,,,N/A,25502963.0
OKX,"Smart Contract Platform, Ethereum Ecosystem, Layer 2 (L2), Optimism Superchain Ecosystem, Outlier Ventures Portfolio, Lisk Ecosystem",lisk,96908104,224921902.0,13579.216370432216,20058.249871748092,0.09,11540912.0
OKX,"Smart Contract Platform, BNB Chain Ecosystem, Binance Launchpool, Ethereum Ecosystem, Layer 2 (L2), Restaking, Rollups-as-a-Service (RaaS), Rollup, Binance Labs Portfolio",altlayer,96695171,346327685.0,,,N/A,13245197.0
OKX,"Software as a service, Ethereum Ecosystem, Energi Ecosystem",status,96389585,165615781.0,74171.71733034331,67635.10566126574,0.12,5620387.0
OKX,"XDC Ecosystem, Telos Ecosystem",ecoin-2,95498064,207099463.0,,,N/A,5.24
OKX,"Smart Contract Platform, Layer 1 (L1), Zero Knowledge (ZK), Andreessen Horowitz (a16z) Portfolio, Privacy Blockchain, Made in USA",aleo,95422602,467553800.0,,,N/A,7045159.0
OKX,"NFT, Polygon Ecosystem, Ethereum Ecosystem, Optimism Ecosystem",blockv,96273116,96273116.0,,,N/A,114306.0
OKX,"Gaming (GameFi), NFT, BNB Chain Ecosystem",infinitar-governance-token,94856441,469774708.0,,,N/A,9433237.0
OKX,"Smart Contract Platform, Gaming (GameFi), Solana Ecosystem, Layer 2 (L2), Gaming Blockchains",sonic-svm,94744506,631630039.0,157989.1948344958,118031.29014511105,0.06,35997496.0
OKX,"Infrastructure, Smart Contract Platform, Ethereum Ecosystem, Data Availability, Modular Blockchain",avail,94582362,484279077.0,,,N/A,4391019.0
OKX,"Gaming (GameFi), NFT, Kaia Ecosystem, Gaming Blockchains",bora,94466326,98809605.0,2951.259994022471,12363.20466567081,0.16,465014.0
OKX,"Fraxtal Ecosystem, Bridged-Tokens",l2-standard-bridged-frxusd,94499124,94499124.0,,,N/A,797862.0
OKX,"Artificial Intelligence (AI), Infrastructure, Smart Contract Platform, Oracle, Polkadot Ecosystem, Ethereum Ecosystem, Interoperability, Layer 2 (L2), Zero Knowledge (ZK), DePIN, DWF Labs Portfolio, Rollup, AI Agents, Sora Ecosystem, AI Framework, Made in USA",pha,94333391,120244434.0,33683.23875495737,35755.52492694397,0.25,25637819.0
OKX,"Infrastructure, Smart Contract Platform, Oracle, Layer 1 (L1), Animoca Brands Portfolio, Coinbase Ventures Portfolio, Cross-chain Communication, Made in USA",supra,94760892,842563004.0,,,N/A,14872865.0
OKX,Layer 1 (L1),oec-token,93838432,93838432.0,10365.598450126554,8657.553083141425,0.15,341362.0
OKX,"Solana Ecosystem, Liquid Staking Tokens, Restaking, Liquid Restaking Tokens, Liquid Staked SOL, Liquid Staking, Liquid Restaked SOL",solayer-staked-sol,93315074,93315074.0,,,N/A,311953.0
OKX,"Ethereum Ecosystem, DWF Labs Portfolio",adventure-gold,93169967,93169967.0,30335.694445236084,92835.82909427899,0.04,31551181.0
OKX,"DaoMaker Launchpad, Ethereum Ecosystem, Real World Assets (RWA), Sequoia Capital Portfolio, Made in USA",clearpool,92548812,121783413.0,,,N/A,3547938.0
OKX,"Artificial Intelligence (AI), Big Data, Media, BNB Chain Ecosystem, Polygon Ecosystem, Ethereum Ecosystem, GMCI DePIN Index, Galaxy Digital Portfolio, GMCI Index",everipedia,91935369,91935369.0,2693.2490267301505,7659.557672980759,0.07,5317347.0
OKX,"Artificial Intelligence (AI), Infrastructure, Smart Contract Platform, Decentralized Finance (DeFi), Arbitrum Ecosystem, Ethereum Ecosystem, Zero Knowledge (ZK), DWF Labs Portfolio, Coinbase Ventures Portfolio, Pantera Capital Portfolio, Binance Labs Portfolio",marlin,91344836,112031477.0,,,N/A,6872056.0
OKX,"Energy, Ethereum Ecosystem, Alleged SEC Securities, Energi Ecosystem, GMCI DePIN Index, Blockchain Capital Portfolio, GMCI Index",power-ledger,90357749,170478711.0,,,N/A,6991108.0
OKX,"Decentralized Finance (DeFi), Yield Farming, BNB Chain Ecosystem, Binance Launchpool, Lending/Borrowing Protocols, Arbitrum Ecosystem, Ethereum Ecosystem, Optimism Ecosystem, ZkSync Ecosystem, opBNB Ecosystem, Unichain Ecosystem",venus,90525537,162401627.0,,,N/A,5241377.0
OKX,"Decentralized Exchange (DEX), Exchange-based Tokens, Decentralized Finance (DeFi), Yield Farming, Automated Market Maker (AMM), Avalanche Ecosystem, Polygon Ecosystem, Near Protocol Ecosystem, Gnosis Chain Ecosystem, Harmony Ecosystem, Arbitrum Ecosystem, Ethereum Ecosystem, Optimism Ecosystem, Base Ecosystem, Index Coop Defi Index, Alameda Research Portfolio, DeFiance Capital Portfolio, Pantera Capital Portfolio, Energi Ecosystem, Polygon zkEVM Ecosystem, Huobi ECO Chain Ecosystem, Blockchain Capital Portfolio, Index Coop Index",balancer,90100741,97432500.0,54532.768549717795,56681.65183745858,0.14,8569680.0
OKX,"SocialFi, Coinbase Ventures Portfolio, Pantera Capital Portfolio, Andreessen Horowitz (a16z) Portfolio, Sequoia Capital Portfolio",deso,89464405,91810867.0,,,N/A,3572677.0
OKX,"Gaming (GameFi), XDC Ecosystem, Gaming Utility Token",gama-coin,89346664,137456481.0,,,N/A,2273380.0
OKX,"BNB Chain Ecosystem, Liquid Staking Tokens",astherus-staked-bnb,113138018,113138018.0,,,N/A,785.55
OKX,"Crypto-Backed Tokens, BNB Chain Ecosystem, Arbitrum Ecosystem, Ethereum Ecosystem, Mantle Ecosystem",ignition-fbtc,90021765,1160954852.0,,,N/A,562128.0
OKX,"Artificial Intelligence (AI), Oracle, Ethereum Ecosystem, DePIN, Energi Ecosystem, Sora Ecosystem, GMCI DePIN Index, GMCI Index",iexec-rlc,89308145,107343409.0,,,N/A,10369346.0
OKX,"Infrastructure, Smart Contract Platform, Decentralized Finance (DeFi), BNB Chain Ecosystem, Avalanche Ecosystem, Polygon Ecosystem, Fantom Ecosystem, Harmony Ecosystem, Arbitrum Ecosystem, Ethereum Ecosystem, DWF Labs Portfolio, Layer 3 (L3), Outlier Ventures Portfolio",orbs,88741113,194883916.0,8218.369705838568,14559.61103548004,0.1,4637627.0
OKX,"Cronos Ecosystem, Bridged USDT, Bridged-Tokens, Bridged Stablecoins",cronos-bridged-usdt-cronos,87786801,87786801.0,,,N/A,398872.0
OKX,"Smart Contract Platform, Ethereum Ecosystem, Layer 2 (L2), Zero Knowledge (ZK), Restaking, Zircuit Ecosystem",zircuit,87576970,398997829.0,,,N/A,17784212.0
OKX,"NFT, Polygon Ecosystem",sathosi-airlines-token,86526795,413241296.0,,,N/A,7572.44
OKX,"Artificial Intelligence (AI), Virtual Reality, Launchpad, Ethereum Ecosystem, Telegram Apps, Discord Bots, PAAL AI Launchpad, AI Agents, AI Applications, AI Agent Launchpad, Binance Alpha Spotlight, AI Framework, DeFAI, Made in USA",paal-ai,86935575,97788909.0,,,N/A,10901607.0
OKX,"Stablecoins, USD Stablecoin, Ethereum Ecosystem, Sonic Ecosystem, Fiat-backed Stablecoin",frax-usd,86184652,86184652.0,,,N/A,1776793.0
