OKX,"Artificial Intelligence (AI), Solana Ecosystem, DePIN, Polychain Capital Portfolio",grass,329720623,1351839855.0,,,N/A,120193225.0
OKX,"Stablecoins, USD Stablecoin, BNB Chain Ecosystem, Avalanche Ecosystem, Polygon Ecosystem, Optimism Ecosystem, Fiat-backed Stablecoin, Binance-Peg Tokens",binance-peg-busd,323180228,323180228.0,,,N/A,15013890.0
OKX,"Solana Ecosystem, Meme, Ethereum Ecosystem, Base Ecosystem, Murad Picks, Stock market-themed",spx6900,312943645,312943645.0,,,N/A,20969449.0
OKX,"Decentralized Exchange (DEX), Smart Contract Platform, Decentralized Finance (DeFi), Prediction Markets, Layer 1 (L1), Gnosis Chain Ecosystem, MEV Protection, Arbitrum Ecosystem, Ethereum Ecosystem, SideChain, Energi Ecosystem",gnosis,310458776,359661834.0,,,N/A,35910072.0
OKX,"Smart Contract Platform, Gaming (GameFi), NFT, BNB Chain Ecosystem, Binance Launchpool, Avalanche Ecosystem, Ethereum Ecosystem, DWF Labs Portfolio, Gaming Blockchains, Avalanche L1",beam-2,312969074,364104513.0,,,N/A,28117762.0
OKX,"Meme, Base Ecosystem, Frog-Themed, Base Meme, The Boy’s Club",based-brett,307348177,307348179.0,,,N/A,33700590.0
OKX,"Smart Contract Platform, Zero Knowledge (ZK), FTX Holdings, Paradigm Portfolio, Coinbase Ventures Portfolio, Multicoin Capital Portfolio, Proof of Stake (PoS), Pantera Capital Portfolio, Circle Ventures Portfolio, Privacy Blockchain, Polychain Capital Portfolio, Made in USA, Coinbase 50 Index",mina-protocol,304725999,304725999.0,32956.30937519424,55294.87278707954,0.04,16388581.0
OKX,"Smart Contract Platform, Layer 1 (L1), MEV Protection, Proof of Work (PoW), Privacy Blockchain",verus-coin,302324892,302325691.0,,,N/A,18305.31
OKX,"Decentralized Finance (DeFi), Arbitrum Ecosystem, Ethereum Ecosystem, Real World Assets (RWA), Base Ecosystem, Coinbase Ventures Portfolio, Energi Ecosystem, Made in USA",reserve-rights-token,301291757,538985969.0,29202.385551458257,71739.68603025183,0.09,27819915.0
OKX,"Yield Aggregator, Ethereum Ecosystem, Binance Labs Portfolio, Polychain Capital Portfolio",stakestone-berachain-vault-token,298635948,298635948.0,,,N/A,181098.0
OKX,"Decentralized Finance (DeFi), Tron Ecosystem",just,297966112,297966112.0,14593.16490240427,25781.71762642017,0.07,24646540.0
OKX,"Decentralized Finance (DeFi), Lending/Borrowing Protocols, Ethereum Ecosystem, Base Ecosystem, Coinbase Ventures Portfolio, Pantera Capital Portfolio, Morpho Ecosystem, Binance Alpha Spotlight",morpho,297746520,1261380122.0,350019.0773831421,389399.64904713654,0.07,13436375.0
OKX,"Artificial Intelligence (AI), Smart Contract Platform, Storage, BNB Chain Ecosystem, Layer 1 (L1), Ethereum Ecosystem, DePIN, DWF Labs Portfolio, Osmosis Ecosystem, GMCI DePIN Index, GMCI Index",aioz-network,287080468,290915359.0,,,N/A,13914360.0
OKX,"Artificial Intelligence (AI), Ethereum Ecosystem, DePIN, Energi Ecosystem, GMCI DePIN Index, GMCI Index",golem,281537230,281537230.0,13040.809032403635,32841.27890731386,0.04,44091849.0
OKX,"Smart Contract Platform, Layer 1 (L1), Ethereum Ecosystem, Real World Assets (RWA), RWA Protocol, Made in USA",plume,276214133,1381070667.0,,,N/A,78639588.0
OKX,"Polygon Ecosystem, Bridged WETH, Bridged-Tokens",polygon-pos-bridged-weth-polygon-pos,275281627,275312120.0,,,N/A,14409970.0
OKX,"Crypto-Backed Tokens, Wrapped-Tokens, Polygon Ecosystem, Arbitrum Ecosystem, Liquid Staking Tokens, Ethereum Ecosystem, Optimism Ecosystem, Base Ecosystem, Liquid Staked ETH, Liquid Staking",coinbase-wrapped-staked-eth,274671333,764707173.0,,,N/A,11490958.0
OKX,"Decentralized Exchange (DEX), Exchange-based Tokens, Decentralized Finance (DeFi), Yield Farming, Derivatives, Synthetic Issuer, Avalanche Ecosystem, Polygon Ecosystem, Near Protocol Ecosystem, Fantom Ecosystem, Harmony Ecosystem, Ethereum Ecosystem, Optimism Ecosystem, Base Ecosystem, DWF Labs Portfolio, Paradigm Portfolio, Coinbase Ventures Portfolio, Index Coop Defi Index, Energi Ecosystem, Huobi ECO Chain Ecosystem, GMCI DeFi Index, Synthetic, Index Coop Index, GMCI Index, Coinbase 50 Index",havven,273780934,274122596.0,35669.3467826611,53212.054505424145,0.02,21339816.0
OKX,"Stablecoins, USD Stablecoin, Ethereum Ecosystem, Fiat-backed Stablecoin",elixir-deusd,267095145,267095145.0,,,N/A,36065711.0
OKX,"Smart Contract Platform, Privacy, Masternodes, Alleged SEC Securities, Proof of Stake (PoS), Proof of Work (PoW), Made in USA",dash,268116926,268122617.0,,,N/A,32533001.0
OKX,"BNB Chain Ecosystem, Wallets, Ethereum Ecosystem, Animoca Brands Portfolio, Binance Launchpad, Energi Ecosystem, Binance Labs Portfolio",safepal,267447322,267447322.0,,,N/A,9455246.0
OKX,"Liquid Staking Tokens, Ethereum Ecosystem, Liquid Staking",stader-ethx,266083251,266083251.0,,,N/A,191923.0
OKX,"Decentralized Exchange (DEX), Exchange-based Tokens, Decentralized Finance (DeFi), Automated Market Maker (AMM), BNB Chain Ecosystem, Avalanche Ecosystem, Polygon Ecosystem, Near Protocol Ecosystem, Harmony Ecosystem, Ethereum Ecosystem, FTX Holdings, Alameda Research Portfolio, DragonFly Capital Portfolio, Pantera Capital Portfolio, Energi Ecosystem, Binance Labs Portfolio, GMCI DeFi Index, Galaxy Digital Portfolio, Blockchain Capital Portfolio, Dex Aggregator, GMCI Index, Coinbase 50 Index",1inch,266973285,290908330.0,32646.95788634853,67146.79880976379,0.05,27054160.0
OKX,"Exchange-based Tokens, Centralized Exchange (CEX) Token, Ethereum Ecosystem, Morph L2 Ecosystem",mx-token,261645318,1152872755.0,,,N/A,15706543.0
OKX,"Smart Contract Platform, Ethereum Ecosystem, Real World Assets (RWA), DWF Labs Portfolio, Proof of Stake (PoS)",creditcoin-2,265524071,371002529.0,55480.23199250988,77206.01609801575,0.03,48852933.0
OKX,"Polygon Ecosystem, Bridged WBTC, Bridged-Tokens",polygon-bridged-wbtc-polygon-pos,260676461,260676461.0,,,N/A,7606074.0
OKX,"Infrastructure, Ethereum Ecosystem, Data Availability, Restaking, Polychain Capital Portfolio, Made in USA",eigenlayer,261138531,1830210711.0,170554.62938754103,214085.63282516543,0.09,49431652.0
OKX,"Decentralized Finance (DeFi), Solana Ecosystem, LSDFi, Restaking, Stablecoin Protocol, Binance Labs Portfolio, Binance HODLer Airdrops, Polychain Capital Portfolio",solayer,253421068,1206766990.0,,,N/A,217154204.0
OKX,"Smart Contract Platform, DePIN, Proof of Stake (PoS), Made in USA",theta-fuel,257439611,257442506.0,,,N/A,3142526.0
OKX,"BRC-20, Bitcoin Ecosystem, Inscriptions",sats-ordinals,257158972,257158972.0,135857.54759319682,310794.77974914055,0.08,7634939.0
OKX,"Smart Contract Platform, Polkadot Ecosystem, Proof of Stake (PoS), Pantera Capital Portfolio, Made in USA, Coinbase 50 Index",kusama,257424799,257440017.0,16615.508668683873,36495.577767457275,0.06,15555207.0
OKX,"Stablecoins, Tokenized Assets, Tokenized Gold, BNB Chain Ecosystem, Real World Assets (RWA), Tokenized Commodities, Commodity-backed Stablecoin",quorium,250856173,250856173.0,,,N/A,163227.0
OKX,"Crypto-Backed Tokens, Decentralized Finance (DeFi), cToken, Ethereum Ecosystem",compound-wrapped-btc,248897803,248897803.0,,,N/A,0.0
OKX,"Decentralized Finance (DeFi), Liquid Staking Tokens, Base Ecosystem, Liquid Staked ETH, Liquid Staking",super-oeth,247897391,247902005.0,,,N/A,3673560.0
OKX,"Decentralized Finance (DeFi), Ethereum Ecosystem, Restaking, Liquid Restaking Tokens, Liquid Staking",ether-fi-staked-btc,246953794,246954729.0,,,N/A,451740.0
OKX,"Solana Ecosystem, Meme, Solana Meme, AI Meme, Pump.fun Ecosystem, Terminal of Truths, Binance Alpha Spotlight",fartcoin,247908874,247908874.0,,,N/A,188720907.0
OKX,"Arbitrum Ecosystem, Liquid Staking Tokens, Ethereum Ecosystem, Liquid Staking",sweth,246960127,246967013.0,,,N/A,240369.0
OKX,"Solana Ecosystem, Arbitrum Ecosystem, Ethereum Ecosystem, Interoperability, Base Ecosystem, Multicoin Capital Portfolio, Cross-chain Communication, Made in USA",wormhole,245105754,844626840.0,136466.10432741023,176251.41950071987,0.12,30819391.0
OKX,"Smart Contract Platform, Layer 2 (L2), Zero Knowledge (ZK), ZkSync Ecosystem, Consensys Portfolio, Blockchain Capital Portfolio, OKX Ventures Portfolio",zksync,244527864,1397302077.0,18683.76373923946,73581.42524658566,0.03,34232095.0
OKX,"Solana Ecosystem, Arbitrum Ecosystem, Impossible Finance Launchpad, Ethereum Ecosystem, DePIN, Animoca Brands Portfolio",aethir,245504495,1539524179.0,207994.2683310427,240979.79860077,0.05,69912222.0
OKX,"Decentralized Finance (DeFi), BNB Chain Ecosystem, Polygon Ecosystem, Fantom Ecosystem, Arbitrum Ecosystem, Moonbeam Ecosystem, Liquid Staking Tokens, Ethereum Ecosystem, Optimism Ecosystem, Polygon zkEVM Ecosystem, Liquid Staking, Made in USA",frax-ether,244166342,244166342.0,,,N/A,3738660.0
OKX,"Meme, Cardano Ecosystem",snek,235141462,238142211.0,,,N/A,1704286.0
OKX,"Smart Contract Platform, BNB Chain Ecosystem, GMCI Layer 1 Index, GMCI Index, Made in China",zilliqa,232766547,240858436.0,62880.06911892141,184313.1646120296,0.08,20829922.0
OKX,"Smart Contract Platform, Polkadot Ecosystem, Layer 1 (L1), Layer 2 (L2), Alameda Research Portfolio, Binance Labs Portfolio, OKX Ventures Portfolio",astar,230971740,253957899.0,114371.10044259414,163861.19281932022,0.07,8067518.0
OKX,"NFT, Ethereum Ecosystem, NFT Marketplace, FTX Holdings, NFTFi, eGirl Capital Portfolio, Paradigm Portfolio, GMCI DeFi Index, GMCI Index, Made in USA, Coinbase 50 Index",blur,228143575,304940457.0,51982.092429104734,75178.8405785797,0.1,29789046.0
OKX,"Stablecoins, USD Stablecoin, BNB Chain Ecosystem, Avalanche Ecosystem, Near Protocol Ecosystem, Arbitrum Ecosystem, Ethereum Ecosystem, Tron Ecosystem, BitTorrent Ecosystem, Algorithmic Stablecoin, Fiat-backed Stablecoin",usdd,222392296,222392296.0,,,N/A,3812634.0
OKX,"Bridged USDC, Sonic Ecosystem, Bridged-Tokens, Bridged Stablecoins",sonic-bridged-usdc-e-sonic,222165226,222165226.0,,,N/A,55995723.0
OKX,"Infrastructure, Wallets, Gnosis Chain Ecosystem, Ethereum Ecosystem",safe,221583346,400232706.0,97701.6241849557,99028.59175916445,0.02,15498229.0
OKX,"Smart Contract Platform, Proof of Stake (PoS), Made in China",qtum,220923748,225659862.0,16888.618625412386,86037.33652339164,0.05,21153291.0
OKX,"Decentralized Exchange (DEX), Exchange-based Tokens, Decentralized Finance (DeFi), Derivatives, Perpetuals, Ethereum Ecosystem, Paradigm Portfolio",dydx,221649928,221649928.0,,,N/A,16151591.0
OKX,"BNB Chain Ecosystem, Polygon Ecosystem, Ethereum Ecosystem, Animoca Brands Portfolio, DWF Labs Portfolio, Alameda Research Portfolio, Energi Ecosystem, Binance Labs Portfolio",mask-network,216970549,216970549.0,97275.02450598186,128641.75792227089,0.05,52868478.0
OKX,"Smart Contract Platform, Interoperability, Layer 2 (L2), Rollup, Multicoin Capital Portfolio, Proof of Work (PoW), DragonFly Capital Portfolio, Sequoia Capital Portfolio, Blockchain Capital Portfolio, Polychain Capital Portfolio, Made in China",nervos-network,217729591,221165126.0,,,N/A,13781195.0
OKX,"Solana Ecosystem, Avalanche Ecosystem, Polygon Ecosystem, Near Protocol Ecosystem, Harmony Ecosystem, Ethereum Ecosystem, Pantera Capital Portfolio, Energi Ecosystem, Made in USA",basic-attention-token,214647616,215269262.0,6525.578461059296,21176.16962740897,0.14,18432272.0
OKX,"BNB Chain Ecosystem, Meme, AI Meme",ai-companions,212647621,212647621.0,,,N/A,5999597.0
OKX,"Gaming (GameFi), Binance Launchpool, Meme, Play To Earn, TON Ecosystem, TON Meme, Tap to Earn",notcoin,209490730,209490730.0,49579.89197846537,103500.13203035295,0.05,74900615.0
OKX,"Smart Contract Platform, BNB Chain Ecosystem, Layer 1 (L1), Proof of Stake (PoS), Pantera Capital Portfolio, Andreessen Horowitz (a16z) Portfolio, Binance Labs Portfolio, Blockchain Capital Portfolio, Privacy Blockchain, Polychain Capital Portfolio, Coinbase 50 Index",oasis-network,209181028,310828190.0,,,N/A,12020879.0
OKX,"Layer 1 (L1), VeChain Ecosystem",vethor-token,206349738,206469351.0,,,N/A,6634034.0
OKX,"Infrastructure, Decentralized Finance (DeFi), Sui Ecosystem",deep,206526849,826107394.0,,,N/A,24349132.0
OKX,"Decentralized Exchange (DEX), Decentralized Finance (DeFi), Avalanche Ecosystem, Harmony Ecosystem, Ethereum Ecosystem, Coinbase Ventures Portfolio, Pantera Capital Portfolio, Energi Ecosystem, GMCI DeFi Index, Blockchain Capital Portfolio, GMCI Index, Made in USA",0x,204835826,241438774.0,16485.91768150824,33633.94015571847,0.12,29105344.0
OKX,"Decentralized Finance (DeFi), Aptos Ecosystem",abtc,205770604,205770604.0,,,N/A,145457.0
OKX,"Stablecoins, USD Stablecoin, Arbitrum Ecosystem, Ethereum Ecosystem, Base Ecosystem, Crypto-backed Stablecoin, Fiat-backed Stablecoin",gho,202373827,202419193.0,,,N/A,20193582.0
OKX,"Liquid Staking Tokens, Ethereum Ecosystem, Base Ecosystem, Liquid Staked ETH, Liquid Staking",liquid-staked-ethereum,201152660,201152660.0,,,N/A,251652.0
OKX,"Artificial Intelligence (AI), Harmony Ecosystem, Arbitrum Ecosystem, Ethereum Ecosystem, DePIN, Coinbase Ventures Portfolio, Multicoin Capital Portfolio, Pantera Capital Portfolio, GMCI DePIN Index, GMCI Index, Coinbase 50 Index",livepeer,201722532,201722532.0,39074.80185025354,98003.49634796113,0.06,30865019.0
OKX,"Smart Contract Platform, Gaming (GameFi), NFT, Layer 1 (L1), Play To Earn, Gaming Blockchains, WEMIX Ecosystem",wemix-token,198904078,255770196.0,,,N/A,4982665.0
OKX,"Stablecoins, Ethereum Ecosystem",usda-2,197545126,197545126.0,,,N/A,16761.44
OKX,"Gaming (GameFi), BNB Chain Ecosystem, Solana Ecosystem, Meme, Ethereum Ecosystem, Dog-Themed, Solana Meme, Gaming Utility Token",baby-doge-coin,195836038,497092840.0,43735.3527674177,69284.50285146391,0.08,15962916.0
OKX,"BNB Chain Ecosystem, Meme",cheems-token,194512740,194512740.0,,,N/A,4902767.0
OKX,"Smart Contract Platform, Storage, Harmony Ecosystem, Ethereum Ecosystem, DePIN, Energi Ecosystem, Sora Ecosystem, GMCI DePIN Index, GMCI Index",holotoken,193796245,193796245.0,,,N/A,10251104.0
OKX,"Decentralized Finance (DeFi), Yield Farming, BNB Chain Ecosystem, Avalanche Ecosystem, Polygon Ecosystem, Fantom Ecosystem, Arbitrum Ecosystem, Ethereum Ecosystem, Optimism Ecosystem, Linea Ecosystem, Bridge Governance Tokens, Base Ecosystem, FTX Holdings",stargate-finance,192190874,197836183.0,,,N/A,7862483.0
OKX,"Artificial Intelligence (AI), Solana Ecosystem, Meme, Solana Meme, AI Meme, AI Agents, Binance Alpha Spotlight, AI Framework, Made in USA",ai16z,191996904,191996904.0,,,N/A,67364481.0
OKX,"Decentralized Finance (DeFi), Polygon Ecosystem, Ethereum Ecosystem, Coinbase Ventures Portfolio, Pantera Capital Portfolio",instadapp,190734720,483646503.0,,,N/A,1209837.0
OKX,"Decentralized Exchange (DEX), Decentralized Finance (DeFi), Automated Market Maker (AMM), Cosmos Ecosystem, Osmosis Ecosystem, Paradigm Portfolio, Evmos Ecosystem, Secret Ecosystem, GMCI DeFi Index, GMCI Index",osmosis,191366177,266730207.0,,,N/A,12456347.0
OKX,"Infrastructure, Smart Contract Platform, BNB Chain Ecosystem, Layer 1 (L1), Ethereum Ecosystem, GMCI Layer 1 Index, Aelf Ecosystem, GMCI Index",aelf,189069984,254865376.0,13699.435728431883,30573.771548859426,0.12,74639738.0
OKX,"Smart Contract Platform, BNB Chain Ecosystem, Avalanche Ecosystem, Polygon Ecosystem, Arbitrum Ecosystem, Ethereum Ecosystem, Optimism Ecosystem, Base Ecosystem, Multicoin Capital Portfolio, Layer 0 (L0), Cross-chain Communication, Circle Ventures Portfolio, Sequoia Capital Portfolio, OKX Ventures Portfolio",layerzero,190245325,1711564909.0,6584.262331145885,7299.429726627712,0.12,34642342.0
OKX,"Artificial Intelligence (AI), Exchange-based Tokens, Analytics, Derivatives, Perpetuals, Centralized Exchange (CEX) Token, Ethereum Ecosystem, Binance Launchpad, Coinbase Ventures Portfolio, Binance Labs Portfolio, Made in USA",arkham,188417039,509654922.0,142404.79184830067,169350.6551078124,0.02,79183853.0
OKX,"Gaming (GameFi), NFT, Collectibles, Polygon Ecosystem, Ethereum Ecosystem, Animoca Brands Portfolio, Gaming Blockchains, Made in USA",superfarm,187169012,414369690.0,,,N/A,17285027.0
OKX,"Smart Contract Platform, Privacy, Layer 1 (L1), Proof of Stake (PoS), Proof of Work (PoW), Blockchain Capital Portfolio, Made in USA",decred,186849371,186850940.0,,,N/A,2962136.0
OKX,"Decentralized Exchange (DEX), BNB Chain Ecosystem, Solana Ecosystem, Ethereum Ecosystem, Real World Assets (RWA), Base Ecosystem, RWA Protocol",chex-token,185604680,185604680.0,,,N/A,1555648.0
OKX,"Crypto-Backed Tokens, Decentralized Finance (DeFi), Wrapped-Tokens, Ethereum Ecosystem",resolv-wstusr,184744046,164781176.0,,,N/A,162.11
OKX,"Infrastructure, Smart Contract Platform, NEO Ecosystem",gas,185767844,185767844.0,22193.17960297485,25437.073373339364,0.07,8990202.0
OKX,"Smart Contract Platform, Gaming (GameFi), Ethereum Ecosystem, Base Ecosystem, Card Games, Paradigm Portfolio, Gaming Blockchains, Gaming Utility Token",echelon-prime,186515900,368263624.0,,,N/A,3550298.0
OKX,"Smart Contract Platform, Layer 1 (L1), Celo Ecosystem, DWF Labs Portfolio, Coinbase Ventures Portfolio, Proof of Stake (PoS), Andreessen Horowitz (a16z) Portfolio, Optimism Superchain Ecosystem, Outlier Ventures Portfolio, Made in USA",celo,184397481,326212475.0,55222.75691591592,65174.49091151967,0.06,23070052.0
OKX,"Solana Ecosystem, Ethereum Ecosystem, Energi Ecosystem",swissborg,181245992,181245992.0,,,N/A,494840.0
OKX,"Smart Contract Platform, Layer 1 (L1), DePIN, Andreessen Horowitz (a16z) Portfolio, Made in USA",chia,180925702,411656688.0,17561.57027036552,48428.04951807326,0.08,4507013.0
OKX,"Solana Ecosystem, Meme, Solana Meme, AI Meme, Pump.fun Ecosystem",act-i-the-ai-prophecy,182945763,182945763.0,83322.20529123649,59854.261160223876,0.1,81277967.0
OKX,"Analytics, Avalanche Ecosystem, Meme, Cat-Themed, Made in USA",ket,184440202,184440202.0,,,N/A,8089195.0
OKX,"Smart Contract Platform, Privacy, Proof of Work (PoW)",mimblewimblecoin,180740026,180742638.0,,,N/A,7269.07
OKX,"Meme, Cronos Ecosystem, AI Meme, Cronos zkEVM Ecosystem",agentfun-ai,178753340,178753340.0,,,N/A,9644.75
OKX,"Solana Ecosystem, BRC-20, Bitcoin Ecosystem, Inscriptions",ordinals,180408558,180408558.0,74409.45905592563,247064.35668025067,0.02,68302387.0
OKX,"Artificial Intelligence (AI), Polkadot Ecosystem, Metaverse, Ethereum Ecosystem, Interoperability, Real World Assets (RWA), DePIN, Decentralized Science (DeSci), AI Agents",origintrail,178428032,178429804.0,,,N/A,9301914.0
OKX,"Exchange-based Tokens, Ethereum Ecosystem",btse-token,177836256,219467615.0,,,N/A,14383424.0
OKX,"Solana Ecosystem, Meme, Dog-Themed, Solana Meme, Bitcoin Ecosystem, Runes",dog-go-to-the-moon-rune,179355275,179355275.0,,,N/A,9489851.0
OKX,"Tokenized Real Estate, Tokenized Assets, Ethereum Ecosystem, Real World Assets (RWA), RWA Protocol",apf-coin,177717748,260937221.0,,,N/A,2890482.0
OKX,"Tourism, BNB Chain Ecosystem",trip,177613239,590037199.0,,,N/A,57508.0
OKX,"Infrastructure, Smart Contract Platform, Venom Ecosystem",venom,178896088,647532789.0,1063.384132460965,926.4245386969251,0.06,2384211.0
OKX,"Solana Ecosystem, Meme, Cat-Themed",meow,171942719,171942719.0,,,N/A,1440750.0
OKX,"Smart Contract Platform, Real World Assets (RWA), Proof of Work (PoW), Made in USA",ravencoin,178781965,178822217.0,12783.84182388702,35051.55040400628,0.08,16159449.0
OKX,"Smart Contract Platform, Storage, DePIN, Paradigm Portfolio, Proof of Work (PoW), DragonFly Capital Portfolio, Made in USA",siacoin,179134846,191427367.0,6158.955001810388,5883.659797088395,0.09,22123437.0
OKX,"Decentralized Finance (DeFi), BNB Chain Ecosystem, Polygon Ecosystem, Fantom Ecosystem, Arbitrum Ecosystem, Moonbeam Ecosystem, Liquid Staking Tokens, Ethereum Ecosystem, Optimism Ecosystem, Liquid Staked ETH, Liquid Staking",staked-frax-ether,177210325,177210325.0,,,N/A,800806.0
OKX,"Gaming (GameFi), BNB Chain Ecosystem, Ethereum Ecosystem, TON Ecosystem",gmt-token,174614352,174614352.0,,,N/A,24647726.0
OKX,"Gambling (GambleFi), Gaming (GameFi), Ethereum Ecosystem",rollbit-coin,174723051,174723051.0,,,N/A,578406.0
OKX,"Solana Ecosystem, Meme, Solana Meme, Pump.fun Ecosystem, Zoo-Themed, Memorial Themed",peanut-the-squirrel,173352673,173352673.0,83205.6701890777,233240.8967043787,0.06,343064322.0
OKX,"Gaming (GameFi), Ethereum Ecosystem, Decentralized Identifier (DID), Animoca Brands Portfolio, OKX Ventures Portfolio, Outlier Ventures Portfolio",mocaverse,173674908,807988129.0,,,N/A,29757296.0
OKX,,nem,171797690,171797690.0,,,N/A,36095894.0
OKX,"Decentralized Finance (DeFi), Launchpad, Ethereum Ecosystem, DWF Labs Portfolio, Coinbase Ventures Portfolio, Pantera Capital Portfolio, Blockchain Capital Portfolio",auction,172613537,200132313.0,54855.590723750895,108099.07601547589,0.08,100154075.0
OKX,"BNB Chain Ecosystem, Avalanche Ecosystem, Polygon Ecosystem, Fantom Ecosystem, Arbitrum Ecosystem, Ethereum Ecosystem, Optimism Ecosystem, Liquid Staking Governance Tokens, Linea Ecosystem, DePIN, Scroll Ecosystem, Rollups-as-a-Service (RaaS), Blast Ecosystem, Mode Ecosystem, Pantera Capital Portfolio, Polygon zkEVM Ecosystem, Binance Labs Portfolio, Liquid Staking, Made in USA",ankr,170796893,170796893.0,,,N/A,16801507.0
OKX,"Meme, Ethereum Ecosystem, Base Ecosystem, Cat-Themed, Murad Picks",mog-coin,170221713,170221713.0,,,N/A,17210455.0
OKX,"Solana Ecosystem, Meme, Solana Meme, Cat-Themed, Murad Picks",popcat,171387464,171387464.0,,,N/A,82346424.0
OKX,Arbitrum Ecosystem,rcge,168805259,168805259.0,,,N/A,2.43
OKX,"Decentralized Finance (DeFi), Yield Farming, Yield Aggregator, Yearn Ecosystem, Avalanche Ecosystem, Polygon Ecosystem, Near Protocol Ecosystem, Gnosis Chain Ecosystem, Fantom Ecosystem, Harmony Ecosystem, Arbitrum Ecosystem, Ethereum Ecosystem, Optimism Ecosystem, Base Ecosystem, Index Coop Defi Index, Alameda Research Portfolio, Energi Ecosystem, Sora Ecosystem, Huobi ECO Chain Ecosystem, Blockchain Capital Portfolio, Index Coop Index",yearn-finance,169092446,183693186.0,17352.096930270374,27634.900563845036,0.1,32998684.0
OKX,"Decentralized Finance (DeFi), Solana Ecosystem, Liquid Staking Tokens, Liquid Staked SOL, Liquid Staking",bybit-staked-sol,168142706,168142706.0,,,N/A,6951507.0
OKX,"Avalanche Ecosystem, Liquid Staking Tokens, Liquid Staking",benqi-liquid-staked-avax,168984952,168984952.0,,,N/A,1708557.0
OKX,"Launchpad, Meme, Base Ecosystem, Cat-Themed, Base Meme",toshi,166901595,166901595.0,,,N/A,65425713.0
OKX,"Starknet Ecosystem, Bridged-Tokens",bridged-wrapped-ether-starkgate,165938053,165938053.0,,,N/A,1438292.0
OKX,"Decentralized Finance (DeFi), Ethereum Ecosystem, Stablecoin Protocol",tribe-2,163747756,359872894.0,,,N/A,57207.0
OKX,"Artificial Intelligence (AI), Smart Contract Platform, Layer 1 (L1), Paradigm Portfolio, Coinbase Ventures Portfolio, DeFiance Capital Portfolio, Polychain Capital Portfolio, Vana Ecosystem",vana,165684729,645524920.0,,,N/A,47028784.0
OKX,"Decentralized Finance (DeFi), Solana Ecosystem, Ethereum Ecosystem, Optimism Ecosystem, Base Ecosystem, Cross-chain Communication, BTCfi",threshold-network-token,162670692,179199983.0,9983.968472020852,18412.839393256745,0.12,10838445.0
OKX,"Solana Ecosystem, DePIN, Multicoin Capital Portfolio, Made in USA",hivemapper,160420895,249508804.0,,,N/A,2745631.0
OKX,"Entertainment, Smart Contract Platform, Gaming (GameFi), NFT, Metaverse, Layer 1 (L1), Harmony Ecosystem, Ethereum Ecosystem, Gaming Blockchains, Energi Ecosystem",enjincoin,161569939,167161692.0,5717.739315305237,20685.490145474865,0.11,16861394.0
OKX,"Decentralized Exchange (DEX), Exchange-based Tokens, Ethereum Ecosystem",coinex-token,159675394,159675394.0,,,N/A,168391.0
OKX,"Solana Ecosystem, Meme, Dog-Themed, Solana Meme, Cat-Themed",cat-in-a-dogs-world,160341471,160341471.0,48870.78875894524,94754.48548178033,0.06,18750784.0
OKX,"Stablecoins, Ethereum Ecosystem, Crypto-backed Stablecoin",elixir-staked-deusd,159177362,159177362.0,,,N/A,2694714.0
OKX,"Decentralized Finance (DeFi), Liquid Staking Tokens, Ethereum Ecosystem, Liquid Staked ETH, Liquid Staking",treehouse-eth,159170741,159172783.0,,,N/A,930200.0
OKX,"Smart Contract Platform, Layer 1 (L1), Layer 0 (L0), Made in USA, Directed Acyclic Graph (DAG)",constellation-labs,156885961,156886074.0,,,N/A,2618152.0
OKX,"Decentralized Finance (DeFi), Tron Ecosystem",sun-token,158267781,320453654.0,,,N/A,44748219.0
OKX,"Internet of Things (IOT), Ethereum Ecosystem, DePIN, Base Ecosystem, Account Abstraction, GMCI DePIN Index, GMCI Index, Made in USA",iotex,155356953,155356953.0,,,N/A,8310673.0
OKX,"Artificial Intelligence (AI), Meme, Base Ecosystem, AI Agents, Binance Alpha Spotlight, AI Framework",freysa-ai,153844674,153844674.0,,,N/A,1120744.0
OKX,"Decentralized Finance (DeFi), Binance Launchpool, Arbitrum Ecosystem, Ethereum Ecosystem, Restaking, Liquid Restaking Governance Tokens, Ether.fi Ecosystem, Consensys Portfolio, OKX Ventures Portfolio",ether-fi,154305257,666067152.0,270935.890984377,380089.21868544794,0.02,60894401.0
OKX,BNB Chain Ecosystem,acet-token,151166433,197217753.0,,,N/A,1498514.0
OKX,"Oracle, Ethereum Ecosystem",redstone-oracles,152318737,543995490.0,,,N/A,149804888.0
OKX,"Smart Contract Platform, BNB Chain Ecosystem, Layer 1 (L1), Ethereum Ecosystem, ZetaChain Ecosystem, Cross-chain Communication, Made in USA",zetachain,151988538,436243760.0,184288.91270200952,222077.99323407692,0.1,14171632.0
OKX,"Decentralized Finance (DeFi), Yield Farming, Yield Aggregator, Ethereum Ecosystem, Metagovernance, Curve Ecosystem, Yield Optimizer",convex-finance,151155299,184087209.0,5188.085032446687,20073.564102615223,0.11,18286966.0
OKX,"Smart Contract Platform, EthereumPoW Ecosystem, Proof of Work (PoW)",ethereum-pow-iou,150598632,150598632.0,16811.867844056564,32350.365415091914,0.14,13224201.0
