OKX,"Decentralized Finance (DeFi), Arbitrum Ecosystem, Liquid Staking Tokens, Ethereum Ecosystem, Optimism Ecosystem, Base Ecosystem",cgeth-hashkey-cloud,325770104,325770104.0,,,N/A,32.64
OKX,"Stablecoins, USD Stablecoin, BNB Chain Ecosystem, Avalanche Ecosystem, Polygon Ecosystem, Optimism Ecosystem, Fiat-backed Stablecoin, Binance-Peg Tokens",binance-peg-busd,323566351,323566351.0,,,N/A,5849793.0
OKX,"Smart Contract Platform, Decentralized Finance (DeFi), Coinbase Ventures Portfolio, DeFiance Capital Portfolio, Pantera Capital Portfolio, YZi Labs (Prev. Binance Labs) Portfolio, Galaxy Digital Portfolio",terra-luna,317421549,378795760.0,11218.452633434428,31384.125337611636,0.09,17439234.0
OKX,"Smart Contract Platform, BNB Chain Ecosystem, Avalanche Ecosystem, Polygon Ecosystem, Arbitrum Ecosystem, Ethereum Ecosystem, Optimism Ecosystem, Base Ecosystem, Multicoin Capital Portfolio, Layer 0 (L0), Cross-chain Communication, Circle Ventures Portfolio, Sequoia Capital Portfolio, OKX Ventures Portfolio",layerzero,312048169,2807378823.0,795697.6565900623,988392.2851504206,0.04,113802848.0
OKX,"Decentralized Finance (DeFi), Tron Ecosystem",just,310332446,310332446.0,79400.19379212664,51936.12194095415,0.06,25163547.0
OKX,"BNB Chain Ecosystem, Meme",cheems-token,308095446,308095446.0,,,N/A,7262490.0
OKX,"Decentralized Exchange (DEX), Decentralized Finance (DeFi), Automated Market Maker (AMM), Base Ecosystem, Binance Alpha Spotlight, Made in USA",aerodrome-finance,303168484,588318304.0,,,N/A,34570230.0
OKX,"Decentralized Exchange (DEX), Smart Contract Platform, Decentralized Finance (DeFi), Prediction Markets, Layer 1 (L1), Gnosis Chain Ecosystem, MEV Protection, Arbitrum Ecosystem, Ethereum Ecosystem, SideChain, Energi Ecosystem",gnosis,301470868,349249477.0,,,N/A,24171574.0
OKX,"Meme, Base Ecosystem, Frog-Themed, Base Meme, The Boy’s Club",based-brett,300441233,300441233.0,,,N/A,36621171.0
OKX,"Solana Ecosystem, Meme, Solana Meme, Binance HODLer Airdrops, Airdropped Tokens by NFT Projects, Made in USA",pudgy-penguins,297177057,362719290.0,60577.70786976784,117007.54193884683,0.06,31393023.0
OKX,"Infrastructure, Wallets, Gnosis Chain Ecosystem, Ethereum Ecosystem",safe,294793633,520004272.0,84065.0630868926,85166.19616249786,0.06,30508984.0
OKX,"Decentralized Finance (DeFi), Solana Ecosystem, LSDFi, Restaking, Stablecoin Protocol, YZi Labs (Prev. Binance Labs) Portfolio, Binance HODLer Airdrops, Polychain Capital Portfolio",solayer,291064334,1386020638.0,,,N/A,84417906.0
OKX,"Decentralized Finance (DeFi), Near Protocol Ecosystem, Ethereum Ecosystem, Payment Solutions, Alleged SEC Securities, Pantera Capital Portfolio, Energi Ecosystem, Made in USA",amp-token,295008535,349077479.0,,,N/A,9928585.0
OKX,"Stablecoins, USD Stablecoin, BNB Chain Ecosystem, Avalanche Ecosystem, Near Protocol Ecosystem, Arbitrum Ecosystem, Ethereum Ecosystem, Tron Ecosystem, BitTorrent Ecosystem, Algorithmic Stablecoin, Fiat-backed Stablecoin",usdd,294385775,294385775.0,,,N/A,8299479.0
OKX,"Stablecoins, Ethereum Ecosystem, XRP Ledger Ecosystem, Fiat-backed Stablecoin, Made in USA",ripple-usd,293554292,293554292.0,,,N/A,42117552.0
OKX,"Smart Contract Platform, BNB Chain Ecosystem, Layer 1 (L1), Ethereum Ecosystem, Base Ecosystem, Proof of Stake (PoS), Pantera Capital Portfolio, Made in USA",chain-2,293420606,428006692.0,,,N/A,26579407.0
OKX,"Yield Aggregator, Ethereum Ecosystem, YZi Labs (Prev. Binance Labs) Portfolio, Polychain Capital Portfolio",stakestone-berachain-vault-token,288144059,288144059.0,,,N/A,3083177.0
OKX,"Decentralized Finance (DeFi), Ethereum Ecosystem, Restaking, Liquid Restaking Tokens, Liquid Staking, Liquid Staked BTC",ether-fi-staked-btc,286901750,286901750.0,,,N/A,1138564.0
OKX,"Smart Contract Platform, Zero Knowledge (ZK), FTX Holdings, Paradigm Portfolio, Coinbase Ventures Portfolio, Multicoin Capital Portfolio, Proof of Stake (PoS), Pantera Capital Portfolio, Circle Ventures Portfolio, Privacy Blockchain, Polychain Capital Portfolio, Made in USA, Coinbase 50 Index",mina-protocol,282883308,282883308.0,32819.31663494377,53185.02256083392,0.04,15550863.0
OKX,"Artificial Intelligence (AI), Smart Contract Platform, DePIN, Osmosis Ecosystem, Proof of Stake (PoS), Archway Ecosystem, Made in USA",akash-network,278142813,279092785.0,,,N/A,7894042.0
OKX,"Polygon Ecosystem, Bridged WETH, Bridged-Tokens",polygon-pos-bridged-weth-polygon-pos,279077013,279077013.0,,,N/A,17131751.0
OKX,"Exchange-based Tokens, Centralized Exchange (CEX) Token, Ethereum Ecosystem, Morph L2 Ecosystem",mx-token,270679660,1192680255.0,,,N/A,14433665.0
OKX,"Decentralized Finance (DeFi), Lending/Borrowing Protocols, Ethereum Ecosystem, Base Ecosystem, Coinbase Ventures Portfolio, Pantera Capital Portfolio, Morpho Ecosystem, Binance Alpha Spotlight",morpho,268341042,1129415349.0,168448.95846611366,207088.37569995603,0.07,17751985.0
OKX,"Polygon Ecosystem, Bridged WBTC, Bridged-Tokens",polygon-bridged-wbtc-polygon-pos,266833015,266833015.0,,,N/A,11415022.0
OKX,"Smart Contract Platform, Privacy, Masternodes, Alleged SEC Securities, Proof of Stake (PoS), Proof of Work (PoW), Made in USA",dash,264511564,264522901.0,,,N/A,41948062.0
OKX,"Smart Contract Platform, Ethereum Ecosystem, Real World Assets (RWA), DWF Labs Portfolio, Proof of Stake (PoS)",creditcoin-2,263206310,359394665.0,55682.913161136,58301.98338031029,0.03,9146814.0
OKX,"Stablecoins, Tokenized Assets, Tokenized Gold, BNB Chain Ecosystem, Real World Assets (RWA), Tokenized Commodities, Commodity-backed Stablecoin",quorium,261513096,261513096.0,,,N/A,93189.0
OKX,"Liquid Staking Tokens, Ethereum Ecosystem, Liquid Staking",stader-ethx,257206902,257206902.0,,,N/A,377820.0
OKX,"BNB Chain Ecosystem, Wallets, Ethereum Ecosystem, Animoca Brands Portfolio, Binance Launchpad, Energi Ecosystem, YZi Labs (Prev. Binance Labs) Portfolio",safepal,258249225,258249225.0,,,N/A,8297542.0
OKX,"Artificial Intelligence (AI), Smart Contract Platform, Storage, BNB Chain Ecosystem, Layer 1 (L1), Ethereum Ecosystem, DePIN, DWF Labs Portfolio, Osmosis Ecosystem, GMCI DePIN Index, GMCI Index",aioz-network,256594876,256738096.0,,,N/A,7780336.0
OKX,"Decentralized Exchange (DEX), Exchange-based Tokens, Decentralized Finance (DeFi), Automated Market Maker (AMM), BNB Chain Ecosystem, Avalanche Ecosystem, Polygon Ecosystem, Near Protocol Ecosystem, Harmony Ecosystem, Ethereum Ecosystem, FTX Holdings, Alameda Research Portfolio, DragonFly Capital Portfolio, Pantera Capital Portfolio, Energi Ecosystem, YZi Labs (Prev. Binance Labs) Portfolio, GMCI DeFi Index, Galaxy Digital Portfolio, Blockchain Capital Portfolio, Dex Aggregator, GMCI Index, Coinbase 50 Index",1inch,256405801,277689575.0,39990.459271861444,54289.433837195276,0.11,22029734.0
OKX,"Crypto-Backed Tokens, Wrapped-Tokens, Polygon Ecosystem, Arbitrum Ecosystem, Liquid Staking Tokens, Ethereum Ecosystem, Optimism Ecosystem, Base Ecosystem, Liquid Staked ETH, Liquid Staking",coinbase-wrapped-staked-eth,252272102,739878353.0,,,N/A,3451805.0
OKX,"Smart Contract Platform, Layer 1 (L1), MEV Protection, Proof of Work (PoW), Privacy Blockchain, Mobile Mining",verus-coin,249773143,249774278.0,,,N/A,11616.27
OKX,"Solana Ecosystem, Meme, Dog-Themed, Solana Meme, Cat-Themed",cat-in-a-dogs-world,245455796,245455796.0,50006.8210827858,137619.2891913575,0.04,70575068.0
OKX,"Smart Contract Platform, Polkadot Ecosystem, Proof of Stake (PoS), Pantera Capital Portfolio, Made in USA, Coinbase 50 Index",kusama,243630539,243635373.0,13689.74216313296,23584.705744399907,0.13,9061315.0
OKX,"Infrastructure, Smart Contract Platform, Venom Ecosystem",venom,241642974,851656571.0,20061.69638950181,18236.183293155475,0.02,2326489.0
OKX,"Arbitrum Ecosystem, Liquid Staking Tokens, Ethereum Ecosystem, Liquid Staking",sweth,239133603,239140270.0,,,N/A,287700.0
OKX,"Smart Contract Platform, Privacy, Proof of Work (PoW)",mimblewimblecoin,236370253,236370788.0,,,N/A,180555.0
OKX,"Solana Ecosystem, Arbitrum Ecosystem, Impossible Finance Launchpad, Ethereum Ecosystem, DePIN, Animoca Brands Portfolio",aethir,236626336,1258121301.0,130765.51590801592,179035.17952358484,0.1,54735880.0
OKX,"Artificial Intelligence (AI), Ethereum Ecosystem, DePIN, Energi Ecosystem, GMCI DePIN Index, GMCI Index",golem,234632477,234632477.0,6860.9451994537285,12547.90778168266,0.09,15079002.0
OKX,"Meme, Cardano Ecosystem",snek,230319758,233109365.0,,,N/A,2361565.0
OKX,"Crypto-Backed Tokens, Decentralized Finance (DeFi), cToken, Ethereum Ecosystem",compound-wrapped-btc,230642379,230642379.0,,,N/A,0.0
OKX,"NFT, Ethereum Ecosystem, NFT Marketplace, FTX Holdings, NFTFi, eGirl Capital Portfolio, Paradigm Portfolio, GMCI DeFi Index, GMCI Index, Made in USA, Coinbase 50 Index",blur,229102483,302103578.0,46705.77096597341,50700.26093957459,0.1,19752491.0
OKX,"Decentralized Finance (DeFi), BNB Chain Ecosystem, Polygon Ecosystem, Fantom Ecosystem, Arbitrum Ecosystem, Moonbeam Ecosystem, Liquid Staking Tokens, Ethereum Ecosystem, Optimism Ecosystem, Polygon zkEVM Ecosystem, Liquid Staking, Made in USA",frax-ether,227461191,227461191.0,,,N/A,1394923.0
OKX,"Smart Contract Platform, DePIN, Proof of Stake (PoS), Made in USA",theta-fuel,222800551,222817205.0,,,N/A,2907088.0
OKX,"Smart Contract Platform, Layer 2 (L2), Zero Knowledge (ZK), ZkSync Ecosystem, Consensys Portfolio, Blockchain Capital Portfolio, OKX Ventures Portfolio",zksync,222462937,1271216784.0,48920.78913607786,82354.81139604237,0.03,29756399.0
OKX,"Artificial Intelligence (AI), Analytics, Base Ecosystem, Binance HODLer Airdrops",kaito,221297374,916767025.0,116642.16322973627,241870.9443831578,0.03,54868794.0
OKX,"Decentralized Exchange (DEX), Exchange-based Tokens, Decentralized Finance (DeFi), Yield Farming, Derivatives, Synthetic Issuer, Avalanche Ecosystem, Polygon Ecosystem, Near Protocol Ecosystem, Fantom Ecosystem, Harmony Ecosystem, Ethereum Ecosystem, Optimism Ecosystem, Base Ecosystem, DWF Labs Portfolio, Paradigm Portfolio, Coinbase Ventures Portfolio, Index Coop Defi Index, Energi Ecosystem, Huobi ECO Chain Ecosystem, GMCI DeFi Index, Synthetic, Index Coop Index, GMCI Index, Coinbase 50 Index",havven,219141412,219414887.0,9487.699366455254,23973.38562265533,0.08,26641086.0
OKX,"Smart Contract Platform, BNB Chain Ecosystem, GMCI Layer 1 Index, GMCI Index, Made in China",zilliqa,218825694,226397300.0,98949.68865704809,146033.64854234926,0.09,13148091.0
OKX,"Gaming (GameFi), NFT, Collectibles, Polygon Ecosystem, Ethereum Ecosystem, Animoca Brands Portfolio, Gaming Blockchains, Made in USA",superfarm,215420211,476914448.0,,,N/A,18239901.0
OKX,"Smart Contract Platform, Gaming (GameFi), NFT, Layer 1 (L1), Play To Earn, Gaming Blockchains, WEMIX Ecosystem",wemix-token,217371738,279368908.0,,,N/A,2679468.0
OKX,"Stablecoins, Ethereum Ecosystem",usda-2,213109679,213109679.0,,,N/A,1715473.0
OKX,"Gaming (GameFi), Binance Launchpool, Meme, Play To Earn, TON Ecosystem, TON Meme, Tap to Earn",notcoin,212594192,212594192.0,61356.322789543476,110119.20866888291,0.1,37953945.0
OKX,"Stablecoins, USD Stablecoin, Arbitrum Ecosystem, Ethereum Ecosystem, Base Ecosystem, Crypto-backed Stablecoin, Fiat-backed Stablecoin",gho,211658128,211658128.0,,,N/A,9150601.0
OKX,"Decentralized Finance (DeFi), Aptos Ecosystem",abtc,206035488,206035488.0,,,N/A,320227.0
OKX,"Stablecoins, USD Stablecoin, Solana Ecosystem, Fiat-backed Stablecoin",global-dollar,206817443,206817443.0,,,N/A,4075509.0
OKX,"Smart Contract Platform, Interoperability, Layer 2 (L2), Rollup, Multicoin Capital Portfolio, Proof of Work (PoW), DragonFly Capital Portfolio, Sequoia Capital Portfolio, Blockchain Capital Portfolio, Polychain Capital Portfolio, Made in China",nervos-network,204614744,207864045.0,,,N/A,10403731.0
OKX,"Stablecoins, USD Stablecoin, Ethereum Ecosystem, Fiat-backed Stablecoin",elixir-deusd,204348043,204348043.0,,,N/A,7990907.0
OKX,"Smart Contract Platform, Polkadot Ecosystem, Layer 1 (L1), Ethereum Ecosystem, Layer 2 (L2), Alameda Research Portfolio, YZi Labs (Prev. Binance Labs) Portfolio, OKX Ventures Portfolio",astar,200976233,220938620.0,123793.11241665689,149486.86819453692,0.08,18870109.0
OKX,"Crypto-Backed Tokens, Wrapped-Tokens, Avalanche Ecosystem",wrapped-avax,200292711,200292711.0,,,N/A,19456964.0
OKX,"Infrastructure, Ethereum Ecosystem, Data Availability, Restaking, Polychain Capital Portfolio, Made in USA",eigenlayer,199609288,1402131207.0,125920.2324876876,158054.29591447007,0.12,36124649.0
OKX,"Liquid Staking Tokens, Ethereum Ecosystem, Base Ecosystem, Liquid Staked ETH, Liquid Staking",liquid-staked-ethereum,199558850,199558850.0,,,N/A,1902038.0
OKX,"Smart Contract Platform, BNB Chain Ecosystem, Layer 1 (L1), Ethereum Ecosystem, ZetaChain Ecosystem, Cross-chain Communication, Made in USA, Chain Abstraction",zetachain,196439802,528685759.0,170037.89254783528,202964.27486112036,0.08,42997346.0
OKX,"Solana Ecosystem, Avalanche Ecosystem, Polygon Ecosystem, Near Protocol Ecosystem, Harmony Ecosystem, Ethereum Ecosystem, Pantera Capital Portfolio, Energi Ecosystem, Made in USA",basic-attention-token,197270702,197842023.0,8854.258064347649,14442.724731678683,0.08,18417302.0
OKX,"Decentralized Exchange (DEX), Decentralized Finance (DeFi), Avalanche Ecosystem, Harmony Ecosystem, Ethereum Ecosystem, Coinbase Ventures Portfolio, Pantera Capital Portfolio, Energi Ecosystem, GMCI DeFi Index, Blockchain Capital Portfolio, GMCI Index, Made in USA",0x,196699288,231848285.0,20682.887626717937,38076.609030114654,0.09,39844206.0
OKX,"Analytics, Avalanche Ecosystem, Meme, Cat-Themed, Made in USA",ket,195388014,195388014.0,,,N/A,7709057.0
OKX,"Meme, Cronos Ecosystem, AI Meme, Cronos zkEVM Ecosystem",agentfun-ai,193630541,193630541.0,,,N/A,9270.26
OKX,"Smart Contract Platform, Proof of Stake (PoS), Made in China",qtum,194843825,198967132.0,35683.6998399586,55799.127960310616,0.05,14670333.0
OKX,"Solana Ecosystem, Meme, Cat-Themed",meow,193632432,193632432.0,,,N/A,62510.0
OKX,"Smart Contract Platform, Gaming (GameFi), Ethereum Ecosystem, Base Ecosystem, Card Games, Paradigm Portfolio, Gaming Blockchains, Gaming Utility Token",echelon-prime,195789015,375472250.0,,,N/A,9965591.0
OKX,"Exchange-based Tokens, Ethereum Ecosystem",btse-token,190594193,235212178.0,,,N/A,3346789.0
OKX,"Artificial Intelligence (AI), Exchange-based Tokens, Analytics, Derivatives, Perpetuals, Centralized Exchange (CEX) Token, Ethereum Ecosystem, Binance Launchpad, Coinbase Ventures Portfolio, YZi Labs (Prev. Binance Labs) Portfolio, Made in USA",arkham,190708035,491805330.0,142185.941657589,179977.44090677868,0.04,87006442.0
OKX,"Gaming (GameFi), BNB Chain Ecosystem, Solana Ecosystem, Meme, Ethereum Ecosystem, Dog-Themed, Solana Meme, Gaming Utility Token",baby-doge-coin,188654904,478864925.0,40188.827857849894,68627.14019769242,0.09,15936168.0
OKX,"Internet of Things (IOT), Smart Contract Platform, Layer 1 (L1), Proof of Work (PoW), Made in USA",digibyte,188098271,188152428.0,5305.368884003381,34080.33559437541,0.14,27509667.0
OKX,"Solana Ecosystem, Ethereum Ecosystem, Energi Ecosystem",swissborg,185141831,185141831.0,,,N/A,654321.0
OKX,"Layer 1 (L1), VeChain Ecosystem",vethor-token,185696951,185699988.0,,,N/A,4000029.0
OKX,"Tourism, BNB Chain Ecosystem",trip,184557977,613107857.0,,,N/A,18610.44
OKX,"Smart Contract Platform, Oracle, Layer 1 (L1), Ethereum Ecosystem, Mantle Ecosystem, Cross-chain Communication, Consensys Portfolio",entangle,206840701,290021225.0,,,N/A,12138.07
OKX,"Infrastructure, Smart Contract Platform, BNB Chain Ecosystem, Layer 1 (L1), Ethereum Ecosystem, GMCI Layer 1 Index, Aelf Ecosystem, GMCI Index",aelf,182866756,246428895.0,7305.463439458965,6841.756254560801,0.08,20644740.0
OKX,"Smart Contract Platform, Privacy, Layer 1 (L1), Proof of Stake (PoS), Proof of Work (PoW), Blockchain Capital Portfolio, Made in USA",decred,181502523,181506024.0,,,N/A,2561657.0
OKX,"BNB Chain Ecosystem, Binance Alpha Spotlight",bnb48-club-token,178527064,178527064.0,,,N/A,153755.0
OKX,"Decentralized Exchange (DEX), BNB Chain Ecosystem, Solana Ecosystem, Ethereum Ecosystem, Real World Assets (RWA), Base Ecosystem, RWA Protocol",chex-token,173536983,173536983.0,,,N/A,650181.0
OKX,"Decentralized Finance (DeFi), Yield Farming, BNB Chain Ecosystem, Avalanche Ecosystem, Polygon Ecosystem, Fantom Ecosystem, Arbitrum Ecosystem, Ethereum Ecosystem, Optimism Ecosystem, Linea Ecosystem, Bridge Governance Tokens, Base Ecosystem, FTX Holdings",stargate-finance,177751810,182972994.0,,,N/A,5820589.0
OKX,"Artificial Intelligence (AI), Harmony Ecosystem, Arbitrum Ecosystem, Ethereum Ecosystem, DePIN, Coinbase Ventures Portfolio, Multicoin Capital Portfolio, Pantera Capital Portfolio, GMCI DePIN Index, GMCI Index, Coinbase 50 Index",livepeer,176393741,176393741.0,28985.53007923673,55831.7304249149,0.07,22977130.0
OKX,"Artificial Intelligence (AI), Polkadot Ecosystem, Metaverse, Ethereum Ecosystem, Interoperability, Real World Assets (RWA), DePIN, Decentralized Science (DeSci), AI Agents",origintrail,174353209,174598964.0,,,N/A,1826907.0
OKX,"Decentralized Exchange (DEX), Decentralized Finance (DeFi), Automated Market Maker (AMM), Cosmos Ecosystem, Osmosis Ecosystem, Paradigm Portfolio, Proof of Stake (PoS), Evmos Ecosystem, Secret Ecosystem, GMCI DeFi Index, GMCI Index, Made in USA",osmosis,173964996,241183633.0,,,N/A,14579563.0
OKX,"Decentralized Finance (DeFi), BNB Chain Ecosystem, Polygon Ecosystem, Fantom Ecosystem, Arbitrum Ecosystem, Moonbeam Ecosystem, Liquid Staking Tokens, Ethereum Ecosystem, Optimism Ecosystem, Liquid Staked ETH, Liquid Staking",staked-frax-ether,173668310,173668310.0,,,N/A,262212.0
OKX,"Internet of Things (IOT), Ethereum Ecosystem, DePIN, Base Ecosystem, Account Abstraction, GMCI DePIN Index, GMCI Index, Made in USA",iotex,173112008,173112008.0,,,N/A,11994850.0
OKX,"Gaming (GameFi), Ethereum Ecosystem, Decentralized Identifier (DID), Animoca Brands Portfolio, OKX Ventures Portfolio, Outlier Ventures Portfolio",mocaverse,173366057,709609401.0,,,N/A,25016925.0
OKX,"SocialFi, Arbitrum Ecosystem",uxlink,177299025,524243125.0,46008.6511775242,64563.92642791077,0.06,232483867.0
OKX,"Artificial Intelligence (AI), Solana Ecosystem, Meme, Solana Meme, AI Meme, AI Agents, Binance Alpha Spotlight, AI Framework, Made in USA",ai16z,170748263,170748263.0,,,N/A,109011286.0
OKX,"Smart Contract Platform, Layer 1 (L1), Celo Ecosystem, DWF Labs Portfolio, Coinbase Ventures Portfolio, Proof of Stake (PoS), Andreessen Horowitz (a16z) Portfolio, Optimism Superchain Ecosystem, Outlier Ventures Portfolio, Made in USA",celo,170621210,300411459.0,24152.60786578671,32629.740023865415,0.07,25388030.0
OKX,Arbitrum Ecosystem,rcge,168805259,168805259.0,,,N/A,2.43
OKX,"Decentralized Finance (DeFi), Yield Farming, Yield Aggregator, Ethereum Ecosystem, Metagovernance, Curve Ecosystem, Yield Optimizer",convex-finance,167194305,203642589.0,9599.884960332012,20013.838761904044,0.2,22369760.0
OKX,"Avalanche Ecosystem, Liquid Staking Tokens, Liquid Staking",benqi-liquid-staked-avax,167486295,167486295.0,,,N/A,1445167.0
OKX,"BNB Chain Ecosystem, Avalanche Ecosystem, Polygon Ecosystem, Fantom Ecosystem, Arbitrum Ecosystem, Ethereum Ecosystem, Optimism Ecosystem, Liquid Staking Governance Tokens, Linea Ecosystem, DePIN, Scroll Ecosystem, Rollups-as-a-Service (RaaS), Blast Ecosystem, Mode Ecosystem, Pantera Capital Portfolio, Polygon zkEVM Ecosystem, YZi Labs (Prev. Binance Labs) Portfolio, Liquid Staking, Made in USA",ankr,167289355,167289355.0,,,N/A,31973414.0
OKX,"Smart Contract Platform, BNB Chain Ecosystem, Layer 1 (L1), Proof of Stake (PoS), Pantera Capital Portfolio, Andreessen Horowitz (a16z) Portfolio, YZi Labs (Prev. Binance Labs) Portfolio, Blockchain Capital Portfolio, Privacy Blockchain, Polychain Capital Portfolio, Coinbase 50 Index",oasis-network,167049531,248223770.0,,,N/A,18507022.0
OKX,"Decentralized Exchange (DEX), Decentralized Finance (DeFi), Yield Farming, Automated Market Maker (AMM), BNB Chain Ecosystem, Seigniorage, Solana Ecosystem, Avalanche Ecosystem, Polygon Ecosystem, Fantom Ecosystem, Harmony Ecosystem, Arbitrum Ecosystem, Moonriver Ecosystem, Ethereum Ecosystem, Liquid Staking Governance Tokens, Curve Ecosystem, Stablecoin Protocol, Polygon zkEVM Ecosystem, Evmos Ecosystem, Fraxtal Ecosystem, GMCI DeFi Index, Liquid Staking, GMCI Index, Made in USA",frax-share,167259809,187435355.0,6694.4414680198815,12173.821453756944,0.11,17333360.0
OKX,"Smart Contract Platform, Storage, Harmony Ecosystem, Ethereum Ecosystem, DePIN, Energi Ecosystem, Sora Ecosystem, GMCI DePIN Index, GMCI Index",holotoken,166842843,166842843.0,,,N/A,12015841.0
OKX,"Artificial Intelligence (AI), Smart Contract Platform, Layer 1 (L1), Paradigm Portfolio, Coinbase Ventures Portfolio, DeFiance Capital Portfolio, Polychain Capital Portfolio, Vana Ecosystem",vana,163573430,637299078.0,,,N/A,20960721.0
OKX,"Decentralized Finance (DeFi), Tron Ecosystem",sun-token,161980252,327779054.0,,,N/A,31116621.0
OKX,"Starknet Ecosystem, Bridged-Tokens",bridged-wrapped-ether-starkgate,160452237,160452237.0,,,N/A,1978130.0
OKX,"Decentralized Exchange (DEX), Exchange-based Tokens, Ethereum Ecosystem",coinex-token,160635022,160635022.0,,,N/A,141990.0
OKX,"Solana Ecosystem, Meme, Solana Meme, Cat-Themed, Murad Picks",popcat,160072582,160072582.0,,,N/A,64281580.0
OKX,"Decentralized Finance (DeFi), Polygon Ecosystem, Ethereum Ecosystem, Coinbase Ventures Portfolio, Pantera Capital Portfolio",instadapp,159213269,403717482.0,20139.423747445537,20183.42891827814,0.02,5857271.0
OKX,"Decentralized Finance (DeFi), Yield Farming, Yield Aggregator, Yearn Ecosystem, Avalanche Ecosystem, Polygon Ecosystem, Near Protocol Ecosystem, Gnosis Chain Ecosystem, Fantom Ecosystem, Harmony Ecosystem, Arbitrum Ecosystem, Ethereum Ecosystem, Optimism Ecosystem, Base Ecosystem, Index Coop Defi Index, Alameda Research Portfolio, Energi Ecosystem, Sora Ecosystem, Huobi ECO Chain Ecosystem, Blockchain Capital Portfolio, Index Coop Index",yearn-finance,159548194,173140042.0,11765.66338954379,20998.336774337946,0.08,29524209.0
OKX,"Smart Contract Platform, Layer 1 (L1), DePIN, Andreessen Horowitz (a16z) Portfolio, Made in USA",chia,159629889,361510252.0,20402.148227898986,27127.55520840286,0.09,8035785.0
OKX,"Smart Contract Platform, Real World Assets (RWA), Proof of Work (PoW), Made in USA",ravencoin,158324472,158327876.0,20147.6094944825,26370.58167582065,0.09,8530234.0
OKX,"Smart Contract Platform, Storage, DePIN, Paradigm Portfolio, Proof of Work (PoW), DragonFly Capital Portfolio, Made in USA",siacoin,156850605,167869690.0,67885.54754181001,67103.59483097563,0.04,24030951.0
OKX,"BNB Chain Ecosystem, Meme, AI Meme",ai-companions,152994852,152994852.0,,,N/A,6494142.0
OKX,"Stablecoins, EUR Stablecoin, Solana Ecosystem, Avalanche Ecosystem, Ethereum Ecosystem, Base Ecosystem, Stellar Ecosystem",euro-coin,156309263,156309263.0,254347.53966946,249664.5571082799,0.11,89264696.0
OKX,"Decentralized Finance (DeFi), Liquid Staking Tokens, Ethereum Ecosystem, Liquid Staked ETH, Liquid Staking",treehouse-eth,156330568,156330568.0,,,N/A,101686.0
OKX,"Decentralized Finance (DeFi), Ethereum Ecosystem, Stablecoin Protocol",tribe-2,153669289,337723174.0,,,N/A,58822.0
OKX,"Smart Contract Platform, Layer 1 (L1), Harmony Ecosystem, Animoca Brands Portfolio, Binance Launchpad, YZi Labs (Prev. Binance Labs) Portfolio, Made in USA",harmony,152861556,153384186.0,16103.57870971358,24472.865958515467,0.09,11986790.0
OKX,"Gambling (GambleFi), Gaming (GameFi), Ethereum Ecosystem",rollbit-coin,152514516,152514516.0,,,N/A,644313.0
OKX,"Decentralized Finance (DeFi), Derivatives, Prediction Markets, Solana Ecosystem",drift-protocol,149692720,507778069.0,,,N/A,25809458.0
OKX,"Solana Ecosystem, BRC-20, Bitcoin Ecosystem, Inscriptions",ordinals,150565914,150565914.0,81391.48356747566,191055.0281638193,0.03,51676888.0
OKX,"Meme, Ethereum Ecosystem, Base Ecosystem, Cat-Themed, Murad Picks",mog-coin,146966401,146966401.0,,,N/A,14345216.0
OKX,"Gaming (GameFi), Play To Earn, Telegram Apps, TON Ecosystem, Tap to Earn, Arcade Games",hamster-kombat,147815705,229616630.0,26698.37056208976,37918.206261454914,0.09,63074255.0
OKX,"Smart Contract Platform, Layer 1 (L1), Real World Assets (RWA), RWA Protocol",polymesh,147873468,147873468.0,,,N/A,2454833.0
OKX,"Infrastructure, Decentralized Finance (DeFi), Sui Ecosystem",deep,147230564,588922255.0,,,N/A,18444305.0
OKX,"Solana Ecosystem, Meme, Solana Meme, Pump.fun Ecosystem, Zoo-Themed, Memorial Themed",peanut-the-squirrel,147072605,147072605.0,129266.40596978055,323013.4366101348,0.07,101662914.0
OKX,"Stablecoins, Tokenized Assets, Tokenized Gold, Real World Assets (RWA), Tokenized Commodities",kinesis-gold,143689330,143689330.0,,,N/A,31778058.0
OKX,"Decentralized Finance (DeFi), Solana Ecosystem, Ethereum Ecosystem, Optimism Ecosystem, Base Ecosystem, Cross-chain Communication, BTCfi",threshold-network-token,143269232,157807580.0,11154.665802015465,15347.334148425885,0.07,8335996.0
OKX,"Stablecoins, BNB Chain Ecosystem",astherus-usdf,142634596,142634596.0,,,N/A,2045246.0
OKX,"Artificial Intelligence (AI), Meme, Base Ecosystem, AI Agents, Binance Alpha Spotlight, AI Framework",freysa-ai,142792129,142792129.0,,,N/A,867949.0
OKX,"Tokenized Assets, Polygon Ecosystem, Arbitrum Ecosystem, Ethereum Ecosystem, Real World Assets (RWA), Starknet Ecosystem, Tokenized Treasury Bills (T-Bills)",eutbl,141818165,141818165.0,,,N/A,0.0
OKX,"Gaming (GameFi), BNB Chain Ecosystem, Ethereum Ecosystem, TON Ecosystem",gmt-token,140169818,140169818.0,,,N/A,17285343.0
OKX,"Solana Ecosystem, Meme, Solana Meme, Murad Picks",gigachad-2,140743639,140743639.0,,,N/A,6762275.0
OKX,"Polygon Ecosystem, Bridged DAI, Bridged-Tokens, Bridged Stablecoins",polygon-pos-bridged-dai-polygon-pos,139684613,139684613.0,,,N/A,14590233.0
OKX,"Solana Ecosystem, Meme, Dog-Themed, Solana Meme, Bitcoin Ecosystem, Runes",dog-go-to-the-moon-rune,140096448,140096448.0,,,N/A,11573502.0
