OKX,"Ethereum Ecosystem, Crypto-backed Stablecoin, Yield-Bearing Stablecoin",elixir-staked-deusd,139963194,139963194.0,,,N/A,757759.0
OKX,"Tokenized Real Estate, Tokenized Assets, Ethereum Ecosystem, Real World Assets (RWA), RWA Protocol",apf-coin,138020732,202651375.0,,,N/A,2703095.0
OKX,"Crypto-Backed Tokens, BNB Chain Ecosystem, Wrapped-Tokens, Ethereum Ecosystem",wrapped-beacon-eth,137204419,137204419.0,,,N/A,8013684.0
OKX,"Smart Contract Platform, Crypto-Backed Tokens, Wrapped-Tokens, Layer 2 (L2), Mantle Ecosystem",wrapped-ether-mantle-bridge,137421887,137421887.0,,,N/A,4289969.0
OKX,"Stablecoins, EUR Stablecoin, Polygon Ecosystem, Ethereum Ecosystem, Real World Assets (RWA), Fiat-backed Stablecoin",stasis-eurs,136412954,136412954.0,,,N/A,377232.0
OKX,BNB Chain Ecosystem,acet-token,137517294,179410543.0,,,N/A,511441.0
OKX,"Entertainment, Smart Contract Platform, Gaming (GameFi), NFT, Metaverse, Layer 1 (L1), Harmony Ecosystem, Ethereum Ecosystem, Gaming Blockchains, Energi Ecosystem",enjincoin,136013657,140442129.0,7859.279365002046,20201.69857367826,0.03,14404933.0
OKX,"Stablecoins, Decentralized Finance (DeFi), USD Stablecoin, BNB Chain Ecosystem, Polygon Ecosystem, Gnosis Chain Ecosystem, Arbitrum Ecosystem, Ethereum Ecosystem, Optimism Ecosystem, Base Ecosystem, Crypto-backed Stablecoin, Fiat-backed Stablecoin",crvusd,135812716,135812716.0,,,N/A,19332078.0
OKX,"Gaming (GameFi), NFT, Solana Ecosystem, Animoca Brands Portfolio, FTX Holdings, Multicoin Capital Portfolio, Alameda Research Portfolio",metaplex,135582217,173131816.0,,,N/A,4554531.0
OKX,"Smart Contract Platform, BNB Chain Ecosystem, Ethereum Ecosystem, Zero Knowledge (ZK), Animoca Brands Portfolio, YZi Labs (Prev. Binance Labs) Portfolio, OKX Ventures Portfolio",polyhedra-network,135649910,2246473614.0,375840.78297024465,378416.9854138962,0.02,13606671.0
OKX,"Smart Contract Platform, Layer 1 (L1), Base Ecosystem, Layer 0 (L0), Made in USA, Directed Acyclic Graph (DAG)",constellation-labs,135042267,135042365.0,,,N/A,2705483.0
OKX,"Smart Contract Platform, EthereumPoW Ecosystem, Proof of Work (PoW)",ethereum-pow-iou,133653192,133653192.0,23462.293522068496,26232.294233585617,0.08,7407557.0
OKX,"Solana Ecosystem, DePIN, Multicoin Capital Portfolio, Made in USA",hivemapper,133764862,206851911.0,,,N/A,679986.0
OKX,"Infrastructure, Smart Contract Platform, NEO Ecosystem",gas,133782522,133782522.0,23028.604128126553,23798.813756719574,0.05,5978261.0
OKX,Smart Contract Platform,bitkub-coin,133776420,165620778.0,,,N/A,438694.0
OKX,,nem,131203985,131203985.0,,,N/A,15907621.0
OKX,"Decentralized Finance (DeFi), Solana Ecosystem, Liquid Staking Tokens, Liquid Staked SOL, Liquid Staking",bybit-staked-sol,131420287,131420287.0,,,N/A,708340.0
OKX,"Decentralized Exchange (DEX), Exchange-based Tokens, Decentralized Finance (DeFi), Automated Market Maker (AMM), BNB Chain Ecosystem, Derivatives, Perpetuals, Centralized Exchange (CEX) Token, Solana Ecosystem, Avalanche Ecosystem, Polygon Ecosystem, Near Protocol Ecosystem, Fantom Ecosystem, Arbitrum Ecosystem, Ethereum Ecosystem, ZkSync Ecosystem, Mantle Ecosystem, Linea Ecosystem, Base Ecosystem, DragonFly Capital Portfolio, YZi Labs (Prev. Binance Labs) Portfolio",woo-network,131291111,151854558.0,17295.74365994842,20513.40165209054,0.1,10354615.0
OKX,"Solana Ecosystem, Liquid Staking Tokens, Liquid Staked SOL, Liquid Staking",drift-staked-sol,130841770,130841770.0,,,N/A,295813.0
OKX,"Smart Contract Platform, Masternodes, Zero Knowledge (ZK), Proof of Work (PoW), Made in USA",zencash,131726195,131728931.0,,,N/A,18236571.0
OKX,"Exchange-based Tokens, Decentralized Finance (DeFi), Ethereum Ecosystem, Real World Assets (RWA), Alleged SEC Securities",lcx,130691088,131942525.0,,,N/A,997484.0
OKX,"Cronos Ecosystem, Bridged USDC, Bridged-Tokens, Bridged Stablecoins",cronos-bridged-usdc-cronos,128909887,128909887.0,,,N/A,1733785.0
OKX,"Gaming (GameFi), Polkadot Ecosystem, NFT, Ethereum Ecosystem, Gaming Blockchains, Andreessen Horowitz (a16z) Portfolio, YZi Labs (Prev. Binance Labs) Portfolio, Galaxy Digital Portfolio, Made in USA",mythos,127223875,161234439.0,,,N/A,2277291.0
OKX,"BNB Chain Ecosystem, Binance-Peg Tokens",binance-peg-sol,127393258,127393258.0,,,N/A,3314202.0
OKX,"BNB Chain Ecosystem, Arbitrum Ecosystem, Cardano Ecosystem, Ethereum Ecosystem, DePIN, Base Ecosystem, DWF Labs Portfolio",world-mobile-token,127931103,361503363.0,,,N/A,16078654.0
OKX,"Liquid Staking Tokens, Aptos Ecosystem, Liquid Staking",amnis-aptos,125887710,125914378.0,,,N/A,346467.0
OKX,"Decentralized Finance (DeFi), Ethereum Ecosystem, Morpho Ecosystem",steakhouse-usdc-morpho-vault,124778188,124778188.0,,,N/A,0.0
OKX,"Decentralized Finance (DeFi), Analytics, DeFi Index, Base Ecosystem",mag7-ssi,125504000,125504000.0,,,N/A,1556134.0
OKX,"NFT, Solana Ecosystem, NFT Marketplace, Paradigm Portfolio, Sequoia Capital Portfolio",magic-eden,124702648,935271938.0,225118.71227369108,248357.6162846116,0.11,12468743.0
OKX,"Gaming (GameFi), NFT, BNB Chain Ecosystem, Solana Ecosystem, Polygon Ecosystem, Play To Earn, Move To Earn, Ethereum Ecosystem, Binance Launchpad, Gaming Governance Token, Sports Games, Alameda Research Portfolio, YZi Labs (Prev. Binance Labs) Portfolio, Sequoia Capital Portfolio",stepn,124654921,232598180.0,35122.44759253675,50887.94325561341,0.02,31856452.0
OKX,"Decentralized Exchange (DEX), Decentralized Finance (DeFi), Yield Farming, Automated Market Maker (AMM), Solana Ecosystem, Coinbase Ventures Portfolio, DeFiance Capital Portfolio, Made in USA",orca,123237261,220948136.0,,,N/A,80689442.0
OKX,"Stablecoins, Tokenized Assets, Real World Assets (RWA), Tokenized Silver, Tokenized Commodities",kinesis-silver,123092202,123092202.0,,,N/A,657446.0
OKX,"Arbitrum Ecosystem, Ethereum Ecosystem",reserve-protocol-eth-plus,123174744,123174744.0,,,N/A,327922.0
OKX,BNB Chain Ecosystem,bitdca,123144080,132228398.0,,,N/A,113890.0
OKX,"Smart Contract Platform, Layer 1 (L1), Kadena Ecosystem, Multicoin Capital Portfolio, Proof of Work (PoW), Made in USA",kadena,121684905,121738039.0,9012.168714332265,12299.932365255563,0.13,9727637.0
OKX,"Smart Contract Platform, Gaming (GameFi), Layer 1 (L1), Ethereum Ecosystem, Modular Blockchain, Account Abstraction, Multicoin Capital Portfolio, Gaming Blockchains, Gaming Utility Token, Skale Ecosystem, Consensys Portfolio, Galaxy Digital Portfolio, Made in USA",skale,120994269,127281844.0,9396.3159473955,37113.596483055975,0.1,25956846.0
OKX,"Meme, Ethereum Ecosystem, Frog-Themed, AI Meme",turbo,120916582,120916582.0,53539.119453991894,104284.28149841574,0.11,22358944.0
OKX,"Stablecoins, Ethereum Ecosystem",level-usd,120159683,120159683.0,,,N/A,9800350.0
OKX,"SocialFi, BNB Chain Ecosystem",h2o-dao,108447910,131452012.0,,,N/A,48821.0
OKX,"Stablecoins, Ethereum Ecosystem, Base Ecosystem, Blast Ecosystem, Fiat-backed Stablecoin",anzen-usdz,120200160,120200160.0,,,N/A,125063.0
OKX,"Smart Contract Platform, SocialFi, NFT, BNB Chain Ecosystem, Binance Launchpool, Ethereum Ecosystem, Decentralized Identifier (DID), Zero Knowledge (ZK), DWF Labs Portfolio, Coinbase Ventures Portfolio, Multicoin Capital Portfolio, Alameda Research Portfolio, DragonFly Capital Portfolio, YZi Labs (Prev. Binance Labs) Portfolio, Quest-to-Earn",project-galaxy,119771485,187510156.0,,,N/A,506.61
OKX,"Stablecoins, USD Stablecoin, Fiat-backed Stablecoin",falcon-finance,119780319,119780319.0,,,N/A,2003385.0
OKX,"Smart Contract Platform, Masternodes, Proof of Stake (PoS), Made in China",ontology,119835970,131154921.0,7231.236452624751,11240.183668996517,0.08,7390077.0
OKX,"Decentralized Exchange (DEX), Smart Contract Platform, Exchange-based Tokens, Decentralized Finance (DeFi), Arbitrum Ecosystem, Ethereum Ecosystem, Layer 2 (L2), Zero Knowledge (ZK), Loopring Ecosystem, Rollup, Energi Ecosystem",loopring,119116050,131341487.0,9500.161721173907,45418.90631426624,0.1,14347652.0
OKX,"Decentralized Finance (DeFi), Binance Launchpool, Arbitrum Ecosystem, Ethereum Ecosystem, Restaking, Liquid Restaking Governance Tokens, Ether.fi Ecosystem, Consensys Portfolio, OKX Ventures Portfolio",ether-fi,118857949,518695792.0,368426.58222632506,365227.06064960366,0.02,85171317.0
OKX,"BNB Chain Ecosystem, Polygon Ecosystem, Ethereum Ecosystem, Animoca Brands Portfolio, DWF Labs Portfolio, Alameda Research Portfolio, Energi Ecosystem, YZi Labs (Prev. Binance Labs) Portfolio",mask-network,117942687,117942687.0,62824.11661269471,86019.2781820927,0.08,150178498.0
OKX,"Gaming (GameFi), Play To Earn, Ethereum Ecosystem, RPG, Alameda Research Portfolio, Circle Ventures Portfolio, OKX Ventures Portfolio, MMO",big-time,116523381,321572947.0,103569.45082676057,89219.24898707762,0.02,179510820.0
OKX,"Internet of Things (IOT), Oracle, NFT, Metaverse, Ethereum Ecosystem, DePIN, Alleged SEC Securities, Made in USA",xyo-network,116998106,116998106.0,,,N/A,7379820.0
OKX,"Smart Contract Platform, Layer 1 (L1), Proof of Stake (PoS), GMCI Layer 1 Index, GMCI Index, Made in USA",casper-network,117333765,121476802.0,36745.679013439425,51522.458954013535,0.12,5864057.0
OKX,"Oracle, Ethereum Ecosystem",redstone-oracles,116202250,415008035.0,,,N/A,31521415.0
OKX,"Infrastructure, Solana Ecosystem, Animoca Brands Portfolio, Cross-chain Communication, OKX Ventures Portfolio",zeus-network,116181243,303520226.0,34992.847312550024,36510.05570832521,0.16,8935622.0
OKX,"Alleged SEC Securities, Osmosis Ecosystem, DeFiance Capital Portfolio, Pantera Capital Portfolio, YZi Labs (Prev. Binance Labs) Portfolio, Delphi Ventures Portfolio, Galaxy Digital Portfolio, OKX Ventures Portfolio",terra-luna-2,115890908,181761977.0,16790.24756886547,16478.517711901408,0.12,21921462.0
OKX,"Stablecoins, Decentralized Finance (DeFi), Lending/Borrowing Protocols, Ethereum Ecosystem",syrupusdc,115266865,115266865.0,,,N/A,1071284.0
OKX,"Arbitrum Ecosystem, Bridged USDC, Bridged-Tokens, Bridged Stablecoins",usd-coin-ethereum-bridged,114770948,114770948.0,,,N/A,32223538.0
OKX,"Decentralized Exchange (DEX), Decentralized Finance (DeFi), Automated Market Maker (AMM), Ethereum Ecosystem, Cronos Ecosystem",vvs-finance,114285291,223188080.0,,,N/A,374312.0
OKX,"Lending/Borrowing Protocols, Ethereum Ecosystem, Paradigm Portfolio, Coinbase Ventures Portfolio",euler,113333552,164872243.0,,,N/A,2849628.0
OKX,"Smart Contract Platform, Ethereum Ecosystem, Zero Knowledge (ZK), Alleged SEC Securities, Privacy Blockchain",coti,113840922,127032693.0,,,N/A,16848717.0
OKX,"Decentralized Finance (DeFi), Insurance, Ethereum Ecosystem",nxm,112966203,112966203.0,,,N/A,0.0
OKX,"BRC-20, Bitcoin Ecosystem, Inscriptions",sats-ordinals,112176697,112176697.0,85389.61948994429,103007.17218961744,0.19,33044275.0
OKX,"Decentralized Finance (DeFi), Derivatives, Perpetuals, Avalanche Ecosystem, Arbitrum Ecosystem",gmx,111976622,111976622.0,16240.369012877341,31131.381762721252,0.18,10850464.0
OKX,"Smart Contract Platform, DWF Labs Portfolio, Proof of Stake (PoS)",waves,110788885,110788885.0,,,N/A,7252258.0
OKX,"Artificial Intelligence (AI), Smart Contract Platform, Layer 1 (L1), Proof of Work (PoW)",qubic-network,109387780,132176964.0,,,N/A,2101666.0
OKX,"BNB Chain Ecosystem, Harmony Ecosystem, Ethereum Ecosystem, Alameda Research Portfolio, YZi Labs (Prev. Binance Labs) Portfolio",swipe,111101728,111341899.0,,,N/A,5697150.0
OKX,"BNB Chain Ecosystem, Avalanche Ecosystem, Polygon Ecosystem, Arbitrum Ecosystem, Ethereum Ecosystem, Optimism Ecosystem, Base Ecosystem",vicicoin,110350699,193724825.0,,,N/A,218585.0
OKX,"Smart Contract Platform, BNB Chain Ecosystem, Ethereum Ecosystem, Layer 2 (L2)",prometeus,109811582,115828655.0,,,N/A,3990397.0
OKX,"Decentralized Exchange (DEX), Exchange-based Tokens, Decentralized Finance (DeFi), Yield Farming, Automated Market Maker (AMM), BNB Chain Ecosystem, Yearn Ecosystem, Solana Ecosystem, Avalanche Ecosystem, Polygon Ecosystem, Near Protocol Ecosystem, Fantom Ecosystem, Harmony Ecosystem, Arbitrum Ecosystem, Celo Ecosystem, Ethereum Ecosystem, Base Ecosystem, Alameda Research Portfolio, Pantera Capital Portfolio, Energi Ecosystem, Sora Ecosystem, Blockchain Capital Portfolio",sushi,108766913,158915803.0,52388.529243872974,49222.5751813686,0.02,37260137.0
OKX,"BNB Chain Ecosystem, Liquid Staking Tokens",astherus-staked-bnb,108296622,108296622.0,,,N/A,72627.0
OKX,"Exchange-based Tokens, BNB Chain Ecosystem, Centralized Exchange (CEX) Token",nkyc-token,108078207,108078207.0,,,N/A,190860.0
OKX,"Solana Ecosystem, Multicoin Capital Portfolio, Stablecoin Protocol, Alameda Research Portfolio, DeFiance Capital Portfolio",uxd-protocol-token,107684304,107684304.0,,,N/A,1.5
OKX,"Payment Solutions, Made in USA, Directed Acyclic Graph (DAG)",nano,105418192,105418192.0,946.6841883837844,1245.2549282347907,0.18,6788682.0
OKX,"Business Services, Decentralized Finance (DeFi), Oracle, Fantom Ecosystem, Ethereum Ecosystem, Binance Launchpad, Osmosis Ecosystem, Energi Ecosystem, YZi Labs (Prev. Binance Labs) Portfolio, Sequoia Capital Portfolio",band-protocol,104671825,106819847.0,7123.3262377002,30383.453737072494,0.04,9226879.0
OKX,"Binance Launchpool, Solana Ecosystem, Ethereum Ecosystem, Base Ecosystem, Decentralized Science (DeSci)",bio-protocol,103615743,211012485.0,63070.49638215156,126610.81456117379,0.03,23673132.0
OKX,"Smart Contract Platform, BNB Chain Ecosystem, Layer 1 (L1), Ethereum Ecosystem, Decentralized Identifier (DID), Base Ecosystem, Gravity Alpha Ecosystem",g-token,103829533,172266842.0,9621.367590214786,12268.471307530195,0.07,8141607.0
OKX,"Decentralized Finance (DeFi), Oracle, Ethereum Ecosystem, DWF Labs Portfolio, Pantera Capital Portfolio",api3,102865640,127820264.0,36173.06160407004,79899.01350316708,0.05,42262775.0
OKX,"Smart Contract Platform, SocialFi, Layer 1 (L1), Gaming Blockchains",hive,102312404,,,,N/A,2879058.0
OKX,"Launchpad, Meme, Base Ecosystem, Cat-Themed, Base Meme",toshi,102577248,102577248.0,,,N/A,16135509.0
OKX,"Decentralized Exchange (DEX), Decentralized Finance (DeFi), Gnosis Chain Ecosystem, MEV Protection, Arbitrum Ecosystem, Ethereum Ecosystem, Intent, Delphi Ventures Portfolio, Blockchain Capital Portfolio",cow-protocol,102342288,245807042.0,,,N/A,15591007.0
OKX,"BNB Chain Ecosystem, Ethereum Ecosystem, Payment Solutions, DWF Labs Portfolio",alchemy-pay,102385925,207104214.0,15535.15637706314,41962.48946800796,0.05,39739230.0
OKX,"Decentralized Finance (DeFi), Yield Farming, Lending/Borrowing Protocols, Ethereum Ecosystem, Real World Assets (RWA), Base Ecosystem, Binance Alpha Spotlight",syrup,102242325,135306258.0,,,N/A,6987910.0
OKX,"Artificial Intelligence (AI), Smart Contract Platform, BNB Chain Ecosystem, Solana Ecosystem, Layer 1 (L1), Polygon Ecosystem, Ethereum Ecosystem, DWF Labs Portfolio, Injective Ecosystem, OKX Ventures Portfolio",zignaly,101080146,140168600.0,,,N/A,2229514.0
OKX,"Bridged USDT, QL1 Ecosystem, Bridged-Tokens, Bridged Stablecoins",qusdt,99974405,99974405.0,,,N/A,6382.36
OKX,"Smart Contract Platform, Layer 1 (L1), Zero Knowledge (ZK)",ozone-chain,99825484,132071961.0,,,N/A,243982.0
OKX,"BNB Chain Ecosystem, Tron Ecosystem",global-commercial-business,96382955,96382955.0,,,N/A,185310.0
OKX,"Artificial Intelligence (AI), Binance Launchpool, Solana Ecosystem, DePIN, Animoca Brands Portfolio, Multicoin Capital Portfolio, Delphi Ventures Portfolio, OKX Ventures Portfolio, Made in USA",io,96413374,512412746.0,,,N/A,30198730.0
OKX,"XDC Ecosystem, Telos Ecosystem",ecoin-2,95560776,207235463.0,,,N/A,2.0
OKX,"Smart Contract Platform, Base Ecosystem, Gaming Blockchains",b3,95242131,461392316.0,,,N/A,11026236.0
OKX,"Artificial Intelligence (AI), BNB Chain Ecosystem, Solana Ecosystem, Ethereum Ecosystem, AI Agents, Alameda Research Portfolio",delysium,95386971,179764988.0,,,N/A,9662252.0
OKX,"Fraxtal Ecosystem, Bridged-Tokens",l2-standard-bridged-frxusd,94800256,94800256.0,,,N/A,546562.0
OKX,"Business Services, Decentralized Finance (DeFi), Oracle, Derivatives, Synthetic Issuer, Avalanche Ecosystem, Ethereum Ecosystem, Blockchain Capital Portfolio, Synthetic, Made in USA",uma,94462609,136070493.0,13017.37059560631,20504.910752144777,0.09,14712316.0
OKX,"Arbitrum Ecosystem, Ethereum Ecosystem, Account Abstraction, Coinbase Ventures Portfolio, YZi Labs (Prev. Binance Labs) Portfolio, Consensys Portfolio, Outlier Ventures Portfolio",biconomy,94833149,100808332.0,33815.89217894157,35923.40460460032,0.2,12170240.0
OKX,"Artificial Intelligence (AI), Virtual Reality, BNB Chain Ecosystem, Launchpad, Ethereum Ecosystem, Telegram Apps, Discord Bots, Base Ecosystem, PAAL AI Launchpad, AI Agents, AI Applications, AI Agent Launchpad, Binance Alpha Spotlight, AI Framework, DeFAI, Made in USA",paal-ai,94671378,105683980.0,,,N/A,12266210.0
OKX,"Gaming (GameFi), NFT, Kaia Ecosystem, Gaming Blockchains",bora,95383192,99768626.0,2722.1597364970967,10982.771784413193,0.06,2422473.0
OKX,"Decentralized Finance (DeFi), DaoMaker Launchpad, Ethereum Ecosystem, Real World Assets (RWA), Sequoia Capital Portfolio, Made in USA",clearpool,93371196,122865574.0,,,N/A,8800243.0
OKX,"Smart Contract Platform, Ethereum Ecosystem, Metis Ecosystem, Layer 2 (L2), DWF Labs Portfolio, Rollup, GMCI Layer 2 Index, OKX Ventures Portfolio, GMCI Index",metis-token,93481350,148057970.0,19536.67887250105,45199.83554291905,0.13,12804405.0
OKX,"Decentralized Finance (DeFi), E-commerce",optio,93344877,122111831.0,,,N/A,55209.0
OKX,"Gaming (GameFi), NFT, Metaverse, Play To Earn, Ethereum Ecosystem, Animoca Brands Portfolio, RPG, Gaming Governance Token, Adventure Games, Energi Ecosystem, Delphi Ventures Portfolio",illuvium,92321555,118219177.0,1624.9680327491942,10138.892320115963,0.08,21455194.0
OKX,"NFT, Meme, Arbitrum Ecosystem, Ethereum Ecosystem, Anime-Themed, Binance HODLer Airdrops, Airdropped Tokens by NFT Projects",anime,91452945,165119106.0,88562.5332424724,104852.06522062248,0.06,21841108.0
OKX,"Crypto-Backed Tokens, Ethereum Ecosystem",temple,91837618,92020662.0,,,N/A,5155.57
OKX,"Smart Contract Platform, Cross-chain Communication, Pantera Capital Portfolio",icon,91681543,92758145.0,17662.210821688022,20517.721108366408,0.02,4074974.0
OKX,"Gaming (GameFi), Polygon Ecosystem",gamebitcoin-power,91615219,537279062.0,,,N/A,6593.32
OKX,"NFT, BNB Chain Ecosystem, Solana Ecosystem, Meme, Ethereum Ecosystem, Base Ecosystem, Hybrid Token Standards, Wojak-Themed",non-playable-coin,90910218,90910218.0,,,N/A,3716258.0
OKX,"Decentralized Finance (DeFi), BNB Chain Ecosystem, Liquid Staking Tokens, Sui Ecosystem, Liquid Staking",lorenzo-stbtc,90279684,90279684.0,,,N/A,359551.0
OKX,Layer 1 (L1),oec-token,90190503,90190503.0,5651.2954267117475,7450.562045254362,0.2,344657.0
OKX,"Polygon Ecosystem, XRP Ledger Ecosystem",crypto-trading-fund,90157091,90157091.0,,,N/A,4301.8
OKX,"Music, NFT, Ethereum Ecosystem, Coinbase Ventures Portfolio, Multicoin Capital Portfolio, Pantera Capital Portfolio, Energi Ecosystem, YZi Labs (Prev. Binance Labs) Portfolio",audius,88435728,88435728.0,,,N/A,9607007.0
OKX,"LP Tokens, Ethereum Ecosystem",resolv-rlp,88751155,88751155.0,,,N/A,2510.3
OKX,"Gaming (GameFi), XDC Ecosystem, Gaming Utility Token",gama-coin,88595388,136300672.0,,,N/A,2250975.0
OKX,"Smart Contract Platform, Decentralized Finance (DeFi), Binance Launchpool, Derivatives, Perpetuals, Ethereum Ecosystem, Layer 2 (L2), DragonFly Capital Portfolio, Pantera Capital Portfolio",aevo-exchange,87840091,97256862.0,67738.76033043816,118861.24881060435,0.1,26569094.0
OKX,"Decentralized Exchange (DEX), Decentralized Finance (DeFi), BNB Chain Ecosystem, Wallets, XRP Ledger Ecosystem",solo-coin,87619375,87619375.0,,,N/A,4809988.0
OKX,"Cronos Ecosystem, Bridged USDT, Bridged-Tokens, Bridged Stablecoins",cronos-bridged-usdt-cronos,87836727,87836727.0,,,N/A,161075.0
OKX,"Decentralized Finance (DeFi), Launchpad, Ethereum Ecosystem, DWF Labs Portfolio, Coinbase Ventures Portfolio, Pantera Capital Portfolio, Blockchain Capital Portfolio",auction,86829998,100672781.0,77870.02462516315,130334.79006981006,0.05,47697184.0
OKX,"Polygon Ecosystem, Arbitrum Ecosystem, Ethereum Ecosystem, Optimism Ecosystem, Bridge Governance Tokens, Cross-chain Communication, Intent, Boba Network Ecosystem, Blockchain Capital Portfolio, Made in USA",across-protocol,86933015,213416054.0,,,N/A,14580220.0
OKX,"Software as a service, Ethereum Ecosystem, Energi Ecosystem",status,86762873,149075243.0,54791.56819980014,52289.216515463406,0.09,6439803.0
OKX,"Exchange-based Tokens, NFT, BNB Chain Ecosystem, Ethereum Ecosystem",swftcoin,86542571,86542571.0,7939.472407395406,26394.318900849295,0.21,2265752.0
OKX,"Artificial Intelligence (AI), Infrastructure, Gaming (GameFi), NFT, Solana Ecosystem, Arbitrum Ecosystem, Impossible Finance Launchpad, Ethereum Ecosystem, Animoca Brands Portfolio, Base Ecosystem",carv,89593695,404447468.0,,,N/A,12741840.0
OKX,"Smart Contract Platform, Polkadot Ecosystem, Layer 1 (L1), DePIN, Outlier Ventures Portfolio",peaq-2,85522540,485855660.0,,,N/A,6916765.0
OKX,"Infrastructure, Smart Contract Platform, Decentralized Finance (DeFi), BNB Chain Ecosystem, Avalanche Ecosystem, Polygon Ecosystem, Fantom Ecosystem, Harmony Ecosystem, Arbitrum Ecosystem, Ethereum Ecosystem, DWF Labs Portfolio, Layer 3 (L3), Outlier Ventures Portfolio",orbs,86451264,189691921.0,9177.980024629715,15068.97596078233,0.11,5269019.0
OKX,"Solana Ecosystem, Meme, Solana Meme, PolitiFi, Made in USA",melania-meme,85871595,572476743.0,,,N/A,20338288.0
OKX,"Solana Ecosystem, Polygon Ecosystem, Ethereum Ecosystem",m2-global-wealth-limited-mmx,86295825,273938255.0,,,N/A,36499.0
OKX,"Decentralized Finance (DeFi), BNB Chain Ecosystem, Ethereum Ecosystem, Real World Assets (RWA), Base Ecosystem, Coinbase Ventures Portfolio, Stablecoin Protocol, YZi Labs (Prev. Binance Labs) Portfolio, Galaxy Digital Portfolio",usual,86228390,95090797.0,,,N/A,23229919.0
OKX,"Big Data, Analytics, Arbitrum Ecosystem, Base Ecosystem",subsquid,86096704,183644770.0,,,N/A,1509922.0
OKX,"Smart Contract Platform, BNB Chain Ecosystem, Binance Launchpool, Ethereum Ecosystem, Layer 2 (L2), Restaking, Rollups-as-a-Service (RaaS), Rollup, YZi Labs (Prev. Binance Labs) Portfolio",altlayer,85356210,281442425.0,,,N/A,15313116.0
OKX,"Artificial Intelligence (AI), Smart Contract Platform, Masternodes, DePIN, Proof of Work (PoW), Made in USA",zelcash,84744858,84745224.0,,,N/A,13486753.0
OKX,"Stablecoins, USD Stablecoin, Ethereum Ecosystem, Fiat-backed Stablecoin",lift-dollar,84591502,84591502.0,,,N/A,6490114.0
OKX,"Smart Contract Platform, Privacy, Layer 1 (L1), Proof of Stake (PoS), Proof of Work (PoW), Zano Ecosystem, Privacy Blockchain",zano,84335137,84337115.0,,,N/A,642246.0
OKX,"Decentralized Finance (DeFi), Yield Farming, BNB Chain Ecosystem, Binance Launchpool, Lending/Borrowing Protocols, Arbitrum Ecosystem, Ethereum Ecosystem, Optimism Ecosystem, ZkSync Ecosystem, opBNB Ecosystem, Unichain Ecosystem",venus,84367070,151000868.0,,,N/A,4614162.0
OKX,"Smart Contract Platform, Ethereum Ecosystem, Layer 2 (L2), Optimism Superchain Ecosystem, Outlier Ventures Portfolio, Lisk Ecosystem",lisk,84479517,189566666.0,9734.418345502774,12962.518646639657,0.15,12555786.0
OKX,"BNB Chain Ecosystem, Soneium Ecosystem",solv-protocol-solvbtc-jupiter,83988917,83988917.0,,,N/A,25975.0
OKX,"Decentralized Finance (DeFi), Yield Farming, Avalanche Ecosystem, Fantom Ecosystem, Arbitrum Ecosystem, Olympus Pro Ecosystem, Ethereum Ecosystem, Stablecoin Protocol",spell-token,84376336,103961326.0,,,N/A,16398701.0
OKX,"Decentralized Finance (DeFi), BNB Chain Ecosystem, Real World Assets (RWA), DWF Labs Portfolio, Stellar Ecosystem",velo,83897208,272448829.0,30040.639105230603,55168.19972506405,0.07,16698337.0
OKX,"Smart Contract Platform, Proof of Stake (PoS), Sequoia Capital Portfolio",iostoken,83099531,83099531.0,11515.077958719667,27891.510178640576,0.06,11271556.0
OKX,"Big Data, Infrastructure, Storage, Cardano Ecosystem, DePIN",iagon,82745510,220055886.0,,,N/A,363184.0
OKX,"Crypto-Backed Tokens, BNB Chain Ecosystem, Arbitrum Ecosystem, Ethereum Ecosystem, Mantle Ecosystem",ignition-fbtc,82024429,1250742410.0,,,N/A,88481.0
OKX,"Artificial Intelligence (AI), Ethereum Ecosystem",0x0-ai-ai-smart-contract,81459152,81459152.0,,,N/A,387386.0
OKX,"Meme, PulseChain Ecosystem",the-grays-currency,81553676,81553676.0,,,N/A,246006.0
OKX,"Artificial Intelligence (AI), Big Data, Media, BNB Chain Ecosystem, Polygon Ecosystem, Ethereum Ecosystem, GMCI DePIN Index, Galaxy Digital Portfolio, GMCI Index",everipedia,81933898,81933898.0,4715.532600103431,3693.1536318641574,0.1,6295442.0
OKX,"Crypto-Backed Tokens, Decentralized Finance (DeFi), Compound Tokens, cToken, Ethereum Ecosystem",compound-ether,81860374,81860374.0,,,N/A,130.04
OKX,"Smart Contract Platform, Bitcoin Sidechains, Stacks Ecosystem, SideChain",sbtc-2,82296904,82296904.0,,,N/A,75735.0
OKX,"NFT, Polygon Ecosystem, Ethereum Ecosystem, Optimism Ecosystem",blockv,81959832,81959832.0,,,N/A,60320.0
OKX,"NFT, BNB Chain Ecosystem, Ethereum Ecosystem, Binance Launchpad, DWF Labs Portfolio, YZi Labs (Prev. Binance Labs) Portfolio",space-id,81338845,377236303.0,52639.21475495261,69325.36202345301,0.11,10072317.0
OKX,"Decentralized Finance (DeFi), Liquid Staking Tokens, Ethereum Ecosystem, LSDFi, Liquid Staked ETH, Liquid Staking",origin-ether,81490643,81490643.0,,,N/A,130306.0
OKX,"Gaming (GameFi), NFT, BNB Chain Ecosystem",infinitar-governance-token,78661890,362632542.0,,,N/A,4296419.0
OKX,"Smart Contract Platform, Polkadot Ecosystem, Binance Launchpool, Layer 2 (L2), Manta Network Ecosystem, Multicoin Capital Portfolio, Alameda Research Portfolio, DeFiance Capital Portfolio, YZi Labs (Prev. Binance Labs) Portfolio",manta-network,81432271,199023348.0,,,N/A,19228016.0
