Exchange,Category,Token CEX,Market Cap Today,FDV Today,Depth +2%,Depth -2%,Bid Ask Spread Percentage,24H Volume (USD)
OKX,"Ethereum Ecosystem, Real World Assets (RWA), Energi Ecosystem, Coinbase 50 Index",quant-network,992783211,997446508.0,,,N/A,35976654.0
OKX,"Arbitrum Ecosystem, Optimism Ecosystem, Berachain Ecosystem, Bridged USDT, Bridged-Tokens, Ink Ecosystem, Bridged Stablecoins, Unichain Ecosystem, Corn Ecosystem",usdt0,975316022,975316022.0,,,N/A,84988782.0
OKX,"Smart Contract Platform, Ethereum Ecosystem, Layer 2 (L2), Zero Knowledge (ZK), YZi Labs (Prev. Binance Labs) Portfolio, OKX Ventures Portfolio, Binance HODLer Airdrops, World Liberty Financial Portfolio, Made in USA",movement,947962750,3869235714.0,167301.7428365466,338473.12408962427,0.04,57897057.0
OKX,"Decentralized Finance (DeFi), Solana Ecosystem, Liquid Staking Tokens, Liquid Staked SOL, Liquid Staking",binance-staked-sol,945336262,945336262.0,,,N/A,8006463.0
OKX,"Smart Contract Platform, Ethereum Ecosystem, Decentralized Identifier (DID), Optimism Ecosystem, Coinbase Ventures Portfolio, Multicoin Capital Portfolio, Andreessen Horowitz (a16z) Portfolio, Blockchain Capital Portfolio, Optimism Superchain Ecosystem, World Chain Ecosystem, Made in USA",worldcoin-wld,923956733,7534259085.0,154111.17066956346,237880.41394596928,0.01,129453615.0
OKX,"Polygon Ecosystem, Arbitrum Ecosystem, Liquid Staking Tokens, Ethereum Ecosystem, Optimism Ecosystem, Base Ecosystem, Liquid Staked ETH, Liquid Staking",rocket-pool-eth,892728009,892728009.0,,,N/A,4268780.0
OKX,"Infrastructure, Smart Contract Platform, Layer 2 (L2), Bitcoin Sidechains, Stacks Ecosystem, SideChain, GMCI Layer 2 Index, GMCI 30 Index, Blockchain Capital Portfolio, GMCI Index, Made in USA, Coinbase 50 Index",blockstack,874977717,874977717.0,89234.0298633479,98028.11167531539,0.03,30790361.0
OKX,"Decentralized Finance (DeFi), BNB Chain Ecosystem, Ethereum Ecosystem",dexe,850784761,1437814629.0,,,N/A,18846340.0
OKX,"BNB Chain Ecosystem, Bridged USDC, Bridged-Tokens, Bridged Stablecoins",binance-bridged-usdc-bnb-smart-chain,848601000,848601000.0,,,N/A,36324524.0
OKX,"BNB Chain Ecosystem, Solana Ecosystem, Polygon Ecosystem, Meme, Arbitrum Ecosystem, Ethereum Ecosystem, Aptos Ecosystem, Dog-Themed, Solana Meme, Neon Ecosystem, GMCI Meme Index, GMCI Index, Made in USA, Coinbase 50 Index",bonk,843927714,968483421.0,179950.98704736537,257509.4342611458,0.05,102303532.0
OKX,"Stablecoins, USD Stablecoin, BNB Chain Ecosystem, Arbitrum Ecosystem, Ethereum Ecosystem, Base Ecosystem, Fiat-backed Stablecoin",usual-usd,843736719,843736719.0,,,N/A,56582431.0
OKX,"Smart Contract Platform, Gaming (GameFi), NFT, Play To Earn, Ethereum Ecosystem, Layer 2 (L2), Zero Knowledge (ZK), Animoca Brands Portfolio, Immutable zkEVM Ecosystem, Coinbase Ventures Portfolio, Rollup, Gaming Blockchains, GMCI 30 Index, GMCI Index, Gaming Marketplace, Coinbase 50 Index",immutable-x,837279597,934028739.0,15224.149246069275,38470.53318859076,0.09,48022980.0
OKX,"Polygon Ecosystem, Bridged USDT, Bridged-Tokens, Bridged Stablecoins",polygon-bridged-usdt-polygon,814191700,814191700.0,,,N/A,21147176.0
OKX,"Smart Contract Platform, Decentralized Finance (DeFi), BNB Chain Ecosystem, Cosmos Ecosystem, Layer 1 (L1), Ethereum Ecosystem, Binance Launchpad, Osmosis Ecosystem, Proof of Stake (PoS), Pantera Capital Portfolio, Secret Ecosystem, GMCI Layer 1 Index, GMCI Index, Made in USA, Coinbase 50 Index",injective-protocol,814835451,833785559.0,84140.23996300745,141529.29970923113,0.06,60640837.0
OKX,"Artificial Intelligence (AI), Smart Contract Platform, Decentralized Finance (DeFi), Layer 1 (L1), Real World Assets (RWA), Parallelized EVM, Coinbase Ventures Portfolio, Multicoin Capital Portfolio, GMCI Layer 1 Index, Delphi Ventures Portfolio, Circle Ventures Portfolio, OKX Ventures Portfolio, GMCI Index, Sei Network Ecosystem, World Liberty Financial Portfolio, Made in USA",sei-network,803626928,1645980109.0,,,N/A,71066029.0
OKX,"Smart Contract Platform, Layer 1 (L1), DWF Labs Portfolio",flare-networks,799932884,1351842814.0,174708.98155747363,172893.1428321085,0.15,14180596.0
OKX,"Artificial Intelligence (AI), Business Services, Infrastructure, Smart Contract Platform, Analytics, Avalanche Ecosystem, Polygon Ecosystem, Near Protocol Ecosystem, Harmony Ecosystem, Arbitrum Ecosystem, Ethereum Ecosystem, DePIN, Coinbase Ventures Portfolio, Multicoin Capital Portfolio, Proof of Stake (PoS), Energi Ecosystem, Sora Ecosystem, Made in USA, Coinbase 50 Index",the-graph,787243643,889433921.0,22499.793813442862,68998.83092841569,0.05,44572309.0
OKX,"Smart Contract Platform, Layer 1 (L1), DePIN, Theta Ecosystem, Blockchain Capital Portfolio, Made in USA",theta-token,777796525,777796525.0,31966.96394379528,41285.445843179186,0.04,22767598.0
OKX,"Stablecoins, Tokenized Assets, Tokenized Gold, Ethereum Ecosystem, Real World Assets (RWA), Tokenized Commodities",tether-gold,770034908,770034908.0,174583.3052542262,545658.4536855852,0.01,42704825.0
OKX,"Stablecoins, USD Stablecoin, Solana Ecosystem, Ethereum Ecosystem, Fiat-backed Stablecoin, Made in USA",paypal-usd,758941973,758941973.0,709302.3191055355,743255.1334642951,0.08,59964085.0
OKX,"Infrastructure, Decentralized Finance (DeFi), Polygon Ecosystem, Arbitrum Ecosystem, Ethereum Ecosystem, Optimism Ecosystem, Liquid Staking Governance Tokens, eGirl Capital Portfolio, Paradigm Portfolio, Coinbase Ventures Portfolio, Multicoin Capital Portfolio, Index Coop Defi Index, Alameda Research Portfolio, DragonFly Capital Portfolio, Andreessen Horowitz (a16z) Portfolio, GMCI DeFi Index, Delphi Ventures Portfolio, Liquid Staking, Index Coop Index, GMCI Index, Coinbase 50 Index",lido-dao,746731047,831662738.0,97509.02134502308,188596.00396537798,0.01,72554383.0
OKX,"Crypto-Backed Tokens, BNB Chain Ecosystem, Avalanche Ecosystem, Arbitrum Ecosystem, Ethereum Ecosystem, Mantle Ecosystem, Base Ecosystem, Restaking, Berachain Ecosystem, Merlin Chain Ecosystem, Sonic Ecosystem, Sei Network Ecosystem, Soneium Ecosystem, Corn Ecosystem",solv-protocol-solvbtc-bbn,740134069,740134069.0,,,N/A,190635.0
OKX,"Crypto-Backed Tokens, BNB Chain Ecosystem, Wrapped-Tokens",wbnb,726475269,726475269.0,,,N/A,246097022.0
OKX,"Liquid Staking Tokens, Ethereum Ecosystem, Mantle Ecosystem, Liquid Staked ETH, Liquid Staking",mantle-staked-ether,703637746,703637746.0,,,N/A,2883442.0
OKX,"Stablecoins, Tokenized Assets, Tokenized Gold, Ethereum Ecosystem, Real World Assets (RWA), Tokenized Commodities",pax-gold,689747083,689747083.0,,,N/A,136959807.0
OKX,"Decentralized Exchange (DEX), Exchange-based Tokens, Decentralized Finance (DeFi), Yield Farming, Automated Market Maker (AMM), Polygon Ecosystem, Fantom Ecosystem, Arbitrum Ecosystem, Ethereum Ecosystem, Optimism Ecosystem, Curve Ecosystem, DWF Labs Portfolio, Stablecoin Protocol, Energi Ecosystem, Sora Ecosystem, YZi Labs (Prev. Binance Labs) Portfolio, GMCI DeFi Index, GMCI Index, Coinbase 50 Index",curve-dao-token,678206302,1161806626.0,128861.76727263731,203722.91261958363,0.04,258062136.0
OKX,"Smart Contract Platform, Layer 1 (L1), Tezos Ecosystem, Proof of Stake (PoS), GMCI Layer 1 Index, GMCI Index, Polychain Capital Portfolio, Made in USA, Coinbase 50 Index",tezos,673540398,686684140.0,17823.2649221574,29087.60860330334,0.03,30612488.0
OKX,"Arbitrum Ecosystem, Bridged WBTC, Bridged-Tokens",arbitrum-bridged-wbtc-arbitrum-one,668801463,668801463.0,,,N/A,126619572.0
OKX,"Infrastructure, Storage, Sui Ecosystem",walrus-2,661181843,2644727373.0,,,N/A,153778095.0
OKX,"Smart Contract Platform, Decentralized Finance (DeFi), Layer 1 (L1), Berachain Ecosystem, Binance HODLer Airdrops, Outlier Ventures Portfolio, Polychain Capital Portfolio",berachain-bera,657260229,3046272758.0,286839.74901742593,335417.15372397273,0.07,153706359.0
OKX,"Smart Contract Platform, Gaming (GameFi), NFT, Layer 1 (L1), Play To Earn, Ethereum Ecosystem, DWF Labs Portfolio, Gaming Platform, YZi Labs (Prev. Binance Labs) Portfolio, GalaChain Ecosystem, Made in USA",gala,651422060,651422060.0,55893.30460741069,80853.9637786291,0.07,72185477.0
OKX,"Gaming (GameFi), NFT, Metaverse, Polygon Ecosystem, Play To Earn, Harmony Ecosystem, Ethereum Ecosystem, Animoca Brands Portfolio, Alleged SEC Securities, Binance Launchpad, Gaming Utility Token, Simulation Games, Energi Ecosystem, YZi Labs (Prev. Binance Labs) Portfolio, Coinbase 50 Index",the-sandbox,638582592,783262341.0,93607.38631161174,108090.7626542731,0.08,61513200.0
OKX,"Smart Contract Platform, Privacy, Layer 1 (L1), Zero Knowledge (ZK), Proof of Work (PoW), Pantera Capital Portfolio, Made in USA, Coinbase 50 Index",zcash,616592874,616595767.0,,,N/A,34952546.0
OKX,"Smart Contract Platform, Layer 1 (L1)",kaia,629181127,629181147.0,60230.7351726569,85327.28648656962,0.09,19550830.0
OKX,"Stablecoins, USD Stablecoin, BNB Chain Ecosystem, Arbitrum Ecosystem, Ethereum Ecosystem, Fiat-backed Stablecoin",usdx-money-usdx,625499200,625499200.0,,,N/A,252968.0
OKX,"Storage, BNB Chain Ecosystem, Ethereum Ecosystem, DePIN, Alleged SEC Securities, Binance Launchpad, Tron Ecosystem, Energi Ecosystem, YZi Labs (Prev. Binance Labs) Portfolio, BitTorrent Ecosystem, GMCI DePIN Index, GMCI Index",bittorrent,619965043,622441516.0,69154.19290326817,76727.95721084336,0.02,23755542.0
OKX,"Decentralized Finance (DeFi), Solana Ecosystem, Liquid Staking Governance Tokens, Multicoin Capital Portfolio, Alameda Research Portfolio, Delphi Ventures Portfolio, Liquid Staking, Made in USA",jito-governance-token,618571882,1978607541.0,209135.85003532076,229629.43674604959,0.1,39928401.0
OKX,"Smart Contract Platform, Bitcoin Fork, Proof of Work (PoW)",bitcoin-cash-sv,610085212,610086557.0,70797.22410663156,89852.21730457272,0.07,30518489.0
OKX,"Internet of Things (IOT), Smart Contract Platform, Layer 1 (L1), DePIN, DWF Labs Portfolio, IOTA EVM Ecosystem, Outlier Ventures Portfolio, Directed Acyclic Graph (DAG)",iota,607438910,753575500.0,106300.77082955536,127093.83787130674,0.06,26281394.0
OKX,"Smart Contract Platform, Sports, NFT, Layer 1 (L1), Animoca Brands Portfolio, Alleged SEC Securities, Multicoin Capital Portfolio, Proof of Stake (PoS), Flow Ecosystem, Andreessen Horowitz (a16z) Portfolio",flow,579237967,579237967.0,28040.856263568647,74022.28492767691,0.05,27461502.0
OKX,"Decentralized Finance (DeFi), Solana Ecosystem, Liquid Staking Tokens, Liquid Staked SOL, Liquid Staking",msol,560933631,560933631.0,,,N/A,33966880.0
OKX,"BNB Chain Ecosystem, Arbitrum Ecosystem, Liquid Staking Tokens, Base Ecosystem, Restaking, Liquid Restaking Tokens, Blast Ecosystem, Mode Ecosystem, Liquid Staking",renzo-restaked-eth,552541824,552541824.0,,,N/A,420336.0
OKX,"Berachain Ecosystem, Bridged USDC, Bridged-Tokens, Bridged Stablecoins",stargate-bridged-usdc-berachain,550355388,550355388.0,,,N/A,14992705.0
OKX,"Decentralized Exchange (DEX), Exchange-based Tokens, Decentralized Finance (DeFi), Yield Farming, Automated Market Maker (AMM), BNB Chain Ecosystem, Arbitrum Ecosystem, Ethereum Ecosystem, Aptos Ecosystem, ZkSync Ecosystem, Linea Ecosystem, Base Ecosystem, Polygon zkEVM Ecosystem, YZi Labs (Prev. Binance Labs) Portfolio, opBNB Ecosystem, GMCI DeFi Index, GMCI Index",pancakeswap-token,535112991,677239256.0,,,N/A,76724411.0
OKX,"Gaming (GameFi), NFT, BNB Chain Ecosystem, Metaverse, Meme, Play To Earn, Ethereum Ecosystem, Telegram Apps, Dog-Themed, DWF Labs Portfolio, RPG, On-chain Gaming, TokenFi Launchpad, GMCI Meme Index, GMCI Index",floki,527682541,546017646.0,133758.95775856887,161556.4599026113,0.04,101276821.0
OKX,"Stablecoins, Berachain Ecosystem",honey-3,527166675,527166675.0,,,N/A,32490759.0
OKX,"Decentralized Exchange (DEX), Decentralized Finance (DeFi), Yield Farming, Automated Market Maker (AMM), Solana Ecosystem, Launchpad, GMCI DeFi Index, GMCI Index",raydium,514028066,980987597.0,36820.22076171844,45672.592042421784,0.07,96643800.0
OKX,"Decentralized Exchange (DEX), Decentralized Finance (DeFi), Yield Farming, Automated Market Maker (AMM), BNB Chain Ecosystem, Derivatives, Lending/Borrowing Protocols, Arbitrum Ecosystem, Ethereum Ecosystem, Optimism Ecosystem, Fixed Interest, Real World Assets (RWA), LSDFi, Base Ecosystem, Restaking, LRTfi, Liquid Restaking Governance Tokens, Yield Tokenization Protocol, YZi Labs (Prev. Binance Labs) Portfolio, GMCI DeFi Index, Sonic Ecosystem, Liquid Staking, GMCI Index, BTCfi",pendle,505209640,881029358.0,65142.16755667391,67530.94991594383,0.06,142449522.0
OKX,"Communication, Internet of Things (IOT), Smart Contract Platform, Solana Ecosystem, DePIN, Multicoin Capital Portfolio, Proof of Stake (PoS), Alameda Research Portfolio, Pantera Capital Portfolio, Andreessen Horowitz (a16z) Portfolio, Made in USA, Coinbase 50 Index",helium,502054911,622817484.0,,,N/A,7268668.0
OKX,"NFT, Ethereum Ecosystem, Decentralized Identifier (DID), Name Service",ethereum-name-service,498870129,1504180096.0,79450.07569054193,102597.17319493118,0.01,43652212.0
OKX,"Artificial Intelligence (AI), Solana Ecosystem, DePIN, Polychain Capital Portfolio",grass,507144716,1840978875.0,,,N/A,81934069.0
OKX,"Stablecoins, USD Stablecoin, BNB Chain Ecosystem, Avalanche Ecosystem, Ethereum Ecosystem, Tron Ecosystem, Andreessen Horowitz (a16z) Portfolio, Fiat-backed Stablecoin",true-usd,494612506,494612506.0,,,N/A,33069769.0
OKX,"Internet of Things (IOT), Ethereum Ecosystem, DePIN, DWF Labs Portfolio, Coinbase 50 Index",jasmycoin,488354270,504289829.0,,,N/A,74751647.0
OKX,"Solana Ecosystem, Liquid Staking Tokens, Liquid Staked SOL, Liquid Staking",jupiter-staked-sol,487114322,487114322.0,,,N/A,6881068.0
OKX,"Artificial Intelligence (AI), Smart Contract Platform, Privacy, Masternodes, DePIN, DWF Labs Portfolio, Proof of Stake (PoS), Proof of Work (PoW)",beldex,482921722,693697375.0,,,N/A,3710751.0
OKX,"Decentralized Finance (DeFi), Liquid Staking Tokens, Berachain Ecosystem, Liquid Staking",infrared-bera,474846693,474846693.0,,,N/A,524142.0
OKX,"Decentralized Exchange (DEX), Smart Contract Platform, Decentralized Finance (DeFi), Cosmos Ecosystem, Perpetuals, Layer 1 (L1), Osmosis Ecosystem, Appchains, DragonFly Capital Portfolio, DeFiance Capital Portfolio, Andreessen Horowitz (a16z) Portfolio, GMCI DeFi Index, Delphi Ventures Portfolio, GMCI Index, Polychain Capital Portfolio, Made in USA",dydx-chain,471809529,471809529.0,112459.41157185227,196864.8460780842,0.05,17362641.0
OKX,"BNB Chain Ecosystem, Ethereum Ecosystem, BTCfi",pumpbtc,469624833,469624833.0,,,N/A,25754.0
OKX,"Stablecoins, Ethereum Ecosystem",resolv-usr,469597792,469597792.0,,,N/A,8330898.0
OKX,"Business Services, Infrastructure, Decentralized Finance (DeFi), Oracle, Solana Ecosystem, Neon Ecosystem, Manta Network Ecosystem, Multicoin Capital Portfolio, GMCI DeFi Index, Delphi Ventures Portfolio, GMCI Index",pyth-network,469618439,1295503149.0,207982.80612352304,220927.25067616298,0.08,39509712.0
OKX,"USD Stablecoin, Polygon Ecosystem, Bridged USDC, Fiat-backed Stablecoin, Bridged-Tokens, Bridged Stablecoins",bridged-usdc-polygon-pos-bridge,468805685,468805685.0,,,N/A,34909934.0
OKX,"Decentralized Finance (DeFi), Wallets, Polygon Ecosystem, Ethereum Ecosystem, Payment Solutions, Base Ecosystem, Sora Ecosystem, Made in USA",telcoin,450585639,490301712.0,,,N/A,4651110.0
OKX,"Entertainment, Gaming (GameFi), NFT, Metaverse, Polygon Ecosystem, Play To Earn, Ethereum Ecosystem, Animoca Brands Portfolio, Alleged SEC Securities, Simulation Games, Coinbase 50 Index",decentraland,452568447,531353878.0,44034.47026512929,64858.47005121092,0.08,49249694.0
OKX,"Smart Contract Platform, Layer 1 (L1), Bitcoin Sidechains, SideChain",coredaoorg,449118161,944709668.0,23032.872853473033,71980.2096183816,0.04,39305604.0
OKX,"Bridged USDC, Sonic Ecosystem, Bridged-Tokens, Bridged Stablecoins",sonic-bridged-usdc-e-sonic,450688052,450688052.0,,,N/A,25161106.0
OKX,"Crypto-Backed Tokens, Decentralized Finance (DeFi), Rebase Tokens, Arbitrum Ecosystem, Ethereum Ecosystem, Berachain Ecosystem",olympus,448847390,448156789.0,,,N/A,4221801.0
OKX,"Smart Contract Platform, Layer 1 (L1), Binance Launchpad, DWF Labs Portfolio, Osmosis Ecosystem, YZi Labs (Prev. Binance Labs) Portfolio, Made in USA",kava,434110772,434110772.0,,,N/A,21101798.0
OKX,"Gaming (GameFi), NFT, BNB Chain Ecosystem, Axie Infinity Ecosystem, Metaverse, Play To Earn, Harmony Ecosystem, Ethereum Ecosystem, Animoca Brands Portfolio, Alleged SEC Securities, Binance Launchpad, Ronin Ecosystem, Card Games, Breeding, Paradigm Portfolio, Gaming Governance Token, Gaming Utility Token, Andreessen Horowitz (a16z) Portfolio, Energi Ecosystem, YZi Labs (Prev. Binance Labs) Portfolio, Consensys Portfolio, Coinbase 50 Index",axie-infinity,433464029,731072415.0,16997.176057059143,23273.914859180943,0.07,38584140.0
OKX,"Ethereum Ecosystem, Mantle Ecosystem, Restaking, Liquid Restaking Tokens, Liquid Restaked ETH",mantle-restaked-eth,431927153,431927153.0,,,N/A,5632927.0
OKX,"NFT, BNB Chain Ecosystem, Ethereum Ecosystem, Tron Ecosystem",apenft,429078223,433361751.0,53750.66517573092,49188.32403849277,0.05,23837524.0
OKX,"Solana Ecosystem, Meme, Ethereum Ecosystem, Base Ecosystem, Bridged-Tokens, Murad Picks, Stock market-themed",spx6900,432353987,432353987.0,,,N/A,35450023.0
OKX,"Smart Contract Platform, Layer 1 (L1), MultiversX Ecosystem, Binance Launchpad, DWF Labs Portfolio, Proof of Stake (PoS), YZi Labs (Prev. Binance Labs) Portfolio, GMCI Layer 1 Index, GMCI Index, Coinbase 50 Index",elrond-erd-2,427235287,427235287.0,12703.954039930608,13416.400185653085,0.07,28385882.0
OKX,"Solana Ecosystem, Meme, Solana Meme, AI Meme, Pump.fun Ecosystem, Terminal of Truths, Binance Alpha Spotlight",fartcoin,431958037,431958037.0,,,N/A,155183212.0
OKX,"Tokenized BTC, Avalanche Ecosystem, Bridged-Tokens",bitcoin-avalanche-bridged-btc-b,422588309,422588309.0,,,N/A,19801594.0
OKX,"Arbitrum Ecosystem, Ethereum Ecosystem, Optimism Ecosystem, Base Ecosystem, BTCfi",clbtc,421113255,421113255.0,,,N/A,5.45
OKX,"Decentralized Finance (DeFi), Yield Farming, BNB Chain Ecosystem, Lending/Borrowing Protocols, Avalanche Ecosystem, Polygon Ecosystem, Near Protocol Ecosystem, Harmony Ecosystem, Arbitrum Ecosystem, Ethereum Ecosystem, Base Ecosystem, Paradigm Portfolio, Index Coop Defi Index, Energi Ecosystem, Sora Ecosystem, Index Coop Index, Polychain Capital Portfolio, Made in USA",compound-governance-token,409863736,458459234.0,37870.60684501665,68354.50398818155,0.02,158135611.0
OKX,"BNB Chain Ecosystem, Meme, Binance-Peg Tokens",binance-peg-dogecoin,415440310,415440310.0,,,N/A,1211595.0
OKX,"Smart Contract Platform, Gaming (GameFi), NFT, Layer 1 (L1), Play To Earn, Zero Knowledge (ZK), FTX Holdings, Ronin Ecosystem, Gaming Blockchains, SideChain, Andreessen Horowitz (a16z) Portfolio, YZi Labs (Prev. Binance Labs) Portfolio",ronin,413184703,667083588.0,8088.544851494771,14718.371751224699,0.04,41327577.0
OKX,"Tokenized Assets, Solana Ecosystem, Polygon Ecosystem, Ethereum Ecosystem, Real World Assets (RWA), Tokenized Treasury Bonds (T-Bonds)",ousg,405074974,405074974.0,,,N/A,0.0
OKX,"Stablecoins, USD Stablecoin, Blast Ecosystem, Crypto-backed Stablecoin, Fiat-backed Stablecoin",usdb,406171509,406171509.0,,,N/A,1604873.0
OKX,"Base Ecosystem, Bridged WETH, Bridged-Tokens",l2-standard-bridged-weth-base,405223405,405223405.0,,,N/A,344608448.0
OKX,"Smart Contract Platform, DWF Labs Portfolio, Proof of Work (PoW), GMCI Layer 1 Index, Sequoia Capital Portfolio, GMCI Index, Made in China",conflux-token,404828233,451886317.0,123726.29707334489,153659.48802313505,0.02,60365412.0
OKX,"Solana Ecosystem, Arbitrum Ecosystem, Ethereum Ecosystem, Interoperability, Base Ecosystem, Multicoin Capital Portfolio, Cross-chain Communication, Made in USA",wormhole,401565170,888115019.0,67874.22896878459,238073.76684393646,0.02,154248825.0
OKX,"Infrastructure, Smart Contract Platform, Ethereum Ecosystem, Layer 2 (L2), Zero Knowledge (ZK), Starknet Ecosystem, Paradigm Portfolio, Coinbase Ventures Portfolio, Rollup, Multicoin Capital Portfolio, Alameda Research Portfolio, Pantera Capital Portfolio, GMCI Layer 2 Index, Consensys Portfolio, Sequoia Capital Portfolio, GMCI Index, Polychain Capital Portfolio",starknet,396691020,1365415096.0,47418.799203740295,96189.65745332652,0.07,37890718.0
OKX,"Arbitrum Ecosystem, Bridged WETH, Bridged-Tokens",arbitrum-bridged-weth-arbitrum-one,396990205,396990205.0,,,N/A,279558364.0
OKX,"Ethereum Ecosystem, Real World Assets (RWA)",hashnote-usyc,393335820,393335820.0,,,N/A,112.07
OKX,"Smart Contract Platform, Sports, NFT, Layer 1 (L1), Ethereum Ecosystem, Alleged SEC Securities, Chiliz Ecosystem, YZi Labs (Prev. Binance Labs) Portfolio, Coinbase 50 Index",chiliz,392463405,392463405.0,45069.470585015275,80192.1393102068,0.07,39876214.0
OKX,"Decentralized Exchange (DEX), Infrastructure, Smart Contract Platform, Exchange-based Tokens, Decentralized Finance (DeFi), Bridge Governance Tokens, Multicoin Capital Portfolio, Proof of Stake (PoS), Delphi Ventures Portfolio",thorchain,391673770,474182463.0,,,N/A,76064746.0
OKX,"Decentralized Finance (DeFi), Liquid Staking Tokens, Base Ecosystem, Liquid Staked ETH, Liquid Staking",super-oeth,390859005,390859005.0,,,N/A,177925.0
OKX,"Smart Contract Platform, Layer 1 (L1), Bitcoin Fork, Proof of Work (PoW)",ecash,382392643,382394088.0,,,N/A,27402114.0
OKX,"Decentralized Finance (DeFi), Arbitrum Ecosystem, Ethereum Ecosystem, Real World Assets (RWA), Base Ecosystem, Coinbase Ventures Portfolio, Energi Ecosystem, Made in USA",reserve-rights-token,381276621,677926809.0,23593.217253171424,73630.0684226222,0.06,50906693.0
OKX,"Solana Ecosystem, Meme, Dog-Themed, Solana Meme, GMCI Meme Index, GMCI Index",dogwifcoin,382708791,382708791.0,163217.61852559383,299435.7173619239,0.08,213172101.0
OKX,"Stablecoins, Solana Ecosystem, Arbitrum Ecosystem, Ethereum Ecosystem, Aptos Ecosystem, Sui Ecosystem, Mantle Ecosystem, Osmosis Ecosystem, Fiat-backed Stablecoin, Yield Tokenization Product, Yield-Bearing Stablecoin",ondo-us-dollar-yield,380485084,587625112.0,,,N/A,2906417.0
OKX,"Artificial Intelligence (AI), Smart Contract Platform, Storage, Layer 1 (L1), DePIN, Coinbase Ventures Portfolio, Multicoin Capital Portfolio, Andreessen Horowitz (a16z) Portfolio, Blockchain Capital Portfolio",arweave,378022942,378022942.0,30703.457546719936,65148.89442040542,0.09,29126279.0
OKX,"Crypto-Backed Tokens, Decentralized Finance (DeFi), Tokenized BTC, Solana Ecosystem, Polygon Ecosystem, Arbitrum Ecosystem, Ethereum Ecosystem, Optimism Ecosystem, Base Ecosystem",tbtc,370418776,370418776.0,,,N/A,6306391.0
OKX,"Decentralized Finance (DeFi), Liquid Staking Tokens, Ethereum Ecosystem, Liquid Staked ETH, Liquid Staking",stakewise-v3-oseth,367842261,367842261.0,,,N/A,257752.0
OKX,"Solana Ecosystem, Payment Solutions, Viction Ecosystem",saros-finance,363219685,1383694129.0,,,N/A,17080373.0
OKX,"Artificial Intelligence (AI), Solana Ecosystem, Ethereum Ecosystem, Base Ecosystem, AI Agents, Virtuals Protocol Ecosystem, AI Agent Launchpad, Binance Alpha Spotlight",virtual-protocol,365073456,560641410.0,,,N/A,118133035.0
OKX,"Smart Contract Platform, Layer 1 (L1), Ethereum Ecosystem, Real World Assets (RWA), RWA Protocol, Made in USA",plume,364212365,1821061823.0,,,N/A,69301124.0
OKX,"Gaming (GameFi), NFT, Polygon Ecosystem, Ethereum Ecosystem, Animoca Brands Portfolio, Gaming Blockchains, Gaming Governance Token, Gaming Utility Token, Andreessen Horowitz (a16z) Portfolio, ApeChain Ecosystem, Airdropped Tokens by NFT Projects, Coinbase 50 Index",apecoin,352057775,440371951.0,60387.80769443659,93171.42702185112,0.05,39703544.0
OKX,"Stablecoins, Decentralized Finance (DeFi), USD Stablecoin, BNB Chain Ecosystem, Seigniorage, Avalanche Ecosystem, Polygon Ecosystem, Fantom Ecosystem, Harmony Ecosystem, Arbitrum Ecosystem, Moonriver Ecosystem, Moonbeam Ecosystem, Ethereum Ecosystem, Optimism Ecosystem, Aurora Ecosystem, Polygon zkEVM Ecosystem, Evmos Ecosystem, Boba Network Ecosystem, Fiat-backed Stablecoin",frax,347829487,347829487.0,,,N/A,10433527.0
OKX,"Mantle Ecosystem, Bridged USDT, Bridged-Tokens, Bridged Stablecoins",mantle-bridged-usdt-mantle,343663736,343663736.0,,,N/A,1737637.0
OKX,"BNB Chain Ecosystem, Wallets, Account Abstraction, Energi Ecosystem",trust-wallet-token,338379913,812144472.0,,,N/A,16828229.0
OKX,"Smart Contract Platform, Gaming (GameFi), NFT, BNB Chain Ecosystem, Binance Launchpool, Avalanche Ecosystem, Ethereum Ecosystem, DWF Labs Portfolio, Gaming Blockchains, Avalanche L1",beam-2,338076481,381848779.0,,,N/A,17800112.0
OKX,"Smart Contract Platform, BNB Chain Ecosystem, Polygon Ecosystem, Harmony Ecosystem, Moonriver Ecosystem, Moonbeam Ecosystem, Ethereum Ecosystem, Layer 2 (L2), Zero Knowledge (ZK), Animoca Brands Portfolio, Alleged SEC Securities, Binance Launchpad, FTX Holdings, Coinbase Ventures Portfolio, Rollup, Proof of Stake (PoS), Alameda Research Portfolio, DragonFly Capital Portfolio, Energi Ecosystem, Sora Ecosystem, YZi Labs (Prev. Binance Labs) Portfolio, GMCI Layer 2 Index, GMCI 30 Index, Galaxy Digital Portfolio, GMCI Index, Coinbase 50 Index",matic-network,332777731,1904463257.0,,,N/A,2656512.0
OKX,"Liquid Staking Tokens, Ethereum Ecosystem, Restaking, Liquid Restaking Tokens, Ether.fi Ecosystem, Liquid Staked ETH, Liquid Staking",ether-fi-staked-eth,328489277,4449772488.0,,,N/A,176398.0
OKX,"Smart Contract Platform, Proof of Stake (PoS), Made in China",neo,327819989,464795107.0,67613.4094628922,80595.9156428628,0.02,81851392.0
OKX,"Infrastructure, BNB Chain Ecosystem, Avalanche Ecosystem, Polygon Ecosystem, Fantom Ecosystem, Arbitrum Ecosystem, Moonbeam Ecosystem, Ethereum Ecosystem, Optimism Ecosystem, Interoperability, Bridge Governance Tokens, Base Ecosystem, Osmosis Ecosystem, Cross-chain Communication, Secret Ecosystem, Galaxy Digital Portfolio, Polychain Capital Portfolio, Made in USA",axelar,326247302,413754943.0,,,N/A,10309104.0
