OKX,"Smart Contract Platform, Layer 1 (L1), Layer 0 (L0), Made in USA, Directed Acyclic Graph (DAG)",constellation-labs,151957254,151957364.0,,,N/A,2315972.0
OKX,"Artificial Intelligence (AI), Meme, Base Ecosystem, AI Agents, Binance Alpha Spotlight, AI Framework",freysa-ai,151869128,151869128.0,,,N/A,637325.0
OKX,"Binance Launchpool, Solana Ecosystem, Ethereum Ecosystem, Decentralized Science (DeSci)",bio-protocol,150920476,309121504.0,144651.19657784252,199041.92450187568,0.21,15958461.0
OKX,"Smart Contract Platform, Layer 1 (L1), Real World Assets (RWA), RWA Protocol",polymesh,150759286,150759286.0,,,N/A,2128790.0
OKX,"Payment Solutions, Made in USA, Directed Acyclic Graph (DAG)",nano,150374221,150374221.0,875.6678254182152,2803.9487270412824,0.14,3486398.0
OKX,"Exchange-based Tokens, Decentralized Finance (DeFi), Ethereum Ecosystem, Real World Assets (RWA), Alleged SEC Securities",lcx,149995765,151432054.0,,,N/A,2754698.0
OKX,BNB Chain Ecosystem,acet-token,149884672,195545516.0,,,N/A,718933.0
OKX,"NFT, Solana Ecosystem, NFT Marketplace, Paradigm Portfolio, Sequoia Capital Portfolio",magic-eden,148650154,1114523158.0,539308.2758164211,572964.5273162287,0.18,11869034.0
OKX,"Smart Contract Platform, Masternodes, Zero Knowledge (ZK), Proof of Work (PoW), Made in USA",zencash,148544274,148557371.0,,,N/A,14691732.0
OKX,"BNB Chain Ecosystem, Binance-Peg Tokens",binance-peg-sol,148428538,148428538.0,,,N/A,3381943.0
OKX,"Internet of Things (IOT), Smart Contract Platform, Layer 1 (L1), Proof of Work (PoW), Made in USA",digibyte,147280313,147311580.0,10755.405472696995,27531.846519877545,0.18,3392668.0
OKX,"Smart Contract Platform, Crypto-Backed Tokens, Wrapped-Tokens, Layer 2 (L2), Mantle Ecosystem",wrapped-ether-mantle-bridge,146578937,146578937.0,,,N/A,4392608.0
OKX,"Crypto-Backed Tokens, BNB Chain Ecosystem, Wrapped-Tokens, Ethereum Ecosystem",wrapped-beacon-eth,146429835,146429835.0,,,N/A,3670614.0
OKX,"Artificial Intelligence (AI), Smart Contract Platform, Layer 1 (L1), Proof of Work (PoW)",qubic-network,145431101,173936461.0,,,N/A,8944710.0
OKX,"Smart Contract Platform, Layer 1 (L1), Kadena Ecosystem, Multicoin Capital Portfolio, Proof of Work (PoW), Made in USA",kadena,144379236,144534278.0,10327.769584385922,17698.282362146445,0.09,4727244.0
OKX,"Smart Contract Platform, DWF Labs Portfolio, Proof of Stake (PoS)",waves,144079328,144079328.0,,,N/A,7505068.0
OKX,"Alleged SEC Securities, Osmosis Ecosystem, DeFiance Capital Portfolio, Pantera Capital Portfolio, Binance Labs Portfolio, Delphi Ventures Portfolio, Galaxy Digital Portfolio, OKX Ventures Portfolio",terra-luna-2,143713457,225398545.0,55989.14645546036,86536.96410797472,0.05,16691520.0
OKX,"Solana Ecosystem, Meme, Solana Meme, Murad Picks",gigachad-2,143043221,143043221.0,,,N/A,11604247.0
OKX,"Stablecoins, Ethereum Ecosystem, XRP Ledger Ecosystem, Fiat-backed Stablecoin, Made in USA",ripple-usd,141452406,141452406.0,,,N/A,18359975.0
OKX,"Smart Contract Platform, Layer 1 (L1), Harmony Ecosystem, Animoca Brands Portfolio, Binance Launchpad, Binance Labs Portfolio, Made in USA",harmony,140977121,150722235.0,12191.222838525004,33420.537735369384,0.09,8042693.0
OKX,"Gaming (GameFi), Polkadot Ecosystem, NFT, Ethereum Ecosystem, Gaming Blockchains, Andreessen Horowitz (a16z) Portfolio, Binance Labs Portfolio, Galaxy Digital Portfolio, Made in USA",mythos,139700418,179853229.0,,,N/A,2116259.0
OKX,"Stablecoins, EUR Stablecoin, Solana Ecosystem, Avalanche Ecosystem, Ethereum Ecosystem, Base Ecosystem, Stellar Ecosystem",euro-coin,139595857,139595857.0,265640.12115786585,259857.18824262498,0.11,26589960.0
OKX,"Gaming (GameFi), NFT, BNB Chain Ecosystem, Solana Ecosystem, Polygon Ecosystem, Play To Earn, Move To Earn, Ethereum Ecosystem, Binance Launchpad, Gaming Governance Token, Sports Games, Alameda Research Portfolio, Binance Labs Portfolio, Sequoia Capital Portfolio",stepn,138895342,259756417.0,59571.63332323019,82334.05043497152,0.04,18589801.0
OKX,"Tokenized Assets, Tokenized Gold, Real World Assets (RWA), Tokenized Commodities",kinesis-gold,138695221,138695221.0,,,N/A,32009627.0
OKX,"Gaming (GameFi), Play To Earn, Telegram Apps, TON Ecosystem, Tap to Earn, Arcade Games",hamster-kombat,138359726,214927729.0,27537.258771062006,57435.19840562842,0.05,20688706.0
OKX,"BNB Chain Ecosystem, Arbitrum Ecosystem, Cardano Ecosystem, Ethereum Ecosystem, DePIN, Base Ecosystem, DWF Labs Portfolio",world-mobile-token,137358901,396889718.0,,,N/A,13263288.0
OKX,"Crypto-Backed Tokens, Wrapped-Tokens, Avalanche Ecosystem",wrapped-avax,136859989,137778445.0,,,N/A,14018219.0
OKX,"Decentralized Finance (DeFi), Analytics, DeFi Index, Base Ecosystem",mag7-ssi,136368360,136368360.0,,,N/A,31433.0
OKX,"Stablecoins, EUR Stablecoin, Polygon Ecosystem, Ethereum Ecosystem, Real World Assets (RWA), Fiat-backed Stablecoin",stasis-eurs,134705594,134705594.0,,,N/A,52209.0
OKX,"Smart Contract Platform, Masternodes, Proof of Stake (PoS), Made in China",ontology,134382536,147236607.0,19766.52696381369,20774.825603676643,0.07,4193553.0
OKX,"Decentralized Exchange (DEX), Smart Contract Platform, Exchange-based Tokens, Decentralized Finance (DeFi), Arbitrum Ecosystem, Ethereum Ecosystem, Layer 2 (L2), Zero Knowledge (ZK), Loopring Ecosystem, Rollup, Energi Ecosystem",loopring,133677936,147397927.0,27920.569998171053,33352.7674883463,0.19,12658428.0
OKX,"Liquid Staking Tokens, Aptos Ecosystem, Liquid Staking",amnis-aptos,133640923,133669234.0,,,N/A,81735.0
OKX,"Smart Contract Platform, SocialFi, NFT, BNB Chain Ecosystem, Binance Launchpool, Ethereum Ecosystem, Decentralized Identifier (DID), Zero Knowledge (ZK), DWF Labs Portfolio, Coinbase Ventures Portfolio, Multicoin Capital Portfolio, Alameda Research Portfolio, DragonFly Capital Portfolio, Binance Labs Portfolio, Quest-to-Earn",project-galaxy,133112789,208396847.0,,,N/A,326719.0
OKX,"Smart Contract Platform, Base Ecosystem, Gaming Blockchains",b3,132219757,620963719.0,,,N/A,18604248.0
OKX,"Artificial Intelligence (AI), Binance Launchpool, Solana Ecosystem, DePIN, Animoca Brands Portfolio, Multicoin Capital Portfolio, Delphi Ventures Portfolio, OKX Ventures Portfolio, Made in USA",io,130549484,708293171.0,,,N/A,35993360.0
OKX,"Stablecoins, USD Stablecoin, Solana Ecosystem, Fiat-backed Stablecoin",global-dollar,130240303,130240303.0,,,N/A,500091.0
OKX,"Cronos Ecosystem, Bridged USDC, Bridged-Tokens, Bridged Stablecoins",cronos-bridged-usdc-cronos,129590629,129590629.0,,,N/A,1499644.0
OKX,"BNB Chain Ecosystem, Harmony Ecosystem, Ethereum Ecosystem, Alameda Research Portfolio, Binance Labs Portfolio",swipe,127610532,127679932.0,,,N/A,3763580.0
OKX,"Tokenized Assets, Real World Assets (RWA), Tokenized Silver, Tokenized Commodities",kinesis-silver,127447710,127447710.0,,,N/A,117052.0
OKX,"Artificial Intelligence (AI), Smart Contract Platform, BNB Chain Ecosystem, Solana Ecosystem, Layer 1 (L1), Polygon Ecosystem, Ethereum Ecosystem, DWF Labs Portfolio, Injective Ecosystem, OKX Ventures Portfolio",zignaly,125340148,173779754.0,,,N/A,2313450.0
OKX,"Decentralized Exchange (DEX), Exchange-based Tokens, Decentralized Finance (DeFi), Yield Farming, Automated Market Maker (AMM), BNB Chain Ecosystem, Yearn Ecosystem, Solana Ecosystem, Avalanche Ecosystem, Polygon Ecosystem, Near Protocol Ecosystem, Fantom Ecosystem, Harmony Ecosystem, Arbitrum Ecosystem, Celo Ecosystem, Ethereum Ecosystem, Base Ecosystem, Alameda Research Portfolio, Pantera Capital Portfolio, Energi Ecosystem, Sora Ecosystem, Blockchain Capital Portfolio",sushi,124707730,181565114.0,61354.12295247227,137056.50516610953,0.03,22813022.0
OKX,"Decentralized Finance (DeFi), Yield Farming, Lending/Borrowing Protocols, Ethereum Ecosystem, Real World Assets (RWA), Base Ecosystem, Binance Alpha Spotlight",syrup,124077900,199095011.0,,,N/A,11221769.0
OKX,"Decentralized Finance (DeFi), Insurance, Ethereum Ecosystem",nxm,123937491,123937491.0,,,N/A,0.0
OKX,"BNB Chain Ecosystem, Tron Ecosystem",global-commercial-business,123702548,123702548.0,,,N/A,194272.0
OKX,"Smart Contract Platform, BNB Chain Ecosystem, Ethereum Ecosystem, Zero Knowledge (ZK), Animoca Brands Portfolio, Binance Labs Portfolio, OKX Ventures Portfolio",polyhedra-network,123400949,2043620785.0,350438.99603936943,329428.9827874826,0.02,7996715.0
OKX,"Decentralized Exchange (DEX), Decentralized Finance (DeFi), Gnosis Chain Ecosystem, MEV Protection, Arbitrum Ecosystem, Ethereum Ecosystem, Intent, Delphi Ventures Portfolio, Blockchain Capital Portfolio",cow-protocol,123340239,297203857.0,,,N/A,31136263.0
OKX,"Business Services, Decentralized Finance (DeFi), Oracle, Fantom Ecosystem, Ethereum Ecosystem, Binance Launchpad, Osmosis Ecosystem, Energi Ecosystem, Binance Labs Portfolio, Sequoia Capital Portfolio",band-protocol,123273447,125122219.0,9676.990645492142,18783.190845975252,0.04,8132205.0
OKX,"Exchange-based Tokens, BNB Chain Ecosystem, Centralized Exchange (CEX) Token",nkyc-token,122661294,122661294.0,,,N/A,237388.0
OKX,"Polygon Ecosystem, Bridged DAI, Bridged-Tokens, Bridged Stablecoins",polygon-pos-bridged-dai-polygon-pos,122578131,122578131.0,,,N/A,11821834.0
OKX,"Tokenized Assets, Polygon Ecosystem, Arbitrum Ecosystem, Ethereum Ecosystem, Real World Assets (RWA), Starknet Ecosystem, Tokenized Treasury Bills (T-Bills)",eutbl,122449574,122449574.0,,,N/A,0.0
OKX,"Smart Contract Platform, Ethereum Ecosystem, Zero Knowledge (ZK), Alleged SEC Securities, Privacy Blockchain",coti,120451224,134408991.0,,,N/A,16292668.0
OKX,"Arbitrum Ecosystem, Ethereum Ecosystem",reserve-protocol-eth-plus,119965796,119965796.0,,,N/A,439663.0
OKX,"Arbitrum Ecosystem, Ethereum Ecosystem, Account Abstraction, Coinbase Ventures Portfolio, Binance Labs Portfolio, Consensys Portfolio, Outlier Ventures Portfolio",biconomy,119845625,128023630.0,18485.519030835694,34200.96835615086,0.16,13218682.0
OKX,"Decentralized Finance (DeFi), Ethereum Ecosystem, Real World Assets (RWA), Coinbase Ventures Portfolio, Stablecoin Protocol, Binance Labs Portfolio, Galaxy Digital Portfolio",usual,119694966,131606826.0,,,N/A,13901285.0
OKX,"Smart Contract Platform, SocialFi, Layer 1 (L1), Gaming Blockchains",hive,116828466,,,,N/A,2245886.0
OKX,"Meme, Ethereum Ecosystem, Dog-Themed",neiro-3,116124138,116124138.0,72393.78374126862,176160.52496830194,0.07,38517911.0
OKX,"Stablecoins, Ethereum Ecosystem, Base Ecosystem, Blast Ecosystem, Fiat-backed Stablecoin",anzen-usdz,115511568,115511568.0,,,N/A,117187.0
OKX,"Solana Ecosystem, Polygon Ecosystem, Ethereum Ecosystem",m2-global-wealth-limited-mmx,114435070,367133762.0,,,N/A,91396.0
OKX,"BNB Chain Ecosystem, Ethereum Ecosystem, Payment Solutions, DWF Labs Portfolio",alchemy-pay,114377395,231360321.0,18445.907373200273,65990.76811418992,0.04,25138184.0
OKX,"Business Services, Infrastructure, Smart Contract Platform, Decentralized Finance (DeFi), Polygon Ecosystem, Arbitrum Ecosystem, Ethereum Ecosystem, Liquid Staking Governance Tokens, Coinbase Ventures Portfolio, Proof of Stake (PoS), Index Coop Defi Index, Consensys Portfolio, Liquid Staking, Index Coop Index",rocket-pool,113390755,113390755.0,1992.4557328316662,5767.790335573412,0.04,9920770.0
OKX,"Smart Contract Platform, BNB Chain Ecosystem, Ethereum Ecosystem, Layer 2 (L2)",prometeus,112792222,118972617.0,,,N/A,2704571.0
OKX,"Decentralized Finance (DeFi), Derivatives, Synthetic Issuer, Ethereum Ecosystem, Synthetic",stp-network,112317306,112317306.0,,,N/A,24934659.0
OKX,"Smart Contract Platform, Proof of Stake (PoS), Sequoia Capital Portfolio",iostoken,112197831,112197831.0,26037.559666078327,51300.37316653695,0.04,46666654.0
OKX,"Smart Contract Platform, BNB Chain Ecosystem, Layer 1 (L1), Ethereum Ecosystem, Decentralized Identifier (DID), Base Ecosystem, Gravity Alpha Ecosystem",g-token,112008830,185837372.0,8669.84484679534,18912.029839641298,0.13,7179084.0
OKX,"Decentralized Exchange (DEX), Decentralized Finance (DeFi), BNB Chain Ecosystem, Wallets, XRP Ledger Ecosystem",solo-coin,111614258,111614258.0,,,N/A,2808927.0
OKX,"Exchange-based Tokens, NFT, BNB Chain Ecosystem, Ethereum Ecosystem",swftcoin,111600597,111600597.0,12054.5530077451,16194.55371788254,0.1,3032028.0
OKX,"Big Data, Business Services, Infrastructure, Decentralized Finance (DeFi), Solana Ecosystem, FTX Holdings, DWF Labs Portfolio, Name Service",bonfida,111587224,112610655.0,,,N/A,10932824.0
OKX,"Decentralized Finance (DeFi), Yield Farming, Avalanche Ecosystem, Fantom Ecosystem, Arbitrum Ecosystem, Olympus Pro Ecosystem, Ethereum Ecosystem, Stablecoin Protocol",spell-token,111502744,137823648.0,,,N/A,98060546.0
OKX,"Arbitrum Ecosystem, Bridged USDC, Bridged-Tokens, Bridged Stablecoins",usd-coin-ethereum-bridged,110270190,110270190.0,,,N/A,22551430.0
OKX,"Smart Contract Platform, Decentralized Finance (DeFi), Binance Launchpool, Derivatives, Perpetuals, Ethereum Ecosystem, Layer 2 (L2), DragonFly Capital Portfolio, Pantera Capital Portfolio",aevo-exchange,109930090,121716367.0,70278.08047694835,171213.35418408527,0.08,13466128.0
OKX,"Gaming (GameFi), NFT, Metaverse, Play To Earn, Ethereum Ecosystem, Animoca Brands Portfolio, RPG, Gaming Governance Token, Adventure Games, Energi Ecosystem, Delphi Ventures Portfolio",illuvium,109394822,140953997.0,4692.928065797349,5258.955951317983,0.07,13778070.0
OKX,"Music, NFT, Ethereum Ecosystem, Coinbase Ventures Portfolio, Multicoin Capital Portfolio, Pantera Capital Portfolio, Energi Ecosystem, Binance Labs Portfolio",audius,109235012,109235012.0,,,N/A,12538840.0
OKX,"Smart Contract Platform, Cross-chain Communication, Pantera Capital Portfolio",icon,108753102,109997483.0,16764.365426251465,26200.41043594044,0.1,934834.0
OKX,"Smart Contract Platform, Ethereum Ecosystem, Metis Ecosystem, Layer 2 (L2), DWF Labs Portfolio, Rollup, GMCI Layer 2 Index, OKX Ventures Portfolio, GMCI Index",metis-token,108641787,173678625.0,28606.483954434036,46456.1147149699,0.12,5111536.0
OKX,"Meme, PulseChain Ecosystem",the-grays-currency,107214954,107214942.0,,,N/A,260586.0
OKX,"Crypto-Backed Tokens, BNB Chain Ecosystem, Arbitrum Ecosystem, Ethereum Ecosystem, Mantle Ecosystem",ignition-fbtc,107136716,1181799705.0,,,N/A,392348.0
OKX,"Lending/Borrowing Protocols, Ethereum Ecosystem, Paradigm Portfolio, Coinbase Ventures Portfolio",euler,106827347,155407327.0,,,N/A,2219711.0
OKX,"Decentralized Finance (DeFi), BNB Chain Ecosystem, Real World Assets (RWA), DWF Labs Portfolio, Stellar Ecosystem",velo,106376413,345448078.0,22794.969381990104,61613.679279306925,0.06,12559635.0
OKX,"Decentralized Finance (DeFi), Ethereum Ecosystem, Morpho Ecosystem",steakhouse-usdc-morpho-vault,106222461,106222461.0,,,N/A,0.0
OKX,"NFT, Meme, Arbitrum Ecosystem, Ethereum Ecosystem, Anime-Themed, Binance HODLer Airdrops, Airdropped Tokens by NFT Projects",anime,106110899,191584173.0,174502.48240186094,145662.90981565905,0.05,12850410.0
OKX,"Solana Ecosystem, Multicoin Capital Portfolio, Stablecoin Protocol, Alameda Research Portfolio, DeFiance Capital Portfolio",uxd-protocol-token,105825013,105825013.0,,,N/A,1.35
OKX,"Stablecoins, BNB Chain Ecosystem",astherus-usdf,105171069,105171069.0,,,N/A,182596.0
OKX,"Tokenized Real Estate, Tokenized Assets, Gnosis Chain Ecosystem, RealT Tokens, Real World Assets (RWA), RWA Protocol",realtoken-ecosystem-governance,105140130,734220594.0,,,N/A,566.12
OKX,"Artificial Intelligence (AI), Smart Contract Platform, Masternodes, DePIN, Proof of Work (PoW), Made in USA",zelcash,104922610,104922858.0,,,N/A,8893616.0
OKX,"Solana Ecosystem, Meme, Solana Meme, PolitiFi, Made in USA",melania-meme,104585229,697234283.0,,,N/A,13713983.0
OKX,"Smart Contract Platform, BNB Chain Ecosystem, Ethereum Ecosystem, DWF Labs Portfolio, Made in USA",proton,104545030,115893055.0,,,N/A,3706536.0
OKX,"Infrastructure, Solana Ecosystem, Animoca Brands Portfolio, Cross-chain Communication, OKX Ventures Portfolio",zeus-network,104199923,272219392.0,36183.98449774643,42694.61135924097,0.19,9119570.0
OKX,"Smart Contract Platform, Polkadot Ecosystem, Binance Launchpool, Layer 2 (L2), Manta Network Ecosystem, Multicoin Capital Portfolio, Alameda Research Portfolio, DeFiance Capital Portfolio, Binance Labs Portfolio",manta-network,104078113,264305761.0,,,N/A,25488098.0
OKX,"NFT, Binance Launchpool, Meme, Ethereum Ecosystem, Binance Labs Portfolio, GMCI Meme Index, GMCI Index",memecoin-2,103964172,175162265.0,80978.68106066664,94866.55360600591,0.08,18571774.0
OKX,"Smart Contract Platform, Privacy, Layer 1 (L1), Proof of Stake (PoS), Proof of Work (PoW), Zano Ecosystem, Privacy Blockchain",zano,103042209,103042360.0,,,N/A,677609.0
OKX,"Solana Ecosystem, Meme, Base Ecosystem, AI Meme, AI Agents, Virtuals Protocol Ecosystem, Binance Alpha Spotlight, DeFAI",aixbt,103004626,120386972.0,96050.64023617709,119656.13787105128,0.08,42744013.0
OKX,"Artificial Intelligence (AI), Base Ecosystem, AI Agents, AI Applications, Made in USA",venice-token,102373794,244034986.0,,,N/A,5700063.0
OKX,"Business Services, Decentralized Finance (DeFi), Oracle, Derivatives, Synthetic Issuer, Avalanche Ecosystem, Ethereum Ecosystem, Blockchain Capital Portfolio, Synthetic, Made in USA",uma,102214041,147480498.0,14799.958694701716,18450.062391450443,0.08,8777906.0
OKX,"Decentralized Exchange (DEX), Decentralized Finance (DeFi), Automated Market Maker (AMM), Ethereum Ecosystem, Cronos Ecosystem",vvs-finance,101355993,198150229.0,,,N/A,277406.0
OKX,"Polygon Ecosystem, Arbitrum Ecosystem, Ethereum Ecosystem, Optimism Ecosystem, Bridge Governance Tokens, Cross-chain Communication, Intent, Boba Network Ecosystem, Blockchain Capital Portfolio, Made in USA",across-protocol,101316950,250757155.0,,,N/A,15524067.0
OKX,"Solana Ecosystem, Meme, Frog-Themed, Solana Meme, GMCI Meme Index, GMCI Index",book-of-meme,100995393,100995393.0,69369.94215274072,94470.29057893537,0.14,44910935.0
OKX,"Big Data, Infrastructure, Storage, Cardano Ecosystem, DePIN",iagon,100619949,267591705.0,,,N/A,446425.0
OKX,"Bridged USDT, QL1 Ecosystem, Bridged-Tokens, Bridged Stablecoins",qusdt,100002449,100002449.0,,,N/A,8795.39
OKX,"NFT, BNB Chain Ecosystem, Ethereum Ecosystem, Binance Launchpad, DWF Labs Portfolio, Binance Labs Portfolio",space-id,99902553,463331750.0,48455.445152650624,59827.07741539629,0.09,17424343.0
OKX,"Solana Ecosystem, Liquid Staking Tokens, Liquid Staked SOL, Liquid Staking",drift-staked-sol,99536041,99536041.0,,,N/A,26550.0
OKX,"Smart Contract Platform, BNB Chain Ecosystem, Binance Launchpool, Ethereum Ecosystem, Layer 2 (L2), Restaking, Rollups-as-a-Service (RaaS), Rollup, Binance Labs Portfolio",altlayer,99242462,355451177.0,,,N/A,12223996.0
OKX,"Crypto-Backed Tokens, Decentralized Finance (DeFi), Compound Tokens, cToken, Ethereum Ecosystem",compound-ether,98286285,98286285.0,,,N/A,174.4
OKX,"Smart Contract Platform, Ethereum Ecosystem, Layer 2 (L2), Optimism Superchain Ecosystem, Outlier Ventures Portfolio, Lisk Ecosystem",lisk,97775761,226932482.0,18667.724754047595,20777.740412575866,0.09,9760946.0
OKX,"Artificial Intelligence (AI), Infrastructure, Smart Contract Platform, Oracle, Polkadot Ecosystem, Ethereum Ecosystem, Interoperability, Layer 2 (L2), Zero Knowledge (ZK), DePIN, DWF Labs Portfolio, Rollup, AI Agents, Sora Ecosystem, AI Framework, Made in USA",pha,97049462,123698983.0,33036.27519671428,46014.60365323065,0.16,22658649.0
OKX,"NFT, Polygon Ecosystem, Ethereum Ecosystem, Optimism Ecosystem",blockv,96674793,96674793.0,,,N/A,69947.0
OKX,"Software as a service, Ethereum Ecosystem, Energi Ecosystem",status,96487846,165784611.0,62356.83403649777,72291.37149362426,0.16,7467717.0
OKX,"Stablecoins, LP Tokens, Ethereum Ecosystem",resolv-rlp,96334197,96334197.0,,,N/A,186465.0
OKX,"Smart Contract Platform, Layer 1 (L1), Zero Knowledge (ZK), Andreessen Horowitz (a16z) Portfolio, Privacy Blockchain, Made in USA",aleo,96184746,471288171.0,,,N/A,6021756.0
OKX,"Infrastructure, Smart Contract Platform, Oracle, Layer 1 (L1), Animoca Brands Portfolio, Coinbase Ventures Portfolio, Cross-chain Communication, Made in USA",supra,96023233,853787063.0,,,N/A,14551338.0
OKX,"XDC Ecosystem, Telos Ecosystem",ecoin-2,95498064,207099463.0,,,N/A,5.24
OKX,"Solana Ecosystem, Payment Solutions, Viction Ecosystem",saros-finance,95200090,362667032.0,,,N/A,725390.0
OKX,Layer 1 (L1),oec-token,95113354,95113354.0,4928.982344307999,3941.536627531428,0.26,339816.0
OKX,"DaoMaker Launchpad, Ethereum Ecosystem, Real World Assets (RWA), Sequoia Capital Portfolio, Made in USA",clearpool,94996073,125003721.0,,,N/A,2633045.0
OKX,"Gaming (GameFi), NFT, Kaia Ecosystem, Gaming Blockchains",bora,94810614,99169723.0,10623.63771695872,11850.38048005646,0.1,419687.0
OKX,"Solana Ecosystem, Liquid Staking Tokens, Restaking, Liquid Restaking Tokens, Liquid Staked SOL, Liquid Staking, Liquid Restaked SOL",solayer-staked-sol,94591066,94591066.0,,,N/A,241531.0
OKX,"Decentralized Finance (DeFi), Yield Farming, BNB Chain Ecosystem, Binance Launchpool, Lending/Borrowing Protocols, Arbitrum Ecosystem, Ethereum Ecosystem, Optimism Ecosystem, ZkSync Ecosystem, opBNB Ecosystem, Unichain Ecosystem",venus,94561758,169642086.0,,,N/A,6212662.0
OKX,"Fraxtal Ecosystem, Bridged-Tokens",l2-standard-bridged-frxusd,94408599,94408599.0,,,N/A,1293437.0
OKX,"Gaming (GameFi), NFT, BNB Chain Ecosystem",infinitar-governance-token,94084689,459131106.0,,,N/A,8691355.0
OKX,"Smart Contract Platform, Gaming (GameFi), Solana Ecosystem, Layer 2 (L2), Gaming Blockchains",sonic-svm,93995518,626636784.0,150250.27193864164,121911.32697100085,0.07,25468906.0
OKX,"Infrastructure, Smart Contract Platform, Ethereum Ecosystem, Data Availability, Modular Blockchain",avail,93784748,480168775.0,,,N/A,3619577.0
OKX,"Artificial Intelligence (AI), Infrastructure, Smart Contract Platform, Decentralized Finance (DeFi), Arbitrum Ecosystem, Ethereum Ecosystem, Zero Knowledge (ZK), DWF Labs Portfolio, Coinbase Ventures Portfolio, Pantera Capital Portfolio, Binance Labs Portfolio",marlin,93181236,114283762.0,,,N/A,5886378.0
OKX,"Ethereum Ecosystem, DWF Labs Portfolio",adventure-gold,92881869,92881869.0,24064.76751466137,87383.94853045126,0.01,27594538.0
OKX,"Artificial Intelligence (AI), Big Data, Media, BNB Chain Ecosystem, Polygon Ecosystem, Ethereum Ecosystem, GMCI DePIN Index, Galaxy Digital Portfolio, GMCI Index",everipedia,92486345,92486345.0,2628.0912069634305,2705.2546908121158,0.02,4681497.0
OKX,"Artificial Intelligence (AI), Virtual Reality, Launchpad, Ethereum Ecosystem, Telegram Apps, Discord Bots, PAAL AI Launchpad, AI Agents, AI Applications, AI Agent Launchpad, Binance Alpha Spotlight, AI Framework, DeFAI, Made in USA",paal-ai,91778746,103236718.0,,,N/A,7554470.0
OKX,"Decentralized Exchange (DEX), Exchange-based Tokens, Decentralized Finance (DeFi), Yield Farming, Automated Market Maker (AMM), Avalanche Ecosystem, Polygon Ecosystem, Near Protocol Ecosystem, Gnosis Chain Ecosystem, Harmony Ecosystem, Arbitrum Ecosystem, Ethereum Ecosystem, Optimism Ecosystem, Base Ecosystem, Index Coop Defi Index, Alameda Research Portfolio, DeFiance Capital Portfolio, Pantera Capital Portfolio, Energi Ecosystem, Polygon zkEVM Ecosystem, Huobi ECO Chain Ecosystem, Blockchain Capital Portfolio, Index Coop Index",balancer,90967873,98369779.0,50686.08084793185,57217.32682841976,0.14,6882249.0
OKX,"Energy, Ethereum Ecosystem, Alleged SEC Securities, Energi Ecosystem, GMCI DePIN Index, Blockchain Capital Portfolio, GMCI Index",power-ledger,90761914,171241252.0,,,N/A,6458082.0
OKX,"Gaming (GameFi), XDC Ecosystem, Gaming Utility Token",gama-coin,89882170,138280338.0,,,N/A,2278947.0
OKX,"Artificial Intelligence (AI), Oracle, Ethereum Ecosystem, DePIN, Energi Ecosystem, Sora Ecosystem, GMCI DePIN Index, GMCI Index",iexec-rlc,89779634,107910112.0,,,N/A,7564979.0
OKX,"BNB Chain Ecosystem, Liquid Staking Tokens",astherus-staked-bnb,88699810,88699810.0,,,N/A,897.35
OKX,"Infrastructure, Smart Contract Platform, Decentralized Finance (DeFi), BNB Chain Ecosystem, Avalanche Ecosystem, Polygon Ecosystem, Fantom Ecosystem, Harmony Ecosystem, Arbitrum Ecosystem, Ethereum Ecosystem, DWF Labs Portfolio, Layer 3 (L3), Outlier Ventures Portfolio",orbs,88549586,194463305.0,9086.905492930027,15371.171476482335,0.1,3431002.0
OKX,"Smart Contract Platform, Ethereum Ecosystem, Layer 2 (L2), Zero Knowledge (ZK), Restaking, Zircuit Ecosystem",zircuit,88219284,401924195.0,,,N/A,14000932.0
OKX,"Cronos Ecosystem, Bridged USDT, Bridged-Tokens, Bridged Stablecoins",cronos-bridged-usdt-cronos,87826713,87826713.0,,,N/A,289087.0
OKX,"Smart Contract Platform, Layer 1 (L1)",ong,87331756,214078296.0,,,N/A,1552673.0
OKX,"Smart Contract Platform, Bitcoin Sidechains, Stacks Ecosystem, SideChain",sbtc-2,86825366,86825366.0,,,N/A,27369.0
OKX,"Artificial Intelligence (AI), Smart Contract Platform, Gaming (GameFi), NFT, BNB Chain Ecosystem, Layer 1 (L1), Ethereum Ecosystem, Modular Blockchain, Chromia Ecosystem",chromaway,86792952,86792952.0,,,N/A,9809374.0
OKX,"Gaming (GameFi), Play To Earn, Ethereum Ecosystem, RPG, Alameda Research Portfolio, Circle Ventures Portfolio, OKX Ventures Portfolio, MMO",big-time,86363084,242319494.0,175265.24988991246,210702.63078655122,0.04,15037948.0
OKX,BNB Chain Ecosystem,metfi-2,86359996,202124582.0,,,N/A,436314.0
OKX,"Smart Contract Platform, Polkadot Ecosystem, Layer 1 (L1), Coinbase Ventures Portfolio, Binance Labs Portfolio",moonbeam,86322576,105119784.0,9334.610384546671,24635.236628868635,0.11,4996839.0
OKX,"Stablecoins, USD Stablecoin, Ethereum Ecosystem, Sonic Ecosystem, Fiat-backed Stablecoin",frax-usd,86177719,86177719.0,,,N/A,1664657.0
OKX,"Smart Contract Platform, Layer 1 (L1), Zero Knowledge (ZK)",ozone-chain,86163206,118772089.0,,,N/A,240361.0
OKX,"Decentralized Exchange (DEX), Decentralized Finance (DeFi), Arbitrum Ecosystem, Ethereum Ecosystem",tokenlon,85885415,103377370.0,,,N/A,21418.0
OKX,"Crypto-Backed Tokens, Ethereum Ecosystem",temple,85748669,85917598.0,,,N/A,14280.62
OKX,"Business Services, Polygon Ecosystem, Ethereum Ecosystem",request-network,85186447,110679933.0,,,N/A,3408205.0
