OKX,"Business Services, Infrastructure, Smart Contract Platform, Decentralized Finance (DeFi), Polygon Ecosystem, Arbitrum Ecosystem, Ethereum Ecosystem, Liquid Staking Governance Tokens, Coinbase Ventures Portfolio, Proof of Stake (PoS), Index Coop Defi Index, Consensys Portfolio, Liquid Staking, Index Coop Index",rocket-pool,81005791,81005791.0,1191.9281965158818,3344.6198313937425,0.21,11576716.0
OKX,"Infrastructure, Binance Launchpool",nillion,80175988,410842878.0,,,N/A,59276144.0
OKX,"Decentralized Exchange (DEX), Decentralized Finance (DeFi), Arbitrum Ecosystem, Ethereum Ecosystem",tokenlon,80549976,97376526.0,,,N/A,91713.0
OKX,"Stablecoins, USD Stablecoin, Ethereum Ecosystem, Sonic Ecosystem, Fiat-backed Stablecoin",frax-usd,80477734,80477734.0,,,N/A,6024859.0
OKX,"Smart Contract Platform, BNB Chain Ecosystem, Ethereum Ecosystem, DWF Labs Portfolio, Made in USA",proton,80207590,88917600.0,,,N/A,3150068.0
OKX,"Artificial Intelligence (AI), Oracle, Ethereum Ecosystem, DePIN, Energi Ecosystem, Sora Ecosystem, GMCI DePIN Index, GMCI Index",iexec-rlc,80129435,96311110.0,,,N/A,8203546.0
OKX,"Smart Contract Platform, Gaming (GameFi), Solana Ecosystem, Layer 2 (L2), Gaming Blockchains",sonic-svm,79958383,533055887.0,143302.6348869903,135341.3363441367,0.07,32147558.0
OKX,"Decentralized Finance (DeFi), Ethereum Ecosystem",relend-usdc,79664221,79664221.0,,,N/A,0.0
OKX,"Stablecoins, USD Stablecoin, Solana Ecosystem, Ethereum Ecosystem, Multicoin Capital Portfolio, Fiat-backed Stablecoin",paxos-standard,79478384,79478384.0,,,N/A,6148939.0
OKX,"Business Services, Polygon Ecosystem, Ethereum Ecosystem",request-network,79117186,106247103.0,,,N/A,3539157.0
OKX,"SocialFi, Coinbase Ventures Portfolio, Pantera Capital Portfolio, Andreessen Horowitz (a16z) Portfolio, Sequoia Capital Portfolio",deso,79069879,81143715.0,,,N/A,1870448.0
OKX,"NFT, Binance Launchpool, Meme, Ethereum Ecosystem, YZi Labs (Prev. Binance Labs) Portfolio, GMCI Meme Index, GMCI Index",memecoin-2,78862911,127362365.0,38397.94087730175,60946.66193078064,0.05,16938203.0
OKX,"Energy, Ethereum Ecosystem, Alleged SEC Securities, Energi Ecosystem, GMCI DePIN Index, Blockchain Capital Portfolio, GMCI Index",power-ledger,78585913,148268690.0,,,N/A,8634205.0
OKX,"Solana Ecosystem, Liquid Staking Tokens, Restaking, Liquid Restaking Tokens, Liquid Staked SOL, Liquid Staking, Liquid Restaked SOL",solayer-staked-sol,78207565,78207565.0,,,N/A,444003.0
OKX,"Decentralized Exchange (DEX), Exchange-based Tokens, Decentralized Finance (DeFi), Yield Farming, Automated Market Maker (AMM), Avalanche Ecosystem, Polygon Ecosystem, Near Protocol Ecosystem, Gnosis Chain Ecosystem, Harmony Ecosystem, Arbitrum Ecosystem, Ethereum Ecosystem, Optimism Ecosystem, Base Ecosystem, Index Coop Defi Index, Alameda Research Portfolio, DeFiance Capital Portfolio, Pantera Capital Portfolio, Energi Ecosystem, Polygon zkEVM Ecosystem, Huobi ECO Chain Ecosystem, Blockchain Capital Portfolio, Index Coop Index",balancer,78030994,84300752.0,22437.59545488487,54152.73358451526,0.16,8782592.0
OKX,"Smart Contract Platform, Layer 1 (L1), DWF Labs Portfolio, Radix Ecosystem",radix,78383012,95951868.0,,,N/A,748911.0
OKX,"Big Data, Business Services, Infrastructure, Decentralized Finance (DeFi), Solana Ecosystem, FTX Holdings, DWF Labs Portfolio, Name Service",bonfida,77578139,78289658.0,,,N/A,17607724.0
OKX,"Smart Contract Platform, Layer 2 (L2), eGirl Capital Portfolio, Paradigm Portfolio, Blast Ecosystem",blast,77471979,284914240.0,,,N/A,15993342.0
OKX,"Solana Ecosystem, Meme, Frog-Themed, Solana Meme, GMCI Meme Index, GMCI Index",book-of-meme,77521127,77521127.0,47002.22520868627,95352.4415562251,0.09,35863909.0
OKX,"Internet of Things (IOT), BNB Chain Ecosystem, Ethereum Ecosystem, DePIN, DWF Labs Portfolio",mass-vehicle-ledger,76725624,80641238.0,,,N/A,455641.0
OKX,"Ethereum Ecosystem, DWF Labs Portfolio",adventure-gold,76247680,76247680.0,24550.296044829007,52503.088939754154,0.04,14814995.0
OKX,"Solana Ecosystem, Polygon Ecosystem, DePIN, Pantera Capital Portfolio",geodnet,76009994,237088005.0,,,N/A,498954.0
OKX,"Optimism Ecosystem, Bridged WBTC, Bridged-Tokens",optimism-bridged-wbtc-optimism,76112432,76112432.0,,,N/A,2546513.0
OKX,"Sports, BNB Chain Ecosystem",pixer-eternity,75861839,352537163.0,,,N/A,120914.0
OKX,"Infrastructure, Smart Contract Platform, Oracle, Layer 1 (L1), Animoca Brands Portfolio, Coinbase Ventures Portfolio, Cross-chain Communication, Made in USA",supra,72250835,496103899.0,,,N/A,9727848.0
OKX,"Meme, Ethereum Ecosystem, Dog-Themed",neiro-3,74818706,74818706.0,27714.361253020423,76658.67238910231,0.11,50869270.0
OKX,BNB Chain Ecosystem,aventis-ai,74480588,191853474.0,,,N/A,18114.96
OKX,"Artificial Intelligence (AI), Smart Contract Platform, Gaming (GameFi), NFT, BNB Chain Ecosystem, Layer 1 (L1), Ethereum Ecosystem, Modular Blockchain, Chromia Ecosystem",chromaway,74054201,74054201.0,,,N/A,10224979.0
OKX,"Exchange-based Tokens, Centralized Exchange (CEX) Token, Ethereum Ecosystem",bitmart-token,74073970,139546579.0,,,N/A,4035667.0
OKX,"Tokenized Assets, Polygon Ecosystem, Arbitrum Ecosystem, Ethereum Ecosystem, Real World Assets (RWA), Starknet Ecosystem, Tokenized Treasury Bills (T-Bills)",spiko-us-t-bills-money-market-fund,73925479,73925479.0,,,N/A,0.0
OKX,"Gaming (GameFi), NFT, BNB Chain Ecosystem, Metaverse, Collectibles, Polygon Ecosystem, Play To Earn, Harmony Ecosystem, Guild and Scholarship, Ethereum Ecosystem, Animoca Brands Portfolio, Base Ecosystem, DWF Labs Portfolio, Ronin Ecosystem, Gaming Governance Token, Andreessen Horowitz (a16z) Portfolio, Delphi Ventures Portfolio",yield-guild-games,73603685,170760078.0,29390.02160554954,45959.78088873317,0.06,16448608.0
OKX,"Artificial Intelligence (AI), Solana Ecosystem, Meme, Pump.fun Ecosystem, AI Applications, Binance Alpha Spotlight",alchemist-ai,73697471,86701731.0,,,N/A,60766634.0
OKX,"Stablecoins, USD Stablecoin, Osmosis Ecosystem, Fiat-backed Stablecoin",usdx,73509404,73509404.0,,,N/A,22482.0
OKX,"Artificial Intelligence (AI), Infrastructure, Smart Contract Platform, Oracle, Polkadot Ecosystem, Ethereum Ecosystem, Interoperability, Layer 2 (L2), Zero Knowledge (ZK), DePIN, DWF Labs Portfolio, Rollup, AI Agents, Sora Ecosystem, AI Framework, Made in USA",pha,73609690,93449398.0,33516.85094043175,34306.174373659764,0.32,21773391.0
OKX,"Smart Contract Platform, Ethereum Ecosystem, Layer 2 (L2), Zero Knowledge (ZK), Restaking, Zircuit Ecosystem",zircuit,73588417,335266437.0,,,N/A,22993779.0
OKX,"Blast Ecosystem, Bridged WETH, Bridged-Tokens",l2-standard-bridged-weth-blast,73201542,73201542.0,,,N/A,2075875.0
OKX,"Decentralized Finance (DeFi), Solana Ecosystem, Real World Assets (RWA), Payment Solutions, DePIN, Coinbase Ventures Portfolio, Alameda Research Portfolio, Circle Ventures Portfolio, OKX Ventures Portfolio, RWA Protocol, Made in USA",zebec-network,72896725,95452175.0,6434.151402225981,8653.446064544361,0.14,9989315.0
OKX,Ethereum Ecosystem,dkargo,72635657,77491810.0,,,N/A,1712828.0
OKX,"Exchange-based Tokens, Centralized Exchange (CEX) Token, Ethereum Ecosystem",hashkey-ecopoints,72172019,544694483.0,,,N/A,1615567.0
OKX,"Smart Contract Platform, Layer 1 (L1)",ong,70916472,173068727.0,,,N/A,1815726.0
OKX,"Exchange-based Tokens, Layer 1 (L1), Ethereum Ecosystem",devve,71545778,98243488.0,,,N/A,531775.0
OKX,"Decentralized Finance (DeFi), Derivatives, Synthetic Issuer, Ethereum Ecosystem, Base Ecosystem, Synthetic",stp-network,70843390,70843390.0,,,N/A,8168747.0
OKX,"Smart Contract Platform, Gaming (GameFi), NFT, Layer 1 (L1), Play To Earn, Ethereum Ecosystem, Animoca Brands Portfolio, Gaming Blockchains, Pantera Capital Portfolio, OKX Ventures Portfolio",wax,70420500,75770292.0,6105.828103509159,14822.00430117674,0.1,8087297.0
OKX,"Smart Contract Platform, Meme, Ethereum Ecosystem, Layer 2 (L2), Shibarium Ecosystem, Dog-Themed",bone-shibaswap,69831559,69860798.0,3271.1192662503317,3821.627053901083,0.18,6905712.0
OKX,Smart Contract Platform,songbird,69817506,82970265.0,,,N/A,245620.0
OKX,"Smart Contract Platform, Layer 1 (L1), Osmosis Ecosystem, XRP Ledger Ecosystem",coreum,69769906,69769906.0,,,N/A,218679.0
OKX,"Wrapped-Tokens, Solana Ecosystem",wrapped-fragsol,69624854,69624854.0,,,N/A,1408839.0
OKX,"Meme, Ethereum Ecosystem, Mantle Ecosystem",puff-the-dragon,69530728,69530728.0,,,N/A,86837.0
OKX,"Lending/Borrowing Protocols, Solana Ecosystem, FTX Holdings, Coinbase Ventures Portfolio, Alameda Research Portfolio, DragonFly Capital Portfolio",solend,69360419,137087973.0,,,N/A,904.32
OKX,"BNB Chain Ecosystem, Solana Ecosystem, Polygon Ecosystem, Meme, Ethereum Ecosystem, Cronos Ecosystem, Dog-Themed, Elon Musk-Inspired, Fuse Ecosystem",dogelon-mars,69179119,125860316.0,6856.777184440969,11072.808597641564,0.24,3903071.0
OKX,"Solana Ecosystem, Meme, Base Ecosystem, AI Meme, AI Agents, Virtuals Protocol Ecosystem, Binance Alpha Spotlight, DeFAI",aixbt,69569098,81309096.0,74045.21349020224,95924.76392887617,0.12,44693369.0
OKX,"Smart Contract Platform, Cosmos Ecosystem, Modular Blockchain, Osmosis Ecosystem, Rollups-as-a-Service (RaaS)",dymension,69051719,261090197.0,,,N/A,21138711.0
OKX,"Artificial Intelligence (AI), Infrastructure, Smart Contract Platform, Decentralized Finance (DeFi), Arbitrum Ecosystem, Ethereum Ecosystem, Zero Knowledge (ZK), DWF Labs Portfolio, Coinbase Ventures Portfolio, Pantera Capital Portfolio, YZi Labs (Prev. Binance Labs) Portfolio",marlin,68806745,84064106.0,,,N/A,5700291.0
OKX,"Smart Contract Platform, Proof of Stake (PoS)",stratis,68629557,72721079.0,,,N/A,1114145.0
OKX,"Software as a service, Polygon Ecosystem, Ethereum Ecosystem, Decentralized Identifier (DID), Pantera Capital Portfolio, Energi Ecosystem, Blockchain Capital Portfolio",civic,68570986,85499982.0,7930.1675764787105,20723.152803277837,0.1,8273634.0
OKX,"Smart Contract Platform, Privacy, Proof of Work (PoW), Made in USA",verge,68554757,68691886.0,,,N/A,4130639.0
OKX,"Artificial Intelligence (AI), Base Ecosystem, AI Agents, AI Applications, Made in USA",venice-token,68395910,165626620.0,,,N/A,25428301.0
OKX,"Exchange-based Tokens, Centralized Exchange (CEX) Token, Near Protocol Ecosystem, Harmony Ecosystem, Ethereum Ecosystem, Multicoin Capital Portfolio, Alameda Research Portfolio, Elastos Smart Contract Chain Ecosystem, Sequoia Capital Portfolio, Made in China",huobi-token,67723568,85415961.0,,,N/A,9164.55
OKX,"Smart Contract Platform, Wallets, Layer 2 (L2), Osmosis Ecosystem",islamic-coin,67375593,792223568.0,,,N/A,454877.0
OKX,"Decentralized Finance (DeFi), Lending/Borrowing Protocols, Moonbeam Ecosystem, Base Ecosystem, Coinbase Ventures Portfolio, Made in USA",moonwell-artemis,66987052,101065521.0,,,N/A,3397992.0
OKX,"Stablecoins, USD Stablecoin, Seigniorage, Alleged SEC Securities, Osmosis Ecosystem, Stablecoin Protocol, DeFiance Capital Portfolio, Terra Classic Ecosystem, YZi Labs (Prev. Binance Labs) Portfolio, Delphi Ventures Portfolio, Galaxy Digital Portfolio, Fiat-backed Stablecoin",terrausd,66580279,72536611.0,32065.14505566858,41032.55747210357,0.17,13923435.0
OKX,Retail,milk-alliance,67250242,148420071.0,,,N/A,3296261.0
OKX,"Decentralized Exchange (DEX), Decentralized Finance (DeFi), Sui Ecosystem, Animoca Brands Portfolio, OKX Ventures Portfolio, Dex Aggregator",cetus-protocol,66170936,95687102.0,34487.1213739904,46266.65081029173,0.04,18985144.0
OKX,"Meme, Dog-Themed, TON Ecosystem, TON Meme",dogs-2,66082830,70334894.0,46771.28827032227,94804.44482780425,0.08,24647474.0
OKX,"BNB Chain Ecosystem, Meme, Binance Alpha Spotlight, Four.meme Ecosystem",test-3,65662814,65662814.0,,,N/A,34333889.0
OKX,"Solana Ecosystem, Avalanche Ecosystem, Polygon Ecosystem, Ethereum Ecosystem, Aptos Ecosystem, Real World Assets (RWA), Ink Ecosystem",apollo-diversified-credit-securitize-fund,65692940,65692940.0,,,N/A,0.0
OKX,"Decentralized Finance (DeFi), Wallets, Ethereum Ecosystem, Pundi AIFX Omnilayer Ecosystem",pundi-x-2,65601261,65601261.0,,,N/A,6018553.0
OKX,"Meme, Ethereum Ecosystem, PolitiFi",constitutiondao,65340333,65340333.0,60012.65274501393,123650.01887238068,0.08,32797468.0
OKX,"Decentralized Finance (DeFi), USD Stablecoin, BNB Chain Ecosystem, Avalanche Ecosystem, Arbitrum Ecosystem, Liquid Staking Tokens, Ethereum Ecosystem, Optimism Ecosystem, Fiat-backed Stablecoin",staked-frax,64837837,64837837.0,,,N/A,1101.07
OKX,"Gaming (GameFi), Play To Earn, Guild and Scholarship, Ethereum Ecosystem, Animoca Brands Portfolio, Base Ecosystem, DWF Labs Portfolio, Ronin Ecosystem, Coinbase Ventures Portfolio, DeFiance Capital Portfolio, Pantera Capital Portfolio, YZi Labs (Prev. Binance Labs) Portfolio, MMO",zentry,63760714,92078622.0,30331.853485185235,43382.31319333007,0.21,4839134.0
OKX,"Smart Contract Platform, Layer 1 (L1), Zero Knowledge (ZK), Andreessen Horowitz (a16z) Portfolio, Privacy Blockchain, Made in USA",aleo,64003378,302662742.0,,,N/A,6885153.0
OKX,"Polkadot Ecosystem, Real World Assets (RWA), Coinbase Ventures Portfolio, Circle Ventures Portfolio, Galaxy Digital Portfolio, RWA Protocol",centrifuge,63047851,69045229.0,1668.0883556203166,3975.0052712872675,0.08,673296.0
OKX,"Business Services, Decentralized Finance (DeFi), Oracle, Polygon Ecosystem, Gnosis Chain Ecosystem, Arbitrum Ecosystem, Ethereum Ecosystem, Optimism Ecosystem, Manta Network Ecosystem, YZi Labs (Prev. Binance Labs) Portfolio, Lisk Ecosystem, Made in USA",tellor,63043186,64962517.0,50443.03795493928,56696.45631989881,0.04,22778612.0
OKX,"Decentralized Exchange (DEX), Decentralized Finance (DeFi), Yield Farming, Automated Market Maker (AMM), BNB Chain Ecosystem, Avalanche Ecosystem, Arbitrum Ecosystem, Mantle Ecosystem, DeFiance Capital Portfolio, Delphi Ventures Portfolio, Dex Aggregator",joe,63329275,79822890.0,24014.531795460513,11973.820630275668,0.19,8101714.0
OKX,"Smart Contract Platform, Gaming (GameFi), Layer 1 (L1), Proof of Stake (PoS), Gaming Blockchains",oasys,62994504,159358086.0,10090.111254730502,15108.833170966354,0.19,708284.0
OKX,"Stablecoins, USD Stablecoin, BNB Chain Ecosystem, Fantom Ecosystem, Arbitrum Ecosystem, Ethereum Ecosystem, Optimism Ecosystem, Base Ecosystem, Crypto-backed Stablecoin, Fiat-backed Stablecoin",dola-usd,63001384,214255357.0,,,N/A,3909009.0
OKX,BNB Chain Ecosystem,diamond-launch,62920137,141329078.0,,,N/A,537160.0
OKX,"Crypto-Backed Tokens, Decentralized Finance (DeFi), Wrapped-Tokens, Ethereum Ecosystem",resolv-wstusr,62719213,62719213.0,,,N/A,12454.28
OKX,Ethereum Ecosystem,saasgo,62661621,78327026.0,,,N/A,237175.0
OKX,"Smart Contract Platform, Polkadot Ecosystem, Layer 1 (L1), Coinbase Ventures Portfolio, Proof of Stake (PoS), YZi Labs (Prev. Binance Labs) Portfolio",moonbeam,62885382,75771737.0,3470.129847436414,11211.095173789981,0.11,8657942.0
OKX,"Entertainment, Gaming (GameFi), NFT, Axie Infinity Ecosystem, Play To Earn, Ethereum Ecosystem, Ronin Ecosystem, Gaming Utility Token",smooth-love-potion,62544988,62544988.0,4962.747139793655,12222.554981776137,0.13,8984057.0
OKX,"Artificial Intelligence (AI), Infrastructure, Ethereum Ecosystem, AI Framework, Made in USA",arcblock,62269900,117490377.0,,,N/A,459734.0
OKX,"Gambling (GambleFi), Ethereum Ecosystem, Pantera Capital Portfolio, Energi Ecosystem",funfair,63240298,65632910.0,,,N/A,74453319.0
OKX,"Ethereum Ecosystem, DePIN",dent,61960094,64774574.0,,,N/A,7145607.0
OKX,"Gaming (GameFi), NFT, Metaverse, Collectibles, Play To Earn, Ethereum Ecosystem, Base Ecosystem, Energi Ecosystem",ecomi,62031664,71173433.0,4848.076683046596,3439.210742060814,0.22,2149020.0
OKX,E-commerce,pay-coin,62009586,115217023.0,,,N/A,1352681.0
OKX,"Ethereum Ecosystem, Morpho Ecosystem",coinshift-usdl-morpho-vault,61082486,61082486.0,,,N/A,0.0
OKX,"Decentralized Finance (DeFi), Lending/Borrowing Protocols, Solana Ecosystem, Binance Alpha Spotlight",kamino,60902091,451126597.0,,,N/A,17754384.0
OKX,"Decentralized Finance (DeFi), Liquid Staking Tokens, Berachain Ecosystem, Liquid Staked ETH",berachain-staked-eth,60545731,60545731.0,,,N/A,52663.0
OKX,"Exchange-based Tokens, BNB Chain Ecosystem, Centralized Exchange (CEX) Token, Polygon Ecosystem, Ethereum Ecosystem",bit2me,61219873,61838255.0,,,N/A,54845.0
OKX,"Artificial Intelligence (AI), Decentralized Finance (DeFi), Ethereum Ecosystem, DePIN",pinlink,60553308,75691635.0,,,N/A,1155583.0
OKX,"Healthcare, Osmosis Ecosystem",medibloc,60495989,65525535.0,,,N/A,246060.0
OKX,SocialFi,steem,60062217,60177698.0,,,N/A,23545227.0
OKX,"Smart Contract Platform, Ethereum Ecosystem, Layer 2 (L2), Zero Knowledge (ZK), Rollup, OKX Ventures Portfolio",taiko,59670218,579708386.0,,,N/A,16943300.0
OKX,"Artificial Intelligence (AI), Cardano Ecosystem, Ethereum Ecosystem, AI Agents, Sora Ecosystem",singularitynet,59613995,90080640.0,,,N/A,19774.95
OKX,"Smart Contract Platform, Layer 1 (L1), Proof of Work (PoW), Privacy Blockchain",ergo,59234707,72085183.0,,,N/A,85575.0
OKX,Ethereum Ecosystem,ai-analysis-token,59369004,269008985.0,,,N/A,106222.0
OKX,"Gaming (GameFi), Ethereum Ecosystem, Telegram Apps, Gaming Platform",gamebuild,61096925,76193121.0,,,N/A,22562512.0
OKX,"Optimism Ecosystem, Bridged WETH, Bridged-Tokens",l2-standard-bridged-weth-optimism,59000543,59000543.0,,,N/A,28615587.0
OKX,BNB Chain Ecosystem,metfi-2,58660891,195065170.0,,,N/A,1103666.0
OKX,"Decentralized Finance (DeFi), Lending/Borrowing Protocols, Arbitrum Ecosystem, Ethereum Ecosystem, Alameda Research Portfolio, Pantera Capital Portfolio",liquity,58545686,60138335.0,52911.29284767758,66120.14322125533,0.08,19023032.0
OKX,"Ethereum Ecosystem, Telegram Apps, Binance HODLer Airdrops",banana-gun,58493788,141809321.0,28705.939545411435,51425.03292615149,0.12,22282604.0
OKX,"Artificial Intelligence (AI), Business Services, Decentralized Finance (DeFi), Ethereum Ecosystem, Paradigm Portfolio, DragonFly Capital Portfolio, Energi Ecosystem",numeraire,58447479,77939253.0,7392.222595269915,15836.742369201416,0.11,7752729.0
OKX,"NFT, Ethereum Ecosystem",superrare,58833260,70902586.0,,,N/A,298371506.0
OKX,"Artificial Intelligence (AI), Smart Contract Platform, Layer 1 (L1), Ethereum Ecosystem, Osmosis Ecosystem, AI Agents, AI Agent Launchpad",humans-ai,60530463,60530463.0,,,N/A,117528.0
OKX,"Solana Ecosystem, Restaking, Liquid Restaking Tokens, Liquid Restaked SOL",renzo-restaked-sol,57689415,57689415.0,,,N/A,823467.0
OKX,"Stablecoins, USD Stablecoin, Ethereum Ecosystem, Fiat-backed Stablecoin",binance-usd,57817918,57817918.0,,,N/A,46960.0
OKX,"Wrapped-Tokens, BEVM Ecosystem",general-layer-btc,57703414,57703414.0,,,N/A,17.76
OKX,"Solana Ecosystem, Meme, Solana Meme, Pump.fun Ecosystem",comedian,57873600,57873600.0,,,N/A,40521790.0
OKX,"Solana Ecosystem, Meme, Ethereum Ecosystem, Cronos Ecosystem, Dog-Themed, AI Meme",corgiai,57379001,62217906.0,,,N/A,67793.0
OKX,"Smart Contract Platform, Meme, Base Ecosystem, Layer 3 (L3), Base Meme, Farcaster Ecosystem",degen-base,57507196,95443404.0,35138.03534808199,37109.70887908733,0.08,25039170.0
OKX,"Solana Ecosystem, Meme, Solana Meme, AI Meme, Pump.fun Ecosystem",act-i-the-ai-prophecy,57728970,57728970.0,65598.20566463037,52791.00939508268,0.16,304392104.0
OKX,"Crypto-Backed Tokens, Wrapped-Tokens, Gnosis Chain Ecosystem, Bridged-Tokens",bridged-wrapped-steth-gnosis,57349907,57349907.0,,,N/A,603074.0
OKX,"Smart Contract Platform, Layer 2 (L2), Made in USA",metal,56877293,56877293.0,,,N/A,656389.0
OKX,"Decentralized Finance (DeFi), Yield Farming, BNB Chain Ecosystem, Binance Launchpool, Yield Aggregator, Ethereum Ecosystem, Manta Network Ecosystem, YZi Labs (Prev. Binance Labs) Portfolio",bella-protocol,57172081,71465102.0,,,N/A,11233489.0
OKX,"Optimism Ecosystem, Bridged USDC, Bridged-Tokens, Bridged Stablecoins",bridged-usd-coin-optimism,56851928,56851928.0,,,N/A,2275816.0
OKX,"Artificial Intelligence (AI), NFT, Metaverse, Solana Ecosystem, Polygon Ecosystem, Ethereum Ecosystem, Cronos Ecosystem, Base Ecosystem, Multicoin Capital Portfolio, AI Agents, Alameda Research Portfolio, DeFiance Capital Portfolio, YZi Labs (Prev. Binance Labs) Portfolio",alethea-artificial-liquid-intelligence-token,57336053,69105025.0,,,N/A,1565839.0
OKX,"Smart Contract Platform, Layer 1 (L1), Decentralized Identifier (DID), Zero Knowledge (ZK)",concordium,56223506,67866835.0,,,N/A,387493.0
