OKX,"SocialFi, Arbitrum Ecosystem",uxlink,151807333,448868518.0,63824.381394082244,81768.16047894504,0.04,24993143.0
OKX,"Smart Contract Platform, Layer 1 (L1), Real World Assets (RWA), RWA Protocol",polymesh,151858222,151858222.0,,,N/A,2161441.0
OKX,"Payment Solutions, Made in USA, Directed Acyclic Graph (DAG)",nano,150287645,150287645.0,2110.41031952164,4766.242754091706,0.19,8401864.0
OKX,Smart Contract Platform,bitkub-coin,149349573,184900991.0,,,N/A,442764.0
OKX,"Smart Contract Platform, Masternodes, Zero Knowledge (ZK), Proof of Work (PoW), Made in USA",zencash,147691082,147691778.0,,,N/A,16728975.0
OKX,"Gaming (GameFi), NFT, Solana Ecosystem, Animoca Brands Portfolio, FTX Holdings, Multicoin Capital Portfolio, Alameda Research Portfolio",metaplex,149679902,191802573.0,,,N/A,6001184.0
OKX,BNB Chain Ecosystem,acet-token,149427143,194948607.0,,,N/A,957044.0
OKX,"NFT, Solana Ecosystem, NFT Marketplace, Paradigm Portfolio, Sequoia Capital Portfolio",magic-eden,145849864,1093527634.0,566481.7439529692,559050.6200752085,0.09,17005893.0
OKX,"Smart Contract Platform, Crypto-Backed Tokens, Wrapped-Tokens, Layer 2 (L2), Mantle Ecosystem",wrapped-ether-mantle-bridge,146287805,146287805.0,,,N/A,6845680.0
OKX,"BNB Chain Ecosystem, Binance-Peg Tokens",binance-peg-sol,147290045,147290045.0,,,N/A,4032806.0
OKX,"Gaming (GameFi), Play To Earn, Telegram Apps, TON Ecosystem, Tap to Earn, Arcade Games",hamster-kombat,141803158,220276750.0,23523.838322942294,57991.20666601334,0.05,25676032.0
OKX,"Crypto-Backed Tokens, BNB Chain Ecosystem, Wrapped-Tokens, Ethereum Ecosystem",wrapped-beacon-eth,146094124,146094124.0,,,N/A,13417627.0
OKX,"Decentralized Finance (DeFi), Derivatives, Prediction Markets, Solana Ecosystem",drift-protocol,141008649,488763652.0,,,N/A,44188757.0
OKX,"Exchange-based Tokens, Decentralized Finance (DeFi), Ethereum Ecosystem, Real World Assets (RWA), Alleged SEC Securities",lcx,146969134,148376441.0,,,N/A,2034501.0
OKX,"Smart Contract Platform, DWF Labs Portfolio, Proof of Stake (PoS)",waves,144820525,144820525.0,,,N/A,19927036.0
OKX,"Decentralized Exchange (DEX), Decentralized Finance (DeFi), Yield Farming, Automated Market Maker (AMM), BNB Chain Ecosystem, Seigniorage, Solana Ecosystem, Avalanche Ecosystem, Polygon Ecosystem, Fantom Ecosystem, Harmony Ecosystem, Arbitrum Ecosystem, Moonriver Ecosystem, Ethereum Ecosystem, Liquid Staking Governance Tokens, Curve Ecosystem, Stablecoin Protocol, Polygon zkEVM Ecosystem, Evmos Ecosystem, Fraxtal Ecosystem, GMCI DeFi Index, Liquid Staking, GMCI Index, Made in USA",frax-share,144558270,163317009.0,11140.16106813475,19163.886608358014,0.12,37609255.0
OKX,"Internet of Things (IOT), Smart Contract Platform, Layer 1 (L1), Proof of Work (PoW), Made in USA",digibyte,142729126,142745972.0,11528.535015072774,23432.264016156394,0.14,5083357.0
OKX,"Smart Contract Platform, Layer 1 (L1), Proof of Stake (PoS), GMCI Layer 1 Index, GMCI Index, Made in USA",casper-network,143641545,148715952.0,43543.90262995008,65576.64197160983,0.1,4348618.0
OKX,"BNB Chain Ecosystem, Binance Alpha Spotlight",bnb48-club-token,155416391,155416391.0,,,N/A,225496.0
OKX,"Stablecoins, Ethereum Ecosystem, XRP Ledger Ecosystem, Fiat-backed Stablecoin, Made in USA",ripple-usd,141436204,141436204.0,,,N/A,28523918.0
OKX,"Stablecoins, EUR Stablecoin, Solana Ecosystem, Avalanche Ecosystem, Ethereum Ecosystem, Base Ecosystem, Stellar Ecosystem",euro-coin,141355874,140811994.0,263501.84004795895,265881.9679518412,0.11,48838624.0
OKX,"Smart Contract Platform, Layer 1 (L1), Harmony Ecosystem, Animoca Brands Portfolio, Binance Launchpad, Binance Labs Portfolio, Made in USA",harmony,140923918,150665354.0,15780.61570327184,34193.17451111472,0.17,13264322.0
OKX,"Binance Launchpool, Solana Ecosystem, Ethereum Ecosystem, Decentralized Science (DeSci)",bio-protocol,139016612,284767118.0,144565.76688387402,191072.63629493854,0.12,16522521.0
OKX,"Solana Ecosystem, Meme, Solana Meme, Murad Picks",gigachad-2,135866022,135866022.0,,,N/A,13372831.0
OKX,"Gaming (GameFi), NFT, BNB Chain Ecosystem, Solana Ecosystem, Polygon Ecosystem, Play To Earn, Move To Earn, Ethereum Ecosystem, Binance Launchpad, Gaming Governance Token, Sports Games, Alameda Research Portfolio, Binance Labs Portfolio, Sequoia Capital Portfolio",stepn,138946443,259908491.0,56906.445793215855,79418.08931598609,0.02,29844115.0
OKX,"Tokenized Assets, Tokenized Gold, Real World Assets (RWA), Tokenized Commodities",kinesis-gold,137539884,137539884.0,,,N/A,136512265.0
OKX,"Smart Contract Platform, Layer 1 (L1), Kadena Ecosystem, Multicoin Capital Portfolio, Proof of Work (PoW), Made in USA",kadena,137986282,138111898.0,2338.6392499275603,12298.16604948225,0.09,5894809.0
OKX,"Alleged SEC Securities, Osmosis Ecosystem, DeFiance Capital Portfolio, Pantera Capital Portfolio, Binance Labs Portfolio, Delphi Ventures Portfolio, Galaxy Digital Portfolio, OKX Ventures Portfolio",terra-luna-2,138133997,216647784.0,36859.519841073445,96774.06572729786,0.1,19856343.0
OKX,"Crypto-Backed Tokens, Wrapped-Tokens, Avalanche Ecosystem",wrapped-avax,136978322,136978322.0,,,N/A,75116556.0
OKX,"Gaming (GameFi), Polkadot Ecosystem, NFT, Ethereum Ecosystem, Gaming Blockchains, Andreessen Horowitz (a16z) Portfolio, Binance Labs Portfolio, Galaxy Digital Portfolio, Made in USA",mythos,135650421,174639179.0,,,N/A,4750723.0
OKX,"Decentralized Finance (DeFi), Analytics, DeFi Index, Base Ecosystem",mag7-ssi,134665829,134665829.0,,,N/A,1720531.0
OKX,"Stablecoins, EUR Stablecoin, Polygon Ecosystem, Ethereum Ecosystem, Real World Assets (RWA), Fiat-backed Stablecoin",stasis-eurs,134062158,134062158.0,,,N/A,287771.0
OKX,"Smart Contract Platform, Masternodes, Proof of Stake (PoS), Made in China",ontology,133586795,146364751.0,18451.75583636653,19559.22924205047,0.07,6701789.0
OKX,"Liquid Staking Tokens, Aptos Ecosystem, Liquid Staking",amnis-aptos,130894841,130922570.0,,,N/A,94257.0
OKX,"Decentralized Exchange (DEX), Smart Contract Platform, Exchange-based Tokens, Decentralized Finance (DeFi), Arbitrum Ecosystem, Ethereum Ecosystem, Layer 2 (L2), Zero Knowledge (ZK), Loopring Ecosystem, Rollup, Energi Ecosystem",loopring,131266992,144739537.0,14718.342145908508,49467.95477816334,0.19,13595118.0
OKX,"BNB Chain Ecosystem, Arbitrum Ecosystem, Cardano Ecosystem, Ethereum Ecosystem, DePIN, Base Ecosystem, DWF Labs Portfolio",world-mobile-token,131212264,379129407.0,,,N/A,17819409.0
OKX,"Smart Contract Platform, Base Ecosystem, Gaming Blockchains",b3,133058344,624902104.0,,,N/A,23485367.0
OKX,"Stablecoins, USD Stablecoin, Solana Ecosystem, Fiat-backed Stablecoin",global-dollar,130264083,133264854.0,,,N/A,1294645.0
OKX,"Cronos Ecosystem, Bridged USDC, Bridged-Tokens, Bridged Stablecoins",cronos-bridged-usdc-cronos,129550055,129550055.0,,,N/A,1600394.0
OKX,"Tokenized Assets, Real World Assets (RWA), Tokenized Silver, Tokenized Commodities",kinesis-silver,129731369,129731369.0,,,N/A,2584400.0
OKX,"Smart Contract Platform, Proof of Stake (PoS), Sequoia Capital Portfolio",iostoken,128026941,128026941.0,9648.566803284575,38915.536465248515,0.05,163910736.0
OKX,"Smart Contract Platform, SocialFi, NFT, BNB Chain Ecosystem, Binance Launchpool, Ethereum Ecosystem, Decentralized Identifier (DID), Zero Knowledge (ZK), DWF Labs Portfolio, Coinbase Ventures Portfolio, Multicoin Capital Portfolio, Alameda Research Portfolio, DragonFly Capital Portfolio, Binance Labs Portfolio, Quest-to-Earn",project-galaxy,126953050,198753369.0,,,N/A,60198.0
OKX,"BNB Chain Ecosystem, Harmony Ecosystem, Ethereum Ecosystem, Alameda Research Portfolio, Binance Labs Portfolio",swipe,126821001,126870153.0,,,N/A,5835911.0
OKX,"Smart Contract Platform, Layer 1 (L1), Zero Knowledge (ZK)",ozone-chain,112373283,154901496.0,,,N/A,219064.0
OKX,"Smart Contract Platform, BNB Chain Ecosystem, Ethereum Ecosystem, Zero Knowledge (ZK), Animoca Brands Portfolio, Binance Labs Portfolio, OKX Ventures Portfolio",polyhedra-network,123237754,2040918146.0,365119.4562148476,317805.5291436318,0.02,7025628.0
OKX,"Decentralized Finance (DeFi), Insurance, Ethereum Ecosystem",nxm,123411389,123411389.0,,,N/A,0.0
OKX,"BNB Chain Ecosystem, Tron Ecosystem",global-commercial-business,122693952,122693952.0,,,N/A,198458.0
OKX,"Artificial Intelligence (AI), Binance Launchpool, Solana Ecosystem, DePIN, Animoca Brands Portfolio, Multicoin Capital Portfolio, Delphi Ventures Portfolio, OKX Ventures Portfolio, Made in USA",io,122448358,664340701.0,,,N/A,28034520.0
OKX,"Tokenized Assets, Polygon Ecosystem, Arbitrum Ecosystem, Ethereum Ecosystem, Real World Assets (RWA), Starknet Ecosystem, Tokenized Treasury Bills (T-Bills)",eutbl,122058101,122058101.0,,,N/A,0.0
OKX,"Polygon Ecosystem, Bridged DAI, Bridged-Tokens, Bridged Stablecoins",polygon-pos-bridged-dai-polygon-pos,122127877,122127877.0,,,N/A,12113560.0
OKX,"Decentralized Exchange (DEX), Decentralized Finance (DeFi), Gnosis Chain Ecosystem, MEV Protection, Arbitrum Ecosystem, Ethereum Ecosystem, Intent, Delphi Ventures Portfolio, Blockchain Capital Portfolio",cow-protocol,120977978,291772730.0,,,N/A,28601631.0
OKX,"Business Services, Decentralized Finance (DeFi), Oracle, Fantom Ecosystem, Ethereum Ecosystem, Binance Launchpad, Osmosis Ecosystem, Energi Ecosystem, Binance Labs Portfolio, Sequoia Capital Portfolio",band-protocol,120775038,122555762.0,14443.974083417312,33976.63474209972,0.03,11532510.0
OKX,"Artificial Intelligence (AI), Smart Contract Platform, BNB Chain Ecosystem, Solana Ecosystem, Layer 1 (L1), Polygon Ecosystem, Ethereum Ecosystem, DWF Labs Portfolio, Injective Ecosystem, OKX Ventures Portfolio",zignaly,120715792,167368245.0,,,N/A,3416394.0
OKX,"Decentralized Exchange (DEX), Exchange-based Tokens, Decentralized Finance (DeFi), Yield Farming, Automated Market Maker (AMM), BNB Chain Ecosystem, Yearn Ecosystem, Solana Ecosystem, Avalanche Ecosystem, Polygon Ecosystem, Near Protocol Ecosystem, Fantom Ecosystem, Harmony Ecosystem, Arbitrum Ecosystem, Celo Ecosystem, Ethereum Ecosystem, Base Ecosystem, Alameda Research Portfolio, Pantera Capital Portfolio, Energi Ecosystem, Sora Ecosystem, Blockchain Capital Portfolio",sushi,119727869,174314808.0,60024.88041637999,129149.11112090685,0.03,47382644.0
OKX,"Arbitrum Ecosystem, Ethereum Ecosystem",reserve-protocol-eth-plus,119831157,119831157.0,,,N/A,1109458.0
OKX,"Arbitrum Ecosystem, Ethereum Ecosystem, Account Abstraction, Coinbase Ventures Portfolio, Binance Labs Portfolio, Consensys Portfolio, Outlier Ventures Portfolio",biconomy,119117489,127277588.0,20227.973553023672,33218.06984196151,0.16,15443120.0
OKX,"Smart Contract Platform, Ethereum Ecosystem, Zero Knowledge (ZK), Alleged SEC Securities, Privacy Blockchain",coti,117537472,131157596.0,,,N/A,14830564.0
OKX,"Decentralized Finance (DeFi), Ethereum Ecosystem, Real World Assets (RWA), Coinbase Ventures Portfolio, Stablecoin Protocol, Binance Labs Portfolio, Galaxy Digital Portfolio",usual,116026929,127485669.0,,,N/A,16731608.0
OKX,"Exchange-based Tokens, BNB Chain Ecosystem, Centralized Exchange (CEX) Token",nkyc-token,117665373,117665373.0,,,N/A,241807.0
OKX,"Stablecoins, Ethereum Ecosystem, Base Ecosystem, Blast Ecosystem, Fiat-backed Stablecoin",anzen-usdz,115861070,115865934.0,,,N/A,245371.0
OKX,"Smart Contract Platform, SocialFi, Layer 1 (L1), Gaming Blockchains",hive,115516119,,,,N/A,5789169.0
OKX,"Meme, PulseChain Ecosystem",the-grays-currency,119050223,119050189.0,,,N/A,991916.0
OKX,"Smart Contract Platform, BNB Chain Ecosystem, Ethereum Ecosystem, Layer 2 (L2)",prometeus,112486143,118649767.0,,,N/A,3342358.0
OKX,"BNB Chain Ecosystem, Ethereum Ecosystem, Payment Solutions, DWF Labs Portfolio",alchemy-pay,113685658,229961089.0,21918.255311651683,62062.25143528111,0.09,30439473.0
OKX,"Decentralized Finance (DeFi), Derivatives, Synthetic Issuer, Ethereum Ecosystem, Synthetic",stp-network,115453471,115453471.0,,,N/A,37123190.0
OKX,"Meme, Ethereum Ecosystem, Dog-Themed",neiro-3,113337580,113337580.0,67020.12553427428,169286.27195238153,0.07,87954647.0
OKX,"Exchange-based Tokens, NFT, BNB Chain Ecosystem, Ethereum Ecosystem",swftcoin,111247410,111247410.0,14352.094815465496,16367.712486881095,0.17,3203430.0
OKX,"Business Services, Infrastructure, Smart Contract Platform, Decentralized Finance (DeFi), Polygon Ecosystem, Arbitrum Ecosystem, Ethereum Ecosystem, Liquid Staking Governance Tokens, Coinbase Ventures Portfolio, Proof of Stake (PoS), Index Coop Defi Index, Consensys Portfolio, Liquid Staking, Index Coop Index",rocket-pool,111661769,111661769.0,1092.245584444707,5962.64061464731,0.1,9748216.0
OKX,"Big Data, Business Services, Infrastructure, Decentralized Finance (DeFi), Solana Ecosystem, FTX Holdings, DWF Labs Portfolio, Name Service",bonfida,111673707,112697931.0,,,N/A,13972509.0
OKX,"Smart Contract Platform, BNB Chain Ecosystem, Layer 1 (L1), Ethereum Ecosystem, Decentralized Identifier (DID), Base Ecosystem, Gravity Alpha Ecosystem",g-token,111755976,185417853.0,9730.479113628171,18252.610435176346,0.07,28955752.0
OKX,"Artificial Intelligence (AI), Smart Contract Platform, Layer 1 (L1), Proof of Work (PoW)",qubic-network,112822258,134936091.0,,,N/A,2355072.0
OKX,"Solana Ecosystem, Polygon Ecosystem, Ethereum Ecosystem",m2-global-wealth-limited-mmx,114960667,368819998.0,,,N/A,117554.0
OKX,"Decentralized Finance (DeFi), Yield Farming, Lending/Borrowing Protocols, Ethereum Ecosystem, Real World Assets (RWA), Base Ecosystem, Binance Alpha Spotlight",syrup,109452801,175637766.0,,,N/A,10598329.0
OKX,"Arbitrum Ecosystem, Bridged USDC, Bridged-Tokens, Bridged Stablecoins",usd-coin-ethereum-bridged,110093123,110093123.0,,,N/A,36858892.0
OKX,"Smart Contract Platform, Cross-chain Communication, Pantera Capital Portfolio",icon,108708779,109949926.0,16834.084088965014,30051.091256901334,0.1,2576730.0
OKX,"Smart Contract Platform, BNB Chain Ecosystem, Ethereum Ecosystem, DWF Labs Portfolio, Made in USA",proton,108450571,120210495.0,,,N/A,4728288.0
OKX,"Decentralized Finance (DeFi), Ethereum Ecosystem, Morpho Ecosystem",steakhouse-usdc-morpho-vault,109798971,109798971.0,,,N/A,0.0
OKX,"Music, NFT, Ethereum Ecosystem, Coinbase Ventures Portfolio, Multicoin Capital Portfolio, Pantera Capital Portfolio, Energi Ecosystem, Binance Labs Portfolio",audius,107489527,107489527.0,,,N/A,20420331.0
OKX,"Tokenized Real Estate, Tokenized Assets, Gnosis Chain Ecosystem, RealT Tokens, Real World Assets (RWA), RWA Protocol",realtoken-ecosystem-governance,107481716,750572493.0,,,N/A,1713.38
OKX,"Decentralized Exchange (DEX), Decentralized Finance (DeFi), BNB Chain Ecosystem, Wallets, XRP Ledger Ecosystem",solo-coin,106047572,106047572.0,,,N/A,5166339.0
OKX,"Lending/Borrowing Protocols, Ethereum Ecosystem, Paradigm Portfolio, Coinbase Ventures Portfolio",euler,106162690,154440415.0,,,N/A,5919342.0
OKX,"Smart Contract Platform, Decentralized Finance (DeFi), Binance Launchpool, Derivatives, Perpetuals, Ethereum Ecosystem, Layer 2 (L2), DragonFly Capital Portfolio, Pantera Capital Portfolio",aevo-exchange,106040989,117410291.0,70197.01395825935,171063.5962723927,0.09,20170506.0
OKX,"Gaming (GameFi), NFT, Metaverse, Play To Earn, Ethereum Ecosystem, Animoca Brands Portfolio, RPG, Gaming Governance Token, Adventure Games, Energi Ecosystem, Delphi Ventures Portfolio",illuvium,105261155,135668574.0,3829.452878578688,9842.195954558336,0.14,21893081.0
OKX,"Solana Ecosystem, Multicoin Capital Portfolio, Stablecoin Protocol, Alameda Research Portfolio, DeFiance Capital Portfolio",uxd-protocol-token,105735061,105735061.0,,,N/A,34.69
OKX,"Smart Contract Platform, Ethereum Ecosystem, Metis Ecosystem, Layer 2 (L2), DWF Labs Portfolio, Rollup, GMCI Layer 2 Index, OKX Ventures Portfolio, GMCI Index",metis-token,104674920,167337051.0,28180.178865865157,50444.07699366608,0.12,7230047.0
OKX,"Stablecoins, BNB Chain Ecosystem",astherus-usdf,104861705,104883464.0,,,N/A,721678.0
OKX,"Solana Ecosystem, Meme, Solana Meme, PolitiFi, Made in USA",melania-meme,104308314,695388184.0,,,N/A,25009256.0
OKX,"Decentralized Finance (DeFi), BNB Chain Ecosystem, Real World Assets (RWA), DWF Labs Portfolio, Stellar Ecosystem",velo,105039099,341105270.0,32429.1028875739,61722.61169740444,0.07,26664234.0
OKX,"Polygon Ecosystem, Arbitrum Ecosystem, Ethereum Ecosystem, Optimism Ecosystem, Bridge Governance Tokens, Cross-chain Communication, Intent, Boba Network Ecosystem, Blockchain Capital Portfolio, Made in USA",across-protocol,103163097,255386412.0,,,N/A,28201213.0
OKX,"NFT, Meme, Arbitrum Ecosystem, Ethereum Ecosystem, Anime-Themed, Binance HODLer Airdrops, Airdropped Tokens by NFT Projects",anime,103468297,186812931.0,140082.74358310946,145455.14001587723,0.11,17686908.0
OKX,"NFT, Binance Launchpool, Meme, Ethereum Ecosystem, Binance Labs Portfolio, GMCI Meme Index, GMCI Index",memecoin-2,101679257,171388797.0,75593.58066627926,101549.16320109968,0.08,19398468.0
OKX,"Artificial Intelligence (AI), Smart Contract Platform, Masternodes, DePIN, Proof of Work (PoW), Made in USA",zelcash,101653876,101680263.0,,,N/A,9407161.0
OKX,"Artificial Intelligence (AI), Base Ecosystem, AI Agents, AI Applications, Made in USA",venice-token,102373794,244034986.0,,,N/A,9514679.0
OKX,"NFT, BNB Chain Ecosystem, Ethereum Ecosystem, Binance Launchpad, DWF Labs Portfolio, Binance Labs Portfolio",space-id,100852632,467738064.0,50158.22839027625,58960.25835840155,0.04,25754550.0
OKX,"Business Services, Decentralized Finance (DeFi), Oracle, Derivatives, Synthetic Issuer, Avalanche Ecosystem, Ethereum Ecosystem, Blockchain Capital Portfolio, Synthetic, Made in USA",uma,101093313,145881415.0,18290.635481923386,19592.207325053765,0.08,12609427.0
OKX,"Big Data, Infrastructure, Storage, Cardano Ecosystem, DePIN",iagon,101000758,268604439.0,,,N/A,549472.0
OKX,"Solana Ecosystem, Meme, Base Ecosystem, AI Meme, AI Agents, Virtuals Protocol Ecosystem, Binance Alpha Spotlight, DeFAI",aixbt,99479866,116267398.0,103752.29881431193,123788.31758953136,0.09,68117035.0
OKX,"Stablecoins, LP Tokens, Ethereum Ecosystem",resolv-rlp,100048432,100048432.0,,,N/A,670804.0
OKX,"Bridged USDT, QL1 Ecosystem, Bridged-Tokens, Bridged Stablecoins",qusdt,99950079,99950079.0,,,N/A,27270.0
OKX,"Decentralized Exchange (DEX), Decentralized Finance (DeFi), Automated Market Maker (AMM), Ethereum Ecosystem, Cronos Ecosystem",vvs-finance,100037610,195582329.0,,,N/A,256024.0
OKX,"Solana Ecosystem, Meme, Frog-Themed, Solana Meme, GMCI Meme Index, GMCI Index",book-of-meme,97777281,97777281.0,59342.936147105815,101907.1271194395,0.07,49818195.0
OKX,"Smart Contract Platform, Polkadot Ecosystem, Binance Launchpool, Layer 2 (L2), Manta Network Ecosystem, Multicoin Capital Portfolio, Alameda Research Portfolio, DeFiance Capital Portfolio, Binance Labs Portfolio",manta-network,98295246,258474417.0,,,N/A,33600317.0
OKX,"Crypto-Backed Tokens, Decentralized Finance (DeFi), Compound Tokens, cToken, Ethereum Ecosystem",compound-ether,98020351,98020351.0,,,N/A,59.03
OKX,"Solana Ecosystem, Liquid Staking Tokens, Liquid Staked SOL, Liquid Staking",drift-staked-sol,98580653,98580653.0,,,N/A,26886.0
OKX,"Smart Contract Platform, Ethereum Ecosystem, Layer 2 (L2), Optimism Superchain Ecosystem, Outlier Ventures Portfolio, Lisk Ecosystem",lisk,97475613,226240590.0,15708.750303836205,17504.374150515432,0.09,13174739.0
OKX,"Decentralized Finance (DeFi), Yield Farming, Avalanche Ecosystem, Fantom Ecosystem, Arbitrum Ecosystem, Olympus Pro Ecosystem, Ethereum Ecosystem, Stablecoin Protocol",spell-token,96897144,119770307.0,,,N/A,15185216.0
OKX,"Infrastructure, Smart Contract Platform, Oracle, Layer 1 (L1), Animoca Brands Portfolio, Coinbase Ventures Portfolio, Cross-chain Communication, Made in USA",supra,98081231,872085678.0,,,N/A,15712018.0
OKX,"Artificial Intelligence (AI), Infrastructure, Smart Contract Platform, Oracle, Polkadot Ecosystem, Ethereum Ecosystem, Interoperability, Layer 2 (L2), Zero Knowledge (ZK), DePIN, DWF Labs Portfolio, Rollup, AI Agents, Sora Ecosystem, AI Framework, Made in USA",pha,96563528,123103943.0,34627.99562389609,39194.008781686505,0.24,25100850.0
OKX,"Software as a service, Ethereum Ecosystem, Energi Ecosystem",status,96607324,165989897.0,56882.190895985004,64877.70275029133,0.16,8309428.0
OKX,"Smart Contract Platform, BNB Chain Ecosystem, Binance Launchpool, Ethereum Ecosystem, Layer 2 (L2), Restaking, Rollups-as-a-Service (RaaS), Rollup, Binance Labs Portfolio",altlayer,95881735,343414247.0,,,N/A,16361297.0
OKX,"Gaming (GameFi), NFT, BNB Chain Ecosystem",infinitar-governance-token,94466964,467845833.0,,,N/A,8065598.0
OKX,"Infrastructure, Smart Contract Platform, Ethereum Ecosystem, Data Availability, Modular Blockchain",avail,95502044,489127368.0,,,N/A,6148007.0
OKX,"DaoMaker Launchpad, Ethereum Ecosystem, Real World Assets (RWA), Sequoia Capital Portfolio, Made in USA",clearpool,94807107,124755065.0,,,N/A,4594631.0
OKX,"XDC Ecosystem, Telos Ecosystem",ecoin-2,95498064,207099463.0,,,N/A,5.24
OKX,"Infrastructure, Solana Ecosystem, Animoca Brands Portfolio, Cross-chain Communication, OKX Ventures Portfolio",zeus-network,99072020,258822892.0,39640.60787053901,51528.82604406766,0.19,12232566.0
OKX,"Solana Ecosystem, Payment Solutions, Viction Ecosystem",saros-finance,94328160,359345396.0,,,N/A,817480.0
OKX,"Gaming (GameFi), NFT, Kaia Ecosystem, Gaming Blockchains",bora,95091523,99463547.0,7423.725687004277,10646.878609864792,0.16,231101.0
OKX,"Smart Contract Platform, Layer 1 (L1), Zero Knowledge (ZK), Andreessen Horowitz (a16z) Portfolio, Privacy Blockchain, Made in USA",aleo,94595809,463502661.0,,,N/A,6853377.0
OKX,"Fraxtal Ecosystem, Bridged-Tokens",l2-standard-bridged-frxusd,94641984,94641984.0,,,N/A,948919.0
OKX,"Smart Contract Platform, Privacy, Layer 1 (L1), Proof of Stake (PoS), Proof of Work (PoW), Zano Ecosystem, Privacy Blockchain",zano,93937399,93941836.0,,,N/A,615489.0
OKX,"NFT, Polygon Ecosystem, Ethereum Ecosystem, Optimism Ecosystem",blockv,95249477,95249477.0,,,N/A,152409.0
OKX,"Solana Ecosystem, Liquid Staking Tokens, Restaking, Liquid Restaking Tokens, Liquid Staked SOL, Liquid Staking, Liquid Restaked SOL",solayer-staked-sol,94182941,94182941.0,,,N/A,569806.0
OKX,Layer 1 (L1),oec-token,92949243,92949243.0,5890.17831461549,8974.493357912266,0.21,320892.0
OKX,"Artificial Intelligence (AI), Big Data, Media, BNB Chain Ecosystem, Polygon Ecosystem, Ethereum Ecosystem, GMCI DePIN Index, Galaxy Digital Portfolio, GMCI Index",everipedia,92462170,92462170.0,2296.637769211792,6638.029747479887,0.05,5405450.0
OKX,"Energy, Ethereum Ecosystem, Alleged SEC Securities, Energi Ecosystem, GMCI DePIN Index, Blockchain Capital Portfolio, GMCI Index",power-ledger,92186348,173928745.0,,,N/A,9150305.0
OKX,"Decentralized Exchange (DEX), Exchange-based Tokens, Decentralized Finance (DeFi), Yield Farming, Automated Market Maker (AMM), Avalanche Ecosystem, Polygon Ecosystem, Near Protocol Ecosystem, Gnosis Chain Ecosystem, Harmony Ecosystem, Arbitrum Ecosystem, Ethereum Ecosystem, Optimism Ecosystem, Base Ecosystem, Index Coop Defi Index, Alameda Research Portfolio, DeFiance Capital Portfolio, Pantera Capital Portfolio, Energi Ecosystem, Polygon zkEVM Ecosystem, Huobi ECO Chain Ecosystem, Blockchain Capital Portfolio, Index Coop Index",balancer,90432567,97791725.0,56626.42332495426,54820.02550808588,0.21,10259795.0
OKX,"Smart Contract Platform, Gaming (GameFi), Solana Ecosystem, Layer 2 (L2), Gaming Blockchains",sonic-svm,89261423,595076151.0,147602.6437878254,164150.86208208537,0.04,39354415.0
OKX,"Decentralized Finance (DeFi), BNB Chain Ecosystem, Arbitrum Ecosystem, Ethereum Ecosystem, Multicoin Capital Portfolio, Energi Ecosystem",dforce-token,81099857,81099857.0,,,N/A,11107016.0
OKX,"Crypto-Backed Tokens, BNB Chain Ecosystem, Arbitrum Ecosystem, Ethereum Ecosystem, Mantle Ecosystem",ignition-fbtc,90562133,1171707446.0,,,N/A,619511.0
OKX,"Decentralized Finance (DeFi), Yield Farming, BNB Chain Ecosystem, Binance Launchpool, Lending/Borrowing Protocols, Arbitrum Ecosystem, Ethereum Ecosystem, Optimism Ecosystem, ZkSync Ecosystem, opBNB Ecosystem, Unichain Ecosystem",venus,89524385,160606065.0,,,N/A,4771568.0
OKX,"Ethereum Ecosystem, DWF Labs Portfolio",adventure-gold,89607554,89607554.0,24521.33321205793,81215.76240735406,0.01,25082664.0
OKX,"Artificial Intelligence (AI), Oracle, Ethereum Ecosystem, DePIN, Energi Ecosystem, Sora Ecosystem, GMCI DePIN Index, GMCI Index",iexec-rlc,89028507,107007299.0,,,N/A,13877295.0
OKX,"Artificial Intelligence (AI), Infrastructure, Smart Contract Platform, Decentralized Finance (DeFi), Arbitrum Ecosystem, Ethereum Ecosystem, Zero Knowledge (ZK), DWF Labs Portfolio, Coinbase Ventures Portfolio, Pantera Capital Portfolio, Binance Labs Portfolio",marlin,89846050,110195567.0,,,N/A,8894856.0
OKX,"Gaming (GameFi), XDC Ecosystem, Gaming Utility Token",gama-coin,90019736,138491978.0,,,N/A,2289559.0
OKX,"Smart Contract Platform, Ethereum Ecosystem, Layer 2 (L2), Zero Knowledge (ZK), Restaking, Zircuit Ecosystem",zircuit,89633988,408369538.0,,,N/A,31880169.0
OKX,"Infrastructure, Smart Contract Platform, Decentralized Finance (DeFi), BNB Chain Ecosystem, Avalanche Ecosystem, Polygon Ecosystem, Fantom Ecosystem, Harmony Ecosystem, Arbitrum Ecosystem, Ethereum Ecosystem, DWF Labs Portfolio, Layer 3 (L3), Outlier Ventures Portfolio",orbs,88385137,194102158.0,12287.18347167434,14860.181759811745,0.1,7393784.0
OKX,"Cronos Ecosystem, Bridged USDT, Bridged-Tokens, Bridged Stablecoins",cronos-bridged-usdt-cronos,87801257,87801257.0,,,N/A,325703.0
OKX,"NFT, Ethereum Ecosystem",superrare,90113392,112589536.0,,,N/A,297817822.0
OKX,"Artificial Intelligence (AI), Smart Contract Platform, Gaming (GameFi), NFT, BNB Chain Ecosystem, Layer 1 (L1), Ethereum Ecosystem, Modular Blockchain, Chromia Ecosystem",chromaway,87158404,87158404.0,,,N/A,11642572.0
OKX,"Smart Contract Platform, Layer 1 (L1)",ong,87033124,213346252.0,,,N/A,2716535.0
OKX,"Smart Contract Platform, Bitcoin Sidechains, Stacks Ecosystem, SideChain",sbtc-2,86430209,86430209.0,,,N/A,37194.0
