OKX,"Decentralized Exchange (DEX), Decentralized Finance (DeFi), Arbitrum Ecosystem, Ethereum Ecosystem",tokenlon,86477645,104090217.0,,,N/A,48602.0
OKX,"Stablecoins, USD Stablecoin, Ethereum Ecosystem, Sonic Ecosystem, Fiat-backed Stablecoin",frax-usd,86165003,86165003.0,,,N/A,2302748.0
OKX,"Business Services, Polygon Ecosystem, Ethereum Ecosystem",request-network,85336958,110875487.0,,,N/A,6109051.0
OKX,"SocialFi, Coinbase Ventures Portfolio, Pantera Capital Portfolio, Andreessen Horowitz (a16z) Portfolio, Sequoia Capital Portfolio",deso,84454908,86669982.0,,,N/A,6380907.0
OKX,"Crypto-Backed Tokens, Ethereum Ecosystem",temple,86060829,86230373.0,,,N/A,10489.24
OKX,"NFT, Solana Ecosystem, NFT Marketplace",tensor,84710571,253164191.0,52496.359938487345,171082.28167883574,0.08,14574197.0
OKX,"Smart Contract Platform, Polkadot Ecosystem, Layer 1 (L1), Coinbase Ventures Portfolio, Binance Labs Portfolio",moonbeam,84426374,102812020.0,10373.968862160154,26647.300317048175,0.11,5832554.0
OKX,"Polygon Ecosystem, XRP Ledger Ecosystem",crypto-trading-fund,84982212,84982212.0,,,N/A,12071.0
OKX,"Smart Contract Platform, Gaming (GameFi), NFT, Layer 1 (L1), Play To Earn, Ethereum Ecosystem, Animoca Brands Portfolio, Gaming Blockchains, Pantera Capital Portfolio, OKX Ventures Portfolio",wax,83812136,90179281.0,6027.140529153237,20492.36424790229,0.08,6115304.0
OKX,BNB Chain Ecosystem,metfi-2,85018161,199030429.0,,,N/A,420086.0
OKX,"Gaming (GameFi), Play To Earn, Ethereum Ecosystem, RPG, Alameda Research Portfolio, Circle Ventures Portfolio, OKX Ventures Portfolio, MMO",big-time,83453052,235078021.0,132587.9547494063,194456.48123154754,0.06,33035462.0
OKX,"BNB Chain Ecosystem, Liquid Staking Tokens",astherus-staked-bnb,98202953,98202953.0,,,N/A,197.2
OKX,"Smart Contract Platform, Layer 2 (L2), eGirl Capital Portfolio, Paradigm Portfolio, Blast Ecosystem",blast,83490865,315402044.0,,,N/A,10248837.0
OKX,"Exchange-based Tokens, Centralized Exchange (CEX) Token, Ethereum Ecosystem",hashkey-ecopoints,82875974,625479046.0,,,N/A,4538937.0
OKX,"Solana Ecosystem, Polygon Ecosystem, DePIN, Pantera Capital Portfolio",geodnet,83447046,260285426.0,,,N/A,251669.0
OKX,"Gaming (GameFi), NFT, BNB Chain Ecosystem, Metaverse, Collectibles, Polygon Ecosystem, Play To Earn, Harmony Ecosystem, Guild and Scholarship, Ethereum Ecosystem, Animoca Brands Portfolio, Base Ecosystem, DWF Labs Portfolio, Ronin Ecosystem, Gaming Governance Token, Andreessen Horowitz (a16z) Portfolio, Delphi Ventures Portfolio",yield-guild-games,82641067,201311473.0,36754.02481012104,74280.26367520304,0.05,15525823.0
OKX,"NFT, Polygon Ecosystem",sathosi-airlines-token,82486816,393946855.0,,,N/A,15600.31
OKX,"Artificial Intelligence (AI), BNB Chain Ecosystem, Solana Ecosystem, Ethereum Ecosystem, AI Agents, Alameda Research Portfolio",delysium,82826844,158097581.0,,,N/A,3226243.0
OKX,Ethereum Ecosystem,dkargo,82303083,87805565.0,,,N/A,1228993.0
OKX,"Decentralized Exchange (DEX), Decentralized Finance (DeFi), Yield Farming, Automated Market Maker (AMM), Solana Ecosystem, Coinbase Ventures Portfolio, DeFiance Capital Portfolio, Made in USA",orca,81714791,153378501.0,,,N/A,25344536.0
OKX,"Artificial Intelligence (AI), Virtual Reality, Launchpad, Ethereum Ecosystem, Telegram Apps, Discord Bots, PAAL AI Launchpad, AI Agents, AI Applications, AI Agent Launchpad, Binance Alpha Spotlight, AI Framework, DeFAI, Made in USA",paal-ai,82222053,92486935.0,,,N/A,14134787.0
OKX,"Berachain Ecosystem, Bridged USDT, Bridged-Tokens, Ink Ecosystem, Bridged Stablecoins",usdt0,80835371,80835371.0,,,N/A,242756.0
OKX,"Meme, Ethereum Ecosystem, PolitiFi",constitutiondao,80148732,80148732.0,92188.65309372832,192173.36349394475,0.06,33795051.0
OKX,"Internet of Things (IOT), BNB Chain Ecosystem, Ethereum Ecosystem, DePIN, DWF Labs Portfolio",mass-vehicle-ledger,81220455,85852279.0,,,N/A,429774.0
OKX,"Gaming (GameFi), Play To Earn, Guild and Scholarship, Ethereum Ecosystem, Animoca Brands Portfolio, Base Ecosystem, DWF Labs Portfolio, Ronin Ecosystem, Coinbase Ventures Portfolio, DeFiance Capital Portfolio, Pantera Capital Portfolio, Binance Labs Portfolio, MMO",zentry,79877707,117264208.0,43100.71899746614,50108.33700513299,0.25,6734039.0
OKX,"Exchange-based Tokens, Centralized Exchange (CEX) Token, Near Protocol Ecosystem, Harmony Ecosystem, Ethereum Ecosystem, Multicoin Capital Portfolio, Alameda Research Portfolio, Elastos Smart Contract Chain Ecosystem, Sequoia Capital Portfolio, Made in China",huobi-token,79757387,100593547.0,,,N/A,11500.97
OKX,"Smart Contract Platform, Privacy, Proof of Work (PoW), Made in USA",verge,79316923,79475581.0,,,N/A,6017999.0
OKX,"Blast Ecosystem, Bridged WETH, Bridged-Tokens",l2-standard-bridged-weth-blast,79934278,79942119.0,,,N/A,213932.0
OKX,"Stablecoins, Decentralized Finance (DeFi), Lending/Borrowing Protocols, Ethereum Ecosystem",syrupusdc,79637346,79637346.0,,,N/A,5004.64
OKX,"Stablecoins, USD Stablecoin, Solana Ecosystem, Ethereum Ecosystem, Multicoin Capital Portfolio, Fiat-backed Stablecoin",paxos-standard,79295950,79295950.0,,,N/A,2514315.0
OKX,"Arbitrum Ecosystem, Bridge Governance Tokens, Base Ecosystem, Cross-chain Communication, OKX Ventures Portfolio",orbiter-finance,78133299,252042899.0,,,N/A,97889850.0
OKX,"Decentralized Finance (DeFi), Lending/Borrowing Protocols, Moonbeam Ecosystem, Base Ecosystem, Coinbase Ventures Portfolio, Made in USA",moonwell-artemis,79858202,121767203.0,,,N/A,31648484.0
OKX,"Smart Contract Platform, Proof of Stake (PoS)",stratis,79439515,87528729.0,,,N/A,1733944.0
OKX,"Smart Contract Platform, Cosmos Ecosystem, Modular Blockchain, Osmosis Ecosystem, Rollups-as-a-Service (RaaS)",dymension,78566276,312544282.0,,,N/A,8665333.0
OKX,"Artificial Intelligence (AI), Smart Contract Platform, Decentralized Finance (DeFi), Analytics, NFT, BNB Chain Ecosystem, Launchpad, Ethereum Ecosystem, Telegram Apps, Discord Bots, ChainGPT Launchpad, Poolz Finance Launchpad, AI Agents, AI Applications, Binance Alpha Spotlight, AI Framework, DeFAI",chaingpt,78788247,97819708.0,,,N/A,26544004.0
OKX,BNB Chain Ecosystem,bitdca,78624881,84449381.0,,,N/A,86789.0
OKX,"Software as a service, Polygon Ecosystem, Ethereum Ecosystem, Decentralized Identifier (DID), Pantera Capital Portfolio, Energi Ecosystem, Blockchain Capital Portfolio",civic,78111706,97396141.0,14597.421360770546,40244.825068908256,0.05,8879108.0
OKX,"Artificial Intelligence (AI), Infrastructure, Ethereum Ecosystem, AI Framework, Made in USA",arcblock,79008924,149073441.0,,,N/A,489653.0
OKX,"Ethereum Ecosystem, Stablecoin Protocol",level-usd,77454326,77454327.0,,,N/A,896617.0
OKX,"Decentralized Finance (DeFi), Wallets, Ethereum Ecosystem, Pundi AIFX Omnilayer Ecosystem",pundi-x-2,77325920,77325920.0,,,N/A,8806337.0
OKX,"Stablecoins, USD Stablecoin, BNB Chain Ecosystem, Fantom Ecosystem, Arbitrum Ecosystem, Ethereum Ecosystem, Optimism Ecosystem, Base Ecosystem, Crypto-backed Stablecoin, Fiat-backed Stablecoin",dola-usd,49071380,184972042.0,,,N/A,3938346.0
OKX,"Optimism Ecosystem, Bridged WBTC, Bridged-Tokens",optimism-bridged-wbtc-optimism,77213027,77213027.0,,,N/A,1551847.0
OKX,"Stablecoins, USD Stablecoin, Osmosis Ecosystem, Fiat-backed Stablecoin",usdx,77514006,77514006.0,,,N/A,25362.0
OKX,"Exchange-based Tokens, Centralized Exchange (CEX) Token, Ethereum Ecosystem",bitmart-token,77941616,146832766.0,,,N/A,4352573.0
OKX,"Smart Contract Platform, Layer 1 (L1), Osmosis Ecosystem, XRP Ledger Ecosystem",coreum,76558602,76558602.0,,,N/A,359043.0
OKX,"Decentralized Finance (DeFi), Liquid Staking Tokens, Ethereum Ecosystem, LSDFi, Liquid Staked ETH, Liquid Staking",origin-ether,75870246,75870246.0,,,N/A,62557.0
OKX,"Business Services, Decentralized Finance (DeFi), Oracle, Polygon Ecosystem, Gnosis Chain Ecosystem, Arbitrum Ecosystem, Ethereum Ecosystem, Optimism Ecosystem, Manta Network Ecosystem, Binance Labs Portfolio, Lisk Ecosystem, Made in USA",tellor,76119644,78334640.0,42107.047429403734,70053.83115222935,0.03,25543130.0
OKX,"Sports, BNB Chain Ecosystem",pixer-eternity,75524041,350967386.0,,,N/A,367953.0
OKX,"Smart Contract Platform, Wallets, Layer 2 (L2), Osmosis Ecosystem",islamic-coin,74818068,903770675.0,,,N/A,873963.0
OKX,"Smart Contract Platform, Polkadot Ecosystem, Layer 1 (L1), DePIN, Outlier Ventures Portfolio",peaq-2,71111132,419504062.0,,,N/A,13385798.0
OKX,"Artificial Intelligence (AI), BNB Chain Ecosystem, Ethereum Ecosystem, DragonFly Capital Portfolio, Binance Labs Portfolio, Delphi Ventures Portfolio, OKX Ventures Portfolio, Binance HODLer Airdrops, AI Agent Launchpad, Binance Alpha Spotlight, AI Framework",myshell,72926408,270097809.0,,,N/A,44007802.0
OKX,"BNB Chain Ecosystem, Solana Ecosystem, Polygon Ecosystem, Meme, Ethereum Ecosystem, Cronos Ecosystem, Dog-Themed, Elon Musk-Inspired, Fuse Ecosystem",dogelon-mars,75271205,136943890.0,12790.224022254704,11237.590417653024,0.22,7229401.0
OKX,"Optimism Ecosystem, Bridged WETH, Bridged-Tokens",l2-standard-bridged-weth-optimism,74254745,74289032.0,,,N/A,6966280.0
OKX,Smart Contract Platform,songbird,74628383,88675282.0,,,N/A,394417.0
OKX,Retail,milk-alliance,74365393,166611895.0,,,N/A,5949867.0
OKX,"Entertainment, Gaming (GameFi), NFT, Axie Infinity Ecosystem, Play To Earn, Ethereum Ecosystem, Ronin Ecosystem, Gaming Utility Token",smooth-love-potion,74753038,74752883.0,10590.783472717238,22587.46974550458,0.11,9089882.0
OKX,"Smart Contract Platform, Gaming (GameFi), Layer 1 (L1), Proof of Stake (PoS), Gaming Blockchains",oasys,73741233,191107222.0,2538.7748634381323,3355.870000220205,0.21,582780.0
OKX,"Meme, Ethereum Ecosystem, Mantle Ecosystem",puff-the-dragon,73228856,73228856.0,,,N/A,59927.0
OKX,"Gaming (GameFi), Play To Earn, TON Ecosystem, Tap to Earn, Arcade Games",watcoin-2,73388681,81474657.0,,,N/A,937683.0
OKX,"Decentralized Exchange (DEX), Decentralized Finance (DeFi), Yield Farming, Automated Market Maker (AMM), BNB Chain Ecosystem, Avalanche Ecosystem, Arbitrum Ecosystem, Mantle Ecosystem, DeFiance Capital Portfolio, Delphi Ventures Portfolio, Dex Aggregator",joe,72917759,93379809.0,28580.084616321292,21789.448014829635,0.16,8729260.0
OKX,"Ethereum Ecosystem, DePIN",dent,71784825,75045586.0,,,N/A,5936937.0
OKX,"Decentralized Finance (DeFi), Solana Ecosystem, Real World Assets (RWA), Payment Solutions, DePIN, Coinbase Ventures Portfolio, Alameda Research Portfolio, Circle Ventures Portfolio, OKX Ventures Portfolio, RWA Protocol, Made in USA",zebec-network,73382963,99033847.0,8132.2070302890115,7720.968337060449,0.08,39558836.0
OKX,"Artificial Intelligence (AI), Decentralized Finance (DeFi), Solana Ecosystem, Arbitrum Ecosystem, Metis Ecosystem, AI Agents, Sonic Ecosystem, IOTA EVM Ecosystem, AI Applications, DeFAI",heyanon,72655509,119668656.0,,,N/A,4335802.0
OKX,"Smart Contract Platform, Gaming (GameFi), NFT, Binance Launchpool, Arbitrum Ecosystem, Layer 3 (L3), XAI Ecosystem, Gaming Blockchains, Outlier Ventures Portfolio",xai-blockchain,71114940,104693049.0,,,N/A,29165735.0
OKX,"Decentralized Finance (DeFi), Ethereum Ecosystem",elixir-finance,71229802,446136584.0,,,N/A,46720040.0
OKX,"Decentralized Exchange (DEX), Exchange-based Tokens, Decentralized Finance (DeFi), BNB Chain Ecosystem, Binance Launchpool, Polygon Ecosystem, Near Protocol Ecosystem, Arbitrum Ecosystem, Ethereum Ecosystem, DWF Labs Portfolio, Coinbase Ventures Portfolio, Alameda Research Portfolio, DeFiance Capital Portfolio, Pantera Capital Portfolio, Aurora Ecosystem, Energi Ecosystem, Binance Labs Portfolio, Galaxy Digital Portfolio",dodo,72061601,72061601.0,,,N/A,5861383.0
OKX,"Stablecoins, Decentralized Finance (DeFi), USD Stablecoin, BNB Chain Ecosystem, Polygon Ecosystem, Gnosis Chain Ecosystem, Arbitrum Ecosystem, Ethereum Ecosystem, Optimism Ecosystem, Base Ecosystem, Crypto-backed Stablecoin, Fiat-backed Stablecoin",crvusd,70481550,70437500.0,,,N/A,8022228.0
OKX,"Decentralized Finance (DeFi), Oracle, Ethereum Ecosystem, DWF Labs Portfolio, Pantera Capital Portfolio",api3,71181174,88830999.0,25893.6289294988,21481.3499972091,0.07,14372510.0
OKX,"Gaming (GameFi), NFT, Collectibles, Play To Earn, Ethereum Ecosystem, Base Ecosystem, Energi Ecosystem",ecomi,70333582,80698827.0,5894.713292850491,7244.119526787466,0.08,2061300.0
OKX,"Artificial Intelligence (AI), Ethereum Ecosystem",0x0-ai-ai-smart-contract,70155537,70155537.0,,,N/A,182187.0
OKX,"Decentralized Finance (DeFi), Ethereum Ecosystem, Binance Alpha Spotlight",avalon-2,70786834,436282490.0,,,N/A,74555416.0
OKX,"Artificial Intelligence (AI), Cardano Ecosystem, Ethereum Ecosystem, AI Agents, Sora Ecosystem",singularitynet,70662956,106785681.0,,,N/A,46819.0
OKX,"Stablecoins, USD Stablecoin, Seigniorage, Alleged SEC Securities, Osmosis Ecosystem, Stablecoin Protocol, DeFiance Capital Portfolio, Terra Classic Ecosystem, Binance Labs Portfolio, Delphi Ventures Portfolio, Galaxy Digital Portfolio, Fiat-backed Stablecoin",terrausd,70323761,99632066.0,33350.690710733565,67733.03878633595,0.16,7184260.0
OKX,"Meme, Dog-Themed, TON Ecosystem, TON Meme",dogs-2,69575903,74052727.0,52919.937795281134,95821.82319228501,0.15,15131537.0
OKX,"Decentralized Finance (DeFi), Lending/Borrowing Protocols, Ethereum Ecosystem, Real World Assets (RWA), Coinbase Ventures Portfolio, Andreessen Horowitz (a16z) Portfolio, RWA Protocol, Made in USA",goldfinch,70521922,87231689.0,,,N/A,605132.0
OKX,"Decentralized Finance (DeFi), Lending/Borrowing Protocols, Arbitrum Ecosystem, Ethereum Ecosystem, Alameda Research Portfolio, Pantera Capital Portfolio",liquity,69900202,71830588.0,10066.290102207975,27492.26575625314,0.08,14759141.0
OKX,"Artificial Intelligence (AI), Business Services, Decentralized Finance (DeFi), Ethereum Ecosystem, Paradigm Portfolio, DragonFly Capital Portfolio, Energi Ecosystem",numeraire,69643166,93256083.0,6598.118852362289,20458.03030086238,0.11,7716007.0
OKX,"Tokenized Assets, Polygon Ecosystem, Arbitrum Ecosystem, Ethereum Ecosystem, Real World Assets (RWA), Starknet Ecosystem, Tokenized Treasury Bills (T-Bills)",spiko-us-t-bills-money-market-fund,69588146,69588146.0,,,N/A,0.0
OKX,"Lending/Borrowing Protocols, Solana Ecosystem, FTX Holdings, Coinbase Ventures Portfolio, Alameda Research Portfolio, DragonFly Capital Portfolio",solend,69360419,137087973.0,,,N/A,3167.11
OKX,"Artificial Intelligence (AI), Marketing, Analytics, BNB Chain Ecosystem, Ethereum Ecosystem, Animoca Brands Portfolio, Base Ecosystem, AI Agents, Binance Alpha Spotlight",cookie,67737564,150768509.0,,,N/A,19532562.0
OKX,"Decentralized Finance (DeFi), Lending/Borrowing Protocols, Solana Ecosystem, Binance Alpha Spotlight",kamino,68522639,507575104.0,,,N/A,7263611.0
OKX,"Stablecoins, Decentralized Finance (DeFi), USD Stablecoin, BNB Chain Ecosystem, Avalanche Ecosystem, Arbitrum Ecosystem, Liquid Staking Tokens, Ethereum Ecosystem, Optimism Ecosystem, Fiat-backed Stablecoin",staked-frax,68137532,68137532.0,,,N/A,59.87
OKX,"Decentralized Finance (DeFi), Ethereum Ecosystem, Restaking",kelp-gain,68001802,68001902.0,,,N/A,36607.0
OKX,"Smart Contract Platform, Binance Launchpool, Layer 2 (L2), Scroll Ecosystem",scroll,66973248,352490778.0,64649.57061326362,89052.05031123749,0.11,17669537.0
OKX,"Smart Contract Platform, Ethereum Ecosystem, Layer 2 (L2), Zero Knowledge (ZK), Rollup, OKX Ventures Portfolio",taiko,67510622,638425725.0,,,N/A,15223584.0
OKX,"Solana Ecosystem, Restaking, Liquid Restaking Tokens, Liquid Restaked SOL",renzo-restaked-sol,67937188,67937188.0,,,N/A,2103979.0
OKX,"Smart Contract Platform, Layer 1 (L1), DWF Labs Portfolio, Radix Ecosystem",radix,67603906,82780189.0,,,N/A,1373126.0
OKX,"NFT, BNB Chain Ecosystem, Solana Ecosystem, Meme, Ethereum Ecosystem, Base Ecosystem, Hybrid Token Standards, Wojak-Themed",non-playable-coin,67624292,67624292.0,,,N/A,5242087.0
OKX,"Solana Ecosystem, Wallets, Base Ecosystem, TON Ecosystem",bitget-wallet-token,67182897,470072637.0,,,N/A,3631.06
OKX,"Decentralized Exchange (DEX), Decentralized Finance (DeFi), Sui Ecosystem, Animoca Brands Portfolio, OKX Ventures Portfolio, Dex Aggregator",cetus-protocol,66469523,97354898.0,52552.07374336856,50867.18369470554,0.04,12318577.0
OKX,"Smart Contract Platform, Layer 1 (L1), Proof of Work (PoW), Privacy Blockchain",ergo,67324274,82195366.0,,,N/A,103447.0
OKX,"Artificial Intelligence (AI), Launchpad, Base Ecosystem, AI Applications, Clanker Ecosystem, Binance Alpha Spotlight",tokenbot-2,66473444,66473444.0,,,N/A,6723058.0
OKX,SocialFi,steem,66253509,66298866.0,,,N/A,12764145.0
OKX,Ethereum Ecosystem,saasgo,66482011,83102514.0,,,N/A,294623.0
OKX,"Ethereum Ecosystem, Telegram Apps, Binance HODLer Airdrops",banana-gun,62451406,151401463.0,22410.722710006095,25922.38325444865,0.17,76120796.0
OKX,"Artificial Intelligence (AI), Solana Ecosystem, DePIN",nosana,66172839,79343932.0,,,N/A,938119.0
OKX,"Artificial Intelligence (AI), Decentralized Finance (DeFi), Ethereum Ecosystem, DePIN",pinlink,67829650,84787063.0,,,N/A,1397020.0
OKX,E-commerce,pay-coin,65625048,121934739.0,,,N/A,3006195.0
OKX,"Smart Contract Platform, Layer 1 (L1), Ethereum Ecosystem, Proof of Stake (PoS)",pundi-aifx,65664275,65665437.0,,,N/A,453027.0
OKX,"Base Ecosystem, Cybersecurity, Binance Labs Portfolio, OKX Ventures Portfolio, Binance Alpha Spotlight",goplus-security,62960487,347195802.0,,,N/A,23413075.0
OKX,"Decentralized Finance (DeFi), BNB Chain Ecosystem, Solana Ecosystem, Wallets, Polygon Ecosystem, Ethereum Ecosystem, Binance Launchpad, DWF Labs Portfolio, Multicoin Capital Portfolio, Alameda Research Portfolio, Viction Ecosystem, Binance Labs Portfolio",coin98,65225895,72406186.0,,,N/A,24662904.0
OKX,"BNB Chain Ecosystem, Binance Megadrop, BTCfi",solv-protocol,65088268,368772057.0,,,N/A,73469145.0
OKX,"Healthcare, Osmosis Ecosystem",medibloc,64790320,70176890.0,,,N/A,336765.0
OKX,"Polkadot Ecosystem, Real World Assets (RWA), Coinbase Ventures Portfolio, Circle Ventures Portfolio, Galaxy Digital Portfolio, RWA Protocol",centrifuge,64861029,71077182.0,2928.056797099092,2626.9055036198774,0.16,994806.0
OKX,"Stablecoins, USD Stablecoin, Fiat-backed Stablecoin",falcon-finance,64446150,64446150.0,,,N/A,35484.0
OKX,"Infrastructure, Smart Contract Platform, BNB Chain Ecosystem, Avalanche Ecosystem, Polygon Ecosystem, Arbitrum Ecosystem, Ethereum Ecosystem, Optimism Ecosystem, Layer 2 (L2), Base Ecosystem, Binance Launchpad, Modular Blockchain, Layer 3 (L3), Rollup, Proof of Stake (PoS), Appchains, Binance Labs Portfolio",cartesi,64152195,74654064.0,,,N/A,8625947.0
OKX,"Artificial Intelligence (AI), BNB Chain Ecosystem, Ethereum Ecosystem, DePIN, AI Agents",netmind-token,64204877,204247184.0,,,N/A,1864447.0
OKX,"Artificial Intelligence (AI), Smart Contract Platform, Layer 1 (L1), Ethereum Ecosystem, Osmosis Ecosystem, AI Agents, AI Agent Launchpad",humans-ai,62623354,62623354.0,,,N/A,284369.0
OKX,,ark,62970721,63516037.0,,,N/A,7558455.0
OKX,"Smart Contract Platform, Layer 2 (L2), Made in USA",metal,62940407,62940407.0,,,N/A,818475.0
OKX,Ethereum Ecosystem,devve,62067596,85228468.0,,,N/A,925879.0
OKX,"Artificial Intelligence (AI), Solana Ecosystem, Polygon Ecosystem, Gnosis Chain Ecosystem, Arbitrum Ecosystem, Celo Ecosystem, Ethereum Ecosystem, Optimism Ecosystem, Base Ecosystem, AI Agents, Mode Ecosystem, AI Agent Launchpad, Binance Alpha Spotlight, AI Framework, DeFAI",autonolas,61219425,179069162.0,,,N/A,297996.0
OKX,"Exchange-based Tokens, BNB Chain Ecosystem, Centralized Exchange (CEX) Token, Polygon Ecosystem, Ethereum Ecosystem",bit2me,61115679,61733009.0,,,N/A,111361.0
OKX,"SocialFi, Solana Ecosystem",access-protocol,61459685,133432603.0,,,N/A,1099407.0
OKX,"Infrastructure, Smart Contract Platform",ardor,60900553,60900553.0,,,N/A,5539509.0
OKX,"Artificial Intelligence (AI), Infrastructure, Solana Ecosystem, Meme, AI Agents, Pump.fun Ecosystem, AI Agent Launchpad, Binance Alpha Spotlight, AI Framework",ai-rig-complex,57259650,57259650.0,,,N/A,20036909.0
OKX,"Stablecoins, USD Stablecoin, Ethereum Ecosystem, Fiat-backed Stablecoin",binance-usd,60718823,60718823.0,,,N/A,31614.0
OKX,"Artificial Intelligence (AI), Infrastructure, Gaming (GameFi), NFT, Solana Ecosystem, Arbitrum Ecosystem, Impossible Finance Launchpad, Ethereum Ecosystem, Animoca Brands Portfolio, Base Ecosystem",carv,60356631,301647164.0,,,N/A,8892592.0
