OKX,"Smart Contract Platform, Layer 1 (L1), Layer 0 (L0), Made in USA, Directed Acyclic Graph (DAG)",constellation-labs,154236632,154236743.0,,,N/A,2477372.0
OKX,"Smart Contract Platform, EthereumPoW Ecosystem, Proof of Work (PoW)",ethereum-pow-iou,154128920,154128920.0,32895.93354447733,36939.81341084093,0.07,4366754.0
OKX,"BNB Chain Ecosystem, Binance Alpha Spotlight",bnb48-club-token,153686049,153686049.0,,,N/A,271712.0
OKX,"Artificial Intelligence (AI), Meme, Base Ecosystem, AI Agents, Binance Alpha Spotlight, AI Framework",freysa-ai,153827525,153827525.0,,,N/A,628477.0
OKX,"Gaming (GameFi), NFT, Solana Ecosystem, Animoca Brands Portfolio, FTX Holdings, Multicoin Capital Portfolio, Alameda Research Portfolio",metaplex,152416820,195309710.0,,,N/A,6789448.0
OKX,"Stablecoins, Ethereum Ecosystem, Crypto-backed Stablecoin",elixir-staked-deusd,152495845,152495845.0,,,N/A,746577.0
OKX,"Internet of Things (IOT), Oracle, NFT, Metaverse, Ethereum Ecosystem, DePIN, Alleged SEC Securities, Made in USA",xyo-network,152314403,152314403.0,,,N/A,7518067.0
OKX,Smart Contract Platform,bitkub-coin,152151410,188369782.0,,,N/A,418295.0
OKX,"Payment Solutions, Made in USA, Directed Acyclic Graph (DAG)",nano,150556381,150556381.0,813.0586840982874,2262.9889107321424,0.17,3977487.0
OKX,BNB Chain Ecosystem,acet-token,149883868,195544467.0,,,N/A,830255.0
OKX,"Exchange-based Tokens, Decentralized Finance (DeFi), Ethereum Ecosystem, Real World Assets (RWA), Alleged SEC Securities",lcx,149729154,151162890.0,,,N/A,2444504.0
OKX,"BNB Chain Ecosystem, Binance-Peg Tokens",binance-peg-sol,147870166,147870166.0,,,N/A,3447187.0
OKX,"Smart Contract Platform, Layer 1 (L1), Real World Assets (RWA), RWA Protocol",polymesh,148587600,148587600.0,,,N/A,2197084.0
OKX,"Solana Ecosystem, Meme, Solana Meme, Murad Picks",gigachad-2,148384773,148384773.0,,,N/A,15182126.0
OKX,"NFT, Solana Ecosystem, NFT Marketplace, Paradigm Portfolio, Sequoia Capital Portfolio",magic-eden,147440919,1105456765.0,539119.9411836206,589371.1405471354,0.09,12654586.0
OKX,"Smart Contract Platform, Crypto-Backed Tokens, Wrapped-Tokens, Layer 2 (L2), Mantle Ecosystem",wrapped-ether-mantle-bridge,146199657,146199657.0,,,N/A,4298573.0
OKX,"Smart Contract Platform, Masternodes, Zero Knowledge (ZK), Proof of Work (PoW), Made in USA",zencash,146469835,146481310.0,,,N/A,13770705.0
OKX,"Crypto-Backed Tokens, BNB Chain Ecosystem, Wrapped-Tokens, Ethereum Ecosystem",wrapped-beacon-eth,146143093,146143093.0,,,N/A,4769486.0
OKX,"Internet of Things (IOT), Smart Contract Platform, Layer 1 (L1), Proof of Work (PoW), Made in USA",digibyte,145936991,145966704.0,15363.454059349704,24046.57465635014,0.1,3422430.0
OKX,"Binance Launchpool, Solana Ecosystem, Ethereum Ecosystem, Decentralized Science (DeSci)",bio-protocol,145505001,298035302.0,138972.25881915604,185587.0234485974,0.11,14067698.0
OKX,"Smart Contract Platform, DWF Labs Portfolio, Proof of Stake (PoS)",waves,143758959,143758959.0,,,N/A,8530459.0
OKX,"Smart Contract Platform, Layer 1 (L1), Kadena Ecosystem, Multicoin Capital Portfolio, Proof of Work (PoW), Made in USA",kadena,141935005,142085003.0,10557.255334992453,23332.42434292843,0.07,4790524.0
OKX,"Stablecoins, Ethereum Ecosystem, XRP Ledger Ecosystem, Fiat-backed Stablecoin, Made in USA",ripple-usd,141610995,141610995.0,,,N/A,26880288.0
OKX,"Alleged SEC Securities, Osmosis Ecosystem, DeFiance Capital Portfolio, Pantera Capital Portfolio, Binance Labs Portfolio, Delphi Ventures Portfolio, Galaxy Digital Portfolio, OKX Ventures Portfolio",terra-luna-2,140985607,221120217.0,60061.44726461127,93050.81837002,0.1,14506096.0
OKX,"Stablecoins, EUR Stablecoin, Solana Ecosystem, Avalanche Ecosystem, Ethereum Ecosystem, Base Ecosystem, Stellar Ecosystem",euro-coin,139576216,139576216.0,265647.94055242965,264280.5035713836,0.11,31804070.0
OKX,"Gaming (GameFi), Polkadot Ecosystem, NFT, Ethereum Ecosystem, Gaming Blockchains, Andreessen Horowitz (a16z) Portfolio, Binance Labs Portfolio, Galaxy Digital Portfolio, Made in USA",mythos,139106460,179088556.0,,,N/A,2416196.0
OKX,"Smart Contract Platform, Layer 1 (L1), Harmony Ecosystem, Animoca Brands Portfolio, Binance Launchpad, Binance Labs Portfolio, Made in USA",harmony,139211009,148834040.0,14262.765346938182,34726.30755545422,0.09,8662581.0
OKX,"Gaming (GameFi), Play To Earn, Telegram Apps, TON Ecosystem, Tap to Earn, Arcade Games",hamster-kombat,140328676,217986292.0,18406.980164887827,64480.80757683688,0.05,21372459.0
OKX,"Tokenized Assets, Tokenized Gold, Real World Assets (RWA), Tokenized Commodities",kinesis-gold,138731856,138731856.0,,,N/A,112150268.0
OKX,"Gaming (GameFi), NFT, BNB Chain Ecosystem, Solana Ecosystem, Polygon Ecosystem, Play To Earn, Move To Earn, Ethereum Ecosystem, Binance Launchpad, Gaming Governance Token, Sports Games, Alameda Research Portfolio, Binance Labs Portfolio, Sequoia Capital Portfolio",stepn,137671049,257466792.0,56166.860415841904,91539.9703138846,0.04,19096357.0
OKX,"BNB Chain Ecosystem, Arbitrum Ecosystem, Cardano Ecosystem, Ethereum Ecosystem, DePIN, Base Ecosystem, DWF Labs Portfolio",world-mobile-token,137058722,396022371.0,,,N/A,14646672.0
OKX,"Decentralized Finance (DeFi), Analytics, DeFi Index, Base Ecosystem",mag7-ssi,136426400,136426400.0,,,N/A,1406454.0
OKX,"Smart Contract Platform, SocialFi, NFT, BNB Chain Ecosystem, Binance Launchpool, Ethereum Ecosystem, Decentralized Identifier (DID), Zero Knowledge (ZK), DWF Labs Portfolio, Coinbase Ventures Portfolio, Multicoin Capital Portfolio, Alameda Research Portfolio, DragonFly Capital Portfolio, Binance Labs Portfolio, Quest-to-Earn",project-galaxy,137011991,214501305.0,,,N/A,261855.0
OKX,"Crypto-Backed Tokens, Wrapped-Tokens, Avalanche Ecosystem",wrapped-avax,135949130,135949130.0,,,N/A,35884006.0
OKX,"Stablecoins, EUR Stablecoin, Polygon Ecosystem, Ethereum Ecosystem, Real World Assets (RWA), Fiat-backed Stablecoin",stasis-eurs,134794020,134794020.0,,,N/A,73860.0
OKX,"Liquid Staking Tokens, Aptos Ecosystem, Liquid Staking",amnis-aptos,133351669,133379919.0,,,N/A,97003.0
OKX,"Smart Contract Platform, Masternodes, Proof of Stake (PoS), Made in China",ontology,133657673,146442409.0,21150.79446432498,20417.20361727022,0.14,4435121.0
OKX,"Decentralized Exchange (DEX), Smart Contract Platform, Exchange-based Tokens, Decentralized Finance (DeFi), Arbitrum Ecosystem, Ethereum Ecosystem, Layer 2 (L2), Zero Knowledge (ZK), Loopring Ecosystem, Rollup, Energi Ecosystem",loopring,132818221,146449976.0,28721.665309176497,51267.09031436743,0.19,13294011.0
OKX,"Smart Contract Platform, Base Ecosystem, Gaming Blockchains",b3,130987651,615177192.0,,,N/A,18953505.0
OKX,"Stablecoins, USD Stablecoin, Solana Ecosystem, Fiat-backed Stablecoin",global-dollar,130238221,130238221.0,,,N/A,377668.0
OKX,"Artificial Intelligence (AI), Binance Launchpool, Solana Ecosystem, DePIN, Animoca Brands Portfolio, Multicoin Capital Portfolio, Delphi Ventures Portfolio, OKX Ventures Portfolio, Made in USA",io,129951331,705047906.0,,,N/A,34157599.0
OKX,"Cronos Ecosystem, Bridged USDC, Bridged-Tokens, Bridged Stablecoins",cronos-bridged-usdc-cronos,129812444,129812444.0,,,N/A,1401465.0
OKX,"Tokenized Assets, Real World Assets (RWA), Tokenized Silver, Tokenized Commodities",kinesis-silver,129279808,129279808.0,,,N/A,1291271.0
OKX,"BNB Chain Ecosystem, Harmony Ecosystem, Ethereum Ecosystem, Alameda Research Portfolio, Binance Labs Portfolio",swipe,126611708,126678450.0,,,N/A,3770966.0
OKX,"Artificial Intelligence (AI), Smart Contract Platform, Layer 1 (L1), Proof of Work (PoW)",qubic-network,126036877,150740853.0,,,N/A,3529034.0
OKX,"Artificial Intelligence (AI), Smart Contract Platform, BNB Chain Ecosystem, Solana Ecosystem, Layer 1 (L1), Polygon Ecosystem, Ethereum Ecosystem, DWF Labs Portfolio, Injective Ecosystem, OKX Ventures Portfolio",zignaly,124776551,172998347.0,,,N/A,2598587.0
OKX,"BNB Chain Ecosystem, Tron Ecosystem",global-commercial-business,123684845,123684845.0,,,N/A,191323.0
OKX,"Decentralized Exchange (DEX), Decentralized Finance (DeFi), Gnosis Chain Ecosystem, MEV Protection, Arbitrum Ecosystem, Ethereum Ecosystem, Intent, Delphi Ventures Portfolio, Blockchain Capital Portfolio",cow-protocol,123111472,296917021.0,,,N/A,32685071.0
OKX,"Decentralized Finance (DeFi), Insurance, Ethereum Ecosystem",nxm,123772670,123772670.0,,,N/A,0.0
OKX,"Smart Contract Platform, BNB Chain Ecosystem, Ethereum Ecosystem, Zero Knowledge (ZK), Animoca Brands Portfolio, Binance Labs Portfolio, OKX Ventures Portfolio",polyhedra-network,123435700,2044196282.0,350915.648911409,346403.37248750083,0.02,8725405.0
OKX,"Decentralized Exchange (DEX), Exchange-based Tokens, Decentralized Finance (DeFi), Yield Farming, Automated Market Maker (AMM), BNB Chain Ecosystem, Yearn Ecosystem, Solana Ecosystem, Avalanche Ecosystem, Polygon Ecosystem, Near Protocol Ecosystem, Fantom Ecosystem, Harmony Ecosystem, Arbitrum Ecosystem, Celo Ecosystem, Ethereum Ecosystem, Base Ecosystem, Alameda Research Portfolio, Pantera Capital Portfolio, Energi Ecosystem, Sora Ecosystem, Blockchain Capital Portfolio",sushi,122819273,178815661.0,53037.44466212034,137730.81150891056,0.05,23454698.0
OKX,"Tokenized Assets, Polygon Ecosystem, Arbitrum Ecosystem, Ethereum Ecosystem, Real World Assets (RWA), Starknet Ecosystem, Tokenized Treasury Bills (T-Bills)",eutbl,122449574,122449574.0,,,N/A,0.0
OKX,"Business Services, Decentralized Finance (DeFi), Oracle, Fantom Ecosystem, Ethereum Ecosystem, Binance Launchpad, Osmosis Ecosystem, Energi Ecosystem, Binance Labs Portfolio, Sequoia Capital Portfolio",band-protocol,121945403,123771592.0,12860.034968051326,25831.58595997968,0.05,8607717.0
OKX,"Polygon Ecosystem, Bridged DAI, Bridged-Tokens, Bridged Stablecoins",polygon-pos-bridged-dai-polygon-pos,122569310,122569310.0,,,N/A,12341687.0
OKX,"Exchange-based Tokens, BNB Chain Ecosystem, Centralized Exchange (CEX) Token",nkyc-token,120027895,120027895.0,,,N/A,242315.0
OKX,"Arbitrum Ecosystem, Ethereum Ecosystem",reserve-protocol-eth-plus,119558408,119558408.0,,,N/A,457943.0
OKX,"Arbitrum Ecosystem, Ethereum Ecosystem, Account Abstraction, Coinbase Ventures Portfolio, Binance Labs Portfolio, Consensys Portfolio, Outlier Ventures Portfolio",biconomy,118293598,126369098.0,17706.101003895987,36334.91578694773,0.16,14515104.0
OKX,"Decentralized Finance (DeFi), Ethereum Ecosystem, Real World Assets (RWA), Coinbase Ventures Portfolio, Stablecoin Protocol, Binance Labs Portfolio, Galaxy Digital Portfolio",usual,118898174,130752796.0,,,N/A,14495193.0
OKX,"Decentralized Finance (DeFi), Yield Farming, Lending/Borrowing Protocols, Ethereum Ecosystem, Real World Assets (RWA), Base Ecosystem, Binance Alpha Spotlight",syrup,119853094,192318779.0,,,N/A,11890932.0
OKX,"Smart Contract Platform, Ethereum Ecosystem, Zero Knowledge (ZK), Alleged SEC Securities, Privacy Blockchain",coti,116482157,129979993.0,,,N/A,13864017.0
OKX,"Smart Contract Platform, SocialFi, Layer 1 (L1), Gaming Blockchains",hive,116156117,,,,N/A,2385570.0
OKX,"Meme, Ethereum Ecosystem, Dog-Themed",neiro-3,115956800,115956800.0,66417.20161412969,184196.02677622548,0.07,43171475.0
OKX,"Stablecoins, Ethereum Ecosystem, Base Ecosystem, Blast Ecosystem, Fiat-backed Stablecoin",anzen-usdz,115289934,115289934.0,,,N/A,111613.0
OKX,"Exchange-based Tokens, NFT, BNB Chain Ecosystem, Ethereum Ecosystem",swftcoin,114396690,114396690.0,10248.445473256752,17893.353950728946,0.18,3232896.0
OKX,"BNB Chain Ecosystem, Ethereum Ecosystem, Payment Solutions, DWF Labs Portfolio",alchemy-pay,114060261,230718828.0,22251.36400041842,63625.76620876443,0.09,24142820.0
OKX,"Smart Contract Platform, BNB Chain Ecosystem, Ethereum Ecosystem, Layer 2 (L2)",prometeus,112779720,118959431.0,,,N/A,2593497.0
OKX,"Decentralized Finance (DeFi), Derivatives, Synthetic Issuer, Ethereum Ecosystem, Synthetic",stp-network,112598714,112598714.0,,,N/A,26116946.0
OKX,"Business Services, Infrastructure, Smart Contract Platform, Decentralized Finance (DeFi), Polygon Ecosystem, Arbitrum Ecosystem, Ethereum Ecosystem, Liquid Staking Governance Tokens, Coinbase Ventures Portfolio, Proof of Stake (PoS), Index Coop Defi Index, Consensys Portfolio, Liquid Staking, Index Coop Index",rocket-pool,112164003,112164003.0,2135.9517114013283,4263.248453679919,0.11,10016307.0
OKX,"Decentralized Exchange (DEX), Decentralized Finance (DeFi), BNB Chain Ecosystem, Wallets, XRP Ledger Ecosystem",solo-coin,111651033,111651033.0,,,N/A,3319329.0
OKX,"Smart Contract Platform, Proof of Stake (PoS), Sequoia Capital Portfolio",iostoken,111580730,111580730.0,18723.745477878587,44936.65729724468,0.04,58738171.0
OKX,"Smart Contract Platform, BNB Chain Ecosystem, Layer 1 (L1), Ethereum Ecosystem, Decentralized Identifier (DID), Base Ecosystem, Gravity Alpha Ecosystem",g-token,111441503,184896101.0,8749.530119965912,20450.051852902354,0.13,7441424.0
OKX,"Big Data, Business Services, Infrastructure, Decentralized Finance (DeFi), Solana Ecosystem, FTX Holdings, DWF Labs Portfolio, Name Service",bonfida,111105655,112124670.0,,,N/A,10941186.0
OKX,"Arbitrum Ecosystem, Bridged USDC, Bridged-Tokens, Bridged Stablecoins",usd-coin-ethereum-bridged,110508852,110508852.0,,,N/A,12569403.0
OKX,"Music, NFT, Ethereum Ecosystem, Coinbase Ventures Portfolio, Multicoin Capital Portfolio, Pantera Capital Portfolio, Energi Ecosystem, Binance Labs Portfolio",audius,109337862,109337862.0,,,N/A,12965165.0
OKX,"BNB Chain Ecosystem, Liquid Staking Tokens",astherus-staked-bnb,109510416,109510969.0,,,N/A,838.67
OKX,"Solana Ecosystem, Polygon Ecosystem, Ethereum Ecosystem",m2-global-wealth-limited-mmx,108016181,346540506.0,,,N/A,80177.0
OKX,"Smart Contract Platform, Cross-chain Communication, Pantera Capital Portfolio",icon,108476180,109715687.0,16558.71642967561,23835.327404691903,0.1,694917.0
OKX,"Smart Contract Platform, Decentralized Finance (DeFi), Binance Launchpool, Derivatives, Perpetuals, Ethereum Ecosystem, Layer 2 (L2), DragonFly Capital Portfolio, Pantera Capital Portfolio",aevo-exchange,108471124,120100976.0,57867.70733177904,181702.03075331092,0.17,14070732.0
OKX,"Smart Contract Platform, Ethereum Ecosystem, Metis Ecosystem, Layer 2 (L2), DWF Labs Portfolio, Rollup, GMCI Layer 2 Index, OKX Ventures Portfolio, GMCI Index",metis-token,108104007,172818911.0,26017.156693699388,47296.85666062575,0.06,5547384.0
OKX,"Decentralized Finance (DeFi), BNB Chain Ecosystem, Real World Assets (RWA), DWF Labs Portfolio, Stellar Ecosystem",velo,107014825,347521264.0,41931.19100167196,64360.61289807988,0.02,13859082.0
OKX,"Gaming (GameFi), NFT, Metaverse, Play To Earn, Ethereum Ecosystem, Animoca Brands Portfolio, RPG, Gaming Governance Token, Adventure Games, Energi Ecosystem, Delphi Ventures Portfolio",illuvium,107902521,139034973.0,4575.72847568174,7835.549167143533,0.14,14553020.0
OKX,"Meme, PulseChain Ecosystem",the-grays-currency,109003139,109003139.0,,,N/A,267993.0
OKX,"Lending/Borrowing Protocols, Ethereum Ecosystem, Paradigm Portfolio, Coinbase Ventures Portfolio",euler,106648927,155147769.0,,,N/A,3448444.0
OKX,"Decentralized Finance (DeFi), Ethereum Ecosystem, Morpho Ecosystem",steakhouse-usdc-morpho-vault,106222206,106222206.0,,,N/A,0.0
OKX,"Solana Ecosystem, Multicoin Capital Portfolio, Stablecoin Protocol, Alameda Research Portfolio, DeFiance Capital Portfolio",uxd-protocol-token,105861725,105861726.0,,,N/A,48.0
OKX,"Stablecoins, BNB Chain Ecosystem",astherus-usdf,105353388,105353388.0,,,N/A,502495.0
OKX,"NFT, Meme, Arbitrum Ecosystem, Ethereum Ecosystem, Anime-Themed, Binance HODLer Airdrops, Airdropped Tokens by NFT Projects",anime,105010327,189597081.0,198150.2805897357,155462.83920540937,0.11,12755617.0
OKX,"Tokenized Real Estate, Tokenized Assets, Gnosis Chain Ecosystem, RealT Tokens, Real World Assets (RWA), RWA Protocol",realtoken-ecosystem-governance,104831418,732064779.0,,,N/A,567.82
OKX,"Smart Contract Platform, BNB Chain Ecosystem, Ethereum Ecosystem, DWF Labs Portfolio, Made in USA",proton,104448481,115787653.0,,,N/A,4237293.0
OKX,"Solana Ecosystem, Meme, Solana Meme, PolitiFi, Made in USA",melania-meme,103843499,692289420.0,,,N/A,14766754.0
OKX,"Smart Contract Platform, Privacy, Layer 1 (L1), Proof of Stake (PoS), Proof of Work (PoW), Zano Ecosystem, Privacy Blockchain",zano,103162688,103176038.0,,,N/A,701772.0
OKX,"NFT, Binance Launchpool, Meme, Ethereum Ecosystem, Binance Labs Portfolio, GMCI Meme Index, GMCI Index",memecoin-2,103135044,173770186.0,77820.74102215403,117063.00501803697,0.08,18552961.0
OKX,"Decentralized Finance (DeFi), Yield Farming, Avalanche Ecosystem, Fantom Ecosystem, Arbitrum Ecosystem, Olympus Pro Ecosystem, Ethereum Ecosystem, Stablecoin Protocol",spell-token,102395188,126566198.0,,,N/A,49279355.0
OKX,"Artificial Intelligence (AI), Base Ecosystem, AI Agents, AI Applications, Made in USA",venice-token,102373794,244034986.0,,,N/A,5973397.0
OKX,"Artificial Intelligence (AI), Smart Contract Platform, Masternodes, DePIN, Proof of Work (PoW), Made in USA",zelcash,102767875,102806624.0,,,N/A,8768384.0
OKX,"Infrastructure, Solana Ecosystem, Animoca Brands Portfolio, Cross-chain Communication, OKX Ventures Portfolio",zeus-network,102013642,266507798.0,36901.397439469634,39211.76143473212,0.19,9911092.0
OKX,"Business Services, Decentralized Finance (DeFi), Oracle, Derivatives, Synthetic Issuer, Avalanche Ecosystem, Ethereum Ecosystem, Blockchain Capital Portfolio, Synthetic, Made in USA",uma,101756373,146826972.0,15001.0844953104,22511.634714048254,0.08,9881224.0
OKX,"Big Data, Infrastructure, Storage, Cardano Ecosystem, DePIN",iagon,102649699,272989681.0,,,N/A,432754.0
OKX,"Polygon Ecosystem, Arbitrum Ecosystem, Ethereum Ecosystem, Optimism Ecosystem, Bridge Governance Tokens, Cross-chain Communication, Intent, Boba Network Ecosystem, Blockchain Capital Portfolio, Made in USA",across-protocol,101181444,250428776.0,,,N/A,23233784.0
OKX,"Decentralized Exchange (DEX), Decentralized Finance (DeFi), Automated Market Maker (AMM), Ethereum Ecosystem, Cronos Ecosystem",vvs-finance,100689792,196848338.0,,,N/A,263671.0
OKX,"Solana Ecosystem, Meme, Base Ecosystem, AI Meme, AI Agents, Virtuals Protocol Ecosystem, Binance Alpha Spotlight, DeFAI",aixbt,102157773,119397210.0,103668.91556341546,131918.61732533062,0.08,43808401.0
OKX,"Bridged USDT, QL1 Ecosystem, Bridged-Tokens, Bridged Stablecoins",qusdt,99999335,99999335.0,,,N/A,11298.18
OKX,"Solana Ecosystem, Liquid Staking Tokens, Liquid Staked SOL, Liquid Staking",drift-staked-sol,99249259,99249259.0,,,N/A,27777.0
OKX,"Solana Ecosystem, Meme, Frog-Themed, Solana Meme, GMCI Meme Index, GMCI Index",book-of-meme,100189068,100189068.0,58645.67292782207,115708.23413217014,0.07,45917919.0
OKX,"Smart Contract Platform, Polkadot Ecosystem, Binance Launchpool, Layer 2 (L2), Manta Network Ecosystem, Multicoin Capital Portfolio, Alameda Research Portfolio, DeFiance Capital Portfolio, Binance Labs Portfolio",manta-network,98743206,259652360.0,,,N/A,23368503.0
OKX,"NFT, BNB Chain Ecosystem, Ethereum Ecosystem, Binance Launchpad, DWF Labs Portfolio, Binance Labs Portfolio",space-id,98037479,454681841.0,48972.80033883861,57229.345076883415,0.09,15462828.0
OKX,"Crypto-Backed Tokens, Decentralized Finance (DeFi), Compound Tokens, cToken, Ethereum Ecosystem",compound-ether,98123154,98123154.0,,,N/A,174.94
OKX,"Smart Contract Platform, BNB Chain Ecosystem, Binance Launchpool, Ethereum Ecosystem, Layer 2 (L2), Restaking, Rollups-as-a-Service (RaaS), Rollup, Binance Labs Portfolio",altlayer,97727714,350025888.0,,,N/A,11770424.0
OKX,"Smart Contract Platform, Ethereum Ecosystem, Layer 2 (L2), Optimism Superchain Ecosystem, Outlier Ventures Portfolio, Lisk Ecosystem",lisk,96823209,224724163.0,15933.32602742309,21141.44880656628,0.11,10531092.0
OKX,"NFT, Polygon Ecosystem, Ethereum Ecosystem, Optimism Ecosystem",blockv,96942976,96942976.0,,,N/A,82783.0
OKX,"Software as a service, Ethereum Ecosystem, Energi Ecosystem",status,96652477,166067479.0,64442.30584043359,70287.08300070727,0.12,8048073.0
OKX,"Stablecoins, LP Tokens, Ethereum Ecosystem",resolv-rlp,96352499,96352499.0,,,N/A,201043.0
OKX,"Solana Ecosystem, Payment Solutions, Viction Ecosystem",saros-finance,95772302,364846890.0,,,N/A,771834.0
OKX,"XDC Ecosystem, Telos Ecosystem",ecoin-2,95498064,207099463.0,,,N/A,5.24
OKX,"Infrastructure, Smart Contract Platform, Oracle, Layer 1 (L1), Animoca Brands Portfolio, Coinbase Ventures Portfolio, Cross-chain Communication, Made in USA",supra,95270205,847091536.0,,,N/A,4722071.0
OKX,"Artificial Intelligence (AI), Infrastructure, Smart Contract Platform, Oracle, Polkadot Ecosystem, Ethereum Ecosystem, Interoperability, Layer 2 (L2), Zero Knowledge (ZK), DePIN, DWF Labs Portfolio, Rollup, AI Agents, Sora Ecosystem, AI Framework, Made in USA",pha,95431484,121639288.0,24574.258128226134,46538.39598340136,0.25,21189544.0
OKX,Layer 1 (L1),oec-token,95020891,95020891.0,8066.347897200874,3648.335674812606,0.28,330696.0
OKX,"Smart Contract Platform, Layer 1 (L1), Zero Knowledge (ZK), Andreessen Horowitz (a16z) Portfolio, Privacy Blockchain, Made in USA",aleo,95552594,468190737.0,,,N/A,6403138.0
OKX,"Solana Ecosystem, Liquid Staking Tokens, Restaking, Liquid Restaking Tokens, Liquid Staked SOL, Liquid Staking, Liquid Restaked SOL",solayer-staked-sol,94560391,94560391.0,,,N/A,288890.0
OKX,"Gaming (GameFi), NFT, BNB Chain Ecosystem",infinitar-governance-token,95338723,465250763.0,,,N/A,9028790.0
OKX,"Fraxtal Ecosystem, Bridged-Tokens",l2-standard-bridged-frxusd,94604617,94604617.0,,,N/A,1151398.0
OKX,"Infrastructure, Smart Contract Platform, Ethereum Ecosystem, Data Availability, Modular Blockchain",avail,94478416,483729807.0,,,N/A,3677587.0
OKX,"Gaming (GameFi), NFT, Kaia Ecosystem, Gaming Blockchains",bora,95207469,99584824.0,5929.780750095342,5005.7389057371065,0.13,168547.0
OKX,"DaoMaker Launchpad, Ethereum Ecosystem, Real World Assets (RWA), Sequoia Capital Portfolio, Made in USA",clearpool,94922492,124906898.0,,,N/A,2911065.0
OKX,"Smart Contract Platform, Gaming (GameFi), Solana Ecosystem, Layer 2 (L2), Gaming Blockchains",sonic-svm,94003034,626686896.0,130348.01790448687,112929.96010013593,0.04,30294137.0
OKX,"Ethereum Ecosystem, DWF Labs Portfolio",adventure-gold,93112960,93112960.0,20048.732232691676,92309.2939107599,0.02,30568997.0
OKX,"Artificial Intelligence (AI), Big Data, Media, BNB Chain Ecosystem, Polygon Ecosystem, Ethereum Ecosystem, GMCI DePIN Index, Galaxy Digital Portfolio, GMCI Index",everipedia,92597119,92597119.0,2472.0317275418333,6872.134002188192,0.02,4937146.0
OKX,"Artificial Intelligence (AI), Virtual Reality, Launchpad, Ethereum Ecosystem, Telegram Apps, Discord Bots, PAAL AI Launchpad, AI Agents, AI Applications, AI Agent Launchpad, Binance Alpha Spotlight, AI Framework, DeFAI, Made in USA",paal-ai,91331013,102733089.0,,,N/A,8568192.0
OKX,"Decentralized Finance (DeFi), Yield Farming, BNB Chain Ecosystem, Binance Launchpool, Lending/Borrowing Protocols, Arbitrum Ecosystem, Ethereum Ecosystem, Optimism Ecosystem, ZkSync Ecosystem, opBNB Ecosystem, Unichain Ecosystem",venus,91186680,163587348.0,,,N/A,4624682.0
OKX,"Artificial Intelligence (AI), Infrastructure, Smart Contract Platform, Decentralized Finance (DeFi), Arbitrum Ecosystem, Ethereum Ecosystem, Zero Knowledge (ZK), DWF Labs Portfolio, Coinbase Ventures Portfolio, Pantera Capital Portfolio, Binance Labs Portfolio",marlin,90928634,111521018.0,,,N/A,5792973.0
OKX,"Decentralized Exchange (DEX), Exchange-based Tokens, Decentralized Finance (DeFi), Yield Farming, Automated Market Maker (AMM), Avalanche Ecosystem, Polygon Ecosystem, Near Protocol Ecosystem, Gnosis Chain Ecosystem, Harmony Ecosystem, Arbitrum Ecosystem, Ethereum Ecosystem, Optimism Ecosystem, Base Ecosystem, Index Coop Defi Index, Alameda Research Portfolio, DeFiance Capital Portfolio, Pantera Capital Portfolio, Energi Ecosystem, Polygon zkEVM Ecosystem, Huobi ECO Chain Ecosystem, Blockchain Capital Portfolio, Index Coop Index",balancer,90866148,98259882.0,54683.115195955244,57349.76150451094,0.21,7247655.0
OKX,"Crypto-Backed Tokens, BNB Chain Ecosystem, Arbitrum Ecosystem, Ethereum Ecosystem, Mantle Ecosystem",ignition-fbtc,107436798,1185109838.0,,,N/A,434619.0
OKX,"Energy, Ethereum Ecosystem, Alleged SEC Securities, Energi Ecosystem, GMCI DePIN Index, Blockchain Capital Portfolio, GMCI Index",power-ledger,90237569,170251967.0,,,N/A,6966976.0
OKX,"Gaming (GameFi), XDC Ecosystem, Gaming Utility Token",gama-coin,89826465,138194636.0,,,N/A,2285125.0
OKX,"Infrastructure, Smart Contract Platform, Decentralized Finance (DeFi), BNB Chain Ecosystem, Avalanche Ecosystem, Polygon Ecosystem, Fantom Ecosystem, Harmony Ecosystem, Arbitrum Ecosystem, Ethereum Ecosystem, DWF Labs Portfolio, Layer 3 (L3), Outlier Ventures Portfolio",orbs,89027985,195513914.0,9221.79363261637,13403.902917951988,0.1,4039779.0
OKX,"Artificial Intelligence (AI), Oracle, Ethereum Ecosystem, DePIN, Energi Ecosystem, Sora Ecosystem, GMCI DePIN Index, GMCI Index",iexec-rlc,89162689,107168578.0,,,N/A,8461793.0
OKX,"SocialFi, Coinbase Ventures Portfolio, Pantera Capital Portfolio, Andreessen Horowitz (a16z) Portfolio, Sequoia Capital Portfolio",deso,88169989,90482502.0,,,N/A,2837171.0
OKX,"Smart Contract Platform, Ethereum Ecosystem, Layer 2 (L2), Zero Knowledge (ZK), Restaking, Zircuit Ecosystem",zircuit,88863068,404857251.0,,,N/A,14824059.0
OKX,"Cronos Ecosystem, Bridged USDT, Bridged-Tokens, Bridged Stablecoins",cronos-bridged-usdt-cronos,87934938,87934938.0,,,N/A,391931.0
OKX,"Smart Contract Platform, Layer 1 (L1)",ong,86627395,212351680.0,,,N/A,2032085.0
OKX,"Smart Contract Platform, Bitcoin Sidechains, Stacks Ecosystem, SideChain",sbtc-2,86394984,86394984.0,,,N/A,28501.0
OKX,"Stablecoins, USD Stablecoin, Ethereum Ecosystem, Sonic Ecosystem, Fiat-backed Stablecoin",frax-usd,86093966,86093966.0,,,N/A,1447628.0
OKX,"Artificial Intelligence (AI), Smart Contract Platform, Gaming (GameFi), NFT, BNB Chain Ecosystem, Layer 1 (L1), Ethereum Ecosystem, Modular Blockchain, Chromia Ecosystem",chromaway,86290668,86290668.0,,,N/A,10300856.0
