OKX,"Decentralized Exchange (DEX), Decentralized Finance (DeFi), Arbitrum Ecosystem, Ethereum Ecosystem",tokenlon,85552213,102976307.0,,,N/A,38138.0
OKX,"Smart Contract Platform, Polkadot Ecosystem, Layer 1 (L1), Coinbase Ventures Portfolio, Binance Labs Portfolio",moonbeam,85531965,104157654.0,6582.691951730888,20631.56198479155,0.11,4613177.0
OKX,"Business Services, Polygon Ecosystem, Ethereum Ecosystem",request-network,85340555,110880160.0,,,N/A,3006785.0
OKX,"SocialFi, Coinbase Ventures Portfolio, Pantera Capital Portfolio, Andreessen Horowitz (a16z) Portfolio, Sequoia Capital Portfolio",deso,85253664,87489687.0,,,N/A,1968027.0
OKX,"NFT, Solana Ecosystem, NFT Marketplace",tensor,84369312,252144312.0,142141.095331014,170248.24839037796,0.08,12925051.0
OKX,"Meme, Ethereum Ecosystem, PolitiFi",constitutiondao,84215182,84215182.0,140474.738244376,227567.69272762418,0.12,18716084.0
OKX,"Exchange-based Tokens, Centralized Exchange (CEX) Token, Ethereum Ecosystem",hashkey-ecopoints,83478327,630025107.0,,,N/A,3102470.0
OKX,"Solana Ecosystem, Polygon Ecosystem, DePIN, Pantera Capital Portfolio",geodnet,83207449,259538081.0,,,N/A,254625.0
OKX,"Smart Contract Platform, Cosmos Ecosystem, Modular Blockchain, Osmosis Ecosystem, Rollups-as-a-Service (RaaS)",dymension,83167389,329733477.0,,,N/A,9953696.0
OKX,"Gaming (GameFi), NFT, BNB Chain Ecosystem, Metaverse, Collectibles, Polygon Ecosystem, Play To Earn, Harmony Ecosystem, Guild and Scholarship, Ethereum Ecosystem, Animoca Brands Portfolio, Base Ecosystem, DWF Labs Portfolio, Ronin Ecosystem, Gaming Governance Token, Andreessen Horowitz (a16z) Portfolio, Delphi Ventures Portfolio",yield-guild-games,82817092,201740266.0,34280.90017888509,74221.364857585,0.1,12715605.0
OKX,"BNB Chain Ecosystem, Liquid Staking Tokens",astherus-staked-bnb,82674820,82674820.0,,,N/A,710.49
OKX,"Smart Contract Platform, Gaming (GameFi), Play To Earn, Guild and Scholarship, Ethereum Ecosystem, Layer 2 (L2), Gaming Blockchains, Pantera Capital Portfolio, Ancient8 Ecosystem, Optimism Superchain Ecosystem",ancient8,82579883,313652056.0,,,N/A,29664746.0
OKX,"Decentralized Exchange (DEX), Decentralized Finance (DeFi), Yield Farming, Automated Market Maker (AMM), Solana Ecosystem, Coinbase Ventures Portfolio, DeFiance Capital Portfolio, Made in USA",orca,82493201,154839575.0,,,N/A,14040472.0
OKX,Ethereum Ecosystem,dkargo,82389038,87897267.0,,,N/A,904190.0
OKX,BNB Chain Ecosystem,bitdca,81518576,87557439.0,,,N/A,18640.62
OKX,"Artificial Intelligence (AI), BNB Chain Ecosystem, Ethereum Ecosystem, DragonFly Capital Portfolio, Binance Labs Portfolio, Delphi Ventures Portfolio, OKX Ventures Portfolio, Binance HODLer Airdrops, AI Agent Launchpad, Binance Alpha Spotlight, AI Framework",myshell,81093478,300346214.0,,,N/A,64757444.0
OKX,"Berachain Ecosystem, Bridged USDT, Bridged-Tokens, Ink Ecosystem, Bridged Stablecoins",usdt0,80867012,80867012.0,,,N/A,181810.0
OKX,"Smart Contract Platform, Proof of Stake (PoS)",stratis,80418240,88604981.0,,,N/A,1121148.0
OKX,"Artificial Intelligence (AI), Smart Contract Platform, Decentralized Finance (DeFi), Analytics, NFT, BNB Chain Ecosystem, Launchpad, Ethereum Ecosystem, Telegram Apps, Discord Bots, ChainGPT Launchpad, Poolz Finance Launchpad, AI Agents, AI Applications, Binance Alpha Spotlight, AI Framework, DeFAI",chaingpt,80408287,99829946.0,,,N/A,22587788.0
OKX,"NFT, Polygon Ecosystem",sathosi-airlines-token,80228611,383161949.0,,,N/A,3119.63
OKX,"Decentralized Finance (DeFi), BNB Chain Ecosystem, Arbitrum Ecosystem, Ethereum Ecosystem, Multicoin Capital Portfolio, Energi Ecosystem",dforce-token,80211718,80211718.0,,,N/A,7589911.0
OKX,"Polygon Ecosystem, XRP Ledger Ecosystem",crypto-trading-fund,80153094,80153094.0,,,N/A,10700.28
OKX,"Blast Ecosystem, Bridged WETH, Bridged-Tokens",l2-standard-bridged-weth-blast,79811596,79811596.0,,,N/A,742346.0
OKX,"NFT, Ethereum Ecosystem",superrare,79584147,99434081.0,,,N/A,97039617.0
OKX,"Gaming (GameFi), Play To Earn, Guild and Scholarship, Ethereum Ecosystem, Animoca Brands Portfolio, Base Ecosystem, DWF Labs Portfolio, Ronin Ecosystem, Coinbase Ventures Portfolio, DeFiance Capital Portfolio, Pantera Capital Portfolio, Binance Labs Portfolio, MMO",zentry,79475090,116673385.0,110189.23258188012,151626.66972894702,0.17,7176810.0
OKX,"Artificial Intelligence (AI), BNB Chain Ecosystem, Solana Ecosystem, Ethereum Ecosystem, AI Agents, Alameda Research Portfolio",delysium,79359973,151342467.0,,,N/A,2637049.0
OKX,"Stablecoins, USD Stablecoin, Solana Ecosystem, Ethereum Ecosystem, Multicoin Capital Portfolio, Fiat-backed Stablecoin",paxos-standard,79208136,79208136.0,,,N/A,3352120.0
OKX,"Artificial Intelligence (AI), Infrastructure, Ethereum Ecosystem, AI Framework, Made in USA",arcblock,79175115,149387010.0,,,N/A,755788.0
OKX,"Stablecoins, Decentralized Finance (DeFi), Lending/Borrowing Protocols, Ethereum Ecosystem",syrupusdc,79153453,79153453.0,,,N/A,181022.0
OKX,"Software as a service, Polygon Ecosystem, Ethereum Ecosystem, Decentralized Identifier (DID), Pantera Capital Portfolio, Energi Ecosystem, Blockchain Capital Portfolio",civic,79146586,98686515.0,13279.745693715611,43581.15994863332,0.04,6909392.0
OKX,"Artificial Intelligence (AI), Smart Contract Platform, Layer 1 (L1), Ethereum Ecosystem, Osmosis Ecosystem, AI Agents, AI Agent Launchpad",humans-ai,79098575,79098575.0,,,N/A,664113.0
OKX,"Ethereum Ecosystem, Stablecoin Protocol",level-usd,78701883,78701883.0,,,N/A,761676.0
OKX,"Stablecoins, USD Stablecoin, Osmosis Ecosystem, Fiat-backed Stablecoin",usdx,78438399,78438399.0,,,N/A,15564.4
OKX,"Exchange-based Tokens, Centralized Exchange (CEX) Token, Ethereum Ecosystem",bitmart-token,78363303,147627174.0,,,N/A,4237547.0
OKX,"Business Services, Decentralized Finance (DeFi), Oracle, Polygon Ecosystem, Gnosis Chain Ecosystem, Arbitrum Ecosystem, Ethereum Ecosystem, Optimism Ecosystem, Manta Network Ecosystem, Binance Labs Portfolio, Lisk Ecosystem, Made in USA",tellor,78227911,80504124.0,56130.21310047267,58521.1544386969,0.07,20949797.0
OKX,"Decentralized Finance (DeFi), Wallets, Ethereum Ecosystem, Pundi AIFX Omnilayer Ecosystem",pundi-x-2,78217143,78217143.0,,,N/A,5436528.0
OKX,"Decentralized Exchange (DEX), Decentralized Finance (DeFi), Yield Farming, Automated Market Maker (AMM), BNB Chain Ecosystem, Avalanche Ecosystem, Arbitrum Ecosystem, Mantle Ecosystem, DeFiance Capital Portfolio, Delphi Ventures Portfolio, Dex Aggregator",joe,77524134,99278817.0,36607.68646881397,19738.876958558954,0.1,7877623.0
OKX,"NFT, BNB Chain Ecosystem, Solana Ecosystem, Meme, Ethereum Ecosystem, Base Ecosystem, Hybrid Token Standards, Wojak-Themed",non-playable-coin,77481038,77481038.0,,,N/A,6219464.0
OKX,"Smart Contract Platform, Layer 1 (L1), Osmosis Ecosystem, XRP Ledger Ecosystem",coreum,77180345,77180345.0,,,N/A,93205.0
OKX,"Optimism Ecosystem, Bridged WBTC, Bridged-Tokens",optimism-bridged-wbtc-optimism,77130685,77130685.0,,,N/A,803095.0
OKX,"Meme, Dog-Themed, TON Ecosystem, TON Meme",dogs-2,76865964,81811863.0,48089.07922520554,97229.62947651456,0.07,53641806.0
OKX,Smart Contract Platform,songbird,76117081,90443725.0,,,N/A,369999.0
OKX,"Meme, Base Ecosystem, Dog-Themed, Base Meme, Farcaster Ecosystem",doginme,75825228,75825228.0,,,N/A,6385714.0
OKX,"Decentralized Finance (DeFi), Liquid Staking Tokens, Ethereum Ecosystem, LSDFi, Liquid Staked ETH, Liquid Staking",origin-ether,75720397,75720397.0,,,N/A,38225.0
OKX,"Stablecoins, USD Stablecoin, Seigniorage, Alleged SEC Securities, Osmosis Ecosystem, Stablecoin Protocol, DeFiance Capital Portfolio, Terra Classic Ecosystem, Binance Labs Portfolio, Delphi Ventures Portfolio, Galaxy Digital Portfolio, Fiat-backed Stablecoin",terrausd,75459269,106908174.0,32875.826856555395,84467.3808139379,0.15,22119485.0
OKX,"Smart Contract Platform, Gaming (GameFi), Layer 1 (L1), Proof of Stake (PoS), Gaming Blockchains",oasys,75246054,194587101.0,2336.8028201320453,2967.3626230748887,0.16,512091.0
OKX,"BNB Chain Ecosystem, Solana Ecosystem, Polygon Ecosystem, Meme, Ethereum Ecosystem, Cronos Ecosystem, Dog-Themed, Elon Musk-Inspired, Fuse Ecosystem",dogelon-mars,75200125,136814571.0,5307.074214085796,9422.699984644098,0.22,2534611.0
OKX,"Smart Contract Platform, Layer 1 (L1), DWF Labs Portfolio, Radix Ecosystem",radix,75039840,91883444.0,,,N/A,1934115.0
OKX,"Sports, BNB Chain Ecosystem",pixer-eternity,74946226,348282222.0,,,N/A,795584.0
OKX,"Exchange-based Tokens, Centralized Exchange (CEX) Token, Near Protocol Ecosystem, Harmony Ecosystem, Ethereum Ecosystem, Multicoin Capital Portfolio, Alameda Research Portfolio, Elastos Smart Contract Chain Ecosystem, Sequoia Capital Portfolio, Made in China",huobi-token,74851149,94405582.0,,,N/A,26591.0
OKX,"Gaming (GameFi), NFT, Ethereum Ecosystem",undeads-games,74632239,259631719.0,,,N/A,361276.0
OKX,"Entertainment, Gaming (GameFi), NFT, Axie Infinity Ecosystem, Play To Earn, Ethereum Ecosystem, Ronin Ecosystem, Gaming Utility Token",smooth-love-potion,74542427,74542427.0,14549.226309768786,25927.208237535833,0.11,9803315.0
OKX,"Optimism Ecosystem, Bridged WETH, Bridged-Tokens",l2-standard-bridged-weth-optimism,74541331,74541331.0,,,N/A,17322329.0
OKX,"Smart Contract Platform, Wallets, Layer 2 (L2), Osmosis Ecosystem",islamic-coin,74329831,895479821.0,,,N/A,365428.0
OKX,Retail,milk-alliance,74253396,166021535.0,,,N/A,2103362.0
OKX,"Artificial Intelligence (AI), Decentralized Finance (DeFi), Ethereum Ecosystem, DePIN",pinlink,73934627,92418284.0,,,N/A,1622680.0
OKX,"Decentralized Finance (DeFi), Solana Ecosystem, Real World Assets (RWA), Payment Solutions, DePIN, Coinbase Ventures Portfolio, Alameda Research Portfolio, Circle Ventures Portfolio, OKX Ventures Portfolio, RWA Protocol, Made in USA",zebec-network,73562971,99276776.0,11441.442262250788,8924.684106573019,0.11,29708648.0
OKX,"Ethereum Ecosystem, DePIN",dent,73143695,76466181.0,,,N/A,4866141.0
OKX,"Decentralized Finance (DeFi), Oracle, Ethereum Ecosystem, DWF Labs Portfolio, Pantera Capital Portfolio",api3,72995334,91094992.0,22524.527445927833,25831.20477325458,0.05,13468679.0
OKX,"Meme, Ethereum Ecosystem, Mantle Ecosystem",puff-the-dragon,72983527,72983527.0,,,N/A,32550.0
OKX,"Gaming (GameFi), Play To Earn, TON Ecosystem, Tap to Earn, Arcade Games",watcoin-2,72860999,80888835.0,,,N/A,716458.0
OKX,"Decentralized Finance (DeFi), Lending/Borrowing Protocols, Moonbeam Ecosystem, Base Ecosystem, Coinbase Ventures Portfolio, Made in USA",moonwell-artemis,72663882,110780899.0,,,N/A,5661473.0
OKX,"Smart Contract Platform, Gaming (GameFi), NFT, Binance Launchpool, Arbitrum Ecosystem, Layer 3 (L3), XAI Ecosystem, Gaming Blockchains, Outlier Ventures Portfolio",xai-blockchain,72650639,107115421.0,,,N/A,27430993.0
OKX,"Base Ecosystem, Cybersecurity, Binance Labs Portfolio, OKX Ventures Portfolio, Binance Alpha Spotlight",goplus-security,72460817,399585406.0,,,N/A,63408238.0
OKX,"Decentralized Exchange (DEX), Exchange-based Tokens, Decentralized Finance (DeFi), BNB Chain Ecosystem, Binance Launchpool, Polygon Ecosystem, Near Protocol Ecosystem, Arbitrum Ecosystem, Ethereum Ecosystem, DWF Labs Portfolio, Coinbase Ventures Portfolio, Alameda Research Portfolio, DeFiance Capital Portfolio, Pantera Capital Portfolio, Aurora Ecosystem, Energi Ecosystem, Binance Labs Portfolio, Galaxy Digital Portfolio",dodo,72310220,72310220.0,,,N/A,8780037.0
OKX,"Decentralized Finance (DeFi), Lending/Borrowing Protocols, Arbitrum Ecosystem, Ethereum Ecosystem, Alameda Research Portfolio, Pantera Capital Portfolio",liquity,71341204,73307654.0,10352.21708280072,30526.669388516482,0.07,10431751.0
OKX,"Decentralized Finance (DeFi), Lending/Borrowing Protocols, Ethereum Ecosystem, Real World Assets (RWA), Coinbase Ventures Portfolio, Andreessen Horowitz (a16z) Portfolio, RWA Protocol, Made in USA",goldfinch,71287712,88178678.0,,,N/A,591003.0
OKX,"Artificial Intelligence (AI), Cardano Ecosystem, Ethereum Ecosystem, AI Agents, Sora Ecosystem",singularitynet,71218306,107672885.0,,,N/A,30759.0
OKX,"Artificial Intelligence (AI), Decentralized Finance (DeFi), Solana Ecosystem, Arbitrum Ecosystem, Metis Ecosystem, AI Agents, Sonic Ecosystem, IOTA EVM Ecosystem, AI Applications, DeFAI",heyanon,70533596,116162422.0,,,N/A,3061476.0
OKX,"Gaming (GameFi), NFT, Collectibles, Play To Earn, Ethereum Ecosystem, Base Ecosystem, Energi Ecosystem",ecomi,70293368,80652686.0,6306.904216708731,7639.451959961335,0.19,1962593.0
OKX,"Artificial Intelligence (AI), Business Services, Decentralized Finance (DeFi), Ethereum Ecosystem, Paradigm Portfolio, DragonFly Capital Portfolio, Energi Ecosystem",numeraire,70052699,93793130.0,6810.3017948342795,18532.70962026523,0.11,5526679.0
OKX,"Artificial Intelligence (AI), Ethereum Ecosystem",0x0-ai-ai-smart-contract,69863370,69863370.0,,,N/A,91773.0
OKX,"Decentralized Finance (DeFi), Lending/Borrowing Protocols, Solana Ecosystem, Binance Alpha Spotlight",kamino,69754299,516698508.0,,,N/A,6775356.0
OKX,"Decentralized Finance (DeFi), Ethereum Ecosystem, Binance Alpha Spotlight",avalon-2,69721705,429717746.0,,,N/A,15107898.0
OKX,"Stablecoins, Decentralized Finance (DeFi), USD Stablecoin, BNB Chain Ecosystem, Polygon Ecosystem, Gnosis Chain Ecosystem, Arbitrum Ecosystem, Ethereum Ecosystem, Optimism Ecosystem, Base Ecosystem, Crypto-backed Stablecoin, Fiat-backed Stablecoin",crvusd,69599797,69599797.0,,,N/A,2647825.0
OKX,"Smart Contract Platform, Ethereum Ecosystem, Layer 2 (L2), Zero Knowledge (ZK), Rollup, OKX Ventures Portfolio",taiko,69589564,658085592.0,,,N/A,10112241.0
OKX,"Tokenized Assets, Polygon Ecosystem, Arbitrum Ecosystem, Ethereum Ecosystem, Real World Assets (RWA), Starknet Ecosystem, Tokenized Treasury Bills (T-Bills)",spiko-us-t-bills-money-market-fund,69588146,69588146.0,,,N/A,0.0
OKX,"Lending/Borrowing Protocols, Solana Ecosystem, FTX Holdings, Coinbase Ventures Portfolio, Alameda Research Portfolio, DragonFly Capital Portfolio",solend,69360419,137087973.0,,,N/A,2989.72
OKX,"Arbitrum Ecosystem, Bridge Governance Tokens, Base Ecosystem, Cross-chain Communication, OKX Ventures Portfolio",orbiter-finance,68719435,221675596.0,,,N/A,58338331.0
OKX,"Solana Ecosystem, Restaking, Liquid Restaking Tokens, Liquid Restaked SOL",renzo-restaked-sol,68653744,68653744.0,,,N/A,175271.0
OKX,"Smart Contract Platform, Binance Launchpool, Layer 2 (L2), Scroll Ecosystem",scroll,68627957,361199774.0,72067.07197335626,92094.83225841676,0.08,10616059.0
OKX,"Artificial Intelligence (AI), Marketing, Analytics, BNB Chain Ecosystem, Ethereum Ecosystem, Animoca Brands Portfolio, Base Ecosystem, AI Agents, Binance Alpha Spotlight",cookie,68156814,151700917.0,,,N/A,18367912.0
OKX,"Stablecoins, Decentralized Finance (DeFi), USD Stablecoin, BNB Chain Ecosystem, Avalanche Ecosystem, Arbitrum Ecosystem, Liquid Staking Tokens, Ethereum Ecosystem, Optimism Ecosystem, Fiat-backed Stablecoin",staked-frax,68149003,68149003.0,,,N/A,38.2
OKX,"Decentralized Exchange (DEX), Decentralized Finance (DeFi), Sui Ecosystem, Animoca Brands Portfolio, OKX Ventures Portfolio, Dex Aggregator",cetus-protocol,68008475,99590400.0,45963.5402996122,47663.021658719794,0.04,9094740.0
OKX,"Artificial Intelligence (AI), Solana Ecosystem, DePIN",nosana,67950440,81475348.0,,,N/A,394878.0
OKX,"Decentralized Finance (DeFi), Ethereum Ecosystem",elixir-finance,67640018,423652541.0,,,N/A,41083512.0
OKX,SocialFi,steem,67240482,67398277.0,,,N/A,8279200.0
OKX,"Solana Ecosystem, Wallets, Base Ecosystem, TON Ecosystem",bitget-wallet-token,67182897,470072637.0,,,N/A,3631.06
OKX,"Decentralized Finance (DeFi), BNB Chain Ecosystem, Solana Ecosystem, Wallets, Polygon Ecosystem, Ethereum Ecosystem, Binance Launchpad, DWF Labs Portfolio, Multicoin Capital Portfolio, Alameda Research Portfolio, Viction Ecosystem, Binance Labs Portfolio",coin98,66504147,73825153.0,,,N/A,14951435.0
OKX,"Smart Contract Platform, Layer 1 (L1), Proof of Work (PoW), Privacy Blockchain",ergo,66344365,80980690.0,,,N/A,73088.0
OKX,Ethereum Ecosystem,saasgo,66230080,82787600.0,,,N/A,208826.0
OKX,"Smart Contract Platform, Layer 1 (L1), Proof of Work (PoW), Made in USA",quai-network,66092115,411265703.0,,,N/A,4923541.0
OKX,Ethereum Ecosystem,devve,65920670,90519338.0,,,N/A,871412.0
OKX,E-commerce,pay-coin,65646703,121974976.0,,,N/A,5250316.0
OKX,"Healthcare, Osmosis Ecosystem",medibloc,65427117,70866630.0,,,N/A,373312.0
OKX,"Meme, Ethereum Ecosystem, Frog-Themed, Murad Picks, Binance Alpha Spotlight",apu-s-club,65223319,65223319.0,,,N/A,7845874.0
OKX,"Polkadot Ecosystem, Real World Assets (RWA), Coinbase Ventures Portfolio, Circle Ventures Portfolio, Galaxy Digital Portfolio, RWA Protocol",centrifuge,65171817,71402864.0,1816.4995228560997,4245.846934032218,0.16,562119.0
OKX,"Stablecoins, USD Stablecoin, Fiat-backed Stablecoin",falcon-finance,64658041,64658041.0,,,N/A,68065.0
OKX,"Infrastructure, Smart Contract Platform, BNB Chain Ecosystem, Avalanche Ecosystem, Polygon Ecosystem, Arbitrum Ecosystem, Ethereum Ecosystem, Optimism Ecosystem, Layer 2 (L2), Base Ecosystem, Binance Launchpad, Modular Blockchain, Layer 3 (L3), Rollup, Proof of Stake (PoS), Appchains, Binance Labs Portfolio",cartesi,64647783,75214790.0,,,N/A,7982749.0
OKX,"Ethereum Ecosystem, Telegram Apps, Binance HODLer Airdrops",banana-gun,64515155,156404628.0,23379.06081276929,48207.79593077128,0.15,81134310.0
OKX,"Artificial Intelligence (AI), BNB Chain Ecosystem, Ethereum Ecosystem, DePIN, AI Agents",netmind-token,64495356,204804459.0,,,N/A,1694782.0
OKX,"Smart Contract Platform, Layer 2 (L2), Made in USA",metal,64183669,64183669.0,,,N/A,671966.0
OKX,,ark,64178582,64744892.0,,,N/A,4346749.0
OKX,"BNB Chain Ecosystem, Meme, Binance Alpha Spotlight, Four.meme Ecosystem",test-3,64048394,64048394.0,,,N/A,49938335.0
OKX,"Artificial Intelligence (AI), Launchpad, Base Ecosystem, AI Applications, Clanker Ecosystem, Binance Alpha Spotlight",tokenbot-2,63397660,63397660.0,,,N/A,4997121.0
OKX,"Smart Contract Platform, Layer 1 (L1), Ethereum Ecosystem, Proof of Stake (PoS)",pundi-aifx,63200781,63200781.0,,,N/A,95501.0
OKX,"Gaming (GameFi), Ethereum Ecosystem, Telegram Apps, Gaming Platform",gamebuild,63000250,79308516.0,,,N/A,8661680.0
OKX,"Decentralized Finance (DeFi), Ethereum Ecosystem, Liquid Staking",usualx,62415854,62415854.0,,,N/A,187854.0
OKX,"SocialFi, Solana Ecosystem",access-protocol,62410583,135493364.0,,,N/A,887720.0
OKX,"Infrastructure, Smart Contract Platform",ardor,62032572,62032572.0,,,N/A,5378057.0
OKX,"Exchange-based Tokens, BNB Chain Ecosystem, Centralized Exchange (CEX) Token, Polygon Ecosystem, Ethereum Ecosystem",bit2me,61474155,62095106.0,,,N/A,27614.0
OKX,"Arbitrum Ecosystem, Ethereum Ecosystem, Base Ecosystem, Decentralized Science (DeSci)",axondao-governance-token,61278632,141685533.0,,,N/A,518804.0
OKX,"Smart Contract Platform, Osmosis Ecosystem, Alameda Research Portfolio, DragonFly Capital Portfolio, DeFiance Capital Portfolio, Privacy Blockchain, Outlier Ventures Portfolio",secret,61273478,64461903.0,,,N/A,4127403.0
OKX,"BNB Chain Ecosystem, Binance Megadrop, BTCfi",solv-protocol,61223648,346876194.0,,,N/A,40547476.0
