OKX,"Smart Contract Platform, Polkadot Ecosystem, Layer 1 (L1), Coinbase Ventures Portfolio, Binance Labs Portfolio",moonbeam,85950105,104665563.0,11255.238225592888,18356.992973868113,0.11,5280300.0
OKX,"NFT, Polygon Ecosystem",sathosi-airlines-token,85278041,407277402.0,,,N/A,4159.82
OKX,"Gaming (GameFi), Play To Earn, Ethereum Ecosystem, RPG, Alameda Research Portfolio, Circle Ventures Portfolio, OKX Ventures Portfolio, MMO",big-time,86185165,241826961.0,176569.31459411935,209755.36921220156,0.06,16264866.0
OKX,"Crypto-Backed Tokens, Ethereum Ecosystem",temple,85748669,85917598.0,,,N/A,14280.62
OKX,BNB Chain Ecosystem,metfi-2,86130705,201588073.0,,,N/A,419606.0
OKX,"Smart Contract Platform, Layer 2 (L2), eGirl Capital Portfolio, Paradigm Portfolio, Blast Ecosystem",blast,85191010,321471710.0,,,N/A,5750822.0
OKX,"Decentralized Exchange (DEX), Decentralized Finance (DeFi), Arbitrum Ecosystem, Ethereum Ecosystem",tokenlon,85766139,103233802.0,,,N/A,19526.15
OKX,"Business Services, Polygon Ecosystem, Ethereum Ecosystem",request-network,84846624,110238412.0,,,N/A,3442220.0
OKX,"Exchange-based Tokens, Centralized Exchange (CEX) Token, Ethereum Ecosystem",hashkey-ecopoints,84657603,638925304.0,,,N/A,2892159.0
OKX,"NFT, Solana Ecosystem, NFT Marketplace",tensor,84502843,252543380.0,143168.04681639693,165486.05260016053,0.04,13060140.0
OKX,"Smart Contract Platform, Gaming (GameFi), NFT, Layer 1 (L1), Play To Earn, Ethereum Ecosystem, Animoca Brands Portfolio, Gaming Blockchains, Pantera Capital Portfolio, OKX Ventures Portfolio",wax,84157357,90550727.0,7185.682282653077,13949.604711359947,0.04,5235302.0
OKX,"NFT, Ethereum Ecosystem",superrare,83100276,103827205.0,,,N/A,168395347.0
OKX,"Polygon Ecosystem, XRP Ledger Ecosystem",crypto-trading-fund,84143506,84143506.0,,,N/A,6844.21
OKX,"Solana Ecosystem, Polygon Ecosystem, DePIN, Pantera Capital Portfolio",geodnet,83485893,260406595.0,,,N/A,354443.0
OKX,Ethereum Ecosystem,dkargo,82882800,88424040.0,,,N/A,1097419.0
OKX,"Gaming (GameFi), NFT, BNB Chain Ecosystem, Metaverse, Collectibles, Polygon Ecosystem, Play To Earn, Harmony Ecosystem, Guild and Scholarship, Ethereum Ecosystem, Animoca Brands Portfolio, Base Ecosystem, DWF Labs Portfolio, Ronin Ecosystem, Gaming Governance Token, Andreessen Horowitz (a16z) Portfolio, Delphi Ventures Portfolio",yield-guild-games,82677193,201399475.0,33916.64092831959,76477.23635888714,0.1,12229499.0
OKX,"Artificial Intelligence (AI), BNB Chain Ecosystem, Ethereum Ecosystem, DragonFly Capital Portfolio, Binance Labs Portfolio, Delphi Ventures Portfolio, OKX Ventures Portfolio, Binance HODLer Airdrops, AI Agent Launchpad, Binance Alpha Spotlight, AI Framework",myshell,82425605,305280019.0,,,N/A,77267738.0
OKX,"Smart Contract Platform, Layer 1 (L1), Zero Knowledge (ZK)",ozone-chain,82570182,113819267.0,,,N/A,222171.0
OKX,"Meme, Ethereum Ecosystem, PolitiFi",constitutiondao,82828869,82828869.0,151621.43907641608,209698.92656010366,0.06,17530632.0
OKX,"Decentralized Finance (DeFi), BNB Chain Ecosystem, Arbitrum Ecosystem, Ethereum Ecosystem, Multicoin Capital Portfolio, Energi Ecosystem",dforce-token,81880384,81880384.0,,,N/A,15413005.0
OKX,"Decentralized Exchange (DEX), Decentralized Finance (DeFi), Yield Farming, Automated Market Maker (AMM), Solana Ecosystem, Coinbase Ventures Portfolio, DeFiance Capital Portfolio, Made in USA",orca,81754993,153453961.0,,,N/A,16936946.0
OKX,"Artificial Intelligence (AI), BNB Chain Ecosystem, Solana Ecosystem, Ethereum Ecosystem, AI Agents, Alameda Research Portfolio",delysium,81647090,155763375.0,,,N/A,1728419.0
OKX,"Internet of Things (IOT), BNB Chain Ecosystem, Ethereum Ecosystem, DePIN, DWF Labs Portfolio",mass-vehicle-ledger,81800033,86464910.0,,,N/A,620931.0
OKX,"Gaming (GameFi), Play To Earn, Guild and Scholarship, Ethereum Ecosystem, Animoca Brands Portfolio, Base Ecosystem, DWF Labs Portfolio, Ronin Ecosystem, Coinbase Ventures Portfolio, DeFiance Capital Portfolio, Pantera Capital Portfolio, Binance Labs Portfolio, MMO",zentry,81625513,119830069.0,52427.22316811881,72439.67399836992,0.16,6137942.0
OKX,"Smart Contract Platform, Privacy, Proof of Work (PoW), Made in USA",verge,81663020,81826370.0,,,N/A,4634631.0
OKX,"Smart Contract Platform, Cosmos Ecosystem, Modular Blockchain, Osmosis Ecosystem, Rollups-as-a-Service (RaaS)",dymension,81157873,322219832.0,,,N/A,6640731.0
OKX,"Berachain Ecosystem, Bridged USDT, Bridged-Tokens, Ink Ecosystem, Bridged Stablecoins",usdt0,80859292,80859292.0,,,N/A,285790.0
OKX,"Blast Ecosystem, Bridged WETH, Bridged-Tokens",l2-standard-bridged-weth-blast,80041264,80041264.0,,,N/A,131604.0
OKX,"Stablecoins, USD Stablecoin, Solana Ecosystem, Ethereum Ecosystem, Multicoin Capital Portfolio, Fiat-backed Stablecoin",paxos-standard,79278716,79278716.0,,,N/A,1724380.0
OKX,"Stablecoins, Decentralized Finance (DeFi), Lending/Borrowing Protocols, Ethereum Ecosystem",syrupusdc,79169947,79169947.0,,,N/A,116560.0
OKX,BNB Chain Ecosystem,bitdca,78823662,84662887.0,,,N/A,34875.0
OKX,"Smart Contract Platform, Layer 1 (L1), Osmosis Ecosystem, XRP Ledger Ecosystem",coreum,78417820,78417820.0,,,N/A,143858.0
OKX,"Smart Contract Platform, Proof of Stake (PoS)",stratis,78816863,86841437.0,,,N/A,588957.0
OKX,"Ethereum Ecosystem, Stablecoin Protocol",level-usd,78197006,78197006.0,,,N/A,842698.0
OKX,"Artificial Intelligence (AI), Smart Contract Platform, Decentralized Finance (DeFi), Analytics, NFT, BNB Chain Ecosystem, Launchpad, Ethereum Ecosystem, Telegram Apps, Discord Bots, ChainGPT Launchpad, Poolz Finance Launchpad, AI Agents, AI Applications, Binance Alpha Spotlight, AI Framework, DeFAI",chaingpt,78497156,97457467.0,,,N/A,21536665.0
OKX,"Software as a service, Polygon Ecosystem, Ethereum Ecosystem, Decentralized Identifier (DID), Pantera Capital Portfolio, Energi Ecosystem, Blockchain Capital Portfolio",civic,78359177,97704709.0,12045.997597022413,39392.50247836733,0.04,7426711.0
OKX,"Arbitrum Ecosystem, Bridge Governance Tokens, Base Ecosystem, Cross-chain Communication, OKX Ventures Portfolio",orbiter-finance,77215647,249082734.0,,,N/A,61901120.0
OKX,"Decentralized Finance (DeFi), Wallets, Ethereum Ecosystem, Pundi AIFX Omnilayer Ecosystem",pundi-x-2,77751704,77751704.0,,,N/A,5966025.0
OKX,"Artificial Intelligence (AI), Infrastructure, Ethereum Ecosystem, AI Framework, Made in USA",arcblock,78076672,147314476.0,,,N/A,1088469.0
OKX,"Exchange-based Tokens, Centralized Exchange (CEX) Token, Ethereum Ecosystem",bitmart-token,77363171,145743044.0,,,N/A,4179050.0
OKX,"Business Services, Decentralized Finance (DeFi), Oracle, Polygon Ecosystem, Gnosis Chain Ecosystem, Arbitrum Ecosystem, Ethereum Ecosystem, Optimism Ecosystem, Manta Network Ecosystem, Binance Labs Portfolio, Lisk Ecosystem, Made in USA",tellor,78075773,80347559.0,75991.92067301588,56211.95762087831,0.03,23056582.0
OKX,"Optimism Ecosystem, Bridged WBTC, Bridged-Tokens",optimism-bridged-wbtc-optimism,77201165,77201165.0,,,N/A,826581.0
OKX,"Stablecoins, USD Stablecoin, Osmosis Ecosystem, Fiat-backed Stablecoin",usdx,76793461,76793461.0,,,N/A,10258.46
OKX,"Exchange-based Tokens, Centralized Exchange (CEX) Token, Near Protocol Ecosystem, Harmony Ecosystem, Ethereum Ecosystem, Multicoin Capital Portfolio, Alameda Research Portfolio, Elastos Smart Contract Chain Ecosystem, Sequoia Capital Portfolio, Made in China",huobi-token,75934020,95771347.0,,,N/A,17073.47
OKX,"Decentralized Finance (DeFi), Liquid Staking Tokens, Ethereum Ecosystem, LSDFi, Liquid Staked ETH, Liquid Staking",origin-ether,75968055,75968055.0,,,N/A,39954.0
OKX,"Smart Contract Platform, Polkadot Ecosystem, Layer 1 (L1), DePIN, Outlier Ventures Portfolio",peaq-2,75920217,446809337.0,,,N/A,9287920.0
OKX,"BNB Chain Ecosystem, Solana Ecosystem, Polygon Ecosystem, Meme, Ethereum Ecosystem, Cronos Ecosystem, Dog-Themed, Elon Musk-Inspired, Fuse Ecosystem",dogelon-mars,75836238,137971876.0,12237.046957438533,9895.991020500669,0.14,3002909.0
OKX,"Artificial Intelligence (AI), Smart Contract Platform, Layer 1 (L1), Ethereum Ecosystem, Osmosis Ecosystem, AI Agents, AI Agent Launchpad",humans-ai,74700417,74700417.0,,,N/A,450333.0
OKX,"Base Ecosystem, Cybersecurity, Binance Labs Portfolio, OKX Ventures Portfolio, Binance Alpha Spotlight",goplus-security,75204142,414713476.0,,,N/A,52477106.0
OKX,"Sports, BNB Chain Ecosystem",pixer-eternity,74968793,348387095.0,,,N/A,722790.0
OKX,"Artificial Intelligence (AI), Decentralized Finance (DeFi), Ethereum Ecosystem, DePIN",pinlink,75821112,94776390.0,,,N/A,1907821.0
OKX,"Smart Contract Platform, Gaming (GameFi), Layer 1 (L1), Proof of Stake (PoS), Gaming Blockchains",oasys,75130383,194517992.0,966.3577888963803,4401.46093469678,0.15,542166.0
OKX,Smart Contract Platform,songbird,74540756,88566336.0,,,N/A,303685.0
OKX,"Meme, Dog-Themed, TON Ecosystem, TON Meme",dogs-2,76382430,81297216.0,48528.548474558265,101392.06371362913,0.07,23562710.0
OKX,"Smart Contract Platform, Wallets, Layer 2 (L2), Osmosis Ecosystem",islamic-coin,74279537,896059157.0,,,N/A,723251.0
OKX,"Optimism Ecosystem, Bridged WETH, Bridged-Tokens",l2-standard-bridged-weth-optimism,74504251,74504251.0,,,N/A,5244291.0
OKX,"Decentralized Finance (DeFi), Lending/Borrowing Protocols, Moonbeam Ecosystem, Base Ecosystem, Coinbase Ventures Portfolio, Made in USA",moonwell-artemis,74015174,112845546.0,,,N/A,10563195.0
OKX,"Meme, Ethereum Ecosystem, Mantle Ecosystem",puff-the-dragon,73607889,73607889.0,,,N/A,27185.0
OKX,"Gaming (GameFi), Play To Earn, TON Ecosystem, Tap to Earn, Arcade Games",watcoin-2,73186788,81250519.0,,,N/A,897284.0
OKX,Retail,milk-alliance,73197683,163661091.0,,,N/A,2731287.0
OKX,"Decentralized Finance (DeFi), Solana Ecosystem, Real World Assets (RWA), Payment Solutions, DePIN, Coinbase Ventures Portfolio, Alameda Research Portfolio, Circle Ventures Portfolio, OKX Ventures Portfolio, RWA Protocol, Made in USA",zebec-network,73009843,98530303.0,15106.162741514863,9548.199437014016,0.13,39988754.0
OKX,"Entertainment, Gaming (GameFi), NFT, Axie Infinity Ecosystem, Play To Earn, Ethereum Ecosystem, Ronin Ecosystem, Gaming Utility Token",smooth-love-potion,72663910,72663538.0,11169.276708732788,23406.680395795272,0.17,8245221.0
OKX,"Decentralized Finance (DeFi), Ethereum Ecosystem, Binance Alpha Spotlight",avalon-2,72044945,444036636.0,,,N/A,24342636.0
OKX,"Ethereum Ecosystem, DePIN",dent,72414071,75703414.0,,,N/A,5229440.0
OKX,"Decentralized Finance (DeFi), Oracle, Ethereum Ecosystem, DWF Labs Portfolio, Pantera Capital Portfolio",api3,72369174,90313571.0,20255.571402355257,25563.513477563738,0.05,13883832.0
OKX,"Smart Contract Platform, Gaming (GameFi), NFT, Binance Launchpool, Arbitrum Ecosystem, Layer 3 (L3), XAI Ecosystem, Gaming Blockchains, Outlier Ventures Portfolio",xai-blockchain,72435434,106748330.0,,,N/A,26090841.0
OKX,"Decentralized Exchange (DEX), Decentralized Finance (DeFi), Yield Farming, Automated Market Maker (AMM), BNB Chain Ecosystem, Avalanche Ecosystem, Arbitrum Ecosystem, Mantle Ecosystem, DeFiance Capital Portfolio, Delphi Ventures Portfolio, Dex Aggregator",joe,72035421,92249871.0,28652.119053079714,16266.52793035927,0.16,5480688.0
OKX,"Decentralized Finance (DeFi), Lending/Borrowing Protocols, Solana Ecosystem, Binance Alpha Spotlight",kamino,71155684,527079137.0,,,N/A,7280610.0
OKX,"Artificial Intelligence (AI), Decentralized Finance (DeFi), Solana Ecosystem, Arbitrum Ecosystem, Metis Ecosystem, AI Agents, Sonic Ecosystem, IOTA EVM Ecosystem, AI Applications, DeFAI",heyanon,70977562,116893593.0,,,N/A,2944447.0
OKX,"Gaming (GameFi), NFT, Ethereum Ecosystem",undeads-games,71330600,248145930.0,,,N/A,425360.0
OKX,"Artificial Intelligence (AI), Cardano Ecosystem, Ethereum Ecosystem, AI Agents, Sora Ecosystem",singularitynet,71015824,107326346.0,,,N/A,34292.0
OKX,"Decentralized Finance (DeFi), Lending/Borrowing Protocols, Ethereum Ecosystem, Real World Assets (RWA), Coinbase Ventures Portfolio, Andreessen Horowitz (a16z) Portfolio, RWA Protocol, Made in USA",goldfinch,70939125,87747747.0,,,N/A,555277.0
OKX,"Decentralized Exchange (DEX), Exchange-based Tokens, Decentralized Finance (DeFi), BNB Chain Ecosystem, Binance Launchpool, Polygon Ecosystem, Near Protocol Ecosystem, Arbitrum Ecosystem, Ethereum Ecosystem, DWF Labs Portfolio, Coinbase Ventures Portfolio, Alameda Research Portfolio, DeFiance Capital Portfolio, Pantera Capital Portfolio, Aurora Ecosystem, Energi Ecosystem, Binance Labs Portfolio, Galaxy Digital Portfolio",dodo,70793145,70793145.0,,,N/A,4045946.0
OKX,"Decentralized Finance (DeFi), Lending/Borrowing Protocols, Arbitrum Ecosystem, Ethereum Ecosystem, Alameda Research Portfolio, Pantera Capital Portfolio",liquity,70994278,72954820.0,11936.36555851205,26804.465713067064,0.1,11819941.0
OKX,"Stablecoins, USD Stablecoin, Seigniorage, Alleged SEC Securities, Osmosis Ecosystem, Stablecoin Protocol, DeFiance Capital Portfolio, Terra Classic Ecosystem, Binance Labs Portfolio, Delphi Ventures Portfolio, Galaxy Digital Portfolio, Fiat-backed Stablecoin",terrausd,70392292,99729235.0,43325.370998910694,62986.167204160985,0.16,5165189.0
OKX,"Stablecoins, Decentralized Finance (DeFi), USD Stablecoin, BNB Chain Ecosystem, Polygon Ecosystem, Gnosis Chain Ecosystem, Arbitrum Ecosystem, Ethereum Ecosystem, Optimism Ecosystem, Base Ecosystem, Crypto-backed Stablecoin, Fiat-backed Stablecoin",crvusd,70258297,70258297.0,,,N/A,4219826.0
OKX,"Gaming (GameFi), NFT, Collectibles, Play To Earn, Ethereum Ecosystem, Base Ecosystem, Energi Ecosystem",ecomi,69995476,80310893.0,3999.663223733287,6913.622782369271,0.08,2147603.0
OKX,"Artificial Intelligence (AI), Ethereum Ecosystem",0x0-ai-ai-smart-contract,69851285,69851285.0,,,N/A,129481.0
OKX,"NFT, BNB Chain Ecosystem, Solana Ecosystem, Meme, Ethereum Ecosystem, Base Ecosystem, Hybrid Token Standards, Wojak-Themed",non-playable-coin,69002907,69002907.0,,,N/A,5396309.0
OKX,"Decentralized Finance (DeFi), Ethereum Ecosystem",elixir-finance,68920454,431672354.0,,,N/A,46862646.0
OKX,"Tokenized Assets, Polygon Ecosystem, Arbitrum Ecosystem, Ethereum Ecosystem, Real World Assets (RWA), Starknet Ecosystem, Tokenized Treasury Bills (T-Bills)",spiko-us-t-bills-money-market-fund,69588146,69588146.0,,,N/A,0.0
OKX,"Artificial Intelligence (AI), Business Services, Decentralized Finance (DeFi), Ethereum Ecosystem, Paradigm Portfolio, DragonFly Capital Portfolio, Energi Ecosystem",numeraire,69449650,92994565.0,5842.610219415869,18693.573083023624,0.11,6327317.0
OKX,"Lending/Borrowing Protocols, Solana Ecosystem, FTX Holdings, Coinbase Ventures Portfolio, Alameda Research Portfolio, DragonFly Capital Portfolio",solend,69360419,137087973.0,,,N/A,1537.62
OKX,"Solana Ecosystem, Restaking, Liquid Restaking Tokens, Liquid Restaked SOL",renzo-restaked-sol,68526848,68526848.0,,,N/A,528965.0
OKX,"Smart Contract Platform, Ethereum Ecosystem, Layer 2 (L2), Zero Knowledge (ZK), Rollup, OKX Ventures Portfolio",taiko,68542069,648179776.0,,,N/A,13169346.0
OKX,"Stablecoins, Decentralized Finance (DeFi), USD Stablecoin, BNB Chain Ecosystem, Avalanche Ecosystem, Arbitrum Ecosystem, Liquid Staking Tokens, Ethereum Ecosystem, Optimism Ecosystem, Fiat-backed Stablecoin",staked-frax,68200502,68200502.0,,,N/A,34.84
OKX,"Artificial Intelligence (AI), Solana Ecosystem, DePIN",nosana,67765682,81253815.0,,,N/A,513900.0
OKX,"Decentralized Finance (DeFi), Ethereum Ecosystem, Restaking",kelp-gain,57918166,57918166.0,,,N/A,7007.74
OKX,"Decentralized Exchange (DEX), Decentralized Finance (DeFi), Sui Ecosystem, Animoca Brands Portfolio, OKX Ventures Portfolio, Dex Aggregator",cetus-protocol,67781299,99264927.0,47621.31306876966,49265.503840792684,0.03,10706893.0
OKX,"Smart Contract Platform, Layer 1 (L1), Proof of Work (PoW), Privacy Blockchain",ergo,67471268,82363792.0,,,N/A,78059.0
OKX,"Solana Ecosystem, Wallets, Base Ecosystem, TON Ecosystem",bitget-wallet-token,67182897,470072637.0,,,N/A,3631.06
OKX,"Artificial Intelligence (AI), Marketing, Analytics, BNB Chain Ecosystem, Ethereum Ecosystem, Animoca Brands Portfolio, Base Ecosystem, AI Agents, Binance Alpha Spotlight",cookie,68021405,151400267.0,,,N/A,17948600.0
OKX,"Smart Contract Platform, Binance Launchpool, Layer 2 (L2), Scroll Ecosystem",scroll,66690134,351000705.0,69020.96167322903,80558.921994224,0.11,14697478.0
OKX,SocialFi,steem,66494472,66555688.0,,,N/A,10167776.0
OKX,Ethereum Ecosystem,saasgo,66171229,82714036.0,,,N/A,218096.0
OKX,E-commerce,pay-coin,65516979,121733942.0,,,N/A,5011709.0
OKX,"Smart Contract Platform, Layer 1 (L1), Ethereum Ecosystem, Proof of Stake (PoS)",pundi-aifx,64009357,64009357.0,,,N/A,75176.0
OKX,"Healthcare, Osmosis Ecosystem",medibloc,64950516,70350405.0,,,N/A,306593.0
OKX,"Decentralized Finance (DeFi), BNB Chain Ecosystem, Solana Ecosystem, Wallets, Polygon Ecosystem, Ethereum Ecosystem, Binance Launchpad, DWF Labs Portfolio, Multicoin Capital Portfolio, Alameda Research Portfolio, Viction Ecosystem, Binance Labs Portfolio",coin98,64989316,72143563.0,,,N/A,16569355.0
OKX,"Polkadot Ecosystem, Real World Assets (RWA), Coinbase Ventures Portfolio, Circle Ventures Portfolio, Galaxy Digital Portfolio, RWA Protocol",centrifuge,64848713,71054356.0,2360.998464412663,3984.483635461379,0.08,1084877.0
OKX,"Stablecoins, USD Stablecoin, Fiat-backed Stablecoin",falcon-finance,64665566,64665566.0,,,N/A,58461.0
OKX,Ethereum Ecosystem,devve,64414875,88451648.0,,,N/A,882926.0
OKX,"Artificial Intelligence (AI), BNB Chain Ecosystem, Ethereum Ecosystem, DePIN, AI Agents",netmind-token,64077030,203669273.0,,,N/A,1791615.0
OKX,"Smart Contract Platform, Layer 1 (L1), DWF Labs Portfolio, Radix Ecosystem",radix,64313760,78750564.0,,,N/A,1732060.0
OKX,"Artificial Intelligence (AI), Launchpad, Base Ecosystem, AI Applications, Clanker Ecosystem, Binance Alpha Spotlight",tokenbot-2,64212472,64212472.0,,,N/A,5019116.0
OKX,"Infrastructure, Smart Contract Platform, BNB Chain Ecosystem, Avalanche Ecosystem, Polygon Ecosystem, Arbitrum Ecosystem, Ethereum Ecosystem, Optimism Ecosystem, Layer 2 (L2), Base Ecosystem, Binance Launchpad, Modular Blockchain, Layer 3 (L3), Rollup, Proof of Stake (PoS), Appchains, Binance Labs Portfolio",cartesi,63703736,74122936.0,,,N/A,7515656.0
OKX,,ark,63215556,63769160.0,,,N/A,5790289.0
OKX,"Decentralized Finance (DeFi), Lending/Borrowing Protocols, Ethereum Ecosystem, Real World Assets (RWA), Alameda Research Portfolio, Circle Ventures Portfolio, RWA Protocol",maple,63205562,160421062.0,,,N/A,2496513.0
OKX,"BNB Chain Ecosystem, Binance Megadrop, BTCfi",solv-protocol,62271931,352815472.0,,,N/A,44330397.0
OKX,"Smart Contract Platform, Layer 2 (L2), Made in USA",metal,62346991,62346991.0,,,N/A,390667.0
OKX,"Artificial Intelligence (AI), Infrastructure, Gaming (GameFi), NFT, Solana Ecosystem, Arbitrum Ecosystem, Impossible Finance Launchpad, Ethereum Ecosystem, Animoca Brands Portfolio, Base Ecosystem",carv,61741996,308570866.0,,,N/A,5322956.0
OKX,"Exchange-based Tokens, BNB Chain Ecosystem, Centralized Exchange (CEX) Token, Polygon Ecosystem, Ethereum Ecosystem",bit2me,61071323,61688205.0,,,N/A,54196.0
OKX,"Infrastructure, Smart Contract Platform",ardor,61509512,61509512.0,,,N/A,5195558.0
OKX,"Artificial Intelligence (AI), Solana Ecosystem, Polygon Ecosystem, Gnosis Chain Ecosystem, Arbitrum Ecosystem, Celo Ecosystem, Ethereum Ecosystem, Optimism Ecosystem, Base Ecosystem, AI Agents, Mode Ecosystem, AI Agent Launchpad, Binance Alpha Spotlight, AI Framework, DeFAI",autonolas,60854990,178003175.0,,,N/A,281138.0
OKX,"SocialFi, Solana Ecosystem",access-protocol,60660059,131695460.0,,,N/A,808741.0
OKX,"Decentralized Finance (DeFi), Ethereum Ecosystem, Liquid Staking",usualx,62009004,62114644.0,,,N/A,207474.0
OKX,"Smart Contract Platform, Osmosis Ecosystem, Alameda Research Portfolio, DragonFly Capital Portfolio, DeFiance Capital Portfolio, Privacy Blockchain, Outlier Ventures Portfolio",secret,60794576,63958240.0,,,N/A,3783830.0
OKX,"Stablecoins, USD Stablecoin, Ethereum Ecosystem, Fiat-backed Stablecoin",binance-usd,60429999,60429999.0,,,N/A,3268.55
