OKX,"Decentralized Finance (DeFi), Arbitrum Ecosystem, Ethereum Ecosystem, Real World Assets (RWA), Base Ecosystem, Coinbase Ventures Portfolio, Energi Ecosystem, Made in USA",reserve-rights-token,323349077,578444686.0,25598.283237507007,72716.09350818767,0.02,19757739.0
OKX,"Stablecoins, USD Stablecoin, BNB Chain Ecosystem, Avalanche Ecosystem, Polygon Ecosystem, Optimism Ecosystem, Fiat-backed Stablecoin, Binance-Peg Tokens",binance-peg-busd,324341205,324341205.0,,,N/A,8418071.0
OKX,"Smart Contract Platform, Zero Knowledge (ZK), FTX Holdings, Paradigm Portfolio, Coinbase Ventures Portfolio, Multicoin Capital Portfolio, Proof of Stake (PoS), Pantera Capital Portfolio, Circle Ventures Portfolio, Privacy Blockchain, Polychain Capital Portfolio, Made in USA, Coinbase 50 Index",mina-protocol,322567815,322568386.0,39583.04409263053,62949.163187749444,0.04,13532835.0
OKX,"Smart Contract Platform, Layer 1 (L1), MEV Protection, Proof of Work (PoW), Privacy Blockchain",verus-coin,311299534,311301596.0,,,N/A,5520.94
OKX,"Artificial Intelligence (AI), Smart Contract Platform, Storage, BNB Chain Ecosystem, Layer 1 (L1), Ethereum Ecosystem, DePIN, DWF Labs Portfolio, Osmosis Ecosystem, GMCI DePIN Index, GMCI Index",aioz-network,312774627,317052414.0,,,N/A,8292714.0
OKX,"Decentralized Finance (DeFi), Lending/Borrowing Protocols, Ethereum Ecosystem, Base Ecosystem, Coinbase Ventures Portfolio, Pantera Capital Portfolio, Morpho Ecosystem, Binance Alpha Spotlight",morpho,310675915,1316154483.0,322973.2721042714,418826.0185612333,0.04,9654230.0
OKX,"Yield Aggregator, Ethereum Ecosystem, Binance Labs Portfolio, Polychain Capital Portfolio",stakestone-berachain-vault-token,308834159,308834159.0,,,N/A,1224174.0
OKX,"Smart Contract Platform, Layer 1 (L1), Ethereum Ecosystem, Real World Assets (RWA), RWA Protocol, Made in USA",plume,301180012,1505900058.0,,,N/A,22037779.0
OKX,"Decentralized Finance (DeFi), Tron Ecosystem",just,299021403,299021403.0,18299.446171322605,23187.26032577584,0.03,19710053.0
OKX,"Solana Ecosystem, Arbitrum Ecosystem, Impossible Finance Launchpad, Ethereum Ecosystem, DePIN, Animoca Brands Portfolio",aethir,294703845,1566914279.0,196400.61039505777,246708.14208569456,0.11,28422350.0
OKX,"Artificial Intelligence (AI), Ethereum Ecosystem, DePIN, Energi Ecosystem, GMCI DePIN Index, GMCI Index",golem,291916388,291916388.0,15483.651451063211,26049.885946778064,0.07,15748941.0
OKX,"Decentralized Exchange (DEX), Exchange-based Tokens, Decentralized Finance (DeFi), Yield Farming, Derivatives, Synthetic Issuer, Avalanche Ecosystem, Polygon Ecosystem, Near Protocol Ecosystem, Fantom Ecosystem, Harmony Ecosystem, Ethereum Ecosystem, Optimism Ecosystem, Base Ecosystem, DWF Labs Portfolio, Paradigm Portfolio, Coinbase Ventures Portfolio, Index Coop Defi Index, Energi Ecosystem, Huobi ECO Chain Ecosystem, GMCI DeFi Index, Synthetic, Index Coop Index, GMCI Index, Coinbase 50 Index",havven,285554977,285911332.0,38716.969251917595,45445.187940733915,0.05,17458610.0
OKX,"Infrastructure, Ethereum Ecosystem, Data Availability, Restaking, Polychain Capital Portfolio, Made in USA",eigenlayer,285353081,1999920361.0,183233.34463744194,310580.9179778891,0.09,26487957.0
OKX,"Polygon Ecosystem, Bridged WETH, Bridged-Tokens",polygon-pos-bridged-weth-polygon-pos,283787113,283787113.0,,,N/A,9116997.0
OKX,"Crypto-Backed Tokens, Wrapped-Tokens, Polygon Ecosystem, Arbitrum Ecosystem, Liquid Staking Tokens, Ethereum Ecosystem, Optimism Ecosystem, Base Ecosystem, Liquid Staked ETH, Liquid Staking",coinbase-wrapped-staked-eth,283586449,788714124.0,,,N/A,4194800.0
OKX,"Smart Contract Platform, Privacy, Masternodes, Alleged SEC Securities, Proof of Stake (PoS), Proof of Work (PoW), Made in USA",dash,280844926,280845527.0,,,N/A,33961188.0
OKX,"Decentralized Exchange (DEX), Exchange-based Tokens, Decentralized Finance (DeFi), Automated Market Maker (AMM), BNB Chain Ecosystem, Avalanche Ecosystem, Polygon Ecosystem, Near Protocol Ecosystem, Harmony Ecosystem, Ethereum Ecosystem, FTX Holdings, Alameda Research Portfolio, DragonFly Capital Portfolio, Pantera Capital Portfolio, Energi Ecosystem, Binance Labs Portfolio, GMCI DeFi Index, Galaxy Digital Portfolio, Blockchain Capital Portfolio, Dex Aggregator, GMCI Index, Coinbase 50 Index",1inch,278358661,303149280.0,31456.65359041989,73895.66522165465,0.05,16830878.0
OKX,"Smart Contract Platform, Polkadot Ecosystem, Proof of Stake (PoS), Pantera Capital Portfolio, Made in USA, Coinbase 50 Index",kusama,272527819,272528315.0,16337.149047814284,32503.084333904888,0.12,8135926.0
OKX,"BNB Chain Ecosystem, Wallets, Ethereum Ecosystem, Animoca Brands Portfolio, Binance Launchpad, Energi Ecosystem, Binance Labs Portfolio",safepal,272309206,272309206.0,,,N/A,7741798.0
OKX,"Liquid Staking Tokens, Ethereum Ecosystem, Liquid Staking",stader-ethx,272861590,272861590.0,,,N/A,151038.0
OKX,"Polygon Ecosystem, Bridged WBTC, Bridged-Tokens",polygon-bridged-wbtc-polygon-pos,270437987,270437987.0,,,N/A,4085373.0
OKX,"Smart Contract Platform, Ethereum Ecosystem, Real World Assets (RWA), DWF Labs Portfolio, Proof of Stake (PoS)",creditcoin-2,267587859,369582830.0,56922.85996736341,62172.73458667904,0.03,13641182.0
OKX,"Solana Ecosystem, Arbitrum Ecosystem, Ethereum Ecosystem, Interoperability, Base Ecosystem, Multicoin Capital Portfolio, Cross-chain Communication, Made in USA",wormhole,267224926,919925236.0,158537.3467543276,191048.33587607674,0.11,32345589.0
OKX,"Smart Contract Platform, Layer 2 (L2), Zero Knowledge (ZK), ZkSync Ecosystem, Consensys Portfolio, Blockchain Capital Portfolio, OKX Ventures Portfolio",zksync,265314738,1516084215.0,53245.43962559392,87921.20532195838,0.03,45566389.0
OKX,"Smart Contract Platform, DePIN, Proof of Stake (PoS), Made in USA",theta-fuel,262886530,262886530.0,,,N/A,2032873.0
OKX,"Stablecoins, USD Stablecoin, Ethereum Ecosystem, Fiat-backed Stablecoin",elixir-deusd,260514672,260514672.0,,,N/A,100802913.0
OKX,"Exchange-based Tokens, Centralized Exchange (CEX) Token, Ethereum Ecosystem, Morph L2 Ecosystem",mx-token,259638413,1144029841.0,,,N/A,12573708.0
OKX,"Meme, Cardano Ecosystem",snek,257484357,260770235.0,,,N/A,1297316.0
OKX,"Crypto-Backed Tokens, Decentralized Finance (DeFi), cToken, Ethereum Ecosystem",compound-wrapped-btc,258541753,258541753.0,,,N/A,0.0
OKX,"Smart Contract Platform, Gaming (GameFi), NFT, Layer 1 (L1), Play To Earn, Gaming Blockchains, WEMIX Ecosystem",wemix-token,256785516,330186979.0,,,N/A,3684637.0
OKX,"Decentralized Finance (DeFi), Ethereum Ecosystem, Restaking, Liquid Restaking Tokens, Liquid Staking",ether-fi-staked-btc,258438292,258438292.0,,,N/A,279952.0
OKX,"BRC-20, Bitcoin Ecosystem, Inscriptions",sats-ordinals,257177026,257177026.0,195873.9009095904,324089.98527506273,0.08,5587809.0
OKX,"Arbitrum Ecosystem, Liquid Staking Tokens, Ethereum Ecosystem, Liquid Staking",sweth,254540279,254547376.0,,,N/A,106327.0
OKX,"Stablecoins, Tokenized Assets, Tokenized Gold, BNB Chain Ecosystem, Real World Assets (RWA), Tokenized Commodities, Commodity-backed Stablecoin",quorium,250763645,250763645.0,,,N/A,82019.0
OKX,"Infrastructure, Decentralized Finance (DeFi), Sui Ecosystem",deep,251655210,1006620840.0,,,N/A,14927420.0
OKX,"Decentralized Finance (DeFi), BNB Chain Ecosystem, Polygon Ecosystem, Fantom Ecosystem, Arbitrum Ecosystem, Moonbeam Ecosystem, Liquid Staking Tokens, Ethereum Ecosystem, Optimism Ecosystem, Polygon zkEVM Ecosystem, Liquid Staking, Made in USA",frax-ether,250375174,250375174.0,,,N/A,716046.0
OKX,"Smart Contract Platform, BNB Chain Ecosystem, Avalanche Ecosystem, Polygon Ecosystem, Arbitrum Ecosystem, Ethereum Ecosystem, Optimism Ecosystem, Base Ecosystem, Multicoin Capital Portfolio, Layer 0 (L0), Cross-chain Communication, Circle Ventures Portfolio, Sequoia Capital Portfolio, OKX Ventures Portfolio",layerzero,254979726,2293955726.0,559169.6429942573,1020049.7769240731,0.04,214634948.0
OKX,"Decentralized Finance (DeFi), Solana Ecosystem, LSDFi, Restaking, Stablecoin Protocol, Binance Labs Portfolio, Binance HODLer Airdrops, Polychain Capital Portfolio",solayer,244149217,1162615320.0,,,N/A,74715358.0
OKX,"Stablecoins, USD Stablecoin, BNB Chain Ecosystem, Avalanche Ecosystem, Near Protocol Ecosystem, Arbitrum Ecosystem, Ethereum Ecosystem, Tron Ecosystem, BitTorrent Ecosystem, Algorithmic Stablecoin, Fiat-backed Stablecoin",usdd,243353398,243366371.0,,,N/A,3222257.0
OKX,"Gaming (GameFi), Binance Launchpool, Meme, Play To Earn, TON Ecosystem, TON Meme, Tap to Earn",notcoin,250505535,250505535.0,90260.23127921367,112869.12456474181,0.08,191624481.0
OKX,"Smart Contract Platform, BNB Chain Ecosystem, GMCI Layer 1 Index, GMCI Index, Made in China",zilliqa,242240095,250660907.0,71453.37185550715,128454.93337041336,0.08,9624114.0
OKX,"Decentralized Finance (DeFi), Solana Ecosystem, Liquid Staking Tokens, Liquid Staked SOL, Liquid Staking",bybit-staked-sol,241779260,241779260.0,,,N/A,2731956.0
OKX,"Bridged USDC, Sonic Ecosystem, Bridged-Tokens, Bridged Stablecoins",sonic-bridged-usdc-e-sonic,241148081,241468799.0,,,N/A,26777035.0
OKX,"Smart Contract Platform, Polkadot Ecosystem, Layer 1 (L1), Layer 2 (L2), Alameda Research Portfolio, Binance Labs Portfolio, OKX Ventures Portfolio",astar,240632502,264574898.0,125964.44067605991,197825.7217259853,0.09,3475454.0
OKX,"NFT, Ethereum Ecosystem, NFT Marketplace, FTX Holdings, NFTFi, eGirl Capital Portfolio, Paradigm Portfolio, GMCI DeFi Index, GMCI Index, Made in USA, Coinbase 50 Index",blur,239689439,320023077.0,59586.02358224066,88672.52469624169,0.09,27996394.0
OKX,"Infrastructure, Wallets, Gnosis Chain Ecosystem, Ethereum Ecosystem",safe,233603483,421943959.0,105261.16203100192,110701.4151212011,0.05,13240381.0
OKX,"Decentralized Finance (DeFi), Liquid Staking Tokens, Base Ecosystem, Liquid Staked ETH, Liquid Staking",super-oeth,233574846,233574846.0,,,N/A,55290.0
OKX,"Smart Contract Platform, Proof of Stake (PoS), Made in China",qtum,230233882,235164452.0,65112.71771501927,82947.93741300829,0.09,16336902.0
OKX,"Smart Contract Platform, Interoperability, Layer 2 (L2), Rollup, Multicoin Capital Portfolio, Proof of Work (PoW), DragonFly Capital Portfolio, Sequoia Capital Portfolio, Blockchain Capital Portfolio, Polychain Capital Portfolio, Made in China",nervos-network,228284280,231888815.0,,,N/A,11010575.0
OKX,"Decentralized Exchange (DEX), Exchange-based Tokens, Decentralized Finance (DeFi), Derivatives, Perpetuals, Ethereum Ecosystem, Paradigm Portfolio",dydx,227346447,227346447.0,,,N/A,11487917.0
OKX,"Solana Ecosystem, Avalanche Ecosystem, Polygon Ecosystem, Near Protocol Ecosystem, Harmony Ecosystem, Ethereum Ecosystem, Pantera Capital Portfolio, Energi Ecosystem, Made in USA",basic-attention-token,224054260,224703150.0,11666.300167949166,20639.153591136874,0.07,15673982.0
OKX,"Analytics, Avalanche Ecosystem, Meme, Cat-Themed, Made in USA",ket,220738721,220738721.0,,,N/A,5557084.0
OKX,"Layer 1 (L1), VeChain Ecosystem",vethor-token,219023339,219122482.0,,,N/A,4093270.0
OKX,"BNB Chain Ecosystem, Polygon Ecosystem, Ethereum Ecosystem, Animoca Brands Portfolio, DWF Labs Portfolio, Alameda Research Portfolio, Energi Ecosystem, Binance Labs Portfolio",mask-network,217938247,217938247.0,93513.01423417844,137057.645361933,0.05,20728539.0
OKX,"Artificial Intelligence (AI), Polkadot Ecosystem, Metaverse, Ethereum Ecosystem, Interoperability, Real World Assets (RWA), DePIN, Decentralized Science (DeSci), AI Agents",origintrail,215872919,216177716.0,,,N/A,5009673.0
OKX,"Decentralized Exchange (DEX), Decentralized Finance (DeFi), Avalanche Ecosystem, Harmony Ecosystem, Ethereum Ecosystem, Coinbase Ventures Portfolio, Pantera Capital Portfolio, Energi Ecosystem, GMCI DeFi Index, Blockchain Capital Portfolio, GMCI Index, Made in USA",0x,214800285,253183823.0,23110.53294205795,35275.32506376132,0.16,23863222.0
OKX,"Artificial Intelligence (AI), Solana Ecosystem, Meme, Solana Meme, AI Meme, AI Agents, Binance Alpha Spotlight, AI Framework, Made in USA",ai16z,217688175,217688175.0,,,N/A,43842138.0
OKX,"Decentralized Exchange (DEX), Decentralized Finance (DeFi), Automated Market Maker (AMM), Cosmos Ecosystem, Osmosis Ecosystem, Paradigm Portfolio, Evmos Ecosystem, Secret Ecosystem, GMCI DeFi Index, GMCI Index",osmosis,214287503,298533716.0,,,N/A,13909369.0
OKX,"Smart Contract Platform, BNB Chain Ecosystem, Layer 1 (L1), Proof of Stake (PoS), Pantera Capital Portfolio, Andreessen Horowitz (a16z) Portfolio, Binance Labs Portfolio, Blockchain Capital Portfolio, Privacy Blockchain, Polychain Capital Portfolio, Coinbase 50 Index",oasis-network,215048396,319546683.0,,,N/A,9062664.0
OKX,"Smart Contract Platform, Gaming (GameFi), Ethereum Ecosystem, Base Ecosystem, Card Games, Paradigm Portfolio, Gaming Blockchains, Gaming Utility Token",echelon-prime,211230958,417062124.0,,,N/A,4231425.0
OKX,"Decentralized Finance (DeFi), Aptos Ecosystem",abtc,211332509,211332509.0,,,N/A,116967.0
OKX,"Artificial Intelligence (AI), Harmony Ecosystem, Arbitrum Ecosystem, Ethereum Ecosystem, DePIN, Coinbase Ventures Portfolio, Multicoin Capital Portfolio, Pantera Capital Portfolio, GMCI DePIN Index, GMCI Index, Coinbase 50 Index",livepeer,211434511,211434511.0,57095.451604764436,91266.67338505242,0.07,15407920.0
OKX,"Liquid Staking Tokens, Ethereum Ecosystem, Base Ecosystem, Liquid Staked ETH, Liquid Staking",liquid-staked-ethereum,206900621,206900621.0,,,N/A,72843.0
OKX,"Decentralized Exchange (DEX), BNB Chain Ecosystem, Solana Ecosystem, Ethereum Ecosystem, Real World Assets (RWA), Base Ecosystem, RWA Protocol",chex-token,205973005,205973005.0,,,N/A,1317510.0
OKX,"Gaming (GameFi), BNB Chain Ecosystem, Solana Ecosystem, Meme, Ethereum Ecosystem, Dog-Themed, Solana Meme, Gaming Utility Token",baby-doge-coin,206510189,524187159.0,52170.45914492564,66604.71328789888,0.08,10791622.0
OKX,"Gaming (GameFi), NFT, Collectibles, Polygon Ecosystem, Ethereum Ecosystem, Animoca Brands Portfolio, Gaming Blockchains, Made in USA",superfarm,206397095,456938353.0,,,N/A,17644290.0
OKX,"Stablecoins, USD Stablecoin, Arbitrum Ecosystem, Ethereum Ecosystem, Base Ecosystem, Crypto-backed Stablecoin, Fiat-backed Stablecoin",gho,205389984,205389984.0,,,N/A,5691330.0
OKX,"Decentralized Finance (DeFi), Yield Farming, BNB Chain Ecosystem, Avalanche Ecosystem, Polygon Ecosystem, Fantom Ecosystem, Arbitrum Ecosystem, Ethereum Ecosystem, Optimism Ecosystem, Linea Ecosystem, Bridge Governance Tokens, Base Ecosystem, FTX Holdings",stargate-finance,202640104,208592344.0,,,N/A,7289210.0
OKX,"BNB Chain Ecosystem, Meme",cheems-token,202592765,202592765.0,,,N/A,5781824.0
OKX,"Smart Contract Platform, Storage, Harmony Ecosystem, Ethereum Ecosystem, DePIN, Energi Ecosystem, Sora Ecosystem, GMCI DePIN Index, GMCI Index",holotoken,202488307,202488307.0,,,N/A,9818657.0
OKX,"Stablecoins, Ethereum Ecosystem",usda-2,201363399,201363399.0,,,N/A,661172.0
OKX,"BNB Chain Ecosystem, Meme, AI Meme",ai-companions,242159284,242159284.0,,,N/A,2501698.0
OKX,"Solana Ecosystem, Meme, Dog-Themed, Solana Meme, Bitcoin Ecosystem, Runes",dog-go-to-the-moon-rune,201239043,201239043.0,,,N/A,5893900.0
OKX,"Oracle, Ethereum Ecosystem",redstone-oracles,211929820,756892213.0,,,N/A,203395162.0
OKX,"Solana Ecosystem, Meme, Solana Meme, Pump.fun Ecosystem, Zoo-Themed, Memorial Themed",peanut-the-squirrel,199138113,199138113.0,14609.83014742938,33520.289861866906,0.25,317616234.0
OKX,"Smart Contract Platform, Layer 1 (L1), DePIN, Andreessen Horowitz (a16z) Portfolio, Made in USA",chia,196958358,447426002.0,39529.81819452701,61835.45888779467,0.15,8919831.0
OKX,"Decentralized Finance (DeFi), Polygon Ecosystem, Ethereum Ecosystem, Coinbase Ventures Portfolio, Pantera Capital Portfolio",instadapp,196533588,498350708.0,,,N/A,967294.0
OKX,"Artificial Intelligence (AI), Exchange-based Tokens, Analytics, Derivatives, Perpetuals, Centralized Exchange (CEX) Token, Ethereum Ecosystem, Binance Launchpad, Coinbase Ventures Portfolio, Binance Labs Portfolio, Made in USA",arkham,196251523,530846655.0,146857.53887480215,175359.23891052566,0.02,49939798.0
OKX,"Smart Contract Platform, Layer 1 (L1), Celo Ecosystem, DWF Labs Portfolio, Coinbase Ventures Portfolio, Proof of Stake (PoS), Andreessen Horowitz (a16z) Portfolio, Optimism Superchain Ecosystem, Outlier Ventures Portfolio, Made in USA",celo,194588903,344241837.0,52104.72811630244,74441.40017937649,0.06,12381112.0
OKX,"Smart Contract Platform, Privacy, Layer 1 (L1), Proof of Stake (PoS), Proof of Work (PoW), Blockchain Capital Portfolio, Made in USA",decred,192927711,192929998.0,,,N/A,1923586.0
OKX,"Infrastructure, Smart Contract Platform, Venom Ecosystem",venom,192922698,697534553.0,820.5630946751847,12313.419323032836,0.02,1099228.0
OKX,"Solana Ecosystem, BRC-20, Bitcoin Ecosystem, Inscriptions",ordinals,193037030,193037030.0,197209.10670761703,247036.8628585139,0.02,68300157.0
OKX,"Infrastructure, Smart Contract Platform, NEO Ecosystem",gas,190981189,190981189.0,22468.888987572846,29768.247822126108,0.07,4125003.0
OKX,"Solana Ecosystem, Meme, Solana Meme, Cat-Themed, Murad Picks",popcat,191797799,191797799.0,,,N/A,62925373.0
OKX,"Exchange-based Tokens, Ethereum Ecosystem",btse-token,187833701,231805457.0,,,N/A,3261646.0
OKX,"Gambling (GambleFi), Gaming (GameFi), Ethereum Ecosystem",rollbit-coin,186976608,186976608.0,,,N/A,660915.0
OKX,"Infrastructure, Smart Contract Platform, BNB Chain Ecosystem, Layer 1 (L1), Ethereum Ecosystem, GMCI Layer 1 Index, Aelf Ecosystem, GMCI Index",aelf,185916927,250615074.0,15359.227323680292,31649.91870557467,0.04,11543267.0
OKX,"Smart Contract Platform, Privacy, Proof of Work (PoW)",mimblewimblecoin,185415915,185415959.0,,,N/A,3247.33
OKX,"Crypto-Backed Tokens, Decentralized Finance (DeFi), Wrapped-Tokens, Ethereum Ecosystem",resolv-wstusr,184744046,165242830.0,,,N/A,162.11
OKX,"Meme, Cronos Ecosystem, AI Meme, Cronos zkEVM Ecosystem",agentfun-ai,184994576,184994576.0,,,N/A,3981.31
OKX,"Smart Contract Platform, Real World Assets (RWA), Proof of Work (PoW), Made in USA",ravencoin,185079885,185105456.0,16387.048663324684,35587.14097698214,0.08,7119447.0
OKX,"Smart Contract Platform, Storage, DePIN, Paradigm Portfolio, Proof of Work (PoW), DragonFly Capital Portfolio, Made in USA",siacoin,184363101,197038778.0,5650.1861796708345,6587.284886747733,0.09,14311322.0
OKX,"Gaming (GameFi), Ethereum Ecosystem, Decentralized Identifier (DID), Animoca Brands Portfolio, OKX Ventures Portfolio, Outlier Ventures Portfolio",mocaverse,183941451,855751190.0,,,N/A,17682085.0
OKX,"Solana Ecosystem, Meme, Solana Meme, AI Meme, Pump.fun Ecosystem",act-i-the-ai-prophecy,183271613,183271613.0,92087.40458504956,119809.1366801981,0.05,32424223.0
OKX,"Decentralized Finance (DeFi), BNB Chain Ecosystem, Polygon Ecosystem, Fantom Ecosystem, Arbitrum Ecosystem, Moonbeam Ecosystem, Liquid Staking Tokens, Ethereum Ecosystem, Optimism Ecosystem, Liquid Staked ETH, Liquid Staking",staked-frax-ether,182164708,182164708.0,,,N/A,31595.0
OKX,"Tourism, BNB Chain Ecosystem",trip,181268429,602179865.0,,,N/A,38955.0
OKX,"Solana Ecosystem, Ethereum Ecosystem, Energi Ecosystem",swissborg,180232454,180232454.0,,,N/A,8098891.0
OKX,"BNB Chain Ecosystem, Avalanche Ecosystem, Polygon Ecosystem, Fantom Ecosystem, Arbitrum Ecosystem, Ethereum Ecosystem, Optimism Ecosystem, Liquid Staking Governance Tokens, Linea Ecosystem, DePIN, Scroll Ecosystem, Rollups-as-a-Service (RaaS), Blast Ecosystem, Mode Ecosystem, Pantera Capital Portfolio, Polygon zkEVM Ecosystem, Binance Labs Portfolio, Liquid Staking, Made in USA",ankr,179357319,179357319.0,,,N/A,11731639.0
OKX,"Tokenized Real Estate, Tokenized Assets, Ethereum Ecosystem, Real World Assets (RWA), RWA Protocol",apf-coin,177500486,260618221.0,,,N/A,2924388.0
OKX,"Artificial Intelligence (AI), Smart Contract Platform, Layer 1 (L1), Paradigm Portfolio, Coinbase Ventures Portfolio, DeFiance Capital Portfolio, Polychain Capital Portfolio, Vana Ecosystem",vana,177464221,691419044.0,,,N/A,24173222.0
OKX,,nem,176923717,176923717.0,,,N/A,18839952.0
OKX,"Meme, Ethereum Ecosystem, Base Ecosystem, Cat-Themed, Murad Picks",mog-coin,176889270,176889270.0,,,N/A,11799023.0
OKX,"Gaming (GameFi), BNB Chain Ecosystem, Ethereum Ecosystem, TON Ecosystem",gmt-token,175351312,175351312.0,,,N/A,15195922.0
OKX,"Solana Ecosystem, Meme, Cat-Themed",meow,175633979,175633979.0,,,N/A,980652.0
OKX,"Avalanche Ecosystem, Liquid Staking Tokens, Liquid Staking",benqi-liquid-staked-avax,172442095,172442095.0,,,N/A,1259749.0
OKX,"Decentralized Finance (DeFi), Launchpad, Ethereum Ecosystem, DWF Labs Portfolio, Coinbase Ventures Portfolio, Pantera Capital Portfolio, Blockchain Capital Portfolio",auction,171127651,198409532.0,49784.0839991294,139092.29937948368,0.05,128240032.0
OKX,"Launchpad, Meme, Base Ecosystem, Cat-Themed, Base Meme",toshi,171423482,171423482.0,,,N/A,21090183.0
OKX,"Solana Ecosystem, Meme, Dog-Themed, Solana Meme, Cat-Themed",cat-in-a-dogs-world,171710383,171710383.0,60111.787344037606,102418.68558970126,0.05,8882560.0
OKX,"Decentralized Finance (DeFi), Yield Farming, Yield Aggregator, Yearn Ecosystem, Avalanche Ecosystem, Polygon Ecosystem, Near Protocol Ecosystem, Gnosis Chain Ecosystem, Fantom Ecosystem, Harmony Ecosystem, Arbitrum Ecosystem, Ethereum Ecosystem, Optimism Ecosystem, Base Ecosystem, Index Coop Defi Index, Alameda Research Portfolio, Energi Ecosystem, Sora Ecosystem, Huobi ECO Chain Ecosystem, Blockchain Capital Portfolio, Index Coop Index",yearn-finance,171400125,186210943.0,19271.840406090578,30184.859612557564,0.08,19822918.0
OKX,"Internet of Things (IOT), Ethereum Ecosystem, DePIN, Base Ecosystem, Account Abstraction, GMCI DePIN Index, GMCI Index, Made in USA",iotex,170253428,170253428.0,,,N/A,12371913.0
OKX,"Starknet Ecosystem, Bridged-Tokens",bridged-wrapped-ether-starkgate,170407169,170407169.0,,,N/A,612546.0
OKX,Arbitrum Ecosystem,rcge,168805259,168805259.0,,,N/A,2.43
OKX,"Decentralized Finance (DeFi), Derivatives, Perpetuals, Avalanche Ecosystem, Arbitrum Ecosystem",gmx,169511948,169511948.0,8806.07747331277,31354.778410389772,0.12,56891439.0
OKX,"Entertainment, Smart Contract Platform, Gaming (GameFi), NFT, Metaverse, Layer 1 (L1), Harmony Ecosystem, Ethereum Ecosystem, Gaming Blockchains, Energi Ecosystem",enjincoin,166036911,171782889.0,4654.451649438002,26507.177728173825,0.11,13029444.0
OKX,"Decentralized Finance (DeFi), Solana Ecosystem, Ethereum Ecosystem, Optimism Ecosystem, Base Ecosystem, Cross-chain Communication, BTCfi",threshold-network-token,165806808,182654767.0,17291.760822095395,15100.541311696461,0.06,12987990.0
OKX,"Decentralized Finance (DeFi), Liquid Staking Tokens, Ethereum Ecosystem, Liquid Staked ETH, Liquid Staking",treehouse-eth,164126970,164126970.0,,,N/A,13839.76
OKX,"Decentralized Finance (DeFi), Ethereum Ecosystem, Stablecoin Protocol",tribe-2,163533040,359401007.0,,,N/A,56871.0
OKX,"Decentralized Exchange (DEX), Decentralized Finance (DeFi), Yield Farming, Automated Market Maker (AMM), BNB Chain Ecosystem, Seigniorage, Solana Ecosystem, Avalanche Ecosystem, Polygon Ecosystem, Fantom Ecosystem, Harmony Ecosystem, Arbitrum Ecosystem, Moonriver Ecosystem, Ethereum Ecosystem, Liquid Staking Governance Tokens, Curve Ecosystem, Stablecoin Protocol, Polygon zkEVM Ecosystem, Evmos Ecosystem, Fraxtal Ecosystem, GMCI DeFi Index, Liquid Staking, GMCI Index, Made in USA",frax-share,162316011,183378496.0,21475.209051635917,33450.2990669094,0.11,49890242.0
OKX,"Decentralized Finance (DeFi), Derivatives, Prediction Markets, Solana Ecosystem",drift-protocol,163811107,567801446.0,,,N/A,96071345.0
OKX,"Decentralized Finance (DeFi), Binance Launchpool, Arbitrum Ecosystem, Ethereum Ecosystem, Restaking, Liquid Restaking Governance Tokens, Ether.fi Ecosystem, Consensys Portfolio, OKX Ventures Portfolio",ether-fi,163871838,707361826.0,364686.6444524053,331629.0613945242,0.01,47141552.0
OKX,"Decentralized Exchange (DEX), Exchange-based Tokens, Ethereum Ecosystem",coinex-token,162186996,162186996.0,,,N/A,97563.0
OKX,"Decentralized Finance (DeFi), Yield Farming, Yield Aggregator, Ethereum Ecosystem, Metagovernance, Curve Ecosystem, Yield Optimizer",convex-finance,160906243,195963872.0,9445.634692856038,28205.493971660948,0.15,11138196.0
OKX,"Smart Contract Platform, BNB Chain Ecosystem, Layer 1 (L1), Ethereum Ecosystem, ZetaChain Ecosystem, Cross-chain Communication, Made in USA",zetachain,160953526,461975438.0,144243.76168155877,222958.7367715862,0.05,10488499.0
OKX,"Smart Contract Platform, Layer 1 (L1), Proof of Stake (PoS), GMCI Layer 1 Index, GMCI Index, Made in USA",casper-network,160631386,166305991.0,74690.15001983965,96659.58995713778,0.06,16340989.0
OKX,"Meme, Ethereum Ecosystem, Frog-Themed, AI Meme",turbo,160522284,160522284.0,59208.768751940996,144655.03069538454,0.04,30567349.0
OKX,"Solana Ecosystem, DePIN, Multicoin Capital Portfolio, Made in USA",hivemapper,159769744,248495020.0,,,N/A,1612193.0
OKX,"Decentralized Exchange (DEX), Exchange-based Tokens, Decentralized Finance (DeFi), Automated Market Maker (AMM), BNB Chain Ecosystem, Derivatives, Perpetuals, Centralized Exchange (CEX) Token, Solana Ecosystem, Avalanche Ecosystem, Polygon Ecosystem, Near Protocol Ecosystem, Fantom Ecosystem, Arbitrum Ecosystem, Ethereum Ecosystem, ZkSync Ecosystem, Mantle Ecosystem, Linea Ecosystem, Base Ecosystem, DragonFly Capital Portfolio, Binance Labs Portfolio",woo-network,159396201,189832032.0,17946.319324821685,33817.33377977051,0.12,10569245.0
OKX,"Decentralized Finance (DeFi), Tron Ecosystem",sun-token,159050360,321991101.0,,,N/A,23739465.0
OKX,"SocialFi, Arbitrum Ecosystem",uxlink,156696872,463326056.0,63373.887161264676,86720.61536009744,0.04,14264751.0
OKX,"Smart Contract Platform, Gaming (GameFi), Layer 1 (L1), Ethereum Ecosystem, Modular Blockchain, Account Abstraction, Multicoin Capital Portfolio, Gaming Blockchains, Gaming Utility Token, Skale Ecosystem, Consensys Portfolio, Galaxy Digital Portfolio, Made in USA",skale,155656305,163745123.0,9668.02595462706,38641.652651111806,0.15,12667202.0
