Exchange,Category,Token CEX,Market Cap Today,FDV Today,Depth +2%,Depth -2%,Bid Ask Spread Percentage,24H Volume (USD)
OKX,"Stablecoins, USD Stablecoin, Arbitrum Ecosystem, Ethereum Ecosystem, Fiat-backed Stablecoin",usual-usd,998307129,998307129.0,,,N/A,68735858.0
OKX,"Decentralized Finance (DeFi), BNB Chain Ecosystem, Ethereum Ecosystem",dexe,993858665,1679607574.0,,,N/A,35669476.0
OKX,"Decentralized Finance (DeFi), Lending/Borrowing Protocols, Avalanche Ecosystem, Polygon Ecosystem, Ethereum Ecosystem, Real World Assets (RWA), Paradigm Portfolio, Index Coop Defi Index, Stablecoin Protocol, DragonFly Capital Portfolio, Andreessen Horowitz (a16z) Portfolio, Energi Ecosystem, Sora Ecosystem, GMCI DeFi Index, RWA Protocol, Index Coop Index, GMCI Index, Polychain Capital Portfolio, Made in USA, Coinbase 50 Index",maker,971844872,1001921290.0,42435.28133955204,48352.56725996282,0.02,123259178.0
OKX,"Polygon Ecosystem, Arbitrum Ecosystem, Liquid Staking Tokens, Ethereum Ecosystem, Optimism Ecosystem, Base Ecosystem, Liquid Staked ETH, Liquid Staking",rocket-pool-eth,933196732,933196732.0,,,N/A,14290658.0
OKX,"Infrastructure, Smart Contract Platform, Layer 2 (L2), Bitcoin Sidechains, Stacks Ecosystem, SideChain, GMCI Layer 2 Index, GMCI 30 Index, Blockchain Capital Portfolio, GMCI Index, Made in USA, Coinbase 50 Index",blockstack,937304088,937304088.0,83419.64434424897,168378.18813304725,0.03,28549346.0
OKX,"Smart Contract Platform, Gaming (GameFi), NFT, Play To Earn, Ethereum Ecosystem, Layer 2 (L2), Zero Knowledge (ZK), Animoca Brands Portfolio, Immutable Ecosystem, Coinbase Ventures Portfolio, Rollup, Gaming Blockchains, GMCI 30 Index, GMCI Index, Gaming Marketplace, Coinbase 50 Index",immutable-x,913110828,1032745314.0,12897.016077205966,49706.403206179886,0.04,35033245.0
OKX,"Smart Contract Platform, Ethereum Ecosystem, Decentralized Identifier (DID), Optimism Ecosystem, Coinbase Ventures Portfolio, Multicoin Capital Portfolio, Andreessen Horowitz (a16z) Portfolio, Blockchain Capital Portfolio, Optimism Superchain Ecosystem, World Chain Ecosystem, Made in USA",worldcoin-wld,913428831,8280191932.0,175469.0907182195,270298.6342186448,0.12,138702000.0
OKX,"Smart Contract Platform, Decentralized Finance (DeFi), BNB Chain Ecosystem, Cosmos Ecosystem, Layer 1 (L1), Ethereum Ecosystem, Binance Launchpad, Osmosis Ecosystem, Proof of Stake (PoS), Pantera Capital Portfolio, Secret Ecosystem, GMCI Layer 1 Index, GMCI Index, Made in USA, Coinbase 50 Index",injective-protocol,909461422,930612187.0,101894.31906024784,109466.40911020608,0.03,131206114.0
OKX,"Decentralized Finance (DeFi), Solana Ecosystem, Liquid Staking Tokens, Liquid Staked SOL, Liquid Staking",binance-staked-sol,883996979,883996979.0,,,N/A,2105971.0
OKX,"Artificial Intelligence (AI), Smart Contract Platform, Decentralized Finance (DeFi), Layer 1 (L1), Real World Assets (RWA), Parallelized EVM, Coinbase Ventures Portfolio, Multicoin Capital Portfolio, GMCI Layer 1 Index, Delphi Ventures Portfolio, Circle Ventures Portfolio, OKX Ventures Portfolio, GMCI Index, World Liberty Financial Portfolio, Made in USA",sei-network,871910047,1872055926.0,,,N/A,107273579.0
OKX,"Smart Contract Platform, Layer 1 (L1), DWF Labs Portfolio",flare-networks,868657595,1468847802.0,95256.04976388178,72727.10084722214,0.14,9160873.0
OKX,"Smart Contract Platform, Layer 1 (L1), DePIN, Theta Ecosystem, Blockchain Capital Portfolio, Made in USA",theta-token,867256859,867256859.0,14439.395211603938,59942.75736737504,0.02,32267618.0
OKX,"Polygon Ecosystem, Bridged USDT, Bridged-Tokens, Bridged Stablecoins",polygon-bridged-usdt-polygon,847969921,847969921.0,,,N/A,15497079.0
OKX,"Artificial Intelligence (AI), Business Services, Infrastructure, Smart Contract Platform, Analytics, Avalanche Ecosystem, Polygon Ecosystem, Near Protocol Ecosystem, Harmony Ecosystem, Arbitrum Ecosystem, Ethereum Ecosystem, DePIN, Coinbase Ventures Portfolio, Multicoin Capital Portfolio, Proof of Stake (PoS), Energi Ecosystem, Sora Ecosystem, Made in USA, Coinbase 50 Index",the-graph,850732694,961164339.0,33890.01923022202,54335.92710572153,0.11,40412619.0
OKX,"Crypto-Backed Tokens, BNB Chain Ecosystem, Avalanche Ecosystem, Arbitrum Ecosystem, Ethereum Ecosystem, Mantle Ecosystem, Base Ecosystem, Restaking, Berachain Ecosystem, Merlin Chain Ecosystem, Sonic Ecosystem, Sei v2 Ecosystem, Soneium Ecosystem, Corn Ecosystem",solv-protocol-solvbtc-bbn,807511290,807511290.0,,,N/A,229497.0
OKX,"BNB Chain Ecosystem, Solana Ecosystem, Polygon Ecosystem, Meme, Arbitrum Ecosystem, Ethereum Ecosystem, Aptos Ecosystem, Dog-Themed, Solana Meme, Neon Ecosystem, GMCI Meme Index, GMCI Index, Made in USA, Coinbase 50 Index",bonk,805828402,924868784.0,190393.56160202503,254504.63888760892,0.06,83470804.0
OKX,"Infrastructure, Decentralized Finance (DeFi), Polygon Ecosystem, Arbitrum Ecosystem, Ethereum Ecosystem, Optimism Ecosystem, Liquid Staking Governance Tokens, eGirl Capital Portfolio, Paradigm Portfolio, Coinbase Ventures Portfolio, Multicoin Capital Portfolio, Index Coop Defi Index, Alameda Research Portfolio, DragonFly Capital Portfolio, Andreessen Horowitz (a16z) Portfolio, GMCI DeFi Index, Delphi Ventures Portfolio, Liquid Staking, Index Coop Index, GMCI Index, Coinbase 50 Index",lido-dao,803860985,896020200.0,187346.15357996762,210360.28344521255,0.04,94990860.0
OKX,"Smart Contract Platform, DWF Labs Portfolio, GMCI Layer 1 Index, GMCI Index, Made in USA, Coinbase 50 Index",eos,757465680,1048647129.0,121656.0957191295,315268.4910947846,0.04,81234512.0
OKX,"Liquid Staking Tokens, Ethereum Ecosystem, Mantle Ecosystem, Liquid Staked ETH, Liquid Staking",mantle-staked-ether,747436226,747436457.0,,,N/A,9086475.0
OKX,"Stablecoins, USD Stablecoin, Solana Ecosystem, Ethereum Ecosystem, Fiat-backed Stablecoin, Made in USA",paypal-usd,738753436,738753436.0,12885.292481886674,113254.74062636701,0.1,317558593.0
OKX,"Stablecoins, Tokenized Assets, Tokenized Gold, Ethereum Ecosystem, Real World Assets (RWA), Tokenized Commodities",tether-gold,735566018,735566018.0,388692.6927683658,429622.65512764995,0.01,24051855.0
OKX,"BNB Chain Ecosystem, Bridged USDC, Bridged-Tokens, Bridged Stablecoins",binance-bridged-usdc-bnb-smart-chain,699075683,699075683.0,,,N/A,86153916.0
OKX,"Smart Contract Platform, Gaming (GameFi), NFT, Layer 1 (L1), Play To Earn, Ethereum Ecosystem, DWF Labs Portfolio, Gaming Platform, Binance Labs Portfolio, GalaChain Ecosystem, Made in USA",gala,701188656,701188656.0,65007.24876903465,89136.84469377041,0.06,76689381.0
OKX,"Smart Contract Platform, Layer 1 (L1), Tezos Ecosystem, Proof of Stake (PoS), GMCI Layer 1 Index, GMCI Index, Polychain Capital Portfolio, Made in USA, Coinbase 50 Index",tezos,698560668,712237228.0,44761.92773182802,60049.319471838324,0.03,26852632.0
OKX,"Crypto-Backed Tokens, BNB Chain Ecosystem, Wrapped-Tokens",wbnb,689065087,689065087.0,,,N/A,325296890.0
OKX,"Berachain Ecosystem, Bridged USDC, Bridged-Tokens, Bridged Stablecoins",stargate-bridged-usdc-berachain,685907315,685907315.0,,,N/A,4690273.0
OKX,"Storage, BNB Chain Ecosystem, Ethereum Ecosystem, DePIN, Alleged SEC Securities, Binance Launchpad, Tron Ecosystem, Energi Ecosystem, Binance Labs Portfolio, BitTorrent Ecosystem, GMCI DePIN Index, GMCI Index",bittorrent,677628793,680335606.0,9902.753595769933,12789.357814636249,0.06,19969298.0
OKX,"Smart Contract Platform, Bitcoin Fork, Proof of Work (PoW)",bitcoin-cash-sv,669345065,669345065.0,69625.61892122909,104927.02567997912,0.06,50366283.0
OKX,"Gaming (GameFi), NFT, Metaverse, Polygon Ecosystem, Play To Earn, Harmony Ecosystem, Ethereum Ecosystem, Animoca Brands Portfolio, Alleged SEC Securities, Binance Launchpad, Gaming Utility Token, Simulation Games, Energi Ecosystem, Binance Labs Portfolio, Coinbase 50 Index",the-sandbox,671354860,823459620.0,103529.32153348562,179367.40750638265,0.04,67983922.0
OKX,"Arbitrum Ecosystem, Bridged WBTC, Bridged-Tokens",arbitrum-bridged-wbtc-arbitrum-one,657052670,657052670.0,,,N/A,119324460.0
OKX,"Decentralized Finance (DeFi), Solana Ecosystem, Liquid Staking Governance Tokens, Multicoin Capital Portfolio, Alameda Research Portfolio, Delphi Ventures Portfolio, Liquid Staking, Made in USA",jito-governance-token,652049095,2144193978.0,134250.3266902733,624538.0193529305,0.09,38309615.0
OKX,"Internet of Things (IOT), Smart Contract Platform, Layer 1 (L1), DePIN, DWF Labs Portfolio, IOTA EVM Ecosystem, Outlier Ventures Portfolio, Directed Acyclic Graph (DAG)",iota,652163640,817498690.0,93323.87296725016,156470.20470094553,0.11,26252202.0
OKX,"Smart Contract Platform, Decentralized Finance (DeFi), Layer 1 (L1), Berachain Ecosystem, Binance HODLer Airdrops, Outlier Ventures Portfolio, Polychain Capital Portfolio",berachain-bera,642121636,2976108338.0,455229.5002130925,492108.43589849264,0.05,120548304.0
OKX,"Stablecoins, Tokenized Assets, Tokenized Gold, Ethereum Ecosystem, Real World Assets (RWA), Tokenized Commodities",pax-gold,633113140,633113140.0,,,N/A,40849480.0
OKX,"Smart Contract Platform, Layer 1 (L1)",kaia,627767001,627767022.0,63166.08288057255,122746.65828713197,0.09,24615044.0
OKX,"Stablecoins, USD Stablecoin, BNB Chain Ecosystem, Arbitrum Ecosystem, Ethereum Ecosystem, Fiat-backed Stablecoin",usdx-money-usdx,625222368,625222368.0,,,N/A,202348.0
OKX,"Stablecoins, Avalanche Ecosystem, Polygon Ecosystem, Arbitrum Ecosystem, Ethereum Ecosystem, Optimism Ecosystem, Aptos Ecosystem, Real World Assets (RWA), Fiat-backed Stablecoin",blackrock-usd-institutional-digital-liquidity-fund,624619333,624619333.0,,,N/A,0.0
OKX,"Internet of Things (IOT), Ethereum Ecosystem, DePIN, DWF Labs Portfolio, Coinbase 50 Index",jasmycoin,630810505,651394574.0,,,N/A,53659632.0
OKX,"Smart Contract Platform, Sports, NFT, Layer 1 (L1), Animoca Brands Portfolio, Alleged SEC Securities, Multicoin Capital Portfolio, Proof of Stake (PoS), Flow Ecosystem, Andreessen Horowitz (a16z) Portfolio",flow,617358373,617358373.0,57184.6964016787,80215.16968379667,0.05,31191648.0
OKX,"BNB Chain Ecosystem, Arbitrum Ecosystem, Liquid Staking Tokens, Base Ecosystem, Restaking, Liquid Restaking Tokens, Blast Ecosystem, Mode Ecosystem, Liquid Staking",renzo-restaked-eth,597566923,597572586.0,,,N/A,2284165.0
OKX,"Decentralized Finance (DeFi), Solana Ecosystem, Liquid Staking Tokens, Liquid Staked SOL, Liquid Staking",msol,591091152,591091152.0,,,N/A,16492628.0
OKX,"Gaming (GameFi), NFT, BNB Chain Ecosystem, Metaverse, Meme, Play To Earn, Ethereum Ecosystem, Telegram Apps, Dog-Themed, DWF Labs Portfolio, RPG, On-chain Gaming, TokenFi Launchpad, GMCI Meme Index, GMCI Index",floki,575051225,594976631.0,131517.8141614242,190788.09062842824,0.02,136500637.0
OKX,"NFT, Ethereum Ecosystem, Decentralized Identifier (DID), Name Service",ethereum-name-service,545411691,1644510990.0,104514.53615314583,159651.83348277162,0.01,49476679.0
OKX,"Smart Contract Platform, Proof of Stake (PoS), Made in China",neo,541876062,768291595.0,30382.15209098238,97003.77336915238,0.01,24499025.0
OKX,"Stablecoins, Ethereum Ecosystem",resolv-usr,528702276,528702276.0,,,N/A,10095677.0
OKX,"Stablecoins, Berachain Ecosystem",honey-3,526807621,526807621.0,,,N/A,8572354.0
OKX,"Artificial Intelligence (AI), Smart Contract Platform, Privacy, Masternodes, DePIN, DWF Labs Portfolio, Proof of Stake (PoS), Proof of Work (PoW)",beldex,517592778,743517435.0,,,N/A,3013512.0
OKX,"Decentralized Exchange (DEX), Exchange-based Tokens, Decentralized Finance (DeFi), Yield Farming, Automated Market Maker (AMM), Polygon Ecosystem, Fantom Ecosystem, Arbitrum Ecosystem, Ethereum Ecosystem, Optimism Ecosystem, Curve Ecosystem, DWF Labs Portfolio, Stablecoin Protocol, Energi Ecosystem, Sora Ecosystem, Binance Labs Portfolio, GMCI DeFi Index, GMCI Index, Coinbase 50 Index",curve-dao-token,512501089,882815490.0,100402.35041302622,197449.14462455077,0.08,123306899.0
OKX,"Business Services, Infrastructure, Decentralized Finance (DeFi), Oracle, Solana Ecosystem, Neon Ecosystem, Manta Network Ecosystem, Multicoin Capital Portfolio, GMCI DeFi Index, Delphi Ventures Portfolio, GMCI Index",pyth-network,509161517,1404587840.0,125459.8458422957,214411.12054071564,0.07,29394741.0
OKX,"Smart Contract Platform, Gaming (GameFi), NFT, Layer 1 (L1), Play To Earn, Zero Knowledge (ZK), FTX Holdings, Ronin Ecosystem, Gaming Blockchains, SideChain, Andreessen Horowitz (a16z) Portfolio, Binance Labs Portfolio",ronin,505823568,816648337.0,46994.166657769085,51870.1379577255,0.06,14767713.0
OKX,"Solana Ecosystem, Liquid Staking Tokens, Liquid Staked SOL, Liquid Staking",jupiter-staked-sol,501312032,501312032.0,,,N/A,6287708.0
OKX,"Entertainment, Gaming (GameFi), NFT, Metaverse, Polygon Ecosystem, Play To Earn, Ethereum Ecosystem, Animoca Brands Portfolio, Alleged SEC Securities, Simulation Games, Coinbase 50 Index",decentraland,500635188,587786327.0,36423.76776627398,78855.74695569779,0.04,55303370.0
OKX,"Communication, Internet of Things (IOT), Smart Contract Platform, Solana Ecosystem, DePIN, Multicoin Capital Portfolio, Proof of Stake (PoS), Alameda Research Portfolio, Pantera Capital Portfolio, Andreessen Horowitz (a16z) Portfolio, Made in USA, Coinbase 50 Index",helium,501229321,623079528.0,,,N/A,6914602.0
OKX,"Gaming (GameFi), NFT, BNB Chain Ecosystem, Axie Infinity Ecosystem, Metaverse, Play To Earn, Harmony Ecosystem, Ethereum Ecosystem, Animoca Brands Portfolio, Alleged SEC Securities, Binance Launchpad, Ronin Ecosystem, Card Games, Breeding, Paradigm Portfolio, Gaming Governance Token, Gaming Utility Token, Andreessen Horowitz (a16z) Portfolio, Energi Ecosystem, Binance Labs Portfolio, Consensys Portfolio, Coinbase 50 Index",axie-infinity,503733453,853216175.0,18719.19179753547,35026.913545972384,0.06,31230761.0
OKX,"Stablecoins, USD Stablecoin, BNB Chain Ecosystem, Avalanche Ecosystem, Ethereum Ecosystem, Tron Ecosystem, Andreessen Horowitz (a16z) Portfolio, Fiat-backed Stablecoin",true-usd,494767178,494767178.0,,,N/A,54754740.0
OKX,"Smart Contract Platform, Layer 1 (L1), MultiversX Ecosystem, Binance Launchpad, DWF Labs Portfolio, Proof of Stake (PoS), Binance Labs Portfolio, GMCI Layer 1 Index, GMCI Index, Coinbase 50 Index",elrond-erd-2,493890304,493890304.0,14316.486050079511,17985.941467777528,0.06,29393797.0
OKX,"Smart Contract Platform, Privacy, Layer 1 (L1), Zero Knowledge (ZK), Proof of Work (PoW), Pantera Capital Portfolio, Made in USA, Coinbase 50 Index",zcash,489133355,489190056.0,,,N/A,61081281.0
OKX,"Decentralized Finance (DeFi), Wallets, Polygon Ecosystem, Ethereum Ecosystem, Payment Solutions, Base Ecosystem, Sora Ecosystem, Made in USA",telcoin,481428291,523862935.0,,,N/A,4709530.0
OKX,"Smart Contract Platform, Layer 1 (L1), Binance Launchpad, DWF Labs Portfolio, Osmosis Ecosystem, Binance Labs Portfolio, Made in USA",kava,467303192,467303192.0,,,N/A,12416382.0
OKX,"Decentralized Exchange (DEX), Smart Contract Platform, Decentralized Finance (DeFi), Cosmos Ecosystem, Perpetuals, Layer 1 (L1), Osmosis Ecosystem, Appchains, DragonFly Capital Portfolio, DeFiance Capital Portfolio, Andreessen Horowitz (a16z) Portfolio, GMCI DeFi Index, Delphi Ventures Portfolio, GMCI Index, Polychain Capital Portfolio, Made in USA",dydx-chain,468034876,468034876.0,98369.0658209478,212422.49427024467,0.02,24613486.0
OKX,"Solana Ecosystem, Meme, Dog-Themed, Solana Meme, GMCI Meme Index, GMCI Index",dogwifcoin,463380359,463380359.0,266060.32344521786,346192.5086749808,0.04,420762540.0
OKX,"Infrastructure, Smart Contract Platform, Ethereum Ecosystem, Layer 2 (L2), Zero Knowledge (ZK), Starknet Ecosystem, Paradigm Portfolio, Coinbase Ventures Portfolio, Rollup, Multicoin Capital Portfolio, Alameda Research Portfolio, Pantera Capital Portfolio, GMCI Layer 2 Index, Consensys Portfolio, Sequoia Capital Portfolio, GMCI Index, Polychain Capital Portfolio",starknet,466378332,1699935609.0,36382.11903582665,95461.40427848251,0.06,38023769.0
OKX,"BNB Chain Ecosystem, Ethereum Ecosystem, BTCfi",pumpbtc,462116231,462116231.0,,,N/A,396.3
OKX,"Decentralized Exchange (DEX), Exchange-based Tokens, Decentralized Finance (DeFi), Yield Farming, Automated Market Maker (AMM), BNB Chain Ecosystem, Arbitrum Ecosystem, Ethereum Ecosystem, Aptos Ecosystem, ZkSync Ecosystem, Linea Ecosystem, Base Ecosystem, Polygon zkEVM Ecosystem, Binance Labs Portfolio, opBNB Ecosystem, GMCI DeFi Index, GMCI Index",pancakeswap-token,461728314,600690115.0,,,N/A,105310939.0
OKX,"USD Stablecoin, Polygon Ecosystem, Bridged USDC, Fiat-backed Stablecoin, Bridged-Tokens, Bridged Stablecoins",bridged-usdc-polygon-pos-bridge,446664516,446676761.0,,,N/A,20977385.0
OKX,"Decentralized Exchange (DEX), Decentralized Finance (DeFi), Yield Farming, Automated Market Maker (AMM), Solana Ecosystem, Launchpad, GMCI DeFi Index, GMCI Index",raydium,438981551,837670485.0,83491.96242022852,35316.616980618826,0.08,58870524.0
OKX,"Base Ecosystem, Bridged WETH, Bridged-Tokens",l2-standard-bridged-weth-base,433925401,433925401.0,,,N/A,472126372.0
OKX,"Ethereum Ecosystem, Mantle Ecosystem, Restaking, Liquid Restaking Tokens, Liquid Restaked ETH",mantle-restaked-eth,433884444,433884444.0,,,N/A,11386886.0
OKX,"NFT, BNB Chain Ecosystem, Ethereum Ecosystem, Tron Ecosystem",apenft,430243258,434538416.0,7784.770389817524,10629.190184340945,0.21,52495515.0
OKX,"BNB Chain Ecosystem, Meme, Binance-Peg Tokens",binance-peg-dogecoin,422344579,422344579.0,,,N/A,1417925.0
OKX,"Arbitrum Ecosystem, Bridged WETH, Bridged-Tokens",arbitrum-bridged-weth-arbitrum-one,419113061,419113061.0,,,N/A,361080186.0
OKX,"Smart Contract Platform, BNB Chain Ecosystem, Layer 1 (L1), Ethereum Ecosystem, Base Ecosystem, Proof of Stake (PoS), Pantera Capital Portfolio, Made in USA",chain-2,419351419,616498196.0,,,N/A,87080726.0
OKX,"Tokenized BTC, Avalanche Ecosystem, Bridged-Tokens",bitcoin-avalanche-bridged-btc-b,416023216,416023216.0,,,N/A,28502514.0
OKX,"Decentralized Exchange (DEX), Decentralized Finance (DeFi), Automated Market Maker (AMM), Base Ecosystem, Binance Alpha Spotlight, Made in USA",aerodrome-finance,409023234,791576862.0,,,N/A,23295718.0
OKX,"Arbitrum Ecosystem, Ethereum Ecosystem, Optimism Ecosystem, Base Ecosystem, BTCfi",clbtc,408231409,408231409.0,,,N/A,277.9
OKX,"Tokenized Assets, Solana Ecosystem, Polygon Ecosystem, Ethereum Ecosystem, Real World Assets (RWA), Tokenized Treasury Bonds (T-Bonds)",ousg,408431834,408431834.0,,,N/A,0.0
OKX,"Stablecoins, USD Stablecoin, Blast Ecosystem, Crypto-backed Stablecoin, Fiat-backed Stablecoin",usdb,407661353,407661353.0,,,N/A,2209703.0
OKX,"Smart Contract Platform, Layer 1 (L1), Bitcoin Fork, Proof of Work (PoW)",ecash,408561111,408563878.0,,,N/A,22646176.0
OKX,"Smart Contract Platform, Sports, NFT, Layer 1 (L1), Ethereum Ecosystem, Alleged SEC Securities, Chiliz Ecosystem, Binance Labs Portfolio, Coinbase 50 Index",chiliz,403192829,403192829.0,52583.663165547245,94642.62496427841,0.07,57126091.0
OKX,"Ethereum Ecosystem, Real World Assets (RWA)",hashnote-usyc,400450325,400450325.0,,,N/A,10.66
OKX,"Smart Contract Platform, DWF Labs Portfolio, Proof of Work (PoW), GMCI Layer 1 Index, Sequoia Capital Portfolio, GMCI Index, Made in China",conflux-token,400387754,447002945.0,98527.41733795297,147428.2391473474,0.12,76201012.0
OKX,"Gaming (GameFi), NFT, Polygon Ecosystem, Ethereum Ecosystem, Animoca Brands Portfolio, Gaming Blockchains, Gaming Governance Token, Gaming Utility Token, Andreessen Horowitz (a16z) Portfolio, ApeChain Ecosystem, Airdropped Tokens by NFT Projects, Coinbase 50 Index",apecoin,400126521,500498808.0,94112.65101543178,135013.8714914099,0.06,57407929.0
OKX,"Stablecoins, Decentralized Finance (DeFi), USD Stablecoin, BNB Chain Ecosystem, Seigniorage, Avalanche Ecosystem, Polygon Ecosystem, Fantom Ecosystem, Harmony Ecosystem, Arbitrum Ecosystem, Moonriver Ecosystem, Moonbeam Ecosystem, Ethereum Ecosystem, Optimism Ecosystem, Stablecoin Protocol, Aurora Ecosystem, Polygon zkEVM Ecosystem, Evmos Ecosystem, Boba Network Ecosystem, Fiat-backed Stablecoin",frax,392283586,392283586.0,,,N/A,6823852.0
OKX,"Smart Contract Platform, Layer 1 (L1), Bitcoin Sidechains, SideChain",coredaoorg,390408286,822530327.0,22967.983044803594,64191.582209229506,0.05,14330547.0
OKX,"Artificial Intelligence (AI), Smart Contract Platform, Storage, Layer 1 (L1), DePIN, Coinbase Ventures Portfolio, Multicoin Capital Portfolio, Andreessen Horowitz (a16z) Portfolio, Blockchain Capital Portfolio",arweave,391472900,391472900.0,34570.45339405332,92248.95995865928,0.05,37660958.0
OKX,"Decentralized Exchange (DEX), Infrastructure, Smart Contract Platform, Exchange-based Tokens, Decentralized Finance (DeFi), Bridge Governance Tokens, Multicoin Capital Portfolio, Proof of Stake (PoS), Delphi Ventures Portfolio",thorchain,388586253,470296397.0,,,N/A,213380354.0
OKX,"Stablecoins, Solana Ecosystem, Arbitrum Ecosystem, Ethereum Ecosystem, Aptos Ecosystem, Sui Ecosystem, Mantle Ecosystem, Osmosis Ecosystem, Fiat-backed Stablecoin, Yield Tokenization Product",ondo-us-dollar-yield,384508823,592331763.0,,,N/A,607416.0
OKX,"Smart Contract Platform, BNB Chain Ecosystem, Polygon Ecosystem, Harmony Ecosystem, Moonriver Ecosystem, Moonbeam Ecosystem, Ethereum Ecosystem, Layer 2 (L2), Zero Knowledge (ZK), Animoca Brands Portfolio, Alleged SEC Securities, Binance Launchpad, FTX Holdings, Coinbase Ventures Portfolio, Rollup, Proof of Stake (PoS), Alameda Research Portfolio, DragonFly Capital Portfolio, Energi Ecosystem, Sora Ecosystem, Binance Labs Portfolio, GMCI Layer 2 Index, GMCI 30 Index, Galaxy Digital Portfolio, GMCI Index, Coinbase 50 Index",matic-network,378378704,2114338657.0,,,N/A,4912615.0
OKX,"Decentralized Finance (DeFi), BNB Chain Ecosystem, Liquid Staking Tokens, Sui Ecosystem, Liquid Staking",lorenzo-stbtc,375777961,375777961.0,,,N/A,4884.16
OKX,"Artificial Intelligence (AI), Solana Ecosystem, Ethereum Ecosystem, Base Ecosystem, AI Agents, Virtuals Protocol Ecosystem, AI Agent Launchpad, Binance Alpha Spotlight",virtual-protocol,378953889,583453721.0,,,N/A,117109103.0
OKX,"Solana Ecosystem, Meme, Solana Meme, Binance HODLer Airdrops, Airdropped Tokens by NFT Projects, Made in USA",pudgy-penguins,375012786,457721646.0,142261.90324638208,159414.45876765624,0.07,131112524.0
OKX,"Decentralized Finance (DeFi), Liquid Staking Tokens, Berachain Ecosystem, Liquid Staking",infrared-bera,368519445,368519995.0,,,N/A,84467.0
OKX,"Liquid Staking Tokens, Ethereum Ecosystem, Restaking, Liquid Restaking Tokens, Ether.fi Ecosystem, Liquid Staked ETH, Liquid Staking",ether-fi-staked-eth,365224273,4182653157.0,,,N/A,49759.0
OKX,"Crypto-Backed Tokens, Decentralized Finance (DeFi), Rebase Tokens, Arbitrum Ecosystem, Ethereum Ecosystem, Berachain Ecosystem",olympus,358393730,459069205.0,,,N/A,990793.0
OKX,"Decentralized Finance (DeFi), Yield Farming, BNB Chain Ecosystem, Lending/Borrowing Protocols, Avalanche Ecosystem, Polygon Ecosystem, Near Protocol Ecosystem, Harmony Ecosystem, Arbitrum Ecosystem, Ethereum Ecosystem, Base Ecosystem, Paradigm Portfolio, Index Coop Defi Index, Energi Ecosystem, Sora Ecosystem, Index Coop Index, Polychain Capital Portfolio, Made in USA",compound-governance-token,355723775,399816903.0,20209.87741101149,52024.81972750898,0.02,42570976.0
OKX,"BNB Chain Ecosystem, Wallets, Account Abstraction, Energi Ecosystem",trust-wallet-token,355661703,853622436.0,,,N/A,13547213.0
OKX,"Decentralized Finance (DeFi), Near Protocol Ecosystem, Ethereum Ecosystem, Payment Solutions, Alleged SEC Securities, Pantera Capital Portfolio, Energi Ecosystem, Made in USA",amp-token,347042962,410648738.0,,,N/A,41770156.0
OKX,"Crypto-Backed Tokens, Decentralized Finance (DeFi), Tokenized BTC, Solana Ecosystem, Polygon Ecosystem, Arbitrum Ecosystem, Ethereum Ecosystem, Optimism Ecosystem, Base Ecosystem",tbtc,343619710,343619710.0,,,N/A,14586369.0
OKX,"Artificial Intelligence (AI), Smart Contract Platform, DePIN, Osmosis Ecosystem, Proof of Stake (PoS), Archway Ecosystem, Made in USA",akash-network,345564351,346744594.0,,,N/A,27421910.0
OKX,"Artificial Intelligence (AI), Analytics, Base Ecosystem, Binance HODLer Airdrops",kaito,338627201,1402828450.0,175575.01338448623,259098.06142463413,0.02,261816438.0
OKX,"Decentralized Exchange (DEX), Decentralized Finance (DeFi), Yield Farming, Automated Market Maker (AMM), BNB Chain Ecosystem, Derivatives, Lending/Borrowing Protocols, Arbitrum Ecosystem, Ethereum Ecosystem, Optimism Ecosystem, Fixed Interest, Real World Assets (RWA), LSDFi, Base Ecosystem, Restaking, LRTfi, Liquid Restaking Governance Tokens, Yield Tokenization Protocol, Binance Labs Portfolio, GMCI DeFi Index, Sonic Ecosystem, Liquid Staking, GMCI Index, BTCfi",pendle,337773735,527302931.0,48299.013409758656,53355.545399219765,0.1,43249432.0
OKX,"Infrastructure, BNB Chain Ecosystem, Avalanche Ecosystem, Polygon Ecosystem, Fantom Ecosystem, Arbitrum Ecosystem, Moonbeam Ecosystem, Ethereum Ecosystem, Optimism Ecosystem, Interoperability, Bridge Governance Tokens, Base Ecosystem, Osmosis Ecosystem, Cross-chain Communication, Secret Ecosystem, Galaxy Digital Portfolio, Polychain Capital Portfolio, Made in USA",axelar,340238314,436337472.0,,,N/A,15425741.0
OKX,"Decentralized Finance (DeFi), Arbitrum Ecosystem, Liquid Staking Tokens, Ethereum Ecosystem, Optimism Ecosystem, Base Ecosystem",cgeth-hashkey-cloud,333815857,333815857.0,,,N/A,22.68
OKX,"Decentralized Finance (DeFi), Liquid Staking Tokens, Ethereum Ecosystem, Liquid Staked ETH, Liquid Staking",stakewise-v3-oseth,327593898,327593898.0,,,N/A,1741510.0
OKX,"Smart Contract Platform, Decentralized Finance (DeFi), Coinbase Ventures Portfolio, DeFiance Capital Portfolio, Pantera Capital Portfolio, Binance Labs Portfolio, Galaxy Digital Portfolio",terra-luna,328433798,391907427.0,42414.73382666784,63098.47480110799,0.05,11414181.0
OKX,"Mantle Ecosystem, Bridged USDT, Bridged-Tokens, Bridged Stablecoins",mantle-bridged-usdt-mantle,325799813,325799813.0,,,N/A,1221543.0
