OKX,"Smart Contract Platform, Bitcoin Sidechains, Stacks Ecosystem, SideChain",sbtc-2,86342095,86342095.0,,,N/A,34744.0
OKX,"Smart Contract Platform, Layer 1 (L1)",ong,86235071,211389965.0,,,N/A,2344374.0
OKX,"Artificial Intelligence (AI), Smart Contract Platform, Gaming (GameFi), NFT, BNB Chain Ecosystem, Layer 1 (L1), Ethereum Ecosystem, Modular Blockchain, Chromia Ecosystem",chromaway,86429109,86429109.0,,,N/A,11314607.0
OKX,"Crypto-Backed Tokens, Ethereum Ecosystem",temple,85886806,86056007.0,,,N/A,14301.96
OKX,"Decentralized Exchange (DEX), Decentralized Finance (DeFi), Arbitrum Ecosystem, Ethereum Ecosystem",tokenlon,86086257,103619117.0,,,N/A,33254.0
OKX,"Gaming (GameFi), Play To Earn, Ethereum Ecosystem, RPG, Alameda Research Portfolio, Circle Ventures Portfolio, OKX Ventures Portfolio, MMO",big-time,85815803,241049824.0,185789.08224625536,214567.0972814258,0.04,19366578.0
OKX,"Business Services, Polygon Ecosystem, Ethereum Ecosystem",request-network,84883184,110285913.0,,,N/A,4061011.0
OKX,"Exchange-based Tokens, Centralized Exchange (CEX) Token, Ethereum Ecosystem",hashkey-ecopoints,80806508,609860434.0,,,N/A,2902670.0
OKX,BNB Chain Ecosystem,metfi-2,84597575,198021845.0,,,N/A,346308.0
OKX,"Smart Contract Platform, Layer 2 (L2), eGirl Capital Portfolio, Paradigm Portfolio, Blast Ecosystem",blast,84200692,317816288.0,,,N/A,7180329.0
OKX,"Smart Contract Platform, Polkadot Ecosystem, Layer 1 (L1), Coinbase Ventures Portfolio, Binance Labs Portfolio",moonbeam,84336756,102700291.0,6686.620927084448,24145.374652839804,0.11,5418343.0
OKX,"Polygon Ecosystem, XRP Ledger Ecosystem",crypto-trading-fund,83819696,83819696.0,,,N/A,5577.49
OKX,"NFT, Solana Ecosystem, NFT Marketplace",tensor,83958138,250915487.0,145714.77464059045,171399.24823996375,0.08,15530504.0
OKX,"Smart Contract Platform, Gaming (GameFi), NFT, Layer 1 (L1), Play To Earn, Ethereum Ecosystem, Animoca Brands Portfolio, Gaming Blockchains, Pantera Capital Portfolio, OKX Ventures Portfolio",wax,83582292,89931975.0,9177.379048042407,17468.572208835154,0.08,5271691.0
OKX,"Decentralized Finance (DeFi), BNB Chain Ecosystem, Arbitrum Ecosystem, Ethereum Ecosystem, Multicoin Capital Portfolio, Energi Ecosystem",dforce-token,83258376,83258376.0,,,N/A,15361481.0
OKX,Ethereum Ecosystem,dkargo,82701843,88230984.0,,,N/A,1223694.0
OKX,"Solana Ecosystem, Polygon Ecosystem, DePIN, Pantera Capital Portfolio",geodnet,82564416,257532351.0,,,N/A,195175.0
OKX,"Smart Contract Platform, Layer 1 (L1), Zero Knowledge (ZK)",ozone-chain,82467981,113678387.0,,,N/A,209405.0
OKX,"Gaming (GameFi), NFT, BNB Chain Ecosystem, Metaverse, Collectibles, Polygon Ecosystem, Play To Earn, Harmony Ecosystem, Guild and Scholarship, Ethereum Ecosystem, Animoca Brands Portfolio, Base Ecosystem, DWF Labs Portfolio, Ronin Ecosystem, Gaming Governance Token, Andreessen Horowitz (a16z) Portfolio, Delphi Ventures Portfolio",yield-guild-games,81756006,199155488.0,44688.26130129034,71439.67135952722,0.05,12784112.0
OKX,"Internet of Things (IOT), BNB Chain Ecosystem, Ethereum Ecosystem, DePIN, DWF Labs Portfolio",mass-vehicle-ledger,81390039,86031534.0,,,N/A,743060.0
OKX,"Artificial Intelligence (AI), BNB Chain Ecosystem, Solana Ecosystem, Ethereum Ecosystem, AI Agents, Alameda Research Portfolio",delysium,80967527,154485632.0,,,N/A,3397491.0
OKX,"NFT, Ethereum Ecosystem",superrare,80571648,100667885.0,,,N/A,220672821.0
OKX,"Smart Contract Platform, Privacy, Proof of Work (PoW), Made in USA",verge,80607025,80768262.0,,,N/A,4889081.0
OKX,"Decentralized Exchange (DEX), Decentralized Finance (DeFi), Yield Farming, Automated Market Maker (AMM), Solana Ecosystem, Coinbase Ventures Portfolio, DeFiance Capital Portfolio, Made in USA",orca,80733799,151537182.0,,,N/A,20458253.0
OKX,"Berachain Ecosystem, Bridged USDT, Bridged-Tokens, Ink Ecosystem, Bridged Stablecoins",usdt0,80757571,80755108.0,,,N/A,438131.0
OKX,"Artificial Intelligence (AI), BNB Chain Ecosystem, Ethereum Ecosystem, DragonFly Capital Portfolio, Binance Labs Portfolio, Delphi Ventures Portfolio, OKX Ventures Portfolio, Binance HODLer Airdrops, AI Agent Launchpad, Binance Alpha Spotlight, AI Framework",myshell,80278293,297327012.0,,,N/A,63433192.0
OKX,"Gaming (GameFi), Play To Earn, Guild and Scholarship, Ethereum Ecosystem, Animoca Brands Portfolio, Base Ecosystem, DWF Labs Portfolio, Ronin Ecosystem, Coinbase Ventures Portfolio, DeFiance Capital Portfolio, Pantera Capital Portfolio, Binance Labs Portfolio, MMO",zentry,80565232,118273527.0,43702.751410369165,52693.17428247768,0.25,6247590.0
OKX,"Exchange-based Tokens, Centralized Exchange (CEX) Token, Near Protocol Ecosystem, Harmony Ecosystem, Ethereum Ecosystem, Multicoin Capital Portfolio, Alameda Research Portfolio, Elastos Smart Contract Chain Ecosystem, Sequoia Capital Portfolio, Made in China",huobi-token,80353842,101345822.0,,,N/A,6609.14
OKX,"Meme, Ethereum Ecosystem, PolitiFi",constitutiondao,79739152,79739152.0,155459.8796677736,190972.59399592833,0.06,20485670.0
OKX,"Stablecoins, Decentralized Finance (DeFi), Lending/Borrowing Protocols, Ethereum Ecosystem",syrupusdc,79132775,79132775.0,,,N/A,114960.0
OKX,"Exchange-based Tokens, Centralized Exchange (CEX) Token, Ethereum Ecosystem",bitmart-token,78766735,148387191.0,,,N/A,4243754.0
OKX,"Artificial Intelligence (AI), Infrastructure, Ethereum Ecosystem, AI Framework, Made in USA",arcblock,78716984,148522610.0,,,N/A,1153216.0
OKX,"Stablecoins, USD Stablecoin, Solana Ecosystem, Ethereum Ecosystem, Multicoin Capital Portfolio, Fiat-backed Stablecoin",paxos-standard,79286138,79286138.0,,,N/A,2139812.0
OKX,"Blast Ecosystem, Bridged WETH, Bridged-Tokens",l2-standard-bridged-weth-blast,79710794,79710794.0,,,N/A,1045366.0
OKX,"Smart Contract Platform, Proof of Stake (PoS)",stratis,78285800,86253000.0,,,N/A,824338.0
OKX,"Software as a service, Polygon Ecosystem, Ethereum Ecosystem, Decentralized Identifier (DID), Pantera Capital Portfolio, Energi Ecosystem, Blockchain Capital Portfolio",civic,78718452,98152682.0,8492.273574341289,35687.07326658173,0.05,7964157.0
OKX,"Smart Contract Platform, Cosmos Ecosystem, Modular Blockchain, Osmosis Ecosystem, Rollups-as-a-Service (RaaS)",dymension,78252124,310835665.0,,,N/A,6814616.0
OKX,"Smart Contract Platform, Layer 1 (L1), Osmosis Ecosystem, XRP Ledger Ecosystem",coreum,78090561,78090561.0,,,N/A,205226.0
OKX,"Ethereum Ecosystem, Stablecoin Protocol",level-usd,77824363,77824363.0,,,N/A,696556.0
OKX,BNB Chain Ecosystem,bitdca,78844926,84685727.0,,,N/A,89430.0
OKX,"Artificial Intelligence (AI), Smart Contract Platform, Decentralized Finance (DeFi), Analytics, NFT, BNB Chain Ecosystem, Launchpad, Ethereum Ecosystem, Telegram Apps, Discord Bots, ChainGPT Launchpad, Poolz Finance Launchpad, AI Agents, AI Applications, Binance Alpha Spotlight, AI Framework, DeFAI",chaingpt,77503043,96223230.0,,,N/A,21860509.0
OKX,"Decentralized Finance (DeFi), Wallets, Ethereum Ecosystem, Pundi AIFX Omnilayer Ecosystem",pundi-x-2,77439278,77439278.0,,,N/A,6622586.0
OKX,"Stablecoins, USD Stablecoin, Osmosis Ecosystem, Fiat-backed Stablecoin",usdx,77192551,77192551.0,,,N/A,20482.0
OKX,"Optimism Ecosystem, Bridged WBTC, Bridged-Tokens",optimism-bridged-wbtc-optimism,76752544,76752544.0,,,N/A,1666426.0
OKX,"Business Services, Decentralized Finance (DeFi), Oracle, Polygon Ecosystem, Gnosis Chain Ecosystem, Arbitrum Ecosystem, Ethereum Ecosystem, Optimism Ecosystem, Manta Network Ecosystem, Binance Labs Portfolio, Lisk Ecosystem, Made in USA",tellor,75633697,77834425.0,52635.150024297196,79621.90764399077,0.04,22044372.0
OKX,Smart Contract Platform,songbird,75803489,90066669.0,,,N/A,291577.0
OKX,"Sports, BNB Chain Ecosystem",pixer-eternity,75330047,350065876.0,,,N/A,322390.0
OKX,"Decentralized Finance (DeFi), Liquid Staking Tokens, Ethereum Ecosystem, LSDFi, Liquid Staked ETH, Liquid Staking",origin-ether,75564486,75564486.0,,,N/A,37530.0
OKX,"Arbitrum Ecosystem, Bridge Governance Tokens, Base Ecosystem, Cross-chain Communication, OKX Ventures Portfolio",orbiter-finance,75417984,243283821.0,,,N/A,68768278.0
OKX,"BNB Chain Ecosystem, Solana Ecosystem, Polygon Ecosystem, Meme, Ethereum Ecosystem, Cronos Ecosystem, Dog-Themed, Elon Musk-Inspired, Fuse Ecosystem",dogelon-mars,75254316,136913163.0,7670.919896422173,12022.386553367398,0.15,3710883.0
OKX,"Smart Contract Platform, Wallets, Layer 2 (L2), Osmosis Ecosystem",islamic-coin,74091753,893806120.0,,,N/A,746462.0
OKX,"Smart Contract Platform, Polkadot Ecosystem, Layer 1 (L1), DePIN, Outlier Ventures Portfolio",peaq-2,74957751,441275864.0,,,N/A,10901643.0
OKX,"Smart Contract Platform, Gaming (GameFi), Layer 1 (L1), Proof of Stake (PoS), Gaming Blockchains",oasys,74819307,193712595.0,103.81540469953963,4011.6948683469195,0.26,563111.0
OKX,"Decentralized Finance (DeFi), Solana Ecosystem, Real World Assets (RWA), Payment Solutions, DePIN, Coinbase Ventures Portfolio, Alameda Research Portfolio, Circle Ventures Portfolio, OKX Ventures Portfolio, RWA Protocol, Made in USA",zebec-network,74760987,100893556.0,12407.449201546677,18408.790714036106,0.11,43812887.0
OKX,"Optimism Ecosystem, Bridged WETH, Bridged-Tokens",l2-standard-bridged-weth-optimism,74227912,74227912.0,,,N/A,24309785.0
OKX,"Decentralized Finance (DeFi), Lending/Borrowing Protocols, Moonbeam Ecosystem, Base Ecosystem, Coinbase Ventures Portfolio, Made in USA",moonwell-artemis,73506562,112074250.0,,,N/A,13255361.0
OKX,"Meme, Ethereum Ecosystem, Mantle Ecosystem",puff-the-dragon,73582644,73582644.0,,,N/A,43135.0
OKX,Retail,milk-alliance,72992998,163537113.0,,,N/A,2954609.0
OKX,"Entertainment, Gaming (GameFi), NFT, Axie Infinity Ecosystem, Play To Earn, Ethereum Ecosystem, Ronin Ecosystem, Gaming Utility Token",smooth-love-potion,72795424,72795424.0,11504.12332300829,23865.210589438306,0.11,8871473.0
OKX,"Gaming (GameFi), Play To Earn, TON Ecosystem, Tap to Earn, Arcade Games",watcoin-2,72830382,80854844.0,,,N/A,986077.0
OKX,"Artificial Intelligence (AI), Smart Contract Platform, Layer 1 (L1), Ethereum Ecosystem, Osmosis Ecosystem, AI Agents, AI Agent Launchpad",humans-ai,72529558,72529558.0,,,N/A,453498.0
OKX,"Gaming (GameFi), NFT, Ethereum Ecosystem",undeads-games,72125816,250912337.0,,,N/A,443750.0
OKX,"Decentralized Exchange (DEX), Decentralized Finance (DeFi), Yield Farming, Automated Market Maker (AMM), BNB Chain Ecosystem, Avalanche Ecosystem, Arbitrum Ecosystem, Mantle Ecosystem, DeFiance Capital Portfolio, Delphi Ventures Portfolio, Dex Aggregator",joe,71946231,92135653.0,23682.621114671598,19827.772274976884,0.16,6608971.0
OKX,"Ethereum Ecosystem, DePIN",dent,71728457,74986657.0,,,N/A,5417279.0
OKX,"Artificial Intelligence (AI), Decentralized Finance (DeFi), Ethereum Ecosystem, DePIN",pinlink,70835588,88544485.0,,,N/A,1893475.0
OKX,"Decentralized Finance (DeFi), Ethereum Ecosystem, Binance Alpha Spotlight",avalon-2,71647018,441584084.0,,,N/A,28944920.0
OKX,"Decentralized Finance (DeFi), Oracle, Ethereum Ecosystem, DWF Labs Portfolio, Pantera Capital Portfolio",api3,71006522,88613041.0,17900.27053128576,20307.200706985084,0.05,15324953.0
OKX,"Smart Contract Platform, Gaming (GameFi), NFT, Binance Launchpool, Arbitrum Ecosystem, Layer 3 (L3), XAI Ecosystem, Gaming Blockchains, Outlier Ventures Portfolio",xai-blockchain,70906001,104490769.0,,,N/A,28236302.0
OKX,"Decentralized Finance (DeFi), Lending/Borrowing Protocols, Ethereum Ecosystem, Real World Assets (RWA), Coinbase Ventures Portfolio, Andreessen Horowitz (a16z) Portfolio, RWA Protocol, Made in USA",goldfinch,70642121,87380369.0,,,N/A,602742.0
OKX,"Decentralized Exchange (DEX), Exchange-based Tokens, Decentralized Finance (DeFi), BNB Chain Ecosystem, Binance Launchpool, Polygon Ecosystem, Near Protocol Ecosystem, Arbitrum Ecosystem, Ethereum Ecosystem, DWF Labs Portfolio, Coinbase Ventures Portfolio, Alameda Research Portfolio, DeFiance Capital Portfolio, Pantera Capital Portfolio, Aurora Ecosystem, Energi Ecosystem, Binance Labs Portfolio, Galaxy Digital Portfolio",dodo,70399367,70399367.0,,,N/A,4517066.0
OKX,"Artificial Intelligence (AI), Decentralized Finance (DeFi), Solana Ecosystem, Arbitrum Ecosystem, Metis Ecosystem, AI Agents, Sonic Ecosystem, IOTA EVM Ecosystem, AI Applications, DeFAI",heyanon,70467364,116053343.0,,,N/A,3336029.0
OKX,"Stablecoins, Decentralized Finance (DeFi), USD Stablecoin, BNB Chain Ecosystem, Polygon Ecosystem, Gnosis Chain Ecosystem, Arbitrum Ecosystem, Ethereum Ecosystem, Optimism Ecosystem, Base Ecosystem, Crypto-backed Stablecoin, Fiat-backed Stablecoin",crvusd,70423004,70423004.0,,,N/A,5862459.0
OKX,"Decentralized Finance (DeFi), Lending/Borrowing Protocols, Arbitrum Ecosystem, Ethereum Ecosystem, Alameda Research Portfolio, Pantera Capital Portfolio",liquity,70390633,72334506.0,9629.805462811546,26495.4505911047,0.08,13615530.0
OKX,"Gaming (GameFi), NFT, Collectibles, Play To Earn, Ethereum Ecosystem, Base Ecosystem, Energi Ecosystem",ecomi,69967458,80278746.0,2895.685799511058,6759.771855494569,0.15,2216881.0
OKX,"Decentralized Finance (DeFi), Ethereum Ecosystem",elixir-finance,70256569,440040897.0,,,N/A,46222333.0
OKX,"Smart Contract Platform, Ethereum Ecosystem, Layer 2 (L2), Zero Knowledge (ZK), Rollup, OKX Ventures Portfolio",taiko,69853975,660586042.0,,,N/A,14266181.0
OKX,"Tokenized Assets, Polygon Ecosystem, Arbitrum Ecosystem, Ethereum Ecosystem, Real World Assets (RWA), Starknet Ecosystem, Tokenized Treasury Bills (T-Bills)",spiko-us-t-bills-money-market-fund,69588146,69588146.0,,,N/A,0.0
OKX,"Artificial Intelligence (AI), Cardano Ecosystem, Ethereum Ecosystem, AI Agents, Sora Ecosystem",singularitynet,69621606,105216923.0,,,N/A,35428.0
OKX,"Lending/Borrowing Protocols, Solana Ecosystem, FTX Holdings, Coinbase Ventures Portfolio, Alameda Research Portfolio, DragonFly Capital Portfolio",solend,69360419,137087973.0,,,N/A,2427.03
OKX,"Stablecoins, USD Stablecoin, Seigniorage, Alleged SEC Securities, Osmosis Ecosystem, Stablecoin Protocol, DeFiance Capital Portfolio, Terra Classic Ecosystem, Binance Labs Portfolio, Delphi Ventures Portfolio, Galaxy Digital Portfolio, Fiat-backed Stablecoin",terrausd,69202293,98043269.0,38242.08248129219,65280.25004147029,0.16,6205998.0
OKX,"Artificial Intelligence (AI), Business Services, Decentralized Finance (DeFi), Ethereum Ecosystem, Paradigm Portfolio, DragonFly Capital Portfolio, Energi Ecosystem",numeraire,69164691,92615378.0,6766.105820316177,21964.674807522973,0.23,7782928.0
OKX,"Artificial Intelligence (AI), Ethereum Ecosystem",0x0-ai-ai-smart-contract,69310971,69310971.0,,,N/A,126373.0
OKX,"Meme, Dog-Themed, TON Ecosystem, TON Meme",dogs-2,68532418,72942100.0,41937.32385339784,91822.38129557627,0.08,12948830.0
OKX,"Decentralized Finance (DeFi), Lending/Borrowing Protocols, Solana Ecosystem, Binance Alpha Spotlight",kamino,68541849,507717397.0,,,N/A,7365800.0
OKX,"Stablecoins, Decentralized Finance (DeFi), USD Stablecoin, BNB Chain Ecosystem, Avalanche Ecosystem, Arbitrum Ecosystem, Liquid Staking Tokens, Ethereum Ecosystem, Optimism Ecosystem, Fiat-backed Stablecoin",staked-frax,68384895,68384895.0,,,N/A,38.24
OKX,"Solana Ecosystem, Restaking, Liquid Restaking Tokens, Liquid Restaked SOL",renzo-restaked-sol,67553506,67553506.0,,,N/A,674383.0
OKX,"Decentralized Finance (DeFi), Ethereum Ecosystem, Restaking",kelp-gain,67703527,67703527.0,,,N/A,20808.0
OKX,"Solana Ecosystem, Wallets, Base Ecosystem, TON Ecosystem",bitget-wallet-token,67182897,470072637.0,,,N/A,3631.06
OKX,"Artificial Intelligence (AI), Marketing, Analytics, BNB Chain Ecosystem, Ethereum Ecosystem, Animoca Brands Portfolio, Base Ecosystem, AI Agents, Binance Alpha Spotlight",cookie,66497333,148008028.0,,,N/A,18495966.0
OKX,"Artificial Intelligence (AI), Solana Ecosystem, DePIN",nosana,67416647,80835309.0,,,N/A,995358.0
OKX,"Smart Contract Platform, Binance Launchpool, Layer 2 (L2), Scroll Ecosystem",scroll,66547755,350251340.0,58113.35726284148,94547.37543100443,0.03,16720653.0
OKX,"Smart Contract Platform, Layer 1 (L1), Proof of Work (PoW), Privacy Blockchain",ergo,66431037,81096237.0,,,N/A,83891.0
OKX,"Decentralized Exchange (DEX), Decentralized Finance (DeFi), Sui Ecosystem, Animoca Brands Portfolio, OKX Ventures Portfolio, Dex Aggregator",cetus-protocol,66402416,97248728.0,50919.1850416247,47511.58019882766,0.04,11519172.0
OKX,Ethereum Ecosystem,saasgo,66247927,82809909.0,,,N/A,222734.0
OKX,SocialFi,steem,66086353,66140908.0,,,N/A,11217155.0
OKX,E-commerce,pay-coin,65398220,121513280.0,,,N/A,4119011.0
OKX,"NFT, BNB Chain Ecosystem, Solana Ecosystem, Meme, Ethereum Ecosystem, Base Ecosystem, Hybrid Token Standards, Wojak-Themed",non-playable-coin,65409130,65409130.0,,,N/A,5565407.0
OKX,"Base Ecosystem, Cybersecurity, Binance Labs Portfolio, OKX Ventures Portfolio, Binance Alpha Spotlight",goplus-security,64879981,357780858.0,,,N/A,41674002.0
OKX,"Smart Contract Platform, Layer 1 (L1), Ethereum Ecosystem, Proof of Stake (PoS)",pundi-aifx,64517353,64517353.0,,,N/A,229298.0
OKX,"Stablecoins, USD Stablecoin, Fiat-backed Stablecoin",falcon-finance,64475435,64475435.0,,,N/A,22144.0
OKX,"Smart Contract Platform, Layer 1 (L1), DWF Labs Portfolio, Radix Ecosystem",radix,64472226,78944473.0,,,N/A,1611707.0
OKX,"Healthcare, Osmosis Ecosystem",medibloc,64412641,69767812.0,,,N/A,356003.0
OKX,"Decentralized Finance (DeFi), BNB Chain Ecosystem, Solana Ecosystem, Wallets, Polygon Ecosystem, Ethereum Ecosystem, Binance Launchpad, DWF Labs Portfolio, Multicoin Capital Portfolio, Alameda Research Portfolio, Viction Ecosystem, Binance Labs Portfolio",coin98,64522579,71625446.0,,,N/A,13666592.0
OKX,"Artificial Intelligence (AI), BNB Chain Ecosystem, Ethereum Ecosystem, DePIN, AI Agents",netmind-token,64216311,204111980.0,,,N/A,1786766.0
OKX,"Artificial Intelligence (AI), Launchpad, Base Ecosystem, AI Applications, Clanker Ecosystem, Binance Alpha Spotlight",tokenbot-2,64133576,64133576.0,,,N/A,5395446.0
OKX,BNB Chain Ecosystem,aventis-ai,58431888,150513858.0,,,N/A,55204.0
OKX,"Infrastructure, Smart Contract Platform, BNB Chain Ecosystem, Avalanche Ecosystem, Polygon Ecosystem, Arbitrum Ecosystem, Ethereum Ecosystem, Optimism Ecosystem, Layer 2 (L2), Base Ecosystem, Binance Launchpad, Modular Blockchain, Layer 3 (L3), Rollup, Proof of Stake (PoS), Appchains, Binance Labs Portfolio",cartesi,63322076,73681339.0,,,N/A,7569031.0
OKX,"Polkadot Ecosystem, Real World Assets (RWA), Coinbase Ventures Portfolio, Circle Ventures Portfolio, Galaxy Digital Portfolio, RWA Protocol",centrifuge,63174971,69223201.0,2451.027449278442,4561.986596120146,0.08,1163276.0
OKX,,ark,62791204,63337663.0,,,N/A,6974039.0
OKX,Ethereum Ecosystem,devve,62610445,85973885.0,,,N/A,1413562.0
OKX,"Smart Contract Platform, Layer 2 (L2), Made in USA",metal,62149119,62149119.0,,,N/A,444289.0
OKX,"BNB Chain Ecosystem, Binance Megadrop, BTCfi",solv-protocol,61685259,349491553.0,,,N/A,49031818.0
OKX,"Artificial Intelligence (AI), Infrastructure, Gaming (GameFi), NFT, Solana Ecosystem, Arbitrum Ecosystem, Impossible Finance Launchpad, Ethereum Ecosystem, Animoca Brands Portfolio, Base Ecosystem",carv,61633195,308027106.0,,,N/A,6302828.0
OKX,"Decentralized Finance (DeFi), Lending/Borrowing Protocols, Ethereum Ecosystem, Real World Assets (RWA), Alameda Research Portfolio, Circle Ventures Portfolio, RWA Protocol",maple,61099321,155075246.0,,,N/A,2483235.0
OKX,"Exchange-based Tokens, BNB Chain Ecosystem, Centralized Exchange (CEX) Token, Polygon Ecosystem, Ethereum Ecosystem",bit2me,60674457,61287331.0,,,N/A,57240.0
OKX,"Artificial Intelligence (AI), Solana Ecosystem, Polygon Ecosystem, Gnosis Chain Ecosystem, Arbitrum Ecosystem, Celo Ecosystem, Ethereum Ecosystem, Optimism Ecosystem, Base Ecosystem, AI Agents, Mode Ecosystem, AI Agent Launchpad, Binance Alpha Spotlight, AI Framework, DeFAI",autonolas,60724190,177620580.0,,,N/A,308586.0
OKX,"Infrastructure, Smart Contract Platform",ardor,60637033,60637033.0,,,N/A,5334650.0
OKX,"SocialFi, Solana Ecosystem",access-protocol,60438034,131213711.0,,,N/A,982625.0
OKX,"Stablecoins, USD Stablecoin, Ethereum Ecosystem, Fiat-backed Stablecoin",binance-usd,60393275,60393275.0,,,N/A,1615.66
