Exchange,Category,Token CEX,Market Cap Today,FDV Today,Depth +2%,Depth -2%,Bid Ask Spread Percentage,24H Volume (USD)
OKX,"Smart Contract Platform, Decentralized Finance (DeFi), BNB Chain Ecosystem, Cosmos Ecosystem, Layer 1 (L1), Ethereum Ecosystem, Binance Launchpad, Osmosis Ecosystem, Proof of Stake (PoS), Pantera Capital Portfolio, Secret Ecosystem, GMCI Layer 1 Index, GMCI Index, Made in USA, Coinbase 50 Index",injective-protocol,998664869,1021890181.0,109805.49918939153,106687.21888379633,0.04,64396003.0
OKX,"Infrastructure, Smart Contract Platform, Layer 2 (L2), Bitcoin Sidechains, Stacks Ecosystem, SideChain, GMCI Layer 2 Index, GMCI 30 Index, Blockchain Capital Portfolio, GMCI Index, Made in USA, Coinbase 50 Index",blockstack,992535978,992535978.0,94619.72135213063,153269.73120181152,0.05,16316978.0
OKX,"Stablecoins, USD Stablecoin, Arbitrum Ecosystem, Ethereum Ecosystem, Fiat-backed Stablecoin",usual-usd,975942147,975942147.0,,,N/A,1664390.0
OKX,"Decentralized Finance (DeFi), Solana Ecosystem, Liquid Staking Tokens, Liquid Staked SOL, Liquid Staking",binance-staked-sol,969994497,969994497.0,,,N/A,2511129.0
OKX,"Polygon Ecosystem, Arbitrum Ecosystem, Liquid Staking Tokens, Ethereum Ecosystem, Optimism Ecosystem, Base Ecosystem, Liquid Staked ETH, Liquid Staking",rocket-pool-eth,959332275,959332275.0,,,N/A,2050970.0
OKX,"Smart Contract Platform, Layer 1 (L1), DWF Labs Portfolio",flare-networks,929957068,1572191789.0,125674.63114934663,139728.98700251724,0.07,10122429.0
OKX,"Artificial Intelligence (AI), Business Services, Infrastructure, Smart Contract Platform, Analytics, Avalanche Ecosystem, Polygon Ecosystem, Near Protocol Ecosystem, Harmony Ecosystem, Arbitrum Ecosystem, Ethereum Ecosystem, DePIN, Coinbase Ventures Portfolio, Multicoin Capital Portfolio, Proof of Stake (PoS), Energi Ecosystem, Sora Ecosystem, Made in USA, Coinbase 50 Index",the-graph,913687163,1032290782.0,50476.498563457586,60677.0456322607,0.1,27535668.0
OKX,"Smart Contract Platform, Layer 1 (L1), DePIN, Theta Ecosystem, Blockchain Capital Portfolio, Made in USA",theta-token,912845426,912845426.0,41706.26108335667,64135.07019895876,0.03,11105234.0
OKX,"Infrastructure, Decentralized Finance (DeFi), Polygon Ecosystem, Arbitrum Ecosystem, Ethereum Ecosystem, Optimism Ecosystem, Liquid Staking Governance Tokens, eGirl Capital Portfolio, Paradigm Portfolio, Coinbase Ventures Portfolio, Multicoin Capital Portfolio, Index Coop Defi Index, Alameda Research Portfolio, DragonFly Capital Portfolio, Andreessen Horowitz (a16z) Portfolio, GMCI DeFi Index, Delphi Ventures Portfolio, Liquid Staking, Index Coop Index, GMCI Index, Coinbase 50 Index",lido-dao,858148991,956532094.0,183603.5382764276,242812.8355603394,0.04,52838796.0
OKX,"BNB Chain Ecosystem, Solana Ecosystem, Polygon Ecosystem, Meme, Arbitrum Ecosystem, Ethereum Ecosystem, Aptos Ecosystem, Dog-Themed, Solana Meme, Neon Ecosystem, GMCI Meme Index, GMCI Index, Made in USA, Coinbase 50 Index",bonk,857899916,984618415.0,227822.46967056964,232317.40727823338,0.02,34968658.0
OKX,"Polygon Ecosystem, Bridged USDT, Bridged-Tokens, Bridged Stablecoins",polygon-bridged-usdt-polygon,845076470,845076470.0,,,N/A,7776063.0
OKX,"Crypto-Backed Tokens, BNB Chain Ecosystem, Avalanche Ecosystem, Arbitrum Ecosystem, Ethereum Ecosystem, Mantle Ecosystem, Base Ecosystem, Restaking, Berachain Ecosystem, Merlin Chain Ecosystem, Sonic Ecosystem, Sei v2 Ecosystem, Soneium Ecosystem, Corn Ecosystem",solv-protocol-solvbtc-bbn,838686401,838686401.0,,,N/A,9232117.0
OKX,"Smart Contract Platform, DWF Labs Portfolio, GMCI Layer 1 Index, GMCI Index, Made in USA, Coinbase 50 Index",eos,772036848,1068819678.0,212235.87433027185,357237.23566013004,0.02,43060300.0
OKX,"Liquid Staking Tokens, Ethereum Ecosystem, Mantle Ecosystem, Liquid Staked ETH, Liquid Staking",mantle-staked-ether,769582883,769582883.0,,,N/A,7375888.0
OKX,"Stablecoins, USD Stablecoin, Solana Ecosystem, Ethereum Ecosystem, Fiat-backed Stablecoin, Made in USA",paypal-usd,760739615,760739615.0,651599.7145977146,677944.4856700613,0.01,95654245.0
OKX,"Smart Contract Platform, Gaming (GameFi), NFT, Layer 1 (L1), Play To Earn, Ethereum Ecosystem, DWF Labs Portfolio, Gaming Platform, Binance Labs Portfolio, GalaChain Ecosystem, Made in USA",gala,754898867,754898869.0,72352.44004761966,95224.8632381596,0.06,40439583.0
OKX,"Smart Contract Platform, Layer 1 (L1), Tezos Ecosystem, Proof of Stake (PoS), GMCI Layer 1 Index, GMCI Index, Polychain Capital Portfolio, Made in USA, Coinbase 50 Index",tezos,741520039,756033763.0,49943.941036891185,53406.328779082636,0.01,14320972.0
OKX,"Stablecoins, Tokenized Assets, Tokenized Gold, Ethereum Ecosystem, Real World Assets (RWA), Tokenized Commodities",tether-gold,736139259,736139259.0,212212.3317186476,512606.305830721,0.01,7045154.0
OKX,"Crypto-Backed Tokens, BNB Chain Ecosystem, Wrapped-Tokens",wbnb,724425751,724425751.0,,,N/A,108403578.0
OKX,"Gaming (GameFi), NFT, Metaverse, Polygon Ecosystem, Play To Earn, Harmony Ecosystem, Ethereum Ecosystem, Animoca Brands Portfolio, Alleged SEC Securities, Binance Launchpad, Gaming Utility Token, Simulation Games, Energi Ecosystem, Binance Labs Portfolio, Coinbase 50 Index",the-sandbox,707628222,867951216.0,160691.3854008497,182493.54720305008,0.03,39488371.0
OKX,"Internet of Things (IOT), Ethereum Ecosystem, DePIN, DWF Labs Portfolio, Coinbase 50 Index",jasmycoin,700866504,723736580.0,,,N/A,63985831.0
OKX,"BNB Chain Ecosystem, Bridged USDC, Bridged-Tokens, Bridged Stablecoins",binance-bridged-usdc-bnb-smart-chain,699251913,699251913.0,,,N/A,60632792.0
OKX,"Storage, BNB Chain Ecosystem, Ethereum Ecosystem, DePIN, Alleged SEC Securities, Binance Launchpad, Tron Ecosystem, Energi Ecosystem, Binance Labs Portfolio, BitTorrent Ecosystem, GMCI DePIN Index, GMCI Index",bittorrent,691994825,694759024.0,11202.812405499033,14837.195971865958,0.04,14040038.0
OKX,"Smart Contract Platform, Decentralized Finance (DeFi), Layer 1 (L1), Berachain Ecosystem, Binance HODLer Airdrops, Outlier Ventures Portfolio, Polychain Capital Portfolio",berachain-bera,690773021,3201598001.0,511470.12161339,589972.9212677743,0.05,65704177.0
OKX,"Berachain Ecosystem, Bridged USDC, Bridged-Tokens, Bridged Stablecoins",stargate-bridged-usdc-berachain,688239969,688239969.0,,,N/A,1988600.0
OKX,"Decentralized Finance (DeFi), Solana Ecosystem, Liquid Staking Governance Tokens, Multicoin Capital Portfolio, Alameda Research Portfolio, Delphi Ventures Portfolio, Liquid Staking, Made in USA",jito-governance-token,684662309,2243210803.0,474912.9801832321,632513.4811018197,0.04,22293569.0
OKX,"Arbitrum Ecosystem, Bridged WBTC, Bridged-Tokens",arbitrum-bridged-wbtc-arbitrum-one,682978598,682978598.0,,,N/A,30743616.0
OKX,"Internet of Things (IOT), Smart Contract Platform, Layer 1 (L1), DePIN, DWF Labs Portfolio, IOTA EVM Ecosystem, Outlier Ventures Portfolio, Directed Acyclic Graph (DAG)",iota,679924524,852297450.0,130368.06906051273,162106.92903995363,0.05,13655357.0
OKX,"Smart Contract Platform, Bitcoin Fork, Proof of Work (PoW)",bitcoin-cash-sv,679256220,679257290.0,71246.82948882894,98755.7996257616,0.06,14051404.0
OKX,"Decentralized Finance (DeFi), Solana Ecosystem, Liquid Staking Tokens, Liquid Staked SOL, Liquid Staking",msol,651060534,651060534.0,,,N/A,8086970.0
OKX,"Smart Contract Platform, Sports, NFT, Layer 1 (L1), Animoca Brands Portfolio, Alleged SEC Securities, Multicoin Capital Portfolio, Proof of Stake (PoS), Flow Ecosystem, Andreessen Horowitz (a16z) Portfolio",flow,650316322,650316322.0,55673.779861360985,90822.73595327273,0.05,15777526.0
OKX,"Smart Contract Platform, Layer 1 (L1)",kaia,648183456,648183477.0,66382.57830299149,115482.71842788515,0.09,5898969.0
OKX,"Stablecoins, Tokenized Assets, Tokenized Gold, Ethereum Ecosystem, Real World Assets (RWA), Tokenized Commodities",pax-gold,632650673,632650673.0,,,N/A,17317640.0
OKX,"Stablecoins, USD Stablecoin, BNB Chain Ecosystem, Arbitrum Ecosystem, Ethereum Ecosystem, Fiat-backed Stablecoin",usdx-money-usdx,625894965,625894965.0,,,N/A,218706.0
OKX,"BNB Chain Ecosystem, Arbitrum Ecosystem, Liquid Staking Tokens, Base Ecosystem, Restaking, Liquid Restaking Tokens, Blast Ecosystem, Mode Ecosystem, Liquid Staking",renzo-restaked-eth,609490582,609490582.0,,,N/A,1543054.0
OKX,"Gaming (GameFi), NFT, BNB Chain Ecosystem, Metaverse, Meme, Play To Earn, Ethereum Ecosystem, Telegram Apps, Dog-Themed, DWF Labs Portfolio, RPG, On-chain Gaming, TokenFi Launchpad, GMCI Meme Index, GMCI Index",floki,606103165,627104700.0,189869.55736435542,218639.18906380658,0.05,55999435.0
OKX,"Smart Contract Platform, Proof of Stake (PoS), Made in China",neo,580181443,822602357.0,89504.7211029494,101662.29812837504,0.01,13622584.0
OKX,"NFT, Ethereum Ecosystem, Decentralized Identifier (DID), Name Service",ethereum-name-service,568308301,1713548245.0,119715.08143596924,155044.56475153068,0.02,26679999.0
OKX,"Decentralized Exchange (DEX), Exchange-based Tokens, Decentralized Finance (DeFi), Yield Farming, Automated Market Maker (AMM), Polygon Ecosystem, Fantom Ecosystem, Arbitrum Ecosystem, Ethereum Ecosystem, Optimism Ecosystem, Curve Ecosystem, DWF Labs Portfolio, Stablecoin Protocol, Energi Ecosystem, Sora Ecosystem, Binance Labs Portfolio, GMCI DeFi Index, GMCI Index, Coinbase 50 Index",curve-dao-token,559023276,962726379.0,96647.63282181782,230220.20404985984,0.05,68867690.0
OKX,"Communication, Internet of Things (IOT), Smart Contract Platform, Solana Ecosystem, DePIN, Multicoin Capital Portfolio, Proof of Stake (PoS), Alameda Research Portfolio, Pantera Capital Portfolio, Andreessen Horowitz (a16z) Portfolio, Made in USA, Coinbase 50 Index",helium,557582061,692516773.0,,,N/A,4465689.0
OKX,"Solana Ecosystem, Liquid Staking Tokens, Liquid Staked SOL, Liquid Staking",jupiter-staked-sol,555764534,555764534.0,,,N/A,2805499.0
OKX,"Decentralized Exchange (DEX), Exchange-based Tokens, Decentralized Finance (DeFi), Yield Farming, Automated Market Maker (AMM), BNB Chain Ecosystem, Arbitrum Ecosystem, Ethereum Ecosystem, Aptos Ecosystem, ZkSync Ecosystem, Linea Ecosystem, Base Ecosystem, Polygon zkEVM Ecosystem, Binance Labs Portfolio, opBNB Ecosystem, GMCI DeFi Index, GMCI Index",pancakeswap-token,555136174,718040768.0,,,N/A,151595493.0
OKX,"Business Services, Infrastructure, Decentralized Finance (DeFi), Oracle, Solana Ecosystem, Neon Ecosystem, Manta Network Ecosystem, Multicoin Capital Portfolio, GMCI DeFi Index, Delphi Ventures Portfolio, GMCI Index",pyth-network,552150874,1523179536.0,190146.37267435162,224970.46549179775,0.07,21978205.0
OKX,"Stablecoins, Ethereum Ecosystem",resolv-usr,541530215,541530215.0,,,N/A,2073858.0
OKX,"Smart Contract Platform, Layer 1 (L1), Binance Launchpad, DWF Labs Portfolio, Osmosis Ecosystem, Binance Labs Portfolio, Made in USA",kava,538439427,538439427.0,,,N/A,14654278.0
OKX,"Smart Contract Platform, Privacy, Layer 1 (L1), Zero Knowledge (ZK), Proof of Work (PoW), Pantera Capital Portfolio, Made in USA, Coinbase 50 Index",zcash,537111012,537130742.0,,,N/A,54358088.0
OKX,"Decentralized Finance (DeFi), Wallets, Polygon Ecosystem, Ethereum Ecosystem, Payment Solutions, Base Ecosystem, Sora Ecosystem, Made in USA",telcoin,527871881,574400213.0,,,N/A,2088569.0
OKX,"Gaming (GameFi), NFT, BNB Chain Ecosystem, Axie Infinity Ecosystem, Metaverse, Play To Earn, Harmony Ecosystem, Ethereum Ecosystem, Animoca Brands Portfolio, Alleged SEC Securities, Binance Launchpad, Ronin Ecosystem, Card Games, Breeding, Paradigm Portfolio, Gaming Governance Token, Gaming Utility Token, Andreessen Horowitz (a16z) Portfolio, Energi Ecosystem, Binance Labs Portfolio, Consensys Portfolio, Coinbase 50 Index",axie-infinity,527410529,892966933.0,20126.32872001489,51415.37800731169,0.03,19395041.0
OKX,"Stablecoins, Berachain Ecosystem",honey-3,526717650,526717650.0,,,N/A,8116454.0
OKX,"Artificial Intelligence (AI), Smart Contract Platform, Privacy, Masternodes, DePIN, DWF Labs Portfolio, Proof of Stake (PoS), Proof of Work (PoW)",beldex,518206652,744396810.0,,,N/A,3288228.0
OKX,"Smart Contract Platform, Layer 1 (L1), MultiversX Ecosystem, Binance Launchpad, DWF Labs Portfolio, Proof of Stake (PoS), Binance Labs Portfolio, GMCI Layer 1 Index, GMCI Index, Coinbase 50 Index",elrond-erd-2,514629542,514629542.0,14940.799693930143,19248.393665288342,0.11,10949429.0
OKX,"Entertainment, Gaming (GameFi), NFT, Metaverse, Polygon Ecosystem, Play To Earn, Ethereum Ecosystem, Animoca Brands Portfolio, Alleged SEC Securities, Simulation Games, Coinbase 50 Index",decentraland,513063780,602378798.0,63162.612408681896,76889.41368746193,0.07,32150642.0
OKX,"Infrastructure, Smart Contract Platform, Ethereum Ecosystem, Layer 2 (L2), Zero Knowledge (ZK), Starknet Ecosystem, Paradigm Portfolio, Coinbase Ventures Portfolio, Rollup, Multicoin Capital Portfolio, Alameda Research Portfolio, Pantera Capital Portfolio, GMCI Layer 2 Index, Consensys Portfolio, Sequoia Capital Portfolio, GMCI Index, Polychain Capital Portfolio",starknet,511811725,1865539022.0,147723.55976661475,199759.93486075074,0.05,22862822.0
OKX,"Smart Contract Platform, Gaming (GameFi), NFT, Layer 1 (L1), Play To Earn, Zero Knowledge (ZK), FTX Holdings, Ronin Ecosystem, Gaming Blockchains, SideChain, Andreessen Horowitz (a16z) Portfolio, Binance Labs Portfolio",ronin,501074971,808981764.0,41509.814392634966,50652.35206560663,0.06,17301729.0
OKX,"Stablecoins, USD Stablecoin, BNB Chain Ecosystem, Avalanche Ecosystem, Ethereum Ecosystem, Tron Ecosystem, Andreessen Horowitz (a16z) Portfolio, Fiat-backed Stablecoin",true-usd,495359536,495359536.0,,,N/A,21951674.0
OKX,"Solana Ecosystem, Meme, Dog-Themed, Solana Meme, GMCI Meme Index, GMCI Index",dogwifcoin,495125745,495125745.0,335568.27959378855,444629.34786621045,0.02,190114683.0
OKX,"Decentralized Exchange (DEX), Decentralized Finance (DeFi), Yield Farming, Automated Market Maker (AMM), Solana Ecosystem, Launchpad, GMCI DeFi Index, GMCI Index",raydium,489498459,934067527.0,39438.58758178913,49680.45923188014,0.05,54999985.0
OKX,"Decentralized Exchange (DEX), Smart Contract Platform, Decentralized Finance (DeFi), Cosmos Ecosystem, Perpetuals, Layer 1 (L1), Osmosis Ecosystem, Appchains, DragonFly Capital Portfolio, DeFiance Capital Portfolio, Andreessen Horowitz (a16z) Portfolio, GMCI DeFi Index, Delphi Ventures Portfolio, GMCI Index, Polychain Capital Portfolio, Made in USA",dydx-chain,485231302,485231302.0,152740.17486374898,228217.16232286047,0.03,12422927.0
OKX,"BNB Chain Ecosystem, Ethereum Ecosystem, BTCfi",pumpbtc,479406713,479406713.0,,,N/A,450.89
OKX,"Artificial Intelligence (AI), Solana Ecosystem, Ethereum Ecosystem, Base Ecosystem, AI Agents, Virtuals Protocol Ecosystem, AI Agent Launchpad, Binance Alpha Spotlight",virtual-protocol,473640091,729236673.0,,,N/A,163693732.0
OKX,"BNB Chain Ecosystem, Meme, Binance-Peg Tokens",binance-peg-dogecoin,451390499,451390499.0,,,N/A,1190081.0
OKX,"Ethereum Ecosystem, Mantle Ecosystem, Restaking, Liquid Restaking Tokens, Liquid Restaked ETH",mantle-restaked-eth,447008145,447008145.0,,,N/A,5397539.0
OKX,"Base Ecosystem, Bridged WETH, Bridged-Tokens",l2-standard-bridged-weth-base,444791385,444791385.0,,,N/A,227982292.0
OKX,"USD Stablecoin, Polygon Ecosystem, Bridged USDC, Fiat-backed Stablecoin, Bridged-Tokens, Bridged Stablecoins",bridged-usdc-polygon-pos-bridge,441607479,441607479.0,,,N/A,10318608.0
OKX,"Smart Contract Platform, Sports, NFT, Layer 1 (L1), Ethereum Ecosystem, Alleged SEC Securities, Chiliz Ecosystem, Binance Labs Portfolio, Coinbase 50 Index",chiliz,441456565,441456565.0,64964.61427578054,107911.21176599141,0.06,50389459.0
OKX,"Artificial Intelligence (AI), Smart Contract Platform, Storage, Layer 1 (L1), DePIN, Coinbase Ventures Portfolio, Multicoin Capital Portfolio, Andreessen Horowitz (a16z) Portfolio, Blockchain Capital Portfolio",arweave,435603754,435603754.0,44435.50214725043,93408.64668364526,0.03,22186453.0
OKX,"Smart Contract Platform, DWF Labs Portfolio, Proof of Work (PoW), GMCI Layer 1 Index, Sequoia Capital Portfolio, GMCI Index, Made in China",conflux-token,431965063,482248070.0,65915.97814429623,163765.3375888878,0.12,44207665.0
OKX,"Tokenized BTC, Avalanche Ecosystem, Bridged-Tokens",bitcoin-avalanche-bridged-btc-b,431688953,431688953.0,,,N/A,22056471.0
OKX,"Decentralized Exchange (DEX), Decentralized Finance (DeFi), Automated Market Maker (AMM), Base Ecosystem, Binance Alpha Spotlight, Made in USA",aerodrome-finance,429703380,831820921.0,,,N/A,12884892.0
OKX,"Smart Contract Platform, BNB Chain Ecosystem, Layer 1 (L1), Ethereum Ecosystem, Base Ecosystem, Proof of Stake (PoS), Pantera Capital Portfolio, Made in USA",chain-2,429062356,630640212.0,,,N/A,26057894.0
OKX,"Gaming (GameFi), NFT, Polygon Ecosystem, Ethereum Ecosystem, Animoca Brands Portfolio, Gaming Blockchains, Gaming Governance Token, Gaming Utility Token, Andreessen Horowitz (a16z) Portfolio, ApeChain Ecosystem, Airdropped Tokens by NFT Projects, Coinbase 50 Index",apecoin,425190394,531849988.0,98601.1464642501,130852.37742400364,0.04,31611865.0
OKX,"NFT, BNB Chain Ecosystem, Ethereum Ecosystem, Tron Ecosystem",apenft,425027950,429271043.0,47331.01404082538,69139.60652105384,0.07,15469376.0
OKX,"Smart Contract Platform, Layer 1 (L1), Bitcoin Fork, Proof of Work (PoW)",ecash,424801586,424801854.0,,,N/A,15580937.0
OKX,"Arbitrum Ecosystem, Ethereum Ecosystem, Optimism Ecosystem, Base Ecosystem, BTCfi",clbtc,420418592,420418592.0,,,N/A,10.04
OKX,"Solana Ecosystem, Meme, Solana Meme, Binance HODLer Airdrops, Airdropped Tokens by NFT Projects, Made in USA",pudgy-penguins,417064159,509047426.0,142878.43119505676,187978.4553434155,0.06,59763083.0
OKX,"Arbitrum Ecosystem, Bridged WETH, Bridged-Tokens",arbitrum-bridged-weth-arbitrum-one,416554708,416554708.0,,,N/A,74609201.0
OKX,"Decentralized Exchange (DEX), Infrastructure, Smart Contract Platform, Exchange-based Tokens, Decentralized Finance (DeFi), Bridge Governance Tokens, Multicoin Capital Portfolio, Proof of Stake (PoS), Delphi Ventures Portfolio",thorchain,413019881,499875279.0,,,N/A,81009835.0
OKX,"Smart Contract Platform, Layer 1 (L1), Bitcoin Sidechains, SideChain",coredaoorg,410852945,865416017.0,48536.14190484623,116084.38255867388,0.05,8823634.0
OKX,"Tokenized Assets, Solana Ecosystem, Polygon Ecosystem, Ethereum Ecosystem, Real World Assets (RWA), Tokenized Treasury Bonds (T-Bonds)",ousg,408882061,408882061.0,,,N/A,0.0
OKX,"Stablecoins, USD Stablecoin, Blast Ecosystem, Crypto-backed Stablecoin, Fiat-backed Stablecoin",usdb,406071132,406071132.0,,,N/A,627600.0
OKX,"Ethereum Ecosystem, Real World Assets (RWA)",hashnote-usyc,400450325,400450325.0,,,N/A,10.66
OKX,"Artificial Intelligence (AI), Solana Ecosystem, DePIN, Polychain Capital Portfolio",grass,393205918,1427371253.0,,,N/A,29175659.0
OKX,"Decentralized Finance (DeFi), BNB Chain Ecosystem, Liquid Staking Tokens, Sui Ecosystem, Liquid Staking",lorenzo-stbtc,391600033,391600033.0,,,N/A,422.35
OKX,"Decentralized Finance (DeFi), Liquid Staking Tokens, Berachain Ecosystem, Liquid Staking",infrared-bera,388994499,388994499.0,,,N/A,64468.0
OKX,"Smart Contract Platform, BNB Chain Ecosystem, Polygon Ecosystem, Harmony Ecosystem, Moonriver Ecosystem, Moonbeam Ecosystem, Ethereum Ecosystem, Layer 2 (L2), Zero Knowledge (ZK), Animoca Brands Portfolio, Alleged SEC Securities, Binance Launchpad, FTX Holdings, Coinbase Ventures Portfolio, Rollup, Proof of Stake (PoS), Alameda Research Portfolio, DragonFly Capital Portfolio, Energi Ecosystem, Sora Ecosystem, Binance Labs Portfolio, GMCI Layer 2 Index, GMCI 30 Index, Galaxy Digital Portfolio, GMCI Index, Coinbase 50 Index",matic-network,386497375,2195779961.0,,,N/A,10062964.0
OKX,"Stablecoins, Solana Ecosystem, Arbitrum Ecosystem, Ethereum Ecosystem, Aptos Ecosystem, Sui Ecosystem, Mantle Ecosystem, Osmosis Ecosystem, Fiat-backed Stablecoin, Yield Tokenization Product",ondo-us-dollar-yield,382627770,589435520.0,,,N/A,1877771.0
OKX,"Solana Ecosystem, Meme, Ethereum Ecosystem, Base Ecosystem, Murad Picks, Stock market-themed",spx6900,381917383,381917383.0,,,N/A,19059788.0
OKX,"Infrastructure, BNB Chain Ecosystem, Avalanche Ecosystem, Polygon Ecosystem, Fantom Ecosystem, Arbitrum Ecosystem, Moonbeam Ecosystem, Ethereum Ecosystem, Optimism Ecosystem, Interoperability, Bridge Governance Tokens, Base Ecosystem, Osmosis Ecosystem, Cross-chain Communication, Secret Ecosystem, Galaxy Digital Portfolio, Polychain Capital Portfolio, Made in USA",axelar,381810140,488909437.0,,,N/A,17964498.0
OKX,"Decentralized Finance (DeFi), Yield Farming, BNB Chain Ecosystem, Lending/Borrowing Protocols, Avalanche Ecosystem, Polygon Ecosystem, Near Protocol Ecosystem, Harmony Ecosystem, Arbitrum Ecosystem, Ethereum Ecosystem, Base Ecosystem, Paradigm Portfolio, Index Coop Defi Index, Energi Ecosystem, Sora Ecosystem, Index Coop Index, Polychain Capital Portfolio, Made in USA",compound-governance-token,379399048,426426225.0,27175.018528961144,43717.937865614535,0.07,42869783.0
OKX,"BNB Chain Ecosystem, Wallets, Account Abstraction, Energi Ecosystem",trust-wallet-token,367784781,882718995.0,,,N/A,10465964.0
OKX,"Artificial Intelligence (AI), Smart Contract Platform, Storage, BNB Chain Ecosystem, Layer 1 (L1), Ethereum Ecosystem, DePIN, DWF Labs Portfolio, Osmosis Ecosystem, GMCI DePIN Index, GMCI Index",aioz-network,367476030,372542730.0,,,N/A,28000458.0
OKX,"Liquid Staking Tokens, Ethereum Ecosystem, Restaking, Liquid Restaking Tokens, Ether.fi Ecosystem, Liquid Staked ETH, Liquid Staking",ether-fi-staked-eth,363878350,4402693024.0,,,N/A,4728.71
OKX,"Decentralized Finance (DeFi), Near Protocol Ecosystem, Ethereum Ecosystem, Payment Solutions, Alleged SEC Securities, Pantera Capital Portfolio, Energi Ecosystem, Made in USA",amp-token,359826618,425775372.0,,,N/A,25990385.0
OKX,"Crypto-Backed Tokens, Decentralized Finance (DeFi), Rebase Tokens, Arbitrum Ecosystem, Ethereum Ecosystem, Berachain Ecosystem",olympus,358969784,459688123.0,,,N/A,194943.0
OKX,"Crypto-Backed Tokens, Decentralized Finance (DeFi), Tokenized BTC, Solana Ecosystem, Polygon Ecosystem, Arbitrum Ecosystem, Ethereum Ecosystem, Optimism Ecosystem, Base Ecosystem",tbtc,355159697,355159697.0,,,N/A,1757177.0
OKX,"Decentralized Exchange (DEX), Decentralized Finance (DeFi), Yield Farming, Automated Market Maker (AMM), BNB Chain Ecosystem, Derivatives, Lending/Borrowing Protocols, Arbitrum Ecosystem, Ethereum Ecosystem, Optimism Ecosystem, Fixed Interest, Real World Assets (RWA), LSDFi, Base Ecosystem, Restaking, LRTfi, Liquid Restaking Governance Tokens, Yield Tokenization Protocol, Binance Labs Portfolio, GMCI DeFi Index, Sonic Ecosystem, Liquid Staking, GMCI Index, BTCfi",pendle,355060970,567179702.0,49742.204652864035,52728.852791095225,0.09,32717280.0
OKX,"Decentralized Finance (DeFi), Arbitrum Ecosystem, Liquid Staking Tokens, Ethereum Ecosystem, Optimism Ecosystem, Base Ecosystem",cgeth-hashkey-cloud,352900345,352900345.0,,,N/A,5.47
OKX,"Stablecoins, Decentralized Finance (DeFi), USD Stablecoin, BNB Chain Ecosystem, Seigniorage, Avalanche Ecosystem, Polygon Ecosystem, Fantom Ecosystem, Harmony Ecosystem, Arbitrum Ecosystem, Moonriver Ecosystem, Moonbeam Ecosystem, Ethereum Ecosystem, Optimism Ecosystem, Stablecoin Protocol, Aurora Ecosystem, Polygon zkEVM Ecosystem, Evmos Ecosystem, Boba Network Ecosystem, Fiat-backed Stablecoin",frax,352764792,352764792.0,,,N/A,5734505.0
OKX,"Smart Contract Platform, Decentralized Finance (DeFi), Coinbase Ventures Portfolio, DeFiance Capital Portfolio, Pantera Capital Portfolio, Binance Labs Portfolio, Galaxy Digital Portfolio",terra-luna,352110949,420279177.0,57962.51364103234,61767.7693452839,0.03,18349417.0
OKX,"Decentralized Finance (DeFi), Liquid Staking Tokens, Ethereum Ecosystem, Liquid Staked ETH, Liquid Staking",stakewise-v3-oseth,345481361,345481361.0,,,N/A,95985.0
OKX,"Solana Ecosystem, Meme, Solana Meme, AI Meme, Pump.fun Ecosystem, Terminal of Truths, Binance Alpha Spotlight",fartcoin,345133549,345133549.0,,,N/A,79044573.0
OKX,"Artificial Intelligence (AI), Analytics, Base Ecosystem, Binance HODLer Airdrops",kaito,343163963,1421622862.0,275346.1313988855,309769.7400303204,0.02,233850759.0
OKX,"Smart Contract Platform, Gaming (GameFi), NFT, BNB Chain Ecosystem, Binance Launchpool, Avalanche Ecosystem, Ethereum Ecosystem, DWF Labs Portfolio, Gaming Blockchains, Avalanche L1",beam-2,338538660,393851866.0,,,N/A,13866288.0
OKX,"Meme, Base Ecosystem, Frog-Themed, Base Meme, The Boy’s Club",based-brett,334368271,334368271.0,,,N/A,13906218.0
OKX,"Mantle Ecosystem, Bridged USDT, Bridged-Tokens, Bridged Stablecoins",mantle-bridged-usdt-mantle,332312042,332312042.0,,,N/A,1494207.0
OKX,"Artificial Intelligence (AI), Smart Contract Platform, DePIN, Osmosis Ecosystem, Proof of Stake (PoS), Archway Ecosystem, Made in USA",akash-network,328963431,330086975.0,,,N/A,6846832.0
OKX,"Smart Contract Platform, Zero Knowledge (ZK), FTX Holdings, Paradigm Portfolio, Coinbase Ventures Portfolio, Multicoin Capital Portfolio, Proof of Stake (PoS), Pantera Capital Portfolio, Circle Ventures Portfolio, Privacy Blockchain, Polychain Capital Portfolio, Made in USA, Coinbase 50 Index",mina-protocol,328063457,328064424.0,42707.20583552941,67185.42328094624,0.04,14195720.0
OKX,"Decentralized Exchange (DEX), Smart Contract Platform, Decentralized Finance (DeFi), Prediction Markets, Layer 1 (L1), Gnosis Chain Ecosystem, MEV Protection, Arbitrum Ecosystem, Ethereum Ecosystem, SideChain, Energi Ecosystem",gnosis,326214113,377914155.0,,,N/A,14840668.0
OKX,"Stablecoins, USD Stablecoin, BNB Chain Ecosystem, Avalanche Ecosystem, Polygon Ecosystem, Optimism Ecosystem, Fiat-backed Stablecoin, Binance-Peg Tokens",binance-peg-busd,324354904,324354904.0,,,N/A,4211657.0
OKX,"Decentralized Finance (DeFi), Arbitrum Ecosystem, Ethereum Ecosystem, Real World Assets (RWA), Base Ecosystem, Coinbase Ventures Portfolio, Energi Ecosystem, Made in USA",reserve-rights-token,323197627,578173754.0,20846.185635078888,80338.21520495418,0.03,20153683.0
