OKX,"Stablecoins, USD Stablecoin, Ethereum Ecosystem, Sonic Ecosystem, Fiat-backed Stablecoin",frax-usd,86135565,86135565.0,,,N/A,3867504.0
OKX,Layer 1 (L1),oec-token,86435634,86435634.0,1662.5475057248755,5835.896954523941,0.18,347919.0
OKX,"Smart Contract Platform, Ethereum Ecosystem, Layer 2 (L2), Zero Knowledge (ZK), Restaking, Zircuit Ecosystem",zircuit,85634770,390149233.0,,,N/A,45506843.0
OKX,"Business Services, Polygon Ecosystem, Ethereum Ecosystem",request-network,85384782,110937622.0,,,N/A,8613375.0
OKX,"Decentralized Exchange (DEX), Decentralized Finance (DeFi), Arbitrum Ecosystem, Ethereum Ecosystem",tokenlon,85408658,102803514.0,,,N/A,103042.0
OKX,"Crypto-Backed Tokens, Ethereum Ecosystem",temple,85151253,85319005.0,,,N/A,8223.15
OKX,"BNB Chain Ecosystem, Liquid Staking Tokens",astherus-staked-bnb,83451366,83451366.0,,,N/A,515.99
OKX,"Polygon Ecosystem, XRP Ledger Ecosystem",crypto-trading-fund,85500994,85500994.0,,,N/A,13799.8
OKX,"Infrastructure, Solana Ecosystem, Animoca Brands Portfolio, Cross-chain Communication, OKX Ventures Portfolio",zeus-network,85957953,224562757.0,36605.97223510024,37564.021362103886,0.04,7715432.0
OKX,"SocialFi, Coinbase Ventures Portfolio, Pantera Capital Portfolio, Andreessen Horowitz (a16z) Portfolio, Sequoia Capital Portfolio",deso,87175277,89461701.0,,,N/A,8804036.0
OKX,"Artificial Intelligence (AI), Oracle, Ethereum Ecosystem, DePIN, Energi Ecosystem, Sora Ecosystem, GMCI DePIN Index, GMCI Index",iexec-rlc,83939332,100890395.0,,,N/A,16322106.0
OKX,"NFT, Solana Ecosystem, NFT Marketplace",tensor,83872598,250659843.0,134340.65815615666,169580.50705804024,0.12,18194394.0
OKX,"Smart Contract Platform, Layer 1 (L1)",ong,83331664,204272780.0,,,N/A,3128367.0
OKX,"Smart Contract Platform, Bitcoin Sidechains, Stacks Ecosystem, SideChain",sbtc-2,82772794,82772794.0,,,N/A,51150.0
OKX,"DaoMaker Launchpad, Ethereum Ecosystem, Real World Assets (RWA), Sequoia Capital Portfolio, Made in USA",clearpool,83040298,109271320.0,,,N/A,4349508.0
OKX,"Solana Ecosystem, Polygon Ecosystem, DePIN, Pantera Capital Portfolio",geodnet,82391519,256993056.0,,,N/A,260490.0
OKX,"Smart Contract Platform, Polkadot Ecosystem, Layer 1 (L1), Coinbase Ventures Portfolio, Binance Labs Portfolio",moonbeam,82520139,100488156.0,6503.8412930288605,18641.918890383706,0.12,4888531.0
OKX,Ethereum Ecosystem,dkargo,81805266,87274466.0,,,N/A,1332005.0
OKX,BNB Chain Ecosystem,metfi-2,82149947,192359481.0,,,N/A,390978.0
OKX,"Artificial Intelligence (AI), Smart Contract Platform, Gaming (GameFi), NFT, BNB Chain Ecosystem, Layer 1 (L1), Ethereum Ecosystem, Modular Blockchain, Chromia Ecosystem",chromaway,82591004,82591004.0,,,N/A,10559185.0
OKX,"Berachain Ecosystem, Bridged USDT, Bridged-Tokens, Ink Ecosystem, Bridged Stablecoins",usdt0,81096547,81096547.0,,,N/A,942476.0
OKX,BNB Chain Ecosystem,bitdca,80757189,86740832.0,,,N/A,21045.0
OKX,"Stablecoins, Decentralized Finance (DeFi), Lending/Borrowing Protocols, Ethereum Ecosystem",syrupusdc,80265494,80271778.0,,,N/A,276467.0
OKX,"Smart Contract Platform, Gaming (GameFi), NFT, Layer 1 (L1), Play To Earn, Ethereum Ecosystem, Animoca Brands Portfolio, Gaming Blockchains, Pantera Capital Portfolio, OKX Ventures Portfolio",wax,80927498,87075498.0,10498.937283961213,13034.581456452157,0.09,6147795.0
OKX,"Smart Contract Platform, Layer 2 (L2), eGirl Capital Portfolio, Paradigm Portfolio, Blast Ecosystem",blast,81048780,306537500.0,,,N/A,13206344.0
OKX,"Decentralized Finance (DeFi), Ethereum Ecosystem",avalon-2,77910095,480185479.0,,,N/A,142921543.0
OKX,"Gaming (GameFi), Play To Earn, Ethereum Ecosystem, RPG, Alameda Research Portfolio, Circle Ventures Portfolio, OKX Ventures Portfolio, MMO",big-time,80486718,227282483.0,144548.03348134118,191250.18427352712,0.07,49333668.0
OKX,"Stablecoins, USD Stablecoin, Solana Ecosystem, Ethereum Ecosystem, Multicoin Capital Portfolio, Fiat-backed Stablecoin",paxos-standard,79234360,79234360.0,,,N/A,2929518.0
OKX,"Artificial Intelligence (AI), Virtual Reality, Launchpad, Ethereum Ecosystem, Telegram Apps, Discord Bots, PAAL AI Launchpad, AI Agents, AI Applications, AI Agent Launchpad, Binance Alpha Spotlight, AI Framework, DeFAI, Made in USA",paal-ai,78847899,88691540.0,,,N/A,6650131.0
OKX,"Gaming (GameFi), NFT, BNB Chain Ecosystem, Metaverse, Collectibles, Polygon Ecosystem, Play To Earn, Harmony Ecosystem, Guild and Scholarship, Ethereum Ecosystem, Animoca Brands Portfolio, Base Ecosystem, DWF Labs Portfolio, Ronin Ecosystem, Andreessen Horowitz (a16z) Portfolio, Delphi Ventures Portfolio",yield-guild-games,79505880,193674241.0,27154.79114925711,73505.81728042514,0.1,20018067.0
OKX,"Internet of Things (IOT), BNB Chain Ecosystem, Ethereum Ecosystem, DePIN, DWF Labs Portfolio",mass-vehicle-ledger,78784963,83277897.0,,,N/A,413368.0
OKX,"Exchange-based Tokens, Centralized Exchange (CEX) Token, Near Protocol Ecosystem, Harmony Ecosystem, Ethereum Ecosystem, Multicoin Capital Portfolio, Alameda Research Portfolio, Elastos Smart Contract Chain Ecosystem, Sequoia Capital Portfolio, Made in China",huobi-token,77986123,98359550.0,,,N/A,14014.11
OKX,"Decentralized Exchange (DEX), Decentralized Finance (DeFi), Yield Farming, Automated Market Maker (AMM), Solana Ecosystem, Coinbase Ventures Portfolio, DeFiance Capital Portfolio, Made in USA",orca,78500688,147345635.0,,,N/A,30597684.0
OKX,"Blast Ecosystem, Bridged WETH, Bridged-Tokens",l2-standard-bridged-weth-blast,77977886,77487108.0,,,N/A,357101.0
OKX,"Smart Contract Platform, Wallets, Layer 2 (L2), Osmosis Ecosystem",islamic-coin,78029982,943842850.0,,,N/A,1112294.0
OKX,Smart Contract Platform,songbird,77416847,91988613.0,,,N/A,323160.0
OKX,"Meme, Ethereum Ecosystem, PolitiFi",constitutiondao,77204346,77204346.0,61869.89751975258,174047.717037971,0.07,37774729.0
OKX,"Gaming (GameFi), Play To Earn, Guild and Scholarship, Ethereum Ecosystem, Animoca Brands Portfolio, Base Ecosystem, DWF Labs Portfolio, Ronin Ecosystem, Coinbase Ventures Portfolio, DeFiance Capital Portfolio, Pantera Capital Portfolio, Binance Labs Portfolio, MMO",zentry,77069695,113142296.0,36731.97308302497,47142.08675682896,0.17,11900313.0
OKX,"Smart Contract Platform, Privacy, Proof of Work (PoW), Made in USA",verge,76968924,77122885.0,,,N/A,8139651.0
OKX,"Exchange-based Tokens, Centralized Exchange (CEX) Token, Ethereum Ecosystem",bitmart-token,76182211,143518254.0,,,N/A,4050512.0
OKX,"Sports, BNB Chain Ecosystem",pixer-eternity,75777503,352145244.0,,,N/A,159186.0
OKX,"Stablecoins, USD Stablecoin, BNB Chain Ecosystem, Fantom Ecosystem, Arbitrum Ecosystem, Ethereum Ecosystem, Optimism Ecosystem, Base Ecosystem, Crypto-backed Stablecoin, Fiat-backed Stablecoin",dola-usd,75742838,203797780.0,,,N/A,4458384.0
OKX,"Artificial Intelligence (AI), BNB Chain Ecosystem, Solana Ecosystem, Ethereum Ecosystem, AI Agents, Alameda Research Portfolio",delysium,76691185,146465675.0,,,N/A,2652263.0
OKX,"Ethereum Ecosystem, Stablecoin Protocol",level-usd,75813192,75813192.0,,,N/A,363359.0
OKX,"Software as a service, Polygon Ecosystem, Ethereum Ecosystem, Decentralized Identifier (DID), Pantera Capital Portfolio, Energi Ecosystem, Blockchain Capital Portfolio",civic,76101763,94889977.0,13667.68652299117,30402.237432787635,0.05,10917555.0
OKX,"Smart Contract Platform, Layer 1 (L1), Osmosis Ecosystem, XRP Ledger Ecosystem",coreum,74922485,74922485.0,,,N/A,330564.0
OKX,"Smart Contract Platform, Proof of Stake (PoS)",stratis,75594253,83293121.0,,,N/A,850960.0
OKX,"Decentralized Finance (DeFi), Ethereum Ecosystem",elixir-finance,74392033,465942723.0,,,N/A,50976388.0
OKX,"Artificial Intelligence (AI), Smart Contract Platform, Decentralized Finance (DeFi), Analytics, NFT, BNB Chain Ecosystem, Launchpad, Ethereum Ecosystem, Telegram Apps, Discord Bots, ChainGPT Launchpad, Poolz Finance Launchpad, AI Agents, AI Applications, Binance Alpha Spotlight, AI Framework, DeFAI",chaingpt,75384997,93625434.0,,,N/A,37778034.0
OKX,"Smart Contract Platform, Cosmos Ecosystem, Modular Blockchain, Osmosis Ecosystem, Rollups-as-a-Service (RaaS)",dymension,74936636,298726960.0,,,N/A,8738982.0
OKX,"Decentralized Finance (DeFi), Wallets, Ethereum Ecosystem, Pundi AIFX Omnilayer Ecosystem",pundi-x-2,75012107,75012107.0,,,N/A,10996356.0
OKX,"Optimism Ecosystem, Bridged WBTC, Bridged-Tokens",optimism-bridged-wbtc-optimism,74599403,74599403.0,,,N/A,3692300.0
OKX,"Smart Contract Platform, Gaming (GameFi), Layer 1 (L1), Proof of Stake (PoS), Gaming Blockchains",oasys,74291107,192760609.0,2411.053451200603,3235.799933087845,0.16,507567.0
OKX,"Stablecoins, USD Stablecoin, Osmosis Ecosystem, Fiat-backed Stablecoin",usdx,73701252,73701252.0,,,N/A,21319.0
OKX,"Meme, Ethereum Ecosystem, Mantle Ecosystem",puff-the-dragon,73165157,73165157.0,,,N/A,93019.0
OKX,"Artificial Intelligence (AI), Infrastructure, Ethereum Ecosystem, AI Framework, Made in USA",arcblock,73446288,138577901.0,,,N/A,759495.0
OKX,"BNB Chain Ecosystem, Solana Ecosystem, Polygon Ecosystem, Meme, Ethereum Ecosystem, Cronos Ecosystem, Dog-Themed, Elon Musk-Inspired, Fuse Ecosystem",dogelon-mars,73154779,133093392.0,5958.8286455406405,14240.06435560349,0.15,6091340.0
OKX,"Exchange-based Tokens, Centralized Exchange (CEX) Token, Ethereum Ecosystem",hashkey-ecopoints,72809668,549506926.0,,,N/A,2271913.0
OKX,"Artificial Intelligence (AI), Launchpad, Base Ecosystem, AI Applications, Clanker Ecosystem, Binance Alpha Spotlight",tokenbot-2,71943112,71943112.0,,,N/A,6934581.0
OKX,"Artificial Intelligence (AI), BNB Chain Ecosystem, Ethereum Ecosystem, DragonFly Capital Portfolio, Binance Labs Portfolio, Delphi Ventures Portfolio, OKX Ventures Portfolio, Binance HODLer Airdrops, AI Agent Launchpad, Binance Alpha Spotlight, AI Framework",myshell,73413539,271901997.0,,,N/A,60364709.0
OKX,Retail,milk-alliance,72655403,163102910.0,,,N/A,9309869.0
OKX,"Business Services, Decentralized Finance (DeFi), Oracle, Polygon Ecosystem, Gnosis Chain Ecosystem, Arbitrum Ecosystem, Ethereum Ecosystem, Optimism Ecosystem, Manta Network Ecosystem, Binance Labs Portfolio, Lisk Ecosystem, Made in USA",tellor,72743193,74860062.0,32231.113974984146,54154.547709309234,0.04,23427997.0
OKX,"Stablecoins, Decentralized Finance (DeFi), USD Stablecoin, BNB Chain Ecosystem, Polygon Ecosystem, Gnosis Chain Ecosystem, Arbitrum Ecosystem, Ethereum Ecosystem, Optimism Ecosystem, Base Ecosystem, Crypto-backed Stablecoin, Fiat-backed Stablecoin",crvusd,71168034,71168034.0,,,N/A,8836100.0
OKX,"Stablecoins, Decentralized Finance (DeFi), USD Stablecoin, BNB Chain Ecosystem, Avalanche Ecosystem, Arbitrum Ecosystem, Liquid Staking Tokens, Ethereum Ecosystem, Optimism Ecosystem, Fiat-backed Stablecoin",staked-frax,70286198,70286198.0,,,N/A,9171.88
OKX,"Entertainment, Gaming (GameFi), NFT, Axie Infinity Ecosystem, Play To Earn, Ethereum Ecosystem, Ronin Ecosystem, Gaming Utility Token",smooth-love-potion,70827701,70827701.0,8264.790791201203,19110.96133021419,0.12,8531547.0
OKX,"Gaming (GameFi), Play To Earn, TON Ecosystem, Tap to Earn, Arcade Games",watcoin-2,70476395,78241494.0,,,N/A,820881.0
OKX,"Decentralized Finance (DeFi), Lending/Borrowing Protocols, Ethereum Ecosystem, Real World Assets (RWA), Coinbase Ventures Portfolio, Andreessen Horowitz (a16z) Portfolio, RWA Protocol, Made in USA",goldfinch,70156355,86779504.0,,,N/A,611963.0
OKX,"Gaming (GameFi), NFT, Collectibles, Play To Earn, Ethereum Ecosystem, Base Ecosystem, Energi Ecosystem",ecomi,69596559,79853186.0,3222.615270237305,7061.208787188103,0.08,1907154.0
OKX,"Tokenized Assets, Polygon Ecosystem, Arbitrum Ecosystem, Ethereum Ecosystem, Real World Assets (RWA), Starknet Ecosystem, Tokenized Treasury Bills (T-Bills)",spiko-us-t-bills-money-market-fund,69530892,69530892.0,,,N/A,0.0
OKX,"Lending/Borrowing Protocols, Solana Ecosystem, FTX Holdings, Coinbase Ventures Portfolio, Alameda Research Portfolio, DragonFly Capital Portfolio",solend,69360419,137087973.0,,,N/A,9212.46
OKX,"Smart Contract Platform, Polkadot Ecosystem, Layer 1 (L1), DePIN, Outlier Ventures Portfolio",peaq-2,70417189,412739703.0,,,N/A,11574869.0
OKX,"Decentralized Exchange (DEX), Decentralized Finance (DeFi), Yield Farming, Automated Market Maker (AMM), BNB Chain Ecosystem, Avalanche Ecosystem, Arbitrum Ecosystem, Mantle Ecosystem, DeFiance Capital Portfolio, Delphi Ventures Portfolio, Dex Aggregator",joe,69896650,89510923.0,20410.179740515094,12748.550551488055,0.17,7923099.0
OKX,"Smart Contract Platform, Layer 1 (L1), DWF Labs Portfolio, Radix Ecosystem",radix,68969435,84453297.0,,,N/A,1477242.0
OKX,"Ethereum Ecosystem, DePIN",dent,69020397,72155586.0,,,N/A,5675001.0
OKX,"NFT, Ethereum Ecosystem",superrare,68919290,86109188.0,,,N/A,117465812.0
OKX,"Optimism Ecosystem, Bridged WETH, Bridged-Tokens",l2-standard-bridged-weth-optimism,68654764,68680900.0,,,N/A,41767317.0
OKX,"Smart Contract Platform, Gaming (GameFi), NFT, Binance Launchpool, Arbitrum Ecosystem, Layer 3 (L3), XAI Ecosystem, Gaming Blockchains, Outlier Ventures Portfolio",xai-blockchain,68198483,100386377.0,,,N/A,32617625.0
OKX,"Smart Contract Platform, Ethereum Ecosystem, Layer 2 (L2), Zero Knowledge (ZK), Rollup, OKX Ventures Portfolio",taiko,68263692,645547259.0,,,N/A,16209830.0
OKX,"Artificial Intelligence (AI), Ethereum Ecosystem",0x0-ai-ai-smart-contract,67383960,67383960.0,,,N/A,185152.0
OKX,"Artificial Intelligence (AI), Solana Ecosystem, DePIN",nosana,67826554,81326803.0,,,N/A,871114.0
OKX,"Decentralized Exchange (DEX), Exchange-based Tokens, Decentralized Finance (DeFi), BNB Chain Ecosystem, Binance Launchpool, Polygon Ecosystem, Near Protocol Ecosystem, Arbitrum Ecosystem, Ethereum Ecosystem, DWF Labs Portfolio, Coinbase Ventures Portfolio, Alameda Research Portfolio, DeFiance Capital Portfolio, Pantera Capital Portfolio, Aurora Ecosystem, Energi Ecosystem, Binance Labs Portfolio, Galaxy Digital Portfolio",dodo,68120691,68120691.0,,,N/A,7027684.0
OKX,"Solana Ecosystem, Wallets, Base Ecosystem, TON Ecosystem",bitget-wallet-token,67182897,470072637.0,,,N/A,3631.06
OKX,"Stablecoins, USD Stablecoin, Seigniorage, Alleged SEC Securities, Osmosis Ecosystem, Stablecoin Protocol, DeFiance Capital Portfolio, Terra Classic Ecosystem, Binance Labs Portfolio, Delphi Ventures Portfolio, Galaxy Digital Portfolio, Fiat-backed Stablecoin",terrausd,95284179,95350597.0,33769.113006742264,64079.648679527025,0.16,6933049.0
OKX,"Decentralized Finance (DeFi), Oracle, Ethereum Ecosystem, DWF Labs Portfolio, Pantera Capital Portfolio",api3,67176532,83833381.0,11585.644353486829,27931.77400432079,0.09,13463857.0
OKX,"Artificial Intelligence (AI), Decentralized Finance (DeFi), Solana Ecosystem, Arbitrum Ecosystem, Metis Ecosystem, AI Agents, Sonic Ecosystem, IOTA EVM Ecosystem, AI Applications, DeFAI",heyanon,66838651,110143782.0,,,N/A,4851711.0
OKX,"Decentralized Finance (DeFi), Lending/Borrowing Protocols, Arbitrum Ecosystem, Ethereum Ecosystem, Alameda Research Portfolio, Pantera Capital Portfolio",liquity,67057299,68938896.0,57105.88715527475,73078.10732449063,0.1,23481602.0
OKX,"Decentralized Finance (DeFi), Solana Ecosystem, Real World Assets (RWA), Payment Solutions, DePIN, Coinbase Ventures Portfolio, Alameda Research Portfolio, Circle Ventures Portfolio, OKX Ventures Portfolio, RWA Protocol, Made in USA",zebec-network,67113572,90573001.0,7622.189070371179,9606.952563778303,0.07,18994708.0
OKX,Ethereum Ecosystem,saasgo,66171703,82714629.0,,,N/A,294729.0
OKX,"Artificial Intelligence (AI), Cardano Ecosystem, Ethereum Ecosystem, AI Agents, Sora Ecosystem",singularitynet,66617788,100650177.0,,,N/A,73766.0
OKX,"Decentralized Finance (DeFi), Ethereum Ecosystem, Restaking",kelp-gain,66029701,66029701.0,,,N/A,408320.0
OKX,"Meme, Dog-Themed, TON Ecosystem, TON Meme",dogs-2,66188330,70447182.0,45865.56710269923,88505.32151103545,0.08,17223018.0
OKX,"BNB Chain Ecosystem, Binance Megadrop, BTCfi",solv-protocol,66147522,374773495.0,,,N/A,175283136.0
OKX,"Decentralized Finance (DeFi), Lending/Borrowing Protocols, Solana Ecosystem, Binance Alpha Spotlight",kamino,65542427,485499456.0,,,N/A,9108676.0
OKX,"Artificial Intelligence (AI), Business Services, Decentralized Finance (DeFi), Ethereum Ecosystem, Paradigm Portfolio, DragonFly Capital Portfolio, Energi Ecosystem",numeraire,66033614,88429756.0,6013.973965875364,12378.126785224922,0.24,6558814.0
OKX,SocialFi,steem,65366504,65373853.0,,,N/A,14215920.0
OKX,"Artificial Intelligence (AI), BNB Chain Ecosystem, Ethereum Ecosystem, DePIN, AI Agents",netmind-token,63938061,203572443.0,,,N/A,1844791.0
OKX,"Smart Contract Platform, Layer 1 (L1), Ethereum Ecosystem, Proof of Stake (PoS)",pundi-aifx,64674185,64674185.0,,,N/A,246366.0
OKX,"Stablecoins, USD Stablecoin, Fiat-backed Stablecoin",falcon-finance,64167357,64167357.0,,,N/A,25070.0
OKX,"Healthcare, Osmosis Ecosystem",medibloc,63842666,69150450.0,,,N/A,223344.0
OKX,E-commerce,pay-coin,63824168,118588611.0,,,N/A,2833781.0
OKX,"Artificial Intelligence (AI), Smart Contract Platform, Layer 1 (L1), Ethereum Ecosystem, Osmosis Ecosystem, AI Agents, AI Agent Launchpad",humans-ai,64817307,64817307.0,,,N/A,75528.0
OKX,"Smart Contract Platform, Binance Launchpool, Layer 2 (L2), Scroll Ecosystem",scroll,64424531,339076477.0,145448.83779426757,179844.84606089068,0.09,18629145.0
OKX,"Decentralized Finance (DeFi), Liquid Staking Tokens, Ethereum Ecosystem, LSDFi, Liquid Staked ETH, Liquid Staking",origin-ether,63780596,63780596.0,,,N/A,118578.0
OKX,"Polkadot Ecosystem, Real World Assets (RWA), Coinbase Ventures Portfolio, Circle Ventures Portfolio, Galaxy Digital Portfolio, RWA Protocol",centrifuge,63230922,69329646.0,2719.6652965028675,3613.3624397076173,0.16,1230855.0
OKX,"Smart Contract Platform, Layer 1 (L1), Proof of Work (PoW), Privacy Blockchain",ergo,62670859,76524720.0,,,N/A,70805.0
OKX,"Solana Ecosystem, Meme, Pump.fun Ecosystem",der-daku,62623956,62623956.0,,,N/A,210650.0
OKX,"Decentralized Finance (DeFi), BNB Chain Ecosystem, Solana Ecosystem, Wallets, Polygon Ecosystem, Ethereum Ecosystem, Binance Launchpad, DWF Labs Portfolio, Multicoin Capital Portfolio, Alameda Research Portfolio, Viction Ecosystem, Binance Labs Portfolio",coin98,62724881,69629851.0,,,N/A,31529153.0
OKX,"Solana Ecosystem, Restaking, Liquid Restaking Tokens, Liquid Restaked SOL",renzo-restaked-sol,61905535,61905535.0,,,N/A,1049147.0
OKX,"Decentralized Exchange (DEX), Decentralized Finance (DeFi), Sui Ecosystem, Animoca Brands Portfolio, OKX Ventures Portfolio, Dex Aggregator",cetus-protocol,62214360,91135290.0,38476.98949218826,49359.07708599315,0.07,15225694.0
OKX,"Base Ecosystem, Cybersecurity, Binance Labs Portfolio, OKX Ventures Portfolio, Binance Alpha Spotlight",goplus-security,61781995,340697008.0,,,N/A,29386263.0
OKX,"Stablecoins, USD Stablecoin, Ethereum Ecosystem, Fiat-backed Stablecoin",binance-usd,60559643,60559643.0,,,N/A,271323.0
OKX,"Infrastructure, Smart Contract Platform, BNB Chain Ecosystem, Avalanche Ecosystem, Polygon Ecosystem, Arbitrum Ecosystem, Ethereum Ecosystem, Optimism Ecosystem, Layer 2 (L2), Base Ecosystem, Binance Launchpad, Modular Blockchain, Layer 3 (L3), Rollup, Proof of Stake (PoS), Appchains, Binance Labs Portfolio",cartesi,60691011,70634619.0,,,N/A,8988920.0
OKX,"Artificial Intelligence (AI), Decentralized Finance (DeFi), Ethereum Ecosystem, DePIN",pinlink,60495489,75619361.0,,,N/A,1599823.0
OKX,"Exchange-based Tokens, BNB Chain Ecosystem, Centralized Exchange (CEX) Token, Polygon Ecosystem, Ethereum Ecosystem",bit2me,59727318,60330624.0,,,N/A,91343.0
OKX,"Stablecoins, USD Stablecoin, Arbitrum Ecosystem, Ethereum Ecosystem, Fiat-backed Stablecoin",lift-dollar,60186087,60186087.0,,,N/A,658303.0
OKX,,ark,60353961,60870465.0,,,N/A,5314344.0
OKX,"Artificial Intelligence (AI), Solana Ecosystem, Polygon Ecosystem, Gnosis Chain Ecosystem, Arbitrum Ecosystem, Celo Ecosystem, Ethereum Ecosystem, Optimism Ecosystem, Base Ecosystem, AI Agents, Mode Ecosystem, AI Agent Launchpad, Binance Alpha Spotlight, AI Framework, DeFAI",autonolas,60213324,176126277.0,,,N/A,423056.0
OKX,"Smart Contract Platform, Layer 2 (L2), Made in USA",metal,60274852,60274852.0,,,N/A,598353.0
OKX,"SocialFi, Solana Ecosystem",access-protocol,59667696,129544441.0,,,N/A,853726.0
OKX,"Decentralized Finance (DeFi), Rebase Tokens, BNB Chain Ecosystem, Avalanche Ecosystem, Near Protocol Ecosystem, Harmony Ecosystem, Ethereum Ecosystem, Pantera Capital Portfolio, Energi Ecosystem",ampleforth,59505733,64565116.0,,,N/A,544653.0
OKX,"Gaming (GameFi), Ethereum Ecosystem, Telegram Apps, Gaming Platform",gamebuild,58932301,74187536.0,,,N/A,19973395.0
OKX,"Solana Ecosystem, Meme, Ethereum Ecosystem, Cronos Ecosystem, Dog-Themed, AI Meme",corgiai,58533635,63469838.0,,,N/A,66548.0
OKX,"Artificial Intelligence (AI), Infrastructure, Gaming (GameFi), NFT, Solana Ecosystem, Arbitrum Ecosystem, Impossible Finance Launchpad, Ethereum Ecosystem, Animoca Brands Portfolio, Base Ecosystem",carv,58599338,292864656.0,,,N/A,10472372.0
OKX,"Storage, Arbitrum Ecosystem",autonomi,58251427,151167558.0,,,N/A,218507.0
OKX,"Infrastructure, Smart Contract Platform",ardor,58379459,58379459.0,,,N/A,6298740.0
